media_en,title_articles,link_articles,date_original
kyt,健康保険の給付費算定ミス、700万円を過剰に受け取る　滋賀・高島市,https://news.yahoo.co.jp/articles/72066839a0007dcf6a58ea00be0486e090a723ae,10/31(火) 11:22
kyt,お父さんと「逃走中」満喫　「帰ったら家族の会話弾みそう」,https://news.yahoo.co.jp/articles/915aa7dcea1db7f0b2a7d3805dcd6264d2d3ccc9,10/31(火) 10:36
kyt,京都の観光スポット、路上駐車で住民迷惑　「収穫した茶葉を運べない」,https://news.yahoo.co.jp/articles/ad52d2666cbd1f38e0a955409969c9be72ae6020,10/31(火) 10:31
kyt,タクシーと衝突、2人にけが　「怖くなって逃げた」　ひき逃げの疑いで男を逮捕　京都,https://news.yahoo.co.jp/articles/05c5f497c27892bf382017a2c625b31a05b35061,10/31(火) 9:02
kyt,思い通りに動かない日もある　人間国宝が語る芸の道　巧みな技も披露,https://news.yahoo.co.jp/articles/53c0594bc1a96f2459fd3dc26cceb7d7db249d25,10/31(火) 7:02
kyt,雑音混じりでも「味がある」　昭和の真空管ラジオ復活　南丹市で公開,https://news.yahoo.co.jp/articles/0403d1729674750e79ac2bf87edce64b5acc463c,10/31(火) 6:02
kyt,維新の吉村大阪府知事、京都市長選で「公認擁立を目指す。明確に維新の旗立てたい」,https://news.yahoo.co.jp/articles/d22c285c0be2580985669aed4395fe5e0d059148,10/30(月) 22:02
kyt,作業員がベルトコンベヤーに巻き込まれ　砕石会社と工場長を書類送検　滋賀,https://news.yahoo.co.jp/articles/59e0d343cfdf50c1d9e6ff35021aaa55f0f25331,10/30(月) 19:06
kyt,カメムシが小学校給食に混入　「ホウレンソウのすまし汁」に4年男児が発見,https://news.yahoo.co.jp/articles/936a9a7328ed05bd4a96b473c5fe89ea76de60b8,10/30(月) 18:54
kyt,服装指導で後輩を平手打ち　2等陸曹を処分　滋賀の陸上自衛隊　隊員は頬腫れる,https://news.yahoo.co.jp/articles/76a4eaefa9663d4daf3110c9db5b804c02520fd4,10/30(月) 17:21
kyt,独自の新税「交通税」導入検討　滋賀県、公共交通の維持費に　市民からは反対の声も,https://news.yahoo.co.jp/articles/6121cc33dbe3789e40e6e878185497db0dd644d7,10/30(月) 16:17
kyt,社説：国の指示権拡充　地方自治損なわぬ仕組みに,https://news.yahoo.co.jp/articles/a1db193c93d9cbc99982b51f7dc7d8b70b5c3b47,10/30(月) 16:01
kyt,ＩＨフェンシング女子エペ２連覇「将来は五輪でメダルを」　龍谷大平安高岸本さん,https://news.yahoo.co.jp/articles/0aece2ea689bee41a6895a4edf7cc3bc9f61cbc5,10/30(月) 15:33
kyt,「いまだ暴力の中」ウクライナから来日の女性画家、現地の風景など描いた作品展,https://news.yahoo.co.jp/articles/6537914604b3ce4929bf538763042493c9055342,10/30(月) 14:27
kyt,「燃やすしかないごみ」を資源化へ　アルミ付き紙パックを回収、レジ袋禁止の亀岡市,https://news.yahoo.co.jp/articles/f881b82fe4652e4a47791f984855d5043367f0c6,10/30(月) 13:57
kyt,「火はまだ小さい。絶対に消せる」　77歳が民家に飛び込み消火、京都,https://news.yahoo.co.jp/articles/07f8632e6109f334d22d6868ca4fc51e8e3eab1b,10/30(月) 13:32
kyt,京都の名神高速道路上り線でトラック炎上　高槻JCT―大山崎JCTが一時通行止めに,https://news.yahoo.co.jp/articles/0d83897ad11d234e634a48888cf36d33048be742,10/30(月) 12:51
kyt,京アニ放火は「妄想」の影響か否か　２人の鑑定医、証言真っ二つ,https://news.yahoo.co.jp/articles/54e8ea277f5f20cff5a361965ea960675f306e64,10/30(月) 12:32
kyt,フリースクール発言　滋賀県知事が連絡協に回答「子ども・子ども・子どもの精神で」,https://news.yahoo.co.jp/articles/2e66d38a1c2ed9a0b3e692fa20b9459d0032c52e,10/30(月) 12:06
kyt,前原誠司氏、京都市長選で自公と相乗り方針の「立民」批判　「党首のお膝元なのに理解できない」,https://news.yahoo.co.jp/articles/3c65a420124dbaf3b9f9202d915b7015426fda53,10/30(月) 11:32
kyt,仮装の若者がまちの未来を考える「うわさのハロウィン」　滋賀,https://news.yahoo.co.jp/articles/b80c3c0d7fa48514d8ec702e5dea88b8595597ca,10/30(月) 11:32
kyt,【速報】元同僚をナイフで切りつけ「4年前の叱責、今でも恨み」19歳少年を逮捕,https://news.yahoo.co.jp/articles/a76aeb926d443689d42198a1167b4d3eadba98cd,10/30(月) 10:57
kyt,男性の育休取得、１年半で３倍超　警察内で進む「ワークライフバランス」　滋賀県警,https://news.yahoo.co.jp/articles/50bab0239076d4dcff0515f9f6377fdac913e862,10/30(月) 10:31
kyt,秀吉の太閤検地の記録も残る、江戸時代築の住宅　京都・亀岡市の民家で初の国登録文化財,https://news.yahoo.co.jp/articles/ba6a2d30cad829c9f1cd529edae504a5c241df1e,10/30(月) 6:01
kyt,社説：外国人新制度　「定住」促す仕組みになるか,https://news.yahoo.co.jp/articles/7bae09eaecf1e8868e44c58328b7e1e2a96650f9,10/29(日) 23:06
kyt,感謝の言葉を紡いで花束に　京都市の生涯学習センター開館25周年で利用者がメッセージ,https://news.yahoo.co.jp/articles/0a3f9c36e9beb9421ad82aa823a549f4c33b6233,10/29(日) 21:42
kyt,「皇室献上」と聞けばていねいな作業もむべなるかな　「不老長寿の果物」ムベかごに詰め　滋賀・近江八幡市,https://news.yahoo.co.jp/articles/c57fc424034c3a01dc6dc0bb3fad33bb7ce98b59,10/29(日) 21:06
kyt,星への旅を誘い1世紀　プラネタリウム誕生100年「国産第１号」ゆかりの京都で特別展,https://news.yahoo.co.jp/articles/7c45ca1df82c22d23302f0eb91459e89bb744508,10/29(日) 19:02
kyt,少し欠けた満月が京都の街の空に　明け方にひっそり天体ショー,https://news.yahoo.co.jp/articles/920fbc34c6a04388f62760de5ef869d0b82b37f4,10/29(日) 16:02
kyt,「紫式部商戦」早くも過熱　大河ドラマ「光る君へ」で「3年前のリベンジ」目指すまち,https://news.yahoo.co.jp/articles/64a5e275aabf6d62807a1cdc7f3b3bbf521a1e51,10/29(日) 16:02
kyt,カステラ食べて火災予防を　山崎製パン、京都府宇治市の消防とコラボし限定販売,https://news.yahoo.co.jp/articles/ac6e2c6132fa1f4b740e7124deca5f3b465f6ec3,10/29(日) 14:02
kyt,身近な人の自殺サイン気付く「命の番人」になろう　精神科医が語る「五つのできること」,https://news.yahoo.co.jp/articles/1fea9a397cb043690ef6865ce02a6ce27efe02bb,10/29(日) 10:31
kyt,小学生が森林の役割学ぶ　学校の裏山で保水力実験　京都府京丹波町,https://news.yahoo.co.jp/articles/77e4c35bf32420ead1ebd4bc2f840de7ec69384e,10/29(日) 9:01
kyt,79歳男から性被害、女子高生が勇気の告白「信用していたのに裏切られた」,https://news.yahoo.co.jp/articles/c67ecfdea50aede1295c44c8f5e76b8983b68c20,10/28(土) 18:32
kyt,京都サンガ、新潟に敗れ3連敗　J1残留決定はまたも持ち越し,https://news.yahoo.co.jp/articles/db742f74cbadb37c7b39ca6d978c95fcf7f1a09d,10/28(土) 16:52
kyt,社説：膨らむ万博整備費　延期、縮小の検討を求める,https://news.yahoo.co.jp/articles/4f466a89d50c6183c6759fd08820040ceda2e08f,10/28(土) 16:02
kyt,「困ったときは理容店に駆け込んで」　理容店組合が待ち合いスペース提供の取り組み,https://news.yahoo.co.jp/articles/296245fc5ce1e0d1d9a425d251d9029d369da882,10/28(土) 14:02
kyt,育てたサツマイモ「大きいの取れた！」　幼稚園児が収穫体験,https://news.yahoo.co.jp/articles/3e797f8ed72c8f8e0e93aa9947fa238520e43a8d,10/28(土) 13:02
kyt,スタジアムに仮設照明をつけたい！　Jリーグ目指すレイラック滋賀がクラファン募る,https://news.yahoo.co.jp/articles/b2bafdc617aaddf49f468b83b235b213ead0231d,10/28(土) 12:01
kyt,ふん尿発酵で電気と液肥、施設運営に市が苦慮　開設25年、老朽化や利用低迷で,https://news.yahoo.co.jp/articles/da2ca518a353c20975601827580fad4952f15bbd,10/28(土) 11:02
kyt,「未来担う子どもたちに平和の尊さ伝える」　京都・南丹で戦没者追悼式,https://news.yahoo.co.jp/articles/4e677a7db78ce2581fbc50b3508a9399c38def5c,10/28(土) 10:01
kyt,落雷で停電か？京都市営火葬場で一部設備の使用制限　復旧めど立たず,https://news.yahoo.co.jp/articles/f85c05d9b839089345e449202ebfeee679f6fd6b,10/27(金) 19:48
kyt,建設現場から浴室暖房乾燥機など盗んだ疑い　835万円被害裏付け、男2人逮捕、追送検,https://news.yahoo.co.jp/articles/1a54e802a0deea0c0fb1a71d1b9ca21443e28da6,10/27(金) 19:36
kyt,使用済み注射器を誤って刺す　ワクチン集団接種で80代男性に,https://news.yahoo.co.jp/articles/c5cf7c53ca639d03f25da29b5fdbdee2dfc677c0,10/27(金) 18:24
kyt,舗装復旧工事の落札決定取り消し　滋賀・彦根市　予定価格の積算誤り,https://news.yahoo.co.jp/articles/8478d0f17ce928218ffe0b278349533f22a289e9,10/27(金) 18:18
kyt,京都市副市長が不適切発言撤回　「自治体の国への要望書、ほとんど読まれない」　総務省から出向中,https://news.yahoo.co.jp/articles/e826d37d90e1e375a1e023a075dc34d9c1e784ea,10/27(金) 18:16
kyt,「あしなが募金」資金不足で遺児らに奨学金行き渡らず　物価高で苦境深まる,https://news.yahoo.co.jp/articles/d62b032a6d9c10f5ce125e421572d203aa8954e8,10/27(金) 16:16
kyt,「トリック・オア・トリート」　魔女やカボチャに仮装、子どもたちがイベント楽しむ,https://news.yahoo.co.jp/articles/e783227883be97d1dc5da3e621744e8375fc8f09,10/27(金) 16:16
kyt,「いつ死んでしまうか不安で食べることも眠ることもできない」ガザ出身女性が学習会で嘆き,https://news.yahoo.co.jp/articles/9f5477ffda37711def170db63a13dd95e6495073,10/27(金) 16:16
kyt,社説：性別変更裁判　人権守る法の見直しを,https://news.yahoo.co.jp/articles/cd08b4737619342bcceafe4ef40a0fbdb36c9647,10/27(金) 16:06
kyt,社説：ＮＴＴ情報流出　ずさん管理にあきれる,https://news.yahoo.co.jp/articles/a66b80634123ab8c567177fb84b3e51d6f250e1e,10/27(金) 16:02
kyt,大気が不安定、京都市内や大津市内で「ひょう」降る,https://news.yahoo.co.jp/articles/9aa816dd57c1cee6b733b8fdda429def01c9269f,10/27(金) 15:42
kyt,近鉄京都線の京都―新田辺駅間で一時運転見合わせ,https://news.yahoo.co.jp/articles/56d1bab58d82364210a0d330532b03386887c4e1,10/27(金) 15:18
kyt,同僚から現金盗む　海上自衛隊員を懲戒免職に　「携帯電話代の支払いで金銭困窮」,https://news.yahoo.co.jp/articles/ba37a268e4b4e5077076fb4f3e09bdd0134edd0d,10/27(金) 11:22
kyt,「守秘義務ある」反発する男性を説得、預金引き出しストップ　信金で特殊詐欺対応訓練,https://news.yahoo.co.jp/articles/cee83b2fa66f03e43846f00adbcef6ceb04cf3cf,10/27(金) 11:06
kyt,墨絵作家が猫の作品制作続ける理由　和紙使い幻想的な表現も　「猫絵展」,https://news.yahoo.co.jp/articles/a5a03602d7042af1136a1f6a15c914517ed2ac8f,10/27(金) 8:02
kyt,ブラトップ差し入れ、京都府警断る　弁護士が是正申し入れ、大阪はOK　容疑者「恥ずかしい」,https://news.yahoo.co.jp/articles/f46cbd586db9d5d9439586a2777f37406d40b82e,10/27(金) 7:30
kyt,バイオガスプラントの課題は？　脱炭素への関心高まりに商機　液肥３倍濃縮実験も　南丹,https://news.yahoo.co.jp/articles/653e183c11150d53d26699e85157a0a0b4459da5,10/27(金) 7:02
kyt,【速報】「FX投資をサポート」とうそ　71歳女性、3800万円だまし取られる,https://news.yahoo.co.jp/articles/1d801a085ae1e84c51bf1856122e63ca22d69b48,10/26(木) 20:24
kyt,京都翔英高校の小笠原蒼内野手はDeNAから育成3位指名　パワフルな打撃が魅力,https://news.yahoo.co.jp/articles/295d8b0a6f055a2e1c4a7dbe554327ba4f90b59e,10/26(木) 20:06
kyt,滋賀・瀬田工業高校の平田大樹外野手が日本ハムから育成2位指名,https://news.yahoo.co.jp/articles/abc9304aa3c403305008cee5a30fdfebd337dde4,10/26(木) 20:02
kyt,青山学院大学の中島大輔外野手、楽天から6位指名　京都・龍谷大平安高校出身,https://news.yahoo.co.jp/articles/59c3747f04e829ef3b2ce27f5cda2db0f81636ce,10/26(木) 19:12
kyt,ダンプカーがトラックに追突　街路樹倒れトラックのフロントガラス割れる,https://news.yahoo.co.jp/articles/4bdc962c6483dc1353d65fdfc3bc5a7875e32379,10/26(木) 18:24
kyt,名城大学の岩井俊介投手、ソフトバンクから2位指名　京都翔英高校出身の本格派右腕,https://news.yahoo.co.jp/articles/bedf6caa2a3ab24b31aa2ad00ef9c27567ac192a,10/26(木) 18:09
kyt,【速報】フリースクール発言　知事と教育長、協議会の意見書に回答　内容は30日公表予定,https://news.yahoo.co.jp/articles/ef9e35f900c69bc0a551a07703f09c568c9ac537,10/26(木) 18:06
kyt,「人身売買」信じ込ませ13歳少女と性交　男に懲役8年判決,https://news.yahoo.co.jp/articles/d37f8cca833904e230edb2b123561915b1b51b3d,10/26(木) 17:51
kyt,「ドラクエウォーク」不正ログインしアカウント転売　容疑で23歳会社員を書類送検,https://news.yahoo.co.jp/articles/1b972e62801a5d42de3e8a5e78736b2168c7c658,10/26(木) 17:46
kyt,大阪桐蔭高校の前田悠伍投手はソフトバンクから1位指名　滋賀・長浜出身、プロ野球ドラフト,https://news.yahoo.co.jp/articles/6c622a5c73bb98d528a4c1a220584ac8e131841c,10/26(木) 17:35
kyt,「コンサートチケット譲る」　女子大生から15万円だまし取る　容疑の42歳女逮捕,https://news.yahoo.co.jp/articles/e4eeb15721bd5a4140c305fa63b5a14d3351d339,10/26(木) 17:31
kyt,社説：国会論戦　首相は逃げずに答弁を,https://news.yahoo.co.jp/articles/42eb96cf41f52a5747f783d5d5f13254e4cf9134,10/26(木) 16:06
kyt,社説：小椋市長の発言　真に反省なら撤回せよ,https://news.yahoo.co.jp/articles/310fe0006d7f83e71a288215ea675d355c8d3c53,10/26(木) 16:01
kyt,ヴォーリズ建築に響く、ピアノとチェロの音色　滋賀・近江八幡,https://news.yahoo.co.jp/articles/a095a67351a3c01835a293716315062c3ec01bc2,10/26(木) 15:02
kyt,車のフロントに自転車衝突、事故を疑似体験　中学生「怖さ知った」,https://news.yahoo.co.jp/articles/49452fbda4e5a1b10b918595e4f5c8586e30e953,10/26(木) 14:39
kyt,「青葉被告は重度の妄想性障害」医師が証言　30歳ごろからか　京アニ放火殺人公判,https://news.yahoo.co.jp/articles/f882a37bc97e2dd4602063376105329fe5c6936d,10/26(木) 12:27
kyt,特別支援教育奨励費を支給ミス、15万円不足　公表に2年、システム不具合,https://news.yahoo.co.jp/articles/9bfc35b544cd4b4fb86b1fa7873b5e82cecad7a8,10/26(木) 11:54
kyt,深まる秋、名所駆け抜けるマラソン　滋賀・高島,https://news.yahoo.co.jp/articles/7aa6b5f4926e4c20656ea1b26a7e73746d4159b1,10/26(木) 11:46
kyt,JR西、特急「はるか」一時運転取り止め　線路修繕のため,https://news.yahoo.co.jp/articles/d1c5a94930c59a1fa336f801b658d256d62c6d4f,10/26(木) 10:48
kyt,元フットサル日本代表らがフリースクール開校へ　「子どもが体動かし、成長できる場所に」,https://news.yahoo.co.jp/articles/23e302d8e30bf9cf1262767f027b3ab93ebd8484,10/26(木) 10:32
kyt,「FXのやり方紹介します」と1300万円詐取、中国籍の3容疑者逮捕,https://news.yahoo.co.jp/articles/de706c988c5a32529453936bdce910c8f64dd031,10/26(木) 7:02
kyt,「保津峡」切り開いた火あがめる、亀岡の請田神社で秋祭り大祭,https://news.yahoo.co.jp/articles/40da964e9db287a2c174d06998db9af70702b058,10/26(木) 7:02
kyt,京都市で震度1の地震　震源は京都府南部,https://news.yahoo.co.jp/articles/e43d731e1fdc5afdeafac7f1515f92070a6c6b8a,10/25(水) 22:12
kyt,小学校の給食にビニール袋片が混入　「はくさいのおかかあえ」に包装材か,https://news.yahoo.co.jp/articles/2526b83b912a1793b834d1f052118a64249d6ae4,10/25(水) 20:16
kyt,京都・清水寺での催しに絡み協賛金横領、一般社団法人の代表理事を容疑で逮捕,https://news.yahoo.co.jp/articles/1032afcc0370bd756b0514c8ff743b5392e00ca6,10/25(水) 19:24
kyt,介護施設職員を入所者暴行疑いで逮捕、再発防止へ市長「やっていく」,https://news.yahoo.co.jp/articles/40620ac64aacdbde5f68f10ef8c0c1b5d09baca5,10/25(水) 19:12
kyt,収賄疑いで市元幹部を再逮捕、無利息で750万円借用「ローンで困っていた」,https://news.yahoo.co.jp/articles/c0c558852e8b61f690ba15ae640f0eca83a39840,10/25(水) 19:06
kyt,プロ・高校野球の賭博で7180万円集める　逮捕の男「納得いかない」否認,https://news.yahoo.co.jp/articles/9c28da3968641fcf8b38eaa575258a7f460cbc22,10/25(水) 18:22
kyt,10代女性が線路に立ち入り、京都行き回送電車にはねられ死亡,https://news.yahoo.co.jp/articles/de1d1a703f8ab4f0098e12e78a3ae275affa9253,10/25(水) 18:12
kyt,特殊詐欺グループの実行犯募るリクルーターか　詐欺容疑で無職男を再逮捕,https://news.yahoo.co.jp/articles/91eda4634b19bd7f72c0ead6fce11e29657d5e2d,10/25(水) 17:24
kyt,社説：ライドシェア　利点欠点、慎重に検討を,https://news.yahoo.co.jp/articles/b004731329322d3556191cadd6484b0c1dc2197d,10/25(水) 16:12
kyt,社説：亀岡市長３選　理念をいっそう成果に,https://news.yahoo.co.jp/articles/e603e70ed6bda992e279d10c3a22672bed50b587,10/25(水) 16:02
kyt,ミラノのファッション専門家、丹後織物「面白い」　京都府案内で産地視察,https://news.yahoo.co.jp/articles/2b4ee14adbcc7c7b5ec63e101ec43c9519696c24,10/25(水) 14:09
kyt,フリースクール発言問題の滋賀・東近江市長、謝罪意向の一方で「撤回して何の意味がある」「信念で発言した」,https://news.yahoo.co.jp/articles/388df62a55a9158499d09b66ef3d09b1be5a473d,10/25(水) 11:27
kyt,リニューアルした市施設の床暖房、未検査で使用不可　設計会社に損賠請求,https://news.yahoo.co.jp/articles/ecaebd503df67bb7e79321dfd14b2bcc47a00537,10/25(水) 11:02
kyt,フリースクール発言問題の滋賀・東近江市長「深く反省、謝罪したい」　定例会見で「配慮の足りないワンフレーズ」,https://news.yahoo.co.jp/articles/3ea553c575226a55901b4c3a6eb08775c9d840ac,10/25(水) 10:57
kyt,「ふくちやまのエエもん」に２品認定,https://news.yahoo.co.jp/articles/06a6c7c3a0937314f6fbab5905f1dc4029a7ff56,10/25(水) 10:42
kyt,京都アニメーションはこうやって放火された　裁判で判明した犯行の一部始終,https://news.yahoo.co.jp/articles/a7953a00aa62403fd002fe126c121f7f14ff7bdf,10/25(水) 10:32
kyt,信号のない交差点で車と衝突　オートバイの男性死亡,https://news.yahoo.co.jp/articles/19d90244724d4ec5bac828785d09ca8e302ac3e1,10/25(水) 9:57
kyt,「日本に素晴らしい木あること知って」　京都府南丹市で優良材の表彰式,https://news.yahoo.co.jp/articles/abd5bb9bffcd39ecc7f9844ce058c3e76cf93df0,10/25(水) 9:02
kyt,今夏の猛暑、バラもこたえた　大津市のバラ園一般公開も、近年では最も花少なく,https://news.yahoo.co.jp/articles/167140fb5043cc781adf5e52f6efc2230eb9a4c7,10/25(水) 7:02
kyt,黄檗駅で人身事故、JR奈良線が一時運転見合わせ　回送電車が人と接触,https://news.yahoo.co.jp/articles/e5ad8e7068a90b1390a947fe941adf690c0fd9e2,10/24(火) 23:22
kyt,畑でパワーショベル転落か、下敷きの72歳男性が死亡　滋賀県長浜市,https://news.yahoo.co.jp/articles/17b7657c8389547e6122f8a83219d76ff3467f9f,10/24(火) 20:06
kyt,ALS嘱託殺人事件、医師・大久保被告の初公判は来年1月に　京都地裁,https://news.yahoo.co.jp/articles/4d658dde87879086de46f67f8c7af3defc54d94c,10/24(火) 19:54
kyt,東近江市長「なんで謝罪する必要あるの」　フリースクール発言「親御さんには誤解与えた」とも,https://news.yahoo.co.jp/articles/ef28501d3da412d21efc779d3b37ee331af23250,10/24(火) 18:46
kyt,13歳未満の女児の下半身触る、49歳塾経営者を不同意わいせつ容疑で逮捕,https://news.yahoo.co.jp/articles/4dfc850f64827a35193b01604bf33a50c98a642c,10/24(火) 18:39
kyt,岸田首相「不登校はさまざまな要因が複雑に関わる」　東近江市長の発言受け答弁,https://news.yahoo.co.jp/articles/d05f246a87bcd63ef7a63f4ce5099ac76a02843f,10/24(火) 18:39
kyt,滋賀県野洲市がピアノ使用料徴収ミス、14万円超返還へ　1回300円が500円に,https://news.yahoo.co.jp/articles/45df416265e78e1730638bd66d7f51db4ebf3044,10/24(火) 18:24
kyt,京都府宮津市の海に沈んだ車で発見の遺体は86歳女性　夫は近くの海岸で遺体発見,https://news.yahoo.co.jp/articles/0dfefd66f256f337d9a9ad0554caa7ccd632c392,10/24(火) 17:01
kyt,同志社大元アメフト部員性的暴行　共犯の男に懲役5年求刑「極めて卑劣で悪質」,https://news.yahoo.co.jp/articles/3f405af00f8442d2d3ba3a34bcdc38fdd1cb9e81,10/24(火) 16:16
kyt,社説：首相の所信表明　借金財政でも「還元」なのか,https://news.yahoo.co.jp/articles/d0d774ce0dc58a9919078312ede66d916e698f7d,10/24(火) 16:01
kyt,保育園児と住民が植えたコキアが真っ赤に　笑顔で抱きつき「大きくなった」,https://news.yahoo.co.jp/articles/8364a683234bac786a0519504abbfeb91c24c335,10/24(火) 15:32
kyt,滋賀・東近江市長のフリースクール発言「配慮に欠けた」　市教委が保護者向け文書で見解,https://news.yahoo.co.jp/articles/feb9a812aa9e0b2a4acde1654e8ea53f3027756e,10/24(火) 14:54
kyt,米スタンフォード大客員講師の僧侶が中学校で講演　「命の大切さ・生きるとは」,https://news.yahoo.co.jp/articles/816b5d81d47d5ac14581992453e5bccc8d533d01,10/24(火) 14:42
kyt,「不登校の大半は親の責任」滋賀県東近江市長のフリースクール発言「配慮ある発言ではなかった」三日月知事が見解,https://news.yahoo.co.jp/articles/616c10eb0cb0a46c6e3fc092947f3d9334782534,10/24(火) 13:17
kyt,幼稚園の送迎バスと軽ワゴン車が接触　通園中の児童26人乗車　滋賀・豊郷,https://news.yahoo.co.jp/articles/0bd8b0b92fdd6c36a0da284c29c6371ac74dc529,10/24(火) 12:48
kyt,キンモクセイにも猛暑が影響？　開花最も遅く、京都府立植物園「めったにない」,https://news.yahoo.co.jp/articles/0df379693ae4b8421c2f7a981dfa5a1989daa4d2,10/24(火) 10:32
kyt,京都の「木」で自由に楽しく工作、小学生の作品をずらりと展示,https://news.yahoo.co.jp/articles/93391829acab367735d2d4c0f519e70e6c14a80e,10/24(火) 7:01
kyt,ワクチンコールセンター過大請求、「全額返還」で住民監査請求を却下,https://news.yahoo.co.jp/articles/2460642d2bac2db8e66af5fb126f1b8051a63a4f,10/23(月) 19:46
kyt,介護施設で入所者暴行、3人目被害者は脳挫傷に　容疑の職員再逮捕,https://news.yahoo.co.jp/articles/e4bb67ac7389edcc253797ef3afa1d099b84f5b6,10/23(月) 19:24
kyt,「発達障『がい』の子も親も元気に」地域との橋渡し役で奔走、女性の思いとは,https://news.yahoo.co.jp/articles/e7493721aae7a45d5978e0cef7ed7275cc22e652,10/23(月) 18:48
kyt,「暴力団に名義貸ししている」警官名乗る男に現金1600万円だまし取られる,https://news.yahoo.co.jp/articles/97f9469a16b548e2a5b20615fabc7873c6d2b51f,10/23(月) 18:22
kyt,在宅中でも「堂々」侵入、自転車で物色し窃盗繰り返す　容疑の35歳男を逮捕,https://news.yahoo.co.jp/articles/46ffc77de101ababe04e2a7ee8d9b3c801142b48,10/23(月) 17:32
kyt,京阪本線、鴨東線、中之島線が全線で一時運転見合わせ　香里園駅で車両故障,https://news.yahoo.co.jp/articles/61a85426910dff1999704c4638487a37da077fda,10/23(月) 16:39
kyt,女性になりすまし電子マネー8万円相当だまし取った疑い　21歳大学生の男逮捕,https://news.yahoo.co.jp/articles/1cbdf59c1bc254bdeb36b629b069b0d860c76871,10/23(月) 16:33
kyt,社説：給食費の無償化　実現に向けて幅広い議論を,https://news.yahoo.co.jp/articles/e522e52ca9a3ca16dd2b6a6781b057898e6ff413,10/23(月) 16:02
kyt,「自分の居場所」「前向けた」　就労支援手がけるNPOが歩んだ20年、精神障害者とともに,https://news.yahoo.co.jp/articles/9de2adfe5b01d4aeb706d22be1461be232992afe,10/23(月) 15:02
kyt,日本三景・天橋立を低速電動車で巡って　狭い道もすいすい、「グリスモ」実証実験　観光船やバスとも連動,https://news.yahoo.co.jp/articles/75d331cdc4277457a9040d548843602a129e0be9,10/23(月) 15:02
kyt,子ども守る町の人に「ありがとう」　児童が感謝込め安全ポスター　緊急時駆けこむ「110番の家」描く,https://news.yahoo.co.jp/articles/0de339760c93a347258ada9a7eb2b789ac1fc4a9,10/23(月) 15:02
kyt,芝居の喜びかみしめ稽古に熱　コロナ乗り越え12月に節目公演　2010年発足の市民演劇サークル「谺」,https://news.yahoo.co.jp/articles/16383a1d689096bf3e07b3e2e777b1d7b6339dbc,10/23(月) 15:02
kyt,「千羽以上の鶏が毎日死んでいる」鳥インフル、国内初の大規模感染との戦いは1本の電話から始まった　#ニュースその後,https://news.yahoo.co.jp/articles/59b1439dd4f42ce07e0f9410d7c061471896a976,10/15(日) 18:04
kyt,これぞ京都ロックシーンの原動力、酒蔵のライブハウス『磔磔』で感じた「懐の深さ」,https://news.yahoo.co.jp/articles/804d829e2eda4eff089ff850161fc7c36b2576ce,9/28(木) 11:29
