media_en,media_jp,title_articles,link_articles,date_original
gifuweb,岐阜新聞Ｗｅｂ,ニジマス釣り場、再開を断念　岐阜市の長良川,https://news.yahoo.co.jp/articles/eb97591342253ab7e4a090323906e9f223700913,2/29(木) 14:04
gifuweb,岐阜新聞Ｗｅｂ,５年ぶり完全復活、豪華な大垣まつり行列や幻想的な夜宮実施へ　５月１１日開幕,https://news.yahoo.co.jp/articles/21982c8b919a9f0ff28bf37b61865f777e4c4cc5,2/29(木) 10:41
gifuweb,岐阜新聞Ｗｅｂ,関刃物が最大９割引き、包丁やはさみアウトレット商品展　岐阜・関市で１１社出品、期間限定,https://news.yahoo.co.jp/articles/cfe17ff83894241379de43f7fc582421f8073561,2/29(木) 10:27
gifuweb,岐阜新聞Ｗｅｂ,中小企業６２％が賃上げ、ベア大幅増　岐阜県、全国平均上回る,https://news.yahoo.co.jp/articles/02ee2cca9d50787f4098de40fc4b4df39af9c26d,2/29(木) 10:16
gifuweb,岐阜新聞Ｗｅｂ,朝の出張カット、免許返納や障害で来店難しい客に対応　価格は店舗同様、岐阜・輪之内町の理容店,https://news.yahoo.co.jp/articles/ea738f3dea7b5478ee016818f0ac729e2659cb5c,2/29(木) 8:42
gifuweb,岐阜新聞Ｗｅｂ,こんにゃくまくら「触っているだけで幸せ」重さ３キロ、カットして料理に　岐阜・池田町の返礼品,https://news.yahoo.co.jp/articles/c0934244eee54b56ab0440637256d03dbe673bc4,2/29(木) 8:12
gifuweb,岐阜新聞Ｗｅｂ,春の女神「ギフチョウ」羽化　岐阜市・名和昆虫博物館,https://news.yahoo.co.jp/articles/7a6c9f7172b1e2ec65270f2154b411961bd15703,2/29(木) 7:58
gifuweb,岐阜新聞Ｗｅｂ,セクハラ認めず町長退場「嫌なら嫌と／報告書に違和感」弁明と不満繰り返す　岐南町長辞意「心折れた」,https://news.yahoo.co.jp/articles/567569cfd97891148eb76b84ffafa040c50d30ec,2/29(木) 7:41
gifuweb,岐阜新聞Ｗｅｂ,「株式の学習」トークグループ招待→メンバーから株購入勧められ…詐欺９７０万円被害　岐阜・中津川市,https://news.yahoo.co.jp/articles/990d182088bf26eefe8dec6520d3c927a7c5d9d4,2/29(木) 7:24
gifuweb,岐阜新聞Ｗｅｂ,岐阜・岐南町長が辞意表明　５月末までに　第三者委のセクハラ認定を受けて記者会見,https://news.yahoo.co.jp/articles/a6c54efbe9c5f8b3d3d8b964f81fad0fb80f0ec6,2/28(水) 15:02
gifuweb,岐阜新聞Ｗｅｂ,昭和の駄菓子屋、街角、学校…ちょっと昔にタイムスリップ　映画セットのように道具展示、岐阜市歴博,https://news.yahoo.co.jp/articles/1900bd22fb6050d30e0abcb989123205541512a9,2/28(水) 10:18
gifuweb,岐阜新聞Ｗｅｂ,中咲き梅、春の陽光浴び見頃　岐阜市の名所・梅林公園、２日から「まつり」,https://news.yahoo.co.jp/articles/a286a73c81b080171b2c6a85e3ed1da43980bf07,2/28(水) 10:11
gifuweb,岐阜新聞Ｗｅｂ,大人が本気の雪合戦「東海大会」廃止、継続希望の声も　後継団体募る、岐阜・高山市,https://news.yahoo.co.jp/articles/136173838e389ab965801ee251000451ea31b29f,2/28(水) 9:51
gifuweb,岐阜新聞Ｗｅｂ,学生は家賃無料、条件は地域行事に参加　岐阜大と揖斐川町協定、若い世代との接点で活性化,https://news.yahoo.co.jp/articles/cbe00085b15e7ca5dda05ea1ed1eb19944442331,2/28(水) 9:16
gifuweb,岐阜新聞Ｗｅｂ,マッチングアプリやＳＮＳで仮想通貨の投資詐欺　男性２人計４８１０万円被害、岐阜・揖斐署捜査,https://news.yahoo.co.jp/articles/6df8ba768bbd391b176d958447ae80c668640762,2/28(水) 8:39
gifuweb,岐阜新聞Ｗｅｂ,「置き配」盗疑い３５歳男逮捕、玄関前の荷物被害　周辺で複数発生、岐阜県警が関連捜査,https://news.yahoo.co.jp/articles/143997eace6b9cf19884b67275433010e2604ed7,2/28(水) 8:11
gifuweb,岐阜新聞Ｗｅｂ,セクハラ町長９９行為「こんなことで岐南町有名に…／辞めないと変わらぬ」批判　不信任案再提出へ,https://news.yahoo.co.jp/articles/79736f2ab25047a3a395e9f9376bc2ac003d01c8,2/28(水) 8:02
gifuweb,岐阜新聞Ｗｅｂ,川上貞奴建立の寺　鐘楼堂全焼　連続不審火か　岐阜・各務原市,https://news.yahoo.co.jp/articles/29de7769b9d1e88bbdfa450fdda1084970551dbb,2/28(水) 5:02
gifuweb,岐阜新聞Ｗｅｂ,第三者委が岐南町長のセクハラ認定　「少なくとも９９の行為が認められた」　多数の女性職員らが証言,https://news.yahoo.co.jp/articles/49801fbe6bae79c731e448dd20716e8673b27d48,2/27(火) 14:39
gifuweb,岐阜新聞Ｗｅｂ,「ゴジラみこし」夜の街にぎやかに練る　飛騨神岡初金毘羅宵祭、岐阜,https://news.yahoo.co.jp/articles/2c0558783994dd21dc2913d3b87c79ad8470f0c1,2/27(火) 9:51
gifuweb,岐阜新聞Ｗｅｂ,高校野球部が小学生指導する活動、スポーツ庁表彰　大垣北高が全国初の部活動受賞、運動の習慣化評価,https://news.yahoo.co.jp/articles/36586455a717a9fa80f87c8beb02237e87dcb58d,2/27(火) 9:37
gifuweb,岐阜新聞Ｗｅｂ,町長セクハラ疑惑の調査委託費１２４１万円に、５００万円増額　岐阜・岐南町,https://news.yahoo.co.jp/articles/773cabba017a306cf717035cbbaa6c043b83a33b,2/27(火) 8:34
gifuweb,岐阜新聞Ｗｅｂ,丸亀製麺の新商品「シャカシャカ揚げうどん」きなこ味＆のり塩味　岐阜大生コラボ、限定販売,https://news.yahoo.co.jp/articles/ce5c0a9a47d670d23057da38d34268bb904c8e92,2/27(火) 8:17
gifuweb,岐阜新聞Ｗｅｂ,川上貞奴創設の貞照寺　鐘楼堂を焼く　けが人なし　岐阜・各務原市,https://news.yahoo.co.jp/articles/e778339275c24c6eb1c84722db78b5f93e03bbcc,2/27(火) 8:03
gifuweb,岐阜新聞Ｗｅｂ,温泉からレジオネラ菌、施設利用２人発症　岐阜・海津市、水晶の湯と宙舟の湯,https://news.yahoo.co.jp/articles/f6aa7fa9cdbfb994efbc1f3f8617ee3c5ea602ee,2/27(火) 7:53
gifuweb,岐阜新聞Ｗｅｂ,釣り場増水で長良川に流出「ニジマス３０００匹」漁協が推計　営業再開は未定、岐阜市,https://news.yahoo.co.jp/articles/e41ebdb5a55ea2b3c948f9b6e97ef3b7b6949c4a,2/27(火) 7:37
gifuweb,岐阜新聞Ｗｅｂ,市役所内で喫煙問題、措置講じてない喫煙場所廃止「幹部のみ利用で特権的」批判も　岐阜・各務原市,https://news.yahoo.co.jp/articles/3414088d97f1836b07b0c3674d03f4f4d4c85ddd,2/27(火) 7:26
gifuweb,岐阜新聞Ｗｅｂ,JR穂積駅で人身事故　列車にはねられ女性死亡　岐阜・瑞穂市,https://news.yahoo.co.jp/articles/bd4a9845dfd5c4c186596a04ecc12a96c82da332,2/26(月) 10:33
gifuweb,岐阜新聞Ｗｅｂ,Ｄａ−ｉＣＥ大野雄大さんとソナーポケット、一夜限り特別ライブ　３月末閉館の岐阜・大垣市民会館,https://news.yahoo.co.jp/articles/8c6e67e90ad400e0e98c57a61cf063f0de157eaa,2/26(月) 10:16
gifuweb,岐阜新聞Ｗｅｂ,金の蛇に化身した母親の伝説、村襲うワシ退治　難読地名「金蛇入池」岐阜・瑞浪市,https://news.yahoo.co.jp/articles/2f1a780d8762327f8635b013cee7040c30d48325,2/26(月) 9:48
gifuweb,岐阜新聞Ｗｅｂ,不要ランドセルや未使用文具をフィリピンへ、子どもの学び応援　岐阜・下呂市の高校生らＳＤＧｓ活動,https://news.yahoo.co.jp/articles/da831353d67ac152cafff6c62bb4bb81e2698839,2/26(月) 9:19
gifuweb,岐阜新聞Ｗｅｂ,耕地面積の岐阜県１位「高山市」水稲やリンゴなど作付トップ　担い手不足で減少傾向続く,https://news.yahoo.co.jp/articles/cee199639d75b0b58c2cf5f6bd5566c2935d6ce1,2/26(月) 8:41
gifuweb,岐阜新聞Ｗｅｂ,ボクシング・田中恒成選手、史上最速４階級制覇で懸垂幕登場　岐阜・多治見市役所,https://news.yahoo.co.jp/articles/c01810b3e411054fcd756a43a50f4963907909e5,2/26(月) 8:09
gifuweb,岐阜新聞Ｗｅｂ,岐阜大前期１８５９人挑む、前後期倍率４．２倍　国公立大２次試験始まる,https://news.yahoo.co.jp/articles/da51b1b930257f06bda6081161c684094362cd94,2/26(月) 7:41
gifuweb,岐阜新聞Ｗｅｂ,必要な「災害への備え」遊びで学ぶ　多治見市の高橋さん、ボードゲーム制作,https://news.yahoo.co.jp/articles/902bc6f8170fc3d5b3dd7cc7d84b018acd3add0e,2/25(日) 9:12
gifuweb,岐阜新聞Ｗｅｂ,田中恒成が４階級制覇、史上最速２１戦目　ボクシング世界戦,https://news.yahoo.co.jp/articles/bffcd487385e68fef3b3fcc8bf38f884e8d42720,2/25(日) 8:44
gifuweb,岐阜新聞Ｗｅｂ,ＦＣ岐阜サポーター「今季こそ」　開幕戦快勝、昇格へ「全緑」応援,https://news.yahoo.co.jp/articles/4a91ded2d7199f5990056909f8c3f6b3f234a5d5,2/25(日) 8:33
gifuweb,岐阜新聞Ｗｅｂ,リニア残土受け入れ、町長判断へ　御嵩町審議会、合意至らず両論併記,https://news.yahoo.co.jp/articles/163ee1e39793138f8dd84ef17b7949653fe1cf9a,2/25(日) 8:12
gifuweb,岐阜新聞Ｗｅｂ,ネコ科の絶滅危惧種繁殖へ岐阜大が技術支援　動物園とタッグ、ふんから発情期を解析,https://news.yahoo.co.jp/articles/9920de22863ed0c4874395a81b8b13e64c2aa67a,2/25(日) 7:57
gifuweb,岐阜新聞Ｗｅｂ,J３・FC岐阜は４―１で開幕戦勝利！　FW藤岡の２発などで福島に逆転！　開幕戦の勝利は５年ぶり,https://news.yahoo.co.jp/articles/3d5b58b24ee8f58d6a1e98a7d3fc465e7dade762,2/24(土) 17:43
gifuweb,岐阜新聞Ｗｅｂ,くぎ使わない大工仕事、ジャングルジム「木造建築」園児が体験　岐阜・郡上の工務店「技術を次代に」,https://news.yahoo.co.jp/articles/2042110cc108e18fa78336d09d373c916dd14e39,2/24(土) 9:36
gifuweb,岐阜新聞Ｗｅｂ,多治見市で「セラミックバレー展」開幕　ハンガリーでの美濃焼展を再構成,https://news.yahoo.co.jp/articles/9b5a29b326b4673004d9d5716afc7878e4982ad5,2/24(土) 8:51
gifuweb,岐阜新聞Ｗｅｂ,「総裁選、派閥の妨害なし」野田聖子衆院議員インタビュー　無派閥、フェアな闘いを歓迎,https://news.yahoo.co.jp/articles/1261a22f863388cfec1eeba4f58e5183aadc6241,2/24(土) 8:03
gifuweb,岐阜新聞Ｗｅｂ,多様な働き方を推進、岐阜市が１３社と改革協議体を設立　労働力不足の解決目指す,https://news.yahoo.co.jp/articles/c80017edb7fcee5758e50008d5b2565dff58bf98,2/24(土) 7:54
gifuweb,岐阜新聞Ｗｅｂ,東濃鉄道が設立８０周年記念乗車券、３月１日発売　鉄道からバス事業までの歴史感じて,https://news.yahoo.co.jp/articles/f4e28bd07e831c7426c9dd6f849c7665b3d19eb7,2/24(土) 7:48
gifuweb,岐阜新聞Ｗｅｂ,昨年誕生の三つ子「コツメカワウソ」公開　岐阜・各務原市「アクア・トト」が名前公募,https://news.yahoo.co.jp/articles/544c4e9860d6cbd18f2935ff1491fac0a43cfaca,2/23(金) 9:34
gifuweb,岐阜新聞Ｗｅｂ,オーガニックの即席ラーメン、海外需要つかむ　桜井食品（岐阜県美濃加茂市）,https://news.yahoo.co.jp/articles/05807c7cadb7b7fc6080e40812d1239fb658caf3,2/23(金) 9:21
gifuweb,岐阜新聞Ｗｅｂ,全員が武義高生、美濃市が新設部署　「未来創造課」地域の課題解決策を提案,https://news.yahoo.co.jp/articles/1a59997b47fcd99fef593b15fb4d086efd212bc1,2/23(金) 9:16
gifuweb,岐阜新聞Ｗｅｂ,「加子母のイチゴ」摘み取り体験来て　岐阜・中津川市「ファンファーミング」,https://news.yahoo.co.jp/articles/46cf4e452211054fbf212dd3eca7758d8adace48,2/23(金) 9:04
gifuweb,岐阜新聞Ｗｅｂ,「自分を肯定して愛して」女装パフォーマー・ブルボンヌさん講演　ＬＧＢＴＱの捉え方紹介,https://news.yahoo.co.jp/articles/996902555f44c7e7197e7d09ccc04793b613f8c3,2/23(金) 8:46
gifuweb,岐阜新聞Ｗｅｂ,ＦＣ岐阜、あす２４日ホーム開幕戦　アンバサダー・柏木陽介さんＰＲ,https://news.yahoo.co.jp/articles/2b5debed2151fcc2a57f346e23a903839ee3a288,2/23(金) 8:07
gifuweb,岐阜新聞Ｗｅｂ,管理釣り場のニジマス、長良川に流出　増水で囲い土砂流され、遡上鮎への影響懸念,https://news.yahoo.co.jp/articles/6d9728a0bf1aca2ea272ee00c32b5b588d4e38ad,2/23(金) 8:01
