media_en,media_jp,title_articles,link_articles,date_original
gifuweb,岐阜新聞Ｗｅｂ,「ゴジラみこし」夜の街にぎやかに練る　飛騨神岡初金毘羅宵祭、岐阜,https://news.yahoo.co.jp/articles/2c0558783994dd21dc2913d3b87c79ad8470f0c1,2/27(火) 9:51
gifuweb,岐阜新聞Ｗｅｂ,高校野球部が小学生指導する活動、スポーツ庁表彰　大垣北高が全国初の部活動受賞、運動の習慣化評価,https://news.yahoo.co.jp/articles/36586455a717a9fa80f87c8beb02237e87dcb58d,2/27(火) 9:37
gifuweb,岐阜新聞Ｗｅｂ,町長セクハラ疑惑の調査委託費１２４１万円に、５００万円増額　岐阜・岐南町,https://news.yahoo.co.jp/articles/773cabba017a306cf717035cbbaa6c043b83a33b,2/27(火) 8:34
gifuweb,岐阜新聞Ｗｅｂ,丸亀製麺の新商品「シャカシャカ揚げうどん」きなこ味＆のり塩味　岐阜大生コラボ、限定販売,https://news.yahoo.co.jp/articles/ce5c0a9a47d670d23057da38d34268bb904c8e92,2/27(火) 8:17
gifuweb,岐阜新聞Ｗｅｂ,川上貞奴創設の貞照寺　鐘楼堂を焼く　けが人なし　岐阜・各務原市,https://news.yahoo.co.jp/articles/e778339275c24c6eb1c84722db78b5f93e03bbcc,2/27(火) 8:03
gifuweb,岐阜新聞Ｗｅｂ,温泉からレジオネラ菌、施設利用２人発症　岐阜・海津市、水晶の湯と宙舟の湯,https://news.yahoo.co.jp/articles/f6aa7fa9cdbfb994efbc1f3f8617ee3c5ea602ee,2/27(火) 7:53
gifuweb,岐阜新聞Ｗｅｂ,釣り場増水で長良川に流出「ニジマス３０００匹」漁協が推計　営業再開は未定、岐阜市,https://news.yahoo.co.jp/articles/e41ebdb5a55ea2b3c948f9b6e97ef3b7b6949c4a,2/27(火) 7:37
gifuweb,岐阜新聞Ｗｅｂ,市役所内で喫煙問題、措置講じてない喫煙場所廃止「幹部のみ利用で特権的」批判も　岐阜・各務原市,https://news.yahoo.co.jp/articles/3414088d97f1836b07b0c3674d03f4f4d4c85ddd,2/27(火) 7:26
gifuweb,岐阜新聞Ｗｅｂ,JR穂積駅で人身事故　列車にはねられ女性死亡　岐阜・瑞穂市,https://news.yahoo.co.jp/articles/bd4a9845dfd5c4c186596a04ecc12a96c82da332,2/26(月) 10:33
gifuweb,岐阜新聞Ｗｅｂ,Ｄａ−ｉＣＥ大野雄大さんとソナーポケット、一夜限り特別ライブ　３月末閉館の岐阜・大垣市民会館,https://news.yahoo.co.jp/articles/8c6e67e90ad400e0e98c57a61cf063f0de157eaa,2/26(月) 10:16
gifuweb,岐阜新聞Ｗｅｂ,金の蛇に化身した母親の伝説、村襲うワシ退治　難読地名「金蛇入池」岐阜・瑞浪市,https://news.yahoo.co.jp/articles/2f1a780d8762327f8635b013cee7040c30d48325,2/26(月) 9:48
gifuweb,岐阜新聞Ｗｅｂ,不要ランドセルや未使用文具をフィリピンへ、子どもの学び応援　岐阜・下呂市の高校生らＳＤＧｓ活動,https://news.yahoo.co.jp/articles/da831353d67ac152cafff6c62bb4bb81e2698839,2/26(月) 9:19
gifuweb,岐阜新聞Ｗｅｂ,耕地面積の岐阜県１位「高山市」水稲やリンゴなど作付トップ　担い手不足で減少傾向続く,https://news.yahoo.co.jp/articles/cee199639d75b0b58c2cf5f6bd5566c2935d6ce1,2/26(月) 8:41
gifuweb,岐阜新聞Ｗｅｂ,ボクシング・田中恒成選手、史上最速４階級制覇で懸垂幕登場　岐阜・多治見市役所,https://news.yahoo.co.jp/articles/c01810b3e411054fcd756a43a50f4963907909e5,2/26(月) 8:09
gifuweb,岐阜新聞Ｗｅｂ,岐阜大前期１８５９人挑む、前後期倍率４．２倍　国公立大２次試験始まる,https://news.yahoo.co.jp/articles/da51b1b930257f06bda6081161c684094362cd94,2/26(月) 7:41
gifuweb,岐阜新聞Ｗｅｂ,必要な「災害への備え」遊びで学ぶ　多治見市の高橋さん、ボードゲーム制作,https://news.yahoo.co.jp/articles/902bc6f8170fc3d5b3dd7cc7d84b018acd3add0e,2/25(日) 9:12
gifuweb,岐阜新聞Ｗｅｂ,田中恒成が４階級制覇、史上最速２１戦目　ボクシング世界戦,https://news.yahoo.co.jp/articles/bffcd487385e68fef3b3fcc8bf38f884e8d42720,2/25(日) 8:44
gifuweb,岐阜新聞Ｗｅｂ,ＦＣ岐阜サポーター「今季こそ」　開幕戦快勝、昇格へ「全緑」応援,https://news.yahoo.co.jp/articles/4a91ded2d7199f5990056909f8c3f6b3f234a5d5,2/25(日) 8:33
gifuweb,岐阜新聞Ｗｅｂ,リニア残土受け入れ、町長判断へ　御嵩町審議会、合意至らず両論併記,https://news.yahoo.co.jp/articles/163ee1e39793138f8dd84ef17b7949653fe1cf9a,2/25(日) 8:12
gifuweb,岐阜新聞Ｗｅｂ,ネコ科の絶滅危惧種繁殖へ岐阜大が技術支援　動物園とタッグ、ふんから発情期を解析,https://news.yahoo.co.jp/articles/9920de22863ed0c4874395a81b8b13e64c2aa67a,2/25(日) 7:57
gifuweb,岐阜新聞Ｗｅｂ,J３・FC岐阜は４―１で開幕戦勝利！　FW藤岡の２発などで福島に逆転！　開幕戦の勝利は５年ぶり,https://news.yahoo.co.jp/articles/3d5b58b24ee8f58d6a1e98a7d3fc465e7dade762,2/24(土) 17:43
gifuweb,岐阜新聞Ｗｅｂ,くぎ使わない大工仕事、ジャングルジム「木造建築」園児が体験　岐阜・郡上の工務店「技術を次代に」,https://news.yahoo.co.jp/articles/2042110cc108e18fa78336d09d373c916dd14e39,2/24(土) 9:36
gifuweb,岐阜新聞Ｗｅｂ,多治見市で「セラミックバレー展」開幕　ハンガリーでの美濃焼展を再構成,https://news.yahoo.co.jp/articles/9b5a29b326b4673004d9d5716afc7878e4982ad5,2/24(土) 8:51
gifuweb,岐阜新聞Ｗｅｂ,「総裁選、派閥の妨害なし」野田聖子衆院議員インタビュー　無派閥、フェアな闘いを歓迎,https://news.yahoo.co.jp/articles/1261a22f863388cfec1eeba4f58e5183aadc6241,2/24(土) 8:03
gifuweb,岐阜新聞Ｗｅｂ,多様な働き方を推進、岐阜市が１３社と改革協議体を設立　労働力不足の解決目指す,https://news.yahoo.co.jp/articles/c80017edb7fcee5758e50008d5b2565dff58bf98,2/24(土) 7:54
gifuweb,岐阜新聞Ｗｅｂ,東濃鉄道が設立８０周年記念乗車券、３月１日発売　鉄道からバス事業までの歴史感じて,https://news.yahoo.co.jp/articles/f4e28bd07e831c7426c9dd6f849c7665b3d19eb7,2/24(土) 7:48
gifuweb,岐阜新聞Ｗｅｂ,昨年誕生の三つ子「コツメカワウソ」公開　岐阜・各務原市「アクア・トト」が名前公募,https://news.yahoo.co.jp/articles/544c4e9860d6cbd18f2935ff1491fac0a43cfaca,2/23(金) 9:34
gifuweb,岐阜新聞Ｗｅｂ,オーガニックの即席ラーメン、海外需要つかむ　桜井食品（岐阜県美濃加茂市）,https://news.yahoo.co.jp/articles/05807c7cadb7b7fc6080e40812d1239fb658caf3,2/23(金) 9:21
gifuweb,岐阜新聞Ｗｅｂ,全員が武義高生、美濃市が新設部署　「未来創造課」地域の課題解決策を提案,https://news.yahoo.co.jp/articles/1a59997b47fcd99fef593b15fb4d086efd212bc1,2/23(金) 9:16
gifuweb,岐阜新聞Ｗｅｂ,「加子母のイチゴ」摘み取り体験来て　岐阜・中津川市「ファンファーミング」,https://news.yahoo.co.jp/articles/46cf4e452211054fbf212dd3eca7758d8adace48,2/23(金) 9:04
gifuweb,岐阜新聞Ｗｅｂ,「自分を肯定して愛して」女装パフォーマー・ブルボンヌさん講演　ＬＧＢＴＱの捉え方紹介,https://news.yahoo.co.jp/articles/996902555f44c7e7197e7d09ccc04793b613f8c3,2/23(金) 8:46
gifuweb,岐阜新聞Ｗｅｂ,ＦＣ岐阜、あす２４日ホーム開幕戦　アンバサダー・柏木陽介さんＰＲ,https://news.yahoo.co.jp/articles/2b5debed2151fcc2a57f346e23a903839ee3a288,2/23(金) 8:07
gifuweb,岐阜新聞Ｗｅｂ,管理釣り場のニジマス、長良川に流出　増水で囲い土砂流され、遡上鮎への影響懸念,https://news.yahoo.co.jp/articles/6d9728a0bf1aca2ea272ee00c32b5b588d4e38ad,2/23(金) 8:01
gifuweb,岐阜新聞Ｗｅｂ,女性宅付近うろつき、タイヤパンクさせる…ストーカー行為疑い７９歳男逮捕　岐阜県警,https://news.yahoo.co.jp/articles/55e6b7057a358307cdde8ead283ff4d8fd561d55,2/22(木) 10:43
gifuweb,岐阜新聞Ｗｅｂ,春の縁起物降ってきた！つりびな飾り　岐阜・大垣市内で「小町めぐり」,https://news.yahoo.co.jp/articles/69496569a9cbb5611e7a326d401e0cb581073d90,2/22(木) 10:22
gifuweb,岐阜新聞Ｗｅｂ,リゾート感あふれるカフェ＆バル、こだわりタコライスやピザ提供　選べるランチセット人気,https://news.yahoo.co.jp/articles/dd9d7cfe8bf2f66c0496ed88edc29e43677b167e,2/22(木) 10:09
gifuweb,岐阜新聞Ｗｅｂ,築４０年市営住宅リノベ「押し入れ→壁面棚」開放感あるリビングに　女子大学生が改修、モダンな雰囲気,https://news.yahoo.co.jp/articles/c3542ef26510dd57d4c1fb3369760cc1b1d53b8c,2/22(木) 9:53
gifuweb,岐阜新聞Ｗｅｂ,レース優勝タイヤ注文急増「シバタイヤ」売上高１１億円見込み　岐阜・柴田自動車「大会で良さ証明」,https://news.yahoo.co.jp/articles/6bc64c89fa14d2a9524f74f90d89ae571e2cc4a9,2/22(木) 9:16
gifuweb,岐阜新聞Ｗｅｂ,岐阜県内３７０社集結　合同企業説明会「オール岐阜・企業フェス」開幕,https://news.yahoo.co.jp/articles/8183f116d897d535db6b8bd6d74e4da9b3b3447e,2/22(木) 8:29
gifuweb,岐阜新聞Ｗｅｂ,メタバース授業出席扱い「フリースペース」開設、主体性育む授業　岐阜市、不登校の児童生徒対象,https://news.yahoo.co.jp/articles/679662ab98e9f0e37f4b62267261d2c67570d428,2/22(木) 8:14
gifuweb,岐阜新聞Ｗｅｂ,郷土の書作家１３２人流麗な筆致、岐阜県書作展開幕　岐阜高島屋では最後の開催,https://news.yahoo.co.jp/articles/eabf0eb063faef160825138bc1120c27f390d0eb,2/22(木) 7:53
gifuweb,岐阜新聞Ｗｅｂ,市役所で市長ら日常的に喫煙、灰皿も設置　「特定場所」措置講じてない屋外スペース、岐阜・各務原市,https://news.yahoo.co.jp/articles/01096eef68188d986a2c78bdec5aad4527d6ab3d,2/22(木) 7:28
gifuweb,岐阜新聞Ｗｅｂ,ＦＣ岐阜と情報発信拠点「ギフツ」コラボ、名古屋・オアシス２１でＰＲ　公式グッズ販売予定,https://news.yahoo.co.jp/articles/9dc33a819c19125f57be0fc38a68ec5df856accf,2/21(水) 14:02
gifuweb,岐阜新聞Ｗｅｂ,甘く香るピンクのシャワー、名物しだれ梅「飛龍梅」満開　岐阜・大垣市,https://news.yahoo.co.jp/articles/7f95d674cf44b0833cb836f787a3b96801fc0ef9,2/21(水) 9:33
gifuweb,岐阜新聞Ｗｅｂ,コンプレックス乗り越え世界女性コン３位、思春期に背骨曲がる側彎症診断「今は個性、心はまっすぐで」,https://news.yahoo.co.jp/articles/d32cde1622ccf39d0a568cabe2c2d624808fe8ae,2/21(水) 9:16
gifuweb,岐阜新聞Ｗｅｂ,猫の日で猫祭り！ねこまんまセットや猫グッズ販売　岐阜・飛騨市でキャンペーン,https://news.yahoo.co.jp/articles/1288053770c8baa7e755979c82c358f256005527,2/21(水) 8:42
gifuweb,岐阜新聞Ｗｅｂ,１３段盛大ひなまつり、人形７００体豪華絢爛　岐阜・恵那市,https://news.yahoo.co.jp/articles/1c62f8e82c2ea9c12b6ee81b6f54599e0e580bf2,2/21(水) 8:28
gifuweb,岐阜新聞Ｗｅｂ,ＳＮＳで知り合った相手「携帯貸して」詐取逃走、容疑の２３歳男再逮捕　同様被害複数発生、岐阜羽島署,https://news.yahoo.co.jp/articles/c4b6569399dac3f09a3839c0d4f7466cd4ded9ea,2/21(水) 7:57
gifuweb,岐阜新聞Ｗｅｂ,女性に６４３回電話、ストーカー疑い４１歳男逮捕　被害者宅探す男に職質→被害発覚、岐阜中署,https://news.yahoo.co.jp/articles/b74a5f57731dd2b661880d4911fde693cd882e6f,2/21(水) 7:41
gifuweb,岐阜新聞Ｗｅｂ,２月なのに気温２０度超え、岐阜県内６地点で史上最高　２１日以降寒さ戻る見込み,https://news.yahoo.co.jp/articles/55bb65422ca296a79723440fc8265d630de7f488,2/21(水) 7:32
gifuweb,岐阜新聞Ｗｅｂ,岐阜・大垣駅前のホテルで火災　けが人なし,https://news.yahoo.co.jp/articles/24cc1747c79d2f75b96e419dc493c295d5c0d515,2/20(火) 15:46
