media_en,media_jp,title_articles,date_original
kyt,京都新聞,日本で唯一淡水湖有人島にある小学校児童ら、在籍2人の山間部の小学校と交流　一緒にアマゴ放流、滋賀,11/3(日) 12:02
kyt,京都新聞,「命は有限だと早くに気付けた」　京都の38歳会社員が体験した白血病と骨髄移植,11/3(日) 10:31
kyt,京都新聞,グンゼ入社後も描き続け磨いた画力　80歳OB男性が京都府綾部市で絵画展,11/3(日) 9:02
kyt,京都新聞,農家対象に「リカレント教育」推進へ　近畿農政局と神戸大学大学院が連携協定,11/3(日) 8:02
kyt,京都新聞,クリやカボチャで彩った「野菜みこし」　40年前開始、地域つなぐ秋祭りに　京都府京丹波町,11/3(日) 7:02
kyt,京都新聞,京都市北区で160軒が停電,11/2(土) 19:54
kyt,京都新聞,東海道新幹線、東京−新大阪で一時運転見合わせ　大雨のため、きょう２回目,11/2(土) 19:27
kyt,京都新聞,J１京都サンガのMF金子大毅選手が人身事故　車運転中にバイクと接触,11/2(土) 18:32
kyt,京都新聞,京都のタケノコ産地に忍び寄る外来種　全国初の注意喚起発表、生産者は戸惑い,11/2(土) 18:32
kyt,京都新聞,「あと10分長く降ったら、どうなったか」　京都で大雨、民家の庭に土砂流入,11/2(土) 18:22
kyt,京都新聞,京都・桂川、氾濫危険水位を一時超える　京都府亀岡市,11/2(土) 16:32
kyt,京都新聞,社説：フリーランス新法　安心して働ける環境整備を,11/2(土) 16:02
kyt,京都新聞,JR山陰線、大雨で福知山−和田山間で一時運転見合わせ,11/2(土) 15:54
kyt,京都新聞,京都・桂川に一時氾濫警戒情報を発表　京都府亀岡市で浸水の恐れ,11/2(土) 15:46
kyt,京都新聞,京都府内の複数の河川、氾濫危険水位を一時超える　由良川の支流など,11/2(土) 15:02
kyt,京都新聞,京都市・鴨川は濁流に　季節外れの大雨で,11/2(土) 14:39
kyt,京都新聞,JR奈良線、大雨で一時運転見合わせ　関西線一部区間も,11/2(土) 14:18
kyt,京都新聞,大阪府能勢町に一時土砂災害警戒情報　大雨警報の１ランク上の警戒を,11/2(土) 14:12
kyt,京都新聞,京都府の亀岡市と南丹市園部町に一時土砂災害警戒情報,11/2(土) 13:57
kyt,京都新聞,京都府北部の川上谷川、水位が堤防を越える恐れ　京丹後市の1300人に避難指示,11/2(土) 13:51
kyt,京都新聞,京都縦貫道、大雨のため京都府中部で上下線が一時通行止め,11/2(土) 13:36
kyt,京都新聞,JR嵯峨野線、大雨で京都府中部の区間が一時運転見合わせ,11/2(土) 13:33
kyt,京都新聞,京都市などの洪水警報すべて解除,11/2(土) 13:27
kyt,京都新聞,滋賀県の広範囲に一時大雨警報　土砂災害に警戒を、守山市と豊郷町をのぞく全市町,11/2(土) 12:57
kyt,京都新聞,79歳男性の運転する車が眼科医院の壁に突っ込む　待合室にいた2人が救急搬送,11/2(土) 11:22
kyt,京都新聞,山陽新幹線・東海道新幹線は全線再開　一時全線で運転見合わせ,11/2(土) 10:57
kyt,京都新聞,山陽新幹線、広島ー博多も運転再開,11/2(土) 10:33
kyt,京都新聞,ＪＲ湖西線、2日午後から運転見合わせへ　和邇駅以北、荒天予想のため,11/2(土) 10:12
kyt,京都新聞,大阪市と堺市に一時大雨警報　昼前から非常に激しい雨の恐れ,11/2(土) 9:39
kyt,京都新聞,京都市など広範囲に一時大雨警報　ピークは昼前から、非常に激しい雨の恐れ,11/2(土) 9:36
kyt,京都新聞,「突きだけでなく人の心伝えたい」日本の空手家がベトナムへ　「白鳥」の形も披露「迫力感じて」,11/2(土) 7:02
kyt,京都新聞,「小論文はミステリー書くのに似てる」　その心は?女性作家の研究者が執筆のコツを伝授,11/2(土) 6:02
kyt,京都新聞,「お菓子あげるから来て」43歳タクシー運転手を8歳女児の連れ去り未遂容疑で逮捕　手引っ張る,11/1(金) 21:46
kyt,京都新聞,全裸で土下座を要求、顔を鉄棒で殴る　集団暴行で無職少年や男子高校生を逮捕、傷害の疑い,11/1(金) 19:54
kyt,京都新聞,2日の「スーパーはくと」京都発ー倉吉着、大阪発ー倉吉着など軒並み運休　大雨見込みで,11/1(金) 19:27
kyt,京都新聞,観光特急「ウエストエクスプレス銀河」1日と2日に運転取りやめ　大雨予報で,11/1(金) 18:54
kyt,京都新聞,「後輩にいい格好したい」京都市バス運転士が同僚女性を無賃乗車させる　IC読み取り部を手で覆う,11/1(金) 18:27
kyt,京都新聞,【速報】滋賀県、あす2日は警報級大雨の可能性も　台風21号起源の暖湿気が流入、激しい雨に,11/1(金) 17:32
kyt,京都新聞,大阪府、あす２日は警報級大雨の見通し　上空に異常な高温の気流、非常に激しい雨の恐れ,11/1(金) 17:32
kyt,京都新聞,京都府、あす2日は警報級大雨の可能性高く　上空に異常な高温の気流、非常に激しい雨の恐れ,11/1(金) 17:32
kyt,京都新聞,米軍に忖度?基地おひざ元の市役所が司令官との面談記録残さず　表敬時のやり取り不明「市民に疑念」,11/1(金) 17:32
kyt,京都新聞,特別展「眷属」が来場1万人突破　埼玉の夫妻に記念品　仏に従う「名脇役」の名品ずらり、魅力堪能,11/1(金) 17:24
kyt,京都新聞,社説：同性婚訴訟判決　立法対応を強く促した,11/1(金) 16:06
kyt,京都新聞,社説：旧ジャニーズ　説明責任を果たさねば,11/1(金) 16:02
kyt,京都新聞,クレジットカードで京都府北部の山村を応援して　京都・与謝野町の団体、活動応援受け取り,11/1(金) 15:57
kyt,京都新聞,横断歩道やトラックの近く「危ないことがある」　京都・与謝野町で交通安全教室,11/1(金) 15:39
kyt,京都新聞,車降りたら羽交い締め、かばん物色されて殴られる　京都・山科で会社役員が強盗被害,11/1(金) 12:32
kyt,京都新聞,「行き過ぎた探偵行為」ストーカー犯罪で摘発　過去には殺人事件も,11/1(金) 10:32
kyt,京都新聞,江戸時代から伝わる丹波八坂太鼓、公演前にメンバーが音の緩急や間合いなど稽古,11/1(金) 8:02
kyt,京都新聞,「カメラを付けるため女子トイレに入った」　盗撮目的で侵入疑い、市課長補佐の男を逮捕,10/31(木) 22:02
kyt,京都新聞,やせ形患者には大きな薬効認められず　心血管疾患の予防効果がある糖尿病治療薬,10/31(木) 21:22
kyt,京都新聞,2000万円相当の乾燥大麻をスナック菓子と一緒に梱包し輸入、容疑でベトナム国籍2人を逮捕,10/31(木) 21:01
kyt,京都新聞,職場で脱衣中の女性をスマホで盗撮、消防士長を懲戒免職,10/31(木) 20:42
kyt,京都新聞,滋賀で鳥インフル検出、半径10キロ圏内を野鳥監視重点区域に指定　今シーズン初,10/31(木) 20:32
kyt,京都新聞,フジテック会長解任取り消し訴訟　元会長側の請求棄却、一部を却下,10/31(木) 20:02
kyt,京都新聞,京都市で不祥事多発、職員同士のなれ合いや「緩み」指摘　懲戒処分者7人、逮捕者5人,10/31(木) 18:31
kyt,京都新聞,730事業所と住民を結ぶ「ガイドブック」　地域活性化へ京都府木津川市商工会が作成,10/31(木) 16:18
kyt,京都新聞,はだしの男児が車道に立往生、車にクラクション鳴らされて　声かけたのは女子小学生「自分がいかなきゃ」,10/31(木) 16:12
kyt,京都新聞,社説：検事正の性暴力　高まる検察不信、直視を,10/31(木) 16:06
kyt,京都新聞,発達障害、現場の警察官に求められる配慮とは　体験談など紹介　滋賀県警がセミナー,10/31(木) 16:02
kyt,京都新聞,社説：北朝鮮の派兵　ロシア加担の暴走防げ,10/31(木) 16:02
kyt,京都新聞,京都府与謝野町と英国・ウェールズの高校生　着物姿で交流「緊張したけど、気持ち伝わった」,10/31(木) 15:32
kyt,京都新聞,農家人生を懸けてつかんだ「さつまいも・オブ・ザ・イヤー」京都府京丹後産のブランド化目指す,10/31(木) 15:02
kyt,京都新聞,在留外国人の増加で迫られる「保育所のグローバル化」　情報バリアフリーへ専門家が事例紹介,10/31(木) 15:02
kyt,京都新聞,茶の湯で学ぶ「和の心」　京都府向日市で児童体験　講師に表千家の西田社中,10/31(木) 14:32
kyt,京都新聞,酒気帯びで軽乗用車運転、信号待ちの車に追突疑い　29歳会社員の男逮捕,10/31(木) 10:03
kyt,京都新聞,乗合タクシー、利用減少で存続のピンチ　理由は「今夏の猛暑」、いったいなぜ？,10/31(木) 10:02
kyt,京都新聞,バイク69歳男性がひき逃げで死亡　無免許で軽乗用車運転、容疑の19歳男逮捕,10/31(木) 9:57
kyt,京都新聞,「アグリフェスタ」で京都・亀岡自慢のグルメ楽しむ　オーガニック野菜の店も,10/31(木) 7:02
kyt,京都新聞,「楽に稼げる投資に挑戦すべき」51歳無職女性、ロマンス詐欺で500万円被害,10/30(水) 19:52
kyt,京都新聞,高速で5台絡む多重事故、オートバイの男性死亡　トラックが追突,10/30(水) 19:18
kyt,京都新聞,71歳女性を刺した殺人未遂疑い29歳女性、不起訴処分に,10/30(水) 18:32
kyt,京都新聞,京都市で火災が多発「機器の掃除や交換を」最多の出火原因は？,10/30(水) 18:32
kyt,京都新聞,乳児に強酸性の薬でやけど負わせた准看護師、罰金30万円命令,10/30(水) 18:22
kyt,京都新聞,映像祭の協賛金を着服疑い　「再度捜査すべき」不起訴不当の議決,10/30(水) 18:09
kyt,京都新聞,およそ80年ぶり、満州でクラスメイトだった2人が京都で涙の再会「あの背が高かった子だ」,10/30(水) 16:32
kyt,京都新聞,社説：イスラエル報復　ただちに停戦に応じよ,10/30(水) 16:06
kyt,京都新聞,社説：滋賀の３市長選　「次の１０年」へ市民目線で,10/30(水) 16:01
kyt,京都新聞,阪急京都線、特急と接触した男性が死亡　高槻市駅のホームで後ろ向きに倒れる,10/30(水) 12:22
kyt,京都新聞,高速で5台絡む多重事故、オートバイの男性死亡　京都・第二京阪道路,10/30(水) 12:12
kyt,京都新聞,国道で「バイクの高齢男性倒れている」、その後死亡確認　警察はひき逃げで捜査,10/30(水) 10:33
kyt,京都新聞,阪急京都線の高槻市駅で人身事故、ホームに倒れた人　阪急京都線と千里線が一時運転見合わせ,10/30(水) 10:09
kyt,京都新聞,少女への性的暴行、公益通報して懲戒処分された公務員は語る　「通報者に報復した組織に厳罰を」,10/30(水) 10:01
kyt,京都新聞,京都府内の40代女性がはしか発症、今年3件目　前日にスーパー訪れる,10/29(火) 21:42
kyt,京都新聞,女子中学生に「個人情報さらす」と脅し、SNSで裸の写真を送らせた疑い　22歳無職男逮捕,10/29(火) 21:09
kyt,京都新聞,能楽・華道・和菓子の第一人者が語る「京文化と食の未来」　京都の歌舞練場でフォーラム,10/29(火) 21:03
kyt,京都新聞,不正改造車を法定検査せず車検通した疑い　検査員ら2人逮捕,10/29(火) 19:46
kyt,京都新聞,JR関西線の伊賀上野ー加茂で一時運転見合わせ　大河原ー笠置で倒木,10/29(火) 18:06
kyt,京都新聞,「どんどん忘れられている」京都の住宅街を襲った土石流　94歳「生きた心地しなかった」,10/29(火) 18:01
kyt,京都新聞,「一緒に一歩ずつ」「つながり取り戻す」ろうあ協会と支援団体、節目の記念大会を合同開催,10/29(火) 16:27
kyt,京都新聞,社説：自民「１強」終止符　熟議を通して政治を進めよ,10/29(火) 16:02
kyt,京都新聞,ウクライナ人が描く琵琶湖ある町の情景、スペイン人が漢字から着想した字　多彩な現代アート展,10/29(火) 15:32
kyt,京都新聞,「支え合いの競技」アルティメットとは　体験会で飛び交うディスク、27年に京都で世界大会開催,10/29(火) 15:02
kyt,京都新聞,「庶民受け入れの歴史を評価。非常にありがたい」新たに重文指定・三井寺観音堂で特別拝観,10/29(火) 14:32
kyt,京都新聞,社説：自公が過半数割れ　民意は政治改革やり直しだ,10/29(火) 10:46
kyt,京都新聞,性暴力の「後遺症」苦しむ天台宗の尼僧　脳裏よぎる被害の映像と音声「配慮欠く聞き取り」,10/29(火) 10:32
kyt,京都新聞,「けがはない、と相手が言ったので」車に追突の53歳男、ひき逃げ疑いで逮捕,10/29(火) 8:54
kyt,京都新聞,粘土と落ち葉で作った竜の住む島、銀の粘着テープで作りこんだ魚　京都・丹波地域の子の力作並ぶ,10/29(火) 7:01
kyt,京都新聞,京都の水路に成人男性の遺体　通行人が発見、衣服身につけたまま,10/28(月) 21:32
kyt,京都新聞,農水省職員を盗撮容疑で逮捕　駅のエスカレーターや階段で女性のスカート内を動画で撮影,10/28(月) 21:22
kyt,京都新聞,滋賀で鳥インフル疑い、県が養鶏業者に注意呼びかけ,10/28(月) 20:57
kyt,京都新聞,スナック菓子の中に188万円分の大麻　密輸の報酬は数万円、容疑で逮捕の男「金欠だった」,10/28(月) 20:31
kyt,京都新聞,「公園の場所を教えて」10歳女児に声かけ、無理やり下半身触る　容疑の男を逮捕,10/28(月) 20:02
kyt,京都新聞,名神でトラックが中央分離帯やガードレールに次々衝突　運転手の男性は死亡,10/28(月) 20:02
kyt,京都新聞,「前理事長が職員に繰り返し性暴力」損賠判決　問題起きた社会福祉法人「極めて不適切な行為」,10/28(月) 20:02
kyt,京都新聞,京都市民が痛切に感じる「観光過剰」AIで軽減できる？　産官学連携で研究へ,10/28(月) 18:32
kyt,京都新聞,「SNS型投資詐欺」で現金500万円被害の男性、だまされた手口は,10/28(月) 17:48
kyt,京都新聞,阪急京都線と千里線が全線で一時運転見合わせ　高槻市ー上牧で人身事故,10/28(月) 16:57
kyt,京都新聞,JR湖西線、堅田−近江今津駅間で一時運転見合わせ　和邇駅で新快速が線路内の人と接触,10/28(月) 15:46
kyt,京都新聞,柔道の動作、五輪メダリストが直伝　京都府福知山市の支援学校で中村美里さんが生徒と交流,10/28(月) 15:32
kyt,京都新聞,広島の被爆者「世界中が知った今こそ核禁止条約に参加を」　ノーベル平和賞受け、京都市で訴え,10/28(月) 15:02
kyt,京都新聞,廃棄される花「ロスフラワー」で押し花づくり　京都市上京区で親子らが環境に優しい取り組み体験,10/28(月) 14:02
kyt,京都新聞,木の優しい手触りに子供たち笑顔　「びわ湖材」のおもちゃで遊び体験イベント　大津市,10/28(月) 12:01
kyt,京都新聞,豪商「収益を独占しなかった」　京都・亀岡で角倉了以ら親子再評価の研究会,10/28(月) 7:02
kyt,京都新聞,衆院選　自民・大岡敏孝氏が当選確実　滋賀1区で落選も比例復活,10/28(月) 1:42
kyt,京都新聞,参政党・北野裕子氏に当選確実　滋賀3区で落選も比例復活,10/28(月) 1:32
kyt,京都新聞,衆院選・滋賀1区、斎藤アレックス氏の当選確実　維新前職,10/28(月) 0:36
kyt,京都新聞,JR福知山駅で列車ホテル実施,10/28(月) 0:32
kyt,京都新聞,共産新人・堀川朗子氏が当選確実　京都2区で落選、比例近畿で復活,10/27(日) 23:48
kyt,京都新聞,自民との大連立「野田体制が考えること」　立民前代表の泉健太氏、衆院選9選確実,10/27(日) 21:42
kyt,京都新聞,滋賀県愛荘町の860軒で一時停電　原因調査中,10/27(日) 21:16
kyt,京都新聞,京都府内の6つの小選挙区で当確出そろう　京都1・5区は自民、3・6区は立民,10/27(日) 21:12
kyt,京都新聞,「大勝利のいしずえつくった」と立民の福山哲郎・京都府連会長　衆院選9選確実の前代表・泉健太氏を称賛,10/27(日) 21:12
kyt,京都新聞,JR神戸線が一時運転見合わせ　西明石ー大久保で新快速が人と接触、1万3千人に影響,10/27(日) 21:09
kyt,京都新聞,衆院選・比例近畿で竹内譲氏が当選確実　公明前職,10/27(日) 21:01
kyt,京都新聞,「維新合流に批判あったが理解いただけた」衆院選・京都2区で当選確実の前原誠司氏が喜び,10/27(日) 20:46
kyt,京都新聞,衆院選で既に期日前投票済ませた人に誤って投票用紙交付の可能性　京都府与謝野町,10/27(日) 20:42
kyt,京都新聞,京都・京福電鉄の踏切で遮断棒上がったままで電車が通過　人や車と接触なし,10/27(日) 20:37
kyt,京都新聞,衆院選の投票所で小選挙区の投票用紙を二重交付の可能性　京都府南丹市,10/27(日) 20:37
kyt,京都新聞,衆院選・比例近畿で小寺裕雄氏が当選確実　自民前職,10/27(日) 20:12
kyt,京都新聞,衆院選・滋賀3区で武村展英氏が当選確実　自民前職、区割り変更乗り越え,10/27(日) 20:12
kyt,京都新聞,衆院選・滋賀2区で上野賢一郎氏が当選確実　自民前職,10/27(日) 20:06
kyt,京都新聞,衆院選・京都4区で北神圭朗氏が当選確実　無所属前職,10/27(日) 20:02
kyt,京都新聞,衆院選・京都1区で勝目康氏が当選確実　自民前職、組織力発揮で逃げ切り,10/27(日) 20:02
kyt,京都新聞,衆院選・京都5区で本田太郎氏が当選確実　自民前職,10/27(日) 20:02
kyt,京都新聞,衆院選・京都2区　維新の前原誠司氏が当選確実　公示直前に党合流も手堅く11選,10/27(日) 20:02
kyt,京都新聞,衆院選・京都3区で泉健太氏が当選確実　立民前代表、貫禄見せつける,10/27(日) 20:02
kyt,京都新聞,衆院選・京都6区で立民・山井和則氏が当選確実　裏金調査や議員立法の実績前面に戦い,10/27(日) 20:02
kyt,京都新聞,JR福知山線が一時運転見合わせ　特急「こうのとり」で異音、4時間40分後に運転再開,10/27(日) 19:32
kyt,京都新聞,「苦手な人でも食べやすい」京都の高校生が小松菜クレープ製造、文化祭で完売,10/27(日) 19:02
kyt,京都新聞,「似合う色を身につけるとポジティブに」　京都・長岡京でパーソナルカラー講座,10/27(日) 18:54
kyt,京都新聞,滋賀県内、午後6時の投票率は30・17％　前回選同時刻より3ポイント余り低く,10/27(日) 18:42
kyt,京都新聞,京都府内の衆院選投票率は午後6時時点で30・14％　前回選を下回る,10/27(日) 18:39
kyt,京都新聞,京都サンガ13大会ぶり天皇杯決勝進出ならず　神戸に1−2で敗れる,10/27(日) 17:22
kyt,京都新聞,衆院選の期日前投票を済ませた2人に「二重投票」させるミス　滋賀県高島市、有効票扱いに,10/27(日) 16:48
kyt,京都新聞,父親を殺害しようとした疑い、25歳の男を逮捕　「いじめてくる人がいたが、信じてもらえず」,10/27(日) 16:46
kyt,京都新聞,京都府内の衆院選投票率は午後4時時点で25・25％　前回選を下回る,10/27(日) 16:39
kyt,京都新聞,社説：きょう投票　目を凝らして未来を選ぼう,10/27(日) 16:02
kyt,京都新聞,京都府内の衆院選投票率は午後2時時点で20・26％　前回選を下回る,10/27(日) 14:42
kyt,京都新聞,京都府の衆院選投票率は正午時点で14・37％　前回選下回る,10/27(日) 14:32
kyt,京都新聞,40年前に天国へ、看板屋のおじいちゃんのイラストが今人気に　孫娘がトートバッグ販売,10/27(日) 10:02
kyt,京都新聞,氷河期世代が安定雇用される「異世界」を思う　過去は変えられなくても今の一票で…,10/27(日) 10:02
kyt,京都新聞,「選挙か。どうでもいいな」その気持ち痛いほどわかる　それでも、その先を考えると…,10/27(日) 9:02
kyt,京都新聞,家で余った賞味期限長い食品、ひとり親家庭などに届けます　京都の町がフードドライブ,10/27(日) 7:01
kyt,京都新聞,1280年前にあった「都」の跡にコスモス揺れる　見頃はあと少し,10/27(日) 6:02
kyt,京都新聞,選挙管理委員会のミスが2日連続発覚、投票用紙を誤交付　滋賀・甲賀市,10/26(土) 18:51
kyt,京都新聞,2メートルの巨大クラゲ、日本海に大量発生　定置網などに引っかかりまくり、漁師ピンチ【動画あり】,10/26(土) 18:02
kyt,京都新聞,ベテランコンビニ店員、「PCがウイルス感染」と慌てる高齢者を、丁寧に落ち着かせて詐欺防ぐ,10/26(土) 17:32
kyt,京都新聞,広〜い市域の全投票所で投票できるシステム、山間部の市が導入　二重投票防止もばっちり,10/26(土) 17:02
kyt,京都新聞,社説：子育てと教育　問われる「次世代への投資」,10/26(土) 16:02
kyt,京都新聞,トランプ入り封筒を渡して116万円盗んだ疑い　「受け子」「出し子」兼務の40歳逮捕,10/26(土) 15:48
kyt,京都新聞,京都発、ニューヨーク・ストリート・ジャズを極めた男　サエキけんぞうの京都音楽グラフィティーvol.14,7/29(月) 11:43
