media_en,media_jp,title_articles,date_original
tvh,テレビ北海道,ゴム長靴がヨーロッパに　「買いたい」をつくる,11/16(土) 12:02
tvh,テレビ北海道,札幌市の認可保育園　誤嚥で男児死亡　施設運営会社が会見し謝罪,11/15(金) 17:52
tvh,テレビ北海道,パリ五輪柔道で「銀&銅」獲得　美唄出身永山選手　道から栄誉賞,11/15(金) 17:52
tvh,テレビ北海道,「雪ミク電車」札幌であすから運行　市電の利用促進が目的,11/15(金) 17:52
tvh,テレビ北海道,字幕ディスプレーで「会話」スムーズに　札幌市が試験導入へ,11/15(金) 17:52
tvh,テレビ北海道,札幌の夜はススキノだけじゃない！海外客も注目するものとは？,11/14(木) 18:32
tvh,テレビ北海道,映像など最新技術の展示会　TVhのシステム　準グランプリ受賞,11/14(木) 17:42
tvh,テレビ北海道,道産ワインの認知度アップ目指し　海外有名ソムリエを招き商談会,11/14(木) 17:32
tvh,テレビ北海道,財布にも厳しい冬？　灯油価格　官民が意見交換,11/14(木) 17:32
tvh,テレビ北海道,新たな輸出ビジネス発掘へ　食品輸出拡大を目指すコンテスト,11/14(木) 17:32
tvh,テレビ北海道,令和の麻雀ブーム　どこまで盛り上がる？,11/14(木) 14:52
tvh,テレビ北海道,3年連続人口減少…札幌市の少子化対策修正へ有識者会議,11/13(水) 17:52
tvh,テレビ北海道,定期便での観測は世界初！HACの旅客機で赤潮観測へ,11/13(水) 17:52
tvh,テレビ北海道,ワイン用ブドウの栽培技術向上で世界と競争へ！ポイントは「台木」,11/13(水) 17:52
tvh,テレビ北海道,元ファイターズガールも街頭啓発　きょうから冬の交通安全運動,11/13(水) 17:42
tvh,テレビ北海道,高校生が子どもたちに教えるレスリング教室　有望株も登場,11/13(水) 10:02
tvh,テレビ北海道,高校生たちが羊まんを開発〜遠別農業高校,11/13(水) 9:52
tvh,テレビ北海道,オホーツク海の特大サケを絶品蔵元の酒粕漬けに,11/13(水) 9:32
tvh,テレビ北海道,移住の決め手は高校生のガイド？,11/13(水) 9:22
tvh,テレビ北海道,約4万4000羽を殺処分　旭川の養鶏場で鳥インフル,11/12(火) 17:42
tvh,テレビ北海道,郵便局の昼の窓口業務休止　今月18日から,11/12(火) 17:42
tvh,テレビ北海道,道産の魅力たっぷり　チカホで「きのこフェスティバル」,11/12(火) 17:42
tvh,テレビ北海道,PAでタイヤの脱輪防止啓発,11/12(火) 17:42
tvh,テレビ北海道,電力は風力・太陽光　石狩に再エネのみ使用のデータセンター,11/12(火) 17:32
tvh,テレビ北海道,事件発生時の対処法は？　路線バスでの殺傷事件想定し訓練,11/11(月) 17:42
tvh,テレビ北海道,衆院選を受け招集　特別国会　道内選出議員も登院,11/11(月) 17:42
tvh,テレビ北海道,「JRなくバス減便相次ぐ」地下鉄東豊線　清田区への延伸要望,11/11(月) 17:42
tvh,テレビ北海道,札幌市と陸上自衛隊　「さっぽろ雪まつり」に向け協定,11/11(月) 17:42
tvh,テレビ北海道,建て替えに…東京で販売　札幌マンション新時代,11/9(土) 12:02
tvh,テレビ北海道,「新たな強み」をアピール　次世代の農業や食品産業を考える,11/8(金) 17:32
tvh,テレビ北海道,ブラックアウト想定し復旧訓練　北電と通信事業者が連携,11/8(金) 17:32
tvh,テレビ北海道,広がるフードバンク　官庁で集められた食品1200点を寄贈,11/8(金) 17:22
tvh,テレビ北海道,障害年金受給に向けて電話相談「ぜひ受給のきっかけに」,11/8(金) 17:22
tvh,テレビ北海道,入場券販売は苦戦…大阪・吉村府知事が道庁で万博PR,11/7(木) 17:52
tvh,テレビ北海道,最新技術が集結！「ビジネスEXPO」開幕　半導体産業などに注目集まる,11/7(木) 17:52
tvh,テレビ北海道,札幌では今季初積雪…さらに今後の雪の見通しは！？,11/7(木) 17:52
tvh,テレビ北海道,今年度から有識者の分析も　全国学力・学習状況調査の結果公表,11/6(水) 17:52
tvh,テレビ北海道,外国人観光客が急増　交通事故想定　救護訓練にタブレットを活用,11/6(水) 17:52
tvh,テレビ北海道,ポールを使って健康に！　札幌でノルディックウォーキング体験,11/6(水) 17:52
tvh,テレビ北海道,道内冷え込み　各地で今シーズン最低気温　札幌では冬支度も,11/6(水) 17:52
tvh,テレビ北海道,上空に寒気　各地で最高気温１桁どまり,11/5(火) 17:22
tvh,テレビ北海道,道内私立学校「いじめによる重大事態」２件公表,11/5(火) 17:22
tvh,テレビ北海道,「福祉灯油」の拡大を 道生協連が道に要請,11/5(火) 17:22
tvh,テレビ北海道,ススキノ殺人事件　母親公判　娘は過去の切断事件を検索か,11/5(火) 17:22
tvh,テレビ北海道,道産サツマイモ 消費拡大を　札幌でイベント,11/4(月) 17:12
tvh,テレビ北海道,ボールパーク新駅着工　北広島の予定地で安全祈願式,11/4(月) 17:12
tvh,テレビ北海道,「勝つ」ための経営　コンサドーレ将来戦略,11/2(土) 12:02
tvh,テレビ北海道,主力選手の練習が間近に　ファイターズ秋季キャンプ　エスコンFで始まる,11/1(金) 17:52
tvh,テレビ北海道,道内発行枚数1500万枚減少　年賀はがき販売始まる,11/1(金) 17:52
tvh,テレビ北海道,最先端の通信技術「IOWN」とは　デモンストレーションで鈴木知事も体感,11/1(金) 17:52
tvh,テレビ北海道,江別の大学生集団暴行死　容疑者「被害者のカードで現金引き出した」,11/1(金) 17:52
tvh,テレビ北海道,「さらなる値上げを見越しているなら論外」北海道消費者協会などがJR北海道に経営努力求め意見書,10/31(木) 17:42
tvh,テレビ北海道,衆院選・小選挙区当選者に証書付与　立憲7人が出席,10/31(木) 17:42
tvh,テレビ北海道,泊原発の事故を想定…防災訓練に周辺住民約7000人が参加,10/31(木) 17:42
tvh,テレビ北海道,江別大学生暴行事件　少年ら2人を新たに逮捕　傷害致死の疑い,10/30(水) 17:42
tvh,テレビ北海道,道が事務手続きミス　国に交付金を返還　総額16億円超,10/30(水) 17:42
tvh,テレビ北海道,AI利用した「見える化」で省エネを　コープさっぽろ系・トドック電力,10/30(水) 17:42
tvh,テレビ北海道,風評被害の影響は？　蘭越町長　知事に「らんこし米」PR,10/30(水) 17:42
tvh,テレビ北海道,ドライバー2024年問題　外国人の採用に注目高まる,10/29(火) 18:52
tvh,テレビ北海道,千歳アウトレットモール・レラ　大規模商業施設営業終了を届け出,10/29(火) 18:52
tvh,テレビ北海道,江差高看パワハラ自殺裁判　初弁論で母親が無念の訴え,10/29(火) 18:42
tvh,テレビ北海道,江別・大学生死亡事件　少年含む男女4人を逮捕,10/29(火) 18:42
tvh,テレビ北海道,鈴木徹・特別編集委員兼解説委員に聞く　衆院選後の政局はどうなる？,10/28(月) 17:32
tvh,テレビ北海道,衆議院議員総選挙　道内も自公が過半数を割り込む,10/28(月) 17:32
tvh,テレビ北海道,札幌・中島公園　紅葉をライトアップで彩る　初めてのイベント開催中,10/28(月) 17:32
tvh,テレビ北海道,北海道は後継者不在率ワースト４　事業承継の現状は,10/26(土) 12:02
tvh,テレビ北海道,プロ野球ドラフト会議　道内10選手指名に沸く　新庄監督続投表明,10/25(金) 17:32
tvh,テレビ北海道,北海道教育委員会　道立高校で「いじめ重大事態」報告書公表,10/25(金) 17:32
tvh,テレビ北海道,人気イベント！さっぽろ焼き芋テラス2024開幕,10/25(金) 17:32
tvh,テレビ北海道,金製品がずらり　札幌三越「大黄金展」始まる,10/25(金) 17:22
tvh,テレビ北海道,千歳のラピダス工場を武藤経産大臣が視察,10/24(木) 18:12
tvh,テレビ北海道,去年の雪辱晴らす！秋の全道高校野球大会で東海大札幌が10年ぶりの優勝,10/24(木) 18:12
tvh,テレビ北海道,30年ぶりの大改修へ　大通公園再整備に向け札幌市が素案,10/24(木) 18:12
tvh,テレビ北海道,震度6の地震を想定　札幌の地下街で大規模な消防訓練,10/23(水) 17:52
tvh,テレビ北海道,道内 24日にかけ暴風に警戒を　低気圧が発達しながら北上する見込み,10/23(水) 17:42
tvh,テレビ北海道,最新技術で農業を効率的に　北広島に実験施設,10/23(水) 17:42
tvh,テレビ北海道,道内3市の隊員が参加　大規模災害を想定した救助訓練,10/22(火) 17:32
tvh,テレビ北海道,北海道　省エネなどに取り組む企業を表彰,10/22(火) 17:22
tvh,テレビ北海道,札幌が全国４都市目　海外企業誘致のための窓口開設,10/22(火) 17:22
tvh,テレビ北海道,衆院選　選挙戦折り返し　立憲民主党野田代表　道内入り,10/21(月) 18:02
tvh,テレビ北海道,衆院選　期日前投票　「中間状況はやや減少」道選管発表,10/21(月) 18:02
tvh,テレビ北海道,札幌の事実婚男女　選択的夫婦別姓求める裁判　初弁論,10/21(月) 18:02
tvh,テレビ北海道,厚真町の養鶏場　鳥インフルエンザ　防疫措置が完了,10/21(月) 18:02
tvh,テレビ北海道,全国サンマの水揚げ　6年ぶり１万トン超　先月末時点,10/21(月) 18:02
tvh,テレビ北海道,気球で成層圏へ　宇宙に挑む北海道企業,10/19(土) 12:02
tvh,テレビ北海道,27日の投開票を前に　衆院選の選挙公報を印刷発送,10/18(金) 17:42
tvh,テレビ北海道,衆院選投開票まで9日　各党トップが来道　支持拡大訴え,10/18(金) 17:42
tvh,テレビ北海道,大樹町のスペースコタン　世界の宇宙港と国際協力,10/18(金) 17:32
tvh,テレビ北海道,心身ともに豊かに生きる「ウェルネス」テーマのイベント開幕,10/18(金) 17:32
tvh,テレビ北海道,道南・北斗のワイナリー　ワイン用ブドウの収穫本格化,10/17(木) 17:52
tvh,テレビ北海道,今シーズン国内初確認　厚真町で鳥インフル　殺処分はじまる,10/17(木) 17:52
tvh,テレビ北海道,道内初開催「新米発表会」　北海道米の魅力″あの人″がPR,10/17(木) 17:52
tvh,テレビ北海道,経営能力が基準の新トップリーグ　2年後スタート「Bプレミア」参入決定,10/17(木) 17:42
tvh,テレビ北海道,北海道・厚真町の養鶏場で鳥インフルエンザか,10/17(木) 4:02
tvh,テレビ北海道,衆院選の期日前投票　道内全市町村で始まる,10/16(水) 17:52
tvh,テレビ北海道,自販機にドローンも　「ミク」が広げる北海道,10/16(水) 17:52
tvh,テレビ北海道,道内就職希望の学生採用へ　中小企業などが合同説明会,10/16(水) 17:52
tvh,テレビ北海道,原作の世界を体験　「東京卍リベンジャーズ」の展覧会,10/16(水) 17:52
tvh,テレビ北海道,衆院選あす公示　道内は58人が立候補予定,10/14(月) 17:42
tvh,テレビ北海道,パリ五輪やり投げ金・北口選手　地元・旭川で凱旋パレード,10/14(月) 17:32
tvh,テレビ北海道,手稲区まで地下鉄が!?　第２青函トンネル？,10/12(土) 12:02
tvh,テレビ北海道,かわいらしい人形で菓子作りを紹介…その人形も菓子原料から！？,10/11(金) 18:22
tvh,テレビ北海道,知床観光船事故の運航会社社長が保釈,10/11(金) 18:22
tvh,テレビ北海道,障害ある生徒に不適切言動の教諭に減給10分の1（2カ月）の懲戒処分,10/11(金) 18:22
tvh,テレビ北海道,「本物には迫力がある」　道立近代美術館で開催「皇居三の丸尚蔵館展」が来場者2万人達成,10/11(金) 18:22
tvh,テレビ北海道,白い恋人パーク内に「サッポロマンガテーマパーク」あすオープン,10/11(金) 18:22
tvh,テレビ北海道,「困難な状況を肌で感じた」沿線自治体らが掘削止まる羊蹄トンネル視察,10/11(金) 18:22
tvh,テレビ北海道,道内秋サケ漁獲数　去年比2割減　9月末時点,10/10(木) 18:12
tvh,テレビ北海道,パリ五輪やり投げ金メダル　北口選手に道が栄誉賞,10/10(木) 18:12
tvh,テレビ北海道,宇宙ビジネスの可能性を議論　帯広で「北海道宇宙サミット」,10/10(木) 18:02
tvh,テレビ北海道,アスファルト製造に廃食油使いCO2削減へ　小樽で取り組み,10/10(木) 18:02
tvh,テレビ北海道,日本酒をダムで熟成　風味豊かに　上川大雪酒造と北電がタッグ,10/9(水) 17:52
tvh,テレビ北海道,知床観光船事故　桂田社長を起訴　釧路地検,10/9(水) 17:52
tvh,テレビ北海道,パリ五輪やり投げ金メダル北口選手　五輪後初めて北海道に,10/9(水) 17:52
tvh,テレビ北海道,秋の中島公園楽しんで　紅葉ライトアップ初開催へ,10/9(水) 17:52
tvh,テレビ北海道,衆議院解散「戦後最短」の衆院選へ　今月27日に投開票,10/9(水) 17:52
tvh,テレビ北海道,【速報】レバンガがエスコンフィールドで公式戦　12月に,10/9(水) 14:22
tvh,テレビ北海道,小３男児に性的いじめ　札幌市教委が報告書　学校側の対応「ずさん」,10/8(火) 17:52
tvh,テレビ北海道,母親殺害の疑いで15歳少年逮捕　札幌　「ひもで首を絞めた」,10/8(火) 17:52
tvh,テレビ北海道,キングムー跡地のホテル　2026年開業　プレミアムルームも,10/8(火) 17:42
tvh,テレビ北海道,パリ五輪金メダル・北口選手　クライマックスシリーズ初戦で始球式に,10/8(火) 17:42
tvh,テレビ北海道,共産党が道5区に候補者擁立へ　与野党一騎打ちの構図崩れる,10/8(火) 17:42
tvh,テレビ北海道,知床観光船事故で釧路地検が桂田社長を起訴へ,10/7(月) 17:52
tvh,テレビ北海道,「小選挙区で全力を尽くすしかない」自民党裏金問題対応が道内にも影響,10/7(月) 17:52
tvh,テレビ北海道,「とりあえずやってみるのが大事」障害がある子どもも普通高校進学を訴え　市民団体が旭川で全国集会,10/7(月) 17:52
tvh,テレビ北海道,札幌市が導入目指す新交通システム「連接バス」がテスト走行,10/7(月) 17:52
tvh,テレビ北海道,スタートアップ企業　成長の裏に「昭和レトロ」？,10/5(土) 12:02
tvh,テレビ北海道,小樽で大学院生が犠牲　飲酒運転根絶へ関係機関が緊急会議,10/4(金) 17:42
tvh,テレビ北海道,小豆の消費拡大目指せ　札幌の百貨店で「あんこ博覧会」,10/4(金) 17:32
tvh,テレビ北海道,ラピダスに富士通が出資検討,10/4(金) 17:32
tvh,テレビ北海道,27日投開票の見通し　衆院選の投票用紙　印刷作業進む,10/4(金) 17:32
tvh,テレビ北海道,値上げ、販売枚数の減少…　来年の年賀はがき　札幌に到着,10/3(木) 17:42
tvh,テレビ北海道,衛星搭載型ロケット開発を加速　インターステラ社　帯広支社開設,10/3(木) 17:32
tvh,テレビ北海道,半導体競争力のカギとして注目「後工程」　ラピダスがセイコーエプソン内に研究拠点,10/3(木) 17:32
tvh,テレビ北海道,出張授業にサラブレッドも登場　石狩の小学校で馬と親しむ,10/3(木) 17:32
tvh,テレビ北海道,北広島市が宿泊税導入へ　2026年4月から予定,10/2(水) 17:42
tvh,テレビ北海道,GX関連で外国企業に対応　札幌市が英語相談窓口開設,10/2(水) 17:42
tvh,テレビ北海道,クリスマスケーキ商戦スタート　札幌の百貨店でお披露目会,10/2(水) 17:42
tvh,テレビ北海道,移植医療の現状をパネルなどで紹介 　札幌・チカホでイベント,10/2(水) 17:42
tvh,テレビ北海道,すすきの殺人事件　瑠奈被告の肉声を公開,10/1(火) 17:52
tvh,テレビ北海道,紅葉の季節到来　定山渓・豊平峡の見ごろは？,10/1(火) 17:52
tvh,テレビ北海道,地域課題解決へ　ドローンや最新デジタル技術が集結,10/1(火) 17:52
tvh,テレビ北海道,北海道イエロースターズ　親会社変更　SVリーグ参入は？,10/1(火) 17:52
tvh,テレビ北海道,買い物客「寂しい」 北海道内「西友」約50年の歴史に幕,9/30(月) 17:42
tvh,テレビ北海道,「飲酒運転は凶悪犯罪」　交通事故死ゼロ目指す催し,9/30(月) 17:42
tvh,テレビ北海道,議員辞職の堀井元議員後任　自民党道9区支部長候補に松下氏,9/30(月) 17:42
tvh,テレビ北海道,書店の新業態として定着するか 定山渓のホテル内に書店オープン,9/30(月) 17:42
tvh,テレビ北海道,さっぽろオータムフェスト　過去最高の人出,9/30(月) 17:02
tvh,テレビ北海道,函館「ラッキーピエロ」石狩「ロープウエー」　けいナビ総集編,9/28(土) 12:02
tvh,テレビ北海道,自民新総裁に石破茂氏　道民の反応は,9/27(金) 18:02
tvh,テレビ北海道,札幌地裁で初弁論　市立中いじめ不登校　札幌市は争う姿勢,9/27(金) 18:02
tvh,テレビ北海道,バレーボールの楽しさ伝授　イエロースターズ選手が小学校訪問,9/27(金) 18:02
tvh,テレビ北海道,パリパラリンピックで金　車いすラグビー池崎選手　岩見沢に凱旋,9/27(金) 18:02
tvh,テレビ北海道,業務上過失致死などの疑い　知床観光船事故　船長を書類送検,9/26(木) 17:42
tvh,テレビ北海道,再開発の工事現場に彩り　JR札幌駅南口近くに巨大壁画,9/26(木) 17:42
tvh,テレビ北海道,生徒は「震災後」生まれ　震災と福島の現状伝える出前授業,9/26(木) 17:42
tvh,テレビ北海道,8期連続黒字レバンガ　売上高・入場者数が過去最高,9/26(木) 17:42
tvh,テレビ北海道,函館にもコンテナ船定期便就航へ　十勝・釧路に続き,9/25(水) 17:42
tvh,テレビ北海道,不要な服をクーポンに交換できる催し　札幌の百貨店　29日まで,9/25(水) 17:42
tvh,テレビ北海道,札幌市円山動物園　基金活用し動物用のICU購入,9/25(水) 17:42
tvh,テレビ北海道,海外15ヵ国のバイヤー　商談会で道産食品を売り込め,9/25(水) 17:42
tvh,テレビ北海道,女性参加者が急増「とんぐうさん」北海道最大級の神輿渡御,9/24(火) 20:22
tvh,テレビ北海道,道内各地で冷え込み強まる　11月上旬並みのところも　紅葉はどうなる？,9/24(火) 17:32
tvh,テレビ北海道,フードドライブ食料配布を前に　生活支援の会社に液体まかれる,9/24(火) 17:32
tvh,テレビ北海道,来年の「おせち」　おつまみ風がトレンド　百貨店でお披露目会,9/24(火) 17:32
tvh,テレビ北海道,箱根駅伝優勝7回のノウハウを　青山学院大学 原監督が経営者セミナーで講演,9/24(火) 17:32
tvh,テレビ北海道,ペットと一緒の避難考える,9/23(月) 17:52
tvh,テレビ北海道,札幌の幼稚園が合同で説明会　人材確保目指し,9/23(月) 17:42
tvh,テレビ北海道,２ナノ半導体量産へ　ラピダス着工１年,9/21(土) 12:02
tvh,テレビ北海道,白糠町の天然ブリ　鮮度保持でブランド力向上へ,9/20(金) 17:42
tvh,テレビ北海道,ラーメンのスナック菓子を開発　発売開始　北海道コンフェクトグループ,9/20(金) 17:42
tvh,テレビ北海道,食品ロスを「ありがとう」に　札幌で市民が持ち寄る「フードドライブ」,9/20(金) 17:42
tvh,テレビ北海道,北海道初公開の国宝も　「皇居三の丸尚蔵館展　皇室の至宝」　あすから,9/20(金) 17:42
tvh,テレビ北海道,児童らが交通安全呼びかけ　あすから「全国交通安全運動」,9/20(金) 17:42
tvh,テレビ北海道,捨てられるはずの熱を再利用！「リサイクルエネルギー」でCO2削減へ…一足早く導入した帯広の病院を徹底取材！,9/19(木) 20:12
tvh,テレビ北海道,人手不足解消なるか　シニア世代対象　職業体験イベント,9/19(木) 17:42
tvh,テレビ北海道,貨物列車脱線事故から11年　JR北海道　再発防止誓う研修,9/19(木) 17:42
tvh,テレビ北海道,第1管区海上保安本部　知床観光船事故　運航会社社長を送検,9/19(木) 17:42
tvh,テレビ北海道,渡辺総務副大臣　TVｈが開発　遠隔監視システム視察,9/19(木) 17:32
tvh,テレビ北海道,認知症は早めにチェック　治療の選択肢増える,9/19(木) 11:42
tvh,テレビ北海道,道立江差高看　自殺した学生の遺族　道に損害賠償求め提訴,9/18(水) 18:02
tvh,テレビ北海道,札幌のイトーヨーカドー撤退地区　北海市場がネット宅配開始,9/18(水) 18:02
tvh,テレビ北海道,知床観光船沈没事故　桂田社長を逮捕 　業務上過失致死などの疑い,9/18(水) 18:02
tvh,テレビ北海道,「あなたの通帳が犯罪に…」警察官名乗る詐欺　約1500万円だまし取られる,9/17(火) 17:52
tvh,テレビ北海道,道内100歳以上　過去最多4800人　最高齢は112歳女性,9/17(火) 17:52
tvh,テレビ北海道,「江戸老舗めぐり」初日からにぎわう　丸井今井札幌本店で開幕,9/17(火) 17:52
tvh,テレビ北海道,中島公園周辺が大きく伸びる　道内地価調査　全体も4年連続で上昇,9/17(火) 17:52
tvh,テレビ北海道,地元企業に就職して　札幌で高校生向け職業体験イベント,9/17(火) 17:52
tvh,テレビ北海道,立憲民主代表選４候補　政権奪取へ決意　札幌で街頭演説,9/16(月) 17:32
tvh,テレビ北海道,江差高看で男子学生自殺　遺族が損害賠償求め道を提訴へ,9/16(月) 17:32
tvh,テレビ北海道,道央道で空港連絡バスが炎上　けが人なし,9/14(土) 22:32
tvh,テレビ北海道,「焼とうきび」だけじゃない！　ＹＯＳＨＩＭＩ急拡大,9/14(土) 12:02
tvh,テレビ北海道,北海道経済の今後を議論,9/13(金) 17:52
tvh,テレビ北海道,黄金のブラックジャックが出迎え　金製品が1000点以上「大黄金展」始まる,9/13(金) 17:52
tvh,テレビ北海道,JR貨物　きょうも一部にダイヤ乱れ,9/13(金) 17:52
tvh,テレビ北海道,自殺との因果関係認める　旭川いじめ問題　再調査委の報告書を公表,9/13(金) 17:52
tvh,テレビ北海道,「地元の応援が力に」パリ五輪銅　東野選手が岩見沢に凱旋,9/13(金) 17:52
tvh,テレビ北海道,北海道産コンブ　水揚げ量減少に悲鳴,9/12(木) 18:12
tvh,テレビ北海道,居酒屋「炎」の運営会社が札証アンビシャスに10月上場,9/12(木) 17:52
tvh,テレビ北海道,新千歳空港での航空機事故を想定した消火救難訓練,9/12(木) 17:42
tvh,テレビ北海道,西友から何に変わる！？イオン北海道が買収の９店詳細発表,9/12(木) 17:42
tvh,テレビ北海道,400個のリンゴが盗まれたリンゴ並木で盗難防止パトロール,9/12(木) 17:42
tvh,テレビ北海道,自民党総裁選に過去最多9人立候補　道民の声は…！？,9/12(木) 17:42
tvh,テレビ北海道,最大震度7を想定　帯広で防災訓練　約4000人が参加,9/11(水) 17:22
tvh,テレビ北海道,車道を自動走行　石狩で無人配送ロボの実証実験,9/11(水) 17:22
tvh,テレビ北海道,道内外のラーメン店が出店　ココノススキノに「食のエリア」,9/11(水) 17:22
tvh,テレビ北海道,住宅ローン変動金利　17年ぶり引き上げ　北洋銀行,9/11(水) 17:12
tvh,テレビ北海道,旭川いじめ報告書　13日にも「公表版」発表,9/11(水) 17:12
tvh,テレビ北海道,新千歳空港でピーチ機が誘導路に誤侵入　けが人なし,9/10(火) 17:32
tvh,テレビ北海道,災害現場にウクライナでも活躍！移動式粉砕機などの展示会,9/10(火) 17:32
tvh,テレビ北海道,道内の郵便配達員が熱戦！「安全運転コンテスト」開幕,9/10(火) 17:32
tvh,テレビ北海道,ヒグマ対策費などに補正予算案３５９億円　定例道議会開会,9/10(火) 17:22
tvh,テレビ北海道,まるで絵画…札幌・豊平公園で推し花とレカンフラワーの展示会,9/10(火) 17:22
tvh,テレビ北海道,苫小牧で開催　脱炭素の取り組み議論　GXフォーラム,9/9(月) 17:22
tvh,テレビ北海道,札幌市職員　職務中に株取引で懲戒処分,9/9(月) 17:22
tvh,テレビ北海道,上限年間4万円に　札幌市　敬老パス見直し案を市議会提出へ,9/9(月) 17:22
tvh,テレビ北海道,「道警ヤジ排除訴訟」　原告らが道警などに謝罪・検証を要請,9/9(月) 17:22
tvh,テレビ北海道,鳥獣被害防げ！　課題解決をビジネスに,9/7(土) 12:02
tvh,テレビ北海道,道議会超党派が制定目指す　カスハラ防止条例案まとまる,9/6(金) 17:22
tvh,テレビ北海道,北海道大学の研究施設　道産ワインの有料試飲始まる,9/6(金) 17:12
tvh,テレビ北海道,北海道胆振東部地震から6年　厚真町で犠牲者を追悼,9/6(金) 17:12
