media_en,media_jp,title_articles,date_original
dancyu,dancyu,目が覚める甘い朝食“焼きトックのきなこがけ”のつくり方,11/17(日) 11:00
dancyu,dancyu,肌寒い日にはコレ！“ささみとズッキーニのトックスープ”のつくり方,11/16(土) 11:00
dancyu,dancyu,香ばしさに食欲が湧き出る“黒酢おろしのからみもち”のつくり方,11/15(金) 11:00
dancyu,dancyu,冷蔵庫に残ってしまいがちな“海苔の佃煮”の活用レシピ！簡単でおいしい“海苔の炊き込みご飯”のつくり方,11/15(金) 11:00
dancyu,dancyu,樋口真嗣監督の“ゲンバメシ”15｜沈黙の11ヶ月,11/14(木) 11:00
dancyu,dancyu,だし汁いらずの簡単調理！“あさりとトマトのもちスープ”のつくり方,11/14(木) 11:00
dancyu,dancyu,新しい美味しさに出会える“長いものクミンロースト”のつくり方,11/13(水) 11:00
dancyu,dancyu,出汁とスパイスを堪能する空港カレーうどん｜松尾貴史のカレードスコープ,11/13(水) 11:00
dancyu,dancyu,肌寒い日にぴったりの“長いもと油揚げのいりこ煮”のつくり方,11/12(火) 11:00
dancyu,dancyu,おいしい映画鑑賞『2人のローマ教皇』,11/11(月) 11:00
dancyu,dancyu,卵のコクとだしの旨味をプラス！“とろろご飯”のつくり方,11/11(月) 11:00
