media_en,media_jp,title_articles,date_original
tokushimav,徳島新聞,B3徳島ガンバロウズ、組織的守備で失点防げるか　11月９・10日第7節、アウェーで立川戦,11/11(月) 13:17
tokushimav,徳島新聞,コーナン川内店（徳島市）11月13日オープン　チャーリー、デコールの跡地,11/11(月) 12:02
tokushimav,徳島新聞,徳島県内で山の事故相次ぐ　遭難・滑落…15件　県警、登山計画の提出など注意喚起,11/11(月) 12:02
tokushimav,徳島新聞,紫のヘタから「手足」がニョキッ！！徳島県つるぎ町で四つまたナスできる,11/10(日) 12:02
tokushimav,徳島新聞,遺失届の申請がパソコン・携帯で可能に、徳島県警がオンライン化,11/10(日) 12:00
tokushimav,徳島新聞,四国36万戸で一時停電　潮流急増で本州と四国の需給バランスに影響　四国電力送配電が見解,11/10(日) 0:39
tokushimav,徳島新聞,四国４県で大規模停電、徳島県は最大で11万超,11/9(土) 21:09
tokushimav,徳島新聞,B3徳島ガンバロウズ、組織的守備で失点防げるか　11月９・10日第7節、アウェーで立川戦,11/9(土) 12:02
tokushimav,徳島新聞,料理に、お風呂に、欧州でも…香り高い木頭ゆず、徳島県那賀町で収穫始まる,11/9(土) 12:02
tokushimav,徳島新聞,徳島県海陽町の美しい海をイメージした「千年サンゴプリン」創業100年の地元洋菓子店が販売,11/8(金) 12:02
tokushimav,徳島新聞,徳島の世界大会優勝パティシエ柴田勇作さん監修Xマスケーキをセブンが数量限定販売,11/8(金) 12:02
tokushimav,徳島新聞,11月7日は「たらいうどん」の日！！徳島県内５店で10日まで地元産小麦使った麺提供するフェア,11/7(木) 12:02
tokushimav,徳島新聞,漂着ごみ、おしゃれなサーフボードに再生　徳島のサーファー「再利用」発信へ２年がかり,11/7(木) 12:02
tokushimav,徳島新聞,乳がん手術後の乳房再建、徳島県内わずか4％　喪失感など軽減も、保険適用知らず？,11/6(水) 12:07
tokushimav,徳島新聞,猫専門の美容サロンとホテルが徳島市内にオープンにゃ　有資格者がカットやシャンプー「けが・皮膚病防止効果も」,11/6(水) 12:02
tokushimav,徳島新聞,カワサキ正規店、徳島市に25年オープン　県内初、大型オートバイ新車が購入可能に,11/5(火) 12:05
tokushimav,徳島新聞,徳島第2のドンキ、小松島ルピア店11月19日オープン　ご当地キャラ「こまポン」とドンペンのコラボ限定Tシャツ販売,11/5(火) 12:05
