media_en,media_jp,title_articles,date_original
tvh,テレビ北海道,延べ300店舗が出店　さっぽろオータムフェスト開幕,9/6(金) 17:12
tvh,テレビ北海道,ファンやプレーヤー期待　eスポーツ世界大会　札幌で開催へ,9/5(木) 17:22
tvh,テレビ北海道,通販大手ベルーナ　小樽・札幌で新たなホテル開業へ,9/5(木) 17:22
tvh,テレビ北海道,道内で動き広がる　発達障害の子ども支援にデジタル活用,9/5(木) 17:22
tvh,テレビ北海道,前年より36％増　昨年の道内宿泊者　過去最多3900万人,9/5(木) 17:22
tvh,テレビ北海道,「世界洋上風力サミット」道内初開催　2日間で約1300人,9/4(水) 17:22
tvh,テレビ北海道,3000人分の炊き出しも　北広島市　新施設使い初の防災訓練,9/4(水) 17:22
tvh,テレビ北海道,JR赤字8区間 50億円収支改善目指す　JR北海道　 2026年度末までに,9/4(水) 17:22
tvh,テレビ北海道,土砂流入のJR石勝線　4日ぶり運転再開,9/4(水) 17:22
tvh,テレビ北海道,４分の３がJR北海道の運賃値上げに反対意見！運輸審議会,9/3(火) 17:42
tvh,テレビ北海道,道内コメ不足いつまで？新米は生育順調も値上げへ,9/3(火) 17:42
tvh,テレビ北海道,過去10年で最高値！秋サケ初競りでキロ当たり８万８，８８８円！,9/3(火) 17:32
tvh,テレビ北海道,パリ・パラリンピックで車いすラグビーが悲願の金メダル,9/3(火) 17:32
tvh,テレビ北海道,旭川・女子中学生凍死　再調査委が最終報告書を提出 「いじめ対策の道標に」,9/2(月) 17:32
tvh,テレビ北海道,お母さんにぴったり　おたる水族館　バンドウイルカの赤ちゃん一般公開,9/2(月) 17:32
tvh,テレビ北海道,ワイナリーやブドウ農園を開放　ワインを堪能「余市ラフェト」にぎわう,9/2(月) 17:32
tvh,テレビ北海道,高速バスは混雑　ＪＲ石勝線運休　あさって再開目指し復旧作業,9/2(月) 17:32
tvh,テレビ北海道,北海道が国に７億３０００万円返還…手続きミスで交付金対象にならず…　さらに拡大も？,9/2(月) 16:22
tvh,テレビ北海道,ＧＸ投資を呼び込め　北海道の可能性は,8/31(土) 12:02
tvh,テレビ北海道,全国で７校！北海道内では唯一！「工芸高校」の支援をOBが呼び掛け,8/30(金) 17:52
tvh,テレビ北海道,コンブ生産量減少…水揚げの安定に向けて北海道が対策会議,8/30(金) 17:52
tvh,テレビ北海道,声掛けや気配りを審査　介護技術を競うコンテスト,8/30(金) 17:52
tvh,テレビ北海道,政府の補助金ありながら…道内電気・ガスとも料金10月検針分は値上げ,8/30(金) 17:52
tvh,テレビ北海道,屈指の人気ケーキ店「きのとや」の会社がラーメンスナック,8/29(木) 19:32
tvh,テレビ北海道,若者の道外流出防げ　道内就職を応援する就活イベント,8/29(木) 17:42
tvh,テレビ北海道,胆振東部地震からもうすぐ6年　ブラックアウト想定し信号機復旧訓練,8/29(木) 17:42
tvh,テレビ北海道,パリパラリンピック開幕　道産子5選手も出場　活躍に期待,8/29(木) 17:42
tvh,テレビ北海道,アジア競馬会議　札幌で始まる,8/28(水) 17:22
tvh,テレビ北海道,堀井学衆院議員が議員辞職,8/28(水) 17:22
tvh,テレビ北海道,死後に遺産を自治体などに寄付　札幌市がセミナー,8/28(水) 17:22
tvh,テレビ北海道,千歳に食材の長期保存拠点　実証実験始まる,8/28(水) 17:12
tvh,テレビ北海道,パリ五輪金メダル北口選手　旭川で10月に凱旋パレード,8/28(水) 17:12
tvh,テレビ北海道,着工から半世紀…道道・美唄富良野線がついに全線開通,8/27(火) 17:32
tvh,テレビ北海道,JR運休も相次ぐ…道内各地で大雨　あすまで警戒を,8/27(火) 17:32
tvh,テレビ北海道,GX特区指定で企業誘致のため「税制優遇」を！,8/27(火) 17:32
tvh,テレビ北海道,半導体人材の確保へ学生に向けPR…反応は？,8/27(火) 17:32
tvh,テレビ北海道,札幌市内の小中学校で2学期始まる　これまでよりも5日長い夏休みでした,8/26(月) 17:22
tvh,テレビ北海道,今年制定「火山防災の日」有珠山のふもと洞爺湖町で学習会,8/26(月) 17:12
tvh,テレビ北海道,カネカ　苫東で先端医療機器を製造　新工場で竣工式　全工程を自動化,8/26(月) 17:12
tvh,テレビ北海道,ソファやカフェスペースも　新たなオフィスの形を提案　来月に見学会開催,8/26(月) 17:12
tvh,テレビ北海道,北海道農業　担い手不足どう解消？,8/24(土) 12:02
tvh,テレビ北海道,北方領土返還運動を次世代に　元島民2世らと高校生が交流,8/23(金) 17:22
tvh,テレビ北海道,認知症当事者を「希望大使」に任命　道民の理解を深めたい,8/23(金) 17:22
tvh,テレビ北海道,アジア初開催　人気上昇のスポーツ　函館で「モルック」世界大会が開幕,8/23(金) 17:12
tvh,テレビ北海道,原因となる虫が急増　「ナラ枯れ」拡大防止へ対策会議,8/23(金) 17:12
tvh,テレビ北海道,道が方針　ヒグマを10年間で1万3000頭捕獲,8/22(木) 17:12
tvh,テレビ北海道,小樽の魅力を再発見　築100年超の民家　オフィスや飲食店に,8/22(木) 17:12
tvh,テレビ北海道,道内企業7社が出展　札幌で体験型の企業説明会,8/22(木) 17:12
tvh,テレビ北海道,道警ヤジ排除訴訟　男性原告と道警側双方の上告棄却,8/21(水) 17:42
tvh,テレビ北海道,日本郵船が15年ぶり道内拠点　ラピダスや洋上風力関連に期待,8/21(水) 17:42
tvh,テレビ北海道,ギフト食品解体セールに長蛇の列　札幌の百貨店,8/21(水) 17:42
tvh,テレビ北海道,洋上から北方領土の先祖しのぶ　元島民ら,8/21(水) 17:42
tvh,テレビ北海道,陸自オスプレイ　道内に初飛来　抗議活動も,8/21(水) 17:32
tvh,テレビ北海道,高速道路での除雪技術競う　夕張ICで「除雪車チャンピオンシップ」,8/21(水) 17:32
tvh,テレビ北海道,中小企業の自慢の商品やサービスPR　札幌で展示・即売会,8/20(火) 17:42
tvh,テレビ北海道,パリ五輪メダリスト永山選手が美唄に凱旋　「ロス五輪では金メダルを」,8/20(火) 17:32
tvh,テレビ北海道,札幌・大通に高級ブランドホテル「パークハイアット」開業へ　2029年予定,8/20(火) 17:32
tvh,テレビ北海道,カレーでエゾシカ肉の消費拡大を　道と江崎グリコが協定,8/20(火) 17:32
tvh,テレビ北海道,コンサドーレ　7人目の補強,8/20(火) 12:02
tvh,テレビ北海道,丘珠空港に臨時駐車場　札幌市が混雑対策を強化,8/19(月) 17:42
tvh,テレビ北海道,ことしの大通ビアガーデン　来場者１．８パーセント増,8/19(月) 17:32
tvh,テレビ北海道,エスコンフィールド　来季から内野が人工芝に,8/19(月) 17:32
tvh,テレビ北海道,「バイクの日」　ライダーに事故防止呼びかけ,8/19(月) 17:32
tvh,テレビ北海道,円山動物園のアジアゾウ「タオ」が１歳に,8/19(月) 17:32
