media_en,media_jp,title_articles,date_original
kanpara,カンパラプレス,関東ブロックが激戦制し優勝！【全日本ブロック選抜車いすバスケットボール選手権大会】,11/10(日) 9:59
kanpara,カンパラプレス,北九州チャンピオンズカップ 国際車いすバスケットボール大会が開幕！,11/8(金) 19:23
kanpara,カンパラプレス,革新の車いすで世界に挑戦！大阪電気通信大、サイバスロン2024で栄光の3位,10/28(月) 9:20
kanpara,カンパラプレス,人間と機械が融合するサイボーグ世界大会「サイバスロン2024」が開幕！,10/25(金) 22:41
kanpara,カンパラプレス,パラアスリートらによるランニングワークショップで「元気力がアップ！」,10/5(土) 15:13
kanpara,カンパラプレス,【全文掲載】決勝戦前に聴いた曲は尾崎豊『僕が僕であるために』18歳小田凱人が金　車いすテニス試合後コメント・後編──パリ・パラリンピック第11日,9/8(日) 7:00
kanpara,カンパラプレス,【全文掲載】18歳小田凱人が金「俺は金メダルを取るために生まれてきた」車いすテニス決勝戦後コメント・前編──パリ・パラリンピック第11日,9/8(日) 6:33
kanpara,カンパラプレス,18歳の小田凱人が金メダル　車いすテニス男子シングルスで劇的逆転勝利【パリ・パラリンピック第11日】,9/8(日) 1:14
kanpara,カンパラプレス,上地結衣が2個目の金　絶対王者に東京大会のリベンジ！　車いすテニス女子シングルス【パリ・パラリンピック第10日】,9/6(金) 23:18
kanpara,カンパラプレス,上地結衣が2個目の金！　車いすテニス女子シングルスで絶対王者デ・フロートにリベンジ【パリ・パラリンピック第10日】,9/6(金) 22:56
kanpara,カンパラプレス,史上初の金メダル　ゴールボール男子日本が延長戦を制して偉業達成！【パリ・パラリンピック第9日】,9/6(金) 3:58
kanpara,カンパラプレス,史上初金メダル　ゴールボール男子日本が延長戦を制して偉業達成【パリ・パラリンピック第9日】,9/6(金) 3:33
kanpara,カンパラプレス,卓球女子・和田なつきが金メダル「すごく幸せ」いじめを乗り越えて世界一の涙を流す【パリ・パラリンピック第9日】,9/6(金) 2:34
kanpara,カンパラプレス,車いすテニス上地・田中ペアが金【パリ・パラリンピック第9日】,9/5(木) 23:42
kanpara,カンパラプレス,決勝進出！卓球女子・和田なつき「良いことをすれば、良いことが返ってくる」崖っぷちを跳ね返した“いつもの心がけ”【パリ・パラリンピック第9日】,9/5(木) 19:44
kanpara,カンパラプレス,銀以上確定！卓球女子・和田なつきが世界ランク1位に勝利し決勝進出【パリ・パラリンピック第9日】,9/5(木) 17:40
kanpara,カンパラプレス,マルクス・レームが男子走り幅跳び8m13でパラ4連覇【パリ・パラリンピック第8日】,9/5(木) 4:56
kanpara,カンパラプレス,パラスポーツは「できないこと」ではなく「どうやったらできるか」を教えてくれた【車いすラグビー金メダル会見全文】（4）,9/4(水) 21:12
kanpara,カンパラプレス,倉橋香衣の笑顔がガチガチに緊張した橋本勝也を救った「俺ってこんな感じで楽しんできたよな」【車いすラグビー金メダル会見全文】（3）,9/4(水) 19:08
kanpara,カンパラプレス,「池崎さんのおかげで強くなれました」橋本勝也の試合後コメント全文【車いすラグビー金メダル】,9/4(水) 9:13
kanpara,カンパラプレス,交通事故で失った3人の友が「背中を押してくれた」【車いすラグビー金メダル会見全文】（2）,9/4(水) 8:38
kanpara,カンパラプレス,帰りのバスでみんなで歌った「We Are the Champions」【車いすラグビー金メダル会見全文】（1）,9/4(水) 7:59
kanpara,カンパラプレス,卓球・和田なつきと古川佳奈美が準々決勝で勝利  銅メダル以上が確定【パリ・パラリンピック第7日】,9/4(水) 3:56
kanpara,カンパラプレス,【車いすラグビー金メダル】「スポーツ選手として最高の瞬間でした」キャプテン・池透暢の試合後コメント全文,9/3(火) 21:53
kanpara,カンパラプレス,【車いすラグビー】事故死した3人の友に捧げた金メダル「亡くなった友が背中を押してくれた」──パリ・パラリンピック第6日,9/3(火) 7:46
kanpara,カンパラプレス,日本、悲願の金！米国下し初のパラ王者に【パリ・パラリンピック第6日】,9/3(火) 7:02
kanpara,カンパラプレス,車いすラグビー日本が悲願の金メダル！　米国を制して初のパラ王者に【パリ・パラリンピック第6日】,9/3(火) 3:54
kanpara,カンパラプレス,【車いすラグビー決勝戦】金に挑戦する選手たちの言葉を紹介！現地で応援する家族たちの想い──パリ・パラリンピック第6日,9/3(火) 1:58
kanpara,カンパラプレス,ブラインドサッカー日本、痛恨のオウンゴールでモロッコに敗北　準決勝進出ならず【パリ・パラリンピック第6日】,9/2(月) 22:07
kanpara,カンパラプレス,【選手コメント全掲載】“準決勝の壁”を破壊した車いすラグビー日本　金メダルへの道「最後は神様が決める」,9/2(月) 9:31
kanpara,カンパラプレス,銀以上確定！　車いすラグビー日本、オーストラリアに劇的逆転勝利で初の決勝進出　【パリ・パラリンピック第5日】,9/1(日) 21:58
kanpara,カンパラプレス,（試合後コメント追記）ブラインドサッカー日本、予選リーグ第1試合でコロンビアに敗れる【パリ・パラリンピック第5日】,9/1(日) 19:55
kanpara,カンパラプレス,パリ・パラリンピック注目競技：ボッチャのルールと見どころを紹介,8/31(土) 23:20
kanpara,カンパラプレス,パリ・パラリンピック注目競技！ブラインドサッカーのルールと見どころを紹介,8/31(土) 22:40
kanpara,カンパラプレス,パリ・パラリンピック注目競技：車いすテニスのルールと見どころを紹介,8/31(土) 21:40
kanpara,カンパラプレス,パリ・パラリンピック注目競技：パラ陸上を徹底解説！道具とサポート　伴走者にもメダルが授与される,8/31(土) 20:40
kanpara,カンパラプレス,車いすラグビー日本の快進撃支える大応援団　手作りした日の丸旗は約1000個！【パリ・パラリンピック第3日】,8/31(土) 7:52
kanpara,カンパラプレス,佐藤友祈が陸上男子車いす400mで銀　「東京パラ王者」から再び挑戦者となって雪辱を誓う,8/31(土) 7:13
kanpara,カンパラプレス,車いすラグビー日本代表、強豪アメリカ相手に競り勝つ！【パリ・パラリンピック第3日】,8/31(土) 6:46
kanpara,カンパラプレス,陸上男子車いす400mで佐藤友祈が銀、61歳の伊藤智也が銅を獲得【パリ・パラリンピック第3日】,8/31(土) 2:43
kanpara,カンパラプレス,パリパラリンピック注目競技：車いすバスケを徹底解説！ ルールと見どころを紹介,8/30(金) 18:50
kanpara,カンパラプレス,パリパラリンピック注目競技：パラ水泳を徹底解説！ルールと見どころを紹介,8/30(金) 8:40
kanpara,カンパラプレス,パリパラリンピック注目競技：ゴールボールを解説！ルールと見どころを紹介,8/30(金) 8:30
kanpara,カンパラプレス,パリパラリンピック注目競技：車いすラグビーを徹底解説！ルールと見どころを紹介,8/30(金) 8:10
kanpara,カンパラプレス,口で弓を引くトゥクレがアーチェリでパラ新記録　上山友裕はランキングR22位、決勝Tでの巻き返し誓う【パリ・パラリンピック第2日】,8/30(金) 7:42
kanpara,カンパラプレス,車いすラグビー日本代表、パリ・パラ初戦でドイツに快勝！,8/30(金) 7:37
kanpara,カンパラプレス,パリ・パラ選手村で大人気！日本人ボランティアがデザインしたピンバッジ、メルカリで高額取引も,8/28(水) 21:35
kanpara,カンパラプレス,ボッチャ甲子園で船橋夏見特別支援学校が優勝！「前向きな言葉」で勝利つかむ,8/11(日) 10:26
kanpara,カンパラプレス,"パリ・パラリンピック日本代表、結団式で熱い決意表明 ""自分史上最強""への挑戦",7/16(火) 19:40
kanpara,カンパラプレス,五輪出場拒否を乗り越え、日本製義足で完全復活目指す鬼才のランナーと日本人エンジニアの夢【神戸世界パラ陸上】,5/26(日) 16:22
kanpara,カンパラプレス,大島健吾が銀メダル！自力でのパリ内定掴む 男子200m【世界パラ陸上神戸大会】,5/26(日) 9:50
kanpara,カンパラプレス,義足で歓喜のジャンプ！ 兎澤が銀、前川が銅 女子100m【世界パラ陸上神戸大会】,5/21(火) 20:24
kanpara,カンパラプレス,男子走り幅跳び（T63）、レオンが7m22の大ジャンプで優勝。山本篤は5位【パラ陸上世界選手権】,5/20(月) 8:01
kanpara,カンパラプレス,パリパラ出場内定が決まったパラカヌー・瀬立モニカ　東京とは異なるパリへのモチベーションとは,5/17(金) 19:40
