media_en,title_articles,link_articles,date_original
minkabu,鬼の岸田政権の狂気「花粉症対策」で喜ぶ利権集団、笑う自民党、殺される国民…国民のお金をおもちゃにするな！,https://news.yahoo.co.jp/articles/a515d75048037843042ef05f77cef68be272055e,10/17(火) 17:10
minkabu,女性がためらう風俗・馬券場の錦糸町がZ世代に人気の謎…東大卒不動産評論家「値段感そのままでオシャレに大変貌」嘘だろ…,https://news.yahoo.co.jp/articles/91c1720686ddda2d6c5e0609b94e9d313f2ec581,10/17(火) 9:10
minkabu,尋常な神経ではない…増税メガネはいい加減にしろ！「岸田首相は増税していない」という意見は事実に反する…,https://news.yahoo.co.jp/articles/44c81b0ca33833d9bbc55d7a67b2a5889680712c,10/16(月) 17:10
minkabu,運用資産は約6.5億円のFIRE投資家「最強ポートフォリオ」の中身を公開…会社員からFIREへの道,https://news.yahoo.co.jp/articles/4d663f91cdabc20ca6b514bcc00b1d77b2a13f90,10/16(月) 12:06
minkabu,税負担すでに6兆のガソリン補助金延長方針…鬼の岸田政権と財務省は誰のために仕事をしているのか「死んでも発動しないトリガー条項」,https://news.yahoo.co.jp/articles/6ced2bf4ba9231be3b5dd46d21e1ab533b50ec4d,10/16(月) 9:10
minkabu,"""増税の鬼""岸田政権の「偽減税政策」があまりにもデタラメすぎる…国民が覚えた強烈な違和感の正体",https://news.yahoo.co.jp/articles/8c8c10dcbc1fb8e9f8dc6ad23ce56c1496d69ef6,10/15(日) 17:10
minkabu,FIRE投資家が「分散投資しない理由」初心者が無視しがちな2つのルール,https://news.yahoo.co.jp/articles/b642c7b831922a7fd210f562f148476e60e082a8,10/15(日) 12:06
minkabu,故ジャニー喜多川は「哀しきモンスター」…55歳のゲイライターが考える高齢同性愛者の性欲と特殊性,https://news.yahoo.co.jp/articles/0f76d4126e582b94eede287f10d81c92064e2653,10/15(日) 9:10
minkabu,成田修造「多くの日本人は日本語ですら議論ができないので、まずは日本語を学ばなければ英語で話せるわけがない」「英語学習のために海外MBAを取得しに行くのは時間のムダ」,https://news.yahoo.co.jp/articles/3a8d233e3fc9224deba2bb3fd0fd45e8123bd2c2,10/14(土) 17:10
minkabu,たった半年でサラリーマン時代年収の10倍を稼ぎ出す。元会社員が教えるFIREへの道「大きな資産を持つ企業に投資を行うべし」,https://news.yahoo.co.jp/articles/6348659d2c12efc37db0f93d7b2d9135b0b1f504,10/14(土) 12:05
minkabu,神宮外苑再開発派の正体…無視される「緑の割合は約25％から30％に、樹木の本数は1904本から1998本に増加」という不都合な真実,https://news.yahoo.co.jp/articles/00425f7806a795da9972480eb03afe9db67dc966,10/14(土) 9:10
minkabu,登録者82万人の英語インフルエンサーが実践! たった半年で英語ペラペラになる「超効率・英語学習法」…あなたは「面白い」という英単語を何個言えるか,https://news.yahoo.co.jp/articles/e0e370e80d1361641b00c885df3a8f896de69b29,10/13(金) 17:10
minkabu,もう騙されない！選挙前の風物詩、自民党発「ガス抜き都合よすぎ提言」の衝撃中身…鬼の岸田政権は鬼のママ,https://news.yahoo.co.jp/articles/f57800884627f6c34df84e11fca5980e1c7f3efb,10/13(金) 9:10
minkabu,英単語を図解する投稿で人気のこあたん「カナダ人師匠が教えてくれた英語力が爆上がりする3ステップ」ただ留学に行くだけでは英語力が上がらない決定的な理由,https://news.yahoo.co.jp/articles/17270704038ea460f0a939924fdadd5721b9ea8e,10/12(木) 17:10
minkabu,ジャニーズが「第2会社」をつくった衝撃の理由”ファンクラブ名簿に秘密あり”…弁護士解説「事務所は法的に制裁できるのか」,https://news.yahoo.co.jp/articles/89b49ffc05c7a7a812b96028e2fc09d5c808c12c,10/12(木) 9:10
minkabu,家中で英語音声をかけるだけで子供はペラペラに…海外留学・インターいらずの「おうち英語」とは何か,https://news.yahoo.co.jp/articles/8df808680a190640c245e3e1edb6ae45d0da980b,10/11(水) 17:10
minkabu,鬼の岸田政権が見捨てる「物価高についていけない家庭」もはや貧困層を増やしたいのでは…「政府も財務省も一般国民を救う気はない」,https://news.yahoo.co.jp/articles/e381d9eb0b2f87a7ff91a302c9398eac4804fec0,10/11(水) 9:10
minkabu,アメリカでは年収2000万円でも生きていくのは難しい…資産7.5億円築いてやっと「お金持ち」になる修羅の国・アメリカで生きる学歴エリートたちの悲哀,https://news.yahoo.co.jp/articles/e5bdc622269c95ba5d8abf0d03c2ebbbcc2b52b5,10/10(火) 17:10
minkabu,60歳以上は貯金500万未満が最多の日本「金持ちおじいちゃん」もういない…「士業、大手企業社員ほど投資詐欺で騙される」,https://news.yahoo.co.jp/articles/0d96c8d2314fe6e14b7ed1ab75a9be5ffabfb996,10/10(火) 9:10
minkabu,英検準1級に落ちた中2娘を激詰めした狂気の早大卒教育パパが、娘の中学受験当日でも日課の英語プリント学習をやめさせなかったワケ,https://news.yahoo.co.jp/articles/e8e1ffbecbc032c8403ff8198cc4668ef9056ccc,10/9(月) 17:10
minkabu,鬼の岸田首相の「減税っぽいヤツ」に騙されるな「減税額＜＜＜大増税額」のウソ減税…増税メガネを流行語大賞に,https://news.yahoo.co.jp/articles/fbfd3dade96083847d58eb9a9ded655c3415f3dc,10/9(月) 9:10
minkabu,英語さえやっていれば入れる「コスパ最強大学」リスト…英語1科目で入れるのに任天堂や村田製作所、アマゾンなどに大量就職できる,https://news.yahoo.co.jp/articles/284820833cc30fd24775ab0d57c1cd6efdfbe554,10/8(日) 17:10
minkabu,サステナビリティ時代の国際基準「Bコープ」…「社会性」と「利益」の両立に”日本での浸透に難しい”の声,https://news.yahoo.co.jp/articles/9f45c87bc04a8c002320bab7a155880c3d225647,10/8(日) 9:10
minkabu,新NISAで最大に儲ける！1800万円をフルに活用したい2つの投資信託…年間配当100万円の凄腕投資家,https://news.yahoo.co.jp/articles/a2db0849ec078ef67ecd524bf5dd658eba8b2a55,10/7(土) 17:10
minkabu,フォロワー数11万人のカリスマ投資家「米国に全財産を預けるべきだ」…FIREはなぜ合理的ではないのか,https://news.yahoo.co.jp/articles/8aeeac225dd1672a445a26b84bb7e7df854627b5,10/7(土) 12:05
minkabu,大人は知らない「通知から120秒以内に1日1投稿SNS」何が楽しいんだ…大学の8割認知の新サービスの台頭と怖すぎるリスク,https://news.yahoo.co.jp/articles/0f6a02636e665be89612a97d7c7e312cf0790041,10/7(土) 9:10
minkabu,年間配当100万円が語る株の買い・売りのタイミングを見極める方法…必須の5つの指数,https://news.yahoo.co.jp/articles/7bc6ea96cfd21991565ea172618795b4aecd32b4,10/6(金) 17:10
minkabu,フォロワー数11万人のカリスマ投資家の米国株ポートフォリオ　レバレッジをかけている金融商品,https://news.yahoo.co.jp/articles/3837eb8c5c5ca46f25b21d3679e3964ee5e95266,10/6(金) 12:05
minkabu,「報道しない自由」を連打した後ろめたさを「ジャニタレ」にぶつける新聞の信頼のなさ…同罪なのに第三者委員会を設置しないズルさ,https://news.yahoo.co.jp/articles/09ea84a3e632454fb83aa3cbe7f5f59fbd7f5107,10/6(金) 9:10
minkabu,年間配当100万円の猛者投資家が辿り着いた保有ルール「ルールを変える人はすぐに負ける」,https://news.yahoo.co.jp/articles/37b8e3a007f0fe101e47b06a2e4ebb2544970ada,10/5(木) 17:10
minkabu,フォロワー数11万人のカリスマ投資家「私がたどり着いた米国株全力投資法」急激な円安の恩恵に大躍進,https://news.yahoo.co.jp/articles/353977882d4d7c392e2306075d48bc4007588a21,10/5(木) 12:05
minkabu,12月に1兆円大増税隠して”11月に解散総選挙”の姑息…鬼の岸田政権”ウソ減税”に国民は怒っている,https://news.yahoo.co.jp/articles/0711627f2dd42401316a0e515388ba62a735e245,10/5(木) 9:10
minkabu,投資3年で4割がダブルバガー！人気投資家・投資熊　私が信用するネット情報と信用しないネット情報,https://news.yahoo.co.jp/articles/fc5d456e284f65fdb0c5c007e065784449216bbb,10/4(水) 17:10
minkabu,投資に費やす時間は毎月たったの5分！”タイパの鬼”サラリーマン投資家が語る「S&P5500より全米株式なワケ」,https://news.yahoo.co.jp/articles/b0dedb73172e8ca79c5c62475f68575872623f60,10/4(水) 12:13
minkabu,「老後資金は自分で稼げ」に国民は限界だ…自民党世襲一家に生まれ「失われた30年」を衆議院議員として放置した岸田総理、いい加減にしろ,https://news.yahoo.co.jp/articles/6368a2a747fe8623a77464e45ad1054a960b04df,10/4(水) 9:10
minkabu,「手の届く投資法」投資熊が語る”株の選び方”「高すぎる配当利回りは危険！」,https://news.yahoo.co.jp/articles/809960d45dabf464e4353dcb36efeeb6ac0860fd,10/3(火) 19:37
