media_en,title_articles,link_articles,date_original
kosodate,「女子だけ体育館に集合」で根付いた苦手意識も…性行為や避妊、だけじゃない『性教育』とは,https://news.yahoo.co.jp/articles/1b628517cc7d239bcc93e624bd9b468caa6444ad,10/21(土) 11:30
kosodate,第一子出産の手島優さん、産後初の外出でおめかし「これだけでもかなりの気分転換に」,https://news.yahoo.co.jp/articles/f7e81d3dcad43e7e8d711b23b2e8bf6aaa25bd21,10/20(金) 12:12
kosodate,おばたのお兄さん、グズる息子に「POISON」よりも効果があった意外な「音」とは？ イモトアヤコさんも実践,https://news.yahoo.co.jp/articles/fdd74a5be85b20e79981c8ad2ece9e4c4c88b9f1,10/19(木) 12:12
kosodate,鈴木亜美さん、言葉が遅くイヤイヤ激しかった次男「暴れ回って怒りまくって」……2歳児健診で言われたこと,https://news.yahoo.co.jp/articles/747ed56e29ac648f70775932cdf5c62bf0190f49,10/18(水) 12:10
kosodate,北川景子さんの子どもの叱り方は「女優さんだから迫真の演技、迫力がすごい」,https://news.yahoo.co.jp/articles/ca96bfa9bdbd39b013f78ba55aaa19cd78d13fcf,10/17(火) 12:12
kosodate,第二子妊娠の滝川クリステルさん、出産予定は11月で甥っ子と1ヶ月違い「同い年の従兄弟、楽しそう」,https://news.yahoo.co.jp/articles/d8d00d5e6ddbb0e676370cf9b496150cd4d1c8da,10/16(月) 12:12
kosodate,人類の歴史上、子どもを朝から晩まで母親が見ていることはなかった――「現代の母親が人類の中で初めてやっている」／東大名誉教授・汐見稔幸先生,https://news.yahoo.co.jp/articles/845f3bb8be03cc48385158aeec8dd5695927ecf3,10/15(日) 11:30
kosodate,「恥ずかしい」という感覚、大人が教える必要はある？ お漏らしが続く子へかけるべき言葉とは……／東大名誉教授・汐見稔幸先生,https://news.yahoo.co.jp/articles/8eef111cd8c66ee1a797dacb1bf76acf44f4cb45,10/14(土) 11:34
kosodate,元乃木坂46衛藤美彩さんが第二子の妊娠を発表「症状が第一子の時とは全く違う」夫の西武・源田選手は「妻を全力サポートしていきます」出産は冬予定,https://news.yahoo.co.jp/articles/6654fdf1bd2da56d384627c41b9a98b6650dbd05,10/13(金) 12:11
kosodate,双子パパ・ハリウッドザコシショウさんの家族愛に「カッコよすぎる！」「最高のお父さん」,https://news.yahoo.co.jp/articles/bbb0306452d8c6917aec2a051645de6a61f78819,10/13(金) 12:10
kosodate,だいたひかるさん1歳息子が飛行機デビューに役立ったもの「2歳までには完全に辞めさせないと」,https://news.yahoo.co.jp/articles/0124b07b8619ffe74322877286b274af4a10167d,10/12(木) 12:12
kosodate,丸山桂里奈さん「なんで自分ばっかりこんなにと思うの」夫婦関係のギクシャク、育児めぐる葛藤に「代弁ありがとう」共感の嵐,https://news.yahoo.co.jp/articles/45ee79171ac7a55b2e7e0f074d776bf7161a4591,10/12(木) 12:12
kosodate,宮崎宣子さん、帝王切開後の体調明かす「歩くのも座るのも激痛」,https://news.yahoo.co.jp/articles/3ff1a238c7da83ad5087f245eeab71b9b061e2c2,10/11(水) 12:13
kosodate,白鳥久美子さんビッグな第二子男児を出産！ 予定日前の破水に夫・チェリーさん動揺「落ち着け、落ち着け！」,https://news.yahoo.co.jp/articles/e8c4de23312411c0b155cc1f83d17bed431f7fba,10/11(水) 12:12
kosodate,おばたのお兄さん「赤ちゃんは『痛い！』とか『しんどい！』って言えないから……」息子の肌荒れに「やはり初めてのことは心配」,https://news.yahoo.co.jp/articles/d8636aca99274bf7b56c5eb52f5fa9f2a2ec33df,10/10(火) 12:12
kosodate,藤本美貴さんは「ハンバーグ弁当」、青木裕子さんは「息子たちも夫も大好きなスパムむすび」に応援海苔デコ…運動会のお弁当公開,https://news.yahoo.co.jp/articles/39c574d4b368710c3921833bd3c2291e52835c44,10/10(火) 12:12
kosodate,「お砂糖も動画もあげない、絵本で育てる！」なんて…「不可能でしたね（笑）」ミスユニバース森理世さんの子育て,https://news.yahoo.co.jp/articles/97f8d867966716ac7a3bc7da038ff9af1d16eec9,10/9(月) 11:30
kosodate,しぼり出した10mlの母乳をこぼし「絶望」 ミスユニバース森理世さんがアメリカで経験した産後うつ,https://news.yahoo.co.jp/articles/34dcbee1db9cf68b7ee0753bea44389412a9de1e,10/9(月) 11:20
kosodate,不妊治療を経て妊娠10週で大出血、出産まで続いたつわりの吐き気。ミスユニバース森理世さんの壮絶だった出産,https://news.yahoo.co.jp/articles/ec0e1f35c62c1e158d245f1cee079a2b66df0ec1,10/8(日) 11:30
kosodate,「国際結婚でステップファミリーに。孤独を感じて涙が出ることもあった」ミスユニバース森理世さんの結婚,https://news.yahoo.co.jp/articles/c9da619b4aad98d6a172faf202730befd386ede2,10/8(日) 11:20
kosodate,即戦力だった育休パパ！ 仕事で培った家事力と先読み力「うちの男性社員はきっとみんなできるはず」,https://news.yahoo.co.jp/articles/3127a44015f1e5704bee11d04085300f1175926c,10/7(土) 11:30
kosodate,平愛梨さん、生後5ヶ月の末っ子は「まだまだ夜泣き授乳中」で睡眠不足に。妹のもてなしごはんに感謝,https://news.yahoo.co.jp/articles/64558253592208cfc5d29d8215f43360bdfe47d2,10/6(金) 12:10
kosodate,手島優さん第一子出産「予定日より20日以上早く」新井恵理那さん、宮崎宣子さんも無事に赤ちゃん誕生,https://news.yahoo.co.jp/articles/90148b4b638b16d8906148a7574f503fdf8e9eaf,10/6(金) 12:10
kosodate,相席スタート・山崎ケイさん「反町隆史様の力は偉大」ギャン泣きする娘に「POISON聞くと泣き止む説」を検証し続けた結果,https://news.yahoo.co.jp/articles/015849c17668d867b10746bbce2d5105f2aa01de,10/5(木) 12:10
kosodate,山崎夕貴アナ、生後一ヶ月の息子が“成長曲線カンスト”「すごいおっきいよねえ」「ビジュがいい」とメロメロ,https://news.yahoo.co.jp/articles/44ff0c1b26b9f8e60d1ff1661ea4747015c5ec0b,10/5(木) 12:10
kosodate,丸山桂里奈さん、2月に出産した長女がもう「哺乳瓶持ってミルク飲んでる」めざましい成長に驚き,https://news.yahoo.co.jp/articles/0664b6fdedc6a6609f4e44da2267ccbcd1114046,10/4(水) 12:11
kosodate,川田裕美さん、息子の予防接種で心がギュッとなった瞬間「お兄ちゃんになったなぁ」,https://news.yahoo.co.jp/articles/6628fd87b8193bdee269a9e6a342c13a780bce29,10/4(水) 12:11
kosodate,第二子妊娠中の白鳥久美子さん「予定帝王切開で出産」妊婦健診のたびに大きいと言われる赤ちゃんの体重は「すでに3400グラムくらい」,https://news.yahoo.co.jp/articles/f665d6184082d06d381b0def0d5cf61d9282f5ac,10/3(火) 12:10
kosodate,紺野あさ美さん「2歳4歳6歳のワンオペお風呂」壮絶なリアルを公開！,https://news.yahoo.co.jp/articles/863a682095ab48e84a40bfde01877dd764b33b4b,10/3(火) 12:10
kosodate,第一子出産の山崎夕貴アナ、念願の金髪に「大満足」仕事の復帰時期は「全然決めてない」,https://news.yahoo.co.jp/articles/0cfeded3032fc6c05f58c3718df13bcbf6842550,10/2(月) 12:12
kosodate,小倉優子さんの運動会弁当「定番の唐揚げと卵焼き、おにぎり」が不人気で…代わりに大好評だったものとは!?,https://news.yahoo.co.jp/articles/dde0d9558cd9a9cdf2fac9c77a11b2c684b8ee03,10/2(月) 12:12
kosodate,保育園お迎え時に潜む子どもの交通事故 実際にあった「ヒヤリ・ハット」の状況とは？,https://news.yahoo.co.jp/articles/dd5565c83f437bba01297c2e783eadcf95574bd9,10/1(日) 11:30
kosodate,自宅で冷凍野菜を作るポイント　冷凍野菜に向かない野菜とは?,https://news.yahoo.co.jp/articles/810df3bd6e2064fa649f0407c8761471d7deca93,9/30(土) 11:30
kosodate,第一子妊娠中の手島優さん「経験したことのない苦しみで完全にパニックになりました」突然訪れた息苦しさ、動悸…妊娠後期の不調明かす,https://news.yahoo.co.jp/articles/02332c85204a205d4cc8ad19c5f15f4fa8d0a47b,9/29(金) 12:10
kosodate,元日テレ宮崎宣子さん、予定日前倒しで帝王切開に「思っていたよりかなり早まりました…」,https://news.yahoo.co.jp/articles/4dd6eefbf2d902b3681a423e763b46537391b54d,9/28(木) 12:12
kosodate,エハラマサヒロさん、「息子の自傷行為が止まらずつらい」というママの悩みに寄り添い「本当に助けを求めた方がいい」,https://news.yahoo.co.jp/articles/efe91568d4cd26de6f43955a242622fcfed917ac,9/27(水) 12:12
kosodate,本並健治さん溺愛する娘を抱っこしすぎで腱鞘炎を発症「めっちゃ手首痛い」,https://news.yahoo.co.jp/articles/dea4d94558b4e65cf30f7f152efb11cc1521e59f,9/26(火) 12:11
kosodate,第一子出産の土屋太鳳さん、赤ちゃんを抱いてお出かけ「ちょっと浦島太郎になった気分です」,https://news.yahoo.co.jp/articles/13f8e18328678499090f2118c79b8411a0dd37fc,9/25(月) 12:30
kosodate,妊婦の歯周病はお腹の赤ちゃんにも悪影響!? なかなか歯が磨けない時は……,https://news.yahoo.co.jp/articles/729795f67db7b0491cdd02f48ab7867a2d99eef5,9/24(日) 11:30
kosodate,出産してすぐに母乳が湧き出てくるとは限らない。「母乳をたくさん出すことのできる食べ物や飲み物、サプリはありません」,https://news.yahoo.co.jp/articles/227b3f3c2b016255e1729033d3fc8fef82cc305e,9/23(土) 11:30
kosodate,おばたのお兄さん「ワンオペ育児動画」に山崎夕貴アナ爆笑！「赤ちゃんあるある」のオンパレードに共感しかない,https://news.yahoo.co.jp/articles/24dedcb300ed3cb7ab9307e2006655e5a8150b66,9/22(金) 12:12
