media_en,media_jp,title_articles,link_articles,date_original
bepal,BE-PAL.NET,自然豊かな森を舞台にした美術展「秋の森とアート」が9月29日から横浜で開催！,https://news.yahoo.co.jp/articles/fa48aeefbcf1f08d33555bab4ff6cd1f447ead7b,10/1(火) 8:05
bepal,BE-PAL.NET,この缶詰、キャンプにピッタリ！コンビーフを使った簡単レシピ4選,https://news.yahoo.co.jp/articles/46599e15b7c55881bd58b072114ea02a4a2e0323,9/30(月) 18:03
bepal,BE-PAL.NET,軽キャンより広〜い！ カップル車中泊にはレクビィのライトバンコン「コット」が便利,https://news.yahoo.co.jp/articles/00abfc3ef4cbaefff7ecd57fa7027f79084e60e7,9/30(月) 8:03
bepal,BE-PAL.NET,生まれ変わったジープ・ラングラー。アウトドア重視なら「ルビコン」がいいぞ！,https://news.yahoo.co.jp/articles/7bed162903aec3b006ecab5185aac0b83ee2370d,9/29(日) 20:00
bepal,BE-PAL.NET,アウトドアで使いたい！女性もコーデしやすいコンデジ専用カメラバッグはいかが？,https://news.yahoo.co.jp/articles/99ba7980474055f961478cfdf6901e237d0ffcf1,9/29(日) 18:00
bepal,BE-PAL.NET,無農薬野菜と魚を同じ農場で生産!? 持続可能な農業として注目される「アクアポニックス」とは？,https://news.yahoo.co.jp/articles/3f673e8e75c4e05b93b4a60b76e20c45c631e7d3,9/29(日) 15:00
bepal,BE-PAL.NET,ヨット世界一周中に日本へ寄港！トカラ列島の悪石島で出会った「山海留学」とは？,https://news.yahoo.co.jp/articles/e0cfbffaa65f3b19cd052edeb8181906fc245ec1,9/29(日) 12:05
bepal,BE-PAL.NET,釣りの後、魚や釣り餌のイヤ〜な臭いを車内に残さないコツ、教えます！,https://news.yahoo.co.jp/articles/8b553f3ff49e6c3190b7a7b2632aa6c1ce62e82c,9/29(日) 8:04
bepal,BE-PAL.NET,キャンプでもラーメン丼でラーメンを食べたって、いいじゃない！「あえて」食器を使ってみよう,https://news.yahoo.co.jp/articles/6c4cb6b42719e45f717c525c963e0311dece00fd,9/28(土) 20:03
bepal,BE-PAL.NET,アウトドア味噌「ねぎし」がキャンプ飯を変える!? おすすめメニュー6選,https://news.yahoo.co.jp/articles/527caf7aa7ac278d2ae87495afbf7cf3ded5c7f9,9/28(土) 18:04
bepal,BE-PAL.NET,人気のクルマの内装端材をアップサイクルした「SG BASE」って知ってる？,https://news.yahoo.co.jp/articles/d8c4b532087f9c71060d56c2a5d728d2f589b1ec,9/28(土) 15:00
bepal,BE-PAL.NET,マイナーチェンジしたカローラクロスはより安全で力強いぞ！コスパも抜群なのだ,https://news.yahoo.co.jp/articles/53a13b2fdcb0ad695cbbb3c1e25e9f619f78a53e,9/28(土) 12:06
bepal,BE-PAL.NET,冷たい麺、サラダ、魚介おつまみ…アウトドア料理の達人に聞いたひんやりレシピ10選,https://news.yahoo.co.jp/articles/38f703e5f49105dc8d0941950b01d87c27e4783f,9/28(土) 8:05
bepal,BE-PAL.NET,ライブもクラフトビールも！音楽好き社長が東京のど真ん中で始めた「CRAFTROCK BREWPUB & LIVE」,https://news.yahoo.co.jp/articles/c6d8198ea5725cbf673fe7cebb30453b0457f309,9/27(金) 18:03
bepal,BE-PAL.NET,グッチ裕三さん直伝！暑くてもガツガツ食べられるアウトドア“冷”レシピ8選,https://news.yahoo.co.jp/articles/dbbc8aaf273c4c2f6a17ec27c59e794289ef8677,9/27(金) 8:04
bepal,BE-PAL.NET,水の流れる音と涼しい風に癒やされる！川遊びも楽しい渓流・清流のキャンプ場10選,https://news.yahoo.co.jp/articles/284b095c1905e93d7762062bdd400923424d1e96,9/26(木) 18:02
bepal,BE-PAL.NET,目に涼しい阿寺ブルーも満喫！長野・阿寺渓谷キャンプ場でハンモック泊＆渓流ハイク,https://news.yahoo.co.jp/articles/7eef86f1be983c2ef093df04e345af7626b9ec5b,9/26(木) 8:03
bepal,BE-PAL.NET,焚き火対応ベストほか4種！スノーピーク「TAKIBI」シリーズの秋冬新作が登場,https://news.yahoo.co.jp/articles/da3d572b454020b63ec0025ae63e406244c1ce6f,9/25(水) 18:05
bepal,BE-PAL.NET,朝晩涼しくて快適に過ごせる！標高600m以上の高原のキャンプ場16選,https://news.yahoo.co.jp/articles/b5459d742013dbe5dad9f57e66bde38064e064d5,9/25(水) 8:03
bepal,BE-PAL.NET,簡単なのに美味しすぎる！親子で楽しくできる「手作りうどん」とアレンジレシピ4選,https://news.yahoo.co.jp/articles/297ff6dd933660a0f8c557aa9c2a7296abe1ae03,9/24(火) 18:02
