media_en,media_jp,title_articles,link_articles,date_original
davincin,ダ・ヴィンチWeb,台所でシャワー。サンマは4人で1匹。生活保護世帯の子どもとして生きた女子高生はどうやって自立したのか【書評】,https://news.yahoo.co.jp/articles/c9cc9609747594c1de8a8269a6645f73fe683020,10/5(土) 12:10
davincin,ダ・ヴィンチWeb,素敵なオーラから目が離せない！マダムの優雅な立ち居振る舞いに感化された女子大生の成長ストーリー【書評】,https://news.yahoo.co.jp/articles/b00ae317797afd79f6b365ab7ff611262072034d,10/4(金) 12:10
davincin,ダ・ヴィンチWeb,「右園死児」とはなにか。不可解な文字列によって生じる、人知を超えた災害とは？ SNSで話題のホラー『右園死児報告』【書評】,https://news.yahoo.co.jp/articles/a783d7082ba5cd39913305d98acd0bec86904355,10/3(木) 17:00
davincin,ダ・ヴィンチWeb,「やばい」で会話を済ませてない？154種類の感情表現を子どもと学べる『きもちのことばえほん』【書評】,https://news.yahoo.co.jp/articles/e658142d6155a67ac1830d92f7f6b0374c52239d,10/3(木) 15:00
davincin,ダ・ヴィンチWeb,石破氏が首相就任した今考えたい『選挙、誰に入れる？』。 “政治アレルギー”でも読みやすい、今の日本を考えるための本【書評】,https://news.yahoo.co.jp/articles/d33e92caf965562e8f7c89a0520ba43f0a79700f,10/3(木) 13:00
davincin,ダ・ヴィンチWeb,「自分の親に読んでほしかった」世界46カ国で200万部を売り上げた、子どもとの向きあい方の根本がわかる1冊【書評】,https://news.yahoo.co.jp/articles/18e4ce95b15152a62aac234ea05dd390722dc854,10/2(水) 17:00
davincin,ダ・ヴィンチWeb,やらなきゃいけないけど、めんどくさいあれこれ。「やっとこっかなリスト」で未来への備えを先のばしにしない！【書評】,https://news.yahoo.co.jp/articles/ad30d74f8d4198240689ca2598f6c984f2d97963,10/1(火) 21:10
davincin,ダ・ヴィンチWeb,なんてことのない当たり前の日々が尊い。忘れ去りそうな瞬間を丁寧に切り取った『コアラ絵日記』【書評】,https://news.yahoo.co.jp/articles/ea3abc3d8b107de3d72e404e69e051616e66dbcb,10/1(火) 20:10
davincin,ダ・ヴィンチWeb,怪異に宣戦布告?!とある高校に流布する怪談話「きれいな本」の真相とは。梨氏による新感覚ホラーモキュメンタリー【書評】,https://news.yahoo.co.jp/articles/d89bebfbecbc8f7ad58a40aa48b569e47a325616,10/1(火) 17:00
davincin,ダ・ヴィンチWeb,『世界の幽霊出現録』優しい、イタズラ好き、邪悪だけじゃない世界の幽霊の目撃証言を記録【書評】,https://news.yahoo.co.jp/articles/9824339d6f1187f4656c55b5b92e2c479fe6399c,10/1(火) 14:00
davincin,ダ・ヴィンチWeb,ご主人の枕をしっかり占領。紙袋はちょっぴり怖い。甘えん坊でドジっ子な黒猫との生活は癒しだらけ！【書評】,https://news.yahoo.co.jp/articles/acf2d7cb20ad44113b90e25b949aea1625af6ef7,10/1(火) 12:10
davincin,ダ・ヴィンチWeb,山下智久主演で実写ドラマ化された話題作。天気予報を武器に自然災害から命を守れ！『BLUE MOMENT ブルーモーメント』【書評】,https://news.yahoo.co.jp/articles/5b7de746de564326a2e09312a43a9df579bd7f32,10/1(火) 6:40
davincin,ダ・ヴィンチWeb,散歩でテンションが上がり、リードに絡まり動けなくなる… ちょっぴりおバカでかわいすぎる柴犬の日常【書評】,https://news.yahoo.co.jp/articles/bc5afc894840c57b53e392758ae04446822701b5,9/30(月) 21:10
davincin,ダ・ヴィンチWeb,本当に恐ろしいのは戦争か？疫病か？はたまた...名画を通して過酷な運命と闘い続けた人間の本質をひもとく『災厄の絵画史』【書評】,https://news.yahoo.co.jp/articles/fee144d7f0756a04e0a81a74bd048ff378f28d3c,9/30(月) 18:00
davincin,ダ・ヴィンチWeb,不思議なものを見ることができる「おまじない」とは!? 妖怪たちとの交流と心温まる絆を描いた『狐の窓』【書評】,https://news.yahoo.co.jp/articles/080419affffe60189902add05c943d4865ab44a3,9/29(日) 23:10
davincin,ダ・ヴィンチWeb,ビビり編集の新担当はホラー作家!? 凸凹コンビが怪異を求めて夜の樹海や廃病院へ！ 体当たり取材で出会ったのは…【書評】,https://news.yahoo.co.jp/articles/f9283a4f27cd14e639aa167aacb050972f9e6b06,9/29(日) 23:10
davincin,ダ・ヴィンチWeb,学校も生徒も選択肢があって良い！ コロナ禍を経て移り変わる生活を描いた『腐女医の医者道！　アフターコロナ編』【書評】,https://news.yahoo.co.jp/articles/98eb1e36e2f875b9a40014f995ee1fe33bbb1cfc,9/29(日) 20:10
davincin,ダ・ヴィンチWeb,刑事ドラマの犯人の似顔絵は似すぎちゃダメ？ドラマの現場で働くイラストレーターが知られざるテレビ業界の裏側を描くお仕事マンガ【書評】,https://news.yahoo.co.jp/articles/883fc15e43bbcdc60b8a4f85c84d6ac8a80c6afe,9/29(日) 19:10
davincin,ダ・ヴィンチWeb,気品と恐怖が絶妙な『ゴースト・ハント』。翻訳者が「最後のゴースト・ストーリー作家」と呼ぶ、ウェイクフィールド英国風幽霊譚【書評】,https://news.yahoo.co.jp/articles/fbaf7334a7fb5fe31b83316d9fa307ce4a440835,9/29(日) 14:00
davincin,ダ・ヴィンチWeb,盛り塩をすると、フライドポテトを作ってくれる!? 生活力の高い怨霊と売れない漫画家の怖かわいい日常【書評】,https://news.yahoo.co.jp/articles/7522d43bed6f1f2a08e4d3ac5db9cdc39dc70bfb,9/28(土) 22:10
davincin,ダ・ヴィンチWeb,「この人たちと離れたら死ぬ」4歳でバックパッカーに。海外旅行初体験の両親と無計画な世界放浪の旅へ【書評】,https://news.yahoo.co.jp/articles/6c4b7f2c944db10a7b28d7de1c6f2a922581fe52,9/28(土) 18:10
davincin,ダ・ヴィンチWeb,お役所仕事だけど命がけ!? 凸凹バディが各所の怪異を調査するお仕事ホラー『百鬼調書 怪異調査はこちらまで』【書評】,https://news.yahoo.co.jp/articles/c7cd501163ff69724cb5ae5b57a7eae50134a85e,9/28(土) 17:10
davincin,ダ・ヴィンチWeb,『キャプテン翼』・高橋陽一「良いシュートが描けるとゴールさせたい」。ネーム連載の最新シリーズで22歳の大空翼が「W杯優勝」を掴むまでの構想とは【インタビュー】,https://news.yahoo.co.jp/articles/28bc03af9a127ecc3efd0c5f5f9213aa9306ced4,9/28(土) 15:00
davincin,ダ・ヴィンチWeb,プレゼント選びで悩んでしまうあなたに。天才ギフトコンシェルジュと新米編集者が織りなすハートフルドラマ【書評】,https://news.yahoo.co.jp/articles/7dc02f5b9d0215e401d4e0d719ed086357fe0e7e,9/28(土) 14:10
davincin,ダ・ヴィンチWeb,仕事に熱中しすぎて部屋は散らかり放題。タイ料理が好きという理由で現地へ。豪快で愛おしい妻に振り回される夫の日常【書評】,https://news.yahoo.co.jp/articles/72f21573046136c020fc97b07ba9ca9a16469ce8,9/28(土) 12:10
davincin,ダ・ヴィンチWeb,愛し合うのは「傘」と「傘立て」!?　正気を疑うBLマンガ『放課後水入らず』はなぜ生まれたのか【BLマンガ家・あぶくインタビュー】,https://news.yahoo.co.jp/articles/5151221cb3c1634c1d595fa433953ee16c525406,9/28(土) 10:10
davincin,ダ・ヴィンチWeb,『虎に翼』ロスの人におすすめ！ 世界を深める「3冊」【書評】,https://news.yahoo.co.jp/articles/16a6c9ce27e01dd79a6e6ed55bfc5dfaf52a37df,9/28(土) 8:30
davincin,ダ・ヴィンチWeb,大人の10人に1人が該当すると言われる発達障害。特性ゆえの失敗・トラブルの改善方法を実例から学ぶ！【書評】,https://news.yahoo.co.jp/articles/8e6aecba00df9f94e8c9954358c3772210a02eb6,9/28(土) 6:40
davincin,ダ・ヴィンチWeb,「東京高尾リゾート（TTR） 山のテーマパークに来たみたいだぜ」笑いと学びが詰まった、インドアオタクたちの山登り入門マンガ！【書評】,https://news.yahoo.co.jp/articles/894edee580a2fe69e96e526e30fdc8bdd1fefab4,9/27(金) 21:40
davincin,ダ・ヴィンチWeb,「キャラクターを生きている人として描きたい」大人気漫画『不運からの最強男』作画・中林ずん先生の原点とは？【インタビュー】,https://news.yahoo.co.jp/articles/a0ec2ac3189d0729fd7f52d3dceca0c35a77e690,9/27(金) 19:10
davincin,ダ・ヴィンチWeb,もう次のミルクタイム!? 5分で起きたが？ 子育て中の“あるある”に心温まる『今日のぽよるし』【書評】,https://news.yahoo.co.jp/articles/fbc8482064fe1625001670bfd6185fa5697a5d4b,9/27(金) 18:40
davincin,ダ・ヴィンチWeb,「1年だけ結婚しよう」期間限定の契約結婚。しかし、離婚前日に事故に遭い記憶を失った夫から、まさかの溺愛がはじまって――!?【書評】,https://news.yahoo.co.jp/articles/faaae0d37772244bf640debe4ee8fe2e415f4946,9/27(金) 18:10
davincin,ダ・ヴィンチWeb,「ある地域」に関する怪談を集めていた編集者が失踪した。次第に浮かび上がる恐ろしい事実とは？ 漫画『近畿地方のある場所について』【書評】,https://news.yahoo.co.jp/articles/e3f75bf435e5a7f7f6db364b1cf096cccf344548,9/27(金) 17:40
davincin,ダ・ヴィンチWeb,アフタヌーン連載で大反響、小学5年生の不穏な友情物語。 著者が語る『どくだみの花咲くころ』誕生秘話【城戸志保氏インタビュー】,https://news.yahoo.co.jp/articles/a84e74492c5f69cb8efb32e77a845a7f8eee431f,9/27(金) 13:00
davincin,ダ・ヴィンチWeb,子育て中のママにも活かせる時間術。心地よく過ごしながら自分の人生をデザインする方法をタイムコーディネーターが伝授！【書評】,https://news.yahoo.co.jp/articles/7f394734cbe67a512d23803c54ad34f19577d851,9/27(金) 12:10
davincin,ダ・ヴィンチWeb,結婚前と妊娠中に浮気した夫。「別れたくない」と土下座までしたのに、1年も経たないうちに3度目の浮気が発覚。サレ妻は徹底的な制裁を決意する！【書評】,https://news.yahoo.co.jp/articles/667c9c1ddb1020ac1a7009f820502f107d00a77b,9/26(木) 23:10
davincin,ダ・ヴィンチWeb,しごできイケおじの秘密とは？  本当に好きなものを愛で、その世界にどっぷりと浸る尊い時間を描いた『おじさんはカワイイものがお好き。』【書評】,https://news.yahoo.co.jp/articles/c4eae9f090502433896bec6f6cab5b341b673ac3,9/26(木) 23:10
davincin,ダ・ヴィンチWeb,「彼氏は既婚者だけど、私と結ばれる運命」と信じていたハイスペ上司は、モラハラ不倫搾取男だった…【書評】,https://news.yahoo.co.jp/articles/42126e7d5d638fb650842c51e709c49e2146ae71,9/26(木) 21:40
davincin,ダ・ヴィンチWeb,メイドが宝石を売る不思議なお店。決して押し売りはせず、お客様の気持ちに寄り添った最適な宝石を提案してくれる宝石商【書評】,https://news.yahoo.co.jp/articles/9fea6e8e0b11e9f7680f1f8beda403c2a6743fb3,9/26(木) 18:40
davincin,ダ・ヴィンチWeb,まさかの鬼になりきる鬼“ごっこ”!? 天才だけどお馬鹿な「紙一重」な少女のにぎやかな日常【書評】,https://news.yahoo.co.jp/articles/ca588b4aad52bfc9f0f75ade11bdfd4a333d35c9,9/26(木) 17:40
davincin,ダ・ヴィンチWeb,『傲慢と善良』が幅広い年齢層に「自分自身を描いているようだ」と感じさせる理由。 映画主演・キスマイ藤ヶ谷＆奈緒の心にも刺さった辻村深月作の恋愛ミステリー【書評】,https://news.yahoo.co.jp/articles/0196eaf05794b1c6d4b35cec41187c5c174dba2e,9/26(木) 15:00
davincin,ダ・ヴィンチWeb,「手間なく美味しく食べてるのに痩せる」“ズルい”ダイエット方法って？ SNSで人気のKikiさんが8キロ落としたレシピを作ってみた【書評】,https://news.yahoo.co.jp/articles/dec1ca9c76e268c8b04c730bcb33a29f8d02a967,9/25(水) 21:40
davincin,ダ・ヴィンチWeb,乳がんが転移し、脳腫瘍になってしまった母。最期を看取るため、母の死と向き合った家族の数カ月の記録【書評】,https://news.yahoo.co.jp/articles/83b26e7bf10dcf4f1d8d194c0f93e7791a7a208f,9/25(水) 18:10
davincin,ダ・ヴィンチWeb,人の死が近づくと聴こえる不穏な音。登場人物の物語がつながる全12話のオムニバス漫画【書評】,https://news.yahoo.co.jp/articles/60482b677e3f284be714960a7fe17c99511db397,9/25(水) 18:00
davincin,ダ・ヴィンチWeb,宮部みゆき原作の怪奇譚集をコミカライズ。心を閉ざした少女が耳を傾けるのは、奇妙で恐ろしい怪談話だった。『三島屋変調百物語』【書評】,https://news.yahoo.co.jp/articles/66f0040e674ec3e6493e4c44620996478c596eef,9/25(水) 16:10
davincin,ダ・ヴィンチWeb,「絶対に嫌」ぼっち男子がクラスで1番かわいい女子からの誘いを断った理由とは？“内緒の友達”との秘密の関係にむずきゅんが止まらない【書評】,https://news.yahoo.co.jp/articles/ad14421ee7ee41350ea63240cd9a04435e12f93f,9/25(水) 12:10
davincin,ダ・ヴィンチWeb,“勝ち組”人生を歩んでいた大人気マンガ家。地位と名誉に溺れて周りを見下しまくった結果、これまでと「真逆」の世界に転移させられて!? 手に汗握る因果応報コミック【書評】,https://news.yahoo.co.jp/articles/72502c9244df3b6d10c96b50f839e28720916641,9/24(火) 20:40
davincin,ダ・ヴィンチWeb,「私だってまだ未熟なのに…」新任教師の指導に悩む中堅の先生の悩みに対し、メンタル激強な保健室の先生が放った力技なアドバイスとは？【書評】,https://news.yahoo.co.jp/articles/14e98c84bfd2dfc50212916a8faee4b3dceb359b,9/24(火) 17:40
davincin,ダ・ヴィンチWeb,帰宅中の事故で死んでしまった主人公。「毒にも薬にもならないから」という理由で異世界転生させられ、治癒師として生きることを目指す！【書評】,https://news.yahoo.co.jp/articles/ea38f3e1caf631998d8b8bd8532587fbfd0a10c4,9/24(火) 12:10
davincin,ダ・ヴィンチWeb,満島ひかりの回文を又吉直樹がショートストーリーに！？満島×又吉【インタビュー】,https://news.yahoo.co.jp/articles/a602a097795b624ffd51d909c5f26393675a002a,9/24(火) 12:00
davincin,ダ・ヴィンチWeb,結婚してから豹変した夫は、DVに借金、不倫三昧！ 息を吐くように嘘をつく夫に、妻は制裁を決意する【書評】,https://news.yahoo.co.jp/articles/fd4331175a0a44ed369c77eebb02a8fb4f75f112,9/23(月) 20:40
davincin,ダ・ヴィンチWeb,動物に異様なほど好かれる体質の義理の兄との同居生活がスタート!? 義兄弟のほのぼの＆にぎやかアニマルライフ【書評】,https://news.yahoo.co.jp/articles/4acbabfa4d1f668d9d62d9ba68b171247bd4920a,9/23(月) 16:40
davincin,ダ・ヴィンチWeb,初対面の異性と話が続かない… マッチングアプリで運命の人を探す、アラサー男性のリアルな婚活体験記【書評】,https://news.yahoo.co.jp/articles/2c805dc806071711c0906169a6e9edee369a4f7d,9/22(日) 23:10
davincin,ダ・ヴィンチWeb,やっと見つけた…！ “好き”を分かち合う喜び、ふたりの女子高生の音楽で彩られた青春を描く『気になってる人が男じゃなかった』【書評】,https://news.yahoo.co.jp/articles/f535a29c8139a72b0b6e4a12b549dec094930792,9/22(日) 21:40
davincin,ダ・ヴィンチWeb,先輩後輩コンビのふたり暮らしを彩る全国の“美味しいもの”たち。お取り寄せを味わう時間がふたりの仲を深めていく【書評】,https://news.yahoo.co.jp/articles/b05c58dc733e256f747d72d2b0bee7a1dbbf9025,9/22(日) 16:10
davincin,ダ・ヴィンチWeb,「天上天下唯我独尊」の特攻服を着たヤンキー。住職がその意味を知っているかと問うと!? ヤンキーが教えを説く仏教コメディ【書評】,https://news.yahoo.co.jp/articles/f70d12fa41fb290699e0d1c477980fd39a31b6fa,9/21(土) 23:10
davincin,ダ・ヴィンチWeb,子育てが終わったら何が残るのだろう？ 『うちの母は今日も大安』は、自分の人生を生きるためのヒントが詰まったお守り本【書評】,https://news.yahoo.co.jp/articles/d2fd060dddd000828baca97d17c7918242957779,9/21(土) 21:40
davincin,ダ・ヴィンチWeb,傷付いたふたりを繋いだのは「パン」...犬と少年のワンダフルな友情物語『こむぎびよりのコッペパン』【書評】,https://news.yahoo.co.jp/articles/a95eeb7a32cb109bce4fc2d997eb00ac612c1ada,9/21(土) 20:00
davincin,ダ・ヴィンチWeb,アニメ放送決定で再熱中、未完の魔法少女マンガ。累計60万部、絶筆となった藤原ここあ作の名作『かつて魔法少女と悪は敵対していた。』【書評】,https://news.yahoo.co.jp/articles/eb9fe44c32dbe0a6524c2e367a343a91d74b6c4a,9/21(土) 18:00
davincin,ダ・ヴィンチWeb,「持ち家を手放そう！」憧れの一軒家を建てたものの、家族の幸せのために手放した実録エッセイ【書評】,https://news.yahoo.co.jp/articles/11bf9a28bf7c7621a0c752a6d6c45defef5bc600,9/21(土) 17:40
davincin,ダ・ヴィンチWeb,パワースポットで運気をチャージ！ ゆるっと巡る、夫婦（ときどき3姉妹）の笑顔あふれる開運旅【書評】,https://news.yahoo.co.jp/articles/2eae5d6b2d2d9aa2ee0b60fce5f14d34b7a0befb,9/21(土) 16:10
davincin,ダ・ヴィンチWeb,「王子をビンタして死刑」から始まる幽霊城でのラブコメディ！恋にも幽霊にもドキドキさせられる『幽霊城の旦那様』【書評】,https://news.yahoo.co.jp/articles/f19d78a18fc8bcfc4c3a1e2ed1eb2eafb76d357b,9/21(土) 11:00
davincin,ダ・ヴィンチWeb,「子どもを産みたいのか分からない」「望めば妊娠できると思っていた」子どもを持つかどうかの選択、不妊の悩みを描いたコミックエッセイ【書評】,https://news.yahoo.co.jp/articles/c74aa9bb36d09a8741a303a65a6f9405dcb91f47,9/20(金) 23:10
davincin,ダ・ヴィンチWeb,本当に「子どものため」ですか？ 歪んでいく母親の愛を描いた衝撃的なセミフィクション『すべては子どものためだと思ってた』【書評】,https://news.yahoo.co.jp/articles/5a35355114fc14f3bc22a1c16cd8da635041c8fb,9/20(金) 22:10
davincin,ダ・ヴィンチWeb,和田秀樹「日本の学者、外国の論文を読んでないんじゃないの」精神科医としての道標となった3冊【私の愛読書】,https://news.yahoo.co.jp/articles/eddf21900958046ddc8d2a67f21791b550ad4af8,9/20(金) 20:00
davincin,ダ・ヴィンチWeb,70歳独身男、はじめての子育てでどうなる!?想定外だらけの3歳児とのドタバタ共同生活【書評】,https://news.yahoo.co.jp/articles/f816529f171b8b5ee2bea0549d6c9616f3b2556b,9/20(金) 19:00
davincin,ダ・ヴィンチWeb,正体不明の祠と事件現場に残される「N」の文字。伏線を解き明かすのが恐ろしくなるホラー漫画『N』,https://news.yahoo.co.jp/articles/174902dcaab4584a01cb822e66d7202fc620ca04,9/20(金) 16:00
davincin,ダ・ヴィンチWeb,猫のふみふみ、肉球によるアイマッサージ… 疲れた社会人の心も体も癒してくれるのは白猫の店主!?『ねこのマッサージ屋さん』【書評】,https://news.yahoo.co.jp/articles/8f5bd00207e075bad4c629d051ab1e0ca222d35b,9/20(金) 15:10
davincin,ダ・ヴィンチWeb,うっかりミスや遅刻、勘違い…もしかしてADHDかも？ リアルな「困りごと」の解決策を学べるコミックエッセイ【書評】,https://news.yahoo.co.jp/articles/11107faaa3714728b71aa0331bcf84ca60b32e14,9/20(金) 6:40
davincin,ダ・ヴィンチWeb,「死体部屋」に遭遇することも日常茶飯事。家賃を滞納している人に督促をする、家賃保証会社の仕事とは？【書評】,https://news.yahoo.co.jp/articles/23e778482be3a41e8843ba8b9e6798f2294f4e17,9/19(木) 22:10
davincin,ダ・ヴィンチWeb,『光が死んだ夏』はホラー？ブロマンス？青春譚？語り尽くせぬ魅力に沼る人続出の漫画をレビュー【書評】,https://news.yahoo.co.jp/articles/d533063b7ff7cfc02240a55b8edb4c7a70f4aeaa,9/19(木) 21:00
davincin,ダ・ヴィンチWeb,この恋は期限付き。余命宣告されたふたりの儚い純愛ストーリー『余命一年と宣告された僕が、余命半年の君と出会った話』【書評】,https://news.yahoo.co.jp/articles/58f9c8ee37e4bb3c0298a86a4f590c92841dca1a,9/19(木) 20:00
davincin,ダ・ヴィンチWeb,出血は痔のせいだと思ってた。37歳の若さで「大腸がん」ステージ4と診断された女性のリアルな闘病日記【書評】,https://news.yahoo.co.jp/articles/e41a893953054f7132fdd60bc4b8436f0003802b,9/19(木) 19:40
davincin,ダ・ヴィンチWeb,天真爛漫・令和ギャル！1歳のしおさんとほぼさんファミリーが送る、抱腹絶倒！子育てコミックエッセイ【書評】,https://news.yahoo.co.jp/articles/b7760152ec126a7359b42947cbd26925569b3ac2,9/19(木) 19:00
davincin,ダ・ヴィンチWeb,浮気された地味令嬢が美しい女性に成長!? 素敵な淑女になるためのスパルタレッスン【書評】,https://news.yahoo.co.jp/articles/47ed133e472202a594a137ae6163489324047378,9/18(水) 22:10
davincin,ダ・ヴィンチWeb,「辺境の雪男」から突然のプロポーズ!? 契約結婚から始まる心温まる雪国の物語『北欧貴族と猛禽妻の雪国狩り暮らし』【書評】,https://news.yahoo.co.jp/articles/679ec8e7b3057df0c4145dbdf85a927b18671656,9/18(水) 21:40
davincin,ダ・ヴィンチWeb,実話怪談マンガ『憑きそい』の重くのしかかるような息苦しさと気持ち悪さ。【書評】,https://news.yahoo.co.jp/articles/ae322852773b8751cafcbb8858be9c0aabed797e,9/18(水) 21:00
davincin,ダ・ヴィンチWeb,そこはかとなくブサイクだけど最高にかわいい！ いくえみ綾と愛猫ブンとの日常を描いた猫コミックエッセイ【書評】,https://news.yahoo.co.jp/articles/2662d6579265f8116d6a9085d898a05cb58a441c,9/18(水) 19:40
davincin,ダ・ヴィンチWeb,チャンネル登録者数30万人超のYouTubeホラー番組『フェイクドキュメンタリーQ』が書籍に！リアルすぎるじっとりとした恐怖がたまらない【書評】,https://news.yahoo.co.jp/articles/81673dcc2c9ca478dec06f1e6ef56a422b8f6e66,9/18(水) 18:00
davincin,ダ・ヴィンチWeb,芥川賞作家・高瀬隼子氏の短編集『新しい恋愛』が描く、恋愛の「ん？」という違和感,https://news.yahoo.co.jp/articles/bb8c6fbc0e3f43d4e2e5a5a998560ae197bf7ffe,9/18(水) 12:00
davincin,ダ・ヴィンチWeb,娘と一緒にいられない哀しさを癒すのは… バツイチ・アラサー女性の唯一の贅沢『ランチ酒』【書評】,https://news.yahoo.co.jp/articles/d0cb32d0fc440f2c7ce9b90abe4e3bc3047a8f08,9/18(水) 11:10
davincin,ダ・ヴィンチWeb,子どもの素顔を投稿するのは罪なのか？ SNSにのめり込み、子どもを利用する母。成長した娘が抱える問題とは…【書評】,https://news.yahoo.co.jp/articles/50074f2682bb32a10981f458e970e7d5241ad764,9/16(月) 21:40
davincin,ダ・ヴィンチWeb,飼い猫との生活を夢見るも、単身赴任から戻った主人公に待っていたのは“自分にだけ”懐いてくれない現実!?【書評】,https://news.yahoo.co.jp/articles/df4543509dc0233ed0ed2192658e105ad09299fe,9/15(日) 22:10
davincin,ダ・ヴィンチWeb,「失恋の癒しにどうですか？」女たらしな年下大学生と恋愛偏差値ゼロOLのドキドキ同居生活【書評】,https://news.yahoo.co.jp/articles/09decd0a0ab8660ecaaa47ab99107b2dc093120e,9/15(日) 22:10
davincin,ダ・ヴィンチWeb,「あなた誰？」身に覚えのない目撃情報。自分にそっくりな人物が近づいてくる恐怖。もしもドッペルゲンガーが現れたら…【書評】,https://news.yahoo.co.jp/articles/d59d3ce644bd77ed2f0ed4ef4fc839c55a0b4162,9/15(日) 19:40
davincin,ダ・ヴィンチWeb,「きっと運命なんだよ」子猫を保護した夫婦。一度は里親に引き取られるも、ふたりの元に帰ってきた子猫とはじめるハートフルライフ【書評】,https://news.yahoo.co.jp/articles/ee2638e989880b5b2fce463d500eda6c55e98f4e,9/15(日) 17:10
davincin,ダ・ヴィンチWeb,少女漫画みたいな恋とは無縁…のはずだったのに。共感MAXな喪女の恋路が見逃せない！『ブスに花束を。』【書評】,https://news.yahoo.co.jp/articles/2b8cba5b07006892a0cb6a75e1ea2f4bf7acdbe7,9/15(日) 12:10
davincin,ダ・ヴィンチWeb,「助けて」と言えないあなたへ。身投げから再起した中年男性が伝える、人を頼る意味『野良猫と便利屋』【書評】,https://news.yahoo.co.jp/articles/051f9749157b2a5345c1f6302849bcca7781f789,9/14(土) 15:10
