media_en,media_jp,title_articles,link_articles,date_original
egolf,e!Golf,「来年は新しい目標に」 山下美夢有が優勝から一夜明け思いを告白…戦いを終えファンへ感謝のメッセージ,https://news.yahoo.co.jp/articles/3dbbf860381adbe8820b8b9a2e232eb26f8ec3ea,11/27(月) 16:10
egolf,e!Golf,最後まで年間女王を争った2人 申ジエは4位タイ 岩井明愛は24位で終戦　ジエは珍しく大きなため息を,https://news.yahoo.co.jp/articles/975506eca01f18ebb8cee6010191c17860852634,11/27(月) 14:10
egolf,e!Golf,来季は米ツアーに挑戦する吉田優利と稲見萌寧　ともに12位タイで国内ツアー最終戦を締めくくる,https://news.yahoo.co.jp/articles/0edfbd7331ad77ad36a0afdd79b7241c99eed0e1,11/27(月) 12:10
egolf,e!Golf,菅沼菜々はまさかの最下位フィニッシュもポジティブ思考…稲見萌寧＆青木瀬令奈らとのオフショットをお披露目,https://news.yahoo.co.jp/articles/6012e7ee0e1fef16c4ddeb8e4254810c1c39eff0,11/27(月) 11:50
egolf,e!Golf,山下美夢有「自分らしいプレーができていなかった」 申ジエとの2日間が自信を取り戻す半年間の総仕上げに,https://news.yahoo.co.jp/articles/705dbc67a4bc74a44f3e689b8291585a84981fbd,11/27(月) 11:10
egolf,e!Golf,パートナーと“水入らず”で回りたいけど1人2000円は痛い！ なぜ「2サム」だと割増料金が跳ね上がるの？,https://news.yahoo.co.jp/articles/3da62497dca677af1868201063e3550cb75c318d,11/27(月) 10:10
egolf,e!Golf,カッコ悪いキズはできるだけ直したい！ ゴルフクラブのキズってどうやって修復すればいいの？,https://news.yahoo.co.jp/articles/ed515bf9198dd63d06e01cf211dee0bfa10f19d9,11/27(月) 9:10
egolf,e!Golf,ビギナーやアベレージは「ディスタンス系ボール」一択は間違い!? 「あえてスピン系」が上達を速める理由,https://news.yahoo.co.jp/articles/c1d7dace69d8326c24f91582e7661fd917496d58,11/27(月) 7:10
egolf,e!Golf,年間女王を争う3人は明暗が分かれる！ スコアを落とした申ジエは「5打差なら分からない」と前を向く,https://news.yahoo.co.jp/articles/65a4e96b45950b1f56d94bb3f6302f4929f1ff5d,11/26(日) 8:10
egolf,e!Golf,昨年のこの時期はQTで頭がいっぱいだった！ 今季大躍進の蛭田みな美がベストスコアで優勝戦線浮上,https://news.yahoo.co.jp/articles/39485e5bb773573f63701f5c670f19834a54b7c0,11/26(日) 7:10
egolf,e!Golf,「焼肉に行きたいです」 大会連覇＆年間女王へ向け山下美夢有が最高の位置につける,https://news.yahoo.co.jp/articles/bcc96db6987a8e1d18de9b4e7642047e697ae970,11/26(日) 6:10
egolf,e!Golf,「2日あれば差はないようなもの」 米ランク10位で終えた古江彩佳が3位タイ　不敵に淡々と逆転勝利狙う,https://news.yahoo.co.jp/articles/36278b95780038235b0d865feb5d14bacae3e036,11/25(土) 7:55
egolf,e!Golf,「ドライバーがヤバいです」も踏みとどまった原英莉花　2度目の大会制覇に向け巻き返しを誓う,https://news.yahoo.co.jp/articles/1b6b8a87f8598b343f354c8e32d940b75b79471e,11/25(土) 7:10
egolf,e!Golf,女子ゴルフ年間女王を争う3選手　山下美夢有が3打伸ばし2位、申ジエ3位タイ、岩井明愛は20位タイと苦しく,https://news.yahoo.co.jp/articles/ac5481d5948c0554ac405e1c535fd9f84e7bc269,11/25(土) 6:25
egolf,e!Golf,藤田光里がC地区トップ！ 河本結、臼井麗香、木戸愛、アン・シネらも順当にQTファーストを突破,https://news.yahoo.co.jp/articles/8995b3ad9c7180d1d3728eb7bb667aaeba8b10ab,11/25(土) 5:40
egolf,e!Golf,BGでもKGでもない「TG」って何!? 日本のゴルフ場で「ティフトン芝」グリーンは流行する？,https://news.yahoo.co.jp/articles/e08afebfb8a2594762d3532092131811f13f90dc,11/24(金) 18:10
egolf,e!Golf,「あーーっ、入る！」 吉田優利が“イーグル寸前”ピンに絡むスーパーショットを披露　さすがの精度に絶賛,https://news.yahoo.co.jp/articles/69d2ef6ebec89ba2ec65edf2710c00a679952783,11/24(金) 16:10
egolf,e!Golf,安定の上位陣にテーラーメイドの新ウェッジがランクイン！　2023年10月売れ筋ウェッジベスト5,https://news.yahoo.co.jp/articles/a2121a080a13dc1d7c82cdcc9e6e4bd669b83228,11/24(金) 14:10
egolf,e!Golf,2人合わせて今季6勝！ 青木瀬令奈が「祝！ 初シード」な櫻井心那との「うなぎ＆パフェ」ディナーを公開,https://news.yahoo.co.jp/articles/f8246b39a563e2b38aa5cb6ea9350eadf4e20cff,11/24(金) 11:59
egolf,e!Golf,プロも仕事だから仕方ないけど“音量”が…隣打席のレッスンする声で気が散る時どうしたらいい？,https://news.yahoo.co.jp/articles/7923c6d7c62a474e7616ea42aa43a4adad2df982,11/24(金) 11:10
egolf,e!Golf,青木瀬令奈のアイアン本数はデビュー時から5本→4本→3本に 「ウッドは飛ばすクラブではなく狙うクラブ」,https://news.yahoo.co.jp/articles/465ce56cfc57b04a2f8df82787bcb55109375492,11/24(金) 10:10
egolf,e!Golf,2位発進の櫻井心那　「富士通以来（5試合“も”）優勝していない」と考える19歳の恐るべき貪欲さ,https://news.yahoo.co.jp/articles/987d1fd5fed54f6c52c6cf983e19d1515f2c3b35,11/24(金) 8:10
egolf,e!Golf,森田遥が単独首位！ 新型コロナやRSウイルスで苦しんだ今シーズンの最終戦でメジャー制覇を目指す,https://news.yahoo.co.jp/articles/bfa7bbefbb12bc445c815f2273a28c20627f055b,11/24(金) 7:10
egolf,e!Golf,山下美夢有、申ジエ、岩井明愛の賞金女王争い　ランキング1位の山下がチップイン連発で好発進,https://news.yahoo.co.jp/articles/decb16525dd0edc80fd1e56db612fb9a4bdcb03f,11/24(金) 6:10
egolf,e!Golf,家族で気楽にゴルフしたいなら！ ファミリー割引充実のゴルフ会員権が狙い目,https://news.yahoo.co.jp/articles/ef559629267c4c18a8c65860156e063d8d869f0d,11/23(木) 20:10
egolf,e!Golf,ゴルフネットワークプラスに新機能「ムービースコアカード」登場！ リリース記念のオンラインコンペ実施中,https://news.yahoo.co.jp/articles/9cf4728efa0b3203470258da34a573f61185ab32,11/23(木) 9:10
egolf,e!Golf,きょう開幕！ 最終戦までもつれた三つ巴女王争い　山下美夢有、申ジエ、岩井明愛それぞれの思いは？,https://news.yahoo.co.jp/articles/24356082d38c5abff8e8275d9cea0e27caffaf69,11/23(木) 7:10
egolf,e!Golf,有村智恵が36歳の誕生日に“妊娠”を報告 「とにかく早く会いたいなという気持ちでいっぱいです」,https://news.yahoo.co.jp/articles/09b9e23cf90624c132d0b1b64234c273b0e704ef,11/23(木) 6:10
egolf,e!Golf,「スイングテンポが良い」って本当はどういう意味？ 動きの順番が分かれば効率的にパワーを生み出せる,https://news.yahoo.co.jp/articles/e1548c99868066bf6081f14c231b58896a861f9c,11/22(水) 18:10
egolf,e!Golf,エリエール欠場の吉田優利はどこで何してた？ 練習動画や“芋ラブ”な満面笑顔などオフショットを大公開,https://news.yahoo.co.jp/articles/15f1327f092e64aa703068ea4904575432d9cb95,11/22(水) 16:10
egolf,e!Golf,酷暑の影響で驚速グリーンが増加!? コースセッティングにおける「カップを切る位置」の決まりとは？,https://news.yahoo.co.jp/articles/b927220496e7a2e14956805e786351bf2d3190ca,11/22(水) 14:10
egolf,e!Golf,「準シード取れたことが奇跡に感じます」 堀琴音が苦しみぬいた23年を支えてくれたファンとキャディーに感謝,https://news.yahoo.co.jp/articles/7c9852726b32f26c961a0a56a118b1dc8ef10e65,11/22(水) 11:50
egolf,e!Golf,ゴルフ場の池でたまに見かける噴水は何のため？ 単なる賑やかしじゃないってホント!?,https://news.yahoo.co.jp/articles/5aaf3eff1a56fd9ebb65af6695b4d8d19c34cfdd,11/22(水) 11:10
egolf,e!Golf,食いつきそうなフェースが特徴的！ ブリヂストン「B1 ST」はヘッドスピードが速くなくても打てるの？,https://news.yahoo.co.jp/articles/08040b73608d68801f725e8d8569a4b3f0e58de5,11/22(水) 10:10
egolf,e!Golf,「スロープレー」より「打ち込み」の方が罪は重い!? プレーヤー無視でカートを進めるのはマナー違反？,https://news.yahoo.co.jp/articles/3e77619f77b14731c5be192206555264e93c4f29,11/22(水) 9:10
egolf,e!Golf,罰打もイヤだし球もモッタイナイ！ 後続組が来る気配がなければボールを探し続けてもいいの？,https://news.yahoo.co.jp/articles/e107246729248e8de75ffef652f0f59e543edbae,11/22(水) 7:10
egolf,e!Golf,西村優菜が米ツアー初年度を振り返り心境明かす「華やかで賑やかな感じは少なく 寂しくなった時も…」,https://news.yahoo.co.jp/articles/bdbe35ec349e6e0a5f5b6283eebbaca8f6c84b17,11/22(水) 6:10
egolf,e!Golf,愛用する女子プロも増加中!? 元・ドラコン日本王者考案の練習グッズ「ダワ筋スティック」ってどうなの？,https://news.yahoo.co.jp/articles/3bde7c9e9da55f2afc891c5a31cc5b1141efbedc,11/21(火) 20:10
egolf,e!Golf,2〜4位をテーラーメイドが独占！ 1位は不動の「G425」　2023年10月の中古ユーティリティー売れ筋ランキング,https://news.yahoo.co.jp/articles/5989d25ca1988c70f56a1bca85b2a26f83325169,11/21(火) 18:10
egolf,e!Golf,米国女子ポイントランキングが発表！ 最終戦2位タイの畑岡奈紗はじめ日本勢の順位は？,https://news.yahoo.co.jp/articles/e46481809ad62fb5130898721a7396bf4c9dd295,11/21(火) 16:10
egolf,e!Golf,「風任せ」が好結果につながる!? 強風ラウンドでの大崩れを防ぐ「当たり前だけど大事」なこととは？,https://news.yahoo.co.jp/articles/f1c300b72c56a06b088a317f2e6cc5b2a29b5a1e,11/21(火) 14:10
egolf,e!Golf,優勝直後にスゴイ顔ぶれ！ 青木瀬令奈が菊地絵理香＆吉田優利との「念願のご飯」ショットを公開,https://news.yahoo.co.jp/articles/810dd36572a612d24b8088aa97d36383747fbe99,11/21(火) 11:59
egolf,e!Golf,賞金大増額の次は大坂なおみとコラボ!? 世界ツアー創設!? サウジマネーも歓迎する米欧女子ゴルフ界のしたたかさ,https://news.yahoo.co.jp/articles/3c9e5905595c6f95f88f3f9d89bb3cd56ccfce37,11/21(火) 11:10
egolf,e!Golf,厄介なのはビギナーよりも横柄なベテラン？ わが物顔でプレーする“不届き者”に要注意,https://news.yahoo.co.jp/articles/0107a3ff9c818c44c43142926d7555489ba7806e,11/21(火) 10:10
egolf,e!Golf,宮里藍の生涯獲得賞金を7年目で突破！ 畑岡奈紗が今季米女子ツアーで打ち立てたスゴイ記録の数々,https://news.yahoo.co.jp/articles/629248b99cc77488310d58e4a3175f8e76163ebf,11/21(火) 9:10
egolf,e!Golf,青木瀬令奈が今シーズン2勝目で7900万円を突破！ 首位・山下美夢有の獲得総額は？ 最新賞金ランキング発表,https://news.yahoo.co.jp/articles/06e9c43d5fc72a42d42d596a522375931e3207ca,11/21(火) 7:10
egolf,e!Golf,「有言実行すんげえなあ…」 通算5勝を挙げた青木瀬令奈に成田美寿々、櫻井心那から愛と尊敬のお祝いメッセージ,https://news.yahoo.co.jp/articles/2d653461ef019a8d3260abfd1a583d523478be9e,11/21(火) 6:10
egolf,e!Golf,畑岡奈紗は年間女王懸かる最終戦でまたも悔しい最終組　メジャー制覇も目前だったシーズンを2位タイで終える,https://news.yahoo.co.jp/articles/2651d6d2cf087a631d435ac21173f8cbc4cf2fee,11/20(月) 18:48
egolf,e!Golf,ダンロップフェニックスで史上7人目のアマチュア優勝！ 日大4年の「杉浦悠太」ってどんなゴルファー？,https://news.yahoo.co.jp/articles/0bb1fa117ec608d97d5bd0ee307e03c4e443b1e1,11/20(月) 17:10
egolf,e!Golf,逆転Vの青木瀬令奈が11位に浮上！ 国内女子・ポイントランキング　3人に絞られた女王争いのポイント差は？,https://news.yahoo.co.jp/articles/51ea3dbb7d68de789d6362eb167370b8d4fc9d67,11/20(月) 16:10
egolf,e!Golf,安田祐香、桑木志帆ら12人が初シードを獲得！ 堀琴音は「0.35差」で逆転シードならず涙,https://news.yahoo.co.jp/articles/f00535be23a013eec20ebde9d4c5f080f1298909,11/20(月) 14:10
egolf,e!Golf,「2年半ぶりに少しは飲みたい」今季2勝・青木瀬令奈 “酒断ち”“宝塚断ち”で勝ち取った通算5勝目,https://news.yahoo.co.jp/articles/15e011977f5a0e2d88dc8ef829a36beb25ea4c95,11/20(月) 12:10
egolf,e!Golf,「面白すぎて涙が出た！」 小祝さくらがキャディーとの”超低レベル”な紙飛行機対決を公開,https://news.yahoo.co.jp/articles/58360df37ce7b8278b8633e2104576d0c9a05d47,11/20(月) 11:50
egolf,e!Golf,女子ゴルフ今季シード選手の“喪失”は堀琴音、三ヶ島かな、大里桃子ら15人　渡邉彩香はQT回避の選択も!?,https://news.yahoo.co.jp/articles/8c04387d0d39ab0b92e3fd7d799e409778514903,11/20(月) 11:10
egolf,e!Golf,ヤマハの新RMXが登場！ 「P790」アイアンは2カ月連続首位　2023年10月売れ筋アイアンベスト5,https://news.yahoo.co.jp/articles/a752d23f6c91581f041698a89e102385ac0e3399,11/20(月) 10:10
egolf,e!Golf,メンテナンスや接客が悪いのは仕方ない部分もある!? ゴルフ場の良し悪しを決めるのが難しい理由,https://news.yahoo.co.jp/articles/3db837eebd804716f4150016059d3806fe3cd737,11/20(月) 9:10
egolf,e!Golf,廃止するゴルフ場が増加!? トイレのハンドタオル非常識な使い方をする困ったゴルファーとは？,https://news.yahoo.co.jp/articles/b6002896ae8ab61abdb8da85c98ebd82da9be7b4,11/20(月) 7:10
egolf,e!Golf,地クラブならではのコンセプトがスゴイ！ 4層メッキなどこだわり満載のMIRAI「KEYEK」アイアン試打,https://news.yahoo.co.jp/articles/9f454020c9431d5798f1c178b0f35dbeb4b6b52e,11/19(日) 20:10
egolf,e!Golf,元阪神“代打の神様”桧山進次郎がホールインワン達成！ 160人超えコンペでの偉業に「一生の思い出になりました」,https://news.yahoo.co.jp/articles/1d12b26ef0d83ec2285e2c1374885cdab2edf99b,11/19(日) 9:10
egolf,e!Golf,「いい筋肉がつくのにもったいない」 ゴルフ練習やラウンド後の上手なプロテインの摂取方法とは？,https://news.yahoo.co.jp/articles/e743ac56fae7fd60498b82acae6d6527dec2470a,11/19(日) 7:10
egolf,e!Golf,青木瀬令奈が日本ラストゲームを迎えた“戦友”へ惜別メッセージ…葭葉ルミらとの同級生ショットを公開,https://news.yahoo.co.jp/articles/d513c36382956d3ca264134ef019ed94d90764a4,11/19(日) 6:10
egolf,e!Golf,左足下がりのアプローチは“ダフらせる”のが正解!? 成功率が限りなく低い“鬼門ライ”を切り抜けるコツ,https://news.yahoo.co.jp/articles/78bbf6833937f2b8e2c3f38eaaa6f2843e04ad68,11/18(土) 20:10
egolf,e!Golf,第3ラウンドは悪天候による中止で競技は54ホールに短縮…シード権＆年間女王の争いにも注目,https://news.yahoo.co.jp/articles/c51dba3047133fbb6985c6d56c1558eed43d3c3e,11/18(土) 11:56
egolf,e!Golf,ホールごとに旗の色が違うゴルフ場があるの気づいてた？ “ゴルフの聖地”も2色を使い分けている!?,https://news.yahoo.co.jp/articles/557349f2922e0990a81ee7e42ab07555ea46d5f4,11/18(土) 9:10
egolf,e!Golf,年間ランキング80位からの下剋上へ　“優勝しかない”宮田成華が3位タイに浮上 「追い込まれたほうが強い」,https://news.yahoo.co.jp/articles/19268bacfccff27d9d62e92b8a790b3037054fa2,11/18(土) 7:10
egolf,e!Golf,金田久美子、植竹希望、セキ・ユウティンら昨季ツアー優勝者が相次いでシード陥落…次なる戦いはQT,https://news.yahoo.co.jp/articles/66f9a6b2c1585b60f741be82ed6da76d00ce09f9,11/18(土) 6:10
egolf,e!Golf,稲見萌寧の勝利に貢献 「ミズノプロ」新作アイアン3機種を試打比較　技術レベルや飛びだけで選ぶと間違う!?,https://news.yahoo.co.jp/articles/241d792176dd1e9892f7fefbac37ceb91b48fbab,11/17(金) 20:10
egolf,e!Golf,「入れ！ 入れー!!」 20歳・桑木志帆が放った“圧巻”ティーショット…ギャラリーも絶叫の結末に大注目,https://news.yahoo.co.jp/articles/6918cbcbf2ef542d267a45b3c33a692e8f3a5ce5,11/17(金) 18:10
egolf,e!Golf,“謎のネジ”は何？ ローリー・マキロイが未発表ドライバー「Qi10」を使用！ テーラーメイドの24年モデルか,https://news.yahoo.co.jp/articles/063edc0f5666c5fb38b13dcc288851a2c89b85db,11/17(金) 16:10
egolf,e!Golf,金田久美子が9ホール終了後に棄権　現在メルセデス・ランキング63位でシード落ちが確定,https://news.yahoo.co.jp/articles/2f5035fc6480894a7b30dde27c934c1ae6ee9da0,11/17(金) 15:10
egolf,e!Golf,パター練習にはシミュレーションゴルフが最適ってホント!? スコア管理で認識したパットの重要性,https://news.yahoo.co.jp/articles/b82a1f4f3062936650a92dda0bcaef3be45f0ef0,11/17(金) 14:10
egolf,e!Golf,渡邉彩香が今季限りでキャディーとのコンビ解消を報告 ファンからは驚きと労いの声 「本当にお疲れさまでした」,https://news.yahoo.co.jp/articles/2322a269a9c940c9bdfcceaf0dc5c8555e3175f8,11/17(金) 11:52
egolf,e!Golf,「ゴルフをやるために人間はつくられたわけじゃない」 ツアー初の“ママになってからプロ”神谷和奏のワークライフバランス,https://news.yahoo.co.jp/articles/3f4021787c299c65269acbbf1342dc15ced29da8,11/17(金) 11:14
egolf,e!Golf,毎週たくさん球を打っても上達しないのは何が間違っている？ 伸び悩むゴルファーの共通点とは,https://news.yahoo.co.jp/articles/5b736df7af1d153a8c544c636d41a8f592cda0f6,11/17(金) 10:10
egolf,e!Golf,「1人くらい上級者入れろ！」 明らかに経験不足なビギナー“だけ”の組ってありなの？,https://news.yahoo.co.jp/articles/cadc3459f5510a74226cfee85e8d951d9b92d3b6,11/17(金) 9:10
egolf,e!Golf,シード圏内“ギリギリ”49位の川崎春花が圧巻の5連続バーディーで2位発進 「朝からずっと緊張していた」,https://news.yahoo.co.jp/articles/1101528fb0657c93e86c9a501d1c900476e9f658,11/17(金) 8:10
egolf,e!Golf,2オンと直接カップインで2イーグル奪取！ ランク56位・鶴岡果恋が“恩返し”逆転シードへ好発進,https://news.yahoo.co.jp/articles/30ea9b13802cf62f65f663518f8016f68bdd98fa,11/17(金) 7:10
egolf,e!Golf,「微妙」と答えた原英莉花のゴルフの現在地…「感覚の悪さから“勝負”に出られない」と苦悩を明かす,https://news.yahoo.co.jp/articles/5d710ba48ff3da9e92023222f52c060f8ea95866,11/17(金) 6:10
egolf,e!Golf,米女子ゴルフ最終戦が今晩開幕　古江、笹生、畑岡、西村が選ばれし60人の戦いに挑む,https://news.yahoo.co.jp/articles/2df27dce2f01ebef4a5b1efc8d9bea34d4cafcce,11/16(木) 20:10
egolf,e!Golf,ゴルフ歴は関係ない!? ド緊張の上司とのラウンド…ビギナーでも実践できる立ち回りとは？,https://news.yahoo.co.jp/articles/0d79ecabd772c370748295191380bbf4ddde2fe5,11/16(木) 18:10
egolf,e!Golf,シード奪取へ正念場…同組で回る鶴岡果恋＆柏原明日架の連続“イーグル”に拍手喝采,https://news.yahoo.co.jp/articles/6f66d8165d0e57b2dbf35719d9e1233838bb8774,11/16(木) 16:10
egolf,e!Golf,なぜ渋野日向子と西村優菜はラインを読むときグリーン上で両足を広げている？,https://news.yahoo.co.jp/articles/9b2a75c36f0f332cf8598f92a99b9e0b51e25e94,11/16(木) 14:10
egolf,e!Golf,「欠かせない家族のような存在…」 渋野日向子へつづった“盟友”上野菜々子の感動メッセージに反響続々,https://news.yahoo.co.jp/articles/0bb618ff5b09f9e7365d9f118c66d0763d4fabd0,11/16(木) 11:50
egolf,e!Golf,1年半ぶり優勝の西郷真央　約4カ月使ったつかまり系の「パラダイム エックス」ドライバーが復調に貢献!?,https://news.yahoo.co.jp/articles/03e67355e2928bcf38a16bf71dd80241493607ba,11/16(木) 11:10
egolf,e!Golf,ヤマハの新作「RMX」が2機種ランクイン！ 2023年10月売れ筋ドライバーベスト5,https://news.yahoo.co.jp/articles/b8e702ffb66f1b51a317c79ee0b1c36f9f1a95e1,11/16(木) 10:10
egolf,e!Golf,パー3が難しいと感じるのは上級者の証!? ビギナーはパー5を嫌うけど逆転現象はなぜ起こる？,https://news.yahoo.co.jp/articles/08597c500289c7f8b9319bd2224fe16255c953fb,11/16(木) 9:10
egolf,e!Golf,女王への意識は「あまりない」 岩井明愛の敵は“見えない”緊張…初日は山下美夢有、上田桃子との注目組でスタート,https://news.yahoo.co.jp/articles/529e3c008b78d3705df32710b5e7c0e61026ad61,11/16(木) 7:10
egolf,e!Golf,女子ゴルフ年間女王争いも残り2試合　1位・山下美夢有と申ジエのポイント差わずか「9」　岩井明愛も肉薄,https://news.yahoo.co.jp/articles/01fd0177d7cddc736939b6057bec03078be221a5,11/16(木) 6:10
egolf,e!Golf,ミート率をアップできれば簡単に飛距離は伸びる！ 手打ちを防いで芯でとらえる「ピタ止めドリル」,https://news.yahoo.co.jp/articles/a87ee89dc9705a89fde011258459dca60b80fe18,11/15(水) 20:10
egolf,e!Golf,「オーラと迫力が別格」 松山英樹が比嘉一貴ら後輩たちとの“激レア”オフショットを大公開！,https://news.yahoo.co.jp/articles/02ac35553e94628b6d6901bfe8c797d847e8f33d,11/15(水) 18:10
egolf,e!Golf,シード獲得へ崖っぷち…金田久美子は「55位までにはなんとか入りたい」と逆転に懸ける,https://news.yahoo.co.jp/articles/9fbd1cd7559002fdb522ccbfebbea80b8918306c,11/15(水) 16:26
egolf,e!Golf,1個1000円以上のティーが売れているって本当!? 話題の「コントロールゴルフティー」を試してみた！,https://news.yahoo.co.jp/articles/7635891c5ce6e935916c79fdbd45598354092d50,11/15(水) 14:20
egolf,e!Golf,金田久美子が冬仕様の“ミニスカコーデ”披露も冷え込みを心配するファンから「体調に気をつけて」の声,https://news.yahoo.co.jp/articles/0679818bf196b8c1764ed4de1ea1e318dacb1b39,11/15(水) 11:50
egolf,e!Golf,フェアウェイキープ率は25％前後が現実的!? スタートホールのティーショットはなぜ難しいの？,https://news.yahoo.co.jp/articles/4442e4bf3f2daefc957b7a0b5646938736e4a8f9,11/15(水) 11:10
egolf,e!Golf,プロはだいたい白いボールを使ってるけどカラーボールの利点は？ シニアツアーで「見やすい」と評判の色は？,https://news.yahoo.co.jp/articles/b214961735fb144224de9c0296b0be0f24c68b98,11/15(水) 10:10
egolf,e!Golf,27個もヘッドが届く!? ミズノの画期的な新サービス “セルフ”でフィッティングってどうやるの？,https://news.yahoo.co.jp/articles/a71a5a15ddf1ab4fba3d5961cc8dced9cf2d8102,11/15(水) 9:10
egolf,e!Golf,「俺は絶対S」って決めつけてない!? シャフトの硬さをSやRの表記だけで選んではいけない理由,https://news.yahoo.co.jp/articles/b9b0db9f2340ffc7dba3654b4a73dd90a732017a,11/15(水) 7:10
egolf,e!Golf,「激アツすぎます」 反町隆史＆小栗旬＆窪塚洋介の“GTO”3ショットがゴルフ場で実現…興奮隠せぬファンからコメント殺到,https://news.yahoo.co.jp/articles/b1e03e5214f9ce7c9a8a5b6c2843a02fea30e8a4,11/15(水) 6:10
egolf,e!Golf,コースの美しさを再確認!? 「ノンプレー」のゴルフ場イベントはゴルフ人口増加につながる？,https://news.yahoo.co.jp/articles/cea328777f329433c54d3d75cfbc1a38b1a6c8f3,11/14(火) 20:10
egolf,e!Golf,米国女子ポイントランキング発表！ 渋野日向子は無念のシード喪失…最終戦は4人の日本勢が出場権獲得,https://news.yahoo.co.jp/articles/55b7a0a0e5193d56eccc13802d1d3d26c433eb9e,11/14(火) 18:10
egolf,e!Golf,単独2位フィニッシュの木村彩子を支えた“レインウエア” その裏にあったスタッフの奔走に感動の声,https://news.yahoo.co.jp/articles/3da57358d5538acc8a2108fd62eb9ddffb687a1c,11/14(火) 16:10
egolf,e!Golf,濱田茉優がランキングを1つ上げてシード権内の50位に　当落線上の選手たちのサバイバルは最終局面へ,https://news.yahoo.co.jp/articles/2cbc52b53159253f64379b80cb23d46edb70aabe,11/14(火) 14:10
egolf,e!Golf,勝みなみが今季終戦を報告…異国の地で戦ったルーキーイヤーを終えファンからは「シードおめでとう」と労いの声,https://news.yahoo.co.jp/articles/875183ceb390c4fe23bc31427149a5689d4f8024,11/14(火) 11:50
egolf,e!Golf,黄金世代だけ「入る確率」が突出!? 新垣比菜が4度目のホールインワン達成で最年少記録更新,https://news.yahoo.co.jp/articles/28afc7a98a2722e3f7aaaae56c873360530a630b,11/14(火) 11:16
egolf,e!Golf,米・老舗スポーツ誌がゴルフ界に“ナンセンスな提案”　荒唐無稽な半面「一理ある」と思わされる理由,https://news.yahoo.co.jp/articles/17c83a21f9d8675d76c720d9ed21274a48a9fead,11/14(火) 10:10
egolf,e!Golf,失敗が許されない舞台になっている!? 女子プロテストは果たして今のままでいいの？,https://news.yahoo.co.jp/articles/eeda16a5fbdbbd3b4e5f4faff6bf1143d1277b66,11/14(火) 9:10
egolf,e!Golf,昔ゴルフ場の近くで警察がよく検問を張ってたって本当!? ゴルファーはなぜ狙われた？,https://news.yahoo.co.jp/articles/8b6437206710370736ad27b60bb333b8b7c37a63,11/14(火) 7:10
