media_en,media_jp,title_articles,link_articles,date_original
aab,秋田朝日放送,秋田県内は５日の夜はじめごろから大雨となる所がある見込み　土砂災害などに警戒を,https://news.yahoo.co.jp/articles/0c09424dbca5e1dc4a9a3566cc8b51b09675e92a,7/5(金) 12:01
aab,秋田朝日放送,秋田市　新スタジアムの建設場所をめぐり部署をまたいだ庁内の検討会を設置,https://news.yahoo.co.jp/articles/3a11e1d75ad6cd076a1a76fb958dd043ec4b3d58,7/5(金) 12:01
aab,秋田朝日放送,暑さが厳しくなる季節の建設現場の熱中症対策は　ダム工事現場では「熱中症対策車」が　秋田・東成瀬村,https://news.yahoo.co.jp/articles/6523fcee66ef03c5338f0bc771828f4272de7840,7/4(木) 19:06
aab,秋田朝日放送,７月下旬に開幕するインターハイ　秋田市の秋田商業からはレスリングなどで県内最多の４２人が出場,https://news.yahoo.co.jp/articles/227999c9d607f9caef024056c2bf1e74caefa776,7/4(木) 19:06
aab,秋田朝日放送,秋田県の佐竹知事の所得公開　２０２３年の所得は１６８６万円で前の年より９万円増,https://news.yahoo.co.jp/articles/2d5a0f45c1167b2324677d51657ab28948da196b,7/4(木) 19:05
aab,秋田朝日放送,「マイナンバーカード」についてもテーマに　河野太郎デジタル大臣が由利本荘市を視察　秋田,https://news.yahoo.co.jp/articles/cea6a750094df9471b0882fe2381bfbaf6c79660,7/4(木) 18:59
aab,秋田朝日放送,交差点で軽トラックとワゴン車が衝突　軽トラックを運転していた４６歳の男性が死亡　秋田・大仙市,https://news.yahoo.co.jp/articles/bb1841bab862b7106c4983ba256ba05bd18bd3e4,7/4(木) 18:56
aab,秋田朝日放送,秋田・能代市の市道でワゴン車と自転車が衝突　自転車を運転していた秋田市の８４歳の男性が死亡,https://news.yahoo.co.jp/articles/2c05a4bba612d975526aa3d843fb7ee48a6f8867,7/4(木) 11:57
aab,秋田朝日放送,河野太郎デジタル大臣　秋田・由利本荘市で小児科クリニックや市役所を訪問　デジタル技術活用について視察,https://news.yahoo.co.jp/articles/786fdd2ad14d83e89f7ddb3de53d44d06cb52792,7/4(木) 11:57
aab,秋田朝日放送,２０年ぶりの新紙幣「すげぇ」の声も　秋田県内の金融機関でも取り扱い始まる,https://news.yahoo.co.jp/articles/e22b4cfdc4d5556c7738f67b98884525591abc20,7/3(水) 19:11
aab,秋田朝日放送,７０代男性が「ロマンス詐欺」で約１３００万円だまし取られる　秋田・由利本荘市,https://news.yahoo.co.jp/articles/1d118609a92001231f0da2d0c0d04f3a18d146f7,7/3(水) 19:09
aab,秋田朝日放送,地域間のバランスや配置は　秋田県の公立高校の再編をめぐり県議会で議論,https://news.yahoo.co.jp/articles/671d496a1cad9df00ab2118d4d3ddc7662aad79c,7/3(水) 19:03
aab,秋田朝日放送,河野太郎デジタル大臣が秋田へ　医療分野でのデジタル活用の取り組みを視察　佐竹知事と意見交換も,https://news.yahoo.co.jp/articles/f11981b2580db1fd165ad7744a5c6be87319d268,7/3(水) 18:52
aab,秋田朝日放送,５６歳の男性が海に浮かんだ状態で見つかりその後死亡確認　素潜り漁をしていたか　秋田・男鹿市,https://news.yahoo.co.jp/articles/a9cccb81c78e68e62174264ea3e7facd7b8ffaf2,7/3(水) 18:38
aab,秋田朝日放送,２０年ぶりの新紙幣発行　秋田県内でも県内の金融機関へ引き渡し,https://news.yahoo.co.jp/articles/8f001c902056169d529e5c53f9c27a5c6fdd01cb,7/3(水) 12:12
aab,秋田朝日放送,ＳＮＳのやりとりをきっかけに　秋田・大館市の２０代男性が１８９万円分の仮想通貨だまし取られる,https://news.yahoo.co.jp/articles/e464fa0812f21b8ac4dbb7acb96aa1e6ee3f60da,7/3(水) 11:55
aab,秋田朝日放送,バドミントン「シダマツペア」の志田千陽選手　初のオリンピックへ地元の秋田・八郎潟町で壮行会,https://news.yahoo.co.jp/articles/6b337a32dc92f237f828bdb7376afe759e0ad1a0,7/2(火) 19:08
aab,秋田朝日放送,県立循環器・脳脊髄センターの医師確保や経営安定化へ　佐竹知事は秋田大学とさらなる連携の必要性を強調,https://news.yahoo.co.jp/articles/0a04a72f105078b4224b5f5299ccfe9e6102f1a8,7/2(火) 18:57
aab,秋田朝日放送,ホテルで女子児童と性交したとして秋田市の４１歳の男を不同意性交等の疑いで逮捕　秋田,https://news.yahoo.co.jp/articles/6e9a664b76ad04836c0b177261b58e3d763bdd94,7/2(火) 18:54
aab,秋田朝日放送,秋田の新スタジアム　秋田市長の「八橋が一番有力」との発言に佐竹知事「秋田市がどう処理するか見極める」,https://news.yahoo.co.jp/articles/cfb3edef9eb2127a825e8feed4500c20042ad8b0,7/2(火) 18:54
aab,秋田朝日放送,秋田市新屋地区の支援学校の敷地内にクマの足跡か　校庭の脇で複数確認される,https://news.yahoo.co.jp/articles/4ee83848456c6aa27c7a6d1ba165407be9884b37,7/2(火) 18:51
aab,秋田朝日放送,５０年以上運転を続けてきた東北電力の秋田火力発電所　１日に４号機を廃止し全ての発電設備が廃止,https://news.yahoo.co.jp/articles/882f8592697b552ce472aacee483c5194932a5bd,7/2(火) 12:07
aab,秋田朝日放送,秋田市で小学１年の男子児童が車にはねられ大けが　警察は運転していた男を逮捕,https://news.yahoo.co.jp/articles/bee07f15d43d61f157e3e32f9eeb2124e3c6a862,7/2(火) 12:05
aab,秋田朝日放送,八橋案か外旭川案か…新スタジアムはどこに　秋田市6月議会での発言を振り返る,https://news.yahoo.co.jp/articles/1daa2bdf1463d679c011bddf63f755c7f3b11af4,7/1(月) 19:06
aab,秋田朝日放送,新スタジアム建設候補地巡り秋田市・穂積市長「八橋が一番有力」　「選択肢の一つ」より踏み込んだ発言,https://news.yahoo.co.jp/articles/fce5c18d0894c052e4d109762ab28277b7fed003,7/1(月) 19:06
aab,秋田朝日放送,政治とカネを巡り“土下座”にどよめき　自民党秋田県連大会　御法川会長「解党的な出直しをしなくては」,https://news.yahoo.co.jp/articles/81ed1df50fa770d8c7c72a2ab32c8d00d7df7cf4,7/1(月) 19:04
aab,秋田朝日放送,大雨による浸水をいち早く…“浸水センサー”実証実験　去年７月に大雨被害の秋田市では２０カ所設置,https://news.yahoo.co.jp/articles/2599cf0310069368a8ce6ba701c8c1ce2574aac9,7/1(月) 19:00
aab,秋田朝日放送,「路線価」発表　秋田県内最高は秋田駅前通り　１平方ｍ１３万５千円　２年連続の上昇,https://news.yahoo.co.jp/articles/efef4ea7035d33c341ac144be40ce93e7619d4b4,7/1(月) 19:00
aab,秋田朝日放送,自民秋田県連・御法川会長が土下座　政治とカネを巡る問題で強い逆風が吹く中…県連大会で　会場どよめく,https://news.yahoo.co.jp/articles/26ab585dbf3381ab6b988581d87bfefdb2e4543c,7/1(月) 11:57
aab,秋田朝日放送,秋田県内で大雨や暴風　秋田市では風にあおられ１人けが　仙北市桧木内で２４時間降水量２３３ｍｍ,https://news.yahoo.co.jp/articles/0d0ed658fadc443e1e9528909f4e7d81ba3563a2,7/1(月) 11:55
aab,秋田朝日放送,秋田県内は引き続き大雨のおそれ　１日の明け方にかけて土砂災害などに警戒を,https://news.yahoo.co.jp/articles/7c645d9e2094abc65bcc7bcc01afc1d339dd25b4,6/30(日) 18:27
aab,秋田朝日放送,秋田市の千秋美術館リニューアルオープン,https://news.yahoo.co.jp/articles/cabd398b08ebd0b1133fb4ebdd3370e32b75325f,6/29(土) 18:50
aab,秋田朝日放送,消防団員が分団の運営費着服し懲戒免職処分に　秋田・鹿角市,https://news.yahoo.co.jp/articles/d18c6580fc30cb9d73c8254e49e86528cebbf93a,6/29(土) 18:49
aab,秋田朝日放送,秋田出身バドミントン志田千陽選手が五輪初出場報告「シダマツ」でパリへ「メダル取ってもう1度報告を」,https://news.yahoo.co.jp/articles/215ee3ed7549bb5e69e83f53e18955d8905aa0d7,6/28(金) 19:17
aab,秋田朝日放送,イノシシが田んぼの中を歩き回る様子を視聴者が撮影　秋田・にかほ市　県内でも農業被害が相次ぐ,https://news.yahoo.co.jp/articles/0151e90dc69a64d2c32ad6b14b4dc2b968f8cc4a,6/28(金) 18:50
aab,秋田朝日放送,「クレヨンしんちゃん列車」が秋田内陸線に登場！８月末まで毎日運行　車内には愛犬「シロ」が隠れてるゾ！,https://news.yahoo.co.jp/articles/644fe05c399e2bb5087dbcb5ede21eaafa7f98ad,6/28(金) 18:50
aab,秋田朝日放送,県職員に夏のボーナス　秋田　一般職員の平均支給額は８３万９千円　佐竹知事は２２８万１千円,https://news.yahoo.co.jp/articles/3a9a650c862327ee3de751f39ee9f8aaf7a57699,6/28(金) 17:23
