media_en,media_jp,title_articles,link_articles,date_original
tssv,テレビ新広島,「ドラフラ電車」優勝の感動乗せて走る　９月ごろまで広島電鉄宮島線で運行,https://news.yahoo.co.jp/articles/0139e1c547a6dd582b05ccdfda0aed502b65241d,7/3(水) 12:03
tssv,テレビ新広島,「古い紙幣は使えない」「回収する」は詐欺　新紙幣発行に乗じた詐欺防止キャンペーン　広島・呉市,https://news.yahoo.co.jp/articles/53235e956048c7ad854a2d9de4f687457213e07f,7/3(水) 12:00
tssv,テレビ新広島,広島でも新紙幣を金融機関に引き渡し　２０年ぶりにデザイン一新し３日発行,https://news.yahoo.co.jp/articles/59d88c1c3dc7941f4a2d469530e098c4519ee09c,7/3(水) 11:11
tssv,テレビ新広島,迫る『新紙幣』発行　対応に追われるラーメン店店長「客２００人分の改修費にショック」　広島,https://news.yahoo.co.jp/articles/861915d6ba902981e02799771a850611e0768164,7/2(火) 19:01
tssv,テレビ新広島,児童の成績など個人情報ファイルを紛失　担任教師の机ロッカーから　警察に被害届提出　尾道市の小学校,https://news.yahoo.co.jp/articles/2f7116512d30ff2266f0582fb5227c6ab959c191,7/2(火) 18:54
tssv,テレビ新広島,広島県議会　埋蔵文化財センター設計費用１４００万円など　２０議案を可決し閉会,https://news.yahoo.co.jp/articles/b5b32d671e848b4b4aa22ccdf805903c67f4dac3,7/2(火) 18:35
tssv,テレビ新広島,殺し方５００回検索　スズメバチの巣で殺害計画も　”保険金目当て”男子大学生殺害事件の真相,https://news.yahoo.co.jp/articles/9d9fce36b6a0694c7861e5808e8eaafe32ec86fc,7/2(火) 18:33
tssv,テレビ新広島,広島からパリ五輪へ　コカ・コーラレッドスパークス出場選手を激励　２８日ドイツとの初戦に臨む,https://news.yahoo.co.jp/articles/10c08e1e6a951b529dfe5ff82ce882ea715b3e13,7/2(火) 18:06
tssv,テレビ新広島,８月６日「要望聞く会」に向け被爆者団体が協議「日本政府は核禁会議オブザーバー参加を」,https://news.yahoo.co.jp/articles/d00cd909c4b86c7f1f621e89b484378cf5868db4,7/2(火) 18:02
tssv,テレビ新広島,カープ「７月最強男」 は野間峻祥　大暴れしてチーム引っ張る　データからひも解くキーマン,https://news.yahoo.co.jp/articles/b1fe7352daf73a9373f9adfb2565fa602d6a2655,7/2(火) 17:56
tssv,テレビ新広島,「替え玉保険金殺人」と認定　男子大学生殺害した男に懲役３０年判決　「金目当てに人命奪った」広島地裁,https://news.yahoo.co.jp/articles/00bf1e42e9c1f98b883a8b626cb928c35ad70af8,7/2(火) 17:53
tssv,テレビ新広島,大雨のピークは過ぎる　県内の警報は全て解除　土砂災害への警戒は必要　広島,https://news.yahoo.co.jp/articles/6a8f97b77e5a98db6bc252379d56924f7f3d97a6,7/2(火) 17:17
tssv,テレビ新広島,サイバー攻撃受け個人情報流出の恐れ　個人事業税などのデータ１０１件　広島県の委託事業者が被害,https://news.yahoo.co.jp/articles/6c6b227530ee3bfb648af4f28f8b365a7b745c87,7/2(火) 16:08
tssv,テレビ新広島,【速報】男子大学生にアルコール注入し殺害　男に求刑通り懲役３０年判決　広島地裁「替え玉保険金殺人」,https://news.yahoo.co.jp/articles/466d3a6b8b9b53c994d2562aa71cf42946a0579b,7/2(火) 15:04
tssv,テレビ新広島,尾道市職員を加重収賄の罪で追起訴　道路工事の入札で「最低制限価格」漏らす　広島地検,https://news.yahoo.co.jp/articles/e7cac5b28d3708fc34278825ee4f917021494596,7/2(火) 15:02
tssv,テレビ新広島,広島高速道路公社の新理事長に友道康仁氏　二葉山トンネル工事補償「それぞれの家庭の事情を聴いて判断」,https://news.yahoo.co.jp/articles/c3fe6802a450f05749fdbf8dd27d6b5019112bc7,7/2(火) 11:56
tssv,テレビ新広島,【柔道】相手に勝つまで手を抜かない覚悟で全国上位へ  高松慶太くん　（有朋柔道塾）,https://news.yahoo.co.jp/articles/5e31958fb6f9cb85cfe213e62fe197025a448780,7/2(火) 11:00
tssv,テレビ新広島,広島県内は一時、叩きつけるような雨　ＪＲ呉線で一部区間運転見合わせ　土砂災害に警戒を,https://news.yahoo.co.jp/articles/46870ea2c4cf381f8ccd061b33dc5c614fceee08,7/2(火) 10:10
tssv,テレビ新広島,オバマ元大統領が食べた「ブンチャー」　暑い夏にはぴったり　異国情緒たっぷりなベトナムの味をどうぞ,https://news.yahoo.co.jp/articles/def4e0dcea237896ded91dcd07789c2845e21332,7/2(火) 10:00
tssv,テレビ新広島,酒に酔って他人の家の敷地に侵入　庄原市教育委員会職員の男（24）を現行犯逮捕　広島,https://news.yahoo.co.jp/articles/8a8247a2f53932a59895fc940ce06fa23bde3b37,7/1(月) 19:35
tssv,テレビ新広島,【中継】２日の運行状況　運休や速度落としての運転も　ＪＲ西日本,https://news.yahoo.co.jp/articles/5929e31c780db019e479804d7b24eac9bfad37e0,7/1(月) 19:14
tssv,テレビ新広島,海上自衛隊・幹部候補生学校で卒業式　部隊から選抜のベテラン６０人　「最も過酷な４カ月だった」,https://news.yahoo.co.jp/articles/38da2b20696ac72b36cec20472fb00fbdb3a9f4f,7/1(月) 19:07
tssv,テレビ新広島,マツダ　来春卒業予定の学生４８２人の採用目指す　５００人を下回るのは８年ぶり,https://news.yahoo.co.jp/articles/16218a50aa916c29c3598b2fc7375a146a4265e2,7/1(月) 19:04
tssv,テレビ新広島,客の迷惑行為「カスハラ」の実態に迫る 　どう対応すれば… 『毅然と』『助けを求める』見えてきた課題,https://news.yahoo.co.jp/articles/2c9fc735cb30781e6d2bb18d0285c393c9fc02db,7/1(月) 19:01
tssv,テレビ新広島,大雨発生のメカニズムは…「典型的な梅雨の大雨」　今後の広島の雨はどうなる　気象予報士・山本 剛弘,https://news.yahoo.co.jp/articles/eeb48ab270bcb1d263e10cffe2d1f1e61ef8987b,7/1(月) 18:47
tssv,テレビ新広島,被爆者が約６８００人減少　平均年齢は８５．５８歳に　”被爆の実相”どう伝えるのか,https://news.yahoo.co.jp/articles/98561a233ac023cf9cd6b538e5b72779cc5b6615,7/1(月) 18:31
tssv,テレビ新広島,陸上自衛隊海田市駐屯地の女性隊員３人　「上官からパワハラ受けた」　国など相手取り広島地裁に提訴,https://news.yahoo.co.jp/articles/9bdb664a8ef52e14277986cdcf5138152348b7db,7/1(月) 18:24
tssv,テレビ新広島,【大雨の影響】 土砂崩れで通行止め　アンダーパスは冠水　２日も警戒が必要　広島,https://news.yahoo.co.jp/articles/a9442cde92226d384eb4e055fa2cd9f2f3f83cd2,7/1(月) 17:48
tssv,テレビ新広島,新紙幣３日が発行日　「県内の券売機の改修は間に合う」との認識　日本銀行広島支店長,https://news.yahoo.co.jp/articles/28f9b1dbd528e2b394c798f2b99347cbf3c0c836,7/1(月) 17:39
tssv,テレビ新広島,【中継】広島駅発着の電車は全て運休　通勤通学客に大きな影響　夕方やっと運転再開　ＪＲ広島駅,https://news.yahoo.co.jp/articles/8e572f8efbde361aa913367c1fcda066cf88ad79,7/1(月) 17:37
tssv,テレビ新広島,福部真子・女子１００mハードル　悲願のパリ五輪内定　「１年間支えてくれた人に感謝」,https://news.yahoo.co.jp/articles/ba8cca2427531fcec4728fe97f2f38cd14b559b1,7/1(月) 17:34
tssv,テレビ新広島,２日未明に再び強い雨の恐れ　引き続き警戒を　広島,https://news.yahoo.co.jp/articles/d1e40f071801c43f9918c7b175bc27b0b6e0897a,7/1(月) 17:28
tssv,テレビ新広島,6億円の保険金かけた男、ネットで何度も殺し方検索　大学生を”身代わり”に殺害　#ニュースその後,https://news.yahoo.co.jp/articles/74fecc62ef312fbe0feccbf8491ca35dabee2154,7/1(月) 16:00
tssv,テレビ新広島,原爆で死亡したマレーシア人留学生　寺に建てられたイスラム教の墓　初来日の姪「言葉にできないほど感動」,https://news.yahoo.co.jp/articles/f9191f6b50b03f67c4d06c863d066e2a7f32440a,7/1(月) 15:17
tssv,テレビ新広島,【大雨に関する気象情報】これまでの大雨で地盤緩む　土砂災害に警戒を　広島地方気象台1日11:32発表,https://news.yahoo.co.jp/articles/b1de5349a705777d724bb12777503d393b1d1317,7/1(月) 12:56
tssv,テレビ新広島,未明から大雨　各地で土砂崩れ、河川増水　ＪＲ在来線再開は午後以降　引き続き警戒を　広島,https://news.yahoo.co.jp/articles/051c98d5ea01578758eeef044046f2f3f86118e0,7/1(月) 12:01
tssv,テレビ新広島,路線価の平均値３年連続で上昇　県内平均で２．４％、再整備の広島駅前通りは９．７％アップ,https://news.yahoo.co.jp/articles/e49ed524b92b320b02375bcfd0553817c730a4e9,7/1(月) 11:58
tssv,テレビ新広島,道路脇の斜面が崩れるなど被害　広島県南部に一時、土砂災害警戒情報　引き続き警戒を,https://news.yahoo.co.jp/articles/a419e7d47d5b24251e9e9133f137802ab8bb2cea,7/1(月) 11:03
tssv,テレビ新広島,「雨が止んだ後でも土石流発生の恐れ」湯崎知事　災害対策本部会議を設置　警戒を呼びかけ　広島,https://news.yahoo.co.jp/articles/63bb05fc7ae0660168db5f714e64589d99723c2e,7/1(月) 10:06
tssv,テレビ新広島,【大雨に関する気象情報】土砂災害、浸水害、河川の増水・氾濫に警戒を　広島地方気象台,https://news.yahoo.co.jp/articles/f384dd0bc802d3c8656d852e5a537a84541181e8,7/1(月) 9:21
tssv,テレビ新広島,【ＪＲ在来線】広島県内全線で運転見合わせ　福塩線の福山ー府中は午前10時すぎ運転再開見込み,https://news.yahoo.co.jp/articles/4c84fba3eea64d7f317b95a38e284a48d9e0d1eb,7/1(月) 8:57
tssv,テレビ新広島,呉市で戦没者合同慰霊式,https://news.yahoo.co.jp/articles/b33e0901f0cab2b8a1e34098f8fc286c63594dbd,6/30(日) 18:55
tssv,テレビ新広島,安芸高田市長選に新人4人が立候補,https://news.yahoo.co.jp/articles/f2e373d47f8739e502455d0ee7baa2e0fe675f93,6/30(日) 18:45
tssv,テレビ新広島,今夜からあさってにかけ警報級の大雨　土砂災害に警戒を,https://news.yahoo.co.jp/articles/525f8ee3cdb0aa189b7b58d7dd3857958cb4ee05,6/30(日) 18:31
tssv,テレビ新広島,保育士の就職フェア　広島市で開催,https://news.yahoo.co.jp/articles/c6c720627bd3ade851bb2d5d6db153dfcc7662d5,6/30(日) 12:31
tssv,テレビ新広島,バイきんぐ・西村さん アウトドアグッズの店でサプライズイベント,https://news.yahoo.co.jp/articles/9ba3d7da0ce787f93ceb33738b27a3c110cb5d02,6/29(土) 18:16
tssv,テレビ新広島,あれから25年「今も続く祈り」6・29豪雨災害の被災地で追悼のサイレン,https://news.yahoo.co.jp/articles/57777cb3782cf17a1d4463d554c1987b83493c6c,6/29(土) 18:11
tssv,テレビ新広島,日鉄呉跡地活用策　呉市と市議会が防衛相案軸に要望事項を協議,https://news.yahoo.co.jp/articles/348cf3a6b873f39d3c095ca67b40d98222c7f291,6/29(土) 18:08
tssv,テレビ新広島,不審火の可能性も　東広島市で空き家が全焼,https://news.yahoo.co.jp/articles/d722fe5c894558380154fe758bdd5f3a6ceda259,6/29(土) 12:06
tssv,テレビ新広島,広島出身・塚本恋乃葉さん　学園ドラマ出演決定！　新感覚の鬼ごっこで河野アナと対決　勝者はどっち？,https://news.yahoo.co.jp/articles/73ab8d7c25b04c1e966e84207b27235e44527ba0,6/28(金) 20:00
tssv,テレビ新広島,架橋計画撤回から１２年「鞆未来トンネル」貫通　町を二分した４１年の歴史　広島・福山市,https://news.yahoo.co.jp/articles/fe6e824479b007a65252c0fa8b63ccb1b2274c75,6/28(金) 19:18
tssv,テレビ新広島,広島マリーナホップ跡地活用　県が議会に事業計画案を説明　「モビリティ・エンターテインメントの聖地」に,https://news.yahoo.co.jp/articles/3a88d43f8143ede17c64457a781b57d0ada42ffe,6/28(金) 19:11
tssv,テレビ新広島,カープ２８日から巨人戦　戸郷投手と相性がいいのが小園選手　対戦打率．６６７　チャンスに期待！,https://news.yahoo.co.jp/articles/9c636227c11cc8f09a383a5364ceb515e0a86607,6/28(金) 18:59
tssv,テレビ新広島,放射性物質を含んだ「黒い雨」を浴び、はしゃぐ子供たち　原爆の絵に込めた被爆者と高校生の想い,https://news.yahoo.co.jp/articles/54ec080a9daab70ffdfe0e6c34f2b2c655ddff57,6/28(金) 18:44
tssv,テレビ新広島,高校生が描いた「原爆の絵」完成披露会　１７回目を迎え、新たに１６作品が生まれる,https://news.yahoo.co.jp/articles/bd4a95d6d13fe623657fc6cdd27e2576250a8048,6/28(金) 18:37
tssv,テレビ新広島,公務員に夏のボーナス　広島県職員平均５２万４千円　広島市は６１万３千円　去年より２万５千円以上アップ,https://news.yahoo.co.jp/articles/c3f9e70d80d660e18b01065aeda379205dc13855,6/28(金) 18:12
tssv,テレビ新広島,マイニングふるさと　北広島町「ホタルと神楽」安芸高田市「音楽フェス」尾道市「祇園祭・三体廻し」,https://news.yahoo.co.jp/articles/7f84785e6c66cf9f29210e19fb271d41059737eb,6/28(金) 17:55
tssv,テレビ新広島,廿日市市とフランス・モンサンミッシェル市が協定締結　食・芸術・経済分野でも交流進める,https://news.yahoo.co.jp/articles/265a67b7e9133fd68b5e4cb3aa6b90ad7ad2b5a4,6/28(金) 17:52
tssv,テレビ新広島,神辺西中・三好美羽選手　日本選手権女子１００mで準決勝進出　堂々の走り見せる,https://news.yahoo.co.jp/articles/ac3599e6bb0b116d995707f227a335a0b91476e7,6/28(金) 17:48
tssv,テレビ新広島,警察官のサングラス着用「ＯＫ」　紫外線から目を守る　市民との会話時は外し威圧感を与えない　広島県警,https://news.yahoo.co.jp/articles/862bf3f55642a6660cab405274ef691d9af1cb24,6/28(金) 17:42
tssv,テレビ新広島,マツダ認証不正　国が２車種の出荷停止解除「マツダ２」「ロードスターＲＦ」　半年ごとに国交省に報告へ,https://news.yahoo.co.jp/articles/a4c4eb8b1b58c38b70029c62919a99cd24ff6da3,6/28(金) 17:35
tssv,テレビ新広島,「６．２９豪雨災害」から２５年　１０人が犠牲になった河内地区　命を守る取り組み地域で続ける　広島,https://news.yahoo.co.jp/articles/37dc50643917601478e04d8b225c91e851a95e71,6/28(金) 17:29
tssv,テレビ新広島,夫の遺体を遺棄した疑いで逮捕送検の女性（76）を不起訴処分　「情状全般を考慮」広島地検,https://news.yahoo.co.jp/articles/c26d151fd0a1344624722afbae9f97b166692e0b,6/28(金) 15:10
tssv,テレビ新広島,カープ大瀬良大地投手 ノーヒットノーラン達成　２９日からマツダスタジアムで記念展示,https://news.yahoo.co.jp/articles/b3fad4d5d4072c341972c8826941d5216fb38b52,6/28(金) 12:48
tssv,テレビ新広島,カープ小園海斗選手　ＪＥＲＡセ・リーグアワード　５月の月間大賞受賞,https://news.yahoo.co.jp/articles/67542953122590e34731879b746fb8c95f8a4dcf,6/28(金) 11:57
tssv,テレビ新広島,ひと気のない道を走らせ犯行か　広島市のタクシー強盗　逃走３日間は自宅に戻らず転々と…,https://news.yahoo.co.jp/articles/9884caa516c135bbdd87c62be570ada71a1870ce,6/28(金) 11:48
tssv,テレビ新広島,広島県　雨による大きな被害なし　ＪＲ運転見合わせは午後から解消へ,https://news.yahoo.co.jp/articles/0fa65d4cef11bcfccc21967fd50a502349d58498,6/28(金) 10:12
tssv,テレビ新広島,卵黄とホイップクリームが平打ち麺に絡む濃厚カルボナーラ　仕上げのひと手間で超美味しい！　お花屋カフェ,https://news.yahoo.co.jp/articles/6ca33a4f0a65f9c08be7ef0c3871170de27bccc6,6/27(木) 20:30
tssv,テレビ新広島,今季８試合目で初勝利　九里亜蓮投手「苦しかった」　完封５試合目指し「１球１球、魂込めて全力で投げる」,https://news.yahoo.co.jp/articles/b2652c86294192810fdb83c432c1f55ae12dce1a,6/27(木) 20:00
tssv,テレビ新広島,瀬戸内海で実証実験の自動航行船　本格的な商用運航実現へ検討会スタート,https://news.yahoo.co.jp/articles/4bb4f26339c9ea6457ef27c142df5393dfb781fa,6/27(木) 19:06
tssv,テレビ新広島,ミュージカル俳優が病気と闘う子どもたちに歌の贈り物　広島大学病院でオンライン公演,https://news.yahoo.co.jp/articles/39d481c5124a1b4b17f9540b94ae73d7537d1c71,6/27(木) 18:40
tssv,テレビ新広島,マリーナホップ跡地活用　広島県は「トムス」の事業計画案を承認へ　多目的サーキットなど整備,https://news.yahoo.co.jp/articles/9f2775bc6d642e8ca456d1510605b1e8c5f04e1a,6/27(木) 18:36
tssv,テレビ新広島,都会のオアシス「ひろしまスタジアムパーク」８月１日開業　芝生広場に大型遊具、飲食店、サウナも…,https://news.yahoo.co.jp/articles/cc87e2c488a5faf50d77ad6c89b96a5f056b687d,6/27(木) 18:34
tssv,テレビ新広島,サンキューベイビー＃59中川維斗（いと）くん　維は繊維の維「人とのつながりを大切にして」,https://news.yahoo.co.jp/articles/192f1e92ef5312aa44ab36da9a9b60696960bb54,6/27(木) 17:47
tssv,テレビ新広島,人気のブランドトマト「まる豊とまと」の出荷始まる　広島・神石高原町,https://news.yahoo.co.jp/articles/f1c5850f2836ea5ac3690901756dfa40581b3ce6,6/27(木) 17:39
tssv,テレビ新広島,広島県に「大雨と突風・落雷に関する気象情報」　28日未明から大雨に注意　広島地方気象台,https://news.yahoo.co.jp/articles/ca321dea6bb99306332acac85abc899b71e335b6,6/27(木) 17:29
tssv,テレビ新広島,イズミ決算発表「増収減益」　システム障害の影響で約３億円の損失　サイバーセキュリティ体制強化へ,https://news.yahoo.co.jp/articles/34b9793e0c8e76e5d0199c1730bd1fb9e78ce6a6,6/27(木) 17:21
tssv,テレビ新広島,「逃げきれない、もうダメだと思った」報道みて逃走を断念か　タクシー強盗事件で男が供述　広島,https://news.yahoo.co.jp/articles/9e69e4c9da20864c9982aa0c6c8beb01b106c4f9,6/27(木) 17:17
tssv,テレビ新広島,池上彰さんかたり「優良株購入できる」とウソ　女性から５００万円騙し取った疑い　共犯の男を逮捕　広島,https://news.yahoo.co.jp/articles/b0e5cb8492e977ce27dc0ef59f73aa731a2eed5c,6/27(木) 16:07
tssv,テレビ新広島,大雨の影響　ＪＲ呉線、芸備線の一部区間で２８日始発から運転見合わせ　運転再開は午後以降の見通し,https://news.yahoo.co.jp/articles/a027fde0f285dd6a861ed507baa907e9eb4d95df,6/27(木) 14:53
tssv,テレビ新広島,給食費の未納額が２７００万円に　広島市立の小・中学校　黄色の封筒で納付書送る,https://news.yahoo.co.jp/articles/0cb216ac724658f9bb73e51c459a1d5c6617d1ef,6/27(木) 12:11
tssv,テレビ新広島,廿日市市とモン・サン＝ミッシェル市　友好都市提携１５周年を記念　祈りの音楽奏でるコンサート,https://news.yahoo.co.jp/articles/d630e5a087dcb77ec30880328f04af95cba89ec9,6/27(木) 12:08
tssv,テレビ新広島,報道を見て逃げ切れないと思ったか　タクシー強盗事件で容疑者が出頭　事件後の足取りなど捜査　広島県警,https://news.yahoo.co.jp/articles/d82a026273f71814588d8bc0b6e2e320946a94b8,6/27(木) 11:51
tssv,テレビ新広島,小学校の男性教師が「不適切指導」　授業中、児童の頭を押さえつける　広島市安芸区,https://news.yahoo.co.jp/articles/78e981c603d1466126f244b9ed3301e5f3edff1c,6/27(木) 10:56
tssv,テレビ新広島,広電宮島線沿線の魅力　草津駅 “がんす”が自慢「創業明治のかまぼこ店」草津南駅は「公園の中に灯台？」,https://news.yahoo.co.jp/articles/638ada3b230c8c8fb1e4ea63ec164a3b5e87cf6e,6/26(水) 20:00
tssv,テレビ新広島,被爆80年　広島が舞台の映画を製作「TWO IN  HIROSHIMA」日本兵とアメリカ兵の友情描く,https://news.yahoo.co.jp/articles/53e220696738247aa3af6cc6a1cf9e4a9318ecd3,6/26(水) 18:49
tssv,テレビ新広島,新広島駅ビルの商業施設「ミナモア」ロゴデザイン発表　地元出身デザイナーが込めた思い　開業が待ち遠しい,https://news.yahoo.co.jp/articles/1628933b8e084be14938adb9e9f43d0fbefe615e,6/26(水) 18:35
tssv,テレビ新広島,東広島市ＰＦＡＳ問題　専門家が初会合「健康不安の住民へ丁寧に向き合っていく」,https://news.yahoo.co.jp/articles/6702fc1fff655e684fcf8390834e11a9db2663e6,6/26(水) 18:27
tssv,テレビ新広島,広島市 松井市長が原爆養護ホーム「神田山やすらぎ園」慰問　７８歳から１０１歳まで被爆者８０人が入所,https://news.yahoo.co.jp/articles/1630e328fdcc9a3cbc17a7ca0731b9a4d09bdad9,6/26(水) 18:05
tssv,テレビ新広島,広島大学からパリ五輪めざす　新星スプリンター・山本匠真　「広大に金メダルを持って帰りたい」,https://news.yahoo.co.jp/articles/869f90da7e8e0528cfb7d1d4a31f70d34b1194c0,6/26(水) 18:01
tssv,テレビ新広島,災害時に連携を　第六管区海上保安本部と海上自衛隊が合同訓練　潜水士が一緒に不明者捜索,https://news.yahoo.co.jp/articles/18b2c618d315034edbd960ce53a9988939ff04e2,6/26(水) 17:34
tssv,テレビ新広島,中国電力株主総会　脱原発を求める議案を否決　株主は「ムダ金使ってる」「電力の安定供給を」,https://news.yahoo.co.jp/articles/6855adc51395b65c2c3e21fedfc97a94f18e4b8f,6/26(水) 17:22
tssv,テレビ新広島,タクシー強盗　容疑者の男（40）を逮捕　「事件を起こしたのは僕です」公開捜査の中、交番に出頭　広島,https://news.yahoo.co.jp/articles/735971b2546fceabc1cfb25de877c3231eb0fc98,6/26(水) 17:17
tssv,テレビ新広島,「死んだ後に角膜を提供しますか？」　医師が問いかける〝献眼〟　回答は免許証の裏側に,https://news.yahoo.co.jp/articles/92abb241afca1575362544fc987d0ca058c96386,5/18(土) 17:01
tssv,テレビ新広島,「先生、家に帰りたい…」自宅での最期を望む患者、〝在宅医療〟を叶えるかりゆし姿の医師,https://news.yahoo.co.jp/articles/63ebc764382cc92a48b560e1e85dbf3a745518cf,5/3(金) 10:00
