media_en,media_jp,title_articles,link_articles,date_original
ybc,YBC山形放送,ＪＲかみのやま温泉駅に不審なスーツケース…山形新幹線つばさが2時間余り運転見合わせ,https://news.yahoo.co.jp/articles/a75f16c8d1840da40477b94fd43856f43b6720f2,3/15(金) 13:17
ybc,YBC山形放送,「フルーツ・ステーション」巡り…山形県が新年度当初予算案撤回し修正の予算案を再提案,https://news.yahoo.co.jp/articles/cd8acc10c7dc6a19b2f88f3197b7aa8dbc60eff7,3/15(金) 13:11
ybc,YBC山形放送,JRかみのやま温泉駅で不審物　危険物ではなし　運転見合わせの山形新幹線つばさは午前10時40分過ぎに運転再開,https://news.yahoo.co.jp/articles/766fab3aa12932f86ff8f64fbb6c86771a81ba0f,3/15(金) 9:33
ybc,YBC山形放送,山形市のハウスメーカーの施工不備 新たに600棟近く　住宅に住む男性「納得できていない」,https://news.yahoo.co.jp/articles/954739eb35a89601b36c97b62af34ddb12be2a70,3/14(木) 18:34
ybc,YBC山形放送,解説・フルーツステーション整備に向けた新年度予算案否決　山形県は撤回へ,https://news.yahoo.co.jp/articles/a24552db8b975fda46a6e027edd914e73185a34b,3/14(木) 18:26
ybc,YBC山形放送,天童グランドホテル舞鶴荘　東京の企業に売却へ「市の繁栄に役立つ旅館施設を運営する」,https://news.yahoo.co.jp/articles/0629609511928d141da0329c567323947651ac0e,3/14(木) 18:18
ybc,YBC山形放送,ドローンで薬剤散布し未然に防ぐ研修会　過去最悪となった庄内地方沿岸の松くい虫被害,https://news.yahoo.co.jp/articles/cad691a3d7c2a94389e55cf831dd93a6cdcd869c,3/14(木) 18:13
ybc,YBC山形放送,全国品評会で金賞にも輝いたおいしさ　雪国では珍しく高畠町で１年通してトマト栽培,https://news.yahoo.co.jp/articles/bc2dfb3a15bba5aa1c04e8cbb01a29cb848156c3,3/14(木) 18:08
ybc,YBC山形放送,インフルエンザ感染者数16週連続で警報レベル　1週間の感染者数1000人超える　山形県,https://news.yahoo.co.jp/articles/f1bb62a72e2db611224b824e7a2b443f058adeca,3/14(木) 12:33
ybc,YBC山形放送,町民交流施設の使用料62万円紛失…管理責任者4人が負担し町へ入金へ　山形県大石田町,https://news.yahoo.co.jp/articles/5da03610396e7bc909419452b287fc71920c799a,3/14(木) 12:33
ybc,YBC山形放送,モンテディオ山形　Jリーグ・YBCルヴァンカップ1回戦で敗退　J３富山に2対1で逆転負け,https://news.yahoo.co.jp/articles/b04a4a6ba2bc45c658939375a9450f6d3e1bdc4f,3/14(木) 12:24
ybc,YBC山形放送,戦後初　PTSD・心的外傷後ストレス障害とみられる旧日本軍兵士について国が実態調査へ,https://news.yahoo.co.jp/articles/a1ede6b7189fdcf072316cab7bab57b09dc0537d,3/13(水) 18:31
ybc,YBC山形放送,自民党会派の反対多数で否決　山形県のフルーツ・ステーション整備事業の新年度予算案,https://news.yahoo.co.jp/articles/bbeb83dc876f63ec429a2255dffb93979a3cb488,3/13(水) 18:30
ybc,YBC山形放送,公民館に宅配便ロッカー設置　山形市とヤマト運輸の包括連携協定の第一弾の取り組み,https://news.yahoo.co.jp/articles/a905c3607d36b95680a31afc094357a92dc6617d,3/13(水) 18:17
ybc,YBC山形放送,展示するクラゲは100種類に　加茂水族館が2026年のリニューアルに向け安全祈願祭,https://news.yahoo.co.jp/articles/744bb2e8cddb0c5bb40fed6fb567e9ae5bbc45b4,3/13(水) 17:53
ybc,YBC山形放送,山形市七日町の御殿堰周辺エリア　景観重点地区に指定され交付式　自然素材を積極的に利用へ,https://news.yahoo.co.jp/articles/28e532cf7a1169077c56dfb8cdb9ea63c7c820ce,3/13(水) 17:51
ybc,YBC山形放送,「迅速・的確に活動できるよう連携図りたい」鶴岡市の警察と消防が災害対応訓練,https://news.yahoo.co.jp/articles/0f02391e20c14089f1eb7b00c0060ec28aa5abcb,3/13(水) 17:51
ybc,YBC山形放送,「送迎運転手の補助が無いため転倒して骨折」　80代女性が損害賠償1400万円を求め社会医療法人を訴え・山形,https://news.yahoo.co.jp/articles/0e4239784519148f708bd102a650e0cb82feca0c,3/13(水) 13:43
ybc,YBC山形放送,自転車で歩行者をはねて死亡させた男（３１）に罰金70万円の略式命令　山形・米沢簡易裁判所,https://news.yahoo.co.jp/articles/a120c28bd6b6fdab70f107cb5f15e18ae7db7dd4,3/13(水) 11:17
ybc,YBC山形放送,鶴岡市が避難指示の基準見直し　津波注意報発表時　津波堤防より海側にいる人全員が対象に,https://news.yahoo.co.jp/articles/93cf0b25478e2a82a6a697f4ee00d2d27a5f80bd,3/12(火) 18:18
ybc,YBC山形放送,山形県産ラ・フランス　去年の収穫量　平年より2割以上減少　霜被害や夏場の高温など影響,https://news.yahoo.co.jp/articles/c22ae308156539cb313c4bf33fb85db04dd0a245,3/12(火) 18:04
ybc,YBC山形放送,ユニフォームを着てサッカーボールを受け止める　加茂水族館で人気のアシカ「なでしこ」が引っ越し,https://news.yahoo.co.jp/articles/d1272b356ebeb4feeb107f6ef15504b6e5d920fb,3/12(火) 17:59
ybc,YBC山形放送,レモネード販売し小児がん患者を支援　山形県内の高校生の支援プロジェクト　新年度も継続へ,https://news.yahoo.co.jp/articles/d93cc0ae60e149a576770fed32a14912e3313a31,3/12(火) 17:47
ybc,YBC山形放送,山形市七日町の御殿堰とその周辺　景観計画の重点地区に　新築や改築時に色や素材に制限,https://news.yahoo.co.jp/articles/dc3bc45ce17f77030db9b4df64c0df99f31bc346,3/12(火) 17:37
ybc,YBC山形放送,「寄り添うことができる存在に」山形県立保健医療大学で卒業式　コロナ禍の4年間乗り越え,https://news.yahoo.co.jp/articles/96250d35fb4e23bfd66244eb16178793f734e791,3/12(火) 17:32
ybc,YBC山形放送,遊佐町長選告示まで１週間　前町議２人の一騎打ちか　前町長は任期中に病気で死去,https://news.yahoo.co.jp/articles/c251418898bd6fee96e0b82bcd221a10f7c410a3,3/12(火) 12:09
ybc,YBC山形放送,実業団選手がバドミントン教室　NTT東日本山形支店が開催,https://news.yahoo.co.jp/articles/9c281fe74bacee6e1a1db200874617d54fc63e08,3/12(火) 12:08
ybc,YBC山形放送,津波への備え　鶴岡市の沿岸地域で住民組織が独自に取り組む　冬の災害対策も,https://news.yahoo.co.jp/articles/355a7ed76cb1c394405ea731893ba6f175e31d8d,3/11(月) 18:33
ybc,YBC山形放送,東日本大震災から13年　山形市で千年和鐘鳴らし犠牲者を追悼　今も400人が避難生活,https://news.yahoo.co.jp/articles/eb9aef973a575b747cbd7d38a5ed32f30f4c66e7,3/11(月) 18:33
ybc,YBC山形放送,「清風学園」の運営費不適切支出　元副理事長の返還金　施設改修や職員の処遇改善に,https://news.yahoo.co.jp/articles/4adc700b1ad6f08c8bbdfdf9e86764376689b6c6,3/11(月) 18:32
ybc,YBC山形放送,「具体的な目標や効果を」　山形県産果樹の情報発信拠点の整備　山形県議会が集中審議,https://news.yahoo.co.jp/articles/07724f72b1d0bce87c5b7bed90fcb32d27a2d23a,3/11(月) 18:15
ybc,YBC山形放送,314人が避難生活を送る米沢市で追悼行事　被災地の様子や復興の取り組みの写真展も,https://news.yahoo.co.jp/articles/d59eee9d9605be87b95ee4ee795867fa906f1da6,3/11(月) 17:50
ybc,YBC山形放送,手術の際のガーゼ1枚取り忘れ再手術　山形県立中央病院　男性患者の健康状態に影響なし,https://news.yahoo.co.jp/articles/1c64c28cb698f310fbddbc950889c2de496b8689,3/11(月) 17:32
ybc,YBC山形放送,3月11日は「県民防災デー」山形県がホームページで「防災チェックシート」公開,https://news.yahoo.co.jp/articles/bcb31c756bc30f18380b5ea45b54f54966726536,3/11(月) 17:16
ybc,YBC山形放送,パリ・パラリンピックの競泳の日本代表に山形県大石田町出身の斎藤元希選手が内定しました。,https://news.yahoo.co.jp/articles/870804a180a65883c49e10d7a770490c9ec663fb,3/11(月) 12:43
ybc,YBC山形放送,東日本大震災の発生から13年・避難した約1200人が山形県内で生活,https://news.yahoo.co.jp/articles/b2ae8dcd19b93a824aa76456cc73d2fae7357c24,3/11(月) 12:38
ybc,YBC山形放送,【県内プロスポーツの結果】女子バレー・アランマーレは惜敗、男子バスケ・ワイヴァンズは勝利,https://news.yahoo.co.jp/articles/0ffa8834da35c871099b483ef490b07f42ac5a88,3/10(日) 18:23
ybc,YBC山形放送,長井市のフラワー長井線の踏切で軽乗用車がと列車が衝突する事故…けが人なし,https://news.yahoo.co.jp/articles/dd894c93c9525f777a85412d7ce37a9bdd67ed42,3/10(日) 12:45
ybc,YBC山形放送,東日本大震災の発生から11日で13年…山形市の文翔館で宮城県の被災地を撮影した写真の展示会,https://news.yahoo.co.jp/articles/e33a4ef4fc765076cd9fcb66f6beb82b738ff957,3/10(日) 12:16
ybc,YBC山形放送,県内で2月に倒産した企業は7件で負債総額は15億円余りと件数、負債総額ともに前の月を上回った,https://news.yahoo.co.jp/articles/87f6b3538958af0ab45a4099a7528eb1cb7d3187,3/10(日) 12:12
ybc,YBC山形放送,J２モンテディオ　開幕３連勝ならず　横浜FC相手に０ー２,https://news.yahoo.co.jp/articles/a55ffdd4f154d2db4b944b3ccdfb98a7c42c7b4c,3/9(土) 17:38
ybc,YBC山形放送,V1アランマーレ　カップ戦で強豪・久光と大接戦　V1初勝利は・・・,https://news.yahoo.co.jp/articles/8350839917ddb976d8a6627c0b89fa521b7fbf6c,3/9(土) 17:35
ybc,YBC山形放送,山形県地区対抗囲碁大会開幕　各予選会の勝者らが総当たりで激突,https://news.yahoo.co.jp/articles/f94cb7c8680c6ebc44b64425fec8790a8581348a,3/9(土) 11:59
ybc,YBC山形放送,山形県内の有効求人倍率1.3倍　高水準維持も半導体分野で求人数減少　労働局「物価高騰が雇用に与える影響に留意する必要がある」,https://news.yahoo.co.jp/articles/87b580e9427e839893f6b8748eaa52dbcb52db2a,3/9(土) 11:57
ybc,YBC山形放送,東北中央道・山形PAにスマートIC完成　３月２４日開通　山形市の西の玄関口として期待　近くには工業団地、病院、公園,https://news.yahoo.co.jp/articles/9729d1b97d725f749376c139038701efa10bcc05,3/8(金) 18:06
ybc,YBC山形放送,「ルフィ」事件のリーダー格 渡辺優樹容疑者を山形県警が再逮捕　キャッシュカードをだまし取り約40万円を不正に引き出し,https://news.yahoo.co.jp/articles/53801ee445ddc11cfedabe7b1c5a7c36c4e6b4be,3/8(金) 18:05
ybc,YBC山形放送,国宝『上杉家文書』2000点公開　手紙から読み取れる戦国武将たちの関係性とは…　上杉博物館（米沢市）,https://news.yahoo.co.jp/articles/cb8da33923124334732d10c2f8b8b8eb6dcbb5a1,3/8(金) 18:05
ybc,YBC山形放送,山形県議会の議員定数検討委員会　「議員を減らすだけが正しいのか」との意見も,https://news.yahoo.co.jp/articles/a2becc43e124d6dbb2d18293dae569f008d06258,3/8(金) 18:05
ybc,YBC山形放送,山形県内のレギュラー価格182.2円／L　４週ぶり値下がりも全国４番目,https://news.yahoo.co.jp/articles/37007a6482e9360630f03ef211e2d6af84e632c3,3/8(金) 18:04
ybc,YBC山形放送,早くも来年春向けのランドセル販売　加熱する”ラン活”「大切に選びたい」　最新のトレンドは…　GWがピーク,https://news.yahoo.co.jp/articles/d4dd3c8b5ee588737b1ae1e775cf69a9acf5675e,3/8(金) 18:04
