media_en,media_jp,title_articles,link_articles,date_original
wakayamav,テレビ和歌山,ロケット「カイロス」1日前天候判断の結果　明日の打上げ可能　午前11時1分12秒の予定　スペースワン発表　和歌山県串本町,https://news.yahoo.co.jp/articles/3c4d84efac4f0cc1d8001e4ae4b948c2179e187d,3/12(火) 19:03
wakayamav,テレビ和歌山,絶滅したものや絶滅の恐れのある和歌山の海に住む生き物たちの展示　京都大学白浜水族館,https://news.yahoo.co.jp/articles/4b16459381576799d5d9edc1fc382a910bb82d1d,3/12(火) 18:33
wakayamav,テレビ和歌山,ロケット「カイロス」打上げは13日　スペースワン発表　予備期間3月14日〜31日　和歌山県串本町,https://news.yahoo.co.jp/articles/7209f37bb62ea385a99bf1093fa113c50f3cb6d7,3/11(月) 19:46
wakayamav,テレビ和歌山,露出多い衣装の女性ダンサー招く　自民党 川畑哲哉 県議会議員が離党届　和歌山県,https://news.yahoo.co.jp/articles/9f5c9735eac44d04cee272b4aae0a9b27e618862,3/11(月) 19:04
wakayamav,テレビ和歌山,ロケット「カイロス」打ち上げ延期　海上警戒区域に船舶が残留　機体自体に問題なし　和歌山県串本町,https://news.yahoo.co.jp/articles/96844cd8d07954f5cb1e64628c4e3e1f3ba70bda,3/9(土) 18:46
wakayamav,テレビ和歌山,民間初小型ロケット打上げ時間帯　明日の午前11時1分12秒から午前11時17分12秒　見学場は最終準備　和歌山県串本町,https://news.yahoo.co.jp/articles/70f162511fec5549b7fd61ed1bc7c0cb5c80250c,3/8(金) 19:23
wakayamav,テレビ和歌山,人工衛星経由のモバイル通信ネットワーク「スターリンク」等を検討　災害時の通信手段確保として　和歌山県議会,https://news.yahoo.co.jp/articles/065a6e333977c083b5091c7463994fd9ddd7ef07,3/8(金) 18:58
wakayamav,テレビ和歌山,ロケット発射まであと2日　打上げ時間「午前11時1分〜17分」に設定　串本町職員は宇宙服の衣装で案内　和歌山県,https://news.yahoo.co.jp/articles/254b169565e872c2db76b87c28cebbe7d797997f,3/7(木) 19:15
wakayamav,テレビ和歌山,ロケット発射に向け　ロケットまぜそば考案　当日はライブ配信も　和歌山県立串本古座高校,https://news.yahoo.co.jp/articles/cec2e55c60a84c64ff5490e9f9caae5d194cd74b,3/6(水) 20:45
wakayamav,テレビ和歌山,東牟婁地方に夜間中学校　令和8年度の開校を目指す　和歌山県議会,https://news.yahoo.co.jp/articles/6cc2e56452515315a53fe262252d84fcfcda7c47,3/6(水) 20:02
