media_en,media_jp,title_articles,link_articles,date_original
fct,福島中央テレビ,国の許可なく1億1200万円の仮想通貨販売か　中国籍男が初公判で起訴内容認める,https://news.yahoo.co.jp/articles/409093097eb040671519f3043c55b916984ea96f,10/5(土) 11:44
fct,福島中央テレビ,被害女性の通報で警察官が駆けつける…同居女性に暴行した疑いで磐梯町の男を逮捕・福島,https://news.yahoo.co.jp/articles/cce40605dc96e93cab2c12ce23f3ca9c8a5edbf4,10/5(土) 11:19
fct,福島中央テレビ,「復興・再生に全力で取り組む」武藤容治経済産業大臣が福島県の内堀知事と面会,https://news.yahoo.co.jp/articles/1e19e846fe5ab98dfa6d9bc9e1f89ce4c7b492aa,10/5(土) 10:51
fct,福島中央テレビ,行き先は白河警察署？タクシー約5万8000円を無賃乗車か埼玉県の男を現行犯逮捕,https://news.yahoo.co.jp/articles/ba84d3b7532cf2133e4d9a2ff6687e1edb719fc2,10/5(土) 10:10
fct,福島中央テレビ,国内外のトッププロも認める波の良さ　南相馬市北泉海岸でサーフイン大会,https://news.yahoo.co.jp/articles/2c743748d82e3a94bba20e1543320708a47c0987,10/4(金) 18:49
fct,福島中央テレビ,熊が道路を横断…会津地方には「ツキノワグマ出没警報」発令中　福島・会津若松市,https://news.yahoo.co.jp/articles/91c2041cb4fd20e54268431b70ff141edc1cc7c6,10/4(金) 18:15
fct,福島中央テレビ,展示作品は700点以上…世界最大規模のリヤドロ展示販売会　福島・郡山市,https://news.yahoo.co.jp/articles/89b86e9acc77bad93fb6c6e4a6b5399d283f3cf9,10/4(金) 16:21
fct,福島中央テレビ,年賀はがきの搬入始まる…全国の発行枚数は10億7千万枚と去年より約4億枚減　福島,https://news.yahoo.co.jp/articles/1b092a41d499e5dd607e1202fbd94e13f97d6384,10/4(金) 16:20
fct,福島中央テレビ,新しい復興相と環境省が内堀知事と会談「福島の復興・再生に全力を尽くす」,https://news.yahoo.co.jp/articles/75bd898ce3b6b1e23dbfcb0091862ead16e867cd,10/4(金) 16:15
fct,福島中央テレビ,会津にツキノワグマ出没警報　昭和村で男性が熊に襲われ亡くなった事故を受け発令・福島,https://news.yahoo.co.jp/articles/3878ba3c614271f0b20168c75b735f14dacbc02f,10/4(金) 16:00
fct,福島中央テレビ,「今日中に返済しないと大変なことになる」フジワラ、ヤマガミ名乗る男からの電話で…　福島・郡山市,https://news.yahoo.co.jp/articles/9232bfc2fb0b9117b9d8a2518800cbc31359454e,10/4(金) 10:40
fct,福島中央テレビ,福島県内ではことし初の死亡事例…山林で見つかった男性の遺体　熊に襲われたか,https://news.yahoo.co.jp/articles/cee8f676b6a549416d17a56489418a9f8e0b18d2,10/3(木) 21:06
fct,福島中央テレビ,自民党福島２区の支部長に根本拓氏　近く出馬表明　立民も選対会議開き動き活発に,https://news.yahoo.co.jp/articles/c560855b1fb5f50c4c6ba900bcf240ce3782ca10,10/3(木) 19:08
fct,福島中央テレビ,秋を告げる北海道物産展　郡山市で北の大地と海の幸を堪能・福島県,https://news.yahoo.co.jp/articles/cfe9e4e825b3d0a221c974d25c9edde8a6f0ebe5,10/3(木) 19:01
fct,福島中央テレビ,B1昇格のラストチャンス　福島ファイヤーボンズがプレースタイル一新へ・福島県,https://news.yahoo.co.jp/articles/3e58e75c832f66b77621c7819569943715eeea71,10/3(木) 18:57
fct,福島中央テレビ,酒造りの“勘”をマニュアル化　福島県が日本酒日本一に輝くまでの喜怒哀楽とは,https://news.yahoo.co.jp/articles/db187ce50ff1f47480f8c62041f2dcfb038b1037,10/3(木) 18:45
fct,福島中央テレビ,東京電力　本番前の予行演習で福島第一原発の燃料デブリをつかむ映像を公開,https://news.yahoo.co.jp/articles/24514410bd86062cd6ac016f2351854eaf501048,10/3(木) 18:44
fct,福島中央テレビ,気温が極端！うって変わって秋らしい気温に…あったか〜い肉まんはいかが？福島・郡山,https://news.yahoo.co.jp/articles/2e3d76de1c7575ef645b167bd52a88392d2a1a5f,10/3(木) 18:41
fct,福島中央テレビ,被害額は1000万円規模か「決算の時期が近づきバレると思った」勤務先の高齢者施設で横領した疑い　福島・喜多方市,https://news.yahoo.co.jp/articles/9dcd9b115fd6acb63fa50097149e0a156ff2cbc6,10/3(木) 16:54
fct,福島中央テレビ,倉庫に侵入し50円相当の清涼飲料水を盗んだ疑いで男を逮捕　福島・いわき市,https://news.yahoo.co.jp/articles/f0c0ca2c3ae424e25e3ba228b62557ea51c04510,10/3(木) 16:37
fct,福島中央テレビ,野焼きの通報を受けて警察官が現場に行ったら鎌を振り上げられ…福島・いわき,https://news.yahoo.co.jp/articles/cc7108b39e794183b83e84378294060a99776420,10/3(木) 16:30
fct,福島中央テレビ,放火未遂の容疑で女逮捕　空き家の窓ガラスを割り…福島・郡山市,https://news.yahoo.co.jp/articles/0a5c236936a43604e3ed34bf79331ec969a680ec,10/3(木) 16:21
fct,福島中央テレビ,「自分が犯人なのは明らかだが殺意はなかった」元妻の殺人未遂罪に問われた男の初公判,https://news.yahoo.co.jp/articles/af9ec478c1a9763f864e762883037c971af30fb4,10/3(木) 16:06
fct,福島中央テレビ,福島県議会9月定例会が26億円余りの補正予算案を可決して閉会,https://news.yahoo.co.jp/articles/863de75e7675d5db03b6517e32502f57e793d0bd,10/3(木) 15:32
fct,福島中央テレビ,燃料デブリの取り出し中断…不具合があったカメラの電源を入れ直し復旧を確認へ,https://news.yahoo.co.jp/articles/d9eb45d541d785263e15c412bfd1dfb6c3d4bc58,10/3(木) 12:01
fct,福島中央テレビ,福島ユナイテッドがアウェーでカマタマーレ讃岐に1対4で大敗　順位は6位をキープ,https://news.yahoo.co.jp/articles/2cf37b409165858e183809169035ad71ea5226c4,10/3(木) 11:55
fct,福島中央テレビ,【速報】郡山市で住宅火災　近くには林が…消火活動急ぐ・福島県,https://news.yahoo.co.jp/articles/368f01f516dc9a96bdbf8f59761dd7258290caa8,10/3(木) 11:35
fct,福島中央テレビ,【速報】郡山市で建物火災,https://news.yahoo.co.jp/articles/4aeeca163ebfecb0efb92b458f8d89c2a4debc7c,10/3(木) 10:46
fct,福島中央テレビ,子どもの感染に注意！福島県内で手足口病感染者が5週連続で増加,https://news.yahoo.co.jp/articles/437e7423e0ba7cf36feb89bef29a81c576bc7642,10/3(木) 9:21
fct,福島中央テレビ,“結核”正しく知って予防を　医師に聞く・福島,https://news.yahoo.co.jp/articles/f609812570c081dce01e245d8d2494f6140063a6,10/2(水) 18:46
fct,福島中央テレビ,郡山市20人以上の結核の集団感染は2011年以来・福島,https://news.yahoo.co.jp/articles/031130f5ee275cf63fe76e7b700396b7a34c129a,10/2(水) 18:43
fct,福島中央テレビ,地元・会津を盛り上げるため…！ねこが働く駅としてお馴染み会津鉄道・芦ノ牧温泉駅が10月5日（土）リニューアルイベントを開催！さくら駅長が車内放送するお座トロ展望列車も運行へ！,https://news.yahoo.co.jp/articles/f63141da9f9bec4eebef6050242c96f140487d53,10/2(水) 18:00
fct,福島中央テレビ,伊達市で32.6度！10月の観測史上最も暑い日に　福島県の13地点で記録塗り替え,https://news.yahoo.co.jp/articles/78cb3a47fadad5fc64e08a3086ef04d3d98e2782,10/2(水) 17:53
fct,福島中央テレビ,県職員　年収平均で約23万円増か　県人事委員会が勧告・福島,https://news.yahoo.co.jp/articles/f7a13225543414a867c9e34b584f7a5a38cce004,10/2(水) 17:20
fct,福島中央テレビ,【最新】郡山市で“結核の集団感染”　患者との接触者約2700人を調査へ,https://news.yahoo.co.jp/articles/a090a1f9b693b62fb3cfeaf26e2bd20bde9141c7,10/2(水) 15:52
fct,福島中央テレビ,読書のススメ 福島県内の素敵な図書館を紹介…移動する図書館に薬局内の図書館,https://news.yahoo.co.jp/articles/73c6a1d128e289109326699ba34327744d7ba696,10/2(水) 14:37
fct,福島中央テレビ,「食べて応援！白熊勝カレー」白熊関を応援しようと地元須賀川市では応援グルメ登場,https://news.yahoo.co.jp/articles/86c513d76d99162bf5453cdb6fa205e126a2117c,10/2(水) 14:22
fct,福島中央テレビ,10月の暑さの記録塗り替えか？福島市で最高気温32度を予想するなか秋を告げる花が,https://news.yahoo.co.jp/articles/723fd4be6c33f9860e99b49f9bcfc4d2b686d495,10/2(水) 12:06
fct,福島中央テレビ,警察官を名乗る男らの電話…福島市の80代女性が140万円の詐欺被害,https://news.yahoo.co.jp/articles/678359077e8fc4a1e3cb54e84f7eb86cb7640680,10/2(水) 12:03
fct,福島中央テレビ,熊に襲われたか？昭和村の山林で男性の遺体発見　キノコ採りに出かけ行方不明に・福島県,https://news.yahoo.co.jp/articles/d1d5d061c81acd3a3edf45873c7f723d0f6c40e4,10/2(水) 12:02
fct,福島中央テレビ,強盗致傷の疑いで逮捕された男性　不起訴に　福島・会津若松市,https://news.yahoo.co.jp/articles/e96011e41bbc7c92ecafac052164b6876308bb2c,10/2(水) 10:34
fct,福島中央テレビ,イーロン・マスク氏になりすまし　現金だまし取った疑い・福島,https://news.yahoo.co.jp/articles/a048415a06b7dcf10f68a6686f4fe84b11111529,10/2(水) 9:32
fct,福島中央テレビ,次の衆院選　自民元県議・坂本さん　福島4区から出馬表明,https://news.yahoo.co.jp/articles/15db52262e25db77954d7bc7c396f1d25a4853e7,10/1(火) 18:45
fct,福島中央テレビ,「生活に寄り添う政治を…」石破内閣に期待することは？福島,https://news.yahoo.co.jp/articles/8fa6ae04a299c02a66cd0ebde5af98363b103fb3,10/1(火) 18:39
fct,福島中央テレビ,おしゃべり狛犬探訪の旅スタンプラリー　2次元コードを読み込むと人気声優の案内が…,https://news.yahoo.co.jp/articles/5b2420dbbb70c1f2eedeca688ed240b6363c9eeb,10/1(火) 18:16
fct,福島中央テレビ,熊に襲われた可能性も…昭和村の山の中で男性の遺体見つかる・福島,https://news.yahoo.co.jp/articles/95987cacab71d9ba4492698f52d574dccf5a475c,10/1(火) 18:14
fct,福島中央テレビ,福島県産品をPRする番組を衛星放送などで放送　QVCジャパンCEOが福島県を訪問,https://news.yahoo.co.jp/articles/7487353f9fa77552654d67ca1936bc1d3f868c94,10/1(火) 18:07
fct,福島中央テレビ,豪雨災害を乗り越えた只見線「世界一応援される鉄道へ」・福島,https://news.yahoo.co.jp/articles/611f61f1e091b421e967a5ba2e647786d9474534,10/1(火) 17:29
fct,福島中央テレビ,福島銀行　来春初任給を1万5千円アップ　県内地銀3行すべてが初任給＆賃上げ,https://news.yahoo.co.jp/articles/d8eab19fc850827dac26e00bc71048d523298821,10/1(火) 16:44
fct,福島中央テレビ,トラブル抱え知人の家に侵入か　男を逮捕・福島,https://news.yahoo.co.jp/articles/9031dc2fa144664bb329fd40d16aea4b4bb07853,10/1(火) 15:24
fct,福島中央テレビ,道路を横切る熊を目撃・福島西郷村,https://news.yahoo.co.jp/articles/a29d77701c3acc8760d0accc670171e9e3c27515,10/1(火) 14:27
fct,福島中央テレビ,「殺してやる」などと脅迫した疑い…75歳の男を逮捕・福島,https://news.yahoo.co.jp/articles/3377ff86498781cab2b8009cba2cca9470eff364,10/1(火) 14:25
fct,福島中央テレビ,1人の遺体見つかる…伊達市で住宅火災　この家に住む一人暮らしの男性と連絡つかず・福島県,https://news.yahoo.co.jp/articles/571e0c995145fc0307f044397d938f037a043f49,10/1(火) 12:05
fct,福島中央テレビ,福島市ではまだ夏服派も多い10月の衣替え…1日は夏日、2日は真夏日を予想,https://news.yahoo.co.jp/articles/943beeb03e20337963b104674577e3887cd1d7d8,10/1(火) 12:04
fct,福島中央テレビ,指名手配していたマレーシア国籍の男を逮捕　福島市の女性が被害にあった詐欺事件,https://news.yahoo.co.jp/articles/56b7c5cd9978bae04b9fd5798f509ce8538c0132,10/1(火) 12:02
fct,福島中央テレビ,グリコ“全冷蔵品”出荷再開　春には県内でも品薄・福島,https://news.yahoo.co.jp/articles/0c4dbeb2600578b72348363e4ddf1b8e95d9e9ea,10/1(火) 11:03
fct,福島中央テレビ,日本一のステーキとは？田村市「川合精肉店」の店主がコンテストで快挙！家庭で簡単にマネできるコツも伝授,https://news.yahoo.co.jp/articles/686ae6265eeba6605df47c16e74b6047ab4bc4e7,10/1(火) 11:01
fct,福島中央テレビ,燃料デブリ取り出し　カメラの不具合30日も“解消せず”・福島,https://news.yahoo.co.jp/articles/38f5c6655c3a2c8e72c2f2b37d2b72a487b993aa,9/30(月) 19:06
fct,福島中央テレビ,猪苗代湖ボート事故の控訴審“一審は事実誤認”無罪を主張・福島,https://news.yahoo.co.jp/articles/a1ebcefa4bd341ed9317c57c25c0b85c7c0e4d52,9/30(月) 19:03
fct,福島中央テレビ,猪苗代ボート事故“控訴審”始まる　これまでの経緯・福島,https://news.yahoo.co.jp/articles/8fa371ea04a366aac88e08b0ef208cfdbe87b8f9,9/30(月) 19:02
fct,福島中央テレビ,次の衆議院選挙　福島県内の立候補予定者“最新情報”,https://news.yahoo.co.jp/articles/4b634efb41c4f854ebef010aad917329b180b22c,9/30(月) 19:01
fct,福島中央テレビ,郡山市の「愛情館」来店者が555万人達成・福島,https://news.yahoo.co.jp/articles/d58df6e6bc63ff03879d56c6f66a0abf9c9b412b,9/30(月) 18:57
fct,福島中央テレビ,来月２７日投開票“総選挙”　福島県も候補者の調整“急ピッチ”で進む！,https://news.yahoo.co.jp/articles/626089c8ffbba805c7af1e789392af5a88d19c01,9/30(月) 18:57
fct,福島中央テレビ,県産食材の魅力を発信！県職員“手作り動画”でＰＲ・福島,https://news.yahoo.co.jp/articles/f0ac52e866cc56e4cde992133ad91cfe5c1ce9c1,9/30(月) 18:56
fct,福島中央テレビ,アクセルとブレーキ踏み間違えたか…会津坂下で事故・福島,https://news.yahoo.co.jp/articles/6bedfac34b2af5bf9513d903468cc47534044129,9/30(月) 18:48
fct,福島中央テレビ,“街づくりなどに役立てて”イオンが福島市に寄付金・福島,https://news.yahoo.co.jp/articles/2738a80f3a11f91e0c5ab39090368fb216950718,9/30(月) 18:00
fct,福島中央テレビ,夫婦でドライヤーを万引きか…夫は「知りません」容疑を否認　福島・郡山市,https://news.yahoo.co.jp/articles/a69073a4bee399b625de54b172ab4f8728cad3a3,9/30(月) 14:55
fct,福島中央テレビ,内堀知事が自民党の石破茂新総裁に期待…「福島の復興に真正面から取り組んでほしい」,https://news.yahoo.co.jp/articles/cae52347cb7d40388c225e4c0af8745df5dc42df,9/30(月) 12:00
fct,福島中央テレビ,1人少ないながら貴重な勝ち点１…福島Uは暫定で6位に浮上　福島,https://news.yahoo.co.jp/articles/1fc59b0e2923b5db5f99870dd3bd2bf6ffbe9df7,9/30(月) 11:50
fct,福島中央テレビ,いわきFCは栃木とドローで8位…プレーオフ進出圏内の6位との勝ち点差は2　福島,https://news.yahoo.co.jp/articles/51f30ff6f8cf5bf3faa5bddafa38bdac10327735,9/30(月) 11:49
fct,福島中央テレビ,警察官などになりすまし現金だまし取ったか…マレーシア国籍の男逮捕・福島,https://news.yahoo.co.jp/articles/2e762a8bb6c63b52560273f893fdfc04623e47e1,9/30(月) 11:24
fct,福島中央テレビ,須賀川市志茂で起きた火事…身元不明遺体は住民・福島,https://news.yahoo.co.jp/articles/b23cec02b3c8e05995158b3334162ccf3cad7e5e,9/30(月) 11:06
fct,福島中央テレビ,３０日の県内“所々で晴れ間“天気の大きな崩れなく”・福島,https://news.yahoo.co.jp/articles/990e601e71e7080476448d2a035d1fb600527b8e,9/30(月) 10:31
fct,福島中央テレビ,磐越道の通行止めは３０日午前１０時４０分に解除・福島,https://news.yahoo.co.jp/articles/4dbf11711bb41b048d2c259b8dfcaee63fbcf1e1,9/30(月) 10:11
fct,福島中央テレビ,バイクが市道の側壁に衝突　運転の41歳男性が死亡　福島・いわき市,https://news.yahoo.co.jp/articles/ca715bfa083a6737d8b8f36e2ae462a9db2caf84,9/29(日) 19:12
fct,福島中央テレビ,根本匠衆議院議員(73・福島2区)次の選挙に不出馬　「世代交代のうねりが決断後押し」,https://news.yahoo.co.jp/articles/13cbbfe1bb4d4970cb2bd884df0df2bfde2e3966,9/29(日) 17:29
fct,福島中央テレビ,福島県産魚介類「常磐もの」の魅力を発信　新地町でキャンプ料理を楽しむ,https://news.yahoo.co.jp/articles/6a958f2853b14835d3b38da68e19dbda5ffd6832,9/29(日) 17:26
fct,福島中央テレビ,脳卒中などの後遺症「失語症」に理解深める　福島市で全国大会,https://news.yahoo.co.jp/articles/cf33b80455f7a30f9c9a8e017d3c8520d223a4fe,9/29(日) 17:10
fct,福島中央テレビ,稲刈り中コンバインに手を巻き込まれる　指の切断など重傷　福島・会津坂下町,https://news.yahoo.co.jp/articles/5affeaee230afc94703d83b37bee49b573303b38,9/29(日) 14:20
fct,福島中央テレビ,サイクリングイベントに参加中の男性がひき逃げ被害,https://news.yahoo.co.jp/articles/4ebc91118bdc3bd47424c4d50b88a559c911791e,9/28(土) 20:35
fct,福島中央テレビ,スポGOMI甲子園福島県代表　いわき総合高校の生徒らが全国大会へ意気込み,https://news.yahoo.co.jp/articles/6017b82b84bd90eddbbd5a81a76447fc3107d6d6,9/28(土) 17:47
fct,福島中央テレビ,福島市で全国大陶器市　10月6日まで開催　能登半島地震の復興を後押し！石川・九谷焼も人気,https://news.yahoo.co.jp/articles/2dc5b8384d566a7b04e1f163ff6c3c603226c476,9/28(土) 17:41
fct,福島中央テレビ,福島市の路上で倒れている男性　現場状況からひき逃げ事件として捜査　男性は重傷,https://news.yahoo.co.jp/articles/ce36423deff7f228d2e47e1866c9f6268b1932de,9/28(土) 15:51
fct,福島中央テレビ,8歳の息子は目の前で死んだ　猪苗代湖ボート事故4年、癒えない遺族の悲しみと「水上法律の壁」,https://news.yahoo.co.jp/articles/e790b36aa1e1dd34b197aa43fceaf03340ca8126,9/27(金) 17:04
fct,福島中央テレビ,処理水放出きっかけに混乱したホタテ市場、体力削られる加工業者「これほどの影響は想定外」,https://news.yahoo.co.jp/articles/5f74973e274d9ae40421701bc8fdfd7d00fcabc1,8/22(木) 11:01
fct,福島中央テレビ,かつて目の前で魚を捨てられた漁師、処理水放出後の応援ムードに目頭熱く…　専門家は中国の存在影響と指摘,https://news.yahoo.co.jp/articles/dceafbd5767c1d7c7882818b9a145833062466be,8/21(水) 11:01
fct,福島中央テレビ,東京から福島に来た17歳、念願の漁師に　処理水への不安抱えつつ夢追う,https://news.yahoo.co.jp/articles/a4dadba6c40a4a37cdd75e94b5bdbf3effaf5735,8/20(火) 11:00
fct,福島中央テレビ,おびただしい数の死体が浮かんだ――　まぼろしの空母「信濃」、なかったことにされた沈没　#戦争の記憶,https://news.yahoo.co.jp/articles/ecaf724350b459d3feacda5606cdd25502681ccf,8/9(金) 11:04
fct,福島中央テレビ,ミツバチのテーマパークで極上はちみつ尽くし！グランドオープンしたばかりのカフェではあま〜いひと時も！,https://news.yahoo.co.jp/articles/11ed389920b9bbdfb91ea88056f19e7c63917764,8/7(水) 11:57
fct,福島中央テレビ,「虚しい気持ちですわ…」日本の原爆開発に動員された15歳　炎天下に見た希望、今も焼き付く戦争の絶望　#戦争の記憶,https://news.yahoo.co.jp/articles/167348cb49f11a43c154989d39eea6294e219434,8/6(火) 18:06
fct,福島中央テレビ,わずか4秒で人生が一変　後を絶たない高齢者の「踏み間違い」、19歳の2人が死傷した福島県の事故,https://news.yahoo.co.jp/articles/d2b6a4091142a916d6061403b7c0bc3b2d78c55c,5/30(木) 17:00
