media_en,media_jp,title_articles,link_articles,date_original
kyt,京都新聞,【速報】京都市東山区・国道1号　東山トンネル付近の交通規制解除に,https://news.yahoo.co.jp/articles/edc339bdab781f42c27b5e3bace41d1c1e88fafa,11/21(火) 11:22
kyt,京都新聞,同志社大学アメフト部元部員らに懲役3年6月　女性に性的暴行「被害者を蹂躙」、京都地裁判決,https://news.yahoo.co.jp/articles/2d46cc42de8477f4b42e8d70c085ca75915f177d,11/21(火) 10:38
kyt,京都新聞,京都市の復活は高速道路の地下引き込み？　論争必至の大胆提言「このままでは衰退」,https://news.yahoo.co.jp/articles/e8c2f64fbe96fdf74dedaa7e2413fe45decc39e4,11/21(火) 10:31
kyt,京都新聞,虹波とは　写真の感光剤を合成した薬剤、370人以上に投与で9人死亡,https://news.yahoo.co.jp/articles/132a7e99561ca7acc75dc6182bfd6a229bd4814f,11/21(火) 10:02
kyt,京都新聞,【速報】京都市東山区・国道1号　事故の大型クレーン車まだ立ち往生、渋滞3・5キロ,https://news.yahoo.co.jp/articles/d84a94557348a1e6041939f6931eaa5032e75ccc,11/21(火) 9:12
kyt,京都新聞,チームで50点ぴったりを目指せ！　ニュースポーツ「モルック」体験　京都・亀岡,https://news.yahoo.co.jp/articles/4c0c6df2a51f00ef54e301203187d069dc050e99,11/21(火) 7:01
kyt,京都新聞,ボクシングの事故で障害　生存率2％から回復　「ボッチャ」知り人生前向きに,https://news.yahoo.co.jp/articles/70a5f9e81ac78367e84c9fcc046365bd6a0c09b3,11/20(月) 20:32
kyt,京都新聞,虚偽記載で政活費不正受給疑いの市議を不起訴　大津地検,https://news.yahoo.co.jp/articles/8eee09ceec885b69411e9446ab7f9f23c715999a,11/20(月) 18:46
kyt,京都新聞,男子高校生の裸体撮影した49歳会社員男を逮捕　公衆浴場の脱衣所,https://news.yahoo.co.jp/articles/398b7581bc96cd926a01a80bcc107d086178e646,11/20(月) 17:12
kyt,京都新聞,社説：グループホーム　「脱施設」へ質と量を整えよ,https://news.yahoo.co.jp/articles/40a45872bf7132278c04da2f93d72aaed2c14ee5,11/20(月) 16:01
kyt,京都新聞,2つの高校の水泳部員ら連係、心肺停止の仲間の命救う　水に沈む生徒に気付き、引き上げAED,https://news.yahoo.co.jp/articles/e5f0daa372f04ced487b314d6795f09ee00a9c19,11/20(月) 16:01
kyt,京都新聞,山下洋輔さん「ひじ打ち奏法」で花添える　世界的ジャズピアニストが赤れんが博物館の30周年祝う,https://news.yahoo.co.jp/articles/26c23bc36a5b5053fb58223d007503ed559d7cf4,11/20(月) 15:01
kyt,京都新聞,国道1号で多重事故、37トンのクレーン車が車線ふさぐ　レッカー移動困難で渋滞発生,https://news.yahoo.co.jp/articles/0c427d7640be56655c1c6ac454b9bc820ab9a067,11/20(月) 12:52
kyt,京都新聞,京都のイオン「観光利用」で平日の駐車料金は無料　渋滞対策に協力の太っ腹,https://news.yahoo.co.jp/articles/2ad16cd12ddc23251fe44f844b63341392e3181e,11/20(月) 10:31
kyt,京都新聞,国道1号で車3台からむ事故　大型クレーン車が分離帯衝突、破損ブロックが反対車線の車にぶつかる,https://news.yahoo.co.jp/articles/36de9bace2696372b1989fbe13e603ede0645949,11/20(月) 9:42
kyt,京都新聞,客の顔覚えていたコンビニ店員、高齢者の詐欺被害防ぐ　電子マネー購入やめるよう説得,https://news.yahoo.co.jp/articles/6a8663e1cf2d7419584d9fe5b2b32ab75a4879cd,11/20(月) 8:01
kyt,京都新聞,75歳女性の車、踏切進入し電車接触「アクセル踏んだ覚えはない」　近鉄一部運休、けがなし,https://news.yahoo.co.jp/articles/4fc48ea3c8db1d30dfa535baf97f88ea46353331,11/19(日) 21:03
kyt,京都新聞,軽乗用車とトラックが出合い頭に衝突、軽に同乗の80歳男性が死亡　滋賀・近江八幡市,https://news.yahoo.co.jp/articles/2f8c7e09a073e6f36230c5f6f86875bbc766ba85,11/19(日) 18:31
kyt,京都新聞,新型コロナ「5類」半年、縮小進む医療体制　年末年始控え、医師ら再流行警戒,https://news.yahoo.co.jp/articles/0387beb273cce63b50ae5379bc8279f30f3cb044,11/19(日) 18:31
kyt,京都新聞,猟犬3匹が民家に入り込み住人襲う　52歳女性が軽傷、飼い犬にも深い傷,https://news.yahoo.co.jp/articles/f3acc6f8afaa7a5cdd9d70512d9f79fb38445eb0,11/19(日) 18:16
kyt,京都新聞,社説：アウティング　重大な人権侵害との認識を,https://news.yahoo.co.jp/articles/8ccc5cf2ec9099936bf9fe23905a7cff1bda1c41,11/19(日) 16:57
kyt,京都新聞,旧海軍・舞鶴鎮守府ゆかりの戦没者弔う　京都・舞鶴の舞鶴海軍墓地で慰霊祭,https://news.yahoo.co.jp/articles/e363bbdda645e88f04ae4c80d7dbd4bc50aa70b7,11/19(日) 14:02
kyt,京都新聞,躍動感あふれる踊りで観客を魅了　京都・宇治で宇治田楽まつり,https://news.yahoo.co.jp/articles/0b138b9e1a4fb2afb94c29aeaaff00939fd8dbbe,11/19(日) 12:02
kyt,京都新聞,名物の餅「うばがもち」作り方学ぶ　滋賀・草津の小学校で出前授業,https://news.yahoo.co.jp/articles/e18c87f112af75009aa659f967817826e522ca36,11/19(日) 11:02
kyt,京都新聞,病院の救急車をクラウドファンディングで買い替え　職員奔走3000万円集まる,https://news.yahoo.co.jp/articles/bb402ebc4d1b807ae0142f44d2fbd7badb89d039,11/19(日) 10:31
kyt,京都新聞,「地元の山の豊かな自然を知って」京都・亀岡の牛松山散策の催し,https://news.yahoo.co.jp/articles/7604991800376773d4192006ac7ba9512cfe028b,11/19(日) 10:01
kyt,京都新聞,タイの少女舞踊団が優美な伝統舞踊を披露　京都・向日市の小学校で児童と交流,https://news.yahoo.co.jp/articles/b2984c1c444de17dcb60000a0a8587536d4a9e39,11/19(日) 9:02
kyt,京都新聞,琵琶湖でヨット4艇転覆、男女8人投げ出される　2人が低体温症疑いで搬送,https://news.yahoo.co.jp/articles/01971e34ce05b117e28df823d6580b7a7bad7917,11/18(土) 19:06
kyt,京都新聞,洋菓子やアクセサリー並ぶ　京都・舞鶴の赤れんがパークで「赤れんがバザール」,https://news.yahoo.co.jp/articles/a925fd0a3aaf55f7f313a86c9c978cd63bd413b6,11/18(土) 18:57
kyt,京都新聞,サンガスタジアム京セラの観客動員数を増やすには？　中学生が誘客案を社員に披露,https://news.yahoo.co.jp/articles/3aab4496213a92e80a1f4688c2b3149e608a54b8,11/18(土) 17:48
kyt,京都新聞,京都サンガのコーチが指南、親子サッカー教室　「お父さんに負けたけど楽しかった」,https://news.yahoo.co.jp/articles/7476bb4a7ed091edd6305defd86a63dc2cb85903,11/18(土) 17:32
kyt,京都新聞,JR湖西線が近江舞子ー近江塩津で一時運転見合わせ　強風のため,https://news.yahoo.co.jp/articles/88d552ac40cd549ec4ecc29aca73355ce5bd3681,11/18(土) 16:54
kyt,京都新聞,社説：国立大法の改正案　学問の自由脅かす管理強化,https://news.yahoo.co.jp/articles/933c49cf31c53578b2919a52ac0482e8ce0e0524,11/18(土) 16:01
kyt,京都新聞,JR湖西線の近江舞子ー近江今津駅間、18日夕から夜に運転見合わせ　強風のため,https://news.yahoo.co.jp/articles/1479b1ae66c48f9e4309757f231700c9e1df4fb9,11/18(土) 15:18
kyt,京都新聞,Vチューバ―、ふるさと納税PRします　京都の専門学生が返礼品モチーフにデザイン,https://news.yahoo.co.jp/articles/d1ff9f04edee817b317920a2457b48a32b7e8da0,11/18(土) 15:01
kyt,京都新聞,「刃物を下ろせ」暴漢役に警告　JR西日本、相次ぐ列車刺傷事件受け緊迫訓練,https://news.yahoo.co.jp/articles/a6fd0038157e8f79b007277d4c314015b1ac9d24,11/18(土) 13:31
kyt,京都新聞,ショッピングモール誘致、バス増便を　「中学生議会」で生徒が質問、町議の答弁は,https://news.yahoo.co.jp/articles/b6f92d925bc06398b789c504b80f08154454d825,11/18(土) 12:02
kyt,京都新聞,移植へ旅立つ臓器に「いってらっしゃい。頑張って」　ドナー遺族に寄り添う仕事とは,https://news.yahoo.co.jp/articles/89151b4af5db1629cc3517b8b20352f7f477a28b,11/18(土) 10:31
kyt,京都新聞,「18歳トリオ」メダル5個獲得　全国障害者スポーツ大会「大舞台で結果、自信に」,https://news.yahoo.co.jp/articles/19fc8429a4460571be7703b8ccd3cdb363fa78e1,11/18(土) 9:02
kyt,京都新聞,林業者と「いかだ師」対立？嵐山や保津峡も登場　京都・南丹で水運の歴史特別展,https://news.yahoo.co.jp/articles/7502373f34781f815bb0d96d93567b09071f4576,11/18(土) 7:32
kyt,京都新聞,予約取り消したのに利用料を誤徴収　滋賀県のスポーツ施設、条例根拠なくキャンセル料設定,https://news.yahoo.co.jp/articles/99413bfcd558907d2e9e7f508c59a04d61f8462e,11/18(土) 6:01
kyt,京都新聞,信楽焼の置物製作ピーク　2024年のえとは「辰」親子ほのぼの,https://news.yahoo.co.jp/articles/b282f454f35a0b56c38ed5fe07912a5f21171f84,11/17(金) 18:57
kyt,京都新聞,京都の名神高速道路上り線でトラック火災　高槻JCT―大山崎JCT、一時通行止め,https://news.yahoo.co.jp/articles/0dff92160b45b813ba4460ac4953ebb7ad693eef,11/17(金) 18:16
kyt,京都新聞,SNS広告「いいね押せば報酬」　アルバイト女性、310万円だまし取られる,https://news.yahoo.co.jp/articles/9cd1015a63578d56c4f00fe157871aa6d758271d,11/17(金) 18:16
kyt,京都新聞,逮捕の警部補、万引き容疑で8月に書類送検　京都府警は公表せず,https://news.yahoo.co.jp/articles/f14ae286e3b254dd9727bc84e123753b4197cffb,11/17(金) 18:02
kyt,京都新聞,社説：米中首脳会談　緊張緩和につなげねば,https://news.yahoo.co.jp/articles/6406b922736a2d1f4e34c0357e127ed842cb63c5,11/17(金) 16:06
kyt,京都新聞,東近江市長の「フリースクール否定」発言　「子どものために」隣の市の25歳は動いた,https://news.yahoo.co.jp/articles/32084f1779b48caf1f812954138adb413e80cc0c,11/17(金) 16:02
kyt,京都新聞,社説：クレカ不正利用　新手口の脅威に対処を,https://news.yahoo.co.jp/articles/f8cd21cfa3ee564615a68634831ae6c88dbb6347,11/17(金) 16:02
kyt,京都新聞,逮捕の警部補、数年にわたり捜査費流用か　捜査中に民家で窃盗疑い、万引きも供述,https://news.yahoo.co.jp/articles/f42acc90183f8c89dbd162d69a34eb51467e7b37,11/17(金) 14:31
kyt,京都新聞,京都市の民間保育園の3割が赤字決算　補助金減額で、保育士の給与引き下げも,https://news.yahoo.co.jp/articles/aedc9c52fbd22594dc95383412eb7feccfa53cc9,11/17(金) 11:02
kyt,京都新聞,白昼に大型トラックがひき逃げ　86歳女性が死亡、容疑の運転手逮捕,https://news.yahoo.co.jp/articles/341db8bd75fe642322ade4f15a7d66245850736a,11/17(金) 10:31
kyt,京都新聞,世界大会で「最小の力士」が銅メダル　養護学校教員「次は世界一に」,https://news.yahoo.co.jp/articles/8d4fb3d3f054ef1a4fb45b4d56e20422737580fd,11/17(金) 9:54
kyt,京都新聞,ベトナム人の20代女性2人に不法就労あっせん　容疑で男女3人逮捕,https://news.yahoo.co.jp/articles/d853f070a52b90bff81214eab6b6822e4cb22d13,11/17(金) 9:32
kyt,京都新聞,亀岡署が大地震で庁舎使用不可の時、機能はどこへ？　緊急時の対応訓練,https://news.yahoo.co.jp/articles/f72dc12ce80c63a46974d7ba8966d5500d20ffac,11/17(金) 7:02
kyt,京都新聞,京都府警の警部補、1千万円超の窃盗か　捜査先で死亡者の現金や認知症高齢者狙い,https://news.yahoo.co.jp/articles/0e5b08be9cf869060f7d0d9e95f74050f9da1f7e,11/17(金) 7:02
kyt,京都新聞,京都の路上で86歳女性が倒れているのを発見、死亡確認　ひき逃げか,https://news.yahoo.co.jp/articles/316240c6b974e18d6d31acce2e5080cb9ba34683,11/16(木) 21:32
kyt,京都新聞,京都で88歳運転の乗用車が電柱に衝突、女性は死亡,https://news.yahoo.co.jp/articles/94047b6125bc2e31cc49320dea00213ff60a3ab9,11/16(木) 19:46
kyt,京都新聞,京都の堀川通で無免許ひき逃げ、トラック運転の28歳男を容疑で逮捕,https://news.yahoo.co.jp/articles/62e6b9b6a455ee35d8f87870a24e14d40d2869a5,11/16(木) 19:39
kyt,京都新聞,「湯につかった状態で眠る様子を撮影」3歳児を浴槽に放置、溺死させた29歳男の初公判,https://news.yahoo.co.jp/articles/debb4ddf02e0f36b03fe98592fa7b56ec9c41c9d,11/16(木) 19:09
kyt,京都新聞,寝たきりだった82歳妻を承諾得て殺害、84歳男に有罪判決「短絡的で身勝手」,https://news.yahoo.co.jp/articles/61385a65ea9819d30b9d739979832059b77c5922,11/16(木) 18:51
kyt,京都新聞,「性欲満たす道具のように」元教え子少女2人と性交した元教諭に有罪判決,https://news.yahoo.co.jp/articles/3a60282ec471845a4091692a877e3fc8af1c0698,11/16(木) 18:42
kyt,京都新聞,中学1年の娘に暴行、骨折疑われるけが負わせる　38歳男と妻を容疑で逮捕,https://news.yahoo.co.jp/articles/b327733a66dfb3133878d326480c2706292fff08,11/16(木) 18:01
kyt,京都新聞,京都・桂川で見つかった身元不明遺体、55歳の女性と判明,https://news.yahoo.co.jp/articles/a3cce8e22af3b1c5e3082476b0ca1f79a7ee2e59,11/16(木) 17:18
kyt,京都新聞,社説：宝塚劇団員の死　真相解明にはほど遠い,https://news.yahoo.co.jp/articles/7f7976e7fc7428468f4070587b14713b31291c1c,11/16(木) 16:06
kyt,京都新聞,社説：補正予算案　不安を高める借金膨張,https://news.yahoo.co.jp/articles/2ea80af0457fa16fefa6426a33241c2ee6b007d0,11/16(木) 16:01
kyt,京都新聞,犯罪やめて「絵だったら表現できる」就労移行支援施設利用者がポスター　警察署長から感謝状,https://news.yahoo.co.jp/articles/0ea74d3c6dc1d57a8761f296c72d0d0b14074b9b,11/16(木) 15:24
kyt,京都新聞,大都会NYマンハッタンで採れた蜂蜜はどんな味？　養蜂家が講演、来場者に振る舞う,https://news.yahoo.co.jp/articles/750f985247da7c7cdadda257d72513d539f3aca4,11/16(木) 14:27
kyt,京都新聞,【速報】交通機動隊の警察官が高速道路を165キロで走行か　道交法違反疑いで書類送検,https://news.yahoo.co.jp/articles/0d0c1a82248318fc69cb440a3e2dbaf465c3d5b2,11/16(木) 13:31
kyt,京都新聞,学生が驚いた日韓の看護の違いとは　韓国の学生が舞鶴の学校で実習,https://news.yahoo.co.jp/articles/277e43c7e0d7cfea1a66f6af5ce5f672312bfaaa,11/16(木) 13:01
kyt,京都新聞,遺体捜査の関係先から10万円盗む　容疑で京都府警警部補を逮捕,https://news.yahoo.co.jp/articles/4076a970f6549ee9ea8cac88bcf3e62c87a7257e,11/16(木) 12:39
kyt,京都新聞,複数女性盗撮疑いで京都府警巡査部長を書類送検　「性的欲求を満たすため」,https://news.yahoo.co.jp/articles/1c54c3578b69b47b54be443bedeffcf5c02b70ca,11/16(木) 11:42
kyt,京都新聞,ここまでやる？財政難の京都市が目を付けたのは「土砂売却」　庭園用で名高い「白川砂」一体いくらに？,https://news.yahoo.co.jp/articles/15712f6953561a08cd78daaf9b6997541f602b49,11/16(木) 10:32
kyt,京都新聞,こどもや障害者の権利テーマ、人権まつわる本150点並ぶ　滋賀県立図書館で資料展,https://news.yahoo.co.jp/articles/a50bffeed57a8ebf2c80500fc09af770b79045cc,11/16(木) 10:02
kyt,京都新聞,ごみ処理場の男性職員が同僚に刺され重傷　殺人未遂の疑いで緊急逮捕,https://news.yahoo.co.jp/articles/1cc1df8ea7f3a66245c7f24c8c97ad039ff4f9d5,11/16(木) 9:32
kyt,京都新聞,「まよなかのおしっこ」原画展　お化けにおびえ、一緒にダンス　柔らかタッチ　京都・向日市,https://news.yahoo.co.jp/articles/d3d9f95c390d43aeb31793e7d9ee844d8051195f,11/16(木) 8:01
kyt,京都新聞,ようやく見頃「菊花展」330点を展示　赤色小ぶりな「初日の出」も　京都・京丹波,https://news.yahoo.co.jp/articles/23773a025b8f9a4a4c62b46cb88dd8b9824fcbde,11/16(木) 7:02
kyt,京都新聞,オートバイとミニバイクが衝突、警備員男性が転倒し、死亡　京都市中京区の丸太町通,https://news.yahoo.co.jp/articles/19cb633cdb2ba412e2b994975e5cee58f7f2a21f,11/15(水) 20:17
kyt,京都新聞,架空のFX持ちかけ現金だまし取る　容疑で中国人の男2人逮捕、現金は人民元に換金,https://news.yahoo.co.jp/articles/c19122cc1b2e861034aa017dac8121ef8c614a9b,11/15(水) 20:03
kyt,京都新聞,4400万円分だまし取られる　整骨院経営者、マッチングアプリ介し暗号資産の投資話に,https://news.yahoo.co.jp/articles/48a6a3c66e6740c7983eb00f4eaa74a71ad0aed9,11/15(水) 19:54
kyt,京都新聞,屋根補修中の塗装工男性が転落死か　別の作業員「大きな音」聞く、地面に倒れ発見,https://news.yahoo.co.jp/articles/15175d2fef3bf78ed46532638b06f86c09f97d93,11/15(水) 19:46
kyt,京都新聞,「ムラムラしてます」13歳女子中学生にSNSで面会要求し乱暴か　通信制高校生を逮捕,https://news.yahoo.co.jp/articles/5dbcdc79b1bbaf929ddf0fe5272457fc541fcd60,11/15(水) 19:31
kyt,京都新聞,現金計750万円を無利息・無担保で借りたか　栗東市元部長を収賄罪で追起訴　大津地検,https://news.yahoo.co.jp/articles/2cd3f6e1d928db108a072bbd2ad56f6acf2dab76,11/15(水) 18:57
kyt,京都新聞,京都・祇園キャバクラで接客女性を押さえつけ、胸触る　容疑で会社役員の男を逮捕,https://news.yahoo.co.jp/articles/0d9d47c726ef5e0b42eedffbb920aa59b6270dfc,11/15(水) 18:48
kyt,京都新聞,「この仕事やらんでええ」係長級女性に罵声、市役所部長級職員をパワハラで懲戒,https://news.yahoo.co.jp/articles/6372b44937bbac286ee8498877730401ef559d2a,11/15(水) 18:12
kyt,京都新聞,社説：辞任ドミノ　政治不信が募る一方だ,https://news.yahoo.co.jp/articles/3c8d2b9a5509c5a55f12f9d85ce364d4b7f689c9,11/15(水) 16:32
kyt,京都新聞,【速報】特殊詐欺疑い、指示役の男逮捕　「少し考えてから話す」などと否認,https://news.yahoo.co.jp/articles/2e8df036773db66694275fb0be025f979b376561,11/15(水) 16:01
kyt,京都新聞,社説：八幡市長選　問われる公約の実行力,https://news.yahoo.co.jp/articles/e560a165bdcc9e394b05c657e3127a440f886c0c,11/15(水) 16:01
kyt,京都新聞,飲酒運転発覚免れ逃走、容疑の女子短大生を書類送検「祇園のバーで客と酒を飲み帰宅中だった」,https://news.yahoo.co.jp/articles/b2f4f016e909f01b1369cbb15f4071124b35a7ba,11/15(水) 14:27
kyt,京都新聞,「トンネル水槽」の展示復活へクラウドファンディング　滋賀・琵琶湖博物館,https://news.yahoo.co.jp/articles/e922b3b5ce74e2eff9a3f1c2330b864373f25c42,11/15(水) 14:17
kyt,京都新聞,「丹波漆」の魅力に触れる　京都・福知山で漆液採取や植樹を体験,https://news.yahoo.co.jp/articles/55d2827ba0edd128651262460497b77156c6729b,11/15(水) 13:54
kyt,京都新聞,牙をむく怪物、火災の怖さ伝える　京都・京丹後の「防災図画」で特選,https://news.yahoo.co.jp/articles/b0dc9cb2fb1ce4c66119ffc681598cec40520610,11/15(水) 12:57
kyt,京都新聞,女性・高齢者への虐待「なぜ起こる、どう防ぐ」　社会福祉士らがセミナー,https://news.yahoo.co.jp/articles/c92502911d4b431f39ee2f58527fb7cd0812a283,11/15(水) 11:06
kyt,京都新聞,漢字変換、フォント変更どうするの？　デジタルに戸惑う高齢者救え、シルバー人材センターの試み好評,https://news.yahoo.co.jp/articles/3b5dfc12421c700baf2ecd9da022fe54b8c1dd6c,11/15(水) 10:31
kyt,京都新聞,グッズ販売サイトからクレカ情報盗んだ疑い　全国初摘発、公式サイトに不正仕掛ける「ウェブスキミング」,https://news.yahoo.co.jp/articles/019e278f6f1df5e59a2068baad285e2efbd365c4,11/15(水) 9:33
kyt,京都新聞,都会の園児ら、京都・美山で「合宿」　田んぼ駆け回り枝豆の茎で工作楽しむ,https://news.yahoo.co.jp/articles/0288243e94929aa5b6e65df40544a9a371f75e0a,11/15(水) 8:02
kyt,京都新聞,選手の契約書を改ざん、B2滋賀レイクスがスタッフを処分　年俸上限超えるミス隠そうと,https://news.yahoo.co.jp/articles/bc38668e76ea91a95b6a0587cbd030f874869125,11/14(火) 22:24
kyt,京都新聞,暴力団が「示談を強要」と認定、慰謝料支払い命令　みかじめ料巡り京都地裁,https://news.yahoo.co.jp/articles/34085aaf35ed244dbf9f2bded1343a8be5c47a84,11/14(火) 21:32
kyt,京都新聞,59歳男性、アプリで知り合った「女」に1億4700万円だまし取られる,https://news.yahoo.co.jp/articles/5a04f727415f79bd9fea79cda2116f3dde44fefa,11/14(火) 20:39
kyt,京都新聞,「長時間労働や雑用でうつ病」女性に労災給付不支給の労基署処分は違法　京都地裁,https://news.yahoo.co.jp/articles/ddfaf38b9803df6f188ddba7255ba648f964e68a,11/14(火) 19:42
kyt,京都新聞,京都・滋賀で多人数に覚醒剤密売、男2人に実刑　「違法薬物の害悪を社会に拡散」,https://news.yahoo.co.jp/articles/9eaec4b724b2b38d60b29106fb9520ac254a91a5,11/14(火) 19:31
kyt,京都新聞,京都の国道178号で落石が道ふさぐ　伊根町ー京丹後市間の4キロ通行止め,https://news.yahoo.co.jp/articles/49fe5032c5c373ccbf1929eaf9fc609da97ab103,11/14(火) 19:12
kyt,京都新聞,メンズエステで性的サービス提供疑い、48歳女を逮捕　京都の性風俗店禁止区域,https://news.yahoo.co.jp/articles/01c5b9817f157175f7839150d92a625787ac575c,11/14(火) 18:33
kyt,京都新聞,障害ある10代女性に性的暴行疑い、49歳男を再逮捕　心神喪失状態に乗じ犯行か,https://news.yahoo.co.jp/articles/18a15a763d9b7f9e5c58347522c00a926684c03a,11/14(火) 17:39
kyt,京都新聞,滋賀・近江八幡市の課長補佐を逮捕　ドラッグストアで耳かきなど盗んだ疑い,https://news.yahoo.co.jp/articles/27a0f08ef8355820e77c8477032c0d89f404150e,11/14(火) 17:24
kyt,京都新聞,社説：出自を知る権利　尊重すべきは子どもの意思,https://news.yahoo.co.jp/articles/01ad34408700ca5c4353fdcff0b0e2361ac91ae0,11/14(火) 16:01
kyt,京都新聞,京都新聞の外部執筆者の寄稿コラム5本、日本経済新聞などから盗用　記事取り消し,https://news.yahoo.co.jp/articles/61199f455a944191149815c43363131309cd4e95,11/14(火) 15:27
kyt,京都新聞,京都の伝統野菜「えびいも」子孫繁栄の象徴　農家が栽培ノウハウ学ぶ,https://news.yahoo.co.jp/articles/d2e7d42d90387501bfd08ef69318fca95fbf211d,11/14(火) 15:02
kyt,京都新聞,「シャイニングヴィーナス」の中学生2人に栄誉賞　笑顔で「うれしすぎる」,https://news.yahoo.co.jp/articles/8a24e5d2a3fe5045a373bc334ea9e96ce0f10dd3,11/14(火) 14:01
kyt,京都新聞,京都市北区の焙煎コーヒー豆専門店が消防署とコラボ　コーヒーで火の用心訴え,https://news.yahoo.co.jp/articles/a80bbadc1016b1c5f3c852392b137a8f75f48a34,11/14(火) 13:02
kyt,京都新聞,京都の桂川で身元不明の女性遺体　うつぶせで水面に浮いた状態,https://news.yahoo.co.jp/articles/22b8fa9b78837d8e338e84d629a1fdb5e918ade7,11/14(火) 12:09
kyt,京都新聞,「写真館は人生の一部を記録できるすごい仕事」　生徒が勤労体験、京都・南丹,https://news.yahoo.co.jp/articles/0650b0575b282a13a275a56cc76317c462e9d63b,11/14(火) 10:36
kyt,京都新聞,京都で愛された神輿がカンボジアへ　「寂しさあるけど」現地の子どもたちが熱望,https://news.yahoo.co.jp/articles/a459b932bf750b203e1031a21bb90faab8f51f48,11/14(火) 10:32
kyt,京都新聞,海外にルーツ持つ子ども27年間支援、非常勤講師を表彰　「けなげな姿に逆に励まされた」,https://news.yahoo.co.jp/articles/3d9080a9e57ed228d7dab5ad3f67cccdd5458e40,11/14(火) 10:12
kyt,京都新聞,滋賀の最高峰・伊吹山が初冠雪、平年より7日早く　比良山系でも観測,https://news.yahoo.co.jp/articles/ff0f35303888647f61ba07268bccdb387efb69b8,11/14(火) 6:02
kyt,京都新聞,「綱領と規約を踏みにじっている」除名の元共産党職員、処分の再考促す,https://news.yahoo.co.jp/articles/36e896fcbe4ce7cb5e77079549787a31b0d10d04,11/13(月) 20:16
kyt,京都新聞,計算シート誤りで幼稚園4園に損害2600万円　京都市が3職員処分,https://news.yahoo.co.jp/articles/dd12cbe1ed2d26430f2cda50bef0a24501fc3702,11/13(月) 20:01
kyt,京都新聞,90代宅に侵入、現金530万円など盗んだ疑い　男3人逮捕、滋賀,https://news.yahoo.co.jp/articles/c6bd7092eeb9bf3b615cfacfa09a29effa5a92a2,11/13(月) 19:16
kyt,京都新聞,【速報】10代女性押さえ付け性的暴行、容疑の23歳逮捕　「互いの同意あった」否認,https://news.yahoo.co.jp/articles/ee3a0596e920b986ff0a3e240d1be90606844f4e,11/13(月) 17:33
kyt,京都新聞,工事現場で銅線320メートル盗まれる　時価310万円、窃盗事件で捜査,https://news.yahoo.co.jp/articles/670a9f4e7339d71a0ab1da12af8030a3b535488e,11/13(月) 17:17
kyt,京都新聞,「OLD THINGS MUST GO ON」な京都で巨大なマリオに出迎えられ、中古レコードを掘った話。,https://news.yahoo.co.jp/articles/5b43b45d1413247db10b9d93709f1048dd57d27c,11/7(火) 11:49
kyt,京都新聞,「千羽以上の鶏が毎日死んでいる」鳥インフル、国内初の大規模感染との戦いは1本の電話から始まった　#ニュースその後,https://news.yahoo.co.jp/articles/59b1439dd4f42ce07e0f9410d7c061471896a976,10/15(日) 18:04
