ctgry,media_jp,title_pickup,title_articles,link_pickup,link_articles,date_original
top-picks,時事通信,タイタニック号 船首の手すり崩落,タイタニック号、手すり崩落　映画の名シーンに登場,https://news.yahoo.co.jp/pickup/6512587,https://news.yahoo.co.jp/articles/606f934013ac0560b3c01d2a57e1ddffda8684e6,9/3(火) 15:22
top-picks,時事通信,総裁選各候補が改憲アピール 背景,保守層にらみ改憲アピール　自民総裁選へ各候補,https://news.yahoo.co.jp/pickup/6512586,https://news.yahoo.co.jp/articles/9d5549da70ed1900d773dfac1808a5b6aeafa785,9/3(火) 15:15
top-picks,テレビ朝日系（ANN）,食べ放題「女性半額」賛否 意図は,牛角食べ放題「女性半額」…SNSでは賛否　担当者「注文4皿分少ないデータある」,https://news.yahoo.co.jp/pickup/6512585,https://news.yahoo.co.jp/articles/98bef4ac5cfa1fd333f80732f501971ec83e850e,9/3(火) 15:03
top-picks,共同通信,中国 バス突っ込み生徒ら11人死亡,中国、中学生の列にバス突っ込む　11人死亡,https://news.yahoo.co.jp/pickup/6512583,https://news.yahoo.co.jp/articles/48f2f95f2823a69019130a46470256088cd94fce,9/3(火) 14:27
top-picks,デイリースポーツ,巨人・若林楽人 自然気胸で入院,巨人　若林楽人が「自然気胸」で入院治療　球団発表　退院後はジャイアンツ球場でリハビリへ,https://news.yahoo.co.jp/pickup/6512584,https://news.yahoo.co.jp/articles/263df0187921cee9f0845a7057667fd746ee2519,9/3(火) 14:25
top-picks,Yahoo!ニュース,中継 林芳正氏の総裁選出馬会見,中継 林芳正氏の総裁選出馬会見,https://news.yahoo.co.jp/pickup/6512581,,9/3(火) 14:20
top-picks,MBSニュース,米買えない なぜ備蓄米を放出せず,“米が買えない”で注目される国の『備蓄米』って何？常に100万トン備えるも政府が放出に慎重なのには理由が【令和の米騒動】,https://news.yahoo.co.jp/pickup/6512580,https://news.yahoo.co.jp/articles/35248a2ccc612183cae522e843cdb7d02aa0fd46,9/3(火) 13:52
top-picks,MBSニュース,乗船実習中の大学生 転落し死亡,石炭専用船で乗船実習中の男子大学生　海へ転落し溺れ死亡　警察は転落の原因を捜査　徳島・阿南市,https://news.yahoo.co.jp/pickup/6512579,https://news.yahoo.co.jp/articles/b15b97daff07b396fa11a96d4581fd632d2fef09,9/3(火) 13:44
top-picks,朝日新聞デジタル,奄美大島のマングース 根絶を宣言,奄美大島のマングース、根絶を宣言　外来種対策では「世界的成果」,https://news.yahoo.co.jp/pickup/6512582,https://news.yahoo.co.jp/articles/a01fbf979ee3dd567e0c71609b411afe606d539a,9/3(火) 13:43
top-picks,AFPBB News,射撃選手 話題のポーズを商標申請,トルコ射撃選手、五輪で話題のポーズを商標申請,https://news.yahoo.co.jp/pickup/6512578,https://news.yahoo.co.jp/articles/ca09c08f4ef8195636fdb429598f8978ef4c2cf8,9/3(火) 13:18
top-picks,毎日新聞,大学生 物価高で食料品を節約51%,大学生の98％が物価高を実感　いま節約しているものは？,https://news.yahoo.co.jp/pickup/6512576,,9/3(火) 12:50
top-picks,南日本新聞,弥生杉が無残 ガイド「ショック」,あまりにショック、樹齢3000年「弥生杉」無残…台風10号猛威まざまざ、幹回り8メートルの巨木を根元からなぎ倒す　屋久島,https://news.yahoo.co.jp/pickup/6512577,https://news.yahoo.co.jp/articles/e93c362371d0b1bee83bae9406cfeb2bfedcdc71,9/3(火) 12:39
top-picks,TBS NEWS DIG Powered by JNN,自民・岸田派が「解散届」提出,岸田派が「解散届」提出　旧森山派に次いで2例目,https://news.yahoo.co.jp/pickup/6512575,https://news.yahoo.co.jp/articles/6a3a01b0abbb193f8883a8e6af5872312143a6e0,9/3(火) 12:28
top-picks,読売新聞オンライン,組長射殺で時効成立の男か 逮捕,組長ら３人射殺で指名手配も時効成立、７５歳の男を名誉棄損容疑で逮捕…虚偽内容の文書を配布,https://news.yahoo.co.jp/pickup/6512574,https://news.yahoo.co.jp/articles/9db7d505ad74304e55c503b083f75be5738daa77,9/3(火) 12:16
top-picks,ウェザーマップ,関東中心に雨強まる 災害に警戒,関東や静岡県　引き続き土砂災害・浸水害・河川の増水など警戒　落雷や突風にも注意を,https://news.yahoo.co.jp/pickup/6512573,https://news.yahoo.co.jp/articles/4d7b14786c9b11fcfa0f5ee6aa32b2f6a8862617,9/3(火) 11:52
top-picks,産経新聞,JFA マーク巡り教科書の修正要請,日本サッカー協会、マークの由来は「八咫烏」だけでなく中国古典も　教科書に修正要請　,https://news.yahoo.co.jp/pickup/6512567,https://news.yahoo.co.jp/articles/12e2f44f08b9f3f5147112c53150df01587e5113,9/3(火) 11:52
top-picks,CNN.co.jp,イスラエル2日にスト 国ほぼ停止,イスラエルでゼネスト、停戦交渉進めぬ政府に怒り,https://news.yahoo.co.jp/pickup/6512572,https://news.yahoo.co.jp/articles/5e338dbb9fbece612543748301755e5ddfbe672b,9/3(火) 11:52
top-picks,TBS NEWS DIG Powered by JNN,電気代など補助へ 予備費9891億円,電気・ガス・ガソリン代への補助金　予備費から9891億円を支出　政府が閣議決定,https://news.yahoo.co.jp/pickup/6512570,https://news.yahoo.co.jp/articles/61b2a9a3f7ee85ddb56755602ee47b3dc8249fb7,9/3(火) 11:41
top-picks,Yahoo!ニュース オリジナル 特集,「口内丼」マナー違反? 識者見解,日本独自の食文化？おかずを食べて白飯を食す「口内丼」に賛否 ＃食の現在地,https://news.yahoo.co.jp/pickup/6512571,https://news.yahoo.co.jp/articles/e9575ab76bcd77e0934598680487de5bfd183d15,9/3(火) 11:38
top-picks,スポーツ報知,大谷 伏兵に打点抜かれ2位に転落,大谷翔平、伏兵に打点抜かれて２位に転落　２安打＆３盗塁で「４４―４６」、ダブル５０には前進,https://news.yahoo.co.jp/pickup/6512569,https://news.yahoo.co.jp/articles/b838605e401a7446906fd839356a469707955c77,9/3(火) 11:36
top-picks,Yahoo!ニュース オリジナル 特集,訪日客驚く食べ方「口内丼」賛否,日本独自の食文化？おかずを食べて白飯を食す「口内丼」に賛否 ＃食の現在地,https://news.yahoo.co.jp/pickup/6512565,https://news.yahoo.co.jp/articles/e9575ab76bcd77e0934598680487de5bfd183d15,9/3(火) 11:20
top-picks,CHANTO WEB,難病の息子亡くし 稲川淳二の思い,「26歳まで生きてくれた難病・クルーゾン症候群の次男」稲川淳二（77）障がいを特別扱いしない活動を続ける現在地,https://news.yahoo.co.jp/pickup/6512564,https://news.yahoo.co.jp/articles/f6e91964a952b4882c97983f884508c5733c61cb,9/3(火) 11:20
top-picks,読売新聞オンライン,中国製か 海岸にたばこ大量漂着,中国製たばこか、長崎・熊本・鹿児島の海岸に大量漂着…市民団体回収も「拾っても拾っても出てくる」,https://news.yahoo.co.jp/pickup/6512561,https://news.yahoo.co.jp/articles/534e9fee23c6de97cb53572fb56dc96c10b8dec6,9/3(火) 10:50
top-picks,時事通信,ホットドッグ早食い 小林さん引退,小林さん、雪辱ならず引退表明　ホットドッグ早食い　米,https://news.yahoo.co.jp/pickup/6512560,https://news.yahoo.co.jp/articles/83730dc92b3c5c02fc5e2eff6cf972b93c2435ad,9/3(火) 10:49
top-picks,共同通信,ベネズエラ大統領機 米政府が押収,ベネズエラ大統領の飛行機押収　制裁違反と米政府,https://news.yahoo.co.jp/pickup/6512562,https://news.yahoo.co.jp/articles/485421ef7567bbb60feac4c43420958c5bb2ba70,9/3(火) 10:44
top-picks,ロイター,プーチン氏、家族は中国語も話す,プーチン氏、家族は「中国語を流暢に話す」　孫に言及か,https://news.yahoo.co.jp/pickup/6512563,https://news.yahoo.co.jp/articles/a0302ec1b5fbed978226d0e8d70a79e29014aa59,9/3(火) 10:37
top-picks,テレビ朝日系（ANN）,移住婚の支援案 首相補佐官が苦言,政府の“移住婚”支援案に「順序が違うと思う」　矢田総理補佐官が苦言,https://news.yahoo.co.jp/pickup/6512559,https://news.yahoo.co.jp/articles/431413fdc850477fb3d52329f6cf111ed14f9f89,9/3(火) 10:23
top-picks,ロイター,プーチン氏逮捕されず ウ遺憾表明,モンゴルは「戦争犯罪の責任を共有」、プーチン氏不逮捕にウクライナが猛反発,https://news.yahoo.co.jp/pickup/6512558,https://news.yahoo.co.jp/articles/bbc68b40ad2870d6a4e7d7465b728ca7e2788992,9/3(火) 10:08
top-picks,読売新聞オンライン,ルイ・ヴィトン 茨城県から撤退へ,ルイ・ヴィトンが茨城県内撤退へ…唯一の直営店がある水戸京成百貨店から、１２月２５日を最後に,https://news.yahoo.co.jp/pickup/6512557,https://news.yahoo.co.jp/articles/52c180cf401b87af69ec8a107686dbafdfde8fff,9/3(火) 9:51
top-picks,スポニチアネックス,大谷、50-50は「チャンスある」,大谷翔平　史上初の50―50は「健康」なら「チャンスがある」Dバックス戦勝ち越しは「大きなこと」,https://news.yahoo.co.jp/pickup/6512556,https://news.yahoo.co.jp/articles/37d5fd817078b05831d7db149382318279eb1871,9/3(火) 9:40
top-picks,共同通信,シカゴ近郊 電車内で銃撃4人死亡,米、電車内で銃撃4人死亡　シカゴ近郊、容疑者逮捕,https://news.yahoo.co.jp/pickup/6512555,https://news.yahoo.co.jp/articles/a9762a8c372e8a460e180acfbb4f0fa021efb078,9/3(火) 9:36
top-picks,読売新聞オンライン,世界は目を覚ませ ガザのパラ選手,親族１７人犠牲のガザ出身選手、パラ出場…「戦争で障害負った人の声代弁する」「世界は目を覚ませ」,https://news.yahoo.co.jp/pickup/6512554,https://news.yahoo.co.jp/articles/7919efeafcf12a8644ffdefe6ecc009b53466ccb,9/3(火) 9:11
top-picks,オリコン,つば九郎&ドアラ「anan」で表紙,つば九郎＆ドアラ、球団マスコット史上初『anan』表紙　1羽＆1匹が密着「びじねすぱーとなー」2ショット,https://news.yahoo.co.jp/pickup/6512553,https://news.yahoo.co.jp/articles/6e662b9f600d64d3971aa04bf65269b3c0cc3dde,9/3(火) 9:11
top-picks,テレビ朝日系（ANN）,USスチール買収にハリス氏否定的,ハリス副大統領「USスチールはアメリカ人によって所有され運営されるべきだ」,https://news.yahoo.co.jp/pickup/6512551,,9/3(火) 8:55
top-picks,HBCニュース北海道,秋サケ 1キロ8万8888円の最高値,秋サケの初競り、１キロ８万8888円の史上最高値！ブランド鮭「銀聖」のオス＋水揚げ去年の４割ほどにとどまり、約4.4キロの１匹39万円　来遊予測“最低”で今後も高値続く見通し,https://news.yahoo.co.jp/pickup/6512552,https://news.yahoo.co.jp/articles/a63e3c4e90ec584ad7e7e536ac2898a98dd54a85,9/3(火) 8:55
top-picks,中国新聞デジタル,ロト7で7億円 広島県で1等相次ぐ,今度は「ロト7」で7億7502万円　広島県内で相次ぐ1等高額当せん,https://news.yahoo.co.jp/pickup/6512549,https://news.yahoo.co.jp/articles/a223386f9ae1d4652ed4ae151584e9511e50bef6,9/3(火) 8:38
top-picks,スポーツ報知,玉木宏 道場仲間・岡田准一に刺激,玉木宏「俯瞰しながらも、がむしゃらに」、ＢＳ時代劇「おいち不思議がたり」で父親役好演、道場仲間の岡田准一から刺激,https://news.yahoo.co.jp/pickup/6512550,https://news.yahoo.co.jp/articles/32d56b0d643657cd336d7bfc7327e4b529af2151,9/3(火) 8:33
top-picks,読売新聞オンライン,太陽光パネル リサイクル義務化へ,太陽光パネルのリサイクル義務化へ…大量廃棄と環境破壊を防止、日本発の薄型電池の普及も後押し,https://news.yahoo.co.jp/pickup/6512548,,9/3(火) 8:31
top-picks,毎日新聞,「新しい認知症観」計画案を了承,希望を持って生きる「新しい認知症観」　基本計画案を了承,https://news.yahoo.co.jp/pickup/6512547,https://news.yahoo.co.jp/articles/cc94ff5d3a8de3d85d2db4941c1fc5811d46b46b,9/3(火) 8:22
top-picks,スポーツ報知,玉木宏、岡田准一は励みになる,玉木宏「俯瞰しながらも、がむしゃらに」、ＢＳ時代劇「おいち不思議がたり」で父親役好演、道場仲間の岡田准一から刺激,https://news.yahoo.co.jp/pickup/6512546,https://news.yahoo.co.jp/articles/32d56b0d643657cd336d7bfc7327e4b529af2151,9/3(火) 8:19
top-picks,Bloomberg,VW ドイツ国内工場の閉鎖を検討,ＶＷがドイツ国内工場の閉鎖検討、実施なら史上初－コスト削減で,https://news.yahoo.co.jp/pickup/6512545,https://news.yahoo.co.jp/articles/aa01c44b9255ed0b6a4f6352de16ca5755395452,9/3(火) 7:50
top-picks,TBS NEWS DIG Powered by JNN,バド梶原大暉が金メダル パラ連覇,バドミントン梶原大暉が金メダルを獲得し連覇達成！国際大会シングルスでは負けなしの125連勝【パリパラリンピック】,https://news.yahoo.co.jp/pickup/6512544,https://news.yahoo.co.jp/articles/312bda8f2e7446622b7ca4bf2713670062a12535,9/3(火) 7:48
top-picks,スポニチアネックス,大谷 1試合3盗塁で「44-46」到達,大谷翔平　自己最多タイ1試合3盗塁　本塁打上回る44―46で史上初の50―50へまた一歩前進,https://news.yahoo.co.jp/pickup/6512543,https://news.yahoo.co.jp/articles/8fd204f3d64291d5b8afce5203b45840f14777cc,9/3(火) 7:40
top-picks,tenki.jp,前線停滞、関東や東海で雨雲発達,3日　関東や東海で雨雲発達　局地的に非常に激しい雨　その他も天気急変に注意,https://news.yahoo.co.jp/pickup/6512542,https://news.yahoo.co.jp/articles/5e2439a2f180f423c7c0df5f591f0ee42c381f39,9/3(火) 7:30
top-picks,FNNプライムオンライン（フジテレビ系）,今週「出馬ラッシュ」自民総裁選,自民党総裁選“出馬ラッシュ”林官房長官がきょう立候補表明…あす茂木幹事長で6日は小泉進次郎氏　高市氏は「確固たる国家観」,https://news.yahoo.co.jp/pickup/6512541,https://news.yahoo.co.jp/articles/f51c6cfd61e061cbbb63623cddb35c855030371f,9/3(火) 7:28
top-picks,山陽新聞デジタル,岡山県PTA連合会が解散へ 全国初,【独自】全国初 岡山県PTA連が解散へ　加盟団体の退会相次ぎ24年度末,https://news.yahoo.co.jp/pickup/6512540,,9/3(火) 7:27
top-picks,スポニチアネックス,大谷 3戦ぶり盗塁で「44-44」到達,大谷翔平　第3打席は四球→二盗　3戦ぶり44盗塁目決めて44―44に　第1打席は痛烈189キロ右前打,https://news.yahoo.co.jp/pickup/6512538,https://news.yahoo.co.jp/articles/8fd204f3d64291d5b8afce5203b45840f14777cc,9/3(火) 6:54
top-picks,KSB瀬戸内海放送,家で5歳と曽祖父死亡 殺人で捜査,住宅で5歳男児と曽祖父が死亡　男児は頚部圧迫による窒息死　警察が殺人事件として捜査　香川・三木町,https://news.yahoo.co.jp/pickup/6512537,https://news.yahoo.co.jp/articles/1b9678dfd82bc3f39ba78cb85827a4961009a225,9/3(火) 6:38
top-picks,日刊スポーツ,車いすラグビー 日本が悲願の金,【車いすラグビー】日本悲願の金メダル！米国撃破「最高の喜び」初出場から20年！過去２大会は銅,https://news.yahoo.co.jp/pickup/6512536,https://news.yahoo.co.jp/articles/0e7c67719464d027f8a137e5f08e9a451e2e60ee,9/3(火) 6:21
top-picks,デイリースポーツ,関テレ 関学アメフト部報道で謝罪,カンテレ　関学大アメフト部の報道で謝罪　「Ｕ20関係者」の証言を「関学大アメフト部関係者」と誤って報じる,https://news.yahoo.co.jp/pickup/6512535,https://news.yahoo.co.jp/articles/b690c0b672f99ba4b50188a5f6f9669b51ca6e06,9/3(火) 6:11
top-picks,朝日新聞デジタル,モンゴル、プーチン氏を逮捕せず,モンゴル、プーチン氏を逮捕せず　国際刑事裁の義務履行避ける,https://news.yahoo.co.jp/pickup/6512534,https://news.yahoo.co.jp/articles/977a90919fa368b57036301d858767108026bfaa,9/3(火) 0:45
top-picks,時事通信,中国主席 南アと関係格上げの宣言,中国主席、南アと「関係格上げ」宣言　貿易赤字で温度差も,https://news.yahoo.co.jp/pickup/6512533,,9/3(火) 0:31
top-picks,読売新聞オンライン,石破氏 金融所得課税の強化に意欲,［深層ＮＥＷＳ］石破茂氏、金融所得課税を強化し格差是正…自民党総裁選へ改めて決意,https://news.yahoo.co.jp/pickup/6512531,https://news.yahoo.co.jp/articles/6b3a08828dbaa83a9998b6ccd95869b668e7b974,9/2(月) 23:57
top-picks,読売新聞オンライン,屋久島「弥生杉」倒れる 台風10号,屋久島の「弥生杉」、台風１０号で倒れる…「縄文杉」へのルート近くでは土砂崩れ,https://news.yahoo.co.jp/pickup/6512530,https://news.yahoo.co.jp/articles/fa5ecd5164776118356856fe8524e2edac55e812,9/2(月) 23:46
top-picks,MBSニュース,資金洗浄Gナンバー3か 男を逮捕,【速報】公開手配の男らを逮捕　資金洗浄G「リバトン」の“ナンバー3“海外逃亡も関空に帰国,https://news.yahoo.co.jp/pickup/6512529,https://news.yahoo.co.jp/articles/167292f08b8f0da03bc57f681fbf983a78282716,9/2(月) 23:32
top-picks,読売新聞オンライン,イラン大統領の墜落死 主因は濃霧,イラン元大統領のヘリ墜落死、複雑な気象条件で発生した濃霧が主因…軍統合参謀本部が最終報告書,https://news.yahoo.co.jp/pickup/6512528,https://news.yahoo.co.jp/articles/32bdfbb91329890cb74aa985183702f89b7c8d1b,9/2(月) 23:10
top-picks,共同通信,岸田派 早ければ3日に解散届提出,自民党岸田派、3日にも正式解散　総務相に届け出、67年に幕,https://news.yahoo.co.jp/pickup/6512524,https://news.yahoo.co.jp/articles/120aeaf540f9883c5283d3f93a188f12afda22bf,9/2(月) 22:49
top-picks,時事通信,男女の賃金格差 全国で最大は栃木,男女の賃金差、最大は栃木　全国順位公表、最小は高知　政府PT,https://news.yahoo.co.jp/pickup/6512525,https://news.yahoo.co.jp/articles/ad3944ca6d8eef9a5a2201faa009130d53bea96f,9/2(月) 22:40
top-picks,時事通信,筑波大マレーシアで開校 13人入学,筑波大、マレーシアで開校　海外初、日本の学士号授与へ,https://news.yahoo.co.jp/pickup/6512523,https://news.yahoo.co.jp/articles/4e278b5fe7f18bd510ad7c351971e588b1ab682b,9/2(月) 22:37
top-picks,テレビ朝日系（ANN）,金利上昇 預金どのくらい増える?,さらに“金利”上昇の可能性も？100万円預けたらいくら増える？記者解説,https://news.yahoo.co.jp/pickup/6512522,https://news.yahoo.co.jp/articles/0f025fa725bbdf5b6ec65748a71fccee3ca30093,9/2(月) 22:26
top-picks,デイリースポーツ,観戦時の撮影巡り NPBが新ルール,ＮＰＢが野球観戦で新ルール施行　「写真・動画などの撮影及び配信・送信規定」動画の配信・送信禁止,https://news.yahoo.co.jp/pickup/6512521,https://news.yahoo.co.jp/articles/4a02dcaf08d61a2c0ee98d7fc1d9d99e7bb5be83,9/2(月) 22:13
top-picks,FNNプライムオンライン（フジテレビ系）,立憲代表選 小沢氏は野田氏支持へ,【速報】小沢氏は野田元首相を支持　立憲・代表選　意向を固め近く野田氏に伝達へ,https://news.yahoo.co.jp/pickup/6512520,https://news.yahoo.co.jp/articles/55c2ba961f65adc6ef7c0801a8598550440dda88,9/2(月) 22:09
top-picks,ウェザーマップ,関東・東海 非常に激しい雨の恐れ,【動画】3日の天気 - 関東や東海で非常に激しい雨　近畿から西も天気急変に注意（2日18時更新）,https://news.yahoo.co.jp/pickup/6512517,https://news.yahoo.co.jp/articles/a5e039857bd9d2a2c03a22b756ebc44759780b68,9/2(月) 21:30
top-picks,ITmedia NEWS,スポーツくじMEGA BIG 1等269口,スポーツくじ「MEGA BIG」が当せん確率上昇→“想定以上の売上”でシステムに影響？　結果発表が遅延する事態に,https://news.yahoo.co.jp/pickup/6512518,https://news.yahoo.co.jp/articles/f49063f29bc5dea7f414cbf1adc99ecb7dd442a2,9/2(月) 21:24
top-picks,ITmedia NEWS,MEGA BIG 1等269口なぜ確率上昇,スポーツくじ「MEGA BIG」が当せん確率上昇→“想定以上の売上”でシステムに影響？　結果発表が遅延する事態に,https://news.yahoo.co.jp/pickup/6512516,https://news.yahoo.co.jp/articles/f49063f29bc5dea7f414cbf1adc99ecb7dd442a2,9/2(月) 21:09
top-picks,毎日新聞,麻生派元議員も過去の裏金認める,麻生派の元議員も裏金認める　「違法だと誰も思っていなかった」,https://news.yahoo.co.jp/pickup/6512514,https://news.yahoo.co.jp/articles/6677dedaf2944c9c4c40864e051fc0b114e7a44d,9/2(月) 20:58
top-picks,読売新聞オンライン,住宅ローン変動金利上昇へ 3メガ,変動型住宅ローン金利上昇へ、連動する短プラを３メガ銀が１７年ぶりに引き上げ年１・６２５％に,https://news.yahoo.co.jp/pickup/6512512,https://news.yahoo.co.jp/articles/6109dd8de6c563d822147e3cbc964ba1fa02eeaf,9/2(月) 20:39
top-picks,TBS NEWS DIG Powered by JNN,パラ・バド里見紗李奈が金 2連覇,バドミントン里見紗李奈、シングルスで金メダル！逆転での大会2連覇達成【パリパラリンピック】,https://news.yahoo.co.jp/pickup/6512513,https://news.yahoo.co.jp/articles/72ad5dfb8c97514a37625a8fe19d23a302d13cc9,9/2(月) 20:21
top-picks,MRO北陸放送,珠洲の自衛隊撤収 住民も隊員も涙,救った命は1000人超え「お元気で」住民も自衛隊員も涙… 過去最長の自衛隊災害派遣が終了 石川・珠洲市　,https://news.yahoo.co.jp/pickup/6512511,https://news.yahoo.co.jp/articles/b631efdd339804dc78fef47b47002eed828033ba,9/2(月) 20:09
top-picks,TBS NEWS DIG Powered by JNN,子ら3人死亡事故 母「許せない」,「ママ頑張ってね、いってらっしゃい」が最後のやりとりに…男の子（2）と父親ら3人死亡事故　母親らが初めての胸の内を明かす「飲酒運転は本当に許せない」群馬・伊勢崎市,https://news.yahoo.co.jp/pickup/6512510,https://news.yahoo.co.jp/articles/04aa33853db02c9e96387a2eb57d2fe8d7e1e56c,9/2(月) 19:56
top-picks,TBS NEWS DIG Powered by JNN,家入る時フェイント有効? 蚊対策,「家に入るときにフェイント」が有効!?今年の『蚊』は9月から?活発化する蚊に刺されない方法【ひるおび】,https://news.yahoo.co.jp/pickup/6512509,https://news.yahoo.co.jp/articles/c2841b12869a80b756d566917f9c5cf242f08cf7,9/2(月) 19:32
top-picks,共同通信,正恩体制 エリート層の脱北2倍超,エリート層の脱北2倍超　金正恩体制、歯止め効かず,https://news.yahoo.co.jp/pickup/6512508,https://news.yahoo.co.jp/articles/ccec66330adaddec6c0d4e0859b2334ae1a2d09a,9/2(月) 19:12
top-picks,FOOTBALL ZONE,長友、長谷部コーチに「違和感」,長友佑都、長谷部誠コーチに「違和感しかない」　代表合流でともに調整「オーラ増している」,https://news.yahoo.co.jp/pickup/6512506,https://news.yahoo.co.jp/articles/3c6f95bff5cc1928c1ddcc4820374530fbd9d0a6,9/2(月) 19:03
top-picks,神戸新聞NEXT,団員死亡の宙組 トップが来春退団,宝塚歌劇、宙組トップ芹香斗亜さん退団へ　団員死亡の組、昨年のお披露目公演は中止,https://news.yahoo.co.jp/pickup/6512507,https://news.yahoo.co.jp/articles/61b038d5103ceef64d150545976755b623ac07f2,9/2(月) 19:01
top-picks,ITmedia NEWS,任天堂 違法投稿など法的措置示唆,任天堂、著作物利用ガイドライン更新　チートやデータマイニングなどの禁止明記　ガイドライン違反に法的措置を示唆,https://news.yahoo.co.jp/pickup/6512504,https://news.yahoo.co.jp/articles/1cf3e22bda5f46ed6b6d504716c348444381bccb,9/2(月) 18:56
top-picks,共同通信,辺野古抗告訴訟 2審も沖縄県敗訴,辺野古、二審も沖縄県敗訴　軟弱地盤工事巡る抗告訴訟,https://news.yahoo.co.jp/pickup/6512505,https://news.yahoo.co.jp/articles/a097d1aa9926672a3b8f2e5373c30e4d19452ac9,9/2(月) 18:44
top-picks,神戸新聞NEXT,宝塚 宙組トップ芹香斗亜が退団へ,宝塚歌劇、宙組トップ芹香斗亜さん退団へ　団員死亡の組、昨年のお披露目公演は中止,https://news.yahoo.co.jp/pickup/6512503,https://news.yahoo.co.jp/articles/61b038d5103ceef64d150545976755b623ac07f2,9/2(月) 18:37
top-picks,デイリースポーツ,平本蓮、ドーピング疑惑を否定,平本蓮がドーピング疑惑否定「自分は一切やっていない。お願いした事実は全くない」「今は検査結果を待ちたい」白スーツ、眼鏡姿で緊急会見　弁護士同席,https://news.yahoo.co.jp/pickup/6512502,https://news.yahoo.co.jp/articles/4a6ce4a343910db122f9979d5380ba6dafbab016,9/2(月) 18:32
top-picks,TBS NEWS DIG Powered by JNN,6～8月の平均気温 過去最高タイ,2年連続で最も暑かった　日本の今夏の平均気温が統計史上最高タイに　平年差＋1.76℃で2023年に並ぶ,https://news.yahoo.co.jp/pickup/6512500,https://news.yahoo.co.jp/articles/f95f78c3e53e36504665d8cee1dbe5119c0dacc8,9/2(月) 18:08
top-picks,ウェザーマップ,北・東日本で雷雨続く 災害警戒,北・東日本　2日（月）夜遅くにかけて　土砂災害・浸水害・河川の増水など警戒を,https://news.yahoo.co.jp/pickup/6512499,https://news.yahoo.co.jp/articles/d6a3be8bcf789001e7212de0d0ca4ef5c828e825,9/2(月) 17:59
