ctgry,media_jp,title_pickup,title_articles,link_pickup,link_articles,date_original
top-picks,ウェザーマップ,暑さ戻る 各地で真夏日続出の予想,東〜西日本では真夏日地点続出へ　関東も暑さ戻る　北日本は急な雷雨に注意　夜は東海や関東で雨の所も　27〜28日は東海や関東で大雨のおそれ,https://news.yahoo.co.jp/pickup/6514758,https://news.yahoo.co.jp/articles/dcbae257f93b85e3d3d3da3b017ac3a847b04ff9,9/26(木) 7:48
top-picks,毎日新聞,麻生派 パー券の現金還付巡り証言,麻生派、パー券ノルマ超過「現金還付」と複数証言　裏金の温床か,https://news.yahoo.co.jp/pickup/6514756,https://news.yahoo.co.jp/articles/fc91b5e237eb182016d78ca8fce96911c1585658,9/26(木) 7:40
top-picks,朝日新聞デジタル,鳴尾浜球場に幕 井川慶氏が終球式,さらば鳴尾浜　阪神2軍施設のラストゲーム　あの左腕が「終球式」,https://news.yahoo.co.jp/pickup/6514755,https://news.yahoo.co.jp/articles/7ed2eeea31939b662e2a4dde71033936e2c20e16,9/26(木) 7:32
top-picks,読売新聞オンライン,海自の護衛艦 台湾海峡を初通過,海自護衛艦「さざなみ」が台湾海峡を初通過、岸田首相が派遣指示…軍事的威圧強める中国をけん制,https://news.yahoo.co.jp/pickup/6514757,https://news.yahoo.co.jp/articles/76338264e460c4fcea8bd48ae11387f2aa89fb3b,9/26(木) 7:30
top-picks,毎日新聞,NHK ラジオ巡り辞任の理事再雇用,NHKラジオ問題で辞任の理事、1週間後にプロデューサーで再雇用,https://news.yahoo.co.jp/pickup/6514754,https://news.yahoo.co.jp/articles/df123523df0a763f95ab5c7f5c059cc7a5d7929b,9/26(木) 6:58
top-picks,共同通信,任天堂のミュージアム 内容公開,任天堂、展示施設を公開　歴代ゲームや体験エリア,https://news.yahoo.co.jp/pickup/6514753,https://news.yahoo.co.jp/articles/0ca7a22c6f82a63e7d85790dc56b88aa979aa248,9/26(木) 6:34
top-picks,西スポWEB OTTO！,SB、継投ノーノーあと1人で逃す,ソフトバンク、継投によるノーヒットノーランまであと1人も　元同僚に阻止されプロ野球史上6度目の偉業逃す,https://news.yahoo.co.jp/pickup/6514752,https://news.yahoo.co.jp/articles/d35e4ea92b60bf01a8d29cd331988fa38e17aa89,9/26(木) 6:17
top-picks,共同通信,イスラエル軍 レバノン侵攻に言及,レバノン地上侵攻に言及　イスラエル軍参謀総長,https://news.yahoo.co.jp/pickup/6514751,https://news.yahoo.co.jp/articles/aa789bbfdc98886d637323cf8a02ba7ebc245029,9/26(木) 0:54
top-picks,時事通信,ガストなどライス値上げ コメ高騰,「ガスト」などライス値上げ　コメ価格高騰で,https://news.yahoo.co.jp/pickup/6514750,https://news.yahoo.co.jp/articles/748d40f4f876617604643b7a0b24f1782020e8e6,9/25(水) 23:53
top-picks,毎日新聞,男児刺殺 中国で日本語控える女性,日本語控え、服に注意…続く不安に「中国離れ」加速も　深男児刺殺,https://news.yahoo.co.jp/pickup/6514749,https://news.yahoo.co.jp/articles/1e32abbb340220a56fe2c5de54274a4ac7850d26,9/25(水) 23:32
top-picks,Full-Count,大谷から映像 引退のハム鍵谷驚く,大谷翔平からのビデオメッセに「ビックリ」　引退のハム鍵谷「これからはファンとして」,https://news.yahoo.co.jp/pickup/6514747,https://news.yahoo.co.jp/articles/1873dcf6c9c9af180725fd66f501a50ccaecf440,9/25(水) 23:08
top-picks,スポニチアネックス,広島の自力CS消滅 歴史的な失速,広島　痛恨3連敗…ついに貯金0　DeNAに1・5差、自力CS消滅　貯金最多14から歴史的大失速,https://news.yahoo.co.jp/pickup/6514748,https://news.yahoo.co.jp/articles/12d78fd42dbb5156a62a6a06a17c5c6960069baa,9/25(水) 23:03
top-picks,ENCOUNT,中田英寿氏が抱負 上場企業で役員,中田英寿氏「国内、海外での経験をさらに生かしたい」　上場企業の執行役員就任で株主に抱負,https://news.yahoo.co.jp/pickup/6514745,https://news.yahoo.co.jp/articles/fe7e314583220ee674f0a7acbf77c19441c23ce2,9/25(水) 22:50
top-picks,日テレNEWS NNN,池江の完全寛解 多くの選手が反応,競泳・池江璃花子が急性リンパ性白血病の「完全寛解」を発表　石川祐希や阿部詩らアスリートがSNSに反応,https://news.yahoo.co.jp/pickup/6514746,https://news.yahoo.co.jp/articles/9bc07c6a4452e5a31601a3b77fc72960de3627f9,9/25(水) 22:30
top-picks,スポニチアネックス,広島が歴史的失速 9月は4勝17敗,広島　痛恨3連敗…ついに貯金0　DeNAに1・5差、自力CS消滅　貯金最多14から歴史的大失速,https://news.yahoo.co.jp/pickup/6514744,https://news.yahoo.co.jp/articles/12d78fd42dbb5156a62a6a06a17c5c6960069baa,9/25(水) 22:29
top-picks,TBS NEWS DIG Powered by JNN,パトカーに新型警光灯 障害者配慮,“蛍の光のように点滅”パトカーに新型警光灯を搭載へ　聴覚障害者にも緊急走行時と警戒活動時の違いを分かりやすく　来月中旬から運用開始　警察庁,https://news.yahoo.co.jp/pickup/6514743,https://news.yahoo.co.jp/articles/8e30478ee9ffa75943f6976e8f6f16bb2432ad60,9/25(水) 22:15
top-picks,共同通信,輪島市で遺体発見 豪雨の死者11人,能登豪雨、死者11人に　災害廃棄物の仮置き開始,https://news.yahoo.co.jp/pickup/6514741,https://news.yahoo.co.jp/articles/30261acf44b1fea57beec5da011af7beaf7956d2,9/25(水) 21:58
top-picks,日テレNEWS NNN,池江が「完全寛解」阿部詩ら反応,競泳・池江璃花子が急性リンパ性白血病の「完全寛解」を発表　石川祐希や阿部詩らアスリートがSNSに反応,https://news.yahoo.co.jp/pickup/6514740,https://news.yahoo.co.jp/articles/9bc07c6a4452e5a31601a3b77fc72960de3627f9,9/25(水) 21:41
top-picks,テレビユー山形,民家で90歳の女性死亡 殺人で捜査,【続報】「気さくな人だった」町長のおばにあたる90歳女性が殺害される　頭部や胸に複数の傷…警察が犯人の行方を追う（山形県・三川町）,https://news.yahoo.co.jp/pickup/6514738,https://news.yahoo.co.jp/articles/ef739620547a3f54c4796d30c827f86dd0024ab2,9/25(水) 21:34
top-picks,朝日新聞デジタル,立憲と候補者調整求む声続出 維新,維新、立憲との候補者調整訴え続出　「立候補辞退してもいい」の声も,https://news.yahoo.co.jp/pickup/6514737,https://news.yahoo.co.jp/articles/c7dfc917b40d4d0ea6ebe33b0564ad8be859a2c2,9/25(水) 21:24
top-picks,スポーツ報知,山田邦子 豪華客船で925の日祝う,山田邦子「９２５の日」を豪華客船でお祝い　川中美幸や鬼越トマホークも参加,https://news.yahoo.co.jp/pickup/6514732,https://news.yahoo.co.jp/articles/c1f4f13d624a501f2907c985ed81aa426f34e4cb,9/25(水) 21:10
top-picks,千葉日報オンライン,ツーブロック禁止 千葉38校→1校,「ツーブロック禁止」38校→1校に　千葉市立中高、“行き過ぎた校則”3年間で大幅減　「肌着の色を指定」は28校→3校に,https://news.yahoo.co.jp/pickup/6514731,https://news.yahoo.co.jp/articles/fa3f62e38c0c7a224a5b225cb526307b4805b03b,9/25(水) 20:58
top-picks,静岡朝日テレビ,袴田事件判決へ 地裁は謝罪するか,袴田巌さん再審あす判決〜判決のポイントは・白鳥衛記者,https://news.yahoo.co.jp/pickup/6514730,https://news.yahoo.co.jp/articles/5867b3300456a8d62662c3291981dca2072a1e7d,9/25(水) 20:35
top-picks,共同通信,台湾、日本産食品全て輸入可能に,日本産食品全て輸入可能に、台湾　規制緩和、農相「復興を後押し」,https://news.yahoo.co.jp/pickup/6514728,https://news.yahoo.co.jp/articles/a253fd2c5e74daa1aa0562a9efe40a4e0c365a95,9/25(水) 20:31
top-picks,産経新聞,NHK中国語ニュース またトラブル,NHKラジオ国際放送の中国語ニュースでまたトラブル　収録間に合わず前日分を放送、謝罪,https://news.yahoo.co.jp/pickup/6514729,https://news.yahoo.co.jp/articles/1acef643253db50d7ca8e907228a440928b60655,9/25(水) 20:20
top-picks,弁護士ドットコムニュース,「喫煙続けたら離婚」法的効力は,「結婚したら禁煙する」約束を守らず、子どもが生まれても喫煙する夫…妻は「婚姻無効にしたい」,https://news.yahoo.co.jp/pickup/6514727,https://news.yahoo.co.jp/articles/d4a293d2e88fbaf0573ff9081b86274f743215c4,9/25(水) 20:05
top-picks,関西テレビ,維新候補幹部 なぜ対立陣営出入り,維新・衆院選公認候補の事務所幹部が偽名で対立候補陣営に出入り　選挙の『命』支援者名簿は？,https://news.yahoo.co.jp/pickup/6514726,https://news.yahoo.co.jp/articles/0807268475afe0bf4e57dbd358ddfb3b91b051f8,9/25(水) 20:02
top-picks,北國新聞社,珠洲市で遺体発見 豪雨の死者10人,〈奥能登豪雨〉死者１０人に　珠洲市の海岸、１遺体発見　不明の７０歳男性か,https://news.yahoo.co.jp/pickup/6514724,https://news.yahoo.co.jp/articles/c2eb988025e73c849bf941235b1456ed9c863193,9/25(水) 19:34
top-picks,CBCテレビ,羽賀研二容疑者ら7人を逮捕,【速報】羽賀研二容疑者（63）逮捕 　差し押さえ逃れるためウソの登記をしたなどの疑い　山口組系弘道会傘下の暴力団稲葉地一家総長ら6人と,https://news.yahoo.co.jp/pickup/6514723,https://news.yahoo.co.jp/articles/6be4cbf8c541e183853e10fb92982526f94f6368,9/25(水) 19:24
top-picks,共同通信,イスラエルの孤立鮮明 非難相次ぐ,イスラエルの孤立鮮明　非難相次ぐ、米国にも矛先,https://news.yahoo.co.jp/pickup/6514720,https://news.yahoo.co.jp/articles/a6e8fd343b843fbab06675d7c9aa04e2e03897c2,9/25(水) 19:11
top-picks,TBS NEWS DIG Powered by JNN,飲む中絶薬の条件緩和 一部再審議,「飲む中絶薬」の無床診療所での使用“異例”の結論先送り　体制整備などに“懸念の声”厚労省の審議会　,https://news.yahoo.co.jp/pickup/6514721,https://news.yahoo.co.jp/articles/c86278406fffc9491c0e930585c3946ad6e2913b,9/25(水) 19:09
top-picks,TBS NEWS DIG Powered by JNN,小泉氏 麻生氏らとの面会に言及,自民・小泉進次郎氏「一人でも多く支援お願いするのは当然」麻生氏・世耕氏らと面会　支援を要請,https://news.yahoo.co.jp/pickup/6514719,https://news.yahoo.co.jp/articles/b6214430aa0156f59a4a8080d13e30bdc52ebe89,9/25(水) 18:55
top-picks,オリコン,山崎賢人ミット打ち 尚弥「重い」,山崎賢人、井上尚弥相手にミット打ち　最強王者が太鼓判「パンチ、重いっすよ」,https://news.yahoo.co.jp/pickup/6514718,https://news.yahoo.co.jp/articles/0aa61715f6f52631daf5f6e6bf43cbbac1917587,9/25(水) 18:40
top-picks,産経新聞,星野リゾート代表 円高に危機感,円高「必ずマイナス」、リピーター増が必須　星野リゾート代表、危機感示す,https://news.yahoo.co.jp/pickup/6514717,https://news.yahoo.co.jp/articles/508f2bd9268ee4d3fa2cb56aeb87d37c627f48dd,9/25(水) 18:28
top-picks,共同通信,被爆地やゆ? 下関市長が発言謝罪,被爆地やゆ？発言を謝罪　前田晋太郎下関市長,https://news.yahoo.co.jp/pickup/6514716,https://news.yahoo.co.jp/articles/d77b76cb73df64f19535c97213cac086d1cc422d,9/25(水) 18:17
top-picks,読売新聞（ヨミドクター）,唐揚げ初めて口に 代謝異常の30歳,フェニルケトン尿症　30歳になるまで唐揚げを口にできなかった女性…「『普通の食事』に罪悪感あった」,https://news.yahoo.co.jp/pickup/6514715,https://news.yahoo.co.jp/articles/64f27cf3f50eef0dd023d79807924074cb614250,9/25(水) 18:13
top-picks,STVニュース北海道,大学院生死亡事故 男は6h超飲酒か,【最新】札幌市内で飲酒転々６時間超　足取り徐々に…飲酒運転死亡事故・逮捕の男に「許せない」,https://news.yahoo.co.jp/pickup/6514714,https://news.yahoo.co.jp/articles/7e4dbccada29b12441b41d0408b1ab9a9bf214e9,9/25(水) 18:07
top-picks,スポニチアネックス,「おまかせ」終了報道 TBSは否定,TBS　「アッコにおまかせ！」番組終了報道を否定　“トド発言”、都知事選誤情報発信にも言及,https://news.yahoo.co.jp/pickup/6514711,https://news.yahoo.co.jp/articles/128f44e5656b306eb3f2647f2ff3599d843d46bb,9/25(水) 18:07
top-picks,毎日新聞,返礼品に60円と誤表示 寄付が殺到,1万円を60円と誤表示で寄付殺到　愛知・南知多町の返礼品,https://news.yahoo.co.jp/pickup/6514712,https://news.yahoo.co.jp/articles/d38f63ab58a886c0d1ea0725ae49d1a7de57e371,9/25(水) 18:01
top-picks,弁護士ドットコムニュース,「結婚したら禁煙」法的効力は,「結婚したら禁煙する」約束を守らず、子どもが生まれても喫煙する夫…妻は「婚姻無効にしたい」,https://news.yahoo.co.jp/pickup/6514709,https://news.yahoo.co.jp/articles/d4a293d2e88fbaf0573ff9081b86274f743215c4,9/25(水) 18:01
top-picks,THE ANSWER,大谷の前で三重殺 監督が采配説明,三重殺敗戦にロバーツ監督「はぁ…」　ため息で采配説明、大谷直前にバントなし「できなかった」,https://news.yahoo.co.jp/pickup/6514710,https://news.yahoo.co.jp/articles/54d8a6517f5c5ccd04b00123546a0b6033d6df64,9/25(水) 17:39
top-picks,ITmedia NEWS,「ワニワニパニック」開発者 死去,「ワニワニパニック」開発、バンナム石川祝男氏死去　スリッパと段ボールで試作しプレゼン,https://news.yahoo.co.jp/pickup/6514708,https://news.yahoo.co.jp/articles/cdd0adb4b6666c468dc49a024306786c63283ae7,9/25(水) 17:37
top-picks,共同通信,北のごみ風船 韓国の空港機能まひ,北朝鮮ごみ風船で滑走路運用中断　韓国の空港機能まひ、被害相次ぐ,https://news.yahoo.co.jp/pickup/6514707,https://news.yahoo.co.jp/articles/964e6a35da4b7a9ae38debf23e69a61a6c524f8a,9/25(水) 17:20
top-picks,THE ANSWER,大谷翔平の直前に三重殺 監督嘆く,三重殺敗戦にロバーツ監督「はぁ…」　ため息で采配説明、大谷直前にバントなし「できなかった」,https://news.yahoo.co.jp/pickup/6514706,https://news.yahoo.co.jp/articles/54d8a6517f5c5ccd04b00123546a0b6033d6df64,9/25(水) 17:10
top-picks,FNNプライムオンライン（フジテレビ系）,豪雨 岩場で心肺停止状態の人発見,【速報】石川・珠洲市の海岸沿い岩場で人を発見　心肺停止状態で年代・性別分からず　能登地方豪雨で新たな被害,https://news.yahoo.co.jp/pickup/6514705,https://news.yahoo.co.jp/articles/45910f34ee19f8adb4b4deba749aef07305d240d,9/25(水) 17:06
top-picks,産経新聞,異例のICBM実験公表 中国の狙い,中国、異例のICBM実験公表　対米牽制の意図鮮明に　ミサイル、太平洋着弾も,https://news.yahoo.co.jp/pickup/6514704,,9/25(水) 17:02
top-picks,北國新聞社,全焼した永井豪記念館解体へ 輪島,永井豪記念館解体へ　輪島・朝市通り　市方針 全焼、損傷激しく　「新たな施設に」「残し活用を」,https://news.yahoo.co.jp/pickup/6514703,https://news.yahoo.co.jp/articles/70bf15ed6f05cf88ef0b0ecc1e69f798617ebe62,9/25(水) 16:52
top-picks,CNN.co.jp,ハリス氏とトランプ氏競る CNN,米大統領選、ハリス氏とトランプ氏が激しく競る　ＣＮＮ世論調査,https://news.yahoo.co.jp/pickup/6514701,https://news.yahoo.co.jp/articles/f40ee27cc51afb0b19552e6dc72554b6bdc4a284,9/25(水) 16:47
top-picks,朝日新聞デジタル,東京都 第1子の保育料を無償化へ,東京都が第1子の保育料を無償化へ　小池百合子知事が選挙で公約,https://news.yahoo.co.jp/pickup/6514698,https://news.yahoo.co.jp/articles/9d621cf242c6dfd7c8572091d31d13bd343a6564,9/25(水) 16:46
top-picks,TBS NEWS DIG Powered by JNN,民間企業の平均給与増加 460万円,【速報】去年の民間企業の平均給与460万円で2014年以降最高に　男女の格差は4年連続拡大　国税庁,https://news.yahoo.co.jp/pickup/6514700,https://news.yahoo.co.jp/articles/e10fc347ecfe8779d59bcad6e1d5042451369bed,9/25(水) 16:37
top-picks,朝日新聞デジタル,中野サンプラザ跡のビル 完成延期,中野サンプラザ跡61階ビル、完成延期に　建設費900億円上ぶれか,https://news.yahoo.co.jp/pickup/6514696,https://news.yahoo.co.jp/articles/2695f958a35fc87ee06de0a36ffe6e834be7fc61,9/25(水) 16:27
top-picks,読売新聞オンライン,野村証券 国債取引で相場操縦疑い,野村証券が国債取引で相場操縦の疑い、監視委が課徴金を勧告へ…「見せ玉」という手口か,https://news.yahoo.co.jp/pickup/6514695,https://news.yahoo.co.jp/articles/93cdf80f9fa1da884738af16ad1d4161bb4dc79e,9/25(水) 16:24
top-picks,スポーツ報知,池江璃花子 白血病が「完全寛解」,池江璃花子、急性リンパ性白血病の「完全寛解」を報告「とても長い５年間だった」感謝の思いつづる,https://news.yahoo.co.jp/pickup/6514694,https://news.yahoo.co.jp/articles/c0318aa8aa2591b620d072c454be2b59acbe136a,9/25(水) 16:13
top-picks,TBS NEWS DIG Powered by JNN,民間企業の平均給与 3年連続増加,【速報】去年の民間企業の平均給与460万円で2014年以降最高に　男女の格差は4年連続拡大　国税庁,https://news.yahoo.co.jp/pickup/6514692,https://news.yahoo.co.jp/articles/e10fc347ecfe8779d59bcad6e1d5042451369bed,9/25(水) 15:52
top-picks,tenki.jp,都心25℃届かず あす暑さぶり返す,都心25℃届かず　明日26日〜関東以西で真夏日増加　10月に入っても残暑長続き,https://news.yahoo.co.jp/pickup/6514693,https://news.yahoo.co.jp/articles/141b9ac44086ab56a9841c58dca3ba9df2e642d4,9/25(水) 15:50
top-picks,関西テレビ,次期市長候補 初の求人サイト公募,【速報】「次の四條畷市長」民間求人サイトで全国初の「公募」と現職市長が発表　次の市長選挙に出馬せず,https://news.yahoo.co.jp/pickup/6514691,https://news.yahoo.co.jp/articles/c303983fc6cff1ed3740b877bf56a6991181a81d,9/25(水) 15:23
top-picks,読売新聞オンライン,Snow Manラウール、パリコレ登場,「Ｓｎｏｗ　Ｍａｎ」ラウール、パリコレ登場…アンリアレイジの膨らむウェアでランウェーに,https://news.yahoo.co.jp/pickup/6514689,https://news.yahoo.co.jp/articles/b0d6cd52032f4005ec2baa53e1cdf9d6dc130f7e,9/25(水) 15:08
top-picks,FNNプライムオンライン（フジテレビ系）,総裁選は石破氏ら3人が激戦 FNN,【最新情勢】石破氏・高市氏・小泉氏で激戦　党員票で石破氏が全国的支持トップ・関西圏では高市氏　議員票は小泉氏リード　あさって投開票の自民党総裁選,https://news.yahoo.co.jp/pickup/6514685,https://news.yahoo.co.jp/articles/b9cbac82b54a4d275ececf2db52ea5cb9c48324f,9/25(水) 15:02
top-picks,ABEMA TIMES,ドジャース 三重殺で劇的敗戦,大谷翔平、今季95本目長打で球団新記録を樹立も… ド軍は地区優勝をかけた天王山の初戦を落とす サヨナラ好機で大谷目前もトリプルプレーで劇的幕切れ,https://news.yahoo.co.jp/pickup/6514684,https://news.yahoo.co.jp/articles/cf4ee6ed06cee93cc4b8db0cebd38706313b47cb,9/25(水) 14:44
top-picks,スポニチアネックス,梅宮アンナ「抗がん剤がつらい」,梅宮アンナ　乳がん闘病SNSで発信「絶望じゃなく希望を与えたいから」投稿に込めた思い、取材で語る,https://news.yahoo.co.jp/pickup/6514683,https://news.yahoo.co.jp/articles/356f7a13d16ad44963e1983626566e1a213489fb,9/25(水) 14:43
top-picks,産経新聞,手足口病また増加 異例の9月流行,「手足口病」が再増加で異例の流行　前年同時期の5倍超える感染者数　過去10年で最多,https://news.yahoo.co.jp/pickup/6514682,https://news.yahoo.co.jp/articles/3e4fc8cc360a5f40720e5d29df3c2615ae39c61f,9/25(水) 14:34
top-picks,ABEMA TIMES,ド軍敗戦 トリプルプレーで幕切れ,大谷翔平、今季95本目長打で球団新記録を樹立も… ド軍は地区優勝をかけた天王山の初戦を落とす トリプルプレーで劇的幕切れ,https://news.yahoo.co.jp/pickup/6514681,https://news.yahoo.co.jp/articles/cf4ee6ed06cee93cc4b8db0cebd38706313b47cb,9/25(水) 14:30
top-picks,スポニチアネックス,梅宮アンナ がん闘病発信する理由,梅宮アンナ　乳がん闘病SNSで発信「絶望じゃなく希望を与えたいから」投稿に込めた思い、取材で語る,https://news.yahoo.co.jp/pickup/6514680,https://news.yahoo.co.jp/articles/356f7a13d16ad44963e1983626566e1a213489fb,9/25(水) 14:16
top-picks,TBS NEWS DIG Powered by JNN,中国SNS 「日本人学校デマ」蔓延,日本人学校の男児刺殺事件から1週間　中国SNSに“デマ蔓延”で保護者に不安「ランドセル背負わせないように」【news23】,https://news.yahoo.co.jp/pickup/6514679,https://news.yahoo.co.jp/articles/1588e116ca750011f80ceae96f4568cef4ab803f,9/25(水) 14:00
top-picks,ITmedia NEWS,モンハン新作 最上位版は18万円,「モンハン」新作、最上位版は約18万円　折り畳み自転車がセット、ファン当惑,https://news.yahoo.co.jp/pickup/6514676,https://news.yahoo.co.jp/articles/c517fbf5567f2709b87d81769d48786c2113fd00,9/25(水) 13:37
top-picks,毎日新聞,仮想化ソフト大手 独禁法違反疑い,仮想化ソフトウエア大手が抱き合わせ販売か　公取委が立ち入り検査,https://news.yahoo.co.jp/pickup/6514675,https://news.yahoo.co.jp/articles/426dc0d17cedc9f8a338f18f3ab569b3c103d9ad,9/25(水) 13:16
top-picks,AERA dot.,そば店 全国展開に「西日本の壁」,なぜ「そば」チェーン店は全国展開できないのか　「ゆで太郎」の挑戦にみる“西日本の壁”の正体,https://news.yahoo.co.jp/pickup/6514674,https://news.yahoo.co.jp/articles/f168c05e5730f4f7a9a1e5378a2cce1406e705bd,9/25(水) 13:10
top-picks,読売新聞オンライン,中国がICBMを発射 太平洋に着弾,中国がＩＣＢＭ発射し太平洋の公海に着弾…「訓練の一環」と主張、米国を威嚇か,https://news.yahoo.co.jp/pickup/6514673,https://news.yahoo.co.jp/articles/1490309b4ef74b81ed6d7d6902b9a27f31ae6bf8,9/25(水) 13:02
top-picks,CNN.co.jp,米大統領 ガザの戦争終わらせる時,バイデン米大統領、ガザ停戦交渉を呼び掛け　国連総会の一般討論演説,https://news.yahoo.co.jp/pickup/6514672,https://news.yahoo.co.jp/articles/5d2652827907bdf8a6005d1c758879eb46a8fc31,9/25(水) 12:57
top-picks,坂本昌彦,気圧の変化 ぜんそく発作と関係は,台風で子どもの喘息は増えるのか？,https://news.yahoo.co.jp/pickup/6514668,,9/25(水) 12:50
top-picks,サンケイスポーツ,中田英寿氏 上場企業の執行役員に,中田英寿氏、サニーサイドアップGの執行役員に　上場企業で異例≠ﾌ抜擢,https://news.yahoo.co.jp/pickup/6514667,https://news.yahoo.co.jp/articles/5dbab95d13f1a2ac1f77557b70b8d657ccae9d1c,9/25(水) 12:45
top-picks,共同通信,能登豪雨の死者9人 新たに1人発見,能登豪雨の死者9人に　石川・輪島で1人発見,https://news.yahoo.co.jp/pickup/6514670,https://news.yahoo.co.jp/articles/b193bdf7bac95af31521d32338c37fa304c1b306,9/25(水) 12:44
top-picks,読売新聞オンライン,中国軍がICBMを発射 海に着弾,中国ロケット軍、ＩＣＢＭを太平洋に向け発射し着弾させたと発表…米国に対する威嚇か,https://news.yahoo.co.jp/pickup/6514665,https://news.yahoo.co.jp/articles/1490309b4ef74b81ed6d7d6902b9a27f31ae6bf8,9/25(水) 12:10
top-picks,共同通信,5160万円でポケカ落札 米競売,ポケモンカードに5千万円　米競売、39枚だけ流通,https://news.yahoo.co.jp/pickup/6514666,https://news.yahoo.co.jp/articles/cd6c5693d170f02ce7f097f6ec887e059d3566a1,9/25(水) 12:06
top-picks,スポニチアネックス,大谷、ダルビッシュ&松井と談笑,大谷翔平がダルビッシュ、松井裕樹らと約12分間談笑　首位攻防戦も試合前はリラックスムード,https://news.yahoo.co.jp/pickup/6514662,https://news.yahoo.co.jp/articles/cb8db0b7590d2e55b00bd63b02a20b433bf4c2be,9/25(水) 11:52
top-picks,共同通信,ポケモンカードに5千万円 米競売,ポケモンカードに5千万円　米競売、39枚だけ流通,https://news.yahoo.co.jp/pickup/6514661,https://news.yahoo.co.jp/articles/cd6c5693d170f02ce7f097f6ec887e059d3566a1,9/25(水) 11:26
top-picks,読売新聞オンライン,ChatGPT音声対話「人間並み」に,チャットＧＰＴに新たな音声対話機能、人間並みの会話が可能に…日本語にも対応,https://news.yahoo.co.jp/pickup/6514659,https://news.yahoo.co.jp/articles/90610a934aa8696caedbb82ad0a3d5ee6e8141fc,9/25(水) 11:20
top-picks,読売新聞オンライン,大の里が大関昇進 昭和以降で最速,大関昇進の大の里「唯一無二の力士を目指し相撲道に精進」…初土俵から９場所で昭和以降最速の昇進,https://news.yahoo.co.jp/pickup/6514658,https://news.yahoo.co.jp/articles/2a0ca334f01ff17398231ea40bdeafc48e925aa6,9/25(水) 11:12
top-picks,中国新聞デジタル,岸田首相、退任後の立ち位置は,岸田首相、退任後の立ち位置は　キングメーカー・院政・入閣…戦後の首相の歩みに見る,https://news.yahoo.co.jp/pickup/6514655,https://news.yahoo.co.jp/articles/0dd3e91a7f8837f4225d83f6d675f3af21302a43,9/25(水) 10:48
