media_en,media_jp,title_articles,date_original
jij,時事通信,あいさつする佐々木と吉井監督,11/17(日) 12:13
jij,時事通信,あいさつする佐々木,11/17(日) 12:13
jij,時事通信,石破首相、APEC台湾代表と会談,11/17(日) 12:07
jij,時事通信,才木浩人「完全アウェー」台湾戦で快投　プレミア12で積む「経験」,11/17(日) 12:00
jij,時事通信,「壁」進展なければ補正賛成せず　国民・古川税調会長,11/17(日) 11:56
jij,時事通信,対米外交「安倍政権の経験生かす」　林官房長官,11/17(日) 11:18
jij,時事通信,女性当選最多も、27府県で「ゼロ」◆偏りの理由は？超党派議連・中川正春氏に聞く【衆院選2024】,11/17(日) 11:02
jij,時事通信,ＡＰＥＣ閉幕,11/17(日) 10:48
jij,時事通信,イスラエル軍の空爆で立ち上る煙,11/17(日) 10:48
jij,時事通信,石破首相、フジモリ氏墓に献花,11/17(日) 10:45
jij,時事通信,渋野のショット,11/17(日) 10:22
jij,時事通信,ＡＰＥＣ首脳の集合写真,11/17(日) 10:12
jij,時事通信,石破首相、ベトナム首脳らと会談　「安保含め関係発展を」,11/17(日) 9:57
jij,時事通信,オランダが準々決勝へ　サッカー欧州ネーションズL,11/17(日) 9:53
jij,時事通信,吉田のフリー,11/17(日) 9:52
jij,時事通信,吉田が優勝、ファイナルへ,11/17(日) 9:52
jij,時事通信,イスラエル首相私邸に照明弾　ネタニヤフ氏は不在,11/17(日) 9:32
jij,時事通信,吉村氏ら4氏立候補　衆院選敗北、立て直し図る　維新代表選告示,11/17(日) 9:21
jij,時事通信,北朝鮮派兵「深刻に懸念」　正常化60周年で「関係飛躍」　日韓首脳,11/17(日) 9:12
jij,時事通信,日本、４強ならず,11/17(日) 9:08
jij,時事通信,姫野のトライ,11/17(日) 9:06
jij,時事通信,日本、ウルグアイに勝利,11/17(日) 9:06
jij,時事通信,ゴーン被告らの起訴要請,11/17(日) 9:06
jij,時事通信,MLBアナリストがデータで見た大谷翔平の進化　「30センチ」「全球種で長打」,11/17(日) 9:00
jij,時事通信,トランプ氏との会談見送り表明　石破首相「なるべく早く」,11/17(日) 8:59
jij,時事通信,握手する米中首脳,11/17(日) 8:53
jij,時事通信,吉田が優勝、ファイナルへ　フィギュア,11/17(日) 8:28
jij,時事通信,対話維持、重要性を確認　習氏、トランプ氏と協力意向　関係進展「誇り」とバイデン氏・米中首脳会談,11/17(日) 8:07
jij,時事通信,インド人材、日本に魅力発信　往来拡大、両国課題解決に貢献　片桐・全日空代表,11/17(日) 7:42
jij,時事通信,インド人材確保、日本の官民が一丸　地方が熱視線、「5年で5万人」目標も,11/17(日) 7:41
jij,時事通信,闇バイトの「脱却支援」強化　避難費用助成、自宅警戒も　「脅迫恐れず相談を」・警察当局,11/17(日) 7:41
jij,時事通信,【図解】戸籍、読み仮名記載に暗雲＝改正法対応「間に合わない」―自治体から懸念相次ぐ,11/17(日) 7:41
jij,時事通信,戸籍、読み仮名記載に暗雲　改正法対応「間に合わない」　自治体から懸念相次ぐ,11/17(日) 7:41
jij,時事通信,通学路の見守り、高齢化が課題　模索する現場、ICタグ活用も　小1女児殺害20年・奈良,11/17(日) 7:40
jij,時事通信,「安全への取り組みが続くことを」　奈良女児殺害20年、遺族が手記,11/17(日) 7:40
jij,時事通信,温室ガス削減、なぜ深掘り？　　「1．5度目標」達成困難に・COP29,11/17(日) 7:30
jij,時事通信,どうなるセブン＆アイ　創業家と外資が買収提案,11/17(日) 7:30
jij,時事通信,兵庫知事選、投票進む　県政再建争点、7人が立候補,11/17(日) 7:19
jij,時事通信,個人消費回復に懐疑論　物価高重し、トランプ政権に懸念も　実質GDP、2期連続プラス成長〔深層探訪〕,11/17(日) 7:00
jij,時事通信,中国圧力で「台湾」広告撤去　APEC開催のペルー,11/17(日) 6:12
jij,時事通信,ウクライナに「揺るぎない支援」　侵攻1000日控え　G7首脳,11/17(日) 6:12
jij,時事通信,自由貿易の重要性を確認　首脳宣言、保護主義けん制　APEC閉幕,11/17(日) 5:43
jij,時事通信,ゴーン被告らの起訴要請　贈収賄事件、ダチ文化相も　仏当局,11/17(日) 5:42
jij,時事通信,中国、26年のAPEC議長国に　習氏,11/17(日) 1:41
jij,時事通信,高専で切り付け、25人死傷　中国江蘇省,11/17(日) 1:35
jij,時事通信,日本、4強ならず　イタリアに敗れる―女子テニス国別対抗戦,11/17(日) 0:58
jij,時事通信,首相、トランプ氏との会談見送り　南米帰途は断念,11/17(日) 0:12
jij,時事通信,力投する大勢　野球プレミア１２,11/16(土) 22:47
jij,時事通信,喜ぶ日本　野球プレミア１２,11/16(土) 22:46
jij,時事通信,岩屋外相、ウクライナ訪問,11/16(土) 22:46
jij,時事通信,日本、台湾下し3連勝　才木が六回途中無失点―野球プレミア12,11/16(土) 22:39
jij,時事通信,安保情報の共有強化　岩屋外相、ウクライナ訪問,11/16(土) 22:34
jij,時事通信,下村青さんのお別れ会（俳優、8月13日死去）,11/16(土) 22:30
jij,時事通信,鍵山が２戦連続Ｖ　フィギュア,11/16(土) 22:29
jij,時事通信,力投する北山　野球プレミア１２,11/16(土) 22:24
jij,時事通信,鍵山が2戦連続V　女子は吉田が優勝―フィギュア,11/16(土) 22:13
jij,時事通信,力投する鈴木昭　野球プレミア１２,11/16(土) 21:45
jij,時事通信,青森で震度4,11/16(土) 21:31
jij,時事通信,源田、初スタメンで豪快ソロ　野球プレミア12,11/16(土) 21:29
jij,時事通信,めぐみさん拉致４７年で県民集会,11/16(土) 21:11
jij,時事通信,叫ぶ才木　野球プレミア１２,11/16(土) 20:59
jij,時事通信,日本、ミスにつけ込む　野球プレミア12,11/16(土) 20:44
jij,時事通信,祝福される源田　野球プレミア１２,11/16(土) 20:42
jij,時事通信,日本、台湾下し３連勝,11/16(土) 20:42
jij,時事通信,衰えぬ突き押し　玉鷲、40歳の誕生日飾る―大相撲九州場所,11/16(土) 20:39
jij,時事通信,石破首相、トランプ政権に備え　日米・日米韓が連携確認　同盟・協力固定化図る,11/16(土) 20:35
jij,時事通信,中国主席、日韓に秋波　トランプ氏復権見据え,11/16(土) 20:35
jij,時事通信,日米韓、連携継続へ事務局新設　トランプ氏復権で再び試練,11/16(土) 20:34
jij,時事通信,極右ルペン氏、政敵が擁護　大統領選出馬危機で　仏,11/16(土) 20:33
jij,時事通信,自由貿易の重要性を強調　APEC首脳会議、17日閉幕,11/16(土) 20:33
jij,時事通信,母「生きていてくれたらいい」　めぐみさん拉致47年で県民集会　新潟,11/16(土) 20:32
jij,時事通信,強盗容疑などで女2人再逮捕　男子大学生暴行死　北海道警,11/16(土) 20:29
jij,時事通信,実業家マスク氏との会談否定　イラン,11/16(土) 20:28
jij,時事通信,ポーズを決める辰己　野球プレミア１２,11/16(土) 20:25
jij,時事通信,辰己の適時二塁打　野球プレミア１２,11/16(土) 20:24
jij,時事通信,才木の力投　野球プレミア１２,11/16(土) 20:01
jij,時事通信,力投する才木　野球プレミア１２,11/16(土) 19:45
jij,時事通信,生還する桑原　野球プレミア１２,11/16(土) 19:40
jij,時事通信,山口が決勝進出　バドミントン,11/16(土) 19:36
jij,時事通信,稲川の滑走　四大陸スピードスケート,11/16(土) 19:33
jij,時事通信,東洋大が先勝　東都大学野球入れ替え戦,11/16(土) 19:33
jij,時事通信,大の里、本来の取り口　大相撲九州場所,11/16(土) 19:24
jij,時事通信,東京・町田で高齢女性死亡　警視庁,11/16(土) 19:15
jij,時事通信,攻める尊富士,11/16(土) 19:14
jij,時事通信,笑顔の堀川　四大陸スピードスケート,11/16(土) 19:13
jij,時事通信,米大統領と台湾代表,11/16(土) 19:12
jij,時事通信,台湾代表、バイデン氏を招待　APECで非公式対話,11/16(土) 19:12
jij,時事通信,宮邸を弔問された上皇ご夫妻,11/16(土) 19:08
jij,時事通信,宮邸を弔問された上皇ご夫妻,11/16(土) 19:08
jij,時事通信,宮邸を弔問された両陛下,11/16(土) 19:07
jij,時事通信,宮邸を弔問された両陛下,11/16(土) 19:07
jij,時事通信,磐田、残留に黄信号　Jリーグ,11/16(土) 19:06
jij,時事通信,宝富士の寄り切り,11/16(土) 19:04
jij,時事通信,玉鷲の押し倒し,11/16(土) 19:04
jij,時事通信,攻める若元春,11/16(土) 19:04
jij,時事通信,堀川、女子３０００でＶ,11/16(土) 19:03
jij,時事通信,敗れた若隆景,11/16(土) 19:02
jij,時事通信,琴桜の上手投げ,11/16(土) 19:02
jij,時事通信,日本代表がアモイ到着　サッカーW杯予選,11/16(土) 19:01
jij,時事通信,豊昇龍初黒星、土つかず消える,11/16(土) 19:01
jij,時事通信,攻める大の里,11/16(土) 19:01
jij,時事通信,力投する上野　ソフトＪＤリーグ,11/16(土) 18:59
jij,時事通信,５８歳タイソンがリングに,11/16(土) 18:58
jij,時事通信,点取り屋、抜群の嗅覚　横浜Mのアンデルソンロペスが得点王へ前進―Jリーグ,11/16(土) 18:49
jij,時事通信,ボールを追うアンデルソンロペス,11/16(土) 18:47
jij,時事通信,横浜Ｍが２連勝　Ｊリーグ,11/16(土) 18:46
jij,時事通信,敗れた磐田イレブン　Ｊリーグ,11/16(土) 18:44
jij,時事通信,アンデルソンロペスの２点目,11/16(土) 18:43
jij,時事通信,アンデルソンロペスの同点ゴール,11/16(土) 18:43
jij,時事通信,ショットを放つ松山　男子ゴルフ,11/16(土) 18:41
jij,時事通信,永野２位、松山英は３位　男子ゴルフ,11/16(土) 18:41
jij,時事通信,豊昇龍初黒星、土つかず消える　大の里、連敗免れ5勝目―大相撲九州場所7日目,11/16(土) 18:39
jij,時事通信,息吹き返した中国　19日に日本と対戦―サッカーW杯予選,11/16(土) 18:28
jij,時事通信,INAC神戸が首位守る　WEリーグ,11/16(土) 18:17
jij,時事通信,前阪神の岩田を獲得　プロ野球・DeNA,11/16(土) 18:14
jij,時事通信,ブレイディヴェーグ4．6倍　競馬マイルCS,11/16(土) 18:08
jij,時事通信,58歳タイソンがリングに　8回戦で判定負け―ボクシング,11/16(土) 18:07
jij,時事通信,堀川、女子3000でV　四大陸スピードスケート,11/16(土) 17:57
jij,時事通信,百合子さま「御舟入」　両陛下、上皇ご夫妻が弔問,11/16(土) 17:54
jij,時事通信,トヨタ、日立が決勝へ,11/16(土) 17:47
jij,時事通信,トヨタ、日立が決勝へ,11/16(土) 17:47
jij,時事通信,谷口が手術　サッカー日本代表,11/16(土) 17:47
jij,時事通信,マクグリービーが首位キープ　永野2位、松山英は3位―フェニックス男子ゴルフ,11/16(土) 17:31
jij,時事通信,トヨタ、日立が決勝へ　ソフト女子JDリーグ,11/16(土) 17:28
jij,時事通信,Ａ・ロッド、大谷を語る　大リーグ,11/16(土) 17:20
jij,時事通信,共産系団体が新人擁立　岐阜知事選,11/16(土) 17:14
jij,時事通信,前阪神の加治屋を獲得　プロ野球・楽天,11/16(土) 17:09
jij,時事通信,A・ロッド、大谷を語る　都内のイベントで絶賛―米大リーグ,11/16(土) 17:08
jij,時事通信,Ａ・ロッド、大谷を語る　大リーグ,11/16(土) 17:07
jij,時事通信,ルーキー政田、2位で最終日へ　エリエール女子ゴルフ,11/16(土) 17:03
jij,時事通信,日中首脳、相互往来で一致　水産物輸入再開へ合意履行　習氏「外国人安全を確保」,11/16(土) 17:02
jij,時事通信,【図解】台湾の船長解放＝7月に拿捕、罰金徴収―中国,11/16(土) 16:49
jij,時事通信,台湾の船長解放　7月に拿捕、罰金徴収　中国,11/16(土) 16:49
jij,時事通信,小学校でこんろ爆発か　児童ら9人けが　広島,11/16(土) 16:27
jij,時事通信,佐々木八段勝ちタイに　将棋・竜王戦,11/16(土) 16:27
jij,時事通信,横浜Mが2連勝　J1,11/16(土) 16:26
jij,時事通信,政田のティーショット　女子ゴルフ,11/16(土) 16:22
jij,時事通信,山下が単独首位守る　女子ゴルフ,11/16(土) 16:22
jij,時事通信,アンデルソンロペスが3ゴール　Jリーグ・磐田―横浜M,11/16(土) 16:18
jij,時事通信,極右ルペン氏の被選挙権停止を求刑,11/16(土) 15:54
jij,時事通信,インフラ投資で透明性を　中国主導の港開港でペルーに念押し　米,11/16(土) 15:53
jij,時事通信,米ペルー首脳が会談,11/16(土) 15:49
jij,時事通信,山下が単独首位守る　エリエール女子ゴルフ,11/16(土) 15:33
jij,時事通信,河村、7得点10アシスト　NBA下部で初出場,11/16(土) 15:09
jij,時事通信,東京国際大の横溝監督死去　陸上,11/16(土) 15:09
jij,時事通信,議員立法で救う弱者の権利　「荒野のともしび」を目指して【政界Web】,11/16(土) 15:00
jij,時事通信,インド人材確保、日本の官民が一丸,11/16(土) 14:59
jij,時事通信,兵庫知事選、17日投開票　県政再建争点、最多7人で競う,11/16(土) 14:53
jij,時事通信,小１女児殺害２０年　奈良,11/16(土) 14:53
jij,時事通信,サイバー法案成立へ政党間協議　自民政調会長、国民民主念頭,11/16(土) 14:46
jij,時事通信,ウルグアイが2位浮上　サッカーW杯南米予選,11/16(土) 14:46
jij,時事通信,インドで病院火災、新生児10人死亡　電気ショート原因か,11/16(土) 14:45
jij,時事通信,巨大自由貿易圏、実現へ年次評価　APEC、成果文書に明記で調整　「FTAAP」研究深化・首脳会議,11/16(土) 14:32
jij,時事通信,ニュースワード「FTAAP」,11/16(土) 14:31
jij,時事通信,地上戦拡大、停戦へ圧力か　対ヒズボラ、泥沼化懸念も　イスラエル,11/16(土) 14:23
jij,時事通信,ニュースワード「奈良女児誘拐殺害事件」,11/16(土) 14:10
jij,時事通信,【Infographie】米国政党の勢力,11/16(土) 13:49
jij,時事通信,【Infographie】米共和党、下院の過半数獲得,11/16(土) 13:47
jij,時事通信,旅費クラファン、初日に目標達成　ノーベル授賞式、継続募集　日本被団協,11/16(土) 13:37
jij,時事通信,日米首脳が初の対面会談,11/16(土) 13:36
jij,時事通信,古里の平壌冷麺、日本でも　脱北者の料理店、連日行列　「本場の味届ける」・千葉,11/16(土) 13:34
jij,時事通信,【Infographie】中国の車暴走事件,11/16(土) 13:34
jij,時事通信,「未来のおむつ」万博で発信　多彩デザインのショー開催へ,11/16(土) 13:34
jij,時事通信,「世界最大」のサンゴ発見　ソロモン諸島沖、バスケコート2面分,11/16(土) 13:33
jij,時事通信,日中懸案、解消見通せず　石破首相、習氏反応に手応えも,11/16(土) 13:32
jij,時事通信,東京駅前、輸入電動車を一堂展示　組合主催、市場活性化に向け,11/16(土) 13:09
jij,時事通信,元国鉄の徳武定之さん死去　プロ野球,11/16(土) 12:57
jij,時事通信,ティーショットを放つ勝　米女子ゴルフ,11/16(土) 12:42
jij,時事通信,「地面師」メンバーを逮捕,11/16(土) 12:41
jij,時事通信,「地面師」メンバーを逮捕、中心人物か　横浜の土地、1．2億円詐取容疑　逃亡先の比から帰国・警視庁,11/16(土) 12:39
jij,時事通信,JR貨物の列車脱線　けが人なし　北海道,11/16(土) 12:06
jij,時事通信,百合子さま悼み記帳　ゆかりの人ら「感謝の気持ちで」　三笠宮邸,11/16(土) 11:57
jij,時事通信,ヨルダンが2位維持　サッカーW杯予選,11/16(土) 11:50
jij,時事通信,首相動静（11月16日）,11/16(土) 11:40
jij,時事通信,石破首相「自由な貿易・投資環境を」　APECで訴え,11/16(土) 11:11
jij,時事通信,到着した石破首相,11/16(土) 11:09
jij,時事通信,輸入再開へ合意実施を確認,11/16(土) 11:07
jij,時事通信,31年議長、日本が立候補　石破首相、APEC首脳会議で表明,11/16(土) 11:05
jij,時事通信,百合子さま悼み記帳,11/16(土) 10:49
jij,時事通信,ペルー入りした石破首相,11/16(土) 10:48
jij,時事通信,武将山が休場　大相撲九州場所,11/16(土) 10:43
jij,時事通信,ユベントス、ポグバの契約解除　イタリア・サッカー,11/16(土) 10:38
jij,時事通信,畑岡奈紗が暫定8位、勝みなみ16位　米女子ゴルフのアニカ・ゲインブリッジ,11/16(土) 10:29
jij,時事通信,久常涼は暫定60位　米男子ゴルフ・バミューダ選手権,11/16(土) 10:18
jij,時事通信,米大統領報道官は２７歳女性,11/16(土) 10:13
jij,時事通信,【Infographie】インドネシア・レウォトビ山噴火,11/16(土) 10:07
jij,時事通信,三原のＳＰ　フィギュア,11/16(土) 9:32
jij,時事通信,松生のＳＰ　フィギュア,11/16(土) 9:32
jij,時事通信,山本のＳＰ　フィギュア,11/16(土) 9:32
jij,時事通信,岩屋外相、ウクライナ入り,11/16(土) 9:31
jij,時事通信,シュートを放つ菅原　サッカー,11/16(土) 9:30
jij,時事通信,トランプ次期米大統領、化石燃料増産へ新組織　内務長官にバーガム氏,11/16(土) 9:17
jij,時事通信,友野のＳＰ　フィギュア,11/16(土) 9:15
jij,時事通信,吉田のＳＰ　フィギュア,11/16(土) 9:15
jij,時事通信,祝福される菅原　サッカー,11/16(土) 9:13
jij,時事通信,パスを出す南野　サッカー,11/16(土) 9:13
jij,時事通信,鍵山のＳＰ　フィギュア,11/16(土) 9:11
jij,時事通信,鍵山優真がＳＰ首位　フィギュア,11/16(土) 9:11
jij,時事通信,イラン核兵器研究施設を破壊か,11/16(土) 9:09
jij,時事通信,民主党全国委員長に出馬検討,11/16(土) 9:06
jij,時事通信,水産物輸入再開へ合意実施　日中、戦略的互恵を推進　石破首相、習主席と初会談,11/16(土) 9:06
jij,時事通信,「世界最大」のサンゴ発見,11/16(土) 9:05
jij,時事通信,ポルトガルが準々決勝へ　サッカー欧州ネーションズL,11/16(土) 9:05
jij,時事通信,日米韓「制度化」へ事務局,11/16(土) 9:00
jij,時事通信,日米韓首脳会談,11/16(土) 9:00
jij,時事通信,トランプ次期政権、米大統領報道官は27歳女性　歴代最年少のリービット氏,11/16(土) 8:55
jij,時事通信,衆院選で買収容疑、町議逮捕　運動員2人に報酬6万円　大阪府警,11/16(土) 8:50
jij,時事通信,トランプ氏との初会談難航　石破首相「具体的に決まらず」,11/16(土) 8:49
jij,時事通信,岩屋外相、ウクライナ入り　石破内閣で初、支援継続を伝達,11/16(土) 8:20
jij,時事通信,日本、独走で折り返し　インドネシアに4ゴール―サッカーW杯予選,11/16(土) 8:14
jij,時事通信,〔NY外為〕円、154円台前半（15日）,11/16(土) 8:00
jij,時事通信,NY円上昇、154円台前半,11/16(土) 7:54
jij,時事通信,トランプ政権で「早期停戦」も　ウクライナ大統領、動揺抑制か,11/16(土) 7:53
jij,時事通信,国民支持5・5％、大都市で立民超え　時事通信世論調査【解説委員室から】,11/16(土) 7:31
jij,時事通信,歴史的低迷から巻き返しへ　121敗のWソックス―米大リーグ,11/16(土) 7:26
jij,時事通信,中国、「新エネ車」シフト加速　会場を席巻　広州モーターショー,11/16(土) 7:25
jij,時事通信,【図解】中国、「新エネ車」シフト加速＝会場を席巻―広州モーターショー,11/16(土) 7:24
jij,時事通信,「心の傷、癒やされない」　犯罪被害者週間前に講演　東京,11/16(土) 7:24
jij,時事通信,「いろんな話楽しみだった」　三笠宮妃百合子さまの思い出語る　彬子さま,11/16(土) 7:23
jij,時事通信,港湾開発、自然破壊の代償　中国依存への不安も　ペルー,11/16(土) 7:22
jij,時事通信,「米国の裏庭」に新ルート　中国主導の巨大港開港　ペルー,11/16(土) 7:20
jij,時事通信,教員の勤務時間、自治体ごと公表　「長時間縮減のメカニズムに」　阿部文科相,11/16(土) 7:19
jij,時事通信,第三者機関、課題多く　政治資金監査、権限・体制が焦点　規正法改正、自公がたたき台,11/16(土) 7:19
jij,時事通信,「自由貿易」維持で一致　中韓首脳、2年ぶり会談,11/16(土) 7:17
jij,時事通信,同盟深化へ協力継続　日米首脳が初の対面会談,11/16(土) 7:07
jij,時事通信,〔米株式〕ダウ続落、305ドル安＝利下げペース鈍化観測（15日）☆差替,11/16(土) 7:00
jij,時事通信,日米韓「制度化」へ事務局　対北朝鮮、連携強化を確認　首脳会談,11/16(土) 6:51
jij,時事通信,〔米株式〕ダウ続落、305ドル安＝利下げペース鈍化観測（15日）,11/16(土) 6:30
jij,時事通信,イラン「トランプ氏暗殺しない」　米に通告、緊張緩和狙いか,11/16(土) 6:27
jij,時事通信,NY株、続落　米利下げペース鈍化観測で,11/16(土) 6:23
jij,時事通信,EV購入支援廃止に反対　「雇用打撃」と警告　米業界団体,11/16(土) 6:11
jij,時事通信,民主党全国委員長に出馬検討　駐日米大使、党立て直し担う　報道,11/16(土) 6:02
jij,時事通信,KKR、富士ソフトTOB価格引き上げ,11/16(土) 6:00
jij,時事通信,島津製作所の質量分析計、国際団体が「偉業」認定,11/16(土) 6:00
jij,時事通信,〔決算〕商工中金、通期連結純利益予想を上方修正,11/16(土) 6:00
jij,時事通信,イラン核兵器研究施設を破壊か　イスラエルが先月攻撃　米メディア,11/16(土) 5:33
jij,時事通信,〔NY外為〕円、153円台後半（15日午後2時）,11/16(土) 4:30
jij,時事通信,〔欧州株式〕軒並み下落＝英0．09％安、独0．27％安（15日）,11/16(土) 3:30
jij,時事通信,保護主義対抗へ協調焦点　APEC首脳会議が開幕,11/16(土) 1:09
jij,時事通信,〔米株式〕NYダウ続落、217ドル安＝ナスダックも安い（15日午前）,11/16(土) 0:30
jij,時事通信,NGO、G7に「化石賞」　COP29,11/16(土) 0:10
jij,時事通信,〔米株式〕NYダウ続落、152ドル安＝ナスダックも安い（15日朝）,11/16(土) 0:00
jij,時事通信,NY株、続落,11/15(金) 23:57
jij,時事通信,じれずにこじ開けた日本　冷や汗の序盤―サッカーW杯予選,11/15(金) 23:55
jij,時事通信,鍵山優真がSP首位、友野一希2位　女子は吉田陽菜トップ―フィギュア,11/15(金) 23:44
jij,時事通信,〔NY外為〕円、155円台前半（15日朝）,11/15(金) 23:30
jij,時事通信,NY円、155円台前半,11/15(金) 23:27
jij,時事通信,独ロ首脳が電話会談,11/15(金) 23:18
jij,時事通信,日本、インドネシアに快勝　サッカー,11/15(金) 23:16
jij,時事通信,日本、効果的に得点　サッカーW杯予選・日本―インドネシア,11/15(金) 23:12
jij,時事通信,南野、歴代10位の24ゴール　サッカー日本代表,11/15(金) 23:11
jij,時事通信,競り合う三笘　サッカー,11/15(金) 23:10
jij,時事通信,勝利した日本代表　野球プレミア１２,11/15(金) 23:10
jij,時事通信,独ロ首脳が電話会談　ウクライナは反発,11/15(金) 23:08
jij,時事通信,日本、インドネシアに快勝　南野ら4発―サッカーW杯予選,11/15(金) 23:07
jij,時事通信,選手交代を告げる井端監督,11/15(金) 23:05
jij,時事通信,牧、チーム救う一振り　流れ変えたムードメーカー―野球プレミア12,11/15(金) 22:57
jij,時事通信,喜ぶ菅原　サッカー,11/15(金) 22:53
jij,時事通信,攻め込む菅原　サッカー,11/15(金) 22:53
jij,時事通信,力投する大勢　野球プレミア１２,11/15(金) 22:51
jij,時事通信,日本、韓国破り2連勝　牧が逆転打、森下2ラン―野球プレミア12,11/15(金) 22:45
jij,時事通信,損保4社に追加報告命令　顧客情報漏えい問題で　金融庁,11/15(金) 22:43
jij,時事通信,八木勇征「ハッピーな気持ちになって！」、運試しは役柄通りに…　映画「矢野くんの普通の日々」公開,11/15(金) 22:43
jij,時事通信,IAEAトップ、イラン核施設を視察　協力姿勢アピールか,11/15(金) 22:42
jij,時事通信,〔NY外為〕円、155円台前半（15日午前8時）,11/15(金) 22:30
jij,時事通信,力投する藤平　野球プレミア１２,11/15(金) 22:29
jij,時事通信,喜ぶ森下　野球プレミア１２,11/15(金) 22:29
jij,時事通信,森下の２ラン　野球プレミア１２,11/15(金) 22:29
jij,時事通信,守田のゴール　サッカー,11/15(金) 22:24
jij,時事通信,鎌田、絶妙な飛び出し　サッカーW杯予選,11/15(金) 22:23
jij,時事通信,シュートを止める鈴木　サッカー,11/15(金) 22:19
jij,時事通信,喜ぶ南野　サッカー,11/15(金) 22:12
