media_en,media_jp,title_articles,date_original
jij,時事通信,パスを出す鎌田　サッカー,11/15(金) 22:10
jij,時事通信,シュートを放つ小川　サッカー,11/15(金) 22:10
jij,時事通信,南野のプレー　サッカー,11/15(金) 22:10
jij,時事通信,攻め込む鎌田と小川　サッカー,11/15(金) 22:10
jij,時事通信,デジタル競技場を紹介　誹謗中傷対策も議論―民間のスポーツ産業推進組織,11/15(金) 22:10
jij,時事通信,富士ソフトTOB価格引き上げ　ベインを1株「1円」上回る　KKR,11/15(金) 21:49
jij,時事通信,競り合う町田　サッカー,11/15(金) 21:37
jij,時事通信,日本、韓国破り２連勝,11/15(金) 21:36
jij,時事通信,力投する隅田　野球プレミア１２,11/15(金) 21:36
jij,時事通信,長友、藤田らベンチ外　サッカーW杯予選,11/15(金) 21:34
jij,時事通信,〔ロンドン外為〕円、155円台半ば（15日正午）,11/15(金) 21:30
jij,時事通信,女川原発、１３年ぶり発送電再開,11/15(金) 21:12
jij,時事通信,メッセージが書かれたパネル,11/15(金) 21:12
jij,時事通信,講演する佐藤さん,11/15(金) 21:12
jij,時事通信,金倒永を抑えた高橋　野球プレミア１２,11/15(金) 21:12
jij,時事通信,米、日韓の懸念払拭に腐心　トランプ政権発足控え,11/15(金) 20:33
jij,時事通信,調整する才木　野球プレミア１２,11/15(金) 20:33
jij,時事通信,途上国支援、中国も資金拠出を　COP29で協議　江守東京大教授,11/15(金) 20:33
jij,時事通信,抑えた高橋宏　野球プレミア１２,11/15(金) 20:32
jij,時事通信,喜ぶ紅林　野球プレミア１２,11/15(金) 20:32
jij,時事通信,イスラエル、ガザ長期駐留を準備か　停戦の道筋見えず　ハマス最高指導者殺害1カ月,11/15(金) 20:32
jij,時事通信,低い攻め、結びで喝采　若隆景、感慨に浸る―大相撲九州場所,11/15(金) 20:27
jij,時事通信,紅林の逆転打　野球プレミア１２,11/15(金) 20:11
jij,時事通信,ピンチをしのいだ高橋宏,11/15(金) 20:10
jij,時事通信,力投する高橋宏　野球プレミア１２,11/15(金) 20:10
jij,時事通信,24年ユーロ圏GDP、0．8％増　5月予想据え置き　欧州委,11/15(金) 20:08
jij,時事通信,阿武剋、狙い通りに　大相撲九州場所,11/15(金) 20:03
jij,時事通信,良品計画、27年8月期に売上高8800億円,11/15(金) 20:00
jij,時事通信,商工中金、政府保有の自社株取得へ,11/15(金) 20:00
jij,時事通信,東北電、料金一時割引で18日会見,11/15(金) 20:00
jij,時事通信,東北電力女川原発、13年ぶり発送電再開,11/15(金) 20:00
jij,時事通信,〔決算〕中部空港、通期予想を上方修正,11/15(金) 20:00
jij,時事通信,東北電力女川原発、13年ぶり発送電再開,11/15(金) 20:00
jij,時事通信,中京銀、元行員が1500万着服,11/15(金) 20:00
jij,時事通信,〔決算〕あおぞら銀、連結純利益1．1％減,11/15(金) 20:00
jij,時事通信,南海、タッチ決済拡大,11/15(金) 20:00
jij,時事通信,大阪ガス、東京ガス、東邦ガス、地震想定で3社合同訓練,11/15(金) 20:00
jij,時事通信,S＆P、JTのアウトルックを「ネガティブ」に変更,11/15(金) 20:00
jij,時事通信,日本郵政、郵便局でポイント獲得,11/15(金) 20:00
jij,時事通信,中国電、中間貯蔵のボーリング調査終了,11/15(金) 20:00
jij,時事通信,〔決算〕八十二銀、連結自己資本比率は20．28％,11/15(金) 20:00
jij,時事通信,ローソンが総菜180個回収,11/15(金) 20:00
jij,時事通信,〔決算〕三ツ星ベルト、9月中間は過去最高益,11/15(金) 20:00
jij,時事通信,記者会見する維新の空本氏,11/15(金) 19:51
jij,時事通信,記者会見する維新の金村氏,11/15(金) 19:51
jij,時事通信,記者会見する平行政改革担当相,11/15(金) 19:51
jij,時事通信,歓声に応える高木,11/15(金) 19:49
jij,時事通信,早期帰国願い音楽集会,11/15(金) 19:48
jij,時事通信,声援に応える上田　ゴルフ,11/15(金) 19:47
jij,時事通信,笑顔を見せる上田　ゴルフ,11/15(金) 19:47
jij,時事通信,調整する才木　野球プレミア１２,11/15(金) 19:46
jij,時事通信,被爆者らの旅費、クラファンで,11/15(金) 19:46
jij,時事通信,力投する高橋宏　野球プレミア１２,11/15(金) 19:46
jij,時事通信,会見する浜住日本被団協事務局次長,11/15(金) 19:46
jij,時事通信,人材開発支援に見直し要求　「秋の行政レビュー」終了,11/15(金) 19:45
jij,時事通信,豊昇龍、薄氷の6連勝　大相撲九州場所,11/15(金) 19:43
jij,時事通信,自主規制機関に否定的見解　損保改革で　金融庁,11/15(金) 19:40
jij,時事通信,総菜2万個回収　加熱不十分　ローソン,11/15(金) 19:39
jij,時事通信,「死に方考えてほしかった」　元妻、3回目の被告人質問　「紀州のドン・ファン」・和歌山地裁,11/15(金) 19:28
jij,時事通信,空本、金村氏が出馬表明　地方議員増で乱立模様　維新代表選,11/15(金) 19:18
jij,時事通信,石破首相、月末にお国入り　地方創生集会出席を調整,11/15(金) 19:07
jij,時事通信,山下が単独首位　ゴルフ,11/15(金) 19:06
jij,時事通信,ＴＷＩＣＥ・ＮＡＹＥＯＮさんが登場,11/15(金) 19:05
jij,時事通信,豪ノ山の引き落とし,11/15(金) 19:02
jij,時事通信,霧島の下手出し投げ,11/15(金) 18:59
jij,時事通信,談笑する松山英ら　ゴルフ,11/15(金) 18:54
jij,時事通信,若隆景の押し出し,11/15(金) 18:53
jij,時事通信,前農業農村相の党籍を剥奪　「重大な規律違反」で送検へ　中国,11/15(金) 18:53
jij,時事通信,被爆者らの旅費、クラファンで　ノーベル授賞式でオスロへ　日本被団協,11/15(金) 18:52
jij,時事通信,攻める阿武剋,11/15(金) 18:51
jij,時事通信,６連勝の豊昇龍,11/15(金) 18:45
jij,時事通信,大の里２敗、豊昇龍は６連勝,11/15(金) 18:45
jij,時事通信,琴桜の押し出し,11/15(金) 18:45
jij,時事通信,蝉川のショット　ゴルフ,11/15(金) 18:44
jij,時事通信,笑顔の石川　プロ野球,11/15(金) 18:44
jij,時事通信,ベネズエラ、米国が2次リーグへ　野球プレミア12,11/15(金) 18:44
jij,時事通信,あいさつする維新の青柳政調会長代行,11/15(金) 18:44
jij,時事通信,三笠宮妃百合子さま逝去　101歳、皇室最高齢,11/15(金) 18:39
jij,時事通信,女川原発、13年ぶり発送電再開　来月中に営業運転へ　東北電,11/15(金) 18:38
jij,時事通信,大の里2敗、豊昇龍は6連勝　大相撲九州場所6日目,11/15(金) 18:37
jij,時事通信,経済対策、18日に再協議　自公が政府案、国民検討,11/15(金) 18:37
jij,時事通信,危険運転、懲役12年求刑　時速194キロ「常軌逸した」　大分地裁,11/15(金) 18:37
jij,時事通信,高木、女子１５００で優勝,11/15(金) 18:13
jij,時事通信,高木、女子１５００で優勝,11/15(金) 18:13
jij,時事通信,ロッテが来季コーチ陣発表　プロ野球,11/15(金) 18:10
jij,時事通信,紙を掲げる原告ら,11/15(金) 18:09
jij,時事通信,手を取り合う原告,11/15(金) 18:09
jij,時事通信,高木、女子1500で優勝　四大陸スピードスケート,11/15(金) 18:09
jij,時事通信,山下が単独首位　大王製紙エリエール・レディース,11/15(金) 18:09
jij,時事通信,全国の強制不妊訴訟が終結　最後の和解成立　名古屋高裁,11/15(金) 18:08
jij,時事通信,「106万円の壁」撤廃へ　パートらの厚生年金加入　社保審部会,11/15(金) 18:05
jij,時事通信,松山英、2位浮上　フェニックス男子ゴルフ,11/15(金) 17:48
jij,時事通信,給食喉に詰まらせ園児死亡,11/15(金) 17:46
jij,時事通信,早期帰国願い音楽集会　めぐみさん母校、拉致47年　新潟,11/15(金) 17:45
jij,時事通信,教員の勤務時間、自治体ごと公表,11/15(金) 17:43
jij,時事通信,地方財政に悪影響与えず　「壁」見直し、根拠は示さず　国民幹事長,11/15(金) 17:32
jij,時事通信,〔東京外為〕ドル、155円台後半＝上にいってこい（15日午後5時）,11/15(金) 17:30
jij,時事通信,両陛下ら服喪　外交団鴨場接待取りやめ,11/15(金) 17:28
jij,時事通信,観光バス横転、指導不足　「フェード現象」原因　事故調,11/15(金) 17:28
jij,時事通信,給食喉に詰まらせ園児死亡　札幌の認可保育園,11/15(金) 17:23
jij,時事通信,空爆の煙を撮影する人々,11/15(金) 17:17
jij,時事通信,郵便局でポイント獲得,11/15(金) 17:14
jij,時事通信,自民人事、裏金議員を起用　党幹部「適材適所」と説明,11/15(金) 17:14
jij,時事通信,取材に応じる宮沢税調会長,11/15(金) 17:12
jij,時事通信,円相場、155円75〜78銭　15日午後5時現在,11/15(金) 17:12
jij,時事通信,防衛増税、国民民主と協議　自民税調会長、結論見通せず,11/15(金) 17:05
jij,時事通信,郵便局でポイント獲得　商品と交換　日本郵政,11/15(金) 16:54
jij,時事通信,共産、参院選候補6人発表,11/15(金) 16:47
jij,時事通信,日産自動車のＥＶ,11/15(金) 16:33
jij,時事通信,中国ＥＶ大手ＢＹＤの展示スペース,11/15(金) 16:32
jij,時事通信,中国ＥＶ大手ＢＹＤの記者発表会,11/15(金) 16:32
jij,時事通信,空爆を受けたガザ,11/15(金) 16:29
jij,時事通信,生後1カ月の娘殺害　容疑で父親逮捕　大阪府警,11/15(金) 16:28
jij,時事通信,東京デフリンピックまで１年,11/15(金) 16:27
jij,時事通信,デフリンピックのメダル,11/15(金) 16:27
jij,時事通信,海自にシーガーディアン導入決定　無人機で警戒監視、23機調達へ　防衛省,11/15(金) 16:25
jij,時事通信,海自にシーガーディアン導入決定,11/15(金) 16:21
jij,時事通信,メダルデザインに折り鶴　東京デフリンピックまで1年,11/15(金) 16:20
jij,時事通信,〔東京株式〕4日ぶり反発＝円安で買い（15日）☆差替,11/15(金) 16:00
jij,時事通信,日経平均、107円21銭高の3万8642円91銭で終了＝東京株式,11/15(金) 16:00
jij,時事通信,父親殺害で夫婦追起訴　浅草の家族連続殺人　東京地検,11/15(金) 15:54
jij,時事通信,自民、比例復活2連続で名簿下位　大阪「立て直し」要望も　次期衆院選方針,11/15(金) 15:47
jij,時事通信,会談する日米外相,11/15(金) 15:44
jij,時事通信,107円高の3万8642円91銭　15日の平均株価,11/15(金) 15:41
jij,時事通信,共産、比例６５０万票目指す,11/15(金) 15:41
jij,時事通信,共産、比例650万票目指す　来夏参院選、SNS対応を強化,11/15(金) 15:39
jij,時事通信,中間貯蔵のボーリング調査終了　山口・上関町への立地見極めへ　中国電,11/15(金) 15:37
jij,時事通信,チャンカイ港の漁船,11/15(金) 15:34
jij,時事通信,JSR、役員解雇　経費5000万円超を私的流用,11/15(金) 15:34
jij,時事通信,一般弔問記帳、16日から　三笠宮妃百合子さま逝去　宮内庁,11/15(金) 15:30
jij,時事通信,〔東京外為〕ドル、156円台半ば＝買い一服後はもみ合い（15日午後3時）,11/15(金) 15:30
jij,時事通信,三笠宮妃百合子さま逝去で謹話　衆参議長,11/15(金) 15:30
jij,時事通信,韓国最大野党代表に懲役1年　地裁、公選法違反で　政局に影響必至,11/15(金) 15:15
jij,時事通信,正恩氏、自爆無人機の量産指示　ロシア軍事協力に関連か　北朝鮮,11/15(金) 15:12
jij,時事通信,自公国の政策協議,11/15(金) 15:07
jij,時事通信,司令部移転「決まっていない」,11/15(金) 15:07
jij,時事通信,式典に出席する中国主席,11/15(金) 15:04
jij,時事通信,与党連合、地滑り的大勝　政権安定へ　スリランカ総選挙,11/15(金) 15:04
jij,時事通信,玉城知事「県民に大きな不安」,11/15(金) 14:57
jij,時事通信,石破首相、米中首脳と16日に会談　APECで自由貿易促進訴え,11/15(金) 14:56
jij,時事通信,補正予算、来月９日審議入り,11/15(金) 14:55
jij,時事通信,クマに扮し保険金詐欺　高級車傷つけられたと主張　米加州,11/15(金) 14:52
jij,時事通信,石破首相がペルー入り,11/15(金) 14:52
jij,時事通信,玉城知事「県民に大きな不安」　米軍ヘリ不時着巡り　沖縄,11/15(金) 14:47
jij,時事通信,「クリスマスの花」,11/15(金) 14:47
jij,時事通信,高額療養費の負担上限引き上げへ　医療費抑制、年内に方向性　厚労省,11/15(金) 14:38
jij,時事通信,【Infographie】熱帯低気圧、相次いでフィリピン襲来,11/15(金) 14:25
jij,時事通信,モナコGP、31年まで契約延長　F1,11/15(金) 14:16
jij,時事通信,大卒内定率、4年ぶり低下　売り手市場で就職先決めきれず　10月,11/15(金) 14:16
jij,時事通信,両陛下、三笠宮邸を弔問　上皇ご夫妻、皇族方も次々に,11/15(金) 14:14
jij,時事通信,両陛下、三笠宮邸を弔問,11/15(金) 14:13
jij,時事通信,選挙後初はアルゼンチン大統領　トランプ氏、外国首脳と対面会談,11/15(金) 14:12
jij,時事通信,補正予算、来月9日審議入り　臨時国会、会期24日間の見通し,11/15(金) 14:04
jij,時事通信,〔東京株式〕しっかり＝好決算銘柄に買い（15日後場中盤）,11/15(金) 14:00
jij,時事通信,みんなが婦人科を受診する理由は？【女性医療現場のリアル】,11/15(金) 14:00
jij,時事通信,東洋大姫路、古豪返上へ　岡田監督が母校導く―高校野球,11/15(金) 13:34
jij,時事通信,米がレバノンに停戦案提示　イスラエル空爆継続　報道,11/15(金) 13:33
jij,時事通信,ペルーに中国主導で巨大港湾　南米に「一帯一路」　米、軍事利用を警戒,11/15(金) 13:32
jij,時事通信,【図解】ペルーに中国主導で巨大港湾＝南米に「一帯一路」―米、軍事利用を警戒,11/15(金) 13:32
jij,時事通信,血圧低下、穏やかな最期　逝去の百合子さま　宮内庁,11/15(金) 13:32
jij,時事通信,激動の1世紀生き抜く　三笠宮さま支え、最期に涙　孫、ひ孫の成長見守り・百合子さま,11/15(金) 13:31
jij,時事通信,〔東京株式〕上げ幅拡大＝円安好感（15日後場寄り付き）,11/15(金) 13:00
jij,時事通信,日経平均、331円61銭高の3万8867円31銭で始まる＝東京株式後場,11/15(金) 13:00
jij,時事通信,麻薬製造か、中国人男を書類送検,11/15(金) 12:58
jij,時事通信,麻薬製造か、中国人男を書類送検　会社倉庫で　警視庁,11/15(金) 12:56
jij,時事通信,紙幣すり替え1300万円盗む　容疑で英国籍の男逮捕　警視庁,11/15(金) 12:52
jij,時事通信,記者会見する永井皇室医務主管ら,11/15(金) 12:52
jij,時事通信,首位アルゼンチン敗れる　サッカーW杯南米予選,11/15(金) 12:50
jij,時事通信,日米豪、17日に防衛相会談　「トランプ政権」にらみ連携,11/15(金) 12:42
jij,時事通信,司令部移転「決まっていない」　中谷防衛相,11/15(金) 12:41
jij,時事通信,〔東京外為〕ドル、156円台前半＝財務相、円安けん制で上げ幅縮小（15日正午）,11/15(金) 12:30
jij,時事通信,経済対策、与党と事前協議せず　国会で「丁寧に議論」　立民の野田代表,11/15(金) 12:27
jij,時事通信,【Infographie】ビットコイン、9万ドル超え,11/15(金) 12:25
jij,時事通信,バンカーショットを放つ渋野　ゴルフ,11/15(金) 12:21
jij,時事通信,県議が出馬表明　秋田知事選,11/15(金) 12:13
jij,時事通信,円相場、156円39〜39銭　15日正午現在,11/15(金) 12:13
jij,時事通信,東白龍、右肘痛め休場　大相撲九州場所,11/15(金) 12:09
jij,時事通信,自公国、週明けに再協議　経済対策で折り合わず,11/15(金) 12:08
jij,時事通信,浅尾環境相、COP29出席へ,11/15(金) 12:07
jij,時事通信,政治資金監査へ第三者機関　公明、規正法再改正で要綱案,11/15(金) 12:06
jij,時事通信,石破首相「悲しみ禁じ得ず」,11/15(金) 12:02
jij,時事通信,〔東京株式〕反発＝円安が追い風に（15日前場）☆差替,11/15(金) 12:00
jij,時事通信,日経平均、306円43銭高の3万8842円13銭で終了＝東京株式前場,11/15(金) 12:00
jij,時事通信,記者会見したホーベルツ氏ら,11/15(金) 11:58
jij,時事通信,在日米軍、司令部の移転検討　横田から都心に　準機関紙,11/15(金) 11:55
jij,時事通信,中国人向け風俗店経営の女逮捕　不法就労助長容疑　警視庁,11/15(金) 11:51
jij,時事通信,中国小売り4．8％増　景気刺激策が押し上げか　10月,11/15(金) 11:48
jij,時事通信,306円高の3万8842円13銭　15日午前の平均株価,11/15(金) 11:44
jij,時事通信,IOC「素晴らしい施設」　野球会場は来夏までに決定―28年ロス五輪,11/15(金) 11:37
jij,時事通信,大谷、２年連続のアーロン賞　大リーグ,11/15(金) 11:35
jij,時事通信,国会議事堂に掲げられた半旗,11/15(金) 11:35
jij,時事通信,脱税容疑で弁護士逮捕　法人税など2700万円　東京地検,11/15(金) 11:33
jij,時事通信,大谷、2年連続のアーロン賞　最優秀DHは4年連続受賞―米大リーグ,11/15(金) 11:32
jij,時事通信,「悲しみ禁じ得ず」　石破首相,11/15(金) 11:10
jij,時事通信,広州モーターショーが開幕,11/15(金) 11:07
jij,時事通信,〔東京株式〕上げ幅縮小＝利益確定の売り（15日前場中盤）,11/15(金) 11:00
jij,時事通信,ラニエリ氏、ローマ監督に復帰　イタリア・サッカー,11/15(金) 10:59
jij,時事通信,【Infographie】ユーロ圏の失業率,11/15(金) 10:47
jij,時事通信,【Infographie】ユーロ圏GDP,11/15(金) 10:45
jij,時事通信,畑岡が初日暫定21位　米女子ゴルフ,11/15(金) 10:44
jij,時事通信,広州モーターショーが開幕　BYD、最新モデル披露　中国,11/15(金) 10:41
jij,時事通信,ブレイディヴェーグは1枠2番　競馬マイルCS,11/15(金) 10:35
jij,時事通信,純金茶わん窃盗、男に有罪　日本橋高島屋「大黄金展」　東京地裁,11/15(金) 10:33
jij,時事通信,フェラーリ、１．７億円超で落札,11/15(金) 10:33
jij,時事通信,フェラーリ、1．7億円超で落札　国税ネット公売で最高額,11/15(金) 10:31
jij,時事通信,百合子さまを乗せた車両,11/15(金) 10:22
jij,時事通信,EV購入支援、廃止検討　トランプ次期米政権　報道,11/15(金) 10:21
jij,時事通信,日米外相会談,11/15(金) 10:14
jij,時事通信,病院を出られる彬子さま,11/15(金) 10:10
jij,時事通信,ロ朝の軍事協力に懸念,11/15(金) 10:05
jij,時事通信,中国、バーレーン下す　サッカーW杯予選,11/15(金) 10:02
jij,時事通信,日経平均、500円超高＝東京株式,11/15(金) 10:00
jij,時事通信,【図解】実質GDP、2期連続プラス＝7〜9月期、個人消費回復,11/15(金) 9:54
jij,時事通信,北朝鮮部隊の戦闘参加を協議　ロ朝軍事協力に「強い懸念」　米韓外相,11/15(金) 9:52
jij,時事通信,日米韓協力の事務局設置　首脳会談で「制度化」合意へ,11/15(金) 9:43
jij,時事通信,ＡＰＥＣ閣僚会議が閉幕,11/15(金) 9:37
jij,時事通信,ペルーで開かれたＡＰＥＣ閣僚会議,11/15(金) 9:37
jij,時事通信,ロ朝の軍事協力に懸念　岩屋氏、相互訪問に意欲　日韓外相,11/15(金) 9:36
jij,時事通信,三笠宮妃百合子さま逝去,11/15(金) 9:35
jij,時事通信,日経平均、400円超高＝東京株式,11/15(金) 9:30
jij,時事通信,〔東京外為〕ドル、156円台半ば＝FRB議長、利下げ慎重姿勢（15日午前9時）,11/15(金) 9:30
jij,時事通信,〔東京株式〕上昇スタート＝下落の反動で買い先行（15日前場寄り付き）,11/15(金) 9:30
jij,時事通信,日経平均、300円超高＝東京株式,11/15(金) 9:30
jij,時事通信,日経平均、213円86銭高の3万8749円56銭で始まる＝東京株式前場,11/15(金) 9:30
jij,時事通信,日本、準々決勝へ,11/15(金) 9:30
jij,時事通信,米ＦＲＢ議長、利下げは急ぐ必要なし,11/15(金) 9:25
jij,時事通信,次期国務長官巡り意見交換　同盟強化へ連携確認　日米外相,11/15(金) 9:23
jij,時事通信,４０歳ボンが現役復帰,11/15(金) 9:21
jij,時事通信,ニュースワード「為替報告書」,11/15(金) 9:19
jij,時事通信,レイズ、ヤンキース施設で来季開催　ハリケーン被害で本拠地使えず―米大リーグ,11/15(金) 9:13
jij,時事通信,練習する遠藤　サッカー,11/15(金) 9:12
jij,時事通信,記者会見する遠藤　サッカー,11/15(金) 9:12
jij,時事通信,円相場、156円46〜48銭　15日午前9時現在,11/15(金) 9:07
jij,時事通信,イラン大統領とＩＡＥＡトップ,11/15(金) 9:07
jij,時事通信,生成AI、iPhoneでも提供　「ジェミニ」アプリ、日本語も可能　米グーグル,11/15(金) 9:06
jij,時事通信,損壊した建物,11/15(金) 9:04
jij,時事通信,イタリア、フランスが8強　サッカー欧州ネーションズL,11/15(金) 9:04
jij,時事通信,40歳ボンが現役復帰　W杯通算82勝―アルペンスキー女子,11/15(金) 9:04
jij,時事通信,マスク氏、イラン大使と会談　緊張緩和策を協議　米紙報道,11/15(金) 9:03
jij,時事通信,調整する松生,11/15(金) 9:01
jij,時事通信,日本、準々決勝へ　ルーマニアに逆転勝ち―女子テニス国別対抗戦,11/15(金) 8:59
jij,時事通信,実質GDP、2期連続プラス　7〜9月期、個人消費回復,11/15(金) 8:58
jij,時事通信,ペルーに中国主導で巨大港湾,11/15(金) 8:58
jij,時事通信,厚生長官にケネディ氏,11/15(金) 8:53
jij,時事通信,NY市渋滞税、来年1月導入　反対のトランプ氏就任前,11/15(金) 8:52
jij,時事通信,試合会場で調整する鍵山,11/15(金) 8:48
jij,時事通信,利下げ「急ぐ必要なし」　トランプ政策、実現に時間　米FRB議長,11/15(金) 8:46
jij,時事通信,APEC、自由貿易の重要性確認　閣僚会議閉幕、声明で調整続く　保護主義対抗、意見隔たりも,11/15(金) 8:42
jij,時事通信,【図解】三笠宮妃百合子さま逝去＝101歳、皇室最高齢,11/15(金) 8:26
jij,時事通信,NY円、156円台前半　FRB議長発言で4カ月ぶり安値,11/15(金) 8:06
jij,時事通信,三笠宮妃百合子さま逝去　101歳、皇室最高齢,11/15(金) 8:04
jij,時事通信,〔NY外為〕円、156円台前半＝4カ月ぶり安値（14日）,11/15(金) 8:00
jij,時事通信,遠藤、出番減少も「自信」　今夜インドネシア戦―サッカーW杯予選,11/15(金) 7:38
jij,時事通信,〔米株式〕NYダウ反落、207ドル安＝ナスダックも安い（14日）☆差替,11/15(金) 7:30
jij,時事通信,松生「自分の演技に集中」　公式練習で好感触―フィギュアGP,11/15(金) 7:21
jij,時事通信,米情報長官候補が日本敵視発言　「太平洋侵略国が再軍備」　トランプ次期政権,11/15(金) 7:13
jij,時事通信,個人献金、税優遇拡大へ　企業献金上限引き下げも　自民調整,11/15(金) 7:12
jij,時事通信,韓国の新星、井端監督も警戒　38本塁打40盗塁の金倒永―野球プレミア12,11/15(金) 7:12
jij,時事通信,途上国との溝鮮明に　米欧、温暖化対策に停滞感　COP29,11/15(金) 7:11
jij,時事通信,次期米政権、対中タカ派が勢ぞろい　外交・安保の陣容固まる　国防長官候補に懸念も,11/15(金) 7:10
jij,時事通信,駆け込みでウクライナ支援強化　「トランプ時代」見据え　米政権,11/15(金) 7:09
jij,時事通信,駐米豪大使の交代要求か　当選祝いに「砂時計」画像返す　トランプ氏側近,11/15(金) 7:09
jij,時事通信,【図解】「年収の壁」、幾重にも＝自公国、見直し協議本格化,11/15(金) 7:09
jij,時事通信,「年収の壁」、幾重にも　自公国、見直し協議本格化,11/15(金) 7:09
jij,時事通信,小児白血病の治療法確立　急性リンパ性、5年生存率94％　東大など,11/15(金) 7:09
jij,時事通信,政策決定、野党が影響力　与党事前審査に変化,11/15(金) 7:08
jij,時事通信,【図解】政策決定、野党が影響力＝与党事前審査に変化,11/15(金) 7:08
jij,時事通信,上場地銀、7割超が増益　金利上昇、本業改善進む　9月中間決算,11/15(金) 7:08
jij,時事通信,エーザイ認知症薬の承認勧告　否定から一転、条件付きで　欧州医薬品庁,11/15(金) 7:02
jij,時事通信,企業業績、4年ぶり減益　車認証不正、中国の弱さ重し　トランプ氏の政策警戒・24年9月中間〔深層探訪〕,11/15(金) 7:00
jij,時事通信,首相動静（11月15日）,11/15(金) 7:00
jij,時事通信,15日の朝刊（都内最終版）☆2,11/15(金) 6:54
jij,時事通信,15日の朝刊（都内最終版）☆1,11/15(金) 6:53
