media_en,media_jp,title_articles,date_original
jij,時事通信,NY株反落、207ドル安　米FRB議長講演受け売り,11/15(金) 6:36
jij,時事通信,〔米株式〕NYダウ反落、207ドル安＝ナスダックも安い（14日）,11/15(金) 6:30
jij,時事通信,厚生長官にケネディ氏　トランプ次期米政権、反ワクチン活動家,11/15(金) 6:07
jij,時事通信,日本の「監視対象」継続　為替介入をけん制　米為替報告,11/15(金) 6:06
jij,時事通信,SBIHD、フィンテックソリューションズを非上場化,11/15(金) 6:00
jij,時事通信,くら寿司、回転レーンでサプライズ演出,11/15(金) 6:00
jij,時事通信,コンコルディアFG、三井住友信託銀のローン会社買収,11/15(金) 6:00
jij,時事通信,〔NY外為〕円、156円台前半＝一時4カ月ぶり安値（14日午後3時37分）,11/15(金) 6:00
jij,時事通信,コーチ親会社、同業買収を断念　「競争阻害」の司法判断響く　米,11/15(金) 5:56
jij,時事通信,宇宙人の証拠、今年も見つからず　米国防総省がUFO報告書,11/15(金) 5:25
jij,時事通信,核査察で「協力の用意」　イラン大統領、IAEAトップと会談,11/15(金) 4:57
jij,時事通信,〔欧州株式〕軒並み上昇＝英0．51％高、独1．37％高（14日）,11/15(金) 3:30
jij,時事通信,〔米株式〕NYダウ反落、48ドル安＝ナスダックも安い（14日午前）,11/15(金) 1:00
jij,時事通信,NY株、反落,11/15(金) 0:51
jij,時事通信,〔米株式〕NYダウ続伸、70ドル高＝ナスダックも高い（14日朝）,11/15(金) 0:00
jij,時事通信,NY株、続伸,11/14(木) 23:55
jij,時事通信,APEC首脳会議、15日開幕　高まる保護主義、閣僚会議で議論,11/14(木) 23:47
jij,時事通信,NY円、156円近辺,11/14(木) 23:38
jij,時事通信,〔NY外為〕円、156円近辺（14日朝）,11/14(木) 23:30
jij,時事通信,EU、米メタに制裁金1300億円　広告巡り競争法違反,11/14(木) 23:22
jij,時事通信,台湾連勝、韓国は初白星　野球プレミア12,11/14(木) 23:22
jij,時事通信,企業献金、第三者機関で議論を　選択的夫婦別姓で自民説得　公明代表,11/14(木) 23:04
jij,時事通信,自民選対代理に河野氏,11/14(木) 22:48
jij,時事通信,〔NY外為〕円、156円近辺（14日午前8時）,11/14(木) 22:30
jij,時事通信,連続比例復活なら名簿下位登載　自民、支部長選任基準明記へ,11/14(木) 22:23
jij,時事通信,石破首相、米中首脳と会談へ　APEC・G20で南米出発,11/14(木) 22:08
jij,時事通信,南海キャンディーズが登場,11/14(木) 22:01
jij,時事通信,池田美優「本当に光栄です」、「ベストジーニスト」殿堂入り　Ｓｎｏｗ　Ｍａｎ目黒蓮は初受賞、愛犬に報告,11/14(木) 22:01
jij,時事通信,〔ロンドン外為〕円、155円台後半（14日正午）,11/14(木) 21:30
jij,時事通信,鍵山、2週連続のGP　15日からフィンランド大会―フィギュア,11/14(木) 21:07
jij,時事通信,演説するバハマ首相,11/14(木) 21:03
jij,時事通信,練習する日本　サッカー,11/14(木) 21:01
jij,時事通信,練習する三笘　サッカー,11/14(木) 21:01
jij,時事通信,豪州、サウジとドロー　サッカーW杯予選,11/14(木) 20:59
jij,時事通信,個人献金、税優遇拡大へ,11/14(木) 20:49
jij,時事通信,藤田が引退　J1鳥栖,11/14(木) 20:48
jij,時事通信,記者会見する森保監督ら　サッカー,11/14(木) 20:45
jij,時事通信,隆の勝、30歳祝う5連勝　元貴景勝の言葉糧に,11/14(木) 20:44
jij,時事通信,ドラ１斎藤、西武と入団合意　プロ野球,11/14(木) 20:41
jij,時事通信,岩手、宮城で震度3,11/14(木) 20:37
jij,時事通信,トランプ氏、権力肥大化　議会掌握し「トリプルレッド」　4年ぶり凱旋、景色一変,11/14(木) 20:32
jij,時事通信,トランプ氏復権前に協調訴え　南米歴訪、中国主席と16日会談　米大統領,11/14(木) 20:32
jij,時事通信,被害を分析、組織的背景浮上　上部の実態解明目指す　美人局事件,11/14(木) 20:31
jij,時事通信,米軍ヘリが不時着　乗員6人、けがなし　沖縄・国頭村,11/14(木) 20:30
jij,時事通信,プーチン氏、来月19日に内外記者会見　米ロ関係やウクライナ焦点,11/14(木) 20:26
jij,時事通信,森保監督「良さ出し一丸で」　15日インドネシア戦―サッカーW杯予選,11/14(木) 20:23
jij,時事通信,国民民主、代表代行に古川氏,11/14(木) 20:22
jij,時事通信,「年収の壁」で臨時国会に法案　国民民主,11/14(木) 20:18
jij,時事通信,ドラ1斎藤、目指すは「源田超え」　西武と入団合意―プロ野球,11/14(木) 20:13
jij,時事通信,スリランカ総選挙、投開票,11/14(木) 20:09
jij,時事通信,試合を見守る河村,11/14(木) 20:09
jij,時事通信,豊昇龍、再戦喜ぶ　大相撲九州場所,11/14(木) 20:08
jij,時事通信,「望むならICC捜査の邪魔せず」　ドゥテルテ氏証言受け、比大統領,11/14(木) 20:06
jij,時事通信,維新代表選、松沢氏が出馬表明,11/14(木) 20:01
jij,時事通信,あいさつする自民党の小野寺政調会長,11/14(木) 20:01
jij,時事通信,〔決算〕近鉄GHD、25年3月期業績予想を上方修正,11/14(木) 20:00
jij,時事通信,〔決算〕日本郵政、24年9月中間純利益は増益,11/14(木) 20:00
jij,時事通信,〔決算〕京都FG、連結純利益予想350億円に上方修正,11/14(木) 20:00
jij,時事通信,〔決算〕三菱UFJ、通期純利益予想引き上げ,11/14(木) 20:00
jij,時事通信,耐久性低い保護材料が原因,11/14(木) 20:00
jij,時事通信,〔決算〕三井住友FG、25年3月期予想を上方修正,11/14(木) 20:00
jij,時事通信,〔決算〕みずほFG、通期連結純利益予想を上方修正,11/14(木) 20:00
jij,時事通信,〔決算〕上場地銀、7割超が増益,11/14(木) 20:00
jij,時事通信,みずほ・楽天が提携クレカ,11/14(木) 20:00
jij,時事通信,〔決算〕コンコルディア、連結純利益17．0％増,11/14(木) 20:00
jij,時事通信,〔決算〕PayPay銀行、純利益35．1％増,11/14(木) 20:00
jij,時事通信,ローソンとワタミが共同配送,11/14(木) 20:00
jij,時事通信,〔決算〕大手銀5グループ、純利益4割増,11/14(木) 20:00
jij,時事通信,〔決算〕九州FG、連結純利益7．0％減,11/14(木) 20:00
jij,時事通信,ワタミ、5％賃上げ方針,11/14(木) 20:00
jij,時事通信,〔決算〕第一生命HD、9月中間は減収増益,11/14(木) 20:00
jij,時事通信,〔決算〕アサヒGHD、24年1〜9月期は増収増益,11/14(木) 20:00
jij,時事通信,第一生命HD、希望退職1000人募集,11/14(木) 20:00
jij,時事通信,カシオ、27日に決算発表,11/14(木) 20:00
jij,時事通信,〔決算〕ソニー銀行、純利益42．7％増,11/14(木) 20:00
jij,時事通信,〔決算〕プロクレアHD、通期純利益予想8億円に上方修正,11/14(木) 20:00
jij,時事通信,〔決算〕大王製紙、25年3月期予想を下方修正,11/14(木) 20:00
jij,時事通信,〔決算〕山梨中央銀行、連結純利益11．5％増,11/14(木) 20:00
jij,時事通信,〔決算〕T＆DHD、9月中間は増収増益,11/14(木) 20:00
jij,時事通信,R＆I、セブン＆アイとセブン銀の格付け方向性を「安定的」に変更,11/14(木) 20:00
jij,時事通信,女川原発、15日に発電再開へ,11/14(木) 20:00
jij,時事通信,かんぽ生命、自己株式取得を決議,11/14(木) 20:00
jij,時事通信,名鉄、来年1月に本社移転,11/14(木) 20:00
jij,時事通信,日本生命、保育大手に出資,11/14(木) 20:00
jij,時事通信,政府、電気・ガス代支援を与党に提示　給付金、半導体支援が柱　経済対策,11/14(木) 19:59
jij,時事通信,ガソリン補助、12月から縮小　価格は月5円上昇へ　政府案,11/14(木) 19:58
jij,時事通信,伊原、阪神と仮契約　プロ野球,11/14(木) 19:58
jij,時事通信,伊原「さらに実感が強く」　阪神と仮契約―プロ野球,11/14(木) 19:53
jij,時事通信,立民代表、１人区の「調整カギ」,11/14(木) 19:53
jij,時事通信,自国税調会長らが協議,11/14(木) 19:53
jij,時事通信,大の里、得意の形で　大相撲九州場所,11/14(木) 19:49
jij,時事通信,自民・麻生氏、衆院選「総括を」,11/14(木) 19:46
jij,時事通信,みずほと楽天がカードで提携,11/14(木) 19:42
jij,時事通信,維新代表選、松沢氏が出馬表明　複数名乗り、吉村氏軸か,11/14(木) 19:42
jij,時事通信,ネット証・銀の資本再編　「auカブコム証」は名称変更　三菱UFJとKDDI,11/14(木) 19:40
jij,時事通信,岩屋氏、米韓外相と会談へ,11/14(木) 19:37
jij,時事通信,住宅から高級かばん盗む　容疑で高校生ら2人逮捕　千葉県警,11/14(木) 19:35
jij,時事通信,耐久性低い保護材料が原因　美浜原発3号機の配管損傷　関電,11/14(木) 19:34
jij,時事通信,闇バイトのリーダー格逮捕　複数の窃盗や強盗事件指示か　大阪府警,11/14(木) 19:32
jij,時事通信,防衛省、辺野古サンゴ移植を再開,11/14(木) 19:27
jij,時事通信,みずほ・楽天が提携クレカ　利用者拡大へ来月発行,11/14(木) 19:24
jij,時事通信,野田立民代表、1人区の「調整カギ」　参院選対本部、代行に小沢氏,11/14(木) 19:22
jij,時事通信,敗れた霧島,11/14(木) 19:17
jij,時事通信,平戸海の押し出し,11/14(木) 19:17
jij,時事通信,攻める隆の勝,11/14(木) 19:17
jij,時事通信,佐田の海のすくい投げ,11/14(木) 19:17
jij,時事通信,来週から税制協議本格化　「103万円の壁」見直しで　自公国,11/14(木) 19:11
jij,時事通信,八村、日本代表に不満　バスケットボール,11/14(木) 19:10
jij,時事通信,阿武剋の寄り切り,11/14(木) 19:03
jij,時事通信,ウクライナ復興で脱炭素化,11/14(木) 18:54
jij,時事通信,質問に答える石破首相,11/14(木) 18:54
jij,時事通信,ウクライナ復興で脱炭素化　資金拠出、欧州開銀と覚書　環境省,11/14(木) 18:54
jij,時事通信,秋の行政レビュー,11/14(木) 18:50
jij,時事通信,会見する平行政改革担当相,11/14(木) 18:50
jij,時事通信,東芝、営業益705億円　発電システム好調　9月中間決算,11/14(木) 18:49
jij,時事通信,大の里連敗せず,11/14(木) 18:46
jij,時事通信,攻める琴桜,11/14(木) 18:46
jij,時事通信,豊昇龍の小手投げ,11/14(木) 18:46
jij,時事通信,平行革相、マスク氏と面会希望　米政権の取り組みに期待,11/14(木) 18:43
jij,時事通信,大の里連敗せず、3大関安泰　大相撲九州場所5日目,11/14(木) 18:38
jij,時事通信,文通費改革、来週にも衆院協議　参院は月内に元議長聴取,11/14(木) 18:32
jij,時事通信,歩く河本　女子ゴルフ,11/14(木) 18:28
jij,時事通信,首位に山下、河本ら４人　女子ゴルフ,11/14(木) 18:28
jij,時事通信,ショットを放つ松山茉　男子ゴルフ,11/14(木) 18:22
jij,時事通信,2位宮崎と契約　プロ野球・ロッテ,11/14(木) 18:15
jij,時事通信,取材に応じる米国務長官,11/14(木) 18:11
jij,時事通信,八村が19得点　河村との対決はお預け―NBA,11/14(木) 18:10
jij,時事通信,死去の勝俣元会長、公訴棄却,11/14(木) 18:02
jij,時事通信,台湾に到着した清宮　野球プレミア１２,11/14(木) 17:53
jij,時事通信,侍ジャパン、台北に移動,11/14(木) 17:52
jij,時事通信,台湾に到着した牧　野球プレミア１２,11/14(木) 17:52
jij,時事通信,台湾に到着した戸郷と大勢,11/14(木) 17:52
jij,時事通信,「紅まどんな」の選果始まる　愛媛県〔地域〕,11/14(木) 17:52
jij,時事通信,大手銀5グループ、純利益4割増　利ざや改善、最高益相次ぐ　9月中間決算,11/14(木) 17:50
jij,時事通信,松山英のショット　男子ゴルフ,11/14(木) 17:49
jij,時事通信,元AKB「ぱるる」が魅力発信応援団に　埼玉県〔地域〕,11/14(木) 17:49
jij,時事通信,練習に臨む北口,11/14(木) 17:39
jij,時事通信,練習を公開した北口,11/14(木) 17:39
jij,時事通信,練習を公開した北口,11/14(木) 17:39
jij,時事通信,佐藤が首位発進　フェニックス男子ゴルフ,11/14(木) 17:38
jij,時事通信,ＮＴＣで壁崩落事故,11/14(木) 17:37
jij,時事通信,NTCで壁崩落事故　けが人なし、当面利用中止へ―JSC,11/14(木) 17:35
jij,時事通信,死去の勝俣元会長、公訴棄却　東電福島原発事故の刑事裁判　最高裁,11/14(木) 17:33
jij,時事通信,希望退職1000人募集　50歳以上対象　第一生命HD,11/14(木) 17:33
jij,時事通信,侍ジャパン、台北に移動　15日から4連戦―野球プレミア12,11/14(木) 17:31
jij,時事通信,〔東京外為〕ドル、155円台後半＝米金利上昇で水準切り上げ（14日午後5時）,11/14(木) 17:30
jij,時事通信,南京事件の日、オンライン授業に　「安全確保」を考慮　北京日本人学校,11/14(木) 17:27
jij,時事通信,公明、国民の税調会長が初協議,11/14(木) 17:20
jij,時事通信,政府、臨時国会28日に召集　補正予算・政治改革を議論,11/14(木) 17:14
jij,時事通信,慰安婦団体前トップの有罪確定　寄付金を私的流用　韓国最高裁,11/14(木) 17:13
jij,時事通信,円相場、155円83〜84銭　14日午後5時現在,11/14(木) 17:13
jij,時事通信,津波観測、18点追加　南海トラフ沿い、最大20分早く　気象庁,11/14(木) 17:08
jij,時事通信,「103万円の壁」見直し、賛成6割超　国民民主連携先は与野党拮抗　時事世論調査,11/14(木) 17:04
jij,時事通信,首位に山下、河本ら4人　エリエール女子ゴルフ,11/14(木) 16:55
jij,時事通信,ベネズエラが3勝目　野球プレミア12,11/14(木) 16:46
jij,時事通信,【図解】エステ店で「美人局」、9人逮捕＝性的サービス後、「罰金」恐喝―警視庁,11/14(木) 16:45
jij,時事通信,抗菌薬誤投与、乳児死亡　医師が確認せず指示　兵庫県立こども病院,11/14(木) 16:44
jij,時事通信,15日からFA交渉　大山、甲斐ら9人公示―プロ野球,11/14(木) 16:12
jij,時事通信,南米歴訪、中国主席と会談　米大統領,11/14(木) 16:07
jij,時事通信,ベイルート南郊で上がる煙,11/14(木) 16:03
jij,時事通信,レバノン停戦、国会議長は新案に期待　南部でイスラエル兵6人死亡,11/14(木) 16:03
jij,時事通信,〔東京株式〕小幅続落＝半導体株安で（14日）☆差替,11/14(木) 16:00
jij,時事通信,日経平均、185円96銭安の3万8535円70銭で終了＝東京株式,11/14(木) 16:00
jij,時事通信,東急エージェンシーに罰金求刑　2億円、五輪談合で検察側　東京地裁,11/14(木) 15:58
jij,時事通信,ベストなジーニストたち,11/14(木) 15:56
jij,時事通信,女川原発、15日に発電再開へ　東北電,11/14(木) 15:52
jij,時事通信,与那国オスプレイ事故は人為ミス　離陸時にスイッチ押し忘れ　陸自,11/14(木) 15:46
jij,時事通信,日本生命、保育大手に出資　業務改善システム開発・販売へ,11/14(木) 15:44
jij,時事通信,185円安の3万8535円70銭　14日の平均株価,11/14(木) 15:38
jij,時事通信,〔東京外為〕ドル、156円前後＝買い一巡後は伸び悩む（14日午後3時）,11/14(木) 15:30
jij,時事通信,官邸に入る石破首相,11/14(木) 15:25
jij,時事通信,Ｕ字工事が詐欺被害防止呼びかけ,11/14(木) 15:15
jij,時事通信,内閣支持、横ばい28．7％　首相続投、過半数が容認　時事世論調査,11/14(木) 15:05
jij,時事通信,【Infographie】中国・珠海で車暴走、35人死亡,11/14(木) 15:05
jij,時事通信,【図解】内閣支持、横ばい28．7％＝首相続投、過半数が容認―時事世論調査,11/14(木) 15:05
jij,時事通信,アルゼンチン、COP29離脱か　多国間協力の懸念材料に,11/14(木) 14:59
jij,時事通信,ブラジル最高裁付近で爆発,11/14(木) 14:53
jij,時事通信,トランプ氏とバイデン氏,11/14(木) 14:53
jij,時事通信,ボランティア決議案を採択　活動強化へ日本提出　国連総会委,11/14(木) 14:47
jij,時事通信,スリランカ総選挙、投開票　与党過半数が焦点,11/14(木) 14:44
jij,時事通信,ブラジル最高裁付近で爆発　侵入試みた男死亡,11/14(木) 14:42
jij,時事通信,ニュースワード「APEC」,11/14(木) 14:39
jij,時事通信,フォルランがプロデビュー　テニス,11/14(木) 14:33
jij,時事通信,武家屋敷の紅葉が見頃,11/14(木) 14:26
jij,時事通信,フォルランがプロデビュー　複で初戦敗退―テニス,11/14(木) 14:10
jij,時事通信,官邸に入る石破首相,11/14(木) 14:08
jij,時事通信,米オスプレイ2機が着陸　警告灯点灯、けが人なし　鹿児島・奄美,11/14(木) 14:08
jij,時事通信,テック業界の担い手,11/14(木) 14:07
jij,時事通信,〔東京株式〕売り買い交錯＝一時マイナス圏も（14日後場中盤）,11/14(木) 14:00
jij,時事通信,「日本とのつながり」実感　アイスダンスのリード―フィギュア,11/14(木) 13:34
jij,時事通信,奈良のシカ、秋は注意　角に刺されるけが急増,11/14(木) 13:33
jij,時事通信,【Infographie】米大統領選の票差,11/14(木) 13:13
jij,時事通信,〔東京株式〕小幅上昇＝前場引き継ぐ（14日後場寄り付き）,11/14(木) 13:00
jij,時事通信,日経平均、47円28銭高の3万8768円94銭で始まる＝東京株式後場,11/14(木) 13:00
jij,時事通信,原発施設隣接地巡り詐欺容疑　保証金名目で1000万円、2人逮捕　警視庁,11/14(木) 12:39
jij,時事通信,死刑廃止「適当でない」　林官房長官,11/14(木) 12:34
jij,時事通信,〔東京外為〕ドル、156円台前半＝4カ月ぶり高値、米金利上昇で（14日正午）,11/14(木) 12:30
jij,時事通信,日米外相、ペルーで会談へ,11/14(木) 12:16
jij,時事通信,臨時国会召集、28日軸　補正、規正法を審議　政府・与党,11/14(木) 12:12
jij,時事通信,円相場、155円99〜99銭　14日正午現在,11/14(木) 12:09
jij,時事通信,〔東京株式〕小幅高＝円安や値頃感で買い（14日前場）☆差替,11/14(木) 12:00
jij,時事通信,日経平均、39円36銭高の3万8761円02銭で終了＝東京株式前場,11/14(木) 12:00
jij,時事通信,円下落、一時156円台　4カ月ぶり安値　東京市場,11/14(木) 12:00
jij,時事通信,住居侵入容疑で43歳男ら逮捕　「Z李」名乗りSNSで発信　警視庁,11/14(木) 11:57
jij,時事通信,お言葉を述べられる天皇陛下,11/14(木) 11:45
jij,時事通信,お言葉を述べられる天皇陛下,11/14(木) 11:45
jij,時事通信,39円高の3万8761円02銭　14日午前の平均株価,11/14(木) 11:44
jij,時事通信,「現・次期政権双方と対話」　米の支援継続に期待　ウクライナ外相,11/14(木) 11:32
jij,時事通信,石破首相、柿で「風邪引かない」,11/14(木) 11:31
jij,時事通信,柿を試食する石破首相,11/14(木) 11:31
jij,時事通信,石破首相、柿で「風邪引かない」　健康不安の払拭図る,11/14(木) 11:27
jij,時事通信,天皇陛下がお言葉　特別国会閉幕へ,11/14(木) 11:21
jij,時事通信,受験と生理が重なったら？85％が「不安」◆追試も可能に、早めの受診を ＃令和の学び舎,11/14(木) 11:01
jij,時事通信,平行革相、マスク氏参考に行政効率化　「秋のレビュー」スタート,11/14(木) 10:51
jij,時事通信,米下院も共和党が過半数,11/14(木) 10:50
jij,時事通信,レバノン国連要員の負傷非難　安保理が報道声明,11/14(木) 10:44
jij,時事通信,与野党国対委員長会談,11/14(木) 10:42
jij,時事通信,発言する平行政改革担当相,11/14(木) 10:41
jij,時事通信,エステ店で「美人局」、9人逮捕　性的サービス後、「罰金」恐喝　警視庁,11/14(木) 10:34
jij,時事通信,闇バイト応募し還付金詐欺　容疑で36歳男逮捕　京都府警,11/14(木) 10:33
jij,時事通信,〔東京株式〕上げ幅拡大＝値頃感で買い（14日前場中盤）,11/14(木) 10:30
jij,時事通信,【Infographie】EU市場で中国EV増加,11/14(木) 10:16
jij,時事通信,【Infographie】ノルウェー市場の大半、EVに,11/14(木) 10:14
jij,時事通信,トランプ氏、３期目に意欲？,11/14(木) 9:32
jij,時事通信,〔東京外為〕ドル、155円台半ば＝「トリプルレッド」で上昇（14日午前9時）,11/14(木) 9:30
jij,時事通信,〔東京株式〕上昇スタート＝前日反動で（14日前場寄り付き）,11/14(木) 9:30
jij,時事通信,日経平均、300円超高＝東京株式,11/14(木) 9:30
jij,時事通信,日経平均、189円38銭高の3万8911円04銭で始まる＝東京株式前場,11/14(木) 9:30
jij,時事通信,米共和上院トップにスーン氏,11/14(木) 9:29
jij,時事通信,トランプ氏、バイデン氏と会談,11/14(木) 9:18
jij,時事通信,英紙ガーディアン、Ｘ投稿停止,11/14(木) 9:15
jij,時事通信,米国務長官にルビオ氏,11/14(木) 9:11
jij,時事通信,円相場、155円40〜43銭　14日午前9時現在,11/14(木) 9:09
jij,時事通信,極右ルペン氏の被選挙権停止を　公金横領事件で求刑　仏検察,11/14(木) 9:08
jij,時事通信,米中首脳、１６日に会談,11/14(木) 9:08
jij,時事通信,米アマゾン、低価格特化コーナー　20ドル以下、中国系通販に対抗,11/14(木) 9:07
jij,時事通信,トランプ氏起訴の特別検察官辞任へ,11/14(木) 9:05
jij,時事通信,奈良のシカ、秋は注意,11/14(木) 8:54
jij,時事通信,奈良のシカ、秋は注意,11/14(木) 8:54
jij,時事通信,演説するトランプ氏,11/14(木) 8:47
jij,時事通信,副大臣・政務官人事を決定,11/14(木) 8:44
jij,時事通信,首相と記念撮影する政務官ら,11/14(木) 8:44
jij,時事通信,マウンドに集まるオーストラリアナイン,11/14(木) 8:41
jij,時事通信,トランプ氏、3期目に意欲？　　「皆が求めれば」　米,11/14(木) 8:40
jij,時事通信,笑顔の井上と牧　野球プレミア１２,11/14(木) 8:40
jij,時事通信,小池都知事がＣＯＰ２９で講演,11/14(木) 8:38
jij,時事通信,８０００万年前の新種鳥類化石,11/14(木) 8:36
jij,時事通信,８０００万年前の新種鳥類想像図,11/14(木) 8:36
jij,時事通信,最も差し迫った課題は中国　政権引き継ぎで強調　米高官,11/14(木) 8:25
jij,時事通信,G20の輸入規制、360兆円　世界経済悪化を懸念　WTO,11/14(木) 8:19
jij,時事通信,NY円、155円台半ば,11/14(木) 8:12
jij,時事通信,首相動静（11月14日）,11/14(木) 8:05
jij,時事通信,米共和上院トップにスーン氏　穏健派、トランプ氏と連携,11/14(木) 8:01
jij,時事通信,〔NY外為〕円下落、155円台半ば＝3カ月半ぶり安値（13日）,11/14(木) 8:00
jij,時事通信,英紙ガーディアン、X投稿停止　「有害」「マイナス面上回る」,11/14(木) 7:53
jij,時事通信,米下院も共和党が過半数　大統領職と議会を独占　トランプ次期政権,11/14(木) 7:44
jij,時事通信,ビットコイン、初の9万ドル台　トランプ氏期待で最高値更新,11/14(木) 7:39
jij,時事通信,日米韓首脳会談、ペルーで開催　3カ国連携の制度化協議,11/14(木) 7:15
jij,時事通信,揺らぐ「安全」、習政権に衝撃　社会の不満解消後回しのつけ　中国暴走事件,11/14(木) 7:09
jij,時事通信,トランプ氏に備え新興国取り込み　中国主席、南米訪問開始,11/14(木) 7:09
jij,時事通信,8000万年前の新種鳥類化石　脳進化解明に期待　ブラジル,11/14(木) 7:07
jij,時事通信,敦賀2号機、再申請のハードル高く　新証拠に、130本超の断層調査も,11/14(木) 7:07
jij,時事通信,「危険運転」へ変更相次ぐ　遺族の署名活動影響か　死亡事故、立証にハードルも,11/14(木) 7:07
jij,時事通信,改革案不発で焦り　MBOで買収回避狙う　セブン＆アイ,11/14(木) 7:06
jij,時事通信,適性評価、準備作業に全力　重要情報の資格者認定　城内経済安保相・新閣僚インタビュー,11/14(木) 7:06
jij,時事通信,14日の朝刊（都内最終版）☆2,11/14(木) 7:06
jij,時事通信,「農家の暮らしも考えて」　コメ高騰で江藤農水相　新閣僚インタビュー,11/14(木) 7:05
jij,時事通信,中野国交相、国土強靱化「必要十分な予算を」　能登地震の被災地視察へ　新閣僚インタビュー,11/14(木) 7:05
jij,時事通信,政倫審積極論、参院側で浮上　「みそぎ済んだ」衆院消極的　自民,11/14(木) 7:05
jij,時事通信,危機の公明「攻め」より「守り」　前途多難の斉藤体制【解説委員室から】,11/14(木) 7:03
jij,時事通信,〔米株式〕ダウ反発、47ドル高＝米利下げ期待で（13日）☆差替,11/14(木) 7:00
