media_en,media_jp,title_articles,link_articles,date_original
fbc,FBC 福井放送,【速報】原発の運転差し止め　仮処分申し立て「却下」　福井地裁,https://news.yahoo.co.jp/articles/0bbc5fa65e334969b7c7ba9c41328dd208af03b6,3/29(金) 13:07
fbc,FBC 福井放送,【速報】ハピラインふくいで社員が売上金を着服,https://news.yahoo.co.jp/articles/55524697c720818927974eb21d2056d43e8c55fd,3/29(金) 12:31
fbc,FBC 福井放送,【特集】大廃炉時代に向き合う　「クリアランス物」の行方　高校生が地域住民とともに考える　再利用し防犯灯設置,https://news.yahoo.co.jp/articles/8768344c4f76747200a4bb32662bdf3fbb7f5eea,3/28(木) 19:46
fbc,FBC 福井放送,駅の切符売り場に長蛇の列　窓口に並ぶ？券売機で買う？　利用客から不満の声も,https://news.yahoo.co.jp/articles/4350b338bd6ea755d1c2c44f7e6abab0618d470b,3/28(木) 18:35
fbc,FBC 福井放送,「食や歴史を生かしたPR」で嶺南誘客を　大学生が高速道路会社に提案　北陸道下り線から舞若道への流入は1割にとどまる,https://news.yahoo.co.jp/articles/89fb086d9236daa615bf8ec0d97cd8d316f12afb,3/28(木) 18:34
fbc,FBC 福井放送,無人販売所から冷凍食品を…　窃盗容疑で逮捕の消防士　停職6か月の懲戒処分　鯖江・丹生消防組合,https://news.yahoo.co.jp/articles/2740b1b7e7cacdc37407461bec59434fc0efa287,3/28(木) 18:32
fbc,FBC 福井放送,「六条大麦」使用のご当地ビール　来週末から順次販売　福井駅前フードホールで醸造進む,https://news.yahoo.co.jp/articles/23c5e0549944f56f1e2667e1c6b3851d6b57e47d,3/28(木) 18:27
fbc,FBC 福井放送,高校生考案の教育旅行プラン　福井ならではの魅力発信　現地での案内役も務める,https://news.yahoo.co.jp/articles/9430effc1334a6b3a2e3d72da56338610457e294,3/28(木) 18:22
fbc,FBC 福井放送,工大福井高校・山田琉碧選手が初優勝　全国高校選抜バドミントン、男子シングルス,https://news.yahoo.co.jp/articles/e28f522fd41b0147065b3148463a5ce3ab6cfbbf,3/28(木) 18:19
fbc,FBC 福井放送,科学技術高・戸田朱音選手が優勝　県勢初の快挙　全国高校選抜、女子ケイリン,https://news.yahoo.co.jp/articles/2bd9da6a9648a0efa3f0937fdcd7dcd18545e3c7,3/28(木) 18:17
fbc,FBC 福井放送,認知度アップへ、おおい町がPR動画制作　地元出身の人気お笑い芸人が出演　ロングコートダディ・堂前透さんら,https://news.yahoo.co.jp/articles/b85c7eb931790cb3af329a0fcb8794dfbadae446,3/28(木) 17:17
fbc,FBC 福井放送,能登半島地震の義援金贈る　「被災者の生活再建に」県トヨタグループ協豊会　日本赤十字社を通じ被災地へ,https://news.yahoo.co.jp/articles/c40a875b0e8828266448c7522057072ea9c6351b,3/28(木) 14:51
fbc,FBC 福井放送,子育て世代を切れ目なくサポート 「こども家庭センター」4月開所　福井市健康管理センター内,https://news.yahoo.co.jp/articles/1839fbed551229ef1e001cdadef3e65723d96320,3/28(木) 13:49
fbc,FBC 福井放送,南越前町で漁師が行方不明　糠漁港の沖合で無人の漁船見つかる　28日朝から捜索再開へ,https://news.yahoo.co.jp/articles/a3042be3e445031793bb04f83e418cf5a83985ca,3/27(水) 20:41
fbc,FBC 福井放送,フェンシング・見延がパリ五輪出場確実　東京五輪団体では金メダル　県勢では2人目,https://news.yahoo.co.jp/articles/d8f8d6932ad91ecbd56a682f58b316e4f0518405,3/27(水) 20:19
fbc,FBC 福井放送,「市の職員がこんなことを？」　越前市の課長級職員のパワハラ　市民から厳しい声,https://news.yahoo.co.jp/articles/732d4b39fa264a25b17e78ebfcc478161f506e1f,3/27(水) 20:13
fbc,FBC 福井放送,新幹線で即日輸送！東京の人気グルメを販売　西武福井店でイベント始まる,https://news.yahoo.co.jp/articles/73f0580dc606409ddac72912787c68a92dafd698,3/27(水) 20:01
fbc,FBC 福井放送,黄色いじゅうたんの上に…新幹線！　鯖江市の菜の花畑　地元の農業法人が栽培,https://news.yahoo.co.jp/articles/948edcb873a9931e06c46f43c800f223da65b240,3/27(水) 19:42
fbc,FBC 福井放送,17年ぶり金利引き上げ　福井銀行と福邦銀行　日銀のマイナス金利政策解除に伴い改定,https://news.yahoo.co.jp/articles/56d78158bb276cff87249e7bdfbec0071bc3fc51,3/27(水) 19:29
fbc,FBC 福井放送,「警察と取引して証言変えた」　38年前の殺人事件で証言の男性　2度目の再審請求めぐる協議で発言,https://news.yahoo.co.jp/articles/b2449eb07f64c5339c615da243318c71e40f80e8,3/27(水) 19:11
fbc,FBC 福井放送,"商業地の地価変動率""32年ぶり""上昇　新幹線開業効果で駅周辺など地価アップ",https://news.yahoo.co.jp/articles/5b5da2290b7a39f82974bfa7da9552635f575feb,3/27(水) 18:39
fbc,FBC 福井放送,別名「早春の妖精」　薬草のセリバオウレン高浜町で見ごろ　暖冬で発芽早まる,https://news.yahoo.co.jp/articles/73aea5b6d7491c1a9391aaa2ef9081ce978683fe,3/27(水) 15:51
fbc,FBC 福井放送,過去最高の漁獲金額　「越前がに」豊漁！　漁獲制限でシーズン通して安定供給,https://news.yahoo.co.jp/articles/ae858716a1d9750b42d37de60a9751f0c1c047db,3/27(水) 14:42
fbc,FBC 福井放送,被災地の炊き出しに…　越前市がコメ寄贈　避難所に食事届ける石川県の料理人グループに,https://news.yahoo.co.jp/articles/344033b5746d3517408106238a8049e50bf88a79,3/27(水) 14:28
fbc,FBC 福井放送,パワハラで市職員を懲戒処分　部下に飲み会代7〜8回支払わせる　50代の課長級2人「スキンシップのつもりだった」　体をつねる、退職届を書かせるなどの行為も　越前市役所,https://news.yahoo.co.jp/articles/6fa9ad43e0af4e829f35a5e5fc337a4c2ef6d1d1,3/26(火) 20:57
fbc,FBC 福井放送,軽ワゴンと乗用車が衝突　16歳の無免許運転か、4人重軽傷　鯖江市・国道8号の交差点,https://news.yahoo.co.jp/articles/cbc11d9e8442664029f23c1a4d87c72f4849ace8,3/26(火) 19:21
fbc,FBC 福井放送,紅麹を使った商品　県内企業でも“自主回収”進む　小林製薬のサプリで死者も,https://news.yahoo.co.jp/articles/e83f30a337f9ba099439e7fac1062cde21f44153,3/26(火) 19:20
fbc,FBC 福井放送,高浜町長選挙　現職・新人の計4陣営が参加　立候補予定者説明会,https://news.yahoo.co.jp/articles/214713354853c74250c0759d5c758cc25a958ba0,3/26(火) 19:20
fbc,FBC 福井放送,ハピラインふくい　鉄道・運輸機構と協定締結　災害に強い地域鉄道へ　復旧支援など盛り込む,https://news.yahoo.co.jp/articles/5ac9c142ecea8e1e143254458b6d947a912a8c45,3/26(火) 19:19
fbc,FBC 福井放送,対話する力など磨く　新入社員研修、59社115人参加　福井商工会議所,https://news.yahoo.co.jp/articles/95b35aa1b99e3ad83687af20a881d98646198a7b,3/26(火) 16:40
fbc,FBC 福井放送,内履き入れる袋、孫のため手作り　小学校入学で準備進む　敦賀市のミシン教室,https://news.yahoo.co.jp/articles/b1a221ff22bc1cd42b13ad08f3387dc66441743f,3/26(火) 16:35
fbc,FBC 福井放送,カーポートで太陽光発電　電気自動車3台を同時充電　災害時の電力供給源にも,https://news.yahoo.co.jp/articles/46626de0e3b2d6593820bf8055c91db1f9a5e4f1,3/26(火) 15:16
fbc,FBC 福井放送,県外からの予約相次ぐ　複合アウトドア施設、新幹線開業を追い風に　若狭町「山座熊川」,https://news.yahoo.co.jp/articles/1aced6828e3e0aa046a82c71ae2b78ed3b442a85,3/26(火) 14:25
fbc,FBC 福井放送,丸岡藩誕生400年記念　オリジナル切手シート販売　80年以上前の丸岡城などデザイン,https://news.yahoo.co.jp/articles/509f269b3622921c71afd1469ffe909064c1a79c,3/26(火) 12:14
fbc,FBC 福井放送,観光客に人気の土産モノは？　にぎわう駅ナカ商業施設で調査　新幹線開業から1週間,https://news.yahoo.co.jp/articles/be9bb9c1f77a1c8a6a3df3a4dc22179e6f963ddd,3/25(月) 19:10
fbc,FBC 福井放送,折れた剣を包丁に、越前打刃物の技術で再生　発起人はフェンシング見延和靖選手　10本限定販売,https://news.yahoo.co.jp/articles/4404c04ac8f31242fd60e8f716e3c8236cbee185,3/25(月) 18:53
fbc,FBC 福井放送,県民からの支援に感謝　松田邦紀・駐ウクライナ大使「問題から目を背けないで」　6年ぶりに帰郷,https://news.yahoo.co.jp/articles/5ec4315648cfade66c208c3d943371e25e115648,3/25(月) 18:29
fbc,FBC 福井放送,県の木・マツを守る　協賛金の一部を県に贈る、薬剤散布などに活用　FBC「ずーっと、福井で。」キャンペーン,https://news.yahoo.co.jp/articles/136e6c47b27172a80472e058b1d84d5d45f6aefc,3/25(月) 18:27
fbc,FBC 福井放送,省エネなど取り組み加速　「温室効果ガス」排出削減へ　推進企業を県が表彰　豪雨や猛暑など気候変動の原因に,https://news.yahoo.co.jp/articles/83442f85cf3733f30739d665309457021b7e9f32,3/25(月) 16:37
fbc,FBC 福井放送,県内にも大きな被害　能登半島地震で県に寄付金贈る　県遊技業協同組合「復旧活動に役立てて」,https://news.yahoo.co.jp/articles/f6584a110778c4ea186cecb41df4467880e9f872,3/25(月) 16:23
fbc,FBC 福井放送,草取り鎌など製造ピーク　手作りでギザギザに“目切り”　春の農作業まもなく　越前市の刃物工場,https://news.yahoo.co.jp/articles/d9365d971ed94d723591bcff1b4a923d5c3fae25,3/25(月) 16:13
fbc,FBC 福井放送,終着駅効果発揮か　北陸新幹線福井開業から約1週間　敦賀の各地でにぎわう,https://news.yahoo.co.jp/articles/05dc73d16fd437e9967341f30f4051b9b67d0179,3/24(日) 18:26
fbc,FBC 福井放送,美方女子がＶ６　ローイング（ボート競技）かじ付きクォドルプル　全国高校選抜大会,https://news.yahoo.co.jp/articles/ddc8be192ed38f8f14a472f7f91edde03d47f5db,3/24(日) 17:46
fbc,FBC 福井放送,し尿を有機肥料やセメントの原料として100％リサイクル　越前市に新施設完成,https://news.yahoo.co.jp/articles/e0c3e717fcb7526d6b8d8de329b2c16ad22dcce1,3/24(日) 12:00
fbc,FBC 福井放送,老化物質を測定し生活習慣の改善に　越前市と島津製作所が協定,https://news.yahoo.co.jp/articles/8691dc768fa37c303719e78011213b21b489f5fd,3/24(日) 11:21
fbc,FBC 福井放送,はがき２枚分ほどの小さなキャンバスに表現　ＦＵＫＵＩサムホール美術展に３４２点　節目４０回目の今年は歴代の大賞作品も展示,https://news.yahoo.co.jp/articles/51b8fe5969ee968f4bf1d8a818cdb0a29ac07ce4,3/23(土) 16:56
fbc,FBC 福井放送,北陸新幹線県内開業から１週間　福井駅前のにぎわい続く　グルメイベントや野球イベント開催,https://news.yahoo.co.jp/articles/b04abeaebe2948bd11863988c8f6d260b04ff4b0,3/23(土) 16:41
fbc,FBC 福井放送,歌手生活６０周年・五木ひろしさん新曲「こしの都」を初披露　北陸新幹線の県内開業記念　越前市中心に福井の魅力を歌にのせ,https://news.yahoo.co.jp/articles/bba5283077f0cf6dfc77ba182f392505e405f9b7,3/23(土) 16:28
fbc,FBC 福井放送,１５０発の打ち上げ花火で新幹線を歓迎　ふくい桜まつり開幕,https://news.yahoo.co.jp/articles/3fa255c4311b9e50e5485a03605fe27b8ae6c218,3/23(土) 15:58
fbc,FBC 福井放送,石油ストーブから引火か　越前市の住宅で火事　女性の遺体見つかる　連絡取れない８０代女性とみて調べ,https://news.yahoo.co.jp/articles/30392dc3662bafb939829cdc65eaf9818148f183,3/23(土) 13:25
fbc,FBC 福井放送,沈んだ軽トラックから男性の遺体　一部白骨化進む　敦賀港の沖合８メートルの海底　身元の特定急ぐ,https://news.yahoo.co.jp/articles/0779bdc7c48f228aa24f5ed7bed8a05ccae42515,3/23(土) 13:23
fbc,FBC 福井放送,閉校を前に最後の修了式　大野市の3つの中学校　少子化などで学校再編、5校→2校に,https://news.yahoo.co.jp/articles/42f916838b68dee39f768b4b45771a3478cea14a,3/22(金) 20:40
fbc,FBC 福井放送,新キャラ「福いいヌ！くん」登用　プロモーション特命課長「福いいネ！くん」の相棒に　福井市で人事異動,https://news.yahoo.co.jp/articles/11950a5be8d38a30377d3dc5f97ada94ea56ead7,3/22(金) 20:36
fbc,FBC 福井放送,「葉ワサビ」収穫始まる　春の山菜、独特の辛みとシャキシャキ食感　おおい町名田庄,https://news.yahoo.co.jp/articles/ca63994bbee243555b31931b9a6108d6c42b521a,3/22(金) 20:17
fbc,FBC 福井放送,ホタルイカ漁解禁　産卵の時期を控え、栄養たっぷり　越前町で水揚げ,https://news.yahoo.co.jp/articles/10e935e68819bae323df86730428dc783dbe23af,3/22(金) 20:07
fbc,FBC 福井放送,県文化財を龍翔博物館で保護　能登半島地震で本堂が被災　坂井市・大善寺「木造黒漆塗厨子」,https://news.yahoo.co.jp/articles/6a89a5ea05273e0101df61fea7ab58af8995045a,3/22(金) 20:03
fbc,FBC 福井放送,満天の星を眺めて宿泊　大野・南六呂師の宿リニューアル　「星空保護区」認定,https://news.yahoo.co.jp/articles/301bd231d60e83332b56158f74aec38cc6a1750c,3/22(金) 20:01
fbc,FBC 福井放送,新幹線で福井の食材を首都圏へ　敦賀駅からスピード発送　魚介など“新鮮さ”を売りに,https://news.yahoo.co.jp/articles/4d10496dad0d2a00b0bffd2c1b5602534f10f9f7,3/22(金) 15:14
fbc,FBC 福井放送,樹齢300年“八重の紅梅”見ごろ　重なり合うように咲く　坂井市三国町・瀧谷寺,https://news.yahoo.co.jp/articles/b10da3d28d6bc75b6da800d14063f8c19f9baabe,3/22(金) 15:00
fbc,FBC 福井放送,狭い天井裏に排ガスが充満か　解体工事現場で3人死傷　一酸化炭素中毒の可能性　池田町・能楽の里文化交流会館,https://news.yahoo.co.jp/articles/a12c00e88c4754fc2ffec3ddad56668f8b1d1f12,3/21(木) 20:40
fbc,FBC 福井放送,鉄道ジオラマリニューアル　越美北線と北陸新幹線の“共演”も　大野・平成大野屋二階蔵,https://news.yahoo.co.jp/articles/c4b177f0a4af8f13612771f62ec91273ea73bca3,3/21(木) 20:15
fbc,FBC 福井放送,あわら温泉舞台の小説　16日に発売　火事で全焼の「べにや」モデルに　人々の奮闘描く,https://news.yahoo.co.jp/articles/cd9ffc0e8b90488604aefe1ece9910b7e5fa3346,3/21(木) 20:03
fbc,FBC 福井放送,あわら温泉の旅館に「恐竜ルーム」誕生　新幹線開業にあわせリニューアル　大浴場の床は全部畳に,https://news.yahoo.co.jp/articles/383f3d8430aefe1e224c9b4c718d98f0ab174c4a,3/21(木) 19:44
fbc,FBC 福井放送,敦賀・金ヶ崎宮「花換まつり」前に　桜の小枝づくり大詰め　新幹線カラーの短冊・能登へのメッセージも,https://news.yahoo.co.jp/articles/c9ee6f852f5450fc8e699ae84c7d359e579efe02,3/21(木) 19:29
fbc,FBC 福井放送,10月の全国育樹祭でふるまう弁当　大学生らが考案　地元食材たっぷり！色とりどりのおかずで「おもてなし」,https://news.yahoo.co.jp/articles/a88f3622b24dbc15002b93b18486f97dd6bce129,3/21(木) 19:21
fbc,FBC 福井放送,"県組織改正「インバウンド推進室」設置　年間40万人目標、海外からの誘客へ　""地域防災力""強化に専門ポスト新設",https://news.yahoo.co.jp/articles/3c78c994db688439252137072d0db86b6f3aaef3,3/21(木) 19:06
fbc,FBC 福井放送,解体工事現場で事故　作業員1人死亡、2人意識不明重体　一酸化炭素中毒か　池田町・能楽の里文化交流会館,https://news.yahoo.co.jp/articles/53383dfd0c39c374a9019ea24042dcf508d643ad,3/20(水) 21:12
fbc,FBC 福井放送,橘ケンチさんらEXILEグループ　福井の食の魅力をアピール　福井市内でトークショー、新幹線開業記念,https://news.yahoo.co.jp/articles/64550392be76f2e32ba9bb24d8610897abc8f038,3/20(水) 19:58
fbc,FBC 福井放送,台風並みの強風、大荒れの県内　北陸道ではスリップ事故相次ぐ　21日も断続的に雪が降る見込み,https://news.yahoo.co.jp/articles/bbdcae8313296e12255a3c720b41432c0a7d73fc,3/20(水) 19:57
fbc,FBC 福井放送,新幹線で県内観光地に　春の嵐にも負けずにぎわう　伝統工芸に親しむ外国人の姿も,https://news.yahoo.co.jp/articles/3a7c864acb8f3e8a4de730518747c35958d2acef,3/20(水) 19:17
fbc,FBC 福井放送,体内の老化物質を測る機器設置　市民の健康づくりを後押し　越前市が島津製作所と協定締結,https://news.yahoo.co.jp/articles/6669cd577095acc77ed7cc2500ff0c9d56cf1e56,3/20(水) 17:46
fbc,FBC 福井放送,避難者におろしそば振る舞う　勝山市のそば愛好家、地元のそば粉使用　福祉避難所での支援継続,https://news.yahoo.co.jp/articles/2e723c4443adc828a8d51a99fa50d556bc325e07,3/20(水) 17:06
fbc,FBC 福井放送,地震対策など大規模改修工事　面積は1.6倍に拡張　福井市立図書館、5月オープン,https://news.yahoo.co.jp/articles/d979431d525886e94faafa9dcd140cc78161003d,3/20(水) 17:04
fbc,FBC 福井放送,大野「七間朝市」再開　新鮮な野菜や花、通りに並ぶ　越前大野城はうっすら雪化粧　大みそかまで,https://news.yahoo.co.jp/articles/8a723a3860584d7fb1ffb501e467d561846265e7,3/20(水) 12:14
fbc,FBC 福井放送,“国内最多”87体の恐竜が出迎え　かつやまディノパーク　新幹線開業でパワーアップ,https://news.yahoo.co.jp/articles/3a1daf6fc8309f71901d4368cd933fc494419a78,3/19(火) 22:24
fbc,FBC 福井放送,県内の3団体に福祉車両贈呈　リフト付きバスなど送迎に役立てる　24時間テレビチャリティー委員会,https://news.yahoo.co.jp/articles/9e41657d4f85fb473621fa7aba37dee29618205c,3/19(火) 21:55
fbc,FBC 福井放送,敦賀駅での乗り換え問題　戸惑いの声相次ぐ「不便、分かりにくい」　北陸新幹線開業で検証,https://news.yahoo.co.jp/articles/d46edf3ac740791ebb56b91aa2506dedc555aeb5,3/19(火) 20:27
fbc,FBC 福井放送,左腕エース146球の力投及ばず　敦賀気比の初戦、明豊にサヨナラ負け　春のセンバツ高校野球,https://news.yahoo.co.jp/articles/3049f4395957cc8f715f6556bdb130ac7166ae4c,3/19(火) 20:17
fbc,FBC 福井放送,まちなかで自然を堪能　足羽川のほとりに新拠点オープン　屋上からは桜並木や花火鑑賞も,https://news.yahoo.co.jp/articles/8e4e71fd75c283241448b30be68c69fa9451b677,3/19(火) 20:01
fbc,FBC 福井放送,越前打刃物の“技”生きる、女性専用シェービングカミソリ　滑らかなそり心地で肌の余分な角質も除去,https://news.yahoo.co.jp/articles/321389f9cd67649d3b7892e169f8166e40f65e51,3/19(火) 19:42
fbc,FBC 福井放送,一足早い春の訪れ　早咲きのヒガンザクラ満開　小浜市の古刹・飯盛寺,https://news.yahoo.co.jp/articles/e56240dd3a7dde5be901eaeaf71b9177b5d3c3d5,3/19(火) 19:33
fbc,FBC 福井放送,にぎわう福井駅前　開業直後“まるで渋谷”　想定以上の人出でトラブルも…,https://news.yahoo.co.jp/articles/02ccfd9a3a8d6d524794f861168c56c55bc3ae67,3/18(月) 19:25
fbc,FBC 福井放送,バドミントン山口茜選手　パリ五輪出場を確実に、女子シングルス　仏オープン・全英オープンで準優勝,https://news.yahoo.co.jp/articles/bcc353ea90cf6e675eff5951c708d838304c28fa,3/18(月) 19:23
fbc,FBC 福井放送,おりひめジャパン福井合宿　地元・永田美香選手「必ず勝って切符を取る」　パリ五輪最終予選へ　ハンドボール女子日本代表,https://news.yahoo.co.jp/articles/8e7bf1d76cb1e0515bde4592320f0c21acf42c99,3/18(月) 19:22
fbc,FBC 福井放送,事務所兼住宅を全焼　焼け跡から1遺体発見　福井市佐野町,https://news.yahoo.co.jp/articles/01c1918b09d89ac9fcdc6ec01aa17e4eaf8076c0,3/18(月) 18:45
fbc,FBC 福井放送,開業2日間で6万人が利用　北陸新幹線、金沢ー福井間　JR西日本「非常に好調」,https://news.yahoo.co.jp/articles/5fdde3b333e9ed9cd8b157baa96bf1e585bd8285,3/18(月) 17:28
fbc,FBC 福井放送,通勤・通学客でホーム混雑　ハピラインふくい、開業後初の平日　定期券未購入で精算も,https://news.yahoo.co.jp/articles/99b304ba8e311b2a37953dc0ac2ca6c0a6de91dc,3/18(月) 11:48
fbc,FBC 福井放送,福井ブローウィンズ　レギュラーシーズン1位確定　ホーム最終戦で勝利　バスケB3リーグ,https://news.yahoo.co.jp/articles/bc8b9e9dbdc94d1cfcc17e7461c977e246786f90,3/17(日) 22:05
fbc,FBC 福井放送,福井市で住宅全焼　1人安否不明　警察と消防が確認急ぐ　午後9時現在,https://news.yahoo.co.jp/articles/4f9544e038779e0c85625834249f252139c5fb0f,3/17(日) 21:45
fbc,FBC 福井放送,"新幹線開業で県内にぎわう　初めて福井を訪れた人も「魅力的な観光地がいっぱい」　""恐竜列車”も連日満員",https://news.yahoo.co.jp/articles/cda85c98624847ea17f753768bca2b0a6f036fdc,3/17(日) 21:29
fbc,FBC 福井放送,道路横断中の高齢者はねられ死亡　現場に横断歩道なし　越前町厨,https://news.yahoo.co.jp/articles/9074b837c1a176e3db400afd4e10922aab446137,3/17(日) 12:18
fbc,FBC 福井放送,ハピライン、開業初日からトラブル　現金での切符販売できず　自動券売機に小銭詰まる　職員が釣り銭の装填ミスか,https://news.yahoo.co.jp/articles/7fcb28b86de12391d43dad8e7e6933139fa3955a,3/17(日) 12:12
fbc,FBC 福井放送,北陸新幹線ついに県内開業　大勢の観光客らでにぎわう　福井駅前、恐竜王国ふくいをアピール,https://news.yahoo.co.jp/articles/ffa53646bc5e98484b820a4fd0ce4c8794e08f93,3/16(土) 19:03
fbc,FBC 福井放送,杉本知事「半世紀にわたる悲願達成」　新幹線開業祝賀会　岸田首相もビデオ出演「北陸を日本有数の観光地域に」,https://news.yahoo.co.jp/articles/a9a9b019491baf2954bea4145704487bcc5452a0,3/16(土) 18:56
fbc,FBC 福井放送,「ハピラインふくい」開業　県民に愛される鉄道に　敦賀ー大聖寺間の運行引き継ぐ,https://news.yahoo.co.jp/articles/2b761467e059100500fc82d375901784c5da2404,3/16(土) 14:00
fbc,FBC 福井放送,“一番列車”出発進行　北陸新幹線、金沢ー敦賀間延伸　北陸全体の復興への思い乗せ走る,https://news.yahoo.co.jp/articles/88707ce00a68f4c01934e0bbac8d2a00ddeceb7b,3/16(土) 7:08
fbc,FBC 福井放送,車両ラッピング大詰め　ハピラインふくい　16日から運行開始、敦賀駅‐大聖寺駅間,https://news.yahoo.co.jp/articles/452ead2a6382e8ac6552aa49b742b3f20260e534,3/15(金) 21:36
fbc,FBC 福井放送,「学びの場を整えてくれたことに感謝」コロナ禍と同時に入学の学生ら卒業式迎える　仁愛大学,https://news.yahoo.co.jp/articles/1f5fbb8c9448d7fd25c33feab44039e561d1a5af,3/15(金) 20:06
