media_en,media_jp,title_articles,link_articles,date_original
sippo,sippo,猫との暮らしは相手を知ることから　その子の気持ちに寄り添い過ごす時間を楽しもう,https://news.yahoo.co.jp/articles/6ce4b84f2c821597f84a9a527a44e254ecd5ef12,5/5(日) 12:20
sippo,sippo,＜うちのニャンコ＞玄関チャイムが鳴ると大騒ぎ　ビビりで甘えん坊なミックス猫「キット」,https://news.yahoo.co.jp/articles/85e04ab6a6d8b8013be5cbfc752c719b6bc5f6a4,5/4(土) 12:20
sippo,sippo,もの言えぬ動物の代弁者として　適切な情報発信で動物虐待の抑止につなげていく,https://news.yahoo.co.jp/articles/5034ac3a0dbb7cdd6a9b66635eb835ba044c40b3,5/4(土) 12:10
sippo,sippo,病院の枠超えつながりたい！　福岡生まれの愛玩動物看護師会、業界変える存在へと成長中,https://news.yahoo.co.jp/articles/a22d40f69b50fa805aa20cabeeaecb4f5bf05d7e,5/4(土) 12:10
sippo,sippo,おてんばな子猫がやって来た！　すると「ゆるキャラ」だった先住猫がお兄ちゃんに変身,https://news.yahoo.co.jp/articles/cbd7e15ce26c35d98762dc4b86d38294822085d4,5/4(土) 12:04
sippo,sippo,窓をたたいて合図し網戸によじ登る　とーさん、家の敷地に現れた子猫のアピールに…,https://news.yahoo.co.jp/articles/f77991faf75f335483206e3c71e59878bbbe5372,5/4(土) 11:50
sippo,sippo,紆余曲折あったトライアルを経て　猫の首輪をはずし、大切そうにバッグにしまった,https://news.yahoo.co.jp/articles/a81649bdfca164d753403dfdeffac4b9416a86c8,5/4(土) 11:40
sippo,sippo,猫を迎え、日当たりのよい家に越したあの日　愛猫は姿を消し不安と焦りが広がった,https://news.yahoo.co.jp/articles/e952b304069e42f8b1015737464d8241d2eaf02d,4/30(火) 19:10
sippo,sippo,愛犬「ハンター」が旅立ち3カ月　優しくて頼もしい元保護犬「マル」の存在,https://news.yahoo.co.jp/articles/e668c04ea3ad55a90603bc4c23a1bd4558c41568,4/29(月) 18:50
sippo,sippo,＜うちのニャンコ＞美形で優しく人懐こい　先住猫の分離不安症をも癒やしたサイベリアンの「レイ」,https://news.yahoo.co.jp/articles/e81f557bc06c7396c25001b14ecc9b2497f16976,4/29(月) 10:10
sippo,sippo,愛猫がフードに混ぜた薬を飲まない　獣医さん直伝の方法は「口になすりつける」,https://news.yahoo.co.jp/articles/efa5fa93731d26dbf4a3025b67f152b9dcca26fd,4/29(月) 10:00
sippo,sippo,災害救助犬の出動「これが最後であってほしい」と願う　眼前の光景に気持ちが揺らいだ,https://news.yahoo.co.jp/articles/a01872550476d95259d0b7e3f1ad97257aaddd96,4/29(月) 10:00
sippo,sippo,坂上パパ、能登半島地震の被災地へ　動物たちの保護状況を見聞きして感じたことは,https://news.yahoo.co.jp/articles/be24a253b356fc943bc762cb98640c7233d6789c,4/28(日) 18:01
sippo,sippo,手違いで忘れられていた愛犬の検査　不安や悲しみを感じた体験を看護にいかす,https://news.yahoo.co.jp/articles/a3bd72da2ea6a40e8da3bdf56353a1fa2873e2da,4/27(土) 19:40
sippo,sippo,愛犬と憧れの京都旅へ！　ワンコファーストな快適ホテルステイも満喫,https://news.yahoo.co.jp/articles/0c18d6d387c0dec512d323a4ce3652efb1dfe7a8,4/27(土) 10:30
sippo,sippo,動物の法的位置づけについて　日本の法で動物の権利を保障することはできるのか,https://news.yahoo.co.jp/articles/f5a3956af1fdbe6bb7f46b4f63fcef000876433d,4/27(土) 10:30
sippo,sippo,急に腕枕をされに来なくなった愛猫ぐっぴー　知らぬ間に部署異動があった？,https://news.yahoo.co.jp/articles/44912d1a0746f54aeda5fd92d9966048176bfe55,4/27(土) 10:20
sippo,sippo,楽しい思い出と共に過ごしたい　犬や猫との別れから教えてもらったこと,https://news.yahoo.co.jp/articles/81c3fd87ecf0beb89e934ec3134c2c6c42afb2c6,4/27(土) 10:10
sippo,sippo,＜うちのニャンコ＞毛布をふわり　お気に入りのベッドでおなかを出して寝ていたキジトラ猫「くぅ」,https://news.yahoo.co.jp/articles/3bdb85db0476c6c614949bfad7a37eeeac771542,4/27(土) 10:00
sippo,sippo,＜うちのワンコ＞ お気に入りのおもちゃと一緒に　明るくて陽気なトイプードル「Tan」,https://news.yahoo.co.jp/articles/a4418751dffa0d23f048ad8fdbf50baead1c5273,4/27(土) 9:50
sippo,sippo,＜うちのニャンコ＞気持ちいい朝だにゃ　いつもお寝坊さんのブリティッシュショートヘア「トントン」,https://news.yahoo.co.jp/articles/2c07e4753bcae882156702d31684a248812f3944,4/27(土) 9:50
sippo,sippo,＜うちのニャンコ＞面白すぎるにゃ〜！　爪とぎベッドをカジカジ分解して楽しんだミックス猫「まる」,https://news.yahoo.co.jp/articles/fbd9105b268ba4b43723a4f81cc022e378f7ea21,4/27(土) 9:50
sippo,sippo,＜うちのニャンコ＞気持ちがいいにゃ　同居猫たちとこたつでくつろぐ温厚で優しいお姉ちゃん猫「蓮」,https://news.yahoo.co.jp/articles/b0a6b4a0bad35884771ec37528c1944a8aa3c644,4/27(土) 9:40
sippo,sippo,巨大な食料システムに組み込まれた畜産動物　養豚場からの豚のレスキューはじまる,https://news.yahoo.co.jp/articles/57d97f7b1ddff8987795a2ad5054cade9bc482bc,4/22(月) 14:10
sippo,sippo,寄付が届く！　アニマル・ドネーション、動物福祉の向上を目指す活動団体の募集を開始,https://news.yahoo.co.jp/articles/9329cfa95ce29219e8827cde4c57d6eac2f9f2a6,4/22(月) 14:00
sippo,sippo,能登半島地震から3カ月　石川県獣医師会はシェルター設けペット預かりを継続,https://news.yahoo.co.jp/articles/50a29562ce1a60bc74d783b73fa3327e3d0d160f,4/22(月) 13:50
sippo,sippo,雨の夜、路上に横たわる大けがした猫　救ったのは通りかかった男子高校生,https://news.yahoo.co.jp/articles/d7d615c9e397cf6263a907a74bec078af2a934e8,4/22(月) 13:40
sippo,sippo,一触即発状態は“よい兆候”だった？　2匹目の猫「ハナ」のトライアルは継続へ,https://news.yahoo.co.jp/articles/d1320b6c956e9a2c3b3fa2bad42dd75b12c244a0,4/22(月) 13:30
sippo,sippo,ただそこにいるだけで大きな力に　病気と闘う子どもたちを支え笑顔に変える犬たち,https://news.yahoo.co.jp/articles/017823f711ca845fbf16b5aead70b03c68028d70,4/22(月) 13:20
sippo,sippo,愛猫の安楽死は正しい選択だった　でも3年経った今も後悔していることがある,https://news.yahoo.co.jp/articles/565430af61eb0e74c242058157ceb3b8c36ce99c,4/22(月) 13:00
sippo,sippo,人より軽くて動きが機敏な救助犬が必要　能登に向けて災害救助犬のココが出動,https://news.yahoo.co.jp/articles/478edab9805f821c3272d4ece51d150716f928dc,4/22(月) 12:10
