media_en,title_articles,link_articles,date_original
fukui,敦賀気比は準優勝、センバツ選出濃厚に　石川県の星稜が延長制しV　秋の北信越地区高校野球大会2023,https://news.yahoo.co.jp/articles/f51a2371c2551b88084dc8510b67e1b68a7a707a,10/23(月) 15:34
fukui,高級車135台がずらり…ランボルギーニやフェラーリ、旧車、アメ車　福井県大野市で催し,https://news.yahoo.co.jp/articles/9f3b37177fa43927fbefb04049cb9238f4db08f4,10/23(月) 11:32
fukui,“ティラノサウルス”全貌現る…「恐竜王国」福井の新ランドマーク　新幹線開業合わせ設置へ,https://news.yahoo.co.jp/articles/659ec5f56cd96b914f083640b82769c7c657d0c3,10/23(月) 7:55
fukui,福井3位の敦賀気比、石川1位の星稜が10月23日の決勝進出　秋の高校野球北信越大会2023,https://news.yahoo.co.jp/articles/b6d133c768c9bfb9e0a8180fd311d7e053480dcb,10/22(日) 15:48
fukui,福井県の防災訓練に海自ホーバークラフト型揚陸艇「LCAC」　高浜原発事故想定、住民を海上搬送,https://news.yahoo.co.jp/articles/5dc191b155144f4f846b92ecdbd11e3c083b2b93,10/22(日) 11:00
fukui,【クマ対策】注意すべき「クマと人の行動時間が重なる」時間帯　出没急増で福井県内の専門家指摘,https://news.yahoo.co.jp/articles/ab388ed8eedc7a8ba09adafdf8b4e109010fec0b,10/22(日) 7:26
fukui,仏国グルメガイド「ラ・リスト」特別賞に福井県、美食を楽しめる旅先で注目　世界のトップレストラン紹介,https://news.yahoo.co.jp/articles/0fed23460c04e2492b16d37fba92cc8dd73337e6,10/21(土) 19:00
fukui,福井地震の遺産、路面電車「モハ62」解体直前に“救世主”　関東の鉄道ファンが引き取り決断,https://news.yahoo.co.jp/articles/69c9f634e692cd1bbde3d466841d74f55bfac5d0,10/21(土) 11:14
fukui,星空と恐竜デザイン…JR越美北線「ディノスター号」運行始まる　福井県大野市,https://news.yahoo.co.jp/articles/0c1650ad15574bbf818ff65c3fdb03d8672fd135,10/21(土) 7:45
fukui,映画「おしょりん」主演の北野きいさん「雪国らしく、芯が強い包容力のある女性を意識した」　撮影の舞台裏、ロケ地福井への思い語る,https://news.yahoo.co.jp/articles/0a8f4b5f98e68c094037dcb0ddb216ff1a0817b0,10/20(金) 21:20
fukui,整備されたばかりなのに…恐竜モニュメント足の指折られる　防犯カメラに犯行の様子、北陸新幹線福井駅隣接の観光交流センター,https://news.yahoo.co.jp/articles/cd14b82cfef1dd27bdd55ea4a533352144b655ed,10/20(金) 10:52
fukui,63年前、福武線「200形」に試乗した人を探しています　福井鉄道が“同窓会”を企画,https://news.yahoo.co.jp/articles/a7fca6dbd4354eba2cc7d121178f5157aec1063f,10/20(金) 7:23
fukui,福井県の高校生に人気のグルメがハピテラスに集結　10月29日にフェス開催、企画した17歳がCFで資金募集,https://news.yahoo.co.jp/articles/cdf7ef67789d4f32514016239d60fa213503e926,10/19(木) 17:34
fukui,信号待ちの車に大阪ナンバーのオートバイが追突、男性死亡　福井県の国道8号,https://news.yahoo.co.jp/articles/223fc0ec68650ccee5926af857e1fd9ac464f422,10/19(木) 12:20
fukui,芭蕉ゆかり茶屋50年の歴史に幕、俳句愛好家も集う　閉店惜しむ人が次々、福井県敦賀市,https://news.yahoo.co.jp/articles/04de69149c8fc71f9cd8b9806fcf82b15fc6fe09,10/19(木) 7:39
fukui,福井市と金沢市…両方に住んでみて感じた「駅前」の違い　一つは「立ち止まりやすさ」【コラム】,https://news.yahoo.co.jp/articles/d5b28048458be1397687291468a7a813dbc3c63c,10/18(水) 19:48
fukui,農作業中にクマに襲われ福井県内の男性けが　10月18日朝、2023年県内初の人身被害,https://news.yahoo.co.jp/articles/d76af662b31c4029a78ad4235e72c6d678b943fc,10/18(水) 9:58
fukui,国内最高級の丹波に匹敵…「若狭マツタケ」収穫始まる　福井県おおい町,https://news.yahoo.co.jp/articles/4fc877b231e29541ba3ff8a6cf1580d201f5acb8,10/18(水) 7:24
fukui,小型犬に多い「逆くしゃみ」、顔を前に突き出しズーズー…獣医師に聞く症状、考えられる病気は,https://news.yahoo.co.jp/articles/a1e7598b2202583f04212692764d934f9ece7f0e,10/18(水) 7:22
fukui,福井産には違いないが…ふるさと納税の返礼品で別産地の甘エビ誤発送　福井県坂井市、希望者には寄付金返金,https://news.yahoo.co.jp/articles/f446c5264ede699de38542b7bbede29eefcfbd31,10/17(火) 18:21
fukui,ふくい桜マラソン2024ゲスト発表　大南博美さんや人気ユーチューバー、アイドル…ランニング界のインフルエンサーも出走決定,https://news.yahoo.co.jp/articles/95bb08e20aefb6dc907c010dedf15b70b5ef88f8,10/17(火) 7:38
fukui,福井県大野市の夫婦が子どもたちにプログラミング指導「主体的な学びを身に付けて」　ボランティアでクラブ運営、クラファンで寄付募る,https://news.yahoo.co.jp/articles/a355803d07b833dcf9c1984269d3e519fc6eefdd,10/16(月) 19:45
fukui,風花随筆文学賞の募集要項発表、国内有数の応募作品3000編…特別審査委員長は作家の出久根達郎さん,https://news.yahoo.co.jp/articles/8fc77439fe429945aee53bc3dce6502ef920ccd1,10/16(月) 11:42
fukui,福井ブローウィンズ、トライフープ岡山に大勝し通算3勝1敗　トレイ・ボイドが20得点の活躍　バスケ男子Bリーグ3部第2節,https://news.yahoo.co.jp/articles/651e2fbf50f16bfa059a4aefa8d496abc1b1f559,10/16(月) 7:23
fukui,延長10回、敦賀気比が帝京長岡との打撃戦制し4強　北信越地区高校野球,https://news.yahoo.co.jp/articles/9e90dc145032efeddacf1eeb0b62067b1ca01145,10/15(日) 16:55
fukui,福井県のデジタル地域通貨「はぴコイン」11月発行スタート　ポイントで買い物、一部給付金受け取りも,https://news.yahoo.co.jp/articles/c661356186488a66fe98a0cdf357df9162e7235e,10/15(日) 11:30
fukui,秋の北信越高校野球大会、雨で試合開始時間繰り下げ　10月15日準々決勝,https://news.yahoo.co.jp/articles/85d1a29cf495a8c47e0cda5234793336b26a4f48,10/15(日) 7:33
fukui,楽譜を「初見」で演奏、どうすればできる？【榎政則の音楽のドアをノックしよう♪】,https://news.yahoo.co.jp/articles/b6399baec6c5e1fe9b6610edb2193bcbc977c8d7,10/14(土) 19:02
fukui,福井市明新公民館の交流ルーム、もっと子どもに使いやすく　「垣根のない世代交流」へ…CFで本の充実など目指す,https://news.yahoo.co.jp/articles/085a44a8e9b3b608ed66dfc2f812b9881fe4378d,10/14(土) 10:01
fukui,ビッグモーター福井店の車検場指定取り消し、国交省が処分案　速度計未検査、書類に虚偽も,https://news.yahoo.co.jp/articles/151a055b509c07fdb478c5929a35a8db96c18d31,10/14(土) 7:18
fukui,市役所業務にChatGPT試験導入、メリットあり？　福井県越前市が検証結果まとめ,https://news.yahoo.co.jp/articles/c9bf0852586a5437dd4766160b68b86939034e22,10/13(金) 17:48
fukui,次のオープンは10月15日…月に1回だけ開く福井県内のキャンプ用品店が好評,https://news.yahoo.co.jp/articles/006f3084f0c1d393f823be5aac030a8b03aad9fb,10/13(金) 11:31
fukui,藤井聡太八冠誕生、記録係が感じたトップ棋士2人のオーラの違い　福井県出身の19歳,https://news.yahoo.co.jp/articles/ccb639ee67696f65a75545abc1dacabac7afca50,10/13(金) 7:27
fukui,意識あるまま開腹…獣医の証言が如実に示した犬たちの激しい痛み 松本市ペット業者裁判、第6回公判【杉本彩のEva通信】,https://news.yahoo.co.jp/articles/64c67fadfe1c17689788a728f39d9c473170d5fb,10/12(木) 18:30
fukui,元受刑者を積極的に雇用、北陸初の福井支部が10社で発足　日本財団の「職親プロジェクト」,https://news.yahoo.co.jp/articles/d98c1aa4c7f2081eb805661c6e601973ce4e8502,10/12(木) 11:59
fukui,「越前国府」の位置特定へ手がかり　福井県越前市、発掘調査で東西方向の溝を確認　施設区画跡か、役人使用の陶器も,https://news.yahoo.co.jp/articles/c26dc50227c441dd91a70aeaf735677f5782daae,10/12(木) 8:20
fukui,石川県の木場潟公園にクマ出没、職員襲われけが　小松市「不要な外出控えて」,https://news.yahoo.co.jp/articles/588cbe453b8951d7a5206228f38864af2c69ed89,10/11(水) 14:58
fukui,ふくい桜マラソン締め切りまであと1カ月…福井県初のフルマラソンは定員の8割超に、2024年3月31日開催,https://news.yahoo.co.jp/articles/9423f755a9f1e4eb472778e77198cc11f1ed04e4,10/11(水) 12:06
fukui,使用済み核燃料巡り国と関電が再説明…知事が週内にも容認へ　県外搬出問題「一歩前進」と一定評価,https://news.yahoo.co.jp/articles/d2cadc2b7ec84e6db43b27b4fad4cd62514e781c,10/11(水) 7:36
fukui,シンセサイザー奏者の喜多郎さんが越前大仏で11月12日公演　福井県勝山市、クラファンで特別席チケット,https://news.yahoo.co.jp/articles/577d39c6334a9b7045b35b18909e7e88cf96c8b4,10/10(火) 16:15
fukui,駆除シカ肉をドッグフードに、福井県産の野菜や玄米入りで栄養満点　若狭町の「ジビエ工房」,https://news.yahoo.co.jp/articles/b7530da6e9e974b1620b988e85bfa18a42a84d5a,10/10(火) 11:27
fukui,使用済み核燃料の福井県外搬出問題がヤマ場　10月10日、国と関西電力が県庁で副知事と面談,https://news.yahoo.co.jp/articles/3bb73262f26791e2b6a926cdce6e5abdcce4e6fa,10/10(火) 7:31
fukui,「三匹の子豚」アレンジ絵本で空き家問題を考える　福井県大野市のまちづくり団体が制作,https://news.yahoo.co.jp/articles/c3421e80972eb5a0912fb4902868bdf9533755bf,10/9(月) 16:21
fukui,オール福井ロケの映画「おしょりん」、原作者が作品に込めた思い語る　福井でトークショー,https://news.yahoo.co.jp/articles/29d5ae48c980ab25fc2ad2427782c663e97499fc,10/9(月) 12:39
fukui,旅の途中、ひらり…海渡るチョウ「アサギマダラ」が飛来　福井県大野市の「矢ばなの里」,https://news.yahoo.co.jp/articles/e3c53c4d0d046ed7b59a254d401e2c30d7bc2f6c,10/9(月) 7:57
fukui,バレー男子パリ五輪切符獲得、清水邦広選手が喜び爆発「感動をありがとう!!!」　SNSに祝福投稿,https://news.yahoo.co.jp/articles/6e7846e6a52d4c271ae4ced02ae3eb6b6fac50ff,10/8(日) 15:03
fukui,敦賀駅と城崎温泉駅を結ぶ直通列車「キハ189系」が初運行　JR西日本、ハイグレード新型観光列車の運行予定区間でプレ企画,https://news.yahoo.co.jp/articles/8cff1e31571e10a5ed1a82245fd75ad7d5886104,10/8(日) 10:34
fukui,B3福井ブローウィンズが開幕戦で勝利　岐阜スゥープスに逆転、3000人沸く,https://news.yahoo.co.jp/articles/e2ee03a078e3637dd6778cc1cf5f3138c61c1b80,10/8(日) 7:29
fukui,屋外スポーツ施設の芝生から飛び出た鉄パイプ、男児が膝ぶつけ15針縫うけが　両親らが福井県大野市に損害賠償請求,https://news.yahoo.co.jp/articles/af6911415db2e719e88cc98f8aa54dc1b28909cb,10/7(土) 13:11
fukui,ビッグモーター以外の販売店の前でも「街路樹ない」の指摘　そもそも管理者の伐採ルールは,https://news.yahoo.co.jp/articles/6748db96d1f366e1f708b8e9c32353a6c818e720,10/7(土) 10:25
fukui,福井県のブランド養殖魚のサバ、飼育の9割死ぬ　猛暑影響、「高温対策は取っていたが予想外」,https://news.yahoo.co.jp/articles/7e38e61f492d9eb13a4fd2656ab3113629b5c432,10/7(土) 7:38
fukui,北陸最大級の古着フェス「スリフト」10月7〜9日開催　福井市に過去最多60店が集結,https://news.yahoo.co.jp/articles/4546b6911913908cb52876477eb402fcf61f2e48,10/6(金) 16:59
fukui,「オレオレ詐欺」福井県内で増加、「息子」から「孫」へ手口変化　9月末までに6件1708万円被害,https://news.yahoo.co.jp/articles/6f2ff1d2f170dd08ac26c82e538c63e57c99d71b,10/6(金) 10:51
fukui,潤いのある酒に…老舗酒蔵で新酒の仕込み作業始まる　福井県勝山市,https://news.yahoo.co.jp/articles/8666cbd84f384f3230b2677c9449de0daa9b8b0d,10/6(金) 7:18
fukui,10月りゅう座流星群2023年、5日から出現か　流れ星がピークの日、オススメの観測時間は,https://news.yahoo.co.jp/articles/b7d35ec5273562d80dd6c492bed7490d61548784,10/5(木) 21:31
fukui,福井県が決めたそばのPRフレーズ「越前蕎麦」周知進まず　「福井そば」などと混在…統一ブランディングに課題,https://news.yahoo.co.jp/articles/cc483bd79b601250529cea77a5c8a55d5fe5b30e,10/5(木) 13:00
fukui,ヒガンバナ深紅の帯、秋の気配伝える　福井県の一乗谷朝倉氏遺跡,https://news.yahoo.co.jp/articles/9f359e1ea3a5b61ae3bc3dec3335c9d86646a13c,10/5(木) 8:01
fukui,歯ごたえプリプリ「若狭ふぐ」シーズン突入…福井県小浜市のホテル、民宿で一斉提供スタート,https://news.yahoo.co.jp/articles/9fe54b7e9570d76a9b908fddc0a8d622e45e573c,10/4(水) 19:19
fukui,福井市の「足羽川ふれあいマラソン」11月19日に号砲　実行委がクラファンで開催費用の支援募る,https://news.yahoo.co.jp/articles/4f5ef397f844c65e802e94fce7654a73a40a547a,10/4(水) 13:48
fukui,通夜や告別式を行わず費用軽減「直葬」ニーズ高まる　火葬のみ、15万円のプランも…変わる従来の価値観,https://news.yahoo.co.jp/articles/6db481ec67455379866529dc2e530e3eb798c87a,10/4(水) 8:37
fukui,福井県内で週末に車上狙い3件発生　アパート駐車場などで被害,https://news.yahoo.co.jp/articles/41e9e9447a8b9a990139543ef5f2f42801e68769,10/3(火) 17:37
fukui,福井県内の9月平均気温、全観測地点で過去最高　夏の猛暑に続く高温、記録的残暑なぜ？,https://news.yahoo.co.jp/articles/634f5de3b142bea6c02767eb2b5814b9d538e1c3,10/3(火) 11:41
fukui,親子心中か…民家で倒れた女性2人確認　福井県坂井市、1人の死亡確認,https://news.yahoo.co.jp/articles/1e0ccf6f033ffe10974a39dc20b4c4f6120072a7,10/3(火) 0:41
fukui,両親殺害疑い、同居の40歳長男を逮捕　福井県警坂井署など、容疑否認,https://news.yahoo.co.jp/articles/3d0d15d760b7d1482faca7fe0e1bb904d59a1f58,10/2(月) 19:45
fukui,福井県の一般教諭採用、倍率2.56倍過去最低　受験者も最少648人,https://news.yahoo.co.jp/articles/e57dde1483c76b30290836911111452ad1b0ecec,10/2(月) 12:03
fukui,福井県内4駅で北陸新幹線「W7系」歓迎セレモニー　抽選で選ばれた3000人が車両出迎え,https://news.yahoo.co.jp/articles/abfeda8f499df4412b2fa1abda5b4cd44ccdc17e,10/2(月) 8:03
fukui,運転士不足、福井−東京間の高速バス休止へ　福井鉄道と京福バスが30年以上共同運行　路線バス維持を優先,https://news.yahoo.co.jp/articles/931fea169dbf6151c50fce01b49d5f085694044e,10/1(日) 18:30
fukui,福井県警と登山地図アプリの「ヤマップ」が連携協定　遭難者の位置情報を共有、迅速に救助,https://news.yahoo.co.jp/articles/a790030b10b2a7b75e9c4e0a6071d30a785ee103,10/1(日) 12:18
fukui,秋の高校野球福井県大会、北陸が福井商業下し35年ぶり優勝　10月14日から選抜つながる北信越大会,https://news.yahoo.co.jp/articles/1d83fc866d8ed58febb9d632a50eb46f6f218f43,10/1(日) 10:37
fukui,市民からの迷惑行為や悪質クレーム…カスハラ対策で職員の名札に変化　福井県福井市が2007年以来の変更,https://news.yahoo.co.jp/articles/409e48c7c0b99cb2a845ed57a10dea48225b0eb1,9/30(土) 19:00
fukui,京都最高峰の料亭「菊乃井」で修業…独立先は福井の山間の集落　「だめならバイト」31歳料理人の心意気,https://news.yahoo.co.jp/articles/f1b434b371c41facd71e843bbb1edb0db68ce06b,9/30(土) 11:32
fukui,国道417号の交通不能区間が解消　福井と岐阜を結ぶ冠山峠道路11月19日開通,https://news.yahoo.co.jp/articles/d9f2c7344716daaa0b27584e8adabc58dd53041c,9/30(土) 7:16
fukui,味も見た目もそっくり…福井銘菓のせんべい「五月ケ瀬」がパンになった！ 創業50周年でオーカワパンと夢のコラボ,https://news.yahoo.co.jp/articles/ad07a6cc8f26cdfdd19d99f767f6317dada3417c,9/29(金) 18:30
fukui,「楽譜を読めますか？」自信を持って「読める」と答えられるようになるまでの経験談【榎政則の音楽のドアをノックしよう♪】,https://news.yahoo.co.jp/articles/7920c03cdd29eff5a2fad196c54993e07ce03d37,9/29(金) 11:48
fukui,レジオネラ属菌検出の「セントピアあわら」利用者20人が体調不良　福井や関西から、発熱やせき症状訴え,https://news.yahoo.co.jp/articles/6b99ed33b68efb18686ee74112aa187c727958d9,9/29(金) 7:59
fukui,福井市清水地区の「清水まつり」が18年ぶり復活　地元有志が10月29日に開催、伝統を若い世代へ,https://news.yahoo.co.jp/articles/7e76adc76c8025e73a274e767ac25548ed6aa6c7,9/28(木) 13:05
fukui,5年半にわたり不正経理か…福井県警OBが役員務める団体で810万円の使途不明金　元事務員と元役員2人を提訴,https://news.yahoo.co.jp/articles/bd9ec62267cf03eda011672a5e8d4384bb5aa1f8,9/28(木) 11:20
fukui,プラレールに日本初の新幹線と道路の併用橋「新九頭竜橋」登場　福井県とタカラトミーがコラボ、W7系とセット,https://news.yahoo.co.jp/articles/88bda588e0c5df6b8e6bab1793743bad8b8a7545,9/28(木) 7:32
fukui,日本女子オープンゴルフ9月28日からの開幕控え歴代優勝者がレッスン会　福井県,https://news.yahoo.co.jp/articles/9fa0e0c79b82c894bd17252d538e93d8430debf0,9/27(水) 19:05
fukui,北陸自動車道下り線の丸岡IC―金津IC間が通行止め、交通事故のため　9月27日、福井県警発表,https://news.yahoo.co.jp/articles/4a7709475395ed5d0a48f93e3716dcc2c73e2382,9/27(水) 9:40
fukui,民家のブロック塀崩れ男児骨折　福井県鯖江市、小学校への登校途中,https://news.yahoo.co.jp/articles/a3e33d97845f3092bf71dfa4889b79df33ab4234,9/27(水) 7:28
fukui,台湾人気カルチャー誌の2人、取材先の福井で愛育て結婚　「微住」した寺で念願の和装式,https://news.yahoo.co.jp/articles/0a86ad4f8140257d6e2a57864a86a710b52b146c,9/26(火) 19:02
fukui,北陸新幹線「W7系」福井県内に姿現す　走行試験スタート、沿線には鉄道ファンら集う,https://news.yahoo.co.jp/articles/b9089bc6e0ea9dabaa4f86a79d3685706aa39afd,9/26(火) 9:49
fukui,北陸新幹線福井駅東側の観光交流センター、10月1日一部オープン　カフェや貸しスペース用意,https://news.yahoo.co.jp/articles/f1d840c37b7393502a870b68e625ce1ea2945e97,9/26(火) 7:22
fukui,福井県の36歳女性が「イカ丼キッチンカー」に挑戦　10月正式オープン、若狭湾のイカのおいしさ発信,https://news.yahoo.co.jp/articles/036907a7964a87cad7954f548ed501dd7564df05,9/25(月) 18:42
fukui,半年前のお祭り騒ぎ、北陸新幹線福井県開業へホコ天パレード　JR芦原温泉駅、AKB48メンバーも登場,https://news.yahoo.co.jp/articles/1ce4e45f8c79f32ec3f031bdf25ce3526b3432d6,9/25(月) 7:36
fukui,犬が大好きな「僕」から届いた手紙…つづられた劣悪繁殖場への怒りと決意【杉本彩のEva通信】,https://news.yahoo.co.jp/articles/ddba0a6897dd266787641833b36803ec04ce1f86,9/24(日) 18:30
fukui,福井県のご当地グルメが中国で密かな人気　出身男性の古里の味を現地料理店が再現、予想外の反響,https://news.yahoo.co.jp/articles/9646529b5a6a8cfd76bd5b76726e95b259d066e8,9/24(日) 11:04
fukui,SNSで人気広がる米袋のキャラクターも登場　福井県ブランド米「いちほまれ」新米の販売始まる,https://news.yahoo.co.jp/articles/66e6c188542d96dad456e214070422a641c0744a,9/24(日) 7:16
fukui,北陸新幹線金沢ー敦賀間、イーストアイが福井県内初入線　走行試験スタート、芦原温泉駅では歓迎式典,https://news.yahoo.co.jp/articles/ae549801c7c4169e16e720e344944b6bc27afd59,9/23(土) 13:30
fukui,ジムで男性が心肺停止…現場に居合わせたインストラクター、そして校長先生と医師　福井、異なる職業3人が見せた「あうん」,https://news.yahoo.co.jp/articles/7734932e00f8315c8cab5b3eecf377efd8b63668,9/23(土) 11:20
fukui,北陸新幹線、福井−東京間は1万5810円　米原経由より890円高、関西と中京方面への特急料金は,https://news.yahoo.co.jp/articles/5d1c5773448a6818b266bc928859372368ab8950,9/23(土) 7:45
fukui,都道府県別デジタル度、福井が東京抜いて全国トップに　SNS利用伸び、画像ソフト使える人多く　野村総研2022年調査,https://news.yahoo.co.jp/articles/6a5249ae33568922ca181b967c31d5cbd547c625,9/22(金) 18:59
fukui,大島優子さん、出産報告から初の公の場　ママ役で福井県ブランド米「いちほまれ」CMに…9月30日から関東や中京で放送,https://news.yahoo.co.jp/articles/93699b2bd598c74bfb44026f504196dfc889f527,9/22(金) 11:57
fukui,101年ぶり記録更新、福井市85日目の真夏日　10月前半も30度以上の可能性,https://news.yahoo.co.jp/articles/e5e3622fb4c418677cbf2829d47c1b944b6b0995,9/22(金) 7:58
fukui,福井市の「日野川大花火」10月8日に3000発打ち上げ　クラファン寄付でメッセージ花火,https://news.yahoo.co.jp/articles/1c8cbbb11f5674461cac66921d9123752d4776fe,9/21(木) 18:04
fukui,サバの棒ずし食べた2人が食中毒、胃からアニサキス　福井の飲食店,https://news.yahoo.co.jp/articles/e92498f77a82970172de2d1b664fab1ffc36ff27,9/21(木) 10:56
fukui,神宮球場が「福井県」一色に…ヤクルト―中日戦で県が観光PR　中村悠平選手やAKB48メンバーも登場,https://news.yahoo.co.jp/articles/0071e534e015067b1a764f84534448336aae4a3e,9/21(木) 7:31
fukui,北陸地方は9月21日昼過ぎから雷雨に注意　1時間に30ミリの激しい雨、警報級の恐れも　新潟地方気象台,https://news.yahoo.co.jp/articles/3a83baab19ebb60b00b769a801e84ef18bbf1c16,9/20(水) 18:11
fukui,対応する農薬なし…トマトやピーマンに感染する「トマト立枯病」、福井県で初確認,https://news.yahoo.co.jp/articles/a11c6faf5cbb2f01269286071d5afb4202ffc85b,9/20(水) 12:22
fukui,5年かけ10万羽…亡き娘が好きだった折り鶴を作り続けた98歳女性　福井県の高齢者施設に贈る,https://news.yahoo.co.jp/articles/792b72fcd6383eecdb79e414a4dbf56f78c7a4c9,9/20(水) 7:31
fukui,乳がんの手術跡を入浴着で隠し温泉、施設スタッフから「前例ない」と入浴断られ…経験者が伝えたい複雑な思い,https://news.yahoo.co.jp/articles/b4a7d7e07b8a2b90734cec6d82366b8291c03a82,9/19(火) 17:50
fukui,ゴルフの日本女子OP選手権、福井県で9月28日開幕　山下美夢有や申ジエら出場予定選手を発表,https://news.yahoo.co.jp/articles/577994eaeaeffdc8ddc863d15e1bf1efea873b4e,9/19(火) 11:09
fukui,「すごい公務員アワード」福井県内から全国最多4人受賞、中学校教諭や市町職員,https://news.yahoo.co.jp/articles/ee0e65a3493998af26838c6f19dc63566717ef2e,9/19(火) 7:23
fukui,佐藤希望が女子史上最多の8度目優勝　全日本フェンシング選手権大会2023、個人戦,https://news.yahoo.co.jp/articles/4b435d7efbe2c9f12b31a47788affe02caf15e89,9/18(月) 15:01
fukui,乳がん、男性も罹患可能性　2019年は全国で748人、医師に聞く症状やチェック方法,https://news.yahoo.co.jp/articles/abe6cbb9bff5a48278e0b30365f2bf333b00057f,9/18(月) 11:20
fukui,北陸新幹線の福井県内区間、列車からの景色ひと足早く　工事用車両から撮影した動画公開,https://news.yahoo.co.jp/articles/8c4d8da0d416a34b7253e4ff9b87db6af3149560,9/18(月) 7:49
fukui,今夏甲子園出場の北陸が逆転で8強入り　秋の高校野球福井県大会2回戦,https://news.yahoo.co.jp/articles/bb8719b69b53614c6ab26b160c7fff58942c0084,9/17(日) 18:12
fukui,スーパーの多目的トイレで女児の口周辺なめる　26歳男を逮捕、不同意わいせつ疑いで福井県警,https://news.yahoo.co.jp/articles/a3fa45849d85b271e3273b846f9efb7c61b153a5,9/17(日) 11:37
fukui,熱気呼ぶ秋祭りの音色…若狭地方最大「放生祭」が開幕、鉦や太鼓鳴り響き山車巡る　福井県小浜市,https://news.yahoo.co.jp/articles/7211ff579c60ca8e9ebcf1a6cade0a7c4f6cd1c3,9/17(日) 7:21
fukui,敦賀気比が福井工大福井を下し8強入り　秋の高校野球福井県大会2回戦始まる,https://news.yahoo.co.jp/articles/c5256504dd86798f959486e27b74049efb708f40,9/16(土) 18:28
fukui,また孫かたる電話…福井県内80代女性が400万円だまし取られる　特殊詐欺事件とみて捜査,https://news.yahoo.co.jp/articles/cf29e73101ed730813534ab15e66c1c94edbc72f,9/16(土) 13:38
fukui,北陸新幹線の福井県内開業まであと半年　9月23日から走行試験スタート、各駅で歓迎式も,https://news.yahoo.co.jp/articles/51caa0fc45d82f3fa314c8c39163876e9e85220e,9/16(土) 7:24
fukui,運転47年の高浜原発2号機が再稼働　関西電力、福井県内の原発7基全て稼働可能に,https://news.yahoo.co.jp/articles/f96acaa2e4a6477bbe9c48c278fa1a6d4889d9d5,9/15(金) 15:05
