media_en,title_articles,link_articles,date_original
fukui,「居酒屋の客がいつも」「出勤時に酒臭い」…飲酒運転の情報提供を　福井県警がメールでの通報制度スタート,https://news.yahoo.co.jp/articles/9c25c48e274c231623397a900ea4296530d68d78,9/15(金) 11:05
fukui,山の実が不作…クマ出没、集落などで頻発する可能性高く　福井県が注意呼び掛け,https://news.yahoo.co.jp/articles/538937a8eddd75b176cc3f2cad876255a2b87417,9/15(金) 7:36
fukui,福井市の文殊山キャンプ場を「複合型アウトドアパーク」に　地元業者がクラファン挑戦、9月21日まで,https://news.yahoo.co.jp/articles/203f099e3302fdd31ed69cc1e7afce6b51d5aaa6,9/14(木) 19:22
fukui,インフルエンザ、福井県内で流行期入り　9月の流行開始は2017年以来6年ぶり,https://news.yahoo.co.jp/articles/d9a394e1a1105520eb4f455c905a217e3ecfea37,9/14(木) 11:25
fukui,足羽山に新種ヨコエビ、採石場跡地の坑道内で発見　福井市自然史博物館が発表,https://news.yahoo.co.jp/articles/db6280cb5ad57f7955f165820ab94e539795f417,9/14(木) 7:27
fukui,今庄365スキー場、コロナ禍や大雨被害を経て4季ぶり営業再開へ　福井県南越前町,https://news.yahoo.co.jp/articles/2f5cd4b3b2f4bb826808f74153d077ba8d2b3aba,9/13(水) 19:10
fukui,登校時間前に大雨で避難指示が出たら…小中学校「登校見合わせ」で統一　福井市が基準を策定,https://news.yahoo.co.jp/articles/b6565844c9fbc8dfbdda2f32bbb376b22a0236fb,9/13(水) 11:49
fukui,小さい秋みーつけた、福井市でナツメ収穫ピーク　地元児童「乾燥したリンゴみたい」,https://news.yahoo.co.jp/articles/ebdceb694f1213c77eecdf9d3ec99b187e9d7f71,9/13(水) 7:50
fukui,登山客8人スズメバチに刺される、福井県福井市の一乗城山山頂付近　1人ヘリで搬送も命に別条なし,https://news.yahoo.co.jp/articles/75985d8f46c76434e5e1c7a2ff201f1bf309c676,9/12(火) 13:31
fukui,三国湊に町家ホテルが姿現す、袖壁生かし玄関に笏谷石　福井県坂井市のオーベルジュ化プロジェクト,https://news.yahoo.co.jp/articles/0012d3d1dea2a18c17d5cb065091ac780ff86b4c,9/12(火) 10:58
fukui,川が育む秋の恵み…モクズガニ、濃厚なみそや内子が特長　福井県の九頭竜川でかご漁,https://news.yahoo.co.jp/articles/7593c999b099d6c13ea1cd2f2df27856af3ea3fd,9/12(火) 7:26
fukui,温水洋一さん、アニメ声優の細谷佳正さん出演　観光XRバスの没入型コンテンツ映像、2024年から福井県で運行,https://news.yahoo.co.jp/articles/10d624bdd7fe741618513e05764b2d17b2769f54,9/11(月) 18:17
fukui,敦賀気比、北陸、福井商業など2回戦進出　秋の北信越高校野球福井県大会,https://news.yahoo.co.jp/articles/4cd18889d78cdf3e5221638f10af74751e172180,9/11(月) 8:40
fukui,自衛隊が福井市中心部をパレード、約2万人の観衆　徒歩部隊と車両行進、F15戦闘機が飛行,https://news.yahoo.co.jp/articles/f9b31a1c9005871d04fb59ef9059bad162eabae4,9/11(月) 7:50
fukui,海に飛び込み車椅子生活になった40歳、10年ぶり海水浴に「最高」　同級生が企画、福井県敦賀市でユニバーサルビーチプロジェクト,https://news.yahoo.co.jp/articles/25aebc761af41de703d2ec42427367993f2c765d,9/10(日) 19:10
fukui,保護猫守る活動広がれ…福井県福井市の「譲渡型カフェ」に新拠点　里親との出合い増やし縁結び,https://news.yahoo.co.jp/articles/5a77dd56f7f4e48deba3ac3de4fc25acbff69607,9/10(日) 12:37
fukui,体操全日本シニア、山本七海が女子個人総合初V　福井県立鯖江高校勢が躍動、女子団体も大差で制覇,https://news.yahoo.co.jp/articles/e23ce69f15c86551cdd095d8b553a250113c41e9,9/10(日) 7:17
fukui,「手術した方がいいね」宣告は突然に…動揺走る「まじっすかぁ」　福井新聞記者の心臓手術体験記,https://news.yahoo.co.jp/articles/f762e09e2b80330c2c0c29bb54c4038fed1d2bb6,9/9(土) 17:53
fukui,しらさぎやサンダーバード、敦賀で乗り換えスムーズに　福井県知事がJR西日本に要望の意向,https://news.yahoo.co.jp/articles/2fe9b7a4fec50f63c912fdadb539bb7798d21fc6,9/9(土) 13:06
fukui,新施設名「CURU-F 福井駅」に決定　プリズム福井跡地に2024年3月16日オープン,https://news.yahoo.co.jp/articles/712295d58f125db0c26b6341fc7bc6b1ed8d7f36,9/9(土) 7:13
fukui,福井県で初の全国ろうあ者体育大会が開会　聴覚障害者1300人、11競技で活躍誓う,https://news.yahoo.co.jp/articles/b4fee61fb542bc6d0a6a6a038008400a2adffa72,9/8(金) 20:25
fukui,福井県で新種恐竜化石、学名はティラノミムス・フクイエンシス　県立恐竜博物館発表,https://news.yahoo.co.jp/articles/f230e0abc351d91bae75b2680f75bf2ee72ff654,9/8(金) 10:41
fukui,福井と岐阜結ぶ中部縦貫自動車道の工事進捗は　大野油坂道路の勝原―九頭竜IC間は10月開通へ,https://news.yahoo.co.jp/articles/f09479b4971398edfa5d38cc990ae9b97d053ad0,9/8(金) 7:59
fukui,わずか5秒で食べ終わる早食い猫…なぜ？ 獣医師に聞く原因とリスク、防止策,https://news.yahoo.co.jp/articles/8fe2716355d42ea094551cc0667d26d4c23c1e95,9/7(木) 17:02
fukui,吉本芸人と福井工大生がリレー競技を考案…中学体育祭で披露　バンビーノとミサイルマン来校、笑顔広がる,https://news.yahoo.co.jp/articles/e2313775a469f949f1cb13d64139a9df83ecbe38,9/7(木) 13:47
fukui,新日本プロレスが福井で9月26日に興行…棚橋弘至選手「大声援をお願いします」　真壁刀義選手らも出場予定,https://news.yahoo.co.jp/articles/a2c6d57ebd63a82afa79fd880aefd2a2a2abbd97,9/7(木) 8:26
fukui,冬の北陸旅行で特産品が当たる…新幹線延伸直前に福井×石川×富山キャンペーン　福井県は宿泊者にデジタル地域通貨,https://news.yahoo.co.jp/articles/f6387b663ca33d1e475f3d59030bfc7906400d4f,9/6(水) 18:20
fukui,福井県初のイオンスタイルが9月11日に着工へ　支社長「2、3店舗目も必要」とさらなる出店意欲,https://news.yahoo.co.jp/articles/2da7731bd92a7172eef23bea019de16d29b4d659,9/6(水) 10:51
fukui,山車巡行や民謡踊り…港町に秋の訪れ　4年ぶり、熱気で満ちた福井県の「敦賀まつり」,https://news.yahoo.co.jp/articles/6ead43bbd6875877d51ebe21752f4df789e24ed9,9/6(水) 7:39
fukui,北陸新幹線、大雨で長野ー富山は運転見合わせ　9月5日夕方JR西日本　新潟県糸魚川市では記録的短時間大雨,https://news.yahoo.co.jp/articles/772de84e902e3226190523d47c0e63a870d70990,9/5(火) 17:28
fukui,舞鶴若狭自動車道の4車線化、10月着工へ　舞鶴東〜大飯高浜IC間の一部区間,https://news.yahoo.co.jp/articles/cf069f61607591be2445ef06744e8fdb3dd671f1,9/5(火) 11:26
fukui,復活の戦国絵巻…絢爛豪華な山車6基、掛け声響かせ港町巡行　福井県で敦賀まつり,https://news.yahoo.co.jp/articles/6430b97f32b49af8a06a304bd23d44de8fdc58c0,9/5(火) 7:12
fukui,めちゃくちゃ難しいピアノ曲、どうやって練習すれば…マスターする方法を紹介【榎政則の音楽のドアをノックしよう♪】,https://news.yahoo.co.jp/articles/2fe00ec70738484c7712a32a4585ceace48a364e,9/4(月) 17:01
fukui,定期購入トラブル相談が急増、対策は　化粧品や健康食品多く…福井県消費生活センターまとめ,https://news.yahoo.co.jp/articles/c0e90fecc0fd114a3c26c7b72837aca30726841b,9/4(月) 12:23
fukui,赤ちゃん堂々…ねじり鉢巻き、化粧まわし姿で土俵入り　福井県美浜町で「八朔祭り」,https://news.yahoo.co.jp/articles/6754d199a432a5ce3f7513d276238fbc6cb39373,9/4(月) 7:35
fukui,福井鉄道の低床車両「フクラム」さくら色の運用再開　故障で長期離脱、1年8カ月ぶりに,https://news.yahoo.co.jp/articles/3bb1df853b2a948af9a636d46ed8070d0f885742,9/3(日) 18:00
fukui,高校生がNPO法人を設立し福井県敦賀市の民謡踊りを継承　クラファンで活動費募集,https://news.yahoo.co.jp/articles/04ec921b3a6902c02b5afce14e0a3037a661fbd2,9/3(日) 13:21
fukui,金色に染まる丸岡城　「世界小児がん啓発月間」に合わせライトアップ、福井県坂井市,https://news.yahoo.co.jp/articles/0ac7af7e28da0105ee3a203c178c84a2cd1db019,9/3(日) 11:57
fukui,港町に熱気…敦賀まつり4年ぶり開幕　「宵山巡行」おはやしにぎやかに,https://news.yahoo.co.jp/articles/597356208df5e9f3890db33369e648793701b2e0,9/3(日) 7:39
fukui,子孫繁栄を願う奇祭「男性のシンボル」持った天狗登場せず　福井県美浜町の八朔祭、人口減で神事のみに,https://news.yahoo.co.jp/articles/3191a7a6987886825a2f3a80f45b01e9628b2773,9/2(土) 10:45
fukui,今だけオレンジ色…フランソワルトンの赤ちゃん愛らしく　福井県の鯖江市西山動物園で誕生,https://news.yahoo.co.jp/articles/4a4e5e75f95eb180aba44324506f9b781e93949e,9/2(土) 7:48
fukui,関東大震災を予見も発表せず…大森房吉が貫いた信念　非難された日本人初ノーベル賞候補、福井出身の地震学権威,https://news.yahoo.co.jp/articles/8af84948592facda78e93a47ad16cde84f3ffd49,9/1(金) 17:32
fukui,戦国の町並み包む優しい光…手作りランプシェードでライトアップ　福井県の一乗谷朝倉氏遺跡,https://news.yahoo.co.jp/articles/771519cae52617c3aeda5d94de0bb12c32527490,9/1(金) 9:19
fukui,福井県が高校授業料を完全無償化　扶養2人以上世帯対象、所得制限なし　「日本一の多子世帯応援」と銘打ち子育て支援拡充,https://news.yahoo.co.jp/articles/2fb8c26d48c525d5cc4e84e78a9d5469e57ef10b,9/1(金) 7:51
fukui,バナナボートでお決まりの落水のはずが…笑えない事態に　福井県の海水浴場で事故【敦賀海保日誌】,https://news.yahoo.co.jp/articles/d485fba9139de62f06de648d87d97215ff645b59,8/31(木) 18:48
fukui,金沢―敦賀間の特急サンダーバード、しらさぎ廃止　JR西日本、北陸新幹線の福井県内開業伴い,https://news.yahoo.co.jp/articles/40d33e28097b0ee6fe4b663a275c308e1647c704,8/31(木) 11:01
fukui,新婚カップルに最大100万円補助へ　福井市、11月ごろから受け付け,https://news.yahoo.co.jp/articles/e72ef49f0c0e8e2b443bf8e42ccf6b0b38256d25,8/31(木) 7:49
fukui,北陸新幹線の福井県内延伸開業は3月16日とJR発表　東京―福井間が最短2時間51分で直通,https://news.yahoo.co.jp/articles/4d7c70e8b80428019b26bcb6005608b884de85e6,8/30(水) 21:42
fukui,福井県の原発施設にも中国ナンバーの迷惑電話、5日間で170件超　カタコト日本語で意味不明、処理水放出巡り抗議か,https://news.yahoo.co.jp/articles/105b5d02d26c9af1d0f93770ab536fd7447b3b98,8/30(水) 14:49
fukui,福井県内の病院で2013年に医療事故　患者の腹腔内に止血用ガーゼ取り残し10年近く…坂井市が250万円賠償,https://news.yahoo.co.jp/articles/b8861acecda38ee43f088df2e4a394cbb605c996,8/30(水) 7:56
fukui,上げ馬神事…報道も語り尽くしていない馬へのひどい扱い　問い直すべき神事の意味【杉本彩のEva通信】,https://news.yahoo.co.jp/articles/94c03c4ceb5bee65edc0976b906e62d8b31d756f,8/29(火) 19:39
fukui,国旗検定1級に福井県の3歳が合格　ひいおじいちゃんからのプレゼントがきっかけ,https://news.yahoo.co.jp/articles/6968e2c9157862a3f942e74ba960a936f6d5570d,8/29(火) 11:24
fukui,まるで銀河鉄道…夜空に一直線に連なる光、数分間の天体ショー　福井県の天文愛好家ら撮影,https://news.yahoo.co.jp/articles/ce3c6a3f0597906d0be72182e735006afde7db89,8/29(火) 8:12
fukui,夏休み明けも続く猛暑…学校は熱中症予防へ厳戒　始業式会場を教室に変更、体育大会延期も,https://news.yahoo.co.jp/articles/89c9ddd9aed96b5f8ca17736ee1f1d1463db9dc4,8/28(月) 18:30
fukui,丸刈りだった男の子が髪をお尻まで伸ばし続けた理由…そしてついに美容室へ,https://news.yahoo.co.jp/articles/bc3e3c16b62b1ac7e95048a6536d1acafb6247e5,8/28(月) 11:41
fukui,バスケB3参戦の福井ブローウィンズが2連勝　B1富山に69ー58、プレシーズン戦,https://news.yahoo.co.jp/articles/59137352a036f3a0aea1229cf16102d1d93c999e,8/28(月) 7:42
fukui,福井市でひき逃げ疑いベトナムの男逮捕、一部否認　7月に交差点でタクシーに衝突,https://news.yahoo.co.jp/articles/e11bb11115afa02d87f9ef0c6ed17d991e20953d,8/27(日) 15:04
fukui,B3参戦の福井ブローウィンズ“初陣”白星で飾る　プレシーズン戦、B2福岡に終盤逆転75−69,https://news.yahoo.co.jp/articles/ff37726845702445722ed7dfa3bb4053e4150a7a,8/27(日) 12:12
fukui,川面に光の帯…夏の風物詩「大燈籠ながし」　福井県永平寺町、先祖の供養など願う,https://news.yahoo.co.jp/articles/e8a6aea0ca122d17d9393148bbbd89283a29a076,8/27(日) 7:49
fukui,めがねのまち鯖江発、子どもの近視を防ぐ紙芝居　NPOが制作、福井県内の園に配布へ,https://news.yahoo.co.jp/articles/3e85e7f8d5bedb301f910ac59e1b40f88a3e86a9,8/26(土) 15:32
fukui,寺に侵入し窃盗疑い20代の男3人逮捕　広域窃盗グループか…岡山や鳥取で犯行、福井でも同様の事件,https://news.yahoo.co.jp/articles/2f8140cecca691818d32940df505966e6945ef49,8/26(土) 12:24
fukui,爆破や殺害予告、福井県にも380カ所以上　学校や企業、飲食店、個人宅にも…警視庁が「恒心教」共鳴の男2人逮捕,https://news.yahoo.co.jp/articles/76336c5b1b60f58014216881c7c7ce3b9b49d04c,8/26(土) 8:25
fukui,原発立地の福井県民、処理水の海洋放出どう見る？ 福島の風評被害、政府の説明不十分…一方で支持する意見も多数,https://news.yahoo.co.jp/articles/2ba249f262417523df379c380913422c39abec18,8/25(金) 19:38
fukui,北陸新幹線の福井県敦賀以西、2024年度の着工見送り　環境アセス遅れ　高木毅・自民党国対委員長「遅くとも25年度中に」,https://news.yahoo.co.jp/articles/f65f1a4d3e038d9e131003218ae02a9b8f76c5dc,8/25(金) 11:06
fukui,赤紫色の実ふっくら…福井市特産「本郷イチジク」が収穫ピーク　猛暑影響も甘み上々,https://news.yahoo.co.jp/articles/8c34845773cbdc1437c42cedc987865b4a8f0bdc,8/25(金) 7:26
fukui,愛犬がタマネギ、チョコレートで中毒に…ペットに起こりうる身近な危険　症状と中毒量まとめ,https://news.yahoo.co.jp/articles/3931b66a5aa4594da0797fc507d36e490deed5ab,8/24(木) 19:03
fukui,幕末の帆船「大野丸」パネルで歴史を発信　福井県大野市の市民グループがクラファン,https://news.yahoo.co.jp/articles/975e9dbb696e5af1687f07dd9193a58c642d534d,8/24(木) 12:24
fukui,お地蔵様カラフルに…子どもが主役の伝統行事「地蔵盆」　福井県小浜市、無病息災を願う,https://news.yahoo.co.jp/articles/eb8c9edfffc687d225874baf31ce08b836524388,8/24(木) 7:36
fukui,カレーの作り置きやバーベキュー、夏の食中毒にご用心　 梅干しやワサビ、殺菌効果アリ？…専門家に聞く,https://news.yahoo.co.jp/articles/f1cd500b123a7e5fc24d9b0f95d9d182a8190691,8/23(水) 18:36
fukui,民家に意識不明の男女、女性は死亡　福井県坂井市、警察が事件性調べる,https://news.yahoo.co.jp/articles/e2120b8bd59b1aa7a7ed677b8273da96a66cecf5,8/23(水) 10:29
fukui,厳しい残暑の中…クリが成長「秋が近づいている」　福井県大野市の園、9月から収穫,https://news.yahoo.co.jp/articles/f192f885df8fad935fdccb999f48442e4b3ef574,8/23(水) 7:26
fukui,福井県中心部の再開発、完成は新幹線開業から4年後以降に…想定超える人件費や資材高騰、「さらに遅れる可能性も」,https://news.yahoo.co.jp/articles/abd6f9ff46ad87b98f8015c2c7fe3c2447da04fd,8/22(火) 19:02
fukui,8月22日昼過ぎから福井県嶺北で激しい雨の恐れ　福井地方気象台が注意呼び掛け,https://news.yahoo.co.jp/articles/d704f97e29457e27600d1760b45f28b656687ee6,8/22(火) 11:00
fukui,「ふくい桜マラソン」フルマラソンコースが日本、世界陸連公認に　5キロコースも認定　2024年3月31日開催,https://news.yahoo.co.jp/articles/7c5f294a81891300e2f712a16ff42411ea56b233,8/22(火) 7:23
fukui,国内4例目「星空保護区」に福井県大野市　市街地から近い「アーバン・ナイトスカイプレイス」部門ではアジア初、米NPO,https://news.yahoo.co.jp/articles/4626aee54211d9b1ff7295f12d3c859cb30a9fb2,8/21(月) 16:24
fukui,ゴディバと福井県特産「黄金の梅」コラボのフローズンドリンク完成　西武福井店で限定販売,https://news.yahoo.co.jp/articles/e8448f52d9461e1c9b4eea453cfd5049971528c4,8/21(月) 11:20
fukui,国道8号の敦賀バイパス余座ランプ、8月21〜23日に夜間通行止め　福井河川国道事務所が迂回呼び掛け,https://news.yahoo.co.jp/articles/d61ec8788da337c3168b55ff945ddf0f343e6ba6,8/21(月) 7:11
fukui,「誰かと」よりも「1人で」派が上回る　福井商工会議所調査「福井県内のソロ活ニーズ高まり」　“1人高級ディナー”はハードル高く,https://news.yahoo.co.jp/articles/0a4fc27dbc049e2ca627a99d0762235b529393b7,8/20(日) 16:11
fukui,金価格高騰の影響、議員バッジにも　福井県議会の14金製は1個7万円に、北陸3県で最高額,https://news.yahoo.co.jp/articles/85324066c16ff795cdeed7a8686d998eff8921aa,8/20(日) 11:19
fukui,戦国の遺構包む光…一乗谷朝倉氏遺跡で「万灯夜」　1万5千個のろうそく並ぶ、福井県福井市,https://news.yahoo.co.jp/articles/20bbdbabc1f96c3a7681ada93de5106d16dbe365,8/20(日) 7:19
fukui,原発の使用済み核燃料搬入への考え、山口県上関町長に聞く　中間貯蔵施設建設に向けた調査容認受け,https://news.yahoo.co.jp/articles/1e4eaf6ffe30685b9d01957b74cd3dcd957e2cfe,8/19(土) 16:00
fukui,台風シーズン捉え「屋根の点検に来た」訪問業者に注意…福井で相談相次ぐ　修理せかされ高額契約,https://news.yahoo.co.jp/articles/85782eb0c52105d0ca46841b923adc5aba3e0134,8/19(土) 11:52
fukui,福井フェニックス花火　70回の節目の打ち上げ、5万2千人魅了　福井県福井市,https://news.yahoo.co.jp/articles/44cfda25b0f4f6f59f2b34e338fa20ed1e00e414,8/19(土) 7:24
fukui,ネットバンキング不正送金が増加…警戒強める福井県警　金融機関かたりフィッシング、今年7月までに県内540万円被害,https://news.yahoo.co.jp/articles/650004775c43df169c24c0a296b762e2cabd996d,8/18(金) 18:07
fukui,ホテルの懐石料理など食べ13人が腹痛や嘔吐、食中毒　調理従事者からもノロウイルス検出、福井,https://news.yahoo.co.jp/articles/2dc3b5a14da75ebe21821e98a6595bee76ddf9e4,8/18(金) 12:11
fukui,“太平洋の白鳥”きた…日本最大級の帆船「日本丸」が24年ぶり敦賀港へ　　8月19、20日一般公開,https://news.yahoo.co.jp/articles/b2073297d2a4f194460a4ebdb59773d695c61539,8/18(金) 7:35
fukui,福井大学の実就職率、16年連続国立大学ランキング1位　2023年春、過去最高の98.4％,https://news.yahoo.co.jp/articles/b87a7e3a9f354bad738d5c6cc0345bec9be2ef4f,8/17(木) 19:01
fukui,お台場に恐竜大集合へ…北陸新幹線開業合わせ恐竜王国福井をアピール　全身骨格や化石発掘体験も,https://news.yahoo.co.jp/articles/b5fb996ae3d8c7d72bfb2216e43483ff0903c0b1,8/17(木) 11:44
fukui,手動でふんわり…酒屋のかき氷が好評　氷とシロップにこだわり、酒とセットも　福井県鯖江市,https://news.yahoo.co.jp/articles/eef5a8d2959fc48d188de73eff551e6a72e1b7b2,8/17(木) 7:27
fukui,「Nagie Lane」はゴスペラーズ注目のアカペラグループ　デビュー5周年、福井県出身barattiさんリーダー,https://news.yahoo.co.jp/articles/c60abc0f4e9744c859f72fe5706a2ebb03f77353,8/16(水) 18:24
fukui,打ち上げ花火や野外シアター…福井県美浜町で8月19日に夏フェス　住民有志の実行委がクラファンで支援募集,https://news.yahoo.co.jp/articles/a3c4f2d6c8e9739e660df8ebed6a17bc85c5fc2c,8/16(水) 13:10
fukui,運転士不足で減便…福井鉄道が福武線のダイヤ改正を発表　10月14日から日中の急行廃止,https://news.yahoo.co.jp/articles/55d395bd7bc46437cd8e9c55ad384cb204003ec1,8/16(水) 8:36
fukui,台風7号が北上中、福井県は8月16日未明にかけて警戒　暴風や浸水、河川増水…警報級高潮の可能性も,https://news.yahoo.co.jp/articles/65384afe9c35051a5acbe9c53f0f138de6853fc0,8/15(火) 18:51
fukui,台風7号は15日夕方から福井県接近　嶺南、嶺北とも非常に激しい雨の恐れ,https://news.yahoo.co.jp/articles/5d1b8c7f7553744f7532cc48bd4c5a06f8a5fd0f,8/15(火) 13:46
fukui,釣り人を捜索していた民間ダイバー男性が行方不明　福井県の九頭竜川、県警と活動中に,https://news.yahoo.co.jp/articles/33ea2c60117363a9dc248fc0dd5d20486ad7e421,8/15(火) 11:32
fukui,一乗谷朝倉氏遺跡をライトアップ…8月19日から越前朝倉万灯夜　福井市民の歌の「ダ・カーポ」招きコンサート,https://news.yahoo.co.jp/articles/916da1c252db4aa37ee4568c0c08790c66fafeb1,8/14(月) 17:43
fukui,熱中症で冷たい水を浴びせるの毛穴が閉まり逆効果　消防局が対策アドバイス、うちわや霧吹きで冷やして,https://news.yahoo.co.jp/articles/4d8ac2a5187154475fd3eca295031c39db24208f,8/14(月) 12:47
fukui,台風7号影響で特急サンダーバード、しらさぎで計画運休　北陸線も…JR西日本、8月15日の運行予定,https://news.yahoo.co.jp/articles/372bab82c7fa065ce5b8a30c0bc5f9b319a2d7d2,8/14(月) 7:59
fukui,福井県の敦賀花火大会、台風7号影響で中止決定　8月16日、5年連続で開催断念,https://news.yahoo.co.jp/articles/163b121f16e8e9c0dcbc8ea7a4854932e5634d8a,8/13(日) 17:27
fukui,ペルセウス座流星群、8月13日に流れ星ピーク　オススメの時間帯は…国立天文台に聞いてみた,https://news.yahoo.co.jp/articles/3fb9be28ebd6f8d7d0fab970352b01170fe163d9,8/13(日) 11:00
fukui,福井市の連続猛暑日「20」でストップ　8月13日は35度予想,https://news.yahoo.co.jp/articles/fdc816946ee79158f394b4aa75cc445af53bcce9,8/13(日) 7:44
fukui,「上げ馬神事」現場の急坂を見て実感した馬に対する酷使　三重県桑名市、時代とともに変わるべき伝統【杉本彩のEva通信】,https://news.yahoo.co.jp/articles/c4d116223fd3fd8bf3b3201187d76e6bfcd86e07,8/12(土) 18:23
fukui,アユ釣り客から「人が流されている」と110番…捜索も見つからず　福井県永平寺町の九頭竜川,https://news.yahoo.co.jp/articles/f50f2d77bf1bf547171c8d12ce6aeefcfba9e32c,8/12(土) 11:58
fukui,夜空彩る大輪…水中花火や2尺玉など1万5千発が観客を魅了　福井県坂井市で三国花火大会,https://news.yahoo.co.jp/articles/f906a0cca8d8cefe2295a8765458a2e22b4fadb1,8/12(土) 7:31
fukui,ピザハット日本初出店から50年、全都道府県を制覇へ　46番目の福井はコンビニ内併設、最後の県も月内計画,https://news.yahoo.co.jp/articles/56f6c5af27ba51247e410ed2dc9e9489ae4cd6a3,8/11(金) 17:31
fukui,【甲子園】強打の慶応どう攻略…福井代表・北陸の勝機は　8月11日第3試合,https://news.yahoo.co.jp/articles/150f6206ad1f1b6fbf93f215726c2fed0c04b9ec,8/11(金) 11:36
fukui,B'z、福井と沖縄公演の中止を発表　松本孝弘さん「僕達も残念でなりません」,https://news.yahoo.co.jp/articles/5c585133905183708fc9c63a741b1d6fe64b8826,8/11(金) 7:31
fukui,女子中学軟式野球「福井ダイヤモンドガールズ」日本一目指す　8月に全国大会が二つ、クラファンで支援募集,https://news.yahoo.co.jp/articles/bf3c5786ff7ac78a3179d4d359a978a46179e6d4,8/10(木) 18:55
fukui,スマホ映像と現実融合…「カラダ探し」作家監修の新感覚お化け屋敷、8月15日まで　福井県高浜町,https://news.yahoo.co.jp/articles/ef9af04bf98d388cd94f8616c4b861c5b144029a,8/10(木) 11:27
fukui,3月に自宅半焼…敦賀市職員を放火疑いで逮捕、容疑を否認　福井県警,https://news.yahoo.co.jp/articles/cf5716b7fafe503b9ba2b523a053ab47c8370700,8/10(木) 7:40
fukui,福井名物ソースカツ丼の老舗が閉店…最後の一日に密着　店先は終日人だかり「やっぱりおいしい。涙が出そう」,https://news.yahoo.co.jp/articles/faf62ae04aad964da2159533d0187a0b51627fe6,8/9(水) 18:43
fukui,バスケB3参戦の福井ブローウィンズ始動、初の全体練習　初代主将は北陸高校出身の29歳,https://news.yahoo.co.jp/articles/f8b70cc43d00bc44b01d91397b94685d55f9390f,8/9(水) 11:00
fukui,「もう一度全国制覇を」敦賀気比高校野球部の東哲平監督が続投　退任意向に学校側が強く慰留,https://news.yahoo.co.jp/articles/28d4dce4fa3ad9f461be3ad861b2208352991657,8/9(水) 7:11
fukui,福井県の最低賃金引き上げ額は過去最大43円、時給931円に　使用者側が最大限の譲歩,https://news.yahoo.co.jp/articles/43f6b76c9a4ee4903020248650c8dcd05ff49d08,8/8(火) 17:55
fukui,神宮球場9月20日のヤクルトvs中日で「ふくいDAY」開催　福井県とスワローズ連携、中村悠平選手に県栄誉賞を贈呈,https://news.yahoo.co.jp/articles/572f1e351614395a7c64bc4b9fab3f9d89b93c2c,8/8(火) 13:15
