ctgry,media_jp,title_pickup,title_articles,link_pickup,link_articles,date_original
sports,ENCOUNT,桜庭和志 格闘技はけんかじゃない,桜庭和志が最近の格闘技を見なくなったワケ　「喧嘩じゃない。そっちの世界に入りたくない」,https://news.yahoo.co.jp/pickup/6474934,https://news.yahoo.co.jp/articles/4761dd800464f2c9fcb2291d2cdfbe8f742c4c80,9/10(日) 10:20
sports,ゲキサカ,ドイツに大勝 冨安「狙い通り」,ドイツ相手に圧巻のプレーを見せた冨安健洋、内容伴う完勝に「狙いどおりの試合」「W杯とはまた違った勝利」,https://news.yahoo.co.jp/pickup/6474931,https://news.yahoo.co.jp/articles/6118720ecc0dd20624ea6da5cd35dd4f84207a52,9/10(日) 9:48
sports,スポーツ報知,吉田正尚と藤浪晋太郎 再会を喜ぶ,吉田正尚と藤浪晋太郎が同地区対決での再会を喜び合う…日米通じて初の対戦なるか注目,https://news.yahoo.co.jp/pickup/6474928,https://news.yahoo.co.jp/articles/3a6c812af1ffff97f8caf3309794b65a6ae7582f,9/10(日) 9:01
sports,日刊スポーツ,サッカー日本 ドイツに4-1で快勝,【日本代表】ドイツに４−１快勝！伊東、上田、浅野、田中がゴール！初のＷ杯優勝経験国に２連勝,https://news.yahoo.co.jp/pickup/6474917,https://news.yahoo.co.jp/articles/e3caba90e04813d6c1a796dcb0562ea0bd5fd596,9/10(日) 7:18
sports,スポーツ報知,侍U18 台湾との「前哨戦」完敗,【Ｕ１８】日本、台湾との“前哨戦”で完敗　先制も投手陣が５失点　１０日・決勝で再戦,https://news.yahoo.co.jp/pickup/6474916,https://news.yahoo.co.jp/articles/04c13954e74e3c45068568c7a0457ff07dd86ad3,9/10(日) 0:29
sports,,速報W杯アイルランド-ルーマニア,ラグビーW杯　アイルランドvs.ルーマニアを速報,https://news.yahoo.co.jp/pickup/6474904,https://news.yahoo.co.jp/articles/af4fde8b8020dea57c6dac02fd0a4bf6dacfa42c,9/9(土) 22:25
sports,デイリースポーツ,由伸ノーノー ヤンキースGM興奮,メジャー衝撃！オリックス山本のノーノーを目撃　ヤ軍ＧＭも絶賛＆興奮「幸せだ」「今日のチケットは大事に取っておく」,https://news.yahoo.co.jp/pickup/6474910,https://news.yahoo.co.jp/articles/4bb5f7bc56e2ab7bd2c4d51e4dffb52edbfc7ab3,9/9(土) 22:19
sports,スポニチアネックス,由伸 ノーノーは3回くらいに意識,オリックス・山本　2年連続ノーノー「最後の1人までドキドキ」　四球の原因は「ラオウさんが…」,https://news.yahoo.co.jp/pickup/6474907,https://news.yahoo.co.jp/articles/3dd65d66e8233193a8c0534475a62aa80668e105,9/9(土) 21:49
sports,日刊スポーツ,オリックス山本由伸 ノーノー達成,【オリックス】山本由伸２年連続２度目のノーヒットノーラン達成　プロ野球通算100度目の快挙,https://news.yahoo.co.jp/pickup/6474901,https://news.yahoo.co.jp/articles/3e7b71080799d69d7d1c72414339bf021fb57171,9/9(土) 20:25
sports,スポーツナビ,速報 オリ山本由伸がノーノー継続,千葉ロッテマリーンズvs.オリックス・バファローズ 試合テキスト速報,https://news.yahoo.co.jp/pickup/6474896,https://news.yahoo.co.jp/articles/175eb9b305b7a5cd114c9345b32c8a694bffdca9,9/9(土) 19:51
sports,スポーツ報知,ラグビー姫野 膝曲がらぬほど固定,【ラグビーＷ杯】姫野和樹主将、１０日チリ戦出場回避か「ふくらはぎの問題」前日練習参加せず,https://news.yahoo.co.jp/pickup/6474897,https://news.yahoo.co.jp/articles/11f5df20bd8397bfaa5fc7dd5bf99ead0d4d3024,9/9(土) 19:51
sports,スポーツ報知,ラグビー姫野 前日の練習参加せず,【ラグビーＷ杯】姫野和樹主将、１０日チリ戦出場回避か「ふくらはぎの問題」前日練習参加せず,https://news.yahoo.co.jp/pickup/6474894,https://news.yahoo.co.jp/articles/11f5df20bd8397bfaa5fc7dd5bf99ead0d4d3024,9/9(土) 19:34
sports,ＡＦＰ＝時事,ラグビー日本 初戦相手に双子2組,チリ代表、日本とのラグビーW杯初戦で双子2組が先発,https://news.yahoo.co.jp/pickup/6474869,https://news.yahoo.co.jp/articles/0cfc692b7a4b2f72f6a067ddf95b5dae13424d44,9/9(土) 15:49
sports,日刊スポーツ,山川 処分後初の3軍戦は出場せず,【西武】山川穂高、処分決定後初３軍戦迎えるも出場せず　練習は行い、試合開始前に球場を離れる,https://news.yahoo.co.jp/pickup/6474864,https://news.yahoo.co.jp/articles/8cf0798282b61f4e5daaf09518ac84656adf3933,9/9(土) 14:29
sports,デイリースポーツ,大谷は復帰目前?指揮官が示唆,大谷翔平は復帰目前？　指揮官「明日が最良の日」　右脇腹の張りで３年ぶり５戦連続ベンチ,https://news.yahoo.co.jp/pickup/6474853,https://news.yahoo.co.jp/articles/f0f4f74718e28f2cd63373ca43ff70fafe33bdb4,9/9(土) 11:19
sports,スポニチアネックス,バスケ 独が米国を撃破し決勝進出,【バスケW杯】日本にも勝利したドイツが快挙!米国撃破し初の決勝進出　今大会唯一の開幕7連勝,https://news.yahoo.co.jp/pickup/6474849,https://news.yahoo.co.jp/articles/2385eee10e64c6ad7f492d0ce8c334ccb1e52c37,9/9(土) 10:40
sports,月刊陸上競技,激走 田中希実が女子5000m日本新,【陸上】田中希実 14分29秒18!!! 5000mDL初挑戦、超特大の日本新で3位／DLブリュッセル,https://news.yahoo.co.jp/pickup/6474839,https://news.yahoo.co.jp/articles/15e2cf1a4105fa38c20773e2bd3a21f8d231ebfa,9/9(土) 7:36
sports,THE ANSWER,ラグビーW杯開幕 仏がNZを撃破,ラグビーW杯開幕戦、開催国フランスがNZ撃破　V候補同士の白熱シーソーゲームに8万人熱狂、NZはW杯1次L初黒星の屈辱,https://news.yahoo.co.jp/pickup/6474836,https://news.yahoo.co.jp/articles/7b608628642ae8d685ee31b1f788e34dc55e0606,9/9(土) 6:40
sports,TBS NEWS DIG Powered by JNN,阪神が6連勝 優勝マジック10,阪神が6連勝で優勝マジック10！村上が自身初の10勝到達、森下先制10号＆佐藤輝豪快18号、広島との直接対決初戦制す,https://news.yahoo.co.jp/pickup/6474825,https://news.yahoo.co.jp/articles/fb6c81531fadf7dd41de85efe5d5e245bbed3c80,9/8(金) 22:35
sports,西スポWEB OTTO！,ソフトバンク周東 プロ初の満塁弾,5点ビハインド、奇跡が起きる予カ〜ン！　ソフトバンク周東佑京がプロ初のグランドスラム,https://news.yahoo.co.jp/pickup/6474817,https://news.yahoo.co.jp/articles/1e7aa54bc5b5d851c231fb7056968caa0de3d746,9/8(金) 21:41
sports,日刊スポーツ,朗希が10日復帰登板 驚異的な回復,【ロッテ】佐々木朗希10日オリックス戦で復帰登板「５回も投げないと思いますけれど」吉井監督,https://news.yahoo.co.jp/pickup/6474794,https://news.yahoo.co.jp/articles/2f72961f010969755d6fd7f97a054cdca13b2a40,9/8(金) 18:42
sports,オリコン,斎藤佑樹さん「ハンカチ店主」に,“ハンカチ王子”斎藤佑樹、ハンカチ店開店　店主就任に意気込み,https://news.yahoo.co.jp/pickup/6474787,https://news.yahoo.co.jp/articles/1d79279e166baceb10ae8532354d996ad22639b1,9/8(金) 17:44
sports,SOCCER DIGEST Web,岩渕が涙の引退会見 澤さんも登場,岩渕真奈の引退会見に澤穂希がサプライズ登場！なでしこ後輩にエール「また輝き続けるのを私自身も楽しみにしています」,https://news.yahoo.co.jp/pickup/6474778,https://news.yahoo.co.jp/articles/184a6f253a25281d669ee3cfaaf2775d2bb0df87,9/8(金) 16:58
sports,日刊スポーツ,侍U18東恩納が完全試合 5回参考,【Ｕ18Ｗ杯】「ミスターゼロ」東恩納蒼が５回参考も完全試合達成　１次Ｒから３試合連続無失点,https://news.yahoo.co.jp/pickup/6474759,https://news.yahoo.co.jp/articles/ffdcabb56fc671113d628819c4f6299923877507,9/8(金) 13:46
sports,スポーツ報知,照ノ富士が休場 2場所連続18度目,照ノ富士が秋場所初日から休場　２場所連続１８度目　先場所は腰の負傷で途中休場　十両以上では伯桜鵬と若隆景も,https://news.yahoo.co.jp/pickup/6474749,https://news.yahoo.co.jp/articles/401e559f985f7481bcc7295511ccc21c2f86ffc9,9/8(金) 13:09
sports,スポーツナビ,速報U-18W杯 侍Jvs.プエルトリコ,速報　U-18野球W杯　日本vs.プエルトリコ,https://news.yahoo.co.jp/pickup/6474745,https://news.yahoo.co.jp/articles/40aed8c1e9450c0c7df8169fdcab008cdc929fbe,9/8(金) 11:23
sports,Full-Count,大谷4戦連続スタメン外 監督慎重,【MLB】大谷翔平は「十分ではない」　4戦連続スタメン外…指揮官は起用に慎重「100％でなければ」,https://news.yahoo.co.jp/pickup/6474736,https://news.yahoo.co.jp/articles/73573b43511ee59cc4c3755a50179657ac1b9ebf,9/8(金) 9:08
sports,超WORLDサッカー！,長友佑都が謝罪 接触のFWが重傷,「心からお詫び申し上げます」長友佑都が自身のプレーを謝罪、接触した高校＆大学の後輩・福岡FW佐藤凌我が全治8カ月の重傷…福岡ファンは「回復を願って」「ご飯でも奢ってあげて」と反応,https://news.yahoo.co.jp/pickup/6474727,https://news.yahoo.co.jp/articles/79e3e86dfbe9ae657392a695dc5a8f26b4d7ba83,9/8(金) 7:35
sports,Number Web,リーチ 前回W杯から体ボロボロ,＜独占告白＞リーチマイケル（34歳）が4度目のW杯前に明かした衝撃の真実「レッドは絶対ダメ」「2019年W杯から体はボロボロでした」,https://news.yahoo.co.jp/pickup/6474716,https://news.yahoo.co.jp/articles/fc7ba9501403913f2ae3eddcdea31093e1fe33e8,9/7(木) 22:42
sports,デイリースポーツ,G坂本 初の三塁スタメンで美技,巨人・坂本がプロ初の三塁スタメンで美技！同点を阻止するファインプレーに笑顔　九回にダメ押し弾も,https://news.yahoo.co.jp/pickup/6474715,https://news.yahoo.co.jp/articles/152a81b03913e29133ceae54e61f02ae9f99c223,9/7(木) 22:34
sports,ＡＦＰ＝時事,大坂なおみ 来年の全豪で復帰へ,大坂なおみ、24年全豪OPでの復帰を明言,https://news.yahoo.co.jp/pickup/6474688,https://news.yahoo.co.jp/articles/29ac63feaaa7b0ba0478f9585a1e707de44f7ea9,9/7(木) 18:05
sports,共同通信,DeNA今永メジャー挑戦か 米報道,DeNA今永、ポスティングか　30歳、MLB公式サイト伝える,https://news.yahoo.co.jp/pickup/6474644,https://news.yahoo.co.jp/articles/c8039ee772e3bad7e4060e8a19d387416d681645,9/7(木) 12:14
sports,FNNプライムオンライン（フジテレビ系）,W杯キス問題 女性選手が告訴,スペインサッカー連盟会長キス問題　女性選手が告訴,https://news.yahoo.co.jp/pickup/6474626,https://news.yahoo.co.jp/articles/7d41c6d9156a0e702db894fae18854440c1eb653,9/7(木) 8:49
sports,Number Web,大谷取材10年目 記者が見た負傷,大谷翔平の負傷禍を“取材歴10年”番記者が検証…日本ハム時代から「中指をつった」記録はなかったが「例えばもう一回ケガをして」の真意,https://news.yahoo.co.jp/pickup/6474622,https://news.yahoo.co.jp/articles/7de09b19498b0f8a4614197efe704f50ac9d3fb2,9/7(木) 8:21
sports,ゲキサカ,サッカーU22 圧巻の6得点で勝利,U-22日本代表が圧巻の大量6得点! 鈴木海、三戸、細谷、藤田がゴール! パリ五輪一次予選の初陣でパキスタン撃破,https://news.yahoo.co.jp/pickup/6474618,https://news.yahoo.co.jp/articles/dd29c12d71b9b8f0324243541117d05f3e597960,9/7(木) 7:42
sports,GOAL,なでしこ宮澤ひなた マンUに移籍,W杯得点王のなでしこジャパンFW宮澤ひなた、マンチェスター・U移籍決定！ 「どこにいても笑顔でひなたらしく」,https://news.yahoo.co.jp/pickup/6474609,https://news.yahoo.co.jp/articles/6045ca8fc8527d1b9815e38a93a2a76a831afa04,9/7(木) 0:13
sports,TBS NEWS DIG Powered by JNN,阪神が5連勝 2005年以来の貯金30,【阪神】5連勝で優勝マジック13！18年ぶり貯金30 初回 森下タイムリーの1点を守り切る 才木6回無失点7勝目 完封リレー岩崎29S,https://news.yahoo.co.jp/pickup/6474606,https://news.yahoo.co.jp/articles/b7a0fed4e2e4ad9f459e26c786db45fa9e204296,9/6(水) 23:53
sports,デイリースポーツ,中日に走塁ミス 監督立ち尽くす,中日・細川、岡林が相次ぐ走塁ミス　本拠地はため息の渦　立浪監督はベンチで立ち尽くす,https://news.yahoo.co.jp/pickup/6474593,https://news.yahoo.co.jp/articles/68f743f1a427872ea70630d561a2c3ef36c8b5ca,9/6(水) 21:42
sports,デイリースポーツ,中日走塁ミス相次ぐ ファンため息,中日・細川、岡林が相次ぐ走塁ミス　本拠地はため息の渦　立浪監督はベンチで立ち尽くす,https://news.yahoo.co.jp/pickup/6474586,https://news.yahoo.co.jp/articles/68f743f1a427872ea70630d561a2c3ef36c8b5ca,9/6(水) 21:09
sports,スポニチアネックス,水連に不満 平井コーチけん責処分,問題行動の平井コーチ　9月1日から半年間代表活動自粛　日本水連からはけん責「倫理規定に反する」,https://news.yahoo.co.jp/pickup/6474582,https://news.yahoo.co.jp/articles/0b1c9004e1594f238058111fd3d2846e539ea29c,9/6(水) 20:10
sports,共同通信,大谷の右脇腹は軽症 最短7日復帰,大谷は軽症、最短7日に復帰　エンゼルス監督「大事に至らず」,https://news.yahoo.co.jp/pickup/6474566,https://news.yahoo.co.jp/articles/62ab04802acc7be11934efee868a2ffd191b9812,9/6(水) 18:06
sports,共同通信,大谷の右脇腹は軽傷 最短7日復帰,大谷は軽症、最短7日に復帰　エンゼルス監督「大事に至らず」,https://news.yahoo.co.jp/pickup/6474559,https://news.yahoo.co.jp/articles/62ab04802acc7be11934efee868a2ffd191b9812,9/6(水) 17:06
sports,Full-Count,藤浪好投に監督「俺たちのフジ」,【MLB】「俺たちのフジ」指揮官が大絶賛　“あえて”の延長戦登板…藤浪晋太郎を温存した理由,https://news.yahoo.co.jp/pickup/6474547,https://news.yahoo.co.jp/articles/6eb901c2542a3c51f5d864fd80554e16d350604c,9/6(水) 15:42
sports,tennis365.net,観客がプレー中に妨害 ジョコ怒り,プレー中に観客が妨害 ジョコビッチが怒り「かなりイライラした」＜全米オープン＞,https://news.yahoo.co.jp/pickup/6474514,https://news.yahoo.co.jp/articles/99cdfc9a8b92bf5a9f8f68080d1179cf55d5df8c,9/6(水) 9:40
sports,スポーツ報知,大谷2戦連続でスタメン外 2年ぶり,大谷翔平が２年ぶりに２戦連続でスタメン外れる　右脇腹張りで前日は欠場も球場入り,https://news.yahoo.co.jp/pickup/6474504,https://news.yahoo.co.jp/articles/51862e91ef8812446dc53e1ebdb421132147048a,9/6(水) 7:57
sports,TBS NEWS DIG Powered by JNN,W杯「キス問題」余波か 監督解任,W杯優勝スペイン女子代表監督が解任　連盟会長の“キス問題”の余波か,https://news.yahoo.co.jp/pickup/6474503,https://news.yahoo.co.jp/articles/2553d3ba1171f0dc0acacc674831429601e512aa,9/6(水) 7:44
sports,共同通信,ラグビーW杯 高額なパックが好調,高額パック好調、ラグビーW杯　観戦、商談や接待組み合わせ,https://news.yahoo.co.jp/pickup/6474493,https://news.yahoo.co.jp/articles/99b689841e9484faa0645564775047164a55b22d,9/5(火) 23:19
sports,ＡＦＰ＝時事,バスケセルビア代表負傷 腎臓摘出,セルビア代表選手が腎臓摘出 バスケW杯,https://news.yahoo.co.jp/pickup/6474461,https://news.yahoo.co.jp/articles/4f5099850783bee0fa35f27670eda3b71b01b649,9/5(火) 17:35
sports,Full-Count,脇腹張りで欠場の大谷 6日に検査,【MLB】大谷翔平は6日検査へ　右脇腹張りで108試合ぶり欠場…ネビン監督「かなり痛そうだった」,https://news.yahoo.co.jp/pickup/6474456,https://news.yahoo.co.jp/articles/632361518c73f216848aee7362b5977d98f33812,9/5(火) 16:35
sports,スポーツ報知,大谷の右肘手術は未定 代理人明言,大谷翔平の右肘手術は未定と代理人が明言　今後も当面は打者で出場継続へ,https://news.yahoo.co.jp/pickup/6474451,https://news.yahoo.co.jp/articles/febfdef58d91b975b5708ba041b6072b95d99252,9/5(火) 15:40
sports,スポーツ報知,大谷翔平の右肘手術は未定 代理人,大谷翔平の右肘手術は未定と代理人が明言　今後も当面は打者で出場継続へ,https://news.yahoo.co.jp/pickup/6474446,https://news.yahoo.co.jp/articles/febfdef58d91b975b5708ba041b6072b95d99252,9/5(火) 14:52
sports,TBS NEWS DIG Powered by JNN,レース事故で重体のライダー死亡,プロライダーの谷本音虹郎選手（23）が死亡国内最高峰のオートバイロードレースで衝突事故　,https://news.yahoo.co.jp/pickup/6474433,https://news.yahoo.co.jp/articles/a566ed908fa30dc52c373d18070d20345e3bf13c,9/5(火) 12:37
sports,FOOTBALL ZONE,J2町田 FWアデミウソン獲得内定,J2首位の町田、FWアデミウソン獲得内定を発表　メディカルチェック後に正式契約へ,https://news.yahoo.co.jp/pickup/6474421,https://news.yahoo.co.jp/articles/eda3960c6462f2c11b4bdd8e783cfa16cf807f95,9/5(火) 10:13
sports,スポーツ報知,大谷急きょスタメン回避 脇腹張り,大谷翔平が右脇腹張りで急きょスタメン外れる　約２か月ぶりフリー打撃で負傷か…１０７戦連続先発も,https://news.yahoo.co.jp/pickup/6474420,https://news.yahoo.co.jp/articles/96135074704afb56a9ed978c26948619d8ca9941,9/5(火) 9:58
sports,Full-Count,吉田正尚 2戦連続のホームラン,【MLB】吉田正尚、メジャー初2試合連発の豪快15号　日本人1年目では鈴木誠也抜き4位,https://news.yahoo.co.jp/pickup/6474413,https://news.yahoo.co.jp/articles/980ae99c571510bab4a09bc768c48e26305dbf56,9/5(火) 8:20
sports,スポーツ報知,鈴木誠也が豪快弾 地元ファン熱狂,鈴木誠也、自己新の先制１５号＆適時二塁打の大活躍　祝日で超満員の地元ファン大熱狂,https://news.yahoo.co.jp/pickup/6474406,https://news.yahoo.co.jp/articles/df5a83af7bd8cf2719a37bbaf02d52305a9d812a,9/5(火) 6:51
sports,Full-Count,侍U18にアクシデント 主将が入院,侍U-18、馬淵監督が試合前から“ゲキ”　主将が入院…思い代弁「絶対に落とせない」,https://news.yahoo.co.jp/pickup/6474395,https://news.yahoo.co.jp/articles/ef0fc79953d0882a8aab61cc1c29f78d81cf400f,9/4(月) 22:22
sports,Full-Count,侍U18主将が入院 監督が選手鼓舞,侍U-18、馬淵監督が試合前から“ゲキ”　主将が入院…思い代弁「絶対に落とせない」,https://news.yahoo.co.jp/pickup/6474393,https://news.yahoo.co.jp/articles/ef0fc79953d0882a8aab61cc1c29f78d81cf400f,9/4(月) 22:05
sports,スポニチアネックス,バスケ日本が羽田到着 ファン声援,バスケ日本代表　羽田空港に到着　渡辺、河村登場にファン黄色い声援,https://news.yahoo.co.jp/pickup/6474359,https://news.yahoo.co.jp/articles/54586a498a7fada6456f69175802c4cccb7a1512,9/4(月) 17:40
sports,デイリースポーツ,無期限出場停止 西武山川の今後は,無期限出場停止の西武・山川　国内ＦＡ権取得まであと１７日　復帰はいつ？今後どうなる？,https://news.yahoo.co.jp/pickup/6474357,https://news.yahoo.co.jp/articles/5e52daeeb14087ba638413fb26ce1b8954480bce,9/4(月) 17:24
sports,スポニチアネックス,山川穂高 無期限の公式戦出場停止,西武　山川を無期限の公式試合出場停止処分　山川謝罪「深く反省」「立場わきまえずにした行動」,https://news.yahoo.co.jp/pickup/6474339,https://news.yahoo.co.jp/articles/3e5e9a8c0cf5f3069d3bc441dc688d551022d548,9/4(月) 14:42
sports,日刊スポーツ,大谷が今季中に肘の手術か 米報道,大谷翔平、10日以内にシーズン終え２度目のトミー・ジョン手術か　米報道,https://news.yahoo.co.jp/pickup/6474326,https://news.yahoo.co.jp/articles/a371ef23178cec86c67036a3aa77188b0fa402fc,9/4(月) 13:25
sports,スポニチアネックス,バスケ五輪切符獲得 視聴率22.9%,バスケW杯　日本がカボベルデ下しパリ五輪切符獲得　今大会最高22・9％！瞬間最高30・2％　列島歓喜,https://news.yahoo.co.jp/pickup/6474323,https://news.yahoo.co.jp/articles/0a5ddae88b9fc661c5f7030fbc0f96e8449af876,9/4(月) 12:24
sports,Full-Count,大谷翔平 10戦48打席ノーアーチ,【MLB】大谷翔平、10戦48打席ノーアーチ　3戦6四球で2戦無安打…エ軍、最下位に3連敗で借金9,https://news.yahoo.co.jp/pickup/6474306,https://news.yahoo.co.jp/articles/8b6e4e1ba1bc87695afe8a4516f94887853587da,9/4(月) 9:09
sports,ABEMA TIMES,吉田正尚3ラン 気づかず全力疾走,吉田正尚、久々に豪快な一発 13試合ぶりの今季14号3ラン！本人気づかず三塁まで全力疾走、日本人メジャー1年目では5位タイ,https://news.yahoo.co.jp/pickup/6474296,https://news.yahoo.co.jp/articles/d3fdb52f4de3efe1c15dd4ac211b3ea32a386215,9/4(月) 7:38
sports,スポーツ報知,近本への死球 ヤクルト監督が謝罪,【ヤクルト】阪神・近本への死球を高津臣吾監督が謝罪「申し訳ない。ぶつけようと思ってぶつけてるわけではない」,https://news.yahoo.co.jp/pickup/6474295,https://news.yahoo.co.jp/articles/012c5957e6436651ce7d01b705e2ff22da4ec253,9/4(月) 7:26
