media_en,media_jp,title_articles,link_articles,date_original
bbt,富山テレビ,パリパラリンピック・ボッチャ女子代表に魚津市出身の藤井友里子選手 4大会連続出場でリオでは銀メダル,https://news.yahoo.co.jp/articles/4565f9be21699e34a41133eb123a1ce3b3888287,8/3(土) 12:35
bbt,富山テレビ,エース八村塁がケガで離脱…パリ五輪バスケ男子 日本はブラジルに敗れ予選敗退 馬場雄大が11得点の活躍,https://news.yahoo.co.jp/articles/bc63e49dd321377f21651b6f5724a505fb9fd48d,8/3(土) 12:31
bbt,富山テレビ,女子中学生への“いじめ”で保護者から再調査を求める2度目の意見 富山市長「しっかり読み込み考えたい」,https://news.yahoo.co.jp/articles/aa4032fefdcedc3ee6a4572f400b4eaa299f8cea,8/2(金) 18:46
bbt,富山テレビ,「会社の金に手をつけた」鉄道会社の20代男性社員が懲戒解雇 駅金庫から売上金421万円着服 全額返金,https://news.yahoo.co.jp/articles/c8a498d5efbd30b3914e9ea221d5efa50045bbc4,8/2(金) 13:03
bbt,富山テレビ,大堀彩（トナミ運輸）が“準々決勝”に進出…五輪バド女子シングルス決勝トーナメント,https://news.yahoo.co.jp/articles/17d0746620023f2701189318f885fd7b9ca66eee,8/2(金) 13:02
bbt,富山テレビ,パリ五輪バスケ男子日本代表の『八村塁（富山市出身）がチーム離脱』…左ふくらはぎの負傷,https://news.yahoo.co.jp/articles/bdedd5c4f7c7eeb2e6fdb1509881b872730dc292,8/2(金) 13:00
bbt,富山テレビ,シニアプロとアマチュアのゴルフトーナメント“アイドマＭＣカップ”に向けて　富山,https://news.yahoo.co.jp/articles/356a80432371253e749d714d089a171c072e8a83,8/2(金) 12:58
bbt,富山テレビ,能登半島地震で液状化被害…氷見市で対策検討委の初会合 復旧に向け10月には対策工法のモデル地区設定へ,https://news.yahoo.co.jp/articles/07fb4939837c9427ec507797cd0df212c781b5dd,8/2(金) 12:55
bbt,富山テレビ,昭和29年に誕生…富山県朝日町が町制70周年を迎え記念式典 笹原町長「魅力あふれる町づくりを目指す」,https://news.yahoo.co.jp/articles/ce67bc38019ddff09a6ef6ee451349b04c473a15,8/1(木) 12:26
bbt,富山テレビ,パリ五輪バドミントン女子シングルス トナミ運輸の大堀彩が決勝トーナメント進出 1回戦は8/2に,https://news.yahoo.co.jp/articles/4a8ea7fb07ab654cfa5c17edc9d11f8b423f74c2,8/1(木) 12:26
bbt,富山テレビ,北陸地方が「梅雨明け」平年より9日 去年より11日遅い発表に この後1週間は晴れる日が多い見込み,https://news.yahoo.co.jp/articles/262ab2a617687990899636c5202ff518516107ca,8/1(木) 12:26
bbt,富山テレビ,4週連続値下がり…レギュラーガソリン小売価格176円50銭 原油価格下落等で先週比1円10銭↓ 富山,https://news.yahoo.co.jp/articles/de68fcd89d84ae7518ed48dfca2d3f51c98d896e,8/1(木) 12:25
bbt,富山テレビ,KITTE大阪に北陸3県のアンテナショップ開店 新田富山県知事「予習をした上でぜひ北陸・富山へ」,https://news.yahoo.co.jp/articles/2ebc4dd9dfc6bcb92c2c4290c847877f44dab649,7/31(水) 21:21
bbt,富山テレビ,人の移動多くなり拡大傾向…新型コロナ 富山県内で定点あたりの感染者数が4週続けて増 県が対策呼びかけ,https://news.yahoo.co.jp/articles/ec6b7b17b53e804ad8c6ec43709582414deb83ca,7/31(水) 21:17
bbt,富山テレビ,国の交付金活用可能に…富山県がツキノワグマ管理計画改定 今秋にも交付金で檻の設置や見回りなど実施へ,https://news.yahoo.co.jp/articles/ef1784a40f6b11a8eee241a07733210768a93446,7/31(水) 21:15
bbt,富山テレビ,市長表明は宗教ヘイト…旧統一教会関連団体等が富山市を訴えた裁判が結審・判決は10月,https://news.yahoo.co.jp/articles/b7e46118edd86a4d0cdc8d7f83b2ea028710d32c,7/31(水) 21:08
bbt,富山テレビ,8月1日で能登半島地震発生から7カ月…住宅被害は2万1273件に（7/31時点）　富山,https://news.yahoo.co.jp/articles/23e01c9cd80bf48fa90e7569c684aea98ad81cf5,7/31(水) 21:07
bbt,富山テレビ,能登半島地震発生から7カ月“復旧の歩み”は…氷見市の介護施設「修繕の方は全く手つかずの状態」,https://news.yahoo.co.jp/articles/4cfa6922109e0a189ce272920998b534e604bf11,7/31(水) 21:05
bbt,富山テレビ,男子水球予選2戦目はフランスと対戦…富山市出身エース稲場悠介はチーム最多6得点あげるも競り負け2連敗,https://news.yahoo.co.jp/articles/ab6696747fadd9e93e5e1bd0ce82f4c49c0f6815,7/31(水) 21:03
bbt,富山テレビ,『過去最高の9位で大会を終える』順位決定戦再びブラジルと対戦…女子7人制ラグビー魚津出身の田中が貢献,https://news.yahoo.co.jp/articles/43bc49dd6373d7ff36c294c5d605feccf0c74876,7/31(水) 21:00
bbt,富山テレビ,富山大空襲から79年…あの日を語り継ぐ93歳男性「生きるか死ぬかという状況で必死だった」,https://news.yahoo.co.jp/articles/05f5ceb36d1989cf95a3ed1cf8c6505aa1bf5e29,7/31(水) 20:58
bbt,富山テレビ,悪天候でも飛行可能…『全天候型ドローン』活用した救助訓練 スピーカーで行方不明者への呼びかけも 富山,https://news.yahoo.co.jp/articles/15aa606bee62d39d792203b05c2e38803a59d761,7/31(水) 20:56
bbt,富山テレビ,富山市に国内外で活躍の“バルーンアーティスト”が結集しフェスティバル…作品展示やパレードも,https://news.yahoo.co.jp/articles/0e0244b962c2748de0c33262fcb56067167867e5,7/31(水) 20:54
bbt,富山テレビ,富山県水墨美術館企画展“没後100年・富岡鉄斎”…『トンネルの奥に理想郷』を描いた鉄斎の思い,https://news.yahoo.co.jp/articles/afb92b99104bed752b6d98f3abe79861302e330d,7/31(水) 20:51
bbt,富山テレビ,五輪バスケ富山市出身“八村塁”擁する日本は仏と『延長戦の激闘』…90対94で敗れ大金星ならず,https://news.yahoo.co.jp/articles/c68766b05d5d1179901b055ddc7b6c585b274d8c,7/31(水) 12:40
bbt,富山テレビ,パリ五輪バド“ホキコバペア”が世界ランク9位の中国ペアと対戦…接戦も1歩及ばず『予選リーグ敗退』,https://news.yahoo.co.jp/articles/03ba94ecd38c46160f12d9be56ea89d525d47c3b,7/31(水) 12:39
bbt,富山テレビ,真夏日の蒸し暑い一日に…予想最高気温は富山市33度・高岡市伏木32度『1日にも梅雨明けか』　富山,https://news.yahoo.co.jp/articles/0acd2849b09f8bb09d14a1334517c9a7e019eeeb,7/31(水) 12:36
bbt,富山テレビ,保護者意見は市長に届けられず…いじめ重大事態で市教委からの“2度目の報告書”受け保護者「調査に瑕疵」,https://news.yahoo.co.jp/articles/a72487f3b0858e38802b37a4f69ecb36184b9852,7/30(火) 20:34
bbt,富山テレビ,ネット銀行の口座開設勧める手口…高齢女性が2千万円余りの詐欺被害 届いたキャッシュカード使い振り込む,https://news.yahoo.co.jp/articles/564a895d94f7a106e5f4d0c5c00dd08c7abd2cf9,7/30(火) 20:32
bbt,富山テレビ,京都で不安根強く7年以上未着工…「小浜-京都か米原か」北陸新幹線ルート問題再燃 整備の先行き見通せず,https://news.yahoo.co.jp/articles/2940a685291b2abd9e5d63309de657853279b2c1,7/30(火) 20:30
bbt,富山テレビ,密着取材『富山湾すしレンジャー』美味しい寿司のヒミツを探りながら“海への理解”を深める　富山,https://news.yahoo.co.jp/articles/14a51000fca8b2e96be1ede1ddfc27bac2281b52,7/30(火) 20:26
bbt,富山テレビ,夏の甲子園出場の富山商業が活躍誓う「県の高校野球の歴史を変えたいという思いを甲子園で」　富山,https://news.yahoo.co.jp/articles/08856c478a010217d1ce6244acc80cfa336021dd,7/30(火) 20:24
bbt,富山テレビ,北陸銀行が個人情報7423件記載書類紛失『預金通帳等をなくした際の届け出記録』誤って破棄の可能性高い,https://news.yahoo.co.jp/articles/14c58da75a3ec368898bdaafd7d7583e9b7d7c89,7/30(火) 20:14
bbt,富山テレビ,人口減少が重要課題に…富山県の成長戦略会議で県に関わる“関係人口”拡大の方策議論 9月下旬に提言予定,https://news.yahoo.co.jp/articles/a9d6efea6f64307b79dbde7182d7f5fd38041d78,7/30(火) 20:11
bbt,富山テレビ,富山県水墨美術館企画展“没後100年・富岡鉄斎”…旅と友人を大切にし枠組にとらわれない作風を生み出す,https://news.yahoo.co.jp/articles/c5aab13e675ee4c404a7ba357909487cd5289efd,7/30(火) 20:09
bbt,富山テレビ,バドの“ホキコバペア”『五輪初勝利』1次リーグ2戦目で米にストレート勝ち…次戦は世界ランク9位の中国,https://news.yahoo.co.jp/articles/0d6ca8d12b071cac3a5526e7adb81e35d3d76081,7/30(火) 12:40
bbt,富山テレビ,パリ五輪女子7人制ラグビー魚津市出身田中が大会初トライを決めブラジルに勝利…リーグ戦3位で決定戦へ,https://news.yahoo.co.jp/articles/c419078c0176622fed4ac212455996ebd71df8ab,7/30(火) 12:38
bbt,富山テレビ,夜にかけ雷伴い激しい雨も…1時間降水量多い所で30ミリ予想　立山町に土砂災害に関する大雨警報　富山,https://news.yahoo.co.jp/articles/aeb6d9b546defb02c4a7da903ab7bf5609549be8,7/30(火) 12:37
bbt,富山テレビ,パリ五輪が開幕！『富山県勢は7競技10人出場』…“セーヌ川舞台”の開会式に稲場・田中・中山の姿も,https://news.yahoo.co.jp/articles/b6ece341a65c9917fc8f389798766a30ab1c3694,7/29(月) 20:15
bbt,富山テレビ,パリ五輪バスケ…富山市出身NBAプレーヤー八村塁がチーム最多得点の活躍見せるも日本は初戦黒星スタート,https://news.yahoo.co.jp/articles/c6bd821c419161b59b5f1aa9c2d91d03fcf6c27f,7/29(月) 20:10
bbt,富山テレビ,五輪ハンド男子…『氷見市出身安平光佑は初戦クロアチア戦チーム初得点・第2戦はドイツと』チームは2連敗,https://news.yahoo.co.jp/articles/ab23cd5e0d1e45e4d29586d948d11941903a8b46,7/29(月) 20:06
bbt,富山テレビ,パリ五輪バドミントン男子ダブルス…“ホキコバペア”は初戦で台湾ペアに敗れ黒星スタート,https://news.yahoo.co.jp/articles/5e4a44d398f93643a8b3a891c0faa47b247dbb08,7/29(月) 20:03
bbt,富山テレビ,五輪7人制ラグビー女子に『魚津出身の田中笑伊』が出場…チームはアメリカ続くフランスに大差で敗れる,https://news.yahoo.co.jp/articles/025ffcd7787c75365952ba5cbc1ad7d699c2767a,7/29(月) 20:01
bbt,富山テレビ,水球は富山市出身稲場悠介がチーム最多6得点と活躍も五輪2連覇のセルビアに敗れる『五輪今後の予定は…』,https://news.yahoo.co.jp/articles/1a129204359af02837b98f971e101f8b63a89422,7/29(月) 19:59
bbt,富山テレビ,「全国学力・学習状況調査」富山県内の児童・生徒は全教科で全国平均以上の正答率 中学生の国語は3位に,https://news.yahoo.co.jp/articles/81b86a2be36d911e1d617a5f58ac49b577a1bf81,7/29(月) 19:57
bbt,富山テレビ,JRから移管の城端・氷見線の”新車両”方向性まとまる…運行実績ある『電気式気動車』など,https://news.yahoo.co.jp/articles/1c1a60ea2fb12ced2f3a47db7b45b6337425ae6c,7/29(月) 19:55
bbt,富山テレビ,31日オープン『KITTE大阪』に北陸3県のアンテナショップ“HOKURIKU+” 日本酒バー備える,https://news.yahoo.co.jp/articles/d5d311911698851739d8507015ecca537274e1d8,7/29(月) 19:51
bbt,富山テレビ,「共感を生む発信が大切」“若い世代に選ばれる企業”目指し経営者や採用担当者対象にセミナー,https://news.yahoo.co.jp/articles/2beb55db889e93ee64725a66af59157b681e66a9,7/29(月) 19:49
bbt,富山テレビ,ベトナム等の労働団体関係者が連合富山で雇用や労働環境について意見交換 工場や職業訓練施設の視察も予定,https://news.yahoo.co.jp/articles/edf5e37992901532a49533108af3ea37b10f0ea0,7/29(月) 19:43
bbt,富山テレビ,『富山映像タイムトラベル』300年以上続く“ねつおくり”そして“七夕まつり”を時間旅行　南砺市福光,https://news.yahoo.co.jp/articles/06b45de8eac071554fe4d03af00eff32b34baa88,7/29(月) 19:41
bbt,富山テレビ,富山県水墨美術館企画展“没後100年・富岡鉄斎”…「自分は画家ではなく学者だ」と言い続けた思いは,https://news.yahoo.co.jp/articles/35e3fe54044e6fd6b7f73a5f0a356c4bb60c97ba,7/29(月) 19:38
bbt,富山テレビ,地元から応援も2大会連続メダル獲得はならず…パリ五輪スケートボードで中山楓奈（富山市出身）は7位,https://news.yahoo.co.jp/articles/62a397f77ccebb48010cf63539ce11e6e02bad92,7/29(月) 12:57
bbt,富山テレビ,五輪デビュー戦を勝利で飾る…バドミントン女子シングルス予選ラウンドで大堀彩（トナミ運輸）が初戦勝利,https://news.yahoo.co.jp/articles/8548553320f391f55a643c6fb1fa7a2cf6f30b28,7/29(月) 12:55
bbt,富山テレビ,焼け跡から遺体発見…富山県黒部市で住宅火災 1棟が全焼とみられ隣家も焼損 火元の家の74歳男性が不明,https://news.yahoo.co.jp/articles/ea4885a41af717b15c9bd216ff9a3fd931145018,7/29(月) 12:51
bbt,富山テレビ,7/29は「世界トラの日」…絶滅危惧種アムールトラを飼育員が紹介するイベント 富山市ファミリーパーク,https://news.yahoo.co.jp/articles/36536ef42275adf60d6c04af78f754ad3f1aca3c,7/28(日) 18:25
bbt,富山テレビ,J3カターレ富山が今季初の3連勝 AC長野パルセイロに2対0で勝利 与えたPKを田川がファインセーブ,https://news.yahoo.co.jp/articles/d8c0e28efb0cdf38f4e63a49f0c0d66c85879c48,7/28(日) 12:45
bbt,富山テレビ,富山大学工学部と同窓会「仰岳会」が今年で80周年迎え記念式典 卒業生は大学院合わせ2万3千人余りに,https://news.yahoo.co.jp/articles/4b9337bb886c5981e632f540d9d5699d157f9411,7/27(土) 18:08
bbt,富山テレビ,2年連続18回目…夏の高校野球富山大会決勝 富山商業が富山北部を逆転で破り甲子園へ 8回に一挙4得点,https://news.yahoo.co.jp/articles/f8294a2429c40422204d9e65c732b66469afeb72,7/27(土) 18:07
