media_en,media_jp,title_articles,link_articles,date_original
travelv,トラベルボイス,日本旅行業協会、インバウンド受入拡大へ観光事業者や自治体に意識調査、復興へのロードマップ策定へ,https://news.yahoo.co.jp/articles/e710acea22338790abc928a623d64cc74509bfbc,8/2(水) 13:01
travelv,トラベルボイス,立教大学の学生が夏のホテル運営、長野県・白馬で宿泊プラン企画から接遇まで、新たなインターンシップ展開,https://news.yahoo.co.jp/articles/e10b3a2fa0538c26d452a217552114d67a54a601,8/1(火) 13:20
travelv,トラベルボイス,JR西日本、AIが倉敷のおすすめルートを提案する新サービス、北陸・せとうち観光ナビで,https://news.yahoo.co.jp/articles/29caba8c91a747f0e9ded1825769c3d2ee7dced3,8/1(火) 13:10
travelv,トラベルボイス,ANA井上社長に聞いてきた、注力する戦略から海外旅行の回復の見通しまで,https://news.yahoo.co.jp/articles/ffe5b5fe231a2e2e5971191b6ce3bb2e7ef1cde7,8/1(火) 13:01
travelv,トラベルボイス,ANA、国際線の運航拡大で大幅な増収増益、インバウンド旅客数が好調　―2024年3月期第1四半期,https://news.yahoo.co.jp/articles/6f8bf24aee042b648dce84ddb2b651320a2737b8,7/31(月) 13:30
travelv,トラベルボイス,マリオット、2023年夏は国内ホテルで音楽イベント、有名アーティストが登場、サマソニへの協賛も,https://news.yahoo.co.jp/articles/22536a67ea4b364b884176ffd8a23286bc76f800,7/31(月) 13:20
travelv,トラベルボイス,シンガポール政府観光局、9月開催のF1グランプリで体験コンテンツを提供、持続可能なイベント運営で協力,https://news.yahoo.co.jp/articles/0439726eb9ec50a696c9d4ebdd72bf4725f6908b,7/31(月) 13:10
travelv,トラベルボイス,オーバーツーリズムで今年訪れるのを「避けるべき場所」と指定された米国タホ湖、観光収入か環境保全か、観光関係者に広がる波紋,https://news.yahoo.co.jp/articles/451f50d2d5fb6724354df15a56c72b377c4f7595,7/31(月) 13:00
travelv,トラベルボイス,国交省、サウジアラビア、アラブ首長国連邦と観光分野で連携、持続可能な観光開発やデジタル変革など,https://news.yahoo.co.jp/articles/a3893542b2e38f7c172bb17c16e392c2f4127f68,7/28(金) 13:20
travelv,トラベルボイス,旅行テックの新潮流、交通ライドシェアからタビナカ体験、地域マネジメントまで、観光×デジタルのスタートアップ企業を取材した ー WiT Japan 2023,https://news.yahoo.co.jp/articles/12660569ad9925ee5c54dfbb618b0f2d53acd711,7/28(金) 13:10
travelv,トラベルボイス,日本政府観光局がインバウンド回復の動向を分析、課題は航空直行便の復活と地方誘客、3つの柱でマーケティング推進,https://news.yahoo.co.jp/articles/44a8700f9bf8ee41e26b5fffcb7e80d8ca7b4779,7/28(金) 13:01
travelv,トラベルボイス,山梨県・河口湖駅前で、電動キックボードのレンタル開始、対面で貸出し、インバウンド急増に対応,https://news.yahoo.co.jp/articles/d4ce5c7c930285261e38464dee60cf611ba1546a,7/27(木) 13:30
travelv,トラベルボイス,若年層のテレビ離れ、動画配信へのシフトが浮き彫りに、一方で「スポーツ」はコミュニケーション重視でテレビで視聴,https://news.yahoo.co.jp/articles/125c8363bbe6e42a940d43c10a497b87a2752de9,7/27(木) 13:20
travelv,トラベルボイス,パリ五輪まで1年、市内の宿泊料金が上昇、今年14万円の客室が来年は45万円の例も,https://news.yahoo.co.jp/articles/0ca4b3016cca4540a173c86392aff4a610a810ee,7/27(木) 13:10
travelv,トラベルボイス,北海道の地元事業者が挑む「アドベンチャーツーリズム」、世界に売り込む準備と課題、見据える未来を聞いてきた,https://news.yahoo.co.jp/articles/cdff5a6a0716c4aee7a53fb30b2978a672b8ae2d,7/27(木) 13:01
travelv,トラベルボイス,クラブツーリズム、テレ東「路線バス乗り継ぎの旅」をリアル体験するツアー、番組関係者が企画から参画,https://news.yahoo.co.jp/articles/c2cbc734eb42ddb644ba744bd2f78acbd8af1f39,7/26(水) 13:20
travelv,トラベルボイス,スペイン・マドリードが富裕層誘致に参戦、高級ホテルが続々誕生、収益性の高い観光ビジネスを模索,https://news.yahoo.co.jp/articles/d7f0a2e3f551ccf8ba0eb35139a1f281bd855995,7/26(水) 13:10
travelv,トラベルボイス,アムステルダム市議会、大型クルーズ船の寄港の禁止を決議、観光客削減と大気汚染緩和を目指して,https://news.yahoo.co.jp/articles/b18d9758be9d6e5b98c6a401ba7ce1970bf2ce65,7/26(水) 13:00
travelv,トラベルボイス,和歌山県観光連盟、世界遺産・高野山の二大聖地のひとつ「壇上伽藍」をデジタル再現、僧侶の祈祷や内部撮影、解説付きで,https://news.yahoo.co.jp/articles/9bf04e7811b076b181b0f6a913647c55c1702fef,7/25(火) 13:20
travelv,トラベルボイス,アリババ系の旅行予約「フリギー」の戦略責任者に聞いてきた、中国人旅行者が求めている最新トレンド,https://news.yahoo.co.jp/articles/e82c0817b12d16d5e4958d535ef05b72464b3edd,7/25(火) 13:10
travelv,トラベルボイス,Trip.com、みずほ銀行と戦略的提携、マーケティング活動を共同展開へ,https://news.yahoo.co.jp/articles/fabd817e9b31b559ecbcf3606dfde636ac626e98,7/25(火) 13:00
travelv,トラベルボイス,HISと徳間書店、「作家と旅する物語」ツアーを企画、徳川家康の軌跡めぐり、1泊2日で,https://news.yahoo.co.jp/articles/ef128faa6a20d9bd946efdbd461a84555452893a,7/24(月) 13:20
travelv,トラベルボイス,観光テーマが多様化傾向、ニッチ扱いだった「地形」「昭和レトロ」「廃墟」などに関心、メタ観光推進機構が調査,https://news.yahoo.co.jp/articles/ab591f903eaf30fff936a3e85e370fa08c4cc5b0,7/24(月) 13:10
travelv,トラベルボイス,北海道観光振興機構トップに聞いてきた、就任後に推進した組織改革から、札幌五輪の誘致、「アドベンチャートラベル」への期待まで,https://news.yahoo.co.jp/articles/f6e544282c8caf5f1fbd21b315c0caf0511583d1,7/24(月) 13:00
travelv,トラベルボイス,愛媛県大洲市の分散型ホテルが拡張、新たに4棟4室を開業、歴史的建造物を再生、合計26棟31室に,https://news.yahoo.co.jp/articles/7e9789ba7e48d5098513c2087160d307999e0683,7/21(金) 13:20
travelv,トラベルボイス,JAL、都道府県をモチーフにしたNFT販売、第一弾は北海道や東京などの5都市、コンプリート特典も用意,https://news.yahoo.co.jp/articles/ec42bd10b4e700dbdcb47af2a060bf7698943c86,7/21(金) 13:10
travelv,トラベルボイス,トリップアドバイザー、生成AI搭載の「旅行計画ツール」発表、10億件超えるクチコミを活用、タビナカ体験の保存も可能に,https://news.yahoo.co.jp/articles/006ddd68ac0a8e623e95bd03ec005bf45d4bcb3c,7/21(金) 13:01
travelv,トラベルボイス,沖縄本島にヘリコプターバス、空港／沖縄北部を30分で移動、クラウドファンディングで先行販売,https://news.yahoo.co.jp/articles/be9857118000d6b12d46a3bee50c88b68cb825c4,7/20(木) 13:20
travelv,トラベルボイス,東南アジアで存在感増すインド人旅行者、訪問者数が急回復、観光産業を支える「第2の中国」になる可能性も,https://news.yahoo.co.jp/articles/e7200966f336fa0e9ccfdb341cd3aa4bab3ee3fe,7/20(木) 13:10
travelv,トラベルボイス,続く酷暑で欧州の旅行トレンドは変わるか？　季節の分散化や、涼しい旅先の人気が高まる可能性,https://news.yahoo.co.jp/articles/55c1ac328acd1f2a99d550d3b74086930db638e3,7/20(木) 13:00
travelv,トラベルボイス,日本人出国者数、6月は70万人、コロナ前の54％減、主要6空港からの出発便数は7割まで回復　−日本政府観光局（速報）,https://news.yahoo.co.jp/articles/a8d0e6a23a60cf25610be57e87330dc1dd99c8e5,7/19(水) 18:20
travelv,トラベルボイス,訪日外国人数、2023年6月は200万人を突破、上半期で1000万人超え、米国人旅行者が大幅増加　−日本政府観光局（速報）,https://news.yahoo.co.jp/articles/56bab54f4934c3faadb6da42ff6a840514dd5d78,7/19(水) 18:16
travelv,トラベルボイス,JALサイトの空席検索の結果にグループLCC2社を表示、リンクを表示、7月下旬以降から,https://news.yahoo.co.jp/articles/dd02b599da53a30050ccdbae35a1837f64653465,7/19(水) 13:20
travelv,トラベルボイス,レジャー白書2023（速報版）、「仕事より余暇を重視」は年々増加で64％に、2022年の余暇参加トップは国内旅行が首位に返り咲き,https://news.yahoo.co.jp/articles/dc06387977edd508cc7d972549b62615f6d36ea8,7/19(水) 13:10
travelv,トラベルボイス,茨城県水戸市でのプロバスケ・オールスターゲーム開催の社会的価値を10億円と試算、ウェルビーイングが最大の価値に、EY社らが試算,https://news.yahoo.co.jp/articles/777479a62a01fd1d8c86c564fdf2f9650f3825b7,7/19(水) 13:01
travelv,トラベルボイス,伊勢志摩の大型リゾートに200台分の車中泊スペース、VISONと「カーステイ」が連携、宿泊施設不足の代替として,https://news.yahoo.co.jp/articles/4c74469e6408019b6a564ea0fe278ef79a2d8dff,7/18(火) 13:20
travelv,トラベルボイス,インドネシア・バリ島、1人10ドルの入島税を徴収へ、州知事「地元文化を尊重する旅行者が訪れる旅先に」,https://news.yahoo.co.jp/articles/cad4f74b01eea9498b9031738d881f0ed9addbeb,7/18(火) 13:10
travelv,トラベルボイス,欧州の人気都市でオーバーツーリズムが再燃か、米国人旅行者の「リベンジ旅行」で、市民生活にも影響,https://news.yahoo.co.jp/articles/5c1a5197dad180e64d2070025aa1fcbf5bc501d7,7/18(火) 13:00
travelv,トラベルボイス,民泊エアビーと三菱地所が協業、第1弾は「次世代レジデンス」、月単位の賃貸と日割り民泊のハイブリッド物件,https://news.yahoo.co.jp/articles/857a6e752bb84474c3f94ac691778df228eec3e6,7/14(金) 13:20
travelv,トラベルボイス,山口県美祢市、デジタル住民票NFTを販売、観光名所の入場無料などの特典、関係人口の創出へ,https://news.yahoo.co.jp/articles/93ba38a7bf76142465dc84d93753b8d3c623aefb,7/14(金) 13:10
travelv,トラベルボイス,都道府県の「観光」満足度ランキング2023、総合1位は大分県、「地元の人」は沖縄県がトップ、「食」は石川県が1位に返り咲き,https://news.yahoo.co.jp/articles/3946360babb5962f9d4e8038b7269e1e207a2a21,7/14(金) 13:00
travelv,トラベルボイス,LINEでタクシー配車が可能に、友だち追加で「今から呼ぶ」「日時指定」を選択、8月から本格提供,https://news.yahoo.co.jp/articles/160917129851b9247ad8dbf233a2327e3849dd97,7/13(木) 13:30
travelv,トラベルボイス,北海道で開催される「アドベンチャートラベル」の世界大会、誘致までの道のりと、世界のバイヤー受入れの舞台裏を道庁で聞いてきた,https://news.yahoo.co.jp/articles/4b821691852e52fbff7f62d675601739f7f88965,7/13(木) 13:20
travelv,トラベルボイス,サステナブル旅行を重要視する日本人旅行者が高水準に、一方で「追加料金をいとわない」は22%止まり、世界と大きな差,https://news.yahoo.co.jp/articles/f3d369649c29be5db040785c45ee0cce5384ac1a,7/13(木) 13:10
travelv,トラベルボイス,東京湾アクアライン、混雑緩和に向けて料金変動制を導入、土日・祝日の上り線の特定時間帯で,https://news.yahoo.co.jp/articles/6cf03c8d209cf0cee929518aa87cc8944277cd93,7/13(木) 13:00
travelv,トラベルボイス,女性限定の「スナック初心者入門体験」、若い女性の需要増を受けて、スナックの楽しみ方や作法を伝授,https://news.yahoo.co.jp/articles/17cc6d0fe53b055861590b82f0a8053a34dc90ed,7/12(水) 13:20
travelv,トラベルボイス,世界のLGBTQ+旅行者、旅行先選びで「安全」考慮は8割、支援ない旅先のキャンセル経験は4割,https://news.yahoo.co.jp/articles/d9fba5daaddada34ca29f35cb126fc108991f2f7,7/12(水) 13:10
travelv,トラベルボイス,アマゾンの会員向け期間限定バーゲン「プライムデー」で、旅行の割引セールも本格化、アメリカ・ドイツ・オーストラリアなど,https://news.yahoo.co.jp/articles/e197e3cb63ee61452f9899d5483eff4809c93553,7/12(水) 13:00
travelv,トラベルボイス,北陸3県を自転車でめぐるスタンプラリー、広域周遊観光を促進、ナビタイムのアプリで全240スポットを配信,https://news.yahoo.co.jp/articles/0a36d9111d92babc4cae5d6b352827be580893c8,7/11(火) 13:20
travelv,トラベルボイス,中央日本の4県が、徳川家康ゆかりの「金山」つなぐ新たな観光ルート、御朱印や高速料金の定額プランなど提供,https://news.yahoo.co.jp/articles/5766d5454f79a8cdd96bcebcb2933fd7fb40179a,7/11(火) 13:10
travelv,トラベルボイス,京都市東山区、「お試し居住」を実施、滞在・生活体験を通じて移住促進、テレワーク環境も用意,https://news.yahoo.co.jp/articles/45f280eb71ed84255ec4355e9902d0e9808b0be3,7/11(火) 13:00
travelv,トラベルボイス,ANA、羽田空港の国内線ラウンジを刷新、100席増設、防音個室ブース8台も正式導入,https://news.yahoo.co.jp/articles/0e0b54927d68b2ee545655690a523ca389132a59,7/10(月) 13:20
travelv,トラベルボイス,新たな世界最大級客船「ユートピア・オブ・ザ・シーズ」の概要発表、乗員乗客8000名規模で2024年デビュー,https://news.yahoo.co.jp/articles/dc16e365bdcf5e6f6f181b421870268f7cf14822,7/10(月) 13:10
travelv,トラベルボイス,日本旅行業協会、「観光産業共通プラットフォーム」で災害時の訓練実施、本稼働に向けて、事務局設置で運用支援も,https://news.yahoo.co.jp/articles/360702d820469b5f86ec57372d81fe42c9cb1c93,7/10(月) 13:01
travelv,トラベルボイス,民泊エアビー、日本のホテルない地域での経済効果を公表、ホスト収入は7.5億円、ゲスト数は6.7万人,https://news.yahoo.co.jp/articles/39effcea6c37c3201ad509ab7e2d78afe217a8e8,7/7(金) 13:20
travelv,トラベルボイス,京都市のホテル客室単価が前年比4割増に上昇、外国人宿泊数がコロナ前を大幅超え、旅館への宿泊も増加 ―2023年5月,https://news.yahoo.co.jp/articles/372cb9b54cb5f1bd51bbeb9d5f67bd8b90b12909,7/7(金) 13:10
travelv,トラベルボイス,JR東日本が推進するシェアオフィス事業、誕生の背景から今後の展開まで、開発担当者に聞いてきた,https://news.yahoo.co.jp/articles/b9b097b3178c520620701e69b985c7e6bba79f9a,7/7(金) 13:00
travelv,トラベルボイス,宿泊・観光DXのTabist（タビスト）社、10.5億円の資金調達を実施、商品開発や営業体制の強化へ,https://news.yahoo.co.jp/articles/8dbd48e62d4d6b7ef4f22174b11a7be934887ce7,7/6(木) 13:20
travelv,トラベルボイス,HIS、夏休みの予約動向を発表、海外旅行がコロナ前の53％まで改善、ツアー比率は4割、韓国が急回復,https://news.yahoo.co.jp/articles/5864885565dd32af99054f6b08f6647774edab68,7/6(木) 13:10
travelv,トラベルボイス,多拠点居住サブスク利用者にワークプレイスも提供、法人プランとして販売、福利厚生や旅先テレワーク,https://news.yahoo.co.jp/articles/aa00f63460754d9fe319e6d82c22267d292cd8f4,7/6(木) 13:00
travelv,トラベルボイス,若年層の「サステナブル観光」への意識、意義を知ることで意欲向上、「責任ある旅行者」にも共感高く,https://news.yahoo.co.jp/articles/bc1656a1b51e4d7352d3155679998831a1353453,7/5(水) 13:20
travelv,トラベルボイス,富士山麓の文化財家屋が一棟貸し「岳麓翠苑」として開業、宿泊は1日1組限定、ガイド付きオーダーメイドツアーも,https://news.yahoo.co.jp/articles/066b831cb94b4d34709e3f9c766f8ab7fda04536,7/5(水) 13:10
travelv,トラベルボイス,沖縄県への観光客数、2023年6月以降は国内客がコロナ前に回復も、インバウンドは国際線再開の遅れで低迷続く予測,https://news.yahoo.co.jp/articles/6620f7134eb3548567665188d67e915148605cd5,7/4(火) 13:20
travelv,トラベルボイス,米国の航空会社、今夏の旅客数は過去最高の見通し、夏の旅行需要増加で株価も上昇、一方で下半期は鈍化の予想も,https://news.yahoo.co.jp/articles/f4295f15dcea208c73ca1623014bdddd40a72d12,7/4(火) 13:10
travelv,トラベルボイス,広島平和記念公園とハワイ・パールハーバー国立記念公園が「姉妹公園」に、和解の場として交流拡大の機会に,https://news.yahoo.co.jp/articles/cfa4991d03b4d694a5dd063bea189365fd44aaa5,7/4(火) 13:00
travelv,トラベルボイス,沖縄県への観光客数、2023年6月以降は国内客がコロナ前に回復も、インバウンドは国際線再開の遅れで低迷続く予測,https://news.yahoo.co.jp/articles/73dd52178ad2ad55e5b710017b6701f3070409ee,7/3(月) 13:30
travelv,トラベルボイス,アマゾンで「手ぶらキャンプ」セット販売、初心者へのアドバイスや、道具一式を1泊2日レンタル、スノーピークが販路開拓へ,https://news.yahoo.co.jp/articles/83576a57098565b2fa4eb81da935757eea07073f,7/3(月) 13:20
travelv,トラベルボイス,中国本土で、外国人旅行者向けにクレジットカード決済が容易に、国内決済サービス大手2社がビザ、マスターカードと連携開始,https://news.yahoo.co.jp/articles/32347ee82f9c240ec10a979a33266aff4bddceaf,7/3(月) 13:10
travelv,トラベルボイス,新潟県・南魚沼市観光協会、夏のファミリー向けツアー、川遊びから野菜収穫まで、グリーンシーズンの体験型滞在,https://news.yahoo.co.jp/articles/096b4d58aa9f118f7084f0447c349e751eda294d,7/3(月) 13:01
travelv,トラベルボイス,韓国のLCCエアロk航空、関西／清州線に新規就航、7月6日から1日2便,https://news.yahoo.co.jp/articles/82aa6d4fa4c01a779ec51aea1e00b387a97aa593,6/30(金) 13:10
travelv,トラベルボイス,ブッキング・ドットコム、チャットGPT搭載の旅行計画ツールを提供開始、宿泊予約機能と直接統合、まずは米国で,https://news.yahoo.co.jp/articles/37af5f899ea94f19b4c217973db4a88b82e29dd7,6/30(金) 13:01
travelv,トラベルボイス,HISチャーターのクルーズで近距離モビリティを試乗・レンタル可能に、本社営業所に販売デスクも、WHILL社と協業,https://news.yahoo.co.jp/articles/1c60c84c87976dd747947f4a93e57521ae5947b6,6/29(木) 13:20
travelv,トラベルボイス,日本財団、「旅するボランティア」募集、25歳以下限定で、若者と地域をつなぐ、旅費は無料,https://news.yahoo.co.jp/articles/ee2dd0c71287f5b2c609273a18fdfa9ee44126ef,6/29(木) 13:10
travelv,トラベルボイス,訪日中国人客のトレンドは「こだわり持つ個人」に大きく変化、受入れ旅行会社団体が急増時への備えを呼びかけ,https://news.yahoo.co.jp/articles/3b5f05306802eee6cd24773d8d4e842cab0979c5,6/29(木) 13:01
travelv,トラベルボイス,駐車場予約アプリ「akippa」とDeNA、Jリーグ観戦客を街に回遊させる実証実験、豊田スタジアムで,https://news.yahoo.co.jp/articles/901c25ac3f60dbbdf361afdcc3de9ebb16a428ac,6/28(水) 13:20
travelv,トラベルボイス,北海道で加速する観光の高付加価値化、道庁の観光政策責任者に、新たなガイド制度も創設から成長への施策まで聞いてきた,https://news.yahoo.co.jp/articles/ee030b6c040071dc6d2cc9056449262d28c5b061,6/28(水) 13:10
travelv,トラベルボイス,新潟市、佐渡市の会員制度と連携で周遊促進へ、会員向けにバス1日乗車券や割引クーポン,https://news.yahoo.co.jp/articles/831afd9b5cc6b003736b312fe8018113f888a109,6/28(水) 13:01
travelv,トラベルボイス,ユナイテッド航空、遅延・欠航時の旅客サポートを強化、アプリ上で再予約、クーポン発行などを自動表示,https://news.yahoo.co.jp/articles/fd00af61b0d81265dcdc74250ea753a6661cdb5e,6/27(火) 13:20
travelv,トラベルボイス,世界の旅行者が選ぶタビナカ体験のランキング2023、日本のトップは「東京自転車ツアー」、ガイドツアーが人気,https://news.yahoo.co.jp/articles/43594162e46d6f7416fb4d895374ea6f195c4e96,6/27(火) 13:10
travelv,トラベルボイス,デジタルノマドに選ばれる世界都市ランキング、1位はメルボルン、東京は6位、旅先テレワーク拠点としての魅力を比較,https://news.yahoo.co.jp/articles/a339b238249af08fcbea3e4f9642f0379795ebdc,6/27(火) 13:01
travelv,トラベルボイス,スノーピーク、米ユタ州のリゾート地とパートナーシップ締結、アウトドア拠点や体験コンテンツを開発へ,https://news.yahoo.co.jp/articles/256cd6af922b34a09a3e906c660d3ec0f4f92807,6/26(月) 13:20
travelv,トラベルボイス,観光庁、国際競争力の高いスノーリゾート形成促進へ、14地域を選定、夏コンテンツの開発支援など,https://news.yahoo.co.jp/articles/b136c1820414f1a674376ddc8b81ddd29a51b52c,6/26(月) 13:10
travelv,トラベルボイス,カナダ南ケベックの知られざる魅力とは？　地元で愛される食、土地に根ざした文化を体験取材した,https://news.yahoo.co.jp/articles/8563aec6473c6505d30515222bd65235c4bb9703,6/26(月) 13:00
travelv,トラベルボイス,東京から「立山黒部アルペンルート」最高地点を結ぶ直通バス、都内を夜出発、標高2500メートルの室堂に翌朝着,https://news.yahoo.co.jp/articles/87fb1079d687d3619b073e46a74e403a78bc6f53,6/23(金) 13:20
travelv,トラベルボイス,キャセイ航空、1 万2000人に航空券が当たるキャンペーン、6月26日から受付開始、条件はマイレージ会員,https://news.yahoo.co.jp/articles/92fe41beb3e22e0f248457742c4d6f047daee3dc,6/23(金) 13:10
travelv,トラベルボイス,米国で1日の空港利用者が過去最高に、今夏は旺盛な需要で過去最高2.6億人と予想、一方で混雑空港の管制官不足は未解決,https://news.yahoo.co.jp/articles/f25085ed14a34b53e4dc21191729b945cb86b355,6/23(金) 13:01
travelv,トラベルボイス,観光庁、歴史的資源を活用した「観光まちづくり」で23地域を採択、比叡山延暦寺や平戸アルベルコディフーゾなど,https://news.yahoo.co.jp/articles/a53298cd2521ab9e11dc3fa8b30f579b2a2e1098,6/22(木) 13:30
travelv,トラベルボイス,活況を呈するインドの航空業界、ライバル2社が合計1000機の新型航空機を発注、一方で規制によるリスクも 【外電】,https://news.yahoo.co.jp/articles/f9f6f1f8ff4a36811a4efe81600a9239a74e9898,6/22(木) 13:20
travelv,トラベルボイス,格付け会社の航空会社ランキング2023、総合1位はシンガポール航空、ANAは3位、JALは5位にランクアップ,https://news.yahoo.co.jp/articles/495778373400bca7ca06130d2734d84622e9a390,6/22(木) 13:10
travelv,トラベルボイス,三重県の真珠養殖場を再生した高級リゾートが開業、地元住民との交流など地域ならではの体験を提供,https://news.yahoo.co.jp/articles/683744d5291f498739600688193b07f1cedfb8f4,6/22(木) 13:00
travelv,トラベルボイス,訪日外国人数、5月は190万人、中国市場は5位、コロナ前超えが8市場に　−日本政府観光局（速報）,https://news.yahoo.co.jp/articles/87158481449922cb5e7a932170a8f99579cad223,6/21(水) 18:05
travelv,トラベルボイス,日本人出国者数、5月は68万人、2019年の半数、国際便は7割まで回復　−日本政府観光局（速報）,https://news.yahoo.co.jp/articles/20db45d15e36517c7e69edc3cfc966f181dba569,6/21(水) 17:52
travelv,トラベルボイス,豪ケアンズ観光局、専用サイト「ケアンズで旅育」を公開、親子で楽しむサステナブル旅行の情報提供,https://news.yahoo.co.jp/articles/73a7959241c31ed8ee93d8979590e696af9a745b,6/21(水) 13:20
travelv,トラベルボイス,大阪観光局、タビナカ予約から決済まで可能な観光アプリの提供開始、データ蓄積・分析へ、今後は顔認証決済の導入も,https://news.yahoo.co.jp/articles/cff44abcb3845efe7fdb11eaf637565a2d94a42c,6/21(水) 13:10
travelv,トラベルボイス,ニュージーランド、観光局がサッカー女子W杯に向けて観光動画、日本戦はウェリントンなどで3試合,https://news.yahoo.co.jp/articles/c20276e3c68ea8444fe06ae4208958cd5dbd8511,6/21(水) 13:00
