media_en,media_jp,title_articles,link_articles,date_original
travelv,トラベルボイス,ANA、売上高と営業利益が過去最高に、株式配当も復活、国際線で高い利益率　―2023年度上半期,https://news.yahoo.co.jp/articles/354fda4791ced8b14c51772d1a7bc43fc6938aff,11/1(水) 13:00
travelv,トラベルボイス,鳥取砂丘に高級ホテルが開業へ、2026年にマリオットの上級ブランドで、全108室で露天風呂付き客室も,https://news.yahoo.co.jp/articles/edcdcfe34dc677b2a1f527eb1c8f191777b9a7e7,10/31(火) 13:20
travelv,トラベルボイス,東京ディズニー、レストランでモバイル注文できる新サービス、まずは4店舗で開始,https://news.yahoo.co.jp/articles/06e95efe17f4f0acedb0a43abef63620f9c9bab8,10/31(火) 13:10
travelv,トラベルボイス,JTB山北社長が語ったグループ戦略と未来、サステナビリティ経営から進化するAIへの対応まで聞いてきた,https://news.yahoo.co.jp/articles/6e98e80b13ee7132b9488f4551fe14989f8c99bd,10/31(火) 13:01
travelv,トラベルボイス,埼玉県小川町で探求型体験プログラム、生き物探しや堆肥用の落ち葉集め、野菜収穫など、関係人口の創出へ,https://news.yahoo.co.jp/articles/2925e3f92bdbd29eb4d0b98f358b7dc6533b9e2e,10/30(月) 13:20
travelv,トラベルボイス,デルタ航空、羽田／ホノルル線の運航開始　初便は利用率9割、毎日運航で,https://news.yahoo.co.jp/articles/9cd150fef954b159319909457d485cf3e907f451,10/30(月) 13:10
travelv,トラベルボイス,国際航空運送協会、完全デジタルIDによる搭乗テストを実施、搭乗者情報はすべてデジタルウォレットに,https://news.yahoo.co.jp/articles/0437acfc9763f3b2c38e43e933e3d6572fa132f8,10/30(月) 13:00
travelv,トラベルボイス,2023年版「世界の持続可能な観光地」100選、日本から10地域が選出、与論島や弟子屈町など,https://news.yahoo.co.jp/articles/c3dc9ae785ee9bf823a370bba893b0408774ec17,10/27(金) 14:20
travelv,トラベルボイス,タビマエに旅程を決める訪日旅行者は8割、タビナカで欲しい情報はタイミングで変化、JTB総研らが意識調査,https://news.yahoo.co.jp/articles/c03e83f1f9eb92f06544b678155113b7942fe8a3,10/27(金) 13:30
travelv,トラベルボイス,大井川鐵道、昭和レトロな「客レ」列車を運行、機関車が牽引、車内販売も実施、昭和の日常を追体験,https://news.yahoo.co.jp/articles/f8bb04e3f36893f18387d323ae17dbc2af42ac5e,10/27(金) 13:10
travelv,トラベルボイス,福島県、「アルツ磐梯」と「猫魔スキー場」がひとつに、リフト連結で移動時間を7分に短縮,https://news.yahoo.co.jp/articles/0ff182e850d5bbe7ee00de7918cdd36277957241,10/27(金) 13:00
travelv,トラベルボイス,欧州で導入検討中の新たな渡航承認プログラム、さらに開始が遅れる可能性、欧州観光委員会CEOが言及,https://news.yahoo.co.jp/articles/3c95aca4828763dfe34753ef06551223213899a6,10/26(木) 13:20
travelv,トラベルボイス,航空5社で「地域航空サービスアライアンス協議会」を設立、協業で安全運航や効率化,https://news.yahoo.co.jp/articles/803d37793c5cdfd4f9493e68f204d0b737f6210e,10/26(木) 13:10
travelv,トラベルボイス,欧州観光委員会、CEO来日で日本市場の回復に期待、ツーリズムEXPOには11カ国の観光局が出展,https://news.yahoo.co.jp/articles/e3353c0f9a2fd766e61084462eafcebf77dcfd44,10/26(木) 13:00
travelv,トラベルボイス,引退したバスに泊まる宿泊施設、西伊豆町に開業へ、案内所と路線バスを一体改修、1棟1台貸切で,https://news.yahoo.co.jp/articles/e2ce24509f4d1bed835bc6f3dcb541fc1a30cbf8,10/25(水) 13:30
travelv,トラベルボイス,アムステルダム市、来年から宿泊税を値上げ、12.5％に、オーバーツーリズム対策の一環で,https://news.yahoo.co.jp/articles/bda44379425d350900d1495354c316dc896f7bbb,10/25(水) 13:20
travelv,トラベルボイス,ハワイ、ラハイナ除くマウイ島西部で宿泊施設を全面再開、11月1日から、地元コミュニティとの協議で決定,https://news.yahoo.co.jp/articles/64b62446ca084e1b6ccd8e0f8cf2fd96c024214e,10/25(水) 13:10
travelv,トラベルボイス,来年始まる「観光税」導入に揺れるインドネシア・バリ島、最大の課題は交通混雑とゴミ処理,https://news.yahoo.co.jp/articles/ab2419f215dcf603b40e3121933f93da8fd3ebc7,10/25(水) 13:01
travelv,トラベルボイス,奈良県で「ガストロノミーツーリズム」推進、訪日客に「酒」や「食」テーマに新ツアー、英語ツールの制作も,https://news.yahoo.co.jp/articles/3faf09d16c1e533fe7476320acdc46cde964a418,10/24(火) 13:20
travelv,トラベルボイス,東京スカイツリー、修学旅行生向けにサステナブルな体験プログラム、東洋大学の学生と連携で企画,https://news.yahoo.co.jp/articles/6e3609b61fc03d3ce303406fc10ba4d53aa9efc3,10/24(火) 13:10
travelv,トラベルボイス,アドベンチャートラベルで挙がった「ガイドの英語」の課題、英語力そのものでなく、ストーリーの語りを ―日本政府観光局,https://news.yahoo.co.jp/articles/03a737e1ac80d1eba4d9eeb6e8b8e78ff6aa31c7,10/24(火) 13:01
travelv,トラベルボイス,日本観光振興協会とNEC、地域の観光DXの推進で連携協定、新たな観光販売プラットフォーム構築へ,https://news.yahoo.co.jp/articles/5ae28178c4a7e8e819e5f5ed452070d848cf4420,10/23(月) 13:20
travelv,トラベルボイス,JR西日本ホテルズ、滞在中の施設案内や朝食混雑状況などスマホ表示、QRコード読み取りで,https://news.yahoo.co.jp/articles/39019216a19d9fb783eb4d9cdb2d12a2979cb805,10/23(月) 13:10
travelv,トラベルボイス,クルーズ客船「ダイヤモンド・プリンセス」の船上体験を取材した、寄港地ツアーは高付加価値体験が人気,https://news.yahoo.co.jp/articles/ed05b08b0122d522b772ad4f137cd122a2e1f026,10/23(月) 13:00
travelv,トラベルボイス,JR東海、自転車を列車に持ち込める臨時列車を運行、イベント参加者限定のサイクリスト専用で,https://news.yahoo.co.jp/articles/7c1a44cb1d75d42f644592887f5a097af37f9c4f,10/20(金) 13:30
travelv,トラベルボイス,観光庁、「オーバーツーリズム対策パッケージ」を取りまとめ、地域と住民が協働した観光振興、観光客向けの乗合タクシーの導入など,https://news.yahoo.co.jp/articles/593a68a6d1985ad0c4ec9fa702dd8fc794c5f793,10/20(金) 13:20
travelv,トラベルボイス,今年の「世界遺産委員会」で注目すべき6つのポイント、「記憶の場」「危機遺産リスト」など、世界遺産アカデミー研究委員が解説,https://news.yahoo.co.jp/articles/11a4706686759932a06cea5108ccedbd1e5c106e,10/20(金) 13:10
travelv,トラベルボイス,世界の観光事業者が注目する「アイヌ文化」、ウポポイなど取材して、北海道観光のすそ野を広げる可能性を探ってみた,https://news.yahoo.co.jp/articles/c6fe9cf5ad604d01cf09eb679d19764cd7e791a7,10/20(金) 13:01
travelv,トラベルボイス,欧州委員会、若者に大陸横断の鉄道パスを無料配布、18歳の3万6000人に,https://news.yahoo.co.jp/articles/dff42a8107ead896c5542478ffdec7c821f2efe5,10/19(木) 13:30
travelv,トラベルボイス,ホテルグランヴィア京都、西陣織や清水焼など工房体験できる宿泊プラン、ハイヤー送迎付きで,https://news.yahoo.co.jp/articles/754467313e44d745b8b73fb1c5e40bc93a9ea961,10/19(木) 13:20
travelv,トラベルボイス,カンボジア、観光名所アンコールワットの玄関口になる新空港が開港、年間700万人の旅客に対応,https://news.yahoo.co.jp/articles/2cc3b3a9bfdc7270c8b786d97548335d6072976b,10/19(木) 13:10
travelv,トラベルボイス,訪日外国人の旅行消費額、2019年比17％増、トップは中国、1人あたり支出はフランス35.8万円　― 2023年7月〜9月（速報）,https://news.yahoo.co.jp/articles/c5de81271ca1b3832a296cc2c859fb645b3b3178,10/19(木) 13:01
travelv,トラベルボイス,国交省、ダムや道路などインフラを「観光資源」とする観光拡大へ、事例など紹介する手引き書を作成,https://news.yahoo.co.jp/articles/4bd9f4d654d3d197be6078a9be264db16041ff52,10/18(水) 13:20
travelv,トラベルボイス,関西エリアでNFT活用の周遊施策、校外の観光地や駅で、地域事業者が連携,https://news.yahoo.co.jp/articles/d26d755d4bd4b82ba598eb24abec6458aa741573,10/18(水) 13:10
travelv,トラベルボイス,米国の地方部で「民泊」がシェア拡大、要因は「旅先テレワーク」の浸透、一方、規制強化で供給減に【外電】,https://news.yahoo.co.jp/articles/04a8ac56912a81b874d2c49b753e3a88f96e942e,10/18(水) 13:00
travelv,トラベルボイス,旅行で日本の水産業を応援する動き、東京都は福島ツアーの割引支援、ホタテや毛ガニを北海道で食べるツアーなど,https://news.yahoo.co.jp/articles/45fb54ee88245e334a04025a371bfa6611fe1cc9,10/17(火) 13:20
travelv,トラベルボイス,世界の航空機で進む座席の二極化、上級クラスはプライバシー重視、エコノミーでは「高密度化」【外電】,https://news.yahoo.co.jp/articles/abddc2654fa7815ff67626354864733dfc3adb66,10/17(火) 13:11
travelv,トラベルボイス,北海道弟子屈町、川湯温泉の再整備計画を公表、「何度も訪れたくなる体験」提供、星野リゾートは「新時代の個人客」向けに施設開発,https://news.yahoo.co.jp/articles/101753496adbb3cc6e1571ac0e6ce24115a8f134,10/17(火) 13:01
travelv,トラベルボイス,トルコ、6000超える宿泊施設が国際サステナビリティ認証を取得、2030年までに全施設取得へ,https://news.yahoo.co.jp/articles/bf27c0a4a8ae4f5c53f061a462ed41260bbfb095,10/16(月) 13:20
travelv,トラベルボイス,観光事業者に聞いたインバウンド誘致の実態、コスト上昇の価格転嫁は不可避、日本旅行業協会が意識調査を実施,https://news.yahoo.co.jp/articles/e7900668649537a0453de288cfa3c31b02908d15,10/16(月) 13:10
travelv,トラベルボイス,地域の魅力度ランキング2023、観光意欲度は7県が順位上昇、都道府県トップは北海道が15年連続,https://news.yahoo.co.jp/articles/ef4a73f7ed431d9f5da22bea8a2d6334ee215d16,10/16(月) 13:00
travelv,トラベルボイス,商船三井クルーズ、新ラグジュアリー客船を発表、シニアだけでない新顧客層狙う、旅先テレワークできるブースも設置,https://news.yahoo.co.jp/articles/c19e8d83cdf63dbcb395c582622ba276752f7b74,10/13(金) 13:20
travelv,トラベルボイス,LCCアジアX、札幌／クアラルンプール線を再開、12月3日から週4便、旺盛なインバウンド需要で,https://news.yahoo.co.jp/articles/6d57a28e6a490b1dd4fa9ad8b42f51370b4378e2,10/13(金) 13:10
travelv,トラベルボイス,紅葉の見ごろ予想2023、東日本や西日本は平年並み、日光いろは坂が10月23日頃、京都・嵐山は11月下旬,https://news.yahoo.co.jp/articles/40f837db99b99ca2d8b89f8b721edcfe713f3936,10/13(金) 13:01
travelv,トラベルボイス,宮崎県日向市がワーケーション推進で「動くオフィスプロジェクト」、カーシェア活用で,https://news.yahoo.co.jp/articles/2430b429917175ce272f754767a583135b737814,10/12(木) 13:20
travelv,トラベルボイス,中国の大型連休「国慶節」2023実績、海外旅行で人気トップはビザ免除のタイ、1日あたり出入国者数は2019年比85%に回復,https://news.yahoo.co.jp/articles/63a1cf0d72e5352cc372791b21d20795e98eb95f,10/12(木) 13:10
travelv,トラベルボイス,開幕まで1年切った「パリ五輪2024」、大会概要を発表、開会式は史上初の屋外開催、期間中も通常の観光客を誘致,https://news.yahoo.co.jp/articles/13992674068e25b15fde993dd217d30bd7748b5f,10/12(木) 13:01
travelv,トラベルボイス,アメリカ旅行の販促アイデアコンテスト、体験予約「ベルトラ」がグランプリ受賞、DMOと連携で知られていない地域を訴求,https://news.yahoo.co.jp/articles/8a7fc7c3d345c9f737c556bd8a2532420c3e73d8,10/11(水) 13:20
travelv,トラベルボイス,ハワイ・マウイ島、火災地周辺も観光客受け入れを再開、観光してもらうことで地元経済の回復へ,https://news.yahoo.co.jp/articles/5afad4b069282c6842df6583e0aa5dd40724fd1e,10/11(水) 13:10
travelv,トラベルボイス,世界の大手航空各社、イスラエル便を続々運休、観光市場の復活にも暗い影【外電】,https://news.yahoo.co.jp/articles/9b28ea435598b0ab76d805681c9b8d93ac066232,10/11(水) 13:01
travelv,トラベルボイス,レンタサイクル利用者向けアプリで観光DX実証、しまなみ海道で貸出・返却地点をつなぐ旅程作成の機能開発など,https://news.yahoo.co.jp/articles/47ced3a378ecabf1c8539cd88ff10b6b708afa2d,10/10(火) 13:20
travelv,トラベルボイス,国交省、シェアサイクル促進へガイドライン取りまとめ、持続可能な事業運営からデータ活用、先進事例まで,https://news.yahoo.co.jp/articles/00f0caabed369487a2f51dbae7284170c9579dfb,10/10(火) 13:10
travelv,トラベルボイス,見せかけだけの環境対策には厳しい目、航空会社が広告で訴えられた理由とは？【外電】,https://news.yahoo.co.jp/articles/7d177b29b23363239f4486b71dec097a681ce987,10/10(火) 13:02
travelv,トラベルボイス,沖縄の修学旅行、バスの運転手不足で12月まで1000台以上がまだ手配できず,https://news.yahoo.co.jp/articles/33f5419397223b702ccb39304857b31cfae5cf07,10/6(金) 13:20
travelv,トラベルボイス,変わる修学旅行の今後とは？　環境変化の実態と「探究学習」を実現するヒント、日本修学旅行協会のシンポジウムで聞いてきた,https://news.yahoo.co.jp/articles/1f8ab51b04388cdd5372b5e6193311b88588d7f3,10/6(金) 13:10
travelv,トラベルボイス,セレブリティ・クルーズ、日本発着クルーズ再開で記念式典、2024年は国内外から3万人の乗船見込む,https://news.yahoo.co.jp/articles/91760cd63647b029a70654f03523498e57113b82,10/6(金) 13:01
travelv,トラベルボイス,グーグル、日本のホテル検索に新機能、宿泊プランと料金のフィルタを追加、露天風呂や温泉の確認も可能に,https://news.yahoo.co.jp/articles/319fb7050d9e95af7d9ca81124323fd865a226cb,10/5(木) 13:20
travelv,トラベルボイス,北海道の周遊観光促進でNFTスタンプラリー、世界遺産・縄文遺跡群でQRコード読み取り、周辺施設での特典も,https://news.yahoo.co.jp/articles/6246f90a784f5e808fabfaf05ade81c83303185a,10/5(木) 13:10
travelv,トラベルボイス,観光分野でのNFT活用、ふるさと納税から関係人口の拡大まで、国内外の事例とその課題とは？,https://news.yahoo.co.jp/articles/5f4b0750edc624653b8f1e174858ab9ebb487e41,10/5(木) 13:00
travelv,トラベルボイス,世界の観光地域づくりで注目される「先住民観光」、カナダ先住民と北海道アイヌの交流で見えた可能性とは？,https://news.yahoo.co.jp/articles/c45d016420e561511ee3ebb48d0671d2c05a90e0,10/4(水) 13:20
travelv,トラベルボイス,世界大手海運MSC社、イタリアの民間高速鉄道「イタロ」の経営に参画、観光事業を強化、持続可能な輸送手段の開発も,https://news.yahoo.co.jp/articles/e982af9b4280e0f44a156dc5350924955239aaaa,10/4(水) 13:10
travelv,トラベルボイス,大阪観光局、公式サイトに生成AIチャットボットを導入、20言語以上で、インバウンド需要に対応,https://news.yahoo.co.jp/articles/af6f1493e99888cbf55d364ec1d29920890176c5,10/4(水) 13:00
travelv,トラベルボイス,レジャー施設の集客ランキング2022、東京ディズニーが2000万人台に回復でトップ、「浅草花やしき」が夜イベント再開などで絶好調,https://news.yahoo.co.jp/articles/20d8423a52c2feb348ae332f1f31e82cc73a2736,10/3(火) 13:30
travelv,トラベルボイス,ドイツとフランスの観光機関が協力、国境を超えた観光推進を強化、両国の鉄道会社をパートナーにキャンペーン,https://news.yahoo.co.jp/articles/24cf023316ddb9be5af4dd4e46847d89b7573f1f,10/3(火) 13:20
travelv,トラベルボイス,国内の延べ宿泊者数、8月はコロナ前水準にあと一歩、外国人は既に1割増　―2023年8月（速報値）,https://news.yahoo.co.jp/articles/75e640fccefaef91b84d6685beeb7c0cd53a3674,10/3(火) 13:10
travelv,トラベルボイス,中国、ビザ免除措置を再開へ、観光やビジネスの交流促進、国際線は再開・増便か,https://news.yahoo.co.jp/articles/1929c2ae4ca4e517d4d4b7aa2a821de6c42efa45,10/3(火) 13:01
travelv,トラベルボイス,オ−バーツーリズム防止への省庁横断会議、観光庁が施策を整理、マナー違反や混雑に対処する具体策を提示,https://news.yahoo.co.jp/articles/77a5fe7ec86865bee8d8e749d22018e553cd723b,10/2(月) 13:20
travelv,トラベルボイス,アジア11市場で「次の旅先」トップ3に日本がランクイン、体験に「お金かけたい」は8割超え,https://news.yahoo.co.jp/articles/29e158fd136fec353cf0a8832e1f6d22688f8699,10/2(月) 13:10
travelv,トラベルボイス,関西国際空港、新たな国際線出発エリアを12月5日開業、出国審査場を中央集約、万博など需要拡大を見据えて,https://news.yahoo.co.jp/articles/c4ec684ad319b7ea7346c92f7eafc8b6bc355f1a,10/2(月) 13:00
travelv,トラベルボイス,エアビーCEO、パリ市民に自宅の部屋貸し出しを呼びかけ、五輪2024のホテル不足と価格高騰への対策として,https://news.yahoo.co.jp/articles/5fe057c63e68180c2cbe7bc50b452a6103358363,9/29(金) 13:20
travelv,トラベルボイス,埼県川越市、「旅先納税」を開始、ふるさと納税実施者が多い関東圏の来訪者に期待,https://news.yahoo.co.jp/articles/32c8475d6aedbc884f69a4da253f007e07bf5fd8,9/29(金) 13:10
travelv,トラベルボイス,中国の大型連休「国慶節」、今年は国内旅行が主流で消費底上げ、海外旅行の回復は道半ば,https://news.yahoo.co.jp/articles/16fc01ffbf33b878b6ec5e3a81aa738b8bc56c33,9/29(金) 13:01
travelv,トラベルボイス,北陸新幹線、福井・敦賀開業に向け魅力発信する観光周遊型XRバス、総合演出は堤幸彦さんに,https://news.yahoo.co.jp/articles/f75b929810c5cd39977555f7321aee9de806bb81,9/28(木) 13:20
travelv,トラベルボイス,国民生活センター、オンライン旅行会社での旅行予約で注意喚起、需要回復で相談件数も増加、自分自身でしっかり確認を,https://news.yahoo.co.jp/articles/41d211d133f96afadf333fa55d6b141287e53711,9/28(木) 13:10
travelv,トラベルボイス,訪日インバウンドの「最後のブルーオーシャン」、富裕層だらけの中東から旅行者を呼び込むポイントを日本政府観光局ドバイ事務所長に聞いてきた,https://news.yahoo.co.jp/articles/d7a9df66e10d98355b67a18c441ce1a77c3f66e3,9/28(木) 13:01
travelv,トラベルボイス,レゴランド運営会社と中国テンセント社が協業、デジタルでテーマパークの体験向上へ、第一弾はパーソナライズ没入体験,https://news.yahoo.co.jp/articles/18de085fd519b75e2ddab7b36b24224ccd01ed1a,9/27(水) 13:30
travelv,トラベルボイス,渋谷区観光協会、サステナブルな街づくりで新プロジェクトを立ち上げ、オーバーツーリズムやゴミ問題に対応,https://news.yahoo.co.jp/articles/2ed6cff581a62ddd746d0bc7a789b0b9363b7981,9/27(水) 13:20
travelv,トラベルボイス,国連世界観光機関、「世界観光デー」に観光分野への投資拡大を訴え、人材育成、グリーン革命、テクノロジーの3分野で,https://news.yahoo.co.jp/articles/e0c2d0731ff85467b820cd7aee7e4552e2d6a071,9/27(水) 13:10
travelv,トラベルボイス,中国旅行市場の予測を、世界的な旅行調査会社が発表、回復は2024年、今後の成長要因の分析も【外電】,https://news.yahoo.co.jp/articles/7753823689d96ccc816c1806603761b912970a67,9/27(水) 13:00
travelv,トラベルボイス,世界の国際線ハブ空港ランキング2023、総合5位に羽田空港、LCC部門はアジアの存在感、福岡空港が13位,https://news.yahoo.co.jp/articles/fee2485a0d5173e7478fa56d5e0c70e06281c9fa,9/26(火) 13:20
travelv,トラベルボイス,北海道ニセコ、タクシー不足解消へ新施策、他営業圏からタクシー車両と乗務員の応援隊,https://news.yahoo.co.jp/articles/d351c6ea6af7ea00b78bd559846e74c7f5a2ac09,9/26(火) 13:10
travelv,トラベルボイス,HIS、インバウンド向けに大阪で伝統芸能「文楽」を楽しむツアー発売、デジタルアートとの融合も,https://news.yahoo.co.jp/articles/ec993781556187d3fcdef50f513c54b79ea51647,9/26(火) 13:01
travelv,トラベルボイス,サウジアラビアの未来都市プロジェクト「NEOM」、東京でイベント開催、スキーリゾートや高級ホテルも開業予定,https://news.yahoo.co.jp/articles/577135dcceec478d59de92f76fcb224f9c3406e7,9/25(月) 13:20
travelv,トラベルボイス,アラスカ航空、アプリで事前にパスポートを読み込み、スマホだけでスムーズに搭乗できるしくみの提供開始,https://news.yahoo.co.jp/articles/222da385fe5476dbacd486da31fa46ee572de83f,9/25(月) 13:10
travelv,トラベルボイス,フランスが進める航空運賃の下限制度は実現するか、EU諸国でも温度差、LCCに大打撃の可能性,https://news.yahoo.co.jp/articles/88f34524354976e47d69bb2dcc247fa80b3ef1bb,9/25(月) 13:00
travelv,トラベルボイス,ジャパン・ツーリズム・アワード2024発表、最優秀賞は「沿線まるごとホテル」、駅と地域をつないだ世界観、課題を価値に転換,https://news.yahoo.co.jp/articles/a2f197946c1f97044203ca3fbd94e007c678a638,9/22(金) 13:30
travelv,トラベルボイス,韓国の秋の大型連休で人気の旅先、1位は東京、トップ10に日本の3都市がランクイン、ブッキング・ドットコムのサイト検索で,https://news.yahoo.co.jp/articles/896abec4fe86c06a771613498ccbcf35c3d3a46a,9/22(金) 13:20
travelv,トラベルボイス,温泉宿選びで重視すること、50代以上は「料理」「露天風呂」、若年層は「アクセス」や「クチコミ評価」,https://news.yahoo.co.jp/articles/954fdde5a4d23e45e98dbceb3e6364c24ebe6b29,9/22(金) 13:10
travelv,トラベルボイス,米・アナハイム、大谷選手の効果で日本人旅行者が増加、滞在日数も増加、新たなスポーツツーリズムのハブに,https://news.yahoo.co.jp/articles/6fac003711f77801cd378c18092712ce1d400cad,9/22(金) 13:00
travelv,トラベルボイス,タビナカ予約「クルック（Klook）」、宿泊予約とタビナカ旅行商品のセット販売を開始、若年層の消費行動の変化に対応,https://news.yahoo.co.jp/articles/22d4472a8b53739ea539ce7d31c5ef99df776aa3,9/21(木) 13:20
travelv,トラベルボイス,消滅しつつある「公衆電話ボックス」がシャワーブースに、ドイツの観光地で、観光客にも人気,https://news.yahoo.co.jp/articles/d77a342f05120a266d47ea05a13820e443f4bc83,9/21(木) 13:10
travelv,トラベルボイス,近ツーの過大請求問題、再発防止策を発表、経営陣含めた全社員の教育機関設立など、業務・組織を改革へ,https://news.yahoo.co.jp/articles/81bbc9b16c02cfb0c9556c26d3f61a62cba6367b,9/21(木) 13:00
travelv,トラベルボイス,西オーストラリアで先住民文化を彩る新たな大型イベント、光、炎、音楽で幻想的な世界を演出,https://news.yahoo.co.jp/articles/0b7cf9c2d8b53b68a64c08983b159aa220cadaba,9/20(水) 13:20
travelv,トラベルボイス,豪州ケアンズ、観光局CEO来日でオーバーツーリズム対策を説明、日本人旅行者は7割まで回復,https://news.yahoo.co.jp/articles/e133c74c4be8979baba1f4d0c735ed5005b635da,9/20(水) 13:10
travelv,トラベルボイス,HIS米国法人、宇宙旅行会社に出資、気球型宇宙船「ネプチューン」を独占販売、日本での商業飛行も視野,https://news.yahoo.co.jp/articles/7d9adf22d0ee63759b75de7e571a200d6ce5ba4f,9/20(水) 13:01
travelv,トラベルボイス,伊ベネチア、危機遺産リスト入りを回避、世界遺産委員会が入域料徴収を評価、2025年に再度審査へ,https://news.yahoo.co.jp/articles/bf036c678b64396635976b1282b55dbbdd2abeee,9/19(火) 13:20
travelv,トラベルボイス,郵船クルーズ、新造客船の船名を「飛鳥III」に、動く洋上の美術館、環境負荷を低減したエコシップ,https://news.yahoo.co.jp/articles/37d9ea6701fd27b88770b360ce47d5c7e835af1a,9/19(火) 13:10
travelv,トラベルボイス,ブータンの観光税は1.45万円に、観光地を劣化させない、環境保護と経済のバランスとは？【外電】,https://news.yahoo.co.jp/articles/eedd7647de6f4cd936a980d309c18cc34b0c14a4,9/19(火) 13:01
