media_en,media_jp,title_articles,link_articles,date_original
travelv,トラベルボイス,旧奈良監獄が星野リゾート「星のや」に、2026年に48室で開業、ミュージアムも併設,https://news.yahoo.co.jp/articles/6b5d599dba423c0adcee0cd383e5b7b0e36acae2,9/15(金) 13:30
travelv,トラベルボイス,シンガポール航空、日本路線を大幅に拡充、10月からコロナ前と同レベルに、羽田線も再開,https://news.yahoo.co.jp/articles/0fbc4001a81713cfcb543cd8eaee921acf391c8c,9/15(金) 13:20
travelv,トラベルボイス,ANA、中国路線をさらに増強、10月初旬から成田／上海線を週3往復、関西／上海線も増便,https://news.yahoo.co.jp/articles/7b2f536dd0ffef6a7505f9ed30762c090f948eee,9/15(金) 13:10
travelv,トラベルボイス,原発処理水による訪日インバウンド市場への影響は？　アジア地域の旅行会社の反応を整理した【外電】,https://news.yahoo.co.jp/articles/5c9a12897503d1cbd9c32ffa68bc3fdcb003ed00,9/15(金) 13:01
travelv,トラベルボイス,旅行予約に影響するビジュアル要因とは？　世界25カ国の調査結果を発表、選定ポイントは「場所ではなく、体験」など4つ,https://news.yahoo.co.jp/articles/e8a1d8f4d9eac74a47373874179d1bada784d518,9/14(木) 13:20
travelv,トラベルボイス,2022年度の旅行のネット取引きは7割増の2兆円越え、EC市場全体では消費者向け、企業間取引きともに拡大,https://news.yahoo.co.jp/articles/a0529b18be491cf1716fd174c765112cb27142ce,9/14(木) 13:10
travelv,トラベルボイス,JRグループ、全国乗り放題パスを販売、3日間連続で普通列車大人7850円、北海道新幹線オプションも,https://news.yahoo.co.jp/articles/516c6896907469776c9f212279712f3dd5b6d774,9/14(木) 13:00
travelv,トラベルボイス,札幌「白い恋人パーク」でハロウィンイベント、ミッション型肝試しやワークショップを開催,https://news.yahoo.co.jp/articles/8ea6bfb5c0ddfd9fa29c83ad59c6594beb91e2fc,9/13(水) 13:20
travelv,トラベルボイス,透析患者など健康不安ある人が観光できる体制へ、長野県・白馬エリアが診療所と連携,https://news.yahoo.co.jp/articles/b2d171eb87001369d27e8c4970999edcdba9e175,9/13(水) 13:10
travelv,トラベルボイス,北海道で「アドベンチャートラベル」世界大会が開幕、64か国・地域から750人が参加、アイヌ文化にも高い関心,https://news.yahoo.co.jp/articles/9e66d76e8270fb5d86d19d0205b3eb9660707f97,9/13(水) 13:00
travelv,トラベルボイス,ジェットスター、成田／旭川線に新規就航、就航記念は復路98円、12月15日から、訪日スキー客にも期待,https://news.yahoo.co.jp/articles/bdad017b1c21c20ed86292ea50013d2e9201f57f,9/12(火) 13:30
travelv,トラベルボイス,千葉県・佐原商家町ホテルNIPPONIA、「佐原の大祭」に参加できる体験を提供、宿泊者限定で1名1万5000円,https://news.yahoo.co.jp/articles/bb3ec4ae53e28a0f35ae81c6794b1692e7d93fe0,9/12(火) 13:20
travelv,トラベルボイス,OMO3札幌すすきの、真冬の市電でアイスを食べる企画、宿泊者限定で、ドレスコードはTシャツ,https://news.yahoo.co.jp/articles/0034048d482275379cee23d0ffa2f62342f595cc,9/12(火) 13:10
travelv,トラベルボイス,楽天ステイCEOに聞いてきた、宿泊事業の独自展開、旅先テレワークの需要増で存在感,https://news.yahoo.co.jp/articles/10f277782eace3c0387a7d54bb14a2753f4c9f38,9/12(火) 13:00
travelv,トラベルボイス,電通、「ウェルネス1万人調査」を実施、認知度上昇の一方で、「常に健康を意識した生活」は減少傾向,https://news.yahoo.co.jp/articles/27297270bc4729192c6a7d181c03d2474dca3f7e,9/11(月) 17:01
travelv,トラベルボイス,東急の宿泊サブスク「TsugiTsugi」に西鉄ホテルズが参画、九州地方のラインナップを強化,https://news.yahoo.co.jp/articles/c310c93140a8d14111a4b9611d5d6c6c684112fc,9/11(月) 13:20
travelv,トラベルボイス,福岡市、海外の「デジタルノマド」誘致へ、ワーケーションをテーマに国際イベント開催,https://news.yahoo.co.jp/articles/d58414d5c208f3523acd5f971df34239843139b8,9/11(月) 13:10
travelv,トラベルボイス,福島県、福島／伊丹線の乗継ぎ利用で片道5000円還元、往復で1万円、西日本エリアからの誘客へ,https://news.yahoo.co.jp/articles/efb18f9e84a3fcf12642ad89489dc05c4a31fb6c,9/11(月) 13:02
travelv,トラベルボイス,Trip.com、中国発の海外ホテル・航空券予約はコロナ前の6割、国内旅行の好調続く ―2023年第2四半期,https://news.yahoo.co.jp/articles/c7d8a36164af9ca388685c0d2b7090fa0b67fa73,9/8(金) 13:20
travelv,トラベルボイス,貸切バスの下限運賃が引き上げ、各地方運輸局が新たに公示、高付加価値サービスも可能に,https://news.yahoo.co.jp/articles/68cc855f9c289beea047c6f942a5c8fdc5fa4b7d,9/8(金) 13:10
travelv,トラベルボイス,ニューヨーク市、「民泊」の事実上の禁止法、その影響と、勝ち組となるホテルとは？【外電】,https://news.yahoo.co.jp/articles/a463e33400ef0a7fff5c3cfac51a43610304ccba,9/8(金) 13:01
travelv,トラベルボイス,エジプトの考古学者ザヒ博士が来日、政府観光局の観光プロモーションの先駆けとして、早稲田大学などで講演,https://news.yahoo.co.jp/articles/6a0fd8611336c00426c82e4e695bb86f5bc580c6,9/7(木) 13:20
travelv,トラベルボイス,伊・ベネチア市が入域料を導入へ、日帰り客から5ユーロを徴収、オーバーツーリズム対策として,https://news.yahoo.co.jp/articles/7a6022e6f7a85abc0cba9e25978909054c4a2c22,9/7(木) 13:10
travelv,トラベルボイス,ハワイ州の議員団が来日、「ハワイ旅行してもらうことがマウイ島の復興支援に」、西マウイ以外は観光客を歓迎,https://news.yahoo.co.jp/articles/8de0cdf10e16e7126590e569e7c1c315a5099ac8,9/7(木) 13:00
travelv,トラベルボイス,軽井沢プリンス、Z世代が企画した宿泊プラン、同世代向けにエモい「夜のピクニック」、29歳までの特別料金,https://news.yahoo.co.jp/articles/25d1dda7e51876ca4db15e5276d65c875eab66f9,9/6(水) 13:20
travelv,トラベルボイス,長野県・海野宿に一棟貸し宿「上州屋」開業、明治初期の古民家を改修、企業研修向けにも,https://news.yahoo.co.jp/articles/df6f6ebde8a6e31dc1c394dad154023e1c21278b,9/6(水) 13:10
travelv,トラベルボイス,埼玉県物産観光協会、新1万円札の渋沢栄一をテーマに観光誘致、川越発着で長瀞・深谷のゆかりの地をめぐるツアー発売,https://news.yahoo.co.jp/articles/0c8b1d0b10c5d0e58ef8bd87baf6ff196497b76a,9/6(水) 13:00
travelv,トラベルボイス,ハワイ州観光局、ハネムーンなど「ロマンス市場」特化のプロジェクト始動、公式サイトも開設,https://news.yahoo.co.jp/articles/484d65377cb77db50da4cbf891e4ce5ef909a3ab,9/5(火) 13:20
travelv,トラベルボイス,エミレーツ航空、羽田空港から都内主要駅への無料バスを運行、エコノミークラス乗客対象に,https://news.yahoo.co.jp/articles/0ce83e0a59672fd81b09594f880adfb376552a58,9/5(火) 13:10
travelv,トラベルボイス,ハワイ州観光局、マウイ島の復興計画に260万ドル拠出、米国向けに「責任ある旅行」キャンペーンを立ち上げ,https://news.yahoo.co.jp/articles/4b46081f2562ed998dbd9043e2b58a5b80131c5e,9/5(火) 13:00
travelv,トラベルボイス,ヤマハ発動機、名古屋大学と共同で持続可能なモビリティ社会構築へ、沖永良部島をモデルに,https://news.yahoo.co.jp/articles/1f8612b0e984392057253c2abc882b152f44f1af,9/4(月) 13:20
travelv,トラベルボイス,新名所「黒部宇奈月キャニオンルート」の一般開放日が決定、2024年6月30日から、ガイド同行のツアー販売は来年1月下旬から,https://news.yahoo.co.jp/articles/4c9ef5db35a21704fd8ce62e4f375a96c2ce1d65,9/4(月) 13:10
travelv,トラベルボイス,田んぼアート「翔んで埼玉」をヘリ遊覧で上空から、AirX社が企画、1機3名7万4000円、10月中旬まで,https://news.yahoo.co.jp/articles/3c7988dae01ff0e5267f0f255e9b65b9e9d9e574,9/4(月) 13:00
travelv,トラベルボイス,HIS、関西エリアの「空飛ぶクルマ」社会実装事業に参画、運航ルートの提案や適正価格を調査,https://news.yahoo.co.jp/articles/a3a901b1ec60d2e8e828ecaa08a4bdc2487fb2bb,9/1(金) 13:20
travelv,トラベルボイス,成田空港の国際線旅客、2023年7月は2ヶ月連続で200万人突破、外国人がコロナ前の9割、日本人は回復半ば,https://news.yahoo.co.jp/articles/78e60ee7e47a2d6f89532961938d68b2b2dc7a65,9/1(金) 13:10
travelv,トラベルボイス,JR西日本、新たな会員基盤サービスの提供を開始、1つのIDで自治体や企業のサービス利用が可能に,https://news.yahoo.co.jp/articles/a1b9b360bee4bbf2abec4813ef25dd71cb29e130,9/1(金) 13:00
travelv,トラベルボイス,JR東日本と西武、地域・観光型MaaS「回遊軽井沢」を実施、住民も利用しやすく、オンデマンド交通や観光チケット,https://news.yahoo.co.jp/articles/24c1bc363438eeed2ce4319d55fdd219fe3c108e,8/31(木) 13:20
travelv,トラベルボイス,旅行比較サイト「トラベルコ」、チャットGPTのプラグイン提供、会話形式で宿泊施設を検索,https://news.yahoo.co.jp/articles/276fa20225faea2a08eeccf60c48ad657c92e573,8/31(木) 13:10
travelv,トラベルボイス,北海道・ニセコの片山町長に聞いてきた、インバウンド成長の軌跡と、未来に描く観光・環境・地域の関わり,https://news.yahoo.co.jp/articles/e1e5bc7b3766b874a57fd1dd2443b5afab1ed966,8/31(木) 13:00
travelv,トラベルボイス,ぴあ、インバウンドに日本でのサッカー観戦ツアーを販売、サガン鳥栖の公式戦を核に、観光庁「観光再始動事業」に採択,https://news.yahoo.co.jp/articles/15524f238fb41d39f830609fb9ecdc48d56702d6,8/30(水) 13:20
travelv,トラベルボイス,デルタ航空、羽田／ホノルル線に新規就航、10月29日から毎日運航で,https://news.yahoo.co.jp/articles/c333c1bdea5e937342e5619e996c9a72cc859a3a,8/30(水) 13:10
travelv,トラベルボイス,出張時に「レジャー旅行を組み合わせ」が好まれる傾向、法人旅行の回復が加速、2024年にはパンデミック前を超える予測,https://news.yahoo.co.jp/articles/c6e25ab9a2d21d561132e7491760c5d64efd0b1c,8/30(水) 13:00
travelv,トラベルボイス,スノーピーク、岩手県陸前高田に直営キャンプ場、道具レンタルの手ぶらプラン、直営店も併設,https://news.yahoo.co.jp/articles/fe4d13c2fcda6061ae0816ea7390de85201be8fe,8/29(火) 13:20
travelv,トラベルボイス,世界全体で観光への投資が復活、APACおよびアフリカでは161％増、未来の継続投資には官民協力のイノベーションがカギ,https://news.yahoo.co.jp/articles/9c003722932a247b89849ca9ea23306e21416cfc,8/29(火) 13:10
travelv,トラベルボイス,和歌山県・紀美野町、ワーケーション目的の滞在に宿泊費を補助、平日2泊以上で1泊5000円、同行家族も,https://news.yahoo.co.jp/articles/6fdaf0312f3cca5a21e304ccb29698b47ea7a927,8/29(火) 13:01
travelv,トラベルボイス,ブリティッシュ・エアウェイズ、日本路線に最新ビジネスクラス席、ファーストクラスも復活,https://news.yahoo.co.jp/articles/7d73c295c1b8894354590641925d36d3d76534fe,8/28(月) 13:20
travelv,トラベルボイス,ジェイアール東海ツアーズ、「新幹線＋宿泊」ツアーのネット限定セール、過去最大規模で9月6日まで,https://news.yahoo.co.jp/articles/b8b75a2423fa0cfd320819c35f5cda081d8f629e,8/28(月) 13:10
travelv,トラベルボイス,観光庁の概算要求2024、昨年比2.2倍の670億円、宿泊業の人手不足対策に重点、「観光GX」推進や「持続可能な観光計画」の策定支援など,https://news.yahoo.co.jp/articles/70887c23ddaf347f5e5e0c94cba34fcdbff594de,8/28(月) 13:00
travelv,トラベルボイス,eスポーツは新たな観光市場となるか？　観光局も注目、そのポテンシャルを専門家が考察した【外電】,https://news.yahoo.co.jp/articles/0d1d64db8bf645cdfed0d5ea3d7427c124e1f2c1,8/25(金) 13:30
travelv,トラベルボイス,日本旅行、旅行体験に「ゲーミフィケーション」を活用、セガXDと共同企画、人気歴史教師の金沢ツアー,https://news.yahoo.co.jp/articles/edc04747afd19b671a1a2add8f1f09034dca7b57,8/25(金) 13:20
travelv,トラベルボイス,那須ハイランドパーク、悪天候の夏休みに「リベンジ割」、8月末まで緊急割引,https://news.yahoo.co.jp/articles/047f27ddf3a4cefe0a76f066308923a7ad0bfeb9,8/25(金) 13:10
travelv,トラベルボイス,星野リゾート、沖縄のホテルで、台風理由のフライト欠航時はキャンセル料免除に、「暴風域入り」予報は50%割引,https://news.yahoo.co.jp/articles/ea4b43533785e605c63d6bbb0b8d3f4897e0b361,8/25(金) 13:01
travelv,トラベルボイス,アリババ、訪日中国人旅行者向け「医療ツーリズム」事業を開始、第1弾は「健康検診」、タビマエに予約、タビナカで受診を可能に,https://news.yahoo.co.jp/articles/48b32c67605b02dcffc530699d363769fcb6869a,8/24(木) 13:20
travelv,トラベルボイス,成田空港と都内をヘリコプター移動で18分、片道3名18万円、AirX社が販売再開、箱根・富士山エリアとの組合せも,https://news.yahoo.co.jp/articles/18f01c3fa5084c754cc3797f20f77798b0364729,8/24(木) 13:10
travelv,トラベルボイス,ホンダジェット飛行＋ガストロノミーの高付加価値旅行、訪日富裕層向けツアーに向けた挑戦と世界観を聞いてきた,https://news.yahoo.co.jp/articles/a1d921d5c6079194ab68c4362105dbce0c924018,8/24(木) 13:01
travelv,トラベルボイス,日本旅行、北海道大樹町で「宇宙」がテーマの教育プログラムを提供、ロケットワークショップとまちづくり,https://news.yahoo.co.jp/articles/6f68c08ec581471dfd40a034d6f2a909772ba598,8/23(水) 13:30
travelv,トラベルボイス,新潟県・佐渡金山で「顔認証」の周遊チケット販売、加盟店での特典サービスも,https://news.yahoo.co.jp/articles/0e57cf5ca4e28ed3530b6b91ba74df52fb6e48d7,8/23(水) 13:20
travelv,トラベルボイス,JAL、関西・中部/ホノルル線を増便、国内線は新型機材で丘珠/根室中標津に新規就航　ー2023年度下期,https://news.yahoo.co.jp/articles/d7b3e90bc4060c72aec9df5a82932ee1f345c41f,8/23(水) 13:10
travelv,トラベルボイス,ANA、超大型旅客機A380の3号機をホノルル線に投入、中国路線も増強、国内線はコロナ前を上回る便数に　ー2023年度下期,https://news.yahoo.co.jp/articles/374a453e5b33da349eb863231663a6a6871238c9,8/23(水) 13:01
travelv,トラベルボイス,HIS、鳥取県のインバウンド推進で新拠点、鳥取発着ツアーの販売や情報発信へ,https://news.yahoo.co.jp/articles/58376a553a6526c2e8bef4004d1e25ebc2b38bd7,8/22(火) 13:20
travelv,トラベルボイス,日本旅行、婚活支援事業に参画、業界大手IBJと提携、メタバース婚活や移住支援も視野に,https://news.yahoo.co.jp/articles/1e62d091b9ab4b8e544d19bd946c9d8d72786807,8/22(火) 13:10
travelv,トラベルボイス,お盆期間の航空便の利用実績2023、ANA、JALとも国際線レジャー需要の回復鮮明、旅客数は2019年の7割に,https://news.yahoo.co.jp/articles/e2f4d72f8f7cc56cef6f0bfcdf9fdcea1fc202fa,8/22(火) 13:00
travelv,トラベルボイス,HIS、韓国旅行の売上げ高が2019年水準に回復、ソウルの予約は女性が8割、釜山と済州島はカップル・夫婦に人気,https://news.yahoo.co.jp/articles/403f14865b44b0c6582daddc61b9564bd974e54c,8/21(月) 13:30
travelv,トラベルボイス,JAL、燃油サーチャージを値上げ、ハワイ線は再び片道2万円台、北米・欧州線は3万円台に、2023年10〜11月発券分,https://news.yahoo.co.jp/articles/95d0a3cf781d27708946ca8b0072513fad70e666,8/21(月) 13:20
travelv,トラベルボイス,立命館大学、大学院に「観光マネジメント専攻」を新設、観光MBA教育で次世代リーダーの育成へ,https://news.yahoo.co.jp/articles/74550a8034910ebd08bb95319c9a4a87fbd844a2,8/21(月) 13:10
travelv,トラベルボイス,レゴランド・ジャパン、週休3日制を導入、育児・介護者が対象、「総労働時間維持」と「報酬削減」を選択可能に,https://news.yahoo.co.jp/articles/1626f124ed9ad6f861acf443e7d90f0c754ab42a,8/21(月) 13:00
travelv,トラベルボイス,ハワイ・マウイ島、山火事からの復興への苦悩、観光による経済再生か、地域住民への配慮か【外電】,https://news.yahoo.co.jp/articles/5ffbb1e2378f9bbc9b26291938bfc26f630dda24,8/18(金) 13:30
travelv,トラベルボイス,災害に強い観光地づくりとは？ 熊本地震が九州観光に与えた影響から考える備え、識者の分析と議論を取材した,https://news.yahoo.co.jp/articles/fd273ff1523e11cca3dd5f6007b6dfd66afb2262,8/18(金) 13:20
travelv,トラベルボイス,近ツーの過大請求問題、調査委員会の報告書から読み解く、前代未聞の不正の背景と要因、再生への提言,https://news.yahoo.co.jp/articles/2facdbbe85d710fe3dc6009ca6fd65cb2543de72,8/18(金) 13:10
travelv,トラベルボイス,ハワイ州観光局、マウイ島の山火事の復興支援に向け、日本円での救援金の受付開始、特設サイトで1000円から,https://news.yahoo.co.jp/articles/1703f3a6a92f74414bef7d22689f25ba0af8a9a1,8/18(金) 13:00
travelv,トラベルボイス,愛媛県、周遊旅行の促進で旅行会社の商品化を支援、観光タクシーの補助、体験プランの組み込みも推奨,https://news.yahoo.co.jp/articles/ed0f8ba608cc320a5f595d748b5400a8abef3715,8/17(木) 13:20
travelv,トラベルボイス,長野県の小諸市、夏休み限定で観光スポットめぐる無料バス運行、市内周遊の二次交通として,https://news.yahoo.co.jp/articles/e36ab885ce5910f3a09896d93ac0d4f4fac5a2ea,8/17(木) 13:10
travelv,トラベルボイス,富士山の世界文化遺産登録10周年、静岡県が期間限定ロゴ入りの「保全協力者証」発行、協力金は環境保全や安全対策に,https://news.yahoo.co.jp/articles/df41036dd6c074bd09a6538ab1e3bc3d521410db,8/17(木) 13:01
travelv,トラベルボイス,訪日外国人数、2023年7月は232万人、年間2000万人まで残り5か月で700万人　−日本政府観光局（速報）,https://news.yahoo.co.jp/articles/cc2423d9108d9f75538fd2a81e5f42e83ba6f6c7,8/16(水) 18:02
travelv,トラベルボイス,日本人出国者数、2023年7月は89万人、夏休み開始で前月から約19万人増加　−日本政府観光局（速報）,https://news.yahoo.co.jp/articles/32ea923a40d8cae06d6697ce6dae861930287d4b,8/16(水) 17:57
travelv,トラベルボイス,キャンピングカーとキャンプ区画を同時に予約できる新サービス、キャンプ道具レンタルもセットで予約しやすく,https://news.yahoo.co.jp/articles/62c092ed923b0bc914a09f79207e2d2b0bd38066,8/16(水) 13:20
travelv,トラベルボイス,長野県・白馬でカメラ女子コミュニティ向け撮影会、トレッキング未経験者を対象に山の魅力を訴求,https://news.yahoo.co.jp/articles/a5e8e165ae9bd8606858083b7149a4fcb02bf17f,8/16(水) 13:10
travelv,トラベルボイス,気候変動で変わる欧州アルプス登山、氷河の喪失で危険度が増大、専門ガイドの需要高まるも供給が追いつかず【外電】,https://news.yahoo.co.jp/articles/a83778357602a691891375b0bfc585979fac77d4,8/16(水) 13:01
travelv,トラベルボイス,子どもが学ぶために旅にでる「ラーケーション」、「ぜひ利用したい」保護者は6割,https://news.yahoo.co.jp/articles/738a6f81a2629f5660bb09c0f548ee971d81b51e,8/14(月) 13:25
travelv,トラベルボイス,沖縄県、台風6号の影響で8月は観光客8.4万人減、見通しを76.6万人に下方修正、県内ホテルの客室単価は上昇基調,https://news.yahoo.co.jp/articles/e14c5c7fd23e5291c03a34272aef84c0faff9516,8/14(月) 13:22
travelv,トラベルボイス,沿線まるごとホテル、JR東日本ローカルスタートアップから資金調達、JR青梅線での沿線活性化事業を加速,https://news.yahoo.co.jp/articles/2410ebd6bcadda1b52219c8dd1a6b4017b39747b,8/10(木) 13:20
travelv,トラベルボイス,米ニューヨーク州、民泊エアビーの宿泊提供者の登録を9月から義務化、不服申し立ては棄却,https://news.yahoo.co.jp/articles/100e3adf9cb63453745d56ae48138fadc3472fb3,8/10(木) 13:10
travelv,トラベルボイス,酷暑が観光産業に与える影響は？「酷暑保険」の開発や、 欧州のバケーション旅先選びに変化の可能性,https://news.yahoo.co.jp/articles/096ed8230ffedb5235f3599f19ca999f7a6e5613,8/10(木) 13:00
travelv,トラベルボイス,HIS、ふるさと納税クーポンの取り扱い開始、宮崎県宮崎市を皮切りに,https://news.yahoo.co.jp/articles/acbf72746ea048c6bf2cdac87cd9aaa03193add3,8/9(水) 13:20
travelv,トラベルボイス,OMO3札幌すすきの、近隣スナックと連携、宿泊客に店紹介や、ママとの会話、定額で楽しむツアーなど,https://news.yahoo.co.jp/articles/afb33eafa8701da580edbdb31f83a6defe888348,8/9(水) 13:10
travelv,トラベルボイス,鶴雅リゾート、初の一棟貸しホテル「阿寒terrace」開業、30名まで宿泊可能、研修や勉強会などラウンジ充実,https://news.yahoo.co.jp/articles/2911a0db6908e5d97742317e2775df79dec7cf84,8/9(水) 13:01
travelv,トラベルボイス,国交省、「ポケモンGO」との連携拡大、地域の歴史的建造物を再発見、静岡県浜松市など3地域で,https://news.yahoo.co.jp/articles/03b27c4d9729a4a2d814a133e2585aab71aeae32,8/8(火) 13:20
travelv,トラベルボイス,電通ら、乗り物での移動中も対応可能な多言語観光ガイドシステムを開発、来春「びわ湖疏水船」で導入へ,https://news.yahoo.co.jp/articles/2d0d21679c67861c6e08e552978d457093607932,8/8(火) 13:10
travelv,トラベルボイス,エアビー「体験」アクティビティの新規登録の保留は、その後どうなっているのか？　他OTAへのシフトや直接予約を模索するタビナカ提供ホストも【外電】,https://news.yahoo.co.jp/articles/c8adf4093e8e762cea268d54d6539b7caca17b98,8/8(火) 13:00
travelv,トラベルボイス,徳島県、阿波人形浄瑠璃の出張サービスを開始、解説付きで人形遣いを派遣、演目の提案も,https://news.yahoo.co.jp/articles/f69c0a5a7436e69490f37784c4b48226e9e89564,8/7(月) 13:20
travelv,トラベルボイス,神戸アリーナプロジェクト、CRM事業会社と連携、アリーナ基点に回遊性高めるまちづくりへ,https://news.yahoo.co.jp/articles/57603ab2a060c2067528728e85b4b796696f40e6,8/7(月) 13:10
travelv,トラベルボイス,ギリシャ、山火事で避難した観光客に1週間滞在を無料提供、今秋と来春、首相が明らかに,https://news.yahoo.co.jp/articles/664505b814f979d3be1e0e5ec96297ca77087c7e,8/4(金) 13:20
travelv,トラベルボイス,認知度高くても足踏みの「ワーケーション」、 導入加速には発想を「旅先テレワーク」に転換を【コラム】,https://news.yahoo.co.jp/articles/ad6b67b25974265a1558eb3f479d154dd5d5a2f9,8/4(金) 13:10
travelv,トラベルボイス,新チャーター航空会社が誕生、2023年10月からサービス開始、プレイベートジェットでカスタマイズ可能なフライトを提供,https://news.yahoo.co.jp/articles/5fcbfab9559318b9704f559e5401324703bd354f,8/4(金) 13:00
travelv,トラベルボイス,長野県軽井沢でタイムシェア別荘の分譲開始、1棟あたりオーナー24名で所有、1口あたり14日間滞在可能,https://news.yahoo.co.jp/articles/bfd5e4d485c7409ba3d8d21a48905c882f284b78,8/3(木) 13:20
travelv,トラベルボイス,星野リゾート、宮城県初進出で「界 秋保」開業へ、観光活性化ファンドの第2号案件として,https://news.yahoo.co.jp/articles/d998807e2ae65b8a399fde7bdd68cab7befabed9,8/3(木) 13:10
travelv,トラベルボイス,ジャパネットが拡大する旅行事業の次の一手を聞いてきた、高級クルーズ、国内ツアーの仕入れや販売手法まで,https://news.yahoo.co.jp/articles/c065c77e35835304d24b4094cb159e8598d72ec6,8/3(木) 13:01
travelv,トラベルボイス,伊・ベネチアが「危機遺産リスト」入りか、ユネスコが勧告、オーバーツーリズム対策が不十分と指摘,https://news.yahoo.co.jp/articles/089ee776425e42da04eae72b9b105b672e691b6d,8/2(水) 13:20
travelv,トラベルボイス,国内の延べ宿泊者数、ついに2019年同月比でプラス成長に、2020年1月以来で初めて　―宿泊旅行統計（2023年6月・速報）,https://news.yahoo.co.jp/articles/913d47844d82b129d2d4517fdc951e16a8108af8,8/2(水) 13:10
