media_en,title_articles,link_articles,date_original
ishikawa,ご当地アイドルが一日警察署長就任　秋の全国交通安全運動出発式,https://news.yahoo.co.jp/articles/742c4debd069db2f1a0a4ca1f3115fb80ad3b201,9/19(火) 12:10
ishikawa,奥能登の隠れた名産“能登栗”　猛暑で収穫減るも甘みは強い,https://news.yahoo.co.jp/articles/20a43833775cc3ff51eacea346229331c3928d78,9/19(火) 12:05
ishikawa,死亡事故ゼロ続く金沢で高齢夫婦の自動車が橋の欄干に衝突　妻が意識不明の重体,https://news.yahoo.co.jp/articles/5db83952572d6f58f1c079dbd248310bb2407101,9/19(火) 12:05
ishikawa,“限定アレ”急遽販売へ…阪神タイガース優勝を祝い人気焼酎『虎の涙』18年物 3000本限定で,https://news.yahoo.co.jp/articles/fc3e42a97524b786ad63eaebc61030b8108491c1,9/18(月) 20:00
ishikawa,歴代1位タイ記録！新十両・大の里が初日から負けなし9連勝 幕内経験者・千代丸を寄り切りで下す,https://news.yahoo.co.jp/articles/b73d8d1ab56de16e9a06cc968ce8cbb27041809a,9/18(月) 20:00
ishikawa,北陸新幹線の敦賀延伸まで半年…JR小松駅の高架下にKomatsu九(ナイン)グランドオープン,https://news.yahoo.co.jp/articles/9a858383888d2d8289b9115bce0afaede40bcb32,9/18(月) 19:55
ishikawa,“プロ野球開催”の基準満たす…白山市立野球場が完成 愛称は一般公募で「あさがおスタジアム」に,https://news.yahoo.co.jp/articles/a7d144cc309c109aa81b48e6b7acabb0ba2e2941,9/18(月) 19:50
ishikawa,約１０億円かけて整備した複合商業施設「Komatsu九」がグランドオープン,https://news.yahoo.co.jp/articles/cb9f5f4d86da8550d471d55ad732824c5ff598ba,9/18(月) 12:05
ishikawa,“災害時の拠点”としても活用…市内唯一の硬式野球規格満たす白山市立野球場が完成,https://news.yahoo.co.jp/articles/429aa9934ad7191a60ba17ec002e21defad87eec,9/18(月) 12:05
ishikawa,リーグ開幕前に“初めて”壮行会を開催…北國銀行ハニービーが地元の人と交流,https://news.yahoo.co.jp/articles/1d0e9942151d3743a564d883339b9921bb8e1f78,9/17(日) 18:40
ishikawa,過去最多約５００人のオーナーが参加…輪島白米千枚田で稲刈り,https://news.yahoo.co.jp/articles/c02a10cb94b0db0c59b98ae17c87fcc22793dc4b,9/17(日) 18:35
ishikawa,「みなさん熱が入っている」仲代達矢さん演出の舞台　市民キャストの稽古始まる,https://news.yahoo.co.jp/articles/4d359a7a1f9703cf234282e93096f5490650b189,9/17(日) 18:35
ishikawa,新十両で”無敗勝ち越し”は史上７人目の快挙！大の里快進撃止まらず,https://news.yahoo.co.jp/articles/010ca349332759a2810a8ddc616b998db7f83bc2,9/17(日) 18:30
ishikawa,夜行バスで就寝中の女性の体触った疑い…６０代の県職員の男逮捕,https://news.yahoo.co.jp/articles/5a97d87f5e97eb7547325f2535359638dbbd7a5c,9/17(日) 12:10
ishikawa,高級車のエンブレムがマグネットに!?…金沢で楽しく学べるSDGS体験イベント,https://news.yahoo.co.jp/articles/eb07f4e3b27cc138d51dc1bc3dc04f1b856b7d0a,9/16(土) 19:35
ishikawa,オートバイで転倒し崖下に転落…金沢市の21歳公務員が死亡,https://news.yahoo.co.jp/articles/7647483652024c6ea50152453eec2b86e4421c55,9/16(土) 19:30
ishikawa,十両で唯一“無傷”の7連勝…大相撲秋場所で大の里が快進撃,https://news.yahoo.co.jp/articles/c7b069b2c6019b54347f7ee6236f7c3655d253f4,9/16(土) 19:30
ishikawa,予算内で上手にカレー作れるかな？…子供たちが買い物しながら金融を学ぶ,https://news.yahoo.co.jp/articles/6c81498d222e8ab9d78c6ef9feb4f538d059ece4,9/16(土) 12:15
ishikawa,勢い止まらず…津幡町出身の大の里6連勝で十両単独首位を守る,https://news.yahoo.co.jp/articles/8eeb804a8c1b634ba34a6c0cb6034451cc6d61dd,9/15(金) 20:35
ishikawa,日常的に刃物所持の可能性も…殺人事件で逮捕された男は7年前「刃物は護身用として持つ」と話す,https://news.yahoo.co.jp/articles/267baabc1d2db0fdf6e8060904b03a5455667d05,9/15(金) 20:30
ishikawa,長期のインターンシップで学ぶ…加賀屋のおもてなしとは,https://news.yahoo.co.jp/articles/124e139e25f32d70f67d9fe9fc6920a896ee15ca,9/15(金) 20:30
ishikawa,2度目の“辞職勧告決議”…飲酒運転で摘発された金沢市議 全会一致で可決も本人は改めて辞職否定,https://news.yahoo.co.jp/articles/443b4c21f4b1340226246698532d78bff8657497,9/15(金) 20:20
ishikawa,無許可で木伐採しコンクリ舗装…イオンリテールがビッグモーター店舗との賃貸契約解除 10月末で,https://news.yahoo.co.jp/articles/4178711bb2ca819047f3cb3791062056fc3d1986,9/15(金) 20:20
ishikawa,震度5強以上と同様に…線状降水帯発生で自動的に県の災害対策本部設置へ 知事が基準見直しの考え,https://news.yahoo.co.jp/articles/d3e3dba29d1656f2c0584126270c91f0ccd6e2e8,9/15(金) 20:15
ishikawa,1980年完成以降で最低値…手取川ダムの貯水率が19%まで低下 節水等の呼びかけは不要の判断,https://news.yahoo.co.jp/articles/9b4871365c0a9b482e9ad4829629a8133bf6f7fa,9/15(金) 20:10
ishikawa,【速報】イオンリテールがビッグモーターの店舗と土地賃貸借契約の解約を発表,https://news.yahoo.co.jp/articles/1eab312bc95927fa041e94328fdfb0dbab6a8794,9/15(金) 16:05
ishikawa,8月だけで18件の特殊詐欺被害　石川県警がコンビニなどに協力依頼,https://news.yahoo.co.jp/articles/338551a37ba7cbc62158d3a2d8783cae2a197041,9/15(金) 12:10
ishikawa,白山ホテル殺人事件で被害者は23歳の接客業と判明　刃物は護身用か計画的に用意したか捜査,https://news.yahoo.co.jp/articles/3e788596011ed8a28f953c4d73dd0fe4c4167fa6,9/15(金) 12:05
ishikawa,遊水地に「車が突っ込んでいく」と通報　転落の乗用車から高齢男性…意識不明の重体,https://news.yahoo.co.jp/articles/6eb5d4900c06cd45ee02d81234485063970f1455,9/14(木) 20:40
ishikawa,石川の食を次世代へ…とり白菜のさぶろうべいと輪島の老舗がコラボ『フグの白菜鍋』カギは事業承継,https://news.yahoo.co.jp/articles/ecf6db44b3407a4192fd5128b577ae7356005ffe,9/14(木) 20:35
ishikawa,“物質的想像力”をテーマに…北陸工芸の祭典「GO FOR KOGEI」9/15から富山で開催,https://news.yahoo.co.jp/articles/33dd6d9133e58f997cf0cc07945054a82d672ea6,9/14(木) 20:35
ishikawa,先生は災害対応のスペシャリスト…陸上自衛隊が小学生に防災の特別授業 テントの設営方法など指導,https://news.yahoo.co.jp/articles/05a342d1c7860f30b23aee9fc655707e6e60005b,9/14(木) 20:20
ishikawa,湖池屋の“ご当地ポテチ”…美大生が新パッケージをデザイン「感動をモチーフに」「金沢伝われば」,https://news.yahoo.co.jp/articles/61a744b0189c9ebbf0697ed2df66eb3caf50b6b0,9/14(木) 20:20
ishikawa,面識ない男が助手席から乗り込み女性暴行…車内のバッグ奪う強盗事件で逮捕,https://news.yahoo.co.jp/articles/cfa7800c898a792b03abcc2c855b21cfbf1ef7b5,9/14(木) 20:15
ishikawa,殺害した女性と面識なし…白山市内のホテルで女性殺害した男「死んでいるから殺意ないと言えない」,https://news.yahoo.co.jp/articles/4d6977a0007e2bc66bb2abf66a6d6c38c97e27d1,9/14(木) 20:10
ishikawa,十両で5連勝は唯一の大の里…立ち会いからつけいる隙あたえず,https://news.yahoo.co.jp/articles/3557f4b37a355a3060e06f4a461e32a5c27db0ad,9/14(木) 20:05
ishikawa,容疑者の男と被害女性は事件当日に”初対面”…石川県白山市のホテル殺人事件,https://news.yahoo.co.jp/articles/a564aff422ec07241f8cd699172035e21174a4ab,9/14(木) 12:10
ishikawa,高1の男子高校生が知人男性をパン切り包丁で切りつける…殺人未遂の疑いで逮捕,https://news.yahoo.co.jp/articles/92bf04eee2df132b6a2ee5b233b6f5abcd1f08dd,9/14(木) 9:25
ishikawa,23日から珠洲市全域で開催…奥能登国際芸術祭を市長自らPR 地震からの復興へ「ぜひお越しを」,https://news.yahoo.co.jp/articles/ea30cd8ab084941eb59e9fdf8b0ebd388b864454,9/13(水) 20:05
ishikawa,被害者は前部を集中的に刺される…ホテルで23歳女性を殺害した疑い 逮捕の54歳男に強い殺意か,https://news.yahoo.co.jp/articles/aecd44a51f8f02fe8d0330cf4264b2ef38fb6bd2,9/13(水) 19:55
ishikawa,224人が発熱等で休校の高校も…インフル・コロナ同時流行 インフルは昨季流行のまま今季入りか,https://news.yahoo.co.jp/articles/1e342d5810b2fe54260912a9064011ab44f8815c,9/13(水) 19:55
ishikawa,新十両対決を寄り切りで制す…津幡町出身の大の里は初日から4連勝,https://news.yahoo.co.jp/articles/6ddf50ac0d2a151d938948343d76f8ca86a0e9f0,9/13(水) 19:50
ishikawa,ハザードマップ活用し災害リスク周知へ…県とJA共済連石川が防災協定,https://news.yahoo.co.jp/articles/ac28c4a7e36c76f617a2069b4c130a506c14de08,9/13(水) 12:35
ishikawa,10月開催のいしかわ百万石文化祭を前に実施…警察や海上保安部などが密入国者の制圧訓練,https://news.yahoo.co.jp/articles/14edaf78ccf40f7d21699feed43b6938f3734a63,9/13(水) 12:35
ishikawa,白山市のホテルでの殺人事件…女性の傷は首や胸など体の前側に集中 強い殺意か,https://news.yahoo.co.jp/articles/fb8d8d95755c7a3821ae24f531ef60b82d8a731f,9/13(水) 12:30
ishikawa,小松市民病院で個人情報入った書類を紛失　受診票・予診票計4枚紛失も外部流出はないとみる,https://news.yahoo.co.jp/articles/e5d609eaed0a9e141546eb71e4e2e1b127f50ce8,9/12(火) 20:00
ishikawa,“インスタ狩り”などと称す…少年少女5人が男性呼び出し暴行や現金強奪か 裁判は上下関係焦点に,https://news.yahoo.co.jp/articles/b9e4a6ffaf41e0b7ba8e100e59769ce51fbf7a87,9/12(火) 19:55
ishikawa,新十両・大の里はベテランを押し出し3連勝　大相撲秋場所三日目の結果,https://news.yahoo.co.jp/articles/390cfb4883335bc78d739650763d4ee7c7b2a51d,9/12(火) 19:55
ishikawa,技術継承等のため…石川の食文化担う人材で『巨匠顕彰制度』県が新設へ 知事「技のAI分析など」,https://news.yahoo.co.jp/articles/ad24f45357edded4f316428d77ebf027efe4bf7b,9/12(火) 19:55
ishikawa,"“うまい,やすい,はやい”ココまで…吉野家が牛丼をドローンで配達する実証実験 実店舗で日本初",https://news.yahoo.co.jp/articles/3bd7b87cf55e81a2cc7b2c9d96105006a39ef0b7,9/12(火) 19:50
ishikawa,被害者は後からホテルへ…20代女性が刺殺された事件 分かってきた当日の動きと“容疑者の評判”,https://news.yahoo.co.jp/articles/59e39336edece602d5330bd7cecf7a3c6f47cce6,9/12(火) 19:45
ishikawa,マウスガードなど約1万800円相当万引き容疑で逮捕の自衛官　陸上自衛隊が陸士長を懲戒免職処分,https://news.yahoo.co.jp/articles/64fb85525f1d9f4234583680c1745253d52ba82c,9/12(火) 17:50
