media_en,title_articles,link_articles,date_original
mietvv,240万円横領で元市職員に懲役2年6カ月求刑　「常習性顕著で刑事責任は重い」　三重・伊賀市,https://news.yahoo.co.jp/articles/3619c21973f0c11d6e4b05b46fa868662c3ea487,9/23(土) 12:07
mietvv,対話をしながら経営課題　中小企業や小規模事業者を支援　三重・津市で合同研修,https://news.yahoo.co.jp/articles/b7df58e9c3447a6866442428848eb24449a5d127,9/23(土) 12:07
mietvv,強盗や窃盗を繰り返した男に懲役10年の判決　「中心的役割を担い責任は重い」　三重・津地裁,https://news.yahoo.co.jp/articles/1bb5f04e717c72576ffcec38a7f64e138b505f5a,9/23(土) 12:07
mietvv,メリーポピンズやモアナと伝説の海を氷上で　ディズニー・オン・アイス5年ぶりに三重で公演,https://news.yahoo.co.jp/articles/46e2a7a50ea1a71660bc5f7c9641fceb78014b3d,9/23(土) 12:07
mietvv,秋の神楽祭はじまる　参拝者もうっとり　雅楽の音色に古代絵巻　三重・伊勢神宮,https://news.yahoo.co.jp/articles/d34eaa9799d5a8986cbdfcb83b467f3875f4a5b6,9/23(土) 12:06
mietvv,F1日本グランプリ開催で世界各国から大勢のファン　母国レース「角田裕毅選手の表彰台を」　三重・鈴鹿サーキット,https://news.yahoo.co.jp/articles/568df4da558a6016c44d06fb324e784b11c20694,9/22(金) 19:10
mietvv,紙幣をカラープリントで作成か　偽1万円札を使おうとした男逮捕　三重・津市,https://news.yahoo.co.jp/articles/40bd4d9ae06f8ff35240b0b461c1487f60556f87,9/22(金) 12:51
mietvv,WBOアジアパシフィック・スーパーフェザー級王者の力石政法選手　3150FIGHT参戦へ,https://news.yahoo.co.jp/articles/48ff2e945eef6a84a26563df43486a008286b904,9/22(金) 12:51
mietvv,五輪金メダリストの土性沙羅さんが特命員　ふるさとの魅力発信へ　三重・松阪市,https://news.yahoo.co.jp/articles/a9d3e80916422d91e0639776a2a9283571d3c351,9/22(金) 12:51
mietvv,わずか40秒ほどで大差勝利　藤波朱理選手がパリ五輪内定　三重・四日市市,https://news.yahoo.co.jp/articles/70cf45886f142dcac913bcdc86c51985377ce489,9/22(金) 12:51
mietvv,重度知的障がい者に暴行の疑い　松阪市が調査し虐待認定　三重県いなば園,https://news.yahoo.co.jp/articles/79f49e519e70ee7a4c7aa234c4dc611f91c452ab,9/22(金) 12:51
mietvv,松坂競輪場で大阪・関西万博PR　公式キャラクターのミャクミャクが表敬　三重・松阪市,https://news.yahoo.co.jp/articles/c004ab15449c7c925df53a9d94b3376989da9ecd,9/22(金) 12:50
mietvv,三重の交通事故死者44人　半数近く占める65歳以上の高齢者　秋の全国交通安全運動,https://news.yahoo.co.jp/articles/66d392959994ce641df09e5350952b653c98e68e,9/22(金) 12:50
mietvv,異業種で働く女性が意見交換　ジェンダーギャップと人口減少対策　三重・津市,https://news.yahoo.co.jp/articles/94ac7dc348604a5cd278e4dbdeb80f61be7744f2,9/22(金) 12:50
mietvv,手ぶらソロキャンプなど楽しみながら三重を周遊　2億4000万円を補助,https://news.yahoo.co.jp/articles/3a17492f87753ccb9cf06c19bd01811e48cbfe9e,9/22(金) 12:50
mietvv,運行開始から120年　「バスの日」にシロモチくんが利用呼びかけ　三重・津市,https://news.yahoo.co.jp/articles/2d9056f640470a386c8f0277b0758ce3ff27271d,9/21(木) 12:51
mietvv,児童書や雑誌など約2万700点の電子書籍が無料　東海3県で最多　三重・四日市市,https://news.yahoo.co.jp/articles/19f3db7542a862067445407447654474952c7a92,9/21(木) 12:51
mietvv,米沢牛たっぷり弁当やとり皮焼き重ねた串焼き　北海道から九州のおいしいもの集結　三重・津市,https://news.yahoo.co.jp/articles/fd8816fd8dd3ac5bd079a1ad5500df3ea4bc92f1,9/21(木) 12:51
mietvv,三重でも新型コロナワクチンの接種始まる　自己負担なしは最後の可能性,https://news.yahoo.co.jp/articles/e20bfebf2cddfe12c8221ed00161ce4a50d55523,9/21(木) 12:51
mietvv,結婚を希望する人を支援　20代から70代の52人がサポーターに　三重県,https://news.yahoo.co.jp/articles/9d8fbd2972128de2d7e06de456c874067158ef20,9/21(木) 12:50
mietvv,1校学年閉鎖　8校で学級閉鎖　三重で増加のインフルエンザ感染,https://news.yahoo.co.jp/articles/caf1e61628002cf1c58b2a486910fc2a468ff631,9/21(木) 12:50
mietvv,レスリング世界選手権で三重出身の2人が快挙　奥野春菜選手は金メダル　藤波朱理選手はパリ五輪内定,https://news.yahoo.co.jp/articles/31cec36e39f7f80becd591abbc36b0fb6e15be28,9/21(木) 12:50
mietvv,390万ダウンロードの登山地図アプリ　遭難した際は位置情報共有　三重県と県警がヤマップと協定,https://news.yahoo.co.jp/articles/235f84467265baa7b4285af3cc415073022fbd3a,9/21(木) 12:50
mietvv,熊野古道の世界遺産登録20周年や関西万博　「三重を国内外に売り込む絶好のチャンス」　一見知事が意気込み,https://news.yahoo.co.jp/articles/e94972ea4a50028fa50690fbb6c848d5fd4d9fa4,9/20(水) 12:51
mietvv,近鉄四日市駅西側は30万6000円　工業地は上昇も住宅地と商業地は下落　三重の地価,https://news.yahoo.co.jp/articles/0628556d75b7a88f0c4af362598298c587b20f56,9/20(水) 12:51
mietvv,赤色の稲穂と緑色の葉　色付く古代米　三重・大安町,https://news.yahoo.co.jp/articles/d6b3e2464f2a054e05fbddb030a04c28a003ee0a,9/20(水) 12:51
mietvv,交通事故で半身不随の女性　卓球通じ新たな希望　特別番組を審議,https://news.yahoo.co.jp/articles/cbe7b7abc6822e0ddfe251053ae1a73a290b417a,9/20(水) 12:50
mietvv,「漁船が転覆状態で漂着」　第三岡安丸の男性船長が死亡　三重・神島,https://news.yahoo.co.jp/articles/1690c5f1d83700d5ccbc02b35ecf96dbc147d8bc,9/20(水) 12:50
mietvv,林道を散歩中の女性が猟犬4頭に耳噛まれ大ケガ　猟友会メンバーの男性を書類送検　三重・度会町,https://news.yahoo.co.jp/articles/519aa5575cbcba9a9ccfcd50e49070f7d09f935d,9/20(水) 12:50
mietvv,1日20件の欠席連絡　教室から職員室に戻ることなく把握　三重でも進むアプリ活用で教職員の負担軽減へ,https://news.yahoo.co.jp/articles/b3dcad5589496395028d21e2db0d876112c18a3b,9/20(水) 12:50
mietvv,敬老の日は百貨店の館内放送で「ありがとう」　恥ずかしがる孫の感謝アナウンス　三重・津市,https://news.yahoo.co.jp/articles/42e01a1f7ae1c9251ef7062bc9a81d2504dcee9f,9/19(火) 12:51
mietvv,敬老の日に健康と長寿願って箸作り　世界に一つだけのとっておき　三重・多気町,https://news.yahoo.co.jp/articles/09fc66baa80812b74f19dd278f328e943a583745,9/19(火) 12:51
mietvv,三重ホンダヒートの選手たちが衣料品と食料品寄贈　SDGsフェス　三重・四日市市,https://news.yahoo.co.jp/articles/e8d3b7295af4bc5070206b6b1ee63316073e8aa0,9/19(火) 12:50
mietvv,平和への思い筆に載せ　子どもたちが力強く披露　三重・護国神社,https://news.yahoo.co.jp/articles/0d1cd146dd1bf0decec138758ff8ed4b3554ab1f,9/19(火) 12:50
mietvv,弥生時代に使われた台付甕　粘土を使って親子連れが再現　三重・松阪市,https://news.yahoo.co.jp/articles/7b27b6725a67cdc459383472825e2b3d53e177ea,9/19(火) 12:50
mietvv,三重の景況感は3期連続「下降」　マイナス幅は縮小　自動車関連企業の生産水準が回復,https://news.yahoo.co.jp/articles/8028c2a79722ef6c9cf46f0b4eb3970313724bfc,9/19(火) 12:50
mietvv,涼しい山頂で愛犬とヨガ　目を合わせたり体に触れあい深い呼吸　三重・御在所ロープウエイ,https://news.yahoo.co.jp/articles/feeee043abd67c1936f7e6b867eb360703efcf49,9/18(月) 12:52
mietvv,高校生が育てる三重の特産米　生徒自ら店頭で販売　問い合わせの電話も相次ぐ人気　県立明野高校,https://news.yahoo.co.jp/articles/ed851ac7fd39d0309a3bc2b76d8a901bfed09782,9/18(月) 12:51
mietvv,水沢産茶葉で入浴剤　一面に広がる香りといやし　神戸高校の生徒が小学生とワークショップ　三重・四日市市,https://news.yahoo.co.jp/articles/6a17d0be26e7566973a3f4a95f5f1754af1c2536,9/18(月) 12:51
mietvv,鼻息で音色奏でる「鼻笛」日本一　技術だけでなく個性も審査対象　まずは「鼻ならし」　三重・四日市市,https://news.yahoo.co.jp/articles/891ae59fe18f41cbf08a9eaf9171d34ce5744636,9/18(月) 12:51
mietvv,三重が逆転勝利で準々決勝進出へ　あと1本が出なかった木本　秋の高校野球三重県大会,https://news.yahoo.co.jp/articles/d6c1b61543aea44f1c536da1629bb0797bac766d,9/18(月) 12:51
mietvv,素潜りの男性遺体で発見　連休に家族と井内浦農村公園へ　三重・熊野市,https://news.yahoo.co.jp/articles/50eedf9a713e6dd63284599b56aa013d0ccb35f1,9/18(月) 12:51
mietvv,おちょこ片手に自慢の地酒100種類を試飲　頬を赤らめ笑顔　25の酒蔵参加　三重・津市,https://news.yahoo.co.jp/articles/8e68d92d09fd1fa39d8b9d75134c36015c63d473,9/18(月) 12:50
mietvv,全国各地の招き猫1万点が集結　今年は「卯辰が上がる福招き」　熱心なファンで熱気　三重・おかげ横丁,https://news.yahoo.co.jp/articles/043d8c8250c7a2fa78bb5f0a815c8876b7ab4fb6,9/18(月) 12:50
mietvv,目標に向かって頑張る人を食で応援　競泳五輪メダリスト松田丈志さんトークショー　三重・桑名市,https://news.yahoo.co.jp/articles/2a5cedef5d3408ba6d6dc0dc75c2c2008f5a162a,9/18(月) 12:50
mietvv,日本酒など名産品1200種　東京から魅力発信「三重テラス」　10周年で大幅リニューアル,https://news.yahoo.co.jp/articles/10edafb2ba54ccf4e82ccf140d7a7e3bc40302d0,9/18(月) 12:50
mietvv,木本や高田が2回戦進出　秋の高校野球三重県大会が開幕,https://news.yahoo.co.jp/articles/c981f56bf73d348a23aad961a559d7216258b0c7,9/17(日) 11:11
mietvv,熊野市の海岸で41歳男性が行方不明　海に流された可能性　三重・井内浦農村公園,https://news.yahoo.co.jp/articles/719f1c4bb8bd966e0733c8911ac251040047ee54,9/17(日) 10:34
mietvv,旧・百五銀行本店をジオラマで再現　約15年かけて会社員の山口さんが制作　三重・津市,https://news.yahoo.co.jp/articles/ad250cd8f246d82ff35df3b5bfa009de329b5814,9/16(土) 17:00
mietvv,「極道を雇わなあかん」知人から1400万円以上をだまし取る　消防組合の男性が懲戒免職　三重・松阪市,https://news.yahoo.co.jp/articles/5a482e499752026295acbd877b58cc181989139c,9/16(土) 12:08
mietvv,三重で100歳以上の高齢者が過去最多　111歳となる明治生まれの女性も,https://news.yahoo.co.jp/articles/8db36f052085d5e37726bf1de619b72e68977487,9/16(土) 12:07
mietvv,緑色の皮からオレンジ果実　極早生ミカン「味一号」が出荷　三重・御浜町,https://news.yahoo.co.jp/articles/aa420df50f435676ee1a000ecdca767e460d802d,9/16(土) 12:07
mietvv,ほこりは上から下へ　小学生に掃除の奥深さ伝える出前授業　三重・藤水小学校,https://news.yahoo.co.jp/articles/24946776812d0a1ed6f036a86fbb7c38977df622,9/16(土) 12:07
mietvv,災害時の助け合い提案　一見知事と花角知事が共通課題の意見交わす　三重・多気町,https://news.yahoo.co.jp/articles/ed80d965d989884e312403f811ee45ddc4b2c27a,9/16(土) 12:06
mietvv,8割が県外進学の三重　新大学設置を議論 「戻ってくる仕組みが重要」との声も,https://news.yahoo.co.jp/articles/88689ff53da125c2d0a5ab0430245ace3691be76,9/16(土) 12:04
mietvv,就任2年迎える一見知事　新型コロナ対応など振り返る　三重県庁,https://news.yahoo.co.jp/articles/7a2bba278c72503a9f7d3f7dcacce7ce3de21bc9,9/15(金) 12:51
mietvv,秋風でゆれる白銀色の穂　パンパスグラスが見頃　三重・松阪農業公園ベルファーム,https://news.yahoo.co.jp/articles/7b6350c28fd6134f4245584fd335fdbf0ddf9fb5,9/15(金) 12:51
mietvv,「大切な情報は口で伝える」電話応対スキルを競う大会　優勝者は全国へ　三重・津市,https://news.yahoo.co.jp/articles/422d48ea022cd49f01a0566ca2edab25f0fc9703,9/15(金) 12:51
mietvv,借り上げた農地を企業に貸し出し　農業新規参入の課題解決へ　三重県農林水産支援センター,https://news.yahoo.co.jp/articles/13ed85c90c802439dede3730a74bf90003d30ea3,9/15(金) 12:51
mietvv,三重県と新潟県が懇談会　花角知事がスマート農業に取り組む農園視察　両県の課題解決に,https://news.yahoo.co.jp/articles/e5382533fed7dfe02b80a0bcaf1671f20d41248b,9/15(金) 12:50
mietvv,障がい者雇用進める企業を表彰　共に働くことが当たり前の社会へ　三重・津市,https://news.yahoo.co.jp/articles/4d0822f9eccc3c36d3e0eb52c00d9a7d31619eb2,9/15(金) 12:50
mietvv,カニ取りから帰らず　沖合の海底で発見　65歳の男性死亡　三重・鈴鹿市,https://news.yahoo.co.jp/articles/50610e0a73c00cd3894424d1de293b00c4c18c4c,9/15(金) 12:50
mietvv,中国の警察官名乗る電話　20代女性が特殊詐欺被害に　三重・多気町,https://news.yahoo.co.jp/articles/d62b091d08873309b9a286135babc61589ae390f,9/15(金) 12:50
mietvv,神社放火の疑いで35歳男を逮捕　「本能寺が燃えるシーンやってみようと」　三重・津市,https://news.yahoo.co.jp/articles/3caecc698139ab222d5ba66616d8dd53407acef2,9/15(金) 12:50
mietvv,三多気の桜で知られる美杉町　伊藤園がミツマタ広がる新名所にソメイヨシノを植樹,https://news.yahoo.co.jp/articles/f04a3dfa2e3f988dfd25849c36178875aea9cf6b,9/14(木) 12:08
mietvv,安心して過ごせる居場所つくる「けいわっこカレー食堂」　津ロータリークラブが支援金を寄付,https://news.yahoo.co.jp/articles/805fbe69d0638fc01013d8f30f655fe3d6c695ac,9/14(木) 12:07
mietvv,人口減少地域を支える「南伊勢町おむかえバス」　町民の声に耳を傾け本格運行へ　三重・南伊勢町,https://news.yahoo.co.jp/articles/0522e6ce303f400951af0d4f097c58fc037648c5,9/14(木) 12:07
mietvv,三重県の景気が緩やかに回復　製造業が3期ぶりに上昇　半導体供給制約の緩和が影響か,https://news.yahoo.co.jp/articles/8bd6ca124431947abf9396901ef06916a48ac802,9/14(木) 12:07
mietvv,国内最大規模のクライミング施設が完成　国際大会規格の3種類の壁　三重・伊賀市,https://news.yahoo.co.jp/articles/1f1ffe92990c93f60ce395f3f4dda09adfcc4bc8,9/14(木) 12:05
mietvv,三重のレギュラー価格が約4カ月ぶりの値下がり　1リットルあたり183.5円に,https://news.yahoo.co.jp/articles/a3402356f18e2420184c9d2fc059705f26b7f4f0,9/13(水) 18:30
mietvv,6月の大雨で浸水被害を受けた伊勢志摩地域　3市長が三重県に対策求める,https://news.yahoo.co.jp/articles/da9bdfb6b280d138cfbf4f31f1e2ca9085a31664,9/13(水) 12:51
mietvv,「お客さまの声を販売に」ぎゅーとらの新商品発表会　試食会で人気投票　三重・津市,https://news.yahoo.co.jp/articles/76a2e63da1cecfbaab6f5128addc8578f7379acf,9/13(水) 12:51
mietvv,災害時の救援物資の費用に　日本赤十字に活動支援金100万円　三重・四日市市,https://news.yahoo.co.jp/articles/12d8a630c7a1f35aa1a77a3ac445e8ce7d9dc792,9/13(水) 12:50
mietvv,資金調達に苦しむ中小企業をサポート　三重県信用保証協会が3者と覚書締結,https://news.yahoo.co.jp/articles/18361beb6240cab6670a967e8d47e1205857e856,9/13(水) 12:50
mietvv,地元サッカークラブを応援　Jリーグ昇格目指す「FC伊勢志摩」に支援金　三重・伊勢市,https://news.yahoo.co.jp/articles/abd5c05cd562c4712c5fbfef98dd1d7ec7b8e9d9,9/13(水) 12:50
mietvv,三重で新型コロナ4週間ぶりの減少　インフルエンザは増加で9校が学年・学級閉鎖,https://news.yahoo.co.jp/articles/5fa9501e48d0f7a572eb7277204096fbab4fe0c5,9/13(水) 12:50
mietvv,いなべ総合は高田ー津西の勝者と対戦　秋の高校野球三重県大会の組み合わせ決まる,https://news.yahoo.co.jp/articles/c48b899988825c4f34524056521e93ba9fba1d0b,9/13(水) 12:50
mietvv,三重県の結城神社で火事　放火の可能性　授与所の一部が燃える,https://news.yahoo.co.jp/articles/f4f4c617e1c9bcc36a4fd7c7056ef1e1e39d97d8,9/13(水) 10:46
mietvv,認定こども園の不適切保育問題　保育士の数増やすよう求める報告書を提出　三重・桑名市,https://news.yahoo.co.jp/articles/33fe8a9ba913d814ba9a71e1d919ebb3aacbdcf5,9/12(火) 12:51
mietvv,9月でも夏物商品が売れ行き好調　電気代の高騰で閉店早める対策も　三重・松菱,https://news.yahoo.co.jp/articles/cb64d0ea1b5f389362752884bb3d5452027042ae,9/12(火) 12:51
mietvv,三十三FGが「みえ松阪マラソン」を支援　500万円寄付　飲み物など大会の運営費に,https://news.yahoo.co.jp/articles/d72a1f70b166328b023a5979088e6beeb87073b0,9/12(火) 12:51
mietvv,百五銀行の新入行員たちが森林を整備　倒れた木など取り除く　三重・多気町,https://news.yahoo.co.jp/articles/2cadf23a062ab9cf60a70f20283141407f2e0c6b,9/12(火) 12:50
mietvv,1340枚の棚田が連なる丸山千枚田で稲刈り　田んぼオーナーら570人参加　三重・熊野市,https://news.yahoo.co.jp/articles/d52caabe892fff4ff3c6c746c5ea632c09866957,9/12(火) 12:50
mietvv,強盗致傷など繰り返したか　無職の男（25）に懲役12年を求刑　判決は22日　津地方裁判所,https://news.yahoo.co.jp/articles/47ebcbfbac81041bdc122e89935cf3b290170d1e,9/12(火) 12:50
mietvv,「行政の現場感覚を」京大生が三重県議会インターンシップに参加,https://news.yahoo.co.jp/articles/3557e976ce74f3c3ce48dd38cb10a05926ba9fac,9/12(火) 12:50
mietvv,小学生が軟式野球の県ナンバーワン目指し白熱　ろうきん杯三重県学童軟式野球大会,https://news.yahoo.co.jp/articles/644118b097e967cfe826477d1ddcf75c1b29f9e7,9/11(月) 12:52
mietvv,縦横無尽に旋回するカースタント　世界9カ国30人以上のハッピードリームサーカス開幕　愛知・名古屋市,https://news.yahoo.co.jp/articles/88802509f4629744c1d4e25d83f2862e7140654b,9/11(月) 12:52
mietvv,財界人で芸術家の川喜田半泥子　生前に制作した俳句や陶芸品紹介　三重・石水博物館,https://news.yahoo.co.jp/articles/daa72a53dd2e5de82918801c85eb8269a15d1f6a,9/11(月) 12:52
mietvv,作品に合わせ作家自ら額装も　花の色彩と木の質感が一体に　絵画と共に楽しんで　三重・桑名市博物館,https://news.yahoo.co.jp/articles/a7f2252260ee631d899eba8c717ce033f08ba6b2,9/11(月) 12:51
mietvv,直径120cmの花火を海上で　真っ暗な夜空が音楽に合わせ鮮やかに　三重・鈴鹿げんき花火大会,https://news.yahoo.co.jp/articles/738b6c1a6c94d037a8fd08c66097d3f3f80c3041,9/11(月) 12:51
mietvv,三重高校硬式野球部OB会創設60周年　高知の明徳義塾高校と招待試合　三重・松阪市,https://news.yahoo.co.jp/articles/044f6b6570213558f39b4995189b41020fa876c5,9/11(月) 12:51
mietvv,特攻機用飛行場の歴史描いた児童文学作品「ひこうき」　小中学生などが絵本と絵画　三重・菰野町,https://news.yahoo.co.jp/articles/01ff3461fd4b1d00d20b75c1f75c2069b5dfa953,9/11(月) 12:51
mietvv,集めたゴミの種類と重さで競うスポGOMI　三重県立津工業高校が全国大会へ,https://news.yahoo.co.jp/articles/19d10a99620bb08c5a9e23047291a87bdf8f91a0,9/11(月) 12:50
mietvv,住宅全焼し焼け跡から遺体　住人の55歳女性と連絡取れず　三重・桑名市,https://news.yahoo.co.jp/articles/8225ae2730c2d852382e2189c8485c7c57d83b66,9/11(月) 12:50
mietvv,三重のボランティア高校生「震災の恐ろしさ実感」　津波で多数の児童や教員が亡くなった宮城の大川小学校見学,https://news.yahoo.co.jp/articles/bd053d7e61a10046879c63baae70cb9b6d0e3651,9/11(月) 12:50
mietvv,伊勢茶でどら焼き　萬古焼の急須でかぶせ茶ゆっくり抽出　三重県立みえこどもの城,https://news.yahoo.co.jp/articles/90c8c9605676c47dec64f9e84d66ba80544c2c14,9/11(月) 12:50
