media_en,media_jp,title_articles,link_articles,date_original
ohbsn,ＢＳＮ新潟放送,志望大学合格へ!誘惑を断ち切って1日12時間猛勉強　ホテルで合宿スタート!,https://news.yahoo.co.jp/articles/65093f80abbfb99d4b493b144fd19c699ec53750,12/31(日) 17:18
ohbsn,ＢＳＮ新潟放送,民家裏から山方向へ歩くクマ目撃　新潟・新発田市,https://news.yahoo.co.jp/articles/7a678e618b1e6f53f0acd866ff5c975609d58d81,12/31(日) 16:24
ohbsn,ＢＳＮ新潟放送,仲裁に入った男性殴り、顔面を骨折させたか　酒に酔った土木作業員の男、傷害の疑いで逮捕　新潟・上越,https://news.yahoo.co.jp/articles/7492e116fa5ef6b3653d99dc432c8ef0f4675ec3,12/31(日) 16:23
ohbsn,ＢＳＮ新潟放送,帝京長岡、同点に追いつくも…　強豪・市立船橋にPK戦で敗れる　全国高校サッカー選手権,https://news.yahoo.co.jp/articles/37305cf9737d5c46d6fa19f84b19a954a36d4446,12/31(日) 15:03
ohbsn,ＢＳＮ新潟放送,頭を押さえつけたり両足を掴み引きずったり…　無職の男（31）を暴行の疑いで現行犯逮捕,https://news.yahoo.co.jp/articles/725acdd05dfdd847d640c1f8d7dcddad6e43033b,12/31(日) 13:13
ohbsn,ＢＳＮ新潟放送,高速道路上で女性をガードレールに押し倒す暴行容疑　無職の男（43）を現行犯逮捕,https://news.yahoo.co.jp/articles/65e150231db685165644770b12163dcee3cecae6,12/31(日) 12:23
ohbsn,ＢＳＮ新潟放送,“山の妖精”山本唯翔（城西大4年）は2年連続 自身3度目の5区山登りへ　箱根駅伝・区間エントリー,https://news.yahoo.co.jp/articles/3d150b07bb4997b56bd6f308bfc8db6fdadd6665,12/31(日) 10:02
ohbsn,ＢＳＮ新潟放送,いざ元日決戦　服部勇馬はアンカー7区、服部弾馬は1区、岸本大紀は5区にエントリー　ニューイヤー駅伝,https://news.yahoo.co.jp/articles/508e9d6292ac95ddb53e3a99d1412909a0a576c9,12/31(日) 8:02
ohbsn,ＢＳＮ新潟放送,『雪国 売ります』400kmの“長旅”をした雪が教えてくれたもの 〜豪雪地 安塚町の挑戦〜【あの日あの時】,https://news.yahoo.co.jp/articles/dc2a247162d0df16b542995c780b5b75ca944652,12/31(日) 5:01
ohbsn,ＢＳＮ新潟放送,上越新幹線　北陸新幹線　自由席乗車率最大で140％に　帰省ラッシュピーク迎える,https://news.yahoo.co.jp/articles/9a07da1f6e8bf9a71ac5d6906e842b234d31cbf9,12/30(土) 18:54
ohbsn,ＢＳＮ新潟放送,ズワイガニに浜焼きがずらりと!　寺泊「魚の市場通り」年末で賑わう,https://news.yahoo.co.jp/articles/1a05c2127177f7463581bcdfc4983e7555784158,12/30(土) 18:51
ohbsn,ＢＳＮ新潟放送,住宅全焼　焼け跡から1人の遺体…70代男性と連絡取れず　新潟・阿賀野市,https://news.yahoo.co.jp/articles/9bb403381f7e56b5729749d48382f5ee154367f2,12/30(土) 18:18
ohbsn,ＢＳＮ新潟放送,試合終了間際に決められ…アルビレックス新潟レディース C大阪Lに0対1で敗れる,https://news.yahoo.co.jp/articles/318d4c89e460828ec4cd435d9951aaa6e3633012,12/30(土) 16:11
ohbsn,ＢＳＮ新潟放送,開志学園JSC　高知学園高知に1対2で敗れ初戦敗退　高校女子サッカー選手権,https://news.yahoo.co.jp/articles/75e28d94d257a2359e44c5b595fd240d482f5377,12/30(土) 16:06
ohbsn,ＢＳＮ新潟放送,『そのときには』と思い続けて3年間…「新たな日常」を手に入れた2023年,https://news.yahoo.co.jp/articles/1a1a1a5c4177f664d9cb73fff20d93515acfc35d,12/30(土) 14:33
ohbsn,ＢＳＮ新潟放送,上越新幹線乗車率ほぼ100％　30日は帰省ラッシュピーク予想日（30日午前10時現在）,https://news.yahoo.co.jp/articles/eca502b9a36895bcfdf8fedb4365c0fa281d1b88,12/30(土) 10:53
ohbsn,ＢＳＮ新潟放送,阿賀野市の商店街で住宅火災　73歳男性と連絡取れず　新潟,https://news.yahoo.co.jp/articles/95b3c6ed2adb3dc871d4b9bb006131e819e44231,12/30(土) 10:09
ohbsn,ＢＳＮ新潟放送,家計簿から振り返る2023年の“やりくり”　食品の値上げ品目 実に3万2395点 ほか,https://news.yahoo.co.jp/articles/2073f48284e011152ed56dba4a012f2d6c430728,12/30(土) 1:02
ohbsn,ＢＳＮ新潟放送,ラグビー日本代表監督に再任のエディー氏 　来春のキャンプに新潟を示唆,https://news.yahoo.co.jp/articles/84df9c183755e1dd931753c502c19cb981aef732,12/29(金) 17:03
ohbsn,ＢＳＮ新潟放送,東京駅発時点の乗車率が130％の列車も　大きな荷物持つ客や家族連れで混雑続く（29日午後4時現在）,https://news.yahoo.co.jp/articles/396ac40f60a39c713c53189bedd16c4d33e20a6e,12/29(金) 17:01
ohbsn,ＢＳＮ新潟放送,「この先、何も考えられない...」住宅など8棟焼ける火事から一夜明け 実況見分　新潟・長岡市寺泊地域,https://news.yahoo.co.jp/articles/c040eb13ca6b633ea9e70783486a8b867235c53f,12/29(金) 16:59
ohbsn,ＢＳＮ新潟放送,試合終了間際の劇的ゴールで逆転勝利　帝京長岡 長崎総科大付属に勝ち2回戦進出　高校サッカー選手権,https://news.yahoo.co.jp/articles/12f86eb99337d82f2a5245ba59829fe1ccc1c721,12/29(金) 16:21
ohbsn,ＢＳＮ新潟放送,北陸新幹線 金沢行で自由席乗車率120％の列車も　大きな荷物を持つ客や家族連れで混雑（29日午前10時現在）,https://news.yahoo.co.jp/articles/b27201d4af938ae8b9fbaeb3548db9212121889e,12/29(金) 10:48
ohbsn,ＢＳＮ新潟放送,知人女性を殴ったり首を絞めたりしてけがをさせた疑い　派遣社員の男（21）を逮捕,https://news.yahoo.co.jp/articles/14e1850dc051722e47cc0dafc4aa68f2661d7c98,12/29(金) 10:11
ohbsn,ＢＳＮ新潟放送,飲食店に居合わせた男性客を殴り、けがをさせた疑い　無職の男（52）を現行犯逮捕,https://news.yahoo.co.jp/articles/947dc592d553ab6341eb7bdaf920ee04a98250aa,12/29(金) 10:08
ohbsn,ＢＳＮ新潟放送,過失運転傷害の疑いで73歳の女逮捕　はねられた70代女性は一時意識不明に,https://news.yahoo.co.jp/articles/5c9bcbbea3f83a054176df36d924bf81e63bb247,12/29(金) 10:01
ohbsn,ＢＳＮ新潟放送,「地元の不安に対し説明の場を設ける」“運転禁止”命令解除に柏崎刈羽原発所長,https://news.yahoo.co.jp/articles/6c346ef7257b7716b762e4f99de4a0f9022d49ac,12/28(木) 18:34
ohbsn,ＢＳＮ新潟放送,「歴史上の事件ではなく現在進行形の問題」林芳正官房長官 横田めぐみさんの拉致現場を視察,https://news.yahoo.co.jp/articles/db3f0166a40f90012e00544224f68bac691c5125,12/28(木) 18:27
ohbsn,ＢＳＮ新潟放送,山からの風で延焼拡大か　寺泊地域で住宅など6棟焼け5世帯17人が被災　長岡市が災害対策本部設置,https://news.yahoo.co.jp/articles/6fd76d543bd57e7e65875f12c99c7ed4fe3712b3,12/28(木) 18:22
ohbsn,ＢＳＮ新潟放送,長岡市寺泊地域の火災　午後3時過ぎに鎮火　6棟焼ける,https://news.yahoo.co.jp/articles/8fd353106ff5148de25502572dbdd145abf7f00a,12/28(木) 15:39
ohbsn,ＢＳＮ新潟放送,自宅裏の畑に体長0.5mほどのクマが…その後クマは南へ走り去る　新潟・新発田市,https://news.yahoo.co.jp/articles/714e68271f9f6b1191502fcc509212111b6a5a4c,12/28(木) 13:42
ohbsn,ＢＳＮ新潟放送,住宅など少なくとも10棟が焼ける火災　火元の住人が肩にやけど負い病院へ搬送　新潟・長岡市寺泊,https://news.yahoo.co.jp/articles/049bebb086cb01c16813e69990709a5dd402b1c4,12/28(木) 13:09
ohbsn,ＢＳＮ新潟放送,ラストプレーでトライも…　高校ラグビー・北越は明和県央（群馬代表）に5対54で敗れ初戦突破ならず,https://news.yahoo.co.jp/articles/db87d462e3ad1b4d7482d00152cba3623575d046,12/28(木) 13:06
ohbsn,ＢＳＮ新潟放送,官製談合事件初公判　新発田地域振興局の元幹部職員ら起訴内容認める　懲役1〜2年を求刑　新潟,https://news.yahoo.co.jp/articles/2d97b4e1ed17060ee2afe39fda082178a2ebf5b2,12/28(木) 12:02
ohbsn,ＢＳＮ新潟放送,「佐渡金山の世界遺産登録目指せ!」28日から運行開始『黄金のラッピングバス』,https://news.yahoo.co.jp/articles/e6d05538f7210038a71b066509e859edae9cb35b,12/28(木) 12:02
ohbsn,ＢＳＮ新潟放送,JR上越新幹線や北陸新幹線などに目立った混雑なし（28日午前10時現在）,https://news.yahoo.co.jp/articles/ac9c29e24e529683eb945afdc218a16316f3deba,12/28(木) 11:44
ohbsn,ＢＳＮ新潟放送,野菜直売所で寝ているイノシシが…その後、山に逃げる　新潟・長岡市小国町,https://news.yahoo.co.jp/articles/9053d3259612a7402cdaad5ec1f5202d67d237e5,12/28(木) 11:09
ohbsn,ＢＳＮ新潟放送,新たな翼に“市民の足”　ウイルス禍を越え、燃料費や人件費高騰も…　暮らしを支える交通の未来,https://news.yahoo.co.jp/articles/8f20e91c4c4525b081f3adf7a7f77b011609ec99,12/28(木) 6:02
ohbsn,ＢＳＮ新潟放送,19点差をはね返すも…バスケ・開志国際　藤枝明誠に敗れ、連覇を逃す　ウインターカップ準々決勝,https://news.yahoo.co.jp/articles/26d187fa6d863d08f15b64cdb86431342fbbdaca,12/27(水) 20:46
ohbsn,ＢＳＮ新潟放送,典型的なオレオレ詐欺　おいを名乗る男に現金100万円をだまし取られる　新潟市東区,https://news.yahoo.co.jp/articles/6469de1126b6d99f59b02138c008b0e8741477ad,12/27(水) 19:08
ohbsn,ＢＳＮ新潟放送,全国高校ラグビー開会式「新潟代表 北越は群馬代表 明和県央」と28日対戦,https://news.yahoo.co.jp/articles/18c7bde4deb9c944e2ba3744218b536cfbcd4eb3,12/27(水) 18:32
ohbsn,ＢＳＮ新潟放送,"「今後は地元の同意が最大の焦点に」規制委が柏崎刈羽原発の""運転禁止""命令を解除",https://news.yahoo.co.jp/articles/db14dacbf5744c9dee3dbc8f9397ad03e903faf2,12/27(水) 18:24
ohbsn,ＢＳＮ新潟放送,強烈寒波に強烈猛暑…天気に振り回された2023年　今後試される対応力,https://news.yahoo.co.jp/articles/7c50581c70e0fb8b25d9e2324758886ae0f95c19,12/27(水) 16:36
ohbsn,ＢＳＮ新潟放送,原発の運転禁止解除に「いい規制・いい電力事業を展開して欲しい」と立地自治体の刈羽村長がコメント,https://news.yahoo.co.jp/articles/7ec818124d539766672e92ad822b35d0a89dca17,12/27(水) 14:03
ohbsn,ＢＳＮ新潟放送,「どうやって食べていけるか本気になって考えていかないと…」新潟市議らが国会議員に農業政策を陳情,https://news.yahoo.co.jp/articles/9142f4fc50f3e93163cdfd8875be9006735a4825,12/27(水) 12:06
ohbsn,ＢＳＮ新潟放送,"再稼働への議論「次のステージへ」柏崎刈羽原発の""運転禁止""命令『解除を正式決定』原子力規制委",https://news.yahoo.co.jp/articles/9a278e974f39b10f92678d79ef648b1343b14039,12/27(水) 12:02
ohbsn,ＢＳＮ新潟放送,"【速報】柏崎刈羽原発の""運転禁止""命令『解除』を正式決定原子力規制委",https://news.yahoo.co.jp/articles/cb2b0452c63cec090e32c457c4f046bb23a0476d,12/27(水) 11:03
ohbsn,ＢＳＮ新潟放送,パンデミック後も伸び悩む上海線「手間が… 再開後もほとんど行き来していない」望まれるビザ免除再開,https://news.yahoo.co.jp/articles/cb6a2ebbfee192b33f0da72e1f5452526ee2c46b,12/27(水) 5:02
ohbsn,ＢＳＮ新潟放送,直属の上司に容姿を侮蔑したり人格を否定するような暴言など　新潟市の男性職員が停職6か月の懲戒処分,https://news.yahoo.co.jp/articles/94e99a001e3f6a2fbcfd3e5a97e6907d59ca5f9b,12/26(火) 20:29
ohbsn,ＢＳＮ新潟放送,人材確保を…小学校教諭の採用試験を複数回実施へ　大学3年生での“特別選考”も　新潟県教育委員会,https://news.yahoo.co.jp/articles/40297034853a15bf82a6b55bf8df0f9f9199dcb6,12/26(火) 20:18
ohbsn,ＢＳＮ新潟放送,ウインターカップ　連覇かけて開志国際　100点ゲームで3回戦突破,https://news.yahoo.co.jp/articles/6593da8649362a4b6d89c87bc7cae349e5a5923b,12/26(火) 18:53
ohbsn,ＢＳＮ新潟放送,「2021年度以降認定者はなし」14人を1月下旬に答申予定『水俣病認定審査会』,https://news.yahoo.co.jp/articles/0475aeef33a05500c4a566b8c3ec89e894845fb8,12/26(火) 18:46
ohbsn,ＢＳＮ新潟放送,政治資金規正法違反の「全容解明求める意見書」可決　新潟県議会,https://news.yahoo.co.jp/articles/6ce16b765a7dd5f25efd15fcfed4af4320282472,12/26(火) 18:38
ohbsn,ＢＳＮ新潟放送,心待ちにしたスノーシーズン!白銀のゲレンデ賑わう　新潟・南魚沼市,https://news.yahoo.co.jp/articles/ad576861063611ac482b23058ace677b0dd183ba,12/26(火) 18:27
ohbsn,ＢＳＮ新潟放送,「ウサギ」のダイバーから「辰」のダイバーにバトンタッチ　上越市立水族博物館『うみがたり』,https://news.yahoo.co.jp/articles/71d75a480b227e5ca13514d8ba7c96bd93875586,12/26(火) 18:11
ohbsn,ＢＳＮ新潟放送,日本トップの阪神より4.5倍多いコンテナを扱う中国の青島港では 既に“無人化”が実現していた,https://news.yahoo.co.jp/articles/418490d83240b380f0d9dba7a1e807da5e3c83c9,12/26(火) 16:53
ohbsn,ＢＳＮ新潟放送,リサイクル店からズボンや帽子など4点（販売価格4万5420円）を万引きか　15歳の少年ら3人を逮捕,https://news.yahoo.co.jp/articles/713710434a68f7ab4de81aed95b3bcf91f9d4aa2,12/26(火) 16:34
ohbsn,ＢＳＮ新潟放送,開志国際101対71で羽黒に勝利　連覇に向けて準々決勝進出　ウインターカップ2023 男子3回戦,https://news.yahoo.co.jp/articles/9032f862b8a1ccf9a6a0e4a3b69376b817e67b5f,12/26(火) 15:04
ohbsn,ＢＳＮ新潟放送,除雪作業中に亡くなるケースこれまでに3人（新潟・12月25日現在）,https://news.yahoo.co.jp/articles/09cb4f87f3bd025624ef22df9c0e852b6c6137b9,12/26(火) 12:53
ohbsn,ＢＳＮ新潟放送,連覇に向け好スタート 開志国際高校は初戦を大量リードで快勝　男子高校バスケ ウインターカップ,https://news.yahoo.co.jp/articles/211bb8dc4d6672fce01acb78b69a7add8d454731,12/26(火) 12:34
ohbsn,ＢＳＮ新潟放送,「5人死亡 33人重軽傷」犠牲者の冥福祈り再発防止への誓い新たに　JR羽越線事故から18年,https://news.yahoo.co.jp/articles/4e49e1c551f98351a5d02c29346a721fc172b6bb,12/26(火) 12:02
ohbsn,ＢＳＮ新潟放送,釣り客ら11人乗った遊漁船の舵が故障「旋回し続けてどうにもならない」巡視船が救助　けが人なし　新潟,https://news.yahoo.co.jp/articles/0d3d9e031972a8de81b126e422b8d44b0af7f088,12/26(火) 9:32
ohbsn,ＢＳＮ新潟放送,今季5勝「思った以上にうまくいった」楽天のドラ1ルーキー 荘司康誠投手 地元新潟で激励会,https://news.yahoo.co.jp/articles/0c59eb24c288d78c12ed46d6150eb19189aade36,12/25(月) 18:24
ohbsn,ＢＳＮ新潟放送,専門学校生が制作「辰を描いた県内最大の大絵馬」新潟県護国神社,https://news.yahoo.co.jp/articles/2cbc7a273baca74b2d4d36a51758131a192ed4e8,12/25(月) 18:16
ohbsn,ＢＳＮ新潟放送,「交通事故の防止や適切な110番通報などを呼び掛け」新潟県警クリスマスコンサート,https://news.yahoo.co.jp/articles/16096922a63f9034bf42b6cc58b3c66cead02f0c,12/25(月) 18:08
ohbsn,ＢＳＮ新潟放送,暖かく湿った空気と上空の寒気 大気の非常に不安定な状態続く新潟県　雷・突風・ひょうに注意,https://news.yahoo.co.jp/articles/e497b6e3db8c9f2bb4efd601370d67874dbd8e85,12/25(月) 17:19
ohbsn,ＢＳＮ新潟放送,「最初は初対面だが 次は古い友人…」ニュースキャスターのお気に入り 中国・青島の食文化,https://news.yahoo.co.jp/articles/be7dd87c0f8ba5c8e0de006275572b20b2f0e750,12/25(月) 16:01
ohbsn,ＢＳＮ新潟放送,新潟市内で知人に大麻を譲り渡した疑い、25歳の配送業の男を逮捕,https://news.yahoo.co.jp/articles/9e6279df88d797937c9609f74f06d416dec6c093,12/25(月) 15:39
ohbsn,ＢＳＮ新潟放送,民家近くでクマ目撃 体長50センチほど　新潟県新発田市,https://news.yahoo.co.jp/articles/aee559b3dde10a7d4afac584b71e1559106bd31c,12/25(月) 15:06
ohbsn,ＢＳＮ新潟放送,用水路で87歳男性が死亡　除雪作業中か　新潟,https://news.yahoo.co.jp/articles/7d5682f77e224984496363a8c18019cc97b1b592,12/25(月) 14:59
ohbsn,ＢＳＮ新潟放送,スキー場のコース内で倒れている男性見つかる　心肺停止状態で搬送　新潟,https://news.yahoo.co.jp/articles/f4fa252eb4f039181c77d9b49d833673baf25271,12/25(月) 14:28
ohbsn,ＢＳＮ新潟放送,自宅敷地内で69歳の男性が死亡　周辺には除雪の跡が…,https://news.yahoo.co.jp/articles/c1adf647c42588a71d68f63adc4c447b514179c4,12/25(月) 14:08
ohbsn,ＢＳＮ新潟放送,雪は落ち着くも上空の寒気の影響で大気の状態は非常に不安定 農作物の管理にも注意を　新潟県内,https://news.yahoo.co.jp/articles/8709a20fa4ea65d574a79cf3e4f888489831a700,12/25(月) 12:11
ohbsn,ＢＳＮ新潟放送,お題は「和」『歌会始の儀』東京学館新潟高校から8人目の選出　2年生の神田さんは今回の最年少,https://news.yahoo.co.jp/articles/5dd5b4cd6da9b08e384111060463de2804402997,12/25(月) 12:02
ohbsn,ＢＳＮ新潟放送,新潟市の沖合で11人乗った遊漁船が故障　巡視船が救助へ,https://news.yahoo.co.jp/articles/c4c3ed41c6ffbf0f3e15335f429bfc4c6cad4292,12/24(日) 19:32
