media_en,media_jp,title_articles,link_articles,date_original
ishikawa,石川テレビ,金沢市の兼六園には雪がまだ残る「雪が積もらないので貴重」観光客が雪景色を写真に収める,https://news.yahoo.co.jp/articles/15e2c279b14786b7e107669bb51cccd2f87ac364,12/27(水) 12:08
ishikawa,石川テレビ,コロナ病棟を改装し産婦人科と小児科の機能を集約…NICUを4年ぶりに再開へ　石川・金沢市,https://news.yahoo.co.jp/articles/c4c42551a37161fc4ac3503bb960fbff805e7324,12/27(水) 12:08
ishikawa,石川テレビ,初場所で新入幕…石川県津幡町出身・大の里の等身大パネルが県内各地の玄関口に 遠藤・輝・炎鵬に肩並べる,https://news.yahoo.co.jp/articles/fb78a7f6045e6c9879db95b4ba039340d423c758,12/26(火) 19:45
ishikawa,石川テレビ,高さ2.3m×幅1.8m…石川・小松空港に受験生等応援する『巨大絵馬』近くには難関突破で知られる神社,https://news.yahoo.co.jp/articles/e9badd80d5110f669ca478301bc2c537f3ff5ede,12/26(火) 19:43
ishikawa,石川テレビ,修繕費用に13億5000万円で断念 夕日が美しいリゾートホテル2024年3月で閉鎖へ,https://news.yahoo.co.jp/articles/d45950e0688e922d00f394b780ba7b91049a8c4e,12/26(火) 19:40
ishikawa,石川テレビ,91歳・仲代達矢さんが再び主演…舞台『肝っ玉おっ母と子供たち』無名塾が24年秋に能登演劇堂で再演へ,https://news.yahoo.co.jp/articles/3b5cc26ee017cfccf48f6b9a6a219075f22f04b8,12/26(火) 19:40
ishikawa,石川テレビ,”やかましい”と戦闘機の飛行差し止めと約26億8000万円の損害賠償など求め提訴,https://news.yahoo.co.jp/articles/8dcec6f030ce740497d5b9b25d6273f16f4204ec,12/26(火) 19:38
ishikawa,石川テレビ,大谷翔平選手からの贈り物のグローブ 石川県内の小学校にも続々到着 来年の始業式で児童に披露する学校も,https://news.yahoo.co.jp/articles/a50fb8e85f25ad199218ec0c586a56438958add4,12/26(火) 18:52
ishikawa,石川テレビ,91歳の仲代達矢さん…次回作に「演劇制作者としての義務」と意気込み語る,https://news.yahoo.co.jp/articles/f24cb6bd017504caed9c9bcdb211a11239c01dae,12/26(火) 17:59
ishikawa,石川テレビ,小松空港に難関突破の絵馬…利用者たちが「来年も元気に！」と願い込める,https://news.yahoo.co.jp/articles/e39ea884132c5efb4a2736b3ff189eaac7f2cc78,12/26(火) 17:59
ishikawa,石川テレビ,昭和以降3位タイのスピード出世…大の里が初土俵から所要4場所で幕内へ 大相撲初場所で西前頭15枚目に,https://news.yahoo.co.jp/articles/178d6f2a00ccc78504ea964656633bb71eed6071,12/25(月) 19:47
ishikawa,石川テレビ,公約実現かなり困難に…小松空港2本目滑走路の建設 馳石川県知事が国に直談判も大臣は「大きな課題ある」,https://news.yahoo.co.jp/articles/d76dff40012efaf089634218951a6f9c94e33122,12/25(月) 19:35
ishikawa,石川テレビ,前町長が贈収賄事件で逮捕…石川・志賀町の町長選で46歳元町議が当選し初登庁「風通しのいい職場目指す」,https://news.yahoo.co.jp/articles/8c952b94223fb403829dbf340ffe6c9d7a3e0e11,12/25(月) 19:35
ishikawa,石川テレビ,石川県内からは35年ぶり…宮中で行われる新年行事「歌会始の儀」かほく市の女性が詠んだ一首が入選果たす,https://news.yahoo.co.jp/articles/95a8d556e050f6a54ca1707abc64fe61686f7de2,12/25(月) 19:35
ishikawa,石川テレビ,冬休みは雪遊びをしたいです！…金沢市などで２学期の終業式,https://news.yahoo.co.jp/articles/d61682201c5dc24c620bade1344147cfac769925,12/25(月) 18:16
ishikawa,石川テレビ,若さと清新さをアピール…志賀町の新町長・稲岡健太郎さんが初登庁,https://news.yahoo.co.jp/articles/0253ec1ff109c1c35827e15ea9a3f9e9319d0f29,12/25(月) 18:14
ishikawa,石川テレビ,贈収賄事件があった志賀町の町長選挙で元町議の稲岡健太郎氏が初当選,https://news.yahoo.co.jp/articles/463fae03034d5a8b58c001a6f1caee0cbb082819,12/24(日) 23:44
ishikawa,石川テレビ,【速報】石川県志賀町長選挙で稲岡健太郎元町議が当選確実,https://news.yahoo.co.jp/articles/84bb89529faa849fae2962d672260f73db3d1d66,12/24(日) 21:59
ishikawa,石川テレビ,水族館にサンタが登場！…のとじま水族館でクリスマスイベント,https://news.yahoo.co.jp/articles/d7568e0bf271211af18854af49f547e6e52ea5d8,12/24(日) 21:05
ishikawa,石川テレビ,大雪から3日たったいまも奥能登2市2町約390世帯停電続く,https://news.yahoo.co.jp/articles/33817dc9e50db638e36777725b21432b252a5b65,12/24(日) 21:02
ishikawa,石川テレビ,大雪で歩道が埋まり、車道を歩行…後ろから走ってきた軽自動車に女性はねられ死亡,https://news.yahoo.co.jp/articles/f1395a085016a652602763349a341d82dab307c8,12/24(日) 21:02
ishikawa,石川テレビ,新人3人による三つ巴の戦いに…志賀町長選挙の投票始まる,https://news.yahoo.co.jp/articles/bce9c757e2425275d0a561864054d1b44e2becaa,12/24(日) 13:59
ishikawa,石川テレビ,2日遅れで待望のオープン…白山市内2つのスキー場が営業開始,https://news.yahoo.co.jp/articles/0e4b69eeeee4897344ee79bb02194f5742599115,12/23(土) 18:30
ishikawa,石川テレビ,クリスマスを前に…輪島市で七面鳥の出荷が最盛期迎える,https://news.yahoo.co.jp/articles/de59883d671987ad252b3421a811723d39da82e2,12/23(土) 18:30
ishikawa,石川テレビ,「クリスマスじゃなくてクルシミマス」…輪島市で依然孤立状態や停電続く,https://news.yahoo.co.jp/articles/aa622af163caf18b7dd55fc50ea2a0f5a3470ea5,12/23(土) 18:27
ishikawa,石川テレビ,石川県内の大雪のピークは過ぎる…輪島市内では一部世帯で孤立状態や停電続く,https://news.yahoo.co.jp/articles/2bd24179be9b8d29a959b2940a6a6f3724c03fe1,12/23(土) 12:51
ishikawa,石川テレビ,奥能登で停電続く 輪島市の住宅ではお昼から7時間たっても解消せず,https://news.yahoo.co.jp/articles/35e66bf3e3f30fcb398daf8f13332648eae9b950,12/22(金) 20:49
ishikawa,石川テレビ,停電の中での実施となった学校も…大雪に見舞われた石川県内で公立小中学校の終業式 児童「雪遊び楽しみ」,https://news.yahoo.co.jp/articles/c59a85a6cde71c862ee0cdc74bb4ca56a53b349b,12/22(金) 20:25
ishikawa,石川テレビ,倒木被害など相次ぐ…石川県内に今季最強寒波入り込む 輪島の積雪量60cmは12月統計開始以降初の水準,https://news.yahoo.co.jp/articles/569cc068dcc6b00c304d9f84789bc2b5971a3695,12/22(金) 20:23
ishikawa,石川テレビ,「そんなことサルでもできる」要望に応じず不適切発言…金沢地検が事務官処分,https://news.yahoo.co.jp/articles/61b627cc533debf788e4a68a013f58dd01be2199,12/22(金) 20:16
ishikawa,石川テレビ,大雪の中も予定通り小中学校で終業式はじまる,https://news.yahoo.co.jp/articles/c73ac22e30fc5657ae61b56ed21b927d6b1981a2,12/22(金) 12:09
ishikawa,石川テレビ,能登の平地に顕著な大雪に関する気象情報発表 夕方にかけて大規模な交通障害に警戒を,https://news.yahoo.co.jp/articles/39eadff66cd973ec356a880479aa975403ed1fab,12/22(金) 12:07
ishikawa,石川テレビ,能登の平地に「顕著な大雪に関する気象情報」発表 大規模な交通障害に警戒を,https://news.yahoo.co.jp/articles/83131fc2c5e8679567328a2dc9a2beb0ad694f6b,12/22(金) 11:59
ishikawa,石川テレビ,映像・音響共にパワーアップ…北陸で初めて映画館に新システム『IMAX』導入 ユナイテッド・シネマ金沢,https://news.yahoo.co.jp/articles/cf12012f81740bb315b6e623c4e9fe31aa97e0c8,12/21(木) 18:51
ishikawa,石川テレビ,能登北部に大雪警報等…北陸地方に今季最強の寒波流れ込む 21日午後5時までに珠洲で最大18cmの積雪,https://news.yahoo.co.jp/articles/8a866c747bacf2331667c31fd58f58a31356109a,12/21(木) 18:47
ishikawa,石川テレビ,老朽化し空き家…石川県知事公舎をカフェやギャラリー等の憩いの場に 建築家・隈研吾氏「需要かなりある」,https://news.yahoo.co.jp/articles/e4b9f88d4f343a519e35acdeb18704b284964f6e,12/21(木) 18:45
ishikawa,石川テレビ,最強寒波！珠洲市や輪島市など能登北部に大雪と波浪の警報,https://news.yahoo.co.jp/articles/a49e72a458c64bf16321b2a7e087ffff33e0a97c,12/21(木) 18:42
ishikawa,石川テレビ,「人の不幸で金をだまし取るのは人としてはやってはいけない」と詐欺の疑いで逮捕の男,https://news.yahoo.co.jp/articles/92eb5edb8c4f9050578dd4eb12e65407a7784b4c,12/21(木) 18:42
ishikawa,石川テレビ,自ら校長に報告し県教委が警察に通報…未成年の女子にわいせつ行為 中学校に勤務する男性教師が懲戒免職,https://news.yahoo.co.jp/articles/95465c4ff8b228bc9040b4c08c21387d98dba0ae,12/21(木) 18:40
ishikawa,石川テレビ,「パイロットなどの確認不足」と結論…去年10月発生の能登空港重大インシデント,https://news.yahoo.co.jp/articles/d91aa6b38eb42b1e2a6f40b174cea847dffc4648,12/21(木) 18:40
ishikawa,石川テレビ,対策グッズは年々進化…ホームセンターで出来る大雪への備え 腰をかがめず雪かきできるアイデア商品も,https://news.yahoo.co.jp/articles/f201e8aa6dd87cdd0a5abd807a31eeea90c9615f,12/20(水) 20:39
ishikawa,石川テレビ,米国テレビ界の最高峰『エミー賞』3冠…アニメスタジオ・トンコハウス制作陣が拠点ある金沢市長に受賞報告,https://news.yahoo.co.jp/articles/97e820382dc6b2922ca29caeaf158b3629a858e2,12/20(水) 20:25
ishikawa,石川テレビ,石川県でインフルエンザの患者数高止まり…基本的な感染対策の継続を呼びかけ,https://news.yahoo.co.jp/articles/fa692e8064bad8869f3c6acc73ef0256ccff0791,12/20(水) 20:12
ishikawa,石川テレビ,5年前の大雪では解消に3日かかる…雪による“車の立ち往生”を想定した対応訓練 警察「慎重な行動を」,https://news.yahoo.co.jp/articles/8666351725c9ed37b4b6a18583c477d93b83a6c6,12/20(水) 20:12
ishikawa,石川テレビ,21日午後6時までに平地で最大25cm予想…石川県内で警報級の大雪か 県が対策会議で万全の体制指示,https://news.yahoo.co.jp/articles/ad3448dcb38ab03501c52536dc7fa8b1da6cd1ee,12/20(水) 20:10
ishikawa,石川テレビ,羽咋市の氣多大社で迎春準備進む…大しめ縄も新調,https://news.yahoo.co.jp/articles/edcc83e2f5e7511691169b2ad768f1b6370ad28c,12/20(水) 17:44
ishikawa,石川テレビ,コロナ禍前を超える水準まで回復…年末年始のJR予約状況,https://news.yahoo.co.jp/articles/8030ca7d037c073d02240761b64554568a5a4e57,12/20(水) 17:44
ishikawa,石川テレビ,木造の納屋を全焼するもけが人なし…野々市で火事,https://news.yahoo.co.jp/articles/5dfcc4db3135537151a883dc5a05773c9748d8a3,12/20(水) 17:40
