media_en,media_jp,title_articles,link_articles,date_original
ybc,YBC山形放送,大雪で倒木発生の酒田市飛島　大規模停電・断水の恐れは解消　26日応急工事が完了,https://news.yahoo.co.jp/articles/f1c01bb4dc08e51494a8df4b0618ead6cc24caec,12/27(水) 12:19
ybc,YBC山形放送,「心に刻まれるシーンを」ニューイヤー駅伝出場のNDソフトで壮行式,https://news.yahoo.co.jp/articles/dbe0354da07b3981ce67d2faccb38227c604b89a,12/27(水) 12:19
ybc,YBC山形放送,ハザードマップの改定進める　鶴岡市の土砂崩れから1年　「大みそかの異変」②,https://news.yahoo.co.jp/articles/f30cb4308795e417421b47943afcee6710d3ba52,12/26(火) 19:00
ybc,YBC山形放送,最上地方の消防本部の新庁舎建設　基本設計の見直しを　消防署員らが嘆願書,https://news.yahoo.co.jp/articles/7c939f1ccf2410d37c3908814e838f5f2d3c4121,12/26(火) 18:16
ybc,YBC山形放送,新年に向け山形市の郵便局で年賀状の仕分け作業ピーク　ＳＮＳの普及で減少も,https://news.yahoo.co.jp/articles/b14e7df56a57a4408fca11b81d37f18b0a1925d7,12/26(火) 18:16
ybc,YBC山形放送,全国高校サッカー28日開幕　山形明正初戦突破目指す　寮生活にカメラが密着,https://news.yahoo.co.jp/articles/021a11470aca10a7cead41163ee7febc92613ac9,12/26(火) 18:15
ybc,YBC山形放送,山形市で乗用車が中央分離帯に衝突の事故　30代の男性の死因は病死　運転中に発症か,https://news.yahoo.co.jp/articles/c1e1b361c571d387cd64924df08ee220667afc72,12/26(火) 16:48
ybc,YBC山形放送,市町村で格差　山形県内全小中学校の給食費無償化に向け財政支援を県に要望,https://news.yahoo.co.jp/articles/d580bb1b5fcb777c64b67c4af8e6a68dd90fcfc6,12/26(火) 16:44
ybc,YBC山形放送,「素晴らしい1年が迎えられるように」　シルバー人材センターの会員手作りの「門松」　天童市に贈る,https://news.yahoo.co.jp/articles/0b9b77c94d5073fbae357198a6d9f25626b817b1,12/26(火) 16:41
ybc,YBC山形放送,近藤市長就任後初の記者会見　今季から「排雪」費用への補助拡充の考え示す　山形・米沢市,https://news.yahoo.co.jp/articles/070c968155fa50ffd953f96d092c0786d3b58b77,12/26(火) 12:44
ybc,YBC山形放送,クリスマスの惨事…38人が死傷したJR羽越線脱線転覆事故から18年　発生時刻に事故現場で黙とう,https://news.yahoo.co.jp/articles/76a2bcdb81e499fefb815517d0c39e4aa86a6d17,12/26(火) 12:39
ybc,YBC山形放送,乗用車が中央分離帯と衝突　その後軽乗用車が衝突　乗用車運転の男性が意識不明の重体,https://news.yahoo.co.jp/articles/6decd3af3ab0ab82f5bd552b2aa8af492c3a9b37,12/26(火) 12:34
ybc,YBC山形放送,倒木で停電懸念の酒田市飛島　島民が一部市街地へ移動　26日に復旧作業不安解消へ,https://news.yahoo.co.jp/articles/25dd278e94b120c1da2071baa8516ee21efec2ee,12/25(月) 18:16
ybc,YBC山形放送,38人が死傷した羽越線脱線転覆事故から18年　AI使い危険度予測の精度高める,https://news.yahoo.co.jp/articles/54421336d7d5b154d540aec74e44fa3cb8d6ad76,12/25(月) 18:10
ybc,YBC山形放送,2年前の中学3年男子生徒自殺受け　寒河江市長「痛恨の極み。地域と連携しながら再発防止を」,https://news.yahoo.co.jp/articles/3936bd664e8891a7f9c59e84af6245314560b862,12/25(月) 17:54
ybc,YBC山形放送,7月豪雨で冠水した大石田大橋　60メートル下流に5メートル高い新しい橋設置へ,https://news.yahoo.co.jp/articles/b9a9d0f2c47b7d2553ab31114f52272326fdaa31,12/25(月) 17:05
ybc,YBC山形放送,山形県内のスキー場　雪不足続く　蔵王温泉スキー場3分の1のゲレンデが滑走できず,https://news.yahoo.co.jp/articles/99051738c41f39a0e3129e092dc7dfb33489b9a6,12/25(月) 16:54
ybc,YBC山形放送,発生から18年、38人死傷のJR羽越線・脱線転覆事故　山形県庄内町の事故現場でJR東日本の社長らが慰霊,https://news.yahoo.co.jp/articles/b6a915449bb5f258508cfccf0c0b95aa8d6e995f,12/25(月) 12:41
ybc,YBC山形放送,大雪による倒木の影響から島全体で停電や断水発生の恐れが続く酒田市飛島　あす26日に現場での応急工事へ,https://news.yahoo.co.jp/articles/93fefbcc33a71bf2a4cdecc54ff0783121efb5fb,12/25(月) 12:33
ybc,YBC山形放送,澄んだ音色響かせて　高校生ハンドベル部クリスマスコンサート・山形,https://news.yahoo.co.jp/articles/2223f234e250e6e4fbe85dfcbbe0fcc0a2388662,12/24(日) 18:49
ybc,YBC山形放送,県内最大級の約15万個のLEDを使ったイルミネーション・山形,https://news.yahoo.co.jp/articles/48b172dec9cbd72c6ea8a1d64ef99893ecf8691a,12/24(日) 17:40
ybc,YBC山形放送,レギュラーガソリン価格　182.8円/L　8週ぶりに値下がりへ・山形,https://news.yahoo.co.jp/articles/32692d74b764261ef06b81b21b41c9f384d824b4,12/24(日) 17:29
ybc,YBC山形放送,84歳男性が顔などにやけど住宅1棟全焼・東根市　南陽市でも火事　住民3人は逃げて無事けがなし,https://news.yahoo.co.jp/articles/82d68f459e574656aa9b98a33669016da8702b9a,12/23(土) 18:05
ybc,YBC山形放送,2020年7月豪雨で冠水した「大石田大橋」架け替えへ…路面は現橋より約５メートル高く,https://news.yahoo.co.jp/articles/9510e3f425ab234330e90ddd0e2f97b92288f2c7,12/23(土) 11:53
ybc,YBC山形放送,寒河江市の中学３年男子生徒自殺　市が調査結果公表　「いじめあったが主な要因と断定できない」,https://news.yahoo.co.jp/articles/893d1d962acd367ba8c0c2ef40f88d68453bd39a,12/22(金) 18:21
ybc,YBC山形放送,朝の景色「がっかりしました」　鶴岡市櫛引24時間で積雪50センチ　飛島40センチ,https://news.yahoo.co.jp/articles/2897a5a61613bf4dc35b8c948bb5f540055e94ba,12/22(金) 18:20
ybc,YBC山形放送,鶴岡市の土砂崩れで通行止めの県道と市道　1年ぶりに解除　年内に4世帯すべてが自宅に,https://news.yahoo.co.jp/articles/38e89e280a7e6848836f9b3345f2020823052ca4,12/22(金) 18:01
ybc,YBC山形放送,二十四節気の一つ「冬至」　鶴岡市の温泉施設で「ゆず湯」楽しむ　「今年の疲れを落としたい…」,https://news.yahoo.co.jp/articles/5ce062f38aebd899555f4d35c12e95598311cc3d,12/22(金) 17:23
ybc,YBC山形放送,性的虐待などで行政処分の山形市の認定こども園　2年間で2100万円を不正受給,https://news.yahoo.co.jp/articles/5985e398e729ea4acae74e8bb88ebb7022add8de,12/22(金) 16:55
ybc,YBC山形放送,「時代に合わせた改善を」　米沢市の近藤洋介新市長が初登庁　職員に訓示,https://news.yahoo.co.jp/articles/9fe33cd2734edfdc75e784f3c1805491138fbff9,12/22(金) 16:36
ybc,YBC山形放送,防火構造の壁に定められた断熱材など施工せず　県内外2800棟を調査改修へ　山形市のハウスメーカー,https://news.yahoo.co.jp/articles/624237358eb723d2ed78e0f2718a3d4ba80b54f4,12/22(金) 15:49
ybc,YBC山形放送,当時中学3年生だった生徒が2年前に自殺　寒河江市「いじめあったが自殺の主因とは断定できない」,https://news.yahoo.co.jp/articles/0d6fff15520ebef3c27a6b4047fd3c5f7fc85d66,12/22(金) 12:50
ybc,YBC山形放送,庄内中心に大雪　大蔵村肘折や鶴岡市櫛引で24時間に約40センチの降雪　交通障害に注意を,https://news.yahoo.co.jp/articles/2099a0ea2ac5709edfca5659fe5d5c491596418e,12/22(金) 12:44
ybc,YBC山形放送,酒田市飛島で積雪50センチか　倒木が電線にかかり断線した場合　停電や断水の可能性,https://news.yahoo.co.jp/articles/4150f4beff248f59c517f3fe398becbb7ab15fe0,12/21(木) 19:01
ybc,YBC山形放送,「いい年になるように？」　米沢市の寺の境内で珍しいサルの姿を撮影,https://news.yahoo.co.jp/articles/65ce6a9dcac8ec3e456ddc2b79998bde3926e9f6,12/21(木) 18:15
ybc,YBC山形放送,ガス事業者補助やドライバー不足対策など山形県議会430億円余りの追加予算可決,https://news.yahoo.co.jp/articles/1d5804fdfd313450591937a63e37d84c5b3679e5,12/21(木) 18:06
ybc,YBC山形放送,「運動会がんばった」　山形県内の小中学校で終業式　冬休みへ,https://news.yahoo.co.jp/articles/edf3f8aace5c48a7b8568162fd2e28e9ae35202a,12/21(木) 17:27
ybc,YBC山形放送,小麦や卵などの材料費高騰　山形県内のケーキ店　価格据え置こうと工夫凝らす,https://news.yahoo.co.jp/articles/e9e42dc9d1079170fdc3caa51ee6450b315462b2,12/21(木) 17:13
ybc,YBC山形放送,猛暑の影響で受粉が進まず　山形県内の夏秋採りのイチゴ出荷量落ち込む　燃料代高騰で負担も増加,https://news.yahoo.co.jp/articles/74291ffed4c46e56593af78a1dcbeb14a4a60d65,12/21(木) 17:05
ybc,YBC山形放送,ピークは下り30日・上り3日　年末年始（12月28日～1月4日）の山形新幹線予約状況,https://news.yahoo.co.jp/articles/84dbeecba730b5c9cd93119abaf5bf4bddcbb9e4,12/21(木) 12:31
ybc,YBC山形放送,東北地方の上空にマイナス39℃以下の強い寒気…庄内を中心に大雪となるところがある見込み,https://news.yahoo.co.jp/articles/e6b0c812b84799fb9f08dfb7e66c6d356c6de0ad,12/21(木) 12:24
ybc,YBC山形放送,小学校給食に画びょう「調理室以外で混入した可能性高い」県内9月以降5件目・尾花沢市,https://news.yahoo.co.jp/articles/11250722b0e7546f1fd0324d96549c07b4cd1ebd,12/21(木) 12:21
ybc,YBC山形放送,Ｊリーグ2026年から「秋春制」へ　「開幕をホームで迎えられる可能性」モンテディオ「賛成」,https://news.yahoo.co.jp/articles/8a914ae72883ce4482b9da069e8765c69b310dc1,12/20(水) 18:19
ybc,YBC山形放送,米沢市周辺に生息する「吾妻の白猿」　3匹のうちめったに姿をみせない「とくら」を撮影,https://news.yahoo.co.jp/articles/b4f403fdf82e9e98b1db91b29724daff6cbcaabb,12/20(水) 18:17
ybc,YBC山形放送,子どもに多くみられる「A群溶血性レンサ球菌咽頭炎」流行　山形県が8年ぶりに警報,https://news.yahoo.co.jp/articles/68e0108da303038a83e0b6dd50ca02a9e5eaf615,12/20(水) 17:55
ybc,YBC山形放送,「しっかりと準備している」　高校サッカー山形県代表「山形明正」本番に向け激励会,https://news.yahoo.co.jp/articles/84fd74abd596baa0150c45f6d762f2389ca61fc8,12/20(水) 17:46
ybc,YBC山形放送,「手間暇に感謝」　上山市原産の品種「紅柿」を使った干し柿　児童らが味わう,https://news.yahoo.co.jp/articles/0dacc6c74016d81e7329656504a1e4a251b85446,12/20(水) 17:45
ybc,YBC山形放送,SNSを通じた投資詐欺被害が増加　12月に4件届け出　被害額は合計5000万円,https://news.yahoo.co.jp/articles/d72ced31d0edafe149044b13a2563f9ccbde03ba,12/20(水) 17:11
