media_en,media_jp,title_articles,link_articles,date_original
wcartop,WEB CARTOP,深夜割引の時間待ちで「高速の料金所」手前の本線にトラックがズラリ駐車状態！　危険な有様を解決すべくNEXCOが発表した「新たな割引制度」の中身とは,https://news.yahoo.co.jp/articles/32c4e52dd70713277d462912fc8db0801aab1e6c,12/11(月) 17:40
wcartop,WEB CARTOP,読んでから買いに行ってほしい！　ノアヴォク・ステップワゴン・セレナを全方位で比較したら「強み」がまったく違っていた,https://news.yahoo.co.jp/articles/59ac11e3868239fc048f20ee830b4171e272cfe7,12/11(月) 17:30
wcartop,WEB CARTOP,【試乗】装備も走りも燃費も満足で「これが売れなきゃ何が売れる？」　スズキ新型スペーシアは魅力が渋滞してた,https://news.yahoo.co.jp/articles/f914b52bc593a55474c98403e81a13050b444713,12/11(月) 17:10
wcartop,WEB CARTOP,お願いだから日本で売ってください！　シトロエン・フィアット・オペルの「兄弟マイクロEV」に乗りたい欲が抑えきれない,https://news.yahoo.co.jp/articles/23f5d002fad7183f7488207d93ecaaa97804e792,12/11(月) 13:10
wcartop,WEB CARTOP,最近「E」とか「電池」みたいなマークが付いてるタイヤが増えてきた！　EV専用タイヤって普通のタイヤと何が違う？,https://news.yahoo.co.jp/articles/d7aba82a93fafcc6a330260397fd0ae3db6a18a2,12/11(月) 11:51
wcartop,WEB CARTOP,最近ガソスタで「水抜き剤いかがですか？」っていわれなくなった！　そもそも水抜き剤ってナニモノで必要だったのか？,https://news.yahoo.co.jp/articles/86fac61a08a7c02a29ed6f29976e7fa6b03b1d4e,12/11(月) 10:10
wcartop,WEB CARTOP,メディアも知らない裏側に潜入！　JMSのSUBARUブース舞台裏リポート,https://news.yahoo.co.jp/articles/2e2cdc46b591c1df2ce42619ffbe028a3557b84a,12/11(月) 7:11
wcartop,WEB CARTOP,自転車は「歩行者用」「車両用」どっちの信号に従うのが正解!?　十分周知も守られてもいない自転車乗りの信号ルール,https://news.yahoo.co.jp/articles/deb741928c38996286105bfaf23fc00219a68f70,12/11(月) 6:30
wcartop,WEB CARTOP,トラック業界は必ずしも歓迎せず！　トラックの高速の制限速度を80→100km/hに引き上げる案への声,https://news.yahoo.co.jp/articles/53aba9e84fe708260f33c31d62c1a79f52fcf926,12/10(日) 17:40
wcartop,WEB CARTOP,この良さに気がつかないとは……スーパーカー大王が「不人気フェラーリ」とか言われる4座モデルの魅力を語り尽くす,https://news.yahoo.co.jp/articles/d1abc3ca56c63aca4779354596c74b75c049dcc4,12/10(日) 17:30
wcartop,WEB CARTOP,黒がテーマのオデッセイ純正アクセサリー！　上品なのに迫力マシマシの姿に買ったら付けたい欲が止まらん!!,https://news.yahoo.co.jp/articles/50cb6772293c1688358f0a7b330d65d559d17cbf,12/10(日) 17:10
wcartop,WEB CARTOP,新型フォレスターはゴツさ控えめの軽快路線！　新たなSUBARUデザインをデザインのプロが分析する,https://news.yahoo.co.jp/articles/6b38917bd9216e3efc09f552be67643279ef9a80,12/10(日) 13:10
wcartop,WEB CARTOP,ホンダは75周年！　ランボは60周年！　ついでにCARトップも55周年！　2023年はアニバーサリーラッシュだった,https://news.yahoo.co.jp/articles/429a1d51a74f7c1cba60cbf0d8741f971a8d51b5,12/10(日) 11:50
wcartop,WEB CARTOP,目に見えないだけに理解が難しい！　クルマの走りを大きく左右する「空力」を歴史とともに解説!!,https://news.yahoo.co.jp/articles/4a3348c3d3737ac517ff6f1751cbea4a7d43e97e,12/10(日) 10:10
wcartop,WEB CARTOP,冬はクルマのドアを開けるのが恐怖でしかない！　「バチッ」とくる静電気がどうにかならないか考えてみた,https://news.yahoo.co.jp/articles/c543590f3c99315c9b4f19b87b70d9418828b269,12/10(日) 7:12
wcartop,WEB CARTOP,水素かBEVかハイブリッドか？　乗用車同様にトラックも「次世代パワートレイン」の議論が活発！,https://news.yahoo.co.jp/articles/8d14ac1459953a876a2c745527aaa96e85b6b8a1,12/9(土) 17:40
wcartop,WEB CARTOP,ポルシェがミニバンを作るとこうなるの!?　真ん中に運転席とかポルシェらしさ全開の「レン・ディエンスト」はガチで欲しくなる！,https://news.yahoo.co.jp/articles/c4303e3c341424fe420a1d3a1d6153a0e40d8014,12/9(土) 17:30
wcartop,WEB CARTOP,復活オデッセイかステップワゴンか？　同門ミニバンの「全席」「ラゲッジ」の使い勝手を徹底比較してみた,https://news.yahoo.co.jp/articles/dccf56685627ef99171783d094450d15c83af7ed,12/9(土) 17:10
wcartop,WEB CARTOP,改「良」のハズだけど前のほうがよかったなぁ……デザインのプロが選抜した「マイチェン前」のほうがイケてる外観のクルマ5台,https://news.yahoo.co.jp/articles/9ce486c243c085f33f11b20db18fb1e636708a95,12/9(土) 13:11
wcartop,WEB CARTOP,なんか家より快適じゃね？　最近のクルマのスゴすぎて「なんじゃこりゃ〜！」な室内装備5選,https://news.yahoo.co.jp/articles/0c921e8a38e99c54745d9e2a901b7aa1463e44ab,12/9(土) 11:51
wcartop,WEB CARTOP,ただの風船人形に見えるけど60万円！　動くマネキンは80万円！　道路工事の癒し系キャラ「旗振りアイテム」の値段を調べてみた,https://news.yahoo.co.jp/articles/c30fab38e4e587c40ecec6dc4b3db6d68897467a,12/9(土) 10:11
wcartop,WEB CARTOP,ホントに真っ二つにするワケじゃない！　クルマ好きが言うナンバーを切るってなに？,https://news.yahoo.co.jp/articles/95e5bdc43f2873fde6dc46d4d41fff43d1220061,12/9(土) 7:10
wcartop,WEB CARTOP,特別な顧客だけが味わえるフェラーリのワンオフモデル！　最新作「SP-8」が贅沢すぎる,https://news.yahoo.co.jp/articles/f8a182d94087a50690e53b3ede04aa2718dd23f8,12/8(金) 17:40
wcartop,WEB CARTOP,「最高速」→「ゼロヨン」ときていまは……最近のクルマの性能指標が「0-100km/h」加速になったワケ,https://news.yahoo.co.jp/articles/79b3da95a3012b06e11c1f0757ec40aea439ac95,12/8(金) 17:30
wcartop,WEB CARTOP,装備が充実して見た目もスポーティでリーズナブル！　アウディから特別仕様車「A3 Sportback / A3 Sedan Signature Edition」が登場,https://news.yahoo.co.jp/articles/2676e3446b910ec4199b446043b9ab4cecdae788,12/8(金) 17:10
wcartop,WEB CARTOP,補助金のバラまきでEV普及を狙う……はいずれツケがまわってくる！　そろそろ仕組みを再構築するべきだ,https://news.yahoo.co.jp/articles/fea95b591cf03335ff78c44b247cc63db239710f,12/8(金) 13:10
wcartop,WEB CARTOP,「プレリュード」復活で昭和オヤジ歓喜！　元祖デートカーはどんなクルマだったのかZ世代にもわかるように振り返ってみた,https://news.yahoo.co.jp/articles/0085030eece07af5eded017e81c92092aa23c442,12/8(金) 11:51
wcartop,WEB CARTOP,速度が上がるにつれてクルマが浮く！　スポーツカー乗りが語る「リフト」って一体なに？,https://news.yahoo.co.jp/articles/4418e0ff388a5f51e1663ce4c7e0a74daf09b142,12/8(金) 10:10
wcartop,WEB CARTOP,これがルノー・スポール最後のイベント！　袖ヶ浦で「走りまくり」の「R.S.アルティメット・デイ」が盛大に開催された,https://news.yahoo.co.jp/articles/dba657576a40c2f581d84c40630995da97a2ba26,12/8(金) 7:11
wcartop,WEB CARTOP,降雪て立ち往生したからクルマを路駐したまま離脱！　それでも駐車違反になるのか？,https://news.yahoo.co.jp/articles/7bdc1f35fd677982986079662b9058f5227a0575,12/8(金) 6:30
wcartop,WEB CARTOP,存在しないはずのオープンモデルが3台制作されていた！　その価値4億円超えの「フェラーリ512TRスハイター」,https://news.yahoo.co.jp/articles/6d15d33d7cde4243f76f16e0c5c1ac00ac345d68,12/7(木) 17:40
wcartop,WEB CARTOP,名車の影に「ロータス」あり！　いすゞの「ハンドリング by ロータス」は名前貸しじゃなく「ガチ開発」のホンモノだった,https://news.yahoo.co.jp/articles/ab1af1edf4253b389b75da0e18da2159f80f2934,12/7(木) 17:30
wcartop,WEB CARTOP,【速報】「2023-2024 日本カー・オブ・ザ・イヤー」はトヨタ・プリウスに決定！,https://news.yahoo.co.jp/articles/b7f6cee9228ea50db5b1c4caf53e9bc727829b8f,12/7(木) 16:50
wcartop,WEB CARTOP,タクシーが使うってことはメリットあり!?　LPGガス車を個人で所有って現実的なのか考えてみた,https://news.yahoo.co.jp/articles/632e6651647d77f29fa5bc178f8b8c84f848f531,12/7(木) 13:10
wcartop,WEB CARTOP,「トールねぇさん」「スプリンクラーおばさん」！　NEXCO中日本の「作業車キャラ」が大人でもハマる,https://news.yahoo.co.jp/articles/5230f4e9c9b0bfc5e1c84d2469c245211e99b0f3,12/7(木) 11:51
wcartop,WEB CARTOP,中国製とか色メガネで見てると損するぞ！　復活したホンダ・オデッセイは2列目席と装備の進化がスゴイ,https://news.yahoo.co.jp/articles/77d9efbe8ff54a1b6df7850c64ecb50af757a49a,12/7(木) 11:42
wcartop,WEB CARTOP,ほとんど使わず数年入れっぱなしって人も多数！　クルマの「ウォッシャー液」は腐らないのか？,https://news.yahoo.co.jp/articles/ba70e7f5056b2c1660e9bdb386e12061d14bd875,12/7(木) 10:10
wcartop,WEB CARTOP,「闇ライドシェアアプリ」まである始末！　東京都心の駅前で堂々と客を乗せるインバウンド向けの違法白バス,https://news.yahoo.co.jp/articles/acd6730840c638419439d57a7714736527c2c764,12/7(木) 6:32
wcartop,WEB CARTOP,公道走行不可！　出られるレースもなし！　サーキットで楽しむしかない1人乗りフェラーリ「499Pモディフィカータ」は究極の贅沢だった,https://news.yahoo.co.jp/articles/83b3151e4ca9b8d05e9d2cc16c5a88ce962cc86a,12/6(水) 17:40
wcartop,WEB CARTOP,納車が年単位待ちの超人気車も発売と同時に乗ってる人はいる！　いの1番にクルマを手に入れるには「見る前にハンコ」だった,https://news.yahoo.co.jp/articles/35d146cc9b88418f989f06e897ee881b69905e38,12/6(水) 17:30
wcartop,WEB CARTOP,ドライブデートを盛り上げてくれる2人だけのプレミアム感！　日産オーラで行く「秘密のオーベルジュ」とは,https://news.yahoo.co.jp/articles/5385dc5df94ac1efd4feb70f9d19d8402335331b,12/6(水) 17:10
wcartop,WEB CARTOP,群馬のスバル車保有割合は全国平均の2倍！　広島でのマツダ車率は10%！　「聖地」が生まれる理由は単に「会社がそこにあるから」じゃなかった,https://news.yahoo.co.jp/articles/eac9a7ecaac85910d2af4c829728f683ca9aff25,12/6(水) 13:10
wcartop,WEB CARTOP,感電死の可能性は？　クルマは破壊される？　クルマに「雷が落ちる」とどうなるのか考えてみた,https://news.yahoo.co.jp/articles/9dfbc7d89ad1a87bfbd2bdbc690b290a1d45539a,12/6(水) 11:51
wcartop,WEB CARTOP,エンジンも完全新規！　サスペンションも新設計！　新型スイフトは見た目を除いて「正常進化」の域を超えてるぞ!!,https://news.yahoo.co.jp/articles/3a89b78bf3373d5b99b87e99757d9afb2864849e,12/6(水) 10:40
wcartop,WEB CARTOP,正式にはT字路じゃなく丁字路！　読めば「ティー」と「テー」でソックリだけど道交法上は漢字が正解だった,https://news.yahoo.co.jp/articles/11e305c995c76c64691860be9847c30c3e2b2a05,12/6(水) 10:10
wcartop,WEB CARTOP,佐藤琢磨に角田裕毅に岩佐歩夢と豪華ゲスト襲来！　モビリティリゾートもてぎにてHRS-Kの特別講習会を開催,https://news.yahoo.co.jp/articles/0c72ce0f1e8fa6a1c3d9bda588351b9eabb328c7,12/6(水) 7:11
wcartop,WEB CARTOP,中国のBYDはバスの世界でも脅威のフットワーク！　JAPANの頭文字「J」を付けたEVバスで日本獲りを狙う,https://news.yahoo.co.jp/articles/97bcf2e4fc39c941e0e9ed40c4ff82c10f9b6dba,12/6(水) 6:32
wcartop,WEB CARTOP,高齢者でもギャルでも昭和オヤジが乗ってもサマになる！　老若男女問わず乗り手まで「オシャレ」に見える輸入車5台,https://news.yahoo.co.jp/articles/367ab988c10f52bba8c2e4916428c39457a7b816,12/5(火) 17:40
wcartop,WEB CARTOP,新型N-BOXのデザインって先代とあんまり変わってない……と思ったらめちゃめちゃ計算されてた！　デザイナーに直撃してわかった「考え抜かれたシンプル」の美学,https://news.yahoo.co.jp/articles/f9f7b17d18501722f92deb076796864daf09be95,12/5(火) 17:30
wcartop,WEB CARTOP,プレリュードの復活に色めき立つ昭和生まれ！　伝統の名前を蘇らせる裏には巧妙なマーケティング戦略があった,https://news.yahoo.co.jp/articles/80b02f46b021a89c0b32390542de2f88f149766b,12/5(火) 13:10
wcartop,WEB CARTOP,「全身センス」ってどういうことだ!?　衝撃キャッチコピーで登場した「初代プレセア」はバブルじゃなきゃ通用しないセダンだった,https://news.yahoo.co.jp/articles/ea87c60cac436f493f801a9c4b3d8e6cac75065b,12/5(火) 11:50
wcartop,WEB CARTOP,宗一郎イズムを体現したホンダの白い作業着！　作っているのは100周年を迎える老舗企業だった,https://news.yahoo.co.jp/articles/70f3588cc0e3dd5764dd7ef39c1f1db51607c710,12/5(火) 10:10
wcartop,WEB CARTOP,いまやアクセルペダルはゲームのコントローラーと同じ！　自動運転時代に必須の「ドライブ・バイ・ワイヤ」って何？,https://news.yahoo.co.jp/articles/df6f1b06a68181584295c3cb4d970c8450ab6242,12/5(火) 7:11
wcartop,WEB CARTOP,国も自治体もライドシェアの基本を理解してる？　新しいサービスなのに既存の仕組みの中に組み込もうとする日本の悪しき慣習,https://news.yahoo.co.jp/articles/8d424ec9257a4efb7164ce275f5c898cef61dc44,12/5(火) 6:32
wcartop,WEB CARTOP,オシャレでいいな〜と思うけど900万円！　VWのID.Buzzは日本で売れる？　苦戦する？,https://news.yahoo.co.jp/articles/6f3d8015de52ac9411771327d23f7aab1164b1b9,12/4(月) 17:40
wcartop,WEB CARTOP,華やかさもないし規模も小さいし「なんでやっていけるの？」　小規模ディーラーが生き残っている納得の戦略とは,https://news.yahoo.co.jp/articles/00276c7afe9fa6de56b46671b0060200180e98fc,12/4(月) 17:30
wcartop,WEB CARTOP,なぜ300km/h出せるスーパースポーツでも180km/h？　日本車の速度リミッターはいまの時代になれば納得の取り組みだった,https://news.yahoo.co.jp/articles/50ccf7e82846ff08482a092568f116c003901f96,12/4(月) 13:10
wcartop,WEB CARTOP,クルマのタイヤが「ハの字」になってるのはナゼ？　「鬼キャン」なんて言葉もある「キャンバー角」って一体何だ,https://news.yahoo.co.jp/articles/bbc052073a0780e5a1d3fc2ab723b65f9ac560f1,12/4(月) 11:52
wcartop,WEB CARTOP,「遅いなら一番左走れよ！」って言いたくもなるが……ガラガラなのに高速道路の「第一走行車線」を避けるワケ,https://news.yahoo.co.jp/articles/d9eb79d8955c7a305fcee57410877c7d153f66f4,12/4(月) 10:10
wcartop,WEB CARTOP,乗ってみたらヒョンデKONAがけっこう脅威！　攻めた装備と大胆デザインの勢いがスゴイ,https://news.yahoo.co.jp/articles/14d534c6aa9a073b0c36a9dae994168a31fe9154,12/4(月) 6:31
wcartop,WEB CARTOP,バトルがないからレースに比べて楽しめない……なんて言ってちゃ人生損してる！　ラリージャパンに見る「ラリー」観戦の楽しみ方,https://news.yahoo.co.jp/articles/a72a49d7d553a946abff2e955862f3ef020922e5,12/3(日) 17:40
wcartop,WEB CARTOP,なんか速そうな「R」とか「RS」！　「レーシング」とか「スポーツ」かと思いきやまったく違う意味のクルマもけっこうあった,https://news.yahoo.co.jp/articles/0968dbd5c050eb48db23f52b7f80f28cb943d32b,12/3(日) 17:30
wcartop,WEB CARTOP,S耐に出てるトヨタの水素カローラは走りながらCO2を回収してるだと!?　超画期的な技術の中身とは,https://news.yahoo.co.jp/articles/553e17b1a37505c29be2ffaf251eee80106f4e2b,12/3(日) 13:10
wcartop,WEB CARTOP,めちゃめちゃ安くて手軽なのに雰囲気激変ってやるしかない！　いまホイールキャップのドレスアップが盛り上がっていた,https://news.yahoo.co.jp/articles/621852388b9c4e4f2d737d16a9c3296feb1e16cb,12/3(日) 11:50
wcartop,WEB CARTOP,「行けんだろ」で冠水道路への突撃は危険！　クルマの「渡河性能」はどの程度か調べてみた,https://news.yahoo.co.jp/articles/d8bd47161482772055a957d48ee35e603d9c9117,12/3(日) 10:11
wcartop,WEB CARTOP,環境問題よりも一般ユーザーは日々の生活が大切！　BEVはユーザーがメリットを感じなければ普及しない,https://news.yahoo.co.jp/articles/60318d2397911844339a475d3ac4554f11a40353,12/3(日) 7:11
wcartop,WEB CARTOP,安くて軽くてスパルタン！　ポルシェ356で誕生した「スピードスター」はやっぱり特別な称号だった,https://news.yahoo.co.jp/articles/67c1fd276446c7f63cdd7d8afb96a6fdac2dfdce,12/2(土) 17:40
wcartop,WEB CARTOP,トヨタの「負けず嫌い」が日本メーカー全体を鍛えた！　意地でもライバルに勝つために開発した「後出しジャンケン車」たち,https://news.yahoo.co.jp/articles/2271fcd59bbc62e6bcf009d75548385b1fd7e3a3,12/2(土) 17:30
wcartop,WEB CARTOP,「10年基準」を謳って10年で終売……ってそういう意味だったの!?　ユーノス800という懐かしすぎる高級車,https://news.yahoo.co.jp/articles/0fa3eb97495d7ee796cbae3d6af9939f4fd1100d,12/2(土) 13:11
wcartop,WEB CARTOP,メルセデス・ベンツがPHEV「GLC 350e 4MATIC Sports Edition Star」を発売,https://news.yahoo.co.jp/articles/182a53416dbdf5e34c230e022b0d1f7017c9a766,12/2(土) 12:00
wcartop,WEB CARTOP,愛車を新調したので「愛犬の愛車」も新調！　ワンコも納得のクルマに合わせた「ペットカート」の選び方とは,https://news.yahoo.co.jp/articles/522c5dd65181b1ac8373a31d495f11190ca7315e,12/2(土) 11:51
wcartop,WEB CARTOP,情報収集なくしていまのクルマは走れない！　じっくり見るとセンサーだらけだった,https://news.yahoo.co.jp/articles/9cf86b05741e88aad45da01a04f3c394bba4f316,12/2(土) 10:40
wcartop,WEB CARTOP,冬用タイヤ規制が発令！　走れるタイヤはドコを見ればわかる？,https://news.yahoo.co.jp/articles/13f877724ac2092e3fb2fcf4648e10d5d7c09a84,12/2(土) 10:11
wcartop,WEB CARTOP,大型トラック2台分の輸送力！　腕も資格も走る場所も難易度高めだけど「ダブルトレーラー」もドライバー不足解決の鍵!!,https://news.yahoo.co.jp/articles/42fd7ce9b785d45e7b9fcbf1b603cc4668820482,12/1(金) 17:40
wcartop,WEB CARTOP,恐ろしいほどバカッ速で若者を熱狂させた「スポーツ軽」！　懐かしモデル7台の中古価格を調べたら驚きの結果に,https://news.yahoo.co.jp/articles/9b2cd6590629e528b7b7a2ae70976df1fd96b103,12/1(金) 17:30
wcartop,WEB CARTOP,「スバルとアウディ」「日産とBMW」「ホンダとプジョーとルノー」は似てる!?　国産オーナーがすんなり受け入れられる輸入車を考えてみた,https://news.yahoo.co.jp/articles/ffbf02059febc8be47562d99b195bd0b31d97bda,12/1(金) 13:10
wcartop,WEB CARTOP,ファッションだけで選ぶのはNG！　着用しちゃいけないものもある「運転に適した」サングラスとは,https://news.yahoo.co.jp/articles/73d1d061c552887ff04a98d26af41482936c960e,12/1(金) 11:51
wcartop,WEB CARTOP,採用するほとんどが日本の小型車！　CVTってそもそも何？　弱点とメリットはどこにある？,https://news.yahoo.co.jp/articles/a54ece9211206172aaf817a28d9be532948d8254,12/1(金) 10:10
wcartop,WEB CARTOP,使わないけどちょっと気になる！　免許証の「ICチップ」にはどんな情報が詰まってる？,https://news.yahoo.co.jp/articles/03dc82da360d4424baa3653ba1d1337158238a5f,12/1(金) 6:30
wcartop,WEB CARTOP,上野のパンダでもキャバレーのダンスでもない！　トラックドライバーが使う用語「カンカン」って何？,https://news.yahoo.co.jp/articles/201a50759bf1be1b82a31da1d157cbae7bef939e,11/30(木) 17:40
wcartop,WEB CARTOP,ポルシェもフェラーリもほぼ見かけないってちょっとガッカリ！　速度無制限の「アウトバーン」をかっ飛ばすクルマは意外に地味だった,https://news.yahoo.co.jp/articles/77029d5c319cb4f064b1b7e1b23b190a3f4eb7f5,11/30(木) 17:30
wcartop,WEB CARTOP,【試乗】氷上でも雪上でも進化が止まらない！　ヨコハマのスタッドレス「アイスガード7」の底力を北の大地で体感,https://news.yahoo.co.jp/articles/7de3e599ab2ed8929b002f0c42962c0155fec4b1,11/30(木) 17:10
wcartop,WEB CARTOP,電動ラグジュアリーSUVに新たな選択肢登場！　電気自動車のレクサスRZにFWDモデル「RZ300e」が登場,https://news.yahoo.co.jp/articles/8a1cd8193c0ac670f81630bc00252a205076e6ab,11/30(木) 13:40
wcartop,WEB CARTOP,どうみても市販車の「スペーシア」と「スイフト」はなぜコンセプトを名乗った？　ジャパンモビリティショー展示車の疑問に迫る！,https://news.yahoo.co.jp/articles/2ca0ef7f35f1fab8029dabfc3cbfde65065cbb29,11/30(木) 13:10
wcartop,WEB CARTOP,日本で惨敗したのは北米向けの「ナンパさ」が原因!?　4年で1.5万台しか売れなかった超個性派「日産NXクーペ」とは,https://news.yahoo.co.jp/articles/1ab70811029dadac12fce7dd42a344ecd55ba066,11/30(木) 11:51
wcartop,WEB CARTOP,死亡率の高い歩行者と自転車を守る対策！　全国で約800カ所もある「あんしん歩行エリア」って何？,https://news.yahoo.co.jp/articles/b7ea7d56f68cb7a6ddfb89c939aaace5fd7be894,11/30(木) 10:10
wcartop,WEB CARTOP,CO2を排出しない「水素エンジン」の泣き所NOx排出！　それでも夢のエンジンとして可能性は大だった,https://news.yahoo.co.jp/articles/ded6d22dc5013f9f476c49412c16ead259619d6f,11/30(木) 6:32
wcartop,WEB CARTOP,小ささがウリだけど小さすぎると売れない!?　名車の称号は得ても販売で苦戦した「2ドアハッチ軽自動車」3台,https://news.yahoo.co.jp/articles/7c675b5f66532827362af6a70a7c61e15828b3a1,11/29(水) 17:40
wcartop,WEB CARTOP,トラックは走るべからず!?　複数車線の一般道にある「環境レーン」って何？,https://news.yahoo.co.jp/articles/50c020ba99daedcb11466ae1778f6deeb0a6f4c0,11/29(水) 17:30
wcartop,WEB CARTOP,日本で一番権威のあるクルマの賞！　「日本カー・オブ・ザ・イヤー」って一体何？,https://news.yahoo.co.jp/articles/586fc12b6d23e3711eed7e0632630cc3048c82b0,11/29(水) 13:10
wcartop,WEB CARTOP,多くのドライバーを悩ませる「フロントガラスの曇り」　一番の原因は「ガラスの汚れ」だった！,https://news.yahoo.co.jp/articles/2eb338a7cbc6e1864086539dfd344ef508609228,11/29(水) 11:52
wcartop,WEB CARTOP,クルマのボディの主役はやっぱり鉄！　置換素材の「アルミ・カーボン・FRP」は何が凄くで何がネック？,https://news.yahoo.co.jp/articles/12eb0b05da498fb395b08945d7cf5a588c090920,11/29(水) 10:10
wcartop,WEB CARTOP,デリカシリーズ伝統の特別仕様車が復活！　三菱デリカD:5とデリカミニに「CHAMONIX（シャモニー）」シリーズが登場,https://news.yahoo.co.jp/articles/c2aab32379517535f52bcd4806bbad29a6a111f6,11/29(水) 7:12
wcartop,WEB CARTOP,「釣りはいらねぇ」「あのクルマ追って」「東京から四国まで」は本当にあった！　タクシードライバーが遭遇したドラマみたいなホントの話,https://news.yahoo.co.jp/articles/fd321f603e5bdec1da6d2802211e49c228a2bf06,11/29(水) 6:32
wcartop,WEB CARTOP,スズキの軽自動車はここから始まった！　軽ブームに火を付けレースでも活躍した「スズライト」は偉大なり,https://news.yahoo.co.jp/articles/d07af07c067a5de0bc056ddc7256e5f43a46c984,11/28(火) 17:40
wcartop,WEB CARTOP,4WSならぬ6WSで長ーい車体がグイッと曲がる！　巨大トレーラーの「後輪操舵」が運輸業界のメシアとなる!!,https://news.yahoo.co.jp/articles/73e097c8b2748de12ed1b1ca19342a86c00f2ad2,11/28(火) 17:30
wcartop,WEB CARTOP,同じようなのゴムの塊に見えるけどなんでそんなに違う？　同サイズでもタイヤの価格がピンキリなワケ,https://news.yahoo.co.jp/articles/553fa637dc61bd01a45b5bb7720236ac6dc429fa,11/28(火) 13:10
wcartop,WEB CARTOP,ラリージャパンのレッキ車両は単なる「下見の足」じゃなかった！　ワークスチームが積んだ「ハイテク機器」に驚き!!,https://news.yahoo.co.jp/articles/2a0eb53bf8692319d0787cae2166bf8f916022a1,11/28(火) 11:51
wcartop,WEB CARTOP,元祖軽商用EVがパワーアップしつつもなんと価格ほぼ据え置き！　三菱が「ミニキャブEV」へ車名を変更し12月21日より販売スタート,https://news.yahoo.co.jp/articles/99566414baade74f6ff10225f47dde048608ef5b,11/28(火) 10:10
wcartop,WEB CARTOP,昔はセルが壊れてもバッテリーが上がっても「押せ」ば解決！　いまや絶滅したテク「押しがけ」って何？,https://news.yahoo.co.jp/articles/bf652fb0f11779111e6b7292ec88bac2492ce6bd,11/28(火) 7:11
