media_en,media_jp,title_articles,date_original
qab,沖縄ニュースQAB,首里城復興祭「古式行列」／華やかな一行が城下町に,11/7(木) 14:55
qab,沖縄ニュースQAB,母親に熱湯　娘ら3人逮捕,11/7(木) 12:20
qab,沖縄ニュースQAB,沖縄地区税関移転　新庁舎で開庁式,11/7(木) 12:20
qab,沖縄ニュースQAB,有機フッ素化合物汚染源調査にかかる専門家会議,11/6(水) 20:09
qab,沖縄ニュースQAB,漂着ペットボトルのフタをアップサイクル,11/6(水) 20:06
qab,沖縄ニュースQAB,米兵が那覇市の学習塾のドアを破損し侵入,11/6(水) 20:04
qab,沖縄ニュースQAB,QAB制作「誰のために島を守る」連盟賞テレビ報道番組部門で優秀賞,11/6(水) 20:03
qab,沖縄ニュースQAB,那覇の秋彩った”復興祭” 正殿完成まで2年 届けたい思い,11/6(水) 19:59
qab,沖縄ニュースQAB,西原高校マーチングバンド部 台湾でも躍動 青春はマーチング,11/6(水) 19:52
qab,沖縄ニュースQAB,NZ ワンガヌイ市　留学誘致などで沖縄を訪問,11/6(水) 17:11
qab,沖縄ニュースQAB,パトカーが追跡中にバイク転倒 無免許の女子中学生が2人けが,11/6(水) 17:08
qab,沖縄ニュースQAB,沖縄・台湾共同制作ドラマ 東海岸で撮影開始,11/6(水) 12:35
qab,沖縄ニュースQAB,泡盛がユネスコ無形文化遺産に登録へ 来月にも正式決定か,11/6(水) 12:25
qab,沖縄ニュースQAB,めーにちしまくとぅばSeason5#41,11/5(火) 18:54
qab,沖縄ニュースQAB,警察「起訴を求める」意見／強制わいせつの容疑で南城市長を書類送検,11/5(火) 18:54
qab,沖縄ニュースQAB,県庁で大津波を想定した避難訓練実施,11/5(火) 18:52
qab,沖縄ニュースQAB,残留2世アカヒジさんの国籍回復願い　親族ら今月フィリピンへ,11/5(火) 18:52
qab,沖縄ニュースQAB,「食のバリアフリー」目指して嚥下障害のある子どもへホテルが対応の試み／ビジネスキャッチー,11/5(火) 18:50
qab,沖縄ニュースQAB,2023年　人口動態統計／ビジネスキャッチー,11/5(火) 18:49
qab,沖縄ニュースQAB,那覇市　消費者物価指数は？／ビジネスキャッチー,11/5(火) 18:48
qab,沖縄ニュースQAB,誰もがより活躍できる環境づくりを目指す報告会／ビジネスキャッチー,11/5(火) 18:48
qab,沖縄ニュースQAB,空自「オスプレイ墜落」内部文書／防衛大臣「省の評価ではない」／「不時着水」の見解維持／2016年・名護の事故,11/5(火) 16:50
qab,沖縄ニュースQAB,第一牧志公設市場アーケード完成セレモニー,11/5(火) 16:50
qab,沖縄ニュースQAB,県警　南城市長を強制わいせつで書類送検方針,11/5(火) 15:07
qab,沖縄ニュースQAB,県庁で大津波を想定した避難訓練実施,11/5(火) 12:17
qab,沖縄ニュースQAB,高校野球 秋の九州大会準決勝 エナジックと沖縄尚学が決勝進出！ 決勝は沖縄県勢の対戦に,11/4(月) 19:08
qab,沖縄ニュースQAB,高校野球 秋の九州大会 11年ぶり沖縄県勢同士の決勝戦 エナジック対沖縄尚学,11/4(月) 19:08
qab,沖縄ニュースQAB,全日本大学駅伝 國學院大學 1区・嘉数純平とアンカー8区・上原琉翔の活躍で初優勝！,11/4(月) 19:05
qab,沖縄ニュースQAB,座間味村の久場島で水難事故　51歳男性死亡,11/4(月) 19:04
qab,沖縄ニュースQAB,安和桟橋付近発生の交通死亡事故　現場で実況見分,11/4(月) 19:04
qab,沖縄ニュースQAB,終戦直後の様子を米兵が撮影　写真展「テューンがみた沖縄」,11/4(月) 19:03
qab,沖縄ニュースQAB,「沖縄の未来を考える」イベント開催,11/4(月) 19:01
qab,沖縄ニュースQAB,個人や団体を特別功労として表彰　沖縄市・市制施行50周年記念式典,11/4(月) 19:01
qab,沖縄ニュースQAB,カヌチャリゾートでイルミネーション始まる,11/4(月) 16:54
qab,沖縄ニュースQAB,首里城復興祭　最終日　国王・王妃役が姿を現す「出御」再現,11/4(月) 12:13
qab,沖縄ニュースQAB,次世代型電動車椅子「WHILL」を活用した全国初の避難訓練を名護市で実施,11/4(月) 12:13
qab,沖縄ニュースQAB,浦添市で強盗致傷事件　万引き発見された男が警備員へ暴行し逃走,11/3(日) 17:57
qab,沖縄ニュースQAB,首里城までランタンウォーク　1000人が参加,11/3(日) 13:56
qab,沖縄ニュースQAB,400人余りで琉球王朝絵巻行列,11/2(土) 18:06
qab,沖縄ニュースQAB,北谷・宜野湾・那覇 ひき逃げ事件3件,11/2(土) 18:06
qab,沖縄ニュースQAB,子どもたちが首里城への思いを胸に合唱「SYURI NO UTA」プロジェクト,11/2(土) 12:20
qab,沖縄ニュースQAB,名護市の男 殺人容疑で起訴,11/2(土) 12:20
qab,沖縄ニュースQAB,第14回週刊首里城　「沖縄を元気に」復興祭　国王の思い,11/1(金) 19:06
qab,沖縄ニュースQAB,リュウキュウの自然　「秋の大合唱」,11/1(金) 19:06
qab,沖縄ニュースQAB,【独自】自衛隊内部文書で「墜落」／2016年・名護の米軍オスプレイ事故／防衛省は「不時着水」表現／自衛隊「誤表記」（開示文書も公開）,11/1(金) 18:59
qab,沖縄ニュースQAB,北谷町と本部町を結ぶ観光バスの実証実験がスタート,11/1(金) 18:58
qab,沖縄ニュースQAB,高校野球秋の九州大会沖縄から2校出場の準決勝はあさってに順延ベスト4意気込み,11/1(金) 18:58
qab,沖縄ニュースQAB,「いい肉の日」PRでQABを訪問,11/1(金) 18:57
qab,沖縄ニュースQAB,台風21号から一夜　交通機関あすの運行は,11/1(金) 16:56
qab,沖縄ニュースQAB,台風21号から一夜　交通機関は,11/1(金) 12:05
qab,沖縄ニュースQAB,米海軍無人機、嘉手納から撤収　空軍・海兵隊の運用は続く,11/1(金) 12:05
qab,沖縄ニュースQAB,国際通りで違法設置看板取り締まり,11/1(金) 12:04
qab,沖縄ニュースQAB,2024U-18島唄者コンテスト本選　唄と言葉を未来へ,10/31(木) 17:50
qab,沖縄ニュースQAB,台風21号　最新情報,10/31(木) 17:50
qab,沖縄ニュースQAB,与那国島オスプレイ事故／国会議員ら、陸上自衛隊に申し入れ,10/31(木) 17:46
qab,沖縄ニュースQAB,台風21号　最新情報,10/31(木) 17:06
qab,沖縄ニュースQAB,首里城火災から5年　火災想定した早朝訓練,10/31(木) 17:06
qab,沖縄ニュースQAB,首里城火災から5年　火災想定した早朝訓練,10/31(木) 12:44
qab,沖縄ニュースQAB,非常に強い台風21号　八重山地方暴風に警戒,10/31(木) 12:31
qab,沖縄ニュースQAB,首里城火災から5年 二度と繰り返さない「火事」への備え,10/30(水) 20:06
qab,沖縄ニュースQAB,わんさか台わん 憧れの列車が復活！,10/30(水) 19:54
qab,沖縄ニュースQAB,普天間オスプレイ「運用停止は不要」／与那国事故は「オスプレイ全体の問題ではない」／米海兵隊が見解示す,10/30(水) 19:47
qab,沖縄ニュースQAB,台風21号　あすには八重山に最接近,10/30(水) 19:42
qab,沖縄ニュースQAB,高校野球秋の九州大会　沖縄尚学がエナジックに続きベスト4でセンバツ前進！　鹿児島実業との継続試合,10/30(水) 19:40
qab,沖縄ニュースQAB,衆院選の小選挙区で当選した4人に当選証書を付与,10/30(水) 17:48
qab,沖縄ニュースQAB,台風21号　あすには八重山に最接近,10/30(水) 17:46
qab,沖縄ニュースQAB,明治ファミリー劇場　感想文・感想画の表彰式,10/30(水) 12:27
qab,沖縄ニュースQAB,台風21号非常に強い勢力に発達し八重山地方があす昼前に暴風,10/30(水) 12:25
qab,沖縄ニュースQAB,第4回 早わかりビズ　ジャパン ウィンターリーグによる経済効果／ビジネスキャッチー,10/29(火) 19:20
qab,沖縄ニュースQAB,高校野球秋の九州大会 エナジックに続けるか　沖縄尚学が春のセンバツかけ鹿児島実業と対戦！,10/29(火) 19:20
qab,沖縄ニュースQAB,めーにちしまくとぅばSeason5#40,10/29(火) 19:20
qab,沖縄ニュースQAB,防衛大臣「安全性問題なし」／与那国・陸自オスプレイ事故／公表は衆院選投票終了後も隠蔽意図否定,10/29(火) 19:20
qab,沖縄ニュースQAB,台風21号最新情報　八重山地方に接近,10/29(火) 19:17
qab,沖縄ニュースQAB,もろみ酢とフコイダンの相乗効果／ビジネスキャッチー,10/29(火) 19:15
qab,沖縄ニュースQAB,CBcloud本店移転会見／ビジネスキャッチー,10/29(火) 19:15
qab,沖縄ニュースQAB,台風21号最新情報　八重山地方に接近,10/29(火) 16:57
qab,沖縄ニュースQAB,東南植物楽園　イルミネーション点灯式,10/29(火) 16:54
qab,沖縄ニュースQAB,沖縄平和賞受「ヒューマンライツ・ナウ」賞式,10/29(火) 12:29
qab,沖縄ニュースQAB,「健康保険証をなくさないで！」医療関係者らが訴える,10/29(火) 12:24
qab,沖縄ニュースQAB,衆院選「オール沖縄」2勝　自民2勝,10/29(火) 11:57
qab,沖縄ニュースQAB,エナジックスポーツから初のドラフト指名 西武6位・龍山暖選手　よろこびの声,10/28(月) 19:19
qab,沖縄ニュースQAB,エナジック 春のセンバツかけた秋の九州大会準々決勝！ 長崎・壱岐と対戦,10/28(月) 19:08
qab,沖縄ニュースQAB,陸自オスプレイが与那国で事故／機体一部が損傷／日米演習参加中の機体,10/28(月) 19:08
qab,沖縄ニュースQAB,公務員が酒気帯びで事故　60代男性はね骨折させる,10/28(月) 16:56
qab,沖縄ニュースQAB,イリオモテヤマネコの銅像が万博フランス館で展示へ,10/28(月) 16:55
qab,沖縄ニュースQAB,衆院選沖縄選挙区　オール沖縄2勝・自民2勝,10/28(月) 12:34
qab,沖縄ニュースQAB,陸自オスプレイが与那国で事故／機体一部が損傷,10/28(月) 12:30
qab,沖縄ニュースQAB,沖縄4選挙区のうち3人の当選決まる,10/28(月) 0:58
qab,沖縄ニュースQAB,衆院選　きょう投開票,10/27(日) 17:58
qab,沖縄ニュースQAB,ガス取り扱う事業者対象に訓練,10/27(日) 17:58
qab,沖縄ニュースQAB,衆院選・投開票日　朝から投票始まる,10/27(日) 12:11
qab,沖縄ニュースQAB,浦添ようどれ 落書きした20代の男らを逮捕,10/26(土) 18:09
qab,沖縄ニュースQAB,沖縄のエンタメについて考える講演,10/26(土) 18:05
qab,沖縄ニュースQAB,衆院選に行こう！街頭啓発活動,10/26(土) 12:22
qab,沖縄ニュースQAB,歌え！ハロウィーン この後開催,10/26(土) 12:14
qab,沖縄ニュースQAB,衆院選選挙区リポート3区／辺野古・振興で論戦,10/25(金) 19:44
qab,沖縄ニュースQAB,楽園の海　水中地形ポイントを冒険！万座の海 Part1,10/25(金) 19:44
qab,沖縄ニュースQAB,プロ野球ドラフト会議　エナジック・龍山暖選手など3人の県勢選手が指名受ける,10/25(金) 18:40
qab,沖縄ニュースQAB,わいせつ誘拐・不同意性交等の米空軍兵裁判　検察が懲役7年を求刑,10/25(金) 18:40
qab,沖縄ニュースQAB,石垣市の殺人事件　逮捕された男が送検,10/25(金) 17:17
qab,沖縄ニュースQAB,第48回沖縄の産業まつり「これいいね！笑顔はじける県産品」,10/25(金) 17:17
qab,沖縄ニュースQAB,琉球エアーコミューター運航再開　25日はダイヤを変更,10/25(金) 12:07
qab,沖縄ニュースQAB,のばそう！健康寿命／名護市で「県老人クラブ大会」開催,10/25(金) 12:07
qab,沖縄ニュースQAB,プロ野球ドラフト会議2024　沖縄県勢の指名の行方,10/24(木) 19:14
qab,沖縄ニュースQAB,衆院選・沖縄2区　候補者の顔ぶれと訴え,10/24(木) 19:13
qab,沖縄ニュースQAB,衆院選・沖縄4区　候補者の訴え,10/24(木) 19:13
qab,沖縄ニュースQAB,琉球エアーコミューター　きょうも全便欠航,10/24(木) 19:11
qab,沖縄ニュースQAB,男が女性を刃物で刺し殺害／石垣市で殺人事件,10/24(木) 19:09
qab,沖縄ニュースQAB,大雨で冠水やダムの事前放水も,10/24(木) 19:09
qab,沖縄ニュースQAB,宮古島の海岸で水難事故　韓国籍の女性が死亡,10/24(木) 16:53
qab,沖縄ニュースQAB,県知事賞に5つの酒造所が選ばれる／泡盛鑑評会　のべ20の酒造所を表彰,10/24(木) 16:51
