media_en,media_jp,title_articles,link_articles,date_original
ibciwatev,IBC岩手放送,広瀬めぐみ参院議員が自民党を離党　公設秘書給与詐欺容疑で特捜部の家宅捜索受ける　藤原崇岩手県連会長「まず本人がしっかり説明を」,https://news.yahoo.co.jp/articles/3e06748a4f17f9a0739d3af200480db8a16bc326,7/31(水) 13:02
ibciwatev,IBC岩手放送,川で溺れ20歳の男性死亡　友人と水遊び中　雨で水量増していたか　岩手・雫石町,https://news.yahoo.co.jp/articles/be95a88e229c7709a48fa413c63f10d44c18b5a0,7/31(水) 9:51
ibciwatev,IBC岩手放送,「岩手と富山が手を取り合い、復興に向けて頑張りたい」郷土芸能でつながる岩手と富山の高校生,https://news.yahoo.co.jp/articles/526906a7dc04c6f53ebeda77677134f0fd977694,7/31(水) 6:02
ibciwatev,IBC岩手放送,「戦争や事件の記憶が薄れていく事を危惧」秋田・花岡事件から79年　慰霊式を取材　語り継ぐ人々、遺族の声を聞く　秋田,https://news.yahoo.co.jp/articles/10c7667c644e95259f97ce3e6e1c3d3b0abc00f2,7/30(火) 20:32
ibciwatev,IBC岩手放送,ガス工場とスーパーマーケットで小学生が仕事の現場を見学　仕事に関する理解深める　岩手,https://news.yahoo.co.jp/articles/69bf0a4b00c0c42310449c3d0ef4fd55aef6659a,7/30(火) 19:04
ibciwatev,IBC岩手放送,元巨人の篠塚和典さん、定岡正二さんらが子どもたちに熱血指導　プロ野球OBによる野球教室　岩手・宮古市,https://news.yahoo.co.jp/articles/bd65be641180574e08fd6f95364fe60aff06e42a,7/30(火) 19:02
ibciwatev,IBC岩手放送,住宅の焼け跡から発見の遺体はこの家に住む50代男性と判明　秋田・能代市,https://news.yahoo.co.jp/articles/8578edaabc1ff8ffbe955ab8b7ea3f6885d4357e,7/30(火) 18:58
ibciwatev,IBC岩手放送,たんの吸引が適切に行われず　たんが詰まって窒息、男性1人死亡　岩手医大附属病院で医療事故　記者会見で謝罪　岩手,https://news.yahoo.co.jp/articles/0a91481c85a73787a6c15a8d2f22063c3afd9703,7/30(火) 18:54
ibciwatev,IBC岩手放送,地元からは「ちゃんとしてほしい」の声　広瀬めぐみ参議院議員の事務所などを家宅捜索　勤務実態のない公設秘書の給料を国からだまし取った疑い,https://news.yahoo.co.jp/articles/d229bc5bb564ac0eda4a62dd2a8050f2351a4dff,7/30(火) 18:32
ibciwatev,IBC岩手放送,大雨で八戸線の一部が運休に,https://news.yahoo.co.jp/articles/ca94833a16e53593dd9717e2443bb0e0b2400764,7/30(火) 16:51
ibciwatev,IBC岩手放送,盛岡市内のデパートにポケモンセンター出張所オープン　デジタルスタンプラリーの出張所も始まり盛況,https://news.yahoo.co.jp/articles/3fc618cdad94280604d5b5ceab240f2618929212,7/30(火) 16:02
ibciwatev,IBC岩手放送,6月の岩手県内の有効求人倍率1.16倍　2か月連続で前の月を下回る,https://news.yahoo.co.jp/articles/eb06659c3ab213f2e8e3e5a9ac2668e650104720,7/30(火) 15:58
ibciwatev,IBC岩手放送,ブルージェイズ・菊池雄星投手　アストロズへの移籍決まる,https://news.yahoo.co.jp/articles/1c2294857aec14fc4763ae2385b7e039bdc9ca7e,7/30(火) 14:34
ibciwatev,IBC岩手放送,東京地検特捜部が広瀬めぐみ議員の関係先を家宅捜索,https://news.yahoo.co.jp/articles/99a55069c6b9133e4a69078d803d740580dcc24b,7/30(火) 12:32
ibciwatev,IBC岩手放送,熱中症特別警戒アラートが発令された際の「避難場所」に　JR釜石駅がクーリングシェルターに指定,https://news.yahoo.co.jp/articles/b04d4cccb32b990d3d5a3c7ddc9e188bd1c642d4,7/30(火) 12:06
ibciwatev,IBC岩手放送,「自分たちのプレーで岩手を盛り上げたい」 いざ夏の甲子園へ　花巻東が岩手県庁訪問し決意語る,https://news.yahoo.co.jp/articles/8fa71897de044fa2b1846e4ec2df0333d34b069d,7/30(火) 6:02
ibciwatev,IBC岩手放送,猛暑!暑い夏到来!この夏食べたい ひんやり冷たいかき氷の新定番をイッキにご紹介!,https://news.yahoo.co.jp/articles/136445fcbcb290d7bf1795d2a26b561ccc26115f,7/29(月) 21:02
ibciwatev,IBC岩手放送,入力漏れで誤って固定資産税を過大徴収　14人が住宅用地の減額措置されず　過去18年間の分もさかのぼって調査し返還検討　岩手・大槌町,https://news.yahoo.co.jp/articles/8b3341044d7415905eff81053062c0f0206601bc,7/29(月) 20:56
ibciwatev,IBC岩手放送,全国学力テスト　岩手県内の小中学生は小学生の国語を除く3教科で全国平均下回る,https://news.yahoo.co.jp/articles/a86d35f01121cc48d01cd14e7de834c881c614a9,7/29(月) 19:02
ibciwatev,IBC岩手放送,小学校の新校舎が完成　児童らは新学期からの生活にわくわく　岩手・山田町,https://news.yahoo.co.jp/articles/339894fe690f7a6d73ee3a492410eae721470441,7/29(月) 19:02
ibciwatev,IBC岩手放送,「重大かつ悪質な凶悪な犯行　一連の無謀な犯行に酌むべき事情はない」　強盗殺人ほか8つの罪に問われている佐藤廣明被告に無期懲役の判決　岩手,https://news.yahoo.co.jp/articles/128ad6260d2f397d8fd3a15dd001fd684e8ff981,7/29(月) 18:54
ibciwatev,IBC岩手放送,パリ五輪・7月29日までの岩手県関連の選手の結果まとめ,https://news.yahoo.co.jp/articles/52a859af88b9de8056404aa8c3c030f8229c265b,7/29(月) 18:32
ibciwatev,IBC岩手放送,JR釜石線で倒木による運休と遅れ,https://news.yahoo.co.jp/articles/d8fcac5b66924670190202e83d482d42aff76f3e,7/29(月) 17:51
ibciwatev,IBC岩手放送,由利本荘市で身元不明遺体を発見　安否不明の男性か　秋田,https://news.yahoo.co.jp/articles/08c91c02bfc9d4de311ea641d6f6d22ffc64e9a7,7/29(月) 17:22
ibciwatev,IBC岩手放送,南部せんべいを使ったチョコレート菓子　国際コンクールで最高賞の三ツ星を獲得　小松製菓が達増拓也岩手県知事に報告,https://news.yahoo.co.jp/articles/e57a8a7ab43d24665132d688d32eb8789fb98698,7/29(月) 16:08
ibciwatev,IBC岩手放送,50回の遠洋航海でおよそ680人の船乗りを育てた共同実習船りあす丸最後の遠洋航海終え帰港　岩手・宮古市,https://news.yahoo.co.jp/articles/7fb458b5eaa06afe8a323b1b4db47811cc7e2e9d,7/29(月) 16:04
ibciwatev,IBC岩手放送,おいしい滝沢スイカをPR　スイカの重さを当てると地元の名産、滝沢スイカがもらえるイベント開催,https://news.yahoo.co.jp/articles/646478d8a7e54b39f99e32121aa4cb7cd63c945c,7/29(月) 12:13
ibciwatev,IBC岩手放送,岩手県内　29日夜から30日にかけ大雨にとなる所がある見込み　土砂災害に警戒を,https://news.yahoo.co.jp/articles/765eaa17b73a27ad2eabac9b955ddf00cb2be691,7/29(月) 12:06
ibciwatev,IBC岩手放送,ドジャース・大谷翔平選手　自己最多更新シーズン27個目の盗塁決める　チームは6対2で勝利,https://news.yahoo.co.jp/articles/bf33d8004bbba32ec5c567fe2efa90d592806374,7/29(月) 11:57
ibciwatev,IBC岩手放送,早朝に発生の住宅の火事　焼け跡から身元不明の遺体　秋田・能代市,https://news.yahoo.co.jp/articles/d335272a155abc72e501d05630eed2c2c20f0900,7/29(月) 9:57
ibciwatev,IBC岩手放送,男子より一足早く8月3日に甲子園で決勝　初優勝懸け兵庫・神戸弘陵と対戦へ　高校女子野球の岩手・花巻東　準決勝で静岡県の東海大静岡翔洋を8-0で下す,https://news.yahoo.co.jp/articles/3626cc61ef44f594ebeeac08f88d7ddc2384bff6,7/28(日) 18:49
ibciwatev,IBC岩手放送,津波被害の復旧作業進む指定文化財の住宅を撮影　7歳から75歳まで20人がシャッター切る　地元の魅力を再発見　岩手・陸前高田市,https://news.yahoo.co.jp/articles/94eda17735cc96d11c507a13919797d9ba7a471f,7/28(日) 18:14
ibciwatev,IBC岩手放送,錦木（盛岡市出身）は狼雅に敗れて5勝10敗で今場所を終える　大相撲名古屋場所千秋楽,https://news.yahoo.co.jp/articles/f83b9f8efd008ec4450e8f48757482a907cd0ebb,7/28(日) 16:14
ibciwatev,IBC岩手放送,ドジャース大谷翔平選手が2試合ぶり32号ソロ　本塁打含む3打数2安打2打点　3試合連続マルチ安打,https://news.yahoo.co.jp/articles/1eca84eb8dd8f8e522c6fabbc8f331cedd20d20b,7/28(日) 12:41
ibciwatev,IBC岩手放送,29日にかけて雷を伴って激しく降り大雨になる所も　土砂災害や低い土地への浸水、河川の増水や氾濫に警戒を　岩手,https://news.yahoo.co.jp/articles/b5530a94694c8a341ddae7022e5dce3d82e2a79a,7/28(日) 11:11
ibciwatev,IBC岩手放送,グルージャ敵地で今季好調の今治に敗れる　サッカーJ3,https://news.yahoo.co.jp/articles/3f0f0f4f5aa03bc043d624a23bef457295df4868,7/28(日) 8:57
ibciwatev,IBC岩手放送,錦木（盛岡市出身）は4連勝で5勝9敗に　大相撲名古屋場所14日目,https://news.yahoo.co.jp/articles/a7acb4c124e5e16d82e67727a97bc95158b6b648,7/27(土) 19:46
ibciwatev,IBC岩手放送,ベテランは長さ12mのトラックを壁まで30センチに寄せる　運転や点検の技術競うトラックドライバーコンテスト　盛岡市,https://news.yahoo.co.jp/articles/2022923cf8e9cb88bbe1e961977b98baadf39953,7/27(土) 18:11
ibciwatev,IBC岩手放送,チキンライスにしていただきます!　食肉加工会社が子ども食堂に食材提供　岩手・釜石市,https://news.yahoo.co.jp/articles/dc5f5b1b69729df2f6a73fae7d17da6183238d7b,7/27(土) 18:08
ibciwatev,IBC岩手放送,ラジオ番組「トップ40」の公開放送も　グルメを味わいながらテレビ・ラジオに親しむイベント今年も　盛岡市,https://news.yahoo.co.jp/articles/33c515f3c2a7a38cfd9a567952e8c1578ac1589e,7/27(土) 18:06
ibciwatev,IBC岩手放送,珍しい「男芸者」が伝統芸で盛り上げ　老舗料亭が100周年で記念の宴席　岩手・奥州市,https://news.yahoo.co.jp/articles/6cb778d353e63719194671f4e86b3b76f964a572,7/27(土) 13:42
ibciwatev,IBC岩手放送,70代男性がクマに手をかまれてけが　秋田・由利本荘市,https://news.yahoo.co.jp/articles/230e56e86457c81b051ca3e629d10103aa2abbac,7/27(土) 11:32
ibciwatev,IBC岩手放送,ひんやりして気持ちいいブナの森で森林浴を楽しむ　井丸キャスターが五感で自然を体感　最後はサウナ、外気浴でリフレッシュ,https://news.yahoo.co.jp/articles/299c8f97c0ef23d58f6f6c3417d4a1de2368770a,7/27(土) 6:02
ibciwatev,IBC岩手放送,存続が危ぶまれていた西和賀町の名産「大根の一本漬」　存続のため生産者が栽培管理の注意点を確認　岩手・西和賀町,https://news.yahoo.co.jp/articles/e65096ff20de8f175c31b4526a68eeccf25ade43,7/26(金) 21:02
ibciwatev,IBC岩手放送,パリ五輪いよいよ開幕　岩手県関連の選手の競技予定を一気に紹介,https://news.yahoo.co.jp/articles/2db544bea32f84ca29ab7e8b402cd2be4c99987b,7/26(金) 20:01
ibciwatev,IBC岩手放送,伝統のIBCカップ最終日　水をたっぷり含んだ重いグリーンに各選手苦しむも　初日1位タイの藤田広一郎選手が逃げ切り初優勝,https://news.yahoo.co.jp/articles/888c355673e3aea190aa51ba0e30c26f2bbb3ea9,7/26(金) 19:21
ibciwatev,IBC岩手放送,「100キロぐらいの出荷予定分がダメに・・・」大雨でイチゴハウスが浸水　岩手・盛岡市玉山,https://news.yahoo.co.jp/articles/a7de294911699c0e8658edf9a4f5669053e036c7,7/26(金) 18:56
ibciwatev,IBC岩手放送,出場予定だった市長「苦渋の決断」　北上川ゴムボート川下り大会が本番2日前に中止を決定　大雨予報や河川増水で安全確保困難に　盛岡市,https://news.yahoo.co.jp/articles/9101944c43a17fe3119fc78811b58b5c0487d3c4,7/26(金) 18:08
ibciwatev,IBC岩手放送,錦木は寄り切りで勝って3連勝　大相撲名古屋場所13日目　郷土力士の勝敗,https://news.yahoo.co.jp/articles/493edb159cdf6065c4e470d6921e382fc7dfaa62,7/26(金) 16:41
ibciwatev,IBC岩手放送,みんなで「こづかいゲーム」に挑戦　夏休みの小学生がお金のやりくりを学ぶ　親子で学ぶ金銭教室　岩手・盛岡市,https://news.yahoo.co.jp/articles/4a6f3c53202d587d1a0b77f6afdcf365c3353b25,7/26(金) 16:08
ibciwatev,IBC岩手放送,北上川や石割桜など盛岡の観光名所を描いたマンホールのふたのカード、盛岡市内のデパートで無料配布　多くのコレクターが列,https://news.yahoo.co.jp/articles/f896516a3d95c9cfb6e877a9bdedbed317eb2067,7/26(金) 16:01
ibciwatev,IBC岩手放送,岩手県内にある世界遺産をおもちゃのブロックで再現、その価値や魅力を発信　ピースでつなぐ世界遺産展,https://news.yahoo.co.jp/articles/2af8880d64992bf56aa912bbdd55fb715cab4e6a,7/26(金) 11:53
ibciwatev,IBC岩手放送,ドジャース大谷翔平選手　待望の日米通算250号ホームラン　打率も首位に返り咲く,https://news.yahoo.co.jp/articles/61e368a85bc96fe6ee869836fe4ca5c51347a4e2,7/26(金) 11:44
ibciwatev,IBC岩手放送,まさに今が旬!おいしい滝沢スイカと色合いが美しいスイカスイーツで涼んでみませんか?,https://news.yahoo.co.jp/articles/4417cdd0d4c9c327c9bf27ae5052bccbd4e8dd2d,7/26(金) 10:59
ibciwatev,IBC岩手放送,秋田市で不明となっていた80代男性、遺体で見つかる　自転車のあった場所から北東におよそ40メートルの水路で発見,https://news.yahoo.co.jp/articles/c2668c5bc004f877336cff9f1b2f09ff981d4d58,7/26(金) 6:24
ibciwatev,IBC岩手放送,お帰りなさい「太平洋の白鳥」　船首像「藍青」は地元神社の樹齢300年の御神木使用　帆船・日本丸が岩手・宮古市に9年ぶり5回目の寄港　停泊中は一般公開や夜間イルミネーションも,https://news.yahoo.co.jp/articles/5cc33aa9b87280f4980a54d1cbc286dc711b0cb4,7/25(木) 20:44
ibciwatev,IBC岩手放送,国内トップ選手が集結するカヌージャパンカップ8月3日・4日に岩手・奥州市で開幕　ワイルドウォーターとスラローム2種目に延べ90人出場　大会実行委員会が応援へ来場呼びかけ,https://news.yahoo.co.jp/articles/659816ee57dd54f9beb082cb3431e2ab6c68d953,7/25(木) 20:29
ibciwatev,IBC岩手放送,過去最多300人超す鬼剣舞の大群舞が2日目に　8月2日開幕の北上・みちのく芸能まつりをキャラバン隊がPR　岩手,https://news.yahoo.co.jp/articles/d471ee97f4b40ec885d3f1f4a4b067d5ce09a589,7/25(木) 20:02
ibciwatev,IBC岩手放送,アマゴルファー頂点決める伝統のIBCカップ開幕　31〜71歳まで44人エントリー　初日は盛岡市の2選手が71で並び首位　岩手・八幡平市,https://news.yahoo.co.jp/articles/82a64e38db18c51753333cf32072c494d595fffa,7/25(木) 19:46
ibciwatev,IBC岩手放送,「獣医師になって苦しんでいる動物助けたい」　動物園で夏休み中の小中学生が飼育員のお仕事体験　普段は入れない場所から近距離で触れ合い　盛岡市,https://news.yahoo.co.jp/articles/d8922acc2d21ae49fe751df94b16e2d0ca355fb9,7/25(木) 19:27
ibciwatev,IBC岩手放送,大相撲名古屋場所12日目　前頭11枚目・盛岡市出身の錦木は佐田の海を押し出しで下して2連勝　岩手県出身力士の勝敗,https://news.yahoo.co.jp/articles/27b34f3df8d0acb2968de8426385ce39e845d9c7,7/25(木) 18:54
ibciwatev,IBC岩手放送,【秋田新幹線】大雨による河川増水で盛岡駅〜秋田駅間で5本の区間運休（25日午後5時40分現在）,https://news.yahoo.co.jp/articles/62d93c15b63491a6f5b48fe12208bd38eef82bf0,7/25(木) 18:34
ibciwatev,IBC岩手放送,秘密は下向きの「穴」　一般ごみが捨てにくいペットボトル専用のリサイクルボックス　盛岡さんさ踊り前に飲料メーカーが50か所設置　リサイクル意識向上に期待,https://news.yahoo.co.jp/articles/713acb3e81a90af2b69bf348231589a9f45ceca7,7/25(木) 18:21
ibciwatev,IBC岩手放送,岩手県内のガソリン価格1リットルあたり169.6円で2週連続値下がり　都道府県別で愛知県に次ぎ2番目安値　全国最安値15週連続で途切れる,https://news.yahoo.co.jp/articles/d8b2f3aa839a7c02e5486359588c325d8a9f9c3b,7/25(木) 14:12
ibciwatev,IBC岩手放送,【速報】夏の高校野球岩手大会決勝　花巻東が2年連続12回目の優勝,https://news.yahoo.co.jp/articles/2b279f9473911a7824049b2efb396caf1a4a22ec,7/25(木) 13:31
ibciwatev,IBC岩手放送,【速報】夏の高校野球岩手大会決勝　花巻東が2年連続12回目の優勝,https://news.yahoo.co.jp/articles/44f2d34d7b3a3f5fc74b72de0828244eea0fda3f,7/25(木) 13:31
ibciwatev,IBC岩手放送,東京や埼玉の50〜70代の女性グループ6人が栗駒山で身動き取れず助け求める　雨で沢が増水　約5時間後に全員救助・けがなし　岩手・一関市,https://news.yahoo.co.jp/articles/de4ff14115449d2af23604418b893baf416dc703,7/25(木) 13:08
ibciwatev,IBC岩手放送,南部中心に雨模様　岩手・西和賀町湯田で138ミリ観測　警報の出ている地域も　引き続き土砂災害や河川の増水に警戒を,https://news.yahoo.co.jp/articles/3be83e3ddd08a2a668628eb00db9b5c86a8d82b7,7/25(木) 12:56
ibciwatev,IBC岩手放送,大雨で東北本線の北上駅〜一ノ関駅で運転見合わせ,https://news.yahoo.co.jp/articles/69af7927cf071d72ec14569042102b0e72a9622d,7/25(木) 8:08
ibciwatev,IBC岩手放送,大雨で由利本荘市の石沢川の堤防が一部決壊　緊急安全確保発表　秋田,https://news.yahoo.co.jp/articles/005e07809e78d6b45e5d844fae7c110158968820,7/25(木) 7:53
ibciwatev,IBC岩手放送,大雨の影響でJR北上線が一部運休,https://news.yahoo.co.jp/articles/48dd0438f8bde56be99e1bbeec18b0019cab20bc,7/25(木) 7:27
ibciwatev,IBC岩手放送,夏から秋にかけて姿を現す期間限定の滝「錦秋湖大滝」とアイス感覚で味わえる凍らせた甘酒デザートで束の間の涼しさを味わう,https://news.yahoo.co.jp/articles/70785d2e3fbe3d406d872f42d34696ef1cf41ec5,7/25(木) 6:02
ibciwatev,IBC岩手放送,秋田・由利本荘市で緊急安全確保（警戒レベル5） 堤防決壊で石沢川に氾濫発生情報　命を守る最善の行動を,https://news.yahoo.co.jp/articles/5a218c0ce94eff127e2fd31a19481e390425990c,7/25(木) 4:27
ibciwatev,IBC岩手放送,警察官に必要な知識や体力を身につけるための訓練に密着　岩手県警察学校に記者が一日体験入校,https://news.yahoo.co.jp/articles/1b6d3083bdc40b94c32e93ed2cc0dbaffda69670,7/24(水) 21:02
ibciwatev,IBC岩手放送,【土砂災害警戒情報】秋田県・湯沢市に発表,https://news.yahoo.co.jp/articles/6b5d4da7b752bca22fb681c2963448fe976abe00,7/24(水) 19:51
ibciwatev,IBC岩手放送,秋田県由利本荘市に避難指示,https://news.yahoo.co.jp/articles/192919812f0da2bcc6527637ac03e6b4f81c63af,7/24(水) 19:46
ibciwatev,IBC岩手放送,秋田県にかほ市が大雨のため5地区に避難指示,https://news.yahoo.co.jp/articles/ab73f2d0de019929d8dd3654c1166f9e25b0f09e,7/24(水) 19:43
ibciwatev,IBC岩手放送,新型コロナ・インフルエンザとも前の週を上回る　岩手県内の感染状況,https://news.yahoo.co.jp/articles/4be7db0f7aa0e07dc55ddf311528aba682b80f6f,7/24(水) 19:24
ibciwatev,IBC岩手放送,岩手県と三陸鉄道　ポケモンキャラクター「イシツブテ」を活用したデジタルスタンプラリーを実施　7月30日から,https://news.yahoo.co.jp/articles/31f00161695ec0db9916373b7c0f1984a65feef5,7/24(水) 19:02
ibciwatev,IBC岩手放送,投手力の花巻東か　攻撃力の盛岡大附か　高校野球岩手大会　あす決勝戦　見どころ紹介,https://news.yahoo.co.jp/articles/bfcb0f2ebf0446b22f207d8792fabfe3c0a42896,7/24(水) 18:54
ibciwatev,IBC岩手放送,【土砂災害警戒情報】秋田県・横手市、羽後町に発表,https://news.yahoo.co.jp/articles/fd499d85794146cb2f0ca832db34abdfe5fd83ff,7/24(水) 18:31
ibciwatev,IBC岩手放送,岩手県内の手足口病　流行警報レベルを上回る　県は症状が出た場合には医療機関を受診するよう呼びかけ,https://news.yahoo.co.jp/articles/f77e2f7b303e6b18155dc8f2aae1a3dbe26087f8,7/24(水) 18:24
ibciwatev,IBC岩手放送,請求額誤り国交付金5700万円受給できず　一般財源で穴埋め　担当職員や管理職ら3人を懲戒処分　市長が陳謝　岩手・大船渡市の道路整備事業で不適切事務処理,https://news.yahoo.co.jp/articles/cb6fa5e5501ae61dd25e30afacb8e85a4f025f41,7/24(水) 18:02
ibciwatev,IBC岩手放送,錦木は宝富士に寄り切りで勝って2勝9敗　大相撲名古屋場所11日目　郷土力士の勝敗,https://news.yahoo.co.jp/articles/ecc661be4003e99649153f908d71ad5c0f6bcc3b,7/24(水) 17:34
ibciwatev,IBC岩手放送,【土砂災害警戒情報】秋田県・由利本荘市沿岸、由利本荘市内陸、にかほ市に発表,https://news.yahoo.co.jp/articles/6144f117c4c4f79086986097392b8fd0d9eb3338,7/24(水) 17:32
ibciwatev,IBC岩手放送,「海に行ったり花火して遊びたい」　明日から楽しい夏休み　岩手県内の小学校　終業式ピーク,https://news.yahoo.co.jp/articles/8c9c6183db5f2e36058657b1ae3d021299097257,7/24(水) 16:02
ibciwatev,IBC岩手放送,福岡ソフトバンクホークス　育成選手の三浦瑞樹投手（盛岡大附属高校出身）、石塚 綜一郎捕手（黒沢尻工業高校出身）を支配下選手登録,https://news.yahoo.co.jp/articles/0091c8d4c1fcb5669829c1e50c4115836b0dccea,7/24(水) 15:44
ibciwatev,IBC岩手放送,岩手県大生が盛岡をPRするお菓子を考案　審査の結果「たるとぺっこ」が最優秀賞に,https://news.yahoo.co.jp/articles/38ca1cfd4a3eaf47dd3e96196280de3cb0e7d426,7/24(水) 15:19
