media_en,media_jp,title_articles,date_original
rkckochi,RKC高知放送,有権者を誤って異なる選挙区に投票させるミス 高知市役所で行われた期日前投票 【高知】,10/18(金) 19:00
rkckochi,RKC高知放送,県展特選ギャラリー 『工芸』の作品を紹介【高知】,10/18(金) 18:55
rkckochi,RKC高知放送,衆議院選挙の争点 社会保障制度に対する各候補者の考え【高知】,10/18(金) 18:52
rkckochi,RKC高知放送,高知の観光名所 はりまや橋が改修工事へ 来年3月に終了予定【高知】,10/18(金) 18:41
rkckochi,RKC高知放送,同居する母親を殺害した男 懲役14年を求刑【高知】,10/18(金) 18:39
rkckochi,RKC高知放送,『久礼の町を楽しんで！』開業85周年のJR土佐久礼駅がリニューアルオープン【高知】,10/18(金) 18:39
rkckochi,RKC高知放送,秋風に揺れる3万本のヒマワリ！大月町で『遅咲きのヒマワリ』見頃を迎える【高知】,10/18(金) 18:17
rkckochi,RKC高知放送,高知新聞旧本社跡地に外資系ホテル！2028年秋にオープン【高知】,10/18(金) 18:08
rkckochi,RKC高知放送,大月町の郵便局で強盗事件を想定した訓練 多発する強盗事件受けて【高知】,10/18(金) 12:01
rkckochi,RKC高知放送,男子児童が水泳の授業中におぼれて死亡した事故 3回目の事故検証委員会【高知】,10/18(金) 11:55
rkckochi,RKC高知放送,女性にわいせつな言動をした高知県教育センターの男性職員を停職10か月の懲戒処分【高知】,10/17(木) 18:58
rkckochi,RKC高知放送,衆議院選挙の争点 経済対策に対する各候補者の考え【高知】,10/17(木) 18:53
rkckochi,RKC高知放送,第78回県展 グラフィックデザイン部門の魅力や作品を紹介【高知】,10/17(木) 18:50
rkckochi,RKC高知放送,看護師を志す専門学校生 病院での実習を前に『戴帽式』【高知】,10/17(木) 18:40
rkckochi,RKC高知放送,俳優の西田敏行さん死去 高知でもロケが行われた映画『釣りバカ日誌』など代表作多数【高知】,10/17(木) 18:39
rkckochi,RKC高知放送,高知−大阪間の空の便の就航が70周年 高知龍馬空港でセレモニー開催【高知】,10/17(木) 18:38
rkckochi,RKC高知放送,高知の魅力発信してみん？『よさこい高知観光大使』募集中！【高知】,10/17(木) 15:15
rkckochi,RKC高知放送,東京六大学の卒業生 約150人が集合！高知市で懇親・講演会【高知】,10/17(木) 15:13
rkckochi,RKC高知放送,越知町 宮の前公園で約150万本のコスモスが満開！10月20日までコスモスまつり開催中【高知】,10/17(木) 11:59
rkckochi,RKC高知放送,衆議院選挙の争点 政治とカネの問題に対する各候補者の考え【高知】,10/16(水) 19:08
rkckochi,RKC高知放送,県展特選ギャラリー 個性あふれる『先端美術』を紹介【高知】,10/16(水) 19:00
rkckochi,RKC高知放送,高知市教育長が辞任 児童が水泳の授業中に死亡した事故を受けて【高知】,10/16(水) 18:40
rkckochi,RKC高知放送,車いすラグビー金メダリストの池透暢選手 支援学校の子どもたちとプレーを楽しむ【高知】,10/16(水) 18:37
rkckochi,RKC高知放送,高知龍馬マラソンに向けたランニングセミナー 3回目開催【高知】,10/16(水) 17:22
rkckochi,RKC高知放送,県内産の約60種類が集結！“ぽん酢王国・土佐”プロジェクト始動！【高知】,10/16(水) 11:52
rkckochi,RKC高知放送,衆議院選挙 期日前投票始まる【高知】,10/16(水) 11:52
rkckochi,RKC高知放送,阪神タイガースの新監督 高知市出身の藤川球児さんが就任会見 「日本一を達成したい」と決意【高知】,10/15(火) 19:05
rkckochi,RKC高知放送,県展・特選ギャラリー『日本画』の魅力【高知】,10/15(火) 18:49
rkckochi,RKC高知放送,副業紹介サイト詐欺 四万十市の30代女性が約430万円の被害【高知】,10/15(火) 18:41
rkckochi,RKC高知放送,衆議院選挙公示 2つの小選挙区に合わせて4人が立候補 ともに与野党一騎打ちの構図【高知】,10/15(火) 18:40
rkckochi,RKC高知放送,いの町長選挙 現職・池田牧子氏が無投票で3期目の当選【高知】,10/15(火) 18:38
rkckochi,RKC高知放送,衆議院選挙公示 高知では2選挙区に4人が立候補【高知】,10/15(火) 12:12
rkckochi,RKC高知放送,同居する母親殺害の男性 裁判員裁判の初公判で起訴内容を認める【高知】,10/15(火) 0:00
rkckochi,RKC高知放送,県内に伝わる伝統芸能が一堂に集う『土佐の伝統芸能まつり』 踊りや演奏などを披露【高知】,10/14(月) 18:55
rkckochi,RKC高知放送,迫力ある作品が並ぶ第78回県展 洋画部門の魅力を紹介【高知】,10/14(月) 18:55
rkckochi,RKC高知放送,国民民主党の玉木雄一郎代表 高知市で街頭演説『政治とカネの問題』への批判し政治改革を訴える【高知】,10/14(月) 18:53
rkckochi,RKC高知放送,県庁で衆議院選挙の立候補受付リハーサル 県選挙管理委員会の職員が手順を確認【高知】,10/14(月) 18:46
rkckochi,RKC高知放送,共産党県委員会が高知市で演説会 高知2区から立候補予定の新人・浜川百合子氏が登壇【高知】,10/14(月) 18:45
rkckochi,RKC高知放送,自民党県連が高知市で高知1区・2区合同の決起大会と演説会【高知】,10/14(月) 18:45
rkckochi,RKC高知放送,高知1区からの立候補を予定している元議員・武内則男氏の総決起集会 立憲民主党県連が開く【高知】,10/14(月) 18:44
rkckochi,RKC高知放送,衆議院選挙の比例代表四国ブロック 自民党公認の新人で元県議会議員の西内健氏が出馬を表明【高知】,10/14(月) 18:43
rkckochi,RKC高知放送,阪神タイガース新監督に藤川球児氏の就任発表！ 近く記者会見の予定【高知】,10/14(月) 18:43
rkckochi,RKC高知放送,県内のブランド肉がずらり『お肉どっぷりフェスタ』高知市で開催【高知】,10/14(月) 17:21
rkckochi,RKC高知放送,10月14日は鉄道の日 園児2人がJR高知駅の一日駅長に任命【高知】,10/14(月) 17:18
rkckochi,RKC高知放送,9月の高知県内の企業短期経済観測調査 前回からプラス11ポイントと3期ぶりの改善【高知】,10/14(月) 17:18
