media_en,title_articles,link_articles,date_original
yom,７月のビール系飲料販売、前年比で微増…サントリー１１％増・キリンは５％減,https://news.yahoo.co.jp/articles/829cbaea3fe839be5e7dcb58324de5c0ac1cdc43,8/10(木) 11:34
yom,ザ・バンドのロビー・ロバートソンさん死去、８０歳…「ザ・ウェイト」手がける,https://news.yahoo.co.jp/articles/5d28d92091a29dd15c9617231681e5d94624d635,8/10(木) 11:28
yom,イニエスタがＵＡＥエミレーツ入団、背番号「８」…「神戸と同じように過ごしたい」,https://news.yahoo.co.jp/articles/273f9b3e2a03488e8613f96bfac527c40257d324,8/10(木) 11:21
yom,バイデン大統領、「懸念国」中国への先端技術の投資を規制…同盟国に同様の措置要請,https://news.yahoo.co.jp/articles/fdb8640438e7a6370293298d5db3741449541f46,8/10(木) 11:13
yom,「バイデンがユタに来る」「狙撃銃のほこりを払っている」と投稿の男、ＦＢＩが射殺,https://news.yahoo.co.jp/articles/60cea16c6b2434f28e726abeb1a2f6b6d2508b6d,8/10(木) 11:06
yom,慶応監督「エンジョイ・ベースボール」、北陸監督「対戦できて幸せ」…あす第３試合,https://news.yahoo.co.jp/articles/41d10e11a0b39e4f14f6548e8d570e4e215c34ea,8/10(木) 10:58
yom,監督から「おまえはもう野球部員だ」と熱烈オファー、浜松開誠館の応援団長が力強くエール,https://news.yahoo.co.jp/articles/b2c7572bdabc63cf671817e2eba0d60b2e2888eb,8/10(木) 10:49
yom,北九州市の旦過市場、2度目の火災から1年…商店街新会長「スピード復旧できた」,https://news.yahoo.co.jp/articles/818747c329e40175b44e6c5c6aed27bb75703e2b,8/10(木) 10:42
yom,中国に批判的なカナダ下院議員、虚偽情報が拡散…アカウントの３割は中国政府機関とつながり,https://news.yahoo.co.jp/articles/0d5f7344e72a30671d803bed61cb895bf5619114,8/10(木) 10:39
yom,神戸ポートアイランドに強毒持つヒアリ、５千匹以上か…住民立ち入らない港湾エリア,https://news.yahoo.co.jp/articles/4c650d1cc3bd8d0c95be1978e4608c129437d38a,8/10(木) 10:32
yom,台風６号は対馬海峡を北上…２４時間雨量は四国地方２５０ミリ、九州で１５０ミリ予想,https://news.yahoo.co.jp/articles/0010f7231078ca0745d99e57359f349a0122447c,8/10(木) 10:24
yom,隣県同士の対戦…立正大淞南「中国地方で１番のチーム」、広陵監督「のびのびと」,https://news.yahoo.co.jp/articles/87f4e2dd0cd1de1961551f3d01e0a083518d1df7,8/10(木) 10:20
yom,フランスの宿泊施設で火災、夏休みの障害者ら１１人死亡…マクロン大統領はＸで追悼,https://news.yahoo.co.jp/articles/0b1bd59571b9419fe5c5c56872ace99052f652ba,8/10(木) 10:12
yom,別府市の温泉施設「かっぱの湯」8月末で閉館…朝まで営業、トラック運転手ら重宝,https://news.yahoo.co.jp/articles/638f45b1382654611ee917a6833d073787a20d33,8/10(木) 10:07
yom,１６歳の安楽宙斗が全体トップで、森秋彩は２位で決勝進出…世界クライミング複合,https://news.yahoo.co.jp/articles/3cdfba05097192b92f32a5cbaedb37d2aa94abee,8/10(木) 10:06
yom,食糧増産に汗する女子「先生、雨が降ればいいな」．．．女性教師が胸に刻んだ歌声　#戦争の記憶,https://news.yahoo.co.jp/articles/b295755bce440431f598ad7a1dee3b1efa799343,8/10(木) 10:00
yom,アルファロメオ初のHV「トナーレ」…伝統の走りと実用性を両立させたSUV,https://news.yahoo.co.jp/articles/53348f6d2701f61473047c96c576a80e24567e2b,8/10(木) 10:00
yom,いなべ総合監督「走姿顕心」、沖縄尚学監督「台風の沖縄に元気を」…初戦へ意気込み,https://news.yahoo.co.jp/articles/dd887c7ab176a85a095ff308ef4a16b6eb8eee62,8/10(木) 9:59
yom,大阪万博、全テーマ館で建設業者決定…海外パビリオンは建築許可申請ゼロと遅れ深刻,https://news.yahoo.co.jp/articles/899947f8a201d3d0363ebad2249d756d0bf2c7ec,8/10(木) 9:54
yom,遮断機と警報機ない「第4種踏切」に一時停止促す新型ゲート…JR西日本が開発,https://news.yahoo.co.jp/articles/c21bba7942d7f8f463a63259b2ae43cf60c5d1e7,8/10(木) 9:27
yom,中国で宇宙企業４３３社に急増、「軍民融合」で新ロケット技術…軍事利用拡大懸念も,https://news.yahoo.co.jp/articles/9663af4a6a9aa04ed955c49fd1d2d57567ee7c8f,8/10(木) 9:27
yom,山陽新幹線の広島―小倉駅間が運転再開、台風６号の影響で始発から見合わせ,https://news.yahoo.co.jp/articles/bb6f81123ecb149d27ed54baf6e8a4c452fe02bb,8/10(木) 9:08
yom,７月企業物価指数、前年比３・６％上昇…２９か月連続のプラスも７か月連続鈍化,https://news.yahoo.co.jp/articles/a89d465a894d973b6fe021f5964dc5a02e29b1f3,8/10(木) 9:01
yom,アマゾン、プライム会員年会費を１０００円値上げし５９００円に…月払いは６００円,https://news.yahoo.co.jp/articles/df87e9a0a6b597880fe1ee46e961b30834f3b505,8/10(木) 8:56
yom,男子ケイリン・大宮工の木村、悔しさ乗り越え優勝…関東大会では落車し自転車担いでゴール,https://news.yahoo.co.jp/articles/5114b418d74c20fffe1c6978806679a656fd622b,8/10(木) 8:51
yom,アーチェリー女子個人、過去最年少で日本代表経験の近大付・和田が貫禄の連覇「団体でも優勝を」,https://news.yahoo.co.jp/articles/603fd4092a64c120db3ecfa4c10f7c35c022a6a4,8/10(木) 8:43
yom,ハワイのマウイ島で３件の山火事…少なくとも６人死亡、２１００人超が避難所に,https://news.yahoo.co.jp/articles/3be1dcbda780af496f3ca7bcbd6097143ef74f89,8/10(木) 8:36
yom,自転車男子スプリント、競輪選手の父のホームバンクでＶ…千歳・杉浦「北海道では負けられない」,https://news.yahoo.co.jp/articles/0574942311b68387dcb6a67cc05b9ae42c4bc58d,8/10(木) 8:22
yom,昨年はコロナで出場辞退、最高到達点３ｍ４７の主将が目指す全国の頂点…バレー男子正智深谷,https://news.yahoo.co.jp/articles/a462c00d3b96baab65b5c961f77838121b4ab606,8/10(木) 8:17
yom,マツコ・デラックスさん、茶わんと箸持ってニッコリ…鮮やか田んぼアート,https://news.yahoo.co.jp/articles/9ec7ba054f1e5ae533c25ca46b67a264b1e6c1a9,8/10(木) 8:16
yom,自転車男子１０００ｍＴＴ・内灘の山下Ｖ、選抜準優勝の雪辱「ちょっと夢みたい」,https://news.yahoo.co.jp/articles/d229c4cf2762b09cfb45a6d3981a215dede64438,8/10(木) 8:12
yom,世界的建築家・磯崎新さんの問い「建築とは何か」…寄せられた回答に「夢のカタチ」など,https://news.yahoo.co.jp/articles/926bae33f4c39f0fd574914fd7d8d4df97a4ed70,8/10(木) 8:11
yom,卓球男子団体・節目の２０度目出場、気合の丸刈りで臨んだ明豊が完勝続きで３回戦へ,https://news.yahoo.co.jp/articles/6aad454bb288059fc987b8c8940021e2c1da2424,8/10(木) 8:09
yom,柔道男子７３キロ級Ｖの習志野・高橋、準決勝で難敵に終了間際の劇的一本勝ち,https://news.yahoo.co.jp/articles/878730dc7bf2a9b67b0ea20182020ece9b3d3460,8/10(木) 8:05
yom,自転車男子ポイントレース制した学法石川の１年成田…父は競輪選手、夢はツール・ド・フランス,https://news.yahoo.co.jp/articles/739dd319c2a334f2df778b4e6336c070ce3b5fb3,8/10(木) 8:02
yom,自転車女子ケイリンＶの青森商・室谷「理想の試合運び」…最後の直線で猛進、鮮やかに抜き去る,https://news.yahoo.co.jp/articles/c23611ae9c7f8bda94cb972fa07bbafdcbcbe24e,8/10(木) 8:01
yom,障害者支援施設の職員、入所者の居室ドアをひもで縛る…外に出ようとして窓から転落,https://news.yahoo.co.jp/articles/3634583cc534ccdd3ae1e8da5f966c55bc0441ea,8/10(木) 7:38
yom,台風接近、九州１４７万人に避難指示…避難所の男性「自宅が気になる」,https://news.yahoo.co.jp/articles/cee0342a6f509849bb8ab3448ed029eecff2cbd4,8/10(木) 7:26
yom,総合格闘家・浜崎朱加さん、女性警察官らに護身術を指導「万が一のときに身を守って」,https://news.yahoo.co.jp/articles/124fd95bb7ddbe727364e36a1307003a3e96f8e1,8/10(木) 7:20
yom,ビッグモーター不正に「大迷惑だ」、自動車整備業界に憤り…修理の透明性高める動きも,https://news.yahoo.co.jp/articles/4987876d692730dc3100065d2d9dd5838fcd3657,8/10(木) 7:00
yom,近ツー過大請求、社長「組織的関与ない」…現場独断との認識「業績向上への思いで」,https://news.yahoo.co.jp/articles/44263761853b0f6499217a1eb3ad463a27d912b8,8/10(木) 6:51
yom,アニソン歌手・きただにひろしさん「山口県は良いところいっぱい」…ふるさと大使活動報告,https://news.yahoo.co.jp/articles/1d4f5db3be3af855cbdd9538c2a2f1b42bba6c6a,8/10(木) 6:50
yom,都の図柄入りナンバーにサクラと東京タワー、都内全域対象に,https://news.yahoo.co.jp/articles/57c84a423ad884c50a07fc245bc8c7caac26558c,8/10(木) 6:32
yom,近ツー、接種会場運営で過大請求１千万円…看護師減員・医師早退を反映させず,https://news.yahoo.co.jp/articles/35fc64d49f1a70e971dbc9b13dc181dcd76ed7d5,8/10(木) 6:32
yom,仮想空間「メタバース」で塾講座、生徒はアバターで参加…踊りや拍手も,https://news.yahoo.co.jp/articles/bb0a522d2d99661015a001d8561fb363ae16ce8b,8/10(木) 6:31
yom,共働き家庭に子ども誕生、夫の仕事・家事に変化ないが…妻は仕事減って家事増える,https://news.yahoo.co.jp/articles/16d74b012e9ea69f62b436caa63ae5e4d40ec6ee,8/10(木) 6:31
yom,マックのコーヒーに「汚れ」の異物混入、担当者が誤って廃棄し成分不明,https://news.yahoo.co.jp/articles/96016f17de1637b45b9f991a59707778a93ec831,8/10(木) 6:31
yom,柔道男子団体、国士舘が優勝…大将・畠山が決める,https://news.yahoo.co.jp/articles/6bfe4f31462a1a8632146bba9b90881553007705,8/10(木) 6:30
yom,創部４１年目の東京学館新潟が初の甲子園、初代から指導し２年前に勇退した長谷和昭・前監督がアルプス席で応援,https://news.yahoo.co.jp/articles/0fe9af69f2c14360f759b14f2f9ffe7ed8e71663,8/10(木) 6:30
yom,「非常に恥ずかしいプレーですよね」ブリンソンの走塁に原監督…阪神と１０差、巨人の自力Ｖ消える,https://news.yahoo.co.jp/articles/97fb77e82262235959ef71a0fe369a2a5b1c6b36,8/10(木) 6:30
yom,重圧を克服、２８年の五輪照準…アーチェリー男子優勝した野田慶一郎選手（成立学園３年）,https://news.yahoo.co.jp/articles/6cf319b01a61419fb25aaa833ffd1e178cc2c82f,8/10(木) 6:30
yom,台風６号で出発できず、空席が目立った神村学園アルプス席…先着１３０人の懸命の応援実る,https://news.yahoo.co.jp/articles/fb1e46f91e146445e0d962383de2f3a3b2b4a30f,8/10(木) 6:30
yom,ユニホームに似せた衣装のチアリーダー、ブラスバンドに合わせて声援…「声が届いて最高」,https://news.yahoo.co.jp/articles/64a581ee0580d29f1aaade2b516425841d8ffff7,8/10(木) 6:30
yom,「父のような」小倉前監督が勇退、「次は三木さんを甲子園に」…ひとつになった日大三が５年ぶり１回戦突破,https://news.yahoo.co.jp/articles/d0d7dcce5728a86367fb1c58b2b7d193a479dd0b,8/10(木) 6:30
yom,7月大雨、娘を小学校に送り出した直後「臨時休校に変更」…福岡県の各校で休校判断分かれる,https://news.yahoo.co.jp/articles/3532c88cc6fb15c24dd7f91930d6980492ef00e2,8/10(木) 6:10
yom,ＮＹダウ続落、終値１９１ドル安の３万５１２３ドル…原油価格上昇で景気冷え込み懸念,https://news.yahoo.co.jp/articles/7ff92ab2051789a6c47f58b0564eadcec6df2400,8/10(木) 5:33
yom,９月１１〜１３日に内閣改造・党役員人事、メンバー入れ替え刷新感…岸田首相が調整,https://news.yahoo.co.jp/articles/0532d5b1563487cd15e23615c48f56c5197f0877,8/10(木) 5:02
yom,バーキン中古バッグ、定価６倍の３２００万円…高級品「プレ値」でも引く手あまた,https://news.yahoo.co.jp/articles/c4667a938ffd3b936efbdaff742c690accbb2a19,8/10(木) 5:02
yom,訂正が１２００か所あった「東京書籍」教科書、２６年度廃刊…新高等地図,https://news.yahoo.co.jp/articles/764f399ca6df16c5588ef723845878c7d2ce6cef,8/10(木) 5:00
yom,ＡＩで重要インフラのバグ発見するコンテスト、賞金総額２８億円…米政権「責任あるＡＩ」の一環,https://news.yahoo.co.jp/articles/92d7c9212fb051e957c8197b133f821784e0a648,8/10(木) 4:37
yom,岸田首相、習近平氏への親書託す方針…訪中の山口・公明代表に,https://news.yahoo.co.jp/articles/e577de5f3472f6a041ee2f5b2c486ff76589ec96,8/10(木) 4:10
yom,天皇ご一家と上皇ご夫妻が黙とう…長崎原爆の日,https://news.yahoo.co.jp/articles/8c47697ca29db1392aa9f3d3bc360ad4c745f1f3,8/10(木) 4:03
yom,秋篠宮ご夫妻、ベトナムを公式訪問へ,https://news.yahoo.co.jp/articles/355c42a2f2a19977d4b55ea57a7626e6bf24e373,8/10(木) 4:00
yom,女性「クマ、クマ」頭から血を流して死亡…腕に爪でひっかかれたような傷,https://news.yahoo.co.jp/articles/088218fd4d75e29f354ce2d2b4ce38381be08d8c,8/10(木) 1:06
yom,高知・大分・愛媛県で線状降水帯が発生…台風６号影響,https://news.yahoo.co.jp/articles/89ec12c8cefb0351f264a22569c0812a8033f5af,8/10(木) 0:54
yom,東京五輪「銀」の野中生萌、世界クライミング予選４位発進…ボルダー上々「パリ切符」照準,https://news.yahoo.co.jp/articles/4ee6359502501dfecb92aa7bce3ef3169c69091b,8/10(木) 0:43
yom,ロシアは食料を「武器」として利用…ジョセップ・ボレルＥＵ外相,https://news.yahoo.co.jp/articles/cdb7265ac9960f67a3bd10bfec1efa5602b336bb,8/10(木) 0:23
yom,東京ドームの巨人戦テレビ中継、映像技術賞…「革新的なプロ野球中継を実現」,https://news.yahoo.co.jp/articles/b1822841ad7edfac4e45e78c27b87d21f0aa6987,8/10(木) 0:14
yom,「ＴＯＫＹＯ　ＵＮＩＴＥ」支援金１８９万６８７８円…困窮家庭の子どもたちへ,https://news.yahoo.co.jp/articles/35e72a7fae5a385f4614134a0a5822552e2580ad,8/10(木) 0:07
yom,月南極の探査でＮＡＳＡ警戒感…中国が最初に到達し「我々のものだという状況は望まない」,https://news.yahoo.co.jp/articles/f1937d45eee10ef2d7d556db36797db436559db6,8/10(木) 0:00
yom,スケボー堀米雄斗、パリ五輪へ意気込み…「自分を信じ世界選手権でも決めたい」,https://news.yahoo.co.jp/articles/d2af6fb94286716b6e242e6924b6fb8e15ecdee1,8/9(水) 23:42
yom,中国、日本への団体旅行を１０日にも解禁…３年半ぶり「爆買い」効果の復活期待,https://news.yahoo.co.jp/articles/cd638b16c42cdb1c389ac8b19ed6f730886c1713,8/9(水) 23:32
yom,原油豊富なアンゴラと日本が投資協定…投資家保護を規定、日本企業の進出後押し,https://news.yahoo.co.jp/articles/da610a684802f372a75ec1df2ac41b40a22d64a9,8/9(水) 23:22
yom,台風６号北上、鹿児島・宮崎・熊本３県で線状降水帯が発生…小笠原近海には台風７号,https://news.yahoo.co.jp/articles/1ce035bce4f0df7403590456b941ab7dbb0a8677,8/9(水) 22:49
yom,柔道男子６０キロ級は比叡山・福田大和が連覇…「注目されれるほど力になる、もっと目立ちたい」,https://news.yahoo.co.jp/articles/cfcefccb1d229dcef9341737adbeab1417a01b45,8/9(水) 22:37
yom,中川圭が４安打４打点、オリックス４連勝…西武の２年目・隅田が初完封,https://news.yahoo.co.jp/articles/39838beb8d4c86826937576b208a8f1bf9a93f02,8/9(水) 22:25
yom,巨人は中田翔の逆転２ラン生かせず、阪神６連勝…バウアーが７回無失点でＤｅＮＡ快勝,https://news.yahoo.co.jp/articles/1ada47c74a4c84dfb25d6592db87165a7d48353a,8/9(水) 22:19
yom,巨人、阪神に敗れ自力優勝の可能性消滅,https://news.yahoo.co.jp/articles/ea10f2c169d8fa4535e790a33082301844e1a9db,8/9(水) 22:02
yom,かつて「鬼の阪口」、大垣日大・阪口監督は大会最高齢…お立ち台に腰掛け「９０歳までやりたい」,https://news.yahoo.co.jp/articles/766ce6e76296609980f717918d7922c145d9dca8,8/9(水) 21:53
yom,モスクワへの無人機飛来が常態化、ロシア「ウクライナの２機撃墜」…軍需企業では大規模な爆発,https://news.yahoo.co.jp/articles/d844fa1dc835440bb6ad1a0822e4139ef9d3031b,8/9(水) 21:44
yom,近ツーの高浦雅彦社長が辞任、コロナ事業で９億円過大請求…役員ら報酬返納し社員３７人処分,https://news.yahoo.co.jp/articles/22118f299367249105944182f37c983933d9bc4e,8/9(水) 21:34
yom,首里城再建の建材、台湾がベニヒノキ５本寄贈へ…「平成の復元」と同じく正殿内部の装飾品に,https://news.yahoo.co.jp/articles/cd723480679d7b3f7076892ef19b1d68d8e32962,8/9(水) 21:28
yom,なでしこ、スウェーデン戦へ調整…東京五輪で４強入り阻まれた因縁の相手,https://news.yahoo.co.jp/articles/a2e579aaedbb9d932fae73c38a003449de29b49d,8/9(水) 21:27
yom,夏のボーナス、３年ぶりに９０万円台回復…食品や鉄道など増加率２ケタ・電力は前年割れ,https://news.yahoo.co.jp/articles/442da991b4bdd3cc08931416237baba465029ed5,8/9(水) 21:20
yom,熊本県球磨地方と宮崎県南部山沿い、線状降水帯が発生,https://news.yahoo.co.jp/articles/80f60976a16ecd5109dd01981dd2355f02569acc,8/9(水) 21:15
yom,夜をテーマにしたアート…回転するキャンバス使った抽象画、写真と絵画の組み合わせ,https://news.yahoo.co.jp/articles/d0343f33cf6506bd55c4bc4dc8410fa3591775d3,8/9(水) 21:01
yom,逮捕の日大アメフト部員「大麻は買って自分で吸った」…覚醒剤錠剤「おまけでもらった」,https://news.yahoo.co.jp/articles/30c0766144653f51c2cd0bf2807a975494247363,8/9(水) 20:42
yom,電通北海道、コロナ対策業務で１億５８２０万円を過大請求…人数や請求方法の確認不足,https://news.yahoo.co.jp/articles/a01dcc43a93dc8228ced8e5a5438e492b74532c8,8/9(水) 20:36
yom,兵庫・社の応援歌はウルフルズ「ガッツだぜ!!」…トータス松本さんの母校,https://news.yahoo.co.jp/articles/a6c8b618dd4c3a411d4becfd3a260ac22a9468fa,8/9(水) 20:30
yom,日大三の応援席に小倉全由・前監督、「グラウンドにいる方が楽ですね」,https://news.yahoo.co.jp/articles/f87e769a365e78c4c6cf2301297ea0b26f9d60b8,8/9(水) 20:17
yom,中古車検索「グーネット」もビッグモーターの掲載停止…リクルート「総合的に判断」,https://news.yahoo.co.jp/articles/85592f75353854a298db9624f75662a3b3343514,8/9(水) 20:15
yom,橋本環奈さん「平成ギャルに変身する」、朝ドラ「おむすび」のヒロイン…ＮＨＫドラマ初出演,https://news.yahoo.co.jp/articles/5d71000153d84e2a98d119c731c9ea0f1bb17d2d,8/9(水) 20:02
yom,妖怪描いた「八女提灯」に込められた願い…旧大名家邸宅、ほのかな明かりに浮かぶ,https://news.yahoo.co.jp/articles/e8f03b97e857d4355ef5845dac98632ad9a8404a,8/9(水) 20:01
yom,ヘンリー王子、公務引退後で初の来日…「スポーツ通じ人生が豊かになる」振興イベント出席,https://news.yahoo.co.jp/articles/e7970eba975e4c07781d62164c60f6f70c3fb771,8/9(水) 19:52
yom,神村学園が立命館宇治に圧勝、４年ぶりの１回戦突破…秋元・正林の連続二塁打で先制,https://news.yahoo.co.jp/articles/20d5a1c0474886d6625f98be58685fcb599f1d65,8/9(水) 19:42
yom,足立区のコンビニ店員２人、無言の刃物男に切りつけられ重傷…１０時間後に男が交番出頭,https://news.yahoo.co.jp/articles/4d9e626b0184c71d90c2ca310f627ce00f41c338,8/9(水) 19:40
yom,三冠王の期待かかる「オオタニサン」もビッグに登場！…兵庫・丹波市で案山子まつり,https://news.yahoo.co.jp/articles/79e1de1a9a5864970372575fb24bcffb7f5732fe,8/9(水) 19:25
yom,阿波おどりの熱気も阿波牛料理も堪能…１人２０万円の桟敷席「海外富裕層ニーズある」,https://news.yahoo.co.jp/articles/970e4bc407746b2c3d829a5497e0470d8193edaa,8/9(水) 19:11
yom,青森ねぶた祭でスタッフが「曳手」６人を殴打、動画拡散…標識にぶつかり「気合を入れ直そうと」,https://news.yahoo.co.jp/articles/2a27f6da972fae7957a75e759233036d37ea43ce,8/9(水) 18:59
yom,ビッグモーターとのトラブル相談、１０年で２３１件・今年度はすでに３０件…香川県内,https://news.yahoo.co.jp/articles/48fd4357b4fdd30397b48ed01099ebecc970881f,8/9(水) 18:53
yom,菊花賞制したアスクビクターモア、熱中症で死ぬ…放牧先で,https://news.yahoo.co.jp/articles/033705732941f6b44f5e29c03548d9e6f25ebb31,8/9(水) 18:39
yom,京都の保育園長、１５００万円使い込んだか…カラのタクシーを石川や宮崎へ走らせ「支払った」,https://news.yahoo.co.jp/articles/4040b2a0217f3cbae943b94711db6ecf8dc73d84,8/9(水) 18:26
yom,東京円、１７銭円安の１ドル＝１４３円２４〜２６銭,https://news.yahoo.co.jp/articles/e8e0f086f38af340ad0463694ffff496e1a89293,8/9(水) 18:24
yom,中国・浙江省当局、福島など３県のチョコやグミ販売した会社に改善命令,https://news.yahoo.co.jp/articles/2e1e0666d3286e446890e63ba76da66401d8e0a1,8/9(水) 18:06
yom,有害物質シアン流出の日本製鉄は「コンプラ意識欠如」…県が評価書公表、意識改革求める,https://news.yahoo.co.jp/articles/4ded5f763c2e23953735b928e8ad0c659e1d69f7,8/9(水) 17:53
yom,最年少当選の中山真珠・静岡県議、無免許運転を謝罪…自民は辞職勧告の構え,https://news.yahoo.co.jp/articles/4234e0ac37e02b0af026a9395e265fc7a43822cc,8/9(水) 17:47
yom,産声上げた4時間後に閃光「被爆者は私たちで最後に」…平和の尊さ語り継ぐ決意　＃戦争の記憶,https://news.yahoo.co.jp/articles/9a699bd1f70846a97c518d270ce4ff2dc87dd95c,8/9(水) 17:40
yom,「小悪魔彼氏がコンセプト」と宣伝のカフェ、少年２人に違法接客させた疑い…経営者逮捕,https://news.yahoo.co.jp/articles/a24d176761a7389330f2c09e120cfa8e6cac12b5,8/9(水) 17:32
yom,「ここで死んでも仕方がないね」絵手紙に残す戦争の記憶…空襲や玉音放送、心情交え　＃戦争の記憶,https://news.yahoo.co.jp/articles/ec587dd2139326d02d2aa605298928dac95b9f2f,8/9(水) 17:30
yom,豊かな自然・絶景と頂上での達成感、夏の山で最高の体験…油断せず準備はしっかりと,https://news.yahoo.co.jp/articles/fafd09411b1082f56661507193876747a2c037a5,8/9(水) 17:30
yom,中古車、ロシアへ駆け込み輸出…追加制裁前に,https://news.yahoo.co.jp/articles/3e975721d849e5ecc3cc6ba06209c98a886967fa,8/9(水) 17:10
yom,猫はなぜ腎臓病になりやすいのか…原因を突き止めた研究者が語る治療薬誕生の可能性,https://news.yahoo.co.jp/articles/6955e0d007c1358596fec299eef71e584c9ba499,8/9(水) 17:01
yom,市和歌山、７年ぶり１回戦突破…東京学館新潟は九回１点差に迫るも及ばず,https://news.yahoo.co.jp/articles/558227341ecc8ba5ad80fb4684602e6aeda58590,8/9(水) 16:52
yom,長崎原爆で殉職した警察官だった父「直チニ沈着冷静ニ従事」…知事からの表彰状　＃戦争の記憶,https://news.yahoo.co.jp/articles/6230b37ee0717c95792f1b8b5c500a4049049b07,8/9(水) 16:48
yom,山で道に迷い、「標識」の情報伝えて救助へ…「朝まで待てた」レスキューポイントが力発揮,https://news.yahoo.co.jp/articles/c4151d443c075c39dcc2da2bd7714bdf56c70ff4,8/9(水) 16:40
yom,「自分は神とつながっている」「修行して人生好転させる」とわいせつ行為…男を逮捕,https://news.yahoo.co.jp/articles/ec66056519e9ad42e41b61d94a7a74c61e875502,8/9(水) 16:23
yom,創成館監督「継投がポイント」、星稜監督「バッテリーが攻守で活躍を」…あす第３試合,https://news.yahoo.co.jp/articles/05327911ca3c45dddab221a6a419f18ba12cd3db,8/9(水) 16:10
yom,「阿蘇の野の花」希少で多様54種の写真展…「危機に瀕した実情訴え」研究家の遺志受け継ぐ,https://news.yahoo.co.jp/articles/7e6c87855abe223f8cec375451ec10c86e649489,8/9(水) 16:10
yom,近畿日本ツーリスト社長、新型コロナ過大請求で辞任,https://news.yahoo.co.jp/articles/ee682f06562382f7c6c7629cc3d43f98f665455d,8/9(水) 16:03
yom,電熱ペンで木の板を焼いて描いた猫・オオカミ・シマウマリアル…焼き絵師Kazumiさん,https://news.yahoo.co.jp/articles/a2db387a2449e483c2f05300d3516b89ad6a0185,8/9(水) 16:00
yom,来秋スタートの朝ドラ「おむすび」、ヒロイン役に橋本環奈さん,https://news.yahoo.co.jp/articles/aa308abefd2b1460314bfc3078d51910c7527477,8/9(水) 15:54
yom,「原爆写真」活用の仕組み整える…収集第一人者・深堀好敏さんの遺志継ぐ決意　＃戦争の記憶,https://news.yahoo.co.jp/articles/f0fc503836f57b0094783c398f202460c43a3829,8/9(水) 15:53
yom,東海大熊本星翔と浜松開誠館、両監督とも打ち合いを予想…甲子園あす第１試合で対決,https://news.yahoo.co.jp/articles/c7d6f1d677a1e13fad64080fe9bf347d92a31995,8/9(水) 15:51
yom,明豊と北海の監督、ともに「ロースコアで勝つ」…あす甲子園第２試合で対戦,https://news.yahoo.co.jp/articles/1aac1cd3ed5de433d43f9606c663546dbce5fd84,8/9(水) 15:42
