media_en,title_articles,link_articles,date_original
yom,半世紀活躍の７４式戦車、最後の雄姿…来年ついに退役,https://news.yahoo.co.jp/articles/88b85a4b3d09848070ef6aa63ab2b570a381f91d,8/8(火) 17:45
yom,キャンピングカーのレンタル料７５％補助…山形県西川町、移住関心ある人に「町内巡って」,https://news.yahoo.co.jp/articles/64b8388f29b31430c38de84c45a656f1b8fa9fca,8/8(火) 17:42
yom,産毛ふわふわ、おめめパチクリ…シロフクロウひな誕生,https://news.yahoo.co.jp/articles/c82f614e588eb79af168eee063752452d771fd50,8/8(火) 17:34
yom,岡本太郎作品、巡回展から川崎に「凱旋」…「タローマン」も「超凱旋！」,https://news.yahoo.co.jp/articles/e06ffef7de21704c37eec39f8032d9be7f0e91af,8/8(火) 17:25
yom,「丸の内ラグビー神社」日本代表の活躍後押し…元主将の広瀬俊朗さんら勝利祈願,https://news.yahoo.co.jp/articles/7f0fb86f1f4318952f5e33dea26527ec52317ae9,8/8(火) 17:17
yom,半導体関連企業誘致へ、熊本市が3か所計48ヘクタールの用地造成へ…産業集積化図る,https://news.yahoo.co.jp/articles/65463947fb25277d047287374977409bd32084d9,8/8(火) 17:11
yom,防衛装備品供与、来年度はベトナムやジブチなど６か国対象…外務省調整,https://news.yahoo.co.jp/articles/513d2abebf846dc4ede7c7605f28e20f561cbaba,8/8(火) 17:05
yom,平和教育のバトン、受け取った娘…一緒に作った紙芝居を子どもたちへ「無力じゃない」　＃戦争の記憶,https://news.yahoo.co.jp/articles/ef3c84dc1e343b93bc8cc564e69b376eec61e453,8/8(火) 16:50
yom,三井物産、世界最大のエビ養殖会社に約５００億円出資…食品など「非資源分野」に注力,https://news.yahoo.co.jp/articles/40e29c44eb9a5d8c0844d1f3fc6fc83895eb1885,8/8(火) 16:40
yom,高校総体・ソフトボール男子、島原工が啓新を下し初優勝,https://news.yahoo.co.jp/articles/30a4c6062d91d9a92c2c6cdb78a07e6034362356,8/8(火) 16:36
yom,九州電力、法人契約の受け付け再開…市場価格反映した新標準メニューで10月供給開始,https://news.yahoo.co.jp/articles/e6c476f5aed935d10eb4bba0221e20fa08e8297c,8/8(火) 16:31
yom,おかやま山陽、逆転で春夏通じて甲子園初勝利…六回に打者１１人の猛攻で５点,https://news.yahoo.co.jp/articles/1c036db8e33ca9fe1351cded6973c4ebc7a2dc30,8/8(火) 16:26
yom,立命館宇治・里井監督「緊張感ありしっかり調整」、神村学園の小田監督「選手を信じて起用」,https://news.yahoo.co.jp/articles/50d6625328275847c2d4d2b2907af39e73e2190e,8/8(火) 16:21
yom,鳥栖工・大坪監督「投手陣をどう攻略するかがカギ」、富山商・前崎監督「ミスなく守り切りたい」,https://news.yahoo.co.jp/articles/c55303fdf2184c98c4ea18d7c2ebcbf6fd65bc0c,8/8(火) 16:20
yom,日大三・三木監督「全体的に手ごわい」、社・山本監督「全員を警戒」,https://news.yahoo.co.jp/articles/909fc5e3cb10ddc34151db8871bd28a430af61cb,8/8(火) 16:20
yom,市和歌山・半田監督「公立の星になれるよう戦う」、東京学館新潟・旅川監督「気負わず気持ち一つに」,https://news.yahoo.co.jp/articles/4c2a2d6cdd3d4a5ee5bfc16a375d926cc4340612,8/8(火) 16:20
yom,ペイペイドーム隣のエンタメ施設、開業3年で来場333万3333人突破,https://news.yahoo.co.jp/articles/5ac6366338f7c37e1c2dc2f2845a5300d696a4f5,8/8(火) 15:38
yom,ソフトバンクグループ、２３年４〜６月期は４７７６億円の最終赤字…前年同期から２兆円以上改善,https://news.yahoo.co.jp/articles/0bb00cb33b7e9f09dfd35be48eed2fc6e1aeb8d4,8/8(火) 15:32
yom,サッカーJ1・サガン鳥栖が接戦落とす…福岡との九州ダービー、VARで2度好機取り消し,https://news.yahoo.co.jp/articles/78bf32d81e608b8510e267f9e2913de4770c6d89,8/8(火) 15:31
yom,日大アメフト部の大麻事件、林真理子理事長が会見で謝罪…「深く心からおわび」,https://news.yahoo.co.jp/articles/945162a8ca5526642827a6b28e0a38b36638d891,8/8(火) 15:27
yom,長崎の平和祈念式典、被爆者代表による「平和への誓い」実施へ…「献水」は長崎市長代行,https://news.yahoo.co.jp/articles/c2d1c0588e5c3196001117c99bbd09ffde16efbe,8/8(火) 15:26
yom,１６０センチ超え巨大アナゴゆったり、三重・尾鷲で一般公開…２人がかりで捕獲,https://news.yahoo.co.jp/articles/cd3bbf7ff22762837eaca2073a5f73f8d16effa3,8/8(火) 15:22
yom,サッカーJ3・鹿児島ユナイテッド、宮崎に2―3で敗れる…順位は変わらず3位,https://news.yahoo.co.jp/articles/f155c9f9bafbc12c2f47d3fd5c2a66c0378465f1,8/8(火) 15:20
yom,サッカーJ2のV・ファーレン長崎、いわきとドロー…シュート10本もゴール奪えず,https://news.yahoo.co.jp/articles/cc9b90799f7ccbe7ed25159712d8bc97dddda0a3,8/8(火) 15:18
yom,日経平均終値、１２２円高の３万２３７７円…３営業日連続で値上がり,https://news.yahoo.co.jp/articles/f102c72a7272e7334552c53d447fb7e00334cfba,8/8(火) 15:11
yom,マイナ保険証、新たに１０６９件のひもづけ誤り判明…総点検中間報告を発表,https://news.yahoo.co.jp/articles/c75a4b57c9a1957b3094f2f3a043f5087f17733e,8/8(火) 15:09
yom,世界初、米バイオ企業がミツバチ用ワクチン開発…養蜂場などに壊滅的被害もたらす「ふそ病」予防,https://news.yahoo.co.jp/articles/6a6d3410ebe5fca157d55a3dc48c7a95c0ef7106,8/8(火) 15:00
yom,児童養護施設の小中高校生にスマホ利用料支援へ…こども家庭庁、学習機会確保狙い月額数千円,https://news.yahoo.co.jp/articles/cd1eec4d175dbad835dd0451bc43a1a9efe09ab0,8/8(火) 15:00
yom,大谷翔平、大リーグ史上最速で「４０発・１５盗塁」…１１４試合目,https://news.yahoo.co.jp/articles/51f6cd41871fd7b7e3c7a073db23982a98d6d0bc,8/8(火) 14:47
yom,「立秋」のきょう、都心で今年１７回目の猛暑日…昨年の１６日上回り過去最多,https://news.yahoo.co.jp/articles/bd5777f01d105dfcaf20dccd7bdd0d1496190d15,8/8(火) 14:40
yom,前橋商アルプス、ＯＢあだち充さんの代表作「タッチ」アニメ主題歌演奏で適時打引き出す,https://news.yahoo.co.jp/articles/d7045711fbf32c37bfb9c5086ae0f4d8c3ffc7be,8/8(火) 14:27
yom,リリー・フランキーさん、そして観客の声が背中を押した…焼失の老舗映画館「小倉昭和館」再建へ,https://news.yahoo.co.jp/articles/4d24d9cb6cb35e7698ee9f6e10dc5b333f578253,8/8(火) 14:24
yom,ボール積み上げ、マット運動…ジンバブエでの指導経験生かした「おかやま山陽」流ユニーク練習法,https://news.yahoo.co.jp/articles/20f391a3d24ea5cb86be73ebeb7b6df34035101b,8/8(火) 14:18
yom,小売店主らに聞いた「街角景気」、前月より０・８ポイント高い５４・４…７月調査,https://news.yahoo.co.jp/articles/33e3fafd3de445cb4c02975fdec6d2101fe9a738,8/8(火) 14:09
yom,なでしこの快進撃「なんで日本はこんなに強いの？」…高橋秀人がＮＺで感じるサッカー熱の高まり,https://news.yahoo.co.jp/articles/74d08355aa5586485142b0a41a13580d8de8210d,8/8(火) 14:08
yom,クラーク記念国際、八回に一挙５点で甲子園初勝利…エース新岡は１０安打浴びるも１失点,https://news.yahoo.co.jp/articles/5aae863fffaf08720c2908f325fd1920149e030d,8/8(火) 13:56
yom,大谷翔平、４試合ぶりマルチヒットもエンゼルス７連敗…今季１５個目の盗塁も,https://news.yahoo.co.jp/articles/386a38b0591fdc076f7183d09c875f8c861900c5,8/8(火) 13:40
yom,敦賀気比の東哲平監督、続投へ…退任意向だったが学校側が慰留,https://news.yahoo.co.jp/articles/7c17b9bad30a27d4552acc4c5c2ebebc850760a5,8/8(火) 13:32
yom,準絶滅危惧種トビハゼ、恋の季節…オスは干潟で跳びはねメスにアピール,https://news.yahoo.co.jp/articles/26ae513b5c210edb105f278465184e8bb2e4a088,8/8(火) 13:20
yom,スカイラインＮＩＳＭＯ、１０００台限定で９月発売…赤と白の「ＧＴ」エンブレムを復刻,https://news.yahoo.co.jp/articles/85c4d6264a6234d84eaa6c12ef81f46e8612e6d0,8/8(火) 13:09
yom,６月の平均賃金４６万２０４０円、前年同月比２・３％増…実質賃金は５か月連続マイナス,https://news.yahoo.co.jp/articles/32caaad87182446849925c9f7463ffe8b1f16f80,8/8(火) 13:02
yom,電動化「ユーザーに選ばれるため、独自の価値を磨き続ける」…マツダ・毛籠勝弘社長,https://news.yahoo.co.jp/articles/197d1d7bf37b22e137ee08b955f82981f57425f8,8/8(火) 13:00
yom,露軍、ウクライナ東部ドネツク州にミサイル２発…集合住宅直撃で５人死亡・３１人負傷,https://news.yahoo.co.jp/articles/f258c8a6bbcfe3ef307f143ca52aaaedec7c9346,8/8(火) 12:55
yom,コカ葉を「世界の国々へ理解深めて」と授業で見せる…女性教諭を懲戒免職「違法とは知らず反省」,https://news.yahoo.co.jp/articles/9c4871c2f7f952399b0673b33f8a9d71f8a20cc6,8/8(火) 12:12
yom,パビリオン建設の準備遅れ…大阪府、手続き簡素化で海外ゼネコンの参入促す,https://news.yahoo.co.jp/articles/11134e7bf7786d3e80f07817258f912a6ca41971,8/8(火) 12:02
yom,島内勤務1050人、東京からの転勤進む…パソナ・本社機能の一部移転取り組み,https://news.yahoo.co.jp/articles/9e3cbf51db45e3d8d642da9b5aaf12f2b7b7cd34,8/8(火) 12:02
yom,戦没者150人の名前を手書き、「サイパン会戦覚え書」父の遺品ノートを寄贈　＃戦争の記憶,https://news.yahoo.co.jp/articles/c9f0c309ea92559c85f55fc1bdec1daef2683580,8/8(火) 12:01
yom,父の被爆体験を語り継ぐ決意、「背中を見て育った自分の役割」…神戸の教師　＃戦争の記憶,https://news.yahoo.co.jp/articles/ac7e1ddd231f2efcf6bbe0d65a2badec59561d9b,8/8(火) 12:00
yom,九州に接近する台風６号、甲子園応援団を妨害…バス運行できず前倒し出発・ＰＶ中止・人数縮小,https://news.yahoo.co.jp/articles/f545aeafb6cdf2bc20365d5196c7d735bfa9ddc4,8/8(火) 11:58
yom,永岡文科相、日大アメフト部員の逮捕に「大変遺憾」…「大学は説明責任を果たして」と要求,https://news.yahoo.co.jp/articles/1b81cce9f6d37b552b0f44b6864760d17c2a3b38,8/8(火) 11:48
yom,台風６号、九州の西を北上…大雨に厳重警戒を,https://news.yahoo.co.jp/articles/7029a622caf89ebd48a40258b09ce9da92d86844,8/8(火) 11:38
yom,ネットフリックス、ＡＩ人材の募集に１億円超の年収を提示…スト中の俳優らと対立激化の恐れも,https://news.yahoo.co.jp/articles/7f39cbc02175ab5b3e0640a7c9f1540a17b4773f,8/8(火) 11:34
yom,世界水泳「銅」の瀬戸大也選手が中学水泳部に実技指導…「推進力、考えながら練習を」,https://news.yahoo.co.jp/articles/6a8aef903519bf8561a0588287540a38c98b7928,8/8(火) 11:22
yom,自民・麻生副総裁が台北で講演、戦争回避のために「戦う覚悟」重要と訴え,https://news.yahoo.co.jp/articles/46918a0d71360818841dd0beb5ac836f4f0dc535,8/8(火) 11:21
yom,「作澪工事」で有明海の養殖ノリ漁場に栄養塩届きやすく…佐賀市、生産量好転に期待,https://news.yahoo.co.jp/articles/52e8687d57c818095ce9cd3d86bec807f495cedf,8/8(火) 11:18
yom,「武雄アジア大」開学を1年延期、2026年春と正式発表…建設工期確保などで,https://news.yahoo.co.jp/articles/4a1d53300a96784779e794e8d7620a42b8fa1a03,8/8(火) 11:16
yom,福岡の民家で女性死亡、同居の孫を殺人容疑で緊急逮捕…刃物で胸を複数回刺す,https://news.yahoo.co.jp/articles/0280545cee506f0d3f873913f612020f1ab7bd51,8/8(火) 11:14
yom,サッカーJ2・ロアッソ熊本が水戸にドロー、14位に順位上昇…シュート10本も無得点,https://news.yahoo.co.jp/articles/946e4935df73ce33724eaa596e46d34a2424766c,8/8(火) 11:12
yom,サッカーJ2・大分トリニータ、終了間際に追いつきドロー…下平監督「次につながる」,https://news.yahoo.co.jp/articles/235af09cd31317bb7eeb30a2d029777cdc1c2042,8/8(火) 11:11
yom,サッカーJ2・レノファ山口、4戦ぶりに白星逃す…大分にドロー「守り切れず残念」,https://news.yahoo.co.jp/articles/47079309234f783c8e20df7a9adc75ef32f8dbb0,8/8(火) 11:11
yom,台風6号接近、鹿児島県内の一部ガソリンスタンドで給油制限…鹿児島市電など運休,https://news.yahoo.co.jp/articles/6475a8d7f291bee31d6bded703ab1bf645e0bdfe,8/8(火) 11:11
yom,「白いキクラゲ」安定生産とプリプリ食感実現も一時は収入難…ミシュラン三つ星店が採用,https://news.yahoo.co.jp/articles/f104fbfe5c320091facbefffc11a7586b1412227,8/8(火) 11:10
yom,中露外相が電話会談、結束確認「中露に制裁を科し発展抑え込もうとする欧米の試みを拒絶」,https://news.yahoo.co.jp/articles/5d4103d77b910f69639fa08a730459d3b4a14e96,8/8(火) 11:04
yom,映画「エクソシスト」「フレンチ・コネクション」のウィリアム・フリードキン監督が死去…８７歳,https://news.yahoo.co.jp/articles/a1db1c8757f2817a449ca8b634c218c7672d96fc,8/8(火) 10:51
yom,花巻東、８年ぶり初戦突破…宇部鴻城は九回に一矢,https://news.yahoo.co.jp/articles/c38f3614b04d3671425e54df1162ff6a7c00bc97,8/8(火) 10:26
yom,明徳義塾の大岡、特大２ラン含む２本塁打６打点の大暴れ…４強進出に貢献「俺が決める」,https://news.yahoo.co.jp/articles/f8b1a9fdb41530e62337fd31db2f2255387ffbc7,8/8(火) 10:21
yom,夏の甲子園で初めて女子マネがノック補助…宇部鴻城の岡野さん「リズムよくできた」,https://news.yahoo.co.jp/articles/6d5fcdfd8a6cb0e0f107c62afd2b26fa82217717,8/8(火) 10:16
yom,引退覚悟は大関カド番、横綱戦「決死の張り手」で新境地…元横綱三重ノ海の「相撲と故郷」,https://news.yahoo.co.jp/articles/265b8ace7095a5fef37debe56484981366851b40,8/8(火) 9:59
yom,タイ人留学生剣士活躍の仙台育英８強入りならず…強豪相手に奮闘も、代表戦で涙,https://news.yahoo.co.jp/articles/16e9c351b47791e77d2683158eefdeb4102b4f50,8/8(火) 9:44
yom,愛工大名電から１０奪三振、直球武器にエースの貫禄…徳島商・森煌誠,https://news.yahoo.co.jp/articles/b0b1a415fc0ec0dc18d0842edc065d65f0cfb3cc,8/8(火) 9:40
yom,自転車女子５００で連覇の北岡マリア「ここまで来るのがきつかった」…重圧に打ち勝ち、万感の涙,https://news.yahoo.co.jp/articles/97a4feaa9cbca39372398dee2f56ac5196e077d4,8/8(火) 9:21
yom,テニス男子ダブルス制した四日市工の本山・水野組、緩急使い難敵に逆転勝利…団体との２冠達成,https://news.yahoo.co.jp/articles/096dcb8801b6a4aeb809c8e7b8c2f8f9b4908a22,8/8(火) 9:18
yom,長崎被爆者ら落胆、「声聞いてほしかった」…原爆の日式典への首相ら参列見送り,https://news.yahoo.co.jp/articles/a4b1e7c83e5a1cb62d121d6474a3ab2c5ac996de,8/8(火) 9:16
yom,上半期の経常収支、８兆１３２億円の黒字…自動車輸出伸び貿易赤字が縮小,https://news.yahoo.co.jp/articles/bc4c682bf44e5a8ab0e0158b2229d9ef8702fce6,8/8(火) 8:59
yom,花巻東のスラッガー佐々木麟太郎「勝つために必要なバッティングにこだわった」…先制打含む３安打,https://news.yahoo.co.jp/articles/60cb619edfa50a111f80ca0c10bca131bd37aaa2,8/8(火) 8:54
yom,世帯の消費支出２７万５５４５円、前年同月比４・２％減で節約志向続く…６月の家計調査,https://news.yahoo.co.jp/articles/2f305f27b49b3489d2f648c82a83721a794b9e4e,8/8(火) 8:46
yom,市長が「隣町の町長から不当な圧力」と録音データ公開…町長は「一言もなしに会見、資質疑う」,https://news.yahoo.co.jp/articles/1821e545352f5702dfc59b2a5598aeb9fc4bcb87,8/8(火) 8:26
yom,イラン警察が取り締まり強化発表、ヘジャブしない女性は減らず…大量摘発の情報もなし,https://news.yahoo.co.jp/articles/ea7f14ad91167d8be41cc67a05b97c05ceb25483,8/8(火) 8:09
yom,富士山９合目に整体施設、「頂上アタックに備えた利用多い」…各地の名峰に店舗展開目指す,https://news.yahoo.co.jp/articles/79e5eb70dac63435a9eb24105ae71d9bdecdfc13,8/8(火) 7:35
yom,打ち上げ花火、開始予定の５分後に中止発表…有料観覧席５５００席販売,https://news.yahoo.co.jp/articles/86157241881ed85b315e5349d85581f45f3342f1,8/8(火) 7:12
yom,中国軍ハッカーが日本の防衛システム侵入と米紙報道、浜田防衛相は「秘密漏えい確認していない」,https://news.yahoo.co.jp/articles/ea5ed559473ef346d2b91e28c86383a124f0e966,8/8(火) 6:49
yom,自転車男子スプリント、松山学院が高校新で予選突破…「先輩にバトンを」に３年松岡が応える,https://news.yahoo.co.jp/articles/2eb826649a3c1f2486699b4ce4852124a214cd4e,8/8(火) 6:30
yom,鳥取商、粘りみせた…聖地で投打の成長を証明,https://news.yahoo.co.jp/articles/bd4f7062da46e11afc598efef969817d2f65738d,8/8(火) 6:30
yom,佐土原・大岐優斗、テニス男子Ｖ…決勝は手の内知り尽くす後輩の宮里琉星と火花,https://news.yahoo.co.jp/articles/ea016b856c7c7fe9a32a1f4711b27b37ed229a64,8/8(火) 6:30
yom,智弁学園、１０回に底力…伝統校エースの誇り胸に熱投,https://news.yahoo.co.jp/articles/937e56496aa3a68d30c83b3aab0a71cfb5ccd775,8/8(火) 6:30
yom,ラグビー日本代表、不本意だった５連戦での光明は長田智希ら「初代表組」の台頭…Ｗ杯開幕まで１か月,https://news.yahoo.co.jp/articles/64cd52ca17f034e961382f9bd8d6f031c6716e27,8/8(火) 6:00
yom,智弁学園　光った小技…１０回サヨナラスクイズ,https://news.yahoo.co.jp/articles/2099f3a79e0317bbd1e67dc8d3cc4ca1cf9e04c7,8/8(火) 6:00
yom,徳島商　１２年ぶり初戦突破,https://news.yahoo.co.jp/articles/0f65f8b5fc9337813b6a1ac03098ccdaac700021,8/8(火) 6:00
yom,履正社・増田　エースの証明…大阪大会決勝　出番なく奮起,https://news.yahoo.co.jp/articles/c48b28b0f0ec67da4af5a1b1ff18c62e3ff3d7fc,8/8(火) 6:00
yom,高知中央　逆方向を徹底…つないで甲子園初勝利,https://news.yahoo.co.jp/articles/57ad43af14a25aecdcf8925d15191bb5c9ca130a,8/8(火) 6:00
yom,ＮＹダウ４営業日ぶり反発、終値４０７ドル高,https://news.yahoo.co.jp/articles/4a3c083f24428ca3341c0915b9198b51010a85d7,8/8(火) 5:33
yom,メルカリで「高く売れるかも」ＷＢＣとともに野球グッズ急上昇…フリマアプリ、中古市場を先導,https://news.yahoo.co.jp/articles/00117418a65ad2108b8325c26aed3e7445f66db9,8/8(火) 5:02
yom,「原爆翌日の長崎」新たな写真、地面から煙立ち上る爆心地付近…山端庸介氏撮影か,https://news.yahoo.co.jp/articles/e419a79f4f62aa395a3ebff72cd3362aa747da81,8/8(火) 5:02
yom,東京・赤坂の住吉会本部、売却され解体開始後も移転先不明…暴排訴訟に支障出る恐れ,https://news.yahoo.co.jp/articles/2004c1cfb0cf25d3e0c962b9f7073bb56d884865,8/8(火) 5:00
yom,万博独自パビリオン６０か国、建設業者決定は「６」どまり…準備遅れ先行き厳しい国も,https://news.yahoo.co.jp/articles/180ed2771b4b19be59200e57f1ef992ba4dcd2a6,8/8(火) 5:00
yom,我妻が２回に適時打、守備でも後藤・上野を巧みにリード…宇津木監督も賛辞「一番頑張った」,https://news.yahoo.co.jp/articles/b1a0ceb6c8a2cd8492013b12cc37d2951f7f2cdf,8/8(火) 0:52
yom,「五輪と逆」後藤から上野へ完封リレー…日米対抗ソフトボール、日本の２勝１敗,https://news.yahoo.co.jp/articles/b3e2f94a81c06aed9240ccdf99d21dad1f729f10,8/8(火) 0:43
yom,安楽宙斗が全体トップで複合へ、百合草碧皇や楢崎兄弟らも進出…女子は森秋彩と野中生萌,https://news.yahoo.co.jp/articles/4ec268ed4f5495e9b90017630e9ab27dcaa87ee8,8/8(火) 0:31
yom,世界クライミング初出場の安楽宙斗、男子リードで銀メダル…「すごく自分でも評価したい」,https://news.yahoo.co.jp/articles/5cb9e4c4d9cdb3b586c5c1483217bab5941026f5,8/8(火) 0:28
yom,世界クライミングで１９歳・森秋彩が優勝、リードでは日本勢初…最後の局面「雰囲気楽しんだ」,https://news.yahoo.co.jp/articles/0b1b23955aa237615c33f649a9d3b36a8b2c3be2,8/8(火) 0:26
yom,損保４社が保険料カルテル疑い、公取委が任意調査開始…東急Ｇ向けや仙台空港で事前調整か,https://news.yahoo.co.jp/articles/f14143262a15856cb130b414d46f04c52e9b7945,8/8(火) 0:16
yom,宇宙飛行士候補の諏訪理さん、月や火星へ広がる「面白い時代」…米田あゆさんと高市科技相表敬,https://news.yahoo.co.jp/articles/f298b7a1c2cc267abc195cf0077c9c69762451a9,8/7(月) 23:53
yom,国家公務員の初任給「１万円以上引き上げ」勧告、３３年ぶり上げ幅…志望減少の歯止め狙う,https://news.yahoo.co.jp/articles/2b93aa0e9a6f23d411368c28ec88cb25b227995d,8/7(月) 23:45
yom,岸田首相、８強入りなでしこは「日本を大いにわき立たせてくれている」,https://news.yahoo.co.jp/articles/ed88b39e20ee11e74571a2d540ecd6f9c581e0f7,8/7(月) 23:35
yom,津波で祖父母も家も失った４歳、楽天の懸命プレー「目がくぎ付け」…正捕手として夢の甲子園に,https://news.yahoo.co.jp/articles/abd27efa15db7afa8a72fdacc1986a470db8e2c0,8/7(月) 23:32
yom,ウクライナ「クリミアへの橋攻撃」、修復には時間要するか…物流の混乱や渋滞起きる可能性も,https://news.yahoo.co.jp/articles/e85553df173b1a6f26a0be912681097e79e4e038,8/7(月) 23:15
yom,［深層ＮＥＷＳ］ウクライナ反攻、南部戦線近い橋の攻撃「露への心理的な打撃大」…廣瀬陽子氏,https://news.yahoo.co.jp/articles/d8fed2115910744bb7d05ee5dbcfc35f89377233,8/7(月) 22:52
yom,東芝ＴＯＢは８日開始、「物言う株主」の影響力排除へ…提示価格に「安すぎる」との声も,https://news.yahoo.co.jp/articles/c2044c4a82287e5285c698466e3ed1d9521960ba,8/7(月) 22:38
yom,麻生副総裁が台湾を訪問、李登輝元総統の墓前に献花…８日に蔡英文総統と会談へ,https://news.yahoo.co.jp/articles/a9fb189ffb488fe549c9653a9fa95f91494445f9,8/7(月) 22:30
yom,テニス女子シングルスは浦和麗明・小高未織がＶ…男子は佐土原・大岐優斗が同校対決制す,https://news.yahoo.co.jp/articles/7e087ffb33ab3c3784631d4c9e8cf8e246437f2a,8/7(月) 21:50
yom,「迷走」する台風６号、原因は太平洋高気圧と上空の風…気象庁「進路予想難しい」,https://news.yahoo.co.jp/articles/8711abc4b803e458d3ff1e3065a85a6b1e1c13ca,8/7(月) 21:48
yom,台風６号ゆっくり北上、９〜１０日に九州接近見通し…総雨量が８月１か月分を上回る恐れも,https://news.yahoo.co.jp/articles/844458d3feec6485ba811102d4d6571a1e15a66e,8/7(月) 21:36
yom,「長崎原爆の日」台風接近で屋内式典、被爆者の参列見送りへ…岸田首相はビデオメッセージ,https://news.yahoo.co.jp/articles/31ab4f423b947f129f3a7abfd2824963cd003ebb,8/7(月) 21:24
yom,菅前首相と二階元幹事長、森山選対委長が日本料理屋で会食…政権運営など意見交換か,https://news.yahoo.co.jp/articles/1fa9dd9b90ee0846296b430a97a10f6f78f87942,8/7(月) 21:13
yom,長崎原爆で皮膚垂れた人や真っ黒な人「この地獄繰り返さない」…教師として伝える決心　＃戦争の記憶,https://news.yahoo.co.jp/articles/8dffa1e7a5350ba343fdc39f61d3ef27b2faf128,8/7(月) 21:02
yom,「褒めて伸ばす教育」徳島で広がる…「自分も友だちも大切に」など設定、問題行動予防に効果,https://news.yahoo.co.jp/articles/fc23c0f254188feaf25aa70276b5f74d5077389b,8/7(月) 20:41
yom,公共トイレ「日本は危険」、盗撮やわいせつから子ども守れ…小型カメラ捜す学生団体も,https://news.yahoo.co.jp/articles/a320fa4469b3f0bd2ce3e731323ca3f4a888ba30,8/7(月) 20:40
yom,「ビーチコーミング」砂浜の漂着物から環境問題を身近に…「シーグラス」に膨らむ想像,https://news.yahoo.co.jp/articles/41b55223d21b06fc730d86370d51a202570b1e28,8/7(月) 20:30
yom,渋谷区副区長、女性新人区議を「ブタ」と業務用チャットに書き込む…１２０人が閲覧可能,https://news.yahoo.co.jp/articles/e9b70a87d40a717cd10e637de0873b9f57e6eb0e,8/7(月) 20:17
yom,「原爆落とした国知らない19％」にがくぜん…「原爆読本」全国に広めた被爆教師　＃戦争の記憶,https://news.yahoo.co.jp/articles/a1e83c2bd82e80add23aec8f9577f3b0a1146564,8/7(月) 20:10
yom,徳島商が１２年ぶりに甲子園初戦突破、昨夏８強の愛工大名電に競り勝つ…下川が逆転打,https://news.yahoo.co.jp/articles/8c1b2d5a13b3ed04ebb252899202a853d785c3b1,8/7(月) 20:01
yom,入所男性がパンを詰まらせ死亡、特養ホーム側に２４９０万円賠償命令…「危険性を認識できた」,https://news.yahoo.co.jp/articles/0424ef2563cf777bc46f19f36724e0ebf22616e6,8/7(月) 19:50
yom,ジャックスがビッグモーターの新規ローン停止、「一連の問題踏まえ判断」…シェア半分占める,https://news.yahoo.co.jp/articles/406d88c422a8c3d1e731657912ad057b11b8bf16,8/7(月) 19:45
yom,国立科学博物館がＣＦ、開始１日で目標の１億円達成…標本など保管費用高騰で,https://news.yahoo.co.jp/articles/431404e7df3899e2bd4e3df62d4a9c5f08966315,8/7(月) 19:33
