media_en,title_articles,link_articles,date_original
yom,ふるさと納税、京都市が急伸し全国７位…宿泊クーポンの返礼品が人気集める,https://news.yahoo.co.jp/articles/7e16e95e33b428c75a5ed7a99c6aa8bb66957811,8/6(日) 15:52
yom,英明の香川監督「６点以上は取りたい」、智弁学園・小坂監督「しっかり守ってリズム作る」,https://news.yahoo.co.jp/articles/52de6bf24a8b8a43e033ed5de608d89d4af8a9d7,8/6(日) 15:39
yom,見合わせの湘南新宿ラインも平常運転に戻る…東海道線の事故影響,https://news.yahoo.co.jp/articles/6a73f739d4489cc470df387862f49b96d1a21dfc,8/6(日) 15:35
yom,四国対決の川之江と高知中央、「甲子園にふさわしい試合をしたい」,https://news.yahoo.co.jp/articles/d5d72000a0225658858482aab3999d550763479d,8/6(日) 15:34
yom,徳島商・森影監督と愛工大名電・倉野監督、ともにロースコアゲームを予想,https://news.yahoo.co.jp/articles/05c51705060c18b79ed1fe17541935b128225419,8/6(日) 15:25
yom,露国防費が倍増１４兆３７００億円に、国家予算の３分の１…増収へ大企業に「超過利潤税」も,https://news.yahoo.co.jp/articles/dfd47d66c2c778f47be65873cc2a4e4a1ec98877,8/6(日) 15:18
yom,履正社・多田監督「選抜の悔しさはらす」、鳥取商・渡辺監督「食らいつきたい」,https://news.yahoo.co.jp/articles/db2860136f92a3e9780d8acaf192d8acc01d3b4a,8/6(日) 15:17
yom,原爆孤児と明かさず白血病で他界した父…伯父の手記で知った三重代表の被爆2世、 語り継ぐ決意　＃戦争の記憶,https://news.yahoo.co.jp/articles/157418a377cdfd4fa05986a93b7f2ada6e5d199e,8/6(日) 15:01
yom,鹿児島市など襲った「8・6水害」から30年…被災した石橋、「実物大」拓本を後世に,https://news.yahoo.co.jp/articles/ec4c778d7a58bedd7cea2fbef618a0ef9a336d1b,8/6(日) 15:00
yom,男子カヤックシングル、北大津・中岡誠琉が優勝…総体カヌー,https://news.yahoo.co.jp/articles/80e13b3f2d13aa480ebb63f4984b1688cd10d3e6,8/6(日) 15:00
yom,ビッグモーターの修理、４４％で不正の可能性…自動車保険料への影響を損保業界が調査へ,https://news.yahoo.co.jp/articles/9e61c4cc53210a3bb328a43a0288f07faf1c6bcc,8/6(日) 14:55
yom,始球式の栗山英樹さん「次世代にボール渡した」「甲子園は宇宙より遠い場所、まさかこの年齢で」,https://news.yahoo.co.jp/articles/881dc6776989de40a240ff7ee2e141a359dcf10c,8/6(日) 14:44
yom,宮崎国際音楽祭で総監督…元ＮＨＫ交響楽団理事長の青木賢児さん死去、９０歳,https://news.yahoo.co.jp/articles/fae1021bb5bd0168591bd5dbd5acacfc1c8493f2,8/6(日) 14:29
yom,コロナ陽性の妻が死亡、「最後の別れ」かなえず火葬した業者を遺族が提訴…１８０万円賠償請求,https://news.yahoo.co.jp/articles/ef3fae3b3db3ebca46cd24b23d3e7962d119c3ee,8/6(日) 14:21
yom,田村セツコさん、８５歳・現役イラストレーターのカワイイ時々ハードボイルドな日々,https://news.yahoo.co.jp/articles/7090d2a2e121765028d4d380cc9be5a7d7c78754,8/6(日) 14:15
yom,姉の遺志を継ぎ、紙芝居の語り部に…「核兵器のない世界に一歩でも近づけたい」　＃戦争の記憶,https://news.yahoo.co.jp/articles/4972e1a2c57744041f0bce6cfe760a44913ab2df,8/6(日) 14:00
yom,土浦日大が３７年ぶり初戦突破…開幕試合で上田西とのタイブレイク制す,https://news.yahoo.co.jp/articles/8336083a4b314584cf585ec985665c5bd5d06148,8/6(日) 13:58
yom,国立公園に上質なホテルを…候補地に十和田湖や大山蒜山など３か所選定,https://news.yahoo.co.jp/articles/e1da526507c6f1455df4f17d2a28873c11a95c8d,8/6(日) 13:38
yom,ツインズ前田健太、７奪三振で３勝目…大谷翔平は連続試合安打が「９」で止まる,https://news.yahoo.co.jp/articles/d475c0d16b3376c15e91ca3eb0380a3967f6fafa,8/6(日) 13:20
yom,和歌山で導入進む「パートナーシップ宣誓制度」…同性カップル公認の動き広まる,https://news.yahoo.co.jp/articles/9e02cef28b7a07c906b52b80d17e20637dbb74ef,8/6(日) 13:02
yom,仙台育英の女性剣士３人、「なぎなた部入部」条件でタイから留学…「怖いくらい成長」,https://news.yahoo.co.jp/articles/09ce10e188ce5f5b700aaa60b2bacdc2a9b9df04,8/6(日) 12:37
yom,秋本真利衆院議員めぐる事件、岸田首相「政策実行に支障ないよう取り組む」,https://news.yahoo.co.jp/articles/09309f9bb7cd43f521298821af16fa4406b3d83b,8/6(日) 12:31
yom,与論島で女性が風にあおられ転倒し重傷…台風６号、沖縄・奄美から北上へ,https://news.yahoo.co.jp/articles/afcf97a833b5b5110475a907af7111119b640798,8/6(日) 12:25
yom,栗山英樹さんが始球式…「俺が先に暴投するから、気楽に投げなよ」と開幕戦の投手に声がけ,https://news.yahoo.co.jp/articles/aa18ae10a60964ab1d5894b36b210dd3756f1f37,8/6(日) 12:03
yom,広島平和記念資料館、外国人も共感…遺品の三輪車、焼け焦げた弁当箱「心に迫ってきた」　＃戦争の記憶,https://news.yahoo.co.jp/articles/868d60a5004e810b2ef7fc9fc597fe90c5fe5ac1,8/6(日) 12:03
yom,ヒョウ柄にネオンの進化系「大阪ええYOKAN」…高校生と老舗がコラボ、関西万博「ご当地みやげ」目指し開発,https://news.yahoo.co.jp/articles/3332eed67689718e6e1418f54cc9f4757d4e9b0b,8/6(日) 12:02
yom,「栄冠は君に輝く」山崎育三郎さんが甲子園開会式で再び熱唱…今回は観客の前で,https://news.yahoo.co.jp/articles/6fec7689ce7a0baeacb82a1bf841027d11e99615,8/6(日) 11:53
yom,なでしこの疾風、中盤の底を支える長野風花…「チームのために走れるのは喜び」,https://news.yahoo.co.jp/articles/05b039bcee92c3909cb0c46c4f909291a1fe368b,8/6(日) 11:40
yom,最年少当選の女性県議、国民民主党に離党届…無免許運転が発覚,https://news.yahoo.co.jp/articles/5b6479a0db9a82c6e6cf16800bd1760472e52bca,8/6(日) 11:35
yom,佐世保市立中学校の部活動いじめ問題、1年男子生徒に1週間のけが負わせた5人を書類送検,https://news.yahoo.co.jp/articles/fa30a7a8de50730d4e9b50f8720f3d38603b53c6,8/6(日) 11:31
yom,甲子園開会式、先導役の生徒は野球と競泳の「二刀流」…今後はトップスイマーとして「五輪へ」,https://news.yahoo.co.jp/articles/4beccc74919594e08c886170de5e529e69534b28,8/6(日) 11:21
yom,「カリブの楽園」は水道もない密林だった…母国からも「棄民」扱い、移民６７年の苦難,https://news.yahoo.co.jp/articles/5aeeac93a7972ee4a7057be98ef718a1bd1dee03,8/6(日) 11:16
yom,盛岡市長選が告示、３回連続の対決となる２人の争いに,https://news.yahoo.co.jp/articles/5ccc2a1bed1b8317e957036c46343b932e5d969a,8/6(日) 10:26
yom,夏の甲子園開幕「追いかけ続ける勇気さえあれば、夢は必ずかなう」…高知中央・西岡主将が宣誓,https://news.yahoo.co.jp/articles/737874691897975be480452acfb936b0a5fd22cf,8/6(日) 10:06
yom,司馬遼太郎を読み歴史学び、生き方を考えた…「竜馬がゆく」「国盗り物語」高度成長期と歩み,https://news.yahoo.co.jp/articles/96bf00203a07cb95e062661012e73c266462178f,8/6(日) 10:00
yom,ラグビー日本代表強化５連戦を総括…２枚のレッドカードをＷ杯への教訓に「高橋銀太郎の目」,https://news.yahoo.co.jp/articles/271d7e6c75d14dbe589e513ed25985bfd2ae3345,8/6(日) 10:00
yom,埼玉知事選、午後１時の投票率は前回下回る７・１６％…新人２人と現職の争い,https://news.yahoo.co.jp/articles/8b3084992951cddb7919f4caa0a63176b226ba78,8/6(日) 9:53
yom,宮沢ひなたの母・貴代さん「楽しんで行けるところまで」…地元から声援、後輩は憧れのまなざし,https://news.yahoo.co.jp/articles/c2251b62c65314006d89185cdfbc3a2d0b88b3fa,8/6(日) 9:38
yom,レッドソックス吉田正尚、日米通算１０００安打…「通過点という感覚」,https://news.yahoo.co.jp/articles/8ddaf05932e717ce2873c26f868512e6ea43ef47,8/6(日) 9:15
yom,７８回目の原爆忌、式典で犠牲者の冥福祈る…コロナ５類移行で屋外参列席２倍に,https://news.yahoo.co.jp/articles/7980ec8a4cdae59c7c6e89ca7b195a962a46beee,8/6(日) 9:10
yom,引退競走馬にも「セカンドキャリア」を…競馬場のある佐賀県で模索,https://news.yahoo.co.jp/articles/8e900c5b52cce961604819bcf74bc54c86e3efb6,8/6(日) 9:01
yom,岸田首相「核なき世界の実現へ努力続ける」…平和記念式典、露の核威嚇挙げ「道のり一層厳しく」,https://news.yahoo.co.jp/articles/8c2df6fd198da5bbc80dda2d40c4761ff2530e4f,8/6(日) 8:59
yom,広島平和記念資料館の入館者、外国人が４割…きょう７８回目の原爆忌,https://news.yahoo.co.jp/articles/efee8c31772744097249f8afa83a9cdf6d94791c,8/6(日) 8:38
yom,前日から運転見合わせの東海道線、午前８時に再開…垂れ下がった架線と衝突・２人けが,https://news.yahoo.co.jp/articles/97cbf155462467f3607c8eae75a4209025aaed77,8/6(日) 8:25
yom,ポイント故障で見合わせの東京臨海高速鉄道・りんかい線が再開…大崎―東京テレポート間,https://news.yahoo.co.jp/articles/4955689e552cfab338e41c4cb23ff9ec0dd5fbd5,8/6(日) 8:11
yom,登山者向け地図情報アプリ「YAMAP」頂点380万DL…目標は「豊かな社会の実現」,https://news.yahoo.co.jp/articles/ea026a69588a483c772f2affa4514333badfb514,8/6(日) 7:03
yom,原爆翌日に詩人が見た長崎「死者のすべてが虚空をつかんだ幽霊の姿」…ルポが小冊子に　＃戦争の記憶,https://news.yahoo.co.jp/articles/3b9cff060aadd749bd31672ebc6cdfe8838c99b5,8/6(日) 6:30
yom,いとこは久保建英、東大阪大敬愛の１年生が女子８００ｍ制す…「世界で活躍する姿が刺激に」,https://news.yahoo.co.jp/articles/1b6907d8f32e7e3db354a222d0d83343c71b0c7a,8/6(日) 6:30
yom,巨人投手陣「天敵」の広島・デビッドソン、山崎伊「気を付けていたけど」先制２ラン許す,https://news.yahoo.co.jp/articles/1b50a4e5ed7594ee632dccf0b548bf53c722b94d,8/6(日) 6:30
yom,沖縄本島北部で線状降水帯、土砂災害や洪水の危険度高まる,https://news.yahoo.co.jp/articles/cc316bf7c0f914dc0a8d8c30abe3ecf191bd6d5e,8/6(日) 5:49
yom,風力開発社長の出資先、秋本議員が管理…国会質問への謝礼で支出か,https://news.yahoo.co.jp/articles/9539765b755a05ab45f87ed8282a09a797470ef3,8/6(日) 5:00
yom,ドミニカ共和国、日本人移民に補償金支払い…事前に約束した農地割り当てず,https://news.yahoo.co.jp/articles/fa9632ee661474d381723e4ae1f1749c509b8c4c,8/6(日) 5:00
yom,コロナ追加接種は９月２０日開始、「ＸＢＢ」対応で全世代対象…厚労省方針,https://news.yahoo.co.jp/articles/99f0c6771793a98834a3fc25fdceeee7031a40ec,8/6(日) 5:00
yom,大船駅近くで電柱と接触か、東海道線運転見合わせ…乗客は線路を歩いて移動,https://news.yahoo.co.jp/articles/7b3060d715a331430ca15f6613be1cccd17ca588,8/6(日) 0:19
yom,Ｗ杯メンバー入りへ猛アピール、ラグビー日本代表の長田がビッグゲイン,https://news.yahoo.co.jp/articles/494bd6a3031fbcbef4ea10ba952d5de84cd0c845,8/5(土) 23:47
yom,ラグビー日本代表、締まりの悪い国内最終戦…共同主将の姫野「信念を持って突き進むしかない」,https://news.yahoo.co.jp/articles/3ac60f9de77bc517158b04ba76cd519d0430bad9,8/5(土) 23:23
yom,男子ボルダー、安楽宙斗４位…上半身の筋力が必要な後半の２課題で暗転,https://news.yahoo.co.jp/articles/8510a8bb17b44e97152e278b90a057b642646f96,8/5(土) 23:01
yom,「電車と電柱が接触」と１１０番、ＪＲ東海道線・横須賀線・京浜東北線で運転見合わせ,https://news.yahoo.co.jp/articles/09491721c43eb2938677a44fba9513a7b8a155a3,8/5(土) 22:47
yom,相撲８０キロ級・秋田北鷹の山城結、狙っていた優勝「安心した」…来年は１００キロ級挑戦も,https://news.yahoo.co.jp/articles/db0cc178aadc3c7e5b5f5e2b4c6c3099375b8e30,8/5(土) 22:39
yom,オリックス山下が西武戦３連勝、七回途中１失点…ソフトバンク近藤は２ラン含む５打点,https://news.yahoo.co.jp/articles/0ec24e5dbdce580960f5d45abca7f458414c680d,8/5(土) 22:38
yom,相撲１００キロ級・平舘の工藤佳太が２年ぶりＶ、粘りの逆転勝利で吹っ切れる,https://news.yahoo.co.jp/articles/a4c5b6fc1ccf22c05d274870d2fda9dcd8ec09f8,8/5(土) 22:34
yom,体操女子団体の鯖江が連覇逃す、副主将の山本七海「来年は日本一に」…後輩に思い託す,https://news.yahoo.co.jp/articles/06e58ab59b0c0714279a765591d7ff4d40179b29,8/5(土) 22:27
yom,陸上男子やり投げを制した草津東・渡辺「投げ急がずにできたことが勝因」,https://news.yahoo.co.jp/articles/9d011a1cb41c6c6ae4bac61bb7eaf362d33552f3,8/5(土) 22:24
yom,陸上男子８００ｍ、滋賀学園・落合が大会新…作戦通りの終盤勝負でＵ２０アジア王者ら振り切る,https://news.yahoo.co.jp/articles/1f65450703e0be4d7e889f946b27f6c34f44c3f6,8/5(土) 22:22
yom,台風６号が奄美に最接近へ、線状降水帯発生の恐れ…西・東日本は１０日にかけ大雨に注意,https://news.yahoo.co.jp/articles/0b4a6b550a6a5987823762e1761e9de2e4a6ec30,8/5(土) 22:11
yom,日大、アメフト部を無期限の活動停止処分に…学生「悪いイメージが追加された」,https://news.yahoo.co.jp/articles/16d53275830ef058d91bc7a9adb06512f8d06a41,8/5(土) 22:01
yom,なでしこのユニホームは「サンライズ」がテーマ…新たな夜明け告げる快勝、決めた清水,https://news.yahoo.co.jp/articles/5efa9ebcf3bcffd90c3c3417c5cc7646de204963,8/5(土) 21:58
yom,なでしこ８強、次戦は世界１位か３位…池田監督「強豪国と当たるのは想定している」,https://news.yahoo.co.jp/articles/a57acdabcf09ff145b69cb37f20462a0694a101e,8/5(土) 21:50
yom,巨人投手陣が崩れ広島に敗れる…阪神は４カード連続勝ち越し、一回に大山が３ラン,https://news.yahoo.co.jp/articles/764af161c4dd030e661e3c0aa79516b6d043e45d,8/5(土) 21:47
yom,女子ボルダー、森秋彩が決勝進出…独創的なムーブで準決勝５位通過,https://news.yahoo.co.jp/articles/e2863fe0c460dabcac0ca7bfeb6ec33c4a81e653,8/5(土) 21:41
yom,ヘアバンドは川澄奈穂美の影響…世界を驚かせた宮沢ひなたが「シンデレラ」になるまで,https://news.yahoo.co.jp/articles/1490aef184cd496f17457db586b41395f2d75382,8/5(土) 21:40
yom,なでしこジャパン２大会ぶり８強入り…ＤＦ高橋はな「次があることが本当に幸せ」,https://news.yahoo.co.jp/articles/5c13f6240354cc29df2a97a7793b3457af86afbe,8/5(土) 21:32
yom,ラグビー日本代表、フィジーに敗れる…Ｗ杯前の国内５連戦を１勝４敗で終える,https://news.yahoo.co.jp/articles/b7defefbc7dfa458ed0abddad3daf30cead62b39,8/5(土) 21:30
yom,ウクライナ無人艇攻撃が活発化、ロシアのタンカー損傷…露軍が報復に出る可能性,https://news.yahoo.co.jp/articles/aba1368231c3dcb2d2ccd32637438119238674e0,8/5(土) 21:08
yom,「快足」宮沢ひなたがカウンター、勝利決定づけたゴールは澤穂希さんに並ぶ５ゴール目,https://news.yahoo.co.jp/articles/2662956bc1e8ee48dce1d72754af0eb817517fcc,8/5(土) 20:58
yom,板橋の花火大会で火災、「大ナイアガラの滝」が燃え移ったか…枯れ草２０００平米焼ける,https://news.yahoo.co.jp/articles/837ceee673b8e02b912d9484ccacac824cfe1241,8/5(土) 20:53
yom,女子棒高跳び、前橋育英・柳川美空が頂点に…４ｍ超は逃し「悔しさの方が大きい」,https://news.yahoo.co.jp/articles/310dce2650304c38470645681c01cf1552e37866,8/5(土) 20:46
yom,なでしこ冷静、「本当に高い」ノルウェーの猛攻しのぐ…ＧＫ山下杏也加ビッグプレー,https://news.yahoo.co.jp/articles/1c092624dcfba337f7459979e629df9871692256,8/5(土) 20:41
yom,ＮＹでゲーム機の無料配布に数千人殺到、一部が暴徒化…インフルエンサーの投稿きっかけに,https://news.yahoo.co.jp/articles/74f00a0e7dbc3a9b30697a3aa9fc6fc92a09b365,8/5(土) 20:32
yom,危険タックルから５年、日大アメフト部は「生まれ変わってくれたと信じていた」…日本協会,https://news.yahoo.co.jp/articles/76418ea0e7da81530b478bad86f314577a233c93,8/5(土) 20:12
yom,住民「待ち望んでいた」、福島・双葉町に震災後初のコンビニオープン,https://news.yahoo.co.jp/articles/66187502282bfcc16ac68c9b7a21bd651afbd382,8/5(土) 19:57
yom,人けのない場所に児童誘い出し、わいせつ行為…元小学教諭に懲役３年判決,https://news.yahoo.co.jp/articles/0c8072b627e44274c7774a7fc3ec6243e84a03f6,8/5(土) 19:47
yom,決勝ゴールの清水梨紗、８年ぶり８強に「一つ壁を破れた」…なでしこは「ホント明るいチーム」,https://news.yahoo.co.jp/articles/582ca0833a7084504b5a74330fe2bfe433d896ec,8/5(土) 19:46
yom,宮沢ひなたが今大会５ゴールで「得点王」、電光石火のカウンターで勝利決定づける,https://news.yahoo.co.jp/articles/c24cd9c59bf03ca8319428e993254284d9b8268c,8/5(土) 19:33
yom,６日開幕の甲子園、開会式のリハ行われる…「クーリングタイム」のスペースを報道陣に公開,https://news.yahoo.co.jp/articles/a2d3924d2b4d94fd8220ec21399818a8e06900e6,8/5(土) 19:22
yom,なでしこジャパン、次戦は１１日夕…アメリカ対スウェーデンの勝者と,https://news.yahoo.co.jp/articles/629827f5a199e1027d263d67f69d3e6de015fad3,8/5(土) 19:15
yom,西鉄「国際物流」事業拡大へ…千葉県習志野市に新施設、2024年1月運用開始予定,https://news.yahoo.co.jp/articles/d31b0b0f9f358e691101759e7b8bab0eff941153,8/5(土) 19:00
yom,なでしこジャパン、ノルウェー破り８強…池田監督「追いつかれてもぶれなかった」,https://news.yahoo.co.jp/articles/541134ddf9704e1d37e3d0f50fb118ca642717cb,8/5(土) 19:00
yom,「戦争の最大の犠牲は真実」被爆者1000人に取材した記者が思う「使命」　＃戦争の記憶,https://news.yahoo.co.jp/articles/28dd6c0c2173a8389ecaa00fb9a8fbacdf32cd75,8/5(土) 18:31
yom,ブルーベリー狩り、甘み強くみずみずしく…佐賀県吉野ヶ里町の観光農園,https://news.yahoo.co.jp/articles/4b05faab98c5b7a94654a5ca8cea1f8af7cbda0c,8/5(土) 18:31
yom,大谷翔平、逆転サヨナラの４１号とはならず…マリナーズの２５歳右腕が真っ向勝負,https://news.yahoo.co.jp/articles/9e778a08a1d8fff4086e8719c336acf6c380ed22,8/5(土) 18:28
yom,逮捕の日大アメフト部員「大麻は人にもらった」…覚醒剤の錠剤「使っていない」,https://news.yahoo.co.jp/articles/473b1c34807604dd9daa3618cbbddc657597f2fb,8/5(土) 18:24
yom,全英前哨戦、渋野日向子が単独首位キープ…日本勢５人全員が決勝Ｒへ,https://news.yahoo.co.jp/articles/255d5770f34264a985a1156da1b9052d4c2a25dd,8/5(土) 18:18
yom,なでしこＪ、試合のペース握るも決定機作れず…パス成功数・ボール支配率は圧倒,https://news.yahoo.co.jp/articles/2202e27c2bf7a59c3d0d02e5da1e8a051168560b,8/5(土) 18:04
yom,福岡・中洲「明治安田生命福岡ビル」開業…多目的ホールとホテル、にぎわい創出へ,https://news.yahoo.co.jp/articles/ad9f6b2a4afa7c0bd74a4ef2dfeed0ecac62072b,8/5(土) 18:01
yom,遠くから等間隔でクラクション…川に車が転落、取り残された老夫婦をドアから救助,https://news.yahoo.co.jp/articles/409b32a3caffef5e7b011a586c37fe1768f61d73,8/5(土) 17:41
yom,「朝鮮通信使」復元船が対馬に来航、記念式典…「日韓関係の架け橋に」,https://news.yahoo.co.jp/articles/5628b59831cece49bfce1287aee8eeeaf19a193f,8/5(土) 17:40
yom,ドラッグストアで連続強盗、警察犬は１５分で逃げた女の住むアパート近くへ,https://news.yahoo.co.jp/articles/0fc0faa611f1dfd263c9500b4ae7f4983529599b,8/5(土) 17:35
yom,女性看守、上司に「死ねよ」…腹部を殴ってケガ負わす・頭を複数回たたく,https://news.yahoo.co.jp/articles/fd1f58121cdf572ee8d9f956faef879f41e6de9a,8/5(土) 17:32
yom,高校いじめ報告書、黒塗り部分が「特定の操作」で閲覧可能状態に…熊本県教委が謝罪,https://news.yahoo.co.jp/articles/38c5bef34bedbecf8c8396ad61435d42961fe200,8/5(土) 17:30
yom,中日・ビシエド、３試合連続のタイムリー…同点打で反撃の口火切る,https://news.yahoo.co.jp/articles/d38d5013b5f1cc89d8a9519b548f3c139c534ab8,8/5(土) 17:23
yom,ビッグモーター側から北九州市に「店舗前の植樹帯、原形復旧する」連絡…ツツジなどなくなる,https://news.yahoo.co.jp/articles/b93dbdd9f53dc63ae89b792d5a4539e1910a1a6a,8/5(土) 17:20
yom,鎌田大地がイタリア１部ラツィオと契約、昨季リーグ２位の強豪…背番号は「６」,https://news.yahoo.co.jp/articles/a271ba602eb27016deca40dd6798c4993523c33c,8/5(土) 17:11
yom,大分県庁敷地内で「人が倒れている」男性死亡…新館出入り口付近,https://news.yahoo.co.jp/articles/50d7244bc87e92f98bfa2c86fcdbd56b0756a4d2,8/5(土) 17:02
yom,九州豪雨の補助金332万円不正受給、熊本県が高齢者福祉施設運営法人に返還命令,https://news.yahoo.co.jp/articles/c8c887c929c518c234581bdf9d00367ad954a607,8/5(土) 16:50
yom,福岡県福智町長選挙、落選した元町議会議長の申し立て受け投票用紙を再点検…県選管,https://news.yahoo.co.jp/articles/e66ee9ebf93903d8b73ee0c08c8630fc42362638,8/5(土) 16:48
yom,武者姿や昇り龍「府内戦紙」山車きらびやか…大分七夕まつり,https://news.yahoo.co.jp/articles/e29b9b00505fd090400feee34191b07227a20866,8/5(土) 16:30
yom,業務用パソコンで不正にログイン、市教委・市職員3人懲戒処分,https://news.yahoo.co.jp/articles/2219534f3ac9bcc53a19d73a2363432ff452fd4a,8/5(土) 16:20
yom,なでしこジャパン、ノルウェー戦のスタメン発表…宮沢ひなた・長谷川唯らが先発出場,https://news.yahoo.co.jp/articles/88ed5297b9b3792bee2b5dad144be43194a52b93,8/5(土) 16:03
yom,土浦日大・小菅監督「開幕戦でワクワク」、上田西・吉崎監督「全員野球でベストゲームを」,https://news.yahoo.co.jp/articles/aed58f3f62471b132cfd90b9b0f3eb633ca37aec,8/5(土) 15:58
yom,初代フラガール小野恵美子さん死去、７９歳…映画で蒼井優さん演じる主人公のモデルに,https://news.yahoo.co.jp/articles/8a3e063b5214bd80af21f503d932192630d26731,8/5(土) 15:48
yom,初日激突…浦和学院・森監督「甲子園の魔物を味方に」、仙台育英・須江監督「２度目の初優勝を」,https://news.yahoo.co.jp/articles/9dee02885e0421a95bef88e846546099412da351,8/5(土) 15:44
yom,なでしこジャパンは「最強」、英有力紙が女子Ｗ杯のチーム格付けを発表,https://news.yahoo.co.jp/articles/e1b5a7a2ccf38a3154ea95b6ac3f1900fe7798b8,8/5(土) 15:42
yom,なでしこと対戦のノルウェー、五輪・Ｗ杯を制した「古豪」…監督は「レジェンド中のレジェンド」,https://news.yahoo.co.jp/articles/2a360007ebdc998aeda7593200fade367021ac51,8/5(土) 15:03
yom,武蔵美のＡＩ絵画コンテスト、「著作権侵害」批判で急きょ中止…４００点以上の応募,https://news.yahoo.co.jp/articles/736e6efc8431499a70d0da01ba2df9b6a2cc399d,8/5(土) 15:00
yom,秋本真利衆院議員と馬主組合、日本風力開発の社長宅を贈賄容疑で捜索…自民は離党届を受理,https://news.yahoo.co.jp/articles/a1cca5eee28574818b26f26e696e00b439a84a3b,8/5(土) 15:00
yom,教員確保へ大学に「地域枠」…文科省が後押し、志望者拡大目指す,https://news.yahoo.co.jp/articles/4a999561e7a46bd330c3fd1c971aa7e620725c64,8/5(土) 15:00
yom,総体バレー女子、下北沢成徳が２年ぶり５度目の優勝,https://news.yahoo.co.jp/articles/b854ef86a40b381a50cd09fd2c9bdc4b1b9671ee,8/5(土) 14:34
yom,今年初の気温４０度、福島県伊達市で観測…福井県坂井市では３９・５度,https://news.yahoo.co.jp/articles/4cc861bfe8303d509e722c465cee055bca55a0df,8/5(土) 14:24
yom,舞台は近未来、人体は体内に新たな臓器生み出す…クローネンバーグ監督の新作映画,https://news.yahoo.co.jp/articles/3aa60dac3f777681ec00e43a4f0161dc406ddeb8,8/5(土) 14:00
yom,羽生結弦さん、政宗公とツーショット…緑のリンクでノッテ・ステラータ,https://news.yahoo.co.jp/articles/9193b58428290d4264a33100d1dfb64aacbb49ed,8/5(土) 13:33
yom,インターハイ開催、クラウドファンディングで応援…募集８競技で目標寄付額上回る,https://news.yahoo.co.jp/articles/91022b0dfe678b67df8e4d33db5c025530cad2ed,8/5(土) 13:03
yom,西宮高の女子生徒が担ってきた甲子園の誘導係、初めて男子生徒も…あす開会式,https://news.yahoo.co.jp/articles/78a1653c9c437287125e261d8c36e382a4134899,8/5(土) 12:44
yom,台風６号が再び接近、沖縄と奄美地方に線状降水帯の恐れ…北上し九州へ,https://news.yahoo.co.jp/articles/8f4003c79b48af2fb0e574a89cc59fc19cfb140d,8/5(土) 12:04
yom,大谷翔平、９試合連続安打…２点を追う九回の好機には三振に倒れる,https://news.yahoo.co.jp/articles/09a45b30ed1b775a2f95bffea8c08da4e2df4021,8/5(土) 11:59
