media_en,title_articles,link_articles,date_original
yom,東京の学テ結果、全５教科で全国平均を上回る…小６の５２％・中３の６６％が塾や家庭教師で勉強,https://news.yahoo.co.jp/articles/630eae547b2a068db9faa9f2011000e52c7d4eaf,8/7(月) 19:11
yom,スウェーデンでプレーする１９歳・浜野まいか、準々決勝での対戦「色んな状況想定しておく」,https://news.yahoo.co.jp/articles/ddacb2c47e6e84b17bb2eb99236f38ad2b141a9f,8/7(月) 18:59
yom,テレワーク実施率１５・５％、ピーク時から半減…大手企業は今年１月に比べ大幅減,https://news.yahoo.co.jp/articles/212beaacdd703cd74c7dcb14f52c829463390e6d,8/7(月) 18:47
yom,学テ国語で小・中が全国１位の秋田、英語は平均下回る…「ネイティブと触れ合う機会少ない」,https://news.yahoo.co.jp/articles/994131c8f52f6fdf1b6c3e4268b4078a001ee6da,8/7(月) 18:17
yom,核兵器に反対する高校生に反論する「チャットGPT」…AI活用で平和教育の学び深く,https://news.yahoo.co.jp/articles/c53db4ea5540b12194b2406d2b9728d6940fe39f,8/7(月) 18:10
yom,食料自給率が生産額ベースで過去最低、政府目標「７５％」と大きく乖離…円安など影響,https://news.yahoo.co.jp/articles/d42469a0820b25c450fdf883a27dd8d0545439b3,8/7(月) 18:08
yom,東京円、５１銭円高の１ドル＝１４２円１２〜１３銭,https://news.yahoo.co.jp/articles/e5f44f8a2c3c1c047165fe9b2fe5e6e37d909d3d,8/7(月) 17:56
yom,総体テニス・ダブルス男子、四日市工が優勝…女子は沖縄尚学が頂点,https://news.yahoo.co.jp/articles/c677d8a3778b995f1002494c7ac2ded3d16111d6,8/7(月) 17:37
yom,９回に追いついた智弁学園、タイブレイクで英明破る…谷口がサヨナラスクイズ,https://news.yahoo.co.jp/articles/2abd459840801851bb0ba6dc6430da5f584fa0dd,8/7(月) 17:31
yom,サッカーJ3・ギラヴァンツ北九州、4試合ぶりの白星…奈良に1―0で勝利,https://news.yahoo.co.jp/articles/891262400eacf95d214f19ca04e067e22b830322,8/7(月) 17:05
yom,「昭和の名人」古今亭志ん生没後５０年追善興行…新宿末広亭９月中席に人間国宝・雲助ら一門が勢ぞろい,https://news.yahoo.co.jp/articles/cf2626b58ba1fe00a1b5686cbec5ca8d9822233c,8/7(月) 17:00
yom,元木大介さん長男・履正社部員の翔大さん、アルプス最前列から声援…「選手たちの力に」,https://news.yahoo.co.jp/articles/95ba91ed0485d97bfc3cc553e16a0473a58bc183,8/7(月) 16:45
yom,ビッグモーター、ようやく広報部門を設置…専任の担当者が取材対応,https://news.yahoo.co.jp/articles/a97ad1e06cfd3c4b178ab1f136a780cd8dd02176,8/7(月) 16:23
yom,大垣日大・阪口監督「踊るような采配したい」、近江・多賀監督「投手全員使ってでも抑えたい」,https://news.yahoo.co.jp/articles/aa24642122dcb9618013f82a80b92b9f91483867,8/7(月) 16:20
yom,花巻東監督「しばらく甲子園で勝てていない」、宇部鴻城監督「山口を出た時から全国に挑む気持ち」,https://news.yahoo.co.jp/articles/3f94877d59e6aa57aa14c9395e5298292f51ef74,8/7(月) 16:20
yom,おかやま山陽・堤監督「試合動いた時にかぶりつく」、日大山形・荒木監督「三回までに流れつかむ」,https://news.yahoo.co.jp/articles/63d7126fee324baab126259b4e03ed0d51d8f892,8/7(月) 16:20
yom,前橋商・住吉監督は中軸打線に期待、クラーク記念国際・佐々木監督は「エースの新岡にかける」,https://news.yahoo.co.jp/articles/acee452beabeb612ad1547efdd0afdecc69446dd,8/7(月) 16:20
yom,ゆっくり北上の台風６号、九州から東海の総雨量が平年の８月分を大きく超える恐れ,https://news.yahoo.co.jp/articles/7a1adb4712148f63d636ff685708a1e67202e81b,8/7(月) 16:19
yom,処理水の海洋放出で岸田首相「夏頃と申し上げてきた点に変更ない」「内外で丁寧に説明」,https://news.yahoo.co.jp/articles/743049c7bb142414ba6d51b5601fbe2794a7a82b,8/7(月) 16:15
yom,英国発祥のハイティー、人気上昇…「貴族の習慣」アフタヌーンティーより豪華な食事,https://news.yahoo.co.jp/articles/c083e897f31c0e3085e49d2cce9edb5d5c38de51,8/7(月) 16:10
yom,台風６号で北海道入り遅れた首里、なぎなた団体で連覇…城間こころが面で一本勝ち,https://news.yahoo.co.jp/articles/9db1faddf0e834de03c2b4b0be48becffa21a17a,8/7(月) 16:01
yom,［深層一直線］サウナ　自分との対話…右松健太,https://news.yahoo.co.jp/articles/bad6646e2200ee92de4bec39dec130cce579ef6d,8/7(月) 16:00
yom,「長崎原爆の日」の式典会場、台風6号接近受け撤去作業「自然には勝てない」,https://news.yahoo.co.jp/articles/9269ba7d219b7b95addd4630445934d255e78efc,8/7(月) 15:19
yom,日経平均終値、６１円高の３万２２５４円…朝の売り優勢から切り返す,https://news.yahoo.co.jp/articles/96d71b3c2fe91256905fab66e83d85ed8c1099c8,8/7(月) 15:12
yom,世界唯一の捕鯨母船「日新丸」ラスト航海へ…1987年に建造、反捕鯨団体の妨害も,https://news.yahoo.co.jp/articles/aab0f8c4667e18a7ac4e3431a0f7ca0741259448,8/7(月) 15:10
yom,学校というレールだけじゃない…不登校経験の運転士が提案、小田急がフリースクール,https://news.yahoo.co.jp/articles/e4cd29f7e9cdfa99b6717509117dcce48abdfba1,8/7(月) 15:00
yom,なぎなたで７分間の死闘、南陽の柳沢心が初優勝…団体は首里が２年連続５度目Ｖ,https://news.yahoo.co.jp/articles/5dff2f74e9e893d4f6fabe7293ed541a8ed0cf84,8/7(月) 14:51
yom,琵琶湖の水面で発見の小学生、救急搬送され死亡確認…サッカーチームで大阪から訪れる,https://news.yahoo.co.jp/articles/3a8cea35be89802c6b6a28ed6ff1f70402e7db59,8/7(月) 14:42
yom,サッカーJ1・アビスパ福岡、サガン鳥栖との九州対決制す…MF金森健志が古巣に一撃,https://news.yahoo.co.jp/articles/82a6a85a8f640976fb07cb7296d67989c46df546,8/7(月) 14:39
yom,自転車の男子チームスプリントで高校新記録、松山学院が決勝進出…中村和樹「涙が出た」,https://news.yahoo.co.jp/articles/5d42e727a6c3abcc437748f5c0b1592bfbfa01e6,8/7(月) 14:17
yom,景気動向指数、６月は０・９ポイント上昇…基調判断は「改善」,https://news.yahoo.co.jp/articles/90d536f207c7eeb5292bc70000ea977b626fb320,8/7(月) 14:10
yom,高齢者の身元保証業、遺贈や寄付のトラブルも…重要事項説明書の作成は２割だけ,https://news.yahoo.co.jp/articles/bf7ee27db09ba901f358059488e04da22b3a5370,8/7(月) 14:00
yom,国産の手持ち花火を山梨で開発、材料はブドウの枝…しだれ桜のような美しい炎,https://news.yahoo.co.jp/articles/714d008583441aef28b59e40fa15790ce6f94efa,8/7(月) 13:49
yom,大阪桐蔭を倒し４年ぶり出場の履正社、鳥取商に得点許さず…森田が先制３ラン,https://news.yahoo.co.jp/articles/8b553d77bc82f00edf7ed1e54e9086f2bb4f8740,8/7(月) 13:30
yom,奈良の大仏さん、猛暑の夏にスッキリ,https://news.yahoo.co.jp/articles/92aa996635edea7769400fe37409e795856a9fc8,8/7(月) 12:41
yom,国鉄の「JNR」マーク付き復刻車両「いい雰囲気」「かえって新鮮」…JR九州運行へ,https://news.yahoo.co.jp/articles/cdf9896ee6a56da1aa5e43ba6db1f6a11a4a0945,8/7(月) 12:20
yom,全国唯一、コロナ禍だった22年の宿泊者数が「コロナ前」の19年を超えた県,https://news.yahoo.co.jp/articles/606caa1a7e9726fa124dbd6e0074f0243bdbbf88,8/7(月) 12:10
yom,青空の下、ヒマワリ咲き誇る…大分県日出町で「ジュニアスマイル」など見頃,https://news.yahoo.co.jp/articles/323f7805d60ad61e0a9cdbe1241e3e03ca7cfb4a,8/7(月) 12:07
yom,医師4代受け継ぎ、救護に最善を…広島原爆忌 ＃戦争の記憶,https://news.yahoo.co.jp/articles/b4b901cd4580981806f233449c67c1cf14f473d6,8/7(月) 12:01
yom,「ヒロシマの思いを語り続けたい」、4歳で被爆…78回目原爆忌 ＃戦争の記憶,https://news.yahoo.co.jp/articles/3330c67b1bcc42ce08918c91cb91cbb8ad9461a1,8/7(月) 12:01
yom,「平和の鐘」これからも、犠牲者の冥福祈り…戦後78年 ＃戦争の記憶,https://news.yahoo.co.jp/articles/849df2c7899ed8f3cebe53e14c9e1efbe37e606b,8/7(月) 12:01
yom,平和願う灯、原爆犠牲者を追悼…広島・元安川 ＃戦争の記憶,https://news.yahoo.co.jp/articles/3651e0f2d3bb1564a52fcee677e8498b902537fa,8/7(月) 12:01
yom,食料自給率、生産額ベースでは過去最低５８％…カロリーベースは３８％で変わらず,https://news.yahoo.co.jp/articles/f0758ef2a163526aafd36d76219e4e51089c61c0,8/7(月) 12:00
yom,仙台七夕まつり、４年ぶり通常開催…女性看護師「飾りの吹き流しをくぐる感覚が好き」,https://news.yahoo.co.jp/articles/ec5046a2264341e499258e4386c1a3187e491995,8/7(月) 11:53
yom,橋本聖子氏「引退競走馬の受け入れ施設整備、官民一体で」…佐賀県の支援団体訪ねる,https://news.yahoo.co.jp/articles/8abceec330c4ae59a349e824b2fc40fc0ee8fb00,8/7(月) 11:50
yom,台湾でも人気の甲子園、高知中央に留学の謝喬恩が４打点で初勝利に貢献,https://news.yahoo.co.jp/articles/d23249943423f8b82175261dc4a46a486047bef5,8/7(月) 11:41
yom,爆心地から1・1km、強烈な光と轟音と静寂…「命尽きる日まで語り続ける」　＃戦争の記憶,https://news.yahoo.co.jp/articles/7117583ce5aeda8924d2948c411b6a90df9155f3,8/7(月) 11:41
yom,花火見物から帰港中の１１人乗りボート、貨物船と衝突し沈没…全員救助,https://news.yahoo.co.jp/articles/d7daa284de1ba71928f1f35439526ed64ca7595a,8/7(月) 11:37
yom,ゆっくり進む台風６号、奄美含む九州南部で線状降水帯の恐れ…９日にかけ九州から東海で大雨,https://news.yahoo.co.jp/articles/bbe0eae8bc9132495600f9442073360478ca2161,8/7(月) 11:17
yom,ロシアの補給路、クリミアの橋２本を攻撃…英仏共同開発のストームシャドーか,https://news.yahoo.co.jp/articles/85d77556edd40f368b330679b993486d9bc2c4bc,8/7(月) 11:11
yom,「おてもやん」軽快なリズムに合わせ…熊本市の「火の国まつり」4年ぶり開催,https://news.yahoo.co.jp/articles/bbbfd1e66a3a921565fcdafca9cbfa820aaec508,8/7(月) 10:57
yom,「ひょっとこ」ユーモアたっぷりパレード…宮崎県日向市で4年ぶり「夏祭り」,https://news.yahoo.co.jp/articles/0504ad0a9fcba5c87bef970c14543e1ce245146c,8/7(月) 10:52
yom,四国対決は初出場の高知中央が打ち勝つ…台湾出身の謝が４打点,https://news.yahoo.co.jp/articles/27c6f88de88d3b4b927f97c40e576e263e8dbba9,8/7(月) 10:48
yom,折り紙はここまで進化、医学や宇宙開発など幅広い産業で応用期待…９万の面を持つ新技術,https://news.yahoo.co.jp/articles/513dac700ba1cd1455d82f1af317cddb23b47897,8/7(月) 10:40
yom,不登校の小中学生、アバターで交流…八尾市教委が仮想空間に居場所づくり,https://news.yahoo.co.jp/articles/6b4e2c802fa3e01a66cbafd510bab0c06dbd005b,8/7(月) 10:29
yom,「戸畑祇園大山笠」など北九州市の祭り勢ぞろい…「わっしょい百万夏まつり」,https://news.yahoo.co.jp/articles/5a77e0676f0ef4e0e10ca369d61a166753fc75f6,8/7(月) 10:26
yom,カヌーで山形・谷地が席巻…鈴木葉月「全国で勝つため、私のスピードに合わせて」,https://news.yahoo.co.jp/articles/0cdd739192dcab93b2d725e3419cd0ecd17e6d41,8/7(月) 10:10
yom,「武雄アジア大学」開学1年延期…学生確保見通しなど審査基準厳格化に対応するため,https://news.yahoo.co.jp/articles/5137fd10c4671ed3b9a1e52ac54b704ee8afd1cf,8/7(月) 10:05
yom,日本の防衛白書にロシア、「ナチスと同盟関係にあった不都合な真実に沈黙」と批判,https://news.yahoo.co.jp/articles/a1f1f83d0558753365be5d642ecf9e04c385eb44,8/7(月) 9:46
yom,鈴鹿８耐、ホンダのチームＨＲＣが全車を周回遅れにする圧勝で連覇,https://news.yahoo.co.jp/articles/dac091995c391d0291dc7709aac9a6ddb4d45d86,8/7(月) 9:42
yom,大分県庁の敷地内に男性遺体…52歳公務員が脳挫傷で死亡,https://news.yahoo.co.jp/articles/17ae159c126e41f92d9615f0f1258d23fb5e53b5,8/7(月) 9:29
yom,日銀の７月の金融政策決定会合、複数委員が「長短金利操作の運用柔軟化」意見,https://news.yahoo.co.jp/articles/76786ee5243b378dff0a66a489d6db4d5a390349,8/7(月) 9:27
yom,甲子園開幕、九州勢の注目校は…3年連続出場の明豊や7試合で無失策の九州国際大付,https://news.yahoo.co.jp/articles/aef591d2076fd18d1611de0a2f220518f9ae6a6b,8/7(月) 9:20
yom,大谷翔平１安打、６連敗のエンゼルスは勝率５割切る…藤浪晋太郎は１回無安打無失点,https://news.yahoo.co.jp/articles/4e1ccf70f0e90933c7ce4cffa97567a0011c6cfd,8/7(月) 9:07
yom,サッカーJ3・テゲバジャーロ宮崎、ホームで鹿児島下す…開始直後に先制し逃げ切る,https://news.yahoo.co.jp/articles/a32f062b4782d29c22a960f46e4a691bad0ba66c,8/7(月) 8:54
yom,防衛財源確保へのＮＴＴ株売却案「２０年とかかけて売らないと」…甘利氏、法改正目指す考えも,https://news.yahoo.co.jp/articles/137b7c3914e4c324757c99b78e8aeeeeb91c9fbc,8/7(月) 8:04
yom,浦和学院の１年生主砲・西田が２安打２打点、聖地でも存在感…「実力つけて甲子園に帰ってくる」,https://news.yahoo.co.jp/articles/40a9c77df01be30cc7a9dbde6ac032f801fa87c2,8/7(月) 7:38
yom,「つけ麺発祥の地」を「聖地」に…中野で外国人ら誘客活動、提供店掲載ＭＡＰや学会設立,https://news.yahoo.co.jp/articles/3d16ac0743a0b551d3d517ce4ce1d58e65dd9228,8/7(月) 7:29
yom,戦艦「武蔵」が沈む姿を目の当たりに…レイテ沖で九死に一生、９６歳元少年兵が初めて伝える記憶,https://news.yahoo.co.jp/articles/92b117152ced0dd476426ea7a4409aeb25aedc45,8/7(月) 7:02
yom,ロシアのウクライナ領土「併合」、中国も不承認の立場…侵略終結へ関係国会合,https://news.yahoo.co.jp/articles/206fe5ad3aaca7bfd5eb97a9633acb63746f6cb3,8/7(月) 6:57
yom,ビッグモーター不正、損保ジャパンに三つの疑問…出向者の役割・査定簡略化・事故車紹介の再開,https://news.yahoo.co.jp/articles/dddc1fe994cf173bd46bd5f8bc2deea841cfea76,8/7(月) 6:53
yom,男性育休奨励金、最大602万円を企業に支給…福井県、全国トップクラス,https://news.yahoo.co.jp/articles/2d1a0be19fd2f75fe0ca9bc138a928c255996af1,8/7(月) 6:40
yom,悪臭漂う粉じん、「震災生き延びた人間が今度はがれきに殺される」…トルコ・シリア地震半年,https://news.yahoo.co.jp/articles/da86b467751fa942403776f9077431d3f757ae70,8/7(月) 6:37
yom,「生き残った者として被爆語る」…Ｇ７に背中押され９１歳、封印解き決意,https://news.yahoo.co.jp/articles/5228fdab7848bc6dbecfbc8705d8e7da651fca12,8/7(月) 6:33
yom,２連敗で野手陣に語りかけた巨人主将・岡本、内容は「内緒」…８月の本塁打すでに８本,https://news.yahoo.co.jp/articles/f88440b6fdd8d2210935e9396638f78162ebd550,8/7(月) 6:30
yom,茨城大会準決勝で頭に死球「高校野球人生が終わるかも」…復帰の土浦日大主将が聖地で躍動,https://news.yahoo.co.jp/articles/8ced66d769d4441739d94954c3d4f821b73d9555,8/7(月) 6:30
yom,初出場の共栄学園、７失点のエース痛感「甲子園は甘くないな」…敗れるも胸には充実感,https://news.yahoo.co.jp/articles/4ef363084616c36b37af6f319c09fd8773ce7c71,8/7(月) 6:30
yom,「ハードルに挑戦してみないか」中２で恩師から勧められ…インターハイ連覇するまでに成長,https://news.yahoo.co.jp/articles/49b92bc7791782a6766f87cc34b76e672c78ab17,8/7(月) 6:30
yom,フェンシング一家の飯村彩乃が女子団体準Ｖ…父は太田雄貴さんを指導、兄は世界選手権「金」,https://news.yahoo.co.jp/articles/15f95b610d1cd9265ac1daabbd688857b1635cf6,8/7(月) 6:30
yom,青春のまなざし　勢ぞろい…夏の甲子園開幕,https://news.yahoo.co.jp/articles/2fd206c35f46c01294882b485cccde4ee841c8fa,8/7(月) 6:00
yom,土浦日大　１０回集中打…粘って下位から５連打,https://news.yahoo.co.jp/articles/fe99f0377855777bc04c84f0eb226abe2c0e2933,8/7(月) 6:00
yom,聖光学院　果敢に内角攻め…小室　精密スライダー,https://news.yahoo.co.jp/articles/0a23607c925ca37fcdd555915de14ebc58df5388,8/7(月) 6:00
yom,仙台育英　序盤９点…初回に先制　乱打戦制す,https://news.yahoo.co.jp/articles/dd678661d971a87dc62c38abc06ea976f351bfb6,8/7(月) 6:00
yom,秋本真利議員、審査基準見直し後に１０００万円受領…競走馬の購入費用に充てる,https://news.yahoo.co.jp/articles/0987783e8285f2ecbb987e693ae5ff8e58051cd3,8/7(月) 5:02
yom,生成ＡＩ使う人材育成、企業向けに新指針策定…導入率は世界平均より低い２４％,https://news.yahoo.co.jp/articles/ff4f16fd43dd796f0746028c31f1247ab4260100,8/7(月) 5:01
yom,原発「処理水」の海洋放出、今月下旬にも開始で調整…日米韓首脳会談後に最終決定へ,https://news.yahoo.co.jp/articles/ba333480c5fc7b9ae02d6b891c527d41e8dc75a0,8/7(月) 5:01
yom,「不動のボランチ」長谷川唯＆長野風花、「こんなに感覚が合う人いない」と断言…あうんの呼吸に注目,https://news.yahoo.co.jp/articles/7969c670696493fe34d04bcca819f2e1810d540a,8/7(月) 5:00
yom,男子リードで安楽宙斗が２位、「あらゆるパターンを想定」して戦った決勝…世界クライミング,https://news.yahoo.co.jp/articles/bb75d0ecf93ad553d2f99ee8f006ec5ebdd1791f,8/7(月) 4:27
yom,女子リードで森秋彩が完登で優勝、女子は全種目通じて日本勢初の金…世界クライミング,https://news.yahoo.co.jp/articles/af5e4e8722d00c468c5e515a705e6eb7bca27bd0,8/7(月) 3:06
yom,松山市沖で貨物船がボートと衝突、乗っていた１１人全員を救助,https://news.yahoo.co.jp/articles/1cf39aa4e326ef909603a7f936d87643fc8df941,8/7(月) 0:18
yom,東海道線の衝突事故、運転士「目の前に電柱が見えた」…３日前の目視点検で異常なし,https://news.yahoo.co.jp/articles/039646302f1daec91b6eeaf8a96f8e3fd28dc76c,8/6(日) 23:56
yom,男子３０００ｍ障害で永原颯磨が高校新Ｖ、自身の記録大幅更新する圧巻レース,https://news.yahoo.co.jp/articles/03e175a869ca3c62ee4b9b1d0fda31e933936f8a,8/6(日) 23:06
yom,女子ボルダー、１９歳森秋彩は悔しい６位「今ある実力が表れた」…世界クライミング,https://news.yahoo.co.jp/articles/be7e714ba62f8d820b91c4ec633c2f11605f0a9e,8/6(日) 22:56
yom,気候変動のコスト、対策遅れると最大「３京２６００兆円」…生物多様性の損失など換算,https://news.yahoo.co.jp/articles/7ea8d0a56bd5ee9b07d78d7ab3b407c7399b25a8,8/6(日) 22:44
yom,巨人・岡本和真が３発、広島に大勝し３位浮上…阪神に敗れたＤｅＮＡが４位転落,https://news.yahoo.co.jp/articles/e1ca96d2c6ba3b3c4e26221d2760c19023bb7d7c,8/6(日) 22:27
yom,オリックス中川圭が２本塁打、西武に快勝し３カード連続勝ち越し…楽天・則本が５連勝,https://news.yahoo.co.jp/articles/b2db24b0977b950297740c8f531e9753af1ce239,8/6(日) 21:44
yom,ＮＨＫ記者が酒気帯び運転「海水浴に行って酒を飲んだ」…接触事故起こし現行犯逮捕,https://news.yahoo.co.jp/articles/3bbf83910b9aca646db9a67185860272ee317703,8/6(日) 21:27
yom,連覇目指す仙台育英、１９―９で浦和学院との打撃戦制す…須江監督「点差離してもついてきた」,https://news.yahoo.co.jp/articles/122eb9048095e5ae5ebd1b4914690aa661f82f73,8/6(日) 21:16
yom,台風６号が九州接近へ、奄美含む南部で線状降水帯の恐れ…西・東日本でも大雨か,https://news.yahoo.co.jp/articles/69814cd4d5a28a2c802bb7568653d585cfff2485,8/6(日) 20:55
yom,世界アーチェリーで野田紗月３位、パリ五輪出場へ…女子リカーブ個人で日本勢初のメダル,https://news.yahoo.co.jp/articles/93dd38f769c268409e89ca8da2703dfd0d4891ae,8/6(日) 20:41
yom,７８回目の広島原爆忌、松井市長が「核抑止論」脱却訴え…死没者計３３万９２２７人に,https://news.yahoo.co.jp/articles/ee36f80f553fc98471a766062435bd45d66fa7ec,8/6(日) 20:26
yom,埼玉知事選、与野党相乗りの大野元裕氏再選…投票率２３・７６％・全国の知事選で過去最低,https://news.yahoo.co.jp/articles/4daf017e049c467c6e0fa7d8649f01e477477b56,8/6(日) 20:01
yom,ロシア戦闘機スホイ３０が緊急発進、黒海上空で米空軍のＭＱ９リーパーが領空接近,https://news.yahoo.co.jp/articles/b0a6c67eee21998c7a9fc69b2f8fbfe6d032adce,8/6(日) 19:57
yom,長崎の平和祈念式典、台風６号接近で会場変更…被爆者・岸田首相の参列も見送り,https://news.yahoo.co.jp/articles/1ea70a2d8076cac708bc1b1aafee7c160ca7b7dd,8/6(日) 19:56
yom,ロシアが徴兵年齢の上限引き上げ、招集令状出たら出国禁止に…侵略長期化で予備兵力拡大,https://news.yahoo.co.jp/articles/bb612a05f1f2193bae434767e6093d3dc6a9b3e9,8/6(日) 19:26
yom,スウェーデンがＰＫ戦で米国に勝利、Ｗ杯準々決勝でなでしこと対戦,https://news.yahoo.co.jp/articles/e7b93d328163d539dce9e0d33aff27d620c632b3,8/6(日) 19:10
yom,仙台育英が序盤の猛攻で大量リード、浦和学院も４点返す…１回戦屈指の好カード,https://news.yahoo.co.jp/articles/6d3b03c80c6efdf01f4770ef192a88666002004a,8/6(日) 19:07
yom,浦和学院のスタンドに元巨人・三浦貴コーチの遺影…野球部顧問「選手を支えてくれるはず」,https://news.yahoo.co.jp/articles/38b4ddada10f57086f9969af2dddede89bf84e7b,8/6(日) 19:00
yom,ニジェールのクーデター部隊、ワグネルに協力要請か…周辺国は軍事介入の構え,https://news.yahoo.co.jp/articles/935178ff972bafad1de724099ee814485fdf2e3b,8/6(日) 18:51
yom,金正恩氏が「重要軍需工場」視察、外貨獲得でロシアへの兵器輸出拡大か,https://news.yahoo.co.jp/articles/fd31442d8748779f407aba8d8774c074763005ab,8/6(日) 18:43
yom,水上タクシーで居酒屋へ＜直行＞！…徳島で1日1便運航,https://news.yahoo.co.jp/articles/b50174cd5f6a0c376d3600e1ed5b964682acabb1,8/6(日) 18:20
yom,中島啓太が逆転で今季２勝目、蝉川泰果が１打差２位…第３日まで首位の稲森佑貴５位,https://news.yahoo.co.jp/articles/e47bc0ba921280c573dc5dfbd7a63f8109ec5379,8/6(日) 18:11
yom,「処理水」放出に反発する中国、甘利明氏「あなたにだけは言われたくない」,https://news.yahoo.co.jp/articles/4ae25d3951465a866aceb18b6473f1fed39b70f1,8/6(日) 17:54
yom,水管橋から水噴出、最大３０ｍ・１２時間…住民「水道代にするといくらになるのか」,https://news.yahoo.co.jp/articles/368b77df8c8e4c232fd947372fc81ea15b586001,8/6(日) 17:48
yom,「手元にまとまった金置くな」「スマホ位置情報に注意を」弁護士が前町長に不適切助言,https://news.yahoo.co.jp/articles/aba0e875777f0931364e1a096fd885452657c9ca,8/6(日) 17:43
yom,ヤクルトの「代打の切り札」川端、今季初の先発でいきなり先制打…中日に競り勝つ,https://news.yahoo.co.jp/articles/6fd88d4058d8a95b38231cf14a2ed098e6fb9c7d,8/6(日) 17:36
yom,どん底から復興した人々の思いを背負う、数奇な「広島大仏」…奈良・極楽寺で慰霊の法要　＃戦争の記憶,https://news.yahoo.co.jp/articles/f5ae005678dfe40c2967d799e17610e9bc7f8c6c,8/6(日) 17:30
yom,聖光学院が共栄学園を破り１回戦突破…四回にスクイズで先取点、斎藤監督「流れが来た」,https://news.yahoo.co.jp/articles/90201c37cddd999e327042835c1db0c63ffd70d3,8/6(日) 17:27
yom,芸舞妓、盛夏にきりり黒紋付で「おたの申します」…鎌倉時代の儀礼にルーツをもつ「八朔」,https://news.yahoo.co.jp/articles/987e7f7165e48c385760684a91a6747dd5f83fed,8/6(日) 17:01
yom,ソフトバンクの今宮が６号ソロ「大きい追加点の一本になって良かった」…日本ハムに勝利,https://news.yahoo.co.jp/articles/4cab3f45fd7fbcbf65ad05229a21595cf92b0271,8/6(日) 16:52
yom,浦和レッズ・田口社長、サポーターの禁止エリア侵入を受け謝罪「多くの方に不快な思い」,https://news.yahoo.co.jp/articles/6a9e899a40e54c2a1116d259b9b4a5a203ccf413,8/6(日) 16:28
yom,帰宅中の女性を狙ったわいせつ相次ぐ…駅から追いかけられ被害、警察「ながら歩きは危険」,https://news.yahoo.co.jp/articles/912695c8b0b9b107d1e6227c2ee02324750ac303,8/6(日) 16:26
yom,１９歳男子大学生、友人７人と川遊び中に溺れ死亡…飛び込んだ後に姿見えなくなり,https://news.yahoo.co.jp/articles/e0f8714511b70b83d8fb2094b22f3e294688c81d,8/6(日) 16:19
yom,猛暑の甲子園「クーリングタイム」新設したが…球児倒れ担架で運ばれる、足がつり交代の選手も,https://news.yahoo.co.jp/articles/0f80089fa3d9fe5571bcf0157283a4c51e9d8346,8/6(日) 16:17
yom,相撲団体で埼玉栄Ｖ、個人は和歌山商の西出大毅が優勝…インターハイ,https://news.yahoo.co.jp/articles/c629bdce9ae685d2e9768fbe39f956c46839fde8,8/6(日) 15:59
