media_en,media_jp,title_articles,link_articles,date_original
finders,FINDERS,横浜の春の風物詩「FLOWER GARDEN 2024」が3月29日(金)〜4月21日(日)に開催,https://news.yahoo.co.jp/articles/eb64e5289566f8508dfdb69b9ae1694571a1604d,3/27(水) 7:04
finders,FINDERS,世界を魅了する日本発の“未来型花火エンターテインメント”「STAR ISLAND 2024」日本凱旋決定！,https://news.yahoo.co.jp/articles/67e29201c0e4534c117a1360407ed5c6cc81d29f,3/27(水) 7:04
finders,FINDERS,日本が世界に誇るアーティスト、田名網敬一の大規模回顧展「田名網敬一 記憶の冒険」が今夏開催,https://news.yahoo.co.jp/articles/9b5859b16ed8208af3f568bfae9855ad47aa012f,3/27(水) 7:04
finders,FINDERS,「枕のサブスク」オンライン診断により、AIが70万通りの中から最適な枕をパーソナライズして提案する「THE PILLOW」,https://news.yahoo.co.jp/articles/3c9fc3437012c25b8bdd255547c3cb5a0bdca2e0,3/26(火) 7:05
finders,FINDERS,Google Maps Platformで日照量が分かる？！環境情報を取得できるAPIの活用方法を紹介,https://news.yahoo.co.jp/articles/6fdfffadaef15d360f9c30a6148261cb88dbe6d3,3/26(火) 7:03
finders,FINDERS,暮らしとともにある「木」について多面的に学ぶ6日間。「木と生きる」 イベントが日比谷で開催,https://news.yahoo.co.jp/articles/a4bf4278646f6ba4687e40d416fb2301b1d3bb4f,3/25(月) 7:04
finders,FINDERS,国内外のデジタルデザインが交差するカンファレンス「Design Matters Tokyo 24」が開催,https://news.yahoo.co.jp/articles/8459a993cdc47f90c2b91b3c432aa9889f79941f,3/25(月) 7:02
finders,FINDERS,高速道路の上を歩き“未来の歩行者空間”を体感「GINZA SKY WALK 2024」が開催決定,https://news.yahoo.co.jp/articles/ed2e884e22a018a411aff3649a7294c9ef478d16,3/24(日) 7:01
finders,FINDERS,「ウイスキーフェスティバル2024 in 大阪」が開催決定！3月28日(木)より入場チケットが発売開始！,https://news.yahoo.co.jp/articles/4665ff7a314b58ac2772d81b6fa1fe762676b36e,3/24(日) 7:01
finders,FINDERS,今年も横浜・みなとみらいの街が映画一色に！日本最大級のシネマフェスティバル「SEASIDE CINEMA 2024」が開催決定,https://news.yahoo.co.jp/articles/62d2ecc7fee788d71fb33b087ed27f89e3ee53ee,3/23(土) 8:06
finders,FINDERS,大人気日本酒イベント「SAKE PARK」の第3弾が開催決定！チケット好評発売中！,https://news.yahoo.co.jp/articles/1e270d0c20963811a9190def78700f922d27d9e4,3/23(土) 7:02
finders,FINDERS,映像クリエーター必須！Google Earth Studioで迫力ある空中映像を制作！！,https://news.yahoo.co.jp/articles/21d5ab977cc09ce7ee2eadba9b02dea380a49c40,3/22(金) 7:06
finders,FINDERS,“地球環謝祭”みんなでつくるみらいのせかい!!「アースデイ東京2024」が開催決定！,https://news.yahoo.co.jp/articles/af7a3a757d3c8e8a21a8b686649081a51c0594c4,3/22(金) 6:26
finders,FINDERS,イラスト・マンガ・アニメーション制作アプリ「CLIP STUDIO PAINT」の専用欧文フォントがリリース,https://news.yahoo.co.jp/articles/aeeed9af8099abb46454df94056404b79997bc78,3/21(木) 7:05
finders,FINDERS,世界で活躍するトッププロデューサーが集うカンファレンス「FUKUOKA PRODUCER SUMMIT 2024」 5月に開催決定！,https://news.yahoo.co.jp/articles/2f382524665f6e948cce42dc42881c83b47ede27,3/21(木) 7:05
finders,FINDERS,今年のお花見はNAKAME OHANAMI PARKで決まり！中目黒・フナイリバにキッチンカーが集結,https://news.yahoo.co.jp/articles/17fb9ff4ee3173d8e915f8d6fc30a2ee54998023,3/20(水) 15:49
finders,FINDERS,山崎怜奈が “選考委員長” に就任！「文房具総選挙2024」が開催決定！！,https://news.yahoo.co.jp/articles/81b988d51774715badc726845b8a2e1fb071dbef,3/20(水) 8:04
finders,FINDERS,北欧デザイン黄金期から現代まで〜スカンジナビアインテリアブランド50社による競演,https://news.yahoo.co.jp/articles/0198f891fa23b90829acc87b0d610a6a1bae687c,3/20(水) 7:04
finders,FINDERS,「Shibuya Sakura Stage」SHIBUYAタワー38階に起業支援施設「manomaカンファレンスホール＆レストラン」が開業,https://news.yahoo.co.jp/articles/4e7c1f5e6087f10165ab90579ddc3140a477c4d8,3/19(火) 8:02
finders,FINDERS,大阪・関西万博「EXPOサービスクルー(仮称)」4月13日より募集を開始,https://news.yahoo.co.jp/articles/a4b24947f5952dcfac652812a25c456d00fdc791,3/19(火) 7:05
finders,FINDERS,note、1万パターンのイラストを作成できるツールを無償公開！,https://news.yahoo.co.jp/articles/0fa62a6822fe1a61bb0952dbce8095ad0cd7df84,3/19(火) 7:04
finders,FINDERS,MTB・北林力を応援する「Team RIKI Supporters Club Passion」が発足。ロス五輪を見据えた本場ヨーロッパでの挑戦を支援！,https://news.yahoo.co.jp/articles/aa7edbd5e76a1ecd35db41de6eca8dfe1a48d0b6,3/18(月) 8:02
finders,FINDERS,アルフレックス リストア、作家 佐藤尚理の作品展 「invisible intention」を開催,https://news.yahoo.co.jp/articles/2bf3963139e1b07f9a1121a79285aa767007e0ae,3/18(月) 7:04
finders,FINDERS,ビル・ゲイツが全著作を愛読！「知の巨人」 バーツラフ・シュミル最新刊『Invention and Innovation 歴史に学ぶ 「未来」 のつくり方』が発売！,https://news.yahoo.co.jp/articles/0efa4cf15efe5d2e9d4e7899cbd622e67e7ff043,3/18(月) 7:03
finders,FINDERS,バリ島でコーヒー収穫体験！スペシャルティコーヒー専門店の「LIGHT UP COFFEE」が農園ツアーを催行！,https://news.yahoo.co.jp/articles/ad33eeeb13da4aae6ae93309f93e44e54c621bff,3/17(日) 8:03
finders,FINDERS,福岡・糸島に体験型グランピング施設「ラストピース糸島」がグランドオープン！,https://news.yahoo.co.jp/articles/1f266f10712d3998619810007a113f511c1d4ec4,3/17(日) 8:02
finders,FINDERS,3月23日(土)宮古島「シギラビーチ」が海開き！早くも2024年のサマーシーズンが到来！！,https://news.yahoo.co.jp/articles/0ded3f1da4f8074f0b0995ec1d649f475a7c2887,3/17(日) 7:03
finders,FINDERS,「横浜マリンタワー」を階段で昇ろう！ UP THE MARINE TOWER!!,https://news.yahoo.co.jp/articles/166c71bce381117403048fac760a0fe0a5ffccba,3/16(土) 8:00
finders,FINDERS,「秋田の酒を楽しむ会」in東京が4月6日(土)、7日(日)に恵比寿で開催！,https://news.yahoo.co.jp/articles/ee30660e8c687264d731ab89b9ae1032433644c4,3/16(土) 7:03
finders,FINDERS,四季の移ろいをメイクで表現ーイラストレーター凪の作品集「雨とほくろ」の出版記念展を開催,https://news.yahoo.co.jp/articles/0f31f8ace3147f694cdabbff46ca7673c5077459,3/16(土) 7:02
finders,FINDERS,国内初！不快な音を集めた音響XRイベント「不快ミュージアム by nwm×NTT」が開催,https://news.yahoo.co.jp/articles/4e0284b9d43712cba470dca7c7be4fce8af8a65d,3/15(金) 16:48
finders,FINDERS,未来のコマース戦略のヒントを探るマーケティングカンファレンス「DIGIDAY COMMERCE FORUM」が3月19日に開催,https://news.yahoo.co.jp/articles/7ab53490c778d4f9c1bb87a5ff4cecc201df87b1,3/15(金) 11:47
finders,FINDERS,鳥取県が映画「デューン 砂の惑星PART2」とコラボ！姉妹都市提携の調印式でアンバサダー・ミキがサンドボードで日本の“デューン”を激走！,https://news.yahoo.co.jp/articles/27dfad9452c090ce1969a819f5ee94e797db4aeb,3/15(金) 11:26
finders,FINDERS,年度内に35の商品化プロジェクトを遂行せよ！南青山より ALL FUKUI で臨む福井県の挑戦,https://news.yahoo.co.jp/articles/27ae09da210cdc52c264d618667756baa4b07cc5,3/14(木) 6:03
finders,FINDERS,キッズフリマ、東京音大の演奏会が中目黒で楽しめるローカルフェス『NAKAME GOOD LOCAL』3月16日に開催,https://news.yahoo.co.jp/articles/77e5d3c10ef7b24e8b9c6c49b792660d9ae80cfc,3/13(水) 20:55
finders,FINDERS,進化系花見？！東京駅で最大風速10m/sの桜吹雪を体験！「TOKYO 桜吹雪 STATION」,https://news.yahoo.co.jp/articles/d3fda816f8b552889c606c0cff5e72b390e3ce5a,3/13(水) 14:31
finders,FINDERS,いつもの公園に、野生動物が出現！XRライド型サファリパーク「TOKYO NIGHT SAFARI」が開催決定,https://news.yahoo.co.jp/articles/bdb7115ed3749f4f9fe883835956eb40323ca12e,3/13(水) 13:45
finders,FINDERS,関東初！「空飛ぶクルマ」のテストフィールドが茨城県つくば市にオープン,https://news.yahoo.co.jp/articles/6235a897c0dabcbbfb7ecb0e2afd37b06807b831,3/12(火) 8:02
finders,FINDERS,日本初！原宿の大型3Dビジョンにリアルタイムに映像制作と映像放映ができるサービスが開始,https://news.yahoo.co.jp/articles/3f13c4bf3e01690a18bc8600fddc0b25f275477b,3/12(火) 7:03
finders,FINDERS,"2026年春開業！収容客数2,000人規模のコンサートホールが渋谷に誕生",https://news.yahoo.co.jp/articles/12e1f198db3428d274e64060ce6c3d46fc128889,3/11(月) 11:28
finders,FINDERS,「HVEN(ヘイヴン)」〜“食・音楽・アート”を通じて新たなつながりを築く場が中目黒にOPEN,https://news.yahoo.co.jp/articles/2f67dda1d8b0e383d2d4e02f1f766665ff8214e7,3/11(月) 9:50
finders,FINDERS,現役女子体育大生が 「卓球バー rinQ」を新宿三丁目にオープン！,https://news.yahoo.co.jp/articles/9c24d838fdd8ebeda6164adf2bb6a61b1b40b189,3/10(日) 8:01
finders,FINDERS,高輪ゲートウェイ駅「まちびらき前年祭」が開催〜J-WAVEがラジオ公開生放送をO.A.,https://news.yahoo.co.jp/articles/32cd520acddb95bbf71568ddeba13f72bfc4629f,3/10(日) 7:03
finders,FINDERS,完売必至！最上級の目黒川お花見クルーズが予約受付を開始！！,https://news.yahoo.co.jp/articles/a0a7af6f2aa7f009b40f8f90514e7e952cb63778,3/9(土) 8:00
finders,FINDERS,星のや沖縄の「海風クルーズチェックイン」が今年も実施決定〜空港近くの港からのプライベートクルーズを満喫,https://news.yahoo.co.jp/articles/91a9303cdc49232dd5ed97ea057cacfa7248698d,3/9(土) 7:02
finders,FINDERS,「人体埋込型マイクロチップ」を体感？！VivoKey Japan がオフラインイベントを開催,https://news.yahoo.co.jp/articles/2bdb36819f888528b542bfcfa80183a6dcd3cba1,3/9(土) 6:02
finders,FINDERS,ポーランドを代表するアーティスト、ヤネック・シモンとアネタ・グジェシコフスカの来日展が開催,https://news.yahoo.co.jp/articles/27d4f5c957d003b9053533324ed9d400e55efc11,3/8(金) 7:07
finders,FINDERS,伊藤ふたば、野口啓代もゲストで登場！次世代型ボルダリングコンペ「いいちこSTEP」が開催,https://news.yahoo.co.jp/articles/adffb150e5a3c0e9a8ad658bfd2ca5fa121c045f,3/8(金) 7:00
finders,FINDERS,石川遼と開発した 世界初の Apple Vision Pro ゴルフアプリが登場！,https://news.yahoo.co.jp/articles/cc6cd3d9923bc053e765d09558a4e78900ed9660,3/8(金) 6:04
finders,FINDERS,日本最大級の国際的なアートの見本市「アートフェア東京」が東京国際フォーラムにて開催,https://news.yahoo.co.jp/articles/2642153eb164d3ee13ca8fa0509d85cb621a23f8,3/7(木) 11:45
finders,FINDERS,イサムノグチ、柳宗理の作品を紹介〜伊勢丹新宿店で「JAPANESE MODERN AND CONTEMPORARY」が開催,https://news.yahoo.co.jp/articles/232ccbd9deb97b327d9aacfa32b30dfd18e98eaa,3/7(木) 11:07
finders,FINDERS,銭湯特化型!?のデジタルサイネージ動画広告「ふろマド」が大阪市内の銭湯でサービス開始,https://news.yahoo.co.jp/articles/79dbc0b428d32f84ce6ed6e9519f4463f6450f7a,3/7(木) 7:04
finders,FINDERS,ハリウッドセレブも来日する世界最大級のカー・フェス「FUELFEST」が今年も開催決定！,https://news.yahoo.co.jp/articles/156263d718e7142f4c075879c6f17b56dfec7aa3,3/7(木) 7:02
finders,FINDERS,雨の夜道から身を守る！再帰反射素材がプリントされたリフレクティブアンブレラ,https://news.yahoo.co.jp/articles/1ab291d60e08aee06bbba7fab59ac00700c20faa,3/6(水) 7:07
finders,FINDERS,今夏、フィンランド発祥のスポーツ「モルック」の世界大会が日本初開催！2024モルック世界大会 in 函館,https://news.yahoo.co.jp/articles/b6b96d9ab2bd6db807eb9363ab218be3ce0c2900,3/6(水) 7:06
finders,FINDERS,日本人初のF1/フォーミュラEドライバーを目指す18歳の野田樹潤さんも登場！Teach For Japan×DHL「ガールズ エンパワーメントワークショップ」が開催！,https://news.yahoo.co.jp/articles/dcb886ddbd3d6fba01d78e1e79e2365c5627d9dd,3/6(水) 7:00
finders,FINDERS,総勢500名のインフルエンサーに直接アピールできるイベント「YELL! YELL! YELL!」の第二弾が開催決定,https://news.yahoo.co.jp/articles/52550a47f677cf378aa536dca679e96d36f993f4,3/5(火) 7:03
finders,FINDERS,東京のスタートアップ支援拠点を見える化！丸の内エリアで実証実験が開始,https://news.yahoo.co.jp/articles/01b667e3897d5995a5f2251c5eca427d2a0372ed,3/5(火) 7:03
finders,FINDERS,フォントワークスのデザイナーが手掛けた初の欧文書体「Yo One」の書体見本帖がリリース,https://news.yahoo.co.jp/articles/ca8b4779056d230bfcbbcafafd8856064c9da32a,3/4(月) 7:01
finders,FINDERS,WHAT CAFE、京都のアートシーンのエネルギーを伝える企画展「東 京都 展 The Echoes of East Kyoto」を開催,https://news.yahoo.co.jp/articles/8049d11351f38cb5158949115bf7fb6c9516823d,3/4(月) 7:01
finders,FINDERS,サウナ特化型の大博覧会「サ博2024」が渋谷で開催決定,https://news.yahoo.co.jp/articles/638e59610470ad6108026581e3a3a6aba1969359,3/3(日) 8:00
finders,FINDERS,小田原に愛犬と泊まれる 「いぬと海辺」が2024年3月にオープン,https://news.yahoo.co.jp/articles/f0d109792785889e0184db6d8776eeca60e4fc87,3/3(日) 8:00
finders,FINDERS,グリーンが主役のインテリアショップがOPEN 「植物との出会いと発見を提供」,https://news.yahoo.co.jp/articles/10a957f17e87bf14b66dc27b16dc8a1e22ee45ba,3/3(日) 7:03
finders,FINDERS,「Security Days Spring 2024」 3月に東京、大阪、名古屋の3都市で開催,https://news.yahoo.co.jp/articles/e303cc25372073ee79ad9ed670eb8877655f7ecf,3/2(土) 18:03
finders,FINDERS,親子で楽しむ野外無料ジャズ・イベント「JAZZ AUDITORIA 2024 in WATERRAS」,https://news.yahoo.co.jp/articles/d1bed97a2a960b06a81413985a53e465be8b09e7,3/2(土) 16:27
finders,FINDERS,国際女性デーに「Business Insider Japan」と「MASHING UP」がカンファレンスを開催,https://news.yahoo.co.jp/articles/bce712d505c11f54c6af662f40902839515f4c50,3/2(土) 16:10
finders,FINDERS,スイス発のオーディオブランドGENEVA、装いを新たにしたGENEVA TIME DIGITAL を発売開始,https://news.yahoo.co.jp/articles/0b79ba337770119496a00aab1abc65148e6beb21,3/1(金) 14:55
finders,FINDERS,世界中の文化遺産ファンを魅了するトルコ共和国、知られざるユネスコ世界遺産暫定リストに注目,https://news.yahoo.co.jp/articles/1665860c1c36277d60d966e66fd0e42e657a89d2,2/29(木) 16:09
finders,FINDERS,世界最大級フェスティバル「SXSW2024」日本の出展企業や出演アーティストは?!,https://news.yahoo.co.jp/articles/fda6fdcc0d8502a4223ba8ac52bb9e4d7627ae15,2/29(木) 14:23
finders,FINDERS,レプロエンタテインメンが芸能戦略PRの新サービス「あなたの宣伝係」の提供を開始,https://news.yahoo.co.jp/articles/858145a84270cd4db0da6623e26b024cb0f6faf2,2/29(木) 12:30
finders,FINDERS,話題の東京都庁プロジェクションマッピング「TOKYO Night ＆ Light」の仕掛人とは？,https://news.yahoo.co.jp/articles/73223b29e66439452be8067c619108f12fb0a1f5,2/29(木) 10:55
finders,FINDERS,ダンスミュージック界のスーパープロデューサーDIPLOが約6年ぶりの来日、ZEROTOKYOで圧倒的なパフォーマンスを披露,https://news.yahoo.co.jp/articles/e1f3eb264f1f3817782175357410900b7c5f73a9,2/29(木) 10:01
finders,FINDERS,Google Cloud、生成AI関連の企業向けソリューションについて紹介する「Generative AI Summit Tokyo '24」を開催,https://news.yahoo.co.jp/articles/ab1921c57340dea89ad1a354f84aa5d3d689ca45,2/29(木) 7:05
finders,FINDERS,次世代へとつなげていく想いを込めて「東京レインボープライド2024」開催＆『PRIDE 30th』刊行,https://news.yahoo.co.jp/articles/207ab6e4169f59a0ea07c10a4c27d28fc6298e7e,2/28(水) 8:00
finders,FINDERS,抹茶ツーリズム＆古民家カフェプロジェクトが始動〜本物のMATCHAを世界へ発信〜,https://news.yahoo.co.jp/articles/ca5e5feb85acf05ecf697928a84a7e912a061695,2/28(水) 7:31
finders,FINDERS,世界を虜にした日本人パフォーマー達が集結！「グレイティスト・ベガス・ショー」,https://news.yahoo.co.jp/articles/074fce29b350014f17e16bf8e3c0798d243c338b,2/28(水) 7:04
finders,FINDERS,キン・シオタニが歩いて見つけた 「としま区百景 Photo＋Graphic展」,https://news.yahoo.co.jp/articles/5d15225ddb1011ff605ca02c3845091ae3c1b6fa,2/27(火) 11:01
finders,FINDERS,世界同時消灯イベントに合わせ「EcoBright Night」を開催〜東京マリオットホテル,https://news.yahoo.co.jp/articles/c1fe6d6ca7806d89331c5eaf41b21e5ef56161a0,2/27(火) 10:01
finders,FINDERS,カレー好き垂涎！18店舗が集結「六本木ヒルズ カレーグランプリ2024」が開催,https://news.yahoo.co.jp/articles/c538bbd83c9cf062e9eac40f804cdefa5fa28580,2/27(火) 7:03
finders,FINDERS,都心高級マンション限定のポスティングマガジン「YO FF（ヨフ）」が2月23日に創刊,https://news.yahoo.co.jp/articles/9f61070e0db179f175e23d35c84fa682ee52750b,2/26(月) 10:00
finders,FINDERS,坂本龍一の演奏を自動演奏で再現「坂本龍一のピアノ展」が開催,https://news.yahoo.co.jp/articles/d90dd890c4b18d68f3b7365e8ee592d086720e2c,2/26(月) 8:03
finders,FINDERS,「JAPAN FEMTECH SUMMIT 2024」が開催、4万人以上のフェムテックアンバサダーが全国から集結,https://news.yahoo.co.jp/articles/31bf00808ef53b27082109bb61aef34187b8552e,2/26(月) 8:03
finders,FINDERS,日本発のビートボックスイベント「BEATCITY JAPAN」が今年も始動！,https://news.yahoo.co.jp/articles/b1696e399802240d8d64056a55334cdee01dda12,2/25(日) 12:00
finders,FINDERS,虎ノ門ヒルズでワインイベント「Toranomon Hills WINE & DINE」が初開催,https://news.yahoo.co.jp/articles/439715548e8fc547278b876a38c7cfa70a0fd4c7,2/25(日) 10:02
finders,FINDERS,2024年夏に沖縄県・古宇利島に「YAWN YARD Kouri Island」がOPEN！,https://news.yahoo.co.jp/articles/ab97d10e89e37c0e437b800f19974260ef9b0015,2/25(日) 8:01
finders,FINDERS,ルイ・ヴィトン マーク・レッキーによる個展を2月22日（木）より開催中,https://news.yahoo.co.jp/articles/8863a793b39d2f10e015180af4775d58cd0cf6b6,2/24(土) 16:50
finders,FINDERS,ニューヨークで開催される世界最大の日本食フェス〜2024年はなんと32回の開催が決定！！,https://news.yahoo.co.jp/articles/6ac68cad8d9ab5c3c32b35ef41f385f0a04f5501,2/24(土) 10:01
finders,FINDERS,東京メトロ eスポーツ大会「第1回 TOKYO METRO CUP STREET FIGHTER 6」を主催,https://news.yahoo.co.jp/articles/65531438662cb1444a1b8f12268917ffcb2895f7,2/24(土) 8:02
finders,FINDERS,「ジョージ ホイニンゲン=ヒューン写真展」日本初の個展が銀座シャネル・ネクサス・ホールで開催中,https://news.yahoo.co.jp/articles/5eb72d2d4e90ba52270fdf0f5285131e49339919,2/23(金) 14:04
finders,FINDERS,デジタルスプレー技術を用いた「DIGITAL LEGAL WALL」2月24〜25日、成田空港の巨大ビジョンにてライブペイントを実施。アーティストDRAGON76とコラボレーション,https://news.yahoo.co.jp/articles/38f01d4ef2ec6b0cdb13d4b1ef1f96ae4d056d4a,2/23(金) 13:27
finders,FINDERS,日本一の学生食堂「食堂コマニ」が 提供する最高のおもてなし！ ゲストに本当に喜ばれるケータリング,https://news.yahoo.co.jp/articles/4906fa96b643f9520b62cdbc7037ed503817b0b8,2/22(木) 17:37
finders,FINDERS,そろそろ春到来。ぶらりとお出かけにおススメ！三連休に東京都内で開催されるアートイベント3選,https://news.yahoo.co.jp/articles/c1cc3661d6d19db104e3da08652c88f954ba06d8,2/21(水) 18:24
finders,FINDERS,小林武史が総合プロデューサーを務める 「百年後芸術祭 ―内房総アートフェス―」が開催,https://news.yahoo.co.jp/articles/3117be546c043bef698e64d10deb2b3261c1517e,2/21(水) 11:59
finders,FINDERS,愛用者の朝日奈央、潮田玲子ら豪華ゲストが登場！美容師などから絶大な支持を受ける美髪コーム「LOVECHROME（ラブクロム）」が新作を発表！,https://news.yahoo.co.jp/articles/6a00a03a9bc201d88e43ed889ac1d068a70300b4,2/20(火) 21:27
finders,FINDERS,35歳以下の若手料理人を発掘する「RED U-35 2023」 女性料理人が初のグランプリに輝く！,https://news.yahoo.co.jp/articles/52103e90b21b73abca7590de1921f183478cbdeb,2/19(月) 20:29
finders,FINDERS,「よなよなエールの超宴」が北軽井沢で5年ぶりに開催決定,https://news.yahoo.co.jp/articles/feb35b54d671e29c4591df92533940acbdff5ccf,2/19(月) 12:49
finders,FINDERS,スパ・ジム・コワーキングスペースの3つを兼ね備えた複合施設が2024年春、大手町にオープン！,https://news.yahoo.co.jp/articles/33c7a1e6cf53dd792852bb70f543e72bb7da67ae,2/18(日) 12:43
finders,FINDERS,自分の限界を超えろ！ 急斜面のスキージャンプ台を駆け上がる400mレース「Red Bull 400」が 参加者を募集中！,https://news.yahoo.co.jp/articles/a2718701f4c9c05a8c7a2dd33198270cde942070,2/17(土) 16:10
finders,FINDERS,予算は度外視？！ 各社が意地をかけてド派手な演出を披露！ ProLight&ProVisual2024イベントレポート,https://news.yahoo.co.jp/articles/62c3a0d5b14d5b047c4a83420de95790eab0c9db,2/17(土) 13:57
finders,FINDERS,カメラと写真映像のワールドプレミアショー「CP+2024（シーピープラス）」が開催,https://news.yahoo.co.jp/articles/2da0f3018b200c0c6e57626bdccd423be629c778,2/16(金) 13:42
finders,FINDERS,日本最大級のヨガ&ライフスタイルイベント 「第11回 オーガニックライフTOKYO」が開催,https://news.yahoo.co.jp/articles/7aa89bbfb1adbbc282514f55d16d7ff2b98eb1bb,2/15(木) 23:48
finders,FINDERS,誰もが宇宙から撮影できる時代へ！ 人工衛星を用いた「宇宙撮影体験」 参加者を募集中,https://news.yahoo.co.jp/articles/284849c7f8136b1805cacf44111ba074997b21ac,2/15(木) 21:12
finders,FINDERS,「ビジネスチャンスが一転ピンチに？！」 展示会で見て「イメージが下がってしまったことがある」 と17.8％が回答。,https://news.yahoo.co.jp/articles/359ee267903785b1f06d3d171d84ff7dc667ac3f,2/14(水) 14:36
finders,FINDERS,COTOH SOLO EXHIBITIO 「CHARACTER I」 の開催が決定,https://news.yahoo.co.jp/articles/aa9cb339e5bd64d4225401ac62b062ec75935ad6,2/11(日) 8:01
finders,FINDERS,AR三兄弟の川田十夢がナビゲート 学生生活に活かせるSNSの活用法をnoteプロデューサー・徳力基彦氏が解説！,https://news.yahoo.co.jp/articles/06e3fa92e14141b42a944b4e7b63668d81f826cc,2/10(土) 20:03
finders,FINDERS,そんなランキングなんてアリ?！ 楽天トラベル「2024年 全国の宿 自慢の看板猫ランキング」を発表,https://news.yahoo.co.jp/articles/a02123bdf3f497f8d10f6f1a9889e903991b227c,2/9(金) 12:10
finders,FINDERS,もうすぐバレンタインデー！季節の催し事は絶好のチャンス！？2024年のユニークなバレンタインプロモーション3選,https://news.yahoo.co.jp/articles/daad82cb791fe433b093cf0b2ab0493c42e57a5e,2/9(金) 10:01
finders,FINDERS,音楽業界を支える「サウンドハウス」は、インターネット黎明期からのPA音響機器通販の先駆者。 スタジオやホール機材も充実、イベント業界にとっても強い味方！,https://news.yahoo.co.jp/articles/53a7f9f965079104fe4e5ac69b830c20ba67666d,2/8(木) 14:31
finders,FINDERS,渋谷PARCO、冬の夜空を彩るAR花火イベント「MIRAI HANABI in SHIBUYA PARCO」を初開催,https://news.yahoo.co.jp/articles/be6cb1d9c9113a55e3a6651ad7e1be1721247892,2/7(水) 17:57
finders,FINDERS,ビジネスエンジニアリング（B-EN-G） BE:YOND FOR LIFE SCIENCE　〜ヘルスケアの未来をともに創る〜 1日限りのリアルイベントを開催,https://news.yahoo.co.jp/articles/80a476bc1ab8fc69e36f061e423062b09dfeb051,2/6(火) 21:07
finders,FINDERS,ゲストの9割は外国人！まるで海外のリゾートにいるかのよう！？なぜ「ニセコ」は世界が注目するスノーリゾートになったのか？,https://news.yahoo.co.jp/articles/d23220f24d6a6a241c023a98db8dc0fb8f760849,2/6(火) 13:33
finders,FINDERS,日本最大級！キャンピングカーの祭典『ジャパンキャンピングカーショー2024』が開催！最新・人気モデルのキャンピングカーが350台以上が集結！,https://news.yahoo.co.jp/articles/0492a43412f745af7195b5ade73f3defad8441cb,2/3(土) 14:27
finders,FINDERS,舞台演出に関わるプロのための照明・映像の専門展示会 ProLight&ProVisual2024 が開催,https://news.yahoo.co.jp/articles/86f57d835f926e30e490f8f11fe22124697cda87,2/2(金) 18:56
