media_en,title_articles,link_articles,date_original
amami,鹿児島県・龍郷町の久場久寿クに日本道路協会から功労者表彰、県大島支庁で伝達式　県道沿い定期的に美化,https://news.yahoo.co.jp/articles/6619538fef0f8ff7503ce9c038f53168167b42ca,8/31(木) 11:40
amami,鹿児島県　名瀬職安・来春高卒職業紹介　地元求人数28・3％増加、就職希望者13・6％減の19人　求人倍率6倍の高さ,https://news.yahoo.co.jp/articles/6333f4049ff6295a7884db78f55a8bb6cca3e893,8/31(木) 11:40
amami,鹿児島県・龍郷町　自然観察の森にオオトラツグミ　春生まれの幼鳥か,https://news.yahoo.co.jp/articles/ca3618b31199bcb3f41d1dc134cc338366ec90bf,8/31(木) 11:40
amami,鹿児島県・天城町でB＆Gインストラクター養成研修スタート　全国37自治体から38人、33日間,https://news.yahoo.co.jp/articles/12cb018a1823a3a7495a374f1beb28f07d303d20,8/31(木) 11:40
amami,かごしま国体選手団結団式 「県代表の誇りを胸に」地元国体での活躍誓う,https://news.yahoo.co.jp/articles/db96920cea4d0631435e59f44066375d8543ba13,8/30(水) 11:40
amami,鹿児島県・徳之島署管内ネットワーク会議　「被害者支援条例」不可欠　見舞金制度など「全国同水準の救済に」,https://news.yahoo.co.jp/articles/591dc007ffc520afd32f8a46d4319c607143dbac,8/30(水) 11:40
amami,4年ぶり「上嘉鉄盆おどり」　やぐら囲み宴に熱気　浴衣や法被姿、踊りの輪広がる,https://news.yahoo.co.jp/articles/b42490504822fbff0b31d88ffbbce429a49f0173,8/30(水) 11:40
amami,鹿児島県・与論町長選告示　新人同士の一騎打ち　子育て支援や港湾整備など争点,https://news.yahoo.co.jp/articles/97da41ac21503d9fc29b8678ce7deb9c7a2ad670,8/30(水) 11:40
amami,鹿児島県・奄美市　各地で旧盆入り 花やちょうちん携え先祖迎える,https://news.yahoo.co.jp/articles/34c09faf4db397dc335842a96c5fbd1777b62840,8/29(火) 11:40
amami,鹿児島県・龍郷町でまちづくりシンポ　住民主体「第2の自治体」提案　過疎地生き残るために事例紹介,https://news.yahoo.co.jp/articles/8ca917dd01542ce9dc113eeb365d88d6abdb8772,8/29(火) 11:40
amami,立候補予定者2人が政策発表　鹿児島県・与論町長選　町の未来へ意見交わす,https://news.yahoo.co.jp/articles/7b32e529c6630a22e9fc99d0c8dee0d1fbfdbcc2,8/29(火) 11:40
amami,鹿児島県・徳之島町が首都圏でインターンシップ開催　中高生、成長の夏を体験,https://news.yahoo.co.jp/articles/4fffc1b76874647aa74b0e387c92dc80ea6a78ed,8/29(火) 11:40
amami,鹿児島県・奄美でも募金　24時間テレビ、看護福祉専門学校学生ら呼び掛け、善意募る,https://news.yahoo.co.jp/articles/6d93476d087ef13ee187a2247f54832b4b64dad8,8/28(月) 11:40
amami,鹿児島県・宇検村、防災イベントを初開催　災害に強い村づくりへ、楽しみながら知識深める,https://news.yahoo.co.jp/articles/6ebcf4c1d3461b06a2a240dc0903ddaddfb49af7,8/28(月) 11:40
amami,鹿児島県・大和村の青年団主催「ひらとみ祭り」にぎわう、ゼロから作った新しい祭り,https://news.yahoo.co.jp/articles/1be232491f32fa53dea3f78e6cba13e4cdefea6d,8/28(月) 11:40
amami,鹿児島県・徳之島町北部振興へハーレー舟大会＆東天城祭り、2本立てで復活,https://news.yahoo.co.jp/articles/e5b90f6f974f6e835ee5f86c0ebefcfb68804ccf,8/28(月) 11:40
amami,鹿児島県　日本シンクロの母・井村氏　伊仙町で講演　「成功は忘れ、悔しさと後悔で次へ」　日々1ミリの努力大事,https://news.yahoo.co.jp/articles/6f7f1089efe5677d51dbb3f0153e064ff1a1fa9d,8/27(日) 11:40
amami,鹿児島県　対馬丸事件の犠牲者悼む　宇検村で慰霊祭　沖縄県副知事も参列,https://news.yahoo.co.jp/articles/ef68211fb86d4b8f773e3ee3e4cc822720d7205d,8/27(日) 11:40
amami,鹿児島県　健康体験交流施設を調査　民間企業と連携、再生目指す　島内外8社が現状確認　奄美市,https://news.yahoo.co.jp/articles/2ebad712da6636734cbfd1a7abcb80611b7c97fd,8/27(日) 11:40
amami,鹿児島県　名瀬の公園でソテツ対策　守る姿勢に期待　外来カイガラムシ被害,https://news.yahoo.co.jp/articles/cb447b9115c0e0ee556e6796ba80566bf4124a71,8/27(日) 11:40
amami,鹿児島県・特定外来種シロアゴガエル駆除作業に大学生ボランティア徳之島入り、採取作業に汗,https://news.yahoo.co.jp/articles/912481ef0395ccf43e29eb00e5d9d5b044fb6011,8/26(土) 11:40
amami,鹿児島県・奄美市名瀬で観光マスタープラン策定委員会、一体的な観光振興目指し、今年度末策定に向け議論スタート2024年度からの10年計画,https://news.yahoo.co.jp/articles/64712a3ca2f80746495c719c0d292075a160d6bf,8/26(土) 11:40
amami,鹿児島県・奄美大島で今年も「島キャン」離島で将来の自分探し、都会の学生が就業体験　働き方「見つけたい」,https://news.yahoo.co.jp/articles/ad3eb1204d8b1dee655be10b7bfcde0a5eac61d4,8/26(土) 11:40
amami,鹿児島県知事定例会見　奄振概算要求「充実した内容」、生活物資備蓄「調査をしたい」、夜間中学校　25年4月開校目指す,https://news.yahoo.co.jp/articles/efe30e4db101b1c1d4c348c8bc301ff63915b3bd,8/26(土) 11:40
amami,沖縄と鹿児島県奄美　交流拡大連携協定　離島割引、沖縄便へ拡大　農林水産物輸送円滑化も,https://news.yahoo.co.jp/articles/b2cbf71856114b01c2b848361eb60483124329f9,8/25(金) 11:40
amami,鹿児島県　離島甲子園野球教室　大会のその先へ　元プロ選手が技術直伝,https://news.yahoo.co.jp/articles/4a373f4f8c0067a6114c2011a64cad3a72079b30,8/25(金) 11:40
amami,壱岐市選抜10年ぶりⅤ　投手力と堅守で最少得点差守る　離島甲子園　石垣島が準Ⅴ,https://news.yahoo.co.jp/articles/ffe92436a31577bfbb5f44ca9f6fa9850ad3d441,8/25(金) 11:40
amami,24年度予算概算要求　鹿児島県・奄振約6・6％増213億6800万円　交付金20％増　住民の航空運賃軽減に沖縄路線追加,https://news.yahoo.co.jp/articles/b81e6b82b20aba70907daeaa364d9f3dc42ebaf9,8/25(金) 11:40
amami,鹿児島県　短編映画『つむぎのうた』に感動　「徳之島の魅力広めたい…」　同島出身高校生（当時）が監督・主演　次回作舞台あいさつも,https://news.yahoo.co.jp/articles/252918d03b864e79849f24650ca8918c8fc4a576,8/24(木) 11:41
amami,鹿児島県　4年ぶりに「ショチョガマ」復活へ　10日に設営作業、ボランティア募集　龍郷町秋名・幾里のアラセツ行事,https://news.yahoo.co.jp/articles/f99cd598e61de238877f39d4e748ba2ebc4a05f8,8/24(木) 11:40
amami,鹿児島県　大高オープンハイスクール　在校生自ら母校の魅力紹介　中学生が体験入学,https://news.yahoo.co.jp/articles/25b4dc62a983c4ccc2cf8110c54cde91d69cfb5d,8/24(木) 11:40
amami,鹿児島県　KIKAI・BASEが開所　仕事や観光、憩いで新拠点　旧校舎再生　喜界町荒木,https://news.yahoo.co.jp/articles/0a28387e41897f6fd3c4e96d1a6d90d0204b1069,8/24(木) 11:40
amami,珍鳥「ソリハシセイタカシギ」が一挙5羽も観察　ラッキーな探鳥会に　鹿児島県・徳之島町「諸田池」,https://news.yahoo.co.jp/articles/2a57cebb2ef8a9705a7ab77251e486c4fa189f55,8/23(水) 11:41
amami,審判として大会支える　急逝した和田さんから声掛けられ「直接感謝伝えたかった」　鹿児島県・徳之島町出身、東さん（東京都在住）　離島甲子園,https://news.yahoo.co.jp/articles/a19d8cf77711ba8c82c3ef9aa5439098762c768e,8/23(水) 11:41
amami,久原奈子さん（喜界小6年）民謡日本一　民謡民舞全国大会　小学校4～6年の部で　鹿児島県奄美勢奮闘、優秀賞に5人,https://news.yahoo.co.jp/articles/b46295f2efed5415f80cadb013a2e3619e9c5325,8/23(水) 11:40
amami,鹿児島県・徳之島町亀徳4年ぶり「ネンケ」復活,https://news.yahoo.co.jp/articles/8d9d2d62532aec7d4233585ca1996a70b33c640f,8/22(火) 12:17
amami,鹿児島県・奄美群島でイセエビ解禁　初セリ、密漁横行に危機感も　アオ価格は平年並み,https://news.yahoo.co.jp/articles/29928c86cda0dd787d123fcbe5e24cb0a613aa4d,8/22(火) 11:40
amami,鹿児島市でふるさと物産展、奄美からも出品「宝箱」に加えてもらえたら,https://news.yahoo.co.jp/articles/48603294aec7c3a42dfb7f780b5bc1fb7f286220,8/22(火) 11:40
amami,鹿児島県・奄美地区聴覚障害者協会　創立50周年記念祝賀会　手話が通じる社会目指して,https://news.yahoo.co.jp/articles/e11fa6d8be18ea402066c55020c158af4869791a,8/22(火) 11:40
amami,鹿児島県・離島甲子園が開幕、全9都県から25チーム出場　開会式で入場行進　奄美群島から5チーム、初優勝目指す,https://news.yahoo.co.jp/articles/c71e2c12091805cbf2560f271f786808d47f9f75,8/22(火) 11:40
