media_en,media_jp,title_articles,link_articles,date_original
ybc,YBC山形放送,【土砂崩れ】鶴岡市の山あいで長さ５０メートルに渡り道路ふさぐ　被害は確認されず・山形,https://news.yahoo.co.jp/articles/31db15dc2cd7931f4777e3ba8cde2631e171dc14,5/17(金) 13:32
ybc,YBC山形放送,【強風】庄内中心に街路樹倒れるなど被害・山形,https://news.yahoo.co.jp/articles/23bc4cc4672bcdafb9702210fbf887b1b87918b0,5/17(金) 13:21
ybc,YBC山形放送,山形・鶴岡市の山あいで土砂崩れ　現場付近の道路通行止め,https://news.yahoo.co.jp/articles/6e5ab2bbc97da7ebe32e9b7557e3100c66d2a225,5/17(金) 7:30
ybc,YBC山形放送,「無惨な茶色い焼け跡…山火事は怖いもの」　南陽市の山林火災現場を吉村知事がヘリで視察,https://news.yahoo.co.jp/articles/6fb596a6a705646b4c8e673520ccfd2104ed3e82,5/16(木) 18:42
ybc,YBC山形放送,「最初にどこを消火するか把握が大変」　南陽市の山火事　鎮圧までの消火活動を陸自隊員が振り返る,https://news.yahoo.co.jp/articles/1c82dd210cd592ac03d505388f815682934183c3,5/16(木) 18:36
ybc,YBC山形放送,遠隔で診療する車両を中山間地域で本格運用　酒田市の日本海総合病院が始める,https://news.yahoo.co.jp/articles/201c895f436a5cf07b8d848b5cdab04e150c6f18,5/16(木) 18:22
ybc,YBC山形放送,鶴岡市の山に山菜採りに入り行方不明の70代女性　無事発見　「道に迷った」,https://news.yahoo.co.jp/articles/9efc9be75a9683252a034e2991355899d9f44a47,5/16(木) 18:14
ybc,YBC山形放送,音楽に合わせて水中で体動かす　山形市の幼稚園でプール開き　園児たちが元気よく,https://news.yahoo.co.jp/articles/12ae4731e19ea4e7aa9ce1bb20dc3b3bf89e5746,5/16(木) 18:10
ybc,YBC山形放送,ことし開学した新庄市の東北農林専門職大学で知事と学生が田植え　「日本の農業界を背負って」,https://news.yahoo.co.jp/articles/910df0e972dd23aedcbcb25140b74a933e541c24,5/16(木) 16:08
ybc,YBC山形放送,住宅屋根の塗装作業中に転落　74歳の男性が意識不明の重体　山形・村山市,https://news.yahoo.co.jp/articles/d408412bac731cf6f63c3f802822eae420266b71,5/16(木) 12:09
ybc,YBC山形放送,山菜採りに行った７０代女性が行方不明　山形県内で山岳遭難相次ぐ,https://news.yahoo.co.jp/articles/6d49c79fe67a1ddc649e641728a169349c77e721,5/16(木) 12:06
ybc,YBC山形放送,長井市が固定資産税485万円あまりを誤徴収　「担当者が十分に把握していなかった」,https://news.yahoo.co.jp/articles/89fb8026ffd346aaf7491e24f11d808a817bb5b3,5/15(水) 18:08
ybc,YBC山形放送,車購入時の値引き額の一部をコインに　地域経済の活性化目指し山形市の自動車販売会社が運用,https://news.yahoo.co.jp/articles/bcab27b633fe62c1cd7f48dc9dcaac43c93804b5,5/15(水) 17:46
ybc,YBC山形放送,梅雨の時期を前に訓練　最上川の堤防が決壊したとの想定　情報伝達や排水設備の操作手順確認,https://news.yahoo.co.jp/articles/91d6190326341421161d55efe7c3c5265ded7b30,5/15(水) 17:25
ybc,YBC山形放送,山形駅前の飲食店の男性店主が集団暴行で死亡　加害者3人に計3300万円の慰謝料の支払い命じる,https://news.yahoo.co.jp/articles/9d302b581c77cc4b54565c54d1d90c72c3d92724,5/15(水) 17:04
ybc,YBC山形放送,ニラの主力ブランド「達者de菜」が全国に　真室川町で出荷式　販売額10億円目指す,https://news.yahoo.co.jp/articles/390497695169d1815886581abc05230459e0a113,5/15(水) 16:17
ybc,YBC山形放送,出火原因や被害状況は　山形・南陽市の大規模山林火災の実況見分開始,https://news.yahoo.co.jp/articles/ac588070b15b2fb5defd73a7bf7b506c53455444,5/15(水) 12:36
ybc,YBC山形放送,県が整備検討の屋内スケート場　酒田市が庄内空港周辺への整備を要望,https://news.yahoo.co.jp/articles/bb2ec605dfdb2e564ff68e70d864232569729301,5/15(水) 12:29
ybc,YBC山形放送,山形銀行の昨年度決算「増収減益」　有価証券売却の損失で利益減少　減益は4年ぶり,https://news.yahoo.co.jp/articles/b2c5c77a1ca579fc518c86800437c81e01aa7196,5/14(火) 18:34
ybc,YBC山形放送,きらやか銀行の昨年度決算　過去最大244億円の赤字　取引先の破綻に備えた「与信関係費用」ふくらむ,https://news.yahoo.co.jp/articles/088f8797a6baa3a28c6d38bb32781015ff3ece4a,5/14(火) 18:20
ybc,YBC山形放送,山形市の野草園で60センチほどのクマ1頭目撃　1週間臨時休園に,https://news.yahoo.co.jp/articles/c9338ffaeaf22b5ad80e608a9089e096492ffde9,5/14(火) 17:44
ybc,YBC山形放送,【続報】酒田市で相次ぐ火事　会社事務所全焼の現場から油の成分検出　放火視野に捜査　不審者情報も,https://news.yahoo.co.jp/articles/d5210fbe5d737190f77fd7cb56192101cdbb2f48,5/14(火) 17:30
ybc,YBC山形放送,山形県内の林野火災件数が去年の2倍以上　「山火事防止キャラバン」で注意呼びかけ,https://news.yahoo.co.jp/articles/2652565572c5e28bb0bf394dbc14aa1f0b166e90,5/14(火) 17:22
ybc,YBC山形放送,荘内銀行の昨年度決算は「減収減益」　有価証券の配当金など減少が大きな要因,https://news.yahoo.co.jp/articles/03313e07aea800e98a9777412dd76cc565b664e5,5/14(火) 17:18
ybc,YBC山形放送,サクランボの「双子果」が増加　去年夏の猛暑の影響　キャラバンで摘果呼びかけ,https://news.yahoo.co.jp/articles/c460722599e689ba3e395af2b108e70b6708187f,5/14(火) 17:06
ybc,YBC山形放送,「再犯の恐れがある」…女性に抱きつくなどしたとされる山形市消防本部の元消防士に懲役2年6か月求刑,https://news.yahoo.co.jp/articles/9e49a6b40a7a7f6f1452bd80ef2789a024a761e8,5/14(火) 12:30
ybc,YBC山形放送,消火活動に延べ1600人　9日目にようやく鎮火となった南陽市の山火事　農作物などの被害確認へ,https://news.yahoo.co.jp/articles/f2a35909acde7dd4817250e97d77a4c9c17143d2,5/13(月) 18:18
ybc,YBC山形放送,酒田市で相次ぐ火事　2週間で6件　いずれも火の気のない場所から出火　市民に不安広がる,https://news.yahoo.co.jp/articles/a400c798a87a3002014148f06f62f202b287249d,5/13(月) 18:18
ybc,YBC山形放送,「歓びから断ち切られた生活」　「シベリア抑留」テーマにした企画展　過酷な体験と心情表現,https://news.yahoo.co.jp/articles/6551153d4b6c61ea1884034ffa159a803eaf5973,5/13(月) 17:40
ybc,YBC山形放送,山形県議会の政務活動費返還訴訟　県が上告せず控訴審の判決が確定　県議に返還を求める方針,https://news.yahoo.co.jp/articles/3598427c72476d1d48b0ecfb0daa00b0eac20839,5/13(月) 17:08
ybc,YBC山形放送,酒田市の「山居バル」にぎわう　市内中心部から新井田川沿いに飲食ブース　屋形船も,https://news.yahoo.co.jp/articles/6e788b2e105d619fcda5d3c74b8a97a41f7ba2bd,5/13(月) 17:04
ybc,YBC山形放送,南陽市の大規模な山林火災　発生から9日目で鎮火　市対策本部が被害状況を報告,https://news.yahoo.co.jp/articles/05ea69ad95a95677935e374b96f11e1ad94618c2,5/13(月) 12:28
ybc,YBC山形放送,未明の火事・酒田で住宅など計４棟焼け、住民１人が病院搬送,https://news.yahoo.co.jp/articles/a36b6853d19bf9b239c793f6094da9276d70a9ab,5/13(月) 10:32
ybc,YBC山形放送,山形・米沢市の白布峠に山菜採りに入り遭難した茨城の70代男性　無事発見,https://news.yahoo.co.jp/articles/4f6b4a0aac71556bddabd8cb799a7e33fd0c1c32,5/12(日) 19:07
ybc,YBC山形放送,山形・南陽の林野火災　発生から9日目で鎮火,https://news.yahoo.co.jp/articles/f4e0d290b57c93021b309cce332428b072737ef3,5/12(日) 19:04
ybc,YBC山形放送,山形県囲碁大会決勝　太田尚吾六段（山形市）が優勝,https://news.yahoo.co.jp/articles/b3d7301bbedb729883aabf0652b2658e335d1b5d,5/12(日) 18:02
ybc,YBC山形放送,【遭難相次ぐ】茨城県の70代男性が行方不明・白布峠　広島市の男性の捜索は打ち切り・西吾妻山　山形,https://news.yahoo.co.jp/articles/2e01a387581c417aef0235f0d628d0bb618ff542,5/12(日) 17:41
ybc,YBC山形放送,酒田港に初の国内定期コンテナ航路開設　博多・門司港と結ぶ「フィーダー（支線）航路」・山形,https://news.yahoo.co.jp/articles/58645b049ebddca1726cd9c84de6f7698be8bea1,5/12(日) 12:49
ybc,YBC山形放送,発生８日目、６か所で煙が確認され消火活動　山形・南陽市の山林火災,https://news.yahoo.co.jp/articles/008a6aa38d20869b7d6550e3560cff49f4cbbebf,5/11(土) 18:21
ybc,YBC山形放送,出火原因の特定に至らず　山形・酒田市中心部の空き家火事,https://news.yahoo.co.jp/articles/82948d0f9046e01d7dae8960c70766a78bebb536,5/11(土) 18:15
ybc,YBC山形放送,「最上川200キロを歩く」始まる　山形・米沢市の小学生が元気に出発,https://news.yahoo.co.jp/articles/d22088c7bb7d52c2446746692056abdad5ff6d44,5/11(土) 18:09
ybc,YBC山形放送,県内アマチュア囲碁界トップを目指し　山形県囲碁大会始まる,https://news.yahoo.co.jp/articles/9496f123a29395e006d45938e137044cb603ab33,5/11(土) 17:54
ybc,YBC山形放送,山形・酒田市で空き家などが焼ける火事　現場近くでは9日前にも,https://news.yahoo.co.jp/articles/0c51e5fb025b4a19c3a47166386d91c4f519d716,5/11(土) 12:11
ybc,YBC山形放送,24時間テレビ　パラスポーツ「ボッチャ」の体験キットを山形・鶴岡市の中学校に寄贈,https://news.yahoo.co.jp/articles/86d848072416b85d32e84263596fb2d332f3c623,5/11(土) 12:03
ybc,YBC山形放送,発生から7日目　南陽市の山火事　9カ所で白い煙上がる　地上からの消火活動やドローンで監視,https://news.yahoo.co.jp/articles/1868013b2d6dc11407474dd281ce7586e392c50e,5/10(金) 18:49
ybc,YBC山形放送,山形県内で相次ぐ山火事　新緑までの間の枯れ葉や下草が燃えやすい時期　気温の上昇も一因,https://news.yahoo.co.jp/articles/73c446760eb88564069cd53e47c765aea08fb5cf,5/10(金) 18:39
ybc,YBC山形放送,老舗「岩渕茶舗」後継者不足で事業譲渡　山形市七日町から姿を消す　長谷堂の古民家で新店舗,https://news.yahoo.co.jp/articles/1522fd6e4a130174504fd90ab8e35b1b8d87b11a,5/10(金) 18:23
ybc,YBC山形放送,結婚式を挙げられなかった夫婦にプレゼントする「夢婚」　新庄市の夫婦「みんないい思い出に」,https://news.yahoo.co.jp/articles/e6fe86bdef13605d22bc284564c01f1542dde834,5/10(金) 18:18
ybc,YBC山形放送,山形市の西蔵王高原でウシの放牧始まる　新鮮な牧草たくさん食べ丈夫な体に,https://news.yahoo.co.jp/articles/fcc4f6507d70ed21a4a4f9613d0f61d0b75e9e6c,5/10(金) 18:07
