media_en,media_jp,title_articles,date_original
reut,ロイター,カナダ西海岸の港湾閉鎖続く、労使交渉に進展の兆しなく,11/6(水) 8:53
reut,ロイター,米裁判所、共和党の不在者投票阻止要求退ける　ジョージア州巡り,11/6(水) 8:51
reut,ロイター,英政府、鳥インフルの警戒レベルを「高」に引き上げ,11/6(水) 8:48
reut,ロイター,ＣＯＰ２９、バイデン氏ら主要国首脳が相次ぎ欠席へ,11/6(水) 8:19
reut,ロイター,米投票者の48％がハリス氏に好意的、トランプ氏44％　出口調査,11/6(水) 8:17
reut,ロイター,カナダ中銀、従来の引き締め的金利必要ないと判断＝議事要旨,11/6(水) 8:07
reut,ロイター,スペイン洪水、被災地企業の被害額は100億ユーロ超か,11/6(水) 8:04
reut,ロイター,アップル、ＥＵ制裁金に直面へ　デジタル市場法違反で＝関係筋,11/6(水) 8:00
reut,ロイター,米メキシコ湾の石油・ガス生産停止、熱帯暴風雨接近で,11/6(水) 7:54
reut,ロイター,3000人の不法移民、メキシコから米国目指す　米大統領選の争点,11/6(水) 7:49
reut,ロイター,ＮＹ市場サマリー（5日）ドル下落、利回りまちまち・株反発　米大統領選にらみ,11/6(水) 7:32
reut,ロイター,サウジの第3四半期財政収支、80億ドルの赤字 原油安で,11/6(水) 7:22
reut,ロイター,アマゾンの週5日オフィス勤務、「退職勧告」ではない＝ＣＥＯ,11/6(水) 7:14
reut,ロイター,映像：米大統領選、投票始まる　激戦州の勝敗なお見通せず,11/6(水) 6:56
reut,ロイター,ＮＹ外為市場＝ドル下落、米大統領選の行方を注視,11/6(水) 6:46
reut,ロイター,再送米国株式市場＝反発、堅調な指標受け　大統領選の結果に注目,11/6(水) 6:45
reut,ロイター,ウクライナ大統領、北朝鮮兵と初の交戦を確認「世界の不安定化の新たな章が幕を開けた」,11/6(水) 6:21
reut,ロイター,アイルランド、累計税収前年比15％増　アップルの追徴課税で,11/6(水) 6:12
reut,ロイター,トランプ氏、勝利に自信　「選挙公正なら結果認める」とも　米大統領選,11/6(水) 5:48
reut,ロイター,北朝鮮兵士と交戦、ゼレンスキー氏が確認　「世界さらに不安定に」,11/6(水) 5:46
reut,ロイター,英国債利回り1年ぶり高水準、トランプ氏返り咲きを警戒,11/6(水) 5:44
reut,ロイター,全米最初に投開票、ニューハンプシャー州の小さな町　有権者6人の民意割れる,11/6(水) 5:38
reut,ロイター,米議会議事堂で男逮捕、トーチや照明弾を所持,11/6(水) 4:38
reut,ロイター,激戦4州の投票所に偽の爆破予告、ロシアから発信か　米大統領選,11/6(水) 4:37
reut,ロイター,訂正（5日付配信記事）-ヘッジファンドのリターン、ハリス氏勝利ならより高まる＝調査,11/6(水) 4:32
reut,ロイター,イスラエル首相、ガラント国防相を解任　後任にカッツ外相,11/6(水) 3:43
reut,ロイター,米ネットフリックス、仏とオランダの拠点に家宅捜索　脱税の疑い,11/6(水) 3:19
reut,ロイター,スペイン警察、水害不明者のＤＮＡ提供要請　政府は116億ドル支援,11/6(水) 3:18
reut,ロイター,中国、国境炭素税などの措置巡る協議要請　ＣＯＰ２９で,11/6(水) 3:16
reut,ロイター,イスラエル、シリア中部を攻撃　ヒズボラ弾薬庫が標的と表明,11/6(水) 2:27
reut,ロイター,イスラエル軍がヨルダン川西岸空爆、7人死亡　イスラム聖戦標的,11/6(水) 2:23
reut,ロイター,ガザから医療避難、子ども含む100人超　6日にＵＡＥなどへ＝ＷＨＯ,11/6(水) 1:25
reut,ロイター,再送-米ＦＢＩ、大統領選巡る偽動画を警告　偽情報拡散に警戒強める,11/6(水) 1:23
reut,ロイター,世界的な利下げサイクル、10月も継続　米大統領選控え,11/6(水) 1:21
reut,ロイター,米10月ＩＳＭ非製造業総合指数56.0、約2年ぶり高水準　雇用好調,11/6(水) 0:51
reut,ロイター,ロシア裁判所、米アップルに約3.6万ドルの罰金　ポッドキャスト削除拒否,11/6(水) 0:49
reut,ロイター,Ｇ７と3カ国外相、北朝鮮のロシア派兵に懸念　「紛争の危険な拡大」,11/6(水) 0:21
reut,ロイター,トムソン・ロイター、第3四半期は売上高が予想上回る　生成ＡＩ投資が奏功,11/6(水) 0:18
reut,ロイター,カミラ英王妃、胸部感染症で公務取りやめ,11/6(水) 0:11
reut,ロイター,米9月貿易赤字、844億ドルに大幅拡大　関税引き上げ予想で輸入増,11/6(水) 0:09
reut,ロイター,ウクライナ南部ザポロジエ市にミサイル攻撃、6人死亡　インフラ破壊,11/6(水) 0:08
reut,ロイター,米大統領選、投票始まる　激戦州の勝敗なお見通せず,11/5(火) 20:16
reut,ロイター,ドイツ、右翼過激派8人逮捕　国家崩壊に備え戦闘訓練,11/5(火) 20:13
reut,ロイター,テスラ、独ギガファクトリーで4％賃上げ,11/5(火) 19:55
reut,ロイター,衣料ネット通販ザランド、第3四半期は利益率上昇　消費好調,11/5(火) 19:54
reut,ロイター,英シュローダー、第3四半期は23億ポンド流出　中国市場混乱が打撃,11/5(火) 19:31
reut,ロイター,英サービスＰＭＩ、10月改定52.0　予算案発表控え11カ月ぶり低水準,11/5(火) 19:20
reut,ロイター,東南アジア版ＮＡＴＯ、現時点で実現困難　国益に乖離とフィリピン国防相,11/5(火) 19:01
reut,ロイター,イスラエルの空爆でパレスチナ人30人死亡、ガザ北部に新たな避難命令,11/5(火) 18:49
reut,ロイター,台湾富裕層の投資「不動」、中国圧力でも資産逃避せず＝国泰金融,11/5(火) 18:46
reut,ロイター,メルカリ、山田氏が米国法人ＣＥＯ兼務　ラーゲリン氏は退任,11/5(火) 18:18
reut,ロイター,ドイツ化学部門、業況が大幅改善　電気代値下げに期待＝ＩＦＯ,11/5(火) 18:06
reut,ロイター,南ア民間部門の成長持続、10月ＰＭＩは3カ月連続50上回る,11/5(火) 17:37
reut,ロイター,香港のヘッジファンド「ジール・アセット」が閉鎖へ、投資家に資金返還,11/5(火) 17:22
reut,ロイター,韓国、初の豪ドル建て国債発行へ　3億米ドル規模＝財政省高官,11/5(火) 17:15
reut,ロイター,ヤマトＨＤが業績予想下方修正、コスト上昇　4─9月期は赤字転落,11/5(火) 16:57
reut,ロイター,モルガンＳ、中国で先物事業の認可取得　米大手で2社目,11/5(火) 16:49
reut,ロイター,アラムコ、第3四半期は15.4％減益　配当は維持,11/5(火) 16:23
reut,ロイター,川汽、自動車船など上振れで業績上方修正　配当も上積み,11/5(火) 16:14
reut,ロイター,インタビュー：利上げは1月が最有力、市場動向と政治情勢が焦点＝桜井元日銀委員,11/5(火) 16:05
reut,ロイター,ユニクロ、10月国内既存店売上高は前年比7.5％減　冬物苦戦,11/5(火) 16:00
reut,ロイター,日経平均は反発、自律反発期待の買い　米大統領選前の備えも,11/5(火) 15:57
reut,ロイター,ヤマトＨＤ、発行済み株式の11.36％・500億円上限に自社株買い,11/5(火) 15:50
reut,ロイター,任天堂、通期営業益予想3600億円に下方修正　スイッチ計画引き下げ,11/5(火) 15:49
reut,ロイター,川崎汽船、発行済み株の5.34%・900億円上限に自社株買い,11/5(火) 15:46
reut,ロイター,レディオヘッドのトム・ヨークにパレスチナ支持者からやじ　ステージ降りる,11/5(火) 15:40
reut,ロイター,アングル：ハリス氏、インフレが依然弱み　ピーク時から沈静化でも,11/5(火) 15:30
reut,ロイター,午後3時のドルは152円前半、ポジション調整で小幅高　米大統領選控え,11/5(火) 15:25
reut,ロイター,103万円の壁見直し、立民も前向き＝党首会談で玉木国民民主代表,11/5(火) 15:17
reut,ロイター,台湾、米大統領選で誰が勝利しても自衛の決意示す＝国防部長,11/5(火) 14:58
reut,ロイター,クインシー・ジョーンズさん死去、「ウィ・アー・ザ・ワールド」など多彩な活躍,11/5(火) 14:46
reut,ロイター,アングル：米大統領選前夜、警戒続く日本株　「急落なら買い」銘柄探る動き,11/5(火) 14:39
reut,ロイター,米国務長官、イスラエル国防相と会談　ガザ人道支援拡大を要請,11/5(火) 14:35
reut,ロイター,タイ中銀元総裁らが政治介入リスクに警鐘、理事長人事が延期,11/5(火) 14:27
reut,ロイター,ボーイングのスト終結、賃上げ案を承認　6日にも生産再開へ,11/5(火) 14:13
reut,ロイター,フィリピン10月ＣＰＩ、前年比＋2.3％に加速　食品・輸送が寄与,11/5(火) 14:11
reut,ロイター,マスク氏とＸ、米大統領選偽情報の発信地＝専門家,11/5(火) 14:04
reut,ロイター,インドネシアＧＤＰ、第3四半期は前年比＋4.95％　1年ぶり低い伸び,11/5(火) 13:52
reut,ロイター,三菱重の4━9月期営業益86.7％増、防衛・宇宙など寄与　通期は維持,11/5(火) 13:48
reut,ロイター,被災地視察のスペイン国王に泥を投げつけ、政府の洪水対応に怒りの声　捜索活動難航,11/5(火) 13:44
reut,ロイター,豪中銀、予想通り金利据え置き　根強いインフレ圧力見込む,11/5(火) 13:37
reut,ロイター,米大統領選の勝者はいつわかる？前回2020年の選挙よりさらに時間がかかる見通し,11/5(火) 13:22
reut,ロイター,ＮＢＡ＝レーカーズ黒星、先発の八村8得点4リバウンド1アシスト,11/5(火) 13:06
reut,ロイター,北朝鮮兵1万人以上がロシア入り、「相当数」が前線に　韓国国防省,11/5(火) 13:01
reut,ロイター,フェンタニル問題でメキシコと中国に関税　トランプ氏が警告,11/5(火) 12:35
reut,ロイター,カナダ、石油・ガス産業に大幅排出削減案　生産減・税収減と反発も,11/5(火) 12:33
reut,ロイター,アングル：迫る米大統領選、騒乱に身構える有権者　不安極限に,11/5(火) 12:18
reut,ロイター,中国首相「開放加速し単独主義に対抗」、成長目標達成に自信も,11/5(火) 12:14
reut,ロイター,午前の日経平均は反発、決算で個別物色も,11/5(火) 12:08
reut,ロイター,電力・ガス支援、再開に1カ月以上必要＝赤沢経済財政相,11/5(火) 12:05
reut,ロイター,原油先物は小反落、米大統領選や中国全人代常務委巡る不透明感で,11/5(火) 12:03
reut,ロイター,ウィリアム英王子が南ア訪問、環境イベントなどで　子どもとラグビーも,11/5(火) 11:58
reut,ロイター,米ブラックストーン、富裕層向け事業で欧州2市場参入へ,11/5(火) 11:50
reut,ロイター,メタ、新たな政治広告の掲載禁止を米大統領選後も継続へ,11/5(火) 11:47
reut,ロイター,韓国ＣＰＩ伸び率、10月は約4年ぶり低水準　追加利下げ後押しか,11/5(火) 11:45
reut,ロイター,財新・中国サービスＰＭＩ、10月は3カ月ぶり高水準　新規受注増加,11/5(火) 11:42
reut,ロイター,訂正-米石油生産、週内の熱帯暴風雨接近で約400万バレル減も＝研究者,11/5(火) 11:39
reut,ロイター,ゴルフ＝コルダ、ＬＰＧＡ年間最優秀選手を獲得　古江届かず,11/5(火) 11:36
reut,ロイター,米銀大手、従業員に大統領選の投票促す　有休取得可能と通知,11/5(火) 11:34
reut,ロイター,トルコＣＰＩ、10月は前年比48.58％上昇　高止まり続く,11/5(火) 11:20
reut,ロイター,サッカー＝スペイン洪水でカップ戦5試合が再延期、久保の試合は未定,11/5(火) 11:18
reut,ロイター,女性の服装に厳格なイランで、下着姿の女性が街中を歩く映像拡散　当局への抗議活動か,11/5(火) 11:03
reut,ロイター,ＭＬＢ＝アスレチックス、球団名からオークランド削除　移転受け,11/5(火) 10:53
reut,ロイター,ＯＰＥＣ産油量、10月は増加　リビア政治危機解決で＝ロイター調査,11/5(火) 10:48
reut,ロイター,サッカー＝マンＵ移籍アモリン氏「まだスポルティングの監督」、ＣＬ注力,11/5(火) 10:42
reut,ロイター,オープンＡＩ、営利企業への転換に向け協議　加州当局と＝ＢＢＧ,11/5(火) 10:41
reut,ロイター,エムポックスの重症化しやすい新タイプ、英で新たに感染者2人確認,11/5(火) 10:32
reut,ロイター,民主党、トランプ氏の一方的勝利宣言に備え　ＳＮＳ・テレビで,11/5(火) 10:24
reut,ロイター,高圧経済の余地ある、日銀は賃上げ見定める必要＝玉木国民民主代表,11/5(火) 10:20
reut,ロイター,ウクライナ・ハリコフで空爆の瞬間をカメラが捉える、ロシアの誘導爆弾攻撃で15人負傷と当局,11/5(火) 10:12
reut,ロイター,テニス＝ＷＴＡファイナル、サバレンカが4強へ　年間世界1位も目前に,11/5(火) 10:10
reut,ロイター,ドイツ企業の雇用意欲が減退、4年超ぶり低水準＝ＩＦＯ,11/5(火) 10:09
reut,ロイター,トランプ氏の関税案、年780億ドルの購買力喪失も＝業界団体,11/5(火) 10:00
reut,ロイター,ＥＵの投資、公的資金を民間の呼び水に＝財務相会議,11/5(火) 9:44
reut,ロイター,仏トタル幹部、米国のパリ協定離脱想定せず　トランプ氏勝利でも,11/5(火) 9:37
reut,ロイター,コニカミノルタ、今期営業損益赤字に修正　米遺伝子検査企業を売却,11/5(火) 9:35
reut,ロイター,債券投資家は中立スタンス、米利下げ予想も大統領選を警戒,11/5(火) 9:34
reut,ロイター,ロシア・クルスクに北朝鮮兵1万1000人とウクライナ大統領、西側の反応は「依然鈍い」,11/5(火) 9:28
reut,ロイター,マネタリーベース、10月は前年比0.3％減　日銀当預がマイナス転換,11/5(火) 9:27
reut,ロイター,サッカー＝パルマ黒星で9試合未勝利、鈴木彩艶はフル出場,11/5(火) 9:22
reut,ロイター,米マリオット、通期業績予想を下方修正　中国の国内旅行低迷で,11/5(火) 9:20
reut,ロイター,ＭＬＢ＝コールの契約破棄が白紙に、ヤンキース残留へ─報道,11/5(火) 9:20
reut,ロイター,日経平均は反発で寄り付く、自律反発狙いの買い優勢,11/5(火) 9:09
reut,ロイター,伊製造業ＰＭＩ、10月は46.9に低下　7カ月連続で50割れ,11/5(火) 9:08
reut,ロイター,世界の石油需要、経済成長続く間はピークなし＝ＯＰＥＣ事務局長,11/5(火) 9:06
reut,ロイター,ゴルフ＝最新世界ランキング、松山は7位　久常89位,11/5(火) 9:03
reut,ロイター,マスク氏の100万ドル配布差し止め認めず、ペンシルベニア州裁判所,11/5(火) 8:55
reut,ロイター,サッカーの試合中に落雷、選手1人が死亡・4人負傷　ペルー,11/5(火) 8:49
reut,ロイター,ＮＺ経済、先行き厳しい　失業増大や企業投資延期＝中銀半期報告,11/5(火) 8:33
reut,ロイター,独「空飛ぶタクシー」開発新興、資金難で破産申請へ,11/5(火) 8:27
reut,ロイター,米検察当局、米企業秘密を盗んだ罪で中国ファンド首脳を起訴,11/5(火) 8:25
reut,ロイター,ＭＬＢ＝シルバースラッガー賞、大谷と鈴木が最終候補に,11/5(火) 8:13
reut,ロイター,ガザ人道状況大きく改善せず、イスラエルの対応期限控え米が指摘,11/5(火) 8:02
reut,ロイター,中国製ＥＶ、関税に代わる最低価格保証にも強制力必要＝ＥＵ高官,11/5(火) 7:59
reut,ロイター,北朝鮮がミサイル発射＝韓国軍,11/5(火) 7:51
reut,ロイター,北朝鮮が複数の短距離弾道ミサイル、官房長官「断じて容認できず」,11/5(火) 7:46
reut,ロイター,米選挙巡る偽情報「前例ない量」、結果に直接影響なし＝当局者,11/5(火) 7:44
reut,ロイター,ジョージア首都で数千人が抗議デモ、議会選の不正訴える,11/5(火) 7:39
reut,ロイター,金与正氏、米日韓軍事訓練に反発　「北朝鮮の核武力強化は正当」,11/5(火) 7:33
reut,ロイター,ＮＹ外為市場＝ドル下落、共和党圧勝の可能性後退との見方,11/5(火) 6:47
reut,ロイター,原油先物3％近く上昇、ＯＰＥＣプラスが自主減産縮小を延期,11/5(火) 6:28
reut,ロイター,米国株式市場＝小反落、米大統領選控え不透明感　ＦＯＭＣも注視,11/5(火) 6:27
reut,ロイター,トランプ・ハリス両候補、激戦州で最後の追い込み　米大統領選目前,11/5(火) 6:26
reut,ロイター,ロシア派遣の北朝鮮兵、戦闘参加は未確認　西部に1万人＝米国防総省,11/5(火) 6:25
reut,ロイター,北朝鮮の戦争関与に「断固たる行動」を、ウクライナと独外相が会談,11/5(火) 5:35
reut,ロイター,国連安保理、北朝鮮ミサイル巡り協議　米「中ロが制裁回避支援」,11/5(火) 5:29
reut,ロイター,イスラエル、ダマスカス近郊のヒズボラ施設を攻撃　シリアは非難,11/5(火) 5:25
reut,ロイター,マスク氏、現金配布を巡る「脅し」に屈しない＝弁護士,11/5(火) 5:21
reut,ロイター,トランプ氏の勝率約57％、賭け市場で　米大統領選まであと1日,11/5(火) 5:19
reut,ロイター,米韓、民生用原子力協力で暫定合意　核不拡散などの最高基準維持,11/5(火) 5:18
reut,ロイター,ＥＵ、米アップルｉＰａｄのＯＳを検証へ　ＤＭＡ順守巡り判断,11/5(火) 2:13
reut,ロイター,米企業、株安で経営トップ交代加速　後任探しは旧態依然＝ＣＢ,11/5(火) 2:12
reut,ロイター,米製造業新規受注、9月は前月比0.5％減　2カ月連続で減少,11/5(火) 2:11
reut,ロイター,プーチン大統領、モスクワで北朝鮮外相と会談　1分間握手交わす,11/5(火) 1:00
reut,ロイター,イスラエルがガザ攻撃継続、16人死亡　北部に緩衝地帯設置目的か,11/5(火) 1:00
reut,ロイター,ＮＹタイムズ、デジタル購読者数伸び鈍化　不透明な経済情勢受け,11/5(火) 0:57
reut,ロイター,独コメルツ銀、6億ユーロ上限に自社株買いへ　買収圧力に対抗,11/4(月) 21:50
reut,ロイター,中国全人代常務委が開幕、地方債務上限引き上げ案審議＝新華社,11/4(月) 20:58
reut,ロイター,ユーロ圏投資家センチメント、11月は−12.8　2カ月連続改善,11/4(月) 19:37
reut,ロイター,仏製造業ＰＭＩ、10月44.5に小幅低下　海外需要が急減,11/4(月) 19:18
reut,ロイター,米テスラの中国製ＥＶ販売台数、10月は前年比5.3％減,11/4(月) 19:08
reut,ロイター,ユーロ圏製造業ＰＭＩ、10月改定46.0に改善　需要安定化の兆し,11/4(月) 18:53
reut,ロイター,独製造業ＰＭＩ、10月改定値は43.0に上昇　「底入れの兆し」か,11/4(月) 18:43
reut,ロイター,訂正-クインシー・ジョーンズさん死去、「We Are the World」や「スリラー」など多彩な活躍,11/4(月) 18:30
reut,ロイター,インド製造業ＰＭＩ、10月は57.5に上昇　需要拡大,11/4(月) 17:25
reut,ロイター,インドネシアとロシア、初の軍事演習開始　ジャワ海で8日まで,11/4(月) 16:52
reut,ロイター,ＥＵ・韓国、安保協力に署名　共同声明で北朝鮮のロシア派兵を非難,11/4(月) 16:44
reut,ロイター,ブラックストーン、リテール・オポチュニティー買収で交渉＝関係筋,11/4(月) 16:30
reut,ロイター,米ＩＴ企業、ベトナムのデータ保護法案に懸念　事業拡大の妨げに,11/4(月) 16:15
reut,ロイター,中国の婚姻数、1─9月は前年比94万組減少,11/4(月) 16:08
reut,ロイター,ミャンマー軍政トップ、中国訪問へ　実権掌握後初,11/4(月) 15:30
reut,ロイター,イスラエル、ＵＮＲＷＡとの関係解消を国連に正式通告,11/4(月) 15:29
reut,ロイター,スペイン水害死者200人超、視察の国王夫妻に住民が泥投げつけ,11/4(月) 15:08
reut,ロイター,ペンシルベニア州暫定投票、最高裁が集計認める　共和の要求却下,11/4(月) 14:58
reut,ロイター,エヌビディア、次世代「ＨＢＭ」チップ供給前倒し要請＝ＳＫ会長,11/4(月) 14:43
reut,ロイター,米、グローバルファウンドリーズに罰金　制裁対象中国企業に出荷,11/4(月) 13:46
reut,ロイター,ガザ機密情報流出、首相側近も関与か　イスラエル当局が調査,11/4(月) 13:33
reut,ロイター,アイオワ州でハリス氏リード、女性の支持で逆転か＝地元紙調査,11/4(月) 13:25
reut,ロイター,ＮＢＡ＝ホークス勝利、ジョンソンが攻守に躍動,11/4(月) 12:57
reut,ロイター,テニス＝ＷＴＡファイナル、2カ月ぶりプレーのシフィオンテクが白星発進,11/4(月) 12:46
reut,ロイター,ＭＬＢ＝ゴールドグラブ、チャプマン5回目の受賞　初受賞は14人,11/4(月) 12:42
reut,ロイター,豪ウエストパック、通期3％減益　マージン上昇もコスト増が重荷,11/4(月) 12:34
reut,ロイター,ＥＵ、ＥＶ貿易巡り受け入れ可能な解決策を　中国が仏に要請,11/4(月) 12:34
reut,ロイター,ガザで31人死亡、イスラエル軍が北部に増派　病院にも砲撃,11/4(月) 12:24
reut,ロイター,ガザで第2回ポリオ予防接種開始、医療施設攻撃で子ども4人負傷,11/4(月) 11:59
reut,ロイター,北朝鮮、白書で韓国大統領を批判　「核戦争リスク高めた」,11/4(月) 11:41
reut,ロイター,ウクライナ国債価格、10月は急伸　トランプ氏復帰観測で早期停戦期待,11/4(月) 11:32
reut,ロイター,Ｓ＆Ｐ、トルコ長期ソブリン格付けを「ＢＢ―」に引き上げ　インフレ抑制評価,11/4(月) 11:25
reut,ロイター,サッカー＝インテル勝利、黒星の首位ナポリと勝ち点1差に,11/4(月) 11:16
reut,ロイター,サッカー＝マンＵとチェルシーはドロー、トットナム大勝,11/4(月) 11:12
reut,ロイター,ロ朝外相、戦略パートナーシップ条約の履行を再確認＝ＫＣＮＡ,11/4(月) 11:00
reut,ロイター,テニス＝マスターズ・パリ大会、ズベレフが初優勝　「かなり良かった」,11/4(月) 10:32
reut,ロイター,米大統領選、両候補が激戦州で支持訴え　トランプ氏は暴力的な発言展開,11/4(月) 10:31
reut,ロイター,モルドバ大統領選、現職が僅差で再選　「親欧米路線に支持」,11/4(月) 10:22
reut,ロイター,サッカー＝堂安所属フライブルク、佐野所属マインツとドロー,11/4(月) 9:13
reut,ロイター,サッカー＝小川が2得点1アシスト、ＮＥＣが6得点で大勝,11/4(月) 9:13
reut,ロイター,Ｆ１＝ブラジルＧＰ、フェルスタッペン優勝　角田が7位入賞,11/4(月) 9:13
reut,ロイター,サッカー＝久保がゴール、ソシエダード白星　バルセロナがダービー勝利,11/4(月) 9:11
reut,ロイター,激戦7州、ハリス氏とトランプ氏の接戦続く＝ＮＹＴ調査,11/4(月) 9:00
reut,ロイター,ＯＰＥＣプラス、有志国による自主減産縮小1カ月延期で合意,11/4(月) 8:48
reut,ロイター,アングル：欧州で実店舗がじわり増加、「ショッピングは娯楽の一部」,11/4(月) 7:52
reut,ロイター,大統領選とＦＯＭＣ、相場急変に警戒＝今週の米株式市場,11/3(日) 15:43
reut,ロイター,米とイスラエル「壊滅的な対応受ける」　イラン最高指導者が表明,11/3(日) 14:14
reut,ロイター,ＮＢＡ＝グリズリーズ河村は途中出場で無得点、チームは快勝,11/3(日) 13:11
reut,ロイター,テニス＝マスターズ・パリ大会、決勝はズベレフ対アンベール,11/3(日) 12:56
reut,ロイター,ＭＬＢ＝ヤンキースのエース右腕、コール投手が契約破棄との報道,11/3(日) 11:40
reut,ロイター,サッカー＝フランス1部でＰＳＧが無敗キープ、デンベレが決勝弾,11/3(日) 11:36
reut,ロイター,英保守党党首にベーデノック氏、初の黒人女性　党内右派,11/3(日) 11:33
reut,ロイター,サッカー＝ユベントスは開幕から無敗、ＡＣミランも勝利,11/3(日) 11:23
reut,ロイター,サッカー＝首位バイエルン快勝、ケーンが2ゴールと活躍,11/3(日) 10:30
reut,ロイター,米バークシャー、アップル株売却　手元資金が過去最高に,11/3(日) 10:25
reut,ロイター,サッカー＝遠藤途中出場のリバプール、ブライトンに逆転勝ち,11/3(日) 9:34
reut,ロイター,米石油・ガス掘削リグ稼働数、2週連続で横ばい＝ベーカー・ヒューズ,11/3(日) 9:31
reut,ロイター,テニス＝錦織、チャレンジャー大会で決勝進出ならず,11/3(日) 9:13
reut,ロイター,Ｆ１＝ブラジルＧＰスプリントはノリスが制す、角田は15位,11/3(日) 9:05
