media_en,media_jp,title_articles,date_original
reut,ロイター,ゴルフ＝ロッテ選手権、首位スタート吉田は4位に後退,11/9(土) 12:39
reut,ロイター,北朝鮮がＧＰＳ妨害、船舶や航空機の運航に影響＝聯合ニュース,11/9(土) 12:28
reut,ロイター,中国10月ＣＰＩ、前年比+0.3％に鈍化,11/9(土) 11:19
reut,ロイター,サッカー＝ルカクが正念場でベルギー代表復帰、4試合選外,11/9(土) 11:06
reut,ロイター,サッカー＝アルアイン、元モナコのジャルディム氏が監督就任,11/9(土) 11:03
reut,ロイター,テニス＝ＷＴＡファイナル、ガウフがサバレンカに勝利　鄭との決勝へ,11/9(土) 11:00
reut,ロイター,ＭＬＢ＝ヤンキース、25年もブーン監督が続投　オプション行使,11/9(土) 10:57
reut,ロイター,ＮＢＡ＝レブロン息子ブロニー、9日にＧリーグデビューか＝報道,11/9(土) 10:54
reut,ロイター,トランプ氏刑事手続き、連邦地裁が延期認める　議会襲撃事件で,11/9(土) 10:49
reut,ロイター,米司法省、トランプ氏暗殺計画巡りイラン在住の男起訴,11/9(土) 10:45
reut,ロイター,サッカー＝堂安フル出場、フライブルクは引き分けで暫定4位,11/9(土) 9:35
reut,ロイター,テニス＝錦織が2大会連続でベスト4進出、チャレンジャー,11/9(土) 9:32
reut,ロイター,フィギュア＝ＮＨＫ杯、坂本が今季世界最高でＳＰ首位,11/9(土) 8:40
reut,ロイター,アングル：米低価格住宅不足に「犯罪スコア」が追い打ち、保険料高騰,11/9(土) 8:05
reut,ロイター,ＮＹ市場サマリー（8日）Ｓ＆Ｐ初の6000台、ドル上昇　国債利回り低下,11/9(土) 7:27
reut,ロイター,米国株式市場＝Ｓ＆Ｐ初の6000台乗せ、トランプ次期政権に期待,11/9(土) 7:26
reut,ロイター,バイデン氏が早期撤退なら、状況は違っていた可能性─ペロシ氏＝新聞,11/9(土) 7:20
reut,ロイター,ＮＹ外為市場＝ドル上昇、トランプ氏勝利で週間でも高い,11/9(土) 7:18
reut,ロイター,トランプ氏政権移行チーム、パリ協定離脱を準備＝報道,11/9(土) 7:17
reut,ロイター,マスク氏、トランプ氏とウクライナ大統領の電話会談に参加＝報道,11/9(土) 7:12
reut,ロイター,ロシア、ウクライナ全土攻撃　1人死亡・30人超負傷,11/9(土) 6:26
reut,ロイター,北朝鮮、ロシア派兵で戦争支援を「危険なほど拡大」　ＮＡＴＯが警告,11/9(土) 6:24
reut,ロイター,トランプ氏、次期政権の人選開始　エネルギー政策担当ポストなど,11/9(土) 6:22
reut,ロイター,米の財政健全性リスク高まる、トランプ氏当選で＝ムーディーズ,11/9(土) 6:21
reut,ロイター,アムステルダム、3日間デモ禁止　イスラエル人サッカー観客襲撃で,11/9(土) 6:20
reut,ロイター,テスラ時価総額1兆ドル台、約2年ぶり　トランプ次期政権下で優遇か,11/9(土) 3:59
reut,ロイター,トランプ氏、自身のＳＮＳ株「売却しない！」　株価10％高,11/9(土) 3:58
reut,ロイター,ＷＴＯ事務局長の候補者争いならず　トランプ氏の米大統領復権で,11/9(土) 3:57
reut,ロイター,欧州の金融機関、トランプ政権2期目での競争激化に備え,11/9(土) 3:55
reut,ロイター,トランプ氏、ライトハイザー氏にＵＳＴＲ代表復帰を打診＝報道,11/9(土) 3:53
reut,ロイター,米Ｓ＆Ｐ、初の6000台乗せ　トランプトレード継続,11/9(土) 3:49
reut,ロイター,ＥＣＢ、慎重姿勢必要　物価目標達成間近でも＝アイルランド中銀総裁,11/9(土) 3:48
reut,ロイター,米下院選、民主党がＮＹ州で善戦　共和党は過半数に迫る勢い,11/9(土) 1:33
reut,ロイター,オランダ極右党首、イスラエル外相と会談へ　サッカー試合襲撃受け,11/9(土) 1:31
reut,ロイター,イスラエル首相、新駐米大使を指名　米国生まれの元財務省補佐官,11/9(土) 1:31
reut,ロイター,米ミシガン大消費者信頼感、11月速報値は73.0　7カ月ぶり高水準,11/9(土) 1:30
reut,ロイター,トランプ氏をトルコ訪問に招待、エルドアン大統領　関係改善に期待,11/9(土) 1:08
reut,ロイター,ロシア、ウクライナ巡る要求に変更なし　トランプ氏と協議の用意も,11/9(土) 0:59
reut,ロイター,米国民の6割、トランプ政権下の債務増加を予想＝世論調査,11/8(金) 20:46
reut,ロイター,中国、ＣＯＰ２９に丁副首相出席へ　習主席の首脳会議参加は不明,11/8(金) 20:08
reut,ロイター,中国人民銀行、景気支援型の政策継続へ,11/8(金) 20:02
reut,ロイター,ハーベック独経済相、緑の党代表で首相目指す意向＝関係筋,11/8(金) 19:49
reut,ロイター,世界食料価格指数、10月は1年半ぶり高水準＝ＦＡＯ,11/8(金) 19:33
reut,ロイター,台湾輸出、10月は8.4％増で予想下回る　中国経済低迷が圧迫,11/8(金) 19:07
reut,ロイター,中国乗用車販売、10月は11.2％増　年間目標達成に向け販売加速,11/8(金) 19:04
reut,ロイター,北尾ＳＢＩＨＤ会長、新生銀の公的資金返済計画「すでに頭の中に」,11/8(金) 18:45
reut,ロイター,ガザ紛争死者、7割が女性・子ども　生まれたばかりの乳児も＝国連,11/8(金) 18:41
reut,ロイター,韓国に新ロシア派によるサイバー攻撃、北朝鮮軍派遣受け,11/8(金) 18:36
reut,ロイター,東京マーケット・サマリー（8日）,11/8(金) 18:24
reut,ロイター,高級ブランドのリシュモン、7─9月は1％減収　中国不振も宝飾品好調,11/8(金) 18:23
reut,ロイター,アングル：トランプ財政政策に「債券自警団」再来か、4.5％が警戒ライン,11/8(金) 18:20
reut,ロイター,シンガポールＯＣＢＣ銀、第3四半期決算は好調　融資拡大を予想,11/8(金) 18:14
reut,ロイター,中国、地方隠れ債務対策に10兆元　直接資金は米次期政権まで温存か,11/8(金) 17:48
reut,ロイター,タイ首相、デジタル政策の推進表明　ＡＩ活用,11/8(金) 17:34
reut,ロイター,日産、半年で業績改善の兆しなければ信用力に下方圧力＝Ｓ＆Ｐ,11/8(金) 17:32
reut,ロイター,米国で海外移住への関心高まる、トランプ氏大統領選勝利に失望,11/8(金) 17:17
reut,ロイター,貿易戦争や産業戦争に勝者はない、駐米中国大使が演説,11/8(金) 16:44
reut,ロイター,ＳＵＭＣＯ、通期営業益予想52％減の349億円、市場予想下回る,11/8(金) 16:10
reut,ロイター,フィリピン大統領、南シナ海の権益守る法案に署名　中国は反発,11/8(金) 16:06
reut,ロイター,日経平均は反発、米株高で　上昇の反動で伸び悩みも,11/8(金) 16:00
reut,ロイター,東急、発行済み株式の4.01％・400億円上限に自社株買い,11/8(金) 15:57
reut,ロイター,ソニーＧ、通期営業益予想は市場予測を下回る　売上高は上方修正,11/8(金) 15:52
reut,ロイター,半導体大手キオクシア、12月―来年6月に上場予定＝有価証券届出書,11/8(金) 15:49
reut,ロイター,返り咲きのトランプ氏、フロリダ州の自宅周辺をロボット犬が巡回し警備強化,11/8(金) 15:41
reut,ロイター,ゴルフ＝吉田が通算9アンダーで首位浮上、ロッテ選手権,11/8(金) 15:36
reut,ロイター,午後3時のドルは152円後半へじり安、重要イベント一巡で小康,11/8(金) 15:31
reut,ロイター,オランダでユダヤ人サポーター襲撃、イスラエルが救助機派遣,11/8(金) 15:26
reut,ロイター,バークレイズ、英金利は12月据え置きと予想　引き下げから変更,11/8(金) 15:18
reut,ロイター,インドネシア新大統領、初の海外歴訪　まず中国で習主席と会談へ,11/8(金) 15:09
reut,ロイター,アングル：トランプ氏の「不法移民大量送還」、費用と根拠法と抵抗勢力,11/8(金) 15:07
reut,ロイター,NY州の高速道路で、作業員にトラックが突っ込む　あわや大事故,11/8(金) 15:06
reut,ロイター,インドネシアで大規模噴火、噴煙が8000メートル上空に達する　噴火は8回確認,11/8(金) 15:04
reut,ロイター,ペルー中銀、予想通り0.25％利下げ　政策金利5％に,11/8(金) 14:50
reut,ロイター,メキシコＣＰＩ、10月は前年比＋4.76％に加速　コア指数は鈍化,11/8(金) 14:45
reut,ロイター,返り咲き決めたトランプ氏が、起訴または捜査対象にしたい人々のリストとその「罪状」,11/8(金) 14:43
reut,ロイター,トランプ氏娘婿のクシュナー氏、次期政権入りせず＝ＦＴ,11/8(金) 14:32
reut,ロイター,米ＬＮＧ開発企業、政権交代で事業拡大に自信　環境団体は対抗へ,11/8(金) 14:25
reut,ロイター,英中銀の段階的な利下げシナリオ、トランプ氏復帰で暗雲,11/8(金) 14:22
reut,ロイター,景気動向一致指数9月は2カ月ぶりプラス、生産など改善,11/8(金) 14:09
reut,ロイター,インドネシア、5年で8600億ドルの投資誘致　8％成長達成へ,11/8(金) 14:06
reut,ロイター,中国半導体製造ＳＭＩＣ、供給過剰の長期化警告　事業拡大に慎重,11/8(金) 14:03
reut,ロイター,米ＥＶのリビアン、第4四半期に粗利益計上へ　コスト削減寄与,11/8(金) 13:54
reut,ロイター,米、リチウム電池再利用施設建設への融資決定　トランプ氏就任前に,11/8(金) 13:46
reut,ロイター,ドイツ、少数政権移行で早期の総選挙求める声強まる,11/8(金) 13:41
reut,ロイター,ブラジル中銀ターミナルレート、市場が予想引き上げ,11/8(金) 13:32
reut,ロイター,ＮＢＡ＝ウルブズ勝利、エドワーズが33得点　バックスも白星,11/8(金) 13:27
reut,ロイター,10月の金ＥＴＦ、6カ月連続で流入超　北米・アジアから＝ＷＧＣ,11/8(金) 13:26
reut,ロイター,香港中銀が0.25％利下げ、ＦＲＢに追随　今後のペース「不透明」,11/8(金) 13:20
reut,ロイター,テニス＝チチパス、マスターズ1000期間延長に疑問　「回復できず」,11/8(金) 13:14
reut,ロイター,オープンＡＩ、ＡＩ訓練で記事無断使用問われた裁判で勝訴,11/8(金) 13:13
reut,ロイター,インド、米企業の関税下げる用意　印製品も条件改善なら＝関係筋,11/8(金) 13:09
reut,ロイター,選挙中に153億円献金、実業家イーロン・マスク氏が手にする「トランプ2.0」の果実,11/8(金) 12:50
reut,ロイター,中国の原油輸入、10月は前年比9％減　6カ月連続で減少＝税関統計,11/8(金) 12:45
reut,ロイター,キオクシア、最短12月のＩＰＯ目指す　新たな上場方式を初活用,11/8(金) 12:38
reut,ロイター,原油先物、小幅下落　ハリケーンの勢力弱まる見通し,11/8(金) 12:35
reut,ロイター,トランプ氏勝利、日本経済・財政などへの影響注視＝加藤財務相,11/8(金) 12:31
reut,ロイター,伊藤忠、川崎重工の二輪子会社に20％出資　800億円,11/8(金) 12:13
reut,ロイター,午前の日経平均は小反発、米株高を好感　円安一服で伸び悩みも,11/8(金) 12:10
reut,ロイター,サッカー＝マンＣのＧＫオルテガ、32歳でドイツ代表初招集,11/8(金) 11:53
reut,ロイター,スイス中銀、仮想通貨になお警戒感　現金決済は今後も重要＝総裁,11/8(金) 11:42
reut,ロイター,焦点：トランプ勝利で円安再燃、揺れる利上げ慎重論　介入警戒感も浮上,11/8(金) 11:39
reut,ロイター,アマゾン、アンソロピックへ数十億ドルの追加投資検討＝報道,11/8(金) 11:35
reut,ロイター,台湾ＴＳＭＣ、米国の投資計画「変更なし」　米大統領選結果巡り,11/8(金) 11:30
reut,ロイター,Ｐ＆Ｇとユニリーバに大きな影響、米新政権がメキシコ関税導入なら,11/8(金) 11:28
reut,ロイター,米国目指す移民キャラバンが縮小、トランプ氏勝利で希望薄れる,11/8(金) 11:25
reut,ロイター,サッカー＝ソシエダード、久保交代後に決勝点奪われ敗れる　ＥＬ,11/8(金) 11:23
reut,ロイター,ＭＬＢ＝ドジャースからＦＡのカーショーが左足手術、来季復帰に意欲,11/8(金) 11:23
reut,ロイター,米金融界、トランプ氏再選で規制緩和に期待,11/8(金) 11:21
reut,ロイター,米ＣＤＣ、鳥インフル検査拡大を推奨　無症状感染者発見へ,11/8(金) 11:18
reut,ロイター,イスラエル、ガザ人道支援で前進　さらに対応必要＝米国防長官,11/8(金) 11:11
reut,ロイター,サッカー＝マンＵが初白星、ディアロが2得点　ＥＬ1次リーグ,11/8(金) 11:07
reut,ロイター,アングル：米銀はトランプ次期政権で大きな恩恵か、資本・買収規制緩和に期待,11/8(金) 11:03
reut,ロイター,インド当局、アマゾン・フリップカート出店者を家宅捜索＝政府筋,11/8(金) 10:59
reut,ロイター,豪ＡＮＺ、通期利益が市場予想下回る　競争激化とコスト増が響く,11/8(金) 10:52
reut,ロイター,ワーナーＣＥＯ、米次期政権でＭ＆Ａ許容に期待　7─9月は黒字確保,11/8(金) 10:43
reut,ロイター,エールフランスＫＬＭ、第3四半期営業利益が市場予想下回る,11/8(金) 10:33
reut,ロイター,イスラエル、仏外交職員を一時拘束　対立深まる,11/8(金) 10:26
reut,ロイター,米国債利回り急上昇、インフレ懸念が主因ではない＝ＦＲＢ議長,11/8(金) 10:20
reut,ロイター,イスラエル軍、ガザ北部で軍事作戦強化　避難所空爆で10人死亡,11/8(金) 10:16
reut,ロイター,2期目のトランプ氏は、自信を深めた金正恩氏とどう向き合うのか？以前よりも米国の影響力が弱まる可能性も,11/8(金) 10:13
reut,ロイター,住友ゴム、通期純利益を大幅下方修正　米子会社解散で,11/8(金) 10:10
reut,ロイター,日産株が急落、純損益予想取り下げ嫌気　営業益予想7割下方修正,11/8(金) 10:00
reut,ロイター,カリフォルニア州知事、トランプ氏との闘いに向け臨時州議会を招集,11/8(金) 9:54
reut,ロイター,アルゼンチン大統領、トランプ氏と来週会談　マスク氏とも,11/8(金) 9:52
reut,ロイター,ロシアのドローン攻撃で3人負傷、エネ施設も被害＝ウクライナ当局,11/8(金) 9:51
reut,ロイター,スター・ウォーズ新3部作、X-MENのＳ・キンバーグ氏が脚本担当,11/8(金) 9:29
reut,ロイター,サッカー＝仏代表、主将エムバペまた選外　監督「2試合のみ」,11/8(金) 9:25
reut,ロイター,米モデルナ、7─9月純損益が黒字転換　コロナワクチン売り上げ好調,11/8(金) 9:24
reut,ロイター,テニス＝錦織が2大会連続で8強入り、チャレンジャー,11/8(金) 9:20
reut,ロイター,トランプ氏、大統領首席補佐官にワイルズ氏起用　初の女性,11/8(金) 9:16
reut,ロイター,映像：プーチン氏、ロシアと北朝鮮の合同軍事演習の可能性示唆,11/8(金) 9:16
reut,ロイター,日経平均は反発で寄り付く、米ハイテク株高の流れ引き継ぐ,11/8(金) 9:14
reut,ロイター,「コーチ」の「マイケル・コース」買収一時停止、上訴の結果待ち,11/8(金) 9:09
reut,ロイター,ドル売り／円買い介入、 7月11日に3.1兆円・12日に2.3兆円＝財務省,11/8(金) 9:07
reut,ロイター,トランプ氏、不法移民を大量強制送還する公算大＝米調査,11/8(金) 9:00
reut,ロイター,テニス＝ＷＴＡファイナル、前回女王シフィオンテクが1次リーグ敗退,11/8(金) 8:56
reut,ロイター,再送-メキシコ大統領、トランプ氏と「友好的」対話　選挙後初の電話会談,11/8(金) 8:54
reut,ロイター,米下院選、共和が過半数まであと7議席　上院では民主との差広げる,11/8(金) 8:49
reut,ロイター,消費支出、9月は1.1％減　家計の「消費よりも貯蓄」続く,11/8(金) 8:38
reut,ロイター,プーチン氏がトランプ氏当選を祝福、対話の用意表明,11/8(金) 8:14
reut,ロイター,エヌビディア、時価総額が史上初3.6兆ドル突破　トランプ相場が支え,11/8(金) 8:11
reut,ロイター,ウクライナの中立維持が和平条件＝プーチン氏,11/8(金) 8:08
reut,ロイター,ゼレンスキー氏、トランプ氏の早期戦争終結計画「承知せず」,11/8(金) 7:52
reut,ロイター,ＮＹ市場サマリー（7日）ＦＯＭＣ受けドル下落、利回り低下　Ｓ＆Ｐとナスダック続伸,11/8(金) 7:19
reut,ロイター,プーチン大統領、中国はロシアの同盟国　台湾巡る立場を支持,11/8(金) 7:17
reut,ロイター,米金利先物、12月と来年の追加利下げを予想　ＦＯＭＣ受け,11/8(金) 6:30
reut,ロイター,プーチン氏、ロシアと北朝鮮の合同軍事演習の可能性示唆,11/8(金) 6:29
reut,ロイター,米国株式市場＝Ｓ＆Ｐとナスダック続伸、ＦＲＢが予想通り追加利下げ,11/8(金) 6:26
reut,ロイター,トランプ氏関税案、完全導入の公算小　実施ならインフレ再燃＝Ｓ＆Ｐ,11/8(金) 6:25
reut,ロイター,トランプ氏、プーチン氏と選挙後対話なし　いずれ「話す」＝報道,11/8(金) 6:24
reut,ロイター,ＦＲＢ議長、トランプ氏に求められても「辞任せず」　法の存在強調,11/8(金) 5:51
reut,ロイター,米ＦＯＭＣ声明全文,11/8(金) 5:49
reut,ロイター,情報ＢＯＸ：パウエル米ＦＲＢ議長の会見要旨,11/8(金) 5:10
reut,ロイター,冷戦後の西側主導の秩序は崩壊、新秩序形成の闘争進行中＝プーチン氏,11/8(金) 5:08
reut,ロイター,プーチン氏、トランプ氏と対話の用意　大統領選勝利を祝福,11/8(金) 4:43
reut,ロイター,ＦＲＢ0.25％利下げ、全会一致で決定　議長「慎重かつ忍耐強く」,11/8(金) 4:19
reut,ロイター,北朝鮮兵士に死傷者、ウクライナ軍との交戦で　ゼレンスキー氏が対応要請,11/8(金) 4:06
reut,ロイター,米国務長官、政権移行調整担う大使を指名　残り任期は目下の課題に注力,11/8(金) 4:05
reut,ロイター,訂正-トランプ氏、パウエルＦＲＢ議長の任期全う認める公算＝報道,11/8(金) 3:34
reut,ロイター,ＣＯＰ２９合意達成に懸念、米大統領選トランプ氏勝利で,11/8(金) 3:31
reut,ロイター,欧州首脳、ウクライナ支援継続呼びかけ　次期米政権にメッセージ,11/8(金) 3:30
reut,ロイター,バイデン氏、国民に「緊張緩和」呼びかけ　米大統領選受け演説,11/8(金) 2:29
reut,ロイター,トランプ氏の関税政策、欧州経済に打撃の恐れ＝ギリシャ中銀総裁,11/8(金) 2:27
reut,ロイター,米卸売在庫、9月は0.2％減　自動車が大幅減,11/8(金) 2:25
reut,ロイター,ドイツ、来年度ウクライナ支援は確保　連立政権崩壊でも＝関係筋,11/8(金) 2:24
reut,ロイター,トランプ氏の大統領2期目、より制約少なく,11/8(金) 2:22
reut,ロイター,ロシア攻撃で4人死亡、ウクライナ・ザポロジエ　がんセンターなど損傷,11/8(金) 1:19
reut,ロイター,米大統領選の結果、イランにとって重要でない＝ペゼシュキアン大統領,11/8(金) 1:17
reut,ロイター,ゼレンスキー氏、「力による平和」への回帰必要　欧州各国に呼びかけ,11/8(金) 1:16
reut,ロイター,米に停戦期待託さず、言葉より行動を＝ヒズボラ幹部,11/8(金) 1:15
reut,ロイター,ウクライナ問題解決目指すとのトランプ氏発言を「留意」＝ロシア報道官,11/8(金) 0:26
reut,ロイター,米軍、政治に関与せず　秩序ある政権移行に尽力＝国防長官,11/8(金) 0:23
reut,ロイター,貿易障壁の高まり、新たな経済リスクに＝オランダ中銀総裁,11/7(木) 23:45
reut,ロイター,米労働生産性、第3四半期は前期比2.2％上昇　人件費が増加,11/7(木) 23:43
reut,ロイター,仏、北朝鮮代表を呼び抗議　ロシア派兵巡り,11/7(木) 23:42
reut,ロイター,米新規失業保険申請は3000件増の22.1万件、小幅増で予想と一致,11/7(木) 23:33
reut,ロイター,英中銀、0.25％利下げ　金利4.75％　予算案受けた物価高予想,11/7(木) 22:03
reut,ロイター,ウクライナ停戦交渉、西側は現実受け入れる必要　ロシアが主張,11/7(木) 20:58
reut,ロイター,イスラエル、米ボーイングからＦ１５戦闘機25機購入へ　52億ドル,11/7(木) 20:23
reut,ロイター,ドイツ銀、ＥＣＢ最終到達金利予想1.5％に下げ　関税リスクで,11/7(木) 20:06
reut,ロイター,ユーロ圏小売売上高、9月は予想上回る　8月も上方改定,11/7(木) 20:05
reut,ロイター,トルコ、次期トランプ政権で関税引き下げ予想　リラ上昇,11/7(木) 20:03
reut,ロイター,ノルウェー中銀、政策金利据え置き　制約的政策を維持,11/7(木) 19:19
reut,ロイター,自民懇談会、参院選へ刷新必要も予算優先との意見多数＝西田議員,11/7(木) 19:06
reut,ロイター,ユーロ圏企業、利益率への圧力続く見通し＝ＥＣＢ調査,11/7(木) 19:01
reut,ロイター,ＥＣＢバランスシート縮小、金融市場機能正常化に寄与＝シュナーベル氏,11/7(木) 18:59
reut,ロイター,中国人民銀の金準備、10月も横ばい　6カ月連続購入見送り,11/7(木) 18:45
reut,ロイター,スウェーデン中銀、予想通り0.5％利下げ　12月と上期に追加緩和,11/7(木) 18:32
reut,ロイター,東京マーケット・サマリー（7日）,11/7(木) 18:22
reut,ロイター,ドイツの輸出・鉱工業生産、9月は予想以上に減少　工業の不振鮮明,11/7(木) 18:17
reut,ロイター,焦点：トランプ氏勝利でドル高継続か、為替市場に「地殻変動」の兆し,11/7(木) 18:10
reut,ロイター,ドイツは依然機能、財務相解任は正しい決断＝経済相,11/7(木) 17:51
reut,ロイター,ＫＤＤＩ、ラックを完全子会社化へ　1株1160円でＴＯＢ,11/7(木) 17:44
reut,ロイター,フジクラ、通期業績を上方修正　データセンター向け需要好調,11/7(木) 17:43
reut,ロイター,オアシスがＮＥＣネッツエスアイ株を6.01％保有、大量保有報告,11/7(木) 17:42
reut,ロイター,日産、グローバルで生産能力20％・9000人削減へ　三菱自株も一部売却,11/7(木) 17:07
reut,ロイター,日産、生産能力と人員削減で純損益予想取り下げ　販売不振続く,11/7(木) 16:54
reut,ロイター,太陽誘電、需要低迷で通期予想を下方修正　純損益はトントンに,11/7(木) 16:43
reut,ロイター,ローム、今期は12年ぶりの営業赤字へ　生産調整を継続,11/7(木) 16:41
reut,ロイター,ＵＳスチール買収に自信、日鉄副会長「間違いなく年末までにクローズ」,11/7(木) 16:40
reut,ロイター,Ｉ−ＰＥＸがＭＢＯ、1株2950円で公開買い付け,11/7(木) 16:22
reut,ロイター,焦点：歴史的選挙戦戦ったハリス氏、なぜ敗北したのか,11/7(木) 16:14
reut,ロイター,資生堂が下方修正、前年から純利益7割減に　中国で不振,11/7(木) 16:11
reut,ロイター,日経平均は3日ぶり反落、トランプ・トレードの反動で値がさ株に売り,11/7(木) 16:06
reut,ロイター,味の素、発行済み株式の1.98％・400億円上限に自社株買い,11/7(木) 15:54
reut,ロイター,日本製鉄、通期事業利益予想を6700億円に下方修正　在庫評価損で,11/7(木) 15:51
reut,ロイター,トランプ氏の勝因は何か、「有権者の怒り」「人工中絶」「有色人種層」がカギに,11/7(木) 15:45
reut,ロイター,午後3時のドルは154円前半へ反落、ＦＯＭＣ控え持ち高調整,11/7(木) 15:42
reut,ロイター,アングル：「トランプ外交」再び、戦火の世界が向かうのは混乱か緩和か,11/7(木) 15:41
reut,ロイター,ＴＯＰＩＸ採用企業の今期純利益0.4％増、夏場の円高が伸び抑制＝ＳＭＢＣ日興集計,11/7(木) 15:40
reut,ロイター,中国、成長促進へ銀行間預金金利の引き下げ要請＝ブルームバーグ,11/7(木) 15:26
reut,ロイター,今年も観測史上最も暑い年に、昨年の記録更新＝ＥＵ機関,11/7(木) 14:58
reut,ロイター,中国人民銀、景気支援する金融政策継続へ　総裁が表明,11/7(木) 14:51
reut,ロイター,ＮＢＡ＝グリズリーズがレーカーズ下す、河村は約2分プレー　八村欠場,11/7(木) 14:35
reut,ロイター,ゴルフ＝ロッテ選手権、吉田が首位と2打差の7位スタート,11/7(木) 14:33
reut,ロイター,アマゾンの森林破壊面積、9年ぶり水準に縮小　前年比30％減,11/7(木) 14:31
reut,ロイター,ウニクレディト、第3四半期利益が予想超え　通年見通し引き上げ,11/7(木) 14:30
