media_en,media_jp,title_articles,date_original
reut,ロイター,フィギュア＝ＧＰフランス大会、女子の樋口と男子の島田が2位,11/3(日) 8:40
reut,ロイター,アングル：中国政府、学習塾規制を水面下で緩和　就職難の大卒者の受け皿に,11/3(日) 8:05
reut,ロイター,焦点：米大統領選、激戦州選管が偽情報対策や警備を強化,11/3(日) 8:05
reut,ロイター,アングル：プロサーファーの夢を追うパキスタンの若者,11/3(日) 8:04
reut,ロイター,ウクライナ大統領、北朝鮮軍関与巡る西側の「無反応ぶり」を非難　北朝鮮外相は「勝利までロシアを支援」と表明,11/2(土) 16:07
reut,ロイター,ＮＢＡ＝レーカーズ白星、デービスがダブルダブル　八村9得点,11/2(土) 14:15
reut,ロイター,テニス＝ルバキナがイワニセビッチ氏と契約、ジョコビッチの元コーチ,11/2(土) 14:14
reut,ロイター,テニス＝マスターズ・パリ大会、ズベレフが4強入り,11/2(土) 14:12
reut,ロイター,アングル：ハリス氏陣営、「労組の男性」の支持確保に苦心,11/2(土) 13:59
reut,ロイター,ドジャースが優勝パレード、ロサンゼルスで36年ぶり　大谷・山本も英語でファンに感謝,11/2(土) 12:44
reut,ロイター,サッカー＝マンＵ新監督にアモリン氏、守田所属スポルティングから,11/2(土) 10:58
reut,ロイター,Ｆ１＝ブラジルＧＰスプリント予選、ピアストリがトップ　角田は18番手,11/2(土) 10:57
reut,ロイター,ＭＬＢ＝菊池や藤浪がフリーエージェントに、ソトもリスト入り,11/2(土) 10:56
reut,ロイター,フィギュア＝ＧＰフランス大会、樋口がＳＰで3位,11/2(土) 10:55
reut,ロイター,テニス＝錦織、チャレンジャー大会でベスト4進出,11/2(土) 10:53
reut,ロイター,五輪＝競歩の池田、ドーピング疑惑で暫定資格停止処分　東京で銀,11/2(土) 9:24
reut,ロイター,ＭＬＢ＝ドジャースが優勝パレード、ロサンゼルスで36年ぶり,11/2(土) 9:22
reut,ロイター,アングル：国家予算の3分の1が軍事支出、さらなる増税迫られるロシア,11/2(土) 8:25
reut,ロイター,トランプ氏の政敵への発言、州法違反の可能性＝アリゾナ州司法長官,11/2(土) 8:18
reut,ロイター,北朝鮮、ミサイル発射は「自衛」のため─金与正氏＝ＫＣＮＡ,11/2(土) 8:14
reut,ロイター,米エヌビディア、ダウ構成銘柄に採用　インテル除外,11/2(土) 8:07
reut,ロイター,ウクライナへの武器供与に「あらゆるシナリオを検討中」＝韓国外相,11/2(土) 8:02
reut,ロイター,アップル、グローバルスターに最大15億ドル投資　通信サービス拡充で,11/2(土) 6:30
reut,ロイター,ガザ北部「破滅的」、攻撃停止と民間人保護呼びかけ　国連機関が声明,11/2(土) 6:20
reut,ロイター,ＮＹ市場サマリー（1日）株価反発、ドルと利回り上昇,11/2(土) 6:17
reut,ロイター,米の中東停戦交渉が不発に終わる、外交筋「提案は非現実的」,11/2(土) 6:16
reut,ロイター,ＮＹ外為市場＝ドル上昇、米雇用者数の急減速を消化,11/2(土) 6:15
reut,ロイター,米国株式市場＝反発、アマゾン急騰が軟調な雇用統計を相殺,11/2(土) 6:13
reut,ロイター,米情報機関、ロシアを非難　南部州での不正投票偽る動画巡り,11/2(土) 6:11
reut,ロイター,中国、スロバキアとの緊密関係確認　ＥＵと貿易対立下で,11/2(土) 3:53
reut,ロイター,ガザのポリオ予防接種、2日再開　対象地域は縮小,11/2(土) 3:50
reut,ロイター,9月の米建設支出、前月比＋0.1％＝商務省,11/2(土) 3:49
reut,ロイター,アングル：米大統領選で4年前の悪夢再来も、トランプ氏の結果覆す企て懸念,11/2(土) 2:47
reut,ロイター,米大統領選前の中東停戦期待潰える、イスラエルの攻撃が継続,11/2(土) 1:26
reut,ロイター,米特使、北極圏での中ロの軍事協力　「懸念すべきシグナル」,11/2(土) 1:20
reut,ロイター,格付け会社2社、英国の厳しい財政状況を強調　新たな予算案受け,11/2(土) 0:52
reut,ロイター,イラン、ミサイル長射程化と核政策変更示唆　イスラエルに適時対応,11/2(土) 0:50
reut,ロイター,米エクソン、第3四半期利益が市場予想上回る　好調な生産量で,11/2(土) 0:49
reut,ロイター,米ＩＳＭ製造業景気指数、10月は46.5に低下　23年7月以来の水準,11/2(土) 0:14
reut,ロイター,11月ＦＯＭＣ0.25％利下げほぼ確実、10月雇用統計受け,11/2(土) 0:13
reut,ロイター,米10月雇用1.2万人増、予想大きく下回る　ストや自然災害響く,11/1(金) 22:12
reut,ロイター,米シェブロン、第3四半期利益が予想を上回る　生産増が寄与,11/1(金) 20:03
reut,ロイター,米、レバノンにイスラエルとの一方的停戦宣言要請か　当局者ら否定,11/1(金) 19:49
reut,ロイター,ロシア、10月にドローン2000機以上発射　過半を迎撃＝ウクライナ,11/1(金) 19:43
reut,ロイター,英製造業ＰＭＩ、10月改定49.9　4月以来の50割れ,11/1(金) 19:33
reut,ロイター,スイスＣＰＩ、9月は前年比＋0.6％　3年強ぶり低い伸び,11/1(金) 19:27
reut,ロイター,三菱自社長「来年3月めど」、日産・ホンダとの協業内容,11/1(金) 19:08
reut,ロイター,南ア製造業ＰＭＩ、10月は2カ月連続で50超え＝アブサ,11/1(金) 19:02
reut,ロイター,インタビュー：向こう半年は利上げ急ぐべきでない＝玉木国民民主代表,11/1(金) 18:55
reut,ロイター,ロシア外相、ＥＵ加盟国訪問へ　ウクライナ侵攻後初＝現地紙,11/1(金) 18:52
reut,ロイター,ロ朝外相が会談、崔氏「勝利の日までロシアを支援」,11/1(金) 18:32
reut,ロイター,モーリシャス、選挙後までソーシャルメディア停止　盗聴問題受け,11/1(金) 18:29
reut,ロイター,東京マーケット・サマリー（1日）,11/1(金) 18:20
reut,ロイター,タイ人4人、ロケット弾で死亡　イスラエルとレバノン国境付近,11/1(金) 18:09
reut,ロイター,今年度の成長率を引き下げ、民間議員「十分な経済対策」提言＝諮問会議,11/1(金) 18:07
reut,ロイター,トルコ製造業ＰＭＩ、10月は45.8に上昇　7カ月連続50割れ,11/1(金) 17:57
reut,ロイター,米ベイン、富士ソフトのＴＯＢ　賛同得られれば11月上旬に開始,11/1(金) 17:56
reut,ロイター,イスラエル軍、ベイルート南郊を空爆　停戦に悲観的見方も,11/1(金) 17:40
reut,ロイター,ガザ中部で47人死亡、イスラエル軍が爆撃＝パレスチナ通信社,11/1(金) 17:30
reut,ロイター,英住宅価格、10月は前月比＋0.1％　依然底堅い＝ネーションワイド,11/1(金) 17:20
reut,ロイター,インドネシア、グーグルスマホも販売禁止　現地調達率未達で,11/1(金) 17:03
reut,ロイター,韓国製造業ＰＭＩ、10月は48.3で横ばい　生産が大きく落ち込む,11/1(金) 16:58
reut,ロイター,中国、公的債務の監視強化へ　中央・地方政府に報告義務付け,11/1(金) 16:21
reut,ロイター,ＧＰＩＦ、7―9月期は9.1兆円の赤字　4四半期ぶりマイナス運用,11/1(金) 16:08
reut,ロイター,中国軍の研究機関、米メタ「ラマ」活用し軍事用ＡＩツール開発,11/1(金) 16:06
reut,ロイター,ＤＭＧ森精機、太陽工機に1株1875円でＴＯＢ　完全子会社化へ,11/1(金) 15:46
reut,ロイター,ＫＤＤＩが1対2の株式分割、1000億円上限に自社株買い,11/1(金) 15:38
reut,ロイター,日経平均は大幅続落、連休前に手じまい　日銀利上げの警戒くすぶる,11/1(金) 15:34
reut,ロイター,午後3時のドルは152円半ばへ反発、米雇用統計前に買い戻し,11/1(金) 15:30
reut,ロイター,イラク政府、領内からの対イスラエル攻撃を警戒　対応進める,11/1(金) 15:26
reut,ロイター,米議事堂前に巨大なうんち、襲撃事件の暴徒を「称える」皮肉な銘文,11/1(金) 15:21
reut,ロイター,村田製作所4―9月期営業益13％増、ＡＩ関連けん引　円安で上積み,11/1(金) 15:18
reut,ロイター,野村ＨＤの7―9月期、純利益は2.8倍の984億円　全部門で収益拡大,11/1(金) 15:13
reut,ロイター,ＴＤＫ、通期営業利益予想を2200億円に上方修正,11/1(金) 15:02
reut,ロイター,インドネシアＣＰＩ、10月は＋1.71％に鈍化　コア1年超ぶり高水準,11/1(金) 14:58
reut,ロイター,年収の壁突破、公明党から前向きな発言＝国民民主幹事長,11/1(金) 14:52
reut,ロイター,三菱ケミカルＧ、通期営業益2180億円に上方修正　市場予想は下回る,11/1(金) 14:45
reut,ロイター,最低賃金引き上げ継続なら、サービス価格中心に物価押し上げ＝日銀,11/1(金) 14:40
reut,ロイター,ＵＢＳの資本要件、破綻処理準備体制が決定要因＝スイス財務相,11/1(金) 14:30
reut,ロイター,クーグラーＦＲＢ理事、倫理規定に抵触　配偶者が株購入,11/1(金) 14:23
reut,ロイター,三井物、25年3月期純利益見通しを200億円上積み　市場予想上回る,11/1(金) 14:20
reut,ロイター,ロシア、軍事費さらに増額へ　予算再配分で＝財務相,11/1(金) 14:17
reut,ロイター,イカゲーム待望の新シリーズが年末配信へ、完結編シーズン3も「編集作業中」,11/1(金) 14:13
reut,ロイター,吸血鬼として葬られたか　400年前の若い女性の骨から生前の顔を再現　ポーランド,11/1(金) 14:03
reut,ロイター,イスラエルの入植者、トランプ氏勝利なら制裁解除と期待,11/1(金) 13:50
reut,ロイター,トヨタ、基金を通じ国際パラリンピック委員会支援を表明,11/1(金) 13:47
reut,ロイター,ＳＵＢＡＲＵ、円安効果で4━9月期営業益19.5％増　通期予想は維持,11/1(金) 13:44
reut,ロイター,旭化成、通期営業利益予想を1950億円に上方修正　市場予想上回る,11/1(金) 13:26
reut,ロイター,ＮＢＡ＝レブロン、米大統領選でハリス氏支持　「選択肢は明確」,11/1(金) 13:25
reut,ロイター,バルト海で衛星信号妨害、ロシアの制裁逃れか　フィンランドが指摘,11/1(金) 13:22
reut,ロイター,ＮＢＡ＝グリズリーズ勝利、モラントがトリプルダブル　河村も出場,11/1(金) 13:21
reut,ロイター,ＮＢＡ＝ラプターズのバーンズが右眼窩骨折、少なくとも3週間離脱へ,11/1(金) 13:18
reut,ロイター,ＭＬＢ＝エンゼルスが元本塁打王ソレア獲得、キャニングとトレード,11/1(金) 13:14
reut,ロイター,アフリカのエムポックス感染者数、前年比500％増＝アフリカＣＤＣ,11/1(金) 13:12
reut,ロイター,豪9月の家計支出、前月比0.1％減,11/1(金) 13:08
reut,ロイター,サウジＧＤＰ、第3四半期は前年比2.8％増　非石油部門好調,11/1(金) 12:58
reut,ロイター,旭化成、発行済み株式の2.52％・300億円を上限に自社株買いを決議,11/1(金) 12:55
reut,ロイター,中国の代理出産女性、あっせん業者に逃げられるトラブル　保健当局が調査,11/1(金) 12:51
reut,ロイター,三菱商の4─9月期、ローソン再評価益などで3割増益　通期は据え置き,11/1(金) 12:49
reut,ロイター,豪マッコーリー、上期利益は予想に届かず　商品取引部門が低調,11/1(金) 12:45
reut,ロイター,投資銀ラザード、第3四半期は大幅増収増益　Ｍ＆Ａ再開で,11/1(金) 12:40
reut,ロイター,ブラジル7─9月期失業率、6.4％に低下　予想以上に改善,11/1(金) 12:35
reut,ロイター,映像：スペイン洪水の死者、155人超える　行方不明者の捜索続く,11/1(金) 12:34
reut,ロイター,ファミマＴＯＢ価格、高裁も安すぎと判断　非公開化価格設定に影響も,11/1(金) 12:28
reut,ロイター,丸紅、通期純利益予想を据え置き　4─9月期は5％減,11/1(金) 12:24
reut,ロイター,日経平均は大幅続落、米株安や円高を嫌気　連休明けの波乱警戒した手じまい売りも,11/1(金) 12:21
reut,ロイター,原油先物1ドル超上昇、イランがイスラエル攻撃準備と報道,11/1(金) 12:17
reut,ロイター,米選挙関連偽情報はロシア組織が関与の公算、ジョージア州が見解,11/1(金) 12:15
reut,ロイター,ベトナム、中国拘束の漁業従事者解放を要求　南シナ海西沙諸島で,11/1(金) 12:11
reut,ロイター,サッカー＝スペイン連盟、バレンシア地域の全試合を延期　洪水被害で,11/1(金) 12:02
reut,ロイター,ＪＰモルガン、和解へ1.5億ドル支払い　自社商品の説明不足巡り,11/1(金) 11:42
reut,ロイター,中国新築住宅価格、10月は前月比＋0.29％にやや加速＝民間調査,11/1(金) 11:38
reut,ロイター,米政府、北朝鮮軍が「数日以内に」前線に投入されるとの見方　　ウ軍との戦闘参加なら「正当な軍事標的」,11/1(金) 11:37
reut,ロイター,米政権、ＮＹの半導体施設に8.25億ドル投資　ＥＵＶ研究をけん引,11/1(金) 11:36
reut,ロイター,ＮＺ、湾岸協力会議と貿易協定締結　輸出業者に大きな商機,11/1(金) 11:31
reut,ロイター,財新・中国製造業ＰＭＩ、10月は50超え　新規受注が拡大,11/1(金) 11:22
reut,ロイター,立憲とも政策・案件ごとに連携、各党と等距離で＝国民民主幹事長,11/1(金) 11:17
reut,ロイター,トランプ氏、激戦州ペンシルベニアで「選挙不正判明」と虚偽の主張,11/1(金) 11:13
reut,ロイター,日本は財政健全化を、新たな支出への国債発行回避すべき＝ＩＭＦ高官,11/1(金) 11:03
reut,ロイター,金融政策手法、今後の利上げ含め日銀に委ねられるべき＝官房長官,11/1(金) 10:56
reut,ロイター,イスラエル軍がヨルダン川西岸のＵＮＲＷＡ事務所破壊＝事務局長,11/1(金) 10:54
reut,ロイター,ＭＬＢ＝大谷のＷＳ制覇に日本のファンも歓喜、「夢をありがとう」,11/1(金) 10:41
reut,ロイター,エジプト、イスラエルの軍事作戦支援を否定　爆発物巡る報道受け,11/1(金) 10:39
reut,ロイター,ＭＬＢ＝ドジャース右腕ハドソンが現役引退、ＷＳ制覇2回,11/1(金) 10:37
reut,ロイター,アジア経済、貿易摩擦や中国成長鈍化がリスク＝ＩＭＦ,11/1(金) 10:33
reut,ロイター,サッカー＝ラツィオがコモ下す、2連勝で5位浮上　セリエＡ,11/1(金) 10:27
reut,ロイター,「ファラオのように飛べ」、ピラミッド上空でスカイダイビング　エジプト（字幕・30日）,11/1(金) 10:26
reut,ロイター,イカゲーム新シリーズ年末配信へ、監督「さらに目離せない展開に」,11/1(金) 10:13
reut,ロイター,負傷のブラジル大統領がＡＰＥＣ会議出席取りやめ、Ｇ２０に集中,11/1(金) 10:13
reut,ロイター,米マスターカード、第3四半期利益は市場予想上回る　消費堅調で,11/1(金) 10:10
reut,ロイター,フォード、業績改善しなければ管理職のボーナス減額へ＝関係筋,11/1(金) 9:58
reut,ロイター,英アストラゼネカの中国法人社長を当局が調査、詳細不明,11/1(金) 9:52
reut,ロイター,サッカー＝スペイン国王杯、アトレチコなど勝利　久保の試合は延期,11/1(金) 9:52
reut,ロイター,テニス＝第2シードのアルカラスが3回戦敗退、マスターズ・パリ大会,11/1(金) 9:49
reut,ロイター,米ボーイング労組執行部、38％賃上げ案を支持　週明けに組合員投票,11/1(金) 9:49
reut,ロイター,大谷翔平、悲願のワールドシリーズ優勝　日本のファンも歓喜に沸く,11/1(金) 9:46
reut,ロイター,チャットＧＰＴに新検索機能、リンク表示追加　グーグルと激しい競争に,11/1(金) 9:44
reut,ロイター,トランプ氏、ＣＢＳを提訴　ハリス氏インタビュー巡り,11/1(金) 9:42
reut,ロイター,韓国10月輸出は7カ月ぶり低い伸び、米大統領選巡る不透明感高まる,11/1(金) 9:39
reut,ロイター,米コノコフィリップス、第3四半期は利益が市場予想上回る,11/1(金) 9:17
reut,ロイター,日経平均は続落で寄り付く、円高や米株安で　一時800円超安,11/1(金) 9:14
reut,ロイター,ウクライナ外相「米の支援継続確信」、大統領選結果にかかわらず,11/1(金) 9:06
reut,ロイター,ＢＩＳ、中銀デジタル通貨の国境を越えた決済基盤プロジェクトから撤退,11/1(金) 8:58
reut,ロイター,米裁判所、マスク氏訴訟の手続き保留を決定　大統領選に向けた100万ドル配布で,11/1(金) 7:57
reut,ロイター,北朝鮮、31日発射は新型ＩＣＢＭ「火星１９」　「最強の戦略ミサイル」と主張,11/1(金) 7:34
reut,ロイター,原油先物は続伸、イランがイスラエル攻撃準備との報道で,11/1(金) 7:14
reut,ロイター,ＮＹ市場サマリー（31日）米国株続落、ドル／円下落、2年債利回り3カ月ぶり高水準,11/1(金) 7:11
reut,ロイター,アップル、見通しさえず株下落　第4四半期は予想上回る,11/1(金) 7:08
reut,ロイター,インテル、第4四半期売上高見通しが予想上回る　株価12％高,11/1(金) 7:05
reut,ロイター,アマゾン、第3四半期利益・売上高が予想超え　ネット通販の改善で,11/1(金) 7:03
reut,ロイター,イスラエルとレバノン、国連決議履行に向け進展＝米国務長官,11/1(金) 7:01
reut,ロイター,米国株式市場＝続落、ＡＩ投資懸念でメタ・マイクロソフトに売り,11/1(金) 5:29
reut,ロイター,ＮＹ外為市場＝ドル／円下落、経済指標受け米利下げ観測維持,11/1(金) 5:28
reut,ロイター,イラン、米大統領選前にイスラエル攻撃か　イラク領内から＝アクシオス,11/1(金) 5:25
reut,ロイター,スペイン洪水の死者、155人超える　行方不明者の捜索続く,11/1(金) 5:23
reut,ロイター,ロシア、北朝鮮兵を近く前線へ　クルスク州に8000人＝米国務長官,11/1(金) 5:21
reut,ロイター,ロシアは北朝鮮部隊増強も、西側・中国の無反応に驚き＝ウクライナ,11/1(金) 3:16
reut,ロイター,ドイツ、国内のイラン領事館を閉鎖へ　独系イラン人の死刑執行で,11/1(金) 3:14
reut,ロイター,トランプ氏再選なら「医療保険縮小へ」　ハリス氏が有権者に警告,11/1(金) 3:08
reut,ロイター,日米韓、北朝鮮のＩＣＢＭ発射を強く非難　外相が電話会談,11/1(金) 3:05
reut,ロイター,ロシア、イランとの包括戦略条約で「緊密な防衛協力」＝ラブロフ外相,11/1(金) 3:02
reut,ロイター,ロシア・クルスクに北朝鮮兵士8000人か、情報入手と米国連代理大使,11/1(金) 3:01
reut,ロイター,サウジ外相、イスラエルのガザ北部攻撃を「大量虐殺」と非難,11/1(金) 1:29
reut,ロイター,イスラエル、イランのどこにでも到達可能　核兵器開発阻止が優先課題＝首相,11/1(金) 1:28
reut,ロイター,国連安保理、北朝鮮ミサイル巡り4日にも会合　日米韓など要請,11/1(金) 1:26
reut,ロイター,中国Ｔｅｍｕ、欧州の偽ブランド品販売防止グループへの参加検討,11/1(金) 1:06
reut,ロイター,ＦＲＢの11・12月0.25％利下げ観測高まる、指標がインフレ緩和示唆,11/1(金) 0:38
reut,ロイター,ウーバー、第4・四半期見通し低調　株価9％安,11/1(金) 0:36
reut,ロイター,イスラエル北部で5人死亡、レバノン南部では医療従事者6人犠牲に,11/1(金) 0:35
reut,ロイター,米雇用コスト、第3四半期0.8％上昇　約3年ぶりの小さな伸び,11/1(金) 0:32
reut,ロイター,イスラエル軍、ガザ全域で攻撃継続　46人死亡　病院も被害,10/31(木) 23:47
reut,ロイター,米新規失業保険申請、3週連続減　ハリケーンによる歪み解消,10/31(木) 23:44
reut,ロイター,米ＰＣＥ価格、9月前年比＋2.1％に鈍化　コア3カ月連続＋2.7％,10/31(木) 22:05
reut,ロイター,米人員削減、10月3カ月ぶり低水準　ボーイングのストでも＝チャレンジャー,10/31(木) 20:58
reut,ロイター,中国人民銀、新型オペで10月に5000億元供給　期間6カ月,10/31(木) 20:20
reut,ロイター,トマホーク供与要請、ウクライナの焦り示す＝ロシア大統領府,10/31(木) 20:08
reut,ロイター,イスラエル、シリア中部の集合住宅を攻撃＝国営通信,10/31(木) 19:53
reut,ロイター,ユーロ圏ＣＰＩ、10月速報前年比＋2.0％　予想以上に加速,10/31(木) 19:43
reut,ロイター,エジプト、イスラエル領内への武器密輸否定　ドローン撃墜受け,10/31(木) 19:41
reut,ロイター,ＥＣＢ、インフレの過度な低下リスク回避すべき＝イタリア中銀総裁,10/31(木) 19:39
reut,ロイター,香港ＧＤＰ、第3四半期は前年比1.8％増　予想下回る,10/31(木) 19:33
reut,ロイター,韓国当局、北朝鮮へのビラ散布を阻止　拉致被害者家族が計画,10/31(木) 19:30
reut,ロイター,独プラント・設備受注、9月は再び減少　国内が2桁減＝ＶＤＭＡ,10/31(木) 19:22
reut,ロイター,ＡＢインベブ、第3四半期決算が予想下回る　自社株買い発表,10/31(木) 19:17
reut,ロイター,ＡＮＡＨＤ通期純利益を上方修正、ボーイング機受領は数カ月遅延,10/31(木) 19:13
reut,ロイター,ロシア、ウクライナ南部オデーサの橋を攻撃　弾道ミサイル発射,10/31(木) 18:52
reut,ロイター,英財務相、景気支援措置を準備　追加の増税回避の方針,10/31(木) 18:50
reut,ロイター,スイス中銀、第3四半期は65.5億ドルの黒字　金上昇が寄与,10/31(木) 18:46
reut,ロイター,スエズ運河航路の利用再開、来年以降にずれ込み＝マースクＣＥＯ,10/31(木) 18:43
reut,ロイター,東京マーケット・サマリー（31日）,10/31(木) 18:37
reut,ロイター,ステランティス、第3四半期は27％減収　在庫圧縮,10/31(木) 18:35
reut,ロイター,インドネシア、領土保護で「適切に対応」　中国船のＥＥＺ侵入で,10/31(木) 18:16
reut,ロイター,英シェル、第3四半期利益は予想上回る　精製低迷もＬＮＧ販売増,10/31(木) 18:06
reut,ロイター,台湾ＧＤＰ、第3四半期は予想上回る前年比＋3.97％　ＡＩ好調,10/31(木) 17:58
reut,ロイター,独小売売上高指数、9月は＋1.2％　予想外の上昇,10/31(木) 17:27
reut,ロイター,仏ソジェン、第3四半期純利益が4倍以上に　国内リテール回復,10/31(木) 17:26
reut,ロイター,Ｘ上で急増する米選挙関連の偽情報、対策の効果不十分＝報告書,10/31(木) 16:58
reut,ロイター,ニコン、通期業績を下方修正　半導体市況の回復遅れ,10/31(木) 16:45
reut,ロイター,野村証券、金融庁から課徴金納付命令　国債先物の相場操縦,10/31(木) 16:44
reut,ロイター,北朝鮮のＩＣＢＭ、1.5万キロ超の射程になり得る＝林官房長官,10/31(木) 16:41
reut,ロイター,ウクライナ、北朝鮮派遣兵の統括役を安保理に報告　金正恩氏側近,10/31(木) 16:31
reut,ロイター,英国債急落、予算案がインフレ押し上げ・利下げ抑制との見方,10/31(木) 16:24
reut,ロイター,今後「時間的余裕」は使わない、毎回会合で情勢判断＝植田日銀総裁,10/31(木) 16:22
reut,ロイター,ＢＮＰパリバ、第3四半期純利益は予想と一致　投資銀行部門が堅調,10/31(木) 16:17
reut,ロイター,イオンと京成電が株式持ち合い、商業施設の開発などで提携,10/31(木) 16:12
reut,ロイター,三菱電、4─9月期は3割の営業増益　通期予想は据え置き,10/31(木) 16:11
reut,ロイター,京成電鉄、12月31日時点の株主に1対3の株式分割,10/31(木) 16:10
reut,ロイター,日本精工、一転営業減益見通しへ　自動車生産台数下振れで,10/31(木) 16:00
reut,ロイター,パナソニックＨＤ、4―9月期営業益は12％増　通期見通し据え置き,10/31(木) 15:58
reut,ロイター,武田薬、通期営業益予想を2650億円に上方修正,10/31(木) 15:53
reut,ロイター,富士通、通期の営業利益予想を下方修正　市場予測下回る,10/31(木) 15:51
reut,ロイター,外為どっとコム、マネパＧにＴＯＢ　1株475円,10/31(木) 15:44
reut,ロイター,日特殊陶、通期営業益予想20％増に上方修正　補修用品販売上振れや円安寄与,10/31(木) 15:41
reut,ロイター,午後3時のドルはじり安152円後半、日銀会合後に円買い戻し,10/31(木) 15:37
reut,ロイター,日経平均は4日ぶり反落、一時400円超安　日銀会合後の円高進行で,10/31(木) 15:31
