media_en,title_articles,link_articles,date_original
khks,今季のサンマが水揚げ　秋の味覚に市場沸く　宮城・女川港,https://news.yahoo.co.jp/articles/1722cf2a014ff8663d7763a5284ff8bf7ceab9f8,9/27(水) 12:05
khks,暑かった東北夏祭り、多かった人出!　盛岡さんさは22年の2・1倍　日銀各支店まとめ,https://news.yahoo.co.jp/articles/49fbf4d2ff74256586d29e25b180be6bcc9d5e88,9/27(水) 7:00
khks,仙台・錦ケ丘に温浴施設、10月6日オープン　目玉はアート映像などを楽しめる岩盤浴,https://news.yahoo.co.jp/articles/d172039c8896ca653368e0d3739cd1d571f3611e,9/27(水) 7:00
khks,サイズは「ワンコイン」でも…水害察知へ強い味方　福島・伊達でセンサー実証実験,https://news.yahoo.co.jp/articles/da8861d3e8dfce1eec90ea470f86933c93d1df27,9/27(水) 7:00
khks,仙台にバスク料理店、商議所がUターン開業後押し　オーナーシェフは本場や東京で修行の41歳,https://news.yahoo.co.jp/articles/a0400cf54a68a3426a912d9a40d8d335d376970f,9/27(水) 7:00
khks,まるで夜の森に降る粉雪　シイタケの胞子飛散の撮影に成功,https://news.yahoo.co.jp/articles/424640e54ebb042153d13ef0745d1de4e39f7747,9/26(火) 16:00
khks,昭和レトロな街再現　宮城・栗原で懐かしの名車・旧車並ぶ,https://news.yahoo.co.jp/articles/79fcd23fb3c86740243bea508c5835e87693b00c,9/26(火) 15:35
khks,「ずんだまつり」初の中止　猛暑、雨不足で生育不良「収穫量は例年の半分」,https://news.yahoo.co.jp/articles/27d5d382a260c62a54059d3f765ef8a01f7d1d59,9/26(火) 6:00
khks,出羽国から下野国への連絡文書か　福島の西久保遺跡で全国初の「鎮兵」記す木簡出土,https://news.yahoo.co.jp/articles/1080881e064e79f418c06c0f5f99db422dfa0709,9/26(火) 6:00
khks,「TOKIOは家族」福島県知事が連携継続を強調　問い合わせは250件,https://news.yahoo.co.jp/articles/d0a40fd433e83978d328f789af3ce72e0e2b49f0,9/26(火) 6:00
khks,猛暑影響？　鳥海山の残雪消える　積雪も例年の7〜8割でした,https://news.yahoo.co.jp/articles/34f33913f629d1392421ebff41cf36fad82084b0,9/26(火) 6:00
khks,みやぎ生協など東北6県の生協が無印の商品宅配を11月から開始へ,https://news.yahoo.co.jp/articles/8d9699856c8f45ba5f174ad428805232e380405d,9/25(月) 18:36
khks,えび、ずんだ、ごま、納豆の「もっちーず」　餅食文化PRキャラクター誕生　岩手・一関市,https://news.yahoo.co.jp/articles/db7e83c2ed2346b9b7e39e4981284a2299b64d2f,9/25(月) 15:32
khks,仙台・泉ケ岳でトレイルラン　秋空の下、750人が健脚競う,https://news.yahoo.co.jp/articles/cf72da8c8ade90c26ec5b30f672882d4d5fb53c8,9/25(月) 15:31
khks,野球U-18で世界一、仙台育英の4人を表彰＜ホイッスル＞,https://news.yahoo.co.jp/articles/c31ec0f92729be0d6d654f3b659480e445ca2227,9/25(月) 15:30
khks,仙台市バス、22年度も全路線赤字　乗客数コロナ前の水準に戻らず,https://news.yahoo.co.jp/articles/c833d2cf6039a6e055de6bdb7057ef05807d5b6f,9/25(月) 6:00
khks,本州のハジでハジを叫ぼう　岩手にある最東端の岬で写真家が動画サービス,https://news.yahoo.co.jp/articles/6e534ae29d4ce2d4ab6ae19ea89c016baae563a3,9/25(月) 6:00
khks,吉田屋弁当食中毒　宮城の体調不良者計36人に,https://news.yahoo.co.jp/articles/594d8e685ae0e99e1ef3669b12a67f4eaa5398bc,9/24(日) 17:08
khks,聖和学園が初の頂点　3位は仙台一　17年ぶり東北大会　秋季高校野球宮城県大会,https://news.yahoo.co.jp/articles/e2df38b25058f6ff11e0ef3059e5eca1758a6001,9/24(日) 12:24
khks,宮城で昨年人身事故最多の交差点は？　8年連続ワースト「六丁目」ではなく…,https://news.yahoo.co.jp/articles/50656cceba255eebfb6fc359609c69a4ebfbd468,9/24(日) 6:00
khks,猛暑でびっくり？　季節外れの桜咲く　仙台・向洋海浜公園,https://news.yahoo.co.jp/articles/4f6236e0cc88d848d81e9644681a64b019a39b75,9/24(日) 6:00
khks,伊達政宗の石こう騎馬像が修復後初公開　宮城・竹駒神社,https://news.yahoo.co.jp/articles/aa2aa4448876d927cc162c65c7be100277f96464,9/24(日) 6:00
khks,古川学園と聖和学園が決勝進出、両校が東北大会へ　秋季高校野球宮城県大会,https://news.yahoo.co.jp/articles/27d3ae8b07cdc6e018fa5d1248c1fa3be451dbab,9/24(日) 6:00
khks,ソバ満開、白くかれんに　収穫を前に4年ぶり花見会　宮城・亘理,https://news.yahoo.co.jp/articles/acdca31941d996369026025dfdad614b0660c0df,9/23(土) 15:39
khks,ホヤ味わい方多彩、海外へ提案　新メニュー25種、宮城県内の和洋中シェフ考案　県、販路開拓狙う,https://news.yahoo.co.jp/articles/db673d200367543cf8e65c168ec6f00679370c8e,9/23(土) 15:38
khks,ＰＲへインフルエンサーを指名　山形の宿泊施設が「ドラフト会議」＜みちのく＞,https://news.yahoo.co.jp/articles/d78511b588d8195c0ab147490e4680ac7a2d5f17,9/23(土) 15:38
khks,藤田引退会見　東北のファンは「家族のように接してくれた」　楽天選手からもねぎらいの声続々と,https://news.yahoo.co.jp/articles/b35cfc4e859e06d2a663e71b609a5122d3be4f85,9/23(土) 6:30
khks,灯油18リットル2250円　みやぎ生協、過去最高値を更新　今冬暫定配達価格,https://news.yahoo.co.jp/articles/373a565fcec916fbe15fa4b1357177951e211a67,9/23(土) 6:30
khks,プールの水13日間出しっ放し、水400万リットル流出　宮城・富谷市の小学校,https://news.yahoo.co.jp/articles/766cc843ab76e8be8cb06350901bb8e7311f9695,9/23(土) 6:30
khks,取り戻せ青春！目指せ観客1万人！モンテ、ホーム戦で若者が誘客イベント,https://news.yahoo.co.jp/articles/1ae972c004add4a87ddd1512a663aa7f4a39c799,9/23(土) 6:30
khks,「仙台に来て本当に良かった」　藤田一也、その闘志、名将たちとの出会い　東北楽天元担当記者が振り返る,https://news.yahoo.co.jp/articles/fec58cd9f4b68e0fb412a5801f31eb890f6986fd,9/22(金) 21:02
khks,名古屋の有名スイーツ「ぴよりん」東北初販売　藤崎、1時間ほどで完売　23日も数量限定で登場,https://news.yahoo.co.jp/articles/e2033dc7f830f9b7ea25ef8e3a759c96c2d62b97,9/22(金) 16:59
khks,東北楽天、銀次が今季初1軍昇格,https://news.yahoo.co.jp/articles/a1f072ae8f193fd9bc363998027f716b31be2b11,9/22(金) 16:28
khks,秋の訪れ、マガン今季初飛来　宮城・栗原と登米の伊豆沼・内沼,https://news.yahoo.co.jp/articles/314fb2ead9a7ef498f0e1c9ad49ea755698ac6e3,9/22(金) 15:50
khks,飛べ、ゴム長靴！　山形・尾花沢でフライングシューズ大会＜みちのく＞,https://news.yahoo.co.jp/articles/5f1f36bafc1fd5d4fe2cd2a0705fe6da86da8485,9/22(金) 15:45
khks,福島・浪江のタマネギで草木染の巾着　東京農大生が町の復興発信,https://news.yahoo.co.jp/articles/a817557cd6cbd415bcd56c0f37d64ee10cc873a6,9/22(金) 15:43
khks,大ぶりサンマ本格入荷　秋の味覚に市場沸く　仙台,https://news.yahoo.co.jp/articles/687297157d7b2e27b9b0260f0f11bac1e79060c8,9/22(金) 11:31
khks,宮城・菖蒲田海水浴場　県内最多の来場数も猛暑で想定より伸びず,https://news.yahoo.co.jp/articles/6ec83fa4ac09a848984009f97a7073b5efa5e45e,9/22(金) 6:00
khks,横浜で「復興ピアノ」演奏会　古里思い祈り奏でる＜ほっとタイム＞,https://news.yahoo.co.jp/articles/5e1f044e8e4ec4f1bda564216204e9528968d749,9/22(金) 6:00
khks,山形・鶴岡の荷物配送を郵便局で受け渡し　料金は1/4　全国初のサービス開始,https://news.yahoo.co.jp/articles/5e79c31428d562261e28525c727212b293c785c0,9/22(金) 6:00
khks,印度カリー子さん監修「川渡カレー」きょう22日発売,https://news.yahoo.co.jp/articles/5ecce547e4f3d68d9ff95d38e0417632a35bf4c9,9/22(金) 6:00
khks,新米の販売、本格的に始まる「猛暑に負けずよく育った」,https://news.yahoo.co.jp/articles/ce19d5514c9a525e1ebe2c34b6b0a54171fa0260,9/21(木) 19:41
khks,東北大理学部で実験中に爆発　学生3人けが、命に別状なし,https://news.yahoo.co.jp/articles/2561ad965aa4c61a0cac613ffb8f3c5050cf8cbc,9/21(木) 18:21
khks,原発事故で故郷を追われ…高齢夫婦が取り戻した暮らし、今度は台風が直撃「もう勘弁して」,https://news.yahoo.co.jp/articles/7b0dfa12fb134f1a9fb948373ef7925d255632d5,9/21(木) 16:31
khks,バットでも魅せた守備職人　藤田、振る勇気を全うした19年のプロ野球人生,https://news.yahoo.co.jp/articles/52cec334bd18a4627c0d1e3257202217de2b9361,9/21(木) 15:34
khks,東北で大雨の恐れ　秋田新幹線は運休や遅れの可能性も,https://news.yahoo.co.jp/articles/86f281d5800b2745bf00cf8ff78958050cc209c6,9/21(木) 12:44
khks,特殊詐欺で元お笑い芸人逮捕　警察官に成り済ましキャッシュカードだまし取ろうとした疑い　宮城県警,https://news.yahoo.co.jp/articles/2c29b57b81e069ea680d401302db2eded4064ebd,9/21(木) 11:19
khks,新型コロナ、新規感染者2072人　インフルエンザは増加続く　宮城県週報,https://news.yahoo.co.jp/articles/cb394f3f7c0017258871db5515c7ddf65a78440e,9/21(木) 11:00
khks,東陵が仙台育英破る金星　秋季高校野球宮城県大会、4強決まる,https://news.yahoo.co.jp/articles/27c685106c3e076982970c2b4e4035e786281ef3,9/21(木) 6:00
khks,山形・東根温泉、新たな名物は…メロン！？　高校物理講師、実家の旅館の元社員寮を活用し起業,https://news.yahoo.co.jp/articles/6edbc1e3f4f61e908aa8f196f14cd8143fe880c1,9/21(木) 6:00
khks,この冬は東北4季ぶり「暖冬・少雪」か　仙台管区気象台が予報発表,https://news.yahoo.co.jp/articles/d7063e3061aad2304c027596e748460f97f9a6f8,9/20(水) 20:56
khks,夏の甲子園準Vの仙台育英、来春の選抜絶望的に　須江監督「状況を打破できる真の実力なかった」,https://news.yahoo.co.jp/articles/4e2fff094edcf2e305cf4219da3bcf5ebcda57a1,9/20(水) 20:39
khks,紅葉の見頃、今年はやっぱり…　専門家に見通しを聞いてみました,https://news.yahoo.co.jp/articles/b29181a3b41987c53b36975fa08225ab29bce9cb,9/20(水) 16:00
khks,絶品「はらこ飯」いくらでも食べられる!　仙台中央卸売市場で試食会,https://news.yahoo.co.jp/articles/a812eab32e61ba03d85bdaac60418f0f9f4dd921,9/20(水) 16:00
khks,インフル感染者539人、前週より増加　仙台市11〜17日,https://news.yahoo.co.jp/articles/5ce5b9e4f07af58e9fbf00b5367ffa95caf1ff57,9/20(水) 15:51
khks,仙台一と聖和学園も準決勝進出　秋季高校野球宮城県大会,https://news.yahoo.co.jp/articles/2babe7fd1ec943bbfe23c42990f0fb9df8fe54e7,9/20(水) 15:19
khks,彼岸の入りなのに…仙台で真夏日,https://news.yahoo.co.jp/articles/e9153d04f3850827cbd3d29961cb392e7a46ea9a,9/20(水) 14:10
khks,仙台育英、来春の選抜絶望的に　秋の宮城県大会準々決勝で敗れる,https://news.yahoo.co.jp/articles/b79aedfa57ef3369b86a56b6ea14ea51bf1a43c2,9/20(水) 12:44
khks,基準地価　仙台圏は住宅需要が旺盛　名取と富谷は上げ幅仙台超え,https://news.yahoo.co.jp/articles/f709f7471d833782b57a436b244b37e8d9153ebd,9/20(水) 6:00
khks,被災ピアノ、傷だらけのローラ　宮城や首都圏で演奏会　横浜の修復師「調律続け風化防ぎたい」,https://news.yahoo.co.jp/articles/dc68459edbc7fc4460ba1baf2c1dad4c4bc72d1c,9/20(水) 6:00
khks,特急「ひたち」など運休　線路に土砂流れ込む　あす20日は始発から平常運転,https://news.yahoo.co.jp/articles/08f12208c58b464316d0d99ed1501b3d8c8b45c5,9/19(火) 20:13
khks,アイリス「もち麦パックごはん」30万パック自主回収へ　菌の残存確認,https://news.yahoo.co.jp/articles/7dd0a4589c9e237a9dccc5ff8443bc202205161d,9/19(火) 18:21
khks,東北楽天・塩見が1軍合流　2季ぶりに1軍登板へ,https://news.yahoo.co.jp/articles/4ecafbbaf99e235cdc84cc9dbb01598c05eaec7a,9/19(火) 17:58
khks,「アイン企画」が自己破産申請　情報誌「やまがたの街」を発行　負債額1億1300万円,https://news.yahoo.co.jp/articles/b782a227387dbb71145d656f4fd0649f873fe607,9/19(火) 17:17
khks,東北の基準地価、1992年以来31年ぶり上昇　コロナ後の景気回復で改善進む,https://news.yahoo.co.jp/articles/fd2b93c3731a75dbbfbfb077a2785129a3c7489c,9/19(火) 16:50
khks,仙台市が宿泊税の導入検討へ　コロナでいったん休止　議論を再開,https://news.yahoo.co.jp/articles/5e017d1db4ac441dd6e38b6a8e4386619cd578d8,9/19(火) 15:54
khks,旧奥州街道の歴史堪能　IGR企画のハイキングツアー人気,https://news.yahoo.co.jp/articles/6f95d4ba3ab2abeed710e943a8e27e3c53f1032f,9/19(火) 15:46
khks,「仙台トク旅」9月25日予約開始　市独自の宿泊促進事業,https://news.yahoo.co.jp/articles/1ef2da370a552d6be898429beda424603a590359,9/19(火) 15:42
khks,仙台市の教諭ら5人がスズムシの教材動画制作、全国コンクールで最高賞受賞,https://news.yahoo.co.jp/articles/d3d5e90b166396128fceb0c68647dc6e6c4ea2f9,9/19(火) 15:40
khks,試練乗り越え夢実現　福島の女性が食と健康のカフェ開店＜ほっとタイム＞,https://news.yahoo.co.jp/articles/489efe3669216ab0c97ad53ef48f1fadc451d61f,9/19(火) 15:39
khks,一面輝くレモンカラー　宮城・川崎　みちのく杜の湖畔公園　キバナコスモス見頃,https://news.yahoo.co.jp/articles/886ff60f5aa543154da1e3579cbc576ef5eaba71,9/19(火) 15:39
khks,仙台市がパートナーシップ制度を来年中に創設　宮城県内初　政令市では最後,https://news.yahoo.co.jp/articles/fc047a061b7bcf57c29c64fec643d05eced26167,9/19(火) 14:39
