media_en,media_jp,title_articles,link_articles,date_original
aab,秋田朝日放送,大気の状態が不安定に　秋田県内では激しい突風や落雷などに注意を　１８日は土砂災害に警戒を,https://news.yahoo.co.jp/articles/bc65926a21387cbc06a10217baa5db603c4073d1,11/17(金) 11:59
aab,秋田朝日放送,秋田市の市道で掃除をしていた９５歳の女性が軽自動車にはねられ死亡,https://news.yahoo.co.jp/articles/641852e3b115a1d37c52d71033a2a67c6a0f420d,11/17(金) 11:57
aab,秋田朝日放送,インフルエンザ　秋田県全体として「注意報」レベル　大館・北秋田保健所管内は「警報」,https://news.yahoo.co.jp/articles/47fde82c5e79ba7a1155d3191c4649760af093bb,11/16(木) 18:54
aab,秋田朝日放送,燃料費高騰で注目の「昭和の部屋着」　半てんに綿を入れた「どんぶく」をオーダーメイドで　秋田・湯沢市,https://news.yahoo.co.jp/articles/2b88e715a23a152887eb0abe4c9cde918fe238eb,11/16(木) 18:54
aab,秋田朝日放送,日本一辛いといわれる鹿角市の「松館しぼり大根」の収穫が最盛期　味は「いつも通り」でも猛暑の影響も,https://news.yahoo.co.jp/articles/af08202a6601f18dd4f8a9fb7bd4aeecf274a99a,11/16(木) 18:54
aab,秋田朝日放送,７月の大雨から４カ月　被災地の復旧は道半ば　秋田市はストーブや布団などの貸し出し行う,https://news.yahoo.co.jp/articles/b94fee61fa1c445bdf3b60c3f3648000b291bdd0,11/16(木) 18:51
aab,秋田朝日放送,サッカーＪ２のブラウブリッツ秋田　吉田謙監督の続投決まる　今季は２２チーム中１３位の成績,https://news.yahoo.co.jp/articles/308821268f4389ef085493afbf1b6e4edfc38b67,11/16(木) 16:50
aab,秋田朝日放送,秋田県内のレギュラーガソリンの平均小売価格は約２カ月ぶりに値上がり　政府の補助金の減額で,https://news.yahoo.co.jp/articles/43ae451cba408ece027f1d44cfb7dbdab387b43f,11/16(木) 12:02
aab,秋田朝日放送,１６日の秋田県内は多くのところで今シーズン一番の冷え込みに,https://news.yahoo.co.jp/articles/5c7198a37f50e6a7ed6212a22cd44a70758a4e2b,11/16(木) 12:02
aab,秋田朝日放送,秋田県内で人身被害や出没相次ぐクマ　今季の冬眠は？　専門家は「１１月中は警戒を」,https://news.yahoo.co.jp/articles/4e7fad384c4d08954a7f79bb0703d9613b889e3f,11/15(水) 19:31
aab,秋田朝日放送,アスリートが競技を続けながら仕事との両立を図る取り組みや支援制度を紹介するセミナー　秋田,https://news.yahoo.co.jp/articles/36209899f50c95e3651ef553fa1999387ac80155,11/15(水) 19:23
aab,秋田朝日放送,秋田市の人口が３３年ぶりに３０万人を下回る　今後の税収減の懸念も,https://news.yahoo.co.jp/articles/8aa1fcca63c184465535c32bb9c8938ed37e28a6,11/15(水) 19:23
aab,秋田朝日放送,秋田県内の記録的大雨から４カ月　浸水した秋田市の幼稚園は冬に向け急ピッチで準備進める,https://news.yahoo.co.jp/articles/ad5dc2184d420f36ee7a28cc6c917f8306229ebd,11/15(水) 19:23
aab,秋田朝日放送,秋田・佐竹知事の”じゃこ天失言”がきっかけに…　東京で四国４県と秋田の合同物産展,https://news.yahoo.co.jp/articles/7d9ec8bd2bf8aca4f9a10a90301cafd594ac449d,11/15(水) 19:22
aab,秋田朝日放送,秋田県内で人身被害や出没相次ぐクマ　環境大臣が「指定管理鳥獣」への指定について検討を指示,https://news.yahoo.co.jp/articles/340bccce4aec741adea38a39fbb2840aa5d416af,11/15(水) 13:01
aab,秋田朝日放送,秋田市で初霜観測　平年より１日早く２０２２年より２１日遅い観測,https://news.yahoo.co.jp/articles/ed049cbdbaa885c8ad7edc4219b5399bf7a72818,11/15(水) 12:59
aab,秋田朝日放送,猛暑の影響で秋田県産のコメの１等米比率は約６割に　コメの等級はどのように決まる？,https://news.yahoo.co.jp/articles/768f8a95f0ffc8b17040e2ee540e79060a928069,11/14(火) 19:38
aab,秋田朝日放送,ツキノワグマの捕獲頭数が秋田県が定めた上限を超える見通しに　県が狩猟の自粛を要請,https://news.yahoo.co.jp/articles/64abf1330809a7b92d909d4667cf10dcefa0fe33,11/14(火) 19:31
aab,秋田朝日放送,ソバ畑で１２頭前後の目撃も…　１１月に入っても秋田県内ではクマの被害や出没相次ぐ,https://news.yahoo.co.jp/articles/0a6009a414b111169e21596d62ae2dd91c5783a5,11/14(火) 19:25
aab,秋田朝日放送,雪のシーズンに備えて　秋田市が道路除排雪対策本部を設置,https://news.yahoo.co.jp/articles/558fe306d25466632636d3dafb05e2aa5ff30ea7,11/14(火) 11:57
aab,秋田朝日放送,秋田県の佐竹知事　四国の料理や酒をめぐる自身の発言について徳島の知事らに謝罪,https://news.yahoo.co.jp/articles/1490ad9879654902f44e3f352ae9949c6bd727c1,11/14(火) 11:57
aab,秋田朝日放送,再整備される秋田市の卸売市場オープンは２０３２年秋に　新スタジアム着工はそれ以降？,https://news.yahoo.co.jp/articles/bf8bf69038875192c246afc4f11a15fbd47cf2e2,11/13(月) 19:03
aab,秋田朝日放送,クマを「指定管理鳥獣」に　国に緊急要望　過去最多のクマによる人身被害受け　秋田県,https://news.yahoo.co.jp/articles/28cd3831747a5717c214b4d15997239f43b85561,11/13(月) 19:00
aab,秋田朝日放送,振り返ると体長１ｍのクマが…カキの実を取っていた女性がクマに襲われけが　秋田・八郎潟町,https://news.yahoo.co.jp/articles/c790a89bb3ac3d3dad491dc653e40644b789b47d,11/13(月) 17:39
aab,秋田朝日放送,秋田県内冷え込み続く　６地点で最低気温が今季最も低く　日中も気温上がらない見込み,https://news.yahoo.co.jp/articles/cbcc91b3d70a21c9a17d3378c0b7406a19dc72c9,11/13(月) 12:03
aab,秋田朝日放送,知的障害のある人たちをスポーツを通じて支援　「スペシャルオリンピックス」の地区大会　秋田・大仙市,https://news.yahoo.co.jp/articles/0acf37e3c84b17f448df38bdc6b9798aa494f835,11/12(日) 18:29
aab,秋田朝日放送,冬型の気圧配置が強まる　１２日の秋田県内は多くのところで今季一番の冷え込みに,https://news.yahoo.co.jp/articles/dc55582ca3019c3a7d7dae94a5900e2e78078fa6,11/12(日) 18:27
aab,秋田朝日放送,冬型と強い寒気で冷え込む　北秋田市森吉では雪景色広がる　秋田市・太平山は初冠雪,https://news.yahoo.co.jp/articles/8972a48e32831e1c7a4f51e22ff3eb38a0336658,11/11(土) 18:00
aab,秋田朝日放送,「プロモーションサッカーフェス」　子どもたちにサッカーに親しんで　秋田県サッカー協会が開催,https://news.yahoo.co.jp/articles/33bc25ef0acc7b521e7d77ea3ef57737280e6fbb,11/11(土) 18:00
aab,秋田朝日放送,秋田県出身の東京ヤクルトスワローズ石川雅規・石山泰稚両投手が７月の大雨で被災した人へ義援金贈呈,https://news.yahoo.co.jp/articles/b717b2b02e11d33b8db3ebb8e8950d5086b8dd96,11/10(金) 18:57
aab,秋田朝日放送,用意した５００本が２０分で完売　大館市の小学生が自分たちで栽培した地元特産のネギを販売　秋田,https://news.yahoo.co.jp/articles/df0c01d91597ae42d3e688b9c9cb49aaec6ac9cf,11/10(金) 18:57
aab,秋田朝日放送,測量作業をしていた４０代男性がクマに襲われけが　秋田・鹿角市,https://news.yahoo.co.jp/articles/5573a0f6456ae6487cc699630e56d3ff9395a8c8,11/10(金) 17:08
