media_en,media_jp,title_articles,date_original
dancyu,dancyu,切って和えるだけのワインのお供！“生マッシュルームのサラダ”のつくり方,10/17(木) 11:00
dancyu,dancyu,極限まできのこの旨味を凝縮した“炒めすぎたきのこの粒マスタードマリネ”のつくり方,10/16(水) 11:00
dancyu,dancyu,弾力と歯触りが楽しい豚ホルモンカレー｜松尾貴史のカレードスコープ,10/16(水) 11:00
dancyu,dancyu,日本酒のアテになるクイックつまみ！“油揚げのなめろう風”,10/15(火) 11:00
dancyu,dancyu,日本酒がクイクイ進んでしまう“中華風温豆腐”のつくり方,10/14(月) 11:00
dancyu,dancyu,黒胡椒でめちゃ旨！「脱水シート干物」研究は続く,10/14(月) 11:00
dancyu,dancyu,偉大なる先代から託された蔵。8代目蔵元・小川原貴夫さんが繋ぎ、拓く未来,10/13(日) 11:00
dancyu,dancyu,ヘルシーなピザ！“油揚げのオニオンブルーチーズ焼き”のつくり方,10/13(日) 11:00
dancyu,dancyu,ホームパーティーに最適な“アンチョビ豆腐”のつくり方,10/12(土) 11:00
