media_en,media_jp,title_articles,date_original
fashiontn,FASHION TECH NEWS,「VCM」の仕掛け人に聞く、イベントの見どころとヴィンテージシーンの未来,10/19(土) 11:10
fashiontn,FASHION TECH NEWS,1300年の伝統を拡張する、畳の新たな可能性：山田一畳店,10/19(土) 8:10
fashiontn,FASHION TECH NEWS,累計出荷数20億枚超え「ルルルン」がフェイスマスク市場で独走し続ける理由,10/18(金) 8:10
fashiontn,FASHION TECH NEWS,アメリカで話題沸騰のハイテク美容施術、人の手が不要な“ロボットまつエク”の実態に迫る,10/17(木) 8:10
fashiontn,FASHION TECH NEWS,老舗帽子メーカーが、がん患者向けの帽子を開発した理由：CHANVRE MAKI（シャンヴル マキ）,10/16(水) 8:10
fashiontn,FASHION TECH NEWS,日本でも大人気、オーストラリア発「ステート オブ エスケープ（STATE OF ESCAPE）」設立10年の軌跡を辿る,10/15(火) 8:10
fashiontn,FASHION TECH NEWS,「メイクは選手の精神的な支えにもなる」コーセーが取り組むスポーツ支援,10/14(月) 11:10
fashiontn,FASHION TECH NEWS,大切な思い出をいつまでも手元に──染め直しできるウエディングドレス「SaboraMi」,10/13(日) 11:10
fashiontn,FASHION TECH NEWS,「本野はきもの工業」が作る、現代のライフスタイルでも履きやすい日田下駄,10/12(土) 11:10
fashiontn,FASHION TECH NEWS,スーツケースに込めた日本の心：プロテカ（PROTECA）、20年の挑戦と進化,10/11(金) 8:10
fashiontn,FASHION TECH NEWS,100％Made in Englandにこだわった、老舗ニットブランド「PEREGRINE（ペレグリン）」に注目,10/10(木) 8:10
fashiontn,FASHION TECH NEWS,皮膚の感覚センサーの働きを活用！ 「デリットテック」のパンツとソックスは筋肉にどう効く？,10/9(水) 8:10
fashiontn,FASHION TECH NEWS,スイス発「オン」が3分でアッパーを完成させる新技術を披露、業界に変革をもたらすイノベーションに迫る,10/8(火) 8:10
fashiontn,FASHION TECH NEWS,8万円超え！ パナソニックの新作ドライヤー「ナノケア アルティメイト」の真価,10/7(月) 8:10
fashiontn,FASHION TECH NEWS,1mm単位でコンセプトを追求　アトリエ小倉染芸の考える、東京手描友禅の魅力とは？,10/6(日) 11:10
fashiontn,FASHION TECH NEWS,「uka（ウカ）」のヘアケアラインが一新　楊枝でお馴染みの植物「クロモジ」に注力する理由,10/5(土) 11:10
fashiontn,FASHION TECH NEWS,「MARQUEEPLAYER（マーキープレイヤー）」 がこだわる、シューケアブランドの在り方とは？,10/4(金) 8:10
fashiontn,FASHION TECH NEWS,ブランケットといえば「PENDLETON（ペンドルトン）」アメリカ文化を象徴するブランドの160年を超える歴史を紐解く,10/3(木) 8:10
fashiontn,FASHION TECH NEWS,屋外広告を服に再生　「Paper Parade」とリガレッタのサステナビリティへの挑戦,10/2(水) 8:10
fashiontn,FASHION TECH NEWS,体温で柔らかくなり体に合わせて伸縮する新感覚の素材「HUMOFIT」,10/1(火) 8:10
fashiontn,FASHION TECH NEWS,名門「ロウアルパイン」の機能的バックパック「エアゾーン」シリーズから目が離せない,9/30(月) 8:10
fashiontn,FASHION TECH NEWS,平成から令和へ、ROXY（ロキシー）が紡ぐ世代を超えたその魅力,9/29(日) 11:10
fashiontn,FASHION TECH NEWS,繊細な手技を未来へと繋ぐ「うちわの太田屋」,9/28(土) 11:10
fashiontn,FASHION TECH NEWS,ワークマンの大ヒットアイテム「超撥水シェフパンツ」が累計77万枚も売れた納得の理由,9/27(金) 8:10
fashiontn,FASHION TECH NEWS,革靴職人目野健太氏に聞く、「Orphe（オルフェ）」ビスポークシューズの世界,9/26(木) 8:10
fashiontn,FASHION TECH NEWS,HOKAから新コンセプトのロードモデルが登場 「スカイフロー」は一体どんなシューズなのか,9/25(水) 8:10
fashiontn,FASHION TECH NEWS,洗濯王子・中村祐一が説く「洗濯の基本となる3つのポイント」,9/24(火) 8:10
fashiontn,FASHION TECH NEWS,機能的なレインウェアの発明家、フランスの国民的ブランド「ケーウェイ（K-WAY）」の歴史と見据える未来,9/23(月) 8:10
fashiontn,FASHION TECH NEWS,薩摩錫器の伝統技術を次世代に。「薩摩錫器工芸館」の今までとこれから,9/22(日) 11:10
fashiontn,FASHION TECH NEWS,水原希子やNewJeans、IVEを虜にするTomoya Nakagawa　3Dプリンターで創るネイルアートの世界,9/21(土) 8:10
fashiontn,FASHION TECH NEWS,通気性400％UP！ さらさらして軽く、涼しい「ミズノ」の機能下着「カルエアー」,9/20(金) 8:10
fashiontn,FASHION TECH NEWS,NewBalance（ニューバランス）「1906」から 話題沸騰のローファータイプが登場！,9/19(木) 8:10
fashiontn,FASHION TECH NEWS,体臭に服、生ごみetc…あらゆる“臭い”を消す万能スプレー「NIOCAN（ニオキャン）」,9/18(水) 8:10
fashiontn,FASHION TECH NEWS,「Polo Ralph Lauren（ポロ ラルフローレン）」のスリープウエアで部屋着にもこだわりたい,9/17(火) 8:10
fashiontn,FASHION TECH NEWS,極細の糸で生まれる極上の触感：武藤株式会社,9/16(月) 8:10
fashiontn,FASHION TECH NEWS,一人ひとりの肌と心に寄り添う存在に：アツギ株式会社の挑戦,9/15(日) 11:10
fashiontn,FASHION TECH NEWS,令和からのガーリーブーム：バレリーナからインスパイアされた新トレンド「バレエコア」とは？,9/14(土) 11:10
fashiontn,FASHION TECH NEWS,アメリカを色濃く感じる「ファティーグ4ポケットパンツ」に象徴される「GUNG HO（ガンホー）」の“6つのコンセプト”とは,9/13(金) 8:10
fashiontn,FASHION TECH NEWS,阪田マリン「昭和99年」を生きるZ世代のファッション,9/12(木) 8:10
fashiontn,FASHION TECH NEWS,プロアスリートの声を生かした製品作り　日本発のリカバリーサンダルブランド「rig」の魅力,9/11(水) 8:10
fashiontn,FASHION TECH NEWS,自己ベストに挑戦するすべてのランナーへ！　プーマ「DEVIATE NITRO ELITE 3」の機能性に迫る,9/10(火) 8:10
fashiontn,FASHION TECH NEWS,時計の歴史に残した偉大な足跡　ハミルトンの「ベンチュラ」伝説を紐解く,9/9(月) 8:10
fashiontn,FASHION TECH NEWS,身近な美を追求する「and us」：スリーコインズが提案する新しい美容ライフスタイル,9/8(日) 11:10
fashiontn,FASHION TECH NEWS,宇多田ヒカルのLIVEツアー衣装デザインの舞台裏【A-POC ABLE ISSEY MIYAKE × Spiber】,9/7(土) 16:10
fashiontn,FASHION TECH NEWS,老舗タンナーが皮革のふるさと姫路で作る、こだわりの革：株式会社山陽,9/7(土) 11:10
fashiontn,FASHION TECH NEWS,新素材のヒートテックも登場！メンズラインが加わった「UNIQLO：C（ユニクロ：シー）」の新作コレクション,9/6(金) 16:10
fashiontn,FASHION TECH NEWS,“ありそうでないカバン”を手がける香川発のブランド「カワニシカバン」,9/6(金) 8:10
fashiontn,FASHION TECH NEWS,日本が誇る先端技術をふんだんに盛りこんだ「MOON-TECH（ムーンテック）」の凄さに迫る！,9/5(木) 8:10
fashiontn,FASHION TECH NEWS,日本でも大人気、オーストラリア発「ステート オブ エスケープ（STATE OF ESCAPE）」設立10年の軌跡を辿る,9/4(水) 16:10
fashiontn,FASHION TECH NEWS,「下北沢」はいかにして古着の聖地となりえたか？ 東洋百貨店オーナーに変遷を聞く,9/4(水) 8:10
fashiontn,FASHION TECH NEWS,「Oliver Peoples（オリバー ピープルズ）」優れたクラフトマンシップと洗練されたラグジュアリー,9/3(火) 8:10
fashiontn,FASHION TECH NEWS,職人技術が受け継がれた「SANDERS（サンダース）」の「MILITARY COLLECTION（ミリタリー コレクション）」に迫る,9/2(月) 8:10
fashiontn,FASHION TECH NEWS,ヒアルロン酸の10倍の保水力！ DICが展開するコスメブランド「fillwith（フィルウィズ）」の革新性,9/1(日) 11:10
fashiontn,FASHION TECH NEWS,肌のダメージケアにビタミンAが欠かせない理由　光老化対策のパイオニア「ENVIRON（エンビロン）」が解説,8/31(土) 11:10
fashiontn,FASHION TECH NEWS,バンドT、映画Tなど、中目黒の老舗古着屋「JUMPIN' JAP FLASH」に聞いた、おすすめビンテージTシャツ,8/30(金) 8:10
fashiontn,FASHION TECH NEWS,「非常に寒さを感じにくい服」を実現させる、ワークマンの脅威の新素材「Xシェルター」の全貌,8/29(木) 8:10
fashiontn,FASHION TECH NEWS,進化を続ける「UNIQLO（ユニクロ）」の機能性インナー　なぜ、エアリズムはこれほど快適なのか？,8/28(水) 8:10
fashiontn,FASHION TECH NEWS,伝統に挑みながら和傘文化を守り続ける「日和」,8/27(火) 8:10
fashiontn,FASHION TECH NEWS,人気再燃中のNew Balance（ニューバランス）「610」が今なぜ注目されているのか？,8/26(月) 8:10
fashiontn,FASHION TECH NEWS,読者から厚い支持を得る「LDK the Beauty」が行う、「LAB.360」での“検証”とは,8/25(日) 11:10
fashiontn,FASHION TECH NEWS,累計500万本を売り上げた「女優ミスト」が初上陸　韓国のスキンケアブランド「groundplan（グラウンドプラン）」の正体,8/24(土) 11:10
fashiontn,FASHION TECH NEWS,99%以上の遮光&UVカット率　真夏の炎天下を乗り切るために開発された東レの機能素材「SUMMER SHIELD　（サマーシールド）」,8/23(金) 8:10
fashiontn,FASHION TECH NEWS,サロモン「X ULTRA 360 GORE-TEX」が 究極のオールラウンド・ハイキングシューズである理由,8/22(木) 8:10
fashiontn,FASHION TECH NEWS,「アクシーズクイン」から登場した心地よい「ベンチレーションシャツ」で涼しく過ごす,8/21(水) 8:10
fashiontn,FASHION TECH NEWS,漁師アイテムからタウンユースへ：ギョサンの新しい可能性,8/20(火) 16:10
fashiontn,FASHION TECH NEWS,厚底のフットベッドに秘められた水への想い　「FREEWATERS（フリーウォータース）」のサンダルが“気持ちいい”理由,8/20(火) 8:10
fashiontn,FASHION TECH NEWS,ミズノ「モレリア ネオ Ⅳ ジャパン」が 多くのフットボーラーに愛されている理由とは,8/19(月) 8:10
fashiontn,FASHION TECH NEWS,「盛り」と「加工」専門家・久保友香が語る、AIが描く未来のビジュアルコミュニケーション,8/18(日) 11:10
fashiontn,FASHION TECH NEWS,手や腕の障がいを持つ人々のメイクアップを支援する、ロレアルの超精密メイクアップアプリケーター“HAPTA”,8/17(土) 11:10
fashiontn,FASHION TECH NEWS,持ち手が消えた！ パナソニック「ラムダッシュ パームイン」が挑む電動シェーバーのデザイン革命,8/16(金) 8:10
fashiontn,FASHION TECH NEWS,世界で最初にスウェットシャツを作った「ラッセル アスレティック」がアメリカメジャースポーツとともに歩んだ歴史,8/15(木) 8:10
fashiontn,FASHION TECH NEWS,バックパックと併用できる「モンベル」のアウトドア仕様「ファンブロー ベスト」は涼しい,8/14(水) 8:10
fashiontn,FASHION TECH NEWS,ジェームズ・ボンドも認めた品質　「SUNSPEL（サンスペル）」が紡ぐ高級Tシャツの系譜,8/13(火) 8:10
fashiontn,FASHION TECH NEWS,パイナップルから植物性レザーを、セレブのためではないサステナブル素材,8/12(月) 11:10
fashiontn,FASHION TECH NEWS,アディダス ランニングの新定番へ 「ADIZERO SL 2」はどう進化したのか,8/11(日) 11:10
fashiontn,FASHION TECH NEWS,パリ五輪へ！ 「ペガサス」とともに歩んできた大迫傑が語る 「ナイキ ペガサス 41」のポテンシャル,8/10(土) 11:10
fashiontn,FASHION TECH NEWS,ブランド史上初のブレイキン用シューズ 「ナイキ ジャム」の全貌,8/9(金) 8:10
fashiontn,FASHION TECH NEWS,腕に宿る小さな宇宙　シチズン時計の「カンパノラ」コスモサインの魅力,8/8(木) 8:10
fashiontn,FASHION TECH NEWS,沖縄独自の着る文化：「かりゆしウェア」が示す郷土愛とアイデンティティ,8/7(水) 8:10
fashiontn,FASHION TECH NEWS,“裸足に近い”ソールで怪我を軽減　アメリカのランシューブランド「ALTRA（アルトラ）」,8/6(火) 8:10
fashiontn,FASHION TECH NEWS,次世代のスタンダードとなる最高のバッグを提供する「MONOLITH（モノリス）」の洗練されたアイテムたち,8/5(月) 8:10
fashiontn,FASHION TECH NEWS,パリ五輪でメダルへ！　110mハードルの日本記録保持者 泉谷駿介がシューズに求めるもの,8/4(日) 11:10
fashiontn,FASHION TECH NEWS,敏感肌にも冷感を！ オンリーミネラルのUVケア「クールコンフォート」の独自処方,8/3(土) 11:10
fashiontn,FASHION TECH NEWS,きゃりーぱみゅぱみゅ、新しい学校のリーダーズ…日本の「原宿カルチャー」を築いたアソビシステムの次なるビジョン,8/2(金) 8:10
fashiontn,FASHION TECH NEWS,伝説の古着屋・Hanjiro（ハンジロー）の軌跡：元商品企画部マネージャー高山亨さんが語るその裏側,8/1(木) 8:10
fashiontn,FASHION TECH NEWS,"サステナブルバッグブランド""AIRPAQ""：車の廃材が生み出す新たな価値",7/31(水) 8:10
fashiontn,FASHION TECH NEWS,ワークマン「Future TECHレインスーツ」がハイスペックになった予想外の理由,7/30(火) 8:10
fashiontn,FASHION TECH NEWS,ブランドを主張しないSUN℃OREのスニーカーがファッションフリークの視線を釘づけにする理由,7/29(月) 8:10
fashiontn,FASHION TECH NEWS,「刺繍で刺繍を超える」 世界のファッションブランドを支える美希刺繍工芸の独自技術,7/28(日) 11:10
fashiontn,FASHION TECH NEWS,いまも変わらずmade in CANADAを貫く、「BARBARIAN（バーバリアン）」のタフなラガーシャツ,7/27(土) 11:10
fashiontn,FASHION TECH NEWS,NBA電撃復帰時に着用した「AIR JORDAN 11（エアジョーダン11）」の知られざる新事実とは,7/26(金) 8:10
fashiontn,FASHION TECH NEWS,マーガレット・ハウエルのリネンシャツが普通のシャツとひと味違うワケ,7/25(木) 8:10
fashiontn,FASHION TECH NEWS,ハワイアンシャツの大定番「REYN SPOONER（レイン・スプーナー）」の歴史と魅力,7/24(水) 8:10
fashiontn,FASHION TECH NEWS,アウトドアと日常のボーダーをなくす「グレゴリー」の軽量デイパック「ナノ」シリーズ,7/23(火) 8:10
fashiontn,FASHION TECH NEWS,多くのアパレルが注目！柔らかく耐候性に優れた高機能素材「ソロテックス」の秘密,7/22(月) 8:10
fashiontn,FASHION TECH NEWS,「HelloRing」でつながる新しいコミュニケーションスタイル,7/21(日) 11:10
fashiontn,FASHION TECH NEWS,ミストなのに肌に密着？ ビオレUV「瞬感ミストUV」の日焼け止め革命,7/20(土) 11:10
fashiontn,FASHION TECH NEWS,PIKO（ピコ）が築いた波：平成の一大ブームから次なるステージへ,7/19(金) 8:10
fashiontn,FASHION TECH NEWS,YOASOBI（ヨアソビ）の衣装も手がける注目のデザイナー「YONLOKSAN（ヨンロクサン）」新國 あおいインタビュー,7/18(木) 8:10
fashiontn,FASHION TECH NEWS,デニムに漆器、美容成分も！ 株式会社 明治が「食品以外」のカカオの可能性に着目する理由,7/17(水) 8:10
fashiontn,FASHION TECH NEWS,着るだけで疲労回復するSIXPAD「リカバリーウェア」 最新モデルは接触冷感機能も搭載,7/16(火) 8:10
fashiontn,FASHION TECH NEWS,軽量で高レベルな防水透湿性を持つ「コロンビア」の次世代レインウエアの着心地とは？,7/15(月) 8:10
fashiontn,FASHION TECH NEWS,ニッセンのトランスジェンダー・乳がん経験者向けブランド「as is」「Heartyell」が誕生した理由,7/14(日) 11:10
fashiontn,FASHION TECH NEWS,世界約80カ国で爆売れ中！ 資生堂メンの“黒アルティミューン”の実力は本物か？,7/13(土) 11:10
fashiontn,FASHION TECH NEWS,35周年を迎えたNew Balance（ニューバランス） 「1500」が現在もサポートされているワケとは？,7/11(木) 8:10
fashiontn,FASHION TECH NEWS,Y2Kとともに再ブーム：バレンシアガとのコラボで火がついた、クロックスの新しい姿,7/10(水) 8:10
fashiontn,FASHION TECH NEWS,「beruf luggage（ベルーフ バゲージ）の他に類を見ないインディペンデントなバッグ作りに迫る,7/9(火) 8:10
fashiontn,FASHION TECH NEWS,ワコールが提供する「SCANBE」に、新サービス「わたしを知る骨格診断」が誕生,7/8(月) 8:10
fashiontn,FASHION TECH NEWS,新しいアウトドアブランド「NNormal（ノーマル）」、その新しさとテクノロジーに迫る,7/7(日) 11:10
fashiontn,FASHION TECH NEWS,大胆な色、質感、型にはまらない形を洋服に：Paula Canovas del Vasのデザイン哲学,7/6(土) 11:10
fashiontn,FASHION TECH NEWS,美顔器カテゴリのマーケットシェアNo.1のYA-MAN、年齢に悩みに立ち向かう自社研究所の知見を探る,7/5(金) 8:10
fashiontn,FASHION TECH NEWS,毛穴をごっそり大掃除！ 累計788万個を売り上げたファンケル「ディープクリア洗顔パウダー」の開発秘話,7/4(木) 8:10
fashiontn,FASHION TECH NEWS,アメリカ最大規模のベーシックアパレル「フルーツ オブ ザ ルーム」の歴史に裏付けられたアメリカンスタンダード,7/3(水) 8:10
fashiontn,FASHION TECH NEWS,モデルは1型のみ　大手シューズメーカー出身のデザインデュオが手がける街履き専用スニーカー「CLEMENS（クレメンス）」,7/2(火) 8:10
fashiontn,FASHION TECH NEWS,特許取得構造と新素材を採用 「MIZUNO NEO VISTA」のポテンシャル,7/1(月) 8:10
fashiontn,FASHION TECH NEWS,時代を彩る「KATE」の革命：平成から令和へのメイクトレンド,6/30(日) 11:10
fashiontn,FASHION TECH NEWS,人気モデルが立ち上げた、パリ発テーブルウエアブランド「TABLE」が彩る食卓芸術の世界,6/29(土) 11:10
fashiontn,FASHION TECH NEWS,軽量化&快適性がアップ　新たなゴアテックスを採用したアークテリクスのシェルジャケット,6/28(金) 8:10
fashiontn,FASHION TECH NEWS,ワークマンがつくる「未来の服」冷暖房服「ペルチェベスト」の革新性,6/27(木) 8:10
fashiontn,FASHION TECH NEWS,「HUNTER（ハンター）」機能とスタイルをシームレスに「レインブーツ」の歴史を紐解く,6/26(水) 8:10
fashiontn,FASHION TECH NEWS,男性の肌印象を格上げ！ FIVEISM × THREEの透明BBクリームが持つ特殊能力,6/25(火) 8:10
fashiontn,FASHION TECH NEWS,無印良品「スキンケアシリーズ」リニューアルの背景,6/24(月) 8:10
fashiontn,FASHION TECH NEWS,福祉とアートを一変させたブランド「へラルボニー」、世界を巻き込みながら課題解決を目指す,6/23(日) 11:10
fashiontn,FASHION TECH NEWS,古着ミックスと異素材ミックス「masterkey（マスターキー）」の唯一無二のデザインワーク,6/22(土) 11:10
fashiontn,FASHION TECH NEWS,完全遮光100%の最強日傘「UVO」が大ヒット：Wpc.が提案する、傘のファッションフロンティア,6/21(金) 8:10
fashiontn,FASHION TECH NEWS,モデルの岡田章吾が手がけるワークウエア「KEIMEN（カイメン）」に見る「畑オタク」の世界,6/20(木) 8:10
fashiontn,FASHION TECH NEWS,エリック・クラプトンもオーナーに名を連ねる伝統的なカントリーウェアブランド「CORDINGS（コーディングス）」に注目,6/19(水) 8:10
fashiontn,FASHION TECH NEWS,子どもの虫さされ対策に：ディート不使用の着る虫よけ服「CAYA（カヤ）」,6/18(火) 8:10
fashiontn,FASHION TECH NEWS,世界初のアンクルストラップ付きのスポーツサンダル　Tevaの「ハリケーン」,6/17(月) 8:10
fashiontn,FASHION TECH NEWS,「LVMHプライズ」セミファイナリストに選出されたフィダン・ノブルゾバ、海外セレブに人気のイットシューズを生み出したその魅力に迫る,6/16(日) 11:10
fashiontn,FASHION TECH NEWS,技術力とアイデア力で、国内のくつ下製造を支える「SOUKI」,6/15(土) 11:10
fashiontn,FASHION TECH NEWS,「カリマー」のリュックサック「コントア27」の無段階調節で得られるフィット感とは？,6/14(金) 8:10
fashiontn,FASHION TECH NEWS,「チャックテイラー」の世界観を服で表現！　コンバースが提案する新たな価値,6/13(木) 8:10
fashiontn,FASHION TECH NEWS,実は知らないことが多い！？執事服にまつわる意外な事実,6/12(水) 8:10
fashiontn,FASHION TECH NEWS,新登場の「メレル ジャパン アパレル」で注目なのは、汎用性の高い「コーチシャツ」だ,6/11(火) 8:10
fashiontn,FASHION TECH NEWS,今後はAIもフル活用!?　ナイキとエアの現在と未来,6/10(月) 8:10
fashiontn,FASHION TECH NEWS,ドライEXやウルトラストレッチなどの高機能素材をフル活用　ユニクロがスウェーデンのトップ選手と開発した特別コレクション,6/9(日) 11:10
fashiontn,FASHION TECH NEWS,じぶんの肌も内面も見つめる時間を：パーソナライズスキンケアブランド「iEL」,6/9(日) 11:10
fashiontn,FASHION TECH NEWS,不動の人気No.1！ メゾン マルジェラの香水「レイジーサンデー モーニング」に行列ができる理由,6/8(土) 11:10
fashiontn,FASHION TECH NEWS,パリで開催されたエキシビション「Nike On Air」 エアが搭載された最新プロダクトの全貌,6/7(金) 8:10
fashiontn,FASHION TECH NEWS,アメリカの歴代大統領も愛した Brooks Brothersの傑作「ポロカラーシャツ」の魅力,6/6(木) 8:10
fashiontn,FASHION TECH NEWS,赤ちゃんに選ばれる歩育シューズ：裸足のような感覚で歩けるAttipasの魅力,6/5(水) 8:10
fashiontn,FASHION TECH NEWS,木更津から発信する、ヤンキーファッションの軌跡とファンクな魅力,6/4(火) 8:10
fashiontn,FASHION TECH NEWS,都市生活での“移動”をより快適に「ザ・ノース・フェイス」が提案する「アーバンエクスプロレーション」のテクノロジー,6/3(月) 8:10
fashiontn,FASHION TECH NEWS,スマホで素肌を撮影し、AIが適切な日やけ止めを提案：ALLIE AI Beauty UV,6/2(日) 11:10
fashiontn,FASHION TECH NEWS,モルドバから世界へ　日本未上陸の新進ブランド「OK KINO」の繊細なものづくりの背景を探る,6/1(土) 11:10
fashiontn,FASHION TECH NEWS,“タフガイTシャツ”の全米代表選手　CAMBERの「マックスウェイト」はなぜこれほど丈夫なのか？,5/31(金) 8:10
fashiontn,FASHION TECH NEWS,90年代の名作シューズがアップデートされて復刻！ 「AIRWALK CLASSICS（エアウォーク クラシックス）」が 見据える未来像とは？,5/30(木) 8:10
fashiontn,FASHION TECH NEWS,1万円台前半で撥水・防風機能を完備　マーモット「GJジャケット」の実力,5/29(水) 8:10
fashiontn,FASHION TECH NEWS,リピーター続出！アウトドアシーンの救世主、Foxfireの「着る防虫」シリーズ,5/28(火) 8:10
fashiontn,FASHION TECH NEWS,実力派！ 「キーン」初の防水ソックス「ニューポート ウォータープルーフ ソックス クルー」,5/27(月) 8:10
fashiontn,FASHION TECH NEWS,ルイ・ヴィトンでジュエリーデザイナーを務める名和光道さんに聞く、欧州有名メゾンでキャリアを築くまで,5/26(日) 11:10
fashiontn,FASHION TECH NEWS,草履をルーツに持つ「JOJO Naitou」に込められた履物文化への思いとは？,5/25(土) 11:10
fashiontn,FASHION TECH NEWS,アウトドアプロダクツのデイパック「452U」が 物語る、「不変」という価値,5/24(金) 8:10
fashiontn,FASHION TECH NEWS,ワークマン独自開発の新素材「オニテックス」開発者のこだわりが生んだ、強くて軽くて涼しいカーゴパンツ,5/23(木) 8:10
fashiontn,FASHION TECH NEWS,スケーター向けに開発された「NIKE DUNK（ナイキ ダンク）」が人気 「NIKE SB（ナイキSB）」の魅力とは？,5/22(水) 8:10
fashiontn,FASHION TECH NEWS,イヌが服を纏う意味　ドッグウエアのテクノロジー【Howly】,5/21(火) 8:10
fashiontn,FASHION TECH NEWS,ハワイ発のサンダルブランド「ISLAND SLIPPER（アイランド スリッパ）」そのルーツは日本の草履だった,5/20(月) 8:10
fashiontn,FASHION TECH NEWS,HOKA「MACH 6（マッハ 6）」が 反発性の強化でさらに爽快な加速感を実現,5/19(日) 11:10
fashiontn,FASHION TECH NEWS,デサントものづくりの心臓部　DISC OSAKAで生まれた新製品の魅力を探る,5/18(土) 11:10
fashiontn,FASHION TECH NEWS,パリオリンピックイヤーを飾る「speedo（スピード）」の最新スイムウェアとは？,5/17(金) 8:10
