media_en,media_jp,title_articles,link_articles,date_original
san,産経新聞,四国走る最高時速差235kmの「最も遅い新幹線」　0系っぽい「顔」、車内も遊び心満載,https://news.yahoo.co.jp/articles/fbeabdb0afb568866a9aaf4b92adf5275d54a6c4,10/1(火) 10:05
san,産経新聞,名古屋市の河村たかし市長、愛知1区から衆院選出馬へ「総理を狙う男、アゲインという感じ」,https://news.yahoo.co.jp/articles/e17584fbefb489d5e3e7f49090c29aa43ede8d65,10/1(火) 9:29
san,産経新聞,ロシア軍事費21兆円規模へ　25年予算案　歳出の3割　「戦勝」へ全力,https://news.yahoo.co.jp/articles/a68bcf0334086a6b80f7a0fc8412652fa513d4ed,10/1(火) 9:25
san,産経新聞,ウクライナ東部ウグレダルにロシア軍が侵入　現地メディア　陥落の恐れ高まる,https://news.yahoo.co.jp/articles/1153c162a0264d2785a083086255925389f5a380,10/1(火) 9:19
san,産経新聞,WEリーグの閉塞感を印象付けた高田春奈チェア退任、求められるトップ交代にとどまらない改革,https://news.yahoo.co.jp/articles/b783f92b64d7b4db56a7db73bc788082a8363b6f,10/1(火) 9:07
san,産経新聞,大阪メトロなかもず駅のエスカレーターから煙、鉄道運行に影響なし　堺,https://news.yahoo.co.jp/articles/e54a68b8cd54b98a54dc802e8476cf949726b3a8,10/1(火) 8:34
san,産経新聞,近くレバノンに限定侵攻か　イスラエル国防相「まもなく新たな段階」,https://news.yahoo.co.jp/articles/fac0f9b3e56080fcce3a85c11a284bbe1b3b19cb,10/1(火) 8:29
san,産経新聞,リニア静岡工区、知事交代で協議進展　工事着工へ手続き申請も射程,https://news.yahoo.co.jp/articles/b53dde0e700b566f86a84261b2a4039a9b2a54a2,10/1(火) 8:23
san,産経新聞,バイデン政権、不法移民対策を強化　大統領選に向けハリス氏援護,https://news.yahoo.co.jp/articles/56269a7b70b28dc65a72b841fb7e6a6977cb8377,10/1(火) 8:20
san,産経新聞,明日の「おむすび」　風見（松本怜生）の言動にひかれる結（橋本環奈）＜10月2日放送＞,https://news.yahoo.co.jp/articles/8e9a8718fd9e11908b10fe3b02808416643bcfd8,10/1(火) 8:18
san,産経新聞,東海道新幹線、還暦の一番列車　「今日もかっこよかった」東京駅で60周年出発式,https://news.yahoo.co.jp/articles/9d8f9df1ea840b3fdf228b006cffc6358ede2568,10/1(火) 8:16
san,産経新聞,不祥事見逃さぬ公正な目　陸自陸上総隊司令部、菊池輝紀2等陸佐　国民の自衛官　横顔⑩（終）,https://news.yahoo.co.jp/articles/5d92a70fd6a3b3d39dc275cb52ab83647f3a8a6a,10/1(火) 7:46
san,産経新聞,脆弱化した被災地に想定上回る豪雨で「複合災害」　気候変動で求められる水害対策の見直し,https://news.yahoo.co.jp/articles/58eb13a3b8f59d40e93fee8c62e54e1f7876d55c,10/1(火) 7:39
san,産経新聞,小田急線が運転見合わせ　新宿－経堂間,https://news.yahoo.co.jp/articles/5a1d597e68834cd7905ca720b755941c5ad0f6f6,10/1(火) 7:37
san,産経新聞,「次の段階間もなく始まる」イスラエル国防相がレバノン地上侵攻示唆　ヒズボラ弱体化狙う,https://news.yahoo.co.jp/articles/97820882d5da14a41f7c554d254493dec14a5038,10/1(火) 0:57
san,産経新聞,関西経済持ち直しも、中国の減速影響に懸念　アジア太平洋研、6年版白書,https://news.yahoo.co.jp/articles/3b574007b85f4875163f7d315b2725667fafa491,10/1(火) 0:07
san,産経新聞,市長らの給与減額条例案が即日可決　大阪・八尾市、職員らの事件・不祥事相次ぎ,https://news.yahoo.co.jp/articles/39a1e01a7744b564e5bf8ef19d9ea56574ecdec5,9/30(月) 23:26
san,産経新聞,「大阪の政治刷新を」自公が維新と全面対決見据え連携強化　10月27日の衆院選を前に,https://news.yahoo.co.jp/articles/8f3d0620b67d89298be4047431c7d0f25a9850d2,9/30(月) 22:12
san,産経新聞,USJの楽しみ方伝授…アトラクションや撮影スポット　公式ホテル社員に新たな認定制度,https://news.yahoo.co.jp/articles/cf2291c83df9fe7e08ba0bcfaef8cd7308068051,9/30(月) 21:51
san,産経新聞,第77回「都民の消防官」受章者5氏が決定　11月27日に表彰式,https://news.yahoo.co.jp/articles/17d2ad3e069ad71842d5fdc43b7f96aa76f4fb7b,9/30(月) 21:46
san,産経新聞,地震で失った仕事、再就職したばかりだった不明の31歳女性　「早く帰ってきて」待つ家族,https://news.yahoo.co.jp/articles/57da146b34478b08d91187da476ae47a88c5dbe1,9/30(月) 21:40
san,産経新聞,狙われる太陽光発電の送電ケーブル　盗難被害は昨年上回るペース、摘発最多はカンボジア人,https://news.yahoo.co.jp/articles/166deb46da5e22c3c74a9b3cb2cd1fca658a3091,9/30(月) 21:37
san,産経新聞,鉄道各社、基準値を軽視　「あくまで目安」不適切な輪軸1万本以上,https://news.yahoo.co.jp/articles/92875a54344211abc31cf497aa3a62a9a0f36fb1,9/30(月) 21:29
san,産経新聞,藤井聡太王座が3連勝で初防衛、永瀬拓矢九段を下す　獲得タイトル通算25期に,https://news.yahoo.co.jp/articles/a058863aff99fd92850773f5ee22cf5564569414,9/30(月) 21:29
san,産経新聞,「制度の体系ゆがめる」専門家は安全意識や企業風土の課題指摘　「輪軸」不正問題,https://news.yahoo.co.jp/articles/3a9d3a5a3de1a85d77f0c78b384f3e72daf561a0,9/30(月) 21:08
san,産経新聞,霞ケ浦とつくば秀英が決勝へ、関東大会出場も決定　秋の高校野球茨城県大会,https://news.yahoo.co.jp/articles/07aa9dd375faa07a95dd97a8189f027b6b2e090f,9/30(月) 21:08
san,産経新聞,石破政権は菅・森山氏が中核　茂木氏は外れ主流派が逆転、火種くすぶる,https://news.yahoo.co.jp/articles/78867617f4dbf09f5e20f0e1c89a319bf7829456,9/30(月) 21:07
san,産経新聞,91事業者で不適切な「輪軸」、50事業者が改竄データ車両を運行　国交省が発表,https://news.yahoo.co.jp/articles/ed06179037964021289284a86b9a7eca75562f65,9/30(月) 20:51
san,産経新聞,埼玉・松山城の御城印、戦う武者と日本初の軍用犬をモチーフにカラー図柄化　埼玉・吉見町,https://news.yahoo.co.jp/articles/75eebd04b8cdb25008b1323660fe28cb924d3d74,9/30(月) 20:51
san,産経新聞,石破茂新総裁「絆強めよう」　自民、公明が連立合意に署名、政治改革を明記,https://news.yahoo.co.jp/articles/55e13d10e0aee4b6f8a9bbe44845988b537fb675,9/30(月) 20:50
san,産経新聞,「金利復活のときこそできる支援を」　武蔵野銀・長堀和正頭取インタビュー,https://news.yahoo.co.jp/articles/c47151db4c8036d3c610488983bd9089c4a9be15,9/30(月) 20:50
san,産経新聞,お年寄り対象に交通安全フェス　サポカーやシミュレーター使い安全について学ぶ,https://news.yahoo.co.jp/articles/79c1fc6f030c4f55adca12a1339375a6ef3a8946,9/30(月) 20:49
san,産経新聞,駅名表示板にストリートファイターのキャラクター　橿原神宮には「ケン」の銅像,https://news.yahoo.co.jp/articles/1b2c0155976e4c931f1c0cd35d1cb079a4f1e7e8,9/30(月) 20:28
san,産経新聞,31回の歴史で初めて、地元の子供ら能舞台に登場　毎年無料公開の東大阪「ひらおか薪能」,https://news.yahoo.co.jp/articles/539595cc849f1cfd343574602c99d8a046e01571,9/30(月) 20:28
san,産経新聞,幹部の関与、不記載の起源…事件の核心、不明のまま幕　旧安倍派事務局長有罪,https://news.yahoo.co.jp/articles/f4b8a254a9c57fadd85a1e0a35c5522f891cb700,9/30(月) 20:23
san,産経新聞,資産運用立国へ向けた改革「継続性が何よりも大事」　岸田首相が退任前最後の講演,https://news.yahoo.co.jp/articles/9790cfb178b8ea1bc1b77202b0613f608c6a9af8,9/30(月) 20:16
san,産経新聞,告示日直前の斎藤前知事、百条委証人尋問に呼ぶべきか賛否　「選挙妨害」との議論も,https://news.yahoo.co.jp/articles/40754a34685cada943615c0b9a6516082f6e2d29,9/30(月) 20:05
san,産経新聞,中国がレアアース管理条例施行　米国対抗で「国家の所有」を明記、罰則も,https://news.yahoo.co.jp/articles/b6ee95ed2bd3ab2b39f195eb73092c4a9b266c98,9/30(月) 20:04
san,産経新聞,自民離党の世耕弘成氏、衆院和歌山2区にくら替えへ　党擁立の二階伸康氏と保守分裂公算,https://news.yahoo.co.jp/articles/4ba44039511eee187447c02b7a68cb3d0eae6b32,9/30(月) 20:03
san,産経新聞,古都の暴力団「会津小鉄会」　8代目は山口組直系組長に、警察当局は情勢を注視,https://news.yahoo.co.jp/articles/96cb9428c98aca8a9c5b5f3b9a7e543ce9ed3758,9/30(月) 19:52
san,産経新聞,「次」見据え…高市早苗氏は石破政権と距離置く構え　「国賊」発言の村上氏起用も党内刺激,https://news.yahoo.co.jp/articles/af5db3d64d9caa5f8e357aa0895a432c5a988ee6,9/30(月) 19:49
san,産経新聞,拍動する「iPS心臓」、展示へ試作品を公開　万博でパソナパビリオンの目玉に,https://news.yahoo.co.jp/articles/ceeb75939f08bf00949de5e1ba8e3839fb83a5e4,9/30(月) 19:43
san,産経新聞,スニーカーが振動で道案内　ホンダ発ベンチャー、視覚障害者の歩行支援に世界初の装置発売,https://news.yahoo.co.jp/articles/1e651a329f73e742184a594f7cbf8306d3380db6,9/30(月) 19:41
san,産経新聞,日本人含む159人死亡の韓国雑踏事故、当時の警察署長に実刑判決　「予防できた人災」,https://news.yahoo.co.jp/articles/ff0c3eb785858060a6e177f1022a7044e541c2f4,9/30(月) 19:34
san,産経新聞,知財・情報フェアが2日開幕　小野特許庁長官「AI含め民間サービスとユーザーの接点に」,https://news.yahoo.co.jp/articles/d7dd5d6a265c1b07329e5b17a28974d9105ed5b0,9/30(月) 19:33
san,産経新聞,再審無罪で検察控訴「したければすればいい」　袴田巌さんの姉、ひで子さんが会見,https://news.yahoo.co.jp/articles/e9a58c657e19f4509ebfb0dae21c53844bd8eef8,9/30(月) 19:26
san,産経新聞,石破新総裁の関連株は上昇　創設提唱の防災省＆地方創生関連　地元の鳥取企業にも恩恵,https://news.yahoo.co.jp/articles/76e88d7fe9706592171222101cd8408d407ba0ae,9/30(月) 19:22
san,産経新聞,自民・森山幹事長がさっそく新潟・長岡市長選候補者を激励　「出馬に深く敬意」とファクス,https://news.yahoo.co.jp/articles/68eb731da593fd4d2b1c60966236aaf15fff5909,9/30(月) 19:21
san,産経新聞,「トランプ政権実現と早期停戦は日本にもプラス」島田洋一氏　大阪「正論」懇話会詳報,https://news.yahoo.co.jp/articles/acee405fe308370e478d025f0a14eb19d56704cd,9/30(月) 18:57
san,産経新聞,旧安倍派事務局長に有罪判決、事件は節目迎えるも告発相次ぎ再捜査　公選法違反で立件も,https://news.yahoo.co.jp/articles/1aa0b3f7a440f6b9a47458366e580ab1972675c0,9/30(月) 18:50
san,産経新聞,自民・桜田義孝元五輪相が政界引退へ,https://news.yahoo.co.jp/articles/d877f5f1bcef6b00dd1c20e09c1f132d826543df,9/30(月) 18:33
san,産経新聞,＜独自＞国旗と市旗、左右逆に取り違え　千葉・浦安の敬老の日式典中に出席者指摘で修正,https://news.yahoo.co.jp/articles/dc1cdc4958a0489d402c44633ae41377eeb15de4,9/30(月) 18:27
san,産経新聞,琴桜が初優勝、新大関大の里は準優勝　全日本力士選士権,https://news.yahoo.co.jp/articles/732f600443593e2161d0b32c211ff18cc4f3c908,9/30(月) 18:20
san,産経新聞,自民不記載事件で旧安倍派会計責任者に有罪判決　東京地裁「法の目的、ないがしろ」,https://news.yahoo.co.jp/articles/fb6e0bbeb48d7a50d35d8f14dcb67723cc652eb9,9/30(月) 18:18
san,産経新聞,ケーブル盗難被害が多発、昨年上回るペース　摘発はカンボジア人が最多、トクリュウ暗躍か,https://news.yahoo.co.jp/articles/c3cf1c230cd0f46c9a87d7bec551141464a6d985,9/30(月) 18:14
san,産経新聞,失われた「日本」の〝物語〟を提示　理想実現に格闘した『戦う江戸思想』とは,https://news.yahoo.co.jp/articles/510d251edb90a5717442c584dbc385e4674874c1,9/30(月) 18:04
san,産経新聞,坂本花織「選択肢増やす」、鍵山優真は4回転ルッツに意欲　フィギュア有力選手が意気込み,https://news.yahoo.co.jp/articles/c7a32a5a252b4a7ad21e45b2226c2fa7b299dcb9,9/30(月) 17:51
san,産経新聞,イラストレーターの山藤章二さん死去　87歳　「ブラック・アングル」など独特の風刺漫画,https://news.yahoo.co.jp/articles/99f9dd85aa52096c696e618d96fbf0a63a925ffb,9/30(月) 17:49
san,産経新聞,出会い系喫茶で売春相手を紹介　容疑で店長と従業員逮捕　10年間で3億円売り上げか,https://news.yahoo.co.jp/articles/0ee05d06ceb212d9877d44b5c4592b1c7b199cce,9/30(月) 17:43
san,産経新聞,エマニュエル駐日米大使が岸田首相を最後の表敬訪問　大谷翔平ユニホームを贈られ笑顔,https://news.yahoo.co.jp/articles/1d2d4a877ce3670b518b09e908d0f998f959b476,9/30(月) 17:42
san,産経新聞,みずほ証券、楽天経済圏との一体化を強調　協業範囲も拡大　浜本吉郎社長インタビュー,https://news.yahoo.co.jp/articles/55a24d19d6c8a308593390e56904f0909bcf0faf,9/30(月) 17:24
san,産経新聞,江崎グリコのチルド食品出荷停止、全面復旧にめど　11月5日以降,https://news.yahoo.co.jp/articles/b2801912d4f7bab05699ee7061e1fbec7b82d078,9/30(月) 17:11
san,産経新聞,「源氏物語は集大成」まひろ役の吉高由里子　利き手を捨て向き合った「書」　光る君へ,https://news.yahoo.co.jp/articles/07297c77ee17395af252cf67a810b912ff32e47c,9/30(月) 16:55
san,産経新聞,NHK国際放送の尖閣発言問題で日テレ社長「他山の石として未然防止につなげたい」,https://news.yahoo.co.jp/articles/abf18f879dbe5fb1e4a4e7868f8e9d2386e6b1e8,9/30(月) 16:37
san,産経新聞,石破新総裁に〝ご祝儀相場なし〟　総裁選後初日株価　1900円超の下げ幅は過去最大規模,https://news.yahoo.co.jp/articles/c452cb77741248c1c617cb6b479a9d26b8e6583a,9/30(月) 16:22
san,産経新聞,被害1億円超も…寂しさつけ込む「SNS型ロマンス詐欺」に注意,https://news.yahoo.co.jp/articles/fb9f44f6214a4f35f59ae56468a0b8d14269c6e8,9/30(月) 16:20
san,産経新聞,ヤマハ発動機の日高祥博社長が辞任　自宅で娘に切り付けられる　渡部克明会長が社長兼務,https://news.yahoo.co.jp/articles/2fd762f0da1f55294248b30d791a18505a208a15,9/30(月) 16:19
san,産経新聞,カルト文化の評論家、唐沢俊一さん死去　66歳　「トリビアの泉」スーパーバイザー,https://news.yahoo.co.jp/articles/e8b65cfda04b49b16af09556d07352e8ac06edac,9/30(月) 16:17
san,産経新聞,「だじゃれは世界を救う！」　日本だじゃれ活用協会設立10年「これからも魅力発信」,https://news.yahoo.co.jp/articles/da9dbabe1a676d425e2d45504031bc1238727e0a,9/30(月) 15:53
san,産経新聞,10月9日解散意向の石破茂総裁　「7条解散」否定の持論と整合性に立民・野田氏が疑問視,https://news.yahoo.co.jp/articles/5bff3aee2d24e74d16e5024dce5d41cf7a7dcb7c,9/30(月) 15:37
san,産経新聞,電動自転車のバッテリー盗んだ疑いで34歳男逮捕　同様被害多発、20件以上関与か,https://news.yahoo.co.jp/articles/417fa6e52f59cdc70be51d84a54e8f4108b02631,9/30(月) 15:25
san,産経新聞,東証、終値は1910円安　〝石破ショック〟総裁選出後初の取引は大幅反落で終える,https://news.yahoo.co.jp/articles/1658f5eaf7f25fd288737e39177ad0e3ab471e15,9/30(月) 15:19
san,産経新聞,石破総裁、衆院選は10月27日投開票と正式表明　首相就任前も「選挙準備の観点から判断」,https://news.yahoo.co.jp/articles/2e088f927e16ff22bc23908cdf4569f517844494,9/30(月) 15:17
san,産経新聞,狙われる送電ケーブル　金属盗多発で警察庁が有識者会議設置、法規制強化など検討,https://news.yahoo.co.jp/articles/e0babcbf7f8dea0a85ecb4882a3ad42d4ca5cfe0,9/30(月) 14:58
san,産経新聞,共産、衆院選での立民との共闘に消極姿勢　3中総幹部会報告「基盤が損なわれている」,https://news.yahoo.co.jp/articles/3e003c0e2ac2a94fdb3a60e1b189257cdbb3579c,9/30(月) 14:49
san,産経新聞,東京株式市場の下げ幅、一時2000円超え　石破政権の発足前に警戒感広がる,https://news.yahoo.co.jp/articles/6f4efdf0be2a7656af7f7c007b26f23a9a42daef,9/30(月) 14:34
san,産経新聞,中国・天安門広場で「烈士記念日」の式典　習近平氏ら最高指導部メンバーが参列,https://news.yahoo.co.jp/articles/c11258d84d4e4ecb8f8de99d3e70d1306fd461a9,9/30(月) 14:07
san,産経新聞,障害者施設入所者の虫歯治療で腹に馬乗り、死亡させる　歯科医師と看護師を書類送検,https://news.yahoo.co.jp/articles/8c8e6d0b7b14247d1bd36a25eb79933b0275a341,9/30(月) 13:50
san,産経新聞,ディズニーランドで秋の定番ハロウィーンイベント　悪役「ヴィランズ」が主役　1日から,https://news.yahoo.co.jp/articles/6838c3c10df9b88637c592af1aa612152109b8cc,9/30(月) 13:17
san,産経新聞,「子供が何万人に1人の難病。死んでしまう」 知人から医療費500万円詐取容疑、逮捕,https://news.yahoo.co.jp/articles/afc081c6374fc95ae7048b051a7a07b4178dd321,9/30(月) 12:50
san,産経新聞,中国、製造業景況感が5カ月連続で節目割れ　9月は49・8、景気対策の効果注視,https://news.yahoo.co.jp/articles/35b17b03f9d292ea368b3fa421d267a32e894fe9,9/30(月) 12:32
san,産経新聞,「騒ぐな、殺すぞ」東京・国分寺の住宅で緊縛強盗　女性を殴り粘着テープで縛って逃走,https://news.yahoo.co.jp/articles/3d8a670a537ef0fc814bd4b47c3533fc28984e4b,9/30(月) 12:29
san,産経新聞,東京・練馬の強盗致傷事件で新たに男1人逮捕　運転と見張りを担当か　警視庁,https://news.yahoo.co.jp/articles/426391201e17583c66432b019df2ddcb84662531,9/30(月) 12:19
san,産経新聞,客のdポイントバーコードを隠し撮り　野菜ジュース購入に利用のコンビニ店員を逮捕,https://news.yahoo.co.jp/articles/eed37bee4975df2a29540d9ec70de8f483c76372,9/30(月) 12:18
san,産経新聞,野党、臨時国会での予算委質疑要求　早期の衆院解散を牽制「国民に見てもらってからが筋」,https://news.yahoo.co.jp/articles/d0497441b421726451bbbba42ebbf2056d2c5cc5,9/30(月) 12:17
san,産経新聞,自著「まだ間に合う」に込めた思い　話の肖像画　元駐米日本大使・藤崎一郎＜28＞,https://news.yahoo.co.jp/articles/930cfbf0a17efc37fc773bc3a40b84e7aab67163,9/30(月) 12:00
san,産経新聞,注目の兵庫県知事選　10月31日告示、11月17日投開票で実施,https://news.yahoo.co.jp/articles/5d78afe98deaf93b73a8e299cb899dc0344c35cc,9/30(月) 11:58
san,産経新聞,「警察犬、廃止して」　殴られ、火をつけられ…英暴動で負傷相次ぎ、愛護団体が要望,https://news.yahoo.co.jp/articles/a8a393ba14f7b1b3b6623698d134aaa69d304740,9/30(月) 11:54
san,産経新聞,ハムやチョコ…今年最多2911食品値上げ、10月　今後はパック米も、年末には沈静化へ,https://news.yahoo.co.jp/articles/9bfcd7681b435d22d27aa5a60331c4ea08e9828a,9/30(月) 11:37
san,産経新聞,30日の東京株式市場、一時1900円超安　石破政権の誕生控え、利上げと課税強化を警戒,https://news.yahoo.co.jp/articles/f4c3aedf1543e821551a2144b18b6ff5f565f07d,9/30(月) 11:35
san,産経新聞,ひた走る東西 552.6km　「東海道新幹線」開業60年 　探訪,https://news.yahoo.co.jp/articles/cdc02fd860b6742bb1a3def37f15f64bd66c72e3,9/30(月) 11:30
san,産経新聞,朝ドラ「おむすび」人物相関図　平成のギャル、橋本環奈の両親は北村有起哉と麻生久美子,https://news.yahoo.co.jp/articles/fa75c573afd5217e2f168993dc72012d43fdfd89,9/30(月) 11:05
san,産経新聞,朝ドラ「虎に翼」の期間平均視聴率　関東16.8％、関西14.8％,https://news.yahoo.co.jp/articles/9600e21280506a80d561bee8d9c35852c2519c0e,9/30(月) 10:55
san,産経新聞,能登地震後も営業続けたスーパーもとや、浸水被害で休業　再起決意の社長「できることやる」,https://news.yahoo.co.jp/articles/b2af453a2390f1fcb01a37b89d96f096ec86db8a,9/30(月) 10:30
san,産経新聞,ローマ教皇「女性が男性になりたがるのは悪いこと」　性差を尊重「救済の歴史の中心」,https://news.yahoo.co.jp/articles/e4464969385a24d2ea5decdbb255b35d1c37d6a3,9/30(月) 10:17
san,産経新聞,高市早苗氏支援の藤川晋之助氏「ネットで勝ち派閥に負けた」「岸田文雄氏は今後も権力者」,https://news.yahoo.co.jp/articles/b81899cbe905e6beea626156f5e73bbc2ade14cc,9/30(月) 10:16
san,産経新聞,全国唯一の空白地帯「四国に新幹線を」　動き活発化の裏に「夢の超特急」との深い縁,https://news.yahoo.co.jp/articles/a72022989b53fe82f827f31e7f3de7c162dcfbe2,9/30(月) 10:10
san,産経新聞,ロシア軍、ウクライナ東部州の集落「再制圧」と主張　露クルスク州奪還作戦は停滞か,https://news.yahoo.co.jp/articles/de33777472d7a6232a146d20fdc3f8e0390a7439,9/30(月) 9:56
san,産経新聞,30日の東京株式市場、一時1600円超安　〝石破ショック〟の様相呈す,https://news.yahoo.co.jp/articles/2b1d4e29d37bb6542e3f2b05bd8354c2f66ba730,9/30(月) 9:15
san,産経新聞,「間違いなくMVP」「圧倒的」　ドジャース大谷翔平、三冠王に届かずも米国メディア称賛,https://news.yahoo.co.jp/articles/200e25a2fdeba8652b2661a91bcfe4b634391b9a,9/30(月) 8:44
san,産経新聞,明日の「おむすび」　博多ギャル連合に入るよう誘われる結（橋本環奈）＜10月1日放送＞,https://news.yahoo.co.jp/articles/25a81c82e43346c0037c190016e2c5cfe4135b39,9/30(月) 8:15
san,産経新聞,大谷、本塁打と打点の2冠確実　三冠王は逃す　「54－59」でレギュラーシーズン終了,https://news.yahoo.co.jp/articles/7595d81cd343eb39719fa93001b586b4ea6c9866,9/30(月) 8:10
san,産経新聞,長時間労働の温床、問われるタカラジェンヌのフリー契約　宝塚歌劇団女性急死から1年,https://news.yahoo.co.jp/articles/f82d1cc4a9c9d9d3f4102edf6dfa524d4365db55,9/30(月) 8:05
san,産経新聞,「就職戦線の前哨戦」インターンシップがより重要に　規模拡大する企業相次ぐ,https://news.yahoo.co.jp/articles/46d95b213b96bab97e85beb59c027e1a575eb9fc,9/30(月) 8:05
san,産経新聞,河南町議選　新議員10人決まる,https://news.yahoo.co.jp/articles/dda871bb2095a7772544a59144a9a3f76861fba8,9/30(月) 7:17
san,産経新聞,斎藤兵庫知事が自動失職　不信任決議から10日以内に議会解散も辞職もせず,https://news.yahoo.co.jp/articles/05708211862cf368ad37e8f1e8d21d7c92f941ca,9/30(月) 0:05
san,産経新聞,大阪・泉南市議選が投開票　新議員15人決まる,https://news.yahoo.co.jp/articles/7253bb3d7f40c4a88f1e54b183bf003b0a196f5d,9/29(日) 23:51
san,産経新聞,最速「10月27日」　自民・石破総裁は熱冷めぬうちの選挙にかじ　公明の早期解散論も後押し,https://news.yahoo.co.jp/articles/028a96d6b30bdced18190645936181b07441984d,9/29(日) 22:40
san,産経新聞,衆院選10月27日投開票へ　閣僚全容固まる　自民は30日に新体制始動、副総裁に菅前首相,https://news.yahoo.co.jp/articles/b5fefdde98522a4b827844a3e94ec48193ea4986,9/29(日) 22:39
san,産経新聞,2位確定の阪神、岡田監督「まだ１カ月ぐらい野球をしたい」　佐藤輝が殊勲の逆転三塁打,https://news.yahoo.co.jp/articles/57d32459fa8fe601578c443909840ffbe29a6d1c,9/29(日) 22:32
san,産経新聞,森元首相も駆けつけた　琴桜の大関昇進祝賀会に1100人　八角理事長「綱への道開ける」,https://news.yahoo.co.jp/articles/9ca449add3d24c9a012e744049ea6fd7ce55a4ff,9/29(日) 21:58
san,産経新聞,女子ゴルフ、21歳竹田が史上初の初優勝から年間7勝　米挑戦「今年やってもいいかな」,https://news.yahoo.co.jp/articles/c11f2245f3ccd46749863ff58eb2541663046092,9/29(日) 21:55
san,産経新聞,小田凱人「感慨深い」　大観衆の中で車いすの部2連覇　ジャパンOPテニス,https://news.yahoo.co.jp/articles/98f5219ec4171bcf3ec52614fd59b28cf13ca3b0,9/29(日) 21:55
san,産経新聞,中小河川でも家屋流され…「谷底平野」リスク　能登半島豪雨で専門家が警鐘,https://news.yahoo.co.jp/articles/b0309ab586595b4a9220eaf522aa8c71bbe15050,9/29(日) 21:21
san,産経新聞,総務相に村上誠一郎元行政改革担当相起用へ　かつて安倍晋三氏を「国賊」と批判し処分,https://news.yahoo.co.jp/articles/84c83cee8ec575563cd44fc00b65af1b8bac3f3b,9/29(日) 20:46
san,産経新聞,復興相に伊藤忠彦氏　御法川信英氏起用は取りやめ,https://news.yahoo.co.jp/articles/04a551447f095a52068460c4e49d971a62e40b0c,9/29(日) 20:37
san,産経新聞,西武に強い！　ロッテ小島が7回無失点で自己最多12勝目　自身は西武戦11連勝,https://news.yahoo.co.jp/articles/f61f67489e4e2ffb64933bdbea0eda1c212af04a,9/29(日) 20:03
san,産経新聞,今年のクリスマス、チョコレートケーキは我慢！？　カカオ豆高騰で商品値上げ相次ぐ,https://news.yahoo.co.jp/articles/53d9c52b80a37b94c1aea692b687c75141d8caf1,9/29(日) 20:00
