media_en,media_jp,title_articles,link_articles,date_original
san,産経新聞,ひと月の収穫期しか味わえぬ逸品、「栗の点心　朱雀」の繊細な甘味と舌触り　長野・小布施　味・旅・遊,https://news.yahoo.co.jp/articles/ff047df034d758654b49031f9bee2ba8eac16cdc,9/28(土) 11:27
san,産経新聞,石破新総裁、党役員や閣僚人事調整を本格化　幹事長、官房長官など焦点,https://news.yahoo.co.jp/articles/3611c2ff8963e053add9714daf4cde4693e61216,9/28(土) 11:07
san,産経新聞,「コロッケ社長」が大阪の高校で授業　ケミカルクッキングで食の安全伝える,https://news.yahoo.co.jp/articles/7b38c9a3b591b5de4d2c3eb8065b76e5c0f8848b,9/28(土) 11:04
san,産経新聞,人食いオオカミの恐怖におびえる人々　洪水ですみかを追われたか、人間への復讐説も　世界行動学,https://news.yahoo.co.jp/articles/6521e43c28526b59f5bfd65c7f01612792b112dc,9/28(土) 11:00
san,産経新聞,対中抑止力に先端半導体の「民主主義供給網」 TSMC抱える台湾の自信,https://news.yahoo.co.jp/articles/9e1dbe983590ab634207397d2b2cd75393eda931,9/28(土) 10:38
san,産経新聞,米、石破新総裁の安保政策に冷ややか　地位協定見直しなら「摩擦」も,https://news.yahoo.co.jp/articles/70da8440f46a62e093feb71f2bc7a78269ed8245,9/28(土) 10:27
san,産経新聞,中学受験国語の文章を読んだことありますか? 「おえっ」となること間違いなし　桜井信一　桜井信一の攻める中学受験,https://news.yahoo.co.jp/articles/709b6a3638e889998fe6b3f9855eba7747520da8,9/28(土) 10:24
san,産経新聞,祖国ベネズエラの混乱の中、音楽と文化の力を信じた指揮者　ドキュメンタリー映画が公開へ,https://news.yahoo.co.jp/articles/0979699376acf2cf876e1c7b756b86060636523e,9/28(土) 10:16
san,産経新聞,生物の目線が分かる上尾市自然学習館で市内の自然と摘田を学ぶ　埼玉「館」巡り,https://news.yahoo.co.jp/articles/d563ccb4f3551632547b27f5c9dbe3e9df0f65b3,9/28(土) 10:13
san,産経新聞,大谷翔平が日本選手最多の57盗塁目決める　イチローの記録を更新,https://news.yahoo.co.jp/articles/8b00ffa9fedd5599b566c03a0ca55ff1421e340d,9/28(土) 10:07
san,産経新聞,NHKらしさの防人・谷地＆暁アナ　全方位ch,https://news.yahoo.co.jp/articles/89f03ddf7bc941fc63bdef53a0a618e0eee8c228,9/28(土) 9:43
san,産経新聞,イスラエル軍、ベイルート郊外のヒズボラ本部を空爆　標的は指導者のナスララ師　安否は不明,https://news.yahoo.co.jp/articles/835e162b95696d30d02c17013534368acf9a1fb3,9/28(土) 8:37
san,産経新聞,2次元で2.5次元を表現する「推しの子」　イマドキTV+,https://news.yahoo.co.jp/articles/178dfc8bc172f6e1b1f27153acc8f32518b9da1b,9/28(土) 8:33
san,産経新聞,気になる大阪・北河内の行方　市長の〝暴走〟議員の党利党略　試される市民の力　from 大阪社会部,https://news.yahoo.co.jp/articles/8931d90543dcfd65c546ca2f8d71a2599104c4a1,9/28(土) 8:05
san,産経新聞,災害時、無心で要人輸送　陸自第15ヘリコプター隊第2飛行隊、青葉伸明1等陸尉（49）　国民の自衛官　横顔⑨,https://news.yahoo.co.jp/articles/126a6908337b2c0d3272825b96db58de3d22d042,9/28(土) 7:23
san,産経新聞,「八百」会見直後、斎藤知事側近は県警本部に走った　混迷・兵庫県知事失職㊥,https://news.yahoo.co.jp/articles/1ad420f22804116ef31157b93d68a41aaadc97b6,9/28(土) 7:22
san,産経新聞,外信コラム　韓国の家事管理士とは　フィリピン女性ヘルパー100人就業、育児を支援,https://news.yahoo.co.jp/articles/6028e3ff1f6fc1fdf270834ae4dc4c3d5877f179,9/28(土) 7:21
san,産経新聞,「日常」の幸せかみしめる橋本環奈の「おむすび」　激動の平成、ヒロインの成長を通じ描く,https://news.yahoo.co.jp/articles/9803957067530bd0d7135ec9303ef445f6701312,9/28(土) 7:20
san,産経新聞,「維新勤王隊」入隊式、時代祭へ練習重ねる,https://news.yahoo.co.jp/articles/403bfe1b11080ce4a03dd36681f740ab91d8030a,9/28(土) 7:20
san,産経新聞,乳がん手術後に腫瘍マーカーが高値に　再発したのでしょうか？　がん電話相談から,https://news.yahoo.co.jp/articles/7a01c44d75783bb5f910f7237e9be42362d9a7db,9/28(土) 7:00
san,産経新聞,痛恨のサヨナラ負けを喫した阪神、岡田監督「大事なところでエラーが出る」,https://news.yahoo.co.jp/articles/3c19eab247479eab46bb6168a45876bc5bdac9b5,9/27(金) 22:58
san,産経新聞,石破茂総裁誕生で自民党内に強まる早期解散論、衆院選投開票は11月10日が有力視,https://news.yahoo.co.jp/articles/7b23aa230d420b72b4b4ca59574a7adfb3aa79d4,9/27(金) 22:13
san,産経新聞,小泉進次郎氏が総裁選で失速した理由、政策打ち出しの初動ミス挽回できず、地方票に泣く,https://news.yahoo.co.jp/articles/073621adef1aa40dc2a68f5c0a570da51e1067a0,9/27(金) 21:55
san,産経新聞,安倍氏国葬から2年　高市早苗氏総裁選善戦も「包囲網」で敗れる、保守層の期待変わらず,https://news.yahoo.co.jp/articles/95b37962b9b9c9986a7b67a6e14f23609774c58d,9/27(金) 21:52
san,産経新聞,石破茂新総裁はカレー好きの鉄道ファン、師は田中角栄氏　「党内野党」から5度目の正直,https://news.yahoo.co.jp/articles/5ff49cc7358753c6a3254e0fe181589e20ffd6f5,9/27(金) 21:40
san,産経新聞,年度内にも4万円台回復？石破茂氏当選を金融市場は手荒く歓迎　日本株は長期的に上昇か,https://news.yahoo.co.jp/articles/219551d861b846483e1c694717ff5cf8ff420cb1,9/27(金) 21:39
san,産経新聞,奈良県内の私立中高募集要項　全日制高校2370人　中学は1520人で来年1月18日入試,https://news.yahoo.co.jp/articles/3b6d062a648d2657400955b5696154552de7dc7f,9/27(金) 20:58
san,産経新聞,「検察の控訴」に大義はあるのか、袴田巌さん再審無罪　3つの捏造を巡る認定,https://news.yahoo.co.jp/articles/a4f1cd5dfd6e3e7a26c34442c8cf33f0631588da,9/27(金) 20:46
san,産経新聞,大災害に備え、調理専門学校の学生と炊き出し訓練　警視庁野方署「食事で一瞬でも笑顔に」,https://news.yahoo.co.jp/articles/9778c4d0af2ce9fc97e7e69c316359541241c1db,9/27(金) 20:41
san,産経新聞,選挙プランナー・野沢高一氏、石破茂新総裁に「政権発足直後の支持率がカギ」,https://news.yahoo.co.jp/articles/e1ce44408f8a806ff6c3e7119dce8115212f01c5,9/27(金) 20:40
san,産経新聞,防衛マニア、プラモデルオタク、筋金入りの鉄道愛…知人ら語る自民党新総裁石破茂氏の素顔,https://news.yahoo.co.jp/articles/ed39df5f092a5b7f0d7e6f9a25ff5e26e4f1bb5d,9/27(金) 20:39
san,産経新聞,石破茂・自民新総裁に漫画家・やくみつる氏「自己批判できる人」「リーダーシップに課題」,https://news.yahoo.co.jp/articles/7181f10477ebc36062095bdf876e278609cdd3b0,9/27(金) 20:38
san,産経新聞,死亡共済金目的か　知人を川に転落させ水難事故装い殺害疑い　61歳の男を逮捕,https://news.yahoo.co.jp/articles/3536e93be2b3abbe42182343bb057dbaf2581cbd,9/27(金) 20:33
san,産経新聞,石破茂新総裁に北朝鮮拉致被害者の家族「即時一括帰国、堅持を」　改めて奪還求める,https://news.yahoo.co.jp/articles/b568c52a077dc5638ac46c1a2003e48fc70e0405,9/27(金) 20:30
san,産経新聞,石破新総裁選出で岸田首相「信頼と共感の政治実現を期待」　自らの投票先は明かさず,https://news.yahoo.co.jp/articles/e02d1f6e42c99528a11252c4208881886ae18e2d,9/27(金) 20:06
san,産経新聞,石破新総裁「日本企業の〝国内回帰〟で雇用と所得機会を」　輸出弱体化の経済構造を問題視,https://news.yahoo.co.jp/articles/51c7331021139d54d54798c047195410d3a8bea2,9/27(金) 20:03
san,産経新聞,自民総裁選　「大きな爪痕」千葉の支援者ら小林鷹之氏たたえる　引きはがしで悔しさも,https://news.yahoo.co.jp/articles/e8f3229228ab81c9790a061eeb93301777481480,9/27(金) 20:03
san,産経新聞,「石破氏、チャーミング」群馬県の山本一太知事　河野太郎氏には「支援足らず申し訳ない」,https://news.yahoo.co.jp/articles/954fa64ce788b577dfc1c4f953eb55c56b912642,9/27(金) 19:55
san,産経新聞,ドクターイエロー、JR東海が引退前のお披露目　老朽化などで来年1月に役目終える,https://news.yahoo.co.jp/articles/bfca40541edb39839b0a3c99d5325ae78b0c3911,9/27(金) 19:47
san,産経新聞,「次も挑戦する」総裁選5位の小林鷹之氏　知名度不足に苦しむも「次」に向け存在感,https://news.yahoo.co.jp/articles/6ad7e5bf2ac4cbb20b3296f6becd80623eaedb10,9/27(金) 19:46
san,産経新聞,海上自衛隊が中国調査船の要請受け負傷の男性乗組員救助　小笠原沖でロープ巻き取り作業中,https://news.yahoo.co.jp/articles/69dbc52e9b8bf9973bb4a8bdad7f2ed7c4661962,9/27(金) 19:43
san,産経新聞,石破茂新総裁が求める幹事長像「第一、選挙に勝つ」「第二、党内掌握し総裁に負担かけぬ」,https://news.yahoo.co.jp/articles/bc2e1bd7f1bdec9f819af1716242d875945e9399,9/27(金) 19:41
san,産経新聞,中国人民銀が利下げ　「5％」成長へ共産党指導部が必死の対策,https://news.yahoo.co.jp/articles/6a7d83f760da2f08668c53f2c748ec09250db8b7,9/27(金) 19:40
san,産経新聞,バスケ女子Wリーグ、10月11日開幕　デンソー馬瓜「優勝目指す」トヨタ山本「革命起こす」,https://news.yahoo.co.jp/articles/cfeda55a90510a83259ed0d04cdf02e5a5eabdca,9/27(金) 19:36
san,産経新聞,国民民主・玉木代表、新総裁の石破氏に「政治資金規正法の再改正を」　経済政策に懸念も,https://news.yahoo.co.jp/articles/53ea10176680425450c37a557a6429c3b80b7fa1,9/27(金) 19:30
san,産経新聞,小林鷹之氏、地元・千葉の党員票3位　1位は高市早苗氏　「せめて千葉は…」　自民総裁選,https://news.yahoo.co.jp/articles/f8d44482b89199556baf80d9fdab440abbf7a577,9/27(金) 19:29
san,産経新聞,女性初の首相の意欲ささやかれる小池百合子都知事「女性候補が普通になりうれしい」総裁選,https://news.yahoo.co.jp/articles/2fcfd9813f674c248cce91df74a3f57d1bacc70e,9/27(金) 19:28
san,産経新聞,首位浮上の山下美夢有「優勝したい」　2年連続女王の意地、ゴルフの日本女子オープン,https://news.yahoo.co.jp/articles/dc028ea440ac9b395006892b64ffcd0134851094,9/27(金) 19:24
san,産経新聞,「あと一歩のところで…」自民総裁選、高市氏惜敗　地元は悔しさと健闘たたえる声,https://news.yahoo.co.jp/articles/6dd5e5b3d358eefc410f2b6e0750192e41dd2369,9/27(金) 19:22
san,産経新聞,沖縄・玉城知事、石破茂新総裁に「日米地位協定の見直し期待」,https://news.yahoo.co.jp/articles/6c13f524ce22857fc5a5ae4b9d0d6e856158b916,9/27(金) 19:19
san,産経新聞,「やり残したことはない」総裁選6位の茂木敏充幹事長、見据える「次」　国会議員票で苦戦,https://news.yahoo.co.jp/articles/70cbceb7cd7bd1127bd7fff9386779f00acae9d9,9/27(金) 19:10
san,産経新聞,パナHD、万博パビリオンデーの概要発表　有名ダンサーのパフォーマンスや子供たちの発表も,https://news.yahoo.co.jp/articles/1360159afaec7519695466f05a584ef42ffe7391,9/27(金) 19:10
san,産経新聞,H3ロケット4号機打ち上げを10月26日に再設定、当初は20日、防衛通信衛星を搭載,https://news.yahoo.co.jp/articles/4e32eba8e7e61e122e5ad8a260fcc5f78de124e7,9/27(金) 19:06
san,産経新聞,上川陽子氏「戦い抜いたと実感」総裁選7位の敗因は準備不足,https://news.yahoo.co.jp/articles/84bd4becf928f7d7ee640780f18902fc9be48c5f,9/27(金) 19:05
san,産経新聞,自民新総裁、小林鷹之氏の地元・千葉県連は期待と失望　「国のため、クリーンな政治を」,https://news.yahoo.co.jp/articles/d3eeaef1cd6bd7b4e0a1d0811ee6f8406b299930,9/27(金) 19:03
san,産経新聞,石破茂氏「同性婚を救済」「北に連絡事務所」「米に自衛隊基地」「地熱を推進」総裁選語録,https://news.yahoo.co.jp/articles/6535bfebbd42c133cbd771c65ab444e6d5007b21,9/27(金) 18:46
san,産経新聞,豊嶋泰嗣さん監督、小さな演奏会の種をまく　10月に京都5市町巡る新たな音楽祭,https://news.yahoo.co.jp/articles/97c97bd4e63be7ea4636d8e80e85ced0b4062d1d,9/27(金) 18:46
san,産経新聞,市場は〝石破ショック〟の様相　円急騰、日経平均株価の先物は一時2000円超も急落,https://news.yahoo.co.jp/articles/73566a4caee3b44b26eef8b474dc7bc21161bcef,9/27(金) 18:45
san,産経新聞,石破茂氏の新総裁選出に台湾の頼清徳総統が祝意　「民進党と関係発展を」,https://news.yahoo.co.jp/articles/4e0591d2b7d80570c40cf88847aa3f4dc196feca,9/27(金) 18:45
san,産経新聞,自民党総裁選　小泉進次郎氏の地元・神奈川では落胆と期待「次につながる堂々の3位」,https://news.yahoo.co.jp/articles/b8abb8fa4a97a319bf4f8bb86b98b0fbcd968e0a,9/27(金) 18:42
san,産経新聞,「国連のシステムに台湾を」　台北駐日経済文化代表処札幌分処の粘信士処長が訴え,https://news.yahoo.co.jp/articles/724e1ca768b805efc6c657684b63b05ab2bda38d,9/27(金) 18:41
san,産経新聞,自民党総裁選　神奈川県内の得票数トップは小泉氏、高市氏が続く　石破氏3位、河野氏4位,https://news.yahoo.co.jp/articles/4301122981c2d4b38c474d963ea7ea68c9807975,9/27(金) 18:41
san,産経新聞,ウクライナの行方、米大統領選が左右　ハリス氏「支援は国益」　トランプ氏「停戦が利益」,https://news.yahoo.co.jp/articles/6614b509b8da6ed71bc24a8a223eaf9af4cf1e53,9/27(金) 18:40
san,産経新聞,自民新潟県連幹事長「選挙を戦えるような新内閣、党役員人事を」　石破新総裁誕生で,https://news.yahoo.co.jp/articles/9aed3eb01987f1e9c7b722f8b33fe2d70242c018,9/27(金) 18:40
san,産経新聞,自民・石破茂新総裁、内閣改造・党役員人事「ともに戦った人はふさわしい役職に」就任会見,https://news.yahoo.co.jp/articles/4e3883ad957f5c8642de10c03953c5463347545f,9/27(金) 18:33
san,産経新聞,石破茂氏といえば…「魔人ブウ」のコスプレ　仕掛け人は「だまし討ちもニコニコ受けた」,https://news.yahoo.co.jp/articles/732b488bbd6e37187f37b8adca413bd4d17f549a,9/27(金) 18:30
san,産経新聞,韓国政府、日本の新内閣との協力表明「肯定的な流れつなぐ」　石破氏の総裁就任歓迎の声,https://news.yahoo.co.jp/articles/5382c9b8c27202268256bffe4f6e48cc0ef36f6e,9/27(金) 18:21
san,産経新聞,「石破新総裁は本来の自民党」「防災省に期待」　面識あるインターアクト・ジャパン帯野会長,https://news.yahoo.co.jp/articles/fd1aaab077ff80ef90732d447979cf79ba635cf7,9/27(金) 18:19
san,産経新聞,女子高生チームがスイスで素粒子実験　検出器を自作、コンテスト最優秀で実現,https://news.yahoo.co.jp/articles/efb01bd41bec9a715bea9f6d2e7f3f9aa98925a5,9/27(金) 18:19
san,産経新聞,大経大サッカー部・村上陽斗選手がいわきFC入団「1年目から活躍を」,https://news.yahoo.co.jp/articles/c9f6784f82e049879a6f685e77aa250d42cd70b2,9/27(金) 18:14
san,産経新聞,自民党総裁選、茂木敏充氏の地元・栃木「結果は少し不満だが、がんばってくれた」,https://news.yahoo.co.jp/articles/f4f4da736a4b8db88c73b4a464e4f96379040399,9/27(金) 18:11
san,産経新聞,自民党総裁選、上川陽子氏の地元・静岡　石破茂新総裁に「期待が大きい」,https://news.yahoo.co.jp/articles/28342429409f11d629984f1f45af530a5c3352c4,9/27(金) 18:06
san,産経新聞,総裁選最下位の加藤勝信氏、議員票16票で推薦人数に届かず　5人が引きはがしか,https://news.yahoo.co.jp/articles/101b4a96a8f790cffb1d799bb83625e74cbc5d24,9/27(金) 18:04
san,産経新聞,石破氏の新総裁選出、ロシアでも速報　集団安全保障の信奉者と紹介　日露関係「変化なし」,https://news.yahoo.co.jp/articles/e90031633b0465cb6c00cfd8e813e77109a1b0d3,9/27(金) 17:47
san,産経新聞,「派閥が問題とは思わない」8位に沈んだ河野太郎氏　敗因は派閥との指摘にさばさば反論,https://news.yahoo.co.jp/articles/1f35794018336a0c0a85a5d150498a3509525871,9/27(金) 17:47
san,産経新聞,自民京都、党員投票トップは高市氏…「堅実な経済政策を」新総裁石破氏に古都から期待の声,https://news.yahoo.co.jp/articles/1aeaaaae4bf2863f027265cdc2c667f248e0de35,9/27(金) 17:44
san,産経新聞,日用品のCO2排出量把握へ業界初の共通システム　ユニ・チャームなど4社が実証実験,https://news.yahoo.co.jp/articles/111a47ba13266d0ddc851aba35d2ab7c87e6eb01,9/27(金) 17:37
san,産経新聞,立民・野田代表、自民党新総裁の石破氏との対決に「腕が鳴る」「がっぷり四つに組んで」,https://news.yahoo.co.jp/articles/df531991a9ba8bf9a187e4852c0d0c84fcfb3efe,9/27(金) 17:27
san,産経新聞,辺野古ダンプ事故現場の路上で防衛局職員に暴行、抗議活動の76歳男を逮捕　沖縄県警,https://news.yahoo.co.jp/articles/ae2ec61560139e66d1669da577885bbf5274be7c,9/27(金) 17:26
san,産経新聞,韓国は石破茂新総裁を歓迎「歴史問題で関係こじらせない」　関係改善の流れ続くと評価,https://news.yahoo.co.jp/articles/e5ddefc763e8dc518939a07e55e43b517615a93f,9/27(金) 17:22
san,産経新聞,フジテレビがガチャピン・ムックなどキャラクター事業展開に本腰　10月に新会社を設立,https://news.yahoo.co.jp/articles/0b3aac1838bd51bcbdbdfd7f9ce5752fca12cb5e,9/27(金) 17:18
san,産経新聞,自民・石破茂新総裁に万博推進を期待　関西財界　原子力の最大活用や中小支援も,https://news.yahoo.co.jp/articles/74720ddd1e9c451c55052d73a51f0411bb0fbd0e,9/27(金) 17:16
san,産経新聞,中国外務省が石破氏勝利で日本側にクギ　「平和発展の堅持を」　台湾訪問に改めて反対表明,https://news.yahoo.co.jp/articles/50e7a76ee10b11e8b2792ac011b61f8e57665540,9/27(金) 17:16
san,産経新聞,「石破政権」などSNSも総裁選関連のキーワードが〝独占〟　「石破かよ」もトレンド入り,https://news.yahoo.co.jp/articles/6d4f859f1e3a8f12f3f9c07fba15dc56d86fcb12,9/27(金) 17:07
san,産経新聞,自民・石破茂新総裁「自由闊達、公平公正、謙虚に」かむ場面も　首相は「一兵卒で支える」,https://news.yahoo.co.jp/articles/019570ce66d0b31e2e45c16388d48cbf6a424dce,9/27(金) 17:04
san,産経新聞,「『また維新か』と思われるのは事実」…偽名出入り問題で京都維新代表,https://news.yahoo.co.jp/articles/35a36e73e3de86ea79896cc35f6bec5a8c6ced26,9/27(金) 17:01
san,産経新聞,林芳正官房長官「ポスト石破」うかがえる4位に滑り込み　「政策通」が浸透,https://news.yahoo.co.jp/articles/fadf5a1c3a00a37811efee05d66fdcdb34adc022,9/27(金) 16:58
san,産経新聞,河野太郎氏、総裁選敗北に「私の力不足」　派閥所属したままの出馬は「問題と思わない」,https://news.yahoo.co.jp/articles/946c6fc4b87e2e45aa0ded0d832e08a2adc2266c,9/27(金) 16:55
san,産経新聞,フジテレビ社長会見中に石破茂新総裁誕生「日本をどうしていくのか冷静に報じていきたい」,https://news.yahoo.co.jp/articles/d63fc2ff74e8d4b50aaeda33a81efd59982d0cf7,9/27(金) 16:53
san,産経新聞,「地方創生」加速期待　自民党新総裁の石破茂氏「人口減っていく地方であってはならない」,https://news.yahoo.co.jp/articles/fcebcdc38614c0427a8c74d625be88dd41fec950,9/27(金) 16:46
san,産経新聞,イエメンからのミサイル、イスラエルが迎撃を発表　ヒズボラ司令官殺害の報復か,https://news.yahoo.co.jp/articles/3fdd7a25fbbb53c68314d1e4b4f91a97e7d11eb6,9/27(金) 16:45
san,産経新聞,自民党総裁選、敗戦の高市早苗氏「私の力不足」　小泉進次郎氏は「できることで支えたい」,https://news.yahoo.co.jp/articles/729dbf644ab33c0a7b0e90278e23fb328d7e50bf,9/27(金) 16:41
san,産経新聞,勤務していた放課後等デイサービス利用の女子中生に性的暴行か　男2人を逮捕,https://news.yahoo.co.jp/articles/3f71edfae232b8ea174e606d5bb04967a9bfed29,9/27(金) 16:19
san,産経新聞,中国の最新鋭原潜が長江で就航前に沈没、事態隠蔽か　米紙報道,https://news.yahoo.co.jp/articles/387ce6a2e8b776506d1cd9b8f949aef622c015d2,9/27(金) 16:18
san,産経新聞,石破氏当選受けて円が急騰、数分間で146円台から143円台へ円高進む　自民党総裁選,https://news.yahoo.co.jp/articles/a1e0030a12637b6df6f1d13c05688d08a364297c,9/27(金) 16:17
san,産経新聞,中国メディアが石破茂新総裁選出を一斉に速報　石破氏持論の「9条2項削除」に警戒感,https://news.yahoo.co.jp/articles/b193b63cc67c6d10d40aa946a68dd6959e250f5a,9/27(金) 16:11
san,産経新聞,「ワイドショー政治」は健在か　「高市潰し」「包囲網」はねのけられず、高市氏敗れる,https://news.yahoo.co.jp/articles/02fddd46a2dd3789b6d79156224f78bb5d4a15cf,9/27(金) 16:11
san,産経新聞,自民総裁選で河野太郎氏は30票と「失速」、党員票でも8位　前回は2位で255票,https://news.yahoo.co.jp/articles/97d8b4745dfdc05dbb99998c81c05398d19a8054,9/27(金) 16:07
san,産経新聞,ボクシング寺地拳四朗が練習公開、世界2階級制覇へ「自信」　10月にフライ級王座決定戦,https://news.yahoo.co.jp/articles/f09e382e62233de188a5847377a78a57374949a7,9/27(金) 16:03
san,産経新聞,中古スマホの市場が拡大、販売の1割規模に成長　端末価格の高騰や1円スマホ禁止が影響,https://news.yahoo.co.jp/articles/c9f68c54815adecb6cf6eb876b10c233505eb9cc,9/27(金) 16:00
san,産経新聞,沖縄で考えた自衛隊の意義　石破茂新総裁は憲法改正実現掲げ速やかに衆院解散を　政治部長　酒井充,https://news.yahoo.co.jp/articles/2b1b59d5f53b67a67636ec2f27eb5b4a1fe23a9a,9/27(金) 15:53
san,産経新聞,陸自15旅団の不発弾処理、無事故で4万件　沖縄・玉城知事「任務に深甚なる敬意」,https://news.yahoo.co.jp/articles/f25dcd16cc377ba1610f720c4e595ece816490fb,9/27(金) 15:48
san,産経新聞,新潟知事、世界文化遺産の佐渡金山「次の世代に引き継ぐ」　県議会の金山議連で,https://news.yahoo.co.jp/articles/567dde4ffa6e134f4a3499719bdf62917c5a9274,9/27(金) 15:45
san,産経新聞,パナHD、AI開発効率化へ向けファストラベルと協業　教師データ作成支援,https://news.yahoo.co.jp/articles/3fd84ec29884298a164f70f6e472adc4db14b9ee,9/27(金) 15:43
san,産経新聞,自民党総裁選決選投票の結果　石破氏215票、高市氏194票,https://news.yahoo.co.jp/articles/5e0fdd27ed46c4d4c23c8427f9ea62239fc86779,9/27(金) 15:30
san,産経新聞,自民党新総裁は石破茂元幹事長　決選投票で高市早苗氏を逆転で破る　1回目投票では2位,https://news.yahoo.co.jp/articles/a9275292e1baa202b960f23b1681c35685e50f44,9/27(金) 15:29
san,産経新聞,決選投票前に高市早苗氏「勝ち続ける自民党を作る」「命守れる日本列島を」　自民党総裁選,https://news.yahoo.co.jp/articles/6e8be50cbbf855be4c0ee10fb4dedd3e1d55aebb,9/27(金) 15:27
san,産経新聞,ラグビー元日本代表の吉田義人氏による親子教室を10～12月に開催　横浜市が参加者募集,https://news.yahoo.co.jp/articles/f26be2ac1867356dd0445426de7a5f60962ab198,9/27(金) 15:25
san,産経新聞,三菱商事、マレーシアのLNG権益を拡大　基地の生産能力は世界最大規模,https://news.yahoo.co.jp/articles/3940cb343f942500a5aa99799f13639f1b0c2f0c,9/27(金) 15:25
san,産経新聞,青山学院大合格高校ランキング　上位3校に桐蔭、山手、桐光、神奈川の私立校が占める,https://news.yahoo.co.jp/articles/32e9144a602e82703206c35ce3ad09354796b926,9/27(金) 15:02
san,産経新聞,6年前の殺人事件、48歳男に懲役16年判決　被告の無罪主張退ける　間接証拠で認定,https://news.yahoo.co.jp/articles/127e8dbf6900ead149e5e14d9cda36bb32954b97,9/27(金) 14:51
san,産経新聞,自民総裁選　決選投票前に石破茂氏「勇気と真心で真実を語ろう」「私は至らぬ者」と釈明も,https://news.yahoo.co.jp/articles/62b9b7b518095fe8b82222f8395d2d5f713d1fda,9/27(金) 14:50
san,産経新聞,自民総裁選、決選投票は過去に5回　〝逆転劇〟で宰相の座つかんだ安倍晋三氏と石橋湛山氏,https://news.yahoo.co.jp/articles/3175cc020b74a67a54a46eaff5ed365d42c8d035,9/27(金) 14:28
san,産経新聞,決選投票の高市氏　積極財政主張、首相になっても靖国参拝、外国人受け入れ拡大「慎重に」,https://news.yahoo.co.jp/articles/dfaded28d4146da7d747b050fda8f498711cff7c,9/27(金) 14:22
san,産経新聞,新総裁の石破氏　政治とカネに厳しく、選択的夫婦別姓賛成、外国人材受け入れ「進める」,https://news.yahoo.co.jp/articles/2a152ef271601c3ca2064f8e92fdbbb792a50fef,9/27(金) 14:21
san,産経新聞,自民党総裁選、第1回投票結果一覧　高市氏181票、石破氏154票、小泉氏136票,https://news.yahoo.co.jp/articles/4879b6d43d6a478d96c422c5cbd45fad70a77d11,9/27(金) 14:20
