media_en,media_jp,title_articles,link_articles,date_original
san,産経新聞,阪急西京極駅で男性が特急にはねられ死亡、2万人に影響,https://news.yahoo.co.jp/articles/fccd69baea5abc867bee393218990af2fbae171f,10/3(木) 12:33
san,産経新聞,トランプ氏「ピート・ローズを野球殿堂に」　米で議論「銘板に『追放』入れればいいだけ」,https://news.yahoo.co.jp/articles/415afece710bf4c4687c1dd9eddbbadac4ac272c,10/3(木) 12:29
san,産経新聞,能登豪雨で東京ドーム200個分の農地冠水　稲刈りは手作業余儀なく　ボランティア募集,https://news.yahoo.co.jp/articles/85abb28308b27cc826ae61ccc388ce132fe6f33b,10/3(木) 12:07
san,産経新聞,今の教育は間違っている　僕には「仕事」しかない　酒もたばこもギャンブルも遊びもしない　話の肖像画　ジャーナリスト・田原総一朗＜2＞,https://news.yahoo.co.jp/articles/5958bb8458d3f93dc345f87c025aeb30d829040c,10/3(木) 12:00
san,産経新聞,英断か落日の象徴か　五輪最高スポンサー、国内勢ゼロに　中国勢が隙間埋めるか,https://news.yahoo.co.jp/articles/ce8b033724cb9fa8866762b4d3cf02afec28e5ba,10/3(木) 11:40
san,産経新聞,女性に睡眠薬飲ませわいせつ容疑、芸能プロデューサーの男再逮捕　警視庁,https://news.yahoo.co.jp/articles/942cfb75e26537215c60c607cef9c9a7988341cf,10/3(木) 11:39
san,産経新聞,甘みたっぷりなウニで「一石三鳥」　廃棄うどんを餌に養殖、藻場再生と漁獲量回復狙う,https://news.yahoo.co.jp/articles/ef95b5c65c1ec15bd0fa38639fc41a462b0b4e7e,10/3(木) 11:30
san,産経新聞,「歴史教育でしか国は救えない」作家・竹田恒泰氏が講演　仙台「正論」懇話会詳報,https://news.yahoo.co.jp/articles/306bcc78fd60ad12d159d929a6ad8b62ea9f2fd7,10/3(木) 11:28
san,産経新聞,寺院に侵入、400万円以上盗んだ容疑で39歳男逮捕　全国で同様の被害か,https://news.yahoo.co.jp/articles/d90a95afff6ac76216186005f879e293c9a9da0d,10/3(木) 11:27
san,産経新聞,阪神岡田監督が今季限り退任、球団首脳「退かれるのは間違いない」　後任候補に藤川球児氏,https://news.yahoo.co.jp/articles/c5ef5385a7dd98e79bf952f36ba1cff0de10af3e,10/3(木) 10:38
san,産経新聞,「貨幣」だけが会社の価値なのか　新たな思考の枠組み提示する「企業内哲学者」,https://news.yahoo.co.jp/articles/126166ac269f77b31d7d03896ea46224149500e2,10/3(木) 10:10
san,産経新聞,「もう一度聴きたい、司馬遼太郎短篇傑作選」10月5日スタート　check!ラジオ大阪,https://news.yahoo.co.jp/articles/3125724891bb31b9ff9c1a007f30f6ed4b2dc1cf,10/3(木) 10:08
san,産経新聞,「動かない怪鳥」国内初繁殖への挑戦　神戸の動植物園、行動調査やホルモン研究に試行錯誤,https://news.yahoo.co.jp/articles/6a0a8144fe6478cbf25a4948c562599daa2bddc4,10/3(木) 10:06
san,産経新聞,バイデン氏がイスラエルのイラン核施設への報復攻撃に「反対」　G7がイランへの制裁協議,https://news.yahoo.co.jp/articles/ff7067be69f5c6fe667cccb26e4f7d12ff54e2bd,10/3(木) 10:04
san,産経新聞,米特別検察官、トランプ氏起訴の妥当性主張「私的な犯罪努力」　陣営は「魔女狩り」と反発,https://news.yahoo.co.jp/articles/d54bbc70c48cc47c0bd7eb4821449445fc07dec4,10/3(木) 10:00
san,産経新聞,埼玉大工学部・菅原さん　東京学生映画祭W受賞　いつパパからお父さんに？の過程テーマ,https://news.yahoo.co.jp/articles/4710526aafb1d14ed8a82fdfb1abddff7fe870d8,10/3(木) 8:47
san,産経新聞,明日の「おむすび」　風見（松本怜生）と展覧会に向かう結（橋本環奈）＜10月4日放送＞,https://news.yahoo.co.jp/articles/f313c4ac743567e549c85c23512b91bac39febcf,10/3(木) 8:15
san,産経新聞,米タイム誌、次世代の100人にアンナ・サワイさん　真田広之さん「もっと大きくなる」,https://news.yahoo.co.jp/articles/74e323de729b256d1366099860a0cfad21f5671c,10/3(木) 8:08
san,産経新聞,「虎に翼」が有終の美　平均視聴率で前作「ブギウギ」上回る　　週間個人視聴率トップ10（9月23日～29日）,https://news.yahoo.co.jp/articles/86cbf0512c5162a357bf0010730bad0b22760118,10/3(木) 8:06
san,産経新聞,岸田前首相の会合欠席に中央アジアの深い落胆、恨み節　徳川慶喜の警句は今も　赤の広場で,https://news.yahoo.co.jp/articles/c2c331ac2166da103b90c6154e19d1ee27264ba8,10/3(木) 8:00
san,産経新聞,「特殊班」変えた４発の銃弾　不動産会社社長宅立てこもり事件　警視庁150年　81／150,https://news.yahoo.co.jp/articles/2d03ea12ae4c98c4779783b5215a85b0f8db8e79,10/3(木) 7:30
san,産経新聞,石破首相、G7首脳会議に初出席、緊密な連携確認　中東情勢激化を「強く非難」,https://news.yahoo.co.jp/articles/ead1bec7b295dda4fb2ea64f642bd389e161782b,10/3(木) 0:51
san,産経新聞,＜独自＞関西電力子会社、中小企業の人材マッチング事業に参入、10月にも事業開始,https://news.yahoo.co.jp/articles/aa719faa8a9f62e27f529c8095b466fe720434cd,10/3(木) 0:02
san,産経新聞,能登地震被災地支援に補正予算求める野党に反論　小泉進次郎氏「予備費で対応できる」,https://news.yahoo.co.jp/articles/b7d82b100b9423b3af084800f381159f8d05a36a,10/2(水) 23:09
san,産経新聞,石破首相、5日に能登視察へ　小泉進次郎氏が明かす,https://news.yahoo.co.jp/articles/3ed07d027970dd490a1fab54cdaefbf17d63e8f2,10/2(水) 23:01
san,産経新聞,DeNA、3年連続のCS切符　チーム満身創痍、敵地も　「自分たちの野球」に懸ける,https://news.yahoo.co.jp/articles/35e66c48c675c168e8a33abed70509e94475f0cf,10/2(水) 22:56
san,産経新聞,石破茂首相、日米地位協定の改定「今後機会を見て議論」　米大統領と会談も提起せず,https://news.yahoo.co.jp/articles/54ab4b9d016df9f90a1c197b0bce3b9c4f33c4c6,10/2(水) 22:29
san,産経新聞,電気・ガス料金の補助金延長を示唆　石破内閣の経済閣僚会見、衆院選にらみ慎重姿勢も,https://news.yahoo.co.jp/articles/e53e8af1aba9d407a7e7c74057e8dcc058b1d4c7,10/2(水) 22:27
san,産経新聞,防災庁、地方創生…石破茂首相の肝いり政策も多難　関係閣僚が就任会見,https://news.yahoo.co.jp/articles/b1e6d2c5045ca15fc0f8d7096cb8b8c95cb5efe9,10/2(水) 21:57
san,産経新聞,「安定供給実現のための計画を」　石破新政権の原発政策、関西でも動向注視,https://news.yahoo.co.jp/articles/b61d667e72b14b3fa709ed3b97251b37b23dc6f1,10/2(水) 21:53
san,産経新聞,バイデン米政権、中東の紛争拡大を制御できず　大統領選を控え後手に、停戦協議も頓挫,https://news.yahoo.co.jp/articles/caa6a362a8a0614612e571ec4078f42acb2002c9,10/2(水) 21:52
san,産経新聞,イスラエル国内に好戦ムード　日本は双方と関係維持し仲介外交を　立山良司・防大名誉教授,https://news.yahoo.co.jp/articles/7e5e74aa5ab0b6db41e1f231d04080c55d055a3f,10/2(水) 21:51
san,産経新聞,イスラエルが「来るに値しない」と入国禁止　国連のグテレス事務総長、安保理で停戦訴え,https://news.yahoo.co.jp/articles/0caf7ee79964991caf721756ff2fc969ad7ffe6f,10/2(水) 20:58
san,産経新聞,不発弾処理、昨年度は全国2348個　住民避難、鉄道運休の事例も　宮崎空港誘導路の陥没,https://news.yahoo.co.jp/articles/d63c3d16a9a898662110f25ba3c7f438c0471095,10/2(水) 20:57
san,産経新聞,石破首相が韓国の尹大統領と電話会談　拉致問題解決へ協力確認,https://news.yahoo.co.jp/articles/6c31383c1b0468435e63cc68b013437b0d440d43,10/2(水) 20:54
san,産経新聞,兵庫県知事選　自民は独自候補の擁立断念へ、意見まとまらず,https://news.yahoo.co.jp/articles/9e31971f5e81f6b371e050444687a9bbbdc586f7,10/2(水) 20:40
san,産経新聞,衆院選、小泉進次郎氏が「次の首相」へ正念場の応援行脚　石破氏「殺人的な忙しさになる」,https://news.yahoo.co.jp/articles/34c21e5e0dbd061724066b084426dc310bc51849,10/2(水) 20:37
san,産経新聞,淀橋浄水場がよみがえった！？　東京都庁に巨大な水紋アート　大巻伸嗣氏作「みずのはし」,https://news.yahoo.co.jp/articles/954c5ac186e220be4e1b318faa905931bf8e37b1,10/2(水) 20:35
san,産経新聞,高校生に無料塾　困窮家庭の受験、自治体が支援も財政力に差　続く拡充の模索　教育格差社会,https://news.yahoo.co.jp/articles/8788132ef806d30d5e2efa1c20acbc6cf70f37d6,10/2(水) 20:34
san,産経新聞,南都銀新本店ビル、開業は2月10日　大宮支店は5月に移転,https://news.yahoo.co.jp/articles/a0f3eb98c480c5d7b7b025b61efc923c66559e05,10/2(水) 20:32
san,産経新聞,鈍麻する感覚、刺激求め常習万引　当事者が語るオーバードーズ　「睡眠薬15錠ボリボリ」,https://news.yahoo.co.jp/articles/62aa8a83c9130258540e01fa3776c81826e7550b,10/2(水) 20:16
san,産経新聞,挙党態勢とは無縁の「お友達内閣」　自民内から石破首相に不満の声　衆院選前に揺らぐ結束,https://news.yahoo.co.jp/articles/64f15032d13431061888093a8b98ad35264d1585,10/2(水) 19:53
san,産経新聞,中谷防衛相「連携拡大し、抑止力強化」　アジア版NATOの是非には触れず,https://news.yahoo.co.jp/articles/958971ceaa0b44ad82fd67a16d13c322b219715e,10/2(水) 19:41
san,産経新聞,石破首相「追加利上げの環境にない」　日銀・植田総裁と会談後に発言,https://news.yahoo.co.jp/articles/613871528cfa8035caec27cc78d56dc970363c4a,10/2(水) 19:19
san,産経新聞,安心・安全な万博実現へ「威信かけて取り組む」　大阪府警に「万博警備対策室」発足,https://news.yahoo.co.jp/articles/4535d8ef9f27daff9406c5cddaab69b6a398d75f,10/2(水) 19:10
san,産経新聞,加藤財務・金融相「成長型経済、実現しないといけない」　賃上げと投資促進策を重視,https://news.yahoo.co.jp/articles/c46999d0f00665d1c230f58931717a2cacd91b57,10/2(水) 19:08
san,産経新聞,両陛下「国際青年交流会議」ご視察　気候変動などの課題議論、おねぎらいに,https://news.yahoo.co.jp/articles/fcd8e0c16eac38c84ca5114920ff69dab104d8a7,10/2(水) 19:05
san,産経新聞,無資格で切開手術した介護施設にメスを貸した疑い　提携する近隣医師ら書類送検　大阪府警,https://news.yahoo.co.jp/articles/f3cae4257ad76d756c9b1ddb742257f351cbe0db,10/2(水) 18:56
san,産経新聞,ヘルメット浸透まだまだ　自転車利用者の努力義務化1年半　滋賀で事故急増、高校生の着用率低く,https://news.yahoo.co.jp/articles/74cf7447a74b2aa061a321c9bf4a61589549dc4e,10/2(水) 18:55
san,産経新聞,アジア版NATOは「将来のビジョンの一つ」　岩屋毅外相「直ちに設立は難しい」,https://news.yahoo.co.jp/articles/9561d57913922a17c4c4739d67138f216299416c,10/2(水) 18:36
san,産経新聞,中国、国慶節連休に延べ19億人超が移動へ　海外旅行では日本が人気トップに,https://news.yahoo.co.jp/articles/dd2d51fadc802ac80a9a8de0ffa44a9078ecc5be,10/2(水) 18:34
san,産経新聞,西山朋佳女流三冠、棋士編入試験で初黒星　山川泰熙四段に敗れ1勝1敗に,https://news.yahoo.co.jp/articles/97803713cb466477a3ea0ffa892d45be1b1224a1,10/2(水) 18:33
san,産経新聞,琵琶湖の魚たち一冊に　滋賀県立琵琶湖博物館の学芸員らが図鑑刊行,https://news.yahoo.co.jp/articles/236f364cc5003804429b02d2b8b963f696e1d421,10/2(水) 18:25
san,産経新聞,悪質ホスト対策で中間報告　恋愛感情乗じた高額請求などの行為規制の方向で議論,https://news.yahoo.co.jp/articles/2e00eb56201e7b616603c8a23b5703a35b3afc61,10/2(水) 18:17
san,産経新聞,「唯我独尊だった」石破首相の〝低姿勢〟　番記者の温かな送り出しも、自民党に熱気なし,https://news.yahoo.co.jp/articles/535c62a792fbb3beebdebd0ef66b46fb633b2358,10/2(水) 18:00
san,産経新聞,最大100万件の文献分析も　東京で知財・情報フェア開幕、140社が最新システムを出展,https://news.yahoo.co.jp/articles/da4c321684be9503b3234117d826940eac5923a9,10/2(水) 17:58
san,産経新聞,マイナポータルでシステム障害発生、一時的にログインできず　デジタル庁「内部の不具合」,https://news.yahoo.co.jp/articles/b6600a876f3086d836dc6ece2098e9a89249628b,10/2(水) 17:56
san,産経新聞,拉致解決へ連絡事務所の設置は「アイデアの一つ」も「既定路線ではない」　岩屋毅外相,https://news.yahoo.co.jp/articles/afc94d885da70ce9d9bf7b3b4975d79cb664468f,10/2(水) 17:29
san,産経新聞,千葉市職員の月給、市人事委が過去最高1万円超引き上げ勧告　民間の賃上げラッシュ受け,https://news.yahoo.co.jp/articles/a84f623c56b4de695f893c82cc2874fe7314f25a,10/2(水) 17:08
san,産経新聞,横田めぐみさん5日に誕生日　新潟・新発田市長「中学生が拉致され還暦…胸張り裂けそう」,https://news.yahoo.co.jp/articles/bc1497f71dc35a1717fd7232c1920650ae0466c6,10/2(水) 17:00
san,産経新聞,ウォルズ・バンス両氏の米副大統領候補討論会、個人攻撃抑制で政策論争「驚くほどの節度」,https://news.yahoo.co.jp/articles/bf3837439a39ca7b1e4d33a62c26727f6978ea93,10/2(水) 16:35
san,産経新聞,清水氏は「有力な1人」、兵庫知事選の維新候補で検討　吉村共同代表,https://news.yahoo.co.jp/articles/58dc33f516ac053ad5c151a31347d1bbf631bcf9,10/2(水) 16:29
san,産経新聞,石破首相の原発ゼロ方針「今は訂正されていると承知」　武藤経産相、総裁選の発言巡り,https://news.yahoo.co.jp/articles/d72bc7103154f106b62bd9f2f64253b75191141c,10/2(水) 16:25
san,産経新聞,サルのエサを盗んだのは…飼育員の男性　大阪・天王寺動物園、窃盗容疑で被害届を提出,https://news.yahoo.co.jp/articles/034ed12953cd8eec34d86b345b0d7c2250f41fa2,10/2(水) 16:18
san,産経新聞,大関豊昇龍が両小結らと連続8番　「体の状態は悪くない」　大相撲秋巡業,https://news.yahoo.co.jp/articles/b9d2f741ff0613a7cb92eee1c569b1af6809fa11,10/2(水) 16:06
san,産経新聞,市川團十郎、大阪で荒ぶる　「十三代目」襲名披露締めくくり、新之助との「連獅子」も,https://news.yahoo.co.jp/articles/0fe0cc7a5fa492098a6fdc6e4126862e2ec4ca28,10/2(水) 16:05
san,産経新聞,現行保険証の廃止方針「堅持したい」　福岡資麿厚労相、マイナ保険証の意義強調,https://news.yahoo.co.jp/articles/36b6bad6cfc3cd02793b3ff15bb32a69ff08a6ff,10/2(水) 15:46
san,産経新聞,住吉会系組員の潜伏先や逃走資金を準備、容疑で男女2人を逮捕　警視庁,https://news.yahoo.co.jp/articles/8386be185348ea87fc0a55b0343308d45c4b0acf,10/2(水) 15:46
san,産経新聞,バイデン氏、石破首相と電話会談　「防衛協力強化と地域の平和と安定」で一致,https://news.yahoo.co.jp/articles/f24b378bd7477e7b6afdfc8dfec94052f3eeb639,10/2(水) 15:31
san,産経新聞,平将明デジタル相、ライドシェア全面解禁に慎重姿勢　「スケジュールに沿って対応」,https://news.yahoo.co.jp/articles/6244f24a7abb9bab44d5c164f8b1507fa69e7236,10/2(水) 15:30
san,産経新聞,マリノスケが一日ルーム長で協力を呼びかけ　献血の重要性をアピール　横浜F・マリノスがある街,https://news.yahoo.co.jp/articles/68eb42fa1ae19c1ded749cabd493d92e517fc78e,10/2(水) 15:00
san,産経新聞,維新、党批判現職の足立氏の対抗馬擁立を検討　衆院大阪9区,https://news.yahoo.co.jp/articles/d787aebdaabb601b11b78c02d6a2ea8d44a800a3,10/2(水) 14:58
san,産経新聞,新環境相の浅尾慶一郎氏「世界的に地球環境に関心ある中、大変ありがたい」,https://news.yahoo.co.jp/articles/506e1439cb2a7aa92412a6ef00afa46905178ea9,10/2(水) 14:45
san,産経新聞,かつて女子大生と愛人契約報道の小里農水相「緊張感持ち職務遂行する」　詳細の明言避ける,https://news.yahoo.co.jp/articles/da4d091797d63b46447e88b1565bca2ca815b213,10/2(水) 14:44
san,産経新聞,インド外相、石破首相の「アジア版NATO」創設支持せず　「重く受け止めなければ」との声も,https://news.yahoo.co.jp/articles/cba4fef68a21081672387dcdd0d25a71b246c18a,10/2(水) 14:34
san,産経新聞,診療報酬詐取疑いで歯科医師ら5人逮捕　留学生の保険証悪用、2000万円だまし取ったか,https://news.yahoo.co.jp/articles/37113c033ff07aefca38bd118ad3121660c4dc4a,10/2(水) 14:13
san,産経新聞,国分寺強盗事件、数百万円奪われたか　所沢事件で使用の車と一致　「闇バイト」の恐れ,https://news.yahoo.co.jp/articles/30918950bac697740f126f78343b34236a8f6778,10/2(水) 14:10
san,産経新聞,「国家の根幹政策の議論を」衆院選で青森・宮下知事が期待表明,https://news.yahoo.co.jp/articles/df67b6540726cce96e00a628230e1a0e5e1e482c,10/2(水) 14:09
san,産経新聞,阿部俊子文科相が就任後初会見　旧統一教会の解散命令請求「引き続き適正に対応」,https://news.yahoo.co.jp/articles/468e8912b9448ff86063bcfecbf81c2078d2bdc8,10/2(水) 14:09
san,産経新聞,ドラクエ3リメーク版の性別撤廃にマスク氏も「非常識だ」　堀井氏動画リポストで〝参戦〟,https://news.yahoo.co.jp/articles/72a4f33197439082259687cea4068471c8a45c1c,10/2(水) 14:06
san,産経新聞,赤沢亮正経済再生相「新しい資本主義発展させる」　就任会見で意欲、防災庁準備に予算強化,https://news.yahoo.co.jp/articles/b90702fe3a769692fba493f4f4816569175fadcc,10/2(水) 14:04
san,産経新聞,習近平氏が石破氏に祝電　「中国と歩み寄ることを希望」　日本との関係安定化継続の意向,https://news.yahoo.co.jp/articles/21172967cc4e102cdfdde60481505ab642389396,10/2(水) 13:52
san,産経新聞,村上総務相、「国賊」発言は「終わったもの」　記者に笑顔で「また遊びに来てください」,https://news.yahoo.co.jp/articles/413a3cc5b318ec12dc9e010f430dc472ab22a205,10/2(水) 13:35
san,産経新聞,参院岩手選挙区補選、参政党が党本部職員の吉田利也氏擁立　出馬表明は5人目,https://news.yahoo.co.jp/articles/ed0dfd671032c4c650290101ab19fdd23e49388a,10/2(水) 13:32
san,産経新聞,「負けたら政界を引退」　衆院選沖縄1区、元職の下地幹郎氏が出馬を正式表明,https://news.yahoo.co.jp/articles/98a28766d2661817a6e60f1bb11a061b72067eca,10/2(水) 13:31
san,産経新聞,習氏とプーチン氏、国交樹立75年で祝電交換　「中露は世界の多極化で重要な貢献」と主張,https://news.yahoo.co.jp/articles/5742b13dff77f9471761a53d3fc4b65e5569df2e,10/2(水) 13:28
san,産経新聞,千葉・我孫子市がSUUMO活用して移住情報PR　都内へのアクセスの良さなどアピール,https://news.yahoo.co.jp/articles/5500d32848ef61a26393cd123385c6ec57c51e8a,10/2(水) 13:25
san,産経新聞,テイラー・スウィフトさんの好感度急減　米大統領選でハリス氏への支持表明後,https://news.yahoo.co.jp/articles/f01b5de0680138037e4fcd272a84a7dd8682e631,10/2(水) 13:19
san,産経新聞,「若手のホープ」小倉将信氏、次期衆院選不出馬の意向　総裁選で小泉進次郎陣営幹部,https://news.yahoo.co.jp/articles/124959e44093ff4a9089d21a2364667a63c874a4,10/2(水) 13:12
san,産経新聞,受かっているのに浪人する「合格浪人」の割合が増加、河合塾で史上最高３割に,https://news.yahoo.co.jp/articles/005a44c5cc7e2501e0e23f41ec9fbddff27cea87,10/2(水) 13:09
san,産経新聞,「協力の余地十分」維新との合流で3日に会見と前原誠司氏、持論は「非自民・非共産」の結集,https://news.yahoo.co.jp/articles/395334d5e27d1985506c13bac35f5e1dd0c86ccc,10/2(水) 12:59
san,産経新聞,ネット中傷に「全員逮捕だ」　新法相の牧原秀樹氏、幼児への暴行加害者は「死刑で足りぬ」,https://news.yahoo.co.jp/articles/e5a1c10dab66c9ac88d35ae849a822c6460530ea,10/2(水) 12:57
san,産経新聞,衆院東京15区・金沢結衣氏、無所属で出馬へ　維新を離党「兵庫パワハラ疑惑の対応残念」,https://news.yahoo.co.jp/articles/d11fe8e3e09c633386e9aab3482d3b4fd78fdf7e,10/2(水) 12:43
san,産経新聞,元経産省官僚中村氏、兵庫県知事選出馬を表明　自民会派と面談,https://news.yahoo.co.jp/articles/1c60ecfcfc17697b5e78d6bff2fc2318699c926f,10/2(水) 12:42
san,産経新聞,かつては特攻隊の出撃基地　爆発音騒ぎの宮崎空港　過去にも米軍不発弾が見つかり閉鎖,https://news.yahoo.co.jp/articles/6eacb5cfb0e65c1a0aa71e592ee5ad8fb1b9f193,10/2(水) 12:31
san,産経新聞,奈良・正倉院で年に1度の「開封の儀」　宝庫の扉明け宝物点検,https://news.yahoo.co.jp/articles/bf3846e8f98ab121217846bdfac4c86c49baa717,10/2(水) 12:19
san,産経新聞,林芳正官房長官、ドジャース大谷翔平選手の2冠に「多くの国民が驚きと興奮に包まれた」,https://news.yahoo.co.jp/articles/cef328340d348f18bd93d6edcae410e8f15a47bc,10/2(水) 12:18
san,産経新聞,林官房長官、イランのイスラエル攻撃　「中東情勢を一層悪化させる」と非難,https://news.yahoo.co.jp/articles/f85bb6bdf27873edf75bcba86a35b47bbda0198a,10/2(水) 12:10
san,産経新聞,引退するつもりはサラサラない　「老害」批判は当然　ネット炎上ありがたいこと　話の肖像画　ジャーナリスト・田原総一朗＜1＞,https://news.yahoo.co.jp/articles/53c41e414866e289e6c413a120143fc972a83486,10/2(水) 12:00
san,産経新聞,伊丹の商店街でしか飲めない「おかえりビール」　産官学コラボ、オリジナル商品開発,https://news.yahoo.co.jp/articles/f6df30cb668720c185f04ca47bb63909dca155a6,10/2(水) 11:52
san,産経新聞,米副大統領候補の討論会、共和党バンス氏「国境開放で市民の生活が破壊された」,https://news.yahoo.co.jp/articles/064dbd5a59beddcaad1616594b218d209087db9f,10/2(水) 11:37
san,産経新聞,インドのジャイシャンカル外相、石破首相の「アジア版NATO」創設を支持せず,https://news.yahoo.co.jp/articles/146cba66e74077f1e8e45b8de332fa7c952a5410,10/2(水) 11:35
san,産経新聞,石破新内閣、経済閣僚の顔ぶれに抜擢感なく　景気浮揚へ課題山積、キーマンは平デジタル相,https://news.yahoo.co.jp/articles/a9fc4e9f21f585af517dd72910461441654996a3,10/2(水) 11:34
san,産経新聞,石破首相、バイデン米大統領と電話会談「日米韓の連携強化を話した」地位協定は話題に出ず,https://news.yahoo.co.jp/articles/e7f158f3c0eca7af3c0bb64bf42eb8480116823c,10/2(水) 11:33
san,産経新聞,メキシコで初の女性大統領就任　治安、財政、米国への不法移民への対処が課題,https://news.yahoo.co.jp/articles/76d80ab6d3313353259692d4a09f99877c68efbc,10/2(水) 11:32
san,産経新聞,米副大統領候補が直接対決　民主ウォルズ氏、共和バンス氏討論会　経済・移民など論戦,https://news.yahoo.co.jp/articles/6bbb647be2774f7a36215bad27c98fe497719363,10/2(水) 11:31
san,産経新聞,石破首相、イランのイスラエル大規模攻撃に「厳しく非難したい」,https://news.yahoo.co.jp/articles/e0e48ac8a110aa29ebc9926ebb6121fa3b00e58c,10/2(水) 11:27
san,産経新聞,DeNA桑原将志がCS王手の決勝打　故障の後輩の手袋を力に「祐大のじゃないとあかん」,https://news.yahoo.co.jp/articles/a32f07ae962be3609f8a948c5431d6efccdbf01c,10/2(水) 11:22
san,産経新聞,本命視された進次郎敗北　「若さが強み」一転、弱点に　書く書く鹿じか,https://news.yahoo.co.jp/articles/305efd9821c69f622b1c75482b89cdeaf3df9506,10/2(水) 11:07
san,産経新聞,なぜ逮捕に2年半　知床事故、「死人に口なし」運航会社社長の責任逃れとずさんな安全管理,https://news.yahoo.co.jp/articles/95b11082ecd3ae2d7f0ed842efbbaf242f88d65c,10/2(水) 10:57
san,産経新聞,被災の能登「御陣乗太鼓」を支援　東大寺と薬師寺で奉納演奏、募金呼びかけ,https://news.yahoo.co.jp/articles/12499ec680b723e9bce53524afb461145b4a34bf,10/2(水) 10:48
san,産経新聞,兵庫知事選に維新・清水参院議員が出馬へ　衆院くら替えやめ斎藤氏の対抗馬に,https://news.yahoo.co.jp/articles/7290aaf48eedb7d7449f8a3ebc732e6cf9108f99,10/2(水) 10:30
san,産経新聞,中央分離帯にいた男性、車にひき逃げされ死亡　堺の府道,https://news.yahoo.co.jp/articles/a76c92813525a507541868f4abd6b26292faa96c,10/2(水) 10:10
san,産経新聞,スターマー英首相とラミー外相が石破首相に祝意　貿易や安保関係の強化に期待,https://news.yahoo.co.jp/articles/580760d61fa517198f9dd4d0c4e3d05a154143ca,10/2(水) 9:58
san,産経新聞,米、石破首相就任を歓迎「パートナーシップの強化に向けて協力楽しみ」　岸田前首相に謝意も,https://news.yahoo.co.jp/articles/6cf759cbb507b0ba77c4875441c23a4bb8a31c4e,10/2(水) 9:49
san,産経新聞,米、イランの攻撃は「攻撃は失敗に終わった」　イスラエル軍と連携し迎撃,https://news.yahoo.co.jp/articles/f80f4ec25e204a883a70500cb32ca220cf2bfc95,10/2(水) 9:48
