media_en,title_articles,link_articles,date_original
yomidr,保育園で小1の教科書を音読　給食はハラルに配慮…増え続ける外国人への対応急務,https://news.yahoo.co.jp/articles/f2227ff2f8286234a93d19179e7e01c8c349eee6,11/2(木) 16:40
yomidr,日本で生まれた子ども　24人に1人は父母のどちらかが外国人…外国人の出産・育児を支えるには？,https://news.yahoo.co.jp/articles/75114382e5c90fbd0777b37095c7bfd05aeec3cc,11/2(木) 11:40
yomidr,「まさか、18歳の私ががん？」――悪性リンパ腫が見つかった女性が治療後に目指した医師への道,https://news.yahoo.co.jp/articles/21a43ceb4cce33c5e54bef70dcadff719b69e200,11/1(水) 17:11
yomidr,「就寝中、尿意で目が覚める」は大けがにつながることも　高齢者の転倒の3割が夜間の「トイレ歩行」,https://news.yahoo.co.jp/articles/cb720f76756ee31be4fe8376287f9d756c69b064,10/31(火) 18:10
yomidr,インフルエンザにかかった！　それでもワクチンを打った方がいいのはなぜ？,https://news.yahoo.co.jp/articles/86a9d83ef807b3d799b7e28b1e9a5148207aabdf,10/31(火) 16:20
yomidr,結婚するカップル　ピークだった1972年の半分以下…国の「結婚新生活支援事業」とは？,https://news.yahoo.co.jp/articles/bd13b95065385891dff3e73032c69815b59ae5ef,10/31(火) 12:30
yomidr,医師になりたてだった私が指導医から「メモを取るな」と注意されたわけ…10年以上の歳月が流れてわかったこと,https://news.yahoo.co.jp/articles/5508f00b4c354157c0fab583b1de2edd85d57416,10/31(火) 12:10
yomidr,子どもの身長が伸びない　受診のタイミングは？　「成長曲線」でチェック…成長ホルモン分泌不全性低身長症の可能性も,https://news.yahoo.co.jp/articles/c29376491352c0861d702a23caae1954e0e51a5b,10/31(火) 11:42
yomidr,腰痛や倦怠感、不眠の原因は結婚を急ぐ相手とその母親？…失恋後のお見合いで、後戻りできなくなった30代男性の決断は,https://news.yahoo.co.jp/articles/c4fb1d5cb04b11c121a13e294214543eecc9e6d9,10/30(月) 17:11
yomidr,シニア向けの「学び」の場　大学や海外に…50歳以上を対象にしたプログラムも開設,https://news.yahoo.co.jp/articles/6b19e91939d676ba58f3dc8d38186e40ef8060d5,10/30(月) 12:30
yomidr,［菅原洋一さん］18で旅立った孫の枕元で歌った「花は咲く」　自分が生きているのは「まだ修行が足りないから」,https://news.yahoo.co.jp/articles/b67653536ee7204a391cf02bcc0619f3fc429906,10/29(日) 17:40
yomidr,発達障害の薬、子どもに使う？　副作用の不安を抱えつつ、ADHDの息子に小1から服用させた結果,https://news.yahoo.co.jp/articles/56a31cd3abb2dab5705355ee8c933afd66cf5997,10/28(土) 20:10
yomidr,［矢方美紀さん］乳がん　乳房を全摘　悩んで「再建しない」と決めた理由…決め手は友人の一言,https://news.yahoo.co.jp/articles/a7384126d390fb33e55b5284c0124e5c68312ea2,10/28(土) 19:12
yomidr,においで体調不良に　対策は？…香りが持続する洗濯用洗剤・柔軟剤の登場で注目,https://news.yahoo.co.jp/articles/7dbee4d09be70187a1d4602b3aae9144106d4bbe,10/28(土) 11:41
yomidr,ギョッ！　家の中にトコジラミ…腕や足に赤いブツブツ　ステロイド軟膏と抗アレルギー薬でかゆみを抑える,https://news.yahoo.co.jp/articles/8780cada1fddf8a9c47ae777b25505a2e66915b5,10/28(土) 11:40
yomidr,自宅で暮らす高齢者　安全に薬を飲んでもらうための取り組みは？…服薬支援ロボットも登場,https://news.yahoo.co.jp/articles/ea510d7a9026fdb15e09b496d80f7904546e6b2f,10/27(金) 16:10
yomidr,部活動中に突然倒れた中学教諭　救ったのはバスケ部員たち…危険な不整脈　いざという時の対応は,https://news.yahoo.co.jp/articles/d5a22883f910876f800439f146ba8af172dfaa97,10/6(金) 10:00
yomidr,「体がふわっと浮く感じがした」50代ランナーがフルマラソンで心肺停止…生還できた奇跡,https://news.yahoo.co.jp/articles/10b390d8e872920cf2b13413b997a89dea586492,10/5(木) 10:00
