media_en,title_articles,link_articles,date_original
binsider,バーガーキング、ハロウィンの渋谷店は「臨時休業」と発表。渋谷区に連帯するポスターも,https://news.yahoo.co.jp/articles/11158e21213a4bc68a94158c6d130f5952c78dba,10/27(金) 12:42
binsider,決算最高益の味の素が実践した「大企業病」脱出術。中計の廃止、自社株の支給,https://news.yahoo.co.jp/articles/2863696d4438c42db7ed32b277b4b2eecbabeb3f,10/27(金) 11:15
binsider,人手不足のロシアで、囚人労働への依存が高まっている（海外）,https://news.yahoo.co.jp/articles/b3d776326826e767f16036237c9a69a1a913ee83,10/27(金) 11:10
binsider,アメリカの低所得者層は所得が増えているが、支出の80％は食料などの必需品（海外）,https://news.yahoo.co.jp/articles/950f43adca014fd2fe8d254eed25116f493c1cfe,10/27(金) 11:10
binsider,史上最高にアグリー？ クロックス、まさかのカウボーイブーツを期間限定発売（海外）,https://news.yahoo.co.jp/articles/413a25ef809033540b65c1735920d7af2df81d15,10/27(金) 11:10
binsider,「ハロウィン渋谷に来ないで」で懸念される「カリギュラ効果」。防災専門家が語る真のリスク対策とは,https://news.yahoo.co.jp/articles/54bc878d25b57ca34a7dacbe0f27246f25439f55,10/27(金) 8:10
binsider,世界の富裕層の租税回避を防ぎ、2％の課税を…フランスの研究機関が提言（海外）,https://news.yahoo.co.jp/articles/aed034f701698fafe0400c5186c63bc6bfad89c5,10/27(金) 8:10
binsider,実機試乗：ハローサイクリングの「免許なしシェア原付」乗ってみた。24年1月から市場投入,https://news.yahoo.co.jp/articles/387aaa833ecb91ee89f00fb5a51efb9a56ec7aa0,10/26(木) 20:00
binsider,アマゾンが軽乗用車による配送を本格展開。2024年に向けて副業ドライバーを拡充か,https://news.yahoo.co.jp/articles/046ec9d2568ca8895a11f550e1d13cd5a996b811,10/26(木) 20:00
binsider,Pixel 8、iPhoneユーザーが乗り換えはアリ？ エアドロができなくても「仕事で使いたい」と思える理由,https://news.yahoo.co.jp/articles/7f3f59e6e1f03962321682efc993fa4fd33244fe,10/26(木) 20:00
binsider,何を着たらいいのか分からない季節の救世主は、無印良品の隠れた名作アイテムだった,https://news.yahoo.co.jp/articles/f65c84abbc5d7e238793bc5d02c0e94fc4da0e31,10/26(木) 20:00
binsider,スマホのアラームで起きれない。「絶対に起きれる目覚まし」の正解は、5000円のスマートウォッチだった,https://news.yahoo.co.jp/articles/a6cf361bb215ee1295e543ca9aa823932b062e76,10/26(木) 20:00
binsider,100歳のインフルエンサーが教えてくれた、長く幸せに暮らす秘訣6つ（海外）,https://news.yahoo.co.jp/articles/b7943dac8f474ae0e05bd9bfd0443ccdab2aac61,10/26(木) 20:00
binsider,37歳でミリオネアになった私は、「節約」に関する一般的なアドバイスのいくつかは間違っていると確信した（海外）,https://news.yahoo.co.jp/articles/c26558801d758ed00f997de471b30fc7befbf737,10/26(木) 20:00
binsider,ZOZOが100億円投資した「秘密の倉庫」潜入。新拠点「ZOZOBASE」の3割省人化のリアル,https://news.yahoo.co.jp/articles/87f6110bdc2b9a1133f2674d4c709c005e048d25,10/26(木) 11:15
binsider,アルファベット決算発表…クラウド事業が予想を下回り、時価総額1650億ドルが消滅（海外）,https://news.yahoo.co.jp/articles/14ed6985859fbe65f2f4ba8e66b013cdebe070f7,10/26(木) 11:10
binsider,イーロン・マスクのXは「言論の自由」を「課金制ゲーム」に変えるのか（海外）,https://news.yahoo.co.jp/articles/9b5070d89f3951ec9a8d7af1d6e81e8d01cc3446,10/26(木) 11:10
binsider,70年代に行われたベーシックインカム実験の教訓…住民の健康と教育の状況は改善したが（海外）,https://news.yahoo.co.jp/articles/e7f8e2d9461f765ebf87f12eb55619cc5dc3ceca,10/26(木) 11:10
binsider,中国「不動産不況」が長期化するワケ、日本経済に悪影響もたらすシナリオ,https://news.yahoo.co.jp/articles/509d21c4761d22891b45f5ce1acf91f6cd9e84ce,10/26(木) 8:10
binsider,アメリカ政府、水素燃料開発に1兆円を投資…「クリーン」な水素とは？（海外）,https://news.yahoo.co.jp/articles/652b30191407a52291aaf9dff8bca87e33ef5fd1,10/26(木) 8:10
binsider,誰でも成功できる、最高の「投資スタイル」が判明する。大手証券会社の最新調査結果より（海外）,https://news.yahoo.co.jp/articles/4971c0c16cc5cb10df4ff016b0954fb6e4901bd4,10/25(水) 20:00
binsider,「牛乳石鹸の固形シャンプー」がここまで優秀だったとは。小さなストレスが消えて、環境にも優しくなれた,https://news.yahoo.co.jp/articles/17e462bcd4541e2c45239b5385477fcbae72aa92,10/25(水) 20:00
binsider,UGGの定番ブーツも「環境負荷のない」素材に。シープスキンもサステナブルな選択を,https://news.yahoo.co.jp/articles/b0fa973a7d57a54c510b12cc865f02f6a07837e6,10/25(水) 20:00
binsider,いまさら聞けない、日本に「カーボンクレジット市場」が必要なワケ。世界15位から32位に転落した“炭素生産性”も背景に,https://news.yahoo.co.jp/articles/8cc8946a4e7449bf0d5c4b7c314ada635b439491,10/25(水) 20:00
binsider,「サフラー王のピラミッド」で隠された部屋を発見…LiDARで3Dマップを作成（海外）,https://news.yahoo.co.jp/articles/c8b4868bcdc449107bd80d2b4d6f42ac4a1c6a1d,10/25(水) 20:00
binsider,投資の神様ウォーレン・バフェットが40年前に語ったこと…それは今も変わらない（海外）,https://news.yahoo.co.jp/articles/faf61d103f3b89fd2dda2e14e0458b2661a37f81,10/25(水) 11:10
binsider,長蛇の列で営業時間の延長も… イスラエルで銃の購入が「これまでにないほど」急増している（海外）,https://news.yahoo.co.jp/articles/891d71ea5d97e21dd46135c22aeba97ab850f458,10/25(水) 11:10
binsider,低所得者層は都市部から押し出され… アメリカの郊外で貧困が急速に増えている（海外）,https://news.yahoo.co.jp/articles/1dff30645daed066852b01a5d36543ba1d7db280,10/25(水) 11:10
binsider,政府が「宇宙スタートアップ」16社に最大388億円。月面着陸船、デブリ対策など採択企業一覧,https://news.yahoo.co.jp/articles/655631c5e38100b92f2f7d10ea2057fd49c74091,10/25(水) 8:10
binsider,中国はビジネスを行うには困難な場所になった…フォックスコンの中国子会社を調査（海外）,https://news.yahoo.co.jp/articles/9a81428e185e65b46065c18e6f32cfd92726a9fc,10/25(水) 8:10
binsider,米国債の利回りは高水準を維持…歴史が物語る、次に債券市場に起こること（海外）,https://news.yahoo.co.jp/articles/2c452dbe38f7681136859f5cc60f7d82ea20933b,10/25(水) 8:10
binsider,吉野家の牛丼にならなかった玉ねぎ「数百万円のごみ」を「数千万円の価値」に変える方法,https://news.yahoo.co.jp/articles/d77adcfe1f202905e8772732728e9accfb38531f,10/24(火) 20:00
binsider,兼業の芥川賞作家・高瀬隼子の仕事術。「レッドブル飲んで出勤」も,https://news.yahoo.co.jp/articles/128fd14e74611c4d7865eace8a2f576e9a0b8755,10/24(火) 20:00
binsider,山の湧水で淹れた絶品コーヒーを飲む、伐採を体験する…。八ヶ岳でサステナブルアクティビティを堪能してきた,https://news.yahoo.co.jp/articles/d105732d9d840576b1b0c95b3c56d49cdd1c626d,10/24(火) 20:00
binsider,パナソニックコネクト樋口CEOが、本気でDEIに取り組む理由 ──女性管理職の次は「介護」,https://news.yahoo.co.jp/articles/7048d6689bafee5fdaa66938bc894fcd57bd3b28,10/24(火) 20:00
binsider,「紙ストロー飲みづらすぎる問題」を解決してくれたのは、ファミマで見つけたコレだった,https://news.yahoo.co.jp/articles/09b04304e8d7c2927d156f14f4c59ba615f83787,10/24(火) 20:00
binsider,新NISAで売買手数料を「無料化」する、5つの証券会社を比較してみた,https://news.yahoo.co.jp/articles/761af9d5c32ec3a9951545c9e709ebcc0d460411,10/24(火) 20:00
binsider,疲れていても、このお皿に載せれば「なんとなくいい感じ」に。陶器からできた陶器という不思議なお皿,https://news.yahoo.co.jp/articles/a7eed9fc31ee5ad15301e5c5b8c519139560771b,10/24(火) 20:00
binsider,【写真で見る】最新空母ジェラルド・R・フォードは東地中海で何をしているのか（海外）,https://news.yahoo.co.jp/articles/74b036bceec730a8961eb2315a8889d1b2035d41,10/24(火) 20:00
binsider,ベースフードが約76万袋を自主回収。カビ多発問題「製造不良が確認」,https://news.yahoo.co.jp/articles/f6fae363f83379e09ffd52e4f5a983a1c73bfa7a,10/24(火) 17:39
binsider,アマゾンの新型倉庫ロボットはかわいいが、従業員には「仕事を奪われる」恐怖を与えるかもしれない（海外）,https://news.yahoo.co.jp/articles/f78cbc268774366a705dd0b0c12d4e011a5e4355,10/24(火) 11:10
binsider,シェイクシャック創業者が後押し！ アメリカでいま急拡大中のクッキーチェーン「チップシティ」に行ってみた（海外）,https://news.yahoo.co.jp/articles/7aa20d9caef85d4c9a55691d9e06d3e870dca47e,10/24(火) 11:10
binsider,株式市場のボラティリティは、S&P500指数が底にあることを示唆（海外）,https://news.yahoo.co.jp/articles/cde74c227e0c2aefe9476d02839b2d3b70211362,10/24(火) 11:10
binsider,習近平の「一帯一路」は本当に“破たん”したのか？ イタリアの離脱後も続く中国の拡大戦略,https://news.yahoo.co.jp/articles/9903ae465d3d9baee4a8c9433ad2e2611e7e966c,10/24(火) 8:10
binsider,イーロン・マスク、テスラ決算報告での14の発言…「我々はサイバートラックで墓穴を掘った」（海外）,https://news.yahoo.co.jp/articles/4a034c240812ba42c6d84f937a30dd1af5b45f1f,10/24(火) 8:10
binsider,『働く人たち』に挑む芥川賞作家・高瀬隼子「とにかく消えずに書き続けたい」,https://news.yahoo.co.jp/articles/cec4dfa84e033e96b68778df15a16d4581fed6ef,10/23(月) 20:00
binsider,洗車がたった15分でできる「水なし洗浄スプレー」の実力は？ 効果はバツグン、ただしリスクもある…,https://news.yahoo.co.jp/articles/054e7e9a7d8685302c8a69ae1e9848c0116026c7,10/23(月) 20:00
binsider,アメリカで最も住宅市場の競争が激しい都市 トップ10（海外）,https://news.yahoo.co.jp/articles/11d0edf12712277dfb1a18141c1ff7b8bb2caee5,10/23(月) 20:00
binsider,「配当株」はどのように選ぶべきか？ 低リスクで資産が増やせる投資方法（海外）,https://news.yahoo.co.jp/articles/aaf78091ef033b943b8575c02c75815286c8893f,10/23(月) 20:00
binsider,AIが仕事を奪うと心配している人へ…Excelの歴史があなたに勇気を与えるだろう（海外）,https://news.yahoo.co.jp/articles/6746c0efce5edf9369e91a127471aaf98184e274,10/23(月) 20:00
binsider,ベースフード、一部商品に「カビ多発」。購入者には個別連絡、交換・返金対応も,https://news.yahoo.co.jp/articles/e1d4c17075d24260241258442f25449d30ddfa0c,10/23(月) 16:05
binsider,3年で契約3倍、MRR160%、ソニーやNTTデータと連携のスペクティが15億円調達。物流・海外展開を加速,https://news.yahoo.co.jp/articles/1c49803b13e2dc0bda441e310fdda1418bec264e,10/23(月) 13:15
binsider,ドロップボックスは「バーチャル・ファースト」を維持…「監視よりも信頼だ」ハウストンCEO（海外）,https://news.yahoo.co.jp/articles/8c0f49a2938c64e3e7c450f44feb474486ed7e0a,10/23(月) 11:10
binsider,上司の82％は「偶然の管理職」…「昇進は能力や実績より人間関係に基づいて行われる」（海外）,https://news.yahoo.co.jp/articles/f44f2f8566725a63c5e536d2f9f2bfd968d773b0,10/23(月) 11:10
binsider,グーグル社員、Bardの有用性と投入された資金の多さを疑問視（海外）,https://news.yahoo.co.jp/articles/13701db34918aee2031ccd004e8a26dae9f28095,10/23(月) 8:10
binsider,レオナルド・ディカプリオがこれまでに出演した映画、全作品ランキング（海外）,https://news.yahoo.co.jp/articles/178b46054af2800e34f87e426a96bc662e2ab924,10/22(日) 20:00
binsider,ガンダム？トランスフォーマー？…日本製の搭乗操作型ロボット、5台限定4億円で先行販売開始（海外）,https://news.yahoo.co.jp/articles/94edc4121f27363a0a810dbcea792878818bd9d6,10/22(日) 11:10
binsider,アメリカで最もストレスフルな州 ワースト10（海外）,https://news.yahoo.co.jp/articles/1ca64eaacdfa19220872794edbe6def79549a745,10/22(日) 8:10
binsider,穴の開いた服がかわいく変身。パタゴニアの“お直し”ワークショップに参加してみた,https://news.yahoo.co.jp/articles/1aa8b8ccbb2fa6469d40724ca9bd5c6b74b95418,10/21(土) 20:00
binsider,悪質な「マネー系インフルエンサー」を嗅ぎ分ける 2つの警告サイン。正しい「お金のヒント」の見分け方とは（海外）,https://news.yahoo.co.jp/articles/121f330e757d49d8b1db17cb90c1f8df99dc0cd9,10/21(土) 20:00
binsider,イギリスのレジェンドお菓子研究家のお気に入り「レモン・ドリズル・トレイ・ベイク」を作ってみた（海外）,https://news.yahoo.co.jp/articles/5a7e9b8f30cd3810c8a4b6c2a6e1009c9385ee08,10/21(土) 20:00
binsider,サバンナの野生生物が最も恐れるのは、ライオンではなく人間だった（海外）,https://news.yahoo.co.jp/articles/f5e7f8f02d38a4018d720bd1feb6626738379f22,10/21(土) 11:10
binsider,筋肉増強の実現にはトレーニングだけではだめ…エリートボディビルダーがヒントを伝授（海外）,https://news.yahoo.co.jp/articles/7d97f886d866c4bf98fbe6c03412218683c9238c,10/21(土) 8:10
binsider,森美術館の床がホタテの貝殻で埋め尽くされる…。20周年記念展「私たちのエコロジー」が開催中,https://news.yahoo.co.jp/articles/8eb2a4929f33ff08a737af181e07c7bbe719edb9,10/20(金) 20:00
binsider,手放す服に新たな選択肢。ビームスが「モノを売らないお店」期間限定でオープン,https://news.yahoo.co.jp/articles/8d93696860bcaf236e6a6d7db226204259267acb,10/20(金) 20:00
binsider,PCメーカー大手HP、最新機種をSXSW Sydney 2023で猛アピール。約80万円の「高価格」機種など一挙展示,https://news.yahoo.co.jp/articles/846358ee3c99fb475e7e94767eb39fdd30c44000,10/20(金) 20:00
binsider,出かける前の「鍵どこいったっけ問題」を解決してくれたのは、美しいキーホルダーだった,https://news.yahoo.co.jp/articles/e7f397e8e7364803b6193adcb65ab1deae920423,10/20(金) 20:00
binsider,ファン垂涎。「劇団四季」の衣装がアーバンリサーチの手でファッションアイテムに生まれ変わる,https://news.yahoo.co.jp/articles/fdd8e2486be900e2543e80edca3801f1b7439dd0,10/20(金) 20:00
binsider,人間の脳細胞をマッピングした「人体脳アトラス」…神経疾患の治療法開発につながるかもしれない（海外）,https://news.yahoo.co.jp/articles/e71af2081ad8ea6d50958c4f13afa69708145a71,10/20(金) 20:00
binsider,私は教師だが、55歳までに約3億円を貯めてFIREをする。だが、それまでの人生も諦めるつもりはない（海外）,https://news.yahoo.co.jp/articles/cf2201568c678a632d413022561a449aae2f1b42,10/20(金) 20:00
binsider,「人と働くロボットは実現可能か」Amazon倉庫で生まれた最新ロボット技術を見た,https://news.yahoo.co.jp/articles/097d02384eb9893fa2f67ea82a58067375d6360b,10/20(金) 11:15
binsider,回収ボックスに入れた服はどうなる？「その先」を担う環境ベンチャーが伊藤忠などから9.4億を調達,https://news.yahoo.co.jp/articles/e87ba1fa52949e4c745d0b32d5bdd289ba3a358b,10/20(金) 11:15
binsider,Z世代が「静かな退職」を実行するのは、経済的苦難を耐え忍ぶミレニアル世代を見てきたから（海外）,https://news.yahoo.co.jp/articles/89964ce232982f54c12175b2eaa56b0c7a9bdc28,10/20(金) 11:10
binsider,LinkedIn、GitHub、そしてActivision…マイクロソフトCEO、買収の基準を明かす（海外）,https://news.yahoo.co.jp/articles/1701e8ba1e37829640183db17f3393338476ff9f,10/20(金) 11:10
binsider,コストコ、ジェリネックCEOが年内で退任… 後任はコストコ歴40年以上のロン・バクリス氏（海外）,https://news.yahoo.co.jp/articles/ee374140bee094aa63aaafee8bd4c09a1ea2d7a7,10/20(金) 11:10
binsider,現在の株式市場の「高揚感」は、歴史的な2つのバブル崩壊と似ている（海外）,https://news.yahoo.co.jp/articles/dba19e76f094f4d41635e7bca7133ddf7c6e28ee,10/20(金) 11:10
binsider,売上3兆円間近、アドビが非クリエイターの能力を激変させる理由,https://news.yahoo.co.jp/articles/f0948da5bd47deb97b2c347f14ce64aaa24780d3,10/20(金) 8:10
binsider,パレスチナ危機の中、岸田首相が中東首脳にかけた無益な電話。「見放されるニッポン」に逆転策は…,https://news.yahoo.co.jp/articles/475f22ec871c9385047504eb110854e6820bfe0f,10/20(金) 8:10
binsider,10代がスターバックスを愛する理由…スタバには彼らが好きなものが4つある（海外）,https://news.yahoo.co.jp/articles/aef4ff1efdbfeb320c767136863d6021ae1e0c8b,10/20(金) 8:10
binsider,毎日ふかふかの布団で眠りたい……けれど、布団を干す時間がない。私にとっての正解はコレでした,https://news.yahoo.co.jp/articles/f82c2f091fbe076c0259a533a9af385a1a8e2570,10/19(木) 20:00
binsider,ある小惑星には未知の元素が存在するかもしれない…地球上ではありえないほど高密度（海外）,https://news.yahoo.co.jp/articles/780498cacfe9fae10ab2c78e716e5ca71076d184,10/19(木) 20:00
binsider,【新NISA、私ならこう使う】iDeCoファーストを前提に、新NISAは「つみたて一択」で老後出費に備える,https://news.yahoo.co.jp/articles/b78b7e7ba73ce41961e0e0727f8f54d9def00e60,10/19(木) 20:00
binsider,使い捨てのラップを「繰り返し使えるコレ」にしたら、洗い物の手間まで減らすことができた,https://news.yahoo.co.jp/articles/92efa29e79f0386a64a956c1267bf7f522cc5bcf,10/19(木) 20:00
binsider,アマゾンの荷物が届く世界の最新技術。アメリカではリビアン製EDVが1万台を突破,https://news.yahoo.co.jp/articles/2abc0935fb0b7d3b7cd04e4e1894c953d5140d44,10/19(木) 15:00
binsider,LVMHなど高級ブランドの株価が大きく下落…「世界的な高級品バブルの終焉を告げるもの」（海外）,https://news.yahoo.co.jp/articles/68c9ff72c46bb1614463842772d22c7e49adfd3f,10/19(木) 11:10
binsider,アメリカで最も安全な都市 トップ20（海外）,https://news.yahoo.co.jp/articles/c3a0e364c39fb946ebc503d14bbfe5bbe239f225,10/19(木) 11:10
binsider,世界初の本格的な「AI規制法」がEUで年内成立へ…他国の動向は？（海外）,https://news.yahoo.co.jp/articles/98762a4f1a224b724bb85dd0cfa810a1a147f97d,10/19(木) 11:10
binsider,ガウディ観光、入場だけで1万4000円。値上げが普通の欧州で感じた「取り残される日本」,https://news.yahoo.co.jp/articles/8099630bdfa40dd7201e95e5c3ab1bc4536b6f3f,10/19(木) 8:10
binsider,マクドナルド、中東での紛争に巻き込まれる…イスラエルとオマーンの運営会社が双方への支援を表明（海外）,https://news.yahoo.co.jp/articles/d48900c4084232a0bb659d11cdca5ab78c85803a,10/19(木) 8:10
binsider,「絶対に最後まで使い切れる歯磨き粉」には、環境にもお財布にも優しい秘密があった,https://news.yahoo.co.jp/articles/07aff6702aaa4b5aa83ad20697e919df0989f812,10/18(水) 20:00
binsider,子どもの将来に「お金の不安」を植え付けかねない、お金にまつわる「親の口癖」とは,https://news.yahoo.co.jp/articles/cade1b72ebb68c7f61fd7b1483a14a936a223435,10/18(水) 20:00
binsider,無印良品の「資源を無駄にしない」新作日用品。100円以下のミニタオルやルームシューズも,https://news.yahoo.co.jp/articles/e7dfe2c8824bf32fbfda9554508eedc89945338a,10/18(水) 20:00
binsider,長い間、行方不明だった映画『スター・ウォーズ』の小道具「Xウイング」、約5億円で落札される（海外）,https://news.yahoo.co.jp/articles/ec90d0cfbd6e07d600abebeecbf2ef7bdc331654,10/18(水) 20:00
binsider,画像の悪意ある改ざん、どう見極める？ 画像や動画に「来歴」アドビが新ツール,https://news.yahoo.co.jp/articles/49423f8e20004a05421cef12f34148d9ae3770ea,10/18(水) 11:15
binsider,高校生から5年使ったiPhone XRを「iPhone 15」に初めて“機種変”した話,https://news.yahoo.co.jp/articles/83508fa92fa70ab1a930ae01f26433025b642f28,10/18(水) 11:15
binsider,世界中の工学専攻の学生にとって、最も魅力的な就職先トップ20 [2023年版]（海外）,https://news.yahoo.co.jp/articles/36a71a530ec167137d8cffe3e09df51e5843602c,10/18(水) 11:10
binsider,富裕層の卒業生が米名門大学への寄付を停止…イスラエルとハマスの紛争への対応をめぐって（海外）,https://news.yahoo.co.jp/articles/50f49de319f743c479c698ba646be548f238c0f5,10/18(水) 11:10
binsider,ブリッジウォーター創業者が警鐘… イスラエルとハマスの衝突受け、第三次世界大戦の可能性が上昇している（海外）,https://news.yahoo.co.jp/articles/dd9ec8c97ddbc376733f7e2a50630886f91d2c1a,10/18(水) 11:10
binsider,Amazonがリヤカー付き電動自転車での配送を正式発表。物流の人手不足に対策、国内24地域で展開,https://news.yahoo.co.jp/articles/a01517f833cf5ef86316a8583d448465bfec360e,10/18(水) 8:35
binsider,IKEA「50円ソフトの牛乳、やめます」宣言。独自のプラントベースに全面切り替え、お味は？,https://news.yahoo.co.jp/articles/3fadc9ac3f6ee22a3680358c9883e9fab1592772,10/18(水) 8:10
binsider,売り上げ億超え、黒字経営「ゲルの歴史変えた」東大発ベンチャーのすごい技術,https://news.yahoo.co.jp/articles/4af15173bdcefe0909128d11cd7c9600bed804f3,10/18(水) 8:10
binsider,政府の「女性役員目標」に世界の投資家らが痛烈な苦言。「未達なら上場廃止」など罰則の有無明確に,https://news.yahoo.co.jp/articles/702e25414b73f35cebcd8858d8eb469f243477e9,10/18(水) 8:10
binsider,ハマスの攻撃が迫っていることをCIAは察知…その情報はバイデン大統領には届かなかった（海外）,https://news.yahoo.co.jp/articles/0ced6c5a7504f9d289c8bb2c9515dbdbb6c8668d,10/18(水) 8:10
binsider,アプリ不要で電球を変えるだけ。玄関照明を自動化したら、時間も電気も節約できた,https://news.yahoo.co.jp/articles/576cd686d17f9efc4a68f291497fabdb82d5ca75,10/17(火) 20:00
binsider,「睡眠の質を上げるパジャマ」は実際どうなのか？ 一般医療機器認定の「BAKUNE」を1週間試してみた,https://news.yahoo.co.jp/articles/7232abbf24a20528636872aedfc1f8615021e941,10/17(火) 20:00
binsider,NASA、とてつもなく高価な小惑星へ向けて探査機を打ち上げ…目的は経済的価値ではない（海外）,https://news.yahoo.co.jp/articles/450379621f3c328f029c76496711fdcf5393fae7,10/17(火) 20:00
binsider,デビットカード詐欺を避けるには、どうすれば良いのか？（海外）,https://news.yahoo.co.jp/articles/a984e8575734e55cc4f0c371d5b9bfe98c4657ab,10/17(火) 20:00
binsider,法務省とリーガルフォースの攻防。知られざる“ロビイング”の正体,https://news.yahoo.co.jp/articles/814b1050549400c767a01b71dcf8906eafedf276,10/17(火) 11:15
binsider,Z世代に燃え尽きと同じくらい有害な「退屈症候群」が広がっている（海外）,https://news.yahoo.co.jp/articles/b64110ac06faf2292e9057f347dc440b6af54657,10/17(火) 11:10
binsider,アップルはZ世代をがっちりと掴んでいる。90％がiPhoneを所有…最新の調査で（海外）,https://news.yahoo.co.jp/articles/e08661e7fbd361f3b9c9fedf33dc19e09a4b3134,10/17(火) 11:10
binsider,イスラエルの駐英大使「ガザに人道危機は存在しない」（海外）,https://news.yahoo.co.jp/articles/ddaa15998a95222a79f602e2828e97f4e7928faa,10/17(火) 11:10
binsider,ビルケンシュトック株はIPO後に急落したが、創業家兄弟にはまだ数十億ドルの資産がある（海外）,https://news.yahoo.co.jp/articles/054e6e7cf5e08a2a896c84ead8f9dcf0643214d9,10/17(火) 8:10
binsider,13時間経過したチョコレートのシミは「衣類の修正ペン」で落ちるのか？ 意外な結果に驚いた,https://news.yahoo.co.jp/articles/876db6d58689bfbf75d35bc5252f531c1511c357,10/16(月) 20:00
binsider,野生生物写真コンテストの入賞作品を紹介しよう...2023年の大賞は「黄金のカブトガニ」（海外）,https://news.yahoo.co.jp/articles/55f35032896223fb48038d624d80f5a837d2f04e,10/16(月) 20:00
binsider,約3億円の資産を築き、28歳でFIREを果たした女性からの最高のアドバイス（海外）,https://news.yahoo.co.jp/articles/c2388cf1cbbc3d6d5a25d4322228b98e47c5fc5e,10/16(月) 20:00
binsider,完全栄養食のベースフードが売上8割増で四半期黒字化。それでも「黒字は続けない」と断言する理由,https://news.yahoo.co.jp/articles/83e5c20174ce27511f60852436975ccdcd853b44,10/16(月) 11:15
