media_en,title_articles,link_articles,date_original
binsider,全銀ネット障害の「周知」は本当に十分だったのか。通信業界との「3つの違い」,https://news.yahoo.co.jp/articles/1742599f351b1dc2c86fc6cca3e8f6a894a946be,10/16(月) 11:15
binsider,サントリーが山崎蒸溜所を刷新。世界で品薄のジャパニーズウイスキー、鳥井社長「需給釣り合うのまだ先」,https://news.yahoo.co.jp/articles/86fb90b5a3bb2265d796d6c306475167fe912bf6,10/16(月) 11:15
binsider,世界中の経営学専攻の学生にとって、最も魅力的な就職先トップ20 [2023年版]（海外）,https://news.yahoo.co.jp/articles/bc06c14f2c5f25b30f789b049af6024a18b92372,10/16(月) 11:10
binsider,「カタツムリ女子」の時代にようこそ…ハッスルカルチャーや有害な職場への反発（海外）,https://news.yahoo.co.jp/articles/774f064bf8d7802ffcf24a962538ab017530676c,10/16(月) 11:10
binsider,リッチな10代はチックフィレイ、スターバックス、チポトレが大好き…最新の調査で（海外）,https://news.yahoo.co.jp/articles/8bf1143eae67cc8fc807ccc201f136180bfe869d,10/16(月) 11:10
binsider,無印良品、増収増益も“国内店”が不調。銀座は食、新宿は服…テーマ特化で挽回狙う,https://news.yahoo.co.jp/articles/86eaae9558f816f20523d3fa8ce99780a6e79e6b,10/16(月) 8:10
binsider,なぜ日立は海外他社と「株価競う役員報酬」に踏み切ったのか。欧米に比べ安すぎる日本のCEO報酬にメス,https://news.yahoo.co.jp/articles/05cfb7852e1953c4e273f64195b9c61199ac072c,10/16(月) 8:10
binsider,円安定着させる外貨流出、背後に「投資性の高い保険商品」の存在。問題はデジタル赤字だけでは…,https://news.yahoo.co.jp/articles/620ec819af5a99271d5d8366a86a88c12d8500bd,10/16(月) 8:10
binsider,15年間リモートで働いていた52歳がオフィスに出社する仕事を探している理由（海外）,https://news.yahoo.co.jp/articles/8968baeddc23e3140e0bab7e4e8f8534c411c8ab,10/16(月) 8:10
binsider,ジーンズがものすごく汚れた時は、履いたままシャワーを浴びて洗え ── リーバイスCEOがアドバイス（海外）,https://news.yahoo.co.jp/articles/5e0a64aae7efac9511169c43b0bd958bf4e8234c,10/15(日) 20:00
binsider,世界中のIT専攻の学生にとって、最も魅力的な就職先トップ20 [2023年版]（海外）,https://news.yahoo.co.jp/articles/f0e2cb53fee8ad8603f8b26e75c74c1943cf53ed,10/15(日) 11:10
binsider,良い睡眠や筋肉回復のために… 栄養士が教える、シンプルな「タルトチェリー・モクテル」の作り方（海外）,https://news.yahoo.co.jp/articles/9bab3c5289f8a4bce1c54dba94007ddb6cfada9b,10/15(日) 8:10
binsider,30代で「資産管理」を懸命に見直した私が、FPに指摘された4つの大きな間違い（海外）,https://news.yahoo.co.jp/articles/339872b8128daa154ae37adebfe2e0d3badb5bb4,10/14(土) 20:00
binsider,15分で作れて美味しい！ 料理研究家アイナ・ガーテン氏の「サーモンの照り焼きとブロッコリー」を作ってみた（海外）,https://news.yahoo.co.jp/articles/f5adf3648c204e8b3424031d2e5ecc0e4b7fc50f,10/14(土) 20:00
binsider,1人旅は初めてという人に… 40カ国を旅してきた1人旅のプロが送る、3つのアドバイス（海外）,https://news.yahoo.co.jp/articles/13b589898dab653e51bb3f532d8ec9ce67e6c6e9,10/14(土) 11:10
binsider,地球の内核は固体の金属というよりもバターに近い…謎が多い磁場の説明に役立つ可能性（海外）,https://news.yahoo.co.jp/articles/5d4dfb09300cfc7c1d836fc12d65455bff9f0349,10/14(土) 8:10
binsider,家の香りの正解は、ディフューザーではなくこれだった。廃棄のドライフラワーが、こんなにちょうどよく香るとは,https://news.yahoo.co.jp/articles/66a6ac4c93a1f9f81db6ef65632a5cf233a84ab3,10/13(金) 20:00
binsider,“サボテンレザー”の排出するCO2は？ エコレザーでも気にしたい「カーボンフットプリント」,https://news.yahoo.co.jp/articles/1afd17fbb705871d48a5b7a91f8b74a009265663,10/13(金) 20:00
binsider,NASAのハッブル望遠鏡、これまでの定説を覆す「青い閃光」を観測（海外）,https://news.yahoo.co.jp/articles/3282ec7145b401ca4ef022bb3902d34ccabb6adc,10/13(金) 20:00
binsider,最小限の犠牲で、スローにFIREを実現できる5つのコンセプト。過激すぎるムーブメントに賢い選択肢を（海外）,https://news.yahoo.co.jp/articles/764adbc217c25370b9b0aec7bfcec2677befa41e,10/13(金) 20:00
