media_en,media_jp,title_articles,date_original
davincin,ダ・ヴィンチWeb,夫婦ふたり月13万円！ がんばりを見えるかたちに、気分を上げる節約アイテム… ユニークな節約術を学べるコミックエッセイ【書評】,10/17(木) 21:10
davincin,ダ・ヴィンチWeb,もしドッペルゲンガーに会ったら…SNSで話題！ 実体験をもとにしたホラー漫画【作者インタビュー】,10/17(木) 20:00
davincin,ダ・ヴィンチWeb,電子マネーでお小遣いを渡して大丈夫？ 毎月コツコツ貯金してれば本当に安心？ 漫画でお金の知識をアップデート！【書評】,10/17(木) 19:10
davincin,ダ・ヴィンチWeb,私は「糖尿病」になってしまったんだ。第2子妊娠中に「妊娠糖尿病」になってしまった作者の、リアルな経験談を描いたコミックエッセイ【書評】,10/17(木) 17:40
davincin,ダ・ヴィンチWeb,ハリソン山中はお金が好きだが、同時に嫌いでもある。『地面師たち』原作者が語るキャラクター造形とハリソンの次なるターゲット【新庄耕インタビュー】,10/17(木) 13:00
davincin,ダ・ヴィンチWeb,挨拶は無視。わざとらしい名字呼び。いつも一緒だったママ友からの嫌がらせに心が限界に達して…【書評】,10/16(水) 19:40
davincin,ダ・ヴィンチWeb,事故や怪我が原因で、令和の公園からブランコやジャングルジムが消えた!? 代わりに増えた「健康器具」に少子高齢化を感じてしまい…【書評】,10/16(水) 17:40
davincin,ダ・ヴィンチWeb,介護施設の利用者を自宅に送り届けると「早すぎる」と家族からキレられてしまい…。シニア介護ドライバーがみたリアルな介護の世界【書評】,10/16(水) 12:10
davincin,ダ・ヴィンチWeb,心霊現象だと思っていたけど人為的なものだった!? 建築デザイナーが教える「住んではいけない場所」とは？【書評】,10/15(火) 20:10
davincin,ダ・ヴィンチWeb,古舘伊知郎が語る「目的のないインプット」の有用性。思考の画一化から抜け出し「自分らしさ」を掴むための“無駄”のススメとは【書評】,10/15(火) 19:00
davincin,ダ・ヴィンチWeb,古舘伊知郎「下品を承知で喋り続ける」実践する生涯現役であるための準備学【インタビュー】,10/15(火) 17:00
davincin,ダ・ヴィンチWeb,「事故物件住みます芸人」の松原タニシさん。家賃を抑えるため、リフォームなしで事故現場を残した状態の部屋に住んでみた！【書評】,10/15(火) 12:10
davincin,ダ・ヴィンチWeb,スティーヴン・キングが「あまりにも恐ろしい」と発表延期したホラー小説『ペット・セマタリー』。ペットの墓場から悲劇が連鎖する…【書評】,10/14(月) 14:00
davincin,ダ・ヴィンチWeb,17kgのダイエットに成功した著者が一番大切にしたこととは？ ダイエットの秘訣が詰まったコミックエッセイ【書評】,10/13(日) 22:10
davincin,ダ・ヴィンチWeb,朝スッキリ起きられない、腰や肩が慢性的に痛い… 毎日続く「うっすら疲労」を解消するコミックエッセイ『体力アップ1年生』【書評】,10/13(日) 19:40
davincin,ダ・ヴィンチWeb,月7万円の食費を1.5万円に減らせたリアルな成功例！ 『ふたりで月1.5万円ごはん』から学ぶ節約と健康の両立術【書評】,10/12(土) 21:10
davincin,ダ・ヴィンチWeb,「今の関係でもいいならまた会わない？」という彼。絶対に振り向かせて本命になる！ セフレから始まる愛の軌跡を描いたコミックエッセイ【書評】,10/12(土) 20:40
davincin,ダ・ヴィンチWeb,無類のギャンブル好き。とにかく“人間くさい”。作家・黒川博行さんの素顔とは？ 直木賞受賞記念の東野圭吾さんとの対談も収録【書評】,10/12(土) 17:40
davincin,ダ・ヴィンチWeb,いつ観ても怖い名作ホラー映画『ペット・セメタリ―』。スティーヴン・キング原作、幼い子どもを襲う理不尽な結末とは？【レビュー】,10/11(金) 23:00
davincin,ダ・ヴィンチWeb,密室で殺された男。部屋からは、銃を握った木製人形が発見された。乱歩をあっと驚かせたトリックとは？ 『江戸川乱歩トリック論集』【書評】,10/11(金) 17:40
davincin,ダ・ヴィンチWeb,最愛の姉が“ジャガイモ頭の化け物”に…！ 閉鎖的な田舎町で発生する恐怖に背筋が凍るホラーコミック【書評】,10/10(木) 19:00
davincin,ダ・ヴィンチWeb,卑劣な罠によって拡散された動画のせいで、全てを失った女子高生。平然と生活する加害者たちに華麗なる復讐を果たす！【書評】,10/10(木) 17:10
davincin,ダ・ヴィンチWeb,生まれたばかりの自分の子を埋めた母親。その事件の犯人は友人だった―― 幼い頃の淡い思い出と残酷すぎる格差を描いた衝撃のセミフィクション【書評】,10/9(水) 20:10
davincin,ダ・ヴィンチWeb,新卒で“給食のおばさん”に！ 笑いと元気がもらえる、新人の成長物語【書評】,10/9(水) 17:10
davincin,ダ・ヴィンチWeb,「愛する人と触れ合えるようになる主人公を通して、生命力を取り戻してもらえたら」最新作『小鳥とリムジン』に込めた願いを小川糸さんに聞く,10/9(水) 13:00
davincin,ダ・ヴィンチWeb,「ラマダン（断食月）」真っ最中のトルコ旅。レストランが軒並み閉まっていて大ピンチ!? 女ひとり世界一周旅行記【書評】,10/8(火) 20:40
davincin,ダ・ヴィンチWeb,スーパーの青果コーナーの知られざる舞台裏！ 笑いと発見が詰まったお仕事エッセイ【書評】,10/8(火) 17:40
davincin,ダ・ヴィンチWeb,月9ドラマ原作。「私の耳にはウソが聞こえます」迫害され、村を出た少女と貧乏探偵がおくるレトロミステリー『嘘解きレトリック』の魅力【書評】,10/7(月) 21:10
davincin,ダ・ヴィンチWeb,台所でシャワー。サンマは4人で1匹。生活保護世帯の子どもとして生きた女子高生はどうやって自立したのか【書評】,10/5(土) 12:10
davincin,ダ・ヴィンチWeb,素敵なオーラから目が離せない！マダムの優雅な立ち居振る舞いに感化された女子大生の成長ストーリー【書評】,10/4(金) 12:10
davincin,ダ・ヴィンチWeb,「右園死児」とはなにか。不可解な文字列によって生じる、人知を超えた災害とは？ SNSで話題のホラー『右園死児報告』【書評】,10/3(木) 17:00
davincin,ダ・ヴィンチWeb,「やばい」で会話を済ませてない？154種類の感情表現を子どもと学べる『きもちのことばえほん』【書評】,10/3(木) 15:00
davincin,ダ・ヴィンチWeb,石破氏が首相就任した今考えたい『選挙、誰に入れる？』。 “政治アレルギー”でも読みやすい、今の日本を考えるための本【書評】,10/3(木) 13:00
davincin,ダ・ヴィンチWeb,「自分の親に読んでほしかった」世界46カ国で200万部を売り上げた、子どもとの向きあい方の根本がわかる1冊【書評】,10/2(水) 17:00
davincin,ダ・ヴィンチWeb,やらなきゃいけないけど、めんどくさいあれこれ。「やっとこっかなリスト」で未来への備えを先のばしにしない！【書評】,10/1(火) 21:10
davincin,ダ・ヴィンチWeb,なんてことのない当たり前の日々が尊い。忘れ去りそうな瞬間を丁寧に切り取った『コアラ絵日記』【書評】,10/1(火) 20:10
davincin,ダ・ヴィンチWeb,怪異に宣戦布告?!とある高校に流布する怪談話「きれいな本」の真相とは。梨氏による新感覚ホラーモキュメンタリー【書評】,10/1(火) 17:00
davincin,ダ・ヴィンチWeb,『世界の幽霊出現録』優しい、イタズラ好き、邪悪だけじゃない世界の幽霊の目撃証言を記録【書評】,10/1(火) 14:00
davincin,ダ・ヴィンチWeb,ご主人の枕をしっかり占領。紙袋はちょっぴり怖い。甘えん坊でドジっ子な黒猫との生活は癒しだらけ！【書評】,10/1(火) 12:10
davincin,ダ・ヴィンチWeb,山下智久主演で実写ドラマ化された話題作。天気予報を武器に自然災害から命を守れ！『BLUE MOMENT ブルーモーメント』【書評】,10/1(火) 6:40
davincin,ダ・ヴィンチWeb,散歩でテンションが上がり、リードに絡まり動けなくなる… ちょっぴりおバカでかわいすぎる柴犬の日常【書評】,9/30(月) 21:10
davincin,ダ・ヴィンチWeb,本当に恐ろしいのは戦争か？疫病か？はたまた...名画を通して過酷な運命と闘い続けた人間の本質をひもとく『災厄の絵画史』【書評】,9/30(月) 18:00
davincin,ダ・ヴィンチWeb,不思議なものを見ることができる「おまじない」とは!? 妖怪たちとの交流と心温まる絆を描いた『狐の窓』【書評】,9/29(日) 23:10
davincin,ダ・ヴィンチWeb,ビビり編集の新担当はホラー作家!? 凸凹コンビが怪異を求めて夜の樹海や廃病院へ！ 体当たり取材で出会ったのは…【書評】,9/29(日) 23:10
davincin,ダ・ヴィンチWeb,学校も生徒も選択肢があって良い！ コロナ禍を経て移り変わる生活を描いた『腐女医の医者道！　アフターコロナ編』【書評】,9/29(日) 20:10
davincin,ダ・ヴィンチWeb,刑事ドラマの犯人の似顔絵は似すぎちゃダメ？ドラマの現場で働くイラストレーターが知られざるテレビ業界の裏側を描くお仕事マンガ【書評】,9/29(日) 19:10
davincin,ダ・ヴィンチWeb,気品と恐怖が絶妙な『ゴースト・ハント』。翻訳者が「最後のゴースト・ストーリー作家」と呼ぶ、ウェイクフィールド英国風幽霊譚【書評】,9/29(日) 14:00
davincin,ダ・ヴィンチWeb,盛り塩をすると、フライドポテトを作ってくれる!? 生活力の高い怨霊と売れない漫画家の怖かわいい日常【書評】,9/28(土) 22:10
davincin,ダ・ヴィンチWeb,「この人たちと離れたら死ぬ」4歳でバックパッカーに。海外旅行初体験の両親と無計画な世界放浪の旅へ【書評】,9/28(土) 18:10
davincin,ダ・ヴィンチWeb,お役所仕事だけど命がけ!? 凸凹バディが各所の怪異を調査するお仕事ホラー『百鬼調書 怪異調査はこちらまで』【書評】,9/28(土) 17:10
davincin,ダ・ヴィンチWeb,『キャプテン翼』・高橋陽一「良いシュートが描けるとゴールさせたい」。ネーム連載の最新シリーズで22歳の大空翼が「W杯優勝」を掴むまでの構想とは【インタビュー】,9/28(土) 15:00
davincin,ダ・ヴィンチWeb,プレゼント選びで悩んでしまうあなたに。天才ギフトコンシェルジュと新米編集者が織りなすハートフルドラマ【書評】,9/28(土) 14:10
davincin,ダ・ヴィンチWeb,仕事に熱中しすぎて部屋は散らかり放題。タイ料理が好きという理由で現地へ。豪快で愛おしい妻に振り回される夫の日常【書評】,9/28(土) 12:10
davincin,ダ・ヴィンチWeb,愛し合うのは「傘」と「傘立て」!?　正気を疑うBLマンガ『放課後水入らず』はなぜ生まれたのか【BLマンガ家・あぶくインタビュー】,9/28(土) 10:10
davincin,ダ・ヴィンチWeb,『虎に翼』ロスの人におすすめ！ 世界を深める「3冊」【書評】,9/28(土) 8:30
davincin,ダ・ヴィンチWeb,大人の10人に1人が該当すると言われる発達障害。特性ゆえの失敗・トラブルの改善方法を実例から学ぶ！【書評】,9/28(土) 6:40
davincin,ダ・ヴィンチWeb,「東京高尾リゾート（TTR） 山のテーマパークに来たみたいだぜ」笑いと学びが詰まった、インドアオタクたちの山登り入門マンガ！【書評】,9/27(金) 21:40
davincin,ダ・ヴィンチWeb,「キャラクターを生きている人として描きたい」大人気漫画『不運からの最強男』作画・中林ずん先生の原点とは？【インタビュー】,9/27(金) 19:10
davincin,ダ・ヴィンチWeb,もう次のミルクタイム!? 5分で起きたが？ 子育て中の“あるある”に心温まる『今日のぽよるし』【書評】,9/27(金) 18:40
davincin,ダ・ヴィンチWeb,「1年だけ結婚しよう」期間限定の契約結婚。しかし、離婚前日に事故に遭い記憶を失った夫から、まさかの溺愛がはじまって――!?【書評】,9/27(金) 18:10
davincin,ダ・ヴィンチWeb,「ある地域」に関する怪談を集めていた編集者が失踪した。次第に浮かび上がる恐ろしい事実とは？ 漫画『近畿地方のある場所について』【書評】,9/27(金) 17:40
davincin,ダ・ヴィンチWeb,アフタヌーン連載で大反響、小学5年生の不穏な友情物語。 著者が語る『どくだみの花咲くころ』誕生秘話【城戸志保氏インタビュー】,9/27(金) 13:00
davincin,ダ・ヴィンチWeb,子育て中のママにも活かせる時間術。心地よく過ごしながら自分の人生をデザインする方法をタイムコーディネーターが伝授！【書評】,9/27(金) 12:10
davincin,ダ・ヴィンチWeb,結婚前と妊娠中に浮気した夫。「別れたくない」と土下座までしたのに、1年も経たないうちに3度目の浮気が発覚。サレ妻は徹底的な制裁を決意する！【書評】,9/26(木) 23:10
davincin,ダ・ヴィンチWeb,しごできイケおじの秘密とは？  本当に好きなものを愛で、その世界にどっぷりと浸る尊い時間を描いた『おじさんはカワイイものがお好き。』【書評】,9/26(木) 23:10
davincin,ダ・ヴィンチWeb,「彼氏は既婚者だけど、私と結ばれる運命」と信じていたハイスペ上司は、モラハラ不倫搾取男だった…【書評】,9/26(木) 21:40
davincin,ダ・ヴィンチWeb,メイドが宝石を売る不思議なお店。決して押し売りはせず、お客様の気持ちに寄り添った最適な宝石を提案してくれる宝石商【書評】,9/26(木) 18:40
davincin,ダ・ヴィンチWeb,まさかの鬼になりきる鬼“ごっこ”!? 天才だけどお馬鹿な「紙一重」な少女のにぎやかな日常【書評】,9/26(木) 17:40
davincin,ダ・ヴィンチWeb,『傲慢と善良』が幅広い年齢層に「自分自身を描いているようだ」と感じさせる理由。 映画主演・キスマイ藤ヶ谷＆奈緒の心にも刺さった辻村深月作の恋愛ミステリー【書評】,9/26(木) 15:00
davincin,ダ・ヴィンチWeb,「手間なく美味しく食べてるのに痩せる」“ズルい”ダイエット方法って？ SNSで人気のKikiさんが8キロ落としたレシピを作ってみた【書評】,9/25(水) 21:40
davincin,ダ・ヴィンチWeb,乳がんが転移し、脳腫瘍になってしまった母。最期を看取るため、母の死と向き合った家族の数カ月の記録【書評】,9/25(水) 18:10
davincin,ダ・ヴィンチWeb,人の死が近づくと聴こえる不穏な音。登場人物の物語がつながる全12話のオムニバス漫画【書評】,9/25(水) 18:00
davincin,ダ・ヴィンチWeb,宮部みゆき原作の怪奇譚集をコミカライズ。心を閉ざした少女が耳を傾けるのは、奇妙で恐ろしい怪談話だった。『三島屋変調百物語』【書評】,9/25(水) 16:10
davincin,ダ・ヴィンチWeb,「絶対に嫌」ぼっち男子がクラスで1番かわいい女子からの誘いを断った理由とは？“内緒の友達”との秘密の関係にむずきゅんが止まらない【書評】,9/25(水) 12:10
davincin,ダ・ヴィンチWeb,“勝ち組”人生を歩んでいた大人気マンガ家。地位と名誉に溺れて周りを見下しまくった結果、これまでと「真逆」の世界に転移させられて!? 手に汗握る因果応報コミック【書評】,9/24(火) 20:40
davincin,ダ・ヴィンチWeb,「私だってまだ未熟なのに…」新任教師の指導に悩む中堅の先生の悩みに対し、メンタル激強な保健室の先生が放った力技なアドバイスとは？【書評】,9/24(火) 17:40
davincin,ダ・ヴィンチWeb,帰宅中の事故で死んでしまった主人公。「毒にも薬にもならないから」という理由で異世界転生させられ、治癒師として生きることを目指す！【書評】,9/24(火) 12:10
davincin,ダ・ヴィンチWeb,満島ひかりの回文を又吉直樹がショートストーリーに！？満島×又吉【インタビュー】,9/24(火) 12:00
davincin,ダ・ヴィンチWeb,結婚してから豹変した夫は、DVに借金、不倫三昧！ 息を吐くように嘘をつく夫に、妻は制裁を決意する【書評】,9/23(月) 20:40
davincin,ダ・ヴィンチWeb,動物に異様なほど好かれる体質の義理の兄との同居生活がスタート!? 義兄弟のほのぼの＆にぎやかアニマルライフ【書評】,9/23(月) 16:40
davincin,ダ・ヴィンチWeb,初対面の異性と話が続かない… マッチングアプリで運命の人を探す、アラサー男性のリアルな婚活体験記【書評】,9/22(日) 23:10
davincin,ダ・ヴィンチWeb,やっと見つけた…！ “好き”を分かち合う喜び、ふたりの女子高生の音楽で彩られた青春を描く『気になってる人が男じゃなかった』【書評】,9/22(日) 21:40
davincin,ダ・ヴィンチWeb,先輩後輩コンビのふたり暮らしを彩る全国の“美味しいもの”たち。お取り寄せを味わう時間がふたりの仲を深めていく【書評】,9/22(日) 16:10
davincin,ダ・ヴィンチWeb,「天上天下唯我独尊」の特攻服を着たヤンキー。住職がその意味を知っているかと問うと!? ヤンキーが教えを説く仏教コメディ【書評】,9/21(土) 23:10
davincin,ダ・ヴィンチWeb,子育てが終わったら何が残るのだろう？ 『うちの母は今日も大安』は、自分の人生を生きるためのヒントが詰まったお守り本【書評】,9/21(土) 21:40
davincin,ダ・ヴィンチWeb,傷付いたふたりを繋いだのは「パン」...犬と少年のワンダフルな友情物語『こむぎびよりのコッペパン』【書評】,9/21(土) 20:00
davincin,ダ・ヴィンチWeb,アニメ放送決定で再熱中、未完の魔法少女マンガ。累計60万部、絶筆となった藤原ここあ作の名作『かつて魔法少女と悪は敵対していた。』【書評】,9/21(土) 18:00
davincin,ダ・ヴィンチWeb,「持ち家を手放そう！」憧れの一軒家を建てたものの、家族の幸せのために手放した実録エッセイ【書評】,9/21(土) 17:40
davincin,ダ・ヴィンチWeb,パワースポットで運気をチャージ！ ゆるっと巡る、夫婦（ときどき3姉妹）の笑顔あふれる開運旅【書評】,9/21(土) 16:10
davincin,ダ・ヴィンチWeb,「王子をビンタして死刑」から始まる幽霊城でのラブコメディ！恋にも幽霊にもドキドキさせられる『幽霊城の旦那様』【書評】,9/21(土) 11:00
davincin,ダ・ヴィンチWeb,「子どもを産みたいのか分からない」「望めば妊娠できると思っていた」子どもを持つかどうかの選択、不妊の悩みを描いたコミックエッセイ【書評】,9/20(金) 23:10
davincin,ダ・ヴィンチWeb,本当に「子どものため」ですか？ 歪んでいく母親の愛を描いた衝撃的なセミフィクション『すべては子どものためだと思ってた』【書評】,9/20(金) 22:10
davincin,ダ・ヴィンチWeb,和田秀樹「日本の学者、外国の論文を読んでないんじゃないの」精神科医としての道標となった3冊【私の愛読書】,9/20(金) 20:00
davincin,ダ・ヴィンチWeb,70歳独身男、はじめての子育てでどうなる!?想定外だらけの3歳児とのドタバタ共同生活【書評】,9/20(金) 19:00
davincin,ダ・ヴィンチWeb,正体不明の祠と事件現場に残される「N」の文字。伏線を解き明かすのが恐ろしくなるホラー漫画『N』,9/20(金) 16:00
davincin,ダ・ヴィンチWeb,猫のふみふみ、肉球によるアイマッサージ… 疲れた社会人の心も体も癒してくれるのは白猫の店主!?『ねこのマッサージ屋さん』【書評】,9/20(金) 15:10
davincin,ダ・ヴィンチWeb,うっかりミスや遅刻、勘違い…もしかしてADHDかも？ リアルな「困りごと」の解決策を学べるコミックエッセイ【書評】,9/20(金) 6:40
davincin,ダ・ヴィンチWeb,「死体部屋」に遭遇することも日常茶飯事。家賃を滞納している人に督促をする、家賃保証会社の仕事とは？【書評】,9/19(木) 22:10
davincin,ダ・ヴィンチWeb,『光が死んだ夏』はホラー？ブロマンス？青春譚？語り尽くせぬ魅力に沼る人続出の漫画をレビュー【書評】,9/19(木) 21:00
davincin,ダ・ヴィンチWeb,この恋は期限付き。余命宣告されたふたりの儚い純愛ストーリー『余命一年と宣告された僕が、余命半年の君と出会った話』【書評】,9/19(木) 20:00
davincin,ダ・ヴィンチWeb,出血は痔のせいだと思ってた。37歳の若さで「大腸がん」ステージ4と診断された女性のリアルな闘病日記【書評】,9/19(木) 19:40
davincin,ダ・ヴィンチWeb,天真爛漫・令和ギャル！1歳のしおさんとほぼさんファミリーが送る、抱腹絶倒！子育てコミックエッセイ【書評】,9/19(木) 19:00
davincin,ダ・ヴィンチWeb,浮気された地味令嬢が美しい女性に成長!? 素敵な淑女になるためのスパルタレッスン【書評】,9/18(水) 22:10
davincin,ダ・ヴィンチWeb,「辺境の雪男」から突然のプロポーズ!? 契約結婚から始まる心温まる雪国の物語『北欧貴族と猛禽妻の雪国狩り暮らし』【書評】,9/18(水) 21:40
davincin,ダ・ヴィンチWeb,実話怪談マンガ『憑きそい』の重くのしかかるような息苦しさと気持ち悪さ。【書評】,9/18(水) 21:00
davincin,ダ・ヴィンチWeb,そこはかとなくブサイクだけど最高にかわいい！ いくえみ綾と愛猫ブンとの日常を描いた猫コミックエッセイ【書評】,9/18(水) 19:40
davincin,ダ・ヴィンチWeb,チャンネル登録者数30万人超のYouTubeホラー番組『フェイクドキュメンタリーQ』が書籍に！リアルすぎるじっとりとした恐怖がたまらない【書評】,9/18(水) 18:00
