media_en,media_jp,title_articles,link_articles,date_original
tsb,テレビ信州,１人で山菜採りに出掛けた83歳男性死亡　沢筋で倒れているのを県警機動隊員が発見,https://news.yahoo.co.jp/articles/58730f462f9a2a0040ed21beba6cce581e8e6430,5/27(月) 15:10
tsb,テレビ信州,高校生が土木現場の調査を体験　将来の職業選択に役立てて,https://news.yahoo.co.jp/articles/ca97065ae306fccdeadf887a67624809fefb5779,5/27(月) 12:01
tsb,テレビ信州,松本市の県道で普通乗用車に37歳の歩行者はねられる　意識のない状態で病院に搬送,https://news.yahoo.co.jp/articles/3560247698985d5fbda7d47aa826df3b15fa5bd2,5/27(月) 11:55
tsb,テレビ信州,御代田町のコンビニで強盗未遂事件　男が刃物のようなものを見せ「金を出せ」と脅す　警察が逃げた男の行方追う【長野】,https://news.yahoo.co.jp/articles/e518ec976f3d148d0ec278c56b46935b6606b962,5/27(月) 8:43
tsb,テレビ信州,飯山市の山林　山菜採りで83歳男性が行方不明　県警ヘリも出動　26日の捜索では発見できず【長野】,https://news.yahoo.co.jp/articles/dd9b094c0f3a9ccb23f6c99c4b75e431af18dd40,5/26(日) 19:15
tsb,テレビ信州,大相撲5月場所千秋楽　御嶽海は敗れて8勝7敗【長野】,https://news.yahoo.co.jp/articles/c447ec2ddf4f542b9c57330175be67faea038be1,5/26(日) 19:12
tsb,テレビ信州,飯山市で山菜採りをしていた83歳男性が行方不明　警察が捜索【長野】,https://news.yahoo.co.jp/articles/0be15a580b811c416695df54180cbebb10a1b83b,5/26(日) 14:35
tsb,テレビ信州,北アルプスの前穂高岳　諏訪市の62歳男性が滑落して死亡【長野】,https://news.yahoo.co.jp/articles/dadeae9926812e245c0bbd7dafffdc210acaa3e8,5/26(日) 13:57
tsb,テレビ信州,華やかな袴姿で勝負！　和装に親しみを　長野市でかるた大会【長野】,https://news.yahoo.co.jp/articles/dec8194f441df95cdb1cba4034a576ce9417ece2,5/26(日) 12:57
tsb,テレビ信州,患者たちにバラで癒しを　上田市の病院でイベント【長野】,https://news.yahoo.co.jp/articles/d601017be2e3981ab5e9bb2bc594d3504d457405,5/26(日) 12:20
tsb,テレビ信州,「ミシミシミシって…」「危ない木を早めに切ってほしい」　バラ祭り開催中の中野市一本木公園で倒木　女子児童が軽いけが【長野】,https://news.yahoo.co.jp/articles/9190212aa7de0387d46028f340e222fc913d527f,5/25(土) 19:53
tsb,テレビ信州,「いまだに信じられない…」中野市4人殺害事件から1年　地元の住民などが献花　静かに手を合わせ犠牲者の冥福を祈る【長野】,https://news.yahoo.co.jp/articles/09c7592fd812822270e14f9a4f9a66cc977b16d1,5/25(土) 16:54
tsb,テレビ信州,北陸新幹線敦賀延伸で「福井県のきれいな海を楽しんで」　夏シーズンへJR長野駅で観光PRイベント　26日まで開催【長野】,https://news.yahoo.co.jp/articles/46791d0d403f6f1afd5d4c0721b82f2595b92c56,5/25(土) 16:44
tsb,テレビ信州,中野市で警察官含む4人が殺害された事件から1年　被告宅の庭先に建立された観音像　犠牲者の冥福を祈り献花【長野】,https://news.yahoo.co.jp/articles/5f3c4b00b7ff00cdea91c137c1e79c06fca0a90c,5/25(土) 12:13
tsb,テレビ信州,「ハーフライフル銃」規制強化　中野4人殺害事件 猟友会「忘れることはない」銃規制　課題は…,https://news.yahoo.co.jp/articles/3858e5df700572faee400be4c7162cd47d5bf6f1,5/24(金) 21:16
tsb,テレビ信州,遺族の悲しみ深く…中野市4人殺害事件から１年　警察署で追悼式 青木被告「事件について話さず」,https://news.yahoo.co.jp/articles/7252e3d445784af321bb05602751e4163a010e88,5/24(金) 21:08
tsb,テレビ信州,道路横断中の50代女性が普通乗用車にはねられ重傷 長野市鶴賀の市道,https://news.yahoo.co.jp/articles/fda74e91a8aef521bdc54fb807437854dcfa5095,5/24(金) 20:54
tsb,テレビ信州,変更！「20分まで100円 以降は20分ごとに100円加算」長野市の城山公園の駐車場　短時間の利用者に配慮　6月１日〜,https://news.yahoo.co.jp/articles/8ec8e0349f0e100cb5ec99c7dd05a93ce3857f68,5/24(金) 15:20
tsb,テレビ信州,予想最高気温 飯田で30度 松本29度 長野・諏訪28度の見込み こまめな水分補給・エアコン使用など熱中症対策を,https://news.yahoo.co.jp/articles/f79aa01704b0c3c5aa6caccdbbdb1ab03fdc99d3,5/24(金) 12:23
tsb,テレビ信州,日本の棚田百選「稲倉の棚田」で小学生が田植え 秋には収穫　新米楽しみに,https://news.yahoo.co.jp/articles/d2b836acdca0ca41fee7fdfb617176c7e0aca612,5/24(金) 12:14
tsb,テレビ信州,無免許ひき逃げの疑い22歳の無職の男逮捕　容疑認める,https://news.yahoo.co.jp/articles/61d968887d1ab70c73ccc343a1db462f0b6e06a2,5/24(金) 11:57
tsb,テレビ信州,【特集】中野市4人殺害事件から１年  青木政憲 被告の今...「自分は我慢の限界だからやがて起こっていただろう」人の笑顔の「ニコニコ」と「ニヤニヤ」の区別つかず,https://news.yahoo.co.jp/articles/2153022337702ff1019dcc15de83ac47b5a1c3b2,5/23(木) 20:36
tsb,テレビ信州,長野市箱清水の地下水から基準を超える有害物質　飲用井戸の利用を控えて クリーニング店の跡地,https://news.yahoo.co.jp/articles/72172c78666aec8c0362e6728ea7856fb2b29f48,5/23(木) 20:26
tsb,テレビ信州,高低差150メートル超　連続するカーブ　難コースを疾走　国内外から96人エントリー 飯田ならでは焼肉食べながら声援も 国内最大級の自転車ロードレース「ツアー・オブ・ジャパン」,https://news.yahoo.co.jp/articles/a0f00f5daec0d882f079179c9b14555b01b286f4,5/23(木) 19:57
tsb,テレビ信州,狙われた山あいの集落 松本市強盗致傷事件 「家に居る時も鍵かけて」事件現場周辺の住宅で防犯指導,https://news.yahoo.co.jp/articles/24eb3340f33f6600a1407d73aff9e8b07433787b,5/23(木) 19:48
tsb,テレビ信州,梅雨入り前に　洪水に備え千曲川流域で現地調査　排水機場や備品を確認「逃げ遅れをださない」,https://news.yahoo.co.jp/articles/43665804d42ffc034c8e7799e5c18a15baecc2ac,5/23(木) 19:34
tsb,テレビ信州,御嶽海は大関・豊昇龍との一番　「寄り切り」で4敗目 大相撲5月場所は12日目,https://news.yahoo.co.jp/articles/36a966656df8a3e921b6d96f07b299232c8b14e5,5/23(木) 19:32
tsb,テレビ信州,「世界カメの日」 体重100キロ　動物園でゾウガメと触れ合う　カメの魅力知って！,https://news.yahoo.co.jp/articles/0372010a8af9cf3fa7be8c2c3405dae4d7b5ec57,5/23(木) 19:31
tsb,テレビ信州,国内最大級の自転車ロードレース「ツアー・オブ・ジャパン」飯田市で開催 国内外96人の選手がエントリー アップダウンの激しいコースを10周走行距離122.6キロ,https://news.yahoo.co.jp/articles/aba4ac9065af6add6a4ac86f9a1bcc1c192d3e03,5/23(木) 12:32
tsb,テレビ信州,ルヴァンカップの3回戦　AC長野パルセイロ J1札幌にPK戦で敗れる,https://news.yahoo.co.jp/articles/c2daaee9739d7f92adf6a146bf6d680d6e680202,5/23(木) 12:25
tsb,テレビ信州,２時間600円！長野市の市営駐車場 有料化に賛否　市民有志が無料化求め署名活動も 周辺の駐車場は…観光地価格？,https://news.yahoo.co.jp/articles/d7e56887ee4758fffac9036549348d3bf9bcef46,5/22(水) 20:13
tsb,テレビ信州,御嶽海は8勝目 勝ち越し決める　美ノ海との一番　大相撲5月場所11日目,https://news.yahoo.co.jp/articles/315261abe86133d85479d963c8a4791569b71973,5/22(水) 20:00
tsb,テレビ信州,土砂災害警戒情報の発表基準が23日から一部変更に　発生危険度を精度よくとらえ的確な発信目指す,https://news.yahoo.co.jp/articles/1dfdb162aa48a4d627d0cf555ca34cc62fb4c0d7,5/22(水) 19:54
tsb,テレビ信州,クリクリお目目の赤ちゃんザルがいっぱい　ベビーラッシュ♪ 新緑の地獄谷野猿公苑「ちっちゃくてかわいい」観光客メロメロ,https://news.yahoo.co.jp/articles/99a8137191b6681680ed23400922c2f9b74e5662,5/22(水) 18:45
tsb,テレビ信州,「亡くなった人が浮かばれるような判決を」御嶽山噴火災害訴訟  原告「噴火警戒レベルを上げていれば登山者は被災を免れた」控訴審が結審  判決は10月21日,https://news.yahoo.co.jp/articles/effa282e6f917e8eda874c0ba2b1feb2aac29d8b,5/22(水) 18:24
tsb,テレビ信州,ウドを採りに…　山菜採りの67歳男性　浮き石に乗り滑落　足にけが　松本市安曇の山林,https://news.yahoo.co.jp/articles/86e060073bab4502aa78fb7dcbe2830ef2f2ad53,5/22(水) 14:09
tsb,テレビ信州,信州BW 勝久マイケルヘッドコーチ来季も契約継続 「日本一のチームになるという目標は変わりません」,https://news.yahoo.co.jp/articles/d80e9d399de5b61e3c5c691285a9d88a03d25981,5/22(水) 12:25
tsb,テレビ信州,ビーナスラインを華やかに　小学生が道沿いに花植える　７月ごろには満開に,https://news.yahoo.co.jp/articles/91812cbb29b7c200aff4b56e58df631d09b9167c,5/22(水) 12:17
tsb,テレビ信州,咲き始め甘い香りに包まれる　園内には850種3000株「信州なかのバラまつり」は25日から,https://news.yahoo.co.jp/articles/2317785f3f0829096e066f2658a3812c38d2d45a,5/22(水) 12:12
tsb,テレビ信州,エディー・ジョーンズ日本代表HC「ラグビーの魂　聖地に戻ってきたかった」ラグビー日本代表の選考につながる合宿　菅平高原で始まる,https://news.yahoo.co.jp/articles/5d1f2c2643c19ecebe88c226bfd565fb8f7fd127,5/21(火) 23:14
tsb,テレビ信州,高騰！キャベツの卸売価格去年と比べ3.5倍に　天候不順で出荷量減　市場は争奪戦  今おすすめの野菜は…,https://news.yahoo.co.jp/articles/5511b4ddc5e592a8cdac320abc40e9b260dc3fa9,5/21(火) 21:18
tsb,テレビ信州,スタジオジブリ「名誉パルムドール」受賞　信州からも喜びの声　ゆかりのある富士見町はジブリ映画の聖地として…期待膨らむ,https://news.yahoo.co.jp/articles/3e29e32beab3813d50d5f5abb0bdc94fa0694a3a,5/21(火) 21:06
tsb,テレビ信州,コンビニに信州のご当地グルメ　山賊焼き弁当にリンゴのスイーツ　販売前に阿部知事が試食,https://news.yahoo.co.jp/articles/efae1c67414481db351865e5378e5221f600b2c1,5/21(火) 20:48
tsb,テレビ信州,大相撲5月場所10日目　左太もも痛めた御嶽海　琴勝峰に「押し出し」で敗れる,https://news.yahoo.co.jp/articles/4cc4183e1af45e712c68afb575bbf39989163b9c,5/21(火) 20:41
tsb,テレビ信州,消火用ホースの先端がなくなる被害　富士見町内で29本 背景に金属高騰か 真ちゅう製 町「被害届の提出」を検討,https://news.yahoo.co.jp/articles/ad3100f2f348b61c755aebc12dade0c3a252a05f,5/21(火) 20:38
tsb,テレビ信州,長野市稲田で火事  木造２階建て住宅１棟全焼　90代女性が顔にやけど　消防車１２台出動　消火活動続く,https://news.yahoo.co.jp/articles/3f88a3e8457ce4cc0cec44fe5011e67af7f1e37f,5/21(火) 18:07
tsb,テレビ信州,甘露煮や唐揚げに…佐久地域の郷土食「小ブナ」楽しみに　親ブナ出荷,https://news.yahoo.co.jp/articles/8c08f27f743174ceae4b4b3b08bc0bfb3b9be49b,5/21(火) 12:32
tsb,テレビ信州,宮田村殺人未遂事件で逮捕の暴力団幹部の男　神戸市の暴力団組長殺人事件にも関与強まり逮捕へ,https://news.yahoo.co.jp/articles/247acb67d0cd7d9313766bce834f419238bc3fda,5/21(火) 12:25
tsb,テレビ信州,世界の子どもの現状知って「ユニセフ・キャラバン・キャンペーン」県と協力を確認,https://news.yahoo.co.jp/articles/dd1fd8f917eb8a4b6c33f4e6cc32d40dc80ad1a2,5/21(火) 12:24
tsb,テレビ信州,ラグビー日本代表選考へ合宿…上田市菅平高原で始まる【長野】,https://news.yahoo.co.jp/articles/5c957dfa25ad7764c51283a4471386bd7a14e6d4,5/20(月) 20:05
tsb,テレビ信州,新たに刃物のような物が見つかる…松本市の強盗致傷事件から2週間　手口似た栃木県の事件で逮捕した男らから押収した車を捜索【長野】,https://news.yahoo.co.jp/articles/fcfa7fccfc3c58abc2e37ae06a4ab16f91f30cce,5/20(月) 20:01
tsb,テレビ信州,今年も生きていた！ライチョウ復活事業のきっかけとなった1羽の雌「飛来メス」【長野】,https://news.yahoo.co.jp/articles/24c6c6aa86d487345ce9fc041f4cb0b1bf9840dc,5/20(月) 19:53
tsb,テレビ信州,左足の太ももを痛めた御嶽海…痛みこらえて7勝目【長野】,https://news.yahoo.co.jp/articles/bc53a289f823d06ee42ecb63a53717237cc50cbe,5/20(月) 18:19
tsb,テレビ信州,北アルプス燕岳で愛知県の男女2人が遭難　足にけが　自力で下山できず県警が救助へ【長野】,https://news.yahoo.co.jp/articles/2020df88642dbbff28f8f88ad03c1afdcd7ba577,5/20(月) 12:26
tsb,テレビ信州,「全員でハードワークできるように頑張りたい」　日本代表選考につながるラグビー15人制の合宿　上田市菅平高原で20日から　市の関係者が出迎え【長野】,https://news.yahoo.co.jp/articles/70fa07961586f4ec505820eee8271d6a3defe66f,5/20(月) 12:15
tsb,テレビ信州,「色とりどりで黄色もあって…」　初夏の花クリンソウが見頃　喬木村の九十九谷森林公園　一気に開花進み色合いも良く見応え十分【長野】,https://news.yahoo.co.jp/articles/32960302e648501cb7355de2610e990e6e902ce3,5/20(月) 11:47
tsb,テレビ信州,大相撲5月場所は4日目　御嶽海は粘りに粘って4連勝,https://news.yahoo.co.jp/articles/0961c4299916fa71c7652c942125a37cabc3530c,5/15(水) 18:02
