media_en,media_jp,title_articles,link_articles,date_original
chuspo,中日スポーツ,『ぽかぽか』生出演の57歳女優、驚きの最新ショートカット姿「美魔女って言葉の最上級」「若い頃より今の方がキレイ」,https://news.yahoo.co.jp/articles/e478ec77912663caf487554871accc2f80a58a31,6/3(月) 13:33
chuspo,中日スポーツ,藤井聡太八冠の王位戦第1局にあわせ「特別ツアー」　『初手』『感想戦』など見学や『勝負めし』の体験など,https://news.yahoo.co.jp/articles/82fc6206db8781232119a0b68c1957b1c16203a7,6/3(月) 12:46
chuspo,中日スポーツ,ＴＢＳ系「パリオリンピック」のＳＰキャスターは８大会連続の高橋尚子さん、総合司会は３大会連続の安住紳一郎アナウンサーに決定,https://news.yahoo.co.jp/articles/1cc39730c2ec7782ffa5ae837f6f76a37802b803,6/3(月) 12:42
chuspo,中日スポーツ,ＴＢＳ系日曜劇場「アンチヒーロー」第８話で急展開、第１話とつながり見えた！,https://news.yahoo.co.jp/articles/53c34a1953e4adf470d22f1fec3323fa6fe6d68e,6/3(月) 12:16
chuspo,中日スポーツ,イチローさん「鬼だと思った」ダイエー監督の”異例采配”、24年後に明かされた真意　王貞治さん「こっちはもうけ物だから」,https://news.yahoo.co.jp/articles/72c81e0358948ce98fbfeeaa27ffb36d0087bd96,6/3(月) 12:05
chuspo,中日スポーツ,ＮＨＫ名古屋、「プライド月間」に多様な性のあり方考える企画を集中放送。１４日に音楽特番「Ｕｔａ　Ｔｕｂｅ　ＦＥＳ」,https://news.yahoo.co.jp/articles/c67539bd478eb61e15c57bed4782db6821283d3d,6/3(月) 12:01
chuspo,中日スポーツ,乃木坂４６・向井葉月＆アンガールズ・山根良顯、「文化放送ライオンズナイター」西武×広島戦にゲスト出演,https://news.yahoo.co.jp/articles/4b363b47dc59bc83b9daefd737ea8760c86f7c50,6/3(月) 12:00
chuspo,中日スポーツ,武田真一アナ、『セクシー田中さん』問題の報告書うけコメント 「メディアに関わっている者の教訓として…」日本テレビには厳しい声も「社長がちゃんと会見して」,https://news.yahoo.co.jp/articles/49632128ad22939664aa7b9ff080f3d2275d9216,6/3(月) 11:40
chuspo,中日スポーツ,奇跡の80歳・高橋英樹、最新の姿にネット仰天「まじすごい」「外見だけじゃなくて…」「何この柔軟性！まるで若手芸人」,https://news.yahoo.co.jp/articles/8476a7e9394fbf6bdc6ebf2efbf8c6b71de59d49,6/3(月) 11:35
chuspo,中日スポーツ,俳優でアーティストの福澤侑がプロデュース、「ACTORS☆LEAGUE in Dance 2024」出演メンバーなど発表　8月に開催,https://news.yahoo.co.jp/articles/b933cc303a7c80d33de5c4a58dcc2c9ab5fc7276,6/3(月) 11:20
chuspo,中日スポーツ,わずかコンマ2秒差…オジエ、最後の最後で勝利スルリ 「これも人生。タナクもすごく良いラリーをしていた」と勝者たたえる【WRC】,https://news.yahoo.co.jp/articles/445a5f9085c453200c11d6e8f1314af89eb81bb7,6/3(月) 10:56
chuspo,中日スポーツ,2軍でのフォーム修正でスケール大きく…“自己最速157キロ” 本来の姿に戻った中日・梅津「打者と勝負できた」,https://news.yahoo.co.jp/articles/ed8f61ec6e16eb551d2d6cece61a56d19f4b80d1,6/3(月) 10:49
chuspo,中日スポーツ,阪神・岡田監督、1戦目「もうええわ」2戦目「もうええやろ」そして3戦目は「オレはもうええやろ」…ロッテ戦、“同じ一言”のいろんな意味,https://news.yahoo.co.jp/articles/560ef7c2b452c6f66f41e5ddc2f9794522cc8f5b,6/3(月) 10:37
chuspo,中日スポーツ,石川祐希VS高橋藍、『世界一決定戦』で直接対決の可能性…膨らむ期待、“ドリームマッチ”実現なら歴史的な一戦に【バレーボール】,https://news.yahoo.co.jp/articles/b7b4ebb3e64fd1e1ca64558d28a2fe4c54f0ebcd,6/3(月) 10:25
chuspo,中日スポーツ,中国女子バレー、パリ五輪切符獲得できるアジア最高位の座、日本に奪われ…中国メディア「大ピンチ！」エースの起用法に疑問呈す,https://news.yahoo.co.jp/articles/6a6bea40beb6da8a62b32a4986e6ecaafb109bd4,6/3(月) 10:21
chuspo,中日スポーツ,大谷翔平、58試合目で移籍後初の申告敬遠…エ軍時代の昨季21個が激減…ド軍とエ軍の違い鮮明,https://news.yahoo.co.jp/articles/f15d6f85625612e09d7ce6a7a8fc5075d8da3a9d,6/3(月) 9:21
chuspo,中日スポーツ,笹生優花、2度目の全米女子オープン制覇「家族の支えなしには、ここにいられなかった」涙で感謝　5位スタートから逆転,https://news.yahoo.co.jp/articles/6d07164a58b59fe1dfdad58e88146f36b3b56dd4,6/3(月) 8:05
chuspo,中日スポーツ,【本城雅人コラム】日本競馬に足りない点、それを感じた国際競走…18年ぶりの香港馬のG1勝利で感じた2つのこと,https://news.yahoo.co.jp/articles/2057bf9a79e5b4c8015e7dfad69af3f7db87fb97,6/3(月) 6:00
chuspo,中日スポーツ,「『ビシエド打って』っていつも願ってる」…中日・中田翔とビシエド、４番を張ってきたからこそ分かち合えること【番記者メモ】,https://news.yahoo.co.jp/articles/6a970372d065d7a43869a8e420d823697e9fa8fd,6/3(月) 5:45
chuspo,中日スポーツ,【中日】中田翔「すごい投球してくれた」投手陣に報いる土壇場延長12回2死の決着打…痛み乗り越え移籍後初のヒーローインタビュー,https://news.yahoo.co.jp/articles/44f8429fcf5fdab8b087e9a1134cb8112b6014c4,6/3(月) 5:45
chuspo,中日スポーツ,【中日】か～め～は～め～波！！ディカーソン、本塁打パフォーマンスは「これからもやっていく」　父からは「謙虚に生きよ」の教えも,https://news.yahoo.co.jp/articles/7a58622375c688269257ed51bc5cee97d4ed139e,6/3(月) 5:45
chuspo,中日スポーツ,Snow Man・渡辺翔太×中村アンが協定恋愛！？ 絶食系男子と干物系女子の超王道ラブコメ 7月6日スタート、テレ朝系ドラマ「青島くんはいじわる」,https://news.yahoo.co.jp/articles/afe762e652cc8dbf9f54a55b51314c62156cb614,6/3(月) 5:00
chuspo,中日スポーツ,ロバーツ監督、大谷翔平と真美子夫人から誕生日に岡山産ウイスキーのギフト…チョコも添えられ「真美子が選んだと思う」とご満悦,https://news.yahoo.co.jp/articles/09069231d171062f87cec3bf47365b3080fbe657,6/3(月) 4:25
chuspo,中日スポーツ,舛添要一氏、「民を奴隷扱いする仕組みをいつまで…」給与明細への減税額明記に企業側の負担増を憂慮,https://news.yahoo.co.jp/articles/2acb7ba2a4346db6afe132730029bfa3d022556a,6/2(日) 22:41
chuspo,中日スポーツ,真鍋かをり、蓮舫氏による都知事選での自民党批判に「ウンザリ」発言連発　SNSではさまざまな意見も,https://news.yahoo.co.jp/articles/c9adc1f6a0e9768773c7f12e979c13c5fb1dc0be,6/2(日) 22:18
chuspo,中日スポーツ,日本ハム・新庄監督、初本塁打の水谷瞬に「メジャー行かせる指導する」と明言　フォロワーからは来季の指揮官続投に激アツ期待,https://news.yahoo.co.jp/articles/a0987d0fa69562ad32cdfb3041aff5be3fe0767b,6/2(日) 22:12
chuspo,中日スポーツ,名古屋グランパス、交代策はまりチャンス増やすもセットプレーの1点のみ…今季最多のシュート数17本も実らず,https://news.yahoo.co.jp/articles/dd7ef8d5a4ccad87e34ed05d0abd3f0e3cbd0570,6/2(日) 21:57
chuspo,中日スポーツ,【名古屋グランパス】山中亮輔、4月のアキレス腱部分断裂から復帰即途中出場　連続CKでチャンス演出,https://news.yahoo.co.jp/articles/89142333d4d59c5099f7bd12c3b207972f98644a,6/2(日) 21:50
chuspo,中日スポーツ,岩橋玄樹がYogibo愛を叫ぶ「名前をつけるくらい好き」「『マックス』です。かわいいでしょ」,https://news.yahoo.co.jp/articles/c332e9d981c890d9dcc427e7f93f5b0a070e5017,6/2(日) 21:38
chuspo,中日スポーツ,ベストナインの東大・大原海輝「率直にうれしい」　53季連続最下位の東大から2季連続で選出【東京六大学野球】,https://news.yahoo.co.jp/articles/69c0f8501fd40675ace3f6b036481d3e8d619464,6/2(日) 21:25
chuspo,中日スポーツ,【中日2軍】辻本倫太郎が勝ち越し右前打「最低限の打撃ができればと思っていた」アピールのマルチ安打,https://news.yahoo.co.jp/articles/28b90999242a055f52ff6eae791bdea0ca2f1fe3,6/2(日) 21:24
chuspo,中日スポーツ,【中日2軍】宇佐見真吾「結果にこだわって」同点打　「逆方向への意識を持っていたのがよかった」,https://news.yahoo.co.jp/articles/af23cc5a223c12c71581a03814c3535fde4664cc,6/2(日) 21:19
chuspo,中日スポーツ,慶大・清原ジュニアが一塁手として初のベストナイン選出　打率と打点でチームトップ【東京六大学野球】,https://news.yahoo.co.jp/articles/c308cf644d102653893f4a08f45d3b77a9c5e81c,6/2(日) 21:03
chuspo,中日スポーツ,【中日2軍】高橋周平、マルチ安打に「結果も出た、内容もよかった」　井上2軍監督「1軍から声が掛かればいつでも」,https://news.yahoo.co.jp/articles/20108536f74a6e1b940f80e015dee10729a3c085,6/2(日) 21:03
chuspo,中日スポーツ,元『アンジュルム』竹内朱莉、「プライベートしか見せていない仕事」　スカパー！『生たけ』特別版収録取材会,https://news.yahoo.co.jp/articles/84d04a7c24cf3efe2303a0cf2206596d281b501f,6/2(日) 21:00
chuspo,中日スポーツ,早大エース伊藤樹が胴上げ投手「気持ちが空回りして…」四球出すも最後は締める【東京六大学野球】,https://news.yahoo.co.jp/articles/3d6d59233d5ca569aad82a892cd61ea4aecce47d,6/2(日) 20:57
chuspo,中日スポーツ,東海学園大、愛知東邦大に連勝で4季ぶり1部昇格決定【愛知大学野球1部2部入れ替え戦】,https://news.yahoo.co.jp/articles/c3657b00140bcfde1f8191ffb5e1b4f93709026a,6/2(日) 20:55
chuspo,中日スポーツ,早大が単独トップ47度目の優勝　小宮山監督、ロッテ時代の背番号にちなみ14度宙に舞う【東京六大学野球】,https://news.yahoo.co.jp/articles/12bfcc4a124a9175d2ec2287ea189a2142e11886,6/2(日) 20:54
chuspo,中日スポーツ,プロ注目の愛工大名電・石見颯真、2安打＆好守備「今までは打撃で評価…夏へ『守備もできる』と証明」【高校野球】,https://news.yahoo.co.jp/articles/c767c036d3b738050068a05d0f5ff1a587147066,6/2(日) 20:53
chuspo,中日スポーツ,全日本大学野球選手権の出場27校出そろう　連覇目指す青学大は2回戦から登場【大学野球】,https://news.yahoo.co.jp/articles/8a8d601ec7308b1048e235037e47fbf8095e10c7,6/2(日) 20:47
chuspo,中日スポーツ,パリ五輪女子マラソン代表・前田穂南、「しっかり準備したい」自身2度目の出場に「すごく楽しみ」,https://news.yahoo.co.jp/articles/d48996cad323fa10eb83f4b9316ad2c9ebaed1e1,6/2(日) 20:43
chuspo,中日スポーツ,「BALLISTIK BOYZ」松井利樹、「やっと来たか！」　11月6日に初の日本武道館公演開催を発表,https://news.yahoo.co.jp/articles/2f6463ca3c2dc771f389deaf4940437b2c6010e7,6/2(日) 20:30
chuspo,中日スポーツ,岩田剛典、フェス登場で驚きの告白「めちゃくちゃ歌詞を間違えちゃう」「結構カンペを見ちゃう」,https://news.yahoo.co.jp/articles/2c110c267f7b1a99bfe6411dc8afe24ba5921b71,6/2(日) 20:28
chuspo,中日スポーツ,井筒親方、妻へ感謝の断髪式「相撲をやめたいと思ったとき…」異例の長さのあいさつで思いのたけを語る【大相撲】,https://news.yahoo.co.jp/articles/583b1f1ec52c44e7bbeed042bc512a2a4c8c8538,6/2(日) 20:18
chuspo,中日スポーツ,名古屋オーシャンズ、今季開幕戦でしながわに敗れる　吉川智貴「自分たちのミスから4失点では厳しい」【Fリーグ】,https://news.yahoo.co.jp/articles/0232dc77d717218c2e0451bbf5f7dccfe4706a7f,6/2(日) 20:14
chuspo,中日スポーツ,【中日】松山晋也が雪辱果たす三者凡退「やり返すことができたのは僕の中でも成長になった」,https://news.yahoo.co.jp/articles/9df269f63369da0799b5af341bf36894e28b6fff,6/2(日) 20:11
chuspo,中日スポーツ,【中日】藤嶋健人が2死満塁ピンチで登板、気合の無失点　得点圏打率4割超の太田を三振斬り,https://news.yahoo.co.jp/articles/95e3586dc36737b2a9d1de06455a65a81e688a15,6/2(日) 20:09
chuspo,中日スポーツ,中日・田中幹也、立浪監督からの『1週間チャレンジ』達成　延長12回には先頭で右前打「何としてもの思いでした」,https://news.yahoo.co.jp/articles/3c876dd3b7e99e0529d15d4bcb1c3a1ba0456b42,6/2(日) 20:08
chuspo,中日スポーツ,【中日】梅野雄吾が移籍後初勝利　延長11回を強気の3人斬り「うれしい。ただそれだけですね」,https://news.yahoo.co.jp/articles/45d4f8e264ffcbee6b02679612a4dd425eb5ff17,6/2(日) 20:04
chuspo,中日スポーツ,中日・清水達也、ピンチの場面で高校の先輩・若月を空振り三振「相手が誰であれゼロに抑えることができた」,https://news.yahoo.co.jp/articles/5e954218ba5af30fc3706b5d23abbca245902af4,6/2(日) 20:04
chuspo,中日スポーツ,【中日】リーグトップ17セーブのマルティネス「先頭を絶対に打ち取る」前日の反省生かした157キロ,https://news.yahoo.co.jp/articles/77f8aeea12b0fed2d8336f141a83842492f36028,6/2(日) 20:02
chuspo,中日スポーツ,中日・立浪監督、決勝二塁打の中田翔に「よく打ってくれた」移籍後初勝利の梅野「大事な場面で抑えてくれた」【語録】,https://news.yahoo.co.jp/articles/eaec8a98e88c3fb66c70b38e67ec1c76c97b28d5,6/2(日) 19:59
chuspo,中日スポーツ,【広島】4連敗で首位陥落も新井監督「たくさん収穫もあった」好守備と救援陣の奮闘に前を向く,https://news.yahoo.co.jp/articles/15c6398fb5ea96f432c833b4ca3cdab3429a0adc,6/2(日) 19:57
chuspo,中日スポーツ,「感性でやってたゴルフが変わった」新垣比菜の成長を認める青木コーチ「我慢できるようになった」【記者の目】,https://news.yahoo.co.jp/articles/f67fda6b426cdb20b743863763ed771d1d2883ee,6/2(日) 19:47
chuspo,中日スポーツ,中村雅俊、本番前に緊張？「キャリアを積めば積むほど何かしらのプレッシャー感じる」　芸能生活50周年記念公演が開幕,https://news.yahoo.co.jp/articles/da06b2056b11dae0cb969b8713d44961e5b3986b,6/2(日) 19:46
chuspo,中日スポーツ,名古屋グランパス、序盤の連続失点が響き川崎に敗れる　後半、１点返すも追いつけず,https://news.yahoo.co.jp/articles/c6aa6289aaf8d87fc1b1f882ff8b234d4d5b661c,6/2(日) 19:14
chuspo,中日スポーツ,ロマンチックウォリアー、内に1頭分だけできたスペースに突っ込み頂点へ　海外遠征馬18年ぶりの凱歌【安田記念】,https://news.yahoo.co.jp/articles/76b37b9346424842eac6566f593b6f1283b300f8,6/2(日) 18:50
chuspo,中日スポーツ,パリ五輪OA候補のDF板倉滉、「非常にうれしく、光栄」も「何も言えない。自分で決めることじゃない」【サッカー】,https://news.yahoo.co.jp/articles/5981137415511f64ffb69043501ba55e9beeedb4,6/2(日) 18:46
chuspo,中日スポーツ,女子ゴルフ・新垣比菜、6年ぶりツアー2勝目　キャディー務めた兄の涙に「私もグッと…」とうれし泣き,https://news.yahoo.co.jp/articles/6007253345695e7f89df9a612be3d50dbaec98cc,6/2(日) 18:40
chuspo,中日スポーツ,ヴァイッジバブルは17着　パートン「勝ち馬の外を取れたけど、直線は伸びなかった」【安田記念】,https://news.yahoo.co.jp/articles/35f421b5dae4a062d4eedcb62048b5925ef40d7c,6/2(日) 18:40
chuspo,中日スポーツ,【川又米利の目】梅津晃大の落ち着きを評価「続けていければ、どんどん勝っていける」6回の村松開人のミスには厳しい指摘も,https://news.yahoo.co.jp/articles/2c0330c2ff30339a5608f5e006ad8aff1da4ec4c,6/2(日) 18:29
chuspo,中日スポーツ,今季最多5発で連勝　木村勇大が先制PK含む2発「15点20点と上を見てやっていきたい」【東京V】,https://news.yahoo.co.jp/articles/f8ab6d5afe538569052b70643ed90ac4a792abf9,6/2(日) 18:19
chuspo,中日スポーツ,ファイターズガール「きつねダンス」の亜種、「カマキリダンス」爆誕　YouTubeでも1日足らずで20万回超え再生,https://news.yahoo.co.jp/articles/e9b708cc0cd784ac3bdc2907ea656185b72bb475,6/2(日) 18:11
chuspo,中日スポーツ,サッカー日本代表・堂安律、結婚相手とのツーショット公開　フォロワーから祝福の声「新婚さんの雰囲気に圧倒されます」,https://news.yahoo.co.jp/articles/7059cabfedcba1b99563dd34e9a6381718eea1b9,6/2(日) 18:10
chuspo,中日スポーツ,「春日の習性」生かしたゲームで〝研究者〟と若林が対決、結果は？【日本テレビ系「オドぜひ」】,https://news.yahoo.co.jp/articles/0956a08ce8bda8b32e5e22fea28e05f177295b62,6/2(日) 18:00
chuspo,中日スポーツ,【ＮＨＫ朝ドラ『虎に翼』３日は】直談判にやってきた寅子。人事課にいたのは・・・,https://news.yahoo.co.jp/articles/58e4c30fb3b538fa8780e38d6695d84bfceb2d72,6/2(日) 18:00
chuspo,中日スポーツ,【巨人】秋広優人が復帰即スタメンで打線点火の左前打　試合会場向かう車内で相手投手の映像チェック,https://news.yahoo.co.jp/articles/364ab21e8ae4c35b37b2602ec087e874f5aba5f7,6/2(日) 17:52
chuspo,中日スポーツ,巨人・菅野智之、7イニング無失点で無傷の5勝目　好調の要因に『チーム全体の成長』挙げる,https://news.yahoo.co.jp/articles/0ee113b60b2c7083c82020ae4189f27cc73df181,6/2(日) 17:51
chuspo,中日スポーツ,【巨人】坂本勇人が2試合連続の欠場　阿部監督「腰がちょっと重かったみたい」4日ロッテ戦から復帰へ,https://news.yahoo.co.jp/articles/e17f29e7e413e3b737bf3ba143ac67bf8f41f744,6/2(日) 17:49
chuspo,中日スポーツ,ソウルラッシュ、3着も悔いなし　早めの仕掛けにモレイラ「勝ち馬に勝負をしていきました」【安田記念】,https://news.yahoo.co.jp/articles/952fd9813c847072fc2dd8c94bd5071e125e7471,6/2(日) 17:46
chuspo,中日スポーツ,ナミュール、”鬼脚”見せ2着確保　2度目のコンビの武豊「惜しかった。残念。悔しい」【安田記念】,https://news.yahoo.co.jp/articles/2192dfd9fe351d2791f02f69de5a577908935b01,6/2(日) 17:41
chuspo,中日スポーツ,【ヤクルト】石川雅規がプロ野球新の新人年から23年連続勝利「1人でできることではない。みなさんに感謝」,https://news.yahoo.co.jp/articles/ccbc432474c6aa20d3f988e01f08fe961ef85cef,6/2(日) 17:41
chuspo,中日スポーツ,ヤクルト・村上宗隆、セ・リーグトップの13号2ラン　チームも連敗ストップ「勝てたことが一番大きかった」,https://news.yahoo.co.jp/articles/e507f1a6aa31cf3939a8eed365eedd00e29eebe3,6/2(日) 17:36
chuspo,中日スポーツ,香港のロマンチックウォリアーがV　来日初勝利のマクドナルド「大変名誉なこと」【安田記念】,https://news.yahoo.co.jp/articles/cb4658a37a7e7e863671f90dd659060a6ea0ad23,6/2(日) 17:29
chuspo,中日スポーツ,今年は元・ドラゴンズ監督の谷繁元信さん参加　「WFP　ウォーク・ザ・ワールド　名古屋」開催,https://news.yahoo.co.jp/articles/2543bdc586a5f11b744ca82c5959ca5e94139f65,6/2(日) 17:25
chuspo,中日スポーツ,門脇誠が5月10日以来の安打「この先いろいろと変わるような1本」阿部監督が試合前に助言【巨人】,https://news.yahoo.co.jp/articles/cde47848b9302a99f63ae064ecf4946a757f3afc,6/2(日) 17:19
chuspo,中日スポーツ,元騎手の「コバテツ」小林徹弥さん死去、50歳　千田師「急過ぎて何とも言えない」【競馬】,https://news.yahoo.co.jp/articles/15aa2e89f97a63b4bf1ec70436aa099ecf07f69d,6/2(日) 17:12
chuspo,中日スポーツ,中日、終盤に勝負強さ発揮し2連勝でカード勝ち越し　延長12回に中田翔の適時二塁打,https://news.yahoo.co.jp/articles/a2ee217187cdfce243df5c7a2857e88fcd6ca904,6/2(日) 17:11
chuspo,中日スポーツ,アンカツさん、ロマンチックウォリアーは「抜け出す時の脚が一流やね」安田記念での勝因分析　宝塚記念の出走も期待,https://news.yahoo.co.jp/articles/fea3c67ee0d84610724064f9cc15edcabde2e306,6/2(日) 16:45
chuspo,中日スポーツ,石田純一＆いしだ壱成、お騒がせ親子が10年ぶり共演 父は結婚３度、息子は４度目の結婚を目指す,https://news.yahoo.co.jp/articles/b0f372063048b8780c5457d918456c34aa74364e,6/2(日) 16:42
chuspo,中日スポーツ,安田記念・マクドナルド騎手「レース前から勝つ自信はありました」ロマンチックウォリアー、有言実行の勝利,https://news.yahoo.co.jp/articles/8d125a49cf5774d04571b91e1265f48879aa82c5,6/2(日) 16:42
chuspo,中日スポーツ,早大、リーグ単独最多47度目の優勝　慶大に逆転勝ちで連勝、完全Vで飾る【東京六大学野球】,https://news.yahoo.co.jp/articles/be9455c7d0c4f5339cdf17a15db7971e75b6a339,6/2(日) 16:39
chuspo,中日スポーツ,阪神・才木浩人が完封、ロッテ12連勝を阻止！ 交流戦初勝利にファン歓喜「大大大大大大エース」「銅像を建てろ」,https://news.yahoo.co.jp/articles/4192d12c533374bc96dc15cf61c04076a56f913e,6/2(日) 16:36
chuspo,中日スポーツ,ロッテ、5試合連続『9回の奇跡』ならず　無死一、二塁のチャンスつくるも…ソト併殺打、ポランコは二ゴロで連勝ストップ,https://news.yahoo.co.jp/articles/4943b7dd096e6c2356dfacda2b1844cae3ba5e45,6/2(日) 16:34
chuspo,中日スポーツ,橋本大輝、負傷の右手は順調に回復 ２大会連続の五輪金メダルへ「焦ることが一番邪魔」【体操】,https://news.yahoo.co.jp/articles/430be7494f566460c51a8696b2fae51fd79dbee2,6/2(日) 16:27
chuspo,中日スポーツ,女子ゴルフ・高橋彩華「今夜は行きつけの焼き肉屋さんでおなかいっぱい食べたい」地元での2位、自身に“ご褒美”,https://news.yahoo.co.jp/articles/9273ed042abdc2f9067ae026e301b96a95a99b97,6/2(日) 16:27
chuspo,中日スポーツ,女子ゴルフ・宮里美香、今季ベスト5位「雨でもリズムを狂わせずにプレー」全米女子オープンに懐かしさと刺激,https://news.yahoo.co.jp/articles/182ac485197df3d06ae36c6fe8d5a515cab5d95b,6/2(日) 16:24
chuspo,中日スポーツ,鈴木誠也、３点タイムリーエラー→満塁弾のジェットコースターぶりに米メディア困惑 「過去最高にクレージーなイニング」「得失点差は＋１だ」,https://news.yahoo.co.jp/articles/fd56799b6f97d854bb4a0985642305d5c2328dda,6/2(日) 16:23
chuspo,中日スポーツ,女子ゴルフ・笹生優花、“男子ばり”スーパーショットで優勝争いに踏みとどまる「運もあったって感じ」,https://news.yahoo.co.jp/articles/03dd4f14708e00edc3d785eb0ff96e49a8a31fa1,6/2(日) 16:17
chuspo,中日スポーツ,女子ゴルフ・8位浮上の竹田麗央　同組の”あこがれの人”から「日本語を教えて」優しさに感激【全米女子オープン】,https://news.yahoo.co.jp/articles/04a5a15fba3dd62ee344b77dac9c71d58fd227d6,6/2(日) 16:14
chuspo,中日スポーツ,ロマンチックウォリア―、圧倒的な強さに競馬ファン驚嘆 「いやー凄いものを見ました」「これだけの馬をよくぞ」【安田記念】,https://news.yahoo.co.jp/articles/719e6b22437863aa0ae17a83d73531912006d07c,6/2(日) 16:14
chuspo,中日スポーツ,安田記念、香港のロマンチックウォリアーが勝利 G１を５連勝,https://news.yahoo.co.jp/articles/8cc01ae7aadaea0e8fe470c5944377aa1b740c8a,6/2(日) 16:11
chuspo,中日スポーツ,大谷翔平の三盗失敗、ドジャース監督は擁護「投手の傾向、うまくはまらなかった」「計算されたリスク、翔平は素晴らしい」,https://news.yahoo.co.jp/articles/f5cda16f875fb2883dffe5a17f2597bc46ba5a9d,6/2(日) 16:11
chuspo,中日スポーツ,巨人、３カード連続勝ち越しで貯金４ 菅野智之は７イニング無失点で無傷の５勝目,https://news.yahoo.co.jp/articles/e756c499132d4876fb59b06f68dbb3abe7661c7c,6/2(日) 16:08
chuspo,中日スポーツ,【女子ゴルフ】渋野日向子、奇跡のようなバーディーで全米OP４位浮上 「ちょっと待ってたら」照れ笑い,https://news.yahoo.co.jp/articles/16bc6fa9654d8aada760686e939a39921898d2c9,6/2(日) 16:02
chuspo,中日スポーツ,54歳・渡辺美奈代、「フランス人形みたい」フリフリワンピース姿に…「20代の女の子より20代」ファン驚きと歓声,https://news.yahoo.co.jp/articles/4130dbfbb9bdb68241c5ec6aacba0f0b8a86feba,6/2(日) 16:00
chuspo,中日スポーツ,カブス鈴木誠也、『究極の罪滅ぼし』だった　同じイニングはおろか「3点を許すエラーを犯した試合で満塁アーチ」はメジャー史上初,https://news.yahoo.co.jp/articles/2043792a29ec5f4613c4505bf2842c26f90ebf00,6/2(日) 15:54
