media_en,media_jp,title_articles,link_articles,date_original
mrt,MRT宮崎放送,2連覇の快挙!　パリ五輪柔道男子81キロ級　永瀬貴規選手（旭化成）が金メダル,https://news.yahoo.co.jp/articles/90bf104a44f7338ad89c2a9fbb543ad14a323c24,7/31(水) 12:09
mrt,MRT宮崎放送,串間市で35.6℃など　宮崎県内は各地で午前中で猛暑日となる危険な暑さ　熱中症警戒アラートが発表（31日午前11時半現在）,https://news.yahoo.co.jp/articles/e040d7970870bf1164034ae70a24187251fd0f97,7/31(水) 12:06
mrt,MRT宮崎放送,マンドリルの赤ちゃん 一般公開はじまる　宮崎市フェニックス自然動物園,https://news.yahoo.co.jp/articles/2c11f892b0ed8618e06e793d835d14ec5298928c,7/31(水) 12:06
mrt,MRT宮崎放送,寝苦しい夜が続く「昔は扇風機で眠れたのに・・・」何が違う?気象予報士に聞いてみた,https://news.yahoo.co.jp/articles/4a7c34be0ce8e888845c0d9b5c605d62905c725d,7/31(水) 11:32
mrt,MRT宮崎放送,OBにはあの俳優も　宮崎南高校演劇部「全国高校総合文化祭」の舞台に臨む,https://news.yahoo.co.jp/articles/80d11423ea35eeeedeb535abab696120edf26c1b,7/31(水) 11:02
mrt,MRT宮崎放送,7/31（水）宮崎県内の交通取り締まり情報,https://news.yahoo.co.jp/articles/94e04d0fa7735784b2ff66f1b9214c4dc49b83e8,7/31(水) 6:02
mrt,MRT宮崎放送,診療報酬76万円余りを不正請求　延岡市の歯科医院の保険医療機関指定を取り消し,https://news.yahoo.co.jp/articles/28101af0a323cb4e0bd537a28f572b0e38fcbf21,7/30(火) 19:02
mrt,MRT宮崎放送,宮崎市で観測史上最高の38.2℃　宮崎県内は危険な暑さ続く　水浴びや凍らせたペットボトルなど動物園の動物も暑さ対策　31日も最高38℃の予想も,https://news.yahoo.co.jp/articles/e17d0d205bcf55d2ed183a93a0ff70bc21f91c4e,7/30(火) 19:02
mrt,MRT宮崎放送,北部九州インターハイ　ホッケー競技女子　高鍋は宮崎県勢初の3位に　陸上男子棒高跳びで結城咲翔選手（宮崎第一）が優勝,https://news.yahoo.co.jp/articles/5b497fcd6368d4a64e1f9c328b503827a2b4c79a,7/30(火) 19:02
mrt,MRT宮崎放送,「お互いにコミュニケーションで仲を深めていきたい」韓国から訪れた児童・学生と延岡市の中学生が交流,https://news.yahoo.co.jp/articles/a0f8f8db24ae12d84bb43973509d23f255e5e035,7/30(火) 18:58
mrt,MRT宮崎放送,生徒から様々な新しいビジネスのアイデアが　宮崎市の宮崎日大高校でキャリア教育の授業,https://news.yahoo.co.jp/articles/ebb66a890988f8cacd30834176684dcfec00a7fc,7/30(火) 18:58
mrt,MRT宮崎放送,夏休み中の子どもたちがえびの市で農家の仕事を体験,https://news.yahoo.co.jp/articles/c7e2115c2bec0388c84be54ee0dd78b36dd156e5,7/30(火) 18:58
mrt,MRT宮崎放送,農山漁村に観光客が宿泊する「農泊」を推進　「みやざき農泊ネットワーク会議」が初会合,https://news.yahoo.co.jp/articles/1e586906e8170fad36a3b5e2aae02fdad674c7c0,7/30(火) 18:58
mrt,MRT宮崎放送,自由な発想で市政に提案を　日南市で「子ども議会」,https://news.yahoo.co.jp/articles/87a642506e1d697f892f0d5769d5fa0fe964a819,7/30(火) 18:58
mrt,MRT宮崎放送,パリ五輪　馬術総合団体　日本が92年ぶりにメダル獲得　「初老ジャパン」を支えた土屋毅明さん（宮崎市出身）に聞く,https://news.yahoo.co.jp/articles/ea01c00f84b703e485294fb3f4c91332ef64b4cf,7/30(火) 17:41
mrt,MRT宮崎放送,宮崎市で観測史上最高の38.2℃を記録,https://news.yahoo.co.jp/articles/5416874ed96b52106a821032bb039c38d7b3546a,7/30(火) 15:31
mrt,MRT宮崎放送,3年ぶり6度目　夏の甲子園へ　宮崎商 選手・監督に聞く,https://news.yahoo.co.jp/articles/e87b25472ced2ad41105d5e6cb249d45cd1c80ea,7/30(火) 15:01
mrt,MRT宮崎放送,宮崎牛のプロモーション事業　「交通広告グランプリ」で優秀賞を受賞　宮崎県が首都圏の駅を中心に展開,https://news.yahoo.co.jp/articles/f93cc97eb3b8f054eaaa3aa727688a9a2d6d39b1,7/30(火) 12:06
mrt,MRT宮崎放送,宮崎県内は危険な暑さ続く　日南市油津で36.4℃など猛暑日　熱中症警戒アラートが発表　涼しい場所で過ごし、こまめな水分や塩分の補給を（30日午前11時半現在）,https://news.yahoo.co.jp/articles/9ea6f0a589c75f9f010f6d5465c5e2abd23024e5,7/30(火) 12:06
mrt,MRT宮崎放送,宮崎県で震度4のやや強い地震　大きな被害はなし　専門家「南海トラフ地震との関連は気にするほどではない」,https://news.yahoo.co.jp/articles/4514351af75a8f7dc2f9782be91a9e4a48b833fe,7/30(火) 12:06
mrt,MRT宮崎放送,宮崎県で最大震度4のやや強い地震　宮崎県・西都市、高千穂町、宮崎市【地震発生時の動画】 専門家「南海トラフ地震との関連を気にするほどの地震ではない」,https://news.yahoo.co.jp/articles/7a1be9193648c7d7ae3baf26fe3532d0c18d029c,7/30(火) 1:36
mrt,MRT宮崎放送,厳しい暑さに米の生育にも影響が・・・　美郷町神門37.4℃ 宮崎市田野で37.0℃など　宮崎県内は猛暑日,https://news.yahoo.co.jp/articles/742e7c61a85ec840def5e42dbbb38cf75be884bf,7/29(月) 19:02
mrt,MRT宮崎放送,動物の殺処分をなくすために　宮崎県と動物愛護団体の意見交換会が初開催,https://news.yahoo.co.jp/articles/cc7ee373cfcb84c6818d3570ebe9c191443e06e2,7/29(月) 19:02
mrt,MRT宮崎放送,2027年宮崎国スポ・障スポ 大会イメージソング「ひなたのチカラ」のレコーディングが完了　特別バンドのメンバー「音楽を通して一つになる、そんな楽曲」,https://news.yahoo.co.jp/articles/9c3cedba03f37888cf16c2c0a3290e4b295614c1,7/29(月) 19:02
mrt,MRT宮崎放送,全国高校総体　男子ソフトボール2回戦　日向工（宮崎県代表）は惜敗,https://news.yahoo.co.jp/articles/6a0ea4a6e0b873aa4fa1b11a65dd0a82dca2dcb7,7/29(月) 18:58
mrt,MRT宮崎放送,パリ五輪　バレーボール男子・甲斐優斗選手が五輪デビュー　地元・延岡市では家族はじめ市民がパブリックビューイングで声援,https://news.yahoo.co.jp/articles/7b2ffc1ae8be28f74778b94d207246f8a6ae8385,7/29(月) 18:58
mrt,MRT宮崎放送,JR日向市駅が10月末まで「日向坂46」駅に「ひなたフェス2024」盛り上げへ　記念切符の発売も,https://news.yahoo.co.jp/articles/1276775e613d0e97bdaada2bbc43b41665c125f9,7/29(月) 18:34
mrt,MRT宮崎放送,SNS型投資詐欺の被害者などから送金を受け指示役の会社に暗号資産として送金　資金決済法違反容疑で女を再逮捕,https://news.yahoo.co.jp/articles/ee3019af3d7782d57fdbd9cac57de14ad2b9d0f8,7/29(月) 16:26
mrt,MRT宮崎放送,覚せい剤を所持、譲渡　えびの市と都城市の男2人を逮捕,https://news.yahoo.co.jp/articles/d86903eef0fe2fec43d8ce549235c8fb1c589b0b,7/29(月) 14:34
mrt,MRT宮崎放送,3年ぶり6度目 夏の甲子園出場　宮崎商業で野球部の壮行式,https://news.yahoo.co.jp/articles/9a2506216c4c9dcb8a0af05dcac4df6d7ae51c72,7/29(月) 12:06
mrt,MRT宮崎放送,地域住民が小学生の宿題をサポート　都城市志和池地区の「夏休み寺子屋サロン」,https://news.yahoo.co.jp/articles/046cd767f5b28231b333717315f3c133b3548da2,7/29(月) 12:06
mrt,MRT宮崎放送,地元の情報や魅力を取材・発信　小林市で「高校生記者クラブ」の任命式,https://news.yahoo.co.jp/articles/b6dd6735ba62814721756aa2b87a9cee3931a440,7/29(月) 12:06
mrt,MRT宮崎放送,北部九州インターハイ　少林寺拳法組演武で都城高校が男女V　今大会県勢初優勝!,https://news.yahoo.co.jp/articles/1b7aea4a64bd60713f4c067a2e624475e23b069c,7/28(日) 18:17
mrt,MRT宮崎放送,無病息災や五穀豊穣願い　えびの市で400年以上続く伝統行事「牛越祭」,https://news.yahoo.co.jp/articles/04b9c20b997dd518cc5c01be044f58010f2bec38,7/28(日) 18:14
mrt,MRT宮崎放送,大人顔負けの巧みな話術　日向市でこども落語全国大会,https://news.yahoo.co.jp/articles/2c950bd833f77b73b125109e8d532b705c860499,7/28(日) 18:11
mrt,MRT宮崎放送,ものづくりの楽しさ知って　宮崎市でレゴブロック教室,https://news.yahoo.co.jp/articles/58a5613161e228f5757ab10d674311f82344f093,7/28(日) 18:08
mrt,MRT宮崎放送,盛況!えれこっちゃみやざき　市民総踊りに約3500人,https://news.yahoo.co.jp/articles/69e422ee876d13d6c94554162e993e50ea51984c,7/28(日) 11:56
mrt,MRT宮崎放送,サッカーJ3第23節　テゲバジャーロ宮崎　結果,https://news.yahoo.co.jp/articles/a04d2b31f4b2cb12d1b8120892d47feb12164cfa,7/28(日) 11:49
mrt,MRT宮崎放送,まつりえれこっちゃみやざき2024始まる,https://news.yahoo.co.jp/articles/c3495f0f09dfcfda99ea1d9bbe77d4932cc59eb1,7/27(土) 17:54
mrt,MRT宮崎放送,北部九州インターハイ　女子バレーボール競技　都城商はベスト16に,https://news.yahoo.co.jp/articles/f0ef24fc6b6f28c5ee2a7b68c1872f06ea5b02a5,7/27(土) 17:53
mrt,MRT宮崎放送,西米良村の市房山で滑落事故　福岡市の男性死亡,https://news.yahoo.co.jp/articles/e79912a7fbeab718e9d0b769f05c381858925d71,7/27(土) 14:16
mrt,MRT宮崎放送,マリンスポーツを体験して海の環境問題について学ぶイベント,https://news.yahoo.co.jp/articles/e642e54d3a9c5331ed0a55d4e8b980ab62d8b841,7/27(土) 12:17
mrt,MRT宮崎放送,戦争の悲惨さを後世に　原爆と戦争・宮崎空襲展,https://news.yahoo.co.jp/articles/fd4a30dbbe3a6eff294355c0ad4f765fb8b570a7,7/27(土) 12:14
mrt,MRT宮崎放送,パリ五輪開幕　宮崎県関係の選手7人が世界に挑む,https://news.yahoo.co.jp/articles/52b4b43bd85d72c7a115c03f1100fdccb4b01243,7/27(土) 12:08
mrt,MRT宮崎放送,相続手続きの統一化へ　宮崎銀行・高鍋信用金庫・延岡信用金庫が協定を締結,https://news.yahoo.co.jp/articles/5eb126e1dada11d59344bd71261466cafb41b546,7/26(金) 19:16
mrt,MRT宮崎放送,大雨による土砂崩れで通行止め続く県道西都南郷線　整備進む仮設の橋を7月31日から供用開始へ,https://news.yahoo.co.jp/articles/15968cd91376bb0bbb740ec79b1646326468d87c,7/26(金) 19:13
mrt,MRT宮崎放送,日向市長選の開票に絡む市選管職員に対する名誉棄損の罪　市長選に落選した被告「名誉毀損にはあたらない」　初公判で争う姿勢を示す,https://news.yahoo.co.jp/articles/5abde2daad86464d1b1e0517beac3e789170a8b1,7/26(金) 19:13
mrt,MRT宮崎放送,27日・28日開催「まつりえれこっちゃ宮崎」　交通規制を実施　混雑やバスの迂回に注意を,https://news.yahoo.co.jp/articles/c4c68d18fd4fc4beb7cb2268c242c05f0be38c22,7/26(金) 19:13
mrt,MRT宮崎放送,稲作を後世に伝え豊かな実りに感謝する伝統神事　鵜戸神宮の「抜穂祭」,https://news.yahoo.co.jp/articles/c25c162a3ae2dbceb6e7ad4d70f8c6d363585e3e,7/26(金) 19:13
mrt,MRT宮崎放送,決勝にふさわしい好ゲーム!　夏の高校野球県大会は宮崎商が優勝　3年ぶりの甲子園出場を決める　決勝戦　富島 vs 宮崎商,https://news.yahoo.co.jp/articles/2a9d2e25cdcf7166d6d975ecdcd109324a4ce558,7/26(金) 19:13
mrt,MRT宮崎放送,小学生が銀行やお金について学ぶ　宮崎市で金融機関によるサマースクール,https://news.yahoo.co.jp/articles/7c1da5053e5406f37acf8a7ff7eda71ad3883989,7/26(金) 19:09
mrt,MRT宮崎放送,宮崎市では平年よりも4.2度高く　九州南部の7月上旬の平均気温　統計開始以降79年間で最も高い記録的な高温に,https://news.yahoo.co.jp/articles/7d88e9ecd3d5fae852d27bf8a5b28d8622b5eff1,7/26(金) 17:19
mrt,MRT宮崎放送,夏の高校野球宮崎県大会　決勝戦　宮崎商が優勝,https://news.yahoo.co.jp/articles/c831bfc71dcf6ca9fabfd549bf1af0190be9753b,7/26(金) 12:06
mrt,MRT宮崎放送,「足湯の駅 えびの高原」がグランドオープン　えびの高原のさらなる集客力アップに期待,https://news.yahoo.co.jp/articles/aa2d8c18ee6ac81e515e11eaa957fe4eef2ae307,7/26(金) 12:02
mrt,MRT宮崎放送,宮崎県のスギ丸太生産量　33年連続で日本一に,https://news.yahoo.co.jp/articles/ea04f2085f14b31c9231c82f2a196a5e92d93cb5,7/26(金) 12:02
mrt,MRT宮崎放送,「花嫁様に喜んでいただきたくて花嫁様の理想を詰め込んで作りました」全国からカップルが訪れるウェディング専門フォトスタジオ,https://news.yahoo.co.jp/articles/209e59e3745d472bbe2ea367293dcf359902cd43,7/26(金) 10:01
mrt,MRT宮崎放送,あす26日決勝　夏の高校野球宮崎県大会　富島と宮崎商業の戦力を分析,https://news.yahoo.co.jp/articles/0b1b8ad1aba5727daf2dc172f2708c5e660d81f7,7/25(木) 19:02
mrt,MRT宮崎放送,「芸能人と連絡を取り続けるために電子マネーを買わないといけない」とっさの判断でコンビニ店員が詐欺被害を未然に防ぐ,https://news.yahoo.co.jp/articles/f860f5c45e2e26e640bebb37c7f6741de4b0c239,7/25(木) 19:02
mrt,MRT宮崎放送,延岡市の小学生が離島で「海の恵み」について学ぶ,https://news.yahoo.co.jp/articles/041cbdb8938f96569fd196a46cff03547288328f,7/25(木) 19:02
mrt,MRT宮崎放送,新型コロナ　宮崎県内の患者数 依然多い状態続く　知事「ポイントを押さえた対策」を,https://news.yahoo.co.jp/articles/e9177de70b5ab4e493ef662372ba0a3fc106ba65,7/25(木) 19:02
mrt,MRT宮崎放送,救急車足りず一旦、消防車で現場に向かい救護を行うケースも　熱中症に新型コロナで救急車の出動件数が急増,https://news.yahoo.co.jp/articles/a6e5b6aa1f594ae4e528f1c6e07b9c76adada880,7/25(木) 19:02
mrt,MRT宮崎放送,綾町の綾北川で遺体発見　川遊び中に行方不明になった男性か,https://news.yahoo.co.jp/articles/d6bb5c40402e393a6e31985beb6623156586ecde,7/25(木) 17:51
mrt,MRT宮崎放送,新型コロナの5類移行後の地域振興など16項目　宮崎県商工会議所連合会が県に商工業振興や地域経済の活性化を要望,https://news.yahoo.co.jp/articles/12c29209ecd82e764d2e34d03c1c96ec527f65ea,7/25(木) 17:29
mrt,MRT宮崎放送,夏休み恒例!　串間市でニジマス釣り大会　子どもたちでにぎわう,https://news.yahoo.co.jp/articles/fb8e7621bbd85544dab6dac3cf22a4826718ceb5,7/25(木) 17:16
mrt,MRT宮崎放送,胸部食道がんで療養のため辞職　前の川南町長　東高士さん死去,https://news.yahoo.co.jp/articles/29c62cd29a7c3702c818258d88eaec95b8a55605,7/25(木) 17:12
mrt,MRT宮崎放送,宮崎市の商業施設で強盗事件を想定した訓練,https://news.yahoo.co.jp/articles/c9cf32a5963714c52ec89d0f5310161990fa069e,7/25(木) 12:02
mrt,MRT宮崎放送,プロ野球オールスターゲーム第2戦　巨人 戸郷翔征投手（都城市出身）が登板,https://news.yahoo.co.jp/articles/8b59bbe71cca05cf0af4bee78dbeeaa3a29c1cfa,7/25(木) 12:02
mrt,MRT宮崎放送,宮崎県のアンテナショップ「みやざき館KONNE」　大阪・梅田の商業施設「KITTE大阪」出店へ　1年間限定で今月31日開業,https://news.yahoo.co.jp/articles/643b17cb91ea6714cea91bc4bc15e20917941403,7/25(木) 12:02
mrt,MRT宮崎放送,「同じ失語症の人のために・・・」元アナウンサーが「話し方教室」を開講した思い,https://news.yahoo.co.jp/articles/e92039b86433727e0459ba675cd7be67cccfa5f3,7/25(木) 11:02
mrt,MRT宮崎放送,インターハイで笑顔の勝利を　九州予選で15年ぶりの優勝　高鍋女子ホッケー部,https://news.yahoo.co.jp/articles/fc1d516ba354e04741e96b6229ac96244f2b1ada,7/25(木) 11:02
mrt,MRT宮崎放送,健やかな成長と火や水の災いを招かないよう願う　宮崎市中村地区の「水かけ地蔵尊まつり」,https://news.yahoo.co.jp/articles/ae1142ae2064fd65ed5429af2002f94e232422f9,7/24(水) 19:28
mrt,MRT宮崎放送,土用の丑の日　宮崎市のうなぎ屋にぎわう,https://news.yahoo.co.jp/articles/6f9f43ba93f3d3f3fb5636672f0493b23cb92982,7/24(水) 19:28
mrt,MRT宮崎放送,綾町・綾北川の水難事故　行方不明の男性の捜索続く　現場は地元住民らが「水の流れも危険」と指摘,https://news.yahoo.co.jp/articles/8896ff3f644cc9ea2e439e93f33f2f3279663c0e,7/24(水) 19:28
mrt,MRT宮崎放送,給付費およそ225万円を不正に受給　延岡市の障害者相談支援事業所　指定取り消しの処分,https://news.yahoo.co.jp/articles/e2dc9322fe3e3e83732144b736c47fab5995ef60,7/24(水) 19:28
mrt,MRT宮崎放送,「避難時には助け合う気持ちが大切」高校生が地域防災を学ぶ研修会　都城市で開催,https://news.yahoo.co.jp/articles/3d04d07001f0c76cf12129615eb7fd14ace9d0a6,7/24(水) 19:24
mrt,MRT宮崎放送,夏の高校野球宮崎県大会 準決勝第2試合　宮崎商業 vs 日南学園,https://news.yahoo.co.jp/articles/3a5d57b9ec318ce3e561b9cf2dbcdd25d9834d4c,7/24(水) 19:24
