media_en,media_jp,title_articles,link_articles,date_original
relifenet,Reライフ.net,「運動育寿」を提唱します　生涯にわたる運動習慣で健康長寿を,https://news.yahoo.co.jp/articles/f01ed852167c051f86dd6a4f91c762fbbe8be8de,11/24(金) 11:02
relifenet,Reライフ.net,男性更年期はさまざまな疾患の誘因に　セルフチェックで対策を,https://news.yahoo.co.jp/articles/61738017132de244c946583e40abdfec2ad51ba6,11/22(水) 12:31
relifenet,Reライフ.net,加齢臭の原因とは 対策や予防に効果的な食事について専門家が解説,https://news.yahoo.co.jp/articles/4f0ed21a34afd0703a3ab264d2c8e6bfd9851ee5,11/22(水) 11:03
relifenet,Reライフ.net,男性ホルモン・テストステロンはインチキが嫌い　仲間を大事にしてホルモン高め、人生の後半戦をはつらつと,https://news.yahoo.co.jp/articles/5798013d9a64f36f18f973c164781f1cbfe17292,11/21(火) 12:01
relifenet,Reライフ.net,<連載　僕はパーキンソン病　恵村順一郎> 居ても立ってもいられない　秋の「神田古本まつり」に今年も来てしまった,https://news.yahoo.co.jp/articles/06705aeec2acb5fc81a25e7b370cab52d2ca47ba,11/20(月) 11:04
relifenet,Reライフ.net,財産の話をすぐに持ち出さないで　親との会話は「今」にフォーカスするのがコツ ～連載「今すぐできる終活講座」～親ともめない実家の片付け②,https://news.yahoo.co.jp/articles/e667e2e16a0f7e56ee20ab2106725ad8ead9247e,11/17(金) 17:04
relifenet,Reライフ.net,高齢者の運転は危ない? 現状やリスク、事故防止に必要な対策を解説,https://news.yahoo.co.jp/articles/299b4b8ac1ce6dc84ea405bea250681d7f5a449b,11/13(月) 11:02
