media_en,title_articles,link_articles,date_original
minkabu,貧乏人は麦を食え…サラリーマンに狙い撃ち増税！国民が普通の生活ができなくなっているのに、更に追い込みをかける鬼の岸田政権,https://news.yahoo.co.jp/articles/7c33b110f2b9078167c16742e5e156aaebf06a3f,7/31(月) 9:10
minkabu,学歴研究家じゅそうけんが医学部合格者たちに聞いた、珠玉の受験合格アドバイス集「偏差値65は普通に落ちる」「特別な事は何も必要ない」,https://news.yahoo.co.jp/articles/b57d174c4cada91232ee182a1d4c136ae87e2931,7/30(日) 17:10
minkabu,45歳で6000万マンション購入したバツイチ女の末路…年間90万円の赤字、78歳で貯金ゼロの老後貧困まっしぐら,https://news.yahoo.co.jp/articles/15361f30082f437a70b8214b5809a32a691ca5b2,7/30(日) 9:10
minkabu,日本最安の半額・簡単に入れてしまう海外医学部のススメ…東京でも受験可で、白人崇拝する日本人にとって”格上”感,https://news.yahoo.co.jp/articles/62908de9838d02e07c48366161afbe00ffc9adac,7/29(土) 17:10
minkabu,平均年収443万円、国民負担率46.8％！ライフプランが描けない…鬼の岸田政権が15〜39%の電気代の値上がりに苦しむ国民にはムチを打ちまくる,https://news.yahoo.co.jp/articles/7b7c8a453d7809ad39485e9be7ad5dd4af27f8e5,7/29(土) 9:10
minkabu,平均年収1378万円の最強職業…学歴研究家じゅそうけんが考える、東大卒三菱商事サラリーマンよりも、私大卒勤務医の方が“格上”なワケ,https://news.yahoo.co.jp/articles/e33979f8e6a4c342689cf1cdad59e246de701f9f,7/28(金) 17:10
minkabu,男の頭蓋骨を爪と牙で粉砕…銃で殺したはずのヒグマが起き上がりまさかの報復！海外研究「ヒグマ被害は年々増加傾向にある」,https://news.yahoo.co.jp/articles/6fc4e921742a80ba02dede1eed7e9d8db3bca88b,7/28(金) 9:10
minkabu,どうすればいいんだ…川勝知事のリニア抗戦サポーターズ「ボーナス持ち逃げ」不信任案に「悪いのは自民」「お門違い」,https://news.yahoo.co.jp/articles/5cbda04d618a28d91571b9ca18cc527f260fc37d,7/27(木) 9:10
minkabu,銀座の女が好きになる男が持つ5つの要素…「銀座ホステスから麻生太郎がモテるワケ」モテる男が絶対持っているたった1つのもの,https://news.yahoo.co.jp/articles/78a6766c04f52a38acd68178d6f181ebf51c8bcd,7/26(水) 17:10
minkabu,国民負担62.8％、平均年収443万…「小倉こども大臣に1日72万円も国が支出」意味無し少子化対策と狂気の増税！鬼の岸田政権,https://news.yahoo.co.jp/articles/564e29030723660f7d69b32473bb60f0d3064be4,7/26(水) 9:10
minkabu,セクシー嬢YouTuberまりてん「お客さんと3回付き合いました」…セクシー嬢落とす男の”何故か気になってしまう”特徴,https://news.yahoo.co.jp/articles/47edfce3151d54e31051d027c40222ff169e4d4f,7/25(火) 17:10
minkabu,一般国民はもう限界だ…「若者には悪いが、退職金はもうあてにするな」鬼の岸田政権、サラリーマンを追い込んで「手取りをさらに減らす」の刑,https://news.yahoo.co.jp/articles/790a56640b1b83e4dc740ee695a0414231ed6367,7/25(火) 9:10
minkabu,元六本木No.1キャバ嬢「年収1000万円はお金持ちではありません」「1回100万円のシャンパンがスタートライン」,https://news.yahoo.co.jp/articles/c34c084d69b80d467559028756f0436f6542f71e,7/24(月) 17:10
minkabu,弁護士指摘「寿司ペロ訴訟勝ち取れて800万円」の衝撃的理由…やったもん勝ち、ヤラレ損の実態「収入と親が出す出さない」,https://news.yahoo.co.jp/articles/4e1b1363d9f0c1ae6c5d8d77c1a2360d942f0970,7/24(月) 9:10
minkabu,正義のギャルあおちゃんぺ「自分の容姿を気にしない男性ほど、女性の容姿を貶す」「会社の上司でもないのに偉そうにしないで」,https://news.yahoo.co.jp/articles/0c1a7ebf55638763ba5f239159d37e835dfce704,7/23(日) 17:10
minkabu,寝過ごすと着く駅「小田原」には何があるのか…海も山も温泉もすべてを手に入れ駅徒歩圏新築戸建て4000万円の「最後の楽園」,https://news.yahoo.co.jp/articles/7a4bc80f6eef552145acc61eccd8d29a91c30118,7/23(日) 9:10
minkabu,34歳婚活OL「年収2000万円までは望んでません。でも、一緒に家庭を作れる年収は欲しい」…婚活ランキング「1位国家公務員、2位地方公務員」の不可思議,https://news.yahoo.co.jp/articles/b5b8d8cdeb8a83a61901cad74bd39b0b8bfa8a14,7/22(土) 17:10
minkabu,ビッグモーターにクルマを売った男の後悔…調査委「2717件調査のうち44%の1198件に不適切な行為の疑い」,https://news.yahoo.co.jp/articles/dec0033b1d958db8692625f9d8a6e628f8e60a85,7/22(土) 9:10
minkabu,週に3〜4回風俗店に通っていた「素人童貞」が新宿・ゴールデン街では急にモテ出した不可思議…アイドル、セクシー嬢からOLまで,https://news.yahoo.co.jp/articles/e0c17d704a4479d46dae7ad8444c368863f1f2c2,7/21(金) 17:10
minkabu,投資家ツイッターを真似るだけ資産2億円を築いた元風俗店員「最高の模倣対象は井村俊哉氏」,https://news.yahoo.co.jp/articles/f5071b35620e4a243b08cd84789d9469b064e4c9,7/21(金) 16:00
minkabu,広末不倫問題にフランス哲学者「フランスでは不倫は存在しない」15歳で40歳と略奪婚し大統領になったマクロン…,https://news.yahoo.co.jp/articles/8975897cad65cf956ee2db9c6e48157ac4d47878,7/21(金) 9:10
minkabu,なぜ他人の不倫が人々の心を波立たせるのか「だって恋しちゃったんだものと言われたらあなたはどうする？」,https://news.yahoo.co.jp/articles/458e4d728ede1d61b51fdbb04b45a742e4d342cf,7/20(木) 17:10
minkabu,平均年収443万円、国民負担率46.8％…世界競争力ランキングでも35位。それでも増税して国民を苦しめる鬼の岸田政権,https://news.yahoo.co.jp/articles/3484d198099532d7ac19edd04ba4668a5a36f130,7/19(水) 9:10
minkabu,風俗店員から投資で資産2億円男「超・独自投資法」…一攫千金を狙えるイナゴの見つけ方,https://news.yahoo.co.jp/articles/53465f7b0395fc9768f9ec64b86020aba94a9e80,7/18(火) 17:10
minkabu,とうとう国民負担率（実績値）は62.8％…鬼の岸田政権が追い打ち「バラマキ＆増税」地獄へ落ちるわよ,https://news.yahoo.co.jp/articles/079cf95364605047270e4f733313bf31d626cbff,7/18(火) 9:10
