media_en,title_articles,link_articles,date_original
minkabu,中2娘に英検準一不合格理由を激詰め…狂気の早大卒教育パパ「SAPIXの校舎満杯問題は私にも原因がある」,https://news.yahoo.co.jp/articles/7968aa8e5228db194af85928e7c9a98f0d95aa05,8/20(日) 17:10
minkabu,「地方一軒家アルファード家族」と「東京ハイスペタワマン家族」、どっちが幸せなのか…モンクレールのダウンを着て港区の公園を歩くことが本当に幸せか,https://news.yahoo.co.jp/articles/2d7a6809701a08757140cae18261b34adbecb7ee,8/19(土) 17:10
minkabu,松川るい、過去に海外出張の経費精算の面倒さに苦言「一件一件書類をそろえて、非常に無駄」2000円の自腹に怒り,https://news.yahoo.co.jp/articles/68ba86373b987afd3bb413607f6ece98fc259447,8/19(土) 9:10
minkabu,東大・医学部になぜか入りやすい”コスパ最強”中高一貫校…日能研偏差値は50だが、150人中5人が東大に受かる謎の学校　9000億円の学習塾業界市場規模の先に,https://news.yahoo.co.jp/articles/6b66e1f82e64d722043dd0b9daa06b2fd9fa3605,8/18(金) 17:10
minkabu,真面目な無能・森まさこ議員が手がけた「ブライダル利権」…結婚のコンセプトが崩壊している国民不在トンデモ補助金の中身,https://news.yahoo.co.jp/articles/d3560436c2b2800028e22d4189c6dbbb81ded36c,8/18(金) 9:10
minkabu,窓際三等兵「中受クラスタは子供をポケモンと勘違いした親の集まり」…「附属校という観点で見ると、『SAPIXの中央値はMARCH』はその通り」,https://news.yahoo.co.jp/articles/074cddc39ee2cd3e4c79e7c07935f10a9bdafbb9,8/17(木) 17:10
minkabu,日大・林理事長、過去コラムで「芸能人と飲むのが嬉しくてたまらない」連日夜までびっしり会議1回4時間”問われる手腕”,https://news.yahoo.co.jp/articles/0a1765e4c8db5a84937fdb6a3ca2a87964c4aa72,8/17(木) 9:10
minkabu,竹中平蔵「マイナンバーカード批判者にみる日本教育の失敗」…ロジカルシンキングができない日本人がもたらす人的資源の劣化,https://news.yahoo.co.jp/articles/e5fced3ced90274542b2dc570192d9438ed06743,8/16(水) 17:10
minkabu,損保ジャパンは被害者なのか…ビッグモーターに不正はあったのに、2022年「不正の指示はなかった」金融庁への報告にモヤモヤ,https://news.yahoo.co.jp/articles/ed7d3c31d1e272312e5e95249843160437d49ca6,8/16(水) 9:10
minkabu,なぜ金持ちの家には観葉植物や龍の置物があるのか…登録者25万人の金運師が教える！最速で億を目指す住環境,https://news.yahoo.co.jp/articles/9aefd447bb799970c38e5b1da14e5d215dc62b5c,8/15(火) 17:10
minkabu,フランス哲学者が松川るい・今井絵理子らに苦笑…「パンがなければお菓子をお食べ」を体現した日本の特権階級の愚鈍さ,https://news.yahoo.co.jp/articles/2e44425af9419a651603b9fd0584202d20870e1f,8/15(火) 9:10
minkabu,金持ちは自然とやっている「金を引き寄せるモーニングルーティン」…金運師が教える「金運のあがる食事」とは,https://news.yahoo.co.jp/articles/578142356ad8756cbb8a2ee8f30e883e9e6a3a40,8/14(月) 17:10
minkabu,馬鹿にしているのか！後どり息子に甘いリーダーたち…ビッグモーター元副社長vs岸田ドラ息子元秘書官、2人を護る親の愛,https://news.yahoo.co.jp/articles/0e3f72317476de0dd26f7233ca7944a5444498dd,8/14(月) 9:10
minkabu,お金は引き寄せられる…金運師が語る「金持ちが自然と実践している金運があがる3つの習慣と口癖リスト」,https://news.yahoo.co.jp/articles/4ef8f112a1d6cf2947d1dc35265eb4f4f32dd379,8/13(日) 17:10
minkabu,どうすることもできない…リニア抗戦の静岡・川勝知事が狙う次のネタは「土と生き物」遠のくリニア開業,https://news.yahoo.co.jp/articles/057772537653284cf2586d2e3f48109fc3b8cb8e,8/13(日) 9:10
minkabu,元銀行マンが投資家に！4年で1億ゲットした「資産防衛術」資金管理に徹した人だけが損失を乗り越えられる,https://news.yahoo.co.jp/articles/a622062a2fe01c9ebe06ea703dbf76f422d0f926,8/12(土) 17:10
minkabu,坂本龍一の主張は無謀！神宮外苑「再開発」反対派こそイチョウ並木を大切に…目をそらされる不都合な真実,https://news.yahoo.co.jp/articles/9d8b02327afdf29797b8dfd3ac18f5c3e67991d5,8/12(土) 9:10
minkabu,4年1億トレーダーが語る「FXで勝つ人、負ける人」の決定的な違い…なぜ「基本は損切しない」のか,https://news.yahoo.co.jp/articles/ed0e8d719d853f2ddd56a7822e32b4b1201d693a,8/11(金) 17:10
minkabu,中古車業界関係者が決死の実名告白「ビッグモーターは氷山の一角だ」無知なユーザーほど騙される仕組みを暴露…”ローンのせどり”の闇,https://news.yahoo.co.jp/articles/03e0a285dc72d49a656b4b2d13697ddca2e28f56,8/11(金) 9:10
minkabu,銀行勤務にもう限界!　4年で1億円をつかんだトレーダー、決断の日「1日で600万円儲けた」,https://news.yahoo.co.jp/articles/04f54bd3137a5965bab781f99a3f413468430899,8/10(木) 17:10
minkabu,「国民をバカにするパリ視察」松川るい持論は「フランスでも消費税は19.6％」6時間視察がぶっ潰した日本外交,https://news.yahoo.co.jp/articles/f422a1bb1971fe62b6d6b311a2c2b5df2457b919,8/10(木) 9:10
minkabu,天文学的数字に愕然…もし、ChatGPTのマイクロソフト株を30年前に100万円買っていたら、今いくらになっている,https://news.yahoo.co.jp/articles/8100549c4f78c0476b05af5b5c968582f84aad70,8/9(水) 17:10
minkabu,【簡単学歴ロンダ】Fラン出身でも東大・早慶院に楽勝で入れる…カリスマ予備校講師「人生は逆転できる」「学力勝負ではない」,https://news.yahoo.co.jp/articles/252c8f8d433908c4eec18b0581b0403ae9a3a924,8/8(火) 17:10
minkabu,松川・今井議員らのパリ視察を完全論破する東大論文…鬼の岸田政権「増税の成功体験を実感したい」地獄へまっしぐら,https://news.yahoo.co.jp/articles/362e8a2d3deafc239316cd6709b98169f3c65b93,8/8(火) 9:10
minkabu,1兆動かす元機関投資家教える「最速で1000万円FXで稼ぐ最終解答」具体的なロードマップを公開,https://news.yahoo.co.jp/articles/d04369802477d4221540edcffcabebc22abbe83b,8/7(月) 17:10
minkabu,"深刻な医師不足を背景に生まれた話題の暗黒漫画『脳外科医 竹田くん』…""医療ミス連発でもクビにならない""は本当なのか",https://news.yahoo.co.jp/articles/891c65f3a7a114b50e5d21bbc7201fd4ffef7482,8/7(月) 9:10
