media_en,media_jp,title_articles,date_original
cnn,CNN.co.jp,光る「謎の軟体動物」を発見、深海に住むウミウシの新種,11/13(水) 13:30
cnn,CNN.co.jp,米政権、イスラエルの国内法違反を認定せず　ガザ支援めぐり人道団体は逆の見解,11/13(水) 13:10
cnn,CNN.co.jp,イーロン・マスク氏、「政府効率化省」のトップに　トランプ氏発表,11/13(水) 12:50
cnn,CNN.co.jp,太平洋で四つの台風が同時発生、連日フィリピンを直撃,11/13(水) 12:14
cnn,CNN.co.jp,１０分以上の長トイレはダメ、スマホ持ち込みに医師が警鐘　米,11/13(水) 11:13
cnn,CNN.co.jp,トランプ氏、ＦＯＸニュースのヘグセス氏を国防長官に起用,11/13(水) 10:42
cnn,CNN.co.jp,トランプ氏、ＣＩＡ長官にラトクリフ氏起用へ　元国家情報長官,11/13(水) 10:27
cnn,CNN.co.jp,刑務所内でギャングの抗争、１５人死亡　南米エクアドル,11/13(水) 10:03
cnn,CNN.co.jp,中国南部での車暴走、３５人死亡　警察発表,11/13(水) 9:41
cnn,CNN.co.jp,米連邦航空局、ハイチ行きの全便を運航停止　旅客機３機への銃撃受け,11/13(水) 9:37
cnn,CNN.co.jp,トランプ氏「口止め料」裁判、有罪覆すかどうかの判断を延期　ＮＹ州地裁,11/13(水) 8:02
cnn,CNN.co.jp,サウジ皇太子、イスラエルを非難　ガザで「集合的ジェノサイド」,11/13(水) 7:15
cnn,CNN.co.jp,トランプ氏、駐イスラエル大使にハッカビー氏　ヨルダン川西岸入植を擁護,11/13(水) 7:00
cnn,CNN.co.jp,シェル石油へのＣＯ２削減命令を破棄、オランダの控訴裁,11/12(火) 20:23
cnn,CNN.co.jp,韓国大統領、「ゴルフ外交」に向けて練習再開　トランプ氏の勝利受け,11/12(火) 19:30
cnn,CNN.co.jp,メラニア夫人、ジル夫人との会談欠席の見通し　先約のため,11/12(火) 19:00
cnn,CNN.co.jp,宇宙人が発したような火星からの信号、解読に成功　次は意味の解釈,11/12(火) 18:27
cnn,CNN.co.jp,屋外スポーツ施設の利用者に車が突入、運転の男を逮捕　中国南部,11/12(火) 18:00
cnn,CNN.co.jp,１０年に一度咲く花を見るため長蛇の列、ただし臭いは最悪　豪植物園,11/12(火) 17:33
cnn,CNN.co.jp,トランプ氏、国土安全保障長官にノーム知事を起用へ,11/12(火) 16:54
cnn,CNN.co.jp,レッドロブスターもＴＧＩフライデーズも米国で相次ぎ閉店、空きスペースに進出しているのは？,11/12(火) 16:19
cnn,CNN.co.jp,気候変動に関連した「影の負担」は３００兆円　国際商業会議所が報告書,11/12(火) 15:08
cnn,CNN.co.jp,トランプ氏の１期目、実際には強制送還が減っていた理由,11/12(火) 15:00
cnn,CNN.co.jp,シベリア永久凍土に巨大陥没穴が続々、地面破裂の謎に迫る,11/12(火) 14:23
cnn,CNN.co.jp,ポンペイ遺跡の入場は１日２万人まで、観光客急増で制限導入,11/12(火) 13:32
cnn,CNN.co.jp,トランプ氏、国務長官にルビオ上院議員起用か　情報筋,11/12(火) 12:31
cnn,CNN.co.jp,「お前の体、俺の選択」　米大統領選後のＳＮＳで女性攻撃あふれる,11/12(火) 12:08
cnn,CNN.co.jp,映画「ウィキッド」人形にポルノサイトのＵＲＬ印刷の手違い、米玩具メーカーが謝罪,11/12(火) 11:16
cnn,CNN.co.jp,米テニス専門チャンネル、解説者を無期限降板　女子選手の額へのコメントで,11/12(火) 10:39
cnn,CNN.co.jp,トランプ氏、ウォルツ下院議員に国家安全保障担当補佐官への起用打診,11/12(火) 9:55
cnn,CNN.co.jp,有害スモッグに覆われたパキスタン、宇宙からも一目瞭然　過去最悪の大気汚染続く,11/12(火) 9:40
cnn,CNN.co.jp,ハイチ首都上空で旅客機に銃撃、航空各社が運航停止へ,11/12(火) 8:39
cnn,CNN.co.jp,ディズニーのクルーズ船、沈没しかかった船から４人救う　バミューダ諸島沖,11/12(火) 8:36
cnn,CNN.co.jp,ウクライナ軍、ロシア兵５万人とクルスク州で戦闘中　ゼレンスキー氏,11/12(火) 7:00
cnn,CNN.co.jp,トランプ氏、政策担当の大統領次席補佐官にミラー氏起用へ　対移民強硬派,11/12(火) 6:55
cnn,CNN.co.jp,購入したのを忘れた宝くじで１．５億円当選　米,11/11(月) 17:39
cnn,CNN.co.jp,ビートルズ、１９９７年以来の米グラミー賞ノミネート,11/11(月) 17:10
cnn,CNN.co.jp,トランプ氏、ステファニク下院議員を国連大使に起用か　情報筋,11/11(月) 16:30
cnn,CNN.co.jp,トランプ氏再選で米女性の間で広まる「４Ｂ」運動　男性との結婚や出産を拒否,11/11(月) 16:07
cnn,CNN.co.jp,ビットコイン、初の８万ドル超え　暗号資産推進派のトランプ氏再選受け,11/11(月) 15:39
cnn,CNN.co.jp,１５年前の女性殺害事件、被害者のホログラムで情報提供呼び掛け　オランダ,11/11(月) 15:01
cnn,CNN.co.jp,スタジアムに生きたトラ、大学アメフトの「伝統復活」非難の的に,11/11(月) 14:26
cnn,CNN.co.jp,米大学同窓会で相次ぐ銃撃、死傷者続出　アラバマ州では１８歳死亡,11/11(月) 13:52
cnn,CNN.co.jp,ロシア人が大金を握りしめて香港のアップルストアを訪問する理由,11/11(月) 13:26
cnn,CNN.co.jp,レバノン・ガザ・シリアで死者８０人超、イスラエルの攻撃で子どもや女性も犠牲に,11/11(月) 12:48
cnn,CNN.co.jp,英キャサリン妃、戦没者追悼の行事に出席,11/11(月) 12:26
cnn,CNN.co.jp,レバノンでの通信機器爆発、初めて関与認める　イスラエル首相,11/11(月) 11:59
cnn,CNN.co.jp,オランダ首都でデモ禁止令、イスラエルのサッカーファンへの暴力受け,11/11(月) 11:28
cnn,CNN.co.jp,キューバでＭ６．８の地震、建物などに大きな被害　相次ぐハリケーンに追い打ち,11/11(月) 11:06
cnn,CNN.co.jp,ロシアと北朝鮮の兵士、クルスク州奪還へ向け数万人が集結,11/11(月) 10:23
cnn,CNN.co.jp,ロシアとウクライナ、大規模ドローン攻撃の応酬,11/11(月) 9:45
cnn,CNN.co.jp,ガザの死者、７割が女性や子ども　国連が人道状況の悪化を警告,11/11(月) 9:12
cnn,CNN.co.jp,「息子の自殺は対話型ＡＩの責任」、中毒に歯止めなし　母親が運営会社を提訴,11/10(日) 17:30
cnn,CNN.co.jp,この小都市が「眼鏡の都」である理由　福井・鯖江,11/10(日) 15:30
cnn,CNN.co.jp,洪水被災地で州首相の退陣求める大規模デモ、警察と衝突　スペイン東部,11/10(日) 13:30
cnn,CNN.co.jp,トランプ氏とバイデン氏、１３日にホワイトハウスで会談,11/10(日) 12:30
cnn,CNN.co.jp,ウクライナ、ロシア西部の化学工場に「ドローン攻撃」,11/10(日) 10:53
cnn,CNN.co.jp,カタール、ガザ停戦交渉の仲介を停止か　情報筋,11/10(日) 10:34
cnn,CNN.co.jp,１９７４年の女性殺害事件、５０年後に容疑者見つかる　米,11/9(土) 17:50
cnn,CNN.co.jp,パキスタンの鉄道駅で自爆テロ、２４人死亡　分離派武装勢力が犯行声明,11/9(土) 17:04
cnn,CNN.co.jp,ロールスロイス、映画「００７／ゴールドフィンガー」に捧げる１台限りの特別車を製作,11/9(土) 17:00
cnn,CNN.co.jp,宇宙から帰還のＮＡＳＡ飛行士、地球への再順応の苦労語る　「座るのがきつい」,11/9(土) 15:50
cnn,CNN.co.jp,台湾政府、トランプ氏宛ての書簡を元当局者に渡す　１６年選挙後の電話会談とは対照的,11/9(土) 15:07
cnn,CNN.co.jp,仏ノートルダム大聖堂、鐘の音再び　１９年の大規模火災以来,11/9(土) 13:40
cnn,CNN.co.jp,２００９年にフーバーダムで見つかった人骨、１５年後に身元判明　米,11/9(土) 12:59
cnn,CNN.co.jp,トランプ氏の政権移行チーム、エネルギーと気候に関する大統領令を準備,11/9(土) 12:12
cnn,CNN.co.jp,国際空港で銃撃、ビジネスマン狙った暗殺か　ブラジル,11/9(土) 11:25
cnn,CNN.co.jp,米国防総省、トランプ氏の物議醸す命令に備え対応協議　当局者,11/9(土) 10:50
cnn,CNN.co.jp,バイデン米政権、軍事請負業者のウクライナ派遣を初めて容認　Ｆ１６などの修理・維持,11/9(土) 9:35
cnn,CNN.co.jp,カスピ海に浮かぶ、ソ連時代の異様な石油掘削都市とは,11/8(金) 19:03
cnn,CNN.co.jp,４１００万桁超の史上最大の素数、半導体大手の元プログラマーが発見,11/8(金) 17:23
cnn,CNN.co.jp,脳の老化防ぐカギは「小さな積み重ね」、外国語や楽器演奏も,11/8(金) 16:48
cnn,CNN.co.jp,北朝鮮兵とウクライナ軍が衝突、死者　ゼレンスキー氏確認,11/8(金) 16:15
cnn,CNN.co.jp,「吸血鬼」と恐れられた４００年前の謎の女性、相貌復元で現代に蘇る　ポーランド,11/8(金) 15:04
cnn,CNN.co.jp,トランプ氏復活に備える中国、経済で混乱も政治的にはチャンスか,11/8(金) 14:36
cnn,CNN.co.jp,米ＡＯＬ「ユー・ガット・メール」の声、エルウッド・エドワーズさん死去,11/8(金) 14:02
cnn,CNN.co.jp,ロシア、大規模ドローン攻撃を増強　ウクライナの防空圧倒する狙い,11/8(金) 13:00
cnn,CNN.co.jp,明朝時代の魚文様のつぼ、１９億円で落札,11/8(金) 12:27
cnn,CNN.co.jp,アルゼンチン検察、リアム・ペインさんの死亡めぐり３人を捜査,11/8(金) 11:45
cnn,CNN.co.jp,世界で最も裕福な１０人、１日で資産「９．８兆円」増　トランプ氏再選受け,11/8(金) 11:16
cnn,CNN.co.jp,トランプ氏、大統領首席補佐官にワイルズ氏起用　初の女性,11/8(金) 10:55
cnn,CNN.co.jp,ロシアのプーチン大統領、トランプ氏に祝意　対話の用意あると表明,11/8(金) 10:08
cnn,CNN.co.jp,実験施設のサル４３匹が脱走、小さな町が大騒ぎ　米サウスカロライナ州,11/8(金) 9:55
cnn,CNN.co.jp,米ＦＲＢ、大統領選後に政策金利を０．２５％引き下げ,11/8(金) 9:26
cnn,CNN.co.jp,イスラエル攻撃で死者多数、空爆で２７人犠牲も　ガザ,11/8(金) 8:00
cnn,CNN.co.jp,「結果受け入れ結束を」　バイデン米大統領が選挙後初の演説,11/8(金) 7:20
cnn,CNN.co.jp,トランプ氏、米大統領２期目でまず不法移民問題に着手　情報筋,11/8(金) 6:43
cnn,CNN.co.jp,世界の気温、２０２４年は初の「１．５度」超えが確実に　ＥＵ気象情報機関,11/7(木) 19:56
cnn,CNN.co.jp,豪シドニーの海岸に数千の「黒い玉」、正体は悪臭漂う油脂の塊,11/7(木) 19:15
cnn,CNN.co.jp,マヤ文明の古代都市と数千の建造物、レーザー測量技術で発見　メキシコ南東部,11/7(木) 18:53
cnn,CNN.co.jp,日中韓など各国首脳、当選したトランプ氏に祝意,11/7(木) 17:22
cnn,CNN.co.jp,２期目のトランプ政権、１期目とは全く異なるものになる理由,11/7(木) 17:01
cnn,CNN.co.jp,ハリス氏敗北の米民主党、反省から非難合戦へ,11/7(木) 16:36
cnn,CNN.co.jp,ショルツ独首相が財務相を解任、連立崩壊の危機　来年総選挙か,11/7(木) 15:48
cnn,CNN.co.jp,トランプ氏を選んだ米国民の意識の変化とは　出口調査が浮き彫りにした分断国家,11/7(木) 13:37
cnn,CNN.co.jp,トランプ氏復活で浮かび上がる、メディアの信用にまつわる深刻な疑問,11/7(木) 13:18
cnn,CNN.co.jp,大雨による洪水で３人溺死　米中西部ミズーリ州,11/7(木) 12:41
cnn,CNN.co.jp,絶滅危惧種のコビトカバの赤ちゃんが誕生　英動物園,11/7(木) 12:31
cnn,CNN.co.jp,女性絞殺事件の容疑者、３０年後に特定　非営利団体の協力で　米ラスベガス,11/7(木) 11:37
cnn,CNN.co.jp,空港の天井からアライグマ落下、搭乗ゲート駆け抜け大騒ぎ　ＮＹラガーディア空港,11/7(木) 11:04
cnn,CNN.co.jp,サンダース氏、米民主党の大統領選敗北に驚きなし　「労働者階級見捨てた」と批判,11/7(木) 10:43
cnn,CNN.co.jp,オーストラリアの海岸にコウテイペンギン、南極から数千キロを旅して漂着,11/7(木) 10:28
cnn,CNN.co.jp,ケネディ氏、ワクチンの安全性と有効性を「直ちに」調査　トランプ次期政権で,11/7(木) 10:01
cnn,CNN.co.jp,空港フェンス突き破った小型機が車に衝突、５人死亡　巻き添えのドライバーも　米アリゾナ州,11/7(木) 9:20
cnn,CNN.co.jp,ハリス氏、大統領選敗北を認める演説　若者に「大丈夫」とメッセージ,11/7(木) 8:21
cnn,CNN.co.jp,各国首脳、トランプ氏当選に祝意　イスラエル首相がいち早く電話,11/7(木) 7:55
cnn,CNN.co.jp,米特別検察官、トランプ氏の訴追取り下げを協議　司法省上層部との間で,11/7(木) 7:16
cnn,CNN.co.jp,米株大幅高、トランプ氏の大統領選勝利を好感,11/7(木) 7:00
cnn,CNN.co.jp,ハリス氏、米大統領選勝利のトランプ氏に祝意　敗北認める,11/7(木) 6:17
cnn,CNN.co.jp,ウクライナ大統領、ＳＮＳでトランプ氏に祝意,11/6(水) 20:24
cnn,CNN.co.jp,米大統領選　トランプ氏が勝利、ハリス氏を破り歴史的な再選　ＣＮＮ予測,11/6(水) 20:03
cnn,CNN.co.jp,米大統領選、トランプ氏がウィスコンシン州で勝利　ＣＮＮ予測,11/6(水) 19:52
cnn,CNN.co.jp,中国国営メディアの大統領選報道、米国の分断に注目,11/6(水) 19:49
cnn,CNN.co.jp,米大統領選、ハリス氏がニュージャージー州で勝利　ＣＮＮ予測,11/6(水) 19:17
cnn,CNN.co.jp,「建国の父」３人が署名の珍しい書簡、落札価格１．５億円か,11/6(水) 19:03
cnn,CNN.co.jp,中絶の権利めぐる住民投票、ＮＹ州などで可決　フロリダ州は否決,11/6(水) 18:17
cnn,CNN.co.jp,米大統領選、ハリス氏がミネソタ州で勝利　ＣＮＮ予測,11/6(水) 18:12
cnn,CNN.co.jp,米議会選・知事選、「史上初」の顔ぶれ誕生の見込み,11/6(水) 18:04
cnn,CNN.co.jp,トランプ氏、支持者らを前に演説　「毎日皆さんのために戦う」,11/6(水) 17:15
cnn,CNN.co.jp,共和党の上院奪還が確実に、ＣＮＮ予測　米政界のパワーバランス変化,11/6(水) 17:06
cnn,CNN.co.jp,オアシスのファン、大勢がチケット詐欺の被害に　再結成ツアー発表後,11/6(水) 16:46
cnn,CNN.co.jp,トランプ氏が勝利目前、４人の選挙人獲得を残すのみ　ＣＮＮ予測,11/6(水) 16:36
cnn,CNN.co.jp,米大統領選、トランプ氏が激戦州ペンシルベニアで勝利　ＣＮＮ予測,11/6(水) 16:28
cnn,CNN.co.jp,米上院、共和党が過半数を奪還　ＣＮＮ予測,11/6(水) 16:11
cnn,CNN.co.jp,ハリス氏、今夜は演説せず　陣営トップは票集計の継続を強調,11/6(水) 15:40
cnn,CNN.co.jp,米大統領選、ハリス氏がニューメキシコ州で勝利　ＣＮＮ予測,11/6(水) 15:24
cnn,CNN.co.jp,激戦州でトランプ氏優勢、狭まるハリス氏の勝利への道　「ブルーウォール」死守が必要,11/6(水) 15:22
cnn,CNN.co.jp,家の改装中に白骨を発見、１５年前に行方不明になった前の所有者か　仏,11/6(水) 15:11
cnn,CNN.co.jp,トランプ氏がジョージア州でも勝利、激戦２州を制す　ＣＮＮ予測,11/6(水) 15:02
cnn,CNN.co.jp,米大統領選、トランプ氏がネブラスカ州で選挙人３人獲得　ＣＮＮ予測,11/6(水) 14:35
cnn,CNN.co.jp,フットボール審判出場停止、パーティーでオサマ・ビンラディン仮装　オーストラリア,11/6(水) 14:24
cnn,CNN.co.jp,米大統領選、初期段階での識者の反応は　「サプライズなし」,11/6(水) 14:17
cnn,CNN.co.jp,米大統領選、ハリス氏がバージニア州とハワイ州で勝利　ＣＮＮ予測,11/6(水) 14:16
cnn,CNN.co.jp,米大統領選、ハリス氏がワシントン州で勝利　ＣＮＮ予測,11/6(水) 14:13
cnn,CNN.co.jp,米大統領選、トランプ氏が激戦州ノースカロライナで勝利　ＣＮＮ予測,11/6(水) 13:59
cnn,CNN.co.jp,トランプ陣営、楽観的なムード高まる,11/6(水) 13:52
cnn,CNN.co.jp,ローマの名所「トレビの泉」前にコイン投げ用仮設プール、ネット冷笑,11/6(水) 13:41
cnn,CNN.co.jp,米大統領選、トランプ氏がアイダホ州で勝利　ＣＮＮ予測,11/6(水) 13:37
cnn,CNN.co.jp,米大統領選、ハリス氏がカリフォルニア州とオレゴン州で勝利　ＣＮＮ予測,11/6(水) 13:32
cnn,CNN.co.jp,米大統領選、トランプ氏がアイオワ州とカンザス州で勝利　ＣＮＮ予測,11/6(水) 12:58
cnn,CNN.co.jp,米大統領選、トランプ氏がオハイオ州とミシシッピ州で勝利　ＣＮＮ予測,11/6(水) 12:48
cnn,CNN.co.jp,米大統領選、ハリス氏がコロラド州で勝利　ＣＮＮ予測,11/6(水) 12:33
cnn,CNN.co.jp,投票所１２カ所、爆破予告で一時閉鎖　「ロシアからの脅迫」とジョージア州,11/6(水) 12:30
cnn,CNN.co.jp,米大統領選、トランプ氏がモンタナ州で勝利　ＣＮＮ予測,11/6(水) 12:16
cnn,CNN.co.jp,米大統領選、トランプ氏がルイジアナ州で勝利　ＣＮＮ予測,11/6(水) 12:05
cnn,CNN.co.jp,激戦州ペンシルベニア、有権者の過半数が人工妊娠中絶の合法化を支持　ＣＮＮ出口調査,11/6(水) 11:53
cnn,CNN.co.jp,米大統領選、ハリス氏がニューヨーク州で勝利　ＣＮＮ予測,11/6(水) 11:47
cnn,CNN.co.jp,米大統領選、トランプ氏がテキサスなど４州で勝利　ＣＮＮ予測,11/6(水) 11:43
cnn,CNN.co.jp,米大統領選、ハリス氏がデラウェアなど３州で勝利重ねる　ＣＮＮ予測,11/6(水) 11:35
cnn,CNN.co.jp,トランプ氏、ペンシルベニア州を取れば「すべてに勝利」　ラジオ番組で,11/6(水) 11:15
cnn,CNN.co.jp,米大統領選、トランプ氏がアーカンソー州とサウスカロライナ州で勝利　ＣＮＮ予測,11/6(水) 11:08
cnn,CNN.co.jp,米大統領選、ハリス氏がメリーランド州などで勝利　ＣＮＮ予測,11/6(水) 10:54
cnn,CNN.co.jp,米大統領選、トランプ氏がフロリダなど５州で勝利　ＣＮＮ予測,11/6(水) 10:45
cnn,CNN.co.jp,イスラエル軍の襲撃相次ぐ、ヨルダン川西岸で８人死亡,11/6(水) 10:33
cnn,CNN.co.jp,米大統領選、トランプ氏がウェストバージニア州とインディアナ州で勝利　ＣＮＮ予測,11/6(水) 10:03
cnn,CNN.co.jp,米ボーイング労組、提案受け入れ　スト終結へ,11/6(水) 9:49
cnn,CNN.co.jp,トランプ氏ＳＮＳの株価、米大統領選当日の取引で激しい乱高下,11/6(水) 9:33
cnn,CNN.co.jp,米大統領選、トランプ氏がケンタッキー州で勝利　ＣＮＮ予測,11/6(水) 9:28
cnn,CNN.co.jp,米大統領選、ハリス氏がバーモント州で勝利　ＣＮＮ予測,11/6(水) 9:18
cnn,CNN.co.jp,米有権者の４分の３、米国の現状に否定的な見方　ＣＮＮ出口調査,11/6(水) 9:14
cnn,CNN.co.jp,トランプ陣営、投票日夜のイベントで一部記者の取材認めず　選挙報道の内容に反応か,11/6(水) 9:01
cnn,CNN.co.jp,米大統領選、すべての州で投票進む　知っておくべきこと,11/6(水) 7:30
cnn,CNN.co.jp,イスラエル首相、国防相を解任　戦争と内政巡り数カ月にわたり衝突,11/6(水) 7:21
cnn,CNN.co.jp,「Ｚ世代」の若者、選挙の情報源はＴｉｋＴｏｋ　活動家が指摘,11/5(火) 20:39
cnn,CNN.co.jp,中国空軍、新型のステルス戦闘機を公開へ　米空軍力への対抗を誇示,11/5(火) 19:52
cnn,CNN.co.jp,米大統領選、郵便投票による逆転は今年も起きるのか,11/5(火) 19:20
cnn,CNN.co.jp,大統領選前夜、各候補が激戦州で最後の集会,11/5(火) 18:10
cnn,CNN.co.jp,トランプ氏支持のインフルエンサー、１００ドルで不正投票の偽動画拡散　ロシア工作員関与　CNN EXCLUSIVE,11/5(火) 18:02
cnn,CNN.co.jp,米国系イラン人のジャーナリスト拘束か、９月にテヘランで,11/5(火) 17:14
cnn,CNN.co.jp,イラン政府、ノーベル平和賞受賞の人権活動家に「緩慢な死」を期待か　家族が非難,11/5(火) 16:24
cnn,CNN.co.jp,妊娠から授乳期に砂糖摂取を抑制、子どもの成人後糖尿病リスク３５％減　新研究,11/5(火) 16:04
cnn,CNN.co.jp,「全米一早い投開票」、ハリス氏とトランプ氏が３票ずつで並ぶ　ニューハンプシャー州の町,11/5(火) 15:28
cnn,CNN.co.jp,サッカー選手、試合中の落雷で死亡　ペルー,11/5(火) 15:18
cnn,CNN.co.jp,トランプ銘柄、投票日を前に急騰,11/5(火) 14:29
cnn,CNN.co.jp,ロシア、北米行き航空機に発火装置の企てか　米紙報道,11/5(火) 14:10
cnn,CNN.co.jp,イスラエル首相の側近、情報漏えいで逮捕　ガザ停戦阻止が狙いだったとの批判,11/5(火) 13:30
cnn,CNN.co.jp,クリス・マーティン、舞台上の穴に落下　豪公演,11/5(火) 13:04
cnn,CNN.co.jp,人身売買業者の故意で船が転覆、子ども含む２５人死亡　国際移住機関,11/5(火) 12:40
cnn,CNN.co.jp,有権者に１００万ドル配るイーロン・マスク氏の「懸賞」、裁判所が継続認める,11/5(火) 11:43
cnn,CNN.co.jp,ハリス陣営、選挙人２７０人獲得へ「複数の道筋」見込む　結果判明時期の予測も,11/5(火) 10:55
cnn,CNN.co.jp,２０２４大統領選は「未曽有の量の偽情報」拡散　米サイバーセキュリティー当局,11/5(火) 10:29
cnn,CNN.co.jp,音楽界の巨匠クインシー・ジョーンズさん死去　９１歳,11/5(火) 9:57
cnn,CNN.co.jp,新たな全米世論調査、ハリス氏がわずかにリード　投票する可能性の高い有権者対象,11/5(火) 9:13
cnn,CNN.co.jp,中国の今年の婚姻数、過去最低の水準へ　政府の奨励策も効果なく,11/5(火) 6:42
cnn,CNN.co.jp,イングランド最後の「魔女」、死刑判決受けるも生き延びた可能性　英研究者,11/4(月) 17:30
cnn,CNN.co.jp,米ＮＹ市、歩行者による信号無視の「斜め横断」を合法化,11/4(月) 16:30
cnn,CNN.co.jp,祈りの時間に落雷　１４人死亡、３４人負傷　ウガンダ難民キャンプ,11/4(月) 15:30
cnn,CNN.co.jp,「地下鉄サーフィン」の死者６人に、ＳＮＳチャレンジで注目集める　米ＮＹ市,11/4(月) 14:30
cnn,CNN.co.jp,下着姿の女子大学生を逮捕、厳格な服装規定に抗議か　イラン,11/4(月) 13:30
cnn,CNN.co.jp,被災地訪問の国王にブーイングや卵投げ、甚大被害に住民の怒り噴出　スペイン,11/4(月) 12:42
cnn,CNN.co.jp,武装集団が軍施設を占拠、２００人が人質に　南米ボリビア,11/4(月) 12:04
cnn,CNN.co.jp,サメに襲われたサーファー、脚を食いちぎられながら自力で岸へ　米ハワイ,11/4(月) 11:38
cnn,CNN.co.jp,ウクライナ軍、激しい攻勢に直面　ロシアは東部で集落を「支配下」に,11/4(月) 11:09
cnn,CNN.co.jp,アイオワ州でハリス氏がリードか、過去２回はトランプ氏勝利　地元紙調査,11/4(月) 10:40
cnn,CNN.co.jp,大統領選の激戦７州、接戦続く　米世論調査,11/4(月) 10:14
cnn,CNN.co.jp,ハリス氏、人気コメディー番組にサプライズ登場　ものまね俳優と共演,11/4(月) 9:50
cnn,CNN.co.jp,宇宙旅行者が直面する「病」とは、民間宇宙飛行士が解決できる可能性,11/3(日) 17:30
