media_en,media_jp,title_articles,date_original
mbcnews,MBC南日本放送,鹿児島市小野町で火事　電気工事会社の事務所が全焼　1人やけど,11/13(水) 11:57
mbcnews,MBC南日本放送,トカラ列島近海で地震 鹿児島十島村で最大震度1 津波の心配なし,11/13(水) 11:44
mbcnews,MBC南日本放送,鹿児島県交通取締り情報2024年11月13日（水）,11/13(水) 6:02
mbcnews,MBC南日本放送,霧島市で乗用車と衝突　原付バイクの男性が意識不明の重体　鹿児島県,11/12(火) 23:27
mbcnews,MBC南日本放送,桜島フェリー就航90年　かつての“ドル箱”9年連続赤字の危機も…「これからもフェリーのある景色を」,11/12(火) 20:06
mbcnews,MBC南日本放送,この秋初めての川内川あらしと800万本のコスモス　鹿児島,11/12(火) 19:59
mbcnews,MBC南日本放送,歩道に車乗り上げなぜ?　専門家「高齢者になると踏み間違えが多くなる」,11/12(火) 19:51
mbcnews,MBC南日本放送,「人がうつぶせで車の下に…」歩道に車乗り上げ死亡事故　目撃証言で振り返る“現場でなにが?”,11/12(火) 19:49
mbcnews,MBC南日本放送,「アクセルとブレーキを間違えた」高齢者運転の車乗り上げ　1人死亡1人意識不明　鹿児島,11/12(火) 19:43
mbcnews,MBC南日本放送,人気のホットドッグが県内初上陸　IKEAの期間限定ショップが2度目の開催,11/12(火) 19:34
mbcnews,MBC南日本放送,桜島の観測坑道で焼酎1年間貯蔵　味のまろやかさや口当たりに期待　全国初の取り組み　鹿児島,11/12(火) 19:28
mbcnews,MBC南日本放送,「若い世代に選ばれるまちを」　下鶴氏がマニフェスト発表　政党には推薦依頼せず　鹿児島市,11/12(火) 19:28
mbcnews,MBC南日本放送,徳之島3町合同で最後の別れ　徳田虎雄氏偲ぶ会,11/12(火) 19:24
mbcnews,MBC南日本放送,わさび漬け、こんぶ和えオススメ　かごしまブランド　東串良のピーマン・キュウリ　初荷出荷式,11/12(火) 19:22
mbcnews,MBC南日本放送,【台風情報】11月に4つの台風は統計史上初 台風遠くても本州で雨【17日（日）までの雨と風のシミュレーション】,11/12(火) 15:06
mbcnews,MBC南日本放送,20代知人男性の腹を刺し殺害しようとした疑い　45歳男を現行犯逮捕　鹿児島市七ツ島,11/12(火) 12:36
mbcnews,MBC南日本放送,早朝の川を覆う霧と朝日「川内川あらし」今シーズン初めて出現　鹿児島・薩摩川内市,11/12(火) 12:02
mbcnews,MBC南日本放送,歩道に車乗り上げ1人死亡1人意識不明　運転の84歳女性の回復待って話聞く方針,11/12(火) 11:59
mbcnews,MBC南日本放送,【台風情報】台風25号発生　沖縄・奄美接近か　24号も北上?気象庁の予想詳しく【17日（日）までの雨・風シミュレーション】進路予想と影響は,11/12(火) 11:51
mbcnews,MBC南日本放送,鹿児島県交通取締り情報2024年11月12日（火）,11/12(火) 6:02
mbcnews,MBC南日本放送,鹿児島県交通取締り情報2024年11月12日（火）,11/12(火) 6:02
mbcnews,MBC南日本放送,高校野球1年生大会　3Rホームランで流れ掴んだ神村学園　5連覇果たす,11/11(月) 20:02
mbcnews,MBC南日本放送,「生活を徹底的に支え民主主義守る」「より力強い政治家になる」特別国会召集で石破総理選出　県関係衆院議員は,11/11(月) 19:48
mbcnews,MBC南日本放送,尾辻秀久氏（84）参院議長を辞任「体調不良」　来年の任期満了で議員引退へ　鹿児島,11/11(月) 19:43
mbcnews,MBC南日本放送,小里農水大臣が退任会見「ゼロからスタート」　衆院選で落選…わずか1か月余りで退任　鹿児島,11/11(月) 19:43
mbcnews,MBC南日本放送,スクールバス急ブレーキで生徒8人を病院へ搬送　打撲などのけが,11/11(月) 19:39
mbcnews,MBC南日本放送,与論町　3日間で年間雨量1/3の大雨　床上床下浸水・がけ崩れで牛も避難　農業被害1000万円超か,11/11(月) 19:37
mbcnews,MBC南日本放送,【鹿児島県与論町】どうして11月に記録的大雨?　気象予報士解説,11/11(月) 19:34
mbcnews,MBC南日本放送,鹿児島実業が2年連続の花園へ!　緊迫した大接戦　逆転に次ぐ逆転　県高校ラグビー,11/11(月) 19:34
mbcnews,MBC南日本放送,フラーゴラッド鹿児島　ホーム日置で快勝!地元の熱い声援も,11/11(月) 19:31
mbcnews,MBC南日本放送,強敵相手にリードも…レブナイズ4連敗で首位陥落,11/11(月) 19:24
mbcnews,MBC南日本放送,J2最終戦0-0　19位で今季終了　引退の木村も出場　鹿児島ユナイテッドFC,11/11(月) 19:19
mbcnews,MBC南日本放送,100歳ランナー宮内義光さん　世界記録を新たに2つ更新「あと5年、105歳まで走りたい」,11/11(月) 19:16
mbcnews,MBC南日本放送,車が歩道に乗り上げ4人はねる　1人死亡　1人意識不明　高齢女性が運転　鹿児島市,11/11(月) 18:24
mbcnews,MBC南日本放送,【今週の九州天気】夏日続出 季節逆戻り【福岡・佐賀・長崎・大分・熊本・宮崎・鹿児島】18日（月）までの予報,11/11(月) 18:22
mbcnews,MBC南日本放送,【台風情報】台風25号発生　沖縄地方接近か　気象庁の予想詳しく【16日（土）までの雨・風シミュレーション】台風22号、23号、24号も　進路予想と日本への影響は,11/11(月) 17:27
mbcnews,MBC南日本放送,鹿児島ユナイテッドFC・浅野哲也監督　契約満了で退任「J2残留果たせず責任痛感」,11/11(月) 15:36
mbcnews,MBC南日本放送,スクールバスが急ブレーキで生徒8人を病院へ搬送　打撲などのけが,11/11(月) 13:27
mbcnews,MBC南日本放送,高校野球選抜1年生大会　栄冠を掴んだのは　鹿児島,11/11(月) 12:06
mbcnews,MBC南日本放送,天城町で軽貨物車に男性（85）はねられ死亡　鹿児島,11/11(月) 11:59
mbcnews,MBC南日本放送,鹿児島県交通取締り情報2024年11月11日（月）,11/11(月) 11:01
mbcnews,MBC南日本放送,【台風情報】台風25号発生へ　気象庁の予想詳しく　熱帯低気圧=台風のたまごが発達する見込み　台風22号、23号、24号と連続発生【進路予想】,11/11(月) 10:29
mbcnews,MBC南日本放送,薩摩半島西方沖で地震 薩摩川内市甑島で最大震度1 津波の心配なし,11/10(日) 22:54
mbcnews,MBC南日本放送,与論町などの大雨警報解除　鹿児島,11/10(日) 22:32
mbcnews,MBC南日本放送,花園行きのチケットは　高校ラグビー鹿児島県大会・決勝　鹿児島実業VS鹿児島工業,11/10(日) 18:51
mbcnews,MBC南日本放送,伊佐市長選　3人が立候補　現職・新人の三つどもえに　鹿児島,11/10(日) 18:48
mbcnews,MBC南日本放送,奄美地方では10日夜遅くにかけて土砂災害に厳重警戒,11/10(日) 18:44
mbcnews,MBC南日本放送,横断歩道を渡っていた女性が軽乗用車にはねられ大けが　運転の無職女（81）を逮捕　薩摩川内市,11/10(日) 18:34
mbcnews,MBC南日本放送,洪水警報が和泊町などに発表,11/10(日) 14:47
mbcnews,MBC南日本放送,奄美地方では非常に激しい雨が降るおそれ,11/10(日) 12:36
mbcnews,MBC南日本放送,列車と軽乗用車が衝突　1人搬送　出水市・肥薩おれんじ鉄道,11/10(日) 11:53
mbcnews,MBC南日本放送,伊佐市長選3人が立候補　現職・新人の三つどもえか　鹿児島,11/10(日) 11:51
mbcnews,MBC南日本放送,鹿児島県交通取締り情報2024年11月10日（日）,11/10(日) 6:02
mbcnews,MBC南日本放送,奄美大島近海で地震 伊仙町で最大震度1 津波の心配なし,11/10(日) 4:36
mbcnews,MBC南日本放送,大隅半島東方沖で地震 鹿屋市などで最大震度2 津波の心配なし,11/10(日) 0:58
mbcnews,MBC南日本放送,列車と軽乗用車が衝突　1人搬送　肥薩おれんじ鉄道　鹿児島,11/9(土) 19:57
mbcnews,MBC南日本放送,ガラスアートや畳製作などのものづくりを体験　「県技能まつり」始まる　鹿児島市,11/9(土) 19:08
mbcnews,MBC南日本放送,一時、大雨特別警報発表の与論町　10日再び非常に激しい雨のおそれ　鹿児島（午後6時）,11/9(土) 18:17
mbcnews,MBC南日本放送,与論町に一時大雨特別警報　浸水や土砂崩れの被害　鹿児島,11/9(土) 17:56
mbcnews,MBC南日本放送,与論町の大雨特別警報は大雨警報に切り替えも…10日奄美北部で激しい雨のおそれ　鹿児島（午後3時）,11/9(土) 15:24
mbcnews,MBC南日本放送,MBC旗争奪高校野球選抜1年生大会　決勝に進んだのは　鹿児島,11/9(土) 15:09
mbcnews,MBC南日本放送,与論町の大雨特別警報が大雨警報に切り替え,11/9(土) 14:04
mbcnews,MBC南日本放送,大雨特別警報の与論町　避難所10か所開設　避難者なし（正午時点）,11/9(土) 13:18
mbcnews,MBC南日本放送,大雨特別警報の与論町　浸水28棟、道路冠水32か所　土砂崩れで通行止めも　鹿児島（午後1時）,11/9(土) 13:12
mbcnews,MBC南日本放送,与論町に大雨特別警報　夕方にかけ1時間50ミリの非常に激しい雨か　鹿児島,11/9(土) 13:04
mbcnews,MBC南日本放送,大雨特別警報の与論島　きょう9日夕方にかけ非常に激しい雨のおそれ　鹿児島（9日正午）,11/9(土) 12:53
mbcnews,MBC南日本放送,鹿児島・与論町に大雨特別警報　気象予報士解説,11/9(土) 12:19
mbcnews,MBC南日本放送,【台風情報】台風23号、24号が発生　気象庁の予想詳しく【14日（木）までの雨・風シミュレーションと進路予想】,11/9(土) 12:17
mbcnews,MBC南日本放送,鹿児島・与論町に大雨特別警報　1日半で1年間の1/3の雨量　土砂災害に厳重警戒,11/9(土) 12:06
mbcnews,MBC南日本放送,与論町　大雨で交通に乱れ　フェリー・空の便は条件付き運航、バスは一部運休の可能性（午前11時）,11/9(土) 10:34
mbcnews,MBC南日本放送,大雨特別警報の与論町　浸水25棟、道路冠水31か所　土砂崩れで通行止めも　鹿児島（午前9時半）,11/9(土) 10:19
mbcnews,MBC南日本放送,奄美・与論島に大雨特別警報　1日半で1年間に降る3分の1の雨量与論町で時間雨量120ミリ　土砂災害に厳重警戒,11/9(土) 10:14
mbcnews,MBC南日本放送,大雨被害の与論町に災害救助法を適用　避難所の設置費用など国・県が負担　鹿児島,11/9(土) 9:27
mbcnews,MBC南日本放送,大雨特別警報の与論島　1日半で年間総雨量3分の1の雨　9日夕方にかけ猛烈な雨のおそれ　鹿児島（午前8時半）,11/9(土) 8:53
mbcnews,MBC南日本放送,インドネシアで大規模噴火　気象庁が日本への津波有無を調査,11/9(土) 8:08
mbcnews,MBC南日本放送,大雨特別警報の与論町　10か所に避難所開設、4人避難　鹿児島（午前7時時点）,11/9(土) 7:36
mbcnews,MBC南日本放送,九州自動車道　人吉IC〜八代JCT上り　八代IC〜人吉IC下り　通行止め解除,11/9(土) 7:27
mbcnews,MBC南日本放送,沖永良部島の洪水警報解除　与論町の大雨特別警報は継続　鹿児島,11/9(土) 7:08
mbcnews,MBC南日本放送,大雨特別警報の与論町　浸水28棟、道路冠水31か所　土砂崩れで通行止めも「これまでにない大雨だった」鹿児島（午後1時）,11/9(土) 6:48
mbcnews,MBC南日本放送,九州自動車道　人吉IC〜八代JCT上り　八代IC〜人吉IC下り　車両火災で通行止め,11/9(土) 6:47
mbcnews,MBC南日本放送,与論島に大雨特別警報　1日半で年間総雨量3分の1の雨　低地の浸水・土砂災害に最大級の警戒を　鹿児島,11/9(土) 6:17
mbcnews,MBC南日本放送,鹿児島県交通取締り情報2024年11月09日（土）,11/9(土) 6:02
mbcnews,MBC南日本放送,「沖永良部島にも大雨特別警報発表の可能性」与論島への大雨特別警報を受け気象台が会見　鹿児島,11/9(土) 5:14
mbcnews,MBC南日本放送,大雨特別警報の与論町　10か所に避難所開設、2人避難　（午前4時時点）,11/9(土) 4:54
mbcnews,MBC南日本放送,大雨特別警報の与論町　役場に避難した90代女性が体調不良訴え搬送　浸水被害16棟（午前4時）,11/9(土) 4:38
mbcnews,MBC南日本放送,与論町は災害対策本部立ち上げ　町内9か所に避難所　鹿児島,11/9(土) 4:26
mbcnews,MBC南日本放送,奄美・与論島に大雨特別警報　与論町で時間雨量120ミリ　8日から2度目の記録的短時間大雨情報　土砂災害に厳重警戒,11/9(土) 3:42
mbcnews,MBC南日本放送,大雨特別警報が与論町に発表,11/9(土) 2:42
mbcnews,MBC南日本放送,奄美に線状降水帯　与論町で時間雨量120ミリ　8日から2度目の記録的短時間大雨情報　土砂災害に厳重警戒　鹿児島県,11/9(土) 2:21
mbcnews,MBC南日本放送,与論町に記録的短時間大雨情報　和泊町、知名町、与論町に土砂災害警戒情報,11/9(土) 1:34
mbcnews,MBC南日本放送,洪水警報が和泊町に発表,11/9(土) 1:19
mbcnews,MBC南日本放送,奄美地方に線状降水帯発生情報,11/9(土) 1:13
mbcnews,MBC南日本放送,[速報]鹿児島県内に記録的短時間大雨情報を発表,11/9(土) 1:09
mbcnews,MBC南日本放送,大雨洪水警報が知名町に発表,11/9(土) 0:59
mbcnews,MBC南日本放送,総務省所管の労働力調査で枕崎市の調査員が調査員証を紛失　鹿児島県が注意呼びかけ,11/8(金) 21:51
mbcnews,MBC南日本放送,【九州土日の天気】10日（日）は雨  七五三が心配 【福岡・佐賀・長崎・大分・熊本・宮崎・鹿児島】11日（月）までの雨と雲のシミュレーション,11/8(金) 21:02
mbcnews,MBC南日本放送,与論町で時間雨量139ミリ　総雨量も平年ひとつきの3倍近く　土砂災害に厳重警戒　鹿児島,11/8(金) 20:44
mbcnews,MBC南日本放送,かごしま南北600キロ　淡いピンクの花々…寿命はたった1日「酔芙蓉」が見ごろ　鹿児島・薩摩川内市,11/8(金) 20:36
mbcnews,MBC南日本放送,出水市で野鳥のねぐらの水から高病原性鳥インフルエンザ検出　鹿児島県内では今季初,11/8(金) 20:32
mbcnews,MBC南日本放送,色鮮やかな15万本のコスモスに多くの見物客　思い思いに楽しむ　鹿児島市,11/8(金) 20:29
mbcnews,MBC南日本放送,鹿児島県与論島に【記録的短時間大雨情報】大雨の理由は?,11/8(金) 20:21
mbcnews,MBC南日本放送,県高校ラグビー決勝「鹿実vs鹿工」それぞれの見どころ　鹿児島,11/8(金) 20:21
mbcnews,MBC南日本放送,南日本銀行　連結経常収益9期ぶり増　サンロイヤルホテルについては…　中間決済　鹿児島,11/8(金) 20:21
mbcnews,MBC南日本放送,「熱意が鹿児島にオーケストラを作った」創立50周年の鹿児島交響楽団　100回目の定期演奏会へ,11/8(金) 20:08
mbcnews,MBC南日本放送,「奄美の人の思いを背負って」高校演劇部が奄美本土復帰を描いた「朝は明けたり」熱演　県高校演劇祭,11/8(金) 20:02
mbcnews,MBC南日本放送,鹿児島市長選投票所整理券を郵便局へ引き渡し　11月17日告示,11/8(金) 19:57
mbcnews,MBC南日本放送,ICT導入補助金を不正受給　沖永良部の介護老人施設に260万円返還命令　鹿児島市議代表の会社含め刑事告訴検討,11/8(金) 19:54
mbcnews,MBC南日本放送,今後の雨は?気象予報士の解説　鹿児島,11/8(金) 19:51
mbcnews,MBC南日本放送,与論町で1時間に139ミリ　記録的短時間大雨情報　鹿児島,11/8(金) 19:48
mbcnews,MBC南日本放送,与論町で時間雨量139ミリ　被害・影響まとめ（午後4時半）　鹿児島県,11/8(金) 16:57
mbcnews,MBC南日本放送,鹿児島の小学生も挑戦!海の研究コンテスト,11/8(金) 16:29
mbcnews,MBC南日本放送,与論町で1時間に139ミリ　記録的短時間大雨情報,11/8(金) 16:12
mbcnews,MBC南日本放送,出水市　水鳥のねぐらから高病原性鳥インフルエンザ検出,11/8(金) 16:08
mbcnews,MBC南日本放送,JACの航空機購入に関する国の補助金一部「不当」　約700万円を返還へ　会計検査院が指摘　鹿児島,11/8(金) 15:51
mbcnews,MBC南日本放送,与論町で1時間に139ミリ　20か所が冠水　床上床下浸水も　記録的短時間大雨情報　鹿児島,11/8(金) 14:12
mbcnews,MBC南日本放送,【速報】与論町で1時間に139ミリ　記録的短時間大雨情報,11/8(金) 13:54
mbcnews,MBC南日本放送,[速報]鹿児島県内に記録的短時間大雨情報　与論町で1時間に139ミリ　20か所が冠水　床上床下浸水も,11/8(金) 13:44
mbcnews,MBC南日本放送,伊佐市に新設予定の特別支援学校は2029年春開校予定　鹿児島,11/8(金) 12:17
mbcnews,MBC南日本放送,あす9日から秋の全国火災予防運動　8日朝アミュプラザ鹿児島で消防訓練　鹿児島,11/8(金) 12:14
mbcnews,MBC南日本放送,日本民間放送連盟賞　MBC制作2番組が優秀賞受賞　鹿児島,11/8(金) 12:11
mbcnews,MBC南日本放送,鹿児島県交通取締り情報2024年11月08日（金）,11/8(金) 10:02
mbcnews,MBC南日本放送,釣りに出ようと乗り込んだボートから転落　溺れた男性（81）死亡　鹿児島,11/7(木) 22:18
mbcnews,MBC南日本放送,11月7日は立冬　今季最低の3.7度観測も奄美は夏日アイスクリームに海水浴,11/7(木) 19:36
mbcnews,MBC南日本放送,イノシシが目の前を猛スピードで…　子どもの通学路に出没「遭遇したらゆっくり離れて」,11/7(木) 19:32
mbcnews,MBC南日本放送,全国大会をかけた中学生の熱い戦い　最後まで混戦に　鹿児島県中学校駅伝大会,11/7(木) 19:28
mbcnews,MBC南日本放送,関税導入など不安…一方で経済対策に期待も　アメリカへ海産物輸出企業　不安と期待が交錯　鹿児島,11/7(木) 19:28
mbcnews,MBC南日本放送,「拉致問題にもう一回、力を貸して」　トランプ前大統領返り咲きに被害者家族の市川健一さん　鹿児島,11/7(木) 19:28
mbcnews,MBC南日本放送,トランプ氏勝利　安全保障の専門家・香田洋二氏「南西諸島防衛“鹿児島の重要さ増す”」,11/7(木) 19:24
mbcnews,MBC南日本放送,米大統領選「家族でも話はタブー」アメリカ出身の鹿児島県在住者が語る母国の分断,11/7(木) 19:21
mbcnews,MBC南日本放送,青森りんご出前授業　皮ごと横向き輪切り「スターカット」鹿児島市の小学校で開かれる,11/7(木) 19:21
mbcnews,MBC南日本放送,トランプ氏勝利　ニューヨーク在住の奄美大島出身者「マンハッタンは普段通り」,11/7(木) 19:17
mbcnews,MBC南日本放送,高校生から70代まで県テニス選手権　鹿児島県内チャンピオンが決定,11/7(木) 19:14
mbcnews,MBC南日本放送,アメリカ大統領選挙　鹿児島県民はどう受け止めた?「突拍子もない」「どんな影響あるのか…」,11/7(木) 19:11
mbcnews,MBC南日本放送,奄美大島北東沖で地震　鹿児島十島村で最大震度1　津波の心配なし,11/7(木) 18:14
mbcnews,MBC南日本放送,感染症情報　「手足口病」の感染者増加続く　インフルエンザは2週連続減少　鹿児島,11/7(木) 17:06
mbcnews,MBC南日本放送,インドネシアで大規模噴火　日本への津波の有無を調査　気象庁,11/7(木) 16:59
mbcnews,MBC南日本放送,桜島の海上「漂流者を揚収した」80代男性が意識不明の重体　鹿児島市高免町,11/7(木) 16:08
mbcnews,MBC南日本放送,「倉庫の中にあるガラクタから火が出た」枕崎市で火災　鹿児島,11/7(木) 16:06
mbcnews,MBC南日本放送,鹿児島県内の経済情勢「緩やかに回復しつつある」物価上昇も季節家電の売れ行きなど好調,11/7(木) 16:04
mbcnews,MBC南日本放送,マッチングアプリの“よしこ”「一緒にオンラインショップ運営しよう」→700万被害　“特別調査班ヤマグチ”「詐欺捜査でお金調べるから送って」→900万円被害　詐欺手口を警察が詳しく公開,11/7(木) 15:53
mbcnews,MBC南日本放送,【九州の天気】きょう立冬なのに来週は夏日!?【福岡・佐賀・長崎・大分・熊本・宮崎・鹿児島】14日（木）までの天気予報,11/7(木) 14:22
mbcnews,MBC南日本放送,きょう11月7日は立冬　霜や川霧も　伊佐市で県内今季最低の3.7度観測　鹿児島,11/7(木) 11:58
mbcnews,MBC南日本放送,鹿児島県交通取締り情報2024年11月07日（木）,11/7(木) 6:02
mbcnews,MBC南日本放送,薩摩半島西方沖で地震 薩摩川内市甑島で最大震度1 津波の心配なし,11/7(木) 4:48
mbcnews,MBC南日本放送,県警・野川前本部長　自動車安全運転センターに異動,11/6(水) 21:11
mbcnews,MBC南日本放送,天気予報でよく耳にする「アメダス」とは?導入から半世紀　線状降水帯予測には課題　鹿児島,11/6(水) 19:51
mbcnews,MBC南日本放送,カニやイクラに大行列!「第60回記念　北海道の物産と観光展」山形屋できょう6日からはじまる,11/6(水) 19:41
mbcnews,MBC南日本放送,夏のような暑さから一転、気温ぐっと↓　鹿児島で9度…今季一番の冷え込み　焼きいもに行列,11/6(水) 19:22
mbcnews,MBC南日本放送,フェリー屋久島2　運休1か月「魚を島外に送れない」「材料が届かない」影響広がる　鹿児島,11/6(水) 19:11
mbcnews,MBC南日本放送,若手料理人ナンバーワンは?　磨き上げた腕競う　城山ホテルで料理コンペ　鹿児島,11/6(水) 19:08
mbcnews,MBC南日本放送,クレーンゲーム歴30年以上　鹿児島大・小山圭一教授が理科の出前授業「磁石の素晴らしさ知った」　鹿児島・奄美市,11/6(水) 19:06
mbcnews,MBC南日本放送,ミカンコミバエ　今年度は9市町村で昨年度上回る50匹確認,11/6(水) 19:01
mbcnews,MBC南日本放送,沖に流された船を追い溺れたか　71歳の男性が意識不明の重体　鹿児島新港,11/6(水) 18:49
