media_en,media_jp,title_articles,link_articles,date_original
yomidr,読売新聞（ヨミドクター）,［小林克也さん］3度のがん　発見のきっかけは「妻のぎっくり腰」…胃の手術は長時間に,https://news.yahoo.co.jp/articles/d4a9c0a59d4efe100ddf25885d8a67cc5effe838,2/24(土) 17:10
yomidr,読売新聞（ヨミドクター）,練りようかんから作る水ようかん…レンジで超カンタン、お年寄りにも食べやすい,https://news.yahoo.co.jp/articles/6446652cc48a4a0e7c8d5a8d261f1f3fd9fdb436,2/24(土) 15:10
yomidr,読売新聞（ヨミドクター）,妊婦健診、出産は無料　支援が手厚いフランスの子育てを紹介…日本で生活保護ワーカーとして働き、燃え尽きた経験も,https://news.yahoo.co.jp/articles/27284aaf781201b98348f61f6b77ba65a3b58402,2/23(金) 18:40
yomidr,読売新聞（ヨミドクター）,人生100年時代　80歳代でも「老衰」で亡くなる？　坂田利夫さんは82歳…穏やかな死を迎えるために必要なこと,https://news.yahoo.co.jp/articles/efe4d6d5dd836583b99c5c4960a975839920134f,2/23(金) 17:10
yomidr,読売新聞（ヨミドクター）,人手不足の介護業界　現場から仕事の魅力を発信する動き…「きつい」イメージ転換へ,https://news.yahoo.co.jp/articles/898d6fa1c7cbb3e67d25d5072ed98513f9954cb5,2/23(金) 11:40
yomidr,読売新聞（ヨミドクター）,レビー小体型認知症と診断されて8年　一人暮らしを続けて職場に通勤する59歳…「働き続けたい」という気持ちは大切に,https://news.yahoo.co.jp/articles/b72a8b5b34dd3bd363a7f8b67e7a544ded4d15c4,2/22(木) 17:10
yomidr,読売新聞（ヨミドクター）,55歳になって部長を退いた　その後の会社生活どう過ごせばよいか？…給与も減って部下もいなくなった,https://news.yahoo.co.jp/articles/d26a3e98366e8f541786d14d97e1c537c40409eb,2/22(木) 11:40
yomidr,読売新聞（ヨミドクター）,要介護認定の80歳代男性が四肢まひの妻を介護　「全て終わらせたいと考えたことも」…介護者支援の取り組み道半ば,https://news.yahoo.co.jp/articles/1e2d98756c69172fb72721726383f31ceb454181,2/22(木) 11:20
yomidr,読売新聞（ヨミドクター）,自分の膝にハサミを突き立てた40歳代女性　訴えは「先生、死ねる薬を出してよ」…消えない痛みにどう向き合うか,https://news.yahoo.co.jp/articles/dfd3b050954422ab80fae47f295dc429b5e5da79,2/21(水) 17:10
yomidr,読売新聞（ヨミドクター）,犬にかまれて男女12人が負傷　犬はなぜ人をかむのか　子どもに教えておきたい8か条…飼うなら子どもが何歳になってから？,https://news.yahoo.co.jp/articles/9105268b5e0f73e8198200d5082952d0da0547d4,2/21(水) 11:03
yomidr,読売新聞（ヨミドクター）,「災害が起きたのに不妊治療をしていていいの？」　東日本大震災が発生した時、40歳代女性が抱いた罪悪感…「心の持ちよう」は,https://news.yahoo.co.jp/articles/774f97151cf2ba26adca3b5acb657264edb6aa40,2/20(火) 17:10
yomidr,読売新聞（ヨミドクター）,カスタマーハラスメント　どんな行為が該当？…精神障害を労災認定する基準として新たに追加,https://news.yahoo.co.jp/articles/51d23e7c807493e40956a993a29219dd113af751,2/20(火) 11:11
yomidr,読売新聞（ヨミドクター）,白内障手術　単焦点レンズと多焦点レンズ　どちらを選択すべきなのか…多焦点なら眼鏡は不要になる？,https://news.yahoo.co.jp/articles/29fc05c8cef025b7a346a1cb4cca1c95aeec9501,2/19(月) 17:40
yomidr,読売新聞（ヨミドクター）,インフルエンザや新型コロナだけではない　冬に悪化しやすい呼吸器の病気…中高年女性や高齢者が気をつけたいものも,https://news.yahoo.co.jp/articles/87a89446ceed00ca8aca68ea34a73d50b7b1f342,2/19(月) 11:40
yomidr,読売新聞（ヨミドクター）,おたふくかぜの予防ワクチン　副反応で高熱を伴う無菌性髄膜炎が起こる頻度は？…日本小児科学会が大規模調査,https://news.yahoo.co.jp/articles/5f73483af50d04ea38304e8db6636c62fad0f53b,2/18(日) 17:10
