media_en,media_jp,title_articles,link_articles,date_original
ishikawa,石川テレビ,能登半島地震の影響で休館続いたのとじま水族館…再オープン前に水族館から中継,https://news.yahoo.co.jp/articles/21cefcbc51e229cce601ca1ffaed7ab07edce0e5,No date found
ishikawa,石川テレビ,20日に金沢で子供向けサッカー教室…元日本代表・小野伸二さん「子供達が最初から最後まで楽しい環境を」,https://news.yahoo.co.jp/articles/36b35852be587fd140d2ae687edaa98391aa1fac,No date found
ishikawa,石川テレビ,入居期間過ぎても居住可能…家賃払うと住み続けられる『石川モデル』の仮設住宅 県内で初めて穴水町に完成,https://news.yahoo.co.jp/articles/e22c708eb9b610f4480f7838a664b45fb87cd1db,No date found
ishikawa,石川テレビ,二次避難中の生徒はオンライン参加…輪島高校で終業式「最高の文化祭にしたい」夏休みに動画企画など準備へ,https://news.yahoo.co.jp/articles/44977127d890f91278aac2f8f7f96d6641dfcdc4,No date found
ishikawa,石川テレビ,地震の影響で“合同授業”も打ち解ける…輪島の小学校で2校の児童が一緒に終業式 共に学んだ1学期終える,https://news.yahoo.co.jp/articles/6e48edcd956ae545e3049730bbfd9a258b7f0c56,No date found
ishikawa,石川テレビ,能登の災害ボランティアバス車内で女性2人の体触ったか…51歳の男は起訴内容認める,https://news.yahoo.co.jp/articles/eed5dc3e424faedb0ccd04d1964a6128e1a55779,No date found
ishikawa,石川テレビ,能登半島地震で採用の仮設住宅「石川モデル」の入居開始…有償で提供も,https://news.yahoo.co.jp/articles/8e85acb2fad006d6b54eab55f959023112ac9aff,No date found
ishikawa,石川テレビ,ルビーロマン初競りで1房100万円の高値！落札金額は能登半島地震の義援金として寄付,https://news.yahoo.co.jp/articles/b877048cc04f8268f78f0987dc43fb98777fe6cb,No date found
ishikawa,石川テレビ,2階の壁を突き破って来る…隣の解体ビルから老舗飲食店内に『コンクリ塊』壁が6mにわたり崩れ料理長絶句,https://news.yahoo.co.jp/articles/0bcecf7e103dcec36d9ce8f11817dd49f2dd9651,No date found
ishikawa,石川テレビ,大切な物捨てるか悩んだ人も…能登の被災地で家財道具の置き場が不足「荷物置く所なく解体の申請できない」,https://news.yahoo.co.jp/articles/d8c13d22cb97ae2aeb03c9018dfa7dabfc90230e,No date found
ishikawa,石川テレビ,地震被害乗り越えインターハイへ…サッカー元代表の槙野さんが鵬学園を激励「石川県の希望となれるように」,https://news.yahoo.co.jp/articles/18cdc010d3a4df54456aa804026a5812bfb9d7cf,No date found
ishikawa,石川テレビ,大関復帰目指す霧島を下す…大相撲名古屋場所5日目 関脇・大の里は勝って2勝3敗に 19日は明生と対戦,https://news.yahoo.co.jp/articles/62b146cea96370dc21b69865c9dc199dba55d1a7,No date found
ishikawa,石川テレビ,レセプトの不正請求で金沢の医院の保険医療機関指定を取り消し…医院側は患者に便宜はかったと主張,https://news.yahoo.co.jp/articles/2b15e208f4de0bcf18f8d3770a67bfe419148dca,No date found
ishikawa,石川テレビ,能登人を訪ねて#16…輪島・門前町の總持寺祖院,https://news.yahoo.co.jp/articles/e8ae3b86cee8a6abcb178b6ad6be3ccaefb7dff8,No date found
ishikawa,石川テレビ,能登半島地震の応急修理制度の追加経費を県が負担へ,https://news.yahoo.co.jp/articles/3e9e98a764e99a9022faf3d5827cdc2f28be96db,No date found
ishikawa,石川テレビ,酒気帯び運転で検挙された消防士が停職2カ月の懲戒処分に,https://news.yahoo.co.jp/articles/333ceb98f6f8b767278c47b7098f5e9745362e9d,No date found
ishikawa,石川テレビ,校長や教師に135万5000円の支払い求める…学校プールの水が最大15日間流出した問題で小松市,https://news.yahoo.co.jp/articles/9647b457ff1d5b08a2585bc6ac51f2d1f87f97a0,No date found
ishikawa,石川テレビ,被災自治体からは半壊未満の住宅支援などを求める声…2回目の復興基金意見交換会,https://news.yahoo.co.jp/articles/a3345400103c18ba2f93849e8d2ece0b98c7d51a,No date found
ishikawa,石川テレビ,芥川賞に朝比奈秋さん…去年には泉鏡花文学賞を受賞,https://news.yahoo.co.jp/articles/6affbf65ca0ce9ded1cb54a196243f2af9b8b471,No date found
ishikawa,石川テレビ,石川県では今年初の熱中症警戒アラート発令…水分補給など熱中症に警戒を！,https://news.yahoo.co.jp/articles/b508987a7036d505fb54b514cea4e83146c7160e,No date found
ishikawa,石川テレビ,金沢市内の都市ガスなど供給する金沢エナジーで委託先に不正アクセス,https://news.yahoo.co.jp/articles/1b167b02744343f56779308d967ba23b31b8d0f4,No date found
ishikawa,石川テレビ,大きな社会問題となっている”カスハラ”について法律の専門家に聞く,https://news.yahoo.co.jp/articles/9007efee05d2f07e3ef1cb889d2e7b9eea8f0211,No date found
ishikawa,石川テレビ,公費解体の加速化に向け議論…「能登創造的復興タスクフォース」が初の会議 仮置き場増設の必要性など確認,https://news.yahoo.co.jp/articles/8ea4b758e81f53ad8f4a495343b7fdb154718058,No date found
ishikawa,石川テレビ,能登半島地震から半年　七尾市の課題をトップに聞く,https://news.yahoo.co.jp/articles/551dc7e6f88bd2f4ac081393b9f0ee2a9da94fac,No date found
ishikawa,石川テレビ,能登と金沢つなぐ石川の大動脈…のと里山海道と能越自動車道が全線通行止め解除 一部で片側交互通行等残る,https://news.yahoo.co.jp/articles/1f00c3e84ccc45754c1d6204396f2ddf7cdcebad,No date found
ishikawa,石川テレビ,箱一杯に詰められる…能登の小学校に花火のプレゼント届く 愛知のメーカーから8市町の小学生4500人へ,https://news.yahoo.co.jp/articles/96b2a4226b92926af7cd1c5032efe78a39fd1c7f,No date found
ishikawa,石川テレビ,早くも3敗目…大相撲名古屋場所4日目 新関脇・大の里は先場所敗れた同い年の平戸海に屈す 明日は霧島と,https://news.yahoo.co.jp/articles/e53ab0ad6c801b0a6d7572d29442b233b79d1ff5,No date found
ishikawa,石川テレビ,京都市の男性から600万円だまし取る　プルデンシャル元社員　再逮捕,https://news.yahoo.co.jp/articles/067706f46184a111fcbe439ee42d8810c69bd7e6,No date found
ishikawa,石川テレビ,子どもの交通事故防げ　音と光りで注意促す道路標識,https://news.yahoo.co.jp/articles/c249f8ef7006545a624b6984fe2adf4a742a3778,No date found
ishikawa,石川テレビ,七尾の空に復興の花火を…七尾と新潟の児童がオンラインで計画話し合う,https://news.yahoo.co.jp/articles/96c1fc1007369f30c73032ee31914b7a39e9f91d,No date found
ishikawa,石川テレビ,火災で店失い192日ぶり…輪島・朝市通りの海鮮丼店『わら』かほくで再出発 開店日の11日に込めた想い,https://news.yahoo.co.jp/articles/b2acbf8f2bf50980273aff87682c480ebaa8cf1f,No date found
ishikawa,石川テレビ,進まぬ復興知り輪島へ…人手不足の施設に就職した介護職の男性に“住む場所なし”「人が来られる仕組みを」,https://news.yahoo.co.jp/articles/a9f788f4ab32280d4235e08ab44077749157dd0a,No date found
ishikawa,石川テレビ,国の制度が使えない事業に用意…復興基金540億円どう使う 能登6市町のトップ全員「集会所等の再建を」,https://news.yahoo.co.jp/articles/d2a907d32df2cccd8bc4b9f2d899ce7299a6c780,No date found
ishikawa,石川テレビ,ようやく初日出る…大相撲名古屋場所3日目 新関脇・大の里が小結・大栄翔に勝利 1勝2敗で明日は平戸海,https://news.yahoo.co.jp/articles/f2a194ebc28874f4c1a7bbde0194efcb59ffd2c6,No date found
ishikawa,石川テレビ,元事務局長の不祥事受け…秋のプライドパレードは実施へ,https://news.yahoo.co.jp/articles/75007f69e4a623d3160acb860f111769ae1630a7,No date found
ishikawa,石川テレビ,復興基金540億円の使い道は…市町との意見交換会,https://news.yahoo.co.jp/articles/4d42f12fa0b2c720d8439700cec0cd004da45d62,No date found
ishikawa,石川テレビ,能登半島地震からの復興に向けた道筋を聞く…大森凡世能登町長,https://news.yahoo.co.jp/articles/a0a2b6c6ac22782b057afe4875110eb69006e6a8,No date found
ishikawa,石川テレビ,終了間際に負傷交代も…なでしこジャパン・北川ひかる 地元の金沢で先発出場し存在感を発揮 ガーナに快勝,https://news.yahoo.co.jp/articles/f6b17d4681cc7af12096f3185ebfd3219319587e,No date found
ishikawa,石川テレビ,栗山英樹さんも視察…夏の高校野球石川大会でプロ注目・金沢の齋藤が活躍「聞いていた以上に素晴らしい」,https://news.yahoo.co.jp/articles/f57f44f154a9e272a2028962814b63a973a3eb93,No date found
ishikawa,石川テレビ,奥能登で唯一開設…「海の日」能登町の五色ヶ浜海水浴場で海開き 海の色が一日で五色に変化と伝わる美しさ,https://news.yahoo.co.jp/articles/077da49a8362901e286887f780372a144ac84a67,No date found
ishikawa,石川テレビ,大相撲名古屋場所2日目 二場所連続優勝目指す大の里は若元春に逆転で敗れる 初日の御嶽海戦に続き2連敗,https://news.yahoo.co.jp/articles/dfabd8d8934ebd15b9f855f842cf223b968bc10f,No date found
ishikawa,石川テレビ,七尾市和倉町の護岸で男性の遺体が漂着…警察が身元の確認急ぐ,https://news.yahoo.co.jp/articles/1303a4149ddf701db7f8a8912a581086f24853ed,No date found
ishikawa,石川テレビ,2場所連続優勝かかる大の里は黒星発進…大相撲名古屋場所初日,https://news.yahoo.co.jp/articles/741cda4620a03ce37aba468f2d0a09073a8c7430,No date found
ishikawa,石川テレビ,地震で70基以上の墓石が倒壊し臨時の献花所も…金沢は新盆に合わせて墓参り,https://news.yahoo.co.jp/articles/e3bae231d1ad1b77c70c70f004bd6d7c17e3713f,No date found
ishikawa,石川テレビ,火元は2階ダイニングキッチンか…石川県川北町で木造2階建て半焼の火事,https://news.yahoo.co.jp/articles/b9dde5b1f6a3698a618b5db85d26807301fdb737,No date found
ishikawa,石川テレビ,航空石川と星稜は危なげなくコールド勝ちで初戦突破…夏の高校野球石川県大会,https://news.yahoo.co.jp/articles/3d990e8720af6f3a2b6adcbd561f199a112b7dbc,No date found
ishikawa,石川テレビ,地元企業と学生によるコラボ…金沢文化服装学院が産学連携でファッションショー,https://news.yahoo.co.jp/articles/51376a1d0d822a2a755b4c9a336fd42cd63c2a33,No date found
ishikawa,石川テレビ,待ちわびた客で開店前から長蛇の列…半年ぶり能登のスーパーが営業再開,https://news.yahoo.co.jp/articles/d5a75bb80bba589ef9078b491ace94571fb66dc0,No date found
ishikawa,石川テレビ,パリ五輪へ弾み！なでしこジャパンがガーナ相手にゴールラッシュ,https://news.yahoo.co.jp/articles/2c69ef83b2108c5383ea4e3a5682d3546dd716e8,No date found
ishikawa,石川テレビ,「つめたーい」けど「楽しい！」３連休の初日…海水浴客でにぎわう,https://news.yahoo.co.jp/articles/ce6569ee3fa9d714a0bf001f13db9f9b5d3102e5,No date found
