media_en,media_jp,title_articles,link_articles,date_original
ishikawa,石川テレビ,珠洲や金沢でコワーキングスペースを運営する伊藤紗恵さんに聞く…能登半島地震からの女性のなりわい再建,https://news.yahoo.co.jp/articles/a0c7d65136e73e6b11f44ed571047815a435401a,9/7(土) 12:55
ishikawa,石川テレビ,幻想の世界と幻想の世界から着想を得た絶品スイーツが楽しめる石川県立美術館の展覧会「武井武雄展」,https://news.yahoo.co.jp/articles/511c1d19a63c5edd79244aec9941bae6881098e3,9/7(土) 12:48
ishikawa,石川テレビ,ドローンを使ってプログラミングを学ぶ特別授業　金沢大学准教授が講師を務め連携した特別講義,https://news.yahoo.co.jp/articles/bf88306f97cb5ee2dbce7b210a5f3c27f06c0511,9/7(土) 12:22
ishikawa,石川テレビ,能登半島地震で遅れが指摘される公費解体…来年10月までの目標変えないものの輪島の遅れ目立つ,https://news.yahoo.co.jp/articles/0520918c9f4701126cbb60f3dc93b791949d77b6,9/7(土) 12:20
ishikawa,石川テレビ,実りの秋に「生きる」メッセージ…能登半島地震で甚大被害の輪島市町野町で古代米アートがくっきりと,https://news.yahoo.co.jp/articles/cc05ce56710fef31f87d9e199b041b0644fa79b7,9/7(土) 12:14
ishikawa,石川テレビ,能登半島地震の津波は「頻度は極めて低い」として堤防の高さはこれまで通りに再整備へ,https://news.yahoo.co.jp/articles/d0bf174de7c6307ae6abda3e37c3ae3ac3e95a1a,9/7(土) 12:14
ishikawa,石川テレビ,石川ゆかりのパラカヌー・瀬立モニカ選手が3大会連続のパラリンピックに挑戦…見事予選通過し準決勝へ,https://news.yahoo.co.jp/articles/60867c0494fa81bbaa6d1710eaa4b84af428de92,9/7(土) 12:05
ishikawa,石川テレビ,自宅アパートで寝ていた女性を監禁してケガさせ性的暴行加えようとした罪 公務員の33歳男に懲役6年求刑,https://news.yahoo.co.jp/articles/534de2b547cf31a0ffbf0cf275f112a392ad218d,9/6(金) 18:54
ishikawa,石川テレビ,狛江市で高齢女性が死亡した強盗事件 元少年に懲役23年の実刑判決「犯行に不可欠な行為し役割は重要」,https://news.yahoo.co.jp/articles/b899cf5e02b7d9550a3b88553fd4f8e003e330b4,9/6(金) 18:44
ishikawa,石川テレビ,被災した能登の酒蔵の銘柄も並ぶ…日本酒の『ひやおろし』が6日解禁 珠洲市の「宗玄」を買いに来た人も,https://news.yahoo.co.jp/articles/e680a96f9710da5095e63f24b3314b8005432829,9/6(金) 18:40
ishikawa,石川テレビ,成績次第で“大関昇進”も…石川県津幡町出身の関脇・大の里 秋場所初日で熱海富士と対戦 過去2戦2勝,https://news.yahoo.co.jp/articles/4290dc58eba9a8d99468790c0e23e25f448be16b,9/6(金) 18:36
ishikawa,石川テレビ,道路で四つんばい状態になっていた高齢男性が乗用車にひかれ死亡…警察が事故原因を捜査,https://news.yahoo.co.jp/articles/17bc87968c841fa9b37b1b369117a89c8838b4cd,9/6(金) 12:22
ishikawa,石川テレビ,先輩・角中選手に続け！中学生の硬式野球チーム「金沢リトルシニア」卒団式…高校でも全員が野球続ける,https://news.yahoo.co.jp/articles/53d8eace22de0f233fea0567282c5cd7dda4b529,9/6(金) 12:22
ishikawa,石川テレビ,台風10号は「サンサン」台風11号は「ヤギ」台風の名前は14カ国で順番につけていた,https://news.yahoo.co.jp/articles/05ebd0617431d14effbb32bd659b52f8ab47cea1,9/5(木) 19:27
ishikawa,石川テレビ,能登半島地震からの復興へ前を向く能登人「七尾・能登島でのタコ漁に励む男性」,https://news.yahoo.co.jp/articles/842d0e44688fa93000cf9fabcceaf54114e00c2d,9/5(木) 19:20
ishikawa,石川テレビ,来年2月任期満了…石川県の内灘町長選挙 現職の川口氏が4選目指し立候補を表明「復旧復興を第一に邁進」,https://news.yahoo.co.jp/articles/d85fa58fce0109da80268d81575ea946c9d57f21,9/5(木) 18:57
ishikawa,石川テレビ,「悲観的になり…」能登半島地震の災害関連死で初めて自殺者1人を認定 16人増えて147人となる見込み,https://news.yahoo.co.jp/articles/53583340e38c14b1504cd0035e074707a88e107d,9/5(木) 18:53
ishikawa,石川テレビ,輪島港から出漁できず…底引き網漁解禁も金沢・近江町市場では地物の割合少なく 価格も例年比で2-3割高,https://news.yahoo.co.jp/articles/216d92d9075fcc75983cbd9b14b62db28738c265,9/5(木) 18:53
ishikawa,石川テレビ,能登半島地震で多くの人が病院に押し寄せ混乱した教訓生かす震度7を経験した志賀町で病院と消防が合同訓練,https://news.yahoo.co.jp/articles/a5fe13410a02e259c0ea7757036c8b9aeee4be11,9/5(木) 18:48
ishikawa,石川テレビ,10年前から家特定し狙う…寝ていた20代女性への逮捕監禁と強制性交等致傷等 33歳男が起訴内容認める,https://news.yahoo.co.jp/articles/3ea5a7f13babc7af676c633d895503e3768985e8,9/5(木) 18:13
ishikawa,石川テレビ,石川県内で詐欺相次ぐ1日で2300万円あまりの被害発覚…SNS型詐欺で今年だけで6億8000万円超に,https://news.yahoo.co.jp/articles/bf17f4cfbc8342ce719d2cdfe79195a8b3e75447,9/5(木) 18:13
ishikawa,石川テレビ,新たに16人を災害関連死に認定　自殺者１人も初認定,https://news.yahoo.co.jp/articles/a4e2adc3e212dcafd82d5a25bb18d7382ce13b33,9/5(木) 13:08
ishikawa,石川テレビ,「近海の魚が並んでうれしい」底引き網漁スタートで初競り,https://news.yahoo.co.jp/articles/ad338b1f25805eea661c3973f317011cc05347b1,9/5(木) 13:05
ishikawa,石川テレビ,復旧進まず児童生徒数が半減した珠洲市宝立町...日常を取り戻すための町の決断とは,https://news.yahoo.co.jp/articles/aa7758697c5456e6f4cbed3295a0bef8921c09d8,9/4(水) 21:59
ishikawa,石川テレビ,羽根のないシンプル構造…災害時も役立つ「次世代マイクロ風力発電機」金沢に全国初の設置 衛星通信機能も,https://news.yahoo.co.jp/articles/76e1c2dae9c49fb681b21f9492add466668c9b4e,9/4(水) 18:47
ishikawa,石川テレビ,県と旅行会社が企画…能登半島地震被災地の「復興応援ツアー」関東から訪れた30人が能登の味覚など楽しむ,https://news.yahoo.co.jp/articles/8c34f2c85e52be7a94a8e62d5d8e7b1c840ff26a,9/4(水) 18:42
ishikawa,石川テレビ,災害支援でも活躍…来年3月に任期終える自衛官対象の合同企業説明会 規律正しい人材揃い参加企業が増加中,https://news.yahoo.co.jp/articles/dc8bbb3479c5c54d0070170952a7d45d24f91473,9/4(水) 18:42
ishikawa,石川テレビ,テルマエロマエで知られるヤマザキマリさんを解き明かす展覧会が富山県で開催へ,https://news.yahoo.co.jp/articles/9662f810861143e33111f38fb126a058286da6d4,9/4(水) 12:04
ishikawa,石川テレビ,被災した観光地を支援する”復興応援ツアー”のモニターツアーがスタート,https://news.yahoo.co.jp/articles/a1c247088746275cd6a5d324072b605b343ce915,9/4(水) 12:04
ishikawa,石川テレビ,台風の影響で石川県民が首を長くして待っている”底引きの魚”が2度も延期に,https://news.yahoo.co.jp/articles/e442669bf8cb3953ecedaf116fea541da2ca8351,9/3(火) 19:17
ishikawa,石川テレビ,静かに夜の町を照らし続ける…輪島大祭で本町九区に並んだ3基のキリコ 祭りを巡って揺れた住民たちの想い,https://news.yahoo.co.jp/articles/3d20ecce1e00bdaaae4dadafe7f05467e165ed48,9/3(火) 19:17
ishikawa,石川テレビ,約95％が地震対応…石川県が一般会計670億円余りの補正予算案発表 初めて復興基金を財源とした事業も,https://news.yahoo.co.jp/articles/37b40a917b716e8d378fab9e9dcb30a4e8720dfb,9/3(火) 18:44
ishikawa,石川テレビ,地震の影響で市立図書館利用できず…輪島市長が仮設図書館を年内目途に開設する考え示す 空き店舗を活用,https://news.yahoo.co.jp/articles/2f9b723e76e09e8f7f6a2ee68bbe366f0d93ea1e,9/3(火) 18:44
ishikawa,石川テレビ,地震を乗り越え“実りの秋”に…輪島市の白米千枚田で稲刈り始まる 県内外から訪れた棚田のオーナーの姿も,https://news.yahoo.co.jp/articles/e908b57a74fadef80c7b45df151ad33e8ddb77c1,9/3(火) 18:42
ishikawa,石川テレビ,能登半島地震後の奥能登の人口減少に歯止めかからず…4市町で元日から3500人以上が減少,https://news.yahoo.co.jp/articles/a31548370d36feb2f5d201f7485e160773760e01,9/3(火) 12:50
ishikawa,石川テレビ,約95％が地震からの復旧復興関連…670億円超の石川県9月補正予算案が内示,https://news.yahoo.co.jp/articles/6ecdc149ae48b2c1442d7557cfcb81919a738990,9/3(火) 12:48
ishikawa,石川テレビ,10/6オープン予定…石川県穴水町で仮設商店街『あなみずスマイルマルシェ』建設進む 9店舗が入居予定,https://news.yahoo.co.jp/articles/5fa1fb211103cb5f76f84e80dc9f7253bbef63b8,9/2(月) 18:49
ishikawa,石川テレビ,能登半島地震で発生…金沢市田上新町の大規模な斜面崩落 今年度中に復旧終える方針 市長が議会で明らかに,https://news.yahoo.co.jp/articles/d2d445acbf768f65985a65257fbf377f08f40d7a,9/2(月) 18:47
ishikawa,石川テレビ,9/29告示 10/6投票…石川県羽咋市長選挙に現職・岸氏が立候補を表明「災害の復旧復興を第一に」,https://news.yahoo.co.jp/articles/93412f1ac7041378db3d8d6cc6fb6970ae969af3,9/2(月) 18:43
ishikawa,石川テレビ,直後から災害支援…自衛隊が8月末で能登半島地震被災地での活動終了 珠洲市で多くの市民が感謝伝え見送る,https://news.yahoo.co.jp/articles/ffef75f67ac67da642d68c3144a500632958bcfa,9/2(月) 18:34
ishikawa,石川テレビ,「教室がいっぱい、広くて良い校舎」校舎被害の6小学校の児童が通う仮設校舎完成し2学期開始,https://news.yahoo.co.jp/articles/d1d57b92927ea322a6df6e5e4b99903a8b425c4d,9/2(月) 18:27
ishikawa,石川テレビ,珠洲市でまた…自称建設作業員のベトナム人を不法滞在で現行犯逮捕 違法派遣の男と関連調べる,https://news.yahoo.co.jp/articles/8ad9d36b5cbfd36b217a24631b50e32fc2a95ce0,9/2(月) 12:51
ishikawa,石川テレビ,地震で校舎が使えない輪島市内6つの小学校の児童が合同の仮設校舎で2学期スタート,https://news.yahoo.co.jp/articles/7e9450aecdf1b25ec006f3f8dd759b3ff78010c0,9/2(月) 12:32
ishikawa,石川テレビ,昼過ぎにかけ激しい雨の所も…台風10号から熱帯低気圧に変わっても大気が不安定な状態続く,https://news.yahoo.co.jp/articles/7add48c74dc67c77589e6b832e6f5488a8a305a1,9/2(月) 12:32
ishikawa,石川テレビ,卓球Tリーグ「金沢ポート」開幕戦は白星ならず,https://news.yahoo.co.jp/articles/c0ca530708f54574cec0b28b544535dbc81e6f0a,9/1(日) 19:01
ishikawa,石川テレビ,「半額で宿泊できる」 いしかわ応援旅行割が再開,https://news.yahoo.co.jp/articles/cf1d17ece1ac504a01adfbe375b0c06b2484cab0,9/1(日) 18:58
ishikawa,石川テレビ,台風10号は熱帯低気圧に　今後も激しい雨に警戒必要,https://news.yahoo.co.jp/articles/62a34650d1b93d03797495477ef89c9d63cc48be,9/1(日) 18:55
ishikawa,石川テレビ,能登半島地震から8カ月　自衛隊が入浴支援の撤収作業,https://news.yahoo.co.jp/articles/18bc9466fcc603f6d8faee6a24d3dbeb6446a0c0,9/1(日) 18:53
ishikawa,石川テレビ,「とてもおいしかった」石川県のブランド食材をPR,https://news.yahoo.co.jp/articles/522d9a80cf00fe002d8f87a98950cf27ba25c11a,9/1(日) 14:47
ishikawa,石川テレビ,過去最長の自衛隊による災害派遣が31日で終了 「ありがとうって言いたい」「明日から別の所へ」,https://news.yahoo.co.jp/articles/3f6e9d25d32c06c3fcf85b49a0eea120df3fe190,8/31(土) 18:43
ishikawa,石川テレビ,北陸で初めての夜間中学の石川県立あすなろ中学校 来年4月の開校に向け体験授業,https://news.yahoo.co.jp/articles/8922ac4ae02f790f25315efd966d954355081541,8/31(土) 18:43
ishikawa,石川テレビ,2日にかけて石川県へ…台風10号熱帯低気圧に変わる見込みも激しい雨に注意警戒必要か,https://news.yahoo.co.jp/articles/75a648152a3f8544a5915bcbc6d4dd120f40a958,8/31(土) 18:41
