media_en,title_articles,link_articles,date_original
ishikawa,特別機にトラブルも無事にご出発…両陛下が25年ぶり石川県へ,https://news.yahoo.co.jp/articles/83409078296da75f5b3482ce2a22c646f352241e,10/15(日) 12:42
ishikawa,落ち着いた色味が魅力…珠洲市で「珠洲焼まつり」 地震に負けず今年も開催,https://news.yahoo.co.jp/articles/8ada2c20bd2bfa0b2d638c46709fb2ab04f70190,10/14(土) 18:55
ishikawa,金沢工業大学の「工大祭」が4年ぶりに通常開催 災害時の救助ロボットなど研究成果も公開,https://news.yahoo.co.jp/articles/d65f6cbb073cf8c7736515e0b98f35abdbc20e4a,10/14(土) 18:43
ishikawa,「U18日清食品 北信越ブロックリーグ」開幕 若手選手の育成目的に北信越で初開催,https://news.yahoo.co.jp/articles/8165c4c8fa203fa1155a4d71474cec02b5cb86c0,10/14(土) 18:42
ishikawa,七尾市の海に浮かぶ男性を釣り人が発見 その場で死亡確認 釣り中に海へ転落か,https://news.yahoo.co.jp/articles/aa3bcbc6237f30f61a07b4afb1ac9623f283ff14,10/14(土) 18:35
ishikawa,テーマは「文化絢爛」いしかわ百万石文化祭が開幕 各地で151のイベント開催,https://news.yahoo.co.jp/articles/c51edcfedfe41f67665df3d5e55bcfb6aa12ce8d,10/14(土) 18:35
ishikawa,誘ってくれた娘に感謝！…県内最大級のコスモス畑が７分咲き,https://news.yahoo.co.jp/articles/b0b64adcda550cd674dd05e491871b2a1da66d33,10/13(金) 21:16
ishikawa,高齢の利用者多く…風呂桶に「留守電！切断！即相談！」銭湯や宿泊施設で特殊詐欺被害への注意呼びかけ,https://news.yahoo.co.jp/articles/e7376385dc3d7f61369d4680b8030c887c1578a7,10/13(金) 21:06
ishikawa,皇室ゆかりの名品集結…皇居「三の丸尚蔵館」収蔵品の展覧会 いしかわ百万石文化祭メイン行事で14日から,https://news.yahoo.co.jp/articles/a450c4e8e07b53f72a9f24b198edb50fd209f9cd,10/13(金) 21:04
ishikawa,地域の人にも開かれた大学を…金沢美大の新学長が会見で抱負語る,https://news.yahoo.co.jp/articles/b018200512534c5465c7f8f0bb23d67f22628928,10/13(金) 20:40
ishikawa,ビッグモーターが業務停止に…不適切な車両整備があったとして野々市店も,https://news.yahoo.co.jp/articles/2f71bf3441a2bbd1d9cf87d3ff97ec5e0b41087a,10/13(金) 20:37
ishikawa,船の上で優雅に“ヌン活”…和倉温泉でインフルエンサー招き体験会 ターゲットは非日常味わいたい個人客等,https://news.yahoo.co.jp/articles/eb630aa9a53888cb0b3efcb771707a37497869c8,10/13(金) 20:29
ishikawa,いしかわ百万石文化祭にあわせ…氣多大社で国の天然記念物『入らずの森』初ライトアップ 10/14-29,https://news.yahoo.co.jp/articles/225bc39ebde3950e3c79039545d35560cbf7e42a,10/13(金) 20:22
ishikawa,【速報】ビッグモーター野々市店は事業停止10日・車検業務停止20日間,https://news.yahoo.co.jp/articles/278b4a4a2d66e871c0c7a06c7483f9b7060443c2,10/13(金) 12:46
ishikawa,『新しいキャンパスで開かれた学校に』金沢美大の新しい学長に山村慎哉氏,https://news.yahoo.co.jp/articles/85bbf57745ed629eafe2fb52b134dfa4914a131e,10/13(金) 12:44
ishikawa,北村薫さんと朝比奈秋さんが泉鏡花文学賞を受賞 泉鏡花生誕150年で賞金50万増,https://news.yahoo.co.jp/articles/a2bac8673fb0c8c201e840bae21455fa35fdc052,10/13(金) 12:42
ishikawa,2mの電気柵を乗り越え入ってきたか…公園で男性がクマに襲われた事故 柵の2カ所に“折れ曲がった場所”,https://news.yahoo.co.jp/articles/b8606e08d4514e880cebebb1952688458e8e0780,10/12(木) 19:53
ishikawa,柵に登る人も…全国からファン訪れる『ユキヒョウの赤ちゃん』一部の撮影マナーが問題化 一般公開が未定に,https://news.yahoo.co.jp/articles/ba39004fd779429400f90c17cec54a927ce1dbae,10/12(木) 19:47
ishikawa,石川・野々市店も行政処分へ ビッグモーター保険金不正請求問題,https://news.yahoo.co.jp/articles/f0324925182c0f1b41ff7e1e2c5c7567b4f1a643,10/12(木) 19:44
ishikawa,石川・和倉温泉のPRキャラ『わくたまくん』一日警察署長に “だまされません茶”で詐欺被害防止呼びかけ,https://news.yahoo.co.jp/articles/4f805c797e531346d8f595774b05c80babbddf99,10/12(木) 19:44
ishikawa,飲酒運転でひき逃げし2人死傷…元少年等に遺族が損害賠償求めた裁判 同乗者側が答弁書で「責任はない」,https://news.yahoo.co.jp/articles/dc2a9f4035e86079704b873e0836f4522f61628d,10/12(木) 19:44
ishikawa,奥能登地域の妊婦の安心へ…胎児や子宮の状態を遠隔監視できるシステムを20日から導入へ,https://news.yahoo.co.jp/articles/453f4a194857ca61e04ce43f6b05e85e109ca8ba,10/12(木) 12:05
ishikawa,総務大臣政務官に就任した小森卓郎衆議院議員 50万円の寄付金を収支報告書に記載せず,https://news.yahoo.co.jp/articles/92746d10adec14ae0bcfa3ac1460712fe95abc0a,10/12(木) 12:05
ishikawa,付近の小学校でクマへの警戒続く…小松市木場潟公園では看板設置,https://news.yahoo.co.jp/articles/7586f9f71b255b208dd6e2eff42539a7e230ebfa,10/12(木) 12:01
ishikawa,木の伐採中に転落して死亡…ヘルメットや命綱はあり警察が事故原因調べる,https://news.yahoo.co.jp/articles/ea387817d0523e33e6bdc175d3a1ff3aa12547f7,10/11(水) 21:09
ishikawa,「最初は新手の詐欺かと…」テニス元世界1位のフェデラーが石川のテニスクラブに 家族で訪れプレー楽しむ,https://news.yahoo.co.jp/articles/2a931af456000895bdae33cb32bfd0a54b097acc,10/11(水) 20:44
ishikawa,調理から接客まで生徒が担当…料理学ぶ専門学生が運営するレストラン イオンモールに期間限定でオープンへ,https://news.yahoo.co.jp/articles/e052674e9a3fd7e4679520e6114846e5c9e6317d,10/11(水) 19:04
ishikawa,ターゲットは欧米の富裕層…石川県内で外国人向け旅行会社等招きモニターツアー 田んぼでの稲刈り体験好評,https://news.yahoo.co.jp/articles/438bdf1a294fa0eed0a3505b28fec93d55c36bf6,10/11(水) 19:01
ishikawa,電気柵の点検中襲われる…今年4月オープンしたばかりの公園に『クマ』遭遇した職員が顔など引っかかれケガ,https://news.yahoo.co.jp/articles/ea2c94cbd53b9941929d35e3309d8763921d4d40,10/11(水) 18:57
ishikawa,障害者によるアートをバッグのデザインに…約2000通りの組み合わせを選択できる,https://news.yahoo.co.jp/articles/a191f7081c01719753ee05627a80f8c9bfdd47d5,10/11(水) 12:36
ishikawa,93年の歴史に幕を閉じる老舗昆布店「しら井」で抒情書家による作品展,https://news.yahoo.co.jp/articles/98d3e61360bf9adba4aea4140dfa5c544c054c25,10/11(水) 12:29
ishikawa,シェアサイクルの新たなポートが完成…北陸新幹線敦賀開業に向け環境整備進む,https://news.yahoo.co.jp/articles/f87659de80d82428be632605fa083ebc2c89661d,10/11(水) 12:23
ishikawa,【速報】木場潟で男性がクマに襲われ搬送,https://news.yahoo.co.jp/articles/98d1669935bdf9755f745576d4be0b29c7424fed,10/11(水) 12:04
ishikawa,環境保全に役立つ製品など表彰…『いしかわエコデザイン賞』県産材を楽器に活用するプロジェクト等が受賞,https://news.yahoo.co.jp/articles/51ef6c0ffb3d756c750aad680089c2855f4320cb,10/10(火) 22:05
ishikawa,「店がなきゃ作っちゃえ」高校生が地元の商店街に古着店オープン 営業は水曜の放課後と日曜 石川・輪島市,https://news.yahoo.co.jp/articles/dff0b959f1a13e3f12fd74749c5ea0f0ebd983d0,10/10(火) 22:03
ishikawa,探偵と共謀し立場悪用か…6人の戸籍謄本等を不正取得の疑い 行政書士逮捕「婚前契約書作成に必要」と偽る,https://news.yahoo.co.jp/articles/bb8da6758dc3a02f95413a3b04fd7fb9137e5b64,10/10(火) 22:01
ishikawa,顔など引っかかれ大ケガ…クマに男性が襲われた現場付近の小学校 登下校時の警戒続く 校長「最大限努力」,https://news.yahoo.co.jp/articles/77585863f7613aeef9df9818e9641531f69378c2,10/10(火) 21:58
ishikawa,甘みと酸味のバランス抜群！県産リンゴに最高級ランクが登場,https://news.yahoo.co.jp/articles/e6a3238334debdd63b4919f80e1edb7ca7cb1fbe,10/10(火) 21:40
ishikawa,「ちょっとやりすぎたのでは？」過去10年間で最大の負債額…物流会社が債権者説明会,https://news.yahoo.co.jp/articles/e6a54a251fc1bc4c93f40e0173cb1b3e00f7aefc,10/10(火) 19:51
ishikawa,石川は寒気入り込み大気の状態非常に不安定に 夜遅くにかけて土砂災害などに警戒を,https://news.yahoo.co.jp/articles/d49779aa8df7dd90ee99940cbe1b001ddabc68bc,10/10(火) 12:10
ishikawa,クマ警戒で教職員等が登下校見守る 熊に襲われ男性大けがした現場付近の小学校,https://news.yahoo.co.jp/articles/879a5a88dd28635032131a17f76a09526bcf70c0,10/10(火) 12:05
ishikawa,同性婚実現等訴える…『金沢プライドウィーク』医療の立場からのパネルトークや結婚の平等考える催し等開催,https://news.yahoo.co.jp/articles/6a92a9bd538cfe6070e7df61f48c43981dd06218,10/9(月) 20:16
ishikawa,3年目の『金沢プライドパレード』に過去最多の700人　馳知事も石川テレビのアナウンサーと歩く,https://news.yahoo.co.jp/articles/2e67fa1bd9b13d79f3cd2b07b8dab97536f16c84,10/9(月) 20:13
ishikawa,在来線に自転車の持ち込み可能…石川県などが『サイクルトレイン』の実証実験 “並行在来線”利用促進図る,https://news.yahoo.co.jp/articles/e73d3bdd83f974a9f3e542b3012a683ac19f5012,10/9(月) 20:09
ishikawa,サポーターからブーイング!ツエーゲン金沢は秋田に敗れ最下位転落 J3転落濃厚に,https://news.yahoo.co.jp/articles/0aa4eb5b76c5e786fea4f359c7297d4be546266f,10/9(月) 19:59
ishikawa,航空石川出身のフィフィタがスタメン出場…ラグビーW杯 アルゼンチンに惜敗し2年連続の決勝T進出ならず,https://news.yahoo.co.jp/articles/8b63d853d4e881edf4c1848710fb3a8c65685e43,10/9(月) 19:44
ishikawa,額や胸を引っ掛かれ流血…ウォーキング中だった84歳男性がクマに襲われ大ケガ 体長1mほどの成獣か,https://news.yahoo.co.jp/articles/378052f993dc72847c8e65adb003e22f36e90470,10/9(月) 19:27
ishikawa,ウォーキング中の男性がクマに襲われ大けが…顔や胸をひっかかれる,https://news.yahoo.co.jp/articles/77773c6a88f880e0112a0ba31cd06d89927eaeed,10/9(月) 12:43
ishikawa,「倒産予備軍がまだ多い」北陸3県の2023年度上半期は企業倒産76件,https://news.yahoo.co.jp/articles/363b719b06042c4a1f94138090998410d0fd9ab4,10/9(月) 12:39
ishikawa,【速報】金沢市でクマに襲われ高齢男性がケガ　「額にひどい切り傷」周辺警戒,https://news.yahoo.co.jp/articles/b6a9f57a77454843fb57f9e9260da3a1b898bf8b,10/9(月) 9:14
ishikawa,麻薬探知犬や化学消防車も出動！…のと里山空港で「空の日」フェスタ,https://news.yahoo.co.jp/articles/f5e1fef5f37d35ff4ed46184ffc35475fe5faf07,10/8(日) 18:53
ishikawa,早くも”冬の使者”がやってきた！…約3500km旅してコハクチョウ初飛来,https://news.yahoo.co.jp/articles/a497c7905aa73d88102f023379fde885efa12562,10/8(日) 18:49
