media_en,media_jp,title_articles,link_articles,date_original
bepal,BE-PAL.NET,キャンピングカーにぴったり！買って正解だった100均の便利グッズ5選,https://news.yahoo.co.jp/articles/6ebaf98a4089f0750e7f6f00fb27ec36b54ca1be,2/3(土) 15:00
bepal,BE-PAL.NET,ハードクーラーボックスは一台で何役も務める便利ギア！2024年に買うべきおすすめは？,https://news.yahoo.co.jp/articles/ae1c907055727a5e0cc94ef4a0ce0e570031a919,2/3(土) 12:07
bepal,BE-PAL.NET,スイス発シューズブランド「On」の「Cloudtrax」5つの魅力を語りたい！高性能で洗練されたデザインが人気,https://news.yahoo.co.jp/articles/7ae9bc394cef59c55b30c422021f91e9a87cefe7,2/3(土) 8:06
bepal,BE-PAL.NET,ノルウェーの「ヘレナイフ」からアウトドアシェフナイフ登場！鋭い切れ味と洗練されたデザインに感動,https://news.yahoo.co.jp/articles/1fd1fc5463b6a74e8e5ab96cc006b1131208340c,2/2(金) 18:05
bepal,BE-PAL.NET,冬キャンプにもおすすめ！極上温泉があるキャンプ場5選,https://news.yahoo.co.jp/articles/4a7bdd24e8fbe9a8b6a2ef4e626e37392784e56e,2/2(金) 8:02
bepal,BE-PAL.NET,ホットサンドのおすすめ王道レシピ5選！初心者でも失敗しにくい簡単なものばかり,https://news.yahoo.co.jp/articles/5d965ca8c257208ccaa6ce47778b58398b9b07d4,2/1(木) 18:06
bepal,BE-PAL.NET,アウトドア料理の達人が2024年に買うべきキッチンツールとバーナーを大予測！,https://news.yahoo.co.jp/articles/f1de151cc199ae338cf9d720524a4289405ce789,2/1(木) 8:04
bepal,BE-PAL.NET,2024年はリラックス系チェアがくる！ BE-PALがヒットを見込むベスト5を公開,https://news.yahoo.co.jp/articles/ad83d0a1d974cca2f1a260661e152ae3197de7e0,1/31(水) 18:05
bepal,BE-PAL.NET,ヨセミテストラップで人気のEPM × ROOT CO.がナスカン仕様のコラボストラップを作ったぞ,https://news.yahoo.co.jp/articles/9bf87adaaa201ef477664829d449cfdc35e0a7b0,1/31(水) 8:04
bepal,BE-PAL.NET,2024年のヒット予想！使いやすくてスタイリッシュなテーブル5選,https://news.yahoo.co.jp/articles/5580972f96a83a567cf799461954b8f74184e0d5,1/30(火) 12:06
bepal,BE-PAL.NET,VWの伝統銘柄「ゴルフGTI」がアウトドアシーンでも輝く理由,https://news.yahoo.co.jp/articles/f89abd73a51798e1e47e950c290cb35ede9cef0e,1/30(火) 8:05
bepal,BE-PAL.NET,BE-PAL編集スタッフが2024年にヒットしそうな「焚き火台」ランキングTOP5を勝手に発表！,https://news.yahoo.co.jp/articles/51ce0a6a28d1ddbd1c9539754f724b0ec43f4367,1/29(月) 18:02
bepal,BE-PAL.NET,数量限定販売！いステンレス鋼材で扱いやすい「LOGOS ブッシュクラフト フルタング・ナタ」,https://news.yahoo.co.jp/articles/63cb796d80c8bcdc6d8e38579dbb9520b3395295,1/29(月) 8:02
bepal,BE-PAL.NET,ダイソーのホットサンドメーカーを実際に使ってみてわかった実力はいかに？おすすめレシピも紹介,https://news.yahoo.co.jp/articles/538f44685b6408229a784b98df59c94961d5e8b8,1/28(日) 20:00
bepal,BE-PAL.NET,フルタングなのになんと337g！薪割りから軽作業までアレコレ使えるTSBBQ「スケルトンナタナイフ」,https://news.yahoo.co.jp/articles/b5aab53beb9109e0a310567f1881a13ae1d68d0c,1/28(日) 18:05
bepal,BE-PAL.NET,一時期は2等星並みに暗く。「いよいよ爆発か」と心配され続けたオリオン座のベテルギウスが…明るい!?,https://news.yahoo.co.jp/articles/3ff40dac10737bdd49ba4a5301ab1efbb81cdf3a,1/28(日) 15:00
bepal,BE-PAL.NET,アンダー250万円の箱系SUV！新型「ホンダ WR-V」はソト遊びグルマの有力候補だ,https://news.yahoo.co.jp/articles/698157e5e85753ffd6b339ba2bf480f692112840,1/28(日) 12:06
bepal,BE-PAL.NET,憧れのランドローバー・ディフェンダーに2024年モデル「V8」登場！ 試乗してわかった“4WDの伝統ここにあり”,https://news.yahoo.co.jp/articles/77ad9659a059e9f31680b1513544e617066b37c2,1/28(日) 8:03
bepal,BE-PAL.NET,SUUNTO X MAMMUT初コラボ！正確な情報を提供し、安心安全な登山をサポートするアドベンチャーウォッチの誕生だ,https://news.yahoo.co.jp/articles/04329e89b87725e1f33870f57ceaa795ec6ff13d,1/27(土) 20:02
bepal,BE-PAL.NET,美しい…北海道生まれの白樺間伐材製「スウェーデントーチ」「ウッドプランク」,https://news.yahoo.co.jp/articles/7d63dbdbba132aa94962426920663bd5e4a51781,1/27(土) 18:06
