media_en,media_jp,title_articles,link_articles,date_original
asmasahi,AERA STYLE MAGAZINE,音楽家・坂本龍一が歩み、彼が信じてきたこと。私たちが「坂本さんになる」ことで彼の人生はこれからも続いていく。,https://news.yahoo.co.jp/articles/27c4253072cfb35f1e092b506ff06f60c1f9724e,2/18(日) 20:00
asmasahi,AERA STYLE MAGAZINE,夕暮れの神楽坂を歩く近藤真彦。マッチのハートに火を付けた“パワー飯”とは？,https://news.yahoo.co.jp/articles/ebcfdbf561ee4e8bdc1069b61d8d73d6cc5fd267,2/17(土) 21:03
asmasahi,AERA STYLE MAGAZINE,スリラーでありながら、家族の関係性をリアルに描き、気づかなかった家族の問題が明るみになっていく。,https://news.yahoo.co.jp/articles/dc92a49202d985b8c0b3066016535b579bf9ad73,2/16(金) 20:05
asmasahi,AERA STYLE MAGAZINE,気軽に立ち寄れる六本木の老舗寿司店の折り詰めは、お土産や差し入れにもってこいの確かな味わい。,https://news.yahoo.co.jp/articles/3d59b3a5ee82e262adebf27b09d4a9067a4cecab,2/13(火) 19:02
asmasahi,AERA STYLE MAGAZINE,ルイナールのコルク樫農園サポートは、採取まで最低43年の超長期プロジェクト！,https://news.yahoo.co.jp/articles/6ef65b522f6cc3f00a769e642e3d1002e4d8cde0,2/11(日) 20:30
asmasahi,AERA STYLE MAGAZINE,知る人ぞ知るニュージーランドのワインの島の絶景リゾートでほろ酔いステイ。,https://news.yahoo.co.jp/articles/01ce1449becae4550ef2e11f60856948ba1817a6,2/10(土) 11:30
asmasahi,AERA STYLE MAGAZINE,個性を生かして輝きを放つNYCのバーたち。世界中の人を引き寄せる、その魅力とは。,https://news.yahoo.co.jp/articles/42bb6e8148cdb47332d8c6d2e2d2ff10c6969828,2/9(金) 20:03
asmasahi,AERA STYLE MAGAZINE,ボルボ・カー・ジャパン初の女性社長が、激動の時代に変化を恐れず前へ進む秘訣。【後編】,https://news.yahoo.co.jp/articles/c393c320a157a6212ee784e223bd705d9f3eb3d9,2/7(水) 11:33
asmasahi,AERA STYLE MAGAZINE,ビジネスという「無限ゲーム」を戦い抜く、強いリーダーのビジョンを養う日本の庭園。,https://news.yahoo.co.jp/articles/81c3a4f5ef3a773c59a5ac43706f11c01774bdcb,2/5(月) 20:05
