media_en,media_jp,title_articles,link_articles,date_original
otekomachi,大手小町（読売新聞）,旅行がきっかけで恋愛破局、成田離婚、友情崩壊…「同行者の許せない行動」第1位は案の定の結果に,https://news.yahoo.co.jp/articles/1b2fb476db1772653181bcbcca6ea9f1f0d78b62,2/19(月) 12:11
otekomachi,大手小町（読売新聞）,婚約指輪は無駄？「タンスの肥やし」にしないリフォーム術とは,https://news.yahoo.co.jp/articles/34d933af7a25791e46dd8bcff9a89af0d664da07,2/18(日) 9:10
otekomachi,大手小町（読売新聞）,自宅リビングを無垢フローリングに…唯一無二の魅力とは,https://news.yahoo.co.jp/articles/47dd451794689afbba04ccd60f9bbe5f68ff17e6,2/17(土) 9:10
otekomachi,大手小町（読売新聞）,「性欲まみれの変態」扱いされた小原ブラスが“性の上納システム”接待を唾棄,https://news.yahoo.co.jp/articles/8fbea8f7c6d73f35d47154064bff935d014f785f,2/16(金) 17:11
otekomachi,大手小町（読売新聞）,ブロッコリーどうやって食べたらおいしい？焼く、揚げる、炒める…ゆでるだけじゃない「わが家の定番レシピ」,https://news.yahoo.co.jp/articles/7b0f43806b9c31134ee6acd9bb6001a774d10c09,2/16(金) 12:11
otekomachi,大手小町（読売新聞）,新NISAどう運用？初心者にもわかる「守りと攻め」3つの戦略,https://news.yahoo.co.jp/articles/9cd3b00447c3d25f2a2f781e5c4ee7e980f12573,2/16(金) 11:40
otekomachi,大手小町（読売新聞）,人には悔しさで眠れぬ夜があることに驚いた私が人生で唯一悔しかったこと,https://news.yahoo.co.jp/articles/01054f37877244fe0c1be6aa396cb4b29246f12e,2/15(木) 17:40
otekomachi,大手小町（読売新聞）,コロナ禍が落ち着いたのに在宅ワークを続ける夫、家にいるだけでイライラします…どうしたらいい？,https://news.yahoo.co.jp/articles/bd01eda5b33600ebf1673cbff171e835e5c93a98,2/15(木) 17:11
otekomachi,大手小町（読売新聞）,おにぎりブーム、多様化する具材とふっくら食感が孤独を癒やす,https://news.yahoo.co.jp/articles/d2433ef2eac8a377d7192db0e7536cce66669168,2/15(木) 12:11
otekomachi,大手小町（読売新聞）,転職の面接、カギは「志望動機」ライバルに差をつける伝え方とは,https://news.yahoo.co.jp/articles/bb2276bfb45e059a2a60a105c222035672266853,2/14(水) 17:11
otekomachi,大手小町（読売新聞）,メンタルの不調を誰に相談する？友だちでなく専門家にすべき理由,https://news.yahoo.co.jp/articles/c8ab7806a85a601baecdcd03095118a2ebcd2875,2/14(水) 12:11
otekomachi,大手小町（読売新聞）,雑誌不況・結婚減なのに「ゼクシィ」好調…あえて情報誌を買う令和カップルの事情,https://news.yahoo.co.jp/articles/f7be57a6b37a1b624f4a293d1ae1b7161e890714,2/13(火) 17:10
otekomachi,大手小町（読売新聞）,災害の備えは水やトイレだけではない「とにかく靴を枕元に」被災経験者の教え,https://news.yahoo.co.jp/articles/0973779664ac0788dcde8784ed8c9fbfaa3e46a6,2/13(火) 12:20
otekomachi,大手小町（読売新聞）,結婚式に黒のウェディングドレス…タブーだったはずなのに着用する花嫁が増えている背景とは,https://news.yahoo.co.jp/articles/f1a4bea5b36ab6affca850d98ad6709cadad356d,2/13(火) 12:13
otekomachi,大手小町（読売新聞）,デート中に自分の話ばかりする男性にうんざり…話を聞いてくれたら誰でもいいの？,https://news.yahoo.co.jp/articles/e17caf0d62ce2890418c62a78c343e55dfd5e6b9,2/12(月) 17:10
