media_en,media_jp,title_articles,link_articles,date_original
bepal,BE-PAL.NET,塔ノ岳「大倉尾根」に挑戦＝自分の体力テストになる!? ひたすら登るルートが人気の秘密,https://news.yahoo.co.jp/articles/78ee9546cc6137d0ffe5cdad579050503252245f,5/9(木) 8:04
bepal,BE-PAL.NET,レトロなつくりの逸品遺産！アルミ食器、別名「林間学校食器」をキャンプで使いたい3つの魅力,https://news.yahoo.co.jp/articles/470941f299134814b1722437617604f3aca281ce,5/8(水) 18:02
bepal,BE-PAL.NET,雷鳥飯盒+BBQのたれで作る、さばいどる かほなんの極旨キャンプ飯レシピ,https://news.yahoo.co.jp/articles/24abe5e74dfd3ad17f7a6fd4db5e672a4ae783ff,5/8(水) 8:02
bepal,BE-PAL.NET,硫黄岳は息を呑むほど美しい絶景！八ヶ岳登山中級者向けの美濃戸ルートを紹介,https://news.yahoo.co.jp/articles/2d9abe947422b7e9fc06eee3a14ce1b3390d0c67,5/7(火) 18:04
bepal,BE-PAL.NET,山やハイキング、タウンユースにも対応！ミレーの多彩な収納&機能を備えたリュック 「KHUMBU」シリーズ,https://news.yahoo.co.jp/articles/15a4bf6eed9d8bbf8941f37169933315883d7952,5/7(火) 8:03
bepal,BE-PAL.NET,車の上に広々とした寝床スペースが！フランス発のルーフトップテント「NatUp」が日本初上陸,https://news.yahoo.co.jp/articles/8455d3fc08d9bc30d23e908bd29a5c59f68c64b0,5/6(月) 20:00
bepal,BE-PAL.NET,街中の小自然を堪能！静岡・三島「源兵衛川」そぞろ歩きのすすめ,https://news.yahoo.co.jp/articles/67fe921fa0922b347123366d4679cb86971754d8,5/6(月) 18:00
bepal,BE-PAL.NET,スウェーデンのアウトドアガールが実践！サウナの楽しみ方、トナカイそり…心身を癒すアウトドア遊び,https://news.yahoo.co.jp/articles/6b4b27be681ad11931032c97d441492e03f9a8a0,5/6(月) 15:00
bepal,BE-PAL.NET,試乗レポ！クラウンスポーツは小回りが利いて荷物も積める高級SUVだ,https://news.yahoo.co.jp/articles/31dc9673c7eb7fde93ce4deedc6574355bf03d16,5/6(月) 12:02
bepal,BE-PAL.NET,メスティンで作るおかずレシピ3選！ キャンプでも自宅でも楽しめるよ,https://news.yahoo.co.jp/articles/43ee2ba3135df6ed512324c1813bd4f6dcff01c7,5/6(月) 8:02
bepal,BE-PAL.NET,キャンピングカー「フィーカ」はハイエースの広さを生かした8人乗車・3人就寝仕様だ！,https://news.yahoo.co.jp/articles/654a3b25a304606cf5b36f3b5c1de762e9704b46,5/5(日) 20:03
bepal,BE-PAL.NET,池袋にある富士塚、その名も池袋富士【プロハイカー斉藤正史のTOKYO山頂ガイド】,https://news.yahoo.co.jp/articles/f46381175983f80c1db6700a320606905e0f6ca1,5/5(日) 18:04
bepal,BE-PAL.NET,ご飯を炊くだけじゃない！ 飯ごうで作る”超”お手軽スープレシピ3選,https://news.yahoo.co.jp/articles/ade9ded1354e5487a99fa696239e6080e0ac2ff7,5/5(日) 15:00
bepal,BE-PAL.NET,マセラティの人気SUV「グレカーレ」にはソト遊び好きのイタリア魂が宿っていた！内装、価格もチェック,https://news.yahoo.co.jp/articles/5b2770a73efc7be7ad5cd552544f897b93283c20,5/5(日) 12:07
bepal,BE-PAL.NET,キャンプ初心者におすすめなダイソーの便利アイテム5選！レジャーマット、フライパン、ミニストーブも,https://news.yahoo.co.jp/articles/327ab000651a55c72790aa267fd4f623745a0124,5/5(日) 8:01
bepal,BE-PAL.NET,バイクで走っているのは…道？池？それとも川？ヒマラヤツーリングを舐めちゃあかん【38歳女芸人・橋爪ヨウコの爆夢旅】,https://news.yahoo.co.jp/articles/901880acd1601ee49e3d79588fa63d38bdd49ecf,5/4(土) 20:04
bepal,BE-PAL.NET,丸福繊維の大人気-10℃遮熱帽子が6％軽量に！「ウルトラライトハット」となって帰ってきた,https://news.yahoo.co.jp/articles/20f39385a0a51f010c22723a38e3f7e299148a18,5/4(土) 18:02
bepal,BE-PAL.NET,ポリ袋調理で作る鯖缶とひじきのカレー煮は災害時にも役に立つレシピ！,https://news.yahoo.co.jp/articles/d2e49a0b8c00e4deb485b41ffaaeb923cc512133,5/4(土) 15:00
bepal,BE-PAL.NET,韓国発「ZEROGRAM」から日本デビュー10周年限定ギア登場！テント「El Chalten」シリーズ初のソロサイズも,https://news.yahoo.co.jp/articles/e9afa84abc9f095d79ea12ea9a2fac3684cd1c62,5/4(土) 12:04
bepal,BE-PAL.NET,春キャベツがモリモリ食べられる！包丁入らずの簡単キャンプ飯レシピ2選,https://news.yahoo.co.jp/articles/1f4e5c664200f29b4d678b3778301d4f2507be07,5/4(土) 8:01
bepal,BE-PAL.NET,歴史的建物やコウモリ保護区…フィリピンのイロイロ市は色々楽しい！,https://news.yahoo.co.jp/articles/5d1a78dc6b717c4bcedd68912b2781cb54133eae,5/3(金) 20:03
bepal,BE-PAL.NET,大型か小型か、ハードかソフトか…機能別おすすめのクーラーボックス10選！ジャグ&ボトルも紹介,https://news.yahoo.co.jp/articles/7fe74e69c7c077e931adc0bd70a61282b997189e,5/3(金) 18:02
bepal,BE-PAL.NET,シェラカップだけで作れちゃう時短おつまみレシピ8選,https://news.yahoo.co.jp/articles/3b3a04d5767090cbad0615ae80ce754097874707,5/3(金) 15:00
bepal,BE-PAL.NET,高機能でリーズナブル！アルペン「TIGORA」のTシャツやパンツ、パーカーはアウトドアシーンでも使えるぞ,https://news.yahoo.co.jp/articles/395cca913a08fa9e0ec85934e10b7942892cf2bc,5/3(金) 12:03
bepal,BE-PAL.NET,砂糖いらずのあんこを手作り！やさしい自然の甘さ「発酵あんこ」「みりんあんこ」レシピ,https://news.yahoo.co.jp/articles/d964e4508b820356b4f4125e6966bf0618b50ef9,5/3(金) 8:01
bepal,BE-PAL.NET,福島県「安達太良山」の絶景を見てほしい！初心者でも登りやすい登山のポイントを解説,https://news.yahoo.co.jp/articles/76ed2a42b4b619a2b84c96a173e6077973c479a4,5/2(木) 18:06
