media_en,media_jp,title_articles,link_articles,date_original
ybc,YBC山形放送,現新一騎打ちの舟形町長選 あす投開票,https://news.yahoo.co.jp/articles/1a1f502b0842e55b51f36c91cf1f9a3aa80aa8d5,2/3(土) 12:01
ybc,YBC山形放送,山形市の火災　焼損した建物は住宅など計９棟に　出火原因は調査中,https://news.yahoo.co.jp/articles/325fe27a59c7ea13d692823fdc10d76415cc2a9a,2/3(土) 11:59
ybc,YBC山形放送,山形県で１０週連続インフル警報　保健所別では最上が最多　子どもに多い感染症も流行,https://news.yahoo.co.jp/articles/bc695357fe9cde7064f4417250cea52b5df58aaa,2/3(土) 11:56
ybc,YBC山形放送,女子中学生自殺問題で酒田市長が近く遺族と面会へ…市長「ご遺族に対して本当に心苦しく感じている」,https://news.yahoo.co.jp/articles/7ea920176c1a800d5143c16ffe4acf26309b51d6,2/2(金) 19:24
ybc,YBC山形放送,500年以上受け継がれてきた幽玄の舞・黒川能「王祇祭」翌日未明まで伝統の舞いが披露される,https://news.yahoo.co.jp/articles/7e20a9d2f9e1a5375f6f7a7e5c671d650edd2828,2/2(金) 19:19
ybc,YBC山形放送,「代理寄付」で被災地支援…被災した自治体が災害対応に集中できるよう業務代行を開始,https://news.yahoo.co.jp/articles/16d7a02031f9dbd19b7a6b1fce97542cd7f1e2ad,2/2(金) 19:15
ybc,YBC山形放送,全国初導入「ナビレンス」目に障がいがある人でも簡単に2次元コードを読み取れるアプリ・上山市,https://news.yahoo.co.jp/articles/06f547260077d9401ef88aa55fff06765c0158c4,2/2(金) 19:09
ybc,YBC山形放送,あす2月3日は節分 山形市の豆菓子メーカーや保育園で豆まき「鬼は外、福は内」の掛け声響く,https://news.yahoo.co.jp/articles/413f8f4621c43d7348e3a659e0c976bfb56ca942,2/2(金) 18:59
ybc,YBC山形放送,暖冬の影響で例年とは違った異変も…暖房費「例年比2割減」バラの生育「良好」,https://news.yahoo.co.jp/articles/3bc636c1f47319a3d0ac35c0249f6a2c91662f8f,2/2(金) 18:54
ybc,YBC山形放送,山形市の1月平均気温は「2.3度」記録が残る1890年以降、2020年と並び過去最も高く,https://news.yahoo.co.jp/articles/3997f01b664ba06c1e870c0496073c4bb769101f,2/2(金) 18:24
ybc,YBC山形放送,2日未明にようやく鎮火した山形市の火事…現場から中継,https://news.yahoo.co.jp/articles/61522a82dfd81e1e43dfcf75dd64baa0e68a5a39,2/2(金) 12:19
ybc,YBC山形放送,山形市で住宅や小屋など５棟焼く火事…付近住民「風向きがあっちこっちに」強風で燃え広がったか,https://news.yahoo.co.jp/articles/e8d683e30c699cd1c73954c2f386533115c7459d,2/2(金) 12:17
ybc,YBC山形放送,【速報】山形市七浦で建物火災　立ち上る炎と黒煙,https://news.yahoo.co.jp/articles/50a867b78303cfbf7d98ea0a9ae5b22884949a4c,2/1(木) 21:17
ybc,YBC山形放送,能登半島地震発生から1ヶ月　続く避難生活　新たな課題「災害廃棄物」NNN取材班が現地から現状報告,https://news.yahoo.co.jp/articles/ef07356e9000ec4c56d49efe247ff006434e80e4,2/1(木) 18:43
ybc,YBC山形放送,能登半島地震の「災害関連死」の死者数15人　東日本大震災は3800人　防ぐポイントは,https://news.yahoo.co.jp/articles/4b5ec15a5adf092d833d13a80009a228afb5ebc9,2/1(木) 18:40
ybc,YBC山形放送,能登半島地震で山形県内沿岸地域も5000人が避難　しかし避難指示解除前に多くが帰宅,https://news.yahoo.co.jp/articles/fe8c0513e59053837c79ed9e11a655c8b12f6f64,2/1(木) 18:23
ybc,YBC山形放送,避難所に少しでも安心感を　上山市の企業が被災地に段ボールで組み立てるベッド寄贈,https://news.yahoo.co.jp/articles/e8c37b7d6f403cf196cf8430761f8ff697d85f6d,2/1(木) 18:22
ybc,YBC山形放送,18日間で述べ2300人が利用　石川県輪島市で入浴支援の陸自部隊が東根市に戻る,https://news.yahoo.co.jp/articles/06695a71ca0172aa0697092bd91c3c58e2b96a5a,2/1(木) 18:20
ybc,YBC山形放送,乗用車が道路脇の田んぼに転落し運転していた山形市の60代男性が死亡　死因は病死,https://news.yahoo.co.jp/articles/6690c9db2592cbd8ec79a6173546fb114ec9d199,2/1(木) 18:08
ybc,YBC山形放送,山形花笠まつりのPR行う「ミス花笠」　今年から性別問わず募集へ　名称の変更も検討,https://news.yahoo.co.jp/articles/08086d43713107769bae995dcacf482f649bcad4,2/1(木) 16:45
ybc,YBC山形放送,乗用車が田んぼに転落　高齢男性が意識不明の重体　山辺町,https://news.yahoo.co.jp/articles/0fa7d0f45861acedc8ffe7d10c493a2e50c7d91a,2/1(木) 12:21
ybc,YBC山形放送,自主防災組織のメンバーが研修会　山形県のアドバイザー「能登半島地震ではほとんど1階が潰れている。２階で就寝を」,https://news.yahoo.co.jp/articles/e1e3fda5291650555223f22ad1a50b4c0766e868,2/1(木) 12:19
ybc,YBC山形放送,伝統の庄内凧あげに児童が歓声「無事飛んでよかった」　冬の強風にも耐える骨組み,https://news.yahoo.co.jp/articles/fcad5f1cc81359520b39b13e0cc711300610178e,2/1(木) 12:15
ybc,YBC山形放送,日本海沿岸東北自動車道　山形県遊佐町内の6.5キロ区間が3月に開通　「梨郷道路」も,https://news.yahoo.co.jp/articles/01fb262b88221d4d9abde643f1ae561ef144222b,1/31(水) 18:43
ybc,YBC山形放送,琴ノ若が正式に大関昇進　次場所のしこ名は大関「琴ノ若」で親方に恩返し　その後「琴桜」に,https://news.yahoo.co.jp/articles/83b5dc3c22ecf71fbb851ee2900a59bbbd549f48,1/31(水) 18:43
ybc,YBC山形放送,琴ノ若の大関昇進祝い　佐渡ヶ嶽親方の出身地　尾花沢市のスーパーで感謝セール,https://news.yahoo.co.jp/articles/1f7d0dd7bc470e87df2f4c1507477d45bcf37837,1/31(水) 18:39
ybc,YBC山形放送,合併に向けた協議を発表した荘内銀行　「地域と共に成長を」松田頭取に今後の経営戦略を聞く,https://news.yahoo.co.jp/articles/5a3ccf9b1c6d9e4787bd98e64913e3f799246abf,1/31(水) 18:26
ybc,YBC山形放送,津波の高さが観測できなかった鼠ヶ関の潮位計　原因究明のため潜水調査　たまった砂清掃も,https://news.yahoo.co.jp/articles/a892f6acc4091350b256694b1331d6b4e5ce5679,1/31(水) 18:05
ybc,YBC山形放送,山形県知事任期満了まで1年余り　「なんとも言えない」吉村知事出馬の明言避ける　自民党県連は擁立準備,https://news.yahoo.co.jp/articles/d059784475c0e81cf461110c23a4d8e8b2dc566f,1/31(水) 17:56
ybc,YBC山形放送,啓翁桜の品評会　山形県知事賞に白鷹町のサンファームしらたか　栽培して30年で初の栄冠,https://news.yahoo.co.jp/articles/c08df644804c07b93d8e67fc33af63d45ebd42a7,1/31(水) 17:27
ybc,YBC山形放送,火事による死者数は過去10年で最少も…件数は前年比で34件増　山形県内去年1年間の火災発生件数,https://news.yahoo.co.jp/articles/35cce1dbe6f23eb3ee0d635373c82b63af916a00,1/31(水) 13:11
ybc,YBC山形放送,「さらに上を目指す」関脇・琴ノ若の大関昇進が正式決定　父は山形・尾花沢市出身の佐渡ケ嶽親方,https://news.yahoo.co.jp/articles/b80d4c93c0e2c8b78d8a7b5ce4d136ee537f3a01,1/31(水) 13:06
ybc,YBC山形放送,国の賠償責任を認めなかった控訴審判決を不服として上告　原発事故訴訟で山形県内の自主避難者,https://news.yahoo.co.jp/articles/40c9641c113f8e82a5ae349728f5b00835563c8e,1/30(火) 18:40
ybc,YBC山形放送,西川町の児童たちが町づくりのアイデア提案　子ども目線のパンフレットや名物メニュー,https://news.yahoo.co.jp/articles/b2e63dcdbf4bcc7daa8f012a90bfb4f687134fbf,1/30(火) 18:28
ybc,YBC山形放送,一足早く「花見の宴」　日本一出荷が早い加温サクランボ生産地の東根市で,https://news.yahoo.co.jp/articles/e444150c01a5ea531ec287d099702d402f8fa4ff,1/30(火) 18:18
ybc,YBC山形放送,ベニバナの花びら散りばめたカヌレ　企業と行政が連携し新商品開発　食卓に彩りを,https://news.yahoo.co.jp/articles/aae0a7e1394ec0edf56a51191bc5a7cbedfb41b5,1/30(火) 18:11
ybc,YBC山形放送,3選を目指す現職と新人で元兵庫県議による一騎打ちが確定　舟形町長選挙,https://news.yahoo.co.jp/articles/df64bd130d4e6b47957add8745d3227c3915f621,1/30(火) 18:03
ybc,YBC山形放送,山形県産フルーツをPRする「フルーツステーション」県内各地に整備へ　官民が連携して勉強会,https://news.yahoo.co.jp/articles/53adc2749c1983afecdeaaa1cf2c9a22ad3c896f,1/30(火) 16:47
ybc,YBC山形放送,山形県内の去年の交通事故発生件数過去10年で最少　一方で死者数は3年ぶりに30人超える,https://news.yahoo.co.jp/articles/8445886470f9626bc1a72dc7162d80e7a412aaed,1/30(火) 16:43
ybc,YBC山形放送,３選目指す現職と元兵庫県議の新人が届け出　8年ぶり選挙戦へ　山形・舟形町長選挙,https://news.yahoo.co.jp/articles/b7300d49e8a94d0d67bf8dd6bc2440de749058cc,1/30(火) 13:06
ybc,YBC山形放送,沢の冷水に実を浸して甘み引き出す「寒ざらしそば」の引き揚げ作業　4月に山形市などで提供へ,https://news.yahoo.co.jp/articles/d0a31e539924fbc18149d573f0b1c852d7f627c7,1/30(火) 13:00
ybc,YBC山形放送,大麻を含んだクッキーなど押収　山形市の10代から20代の男3人を逮捕,https://news.yahoo.co.jp/articles/33a3c45449b41b5f71dbcab4864e27d4ba985c7a,1/29(月) 18:33
ybc,YBC山形放送,積雪は去年の半分の2メートル　月山志津温泉の「雪旅籠の灯り」　3日の開催に向け作業急ピッチ,https://news.yahoo.co.jp/articles/481e8292765643dd4635c150c3321c5ba11433ce,1/29(月) 18:04
ybc,YBC山形放送,大関昇進が確実な琴ノ若　父・佐渡ヶ嶽親方の出身地　山形県内ではスーパーから取り組みに声援,https://news.yahoo.co.jp/articles/90885f4ad9baec86d2bd4550420e40d94df7ff4c,1/29(月) 18:01
ybc,YBC山形放送,「顔つきが本当の勝負師に」　大一番を見守った尾花沢市の祖父母が琴ノ若関を祝福,https://news.yahoo.co.jp/articles/5af0201a042e4da82ffc3928f783a6417d4a4e7e,1/29(月) 17:57
ybc,YBC山形放送,10キロ以上の大物続々　350本を水揚げ　庄内沖の寒ダラ漁本格化,https://news.yahoo.co.jp/articles/dd3be1d7048bc99f7b498bb3140eeb2a778c55e9,1/29(月) 17:31
ybc,YBC山形放送,偉大な祖父と父　幼い頃から相撲道を歩んだ琴ノ若　「しこ名」はどうなる？,https://news.yahoo.co.jp/articles/ab90b78e07ca18eeb0c66f9a9ab68c47f228afb7,1/29(月) 17:13
ybc,YBC山形放送,国道13号山形大橋近くの住宅地で火事　作業小屋と住宅の一部焼ける　2人搬送も命に別条なし,https://news.yahoo.co.jp/articles/4f1ec47628c7c3a07e9c893330489b4518c27575,1/29(月) 14:33
ybc,YBC山形放送,山形県冬季ロードレース大会　下條乃将選手（NDソフト）が大会新記録で優勝,https://news.yahoo.co.jp/articles/a53c80330d65c131a450af61c8fc38fde3fd0487,1/28(日) 20:21
ybc,YBC山形放送,高校生が献血の大切さ訴え　山形市でイベント,https://news.yahoo.co.jp/articles/b744b3657ef40fa9a6830b1943dc1fb36788a4e0,1/28(日) 12:46
ybc,YBC山形放送,尾花沢市で雪下ろし中転落か？男性死亡　山形県内今季初の雪害死亡事故,https://news.yahoo.co.jp/articles/79738588a0c288a78f547f82cfd5645bc4308fbd,1/28(日) 12:44
ybc,YBC山形放送,世界三大ピアノ「スタインウェイ」を弾くことができる体験イベント　山形市の文翔館で,https://news.yahoo.co.jp/articles/14f64dc49e1fe400c5dfa7128822b81fa4e1600c,1/27(土) 18:02
