media_en,media_jp,title_articles,link_articles,date_original
seraijp,サライ.jp,本場のトラフグから手軽に味わえるご飯やひれ酒も「ふぐのお取り寄せ」5選【「ふぐ」をたらふく】,https://news.yahoo.co.jp/articles/04f42d3efe7c65c66441d647e9be7f925dea2fd7,1/13(土) 17:00
seraijp,サライ.jp,漢方薬局を半世紀近く営むプロが教える、誰でもできる「ゆるゆる薬膳」のすすめ,https://news.yahoo.co.jp/articles/cae3318afe4093625ac2921159b1697a20397d58,1/13(土) 15:00
seraijp,サライ.jp,安倍晴明、入内、散楽、源高明、出世への渇望、平安のお菓子…。歴史好きにはたまらない『光る君へ』は子供にこそ見てほしい【光る君へ 満喫リポート】,https://news.yahoo.co.jp/articles/033b03f431c1e21e5fea86c1718a68725fc7a465,1/13(土) 13:00
seraijp,サライ.jp,欲しい運気が旅先で見つかる！ 日本最強のパワースポット15選【李家幽竹の最強！ 開運旅行風水】,https://news.yahoo.co.jp/articles/36d5b4a49396a77b72708e086d0fe2d47e4eaa41,1/13(土) 11:05
seraijp,サライ.jp,【娘のきもち】「これから幸せな日々を過ごそうと思っていたのに…」心をえぐられる辛さだった、不妊治療でやっと授かった子供の病気との闘い〜その1〜,https://news.yahoo.co.jp/articles/75c470a0fdffb5264aa0001f30db4add105ab126,1/13(土) 9:00
seraijp,サライ.jp,【朝めし自慢】寺園清子（創作人形作家・68歳）「塩分は控えめ野菜たっぷりの献立です」,https://news.yahoo.co.jp/articles/39446af028f3c2f269ca126f3277db7285a42f86,1/13(土) 6:04
seraijp,サライ.jp,関西名物「焼きふぐ」を味わう｜ふぐ倶楽部 miyawaki（東京・銀座）【「ふぐ」をたらふく】,https://news.yahoo.co.jp/articles/42c278cc5309db00efa46dbaa5f8a9db5b04bc8d,1/12(金) 17:00
seraijp,サライ.jp,動画を見ながら、別のアプリを操作できる「ピクチャインピクチャ」を利用するには？【スマホ基本のき】,https://news.yahoo.co.jp/articles/c23a4838d6272ea80e15a5ed571c1f3e89db96e0,1/12(金) 11:05
seraijp,サライ.jp,働き手不足を解消する大切な労働力！「シニア世代が戦力になる」効果的なマネジメントとは【ビジネス最前線】,https://news.yahoo.co.jp/articles/d2e163386dd27c3a16ef8ac33b6eea3d1c951181,1/12(金) 6:03
seraijp,サライ.jp,【インタビュー】コシノジュンコ（ファッションデザイナー）「素敵な洋服は、気持ちや顔つきを変え、お洒落をするとやる気がみなぎります」,https://news.yahoo.co.jp/articles/493c12c41493f7e983265ed2a1be60c25750005e,1/11(木) 17:02
seraijp,サライ.jp,ホルン、ギター、サックス…「売れた楽器ランキング（2023年度上半期）」TOP10,https://news.yahoo.co.jp/articles/f7d13df7886943d437ce8a1cb5dfb73f18b74957,1/11(木) 11:01
seraijp,サライ.jp,新発見で解明！「レオナール・フジタ（藤田嗣治）」が描いた肌質感の秘密,https://news.yahoo.co.jp/articles/faf020a9ffb9241358a74e7a69374ec310a86609,1/11(木) 6:04
seraijp,サライ.jp,入場券がロゴ入りの手ぬぐい！ 日本初、唯一の手ぬぐい専門美術館「細辻伊兵衛美術館（京都）」の魅力,https://news.yahoo.co.jp/articles/3347adbde3cd36d10068d6b0585621fbf75dd784,1/10(水) 17:02
seraijp,サライ.jp,吐き気や下痢だけでなく、むくみにも適応する「柴苓湯」【漢方薬剤師が教える漢方のキホン】,https://news.yahoo.co.jp/articles/f097e2fc9545fdb304b55f3e5af1eea029616b7b,1/10(水) 11:03
seraijp,サライ.jp,仕事を与えないのはパワハラになる？｜仕事を与えない上司への対処法【シン・会社のマナー】,https://news.yahoo.co.jp/articles/8112a50dd0e06504803d254005c9664405db2f6e,1/10(水) 6:05
seraijp,サライ.jp,人間ドラマの宝庫！「赤穂浪士の討ち入り」をなぜ「忠臣蔵」と呼ぶのか？【古典芸能 “好芸家” のススメ】,https://news.yahoo.co.jp/articles/4cc8ce02cce4307ead5aa0bcbbad2fe1e4c1e75a,1/9(火) 17:00
seraijp,サライ.jp,「パン焼き窯を密送」。“イストリア難民脱出”の舞台、イタリア統治時代の名残りが色濃いクロアチアの町「プーラ」,https://news.yahoo.co.jp/articles/b44e0503e76e0d130f6fbacc926bf46ec03b689f,1/9(火) 11:03
seraijp,サライ.jp,大切な仲間はどうやって見つける？ 定年後のセカンドキャリアにおける「新たな人間関係の築き方」【ビジネス最前線】,https://news.yahoo.co.jp/articles/f453a917104c865e45ad45baa45b6e3dc5992eba,1/9(火) 6:03
seraijp,サライ.jp,【家族の貧困】「30代独身の娘がステージ4のすい臓がんに…」家族3人で再び暮らした最期までの日々〜その2〜,https://news.yahoo.co.jp/articles/076793d2eec91c25219621bee6536c2ca4948175,1/8(月) 19:00
seraijp,サライ.jp,家綱の叔父・保科正之が天守無用論を唱えた？「江戸城4代天守」はなぜ再建されなかったのか？,https://news.yahoo.co.jp/articles/cc3d04fa2e7110b70c6d837f03bbd8aeb98339d5,1/8(月) 15:00
seraijp,サライ.jp,定番から個性派まで「お取り寄せアップルパイ」4選【評判店のアップルパイ】,https://news.yahoo.co.jp/articles/387603a35ec99a784fde3e02c97910e867f0bbd6,1/8(月) 13:00
seraijp,サライ.jp,最新医学でわかった！ 信じていた常識は大間違いという衝撃の事実【医者が教える健康の新常識】,https://news.yahoo.co.jp/articles/1aebe1da6a18ec49d33bc93dff8c39ad20a1e284,1/8(月) 11:02
seraijp,サライ.jp,【もう君はいない】「定年の日に家に帰ると妻はいなかった…」家庭より仕事優先だった夫の悔恨〜その1〜,https://news.yahoo.co.jp/articles/09dcfe40cbcdc3a203ec77fc05fba033817b4c0b,1/8(月) 9:00
seraijp,サライ.jp,ブルーベリーを食べても視力改善に効果はない!? 眼科専門医が教える「目の常識のウソ・ホント」,https://news.yahoo.co.jp/articles/d4efb9ab1a8fdd16446a0a7cd34fabf209cb1554,1/8(月) 6:00
seraijp,サライ.jp,1000年前と変わらない人間の性（さが）。大河ドラマ『光る君へ』を楽しむ要諦とは？【光る君へ 満喫リポート】,https://news.yahoo.co.jp/articles/451ab32624b6f67a437fb4e2a5e0e848daccc544,1/7(日) 21:00
seraijp,サライ.jp,【家族のかたち】「親からフェードアウトされた」人間関係のリセットを繰り返す女性が育った環境とは〜その2〜,https://news.yahoo.co.jp/articles/bb245a2404befa2f8a73035a79cd2b0f96315da1,1/7(日) 19:00
seraijp,サライ.jp,丹後半島で水揚げされる最上級の伊根鰤を味わう｜油屋別館 和亭（京都）【全国ごちそう温泉】,https://news.yahoo.co.jp/articles/ded9e7688b081d040a9e0c59851bd17c6c6e0962,1/7(日) 17:00
seraijp,サライ.jp,抗酸化作用でアンチエイジング！「にんじんスープ」「豆乳みそ汁」「アジアンスープ」【ずぼら瞬食スープダイエット】,https://news.yahoo.co.jp/articles/b818f63909a71da3e78f1c8e27aad2e9067e159b,1/7(日) 15:00
seraijp,サライ.jp,春の七草のひとつ「大根」を使ったおかずで無病息災を願う【管理栄養士が教える減塩レシピ】,https://news.yahoo.co.jp/articles/90c169d7a03df194b73c9d2f8ee414314b1e5ba4,1/7(日) 13:00
seraijp,サライ.jp,『どうする家康』から260年後の「徳川」。「日本の近代化」は最古参家臣の子孫小栗上野介が創った！【どうする家康 満喫リポート】後夜祭2,https://news.yahoo.co.jp/articles/a18b14d4660c04b4ed854a555521f6572bfcfa09,1/7(日) 11:03
seraijp,サライ.jp,【家族の秘密】「就職した息子と連絡が取れない…」出世コースを歩んでいた中高一貫校出身の息子の初めての反抗期〜その1〜,https://news.yahoo.co.jp/articles/cd8baf0fd2530cbff0a675d09dbe8d736ea52ca1,1/7(日) 9:00
seraijp,サライ.jp,放置すれば失明のリスクも！「緑内障」を効果的に予防する生活習慣とは？,https://news.yahoo.co.jp/articles/ad09677d333dc8df84e99cea41a5baed4c5b5559,1/7(日) 6:03
seraijp,サライ.jp,【韓国大人留学3】50代で楽しむキャンパスライフのはずが、韓国語学習に悪戦苦闘,https://news.yahoo.co.jp/articles/5ed450ac7a9d8efee19151c9a93c23ae86c65893,1/6(土) 20:03
