media_en,media_jp,title_articles,link_articles,date_original
kyt,京都新聞,琵琶湖の湖底で発見の遺体は34歳会社員の男性　大津,https://news.yahoo.co.jp/articles/3930adae0faccb9ae52d24b7e4f1392112f0d26e,2/5(月) 20:54
kyt,京都新聞,８、９日に滋賀でひきこもり電話相談　「心のうちを自分のペースで話して」,https://news.yahoo.co.jp/articles/08f000e505e8ad63f4fb625a61b47bc394992fd9,2/5(月) 19:51
kyt,京都新聞,強制わいせつ疑い、海上自衛官ら3人不起訴処分　路上で20代女性にキス疑い,https://news.yahoo.co.jp/articles/407e783f0adfedfc4f98c2a070658f6a2203b617,2/5(月) 19:27
kyt,京都新聞,新名神工事、機械停止させず前腕切断　土木工事業者と現場責任者を書類送検,https://news.yahoo.co.jp/articles/670b842e654db96b355a39d93538c5717a0608da,2/5(月) 19:06
kyt,京都新聞,工事現場2カ所で銅線5200メートル盗まれる　時価130万円、連続窃盗か,https://news.yahoo.co.jp/articles/f7375e18f8d3ed7eae6a04cc407890250fd1de09,2/5(月) 18:42
kyt,京都新聞,東海道新幹線、6日も遅れが発生する可能性　関東地方の雪の予報で,https://news.yahoo.co.jp/articles/e330823edfca413c0c300addaddb6d10560a3988,2/5(月) 18:06
kyt,京都新聞,69歳女性、1300万円分の暗号資産だまし取られる　警官や検察官かたる男らから,https://news.yahoo.co.jp/articles/731d16eaa563b58a1cd59bb76ee6ee70ccb0a915,2/5(月) 18:02
kyt,京都新聞,琵琶湖の水位はマイナス62センチ　5日午前6時現在,https://news.yahoo.co.jp/articles/e816cd367f7adf118d28fd4bc8a5bb3e99425b89,2/5(月) 18:02
kyt,京都新聞,「ゴースト血管」増やさない生活習慣とは？　京都市で心臓病や脳卒中などの非感染性疾患シンポ,https://news.yahoo.co.jp/articles/639e2a97cf33ffedcc41f1ed347c94dafb4cfbb7,2/5(月) 17:32
kyt,京都新聞,社説：京都市長に松井氏　厳しい民意受け市政刷新を,https://news.yahoo.co.jp/articles/4b493da420eb3c524e71aeb12942efc37f713678,2/5(月) 16:01
kyt,京都新聞,東海道新幹線に遅れの可能性　関東地方の雪で,https://news.yahoo.co.jp/articles/10a1879987713f0e29d32108bbb20c6871d6b5b3,2/5(月) 15:54
kyt,京都新聞,出町柳駅前のジャズ喫茶「LUSH LIFE」　京都の町にたゆたう音楽の記憶（その1）,https://news.yahoo.co.jp/articles/13b512d8449a12deccf7973010ef64e4fa5c679c,2023/12/11(月) 15:23
kyt,京都新聞,「OLD THINGS MUST GO ON」な京都で巨大なマリオに出迎えられ、中古レコードを掘った話。,https://news.yahoo.co.jp/articles/5b43b45d1413247db10b9d93709f1048dd57d27c,2023/11/7(火) 11:49
kyt,京都新聞,「千羽以上の鶏が毎日死んでいる」鳥インフル、国内初の大規模感染との戦いは1本の電話から始まった　#ニュースその後,https://news.yahoo.co.jp/articles/59b1439dd4f42ce07e0f9410d7c061471896a976,2023/10/15(日) 18:04
kyt,京都新聞,これぞ京都ロックシーンの原動力、酒蔵のライブハウス『磔磔』で感じた「懐の深さ」,https://news.yahoo.co.jp/articles/804d829e2eda4eff089ff850161fc7c36b2576ce,2023/9/28(木) 11:29
