media_en,media_jp,title_articles,link_articles,date_original
kyt,京都新聞,大蛇見立て五穀豊穣祈る　「町内最大級」しめ縄作りで住民協力,https://news.yahoo.co.jp/articles/18219c47e7753c7c6109c9068b78f0b63997a865,2/13(火) 12:06
kyt,京都新聞,西川貴教さんが「イナズマロックフェス」収益を滋賀県に寄付　「琵琶湖保全に役立てて」,https://news.yahoo.co.jp/articles/fb52b276c1d43023b36ef1a2ceab9577b3921827,2/13(火) 12:01
kyt,京都新聞,【速報】「拝殿の東に女性が倒れている」神社境内で2人倒れて死亡　雪かぶり,https://news.yahoo.co.jp/articles/91f310735b81f5a066b385743df49c497903e263,2/13(火) 11:33
kyt,京都新聞,イベント次々「地域あっての寺」　京都・宇治田原の住職、観光ツアーも企画,https://news.yahoo.co.jp/articles/e44deeb50e0083ecb9b848f822b57180c97a53a7,2/13(火) 11:22
kyt,京都新聞,ご当地「あるある」を募集　滋賀・守山の観光物産協会　かるた制作へ,https://news.yahoo.co.jp/articles/755d625aa2f4987da5073ef8109d17d597c99546,2/13(火) 11:12
kyt,京都新聞,琵琶湖の水位はマイナス54センチ　12日午後5時現在,https://news.yahoo.co.jp/articles/20ab3648b19119d642c821b03ce89230a0ff15b8,2/13(火) 11:02
kyt,京都新聞,能登半島地震で大規模火災　「著しく危険な密集市街地」　解消の方向性は,https://news.yahoo.co.jp/articles/2cbdf64fd96e7b3e74d683ec36b17ec695780312,2/13(火) 10:32
kyt,京都新聞,「滋賀」のジャージー、炬火リレートーチ　1981年のびわこ国体ゆかりの品を展示,https://news.yahoo.co.jp/articles/d81b9a0efb829e75462131a344c0fdc455a09bee,2/13(火) 7:32
kyt,京都新聞,貧しさゆえに苦労…企業の社長となったOBが母校に寄付　生徒が恩返しの楽器演奏,https://news.yahoo.co.jp/articles/3d9f51c4370052022bf67520772c6133a5d14fe0,2/13(火) 7:02
kyt,京都新聞,「海を舞台に働く姿はかっこいい」　20歳の海上保安官の志「地元の海を守りたい」,https://news.yahoo.co.jp/articles/5565600f849edbef3082e9de3e6bd95bf1456f3d,2/12(月) 21:20
kyt,京都新聞,「荒波に立ち向かう姿が格好いい」　マグロ漁にあこがれた都会の青年は漁師になった,https://news.yahoo.co.jp/articles/d922a8de56b074bf01fa74cbfa5dcb9a0c7b5584,2/12(月) 20:07
kyt,京都新聞,「思いが届いてほしい」　小学生が高齢者「配食サービス」のレシピ考案　京都・木津川,https://news.yahoo.co.jp/articles/e7a94c638caa51791383faa1787fad798c5dcb23,2/12(月) 18:39
kyt,京都新聞,薬の視点から茶や日本酒、信楽焼との関わり紹介　滋賀・甲賀で「甲賀のおもてなし展」,https://news.yahoo.co.jp/articles/b17d9b9cf3e255238b2efc97fcdb4873f4c745bb,2/12(月) 18:36
kyt,京都新聞,かごしま国体で活躍　4選手に滋賀・守山市がスポーツ栄誉賞,https://news.yahoo.co.jp/articles/40ac5a53974035f9465dfc7aad28783add36f807,2/12(月) 18:32
kyt,京都新聞,琵琶湖の水位はマイナス56センチ　12日午前6時現在,https://news.yahoo.co.jp/articles/ab90feb1c395f5b356b4c39f5607d8c6a9152ebc,2/12(月) 18:12
kyt,京都新聞,北陸線が運転再開、サンダーバードに5時間以上の遅れ　北鯖江駅付近で沿線火災,https://news.yahoo.co.jp/articles/1142989adde239c8292fb94ab06dadd2d7103880,2/12(月) 18:03
kyt,京都新聞,北陸線北鯖江駅付近の沿線火災で特急しらさぎの運転取り止め,https://news.yahoo.co.jp/articles/9544f6c3711eafe54787e5215a5cd157e69bfa5b,2/12(月) 16:54
kyt,京都新聞,北陸線北鯖江駅付近の沿線火災で特急サンダーバードの臨時列車を運転へ,https://news.yahoo.co.jp/articles/7ccf4ba5f6220d9ae7211777d08943529f07043f,2/12(月) 16:48
kyt,京都新聞,北陸線・北鯖江駅付近の沿線火災でサンダーバードが運転取り止め,https://news.yahoo.co.jp/articles/d535ebbac8f99ca372e846cf12ebee01222c7536,2/12(月) 16:42
kyt,京都新聞,北鯖江駅付近で沿線火災　北陸線の敦賀ー福井駅間で一時運転見合わせ,https://news.yahoo.co.jp/articles/e3e303f112db91eea69f9e05294704089fea8a70,2/12(月) 16:36
kyt,京都新聞,社説：滋賀県予算案　「ともに」支える施策着実に,https://news.yahoo.co.jp/articles/9b18e9b7f9864c5d33e91386fa83396a89d85dfc,2/12(月) 16:02
kyt,京都新聞,放火で焼失の京都北部の「愛宕神社」、住民らが再建へ奔走　「歴史途絶えさせたくない」,https://news.yahoo.co.jp/articles/2ac1cccbeefd9e5dec15df1b1d961f727a365fd3,2/12(月) 14:02
kyt,京都新聞,参加者低迷の京都「福知山マラソン」、魅力向上どうすれば　市が検討会議,https://news.yahoo.co.jp/articles/1dfafe87c8c48a50c2cfa56cc6998baa53ff983b,2/12(月) 13:01
kyt,京都新聞,「地形似た京都・丹後半島も道路整備重要」　能登地震、被災地派遣の消防隊員が報告,https://news.yahoo.co.jp/articles/f89ac1519df4c09c4c37e896ce0a166eb3102a71,2/12(月) 11:32
kyt,京都新聞,大阪府と兵庫県で震度2、京都府で震度1の地震　震源は兵庫県南東部,https://news.yahoo.co.jp/articles/159679a07b867fb467da59cb3f55d529865e91cd,2/12(月) 11:18
kyt,京都新聞,琵琶湖の水位はマイナス54センチ　11日午後5時現在,https://news.yahoo.co.jp/articles/6601f218b9e0b4e8bb8bef863c015ba07d4ba886,2/12(月) 11:02
kyt,京都新聞,人気の千手千足観音像　東京出展取りやめに　信仰かPRか、揺れる地元住民　滋賀,https://news.yahoo.co.jp/articles/62af82fb40491337fb96db5f62633e7de6fd7a3c,2/12(月) 10:32
kyt,京都新聞,長刀鉾をダイナミックに描いた作品など展示　京都市中京区で障害者制作のアート展,https://news.yahoo.co.jp/articles/bea2b537092fc5ac4d6b3875c592aa2a19882fa8,2/12(月) 9:02
kyt,京都新聞,旧小学校の校舎、どう活用する？　飲食店やアトリエの事例、維持費確保など議論　京都府南丹市,https://news.yahoo.co.jp/articles/49928c8a70ec88c156b2379f93dbc457e874950e,2/12(月) 7:02
kyt,京都新聞,救急車が脱輪で走行できず、搬送遅れ　京都府八幡市「患者への影響なかった」,https://news.yahoo.co.jp/articles/fc7307cf820eea07b957d045d063fd13b24a821d,2/12(月) 6:02
kyt,京都新聞,滋賀県で連続窃盗事件、店荒らされ現金やカメラなど100点盗まれる　東近江市・日野町,https://news.yahoo.co.jp/articles/b26c74a29efb48e7a8aecdb4c2cdb0d0a0b6a092,2/11(日) 20:39
kyt,京都新聞,アメリカ有機農家が語る「食の安心安全」買い手と築く相互扶助「ビジネスというより友人」,https://news.yahoo.co.jp/articles/00d315da4c4464e823342e5d7df7b02f5d78ca15,2/11(日) 19:02
kyt,京都新聞,用水路に男性遺体、うつぶせで倒れているところ発見　滋賀県甲良町,https://news.yahoo.co.jp/articles/b8a5510b70d0e480dd28590a4f709cfb25efb6d9,2/11(日) 18:12
kyt,京都新聞,遺体の検案、かかりつけ医か輪番制で対応　新体制導入で円滑化　滋賀県警が医師会に感謝状,https://news.yahoo.co.jp/articles/6d28080b183c7b98f091aea55f01df0c07fdbae1,2/11(日) 16:54
kyt,京都新聞,社説：名張再審請求棄却　なぜ門を閉ざし続けるのか,https://news.yahoo.co.jp/articles/efe8463ccbe23db02d4c819a18cbd1d815026527,2/11(日) 16:36
kyt,京都新聞,「いざというとき自分から進んで動こう」校舎２階まで浸水恐れの小学校　避難所設営の授業,https://news.yahoo.co.jp/articles/6c66470e8c82f8c9b927fc5ea3750d5f887e6eec,2/11(日) 13:02
kyt,京都新聞,人口減が地域情報誌を直撃　存続危機で誌面改革、地道な営業「何とか守りたい」模索の日々,https://news.yahoo.co.jp/articles/b5be750401a31af10af6838748ce397897330f2a,2/11(日) 10:32
kyt,京都新聞,地元食材使ってます「めっちゃおいしい」子どもたちが笑顔浮かべた「あやべ茶チキン」とは,https://news.yahoo.co.jp/articles/5a420a89b5e2291c1bfe35f7ed753992fdc22776,2/11(日) 9:02
kyt,京都新聞,叡山電鉄の市原ー鞍馬駅間で一時運転見合わせ,https://news.yahoo.co.jp/articles/4d7188c26d227d1a084ea0b12e750bc77f7ba00f,2/11(日) 8:02
kyt,京都新聞,「新卒。でも一軒家」窓から茶畑、部屋5つ古民家で始める公務員　向き合うまちに膨らむ期待,https://news.yahoo.co.jp/articles/6c7087999a8b9d1d34590df2343652aa47053d3c,2/11(日) 8:02
kyt,京都新聞,「害虫捕獲の黄色いテープ、興味深い」アメリカの大学生が京都・亀岡市の農業に熱視線,https://news.yahoo.co.jp/articles/a15a8befe6afed729d503567911e3350460a5321,2/11(日) 7:02
kyt,京都新聞,社説：どうする大阪万博　能登の復興に集中すべきだ,https://news.yahoo.co.jp/articles/d074b9f7d796a152ddf11be0a446f951448c1795,2/10(土) 16:02
kyt,京都新聞,料理研究家が教える独自レシピの減塩みそ　京都府舞鶴市で市民ら仕込み「孫にうまいみそ汁を」,https://news.yahoo.co.jp/articles/1b8b0d7dc6939e639f0264d1ebf4bfce1ba781de,2/10(土) 16:02
kyt,京都新聞,明治時代に作成、初の英文京都ガイドはどんな内容？　「幻の原本」行方追う女性司書,https://news.yahoo.co.jp/articles/9efdfe09acd65d901b027f95cb0d8e5f98e8b802,2/10(土) 13:02
kyt,京都新聞,京都市動物園のシロテテナガザル「クロマティー」天国へ　推定39歳、園の人気者,https://news.yahoo.co.jp/articles/6d7ddb8e886a1d7a5840696cb488bacd30661aad,2/10(土) 11:27
kyt,京都新聞,中学校の運動部活の未来は？「過剰に肥大化」「地域任せは本末転倒」　教育者やプロ野球選手ら議論,https://news.yahoo.co.jp/articles/c9582edb0f67d0e25e319873bcb755dfd83eefb2,2/10(土) 10:32
kyt,京都新聞,世界的指揮者の小澤征爾さん、88歳で死去　京都でも後進指導に情熱,https://news.yahoo.co.jp/articles/be576a1542968d81c588bde636e842f265882e07,2/9(金) 21:16
kyt,京都新聞,28歳中国籍男性が2200万円詐欺被害　警察官ら名乗る男女「強制送還されたくなければ入金を」,https://news.yahoo.co.jp/articles/3bdc22f11697873ae0fdf9b910b2ef7e9680459d,2/9(金) 20:42
kyt,京都新聞,琵琶湖の水位はマイナス57センチ　9日午前6時現在,https://news.yahoo.co.jp/articles/b530bd6094b9049190f52bd91391da3141a5be5a,2/9(金) 18:42
kyt,京都新聞,京都府亀岡市の「川の駅」が使用料6万5千円超を過大徴収　料金体系を勘違い,https://news.yahoo.co.jp/articles/3e20be55659d7849b7bee7139f754fc371f498cd,2/9(金) 18:24
kyt,京都新聞,滋賀県職員、スカート内盗撮で懲戒免職　「仕事の重圧逃れるため、100件近く繰り返した」,https://news.yahoo.co.jp/articles/360b07e622ea5968e17c22a96eab63f2802c5340,2/9(金) 17:02
kyt,京都新聞,社説：情報扱い者調査　危うい民間人への拡大,https://news.yahoo.co.jp/articles/97e405de60cda4a535baf1461b38b3fdf48a5011,2/9(金) 16:06
kyt,京都新聞,社説：共産党の新体制　開かれた組織へ変革を,https://news.yahoo.co.jp/articles/8cb1a069d5275495d7ea0047ec966389c7c3fb27,2/9(金) 16:02
kyt,京都新聞,死刑判決の青葉真司被告、本人も不服で控訴　京都アニメーション放火殺人事件,https://news.yahoo.co.jp/articles/5a6efed82fcfd999f40dfad527e9485850937c32,2/9(金) 15:02
kyt,京都新聞,泉房穂さん「子どもを応援すれば、みんなハッピーに」　京都・木津川で講演,https://news.yahoo.co.jp/articles/add1f9f376a9bd7e9104b664f20fa65005ecd7d9,2/9(金) 15:02
kyt,京都新聞,林業の現場「VR」で体験　伐倒作業・倒木事故も再現「経験思い出したい」,https://news.yahoo.co.jp/articles/8dbc594daefcd01c3583d7feb5442d163ffbe89e,2/9(金) 14:02
kyt,京都新聞,74歳運転のタクシーが渋滞列に追突し5人重軽傷、容疑で書類送検,https://news.yahoo.co.jp/articles/f623507fc0a7ff4b5aaa0e5e6b965a3936bd0d67,2/9(金) 12:33
kyt,京都新聞,復活した京の伝統野菜「佐波賀だいこん」　煮物や大根おろし向き、出荷スタート,https://news.yahoo.co.jp/articles/e4b3deb4bbdcd96e438e4248e6a1e30d9cd92152,2/9(金) 11:39
kyt,京都新聞,内閣府に「住民の安心確保を」　防衛施設の特別注視区域候補で京都・京丹後市,https://news.yahoo.co.jp/articles/497e359981e666aa662941b638974fb5c90692f7,2/9(金) 11:06
kyt,京都新聞,琵琶湖の水位はマイナス56センチ　8日午後5時現在,https://news.yahoo.co.jp/articles/466e8ec047b5f92efc756b1afdf44ea75686c50b,2/9(金) 11:01
kyt,京都新聞,「大雪警報でも全学校で通常通り授業」　特殊な市域背景、周囲は休校相次ぐ,https://news.yahoo.co.jp/articles/e8f3aa37abe0b9d0a77df4ab5360efdcdbaabe51,2/9(金) 10:32
kyt,京都新聞,「今があるのは兄のおかげ」太平洋戦争で戦死した元兵士の遺品、親族に返還,https://news.yahoo.co.jp/articles/519c108b464fe869dd458436b694b189d9035c1e,2/9(金) 8:02
kyt,京都新聞,町内の小中高校タッグ「善意の重み」寄付金50万円超す　能登半島地震の被災地支援,https://news.yahoo.co.jp/articles/cb83247a8fbc03ed92f171db92ee88758f5ad1e5,2/9(金) 6:02
kyt,京都新聞,小論文の解答用紙を誤って配布、合否に影響なし　滋賀県立高入試,https://news.yahoo.co.jp/articles/90c8c90a0cfe8438e734fd024574021b29f81d9d,2/8(木) 21:01
kyt,京都新聞,やじ注意され胸ぐら掴む、観客「出禁」に　バスケ滋賀レイクスが処分,https://news.yahoo.co.jp/articles/b4faea4c6b3b6f6010400cad762d672c2a7711df,2/8(木) 20:18
kyt,京都新聞,「中学生に寄り添って」能登から避難生徒をサポートへ　滋賀県、教員3人を派遣,https://news.yahoo.co.jp/articles/81ddfbb33e07290c4e4ddea64d9142a3ae23bdf6,2/8(木) 20:01
kyt,京都新聞,「もうけたお金で一緒に旅行へ」　57歳男性、740万円だまし取られる,https://news.yahoo.co.jp/articles/a7ea3a49d2f7ab359ee410747909dab4aa651316,2/8(木) 19:36
kyt,京都新聞,「けじめが必要だ」前原氏、玉木氏の続投を疑問視　「トリガー条項」協議巡り,https://news.yahoo.co.jp/articles/424bfa91e37aa8b984e74de4ac9d2829055a627f,2/8(木) 19:27
kyt,京都新聞,滋賀県高島市の国道161号で多重事故、一時通行止めに,https://news.yahoo.co.jp/articles/40b8ceef83721641ac30fbc633e42c9daa800636,2/8(木) 18:57
kyt,京都新聞,元TOKIO・山口達也さん「お酒が好きで、寂しかった」　アルコール依存症の苦しみ語る,https://news.yahoo.co.jp/articles/4bf1ee38751c5c9004fdf6c15eb907a0bd9aa9c4,2/8(木) 18:46
kyt,京都新聞,京都府長岡京市で伝統のみそづくり　農村の食文化、地元小学生ら親子で体験,https://news.yahoo.co.jp/articles/73d6fa8e6e41689b7fcaba26521ba44b7dd8f8a9,2/8(木) 18:02
kyt,京都新聞,能登半島地震の被災地、断水で手洗いや排便処理に苦労　支援の消防隊員が現地で実感,https://news.yahoo.co.jp/articles/5b020d9ea888368fc96aa2e040c728fcce1f0fff,2/8(木) 17:46
kyt,京都新聞,京都・宇治田原町の元理事、また有罪判決　入札情報漏らし現金受け取る,https://news.yahoo.co.jp/articles/442a4f6042fa399074f8ad477a8b8cb529176490,2/8(木) 16:48
kyt,京都新聞,社説：盛山文科相　宗教所管の適性を欠く,https://news.yahoo.co.jp/articles/12291da8d6e2612299d7b36fea1f559aca688dc1,2/8(木) 16:06
kyt,京都新聞,社説：災害ごみ　復旧加速へ広域処理を,https://news.yahoo.co.jp/articles/64810e49e49ee36b7b62e3b1b8d007b06854885c,2/8(木) 16:01
kyt,京都新聞,絵・物語・演者をこなすプラネタリウム解説員　時代考証もばっちりの新作上映へ　開館30年の天文館で特別番組,https://news.yahoo.co.jp/articles/bd2329d44279676e48c4f76bc339c5b647088f4a,2/8(木) 15:02
kyt,京都新聞,琵琶湖の水位はマイナス56センチ　7日午後5時現在,https://news.yahoo.co.jp/articles/07b4d6c7efa4dcf79efbf66ef3df48d4fcce1e42,2/8(木) 10:36
kyt,京都新聞,滋賀県内の特殊詐欺被害が過去最悪を更新　最も被害の多い手口は,https://news.yahoo.co.jp/articles/192463492fe8c4d6f28c82c45c1ccbace0b451ef,2/8(木) 10:32
kyt,京都新聞,小学校給食に北海道産ホタテ「柔らかくておいしかった」　国内需要の一助に,https://news.yahoo.co.jp/articles/063f860b618a09c8392a066fb1da75fc30a93e51,2/8(木) 7:02
kyt,京都新聞,歯型取違え「誤認逮捕」滋賀県が和解方針　損賠訴訟、国相手は協議中,https://news.yahoo.co.jp/articles/57ab1bfb260fdf14170ec16c6357491985408cdd,2/8(木) 6:02
kyt,京都新聞,マイクロソフトに類似した商標付きUSB所持、商標法違反疑いで男逮捕　中国から輸入か,https://news.yahoo.co.jp/articles/a4a56e4b3d04e931007854066d154a7b54eeb9f9,2/7(水) 20:17
kyt,京都新聞,王将社長射殺事件、被告本人が出席し公判前整理始まる　京都地裁、犯人性が争点に,https://news.yahoo.co.jp/articles/a250912c38ded72a1aa70d0762da4cef482f6457,2/7(水) 20:03
kyt,京都新聞,消費税課税対象なのに誤って「非課税」表示のレシート発行　滋賀県立美術館,https://news.yahoo.co.jp/articles/07cad2081e5f3a4749b10a9f74249035d4aa2963,2/7(水) 19:31
kyt,京都新聞,天皇即位に伴う大嘗祭に公務参加「社会的儀礼として許容される」　政教分離訴訟で請求棄却,https://news.yahoo.co.jp/articles/b99b670c708521d3b2c6edcb742373b8f8861163,2/7(水) 19:22
kyt,京都新聞,外国籍の男名乗り「暗号資産が買い時」銀行から借金し入金、45歳女性が2000万円被害,https://news.yahoo.co.jp/articles/a7c8e4ac351bea9344f0975d4c2bba7492192d75,2/7(水) 19:16
kyt,京都新聞,琵琶湖の水位はマイナス57センチ、7日午前6時現在　前日比2センチ増,https://news.yahoo.co.jp/articles/5c96efc67bdc23a327b7636aa0db4b0cb140a7aa,2/7(水) 18:32
kyt,京都新聞,自分と複数の人物相手に18歳未満少女に性交させる　容疑で35歳男を再逮捕,https://news.yahoo.co.jp/articles/4c4627a6c19d0f0761fe5eeed7838d515478e833,2/7(水) 18:24
kyt,京都新聞,投資の宣伝広告にアクセス「金塊購入すれば利益」57歳会社員男性が1100万円被害,https://news.yahoo.co.jp/articles/59190e6d01817f5eb4dd5e1a28230e165aed4398,2/7(水) 18:02
kyt,京都新聞,ひとり親家庭の6割超「暮らし向き苦しい」　母子・父子とも増「物価高が影響か」,https://news.yahoo.co.jp/articles/954338af0fd222367b7074dc50efa1461e63b5a6,2/7(水) 18:02
kyt,京都新聞,ドラッグストアで化粧品など11000円相当盗んだ疑い　市職員の女を逮捕,https://news.yahoo.co.jp/articles/edcf8a874fcf5c034638b16062a4f125bc006016,2/7(水) 17:57
kyt,京都新聞,SNS通じ「芸能人が投資で多額の利益」投資誘われ57歳女性が540万円被害,https://news.yahoo.co.jp/articles/4c21dcf769c81fa05fbf04bc824535393e472ceb,2/7(水) 17:51
kyt,京都新聞,京都の大学生2人、こまの世界大会で王者に　小学生からの「こま仲間」普及にも力,https://news.yahoo.co.jp/articles/d53f8183d2d4fd7223cf1757ed92313635f39d7c,2/7(水) 16:31
kyt,京都新聞,JR神戸線の宝殿駅で新快速と人が接触　土山ー姫路で一時運転見合わせ,https://news.yahoo.co.jp/articles/f5ab81463709a7b67b96a27ee2d5a5a595b01169,2/7(水) 16:24
kyt,京都新聞,社説：国会の裏金答弁　目に余る首相の消極さ,https://news.yahoo.co.jp/articles/8f3bcbb93eecc7a629ceb0c66dd058e876fe30c1,2/7(水) 16:06
kyt,京都新聞,社説：麻生氏の発言　蔑視スルーは許されぬ,https://news.yahoo.co.jp/articles/919d03efa2c6939698547886dc9f3d24d60cacb3,2/7(水) 16:01
kyt,京都新聞,「自分の人生は自分しか歩めない」東京パラ出場のアスリートが語る、逆境を乗り越えるこつは,https://news.yahoo.co.jp/articles/60755ba53d7f3b241e0e72f66147c93b190fd632,2/7(水) 14:36
kyt,京都新聞,琵琶湖の男性遺体　逮捕の男女、コンビニATMで金を引き出す姿がカメラに,https://news.yahoo.co.jp/articles/1102135f282db4c96e31dee7953ed74c64c2503b,2/7(水) 11:32
kyt,京都新聞,琵琶湖の水位はマイナス58センチ　6日午後5時現在,https://news.yahoo.co.jp/articles/362b85507a28d9ac869e3e2aabf9bc5b4df2692b,2/7(水) 11:02
kyt,京都新聞,「Z世代」猟師じわり増える　狩猟のやり方はネットで学ぶ、京大生や元新聞記者も参戦,https://news.yahoo.co.jp/articles/157d0b083d9a8a4a0271d8f65c32c931cb2552e4,2/7(水) 10:31
kyt,京都新聞,JR駅近くで血を流し倒れていた男性は大学生、ホームから転落か,https://news.yahoo.co.jp/articles/97c66794f3d4307fc22213e01eee4aee2c9127d2,2/7(水) 10:27
kyt,京都新聞,「自分たちも支援したい」京都・亀岡の中学生が能登地震の被災地へ募金,https://news.yahoo.co.jp/articles/747a7c2ba33548f290d618a94f019058e6619fcb,2/7(水) 7:02
kyt,京都新聞,「血を流した男性」意識不明の重体　大津市のJR駅ロータリー前,https://news.yahoo.co.jp/articles/ee2d28a7284c69bb36a53dbc907004fdd5c27ef0,2/6(火) 21:39
kyt,京都新聞,関西生コン事件で大津地裁　ビラまきで起訴の7人は無罪、湖東ブロック2被告は刑猶予,https://news.yahoo.co.jp/articles/501147ed7401e6e91c52455fc82e3934cdc2425d,2/6(火) 20:06
kyt,京都新聞,化粧品販売への投資名目で得た646万円、犯罪収益と知り受け取った疑いで男逮捕,https://news.yahoo.co.jp/articles/af829e888aa3438f84e5cf9fd6fdeb24316a8e87,2/6(火) 19:54
kyt,京都新聞,野球賭博で1億円超を賭けさせた疑いで男女3人再逮捕、暴力団の活動資金か,https://news.yahoo.co.jp/articles/7b1ac3f8a9fba8450f1cecacba80e94f1c5c3ffb,2/6(火) 19:42
kyt,京都新聞,大津の琵琶湖岸で見つかった遺体は60歳女性、家族が警察に行方不明届,https://news.yahoo.co.jp/articles/339b0d39a4df818af610978dad8996b69818b12d,2/6(火) 19:31
kyt,京都新聞,琵琶湖の男性遺体の会社口座から現金引き出した疑いで男女逮捕、死亡経緯知る可能性も,https://news.yahoo.co.jp/articles/e9f641d462b4b11c9b1fb1717049dd2a48cdb0f5,2/6(火) 19:24
kyt,京都新聞,京都・宇治の路上で車内に連れ込み「今日で話を終わらせよう」と5時間監禁、容疑の男逮捕,https://news.yahoo.co.jp/articles/a19c6ddb6348e76c6efdcc8c3a5c80202f512ed9,2/6(火) 19:02
kyt,京都新聞,「軽慮で愚かだった」公務員を懲戒免職、交際の女性宅から衣類など窃盗,https://news.yahoo.co.jp/articles/0e766b633e581f5838d4f58e43b46e62de210d7a,2/6(火) 18:46
kyt,京都新聞,京都市長選落選の村山祥栄氏を告発、弁護士ら「架空の政治資金パーティーは違反」,https://news.yahoo.co.jp/articles/56df89ab080b3a6f1a1a26808bfc17fc9c557f06,2/6(火) 18:32
kyt,京都新聞,琵琶湖の水位はマイナス59センチ、6日午前6時現在　前日比3センチ増,https://news.yahoo.co.jp/articles/d8ca4c8944257edb68bb2d41a89a576d236498ab,2/6(火) 18:02
kyt,京都新聞,不動産取引の手付金1320万円だまし取る、不動産会社の元経営者を容疑で逮捕,https://news.yahoo.co.jp/articles/c037b3d25c356ae6a9da352350f57688a1a941b7,2/6(火) 17:46
kyt,京都新聞,京都・西京極で車に追突し逃走、運搬業の男を容疑で逮捕　追突された女性はけが,https://news.yahoo.co.jp/articles/cec9a3eebb03d0e70df4214ff9e03c8c05f16c67,2/6(火) 17:42
kyt,京都新聞,任天堂、一転増収増益の見通し　2024年3月期連結業績　年末商戦「スイッチ」好調で,https://news.yahoo.co.jp/articles/f12e9ce29c5d43a879a08377577626a4327e08c2,2/6(火) 16:02
kyt,京都新聞,社説：認知症の新薬　正しい理解を広げて活用を,https://news.yahoo.co.jp/articles/5c10b64392ec252027fb66af4c08c33f4016c98a,2/6(火) 16:02
kyt,京都新聞,「5歳のバイオリニスト」被災地へ奏でる音色　チャリティーコンサートで聴衆魅了,https://news.yahoo.co.jp/articles/edef64d6bd62782613088ff859e8efa64eb7ebce,2/6(火) 14:01
kyt,京都新聞,琵琶湖の水位はマイナス61センチ　5日午後5時現在,https://news.yahoo.co.jp/articles/4bb964921390425202da16b76021ecd848e9de61,2/6(火) 11:02
kyt,京都新聞,京都でもかつて大地震あった　能登半島地震で見られた隆起や液状化現象も,https://news.yahoo.co.jp/articles/440025ff4c5a6f9e9539e0f536a530a8edb2abaa,2/6(火) 11:02
kyt,京都新聞,琵琶湖固有種「ホンモロコ」の不思議　雌と雄の割合を決める要因とは「産卵期に水位保つこと重要」,https://news.yahoo.co.jp/articles/b0f21203d0d3993f3b545ab84cc6d7ec6f6a1d78,2/6(火) 11:02
kyt,京都新聞,街中に「ニャー」　善意だけでは続かない京都市の「まちねこ活動」 住民の負担と本音,https://news.yahoo.co.jp/articles/51f2739e4d8eff875ebfd030d74cc691dfd9b563,2/6(火) 10:32
kyt,京都新聞,あでやか「日本舞踊」子どもらが優美な踊り披露　京都で発表会,https://news.yahoo.co.jp/articles/0ad5e0e49b84c9c07c1ab9f80446e830aa1f6ca8,2/6(火) 10:02
kyt,京都新聞,働き世代男性、料理に挑戦　京都・南丹で教室「これから料理してみようという気に」,https://news.yahoo.co.jp/articles/1b4e128aeb658655b084d919ccca397ccb41493d,2/6(火) 7:01
kyt,京都新聞,株投資のサイトにアクセス、890万円分の暗号資産だまし取られる　滋賀,https://news.yahoo.co.jp/articles/d6fde66d9dcfe3ba9d1dab427b560389dc54f996,2/5(月) 22:12
