media_en,title_articles,link_articles,date_original
yom,世界初、液化天然ガス燃料の大型石炭運搬船…九州電力と日本郵船が運航始める,https://news.yahoo.co.jp/articles/f1699e25f165832713ce07d5233d1537d0dbf3ed,10/17(火) 15:20
yom,日経平均、終値は３８１円高の３万２０４０円…上昇幅は一時６００円超,https://news.yahoo.co.jp/articles/2011e7736a98a8ccaa5c93799cbd6c1397ce8354,10/17(火) 15:17
yom,「トイレまで追ってきた子が出ていく日」…トイレ川柳最優秀賞「親の心の動きを深く味わう表現」,https://news.yahoo.co.jp/articles/489ee3c47310137e8181eb40e598de74840a67a7,10/17(火) 15:06
yom,銀行支店の統廃合進む中、西日本シティ銀行が初の新支店…九州大近くでベンチャー支援,https://news.yahoo.co.jp/articles/4c56ccc7e4564f8116f12bb4214f2d5c118c9cd0,10/17(火) 15:02
yom,「女人高野」幻想的に、龍神の姿映す…11月3日から紅葉ライトアップ,https://news.yahoo.co.jp/articles/3dea0201bdfd9dc95e501939b24770a50a0b10b1,10/17(火) 15:00
yom,豪雨や洪水の予測向上へ、ＪＡＸＡが新衛星開発…雨粒の落下速度も観測,https://news.yahoo.co.jp/articles/1d932ef157a846e2e57d800d25c63bbd6a2f0b1c,10/17(火) 15:00
yom,「医療的ケア児」一時預かり補助へ、保護者の育児負担軽減…こども家庭庁,https://news.yahoo.co.jp/articles/a96b4bd9c214e3b6e63fca39e8d68a0303728d13,10/17(火) 15:00
yom,運転免許取り消し撤回の女性、事故前と同じ「ゴールド」取り戻す…「無罪の場合の仕組みを作るべきだ」,https://news.yahoo.co.jp/articles/bba2377f2cfac59b953196e846c5813e4485f909,10/17(火) 14:58
yom,天皇陛下、バット振る身ぶりで「松井秀喜さんの母校ですよね」…金沢で高校生らと交流,https://news.yahoo.co.jp/articles/f11ce1b99adff151c4a83863785e36612a6fc737,10/17(火) 14:51
yom,ＮＴＴ西日本の子会社、顧客の個人情報９００万件流出…元派遣社員が不正アクセスし持ち出し,https://news.yahoo.co.jp/articles/51a81ef8ffb7f00e6d568ec90818e492f19828b1,10/17(火) 14:35
yom,ＪＲ中央線の八王子駅で人身事故、東京―高尾などで一時運転見合わせ,https://news.yahoo.co.jp/articles/5fd8178c9fb052587ccc1ed0e7e69d42c9bbd412,10/17(火) 14:33
yom,市役所窓口担当からミス・ジャパンプレミアムのグランプリに…義村歩美さん「人に寄り添う愛は無限大」,https://news.yahoo.co.jp/articles/1fcba607e195335aad246a763e14dfae22aa3d40,10/17(火) 14:26
yom,ソフトバンクの助っ人野手4人全員退団へ…デスパイネ、アストゥディーヨら,https://news.yahoo.co.jp/articles/2a0f6b982abd850d8a73e1bea9cba704b155ff13,10/17(火) 14:08
yom,尖閣沖に侵入、中国海警船２隻が退去,https://news.yahoo.co.jp/articles/ab209544e151d48d1b82b0ed26c10201c9e8698f,10/17(火) 14:03
yom,ソフトバンク10回に3点奪った後の悲劇…津森宥紀が同点3ラン被弾、大津亮介も粘れず,https://news.yahoo.co.jp/articles/73ca044c61240f23eae41f872da1ab25fdbccb08,10/17(火) 14:00
yom,ローマ教皇の旅たどるドキュメンタリーに映る「敗北」と不屈の「夢」…名匠ロージ監督が語る,https://news.yahoo.co.jp/articles/32984271b619bb1623856888af0ebc4c8d202099,10/17(火) 14:00
yom,天王寺動物園でおりから脱走したチンパンジー、木から落ちたところを捕獲,https://news.yahoo.co.jp/articles/54645783e35e2bbf1f2821d5fd68790270d5b9e3,10/17(火) 13:49
yom,認知症女性狙って繰り返し訪問販売、９５万円詐取か…元設備業の兄弟ら５人逮捕・起訴,https://news.yahoo.co.jp/articles/4ba73d9db97a775c444a7c0f9b888560972c17d9,10/17(火) 13:44
yom,白良浜ときめく秋冬…10月28日から浜全体をライトアップ、アートや音楽催し続々,https://news.yahoo.co.jp/articles/4860e788e246df1d5856a14756bc3562ecc0d2a6,10/17(火) 13:30
yom,音楽プロデューサーの男、赤羽駅で女子中学生のスカート内を盗撮未遂…「ストレス発散のため」,https://news.yahoo.co.jp/articles/94d970fd2ac398faa1632436c0d35e8d05244b09,10/17(火) 13:29
yom,松田聖子さん、大雨被害の故郷久留米市に義援金１０００万円…「一日も早い復興をお祈りいたしております」,https://news.yahoo.co.jp/articles/7022799b56df14a51461c3f51c9b09b569dafedd,10/17(火) 13:20
yom,プーチン大統領が北京到着、ウクライナ侵略後は初の訪中…「一帯一路」フォーラム出席,https://news.yahoo.co.jp/articles/a41f365ca3f9750e5dcfe69edec67e4122c6ee1c,10/17(火) 13:12
yom,ロシア財務相、輸入ドローンの「大半は中国製」…４割国産化へ９２０億円以上を投入,https://news.yahoo.co.jp/articles/8605bad604eb513f6d113b62e36344841eee5669,10/17(火) 13:08
yom,銀座にスーパー「オーケー」初出店…割安感が売り、会社員男性「とても安くてありがたい」,https://news.yahoo.co.jp/articles/89be24da38b48b2642457d2f5744d97026909655,10/17(火) 13:05
yom,メジャー屈指の強打者ハーパー「五輪に出ることはみんなの夢」…ロス五輪野球・ソフト追加を歓迎,https://news.yahoo.co.jp/articles/2604ec80b70efba4b18798c014d4eec141ad09d0,10/17(火) 12:57
yom,京王線で人身事故、調布―府中駅の上下線で一時運転見合わせ,https://news.yahoo.co.jp/articles/877e7fe310732ddf72fe71694a290cae3b1d19f6,10/17(火) 12:50
yom,日本政府、ＷＴＯ委員会で中国による水産物全面輸入停止は「協定違反で不当」…米やＥＵなど支持,https://news.yahoo.co.jp/articles/0243de451deaa0f9f175d1bd0d2eea07bd563c93,10/17(火) 12:48
yom,脚本家の畑嶺明さん死去、８０歳…「ゆうひが丘の総理大臣」「毎度おさわがせします」「キッズ・ウォー」,https://news.yahoo.co.jp/articles/e1b4ebf02dd81802517f2f96eb7bb1980c66dfb5,10/17(火) 12:36
yom,竜王戦第２局、じっくりした序盤に…解説の大石直嗣七段「両者慎重に駒組み」,https://news.yahoo.co.jp/articles/df0cd278e68080aa797b40b0322c77c85434c776,10/17(火) 12:32
yom,京都高島屋ショッピングセンター10月17日開業、専門店など51店で集客強化,https://news.yahoo.co.jp/articles/515aac43b02ac84a6f33bb2b5a2b989ab9bbda70,10/17(火) 12:30
yom,サイバー対策、日米英など１３か国が国際協力枠組み発足…事業者の責任重視する指針作成へ,https://news.yahoo.co.jp/articles/e7a6add56d8256baa62e9870a7bd0e292d99c8d8,10/17(火) 12:20
yom,シーテック10月17日開幕…パナソニックHDやシャープなど、省エネ・創エネ技術アピール,https://news.yahoo.co.jp/articles/30c94a5a983a25015e32100aa7b4b9e395de1112,10/17(火) 12:20
yom,旧高千穂鉄道の精巧ジオラマ畳6枚分、旭化成の煙突や宮崎交通バスも「リアル感楽しんで」,https://news.yahoo.co.jp/articles/c6b2d61b293aa102afe7e1618176dd94ac2c9876,10/17(火) 12:13
yom,谷村新司さん、喫茶店で「コーヒー1杯で粘りギターを弾いていた」学生時代…故郷・大阪のファン惜しむ,https://news.yahoo.co.jp/articles/115aa2f95a692f81ac7bb70776d28cf835ea863c,10/17(火) 12:01
yom,国連安保理、ロシアのガザ停戦決議案を否決…ブラジル案を軸に協議継続へ,https://news.yahoo.co.jp/articles/b047f86cb61099fb7edb2fd2116625a91a366585,10/17(火) 11:54
yom,難曲「ラ・カンパネラ」弾く佐賀のノリ漁師モデルに映画…「無骨な手でつかんだ物語」,https://news.yahoo.co.jp/articles/50284227a08da1399575836b9c5ba0a3f111a481,10/17(火) 11:51
yom,維新の緊急経済対策案、１０兆円規模で社会保険料の減免が柱…「減税より時間かからず効果的」,https://news.yahoo.co.jp/articles/dbdd39a5dde26e18132e5ea0e53c1466d8e9ebd2,10/17(火) 11:39
yom,ロシアの日本産水産物禁輸「全く受け入れられない」…西村経産相「科学的根拠に基づかない一方的な決定」,https://news.yahoo.co.jp/articles/09d9b02fab7f1de5dc05f048b686f82f8f70f35d,10/17(火) 11:33
yom,イスラエル支援へ米兵２０００人に派遣の準備命じる…オースティン国防長官,https://news.yahoo.co.jp/articles/2d32ce67b7c9f52d5d85d3bb4738cee4bb69c357,10/17(火) 11:29
yom,内縁の妻を殺害し遺体放置、懲役13年判決…精神障害理由に無罪主張も「不自然な点ない」,https://news.yahoo.co.jp/articles/7e5e3f2f6f6be714c97451f02f47b68d2b7b3d2b,10/17(火) 11:26
yom,「大崎事件」支援者ら22回目の事件現場調査…人形を自転車ごと転落させ状況再現,https://news.yahoo.co.jp/articles/0450e9bb54c4f184a83fcb3b302c36b3e77fbbfd,10/17(火) 11:24
yom,ミュージカルチケット不正転売か、４７歳女を書類送検…３００の架空アカウント使い応募,https://news.yahoo.co.jp/articles/4934dc1d753f060ad7036d2c87119c4a9de54b9e,10/17(火) 11:22
yom,プレミアム商品券当選通知1000世帯二重発送するミス…本来の送り先に届かず,https://news.yahoo.co.jp/articles/c740f2a5e5aa8bfa6030dbcc4e04c09857eddc61,10/17(火) 11:15
yom,睡眠導入剤使い女性に性的暴行した疑い、元都城高専職員の58歳男を再逮捕…6回目逮捕,https://news.yahoo.co.jp/articles/00eae35bf7e0ea78b550d3dadc666b7d03e5d799,10/17(火) 11:13
yom,JAL宮崎―福岡線60周年…3社で1日13往復、ビジネス・観光の重要路線,https://news.yahoo.co.jp/articles/934e53d27c0a70c611b769652f139434558dc69a,10/17(火) 11:10
yom,楽天新監督に今江敏晃・打撃コーチ…ヘッドコーチには渡辺直人コーチ補佐,https://news.yahoo.co.jp/articles/9707ff1701520585d48717ba564d361b4d6cbb46,10/17(火) 11:07
yom,1000頭規模の大牧場、大分県中津市耶馬渓町に…グリーンコープと地元酪農家が新会社,https://news.yahoo.co.jp/articles/6efe8bf80056c507cfc70854c1a7223bdf7642e1,10/17(火) 11:07
yom,奇怪な面「ケベス」炎に突進、白装束「トウバ」押し返す…参拝者は火の迫力に悲鳴と笑顔,https://news.yahoo.co.jp/articles/5339c0cdfa7ac9e7691eb956d2c6fe2e5aeda158,10/17(火) 11:04
yom,天王寺動物園でチンパンジー脱走、臨時休園に…麻酔銃命中し園内の木の上にいるのを見守る,https://news.yahoo.co.jp/articles/ffad7ba89f13f05a8062a0fc9e9e08ea1c184e02,10/17(火) 10:59
yom,藤井聡太竜王に伊藤匠七段が挑む竜王戦第２局、世界遺産の仁和寺で始まる,https://news.yahoo.co.jp/articles/22b040b3fb1395c9d4b280a61175aecc26bbdb39,10/17(火) 10:55
yom,70歳代男性にFX取引持ちかけ500万円詐取容疑…カンボジア拠点グループ4回目逮捕,https://news.yahoo.co.jp/articles/a06b26ecb94275d7b54b2f80d2aff5168e32dc30,10/17(火) 10:49
yom,「ボタ山火災」終息宣言…佐賀県多久市で2017年発生、火が地中の石炭くずに燃え移る,https://news.yahoo.co.jp/articles/bf064fcb2e7a1fa81d336ad9fc4869968b75197e,10/17(火) 10:45
yom,「ホンダジェット・エシュロン」航続距離１・７倍、給油なしで北米横断も…２０２８年発売予定,https://news.yahoo.co.jp/articles/b78fe300501cc8a1e66a500144df576bc6bddb97,10/17(火) 10:41
yom,プーチン大統領「市民の犠牲に反対」、イスラエル首相と電話会談…人道危機防ぐため「協力する用意ある」,https://news.yahoo.co.jp/articles/6646e7a6153c40471a4f1be7222b9e572f363f7a,10/17(火) 10:34
yom,父子５人が海中転落した「車でアクセスしやすい」護岸、釣り人「満潮になると水面と道路の境目分からず」,https://news.yahoo.co.jp/articles/b78cbe6d4bd95d96861cf2d5af1eb152ab42617a,10/17(火) 10:26
yom,トヨタ６工場１０ラインで稼働停止、カローラやプリウスに影響…部品メーカー爆発事故で調達滞る,https://news.yahoo.co.jp/articles/11980c798d98afa6608f55dbd16681083cfa5755,10/17(火) 10:17
yom,需要増すプラスチックなどの再生材、「ナノテラス」で診断・ＤＢ化へ…東北大,https://news.yahoo.co.jp/articles/1c0fee30af42ad8de1d668c9c1098533e3e9a48a,10/17(火) 10:15
yom,［評伝］「詞」に情熱、音楽の力を信じた谷村新司さん…残した歌や言葉は「昴」のような道しるべに,https://news.yahoo.co.jp/articles/221f030ef45e4f97f30b43f52e4b1cecc175ba1e,10/17(火) 10:07
yom,トヨタ「ハイエース」初のＥＶ試作車…ジャパンモビリティショーで披露へ、反響踏まえ市場投入検討,https://news.yahoo.co.jp/articles/db7fa5b4b90cdb0e0a85f6b3075c0c42d5e34722,10/17(火) 9:59
yom,サッカーJ3・鹿児島ユナイテッドFC、八戸に1−2で敗れる…8試合ぶり黒星,https://news.yahoo.co.jp/articles/e75eaf0044602ddb3661412c7a20f68645118b69,10/17(火) 9:58
yom,宮崎日大高サッカー部ユニホームに県のロゴ…部員半数県外出身「県のPRと代表の誇りに」,https://news.yahoo.co.jp/articles/d496457d7b487092d215286336571bf588a5d830,10/17(火) 9:53
yom,ヤマト運輸と個人事業主３万人の契約、労組が継続訴え…「ネコポス」やメール便を日本郵便に委託方針,https://news.yahoo.co.jp/articles/cdb7c0f75f6986159c4b60ee8191cb3952de71ba,10/17(火) 9:50
yom,サッカーJ3・テゲバジャーロ宮崎、ホームで相模原とドロー…9試合連続白星なし,https://news.yahoo.co.jp/articles/e35a38ab0eae62c97fcc114c894fd31ab00e1d35,10/17(火) 9:50
yom,赤信号無視の軽トラにはねられ死亡した11歳女児の父、「危険運転」事例の共有訴え,https://news.yahoo.co.jp/articles/e73fd9294801d6d7ba4a00b99d5f8a77fac49d67,10/17(火) 9:48
yom,遅咲きの昇進、短命ながら「綱の矜持」の連続優勝…元横綱三重ノ海の「相撲と故郷」,https://news.yahoo.co.jp/articles/c876a48eea755564e9ad0747ce38adb2163d2a13,10/17(火) 9:44
yom,イチゴやメロン「フルーツバス停」横を走る…有明海一周サイクリング「素晴らしい景色」,https://news.yahoo.co.jp/articles/aa60a1345e14ca32e53ef3591fab412aa56ced7e,10/17(火) 9:44
yom,バイデン大統領が１８日にイスラエル訪問、ガザ人道支援など協議へ…「ラファ検問所」近く開通見通し,https://news.yahoo.co.jp/articles/95ae13cc7f6500f061b358e0ed500b8eab6c2a39,10/17(火) 9:41
yom,藤井聡太竜王、いつものようにお茶を飲み初手…京都・仁和寺で竜王戦第２局始まる,https://news.yahoo.co.jp/articles/4b4de6d5b1f7f728a0dcd57ad346a0174d7fe4d2,10/17(火) 9:18
yom,ロシアが連れ去りのウクライナ人の子供４人、解放され帰還へ…カタールが仲介,https://news.yahoo.co.jp/articles/3ee8c87b14c8ef2e62756da7d715211c7b43ac01,10/17(火) 9:17
yom,日経平均、一時６００円超上昇…３万２２００円台で推移,https://news.yahoo.co.jp/articles/5080767d5b7556c0f46372053a9cb1037b3547e6,10/17(火) 9:11
yom,児相職員、男子生徒に顔近づけて「黙れよ」…虐待行為と認定し別の部署に異動,https://news.yahoo.co.jp/articles/e003b2c9fa9dd560c685a577ea995c029373cbb3,10/17(火) 8:58
yom,首相所信表明演説は２３日、自民と立民が合意…臨時国会の会期は１２月１３日まで,https://news.yahoo.co.jp/articles/33e7be9e2969df03a9edfaa447a77923e48b213c,10/17(火) 8:50
yom,ペットボトル回収、公取委が業界団体の自粛合意「問題」と判断…背景に飲料会社と自治体の取引増,https://news.yahoo.co.jp/articles/2a68049ad6fc5b6128278fb97821f12a7033532c,10/17(火) 8:28
yom,駅弁の集団食中毒、２８度で納品予定の酢飯が３時間後も４５度…冷却時の製造記録も残さず,https://news.yahoo.co.jp/articles/eee9d99cb78c8373428db3e1427f5e75bf8273c2,10/17(火) 7:57
yom,御堂筋の中央分離帯で自生したスイカ、大阪市が移植作業…鳥が落とした？人が種持ち込む？,https://news.yahoo.co.jp/articles/c21f03b9e11cca27d78c19ead47327fc07c078b1,10/17(火) 7:49
yom,岸田首相、靖国神社の秋季例大祭で真榊を奉納…新藤経済再生相と高市経済安保相が参拝,https://news.yahoo.co.jp/articles/aa8e9e99afb48483e12f5864ca8e5f0e343b98b9,10/17(火) 7:38
yom,ふるさと納税で電力、地域の風力・太陽光の発電後押しを期待…総務省「地場産品に不適合」から容認に一転,https://news.yahoo.co.jp/articles/a8492406bfbea43a7174bf7852edc14c2cbba936,10/17(火) 7:17
yom,鳥インフル、「ハシブト」が感染拡大か…北海道の養鶏場が追い払う音や隔離の囲いで警戒高める,https://news.yahoo.co.jp/articles/c2a6a73e2bd53a642ac55ea6c12332e8b29ffced,10/17(火) 6:55
yom,【ラグビーＷ杯準々決勝】一体感と気骨あふれる前回王者南アフリカ…１点差の死闘で開催国フランスをはねのける,https://news.yahoo.co.jp/articles/dbfb6bf21a540a138ea627d328b467bcdf0cfee9,10/17(火) 6:00
yom,ＮＹダウ続伸、終値は３１４ドル高の３万３９８４ドル…好調な企業決算が押し上げ,https://news.yahoo.co.jp/articles/fc5684ce3d6297b70435136b2689b20ef01cbd7a,10/17(火) 5:32
yom,沢村賞選考委員に工藤公康・前ソフトバンク監督が内定,https://news.yahoo.co.jp/articles/f406ab8cd2b3df498ddf509135056ab8a6b9e5c1,10/17(火) 5:07
yom,官民が互いに一歩前に出て課題解決、新しいスタイルの資本主義…自民党政調会長・萩生田光一氏,https://news.yahoo.co.jp/articles/f033dcf2a3be2b87daaa3b6d3f3b39ef0959c945,10/17(火) 5:07
yom,情感あふれる楽曲と歌唱、国境超えて愛された谷村新司さんの「昴」…中国外務省も死去受け「哀悼」,https://news.yahoo.co.jp/articles/8379e26ca025154bc006d9ecd41356a8de59a620,10/17(火) 5:06
yom,パレスチナ自治政府アッバス議長、ハマスの越境攻撃に沈黙…欧米からの「テロ非難」要請も拒否,https://news.yahoo.co.jp/articles/83252b3f80e80858473fa8dd5b87a188f68cf673,10/17(火) 5:01
yom,テレパシーの世界が現実に？…「脳波」研究で脳疾患の患者支援やスポーツのパフォーマンス改善,https://news.yahoo.co.jp/articles/35a379f51b7b8008e0707369464ae4499849608d,10/17(火) 5:00
yom,危険なブロック塀の根元から「ドーン」と倒壊、大阪北部地震の揺れで再現…防災科学技術研究所,https://news.yahoo.co.jp/articles/3a2ed265104d5cf73e69858bf539b2abfbb3b90b,10/17(火) 1:18
yom,ソフトバンク、藤本博史監督の退任を発表…ＣＳ敗退,https://news.yahoo.co.jp/articles/16593c202e01a18caabbdcbf9e37c1457397f739,10/17(火) 0:00
yom,京王線と京王相模原線の運転再開…柴崎駅で人身事故,https://news.yahoo.co.jp/articles/ae2f1803ca6a511254579e93481077744afedc50,10/16(月) 23:40
yom,富士通がロシアから完全撤退へ、現地法人の清算手続きが２４年に完了見通し…現地報道,https://news.yahoo.co.jp/articles/c0cd892769509dd8d28d57844c455b7d984187f7,10/16(月) 23:28
yom,生成ＡＩの著作物無断学習は「利益侵害」、新聞協会が著作権法の改正訴え…文化審議会小委,https://news.yahoo.co.jp/articles/c01e8e092301854806accd862af3dbd6f649cc62,10/16(月) 22:50
yom,ロッテ、逆転サヨナラ勝ちでＣＳファイナル進出…藤岡が同点３ラン・安田が決める,https://news.yahoo.co.jp/articles/1bd9c13516dbcbae65b71e9888f32dfdf19feb0b,10/16(月) 22:33
yom,中国「一帯一路」、習国家主席の提唱から１０年の節目…プーチン大統領と１８日首脳会談へ,https://news.yahoo.co.jp/articles/08331c3c6b9f21a3ad001049124e92e6c55ea208,10/16(月) 22:31
yom,フィンランド元大統領のマルッティ・アハティサーリ氏が死去、８６歳…０８年ノーベル平和賞,https://news.yahoo.co.jp/articles/24893c6f03b08385cd26f42748e365b113ea8295,10/16(月) 22:18
yom,授業中トイレ行った小１に担任「勝手に行っては駄目」、児童数人が失禁…「怖い」と不登校や転校も,https://news.yahoo.co.jp/articles/aea312a353c8feeabede4f2780c2533d1d134ad7,10/16(月) 22:05
yom,旧統一教会、解散命令請求裁判で全面的に争う方針…「財産隠し」指摘には「うわさで根拠ない」,https://news.yahoo.co.jp/articles/0e102fef92516a2e9bcc0d478db2c011f3c65eb4,10/16(月) 21:49
yom,弁護士が調停や訴訟を長期間放置、依頼者に判決文と偽った文書を作り送る…業務停止２年の処分,https://news.yahoo.co.jp/articles/ca5ef840d49e52d5e6217dc6b3387fa4ab33557b,10/16(月) 21:20
yom,［深層ＮＥＷＳ］ガザ北部住民に退避勧告、イスラエルが「国際社会に最大限の配慮をアピール」,https://news.yahoo.co.jp/articles/769009b21ce64e3c23c3bc447fe30480759c2862,10/16(月) 21:18
yom,国内動物園で唯一飼育、タスマニアデビルの「テイマー」安楽死…多摩動物公園,https://news.yahoo.co.jp/articles/5878c4d22ef9a3e11e702165fd0f262b3ebe7afb,10/16(月) 21:12
yom,岸壁に柵なく海との境目わかりにくく…車ごと転落か、海中の車中から父子５人の遺体,https://news.yahoo.co.jp/articles/ca0d523c2bb8edc7d9d92e4bf5bf37d8cfcfb0c0,10/16(月) 21:06
yom,２８年ロス五輪に５競技追加、組織委委員長「世界が楽しめる舞台を用意する」,https://news.yahoo.co.jp/articles/8c5e3da6a26cc944dd4d7e7c30315d587b161954,10/16(月) 20:46
yom,ガザ・エジプト境界の検問所、開通する方向で調整…国連「１００万人以上が家を追われた」,https://news.yahoo.co.jp/articles/9591d7704f41a3145cdce79192b622667d02def9,10/16(月) 20:44
yom,藤井聡太竜王、初の全冠防衛かけ竜王戦第２局へ…「８時間の対局なので一手一手しっかり考えたい」,https://news.yahoo.co.jp/articles/a6cec706f41044636c14755f3a99d9a472757735,10/16(月) 20:32
yom,北島三郎さん「人間的にも素晴らしい、もう会えないなんて悲しいね」…谷村新司さん悲報,https://news.yahoo.co.jp/articles/da36600df1ae0d0a58ed753663c005f6d1faf556,10/16(月) 20:11
yom,米飯を指定温度超で受け入れ、冷却までに原因菌が増殖か…駅弁集団食中毒,https://news.yahoo.co.jp/articles/9a7e10a9739e7ba0ff77de16495c7bf814dee25b,10/16(月) 20:07
yom,宮古島で震度４、津波の恐れなし…気象庁,https://news.yahoo.co.jp/articles/6e6ad83b57f1aa0f8834ea160eb4c586822adb7e,10/16(月) 19:55
yom,ジャニーズのグッズショップが営業終了、ファンは複雑…「購入したらなくなる実感が湧いた」,https://news.yahoo.co.jp/articles/6d457835b3342ef0a35796befa468185b1784d17,10/16(月) 19:47
yom,男の中学校教諭、男子生徒にわいせつな行為で逮捕…行事で訪れた宿泊施設の浴場,https://news.yahoo.co.jp/articles/67a58ce88cfab90f5595f4ebd76939cdb2153ec2,10/16(月) 19:39
yom,中露関係は「世界の安定の基盤」、プーチン大統領が連携強化に意欲…習氏とは「友人」と呼び合う仲,https://news.yahoo.co.jp/articles/a83c7dd712f78f0926489505168e22e1cc7bff5b,10/16(月) 19:31
yom,自民党候補を応援、木原防衛相「自衛隊とその家族の苦労に報いることになる」…釈明し発言撤回,https://news.yahoo.co.jp/articles/a244e024e0109974832354955b453d129aac6bfe,10/16(月) 19:14
yom,補選の応援演説で自衛隊に言及、木原防衛相が発言撤回の意向…首相は続投させる考え,https://news.yahoo.co.jp/articles/9ea4e2a4432c365bfc6e1e531cf45c05cf6bd208,10/16(月) 19:02
yom,生命科学や医科学の研究「米より２年遅れ」、欧米はデータやＡＩ駆使し解明…文科省ライフ委が危機感,https://news.yahoo.co.jp/articles/b3da776c5d3918478f98c5cb4b5da08c39a71c14,10/16(月) 19:00
yom,谷村新司さん死去、松野官房長官「アジアに受け入れられる作品数多く音楽文化の発展に貢献」,https://news.yahoo.co.jp/articles/d889283273422be93be8d26a04d45bd7ac3f0c3e,10/16(月) 18:54
yom,福島第一原発の処理水、中国の分析機関も参加しＩＡＥＡが海水調査,https://news.yahoo.co.jp/articles/689405050bf3e0fe763cae437307609506b382a6,10/16(月) 18:51
yom,消火設備の二酸化炭素噴出か、シャトレーゼ工場から病院搬送の３人回復…電気系統の一斉点検中,https://news.yahoo.co.jp/articles/3c3d737880a0badb7a5c40615405162a7caca772,10/16(月) 18:44
yom,谷村新司さん死去、７４歳…アリスで「冬の稲妻」・ソロで「昴」・加山雄三さんと「サライ」,https://news.yahoo.co.jp/articles/f54c944f3f2556aed9567ac5064482c2713f935b,10/16(月) 18:37
yom,秋篠宮ご夫妻、海外日系人大会の開会式に出席…「絆が深まることを心より祈念します」,https://news.yahoo.co.jp/articles/1e8385f63d8bd62e0ce5b6dfc35587704ff2f0f0,10/16(月) 18:30
yom,シャツのにおい手がかりに、高齢男性を山中で発見…嘱託警察犬「リン」出動増え今年15回,https://news.yahoo.co.jp/articles/96a14ff2ce11c53ef93ce5ecbe8aeb723ce0bf9e,10/16(月) 18:21
yom,巨人が来季の一〜三軍のコーチ陣発表…今季から５人減、ほとんどが４０代に,https://news.yahoo.co.jp/articles/1825cc4f4fd41eddec849001bd58d086eb9f10db,10/16(月) 18:18
yom,マイケル・ジャクソンの魅力伝える１００枚展示、一緒に撮影できるブースも…横浜,https://news.yahoo.co.jp/articles/8c797911b090521d2e0b9ce1f04b3d1b1f623214,10/16(月) 18:16
yom,95歳女性を「見かけない」と近隣住民が家を訪ねると…72歳娘を死体遺棄容疑で逮捕,https://news.yahoo.co.jp/articles/5f9488ad7745930c2af317f93c1deab3eef6e63d,10/16(月) 18:02
