media_en,title_articles,link_articles,date_original
yom,日中から参加の１００人が日中関係や国際社会の課題を議論…「東京―北京フォーラム」始まる,https://news.yahoo.co.jp/articles/0656282a397e516e04610481894e96f05de0d5b9,10/19(木) 12:16
yom,米が拒否権行使、イスラエルとハマスの戦闘「中断」求めた決議案否決…国連安保理,https://news.yahoo.co.jp/articles/ec96e74a064e09aedf7706e7db5813f09b1ffd8f,10/19(木) 12:15
yom,カープのレジェンド歩みたどる…大下・三村の二遊間ゆかりの品展示,https://news.yahoo.co.jp/articles/50f89686a6a1087fc7821cbb3a2bf62d9e1a2856,10/19(木) 12:12
yom,乙女心にどストライク！レトロ雑貨店…「ときめきが止まらない」SNSで人気,https://news.yahoo.co.jp/articles/2cf34e14da845990f830aafd5250d20baf7e8351,10/19(木) 12:03
yom,東京・上野の貴金属店でネックレスやブレスレットなど１６００万相当奪った疑い、男２人を逮捕,https://news.yahoo.co.jp/articles/3f4b9eea09303faf8f35a473da0a0d0f6658f23a,10/19(木) 11:53
yom,バスを待っていた女子高校生がクマに左腕をかまれる…秋田で計４人負傷、同じクマか,https://news.yahoo.co.jp/articles/8b92c7f369003ec79ead3b35a658d259b58240b6,10/19(木) 11:44
yom,外壁に西陣織・笑顔表す直径20m球体…万博に出展予定の民間パビリオン出そろう,https://news.yahoo.co.jp/articles/de53241a2f3e354d57b151fea2134b864a9b3d60,10/19(木) 11:41
yom,藤井聡太八冠も竜王戦振り返り…大盤解説会,https://news.yahoo.co.jp/articles/8df4daf434af65c0226b9f88f4a5e8309962c9c6,10/19(木) 11:40
yom,４００人超のデモ隊が米議会建物に侵入、ガザ停戦を求める抗議デモ…警察官への暴行容疑で３人逮捕,https://news.yahoo.co.jp/articles/34747948cd502a427026e79f10f37b2dcdca087d,10/19(木) 11:26
yom,集合住宅にロシア軍がミサイル攻撃、５人死亡…ゼレンスキー大統領「邪悪な国家が民間人を攻撃」,https://news.yahoo.co.jp/articles/70ae8b1a219ca50a229d8a9290b9b4063ba6d24b,10/19(木) 11:20
yom,「ラファ検問所」２０日にも開通へ…食料や水、医薬品を積んだトラック２０台が第１陣,https://news.yahoo.co.jp/articles/3c5770dcbfcc12c57f5521e9b80fe34ccdea58c3,10/19(木) 11:13
yom,台湾有事の先島諸島「鹿児島には1日あたり1万人避難を想定」…知事と官房長官が意見交換,https://news.yahoo.co.jp/articles/e8fcade19c95e6f5e7a8ee3f283e911f375eff96,10/19(木) 11:10
yom,職務質問すると車の後部座席に横になった若い女性の遺体…無職男を死体遺棄容疑で逮捕,https://news.yahoo.co.jp/articles/3d9eab95ce6ba0ffc9fe60332ac2a259b58d42c2,10/19(木) 11:08
yom,幻覚作用キノコの輸入容疑で2人逮捕…国際宅配貨物で発送、コーヒー豆の袋の中に隠す,https://news.yahoo.co.jp/articles/0fa8edd46534c35cbef06db9058173f65ff3c352,10/19(木) 11:07
yom,プリンセス天功さんが「キング」と名付ける、ホワイトライオンの赤ちゃん４頭すくすく,https://news.yahoo.co.jp/articles/e26a69bd8f7da790da371ee186ec81f1914a91b3,10/19(木) 11:04
yom,潜水士死亡事故、大分区検が業務上過失致死罪で1人略式起訴、3人は不起訴…遺族は不服申し立て検討,https://news.yahoo.co.jp/articles/06e4d2b3c308bd4ab31d01aff6612b2c4ce03924,10/19(木) 11:04
yom,小中高校生の不登校、大分県内で過去最多3285人…いじめ認知は9361件,https://news.yahoo.co.jp/articles/427b309dc6ca464459a248e777a0862392495ba1,10/19(木) 11:01
yom,「希望はこれくらい」県民割の不適切受給問題で新たな音声データ…熊本県の次長級か、具体的金額示す,https://news.yahoo.co.jp/articles/644347d83b63321eb4a196dc8762b7b90f052391,10/19(木) 10:59
yom,「純白の花じゅうたん」そば満開…長崎県対馬市、新そばは年末に,https://news.yahoo.co.jp/articles/cf47b871ffab502df90fdcc42e4aec6b7ec2a419,10/19(木) 10:56
yom,ホテル総支配人は元ALT…「第二のふるさと長崎」へのマリオット進出に運命感じて,https://news.yahoo.co.jp/articles/7168e276c0c063cbf5f3a05fe2c415933bc4feb7,10/19(木) 10:54
yom,「酒残っている感覚はなかった」電柱に衝突し横転…酒酔い運転容疑で1等陸尉を逮捕,https://news.yahoo.co.jp/articles/f6710d3fd85af3524f234b3b537f84d423ec17e7,10/19(木) 10:50
yom,「伊万里トンテントン祭り」担ぎ手10代解禁の方針変えず…高校生遺族ら撤回要望も「十分に対策」,https://news.yahoo.co.jp/articles/7e9c755538155574ff9e8b07dbae168f239ca3fe,10/19(木) 10:47
yom,のびのび野球「長髪グッズ」、西武ライオンズが商品化…「チームロンゲ」高橋光成投手が提案,https://news.yahoo.co.jp/articles/19837ea11d02baa72186e950717ec5f4b1724805,10/19(木) 10:45
yom,大型クルーズ船「飛鳥2」が岩国港に寄港…4年ぶりセレモニー、音楽隊や甲冑姿で出迎え,https://news.yahoo.co.jp/articles/e2850a7445e5cc9f62be465429f73ccea1f440a6,10/19(木) 10:44
yom,ろう者サッカーW杯で活躍「FCバレイン下関」2選手が準優勝報告…25年デフリンピックへ健闘誓う,https://news.yahoo.co.jp/articles/10fdd23ee984eb2c9e70eefab4319a85649b53dc,10/19(木) 10:42
yom,最新鋭ステルス戦闘機「Ｆ３５Ｂ」や長射程ミサイル配備へ…自衛隊の「南西防衛」、強化着々と進む,https://news.yahoo.co.jp/articles/493a27ef4e218afe0dfc867db64d5e5a72a11139,10/19(木) 10:15
yom,秋田でクマ出没相次ぐ、中学校敷地内を歩く１頭を授業中の生徒ら目撃…保育園でも,https://news.yahoo.co.jp/articles/0a79273db5a4abcdef3cb47b9122a117b57eadc0,10/19(木) 10:04
yom,日本代表になれば「メダル争いの主役」、五輪代表を激しく争うスケボー・ストリートの選手たち,https://news.yahoo.co.jp/articles/9385725fe86749d89f0acb9eae16236685fc9779,10/19(木) 10:00
yom,ビールを飲んで排水口を掃除するアイドル、好きだけではスケボーは続けられない…清司麗菜の#skatelife,https://news.yahoo.co.jp/articles/6ef52f9c176038b2f88cf1d3e1331159711d34f0,10/19(木) 10:00
yom,自宅敷地で女性死亡、富山でクマ出没相次ぐ…県担当者「危険が本当に身近に迫っている」,https://news.yahoo.co.jp/articles/77e53391671a130cfa4f826a191f53edc74d0a7f,10/19(木) 9:56
yom,ＮＴＴ西日本子会社の顧客情報９００万件流出、社内調査後も対策せず…個人情報を自由に持ち出し,https://news.yahoo.co.jp/articles/a41647eae6b7a11b9a740d396a08791189e5376b,10/19(木) 9:43
yom,長期金利、一時０・８２５％…１０年２か月ぶり高水準更新,https://news.yahoo.co.jp/articles/8c61a2c81336b783c53e0b89776c35d825ab5af1,10/19(木) 9:32
yom,日経平均、午前終値５９５円安の３万１４４６円…長期金利上昇で,https://news.yahoo.co.jp/articles/2b1efc5b780602c545a7f40cb615618dcaaa13f8,10/19(木) 9:11
yom,２３年度上半期の貿易収支、２・７兆円の赤字も赤字幅は大幅縮小…９月は６２４億円の黒字,https://news.yahoo.co.jp/articles/fd86c6932ae16737f1149172f3ea7a6874ecc89d,10/19(木) 9:00
yom,「犬かと思って」振り返ったら「クマだった」…襲われた男性、両腕で頭覆い身をかがめると「逃げた」,https://news.yahoo.co.jp/articles/86a9ebf32a60db0dad2999cfa02d9bab0d48c0a3,10/19(木) 8:05
yom,「ニトリの働き方」語る会長、年齢層ごとに役割設定…アイデアは「寝ても覚めてもお客さんの立場で」,https://news.yahoo.co.jp/articles/0a30499b21a82b40fa52c596c008a8b69e33381a,10/19(木) 7:30
yom,「また家を失った」訪日したガザの中学生、ヨルダンに滞在…故郷戻れず「罪悪感を感じているように見える」,https://news.yahoo.co.jp/articles/0881797e455dcde4664128ac99ccccc195abc595,10/19(木) 7:22
yom,突然停止したモノレールに後続の４台が相次ぎ衝突、動植物園で６人けが…時速８キロで走行,https://news.yahoo.co.jp/articles/9aeb7c8d26e8dfa0499384686dcf423dda040889,10/19(木) 7:11
yom,観光公害で高まる住民の不満、観光地の魅力も低下…星野リゾート代表「長期的には集客減」「深刻な課題」,https://news.yahoo.co.jp/articles/0666bc72a9ddd982a1dd63807f622d545484a7b2,10/19(木) 7:03
yom,ガザの病院爆発、多くの民間人はなぜ犠牲に…真偽不明のまま国際的な人道非難強まる,https://news.yahoo.co.jp/articles/6071447ac9bcc891393bebbdfcad9556ed75af8e,10/19(木) 6:53
yom,「親愛なる友よ」中国への依存強めるロシア…習近平政権、露との連携利用しつつ深入り避ける構え,https://news.yahoo.co.jp/articles/1c282e54c147e4f0232914cb8ada9d071e062fee,10/19(木) 6:48
yom,途上国を借金漬けにする「債務のわな」に懸念、中国「一帯一路」方針転換か…フォーラム参加国は過去最少,https://news.yahoo.co.jp/articles/fe990a3c89bf535e62c1ded844f0695e01108994,10/19(木) 6:38
yom,ＮＹダウ平均終値、３３２ドル安の３万３６６５ドル…４営業日ぶり値下がり,https://news.yahoo.co.jp/articles/ab9bf68eee24b3e2c3eded02d88b313c7d3ddfda,10/19(木) 5:31
yom,アジアパラ大会「最後まで戦い抜く」…結団式で岩渕幸洋主将,https://news.yahoo.co.jp/articles/96f73d160151a6fa6941f31ae12c3f76b09a31f7,10/19(木) 5:03
yom,新宿のホテル、顔認証で１秒チェックイン…広がる「生体認証」買い物・飲食店・乗り物も,https://news.yahoo.co.jp/articles/f3aa742fff8987fed847e86accd74091ed89a0b5,10/19(木) 5:00
yom,豚熱による豚の移動制限、佐賀県が解除,https://news.yahoo.co.jp/articles/fe47ca8543f49db1fecc24de752205b031a2ed83,10/19(木) 1:33
yom,林真理子・日大理事長、「私学助成金の不交付」を懸念し沢田康広副学長に辞任迫る,https://news.yahoo.co.jp/articles/46a103542a8093b471f94529c2bc4eac652cdf40,10/19(木) 0:55
yom,秋の園遊会、ユーミンや加藤一二三さんら１４００人を招待…２０１８年以来の開催,https://news.yahoo.co.jp/articles/49e8ea797788317dead7012eda7fb2b3a077fdbf,10/19(木) 0:23
yom,岸田首相、中東４か国首脳と相次いで電話会談…「外交努力を全力で続ける」と投稿,https://news.yahoo.co.jp/articles/ac6a86df8cd6b98d9b9ee83c07262d13ba70e106,10/19(木) 0:03
yom,２人で飲酒後、路上でふざけ合っていたらにエスカレートしてけんかに…近大剣道部員死亡,https://news.yahoo.co.jp/articles/ce15eda2446fdf8c69e8ef4f7d54371c6a0e4b52,10/18(水) 23:48
yom,イスラエルとハマスの戦闘、「中断」求めた決議案を米が拒否権行使し否決…国連安保理,https://news.yahoo.co.jp/articles/e402b700497d05281656b4a1884c4eb0e48b915a,10/18(水) 23:38
yom,「責任あるＡＩ」へ法規制が必要、新聞大会で議論…偽情報への懸念も,https://news.yahoo.co.jp/articles/41abb5848f1597c9f8aac243890063f97904c9d6,10/18(水) 23:09
yom,人気グループ「ジャニーズＷＥＳＴ」、グループ名を「ＷＥＳＴ．」に変更,https://news.yahoo.co.jp/articles/81a89c3889dc441fa9d4227b09c0c41489764291,10/18(水) 23:09
yom,７〜９月期の訪日外国人消費額、コロナ前を上回る１兆３９０４億円…目標の年間５兆円突破も,https://news.yahoo.co.jp/articles/c458d36ffd37803d760eb2d6a0ef44d793d59505,10/18(水) 22:18
yom,退避困難な１０００人が身を寄せた病院で爆発、「４７１人死亡」…イスラエルとハマスの主張食い違う,https://news.yahoo.co.jp/articles/c0326f51dbf41fa4b850dc2d8c9e486d45024c96,10/18(水) 22:00
yom,ＣＳファイナル開幕、村上が勝ち越し打と６回１失点の好投で阪神勝利…山本崩れたオリックスも逆転勝ち,https://news.yahoo.co.jp/articles/cff33e4fd49339f2bf17c5c6686f4f83f8e7b3dc,10/18(水) 21:43
yom,中露首脳が会談、対米を念頭に結束確認…プーチン氏「完全な機密情報の性質を持つ話もした」,https://news.yahoo.co.jp/articles/4cd11d34d2252e875b9db3ae149b4d2c79274a7b,10/18(水) 21:36
yom,ＮＨＫ「性被害を知っている人間いなかった」…「ザ少年倶楽部」歴代プロデューサーに聞き取り,https://news.yahoo.co.jp/articles/7a4db2ec85f91e45a2737023bc497a9cb3e530d9,10/18(水) 21:22
yom,［深層ＮＥＷＳ］ガザ病院爆発、バイデン氏のイスラエル訪問直前「最悪のタイミング」…佐藤正久氏,https://news.yahoo.co.jp/articles/3dbe5b2fa14836ef8f25f1305a403989b56712d9,10/18(水) 21:11
yom,バイデン大統領、ネタニヤフ首相らと会談…イスラエルに「孤独ではない」と全面支援を約束,https://news.yahoo.co.jp/articles/474c1b7ad7c39f92d857598db75cf49edb3e992f,10/18(水) 21:00
yom,偽レビュー増加、アマゾンと旅行予約サイト・エクスペディアが対策で提携,https://news.yahoo.co.jp/articles/5b775300253e56ed9f5f3ea1f21dc7266306bf1f,10/18(水) 20:58
yom,３４年サッカーＷ杯、日本はサウジ開催を支持…協会の宮本恒靖専務理事が表明,https://news.yahoo.co.jp/articles/82c2397f1bafde1ad70266c2d6970cb9f108b7d9,10/18(水) 20:48
yom,北朝鮮がハマスと武器取引で連携か、武装組織の砲弾にハングル…韓国軍が分析,https://news.yahoo.co.jp/articles/3cbd3d9ffc0aef472a4a93a0e338c3299da878de,10/18(水) 20:41
yom,公共施設などの「子連れ優先」広がる…公平性などの観点から導入見送るケースも,https://news.yahoo.co.jp/articles/17043a2366c47226d949f154fa8f22d2e32a378e,10/18(水) 20:30
yom,大麻事件対応、日大内部で対立…広報部「進退は沢田副学長自身で判断をと促した」,https://news.yahoo.co.jp/articles/9aeaec68d8bf3a3544eaf7b6cc2ab65111ea6839,10/18(水) 20:21
yom,中国、日本産魚介類の９月輸入額はゼロ…６月は７２億円あったが完全停止,https://news.yahoo.co.jp/articles/ea15b5aca70ea988460622f84ac6984349a38bbd,10/18(水) 20:15
yom,餌の木の実が不作、子連れのクマが人里に…宅地開発で「アーバンベア」の被害相次ぐ,https://news.yahoo.co.jp/articles/4426a717ec415555e8ab5e9980daf760416aba9d,10/18(水) 19:56
yom,児童養護施設で暮らす子ども、年齢制限を撤廃し「自立」重視…少子化相は指針策定の方針,https://news.yahoo.co.jp/articles/0e2eb6803e107b3653cf31e82978fe02e58bdf83,10/18(水) 19:47
yom,中国の海洋調査船、尖閣諸島北東のＥＥＺ内でワイヤのようなもの延ばす…日本政府抗議,https://news.yahoo.co.jp/articles/77d09b68fbb56963ffdf2d2e7f4c674955ed389e,10/18(水) 19:41
yom,コロナ交付金のマスクや消毒液、不適切な使い方１１２億円…自治体側「必要量の算出は難しい」,https://news.yahoo.co.jp/articles/9c32b0e05b2a7ecebd954ee2bde730506e9c2b07,10/18(水) 19:26
yom,自販機と民家のブロック塀にぶつかった車…運転の81歳女から基準値2倍のアルコール,https://news.yahoo.co.jp/articles/c32b70eef59422ab9555b451bff522df4b6a42ec,10/18(水) 19:21
yom,英の９月消費者物価、前月から横ばい６・７％上昇…食料品・飲料は１２・１％アップ,https://news.yahoo.co.jp/articles/11fc66563aa49813ce3405e7831d27e55ab1a25a,10/18(水) 19:06
yom,竜王戦２連勝の藤井竜王「攻めがつながるか難しいと思っていた」…正確な読みで勝負手かわす,https://news.yahoo.co.jp/articles/6f6b38f38cba30050c6fa9ba4fccff8c7281b5c9,10/18(水) 19:03
yom,一緒に宿泊した女が体調不良訴え…「従業員に何してくれるんや」美人局で現金と車詐取,https://news.yahoo.co.jp/articles/5dbbeebd17a723393340b51b7a91dab035910a17,10/18(水) 18:51
yom,宮崎県内の梅毒感染者数、137人で過去最悪…匿名検査17機関で実施へ,https://news.yahoo.co.jp/articles/b837a05bd521c6158d25984e6e5e296dff81d8e2,10/18(水) 18:50
yom,ＳＮＳに「お金を入れておくだけでもうかる」、６０代女性が１億３６００万円だまし取られる,https://news.yahoo.co.jp/articles/8499cc646a0ec5c8ce2ab91c5272192d6b6eef2c,10/18(水) 18:47
yom,藤井聡太竜王が２連勝「八冠を意識せず集中して指せた」…第３局は２５日開始,https://news.yahoo.co.jp/articles/369c575c81ed9a05cc91becb1fac617156e6c29b,10/18(水) 18:45
yom,東京２３区の新築マンション価格、初の１億円超え…高額タワマンが押し上げバブル期上回る,https://news.yahoo.co.jp/articles/de8601eab3728377413b36598a75426eecceecf8,10/18(水) 18:39
yom,トヨタの工場停止は２０日まで継続、宮城と岩手でも新たに…バネの代替生産急ぐ,https://news.yahoo.co.jp/articles/29571e32aaed1d8d48f6db69bb6ede83fe81dd13,10/18(水) 18:32
yom,70年活動、劇団「海峡座」最後の舞台へ…新作は下関の歴史振り返る「まちへのラブレター」,https://news.yahoo.co.jp/articles/dfcb3a1169642873186c666e8b3878e60e9e8a4d,10/18(水) 18:30
yom,台湾有事での避難民受け入れ、鹿児島知事に態勢整備を要請…松野官房長官,https://news.yahoo.co.jp/articles/f2680175bc091bc36a05bbf7ead6da46c531810d,10/18(水) 18:27
yom,「Ｘ」が年会費１ドルの会員サービス、ＮＺとフィリピンで試験的開始…新規利用者の「いいね」は加入必要,https://news.yahoo.co.jp/articles/fdbdce214efa3dd1af83102f9fd1d80c51f6f8a8,10/18(水) 18:18
yom,旧統一教会の元２世信者をネットで中傷、４０代投稿者を侮辱容疑で書類送検,https://news.yahoo.co.jp/articles/35e2fd9a8b853f6a0212cb267ba0fcfbcc05e958,10/18(水) 18:16
yom,未成年者への性加害防止、日本取締役協会が指針…「最も深刻な人権侵害」関与企業と取引禁止,https://news.yahoo.co.jp/articles/fc3b44384f84119c9a923ca3cb5450371a091c33,10/18(水) 18:02
yom,東京円１５銭安の１ドル＝１４９円７４〜７６銭,https://news.yahoo.co.jp/articles/51337fe0aacafeae9cd25f1fb045547574564c8e,10/18(水) 17:56
yom,業務用小麦粉の販売価格を3年ぶり値下げ…福岡市の鳥越製粉、政府の売り渡し価格改定で,https://news.yahoo.co.jp/articles/9ada3c68b754e5796f24bf0cbdb40a02de143d4c,10/18(水) 17:51
yom,メッツの千賀、ナ・リーグ最優秀新人候補に…受賞者は１１月２日発表,https://news.yahoo.co.jp/articles/3a2c54f829f93c9946baf2236b0a8e4bbf8edaf6,10/18(水) 17:38
yom,父の高座姿に感動し入門、一龍斎貞鏡が講談と４児の母「二刀流」で真打ちに…最初は「ダメだ」と断られ,https://news.yahoo.co.jp/articles/fddfb5e64c1c3b3388532ff1dd5edf5ffe5b49c6,10/18(水) 17:31
yom,地方議会の慣例「自宅住所公開」見直す動き…票ハラスメント懸念「必要性の検討を」,https://news.yahoo.co.jp/articles/9ee3f56cc356acac0b4f85e55d071c3959f50d76,10/18(水) 17:31
yom,奈良県、私立高校の「授業料無償化」を提案へ…所得制限ありで年63万円上限,https://news.yahoo.co.jp/articles/3dc4c2325d806202494b5a4f7e4401bfb8f01529,10/18(水) 17:30
yom,＜お歳暮商戦＞本格スタート…コロナ禍明けて「集い」意識・送料無料も,https://news.yahoo.co.jp/articles/93f6b1a4bbfc664aefbd24f9f06b2782531a7d1d,10/18(水) 17:30
yom,キンモクセイの甘く心地よい香り、大切な人や記憶に思いはせ,https://news.yahoo.co.jp/articles/55031d434457bdd202f8dcc909eb00ade4849709,10/18(水) 17:30
yom,マッサージ店で女性客に性的暴行の疑い…セラピストの男、不同意性交容疑で再逮捕,https://news.yahoo.co.jp/articles/deb2b6db033c5d18b3a70861549fc3d08e6b6234,10/18(水) 17:24
yom,東都大学野球、青学大が今春に続いて連覇…日大に完勝し通算１４度目Ｖ,https://news.yahoo.co.jp/articles/faf350bdb129bb0c177d6d265d4ebfe61dc4a309,10/18(水) 17:16
yom,八王子市のデジタル通貨「桑都ペイ」、初日からトラブル…アクセス集中でチャージできず,https://news.yahoo.co.jp/articles/b9a6f51ff55968bdbca73debb9d0a258d0f2b969,10/18(水) 17:13
yom,猫あるある（下）――箱入り娘のハニー,https://news.yahoo.co.jp/articles/3bd063d3024c04217488977e7ae30041d664f8cb,10/18(水) 17:10
yom,ギャラリーで伝える＜共助＞…阪神大震災を経験した那須さん、「アール・ブリュット」で,https://news.yahoo.co.jp/articles/1a38247a2bdf3d942abee45ae49aeab3754e40dc,10/18(水) 17:01
yom,扇子で顔隠し一瞬で猿やパンダに変化…長崎市の女子中学生「変面師」、支えた母も舞台デビュー,https://news.yahoo.co.jp/articles/86bb58e26c45fc10da540bf860ba3bf3d4a4d5a9,10/18(水) 16:30
yom,全銀システム障害、理事長「信頼性を揺るがす大問題」と記者会見で謝罪…処理遅れなど５０６万件に,https://news.yahoo.co.jp/articles/b316cd5a05f03a1c3ce5c6fcca9e2ee8b7b031c7,10/18(水) 16:23
yom,「危ないから行くな」と声かけた直後に山崩れ…１９年の台風１９号で夫と義理の姉を失った女性、喪失感消えず,https://news.yahoo.co.jp/articles/40ff2b526c6d9b0ed8dd20821ad8939bc810e2bf,10/18(水) 16:02
yom,美容店の女性従業員と面識ある男、同じ日に偽名で予約を３回入れる…無断キャンセルの業務妨害疑いで逮捕,https://news.yahoo.co.jp/articles/0d49be8a83ff335a2831fc167420a144b2e60d65,10/18(水) 15:42
yom,９月の訪日外国人２１８万人、コロナ禍前の９６％に回復…韓国が最多で５７万人,https://news.yahoo.co.jp/articles/bfb7d9727bd5e05a75cbb4836b3fbbf46690c473,10/18(水) 15:31
yom,サッカーＵ―２２日本代表、米国に敗れる…前半に松木玖生のゴールで一時同点に追い付く,https://news.yahoo.co.jp/articles/5a70d3bff93f3232ff42535f57cc25f11cf49c37,10/18(水) 15:25
yom,昨夏の参院選「１票の格差」、最高裁が「合憲」判断,https://news.yahoo.co.jp/articles/80d264fc12d645fda8c0c520259c51be04c67713,10/18(水) 15:19
yom,日経平均の終値、１円高の３万２０４２円…金利の上昇で銀行株が買われる,https://news.yahoo.co.jp/articles/cd304a0a9d72bf4465edcb96bf1e88b47080afa9,10/18(水) 15:16
yom,「お化けススキ」フサフサ大きな穂を揺らし…「秋の空に堂々、気持ちよい」,https://news.yahoo.co.jp/articles/f0ba6215dff1433d51f1ca2020e6e0a98b519c78,10/18(水) 15:10
yom,全銀システム障害、各金融機関が余分に生じた個人・企業の手数料・延滞金・金利などを補償,https://news.yahoo.co.jp/articles/3f3cf61a5a5b931bb9db6a90d2346091f7b3bc96,10/18(水) 14:52
yom,佐賀県小城市長が手術のため入院へ、足のしびれなどの症状…職務代理者は置かず,https://news.yahoo.co.jp/articles/a99358d929fb26dc3060aa58bf41de311be2ad30,10/18(水) 14:45
yom,友達が「殺すのを手伝って」と言ったら手伝う？…小学校講師、自分の首にカッターナイフ向け児童に問う,https://news.yahoo.co.jp/articles/33ac1d90a9e63440eabd53d9543cc39d7e83a452,10/18(水) 14:40
yom,工藤会系幹部ら4人「還付金ある」とうそ電話…60歳代女性から98万円振り込ませた疑い,https://news.yahoo.co.jp/articles/1c4f6e28f9cd50792e9717fd75b402a4b81dbfa7,10/18(水) 14:28
yom,米がウクライナに最大射程１６５ｋｍのミサイル「ＡＴＡＣＭＳ」供与…露本土は狙わないと合意か,https://news.yahoo.co.jp/articles/434d8f5deaa4bf8e553f053c064fbef93b2c4c8d,10/18(水) 14:27
yom,70歳代女性に外国為替取引持ちかけ11万円詐取疑い…カンボジア拠点詐欺グループ再逮捕,https://news.yahoo.co.jp/articles/5abfc708009c2fb5dd0113856e35a86a85e66b55,10/18(水) 14:16
yom,ガソリン平均価格１７４・７円、６週連続で値下がり…政府目標の「１７５円程度」に到達,https://news.yahoo.co.jp/articles/c721bafc39593c35fb3b0331f81cf2f5efe57399,10/18(水) 14:13
yom,近大剣道部員、同じ学年の部員に殴られ搬送後に死亡…もめる直前に飲食店で飲酒,https://news.yahoo.co.jp/articles/df9d56a9159c059bf98115afe8b7bf59dd122f74,10/18(水) 14:05
yom,ソフトバンク藤本博史・前監督をファンがねぎらう…小久保裕紀・二軍監督に期待の声も,https://news.yahoo.co.jp/articles/45575ea12c37e50a45adb58af9b6f62bb6da5e91,10/18(水) 14:02
yom,めくるめく狂騒の果て、ジャズマンの心の叫びが響く「白鍵と黒鍵の間に」…冨永昌敬監督に聞く,https://news.yahoo.co.jp/articles/61313811806d82639790f85e819e7e2a62cc59a6,10/18(水) 14:00
yom,新聞大会が開幕、会長「良質な情報が評価される仕組み築く」…協会賞の読売新聞「海外臓器売買」取材班を表彰,https://news.yahoo.co.jp/articles/279ea8544e55260a06809cee2926a41f819ca73d,10/18(水) 13:48
yom,東名阪８人死傷の多重事故、運転手ら３人と死亡した会社員を書類送検,https://news.yahoo.co.jp/articles/27901117a9869bb37790889f65d06640a5ce3963,10/18(水) 13:38
yom,運転見合わせの京王線、全線で再開…仙川駅で人身事故,https://news.yahoo.co.jp/articles/36f29892f6ecff7d9773bd33b1df3f039d9677d8,10/18(水) 13:32
yom,米が半導体の対中輸出規制を強化、商務長官「安全保障への脅威に立ち向かう」,https://news.yahoo.co.jp/articles/da50e15acaa2aea2062eb4b9fe0f7ce3f714b920,10/18(水) 13:26
yom,異常接近など中国軍機の威圧的な飛行、東・南シナ海上空で１８０件…米国防総省が警告,https://news.yahoo.co.jp/articles/838463e75f39a7ead73b4d876e5b4c36c80e071b,10/18(水) 13:19
