media_en,title_articles,link_articles,date_original
yom,親戚宅の２階から転落死の１０か月女児、窓枠をよじ登って乗り越えたか,https://news.yahoo.co.jp/articles/f1debd0120fde442e72ae0b104846edfb73619d4,10/14(土) 15:04
yom,現金５０００万円入り金庫と指輪など１５００万円相当持ち去った男「盗むつもりはなかった」,https://news.yahoo.co.jp/articles/7b60aee19635f674fc4bf039856308f8e488c8c3,10/14(土) 14:15
yom,旧ソ連構成国でもロシアの威信低下、盟友のベラルーシ大統領「誰もが我々を恐れて尊敬した」と振り返る,https://news.yahoo.co.jp/articles/109a1ca9af684dc7b05ce284b49c94381291cf4d,10/14(土) 13:42
yom,女性宅に男２人組「福祉の者です」…口ふさいで押し入り、現金と財布奪う,https://news.yahoo.co.jp/articles/cdedb3d262e3f1a488d5ffde825c98df582ed341,10/14(土) 13:25
yom,鳥取砂丘の西側にマリオット最高級ブランド「ラグジュアリーコレクション」,https://news.yahoo.co.jp/articles/8f62da415b7c86c29081bd8a2f70403f7752680a,10/14(土) 13:15
yom,優勝１２回の「名門」日大、４年ぶり箱根路へ…新留学生キップケメイが個人１位,https://news.yahoo.co.jp/articles/6f5c3eea1d161c885dc6c28bfa23c110af7a2c6c,10/14(土) 13:08
yom,阿部ジャイアンツ始動…「僕も変わりますし、皆も変わってほしい」,https://news.yahoo.co.jp/articles/67c19e1e4c99d778f95240b727ec78017760230e,10/14(土) 12:28
yom,前回大会１１位でシード落ちの東京国際大、予選会３秒差で本大会逃がす,https://news.yahoo.co.jp/articles/c2288cd21bcafbab1f4a1d82ae784f92d5637dde,10/14(土) 12:24
yom,予選会直前に「女子部員と不適切行為」で監督解任の立教大、２年連続２９回目の箱根路へ,https://news.yahoo.co.jp/articles/b6b60751c65f042dc3d1bb7a65268935e600bf52,10/14(土) 12:18
yom,JR芸備線「再構築協議会」設置、沿線自治体に国から意見聴取文書,https://news.yahoo.co.jp/articles/026af1544fc10c935d9d5df0937fd5e8298042b3,10/14(土) 12:11
yom,「瑞風」で石見銀山遺跡に…島根・大田に来年秋から停車,https://news.yahoo.co.jp/articles/5dee6ae84532b2a682623365ffe2103a7eef905f,10/14(土) 12:03
yom,タイガースと甲子園は他社にはない強み、街づくりの核に…優勝18年ぶり「お待たせしました」,https://news.yahoo.co.jp/articles/987b68239c1404a339ffe79f922d4a31a89c28a3,10/14(土) 12:03
yom,松田県議着服法的措置へ、ゴルフ同好会「見過ごせない」…会費230万円を私的流用,https://news.yahoo.co.jp/articles/3ab14898a10a2a26808b2be18ad894a0fe6d8f16,10/14(土) 12:03
yom,カープ伝説の二遊間、ユニホーム・ヘルメット展示…記念撮影できるスポットも,https://news.yahoo.co.jp/articles/a664843b8fc8c0c5161afe3531d3c47e439e4658,10/14(土) 12:03
yom,「カープ鉛筆」復刻へ、最初の球団グッズに学生ら挑戦…草創期に選手自ら売り歩き,https://news.yahoo.co.jp/articles/84ade117b295d5d2da72bde7104e21637ed05d03,10/14(土) 12:03
yom,生きた化石、意外にかわいい…和歌山・古座川のオオサンショウ,https://news.yahoo.co.jp/articles/42481cead432823752049b0b48872d8328729acd,10/14(土) 12:01
yom,「エトルリアの剣」「地中海のルカ」漫画家・文月今日子さん50年の足跡…北九州市で記念展,https://news.yahoo.co.jp/articles/3dd576ac588df2bf868e23df619dc071a9604944,10/14(土) 11:50
yom,東農大スーパールーキー前田和摩が日本人トップ「このチームで勝負したい」…１０年ぶり箱根切符,https://news.yahoo.co.jp/articles/79e46ac42b1bbf038a593e765b77a54b2c9175b4,10/14(土) 11:41
yom,ソニーＧやテンセントと並ぶ巨大ゲームメーカー誕生…マイクロソフト、アクティビジョン買収完了,https://news.yahoo.co.jp/articles/9da17d9a88942a1f83f941c0e965f49f4d9ea4d2,10/14(土) 11:34
yom,「キハ47系」2両でほろ酔い旅,https://news.yahoo.co.jp/articles/72335ca0b010036066df5ceab3cccee8e69d90cb,10/14(土) 11:33
yom,「未来へ羽ばたけ！」卓球・早田ひな選手へ感謝の垂れ幕…火災復興に義援金、北九州市の旦過市場,https://news.yahoo.co.jp/articles/61bf5d290f31e58366331fbd850db9198a6ffcb6,10/14(土) 11:30
yom,イスラエル軍、ガザで地上部隊の作戦開始…大規模展開へ向けた偵察活動か,https://news.yahoo.co.jp/articles/00bd5a12333985fc3ea41fa0c092680a5e15bd62,10/14(土) 11:25
yom,イスラエル邦人退避準備、空自輸送機３機がアフリカのジブチへ出発…民間機運航停止に備え待機へ,https://news.yahoo.co.jp/articles/5fa98a7eb088cbc4e2fec48a9d56cc5e7d7600c6,10/14(土) 11:16
yom,「瀬戸内色」列車8年ぶり復活…「懐鉄」シリーズ第3弾、JR山陽線・下関―岩国を中心に運行,https://news.yahoo.co.jp/articles/b157b58d8a7c6825972666c3b5a863d36501e1d2,10/14(土) 11:11
yom,北朝鮮、ロシアにコンテナ１０００基以上の武器・弾薬…見返りに戦闘機やミサイル要望と米が指摘,https://news.yahoo.co.jp/articles/8bbcecfdb071fcbaa94a5670a7238161e67c5ccc,10/14(土) 11:06
yom,長崎市浜町の「S東美」来春めどに閉店…「スタバ」「ミスド」入るビル、老朽化で建て替え,https://news.yahoo.co.jp/articles/2942a978dbb138f2a4b279a21076ebdc2f131ec3,10/14(土) 11:03
yom,イノシシのわなにクマ、近くに男性の遺体…頭に爪痕,https://news.yahoo.co.jp/articles/843c7238222a2a761be9995e519513f98b634e66,10/14(土) 10:59
yom,韓国軍の輸送機に日本人５１人、イスラエル退避で協力…テルアビブを出発,https://news.yahoo.co.jp/articles/69bf864b4c915668befb69dbd7819ef8a1bfd972,10/14(土) 10:52
yom,藤井聡太八冠「竜王」獲得の会場ホテル、来年3月で営業終了…山口県宇部市のANAクラウンプラザ,https://news.yahoo.co.jp/articles/a0e253cb283ba77fa03083f01f90440dd904f662,10/14(土) 10:50
yom,元プロレスラー金村キンタロー逮捕…自転車に衝突して逃げ、軽乗用車にも追突,https://news.yahoo.co.jp/articles/96ab962da709986451bfc307505b2315436cb30f,10/14(土) 10:45
yom,「コンカフェ」で無許可の「接待」サービス、魔女やアイドルの扮装で「談笑」,https://news.yahoo.co.jp/articles/e9d158f0edbde930c6f378b32794a484124d932b,10/14(土) 10:12
yom,初タイトル目前では手が震えた谷川浩司十七世名人、「大谷選手のような」藤井聡太竜王に衝撃,https://news.yahoo.co.jp/articles/946b35a5bf9e0ee50127bd33379c58e84ea75ba0,10/14(土) 9:49
yom,広島・府中で６２年の歴史「洋酒ケーキ」…芳醇な香り、大人のお菓子です,https://news.yahoo.co.jp/articles/8a335273fc38a47137e0c632839a2ff203910ad5,10/14(土) 9:31
yom,セクハラ「覚えがない」、旧統一教会との関係「呼ばれれば出る程度」…細田衆院議長会見に「不誠実だ」,https://news.yahoo.co.jp/articles/97fcf718c79e290608d6cacd0d8519ce1dee5631,10/14(土) 9:08
yom,新鮮なナス載せたドローンが通る「空の道」…物流業界「2024年問題」に商機,https://news.yahoo.co.jp/articles/227eb0ee5c1502ed17c8ddb720c713f36247c414,10/14(土) 9:03
yom,あこがれの箱根駅伝、通信制の学生も目指す…予選会スタート,https://news.yahoo.co.jp/articles/f7a4f5221ecd3d98ad1d27343301bf2152eb37b4,10/14(土) 8:52
yom,フランスの高校に卒業生の刃物男、教員１人が死亡…イスラム過激派の活動関与で監視対象,https://news.yahoo.co.jp/articles/f49198e8222561efdb0eb4a31a5ae643efa21497,10/14(土) 8:49
yom,箱根駅伝予選会、大東文化大・明治大・帝京大など１３校が出場権獲得…東農大は１０年ぶり,https://news.yahoo.co.jp/articles/137cf3b3d2a131cf411cbc01db6edc7ebd8cd457,10/14(土) 8:03
yom,「１人トリプルプレー」元阪急・住友平さん死去…プロ野球史で唯一の「無補殺三重殺」,https://news.yahoo.co.jp/articles/f236b07e24b1386dea31ee8b8031a337f52dbf31,10/14(土) 8:00
yom,「柳ヶ瀬ブルース」ヒットから１１年後に開業、「街の誇り」岐阜高島屋が閉店へ,https://news.yahoo.co.jp/articles/855adda0ede273c18cc0b887238a3572b9b2cedc,10/14(土) 7:57
yom,チーム底上げ進んだ立教大、２年連続「箱根路」狙う…監督解任の難局でも１万ｍ２８分台５人,https://news.yahoo.co.jp/articles/dae9861005811d4963a69311d4bdaac6490683b1,10/14(土) 7:52
yom,１０代の男、札幌駅で刃物を自分の首に突きつけて叫ぶ…報道を見て自ら１１０番,https://news.yahoo.co.jp/articles/b60ecc15ba00676e4c8754f182a9d2efe00dba39,10/14(土) 7:35
yom,「ハマス消し去る」イスラエル、近く地上作戦か…多方面から一気に侵攻・短期戦狙う,https://news.yahoo.co.jp/articles/86a5d7954df9be0834967df80cd0e058f6f4da48,10/14(土) 7:19
yom,藤井聡太竜王の作法を見て学んだ伊藤匠七段…新時代告げる竜王戦の初陣は完敗も、「大きな経験」と前を向く,https://news.yahoo.co.jp/articles/1b1de40e2706806981a8f669e0bdd3712fe1257c,10/14(土) 7:03
yom,山陰中央テレビ元部長、「事業費名目で４７０万円詐取」で指名手配…都内で身柄確保,https://news.yahoo.co.jp/articles/432f6431d3a561cbaa2838c983da5b2f87d6a108,10/14(土) 6:58
yom,４年前の「教諭が少女とわいせつ行為」、市教委は県教委に報告せず…先月は別の少女と,https://news.yahoo.co.jp/articles/a0e0fa4408af208de36fde656e41b64fec01dbac,10/14(土) 6:38
yom,「無免許で飲酒運転」知っていたのに…女性巡査、迎えにきた知人男性の車に同乗,https://news.yahoo.co.jp/articles/ea1d0025f03eee17c470400860b9d75a72bd2abc,10/14(土) 6:37
yom,男が窓割り実家侵入、隠れたのを母親に見つかりそうになりハンマーで頭殴る・首絞める,https://news.yahoo.co.jp/articles/6cfb2297062f3ab2a429478b3cb8707ad02a9ac5,10/14(土) 6:36
yom,スーパーの「シラス干し」にフグの稚魚が混入…４０パック販売、自主回収,https://news.yahoo.co.jp/articles/61625fadd95b836839d092e9d8657496ca11a8ac,10/14(土) 6:36
yom,ＮＹダウ終値、３９ドル高の３万３６７０ドル…売り買いが交錯,https://news.yahoo.co.jp/articles/d937f205ed68f544640ce71c6a8d427cd8161c09,10/14(土) 6:08
yom,安全保障の新領域「宇宙」で官民連携…民間の技術を防衛に活用「今後５年が正念場」,https://news.yahoo.co.jp/articles/2106a3128030274e713774e4c833643efcfe72a4,10/14(土) 5:05
yom,街中で自由に「ストリートピアノ」、シャイな日本人の「弾きたい」をくすぐる,https://news.yahoo.co.jp/articles/7c1f8bd8590af41d91f2ab809187735f54c94890,10/14(土) 5:02
yom,何でもやる「タマネギ部隊」…教団の選挙支援が自民侵食、「決別」強調でも先行き不透明,https://news.yahoo.co.jp/articles/1236dad6d4d3aca0ed4cea32862d6e18590d4266,10/14(土) 5:02
yom,暗闇のガザ「見えるのは空爆の光だけ」…電気遮断・水や食料も枯渇へ、病院に負傷者殺到,https://news.yahoo.co.jp/articles/bbd1abbb1e9819f69c9296f5ae1396a53b32d1e3,10/14(土) 5:02
yom,根強い反イスラエル感情、アラブ諸国ではパレスチナへの連帯示す大規模デモ,https://news.yahoo.co.jp/articles/a634b0e31e95c4253def7e2425356f1c065af437,10/14(土) 0:34
yom,福島第一原発２号機、核燃料デブリ取り出すため通路の蓋開く…ロボットアーム通し採取へ,https://news.yahoo.co.jp/articles/f2b5ff344209eb5180eb3dcca48a1fad4661a7d1,10/14(土) 0:25
yom,ロシア軍がウクライナ東部アウディーイウカで４・５平方キロ制圧か…激しい攻防続く,https://news.yahoo.co.jp/articles/0cf36f09942487906caa29585c53dbf02632ad44,10/14(土) 0:17
yom,イスラエルの邦人退避に備え、ジブチに自衛隊機…海自艦艇の派遣も検討,https://news.yahoo.co.jp/articles/6e1cd744694a8934bbb98e65b6a9f0e3eb827c63,10/14(土) 0:09
yom,元社民党副党首・渕上貞雄氏が死去、８６歳…参院４期務める,https://news.yahoo.co.jp/articles/6d4cbd605b80858022911b3a6e15943c62c98a47,10/13(金) 23:55
yom,打ち切るな・まだ質問ある…細田議長に怒号、再会見求める声に「会話をしましょう」,https://news.yahoo.co.jp/articles/5613c51df47bb55634beefb994d168fac2af46e8,10/13(金) 23:46
yom,ＮＡＳＡ、小惑星プシケへ向かう探査機サイキ打ち上げ…内部に金？「１０００京ドル」の価値,https://news.yahoo.co.jp/articles/2ff4708aede3b43581cabe217ec914e6993e562f,10/13(金) 23:42
yom,旧統一教会との関係・セクハラ疑惑、具体的な説明避ける細田衆院議長…次期衆院選には出馬の意欲,https://news.yahoo.co.jp/articles/14b8d83fba09818b525012e41be94a95a8530693,10/13(金) 23:29
yom,冬季五輪開催地、３０年・３４年大会の同時決定へ…３０年招致断念の札幌は窮地に,https://news.yahoo.co.jp/articles/21a2d1a90066ec80e3b77406c4871a58e7803f98,10/13(金) 22:58
yom,中央道下り線で複数台が絡む事故、７人けが,https://news.yahoo.co.jp/articles/6656605eb43001708749eff3630aaa4025088926,10/13(金) 22:36
yom,韓国の旧統一教会本部、解散命令請求に「深い遺憾」,https://news.yahoo.co.jp/articles/3f55d59067e82ef7fbc53446dd1763c6208dde8b,10/13(金) 22:32
yom,「くら寿司」迷惑動画で有罪判決の男、売春させながら少女を連れ回した営利誘拐罪も認定,https://news.yahoo.co.jp/articles/7eeae0081cceb231dc0c5428dfe23e8c1d49de98,10/13(金) 22:27
yom,［深層ＮＥＷＳ］イスラエル軍地上戦なら「これまでにない規模の民間人の犠牲が出る」…小泉悠氏,https://news.yahoo.co.jp/articles/cee8f230cd9fa675aeee33c173e153189cd4f1fe,10/13(金) 21:59
yom,急増する盗難対策「売る場所の警戒を強化」…不審な金属類持ち込み、買い取り業者に警察が通報要請,https://news.yahoo.co.jp/articles/9769961e92ddc9185a871dca776dd1bfa01ce348,10/13(金) 21:50
yom,洗剤販売額が１０年で３割増、計量不要な「ワンショット型」好調…「多少高くても高機能な商品使いたい」,https://news.yahoo.co.jp/articles/fd1fac664d5460066334712e04159d9d5405ad25,10/13(金) 21:44
yom,睡眠時間が理想より不足、うつ病リスク高まる傾向…厚労省・過労死白書,https://news.yahoo.co.jp/articles/4992e613311dbcd8c7b91e308862688fbb41c92d,10/13(金) 21:29
yom,イスラエル軍がガザ退避勧告、日本時間１４日午前が期限か…ハマス「空爆で人質１３人死亡」と主張,https://news.yahoo.co.jp/articles/b0e382460567c5fa2ecd3e7fe2f5948118ab88b2,10/13(金) 21:13
yom,元同僚の女性教諭殺害、野球部の副部長を除名処分…日本学生野球協会,https://news.yahoo.co.jp/articles/2212fc06be95740e8170ab5b6cff54cd471cae1e,10/13(金) 20:59
yom,藤井聡太竜王、将棋の面白さは「終盤に向けて複雑さを増すのが魅力」…凱旋会見の一問一答,https://news.yahoo.co.jp/articles/aa00e3e7c95f3ccd02f56ede4fbe7044687602a0,10/13(金) 20:46
yom,４勝２敗の地元対局場、藤井聡太竜王「痛いところを突かれた」…落ち着く場所は「師匠の研究室」,https://news.yahoo.co.jp/articles/4c4edb1a4ed6d6b7706ae3ecae4705443b3cd01c,10/13(金) 20:42
yom,日本レコード大賞、ジャニー喜多川氏に贈った「特別音楽文化賞」取り消し,https://news.yahoo.co.jp/articles/87030ed3517ac7ea07aa1969e3a3f54f9f323ae6,10/13(金) 20:31
yom,藤井聡太竜王が凱旋、最も喜んでいるのはと問われ「まずは隣にいる方」…師匠の杉本昌隆八段から花束,https://news.yahoo.co.jp/articles/beacf5ed52e92f4f6c37c5b6ea469fe47a039143,10/13(金) 20:29
yom,容貌を放送された不起訴の男性、ＴＢＳと和解成立…条項に謝罪とネット画像の削除,https://news.yahoo.co.jp/articles/22547d21e6e2168b915ea512ecac4293c4177a94,10/13(金) 20:18
yom,「全世代型社会保障を実現すべきだ」経団連が提言…消費税率引き上げも有力な選択肢の一つ,https://news.yahoo.co.jp/articles/358dbf521fbfcd16c473df8682f6919186779fb4,10/13(金) 20:04
yom,井上咲楽さん登場に出身地の全中学生６００人集結、小学生の時は「暗い性格」…中学の部活が転機に,https://news.yahoo.co.jp/articles/90a76f6eb56df4212ea210b1f6c31d63cb2b1b6a,10/13(金) 20:00
yom,新閣僚１３人の資産を公開、平均額は６６８０万円…トップは新藤経済再生相の３億４０６万円,https://news.yahoo.co.jp/articles/b2b333f4e1cdbdd53088554984e4d3f79b816a20,10/13(金) 19:56
yom,リニア中央新幹線、初のトンネル貫通…２７年開業を目指すが静岡で着工できず遅れ必至,https://news.yahoo.co.jp/articles/bdf77e2b488b5db73a758701192539849c54490a,10/13(金) 19:53
yom,在中国イスラエル大使館の職員、北京市内で何者かに襲われる,https://news.yahoo.co.jp/articles/bd3134364055733c848e5f044cf1a0396d173223,10/13(金) 19:44
yom,高島屋岐阜店、来年７月末で閉店…「県内唯一」百貨店の業績回復見通せず,https://news.yahoo.co.jp/articles/ec7bade21211df610164b73f26976978ed5e9932,10/13(金) 19:37
yom,大阪に世界の起業家らが集結、万博期間中にデジタル医療の国際コンテストを開催へ,https://news.yahoo.co.jp/articles/f91296e6c3a1c40063d58f69df01d393eed98921,10/13(金) 19:31
yom,サッカー日本代表まもなくカナダ戦、スタメンに中村敬・伊東・冨安…久保は外れる,https://news.yahoo.co.jp/articles/017e895ecbd2eeaa05ff7669c8a307e3f9cea993,10/13(金) 19:21
yom,２８年ロス五輪での野球・ソフトボールなど５競技追加、ＩＯＣ総会で正式決定へ,https://news.yahoo.co.jp/articles/3e698c168a04dbe209eea4601f349d178febb6fd,10/13(金) 19:20
yom,「子ども放置禁止」の埼玉県条例改正案、正式に取り下げ…批判噴出し自民が陳謝,https://news.yahoo.co.jp/articles/24c359ba637a3a0a7a74399b9eed8ecc75f52163,10/13(金) 19:14
yom,細田衆院議長セクハラ疑惑、岸田首相「『名乗り出る人いなければない』は適切ではない」,https://news.yahoo.co.jp/articles/2f5555a53f26c3e2a21eceb7abd450a9bdf8cb7d,10/13(金) 19:02
yom,水木しげるロードが30周年…鬼太郎やねずみ男などのブロンズ像が立ち並ぶ名所に4290万人が来訪,https://news.yahoo.co.jp/articles/2a194b1cb079fb3d0a4fa61c20f33d88635ef51c,10/13(金) 19:01
yom,首相夫人や広島市長が平和願うソメイヨシノを植樹…G7首脳らの芳名録展示施設を整備へ,https://news.yahoo.co.jp/articles/d39344ba254704922b628115ffede8d4c42203d9,10/13(金) 19:01
yom,パレスチナ緊迫化、邦人退避に備え自衛隊機をジブチに派遣へ…岸田首相「安全確保に万全期す」,https://news.yahoo.co.jp/articles/0c332067ce590be2acd71317d52680590e0a390c,10/13(金) 18:55
yom,インフルエンザ感染者数、沖縄は「警報」超えの３０・８５人…コロナは５週連続で減少,https://news.yahoo.co.jp/articles/370fd44fdf624b0d4d0caadc5fc4bef524e55f84,10/13(金) 18:50
yom,米原子力空母ロナルド・レーガン、韓国・釜山に入港…北朝鮮「露骨な軍事的挑発だ」,https://news.yahoo.co.jp/articles/e5352a1cba609e5442fa575e8ea296c6bf212da6,10/13(金) 18:38
yom,全日本大学女子駅伝、２年連続区間賞の拓大・不破聖衣来はメンバー入りせず,https://news.yahoo.co.jp/articles/1cb7e2bcbd574d2518601152248d42ad8634e8ed,10/13(金) 18:33
yom,札幌市営地下鉄の駅トイレ洋式化、７年遅れで４３年度完了見通し…エスコンフィールド開発の影響も,https://news.yahoo.co.jp/articles/1d3009378198fb9398952557fee7478651ff7ef0,10/13(金) 18:22
yom,中島啓太と貞方章男が首位浮上、アマチュアの岡田晃平は１打差３位…日本オープン第２日,https://news.yahoo.co.jp/articles/a426a1edc9ab2a9363e465d5666672c643f5714c,10/13(金) 18:18
yom,システム障害で復旧まで丸２日、全銀ネットに金融庁が報告徴求命令,https://news.yahoo.co.jp/articles/a7fd72afb574110e251074678518a2198e427a05,10/13(金) 18:13
yom,東京円、４７銭安の１ドル＝１４９円６４〜６７銭,https://news.yahoo.co.jp/articles/bfa74bd930a4ae37aa1536991d2d4985e947c618,10/13(金) 17:57
yom,運転中に意識失ったか、橋の欄干や縁石に接触・電柱に衝突…７３歳男性死亡,https://news.yahoo.co.jp/articles/0bd374e64b521131cc2bb3b9f848c234c4a878f8,10/13(金) 17:52
yom,ペットが捨てられ野生化、激増するアライグマ…捕獲数は20年前の20倍超「街にもすみ着くとは」,https://news.yahoo.co.jp/articles/459d14a0a4e7186f5498a740227dda8861a4b5c8,10/13(金) 17:50
yom,部下に「なめているのか」…訓練中の声が小さかったとして消防職員が繰り返し威圧的な言葉,https://news.yahoo.co.jp/articles/c1616b2663d8c996084690eeab779a7b422f35c1,10/13(金) 17:43
yom,外国ルーツ生徒の大学進学を支援…書類・面接で選考し入学後に日本語指導、多様性が学生の刺激に,https://news.yahoo.co.jp/articles/decb278e852f6cc4aad8634bd50a13d86cee7251,10/13(金) 17:30
yom,落雷被害の国宝本殿、修理に全国から2041万円支援,https://news.yahoo.co.jp/articles/c5ff106b6bf00fccee8268ba35442681eb328d08,10/13(金) 17:30
yom,日本シリーズは２８日開幕、全試合ナイターで…第７戦までは延長十二回打ち切り,https://news.yahoo.co.jp/articles/4cf2868e60254237aae67083eab27edfe7a66654,10/13(金) 17:20
yom,米下院議長選は振り出しに、異常事態の出口見えず…共和党・スカリス氏撤退,https://news.yahoo.co.jp/articles/cd41d25b1b9dd9bf40fd0c4018ca5c6d8473a4e2,10/13(金) 17:13
yom,政務活動費問題「真相究明へ一歩」、関係者ら期待…元維新の尼崎市議書類送検,https://news.yahoo.co.jp/articles/cb3547af06bf1715707a07c78ccd7fcc92f4505f,10/13(金) 17:01
yom,ピアニストの高橋アキ、佐藤聰明作品を録音…２５日に豊洲でリサイタルも,https://news.yahoo.co.jp/articles/730d3ba42f6af78bc9d190fe1b28ab7d97012612,10/13(金) 17:00
yom,ポテチ1日25万袋、まるで流れる川のよう…材料は1日50トン・湖池屋「九州阿蘇工場」,https://news.yahoo.co.jp/articles/a11f334db4b3396b3b35c4822551e625044d248d,10/13(金) 16:50
yom,ヒンギスさん華麗さ健在、東レ・エキシビションでプレー…「この大会は私が一番勝っている」,https://news.yahoo.co.jp/articles/ed39d3d59b4902947e2a49e4cd8709f7abf906ca,10/13(金) 16:49
yom,「入」場券＋「学」文路駅、今年は「お守り袋」入りで受験生応援,https://news.yahoo.co.jp/articles/ed89ceb9aae29693e398d83cede21672fdf120e3,10/13(金) 16:30
yom,アメフトX1スーパー・福岡SUNS、昇格2年目で初勝利目指す…「歓喜の瞬間、今年こそ」,https://news.yahoo.co.jp/articles/c22dbe4cc7f9d4be7083f6d729ae4cd9777093b6,10/13(金) 16:20
yom,横浜の雑居ビル、鉄製の二重扉の奥に２４時間営業のバカラ賭博…男女２１人を現行犯逮捕,https://news.yahoo.co.jp/articles/c6807f5be0fd2f460a24b6f94b95a5274fcd230b,10/13(金) 16:02
yom,ガザへの人道支援、イスラエル「人質が解放されるまで協力しない」…地上作戦を準備,https://news.yahoo.co.jp/articles/f254c16e549e5717d5fc470ca21f5f7edce0f808,10/13(金) 15:40
yom,４０年超の原発３基、運転停止を回避…使用済み核燃料の「福井県外搬出計画」で知事同意,https://news.yahoo.co.jp/articles/ab921e9ad06ab11093bc177f2b09c9a3e136fec2,10/13(金) 15:33
yom,「ノウイットオール」森バジルさん……落選の評をバネにひらめいたアイデアは？,https://news.yahoo.co.jp/articles/858c83821b71c351e52a43673d04287d65eecb42,10/13(金) 15:30
yom,男子バレーを牽引する石川祐希と高橋藍を育てた指導者、「上を目指してほしい」とエール,https://news.yahoo.co.jp/articles/9d363ec2e193b2f265a841e754f5c63e4cd50b5a,10/13(金) 15:26
yom,実家に侵入しクローゼットに隠れ母親をハンマーで襲撃…殺人未遂容疑で23歳男を逮捕,https://news.yahoo.co.jp/articles/bba1097222dd24afe3d8e678f50f93ef10098ac0,10/13(金) 15:20
yom,鹿児島銀の決済アプリ「Payどん」地元2機関と共同利用…会員12万人から倍増目指す,https://news.yahoo.co.jp/articles/99073f0cfc1b4fbb1fbbd484989b1e8990a36757,10/13(金) 15:20
yom,日経平均株価が反落、終値は１７８円安…前日までの３日間で約１５００円上昇,https://news.yahoo.co.jp/articles/708a0ea8110f1d577c48d0a8442d00bf9dff1675,10/13(金) 15:16
yom,ウクライナ侵略　今読むべき本,https://news.yahoo.co.jp/articles/250365cc3daf77bf90ab6d3206286bc8671d60ce,10/13(金) 15:15
yom,福岡市中心部のオフィスビル空室率は5・80％…3か月連続で低下、新築・既存ともに成約進む,https://news.yahoo.co.jp/articles/38baf310e65bd10c014264dfb18e31a68e9ab238,10/13(金) 15:06
yom,百貨店の井筒屋、中間期3年ぶりの減益…前年同期比43・3％減の利益4億円,https://news.yahoo.co.jp/articles/f9555dcfffe1f60204d72ce011d289e782920f11,10/13(金) 15:03
yom,イスラエル首相「我々は肉食動物を見た」、ガンツ前国防相「ハマスを地球上から消し去るであろう」,https://news.yahoo.co.jp/articles/f4a8030aa70554cbde5b7d06793aac7601fc0c78,10/13(金) 14:54
