media_en,title_articles,link_articles,date_original
yom,エースも主将も欠いた東海大、２年生がチーム引っ張り箱根路へ…次期エース候補もコロナ明け,https://news.yahoo.co.jp/articles/5d4f4626c13ddc57136561435c91639a3ae8a460,10/15(日) 13:22
yom,民間建立の戦没者慰霊碑、遺族の高齢化で維持困難に…全国に１万６２３５基,https://news.yahoo.co.jp/articles/cbc13493ea4cc7297f393a00a06a6b4f53c1fb64,10/15(日) 13:14
yom,山梨学院大、３秒差で箱根本大会へ滑り込み…後半失速に飯島監督「現実を突きつけられた」,https://news.yahoo.co.jp/articles/1b8772e080cf82ae61c11a4ca36567bab4dc9873,10/15(日) 12:55
yom,イスラエル退避で韓国軍機に日本人搭乗、上川外相が韓国外相に謝意…「互いに協力」で一致,https://news.yahoo.co.jp/articles/523be79f57ce87603d02f577b750fac0d524f54d,10/15(日) 12:49
yom,古豪・筑波大、４年ぶりの箱根路出場ならず…弘山勉監督「予選通過校との差が広がっている」,https://news.yahoo.co.jp/articles/7be648acc1865bf7e1f52b90a3361ff2be2c7023,10/15(日) 12:32
yom,箱根予選３秒差敗退の東京国際大コーチ「見積もりが甘かった」…「最速留学生」転倒の不運も,https://news.yahoo.co.jp/articles/b3601c33c472f37e839dfe9bc7fa25204787c33e,10/15(日) 12:05
yom,ガザの中学生が広島訪問、原爆慰霊碑に献花…「広島とガザの置かれた状況似ている」,https://news.yahoo.co.jp/articles/573339949249c939f11b6d706fae73ea06daf94e,10/15(日) 12:02
yom,CSカープの劇的勝利に歓喜、秋山選手が延長サヨナラ打…「日本一になって」,https://news.yahoo.co.jp/articles/f931e031f6e392d39102913eee968a46571a5da6,10/15(日) 12:01
yom,広島レジーナの初Vに感動、サッカー女子WEリーグ杯…「勇気をもらった」,https://news.yahoo.co.jp/articles/95da82c422e1ed46ffa2ebe6f377b758dd9b512e,10/15(日) 12:01
yom,経費両県で10億円超、投票所運営担う市町村への交付金や委託料…参院徳島・高知補欠選挙,https://news.yahoo.co.jp/articles/31deb8a556dfc4b7dd9a450cf62e0a9603235902,10/15(日) 12:01
yom,路面電車「お疲れさま」、50形52号、69号の運行終了…伊予鉄道最古の車両,https://news.yahoo.co.jp/articles/b19ee4f1902cca0beef7af53733216fb2ed7afb8,10/15(日) 12:00
yom,ＳＮＳで話題「不合格の碑」、「人生に寄り添う医師」の遊び心と決意…「あの場所で笑いあいたい」,https://news.yahoo.co.jp/articles/7baaee472edd8c93204ef37906f83ec1d6f0190b,10/15(日) 11:53
yom,12年前に娘を殺害された母「生きていることに価値や意味」…中学校で命の大切さ訴え,https://news.yahoo.co.jp/articles/2c5579c06033b5268db7555ba30bb86fff676818,10/15(日) 11:47
yom,チャットで「水素エネルギー」投資勧誘、送金した暗号資産１２００万円分をだまし取られる,https://news.yahoo.co.jp/articles/3a6003a388c08274c99eda675c13a12021eee327,10/15(日) 11:40
yom,箱根予選・東京農業大、「涙の９年」乗り越えて「花」…スーパールーキー前田和摩に上級生も奮起,https://news.yahoo.co.jp/articles/0af724a1253b6f9574cc55dae4dddccd851f8760,10/15(日) 11:38
yom,大分県日田市の小鹿田焼、大雨被災後初の火入れ…「出来としてはほぼ完璧」,https://news.yahoo.co.jp/articles/3ce5ecb145b20af82bdd51dd912cd3f0abcf8547,10/15(日) 11:35
yom,物価高やコロナで「ホーユー」など業者撤退、公立高の学食ピンチ…弁当注文・コンビニに切り替えも,https://news.yahoo.co.jp/articles/8d5580d3c365ef28308a81e8c129b4c3b4b2a4b2,10/15(日) 11:31
yom,熊本と台湾の漫画家10人、交流しながら文化の違いをマンガで発信へ…年明けめどに作品,https://news.yahoo.co.jp/articles/ef133bc8d0eaa0db9f28893db57cb265bceb1a74,10/15(日) 11:31
yom,軽乗用車を無免許運転し事故、同乗の少女に身代わりを依頼した疑いで逮捕,https://news.yahoo.co.jp/articles/75f4e2b9739aa573faf23fed6c751bb1e0696024,10/15(日) 11:29
yom,白いタンクトップで「ヤー！」現れたのは長崎県警採用係長…業務説明会、元芸人の巡査長も登場,https://news.yahoo.co.jp/articles/45b6f37d78ea7728cd5ce9db3d61fa3b5ffc17ac,10/15(日) 11:26
yom,悪天候で最終ラウンド中止、前日まで単独首位の桜井心那が優勝…１０代での４勝は３人目,https://news.yahoo.co.jp/articles/bca383b04b0b4fa190e330ac101380249d96733a,10/15(日) 11:23
yom,玄海原発での重大事故発生を想定し防災訓練…佐賀県からは2万8000人が参加、手順確認,https://news.yahoo.co.jp/articles/7fb7bf55d6b07d7e0db55fff2537ea4a8715b7ac,10/15(日) 11:20
yom,高倉健さん命日にあわせ黄色いタオルでしのぶ…北九州の堀川運河,https://news.yahoo.co.jp/articles/d8caae95e63901f3121d9c2d8801412a4cfe1432,10/15(日) 11:16
yom,バスケB3・パッツファイブ「山口のバスケ盛り上げたい」…下関市役所で公式戦PR,https://news.yahoo.co.jp/articles/1596d1a1dcf27d7cb6341dca1f8a64435b16ac28,10/15(日) 11:13
yom,箱根予選２位通過の明治大、「ジョギング１０分増」効果…「上り坂で前との差を詰められた」,https://news.yahoo.co.jp/articles/9ca6369502fc69816e91f0efc99b16f32cd3cc66,10/15(日) 11:12
yom,アジア大会で二つの「金」、柔道・田中志歩選手を祝う横断幕…出身地の山口県光市に,https://news.yahoo.co.jp/articles/a8483a7ca13f5f84431001df149cfb6676ad2f58,10/15(日) 11:10
yom,「普段見ることのできない」車両検査の様子にファン興奮…山口県下関市で鉄道フェスタ,https://news.yahoo.co.jp/articles/3f183a39b2a4203d54bc0a6f7cd8a490907a8a4e,10/15(日) 11:07
yom,箱根予選・日本人２位の吉田礼志、中央学院大を２年ぶり本大会へ導く…川崎監督「シード目指したい」,https://news.yahoo.co.jp/articles/a088853230c7859663eea69e3a59c5323d57edb1,10/15(日) 11:00
yom,ＭＧＣ女子１位は鈴木優花、２位の一山麻緒とパリ五輪代表内定…３位は細田あい,https://news.yahoo.co.jp/articles/d94437dbefaae25b2e2a0d11f46558cedae16228,10/15(日) 10:53
yom,パリ五輪目指すサッカーＵ２２日本代表、メキシコに４―１…流れ変えた細谷真大の２ゴール,https://news.yahoo.co.jp/articles/eb02029a305154c59d8fa46126f9ddf8f27212f3,10/15(日) 10:46
yom,「寺田交差点」の皇学館大・寺田監督、箱根予選敗退の選手１２人に「１００点満点」,https://news.yahoo.co.jp/articles/a248b5a5158a5e97fbb9cf722bdebe11fb1729ee,10/15(日) 10:39
yom,ガザ紛争でロシアが「即時停戦」決議案、ハマス非難せず…イスラエル全面支援の米と一線画す,https://news.yahoo.co.jp/articles/7878b3ed7416fb068aa2588e664e246c57cd98da,10/15(日) 10:29
yom,小山直城・赤崎暁がパリ五輪代表内定、大迫傑はＭＧＣ３位…日本記録保持者の鈴木健吾は途中棄権,https://news.yahoo.co.jp/articles/d5ecb40d89a7a985564f4d54c247d1cc210a9726,10/15(日) 10:18
yom,東地中海に２隻目の米空母、「ドワイト・アイゼンハワー」派遣指示…イスラエルへの攻撃抑止,https://news.yahoo.co.jp/articles/eeae4c367748abe74520eb3dce6c3563101d3fdb,10/15(日) 10:12
yom,フランスがテロ警戒態勢を最高レベルに…イスラエルとハマスの戦闘受け、兵士も動員,https://news.yahoo.co.jp/articles/1132b321fd1c3dc454dc69d57fc7005ffcf9212d,10/15(日) 9:51
yom,「難関突破」「初志貫徹」…リニアのトンネル貫通時に砕いた岩、「貫通石」として返礼品に,https://news.yahoo.co.jp/articles/f50e0399b38ff50c12efc9d940b208226bcc1547,10/15(日) 9:29
yom,茨城県が「魅力度ランキング」最下位、過去１５年で１２度目,https://news.yahoo.co.jp/articles/020ba41aba91e56e92da4a387ead7f4f033af3ce,10/15(日) 9:21
yom,優勝１２度の日大、予想外の予選会５位…高校駅伝の名門校から招聘の新監督が再建,https://news.yahoo.co.jp/articles/c783c4fd915fe130366e09d44d99f6e37a6f3b1e,10/15(日) 9:13
yom,「失言」知事、今度は懇談で議会未報告の事業を発言…県議会は緊急質問で大荒れ,https://news.yahoo.co.jp/articles/37a0189534339feb38df5491f5dd2a052f65c1e6,10/15(日) 9:07
yom,パリ五輪代表決めるＭＧＣ、日本記録保持者・鈴木健吾が１２キロ手前で途中棄権,https://news.yahoo.co.jp/articles/1eed53856aa3912f244ec580f4d101de731ed7db,10/15(日) 8:57
yom,「にわか将棋ファン」にもオススメ…「藤井聡太竜王」関連本が続々,https://news.yahoo.co.jp/articles/b7a5b3b3c7f3d80523ce92e73dcf31828f0b90be,10/15(日) 8:35
yom,オールブラックスが準決勝進出、世界ランク１位のアイルランド破る…アルゼンチンも４強入り,https://news.yahoo.co.jp/articles/fbb9a44d02b95bab2340277a53ea6a3bb95d6943,10/15(日) 6:29
yom,スタートアップの「成長性」を融資の担保に…新法制定へ、技術力や顧客基盤など想定,https://news.yahoo.co.jp/articles/7c249c27f7ae10d3073f6ea17721168e4b5dea21,10/15(日) 5:03
yom,日本発の先端技術に資金の壁…１００億円超集めたスタートアップ「政府の最後の一押し必要」,https://news.yahoo.co.jp/articles/31214668fdb8ed48d4728811b3ed5b82d51fefbb,10/15(日) 5:02
yom,日本の人口減少に「危機感」７９％、効果的対策は「子育て環境整備」５１％…新聞通信調査会,https://news.yahoo.co.jp/articles/6b0c4948a6f3b2942c38c274ccdb38a1f00f7459,10/15(日) 5:01
yom,スマホで縦に読むマンガ、「タイパ」ニーズで人気…業界に押し寄せる「新しい波」,https://news.yahoo.co.jp/articles/5ee91f2ef95aeaf84ed5f63e99f5b55780b029c0,10/15(日) 5:00
yom,「献金でお金ない」「人生めちゃくちゃに」悲痛な陳述書、カギは証明力…刑事証拠なく審理長期化も,https://news.yahoo.co.jp/articles/5f1870d78116f448e84bd72e84e214d22804bcae,10/15(日) 5:00
yom,川崎のタワマン、１９年の台風では数日間の停電・断水…今は１３棟が「共助」でつながる,https://news.yahoo.co.jp/articles/3cf68b1d8f631c5508a631d093585fd8781faba6,10/15(日) 3:09
yom,ニュージーランド総選挙、最大野党・国民党が第１党に…６年ぶり政権交代の見通し,https://news.yahoo.co.jp/articles/5558c62ff11dcb6d30c94c5ad0f985ef13f09516,10/15(日) 0:25
yom,政府チャーター機、テルアビブからドバイに向け出発…イスラエル退避希望の邦人８人搭乗,https://news.yahoo.co.jp/articles/a96303a7f7183183d71165e030ce67e867ba9e9c,10/15(日) 0:08
yom,ガザ北部から南部へ海岸道路２０キロに避難者の列…イスラエル軍空爆、ハマス幹部を殺害,https://news.yahoo.co.jp/articles/14b4a1ec67e48afa7614de2b714ca3299955ad34,10/14(土) 23:38
yom,日本人５１人同乗の韓国軍輸送機、ソウル近郊の軍用空港到着…イスラエルから退避,https://news.yahoo.co.jp/articles/a7ed5d639d10a10d21835eefdcf513fb203eb21c,10/14(土) 23:19
yom,ＷＥリーグ杯・広島が初優勝、ＰＫ戦の末に新潟破る…３９歳ＤＦ近賀「最後まで走り続けた」,https://news.yahoo.co.jp/articles/c1d51e2fde1e98dd0194bca585e1f5d5d04b6666,10/14(土) 23:00
yom,東大寺で初代別当・良弁の１２５０年御遠忌法要…「観相窓」特別開放し大仏が顔のぞかせる,https://news.yahoo.co.jp/articles/64b24760927021bbcd49006f36aea9b098a0d69f,10/14(土) 22:56
yom,陸自と米海兵隊の共同訓練「レゾリュート・ドラゴン」始まる…石垣島にはオスプレイ初飛来,https://news.yahoo.co.jp/articles/7e59c7534ca850b2866c69bf86adbdb404fe0053,10/14(土) 22:37
yom,児童生徒が平日休みを選択「ラーケーション」、愛知で始まる…働き方改革期待・「新たな格差」懸念も,https://news.yahoo.co.jp/articles/475ca6c688a37bc0ea45e7ba56c13df867a1e089,10/14(土) 22:25
yom,復帰の佐々木朗希「気持ちたかぶった」、ぶっつけＣＳで魂ほとばしる「３回完全」…ロッテ先勝,https://news.yahoo.co.jp/articles/81ab2e54b41b5dc951459dc4e2fe8e8512e30d9d,10/14(土) 22:03
yom,音楽活動中のコミュニティセンターで２人切りつけ、男を居合わせた人らが取り押さえる…騒音に不満か,https://news.yahoo.co.jp/articles/edd4f027659489df87265ca2f2ac79ef01c9007a,10/14(土) 21:55
yom,山下ＪＯＣ会長「えっという感じ」、ＩＯＣの動き「読み違えた」…冬季五輪３０・３４年同時決定へ,https://news.yahoo.co.jp/articles/5dd4feab1434653e71c817e8fcc93ea71ed6dcf3,10/14(土) 21:50
yom,２７位の京都産業大主将「予想以上にレベル高かった」…箱根予選会に関東以外から１１校,https://news.yahoo.co.jp/articles/904a9cef7ed64abb979c5acbf2eadcd63bbe058e,10/14(土) 21:34
yom,駿河台大「本大会は一泡吹かせ笑って終わりたい」、東海大「１０位は妥当」…箱根予選会,https://news.yahoo.co.jp/articles/9d9faaaca7f0af3b2d897bd7106649703b14b701,10/14(土) 21:18
yom,サウジ、イスラエルとの国交正常化交渉を凍結…ガザ衝突で困難と判断か,https://news.yahoo.co.jp/articles/48d1b0112272cf1e5b7a019a658abee93452e280,10/14(土) 21:15
yom,映画「アンダーカレント」、失踪夫捜す真木よう子「大人なら共感できる部分あるはず」…原作漫画読み必死に近づく,https://news.yahoo.co.jp/articles/004652f9bc5d2da69886149a0049fa71ea374c05,10/14(土) 21:14
yom,神奈川大の大後監督「ほっとした」「胸を借りてぶちかますしかない」…各監督の談話,https://news.yahoo.co.jp/articles/a3fd87b64b96de09337639683859c96ef95c01c6,10/14(土) 21:10
yom,「花になれ」のｆｌｕｍｐｏｏｌがベスト盤、初期代表曲歌い直す…「言葉の意味が深くなった」,https://news.yahoo.co.jp/articles/751d14c7cd1124b6f3b4ac62f695c63e86b3c6c1,10/14(土) 21:05
yom,３位帝京大「１０人以上コロナ、よく辛抱した」「本物の駅伝チームだ」…各監督談話,https://news.yahoo.co.jp/articles/be6231b8918cca9338cb7f86e3eeb7e4312032cb,10/14(土) 21:02
yom,８月に監督交代、明治大が２位通過…チームトップの４年生「みんなのスイッチ入った」,https://news.yahoo.co.jp/articles/456833d008a157d8497d1ba7a60648b40cc00834,10/14(土) 20:48
yom,ローソン「大きなサラダチキン柚子こしょう風味」アレルギー表示不備で回収…客が症状訴え,https://news.yahoo.co.jp/articles/eabe2be7f052710d39becebe1529a3442e41f10b,10/14(土) 20:42
yom,山梨学院大が「３秒差」で予選通過…「１度どん底を見た」監督も胸なでおろす,https://news.yahoo.co.jp/articles/bcdeb1dab9bafc8516600a50e777fe580c18bb84,10/14(土) 20:41
yom,創立１００周年の大東文化大、留学生が棄権も揺るがず…「１」テーマに第１００回大会へ１位通過,https://news.yahoo.co.jp/articles/624b311f65fca12329ac8f860343bc37a90bebf9,10/14(土) 20:31
yom,内堀知事「本当に恥ずかしい」、自民「再発防止策はむなしく空を切った」…相次ぐ県職員逮捕,https://news.yahoo.co.jp/articles/393f9534741dae09cfa3c894255d30a044e6c83f,10/14(土) 20:26
yom,イスラエル奇襲「インテリジェンスの失態」、米長官も認める…モサドやＣＩＡのハイテク頼み「あだ」,https://news.yahoo.co.jp/articles/4d125f33b0e43fe8617a56da4acaf989906d7da4,10/14(土) 20:22
yom,東京農業大の末恐ろしい１年生、初のハーフで日本人トップ…監督「練習あまりやらせていない」,https://news.yahoo.co.jp/articles/6368f51131b80e7bf449046453c22f3bc8e4d8b6,10/14(土) 20:16
yom,「のけぞるほどの勢い」で乳幼児に食事押し込む、脱がしたタイツを顔にかぶせる…保育士虐待,https://news.yahoo.co.jp/articles/bbda01fa62ec4046fb779fb7b158703f6ff8fbbe,10/14(土) 20:07
yom,１７０６円の「国産うな重弁当」なのに…中国産ウナギ一部使用、ＪＡいるま野が謝罪文掲示,https://news.yahoo.co.jp/articles/cd1e8a8e06e1d98f349362b81ac715f173b7bbf8,10/14(土) 19:54
yom,プロ野球・元中日の中利夫さん死去、８７歳…首位打者と盗塁王１回・監督も務める,https://news.yahoo.co.jp/articles/d102512ba0a5eb2b280427fd6eb8c6851703208b,10/14(土) 19:45
yom,日本人５１人同乗の韓国軍輸送機、１４日夜にソウル近郊に到着予定…イスラエルから退避,https://news.yahoo.co.jp/articles/be4e11d823b6d626ea3423a50d7346377797d427,10/14(土) 19:40
yom,ノーベル文学賞受賞の米国詩人ルイーズ・グリュック氏死去、８０歳…詩集「野生のアイリス」,https://news.yahoo.co.jp/articles/4b2acf341304695f5c856e75b134f3e1a7c30616,10/14(土) 19:34
yom,始動した巨人の阿部新監督、「対話」重視…「相手の顔を見て話す方が真意が伝わる」,https://news.yahoo.co.jp/articles/65eb6a95449facc6435dd9090059c2d89db0f325,10/14(土) 19:26
yom,国体の相撲選手多くて「重量オーバー」の可能性…奄美大島行き、ＪＡＬが臨時便で関係者分散,https://news.yahoo.co.jp/articles/fcf43f95b2d3c64a4654fb3aebcc4ff7c567bc9d,10/14(土) 19:12
yom,氏子の町長が神社に１００万円寄付「あんなに大きな石碑が建つとは」…公選法抵触の可能性,https://news.yahoo.co.jp/articles/2f651109d8ee4ddd35a3c80fa5964d13a9666b7d,10/14(土) 19:03
yom,れいわ八幡愛氏の車にパチンコ玉、撃った６５歳男逮捕…「むしゃくしゃしてやり過ぎた」,https://news.yahoo.co.jp/articles/15cfd00f037384052551009ef1cd7b1e2cb5a64d,10/14(土) 18:57
yom,広島が先勝、８回スクイズで追いつき１１回秋山サヨナラ打…ＤｅＮＡは東の好投フイ,https://news.yahoo.co.jp/articles/1efd99ee563f78260de987082fe3b7b0010f84dd,10/14(土) 18:50
yom,腰の張りを訴えていたＤＦ伊藤洋輝、日本代表を離脱,https://news.yahoo.co.jp/articles/180488ccbe430870062ffc8ca4554c41648c1c3c,10/14(土) 18:48
yom,ボクの名前つけて！絶滅危惧種「フランソワルトン」の赤ちゃん誕生…金色の体毛は今だけ,https://news.yahoo.co.jp/articles/3f01a60ee82523f746d38a7e9ae31772b110cb79,10/14(土) 18:41
yom,池江璃花子と瀬戸大也、豪州で練習へ…パリ五輪見据え有力選手抱えるコーチに師事,https://news.yahoo.co.jp/articles/1954e6bb75ca565e4ffceabdb2cee5f82029a601,10/14(土) 18:36
yom,ＮＹタイムズスクエア、パレスチナ支持集会に３０００人…道を隔てイスラエル支持者も集まる,https://news.yahoo.co.jp/articles/4865e3fe81dd5ed4756a46f4556529e9454bc40c,10/14(土) 18:30
yom,病気に強いサツマイモ育成へ「イモテラス」…霧島酒造が安定的な焼酎づくり目指し新施設,https://news.yahoo.co.jp/articles/9fd6dd820042ed09103f8997bf105ae4a010f1b1,10/14(土) 18:30
yom,スプリンクラー誤作動で市のホール水浸し、１２月末まで利用停止に…名画鑑賞会や寄席に影響,https://news.yahoo.co.jp/articles/5f22eaf2355223bbcee6a51f2e5ebdea314ab03b,10/14(土) 18:25
yom,イスラエル軍、ガザ北部住民への退避勧告時間を延長…避難経路示し「安全な移動認める」,https://news.yahoo.co.jp/articles/29bd3cbba8835554a40def18a525efebbfde7d21,10/14(土) 18:21
yom,全国に門戸開いた予選会、一度はあきらめた夢舞台に挑戦した立命館大・山崎皓太は自己ベスト更新,https://news.yahoo.co.jp/articles/d8bfacd8957a1f36c7666360aa0e641dd2d8b1bb,10/14(土) 18:10
yom,嘉手納基地に移駐する米軍無人機、海自鹿屋基地を飛び立つ…式典で部隊司令官「任務果たせて光栄」,https://news.yahoo.co.jp/articles/59598f2107cac6b90017f2dfe42cbffaa49327cf,10/14(土) 18:10
yom,「郵便受けに新聞たまってる」と届け出…流し台に寄りかかる男性、和室に横たわった女性ともに死亡,https://news.yahoo.co.jp/articles/1ee61e5fe7b33fbdefd8a935330095abbb4094a8,10/14(土) 18:06
yom,「奏でる家」、居住空間と調和した防音室がヒット…プロの音楽家も支持,https://news.yahoo.co.jp/articles/ae68c82946bbf3748146ed44cde1c07c8ff3f9fd,10/14(土) 18:04
yom,トヨタ「ライズ」ＨＶの受注取り消し、ダイハツ不正で生産メド立たず…ダイハツ「ロッキー」も,https://news.yahoo.co.jp/articles/74289ca072b27a231044e677751b5adb17b65158,10/14(土) 17:59
yom,天童市の林道、「人が乗った車の中に練炭が見える」と１１９番…成人男女と女児の死亡確認,https://news.yahoo.co.jp/articles/4b991fd78ceac1842133e16ded58006fec034efc,10/14(土) 17:48
yom,収穫前の「つがる」「シナノゴールド」計８５０個もぎ取られる…リンゴ農家「農業を侮辱」,https://news.yahoo.co.jp/articles/60f3bae9c5d0774d2c65969c06cb1d137021825e,10/14(土) 17:43
yom,市街地の木にクマ２頭、１１時間以上も居座る…出没相次ぎ紅葉のライトアップ延期,https://news.yahoo.co.jp/articles/d049b33441eec5170502287fdb13742975ebdc31,10/14(土) 17:40
yom,食べればわかるさ！カボスとスダチが「異色」タッグ…大分と徳島、知恵を絞って認知度アップ,https://news.yahoo.co.jp/articles/a47ef89ab853987bea5ca9f7d546d9d5c1ce78e5,10/14(土) 17:40
yom,５０代の男性巡査部長と女性一般職員、それぞれが「不倫」で本部長訓戒,https://news.yahoo.co.jp/articles/59d560634b6f472e31b0d1ede897d1bbcf496aad,10/14(土) 17:34
yom,「京阪京都交通」路線バスを減便、JR京都駅―亀岡駅など…運転手不足で,https://news.yahoo.co.jp/articles/8bae12745f60629dcb42b31afc86c9f8823c7306,10/14(土) 17:20
yom,「ど根性スイカ」御堂筋で育つ,https://news.yahoo.co.jp/articles/043c709f76a2335d3f9505723ef7cb1ccfae9d4e,10/14(土) 17:20
yom,箱根の夢に挑んだ、立命大コーチ「選手の人生変わるかも」…予選会関東外11校,https://news.yahoo.co.jp/articles/2ffcd672b3dde30b71e369bd03abfa3d4647b592,10/14(土) 17:20
yom,西鉄バス値上げで初乗り210円に…都市圏中心に来年1月、通勤・通学定期13種類も,https://news.yahoo.co.jp/articles/74bbcf138f13ba1e64afcbcee963c538e376f904,10/14(土) 17:10
yom,先制２ランのＤｅＮＡ宮崎「完璧に捉えることができた」…ＣＳファーストステージ先勝は広島,https://news.yahoo.co.jp/articles/e32a6512a74da8baa0ef8be548e60028a3879f88,10/14(土) 17:02
yom,日本人エースが引っ張った上位校は盤石、関東以外の学校には高かった壁…早大の「天才ランナー」竹澤健介さんが箱根予選会を振り返る,https://news.yahoo.co.jp/articles/51ee91337e70517864aa6474e5a279d198077f7e,10/14(土) 17:00
yom,箱根予選初出場の放送大関西、５５位…制限時間内ぎりぎりでフィニッシュ,https://news.yahoo.co.jp/articles/29cbc56996d917e8e68bfebda477126bd627bb9e,10/14(土) 16:55
yom,監督解任の立教大、チームトップ関口絢太「眠れない夜もあったがやるしかなかった」,https://news.yahoo.co.jp/articles/36637df2128e11ad2189988a07c2aea0a5a050b3,10/14(土) 16:53
yom,ツアー未勝利の平本世中が首位に、１打差２位に大槻智春…ゴルフ日本ＯＰ,https://news.yahoo.co.jp/articles/92804090cddcf03d26d88abffb91aa5f834920d8,10/14(土) 16:34
yom,熊本市が住民票の誤記1万8500件…8月のシステム更新時に、ほぼ1か月気付かず,https://news.yahoo.co.jp/articles/b1f8a135d3b865740d357d2f0b2dc3b7ea9b135a,10/14(土) 16:28
yom,箱根駅伝の予選会、厚かった「関東の壁」…門戸開放１１校中の最高は京都産業大の２７位,https://news.yahoo.co.jp/articles/cece8e7735622b70c43bd4a9a44413e07c50203e,10/14(土) 16:19
yom,ちゃんぽん好調でも、高騰する光熱費や材料費…リンガーハット中間決算2年連続の赤字,https://news.yahoo.co.jp/articles/f6b38364096bafaf3c1b34c369ad34127d1b860f,10/14(土) 15:57
yom,台湾企業の九州進出を支援する拠点を福岡に…台新国際商業銀行が出張所計画、認可出れば来春にも,https://news.yahoo.co.jp/articles/bb1d2dbce297ad8501b761f41d51b0a90ab53d94,10/14(土) 15:55
yom,九州・沖縄10月の景気判断据え置き「緩やかに回復」…4か月連続、個人消費は底堅く,https://news.yahoo.co.jp/articles/544a681deaf61b0f28e9e58af9ed631b24b522ae,10/14(土) 15:50
yom,熊本新工場に160億円、投資額を3倍増…半導体関連フェローテックHD「事業規模100億円に」,https://news.yahoo.co.jp/articles/aa38eec8e5ebbc893608e67db902d56d1832064b,10/14(土) 15:38
yom,九州・山口の流通5社が増収、個人消費は回復したが…光熱費高騰で3社は減益,https://news.yahoo.co.jp/articles/94e0c5776cded3ef96588f37e84280260295fbab,10/14(土) 15:31
yom,箱根駅伝予選会に出場した信州大「一生一度」駆けた夢、関東以外で唯一の国立大として出場,https://news.yahoo.co.jp/articles/7f68ba0b510b67c4826f52baeaaf4a54023b6dfa,10/14(土) 15:31
yom,コロナ禍でブームとなった無人店舗、いまは別の理由で拡大中…餃子から化粧品・書籍でも,https://news.yahoo.co.jp/articles/d656ecf072074d22c1338bf8da706755921f6baa,10/14(土) 15:30
yom,バレーV1・久光スプリングス「国体優勝の勢いで勝ち切る」…21日に佐賀市でリーグ開幕戦,https://news.yahoo.co.jp/articles/3ac26c27e54bcb87fc231fbb86cc23061c7ec061,10/14(土) 15:30
