media_en,media_jp,title_articles,link_articles,date_original
ybc,YBC山形放送,”地域の福祉活動に役立てて”　山形県内の自動車メーカーディーラーらが山新放送・愛の事業団に20万円寄託,https://news.yahoo.co.jp/articles/3dde9048510af65d2994839a0f88df6b518810e7,12/7(木) 12:16
ybc,YBC山形放送,山形県でインフル警戒レベル続く　患者の８割以上が20歳未満　県「マスクの着用・小まめな手洗い・換気などの徹底を」,https://news.yahoo.co.jp/articles/32b633cdb492e8174a1b5d622fbfec8dd7596530,12/7(木) 12:11
ybc,YBC山形放送,警察犬が投入され山狩りも　外国人の男が逃走　一緒にいた男はバールを隠し持っていて逮捕,https://news.yahoo.co.jp/articles/e4545297635d821ccc9cdd19a28bfbd93873832d,12/6(水) 17:56
ybc,YBC山形放送,土砂崩れに猛暑…　山形県内を襲った「自然災害」　カメラが見つめたやまがた2023,https://news.yahoo.co.jp/articles/3eee1324dbf3f77049ad352cb7398a6c70264abd,12/6(水) 17:36
ybc,YBC山形放送,軽トラックにはねられ13歳の男子中学生が大けが　酒田市内の県道交差点,https://news.yahoo.co.jp/articles/448c19d8d706a6e694dcd11b3c46dd5867a790a5,12/6(水) 17:21
ybc,YBC山形放送,「パリコレ」に出品された作品も　山辺町で「ニット議会」開催　地場産品をPR,https://news.yahoo.co.jp/articles/2c058a3df32a107d40ef8067d1b8fdda6f5a1f5f,12/6(水) 16:58
ybc,YBC山形放送,山形大学の学生たちが育てたカラフルニンジンを子供たちが収穫体験,https://news.yahoo.co.jp/articles/003e346bfba96c931439093cc896285f718b72ce,12/6(水) 16:55
ybc,YBC山形放送,バール1本を隠し持つベトナム国籍の男を逮捕　現場からもう1人の男が逃走中　付近住民に注意呼びかけ,https://news.yahoo.co.jp/articles/3dfbfc6a6a81fb59a9dc8071137271d1466926c1,12/6(水) 12:43
ybc,YBC山形放送,犯罪に関与した恐れのある東南アジア系の男性が警察官の職務質問に応じず走って逃走　警察「住民は家の鍵をかけて」,https://news.yahoo.co.jp/articles/97ce2082b0a5df1627c712bda2ab5abcf1630c0a,12/6(水) 9:12
ybc,YBC山形放送,区間運休続くJR米坂線　JRと自治体が事務レベルで復旧検討会議　早期復旧要望,https://news.yahoo.co.jp/articles/34344ba61cad713445c705f420fcf803cc6380fd,12/5(火) 18:33
ybc,YBC山形放送,横領した金は高級車やブランド品購入に　8600万円着服の元会社員の女に懲役6年求刑,https://news.yahoo.co.jp/articles/604ebf7277a2bea310bebd3be7e6491893c0491a,12/5(火) 18:28
ybc,YBC山形放送,里見女流王座の3連勝を加藤女流四段が阻止　天童市で女流王座戦第3局開催,https://news.yahoo.co.jp/articles/9f6426204fbc87d119011901e3e7d30cf24c053f,12/5(火) 18:27
ybc,YBC山形放送,モンテディオ山形　今シーズンの結果を吉村知事に報告　シーズンの秋春制「決めたことに従う」,https://news.yahoo.co.jp/articles/74711bed2b9ca01b489a4a27d3d49f8ee13b90ed,12/5(火) 18:19
ybc,YBC山形放送,山形市民会館の跡地を利活用　山形市が検討プロジェクトチームを来年度設置へ,https://news.yahoo.co.jp/articles/07c995ab3214bae80d747f732c79ae6d45a778e7,12/5(火) 18:19
ybc,YBC山形放送,山形県のご当地サーモン「ニジサクラ」のブランド化目指しワークショップ,https://news.yahoo.co.jp/articles/6c6197dbcf98607ca1e4b1dfa80eb118040f66ae,12/5(火) 18:19
ybc,YBC山形放送,「つや姫」じゃなかった！　「つや姫給食」として提供された学校給食のコメが「はえぬき」,https://news.yahoo.co.jp/articles/1e6894e7ed4d0d3a5c6adb4157347badcc231502,12/5(火) 13:48
ybc,YBC山形放送,猛暑に備えて　来年度は高温に強い県産ブランド米「雪若丸」の作付拡大方針　ことしの品質が低下受けて,https://news.yahoo.co.jp/articles/bb48ea948cb2a794d75dee3c533f3276333f7c88,12/5(火) 13:48
ybc,YBC山形放送,山形県が性的少数者に婚姻と同等の関係認める「パートナーシップ宣誓制度」を導入へ　来年１月から,https://news.yahoo.co.jp/articles/84d5aa9f9505224c5e7f5b6c8abea8b989c9042d,12/4(月) 18:19
ybc,YBC山形放送,「山形セレクション」の牛肉決まる　物価高騰で牛肉需要伸び悩み　高値をつけられず,https://news.yahoo.co.jp/articles/7b8005935620248475f7b8f6c208bff3c14db886,12/4(月) 18:18
ybc,YBC山形放送,住宅と車両2台が全焼した高畠町の火事　住宅中央部分の燃え方激しく　出火原因の特定には至らず,https://news.yahoo.co.jp/articles/0e4642b110907a1515165775d06a0c5efc57b006,12/4(月) 18:18
ybc,YBC山形放送,「プール」や「体育館」2つの「公園」も対象　酒田市がネーミングライツ初導入へ,https://news.yahoo.co.jp/articles/7ed84015fb881a4b2de8a7af8806a261fb11b73a,12/4(月) 18:06
ybc,YBC山形放送,民謡の山形県ナンバー1に「庄内草刈唄」歌った治部恵子さん　山形県民謡王座決定大会開催,https://news.yahoo.co.jp/articles/37092d74b8293315f049fcd1a50d9d6cda313b00,12/4(月) 13:13
ybc,YBC山形放送,餅を天井まで突き上げて…1年の収穫に感謝し来年の豊作願う380年の伝統「裸餅つき」　山形・米沢市,https://news.yahoo.co.jp/articles/018e4229f49864b1906be09314b25f8cc3e1e4d9,12/4(月) 13:02
ybc,YBC山形放送,山形市で初の道の駅「やまがた蔵王」がオープン,https://news.yahoo.co.jp/articles/879f487df20953582bb6595672ddd4e0087f3ff7,12/3(日) 19:30
ybc,YBC山形放送,おばあちゃんの手作り服のファッションショー　ランウエイを颯爽と「孫と一緒に歩けた」,https://news.yahoo.co.jp/articles/c625bc2d5af866cde2914d17748c570521270c05,12/3(日) 12:42
ybc,YBC山形放送,高畠町で住宅火災1棟全焼　1人が軽傷・山形,https://news.yahoo.co.jp/articles/bea50c5e9ab91ccd30dad381b3225e14cb49b150,12/3(日) 12:37
ybc,YBC山形放送,V1女子アランマーレ初勝利ならず9連敗　トヨタ車体相手に３−１で敗北,https://news.yahoo.co.jp/articles/48846be293c61b5115591c98df62ec51285315f1,12/2(土) 17:47
ybc,YBC山形放送,全日本エアロビックフェスティバルに500人　仮装エアロビックも　参加者「ひたすら楽しい」　最高齢は89歳,https://news.yahoo.co.jp/articles/34b804fb62f47b53b737ba39fd9d5bbfe679e7d7,12/2(土) 17:44
ybc,YBC山形放送,山形県内レギュラーガソリン180.4円／L　5週連続値上がり　灯油は全国4番目の安さ,https://news.yahoo.co.jp/articles/c51ddb739eacc64f804fa6f95bc73adcb618b5c3,12/2(土) 11:55
ybc,YBC山形放送,蔵王にスキーシーズン到来！蔵王温泉スキー場がプレオープン　　スキーヤー「雪質すごくいい」　約50センチの積雪,https://news.yahoo.co.jp/articles/c138eb8b890828c52f4bd28e8863e7961e7a75e3,12/2(土) 11:52
ybc,YBC山形放送,講師の派遣がなくなっても尾花沢市に委託料請求　スポーツクラブ運営のNPO法人が不正受給,https://news.yahoo.co.jp/articles/081ca6afa327bb112891dac263559b23b6adfc15,12/1(金) 18:42
ybc,YBC山形放送,山形市初の道の駅「やまがた蔵王」プレオープン　手ぶらで芋煮会体験も　観光や防災の拠点,https://news.yahoo.co.jp/articles/957ac1145aef8bb73edd9b776b9197cd07573b41,12/1(金) 18:10
ybc,YBC山形放送,山形県内の一等米比率47.4％　　猛暑の影響で過去最低　吉村知事「厳しい状況」,https://news.yahoo.co.jp/articles/a236949ae5822a4b640572eea0e4dce62d3cb638,12/1(金) 18:09
ybc,YBC山形放送,来年度開校の中高一貫校・致道館の志願倍率は2.21倍　山形県立中学校の入試,https://news.yahoo.co.jp/articles/2b3621f2c37ef41267a6e342ee990cf9d5cbde83,12/1(金) 17:50
ybc,YBC山形放送,「お金の知識学べた」山形市の高校生が中央銀行の役割など学ぶ　日銀のオンライン授業,https://news.yahoo.co.jp/articles/7f39e8b6bd3874d131bd15dd99c8f04aa2563cbe,12/1(金) 17:44
ybc,YBC山形放送,笑いと元気を届ける　三刀流で活躍する女子大学院生　ミス花笠にアマチュア落語家,https://news.yahoo.co.jp/articles/a51c006e53f7d3775f2c6eac4529d8b552885438,12/1(金) 17:35
ybc,YBC山形放送,警察の通信設備の維持管理　高所での作業の転落事故を防ぐ研修会開催　東北管区警察局,https://news.yahoo.co.jp/articles/c713b43b006830962a326b19234294e4cc22dc0d,12/1(金) 17:28
ybc,YBC山形放送,知人男性の頭をくわで殴る　殺人未遂の疑い　米沢市の86歳の男を送検,https://news.yahoo.co.jp/articles/c837ee995cb548457d655e6e8d552f97f90c1ac1,12/1(金) 12:35
ybc,YBC山形放送,一年の汚れを落として新年を迎えたい　鶴岡市の出羽三山神社で師走恒例の「すす払い」,https://news.yahoo.co.jp/articles/83af01ab5129656e2c0e025002c11036115410ce,12/1(金) 12:33
ybc,YBC山形放送,卒業式で身に付けるコサージュづくりに向けて　中学生が紅花染めを体験,https://news.yahoo.co.jp/articles/8686d15d331500a79e08da6ab293f33339953e50,12/1(金) 12:01
ybc,YBC山形放送,民話の伝承活動に取り組む「新庄民話の会」に社会貢献者表彰　東京都内で表彰式,https://news.yahoo.co.jp/articles/94a28a3fdc01d07d9d91addbf63675b834c2dd90,11/30(木) 20:37
ybc,YBC山形放送,減産方針から5年ぶり転換　県産主食用米の来年の生産量　ことしと同水準の31万6100トンに,https://news.yahoo.co.jp/articles/6cb4aab7077673dc24c0c022a372d854e890a965,11/30(木) 20:19
ybc,YBC山形放送,「車間距離を十分に取って」　高速道路パーキングエリアで冬タイヤの装着と安全運転を呼びかけ,https://news.yahoo.co.jp/articles/7f2bad139162d9b87ac70a49d4acd33af6643b6c,11/30(木) 20:15
ybc,YBC山形放送,厳しい冷え込みとなった県内　平地でも本格的な積雪に　1日にかけて特に庄内で注意を,https://news.yahoo.co.jp/articles/d9fd71fc528c7dc80e9cd03d6f23cad633a08b34,11/30(木) 20:09
ybc,YBC山形放送,スキー場　オープンに向けた作業が急ピッチ　「まだ足りない」積雪増加を期待,https://news.yahoo.co.jp/articles/6b93a6ea77528b461c2572bcadc65bf5c6948f4e,11/30(木) 20:05
ybc,YBC山形放送,くわで頭部を殴打　被害男性が語る状況　米沢市の86歳の男を殺人未遂の疑いで逮捕,https://news.yahoo.co.jp/articles/ac1961c490e4da225277bd4aeff1c1ea206f33e4,11/30(木) 19:55
