media_en,media_jp,title_articles,link_articles,date_original
ibciwatev,IBC岩手放送,ふるさと納税返礼品の「そうめん」にも“カビ毒”検出の小麦を使用　岩手・花巻市が発送取りやめ　寄付金392万円あまりを返還へ,https://news.yahoo.co.jp/articles/98dc1b0156f90cedae0d7fa2ae979dfa2db23991,12/7(木) 12:48
ibciwatev,IBC岩手放送,二十四節気「大雪」　岩手県内は穏やかな朝に　盛岡の寺院に「シキザクラ」の可憐な花,https://news.yahoo.co.jp/articles/ad3dbdcf88111cdfe7dd73f4dd1aa6d70c3de971,12/7(木) 12:04
ibciwatev,IBC岩手放送,ひき逃げなどの容疑で宮城県の65歳の男を逮捕　軽乗用車で原付バイクに衝突しそのまま走り去った疑い　バイクの女性が重傷　岩手・一関市,https://news.yahoo.co.jp/articles/89ba15dcb1d2a58efca45b6c8719394575d782c7,12/7(木) 10:48
ibciwatev,IBC岩手放送,"サンマの水揚げ量は去年の1.22倍の4,180トン　岩手県・11月末現在　大船渡が本州トップの3,770トン　小ぶりのもの多く金額は減少",https://news.yahoo.co.jp/articles/e4fe5b2d5ea43e0b59c924981f942c885eacffd2,12/7(木) 10:06
ibciwatev,IBC岩手放送,時が止まった被災跡地〜四輪車のオフロード走行で活気を!　Uターン男性が土地活用しコースを整備　岩手・大船渡市【復興への羅針盤】,https://news.yahoo.co.jp/articles/b49e0bcc326bd1f127101ec6055200ec44595358,12/7(木) 9:38
ibciwatev,IBC岩手放送,敷地内にクマが出没する時計工場　遭遇に備えて従業員が研修　スプレーや花火の使用方法学ぶ　岩手・雫石町,https://news.yahoo.co.jp/articles/c862db37ca5a1d348414af57be037e2a20f8a8c0,12/6(水) 19:02
ibciwatev,IBC岩手放送,岩手県遊技業協同組合から福祉施設へ贈呈　正月の年賀シール貼り作業への賃金と支援金　飲料3万本を準備,https://news.yahoo.co.jp/articles/a0c68bd487a109dc8f7f1c0934e4c8ad881d1fb5,12/6(水) 19:02
ibciwatev,IBC岩手放送,焼け跡から見つかった遺体は8歳の男子小学生　岩手・盛岡市の住宅火災　身体的特徴から身元を特定,https://news.yahoo.co.jp/articles/35a2bd9fc2b192b05a7e79e82facfa61e0bd1f65,12/6(水) 18:34
ibciwatev,IBC岩手放送,陸前高田市立高田第一中学校27人り患し2年生が学年閉鎖　インフルエンザで7つの小中学校・幼稚園で休業措置　去年1件に対して今季延べ277件　岩手,https://news.yahoo.co.jp/articles/a4ff48f46045686e0548cece962ceefc42ded4b1,12/6(水) 17:51
ibciwatev,IBC岩手放送,インフルエンザ患者が11週連続で増加　岩手県　奥州、宮古、盛岡市など6保健所管内で「警報」レベル　新型コロナ患者も2週連続増,https://news.yahoo.co.jp/articles/cd63339123ba37899d36ef2c606d70fd52da4718,12/6(水) 17:24
ibciwatev,IBC岩手放送,岩手県内のレギュラーガソリン　1リットル169.6円　2週連続で値上がり,https://news.yahoo.co.jp/articles/5820d22310ff9f3bafc14a6c295834f866da0637,12/6(水) 17:16
ibciwatev,IBC岩手放送,将棋の藤井聡太八冠　対局が幻となった秋田・大仙市を満喫　地元在住の俳優・柳葉敏郎さんも歓迎　名物「刈和野の大綱引き」を紹介　ご当地グルメ「オープンカツ」にも舌鼓,https://news.yahoo.co.jp/articles/7894804ff0bf41debd49f76eb7899cc9a21d509b,12/6(水) 16:51
ibciwatev,IBC岩手放送,「せんべい汁」食べた仙台市の児童13人が体調不良　岩手・北上市や東京・杉並区の給食にも使用が判明　“カビ毒”が検出された岩手県産の「ナンブコムギ」,https://news.yahoo.co.jp/articles/bfa7404f01280a2b49c831f5f8078a7658241bb5,12/6(水) 16:16
ibciwatev,IBC岩手放送,「手堅く運用したい人に魅力的」　利率0.359％で国債の+0.1％　7日販売開始の岩手県個人向け地方債「わんこ債」　購入は1万円単位,https://news.yahoo.co.jp/articles/1923b34df2ee78059ee84f373b2ac7a747154e15,12/6(水) 16:12
ibciwatev,IBC岩手放送,盛岡のメーカーが出品した地ビールが世界1位の評価獲得　ドイツで行われた国際コンクール　創業20周年に栄冠,https://news.yahoo.co.jp/articles/18bebd2cc4c23cc9e25bc4c38d0c52d9fc185e6c,12/6(水) 15:53
ibciwatev,IBC岩手放送,3月に計画するクマの捕獲で1頭当たり8000円の報奨金を猟友会へ　岩手県が人身被害対策で600万円の補正予算案　ほか中小企業の賃上げ支援も,https://news.yahoo.co.jp/articles/26e25c0930f31636ca530d12d56f411e6101d123,12/6(水) 14:51
ibciwatev,IBC岩手放送,運送会社の岩手営業所を2時間あまり家宅捜索　八戸道でのトラック脱輪死亡事故で青森県警　資料を押収　岩手・矢巾町,https://news.yahoo.co.jp/articles/16bc160ed53ab125ebfe93ec593cbb147bc44490,12/6(水) 14:27
ibciwatev,IBC岩手放送,さすまたや買い物カートで取り囲む　ショッピングセンターで防犯訓練　万引き犯が従業員を切り付けた想定　盛岡市,https://news.yahoo.co.jp/articles/64198202c756b589aee5381aff913d487e8f5907,12/6(水) 12:06
ibciwatev,IBC岩手放送,「生活保護ホットライン」6日開設　弁護士が電話で相談受け付け　昨年は「灯油代が高く厳しい」など岩手県で19件の相談,https://news.yahoo.co.jp/articles/17396982375df6518a59cc88adbb7011855e9258,12/6(水) 12:04
ibciwatev,IBC岩手放送,6日水揚げ分から殻付き販売可能に　今年5月以来7か月ぶりのホタテガイ出荷自主規制解除も岩手県3海域は継続中,https://news.yahoo.co.jp/articles/386e3ecd754ffafe5ac49d950b14bf98e285171f,12/5(火) 20:34
ibciwatev,IBC岩手放送,「趣があって対局場として素晴らしいところ」　将棋の藤井聡太八冠が秋田・大仙市に　“幻の”竜王戦第6局会場を訪問　市民が大歓迎,https://news.yahoo.co.jp/articles/3edc93b998f6148598b3db32c817a225aeb1cb69,12/5(火) 19:27
ibciwatev,IBC岩手放送,来年2月が最後に・・・裸の男たちによる炎の祭り「黒石寺蘇民祭」が1000年以上の歴史に幕　担い手不足を理由に　岩手・奥州市　市民からは驚き・惜しむ声,https://news.yahoo.co.jp/articles/b9ebacbab4af4d545d1dca607032248938ed9d7f,12/5(火) 19:24
ibciwatev,IBC岩手放送,インバウンド意識し洋室化など〜観光庁の支援事業で施設改修　花巻温泉郷の9事業者　岩手,https://news.yahoo.co.jp/articles/ef943ed99d41fcaf2c817396f35eec781e4cec02,12/5(火) 19:21
ibciwatev,IBC岩手放送,木を狙った方向へ切り倒すには〜39歳以下の16人が参加　林業の技術向上へ若手対象に講習会　岩手・矢巾町,https://news.yahoo.co.jp/articles/7eb61f079c182862f0cea655221dfeeaa6e37403,12/5(火) 19:21
ibciwatev,IBC岩手放送,クレーンを操作し鋼材をトラックに積んでいた男性（32）運んでいた鋼材に挟まれ死亡　岩手・盛岡市,https://news.yahoo.co.jp/articles/2d06aa0e54a232ba19f1224a96b914330048cc5a,12/5(火) 18:02
ibciwatev,IBC岩手放送,一関市立山目小学校111人り患し複数の学年閉鎖　休業措置が2日連続20件超え岩手県内インフルエンザ猛威続く　今季延べ270件,https://news.yahoo.co.jp/articles/4dbd0186177ea467ec9ade16ccc40c1658584bd1,12/5(火) 17:54
ibciwatev,IBC岩手放送,岩手での12月の人身被害は8年ぶり　市営住宅の駐車場で40代男性がクマに襲われる　頭や背中にけが　大船渡市,https://news.yahoo.co.jp/articles/56aa8db15b156b2f66af7044c205bcecfb71ffc6,12/5(火) 16:01
ibciwatev,IBC岩手放送,「氷点下4度以下は対策を」　ショッピングモールで市が水道凍結防止キャンペーン　水抜きの実演も　盛岡市,https://news.yahoo.co.jp/articles/0c9ea16ee7523fc4ac83df82cfa4c9763c493c90,12/5(火) 15:51
ibciwatev,IBC岩手放送,オーストラリアの旅行会社招き「みちのく潮風トレイル」をPR　人気高まる“歩く旅”　夕暮れの浄土ヶ浜を堪能　岩手・宮古市,https://news.yahoo.co.jp/articles/d7329dc492910d53413733ebdf0a12c73e75b5d4,12/5(火) 13:16
ibciwatev,IBC岩手放送,過去にはポスター巡り騒動も　1000年以上続く奇祭「黒石寺蘇民祭」が来年2月で終了　深刻な担い手不足が要因　岩手・奥州市,https://news.yahoo.co.jp/articles/e535d156f9537053787c326ff2a5ac345087bb58,12/5(火) 13:03
ibciwatev,IBC岩手放送,隊員2人を懲戒処分　同僚のワイヤレスイヤホン盗んだ26歳の男性3曹は免職、同僚の尻や胸を触った19歳男性陸士長は停職6か月　陸上自衛隊秋田駐屯地,https://news.yahoo.co.jp/articles/56c68854d52f383d9d378cd3e8be50475fcf0408,12/5(火) 12:31
ibciwatev,IBC岩手放送,新型コロナ関連が3件　11月の岩手県内企業倒産は7件で負債総額20億9300万円　「中小・零細企業で倒産傾向の勢い強まる」,https://news.yahoo.co.jp/articles/c9cbb212409bfbeeedec001f6ec4e30bdac80761,12/5(火) 10:31
ibciwatev,IBC岩手放送,12月に入っても人身被害相次ぐ　クマに襲われ40代男性が頭にけが　岩手・大船渡市,https://news.yahoo.co.jp/articles/150b625c0420acaaa363e0b75c4fd66c793a92ea,12/5(火) 10:19
ibciwatev,IBC岩手放送,家族5人が暮らす住宅で火事　性別不明の2人の遺体が見つかる　小6の長女（12）と短大生の長男（20）が連絡取れず　秋田・鹿角市,https://news.yahoo.co.jp/articles/4e2bef97075cb3e0795e545404a0fcbe399c31bc,12/5(火) 10:03
ibciwatev,IBC岩手放送,地元住民・商店主が盛岡市長に要望　「新庁舎は内丸地区で」　存続の危機が訪れると訴え,https://news.yahoo.co.jp/articles/fe8ea96883ce2b2c69021d68870e3aafec56eca4,12/4(月) 19:19
ibciwatev,IBC岩手放送,八戸道トラック脱輪事故で運送会社の岩手営業所を「立ち入り監査」　東北運輸局　タイヤぶつかった32歳の男性死亡,https://news.yahoo.co.jp/articles/34fd51fb8fc5be212b4a2dee568ad9c096267663,12/4(月) 19:19
ibciwatev,IBC岩手放送,台湾の高校生が雫石高校に　教育旅行誘致活動が実を結ぶ　折り紙、ダンスで交流し互いの文化を知る　岩手,https://news.yahoo.co.jp/articles/7ad27286845b431382e7cb0336dba92c2d059f33,12/4(月) 19:16
ibciwatev,IBC岩手放送,金ケ崎町立金ケ崎中学校117人がり患し6日まで学校閉鎖　インフルエンザで20施設が休業措置　今季延べ247件　岩手,https://news.yahoo.co.jp/articles/f7ab92f3193d98a3c423237ba0feaba2874b11d8,12/4(月) 18:06
ibciwatev,IBC岩手放送,大船渡保健所管内の教育・保育施設でノロウイルスによる感染性胃腸炎の集団発生　園児と職員計28人が嘔吐や下痢の症状　全員回復傾向　岩手,https://news.yahoo.co.jp/articles/41dd63fba2b1348398cbc18280fdd97f7c6ee108,12/4(月) 17:24
ibciwatev,IBC岩手放送,宿泊型サービスやタクシー代補助など「産後ケア」の充実を〜サポート団体が県議会に請願　岩手,https://news.yahoo.co.jp/articles/f7d919b978720cb71f57ae85fe1ce0aec373d093,12/4(月) 15:54
ibciwatev,IBC岩手放送,「ご迷惑をおかけしている」と市長が陳謝　生活保護費障害者加算の認定誤りで過払い60年近く続いた可能性も　返還求めた受給66世帯中37世帯が応じる　盛岡市,https://news.yahoo.co.jp/articles/4482f1e74954ba1c8ad1b5e9a262ba1413dffb8a,12/4(月) 13:57
ibciwatev,IBC岩手放送,「なもみ」も登場　三陸鉄道の冬のイベント列車をPR　“食”も魅力の「こたつ列車」、「洋風こたつ列車」　今季の運行開始へ,https://news.yahoo.co.jp/articles/af27ee83d1274491279fdf56fdda3df0d36b6422,12/4(月) 12:09
ibciwatev,IBC岩手放送,いわてグルージャ盛岡がシーズン終了の報告会　今季J3で10位　サポーターにJ2復帰を誓う,https://news.yahoo.co.jp/articles/4dc4fa36f015791aae212c41e7367113a7140bdb,12/4(月) 12:06
ibciwatev,IBC岩手放送,変則サーブに強烈スマッシュ!　全国大会切符目指して子どもたちが躍動　小学生の卓球大会　岩手・矢巾町,https://news.yahoo.co.jp/articles/71e43d48901904f08943b535c12c75b9de8e78c1,12/3(日) 21:54
ibciwatev,IBC岩手放送,最大クラスの津波被害想定受け沿岸で初開催　自主防災組織のリーダー養成講座　岩手・久慈市,https://news.yahoo.co.jp/articles/56ae073a78804e87ad8e171cd3efc03f520a36f6,12/3(日) 18:19
ibciwatev,IBC岩手放送,学校給食でせんべい食べた児童生徒に下痢の症状　カビ毒検出で自主回収中の岩手県産小麦が原料　因果関係は不明,https://news.yahoo.co.jp/articles/ff96b7b7b1763c45bee965d530bca0236a50e7f1,12/3(日) 18:17
ibciwatev,IBC岩手放送,スコップを取りに小屋へ　寝ていたクマと鉢合わせ襲われる　64歳男性が腕にけが　岩手・北上市,https://news.yahoo.co.jp/articles/1f4cabe201e84cd8f7e00c5c5557433923e7ab1c,12/3(日) 17:18
ibciwatev,IBC岩手放送,岩手ビッグブルズが新潟に2連勝!　キャプテン横川、マーティンが躍動　バスケットボールB2リーグ,https://news.yahoo.co.jp/articles/c864ae00dfd082db69202e692f90915e26e2e5c8,12/3(日) 17:08
ibciwatev,IBC岩手放送,コンビニの店主に包丁を突きつけ「強盗だ」　強盗未遂の疑いで57歳無職の男を逮捕　岩手・二戸市,https://news.yahoo.co.jp/articles/861922b4cd0ec75c33c61894d2b789f699cee1f8,12/3(日) 17:03
ibciwatev,IBC岩手放送,秋田市向浜で釣りをしていた男性が行方不明　海中に転落か　岸壁で自家用車が見つかる,https://news.yahoo.co.jp/articles/4d9d1a4b6a1ff219300997a5b84a963b5a6fb695,12/3(日) 12:16
ibciwatev,IBC岩手放送,ハートフルな熱演が観客を魅了　初冬の風物詩「盛岡文士劇」　23人の文化人が出演　岩手・盛岡市,https://news.yahoo.co.jp/articles/9a784839e83e4afe1d7d8593b89d95949d1d69f7,12/3(日) 12:02
ibciwatev,IBC岩手放送,初戦から東北対決!　黒沢尻工業は仙台育英と初戦　全国高校ラグビー組み合わせ決まる,https://news.yahoo.co.jp/articles/ac1fd67d188be133f147cc2c9efce0d8b9a2da42,12/3(日) 12:02
ibciwatev,IBC岩手放送,芳醇な香りが会場を包む　葛巻町特産のワインの新酒をお披露目　パーティーで参加者が味わう　岩手・盛岡市,https://news.yahoo.co.jp/articles/3d903ec803933aa8635e42d08a9bda92d917a77c,12/2(土) 21:54
ibciwatev,IBC岩手放送,日本製鉄釜石シーウェイブスが出陣式　ディビジョン1への昇格目指す新シーズン開幕へ　岩手・釜石市,https://news.yahoo.co.jp/articles/91a5810b5ca740391429b6e610af5026824fdd8e,12/2(土) 18:02
ibciwatev,IBC岩手放送,「北限のユズ」今年最後の収穫　復興の象徴へ、様々な商品に　豊作で予想上回る収量　岩手・陸前高田市,https://news.yahoo.co.jp/articles/b10279349a229b87dd0b420bd9184800527a2010,12/2(土) 17:59
ibciwatev,IBC岩手放送,いわてグルージャ盛岡　試合終了間際の劇的弾で最終戦を勝利で飾る　10位で今シーズンを終える　サッカーJ2,https://news.yahoo.co.jp/articles/8d527faa00bd111999c444dc1fb75302783d7f05,12/2(土) 17:36
ibciwatev,IBC岩手放送,側溝の中に衣服を着けていない男性の遺体　腐敗が進み顔の判別できず　警察が事件性の有無を捜査　秋田市,https://news.yahoo.co.jp/articles/051cd45ca0c2074ed02bfb38aa52733586f1c400,12/2(土) 14:33
ibciwatev,IBC岩手放送,【速報】黒沢尻工業（岩手）の初戦は仙台育英（宮城）との東北対決　全国高校ラグビー大会,https://news.yahoo.co.jp/articles/352c910461beb4fa9aa92f451d633f00390d486c,12/2(土) 14:03
ibciwatev,IBC岩手放送,歩道のない県道を歩行中の男性がはねられ死亡　警察が軽ワゴン運転の男性から事情聴く　岩手・二戸市,https://news.yahoo.co.jp/articles/6a7683297f91bff2f5901e55efdef45b8d3a7ed6,12/2(土) 8:38
ibciwatev,IBC岩手放送,冬の街に光あふれる　「もりおかイルミネーションブライト」始まる　中心部7か所に計15万個の電球　2月29日まで,https://news.yahoo.co.jp/articles/95759b58761567aaf55dc3886cb6bb03074b390d,12/1(金) 19:17
ibciwatev,IBC岩手放送,盛岡八幡宮で破魔矢づくり　作業時期分散させ縁起物製作は7月上旬から　三が日の混雑緩和図り販売も開始　岩手,https://news.yahoo.co.jp/articles/f8670db5c4b3b0d8ee1fe3269eca751e8aacc764,12/1(金) 19:14
ibciwatev,IBC岩手放送,盛岡で全日本選抜スピードスケート競技会　国内トップクラスの選手が屋外リンクで熱戦,https://news.yahoo.co.jp/articles/da11d5a2e606c7b29c7e94727bfafe42d2b54ef9,12/1(金) 19:12
ibciwatev,IBC岩手放送,矢巾町立不動小学校54人り患で学年閉鎖　インフルエンザで小中学校7施設が休業措置　今季延べ227件　盛岡は発表なし　岩手,https://news.yahoo.co.jp/articles/6e12aadb788a31a36aa9f22423f3fc6fa1103a2f,12/1(金) 17:46
ibciwatev,IBC岩手放送,盛岡地域の電子マネー「MORIO Pay」　20％還元キャンペーンに合わせスーパーに無人チャージ機設置　利用拡大図り31日まで,https://news.yahoo.co.jp/articles/f2930454cb322de9bf7646c25e9c2b18a9501990,12/1(金) 15:53
ibciwatev,IBC岩手放送,中小企業のデジタル化を後押し　金融機関とソフトウエア開発会社が連携協定　盛岡市,https://news.yahoo.co.jp/articles/bf31887365a5723cbc2dd8f22293d970b2f09062,12/1(金) 15:51
ibciwatev,IBC岩手放送,大谷翔平選手が「エドガー・マルティネス賞」受賞　3年連続の“最優秀指名打者”に,https://news.yahoo.co.jp/articles/497013aad7a986d916519ff2f4c423a77d2d67d7,12/1(金) 14:21
ibciwatev,IBC岩手放送,1743年開湯　根強いファン持つ松川温泉の「松楓荘」　運営会社が破産申請へ　新型コロナの影響受け　岩手・八幡平市,https://news.yahoo.co.jp/articles/280d51f38dba24687960fa572b2db039578c862e,12/1(金) 12:51
ibciwatev,IBC岩手放送,裁判所の「石割桜」が冬の装いに　国の天然記念物に恒例の“雪囲い”　盛岡市,https://news.yahoo.co.jp/articles/1b42d0a4ecba439cae8171415da7c0543709ad8d,12/1(金) 12:04
ibciwatev,IBC岩手放送,乗用車のサイドミラーが背中にぶつかり転倒　自転車の男性（63）が死亡　盛岡市の県道,https://news.yahoo.co.jp/articles/f6d99adf8b3763fa0797ec9138022a1131c81ffa,12/1(金) 10:57
ibciwatev,IBC岩手放送,来季J3昇格圏ならJ2入り可能に　サッカー・いわてグルージャ盛岡　スタジアム整備計画案は提出期限が2025年6月へ1年延長,https://news.yahoo.co.jp/articles/7dff047a069166fcfbff4900829e13d92b7e299d,11/30(木) 19:16
ibciwatev,IBC岩手放送,高校の正門にクリスマスツリー登場　高さ5メートルのドイツトウヒ　4年ぶりの点灯式に100人　盛岡市,https://news.yahoo.co.jp/articles/8d48fd3fe7a3ae3f8b22471be5be2561d6a2bfd7,11/30(木) 19:16
ibciwatev,IBC岩手放送,1日から盛岡で全日本選抜スピードスケート競技会　地元・熊谷萌選手らが前日練習　164人がエントリー,https://news.yahoo.co.jp/articles/405cf4e3727f1aedfeb0efe0509a589aae292015,11/30(木) 19:16
ibciwatev,IBC岩手放送,盛岡市役所の新庁舎　「用地選定から10年で供用開始」　市が整備審議会に示す　市民説明会の結果も報告,https://news.yahoo.co.jp/articles/8a6d514b16f478f5d27186aa3c25458ec7f980b0,11/30(木) 19:12
ibciwatev,IBC岩手放送,岩手県内でインフルエンザの猛威続く　3つの小学校と専門学校の合わせて4施設で閉鎖措置,https://news.yahoo.co.jp/articles/f80a564fc8268404b02eb9fc65d191a97624d994,11/30(木) 18:16
ibciwatev,IBC岩手放送,岩手県内ナンバーの冬タイヤ装着率は100％　国交省が雫石町と岩手町の道の駅で270台を調査　雪の季節到来,https://news.yahoo.co.jp/articles/464089a95012e91807c2f2aa6231cac1d71a2e05,11/30(木) 16:14
ibciwatev,IBC岩手放送,ネコの“多頭飼育崩壊”　問題解決へNPO理事長が講演　「飼い主への声がけも重要」　岩手・花巻市,https://news.yahoo.co.jp/articles/bffe8db78d79662e94309009eb60f54c7b97faa4,11/30(木) 15:54
ibciwatev,IBC岩手放送,東北の夏祭りをボトルにデザインした紅茶の売り上げから　　大手飲料メーカーが岩手県に寄付　観光振興に活用,https://news.yahoo.co.jp/articles/c3c3a3211e075f36d0759667e25b792b2319214f,11/30(木) 15:53
