media_en,media_jp,title_articles,link_articles,date_original
gifuweb,岐阜新聞Ｗｅｂ,金の破魔矢、金運射止めて　岐阜市・金神社で制作「昇り竜のように縁起よく」,https://news.yahoo.co.jp/articles/6b9e44caa23528da708e0808d6a9904777206cee,12/5(火) 10:31
gifuweb,岐阜新聞Ｗｅｂ,クリスマスケーキ以外の選択肢　シュトーレン→育つ味、変化味わう／聖夜のお菓子→目でも楽しむ和菓子,https://news.yahoo.co.jp/articles/1faecc3eb78677c6e601881a807263fdb5da5f5a,12/5(火) 10:21
gifuweb,岐阜新聞Ｗｅｂ,湯けむりトキメキ幻想郷　下呂温泉花火ミュージカル冬公演、雪の結晶あんどん登場,https://news.yahoo.co.jp/articles/489e1f5580df5ab8a030c4bafde56406835f6309,12/5(火) 9:43
gifuweb,岐阜新聞Ｗｅｂ,不登校経験の生徒支援「学びの多様化校」準備　岐阜・北方町、授業時間数減らし個別進度に合わせ進行,https://news.yahoo.co.jp/articles/d4823ab73f03a7fab28b38c8840cd608403e8eaa,12/5(火) 9:06
gifuweb,岐阜新聞Ｗｅｂ,ＰＦＡＳ血液検査、住民９割が米指針値超す　岐阜・各務原市の三井水源地「急性の影響可能性ほぼない」,https://news.yahoo.co.jp/articles/61290e8ab00b0d0312dd6da65f51eb8f6e238a44,12/5(火) 8:42
gifuweb,岐阜新聞Ｗｅｂ,線路内で特急ひだと接触、７６歳男性が重傷　ＪＲ高山線、乗員乗客けがなし,https://news.yahoo.co.jp/articles/46c153b18dbd8b4a6c307bcc5cd737f13de8285c,12/5(火) 8:21
gifuweb,岐阜新聞Ｗｅｂ,金華山「めい想の小径」で滑落、８３歳けが　岐阜県警ヘリで搬送,https://news.yahoo.co.jp/articles/acbcfe42b8373f94a2ff6b7d099c074eed60c7a1,12/5(火) 8:02
gifuweb,岐阜新聞Ｗｅｂ,戸部北方町長、３選出馬表明　１７年ぶり選挙戦見通し,https://news.yahoo.co.jp/articles/9289a2c6330d0ef3f723af1665197b2930eabab2,12/5(火) 7:27
gifuweb,岐阜新聞Ｗｅｂ,ゴルフコンペ参加の町議辞職、虚偽報告で議会を欠席　１２月分の議員報酬と期末手当は支払いへ,https://news.yahoo.co.jp/articles/986ed0135aeafe209c3c992d146ec41bcf938472,12/4(月) 22:12
gifuweb,岐阜新聞Ｗｅｂ,サツキマス昨年「市場入荷３匹」長良川産激減で放流場所１９年ぶり見直し　河口堰→岐阜市、遡上回復へ,https://news.yahoo.co.jp/articles/860e27d9b31065c2e10713a7d88f24dbb15a5790,12/4(月) 10:02
gifuweb,岐阜新聞Ｗｅｂ,湯上がりに冬空花火、下呂温泉花火ミュージカル開幕　温泉街にはイルミネーションも,https://news.yahoo.co.jp/articles/30489c43f6144669e4d212784bd8ca6fdbbac0f7,12/4(月) 9:41
gifuweb,岐阜新聞Ｗｅｂ,お肉味わうバスツアー、博士も随行「見分け方や部位の解説」　ＪＲ岐阜駅発着、買い物や飛騨牛ランチ,https://news.yahoo.co.jp/articles/1404ddc013197f0cb32497d150ce7b8328549e9d,12/4(月) 9:27
gifuweb,岐阜新聞Ｗｅｂ,災害史の重要な場所「畚場」岐阜・安八町の難読地名　９・１２豪雨で長良川の堤防決壊,https://news.yahoo.co.jp/articles/6ec0e8d2167b93f45ac392250762c17bcba356d1,12/4(月) 9:04
gifuweb,岐阜新聞Ｗｅｂ,祭りは人を健康にする？岐阜大と東京芸大チームが調査へ「日本変える可能性」　高山市民を１０年間検証,https://news.yahoo.co.jp/articles/ba31ef70639db899dfe946de3fc9577d52c1e428,12/4(月) 8:46
gifuweb,岐阜新聞Ｗｅｂ,消えゆく渡船、橋建設で廃止可能性も　岐阜県内は２カ所のみ、江戸時代から続く交通手段,https://news.yahoo.co.jp/articles/ef2847e52dda5762f16701fb4ba5eea2c2f45d4b,12/4(月) 8:26
gifuweb,岐阜新聞Ｗｅｂ,リニア残土用地、ＪＲ東海が搬入候補１カ所取得　岐阜・御嵩町長「自社用地、全否定は困難」,https://news.yahoo.co.jp/articles/45f9386c0816b0caafa03c70d87da5bdd93c4a48,12/4(月) 7:57
gifuweb,岐阜新聞Ｗｅｂ,岐阜県博物館でクリスマスナイトミュージアム　恐竜骨格標本をライトアップ　大きな影「出た〜」,https://news.yahoo.co.jp/articles/b0cd4e132bc896ec757d4922bb01d21a61b3030f,12/3(日) 20:25
gifuweb,岐阜新聞Ｗｅｂ,【３日の岐阜スポ速報】バスケB３スゥープスが大勝　バレーV２リオレーナは敗れ６連勝ならず,https://news.yahoo.co.jp/articles/470eae89fbb579d32e173da1dabef7a0893ff584,12/3(日) 17:26
gifuweb,岐阜新聞Ｗｅｂ,Ｊリーグ　名古屋ＶＳ柏試合開始４５分遅れ　事故の影響,https://news.yahoo.co.jp/articles/37817e0fffd1470ebffe3801f71cfa3127bf0ac6,12/3(日) 16:27
gifuweb,岐阜新聞Ｗｅｂ,ＪＡぎふ５連勝、熊本に３−２で競り勝つ　バレーＶリーグ２部,https://news.yahoo.co.jp/articles/50b0626a89d70d07f6873cd0b07e3b1b8b783de6,12/3(日) 11:36
gifuweb,岐阜新聞Ｗｅｂ,柏木・田中最後の勇姿、代名詞の左で見せ場　ＦＣ岐阜最終戦、若手にチーム託す,https://news.yahoo.co.jp/articles/4b4f748bee9df999cb48cbe80d9d7da2dab733cb,12/3(日) 11:14
gifuweb,岐阜新聞Ｗｅｂ,「川辺セブンマウンテン」魅力語り合う　岐阜・川辺町がイベント、登山者集う,https://news.yahoo.co.jp/articles/e9de5a7fdc2068557ed7b1635e1fa5b570d15ed6,12/3(日) 10:37
gifuweb,岐阜新聞Ｗｅｂ,解体寸前、名鉄「モ５６２」再び輝け　かつて岐阜で活躍、旧美濃駅保存会が復元へ富山から運搬,https://news.yahoo.co.jp/articles/68d9c354e678f2cc435c57b30ce3f9cd73adf843,12/3(日) 10:11
gifuweb,岐阜新聞Ｗｅｂ,美濃和紙工房と倉庫４棟を焼く　岐阜・美濃市、けが人なし,https://news.yahoo.co.jp/articles/b0bc5fc618a51c8f52e98d821e4bdb22f09ad3a6,12/3(日) 9:38
gifuweb,岐阜新聞Ｗｅｂ,飛騨地域初の挑戦、岐阜・高山市のワイナリー　醸造進む施設を公開,https://news.yahoo.co.jp/articles/2a40d4ec4afd8fdff2cc0ba9084e56ee3b490606,12/3(日) 9:21
gifuweb,岐阜新聞Ｗｅｂ,「シェ・シバタ」と現代アーティスト東金さん、スイーツでコラボ　デザイン缶のクッキーとチョコ発売へ,https://news.yahoo.co.jp/articles/6ce67832da9c639a1d209431215c833b2f7b9905,12/3(日) 8:16
gifuweb,岐阜新聞Ｗｅｂ,グルメ食堂車「じねんじょ列車」運行始まる　岐阜・明知鉄道,https://news.yahoo.co.jp/articles/1eead6da2a6352f5cc1f4e5d3f6e908475ffeb59,12/3(日) 7:46
gifuweb,岐阜新聞Ｗｅｂ,FC岐阜は０―１で最終節ホームを勝利で飾れず...８位で今季を終える,https://news.yahoo.co.jp/articles/891df3d0b2de88fb974573bbd1287c5ab4cfc739,12/2(土) 17:41
gifuweb,岐阜新聞Ｗｅｂ,国民民主岐阜県連　衆院選岐阜３区に新人の仙田氏を擁立,https://news.yahoo.co.jp/articles/5c30f676ba0ba6bd358ece7634a33cf43b889bf0,12/2(土) 14:22
gifuweb,岐阜新聞Ｗｅｂ,水に浮く新感覚リラクゼーション「フロテッタ」無重力体験を　岐阜・大野町の屋内温水プール,https://news.yahoo.co.jp/articles/2a083d15abde83b47e8bb62cb4b759106315ca35,12/2(土) 9:36
gifuweb,岐阜新聞Ｗｅｂ,今年のコトバ「迎和」違う立場でも話し合って解決を、住職が揮毫　岐阜・笠松町の福證寺,https://news.yahoo.co.jp/articles/ea964a86c9d599811a5eaee67f0bf869d1a0a29d,12/2(土) 9:16
gifuweb,岐阜新聞Ｗｅｂ,侍ジャパン女子代表・堀田ありさ選手「野球大好き、夢諦めなかった」母校で講演　岐阜・関商工高,https://news.yahoo.co.jp/articles/8ed6306a6e7b3188df5c92d68a19d0d1b98f29f0,12/2(土) 8:57
gifuweb,岐阜新聞Ｗｅｂ,教授「たわけたこと言うんじゃない」同僚教員に大声でハラスメント　岐阜市立女子短大、戒告処分,https://news.yahoo.co.jp/articles/e379343cc163292d744c99207d79946190c999a7,12/2(土) 8:37
gifuweb,岐阜新聞Ｗｅｂ,高さ３８メートルの木が倒れ下敷きに、伐採中のブラジル人死亡　岐阜・白川村,https://news.yahoo.co.jp/articles/15b54c6f400aef5859012d13510c3b7482828474,12/2(土) 8:28
gifuweb,岐阜新聞Ｗｅｂ,銀行で拳銃？突きつけ「金出せ」強盗未遂疑い、職員脅した男逮捕　岐阜・多治見市,https://news.yahoo.co.jp/articles/1a260041f5298180503b11899a2fe22635a1032f,12/2(土) 8:18
gifuweb,岐阜新聞Ｗｅｂ,タカ１羽鳥インフル陽性、タカ狩りで捕食の野生カルガモ原因か　岐阜・海津市の飼養施設,https://news.yahoo.co.jp/articles/40c6edbe470210742776b3e3adcd1a5097448578,12/2(土) 8:09
gifuweb,岐阜新聞Ｗｅｂ,伊藤英明さん一日署長「岐阜は安全で安心な街」署員らを激励　年末特別警戒,https://news.yahoo.co.jp/articles/516084524288ad81b128b3f01d5d0dcdf363604a,12/2(土) 8:03
gifuweb,岐阜新聞Ｗｅｂ,岐阜県飛騨市神岡町の住宅密集地で火災　民家と居酒屋など４棟焼く　けが人なし,https://news.yahoo.co.jp/articles/8c380e5b75e23dad18c519872e0390304330c9fc,12/1(金) 21:51
gifuweb,岐阜新聞Ｗｅｂ,れいわ新選組　衆院選の岐阜３区に元衆院議員の阪口氏擁立,https://news.yahoo.co.jp/articles/55a53507258bc6f34efc27af961803996e3a22d6,12/1(金) 14:49
gifuweb,岐阜新聞Ｗｅｂ,ＦＣ岐阜・柏木「後悔はない」田中「楽しんで終わりたい」ラストマッチに燃える　２日ホーム最終節,https://news.yahoo.co.jp/articles/cccbdf6ca9037dae17f477acf01ed9c01bb21c8e,12/1(金) 11:16
gifuweb,岐阜新聞Ｗｅｂ,コンビニ客の詐欺を直感、被害また防ぐ「日頃から注意している」今年２回目の感謝状　岐阜北署,https://news.yahoo.co.jp/articles/2113d33c30e947d443ee0ec2eaa6f009cbf95e9d,12/1(金) 9:46
gifuweb,岐阜新聞Ｗｅｂ,鍼灸整骨院＋パーソナルジム＋痩身エステ＋漢方カフェ　体の内と外の健康サポートする複合施設,https://news.yahoo.co.jp/articles/d5f6c49392809c7a29f44a2430de82acf994965a,12/1(金) 9:32
gifuweb,岐阜新聞Ｗｅｂ,２時間で４５回「殺される」「嫌がらせ受けている」虚偽１１０番　偽計業務妨害疑いで男逮捕、岐阜県警,https://news.yahoo.co.jp/articles/8cb974ff5d29750ee61893cb856ef24ac566ad9d,12/1(金) 9:12
gifuweb,岐阜新聞Ｗｅｂ,山口組対立抗争の警戒区域に岐阜・大垣市を追加　事務所新設や集会禁止、違反で逮捕,https://news.yahoo.co.jp/articles/e0e8600f014a964c101b8ab2838e5dd34f327887,12/1(金) 8:52
gifuweb,岐阜新聞Ｗｅｂ,交差点で正面衝突→重傷ひき逃げ疑い、他人名義の車乗り捨て　イラン国籍の男逮捕、岐阜中署,https://news.yahoo.co.jp/articles/cf4c9689295b460247ff19da59cb587af326d60c,12/1(金) 8:38
gifuweb,岐阜新聞Ｗｅｂ,カップル並ぶ行列店「ミツバチ食堂」閉店　オーガニックに挑んだ１１年「役割果たした」岐阜市,https://news.yahoo.co.jp/articles/18728b53d9f5da04405b631142763819fae67325,12/1(金) 8:16
gifuweb,岐阜新聞Ｗｅｂ,「競馬の八百長レースで配当金」２５００万円詐取した疑い　岐阜中署、６３歳男を再逮捕,https://news.yahoo.co.jp/articles/c9e1bb18b2de756ebc4100f4e7000da7c08763a7,12/1(金) 7:49
gifuweb,岐阜新聞Ｗｅｂ,郷土作家、慈善の名品　岐阜県有名人チャリティー色紙展開幕、作家２１３人の２１８作品,https://news.yahoo.co.jp/articles/1bc3b47973b436a551736a459ceaddbc5e965d75,12/1(金) 7:36
gifuweb,岐阜新聞Ｗｅｂ,Ｊ３・ＦＣ岐阜の上野監督　来季も続投　安定した守備を構築,https://news.yahoo.co.jp/articles/a480ff7e53494e62e87725c5d4cdc579d51f38ee,11/30(木) 18:21
gifuweb,岐阜新聞Ｗｅｂ,岐阜県南濃町の行基寺で紅葉　濃尾平野を借景にした書院の風景に彩り,https://news.yahoo.co.jp/articles/8229b0163021cae2805e43805a8c45a88d86d2ec,11/30(木) 16:27
gifuweb,岐阜新聞Ｗｅｂ,ジビエステーキ缶詰、キャンプ飯に　シカ肉オイル漬け、岐阜市・ひょうたん姉妹が第１弾販売,https://news.yahoo.co.jp/articles/1dd750ec96b1ca8314bc57e1d5dcbef2a31916e8,11/30(木) 10:26
gifuweb,岐阜新聞Ｗｅｂ,泉質や展望露天風呂が好評「湯華の郷」来館６０万人　岐阜・池田町、開業１０周年,https://news.yahoo.co.jp/articles/96832ed14874df2c4d5158482e259e92803ea389,11/30(木) 10:21
gifuweb,岐阜新聞Ｗｅｂ,朝からギョーザ「モーニング餃子」におい控えめで高タンパク低カロリー　岐阜・本巣市の返礼品に,https://news.yahoo.co.jp/articles/fd33a6fc1acd9165deb1e651e18b1de96e0b950d,11/30(木) 9:53
gifuweb,岐阜新聞Ｗｅｂ,通信制高まる需要に影も…文科省が基準例、新設上がるハードル　飛騨高山サンコスモ高「慎重に判断」,https://news.yahoo.co.jp/articles/d74f0cc2ce5d9244662b8beece7eee15ff772be3,11/30(木) 9:37
gifuweb,岐阜新聞Ｗｅｂ,ＦＣ岐阜、ホームで２日今季最終戦＆柏木選手と田中選手現役ラストマッチ「大声援を」,https://news.yahoo.co.jp/articles/733f648ac9572be0c67a46b79f564a2f24413267,11/30(木) 8:51
gifuweb,岐阜新聞Ｗｅｂ,パワハラ対策幹部が部下の頭をペンでたたく、岐阜県総務部長パワハラ認定　戒告処分、異動,https://news.yahoo.co.jp/articles/481cbd2928f3be3fa103ed1459bb253f413507a2,11/30(木) 8:03
gifuweb,岐阜新聞Ｗｅｂ,「通院で協議会欠席」虚偽→ゴルフコンペに参加　岐阜・池田町議、過去にハラスメント発言で辞職勧告も,https://news.yahoo.co.jp/articles/61af35026989b26103c65717d7b9d8b150994e64,11/30(木) 7:32
gifuweb,岐阜新聞Ｗｅｂ,岐阜・恵那市で住宅２棟焼く　平屋の焼け跡から遺体　一人暮らしの住人の男性と連絡取れず,https://news.yahoo.co.jp/articles/0d7a9afc0117ff739c641a18392a82735d8a25e5,11/29(水) 19:47
gifuweb,岐阜新聞Ｗｅｂ,官製談合防止法違反の疑い　山県市職員を逮捕　岐阜県警,https://news.yahoo.co.jp/articles/a85f21434f8f9dca2d912a3896bc15b7c3f12ddb,11/29(水) 16:13
gifuweb,岐阜新聞Ｗｅｂ,「流れ星☆」ラジオ新番組、ヒッツＦＭで生放送「地元リスナーと交流深めたい」　岐阜出身お笑いコンビ,https://news.yahoo.co.jp/articles/67f88552e7237317ecfb2c8acfa8aa09ae2469b7,11/29(水) 9:48
gifuweb,岐阜新聞Ｗｅｂ,幸せ運ぶキュートな辰の置物　岐阜・土岐市で「えと展」展示販売,https://news.yahoo.co.jp/articles/8e7519790d2ad20b1d6fcab18cb656ce34c39119,11/29(水) 9:38
gifuweb,岐阜新聞Ｗｅｂ,西濃ゆかりの刀剣集結、永貞作の脇差しや兼定の太刀並ぶ　岐阜・垂井町で企画展,https://news.yahoo.co.jp/articles/653a5affddfe27a0ee762a473e2ce1588b758381,11/29(水) 9:24
gifuweb,岐阜新聞Ｗｅｂ,名画座「ロイヤル劇場」短編映画に、撮影スタート　岐阜出身の大野監督「街自体が主人公、作品に残す」,https://news.yahoo.co.jp/articles/4248fc7548eb1bf1a2ced67281c7e3ea2e1698d4,11/29(水) 8:59
gifuweb,岐阜新聞Ｗｅｂ,マッチングアプリ「Ｐａｉｒｓ」出会い応援、自己紹介の書き方指南　岐阜県内４市がセミナー,https://news.yahoo.co.jp/articles/794dbe7680f165c235c971b33df06759c40b13c2,11/29(水) 8:46
gifuweb,岐阜新聞Ｗｅｂ,超硬合金包丁「ＫＩＳＥＫＩ：」第３弾に万能ペティナイフ　福田刃物工業、商品拡充,https://news.yahoo.co.jp/articles/33c7e4b930a310508f08750f00f12724c99294b4,11/29(水) 8:32
gifuweb,岐阜新聞Ｗｅｂ,訓練再開日に陸自隊員が不適切行為、訓戒処分　発砲事件があった岐阜市・日野射撃場,https://news.yahoo.co.jp/articles/ba88160194151e952704b86a692505f349b5b46c,11/29(水) 8:06
gifuweb,岐阜新聞Ｗｅｂ,ひき逃げ疑い３４歳男を逮捕、女性骨折　岐阜・岐南町、駐車場から道路進入時接触,https://news.yahoo.co.jp/articles/ee4413a669e44e734f1f2f8bd1f080c1c1e2ecdb,11/29(水) 7:41
gifuweb,岐阜新聞Ｗｅｂ,甘みは最高　「富有柿」収穫が最盛期　岐阜・本巣市,https://news.yahoo.co.jp/articles/a26ede66493736bf5d2d68247933d6723bea6538,11/28(火) 18:33
