media_en,media_jp,title_articles,link_articles,date_original
theanswer,THE ANSWER,久保建英も「圧倒された」戦術から決まった衝撃ゴール　トルシエ期待の19歳「事前にたくさん…」,https://news.yahoo.co.jp/articles/e1a2b8b4a2861357f8b2ee9007246d15f5f70140,1/19(金) 16:03
theanswer,THE ANSWER,井上尚弥でもクロフォードでもないPFP王者誕生の可能性　元2階級王者が指摘「真剣に考えないと」,https://news.yahoo.co.jp/articles/8c8bbe4653d303da07f02a9a1c9d09515b510d3f,1/19(金) 15:33
theanswer,THE ANSWER,「昔からイケメン」　長谷部誠、ちびっ子時代の短パン＆裏ピース秘蔵写真に反響　40歳を祝福,https://news.yahoo.co.jp/articles/ba46c8b2ef0ed3c7af4741534f359637c13866ac,1/19(金) 15:03
theanswer,THE ANSWER,53歳のアクセル着氷で話題　フィギュア伊藤みどりが1年後に名曲ダンスで反響「変わりなくキレキレ」,https://news.yahoo.co.jp/articles/3f258ebc3d642b93dd183b8efb2146978cfcf463,1/19(金) 13:33
theanswer,THE ANSWER,7500万円の超高級車に英衝撃　C.ロナウドの新フェラーリが話題「32億円のコレクションに加入」,https://news.yahoo.co.jp/articles/fb85f3c57fe90b083a692e00a8c955fd19f2c2f0,1/19(金) 12:13
theanswer,THE ANSWER,女子ゴルフ岩井姉妹、双子でダブルプレー完成に驚きの声　オフの練習で話題「運動神経の塊」,https://news.yahoo.co.jp/articles/0908dd7b2d2090022e91f90953a9feff0fdeaf53,1/19(金) 11:33
theanswer,THE ANSWER,「日本の雰囲気を味わって」　来日カナダ女子が味わう札幌の食をFISまで紹介「競技生活の極み」,https://news.yahoo.co.jp/articles/e02567ff7f2122918dbde29f05b7a06563dab4d3,1/19(金) 10:33
theanswer,THE ANSWER,世界陸上金メダリストが29歳で死去　合併症が原因、16年リオ五輪にも出場,https://news.yahoo.co.jp/articles/e5508a855bc0a390e2aece93754133b36024e5ab,1/19(金) 10:08
theanswer,THE ANSWER,大谷翔平から20歳への“注目の証し”が話題　選ばれし200人の一員に、異競技スターとは3年前に縁,https://news.yahoo.co.jp/articles/a4d3a3051d7a5f16b3568d71415257146212526d,1/19(金) 10:03
theanswer,THE ANSWER,アジア杯の衝撃レッドに報復ポーズ　怒るカタール選手に海外実況呆れ気味「パンチの威嚇をした」,https://news.yahoo.co.jp/articles/f0bc2c1c59459820c40ea8b75ce34a788b87ca24,1/19(金) 9:33
theanswer,THE ANSWER,「大谷翔平は戻ってこない」勘付いたエ軍戦士の胸中　涙を誘う別れの1枚も…存在の大きさ顕著に,https://news.yahoo.co.jp/articles/ee45ed5dd009b9611e1c38482da4082720428cd0,1/19(金) 8:33
theanswer,THE ANSWER,大谷翔平らの手本は「1998年のヤンキース」　新スター軍団にヤ軍OB提言「手本にしてもらいたい」,https://news.yahoo.co.jp/articles/61e9d5da80c1e85b02b645d6729aa999a2c31e8e,1/19(金) 8:13
theanswer,THE ANSWER,大谷翔平入団でドジャース守護神「義理の兄弟から連絡が来たんだ」　情報を知った意外な経緯とは,https://news.yahoo.co.jp/articles/fafb576179d4c0eddcbb4e8f0de93f02768166cd,1/19(金) 7:33
theanswer,THE ANSWER,アジアサッカーの危険プレーが世界に波及　決定的瞬間は「靴が顔よりデカい」「AFCじゃなくUFC」,https://news.yahoo.co.jp/articles/d7220aed46400340366815d00d0bf8d8d1246be4,1/19(金) 7:13
theanswer,THE ANSWER,大谷翔平の「副収入＝74億円」も納得させた予想外の行動　垣間見せた人柄に集まる称賛＆感心,https://news.yahoo.co.jp/articles/5f777a8218ebb1f2697c1d67b5ae31ac6a43fbba,1/19(金) 7:03
theanswer,THE ANSWER,大谷翔平は「体の標本だ」とド軍GM仰天の理由　発端は右肘手術「リハビリ方法に誇りを持ってる」,https://news.yahoo.co.jp/articles/478385c4150bfa48681663bfe25b943175fc5d42,1/19(金) 6:53
theanswer,THE ANSWER,アジア杯で日本製品を「世界クラス」と称賛　現地100万人が利用、地元メディア「安全で効率的」,https://news.yahoo.co.jp/articles/0e417d579a219dc756f0e35c6a04148e340b9245,1/19(金) 6:33
theanswer,THE ANSWER,大谷翔平に「惚れ惚れ」した最大の理由　“初絡み”したド軍大砲「本当に楽しみにしているんだ」,https://news.yahoo.co.jp/articles/947d0ce975d8b789c65b64b6bf5b3cc05a2bb856,1/19(金) 6:13
theanswer,THE ANSWER,殿堂入り黒田博樹へ米国から祝福　ドジャース「クラブハウスで絶大な尊敬」ファン「本物だった」,https://news.yahoo.co.jp/articles/2d557f586566c8915c8daa10322b48691987831d,1/19(金) 5:16
theanswer,THE ANSWER,サッカー日本最大の課題は「対戦相手ではない」　初戦で露呈、経験不足か…海外メディア指摘【アジア杯】,https://news.yahoo.co.jp/articles/465f3e7165e87df1a556cec42bf9da422da09b45,1/19(金) 5:13
theanswer,THE ANSWER,智将ベント率いるUAE、痛恨レッド＆オウンゴールで1-1ドロー　最終イラン戦は気の抜けない展開に【サッカーアジア杯】,https://news.yahoo.co.jp/articles/acdf8e269772e423d4d82a845661e70e478097cf,1/19(金) 4:58
theanswer,THE ANSWER,ウズベキスタン20歳新星の先制弾に日本人驚き　あどけなさ残るも「将来代表の顔」「上手いな」【サッカーアジア杯】,https://news.yahoo.co.jp/articles/3a4b83bfeafa144fa6b47f34a20aa8c4f8cab2d2,1/19(金) 0:10
theanswer,THE ANSWER,日本の次戦イラクファンが“日の丸”横断幕に挑発か　「アウェーになる」と日本人警戒の激闘へ【サッカーアジア杯】,https://news.yahoo.co.jp/articles/0d74d50680853902269fb862d74e9e71e91a3b02,1/18(木) 21:36
theanswer,THE ANSWER,女子ゴルフ期待の新人・政田夢乃の新スポンサー契約に反響「どんどん増えるのでは!?」「可愛い」,https://news.yahoo.co.jp/articles/f7e8c2d1fce152d8e4334023b8dd3a7a2965a3e0,1/18(木) 21:03
theanswer,THE ANSWER,大谷翔平に「一緒にやってやろうぜ」と鼓舞された新同僚が感激　「昨日彼と話したんだ」,https://news.yahoo.co.jp/articles/c80041ace1246021133a89de671608b6ecb16791,1/18(木) 20:06
theanswer,THE ANSWER,主力離脱、メディア取材禁止…サウジの世界的名将への渦巻く不満に英紙「非難はしばらく続くかも」,https://news.yahoo.co.jp/articles/1dd35b3695d18716fbbc2dc4b1a79f5e52837eaa,1/18(木) 19:03
theanswer,THE ANSWER,サッカー中国戦で炸裂「カンフーキック」に韓国紙バッサリ　「乱闘劇」「中国は16強も不透明」,https://news.yahoo.co.jp/articles/b0b56fb915b86d3489dfb8606e341173980fecd6,1/18(木) 18:03
theanswer,THE ANSWER,「あなたは日本人です」　サッカー超大物イニエスタが今、取った行動に日本人感激「ありがたい」,https://news.yahoo.co.jp/articles/19b0dd80925e47d4f2c963af36f877fd3cda7412,1/18(木) 17:38
theanswer,THE ANSWER,全豪テニス会場の設備に相次ぐ批判　選手怒り露わ、酔っ払い客に邪魔され「心かき乱されたわ」,https://news.yahoo.co.jp/articles/2c8b2787f8a7edb2bbed6120dfa6e3fe29ee10a4,1/18(木) 17:03
theanswer,THE ANSWER,「まさにユートピアさ」　エビマヨにはまった来日ラグビー選手・ソポアンガが語る日本の素晴らしさ,https://news.yahoo.co.jp/articles/9626b19fe4944edf4a03c0d0e7a3a73b794cca85,1/18(木) 16:33
theanswer,THE ANSWER,那須川天心の相手ロブレスは好青年　公開練習で感謝の言葉連呼「テンシンの応援が多いのはいい事」,https://news.yahoo.co.jp/articles/16f3459008bdd2b5f883b5f04404d4ef63f0d97b,1/18(木) 16:15
theanswer,THE ANSWER,1776億円補強ドジャースは「悪党モード」　辛辣なライバル球団投手が抱く期待「見るの待ちきれない」,https://news.yahoo.co.jp/articles/2dca4333c686977feb3a22a68486d7e28361f680,1/18(木) 16:03
theanswer,THE ANSWER,和田毅“塾長”に学ぶロッテ3選手の食事会にカメラ潜入　慕われる42歳に「凄い人望」と再生10万超,https://news.yahoo.co.jp/articles/4b37d84c248dcf6e9ed26c3f36c93d6f72cf7e59,1/18(木) 15:50
theanswer,THE ANSWER,世界王者候補ロブレスをKOへ　那須川天心担当の粟生トレーナー自信「ここでちょっと挫折をね」,https://news.yahoo.co.jp/articles/13ad06d8cbe99e5ae6d3daef03cc3575507a93ec,1/18(木) 15:34
theanswer,THE ANSWER,女子ゴルフ吉田優利が“懐いている”先輩と私服ショット　大爆笑のクッキング「会う日までながーーく」,https://news.yahoo.co.jp/articles/553eb5d9563479f502ac1c06c15ef778d85cdd55,1/18(木) 15:03
theanswer,THE ANSWER,久保建英の“親友”イ・ガンインが見せつけた筋肉美　謎のポーズにファン衝撃「私のウエストくらいある」,https://news.yahoo.co.jp/articles/e6f431505a36a141464a6171dca05081c8c24ff6,1/18(木) 14:16
theanswer,THE ANSWER,ボクシング穴口一輝の現状を所属ジム説明　4度ダウンの激闘から搬送、意識回復せずも「懸命に治療を続けている」,https://news.yahoo.co.jp/articles/3f3102f50d9b1a5d11c7360f7df55e3af8599bd3,1/18(木) 13:54
theanswer,THE ANSWER,大谷翔平の加わったドジャースは「気に食わない」　獲得逃した球団のエースが本心語る「あそこだけは…」,https://news.yahoo.co.jp/articles/f4e4647adc43e0b03ddce6fd0e35e672020e7cfe,1/18(木) 13:03
theanswer,THE ANSWER,来日女子ジャンプ選手が日本の“癒し”にビックリ　バッチリ防寒なのに生足で「奇麗にリフレッシュ」,https://news.yahoo.co.jp/articles/d3beece72238d2432c9fd6df867c4d2bfa497a5a,1/18(木) 12:43
theanswer,THE ANSWER,大谷愛犬デコピンが「ファンをメロメロに」　野球不毛の地インドも熱い注目「瞬く間に話題に」,https://news.yahoo.co.jp/articles/2f088d8aa75058a387fe99b5dc088e80d3b26fa5,1/18(木) 12:13
theanswer,THE ANSWER,顔面キックにもカード出さない韓国人主審、母国メディアは擁護「中国は判定の心配よりも…」【サッカーアジア杯】,https://news.yahoo.co.jp/articles/c086a68e6b1bd48815af66fbfb1a2117e6a59481,1/18(木) 11:43
theanswer,THE ANSWER,アジア杯のベンチで抜群の存在感　サウジ代表にいた往年の名選手にファン熱視線「気になった」,https://news.yahoo.co.jp/articles/b2d61d8ba346532d5b5d61b97239fda6549cc084,1/18(木) 11:13
theanswer,THE ANSWER,90歳陸上女子選手が200m世界新記録　54秒47の力走に海外喝采「彼女には勝てない」「信じられない」,https://news.yahoo.co.jp/articles/fa7cf76c45f1a55bceccfe095682aabcec10c169,1/18(木) 11:07
theanswer,THE ANSWER,光明見えぬエ軍でトラウトは「トレードすべきか」　殿堂入り投手が見解「好機は終わりつつあるかも」,https://news.yahoo.co.jp/articles/ce0ed3f5263073a861e38bff3cf9a557196278fe,1/18(木) 10:03
theanswer,THE ANSWER,今の中国代表は「団結力なくバラバラだ」　母国は悲観論、世界100位台に2戦連続0-0でGL敗退危機,https://news.yahoo.co.jp/articles/28cba12635850dd2317550ddefeff1fe005a4480,1/18(木) 9:03
theanswer,THE ANSWER,未だ大谷グッズ売られるエ軍本拠地の悲哀　LA紙皮肉「在庫一掃セールなし」ポスターも昨季のまま,https://news.yahoo.co.jp/articles/efb5f86640f45b4eed6779c4261b75b67c77bf75,1/18(木) 8:13
theanswer,THE ANSWER,中国選手の顔面に相手のスパイク裏が激突　頬に痕もカードなし…海外ファン騒然「酷い審判だな」【サッカーアジア杯】,https://news.yahoo.co.jp/articles/a11949fb905f49a7866627791d800903e058e8c9,1/18(木) 7:43
theanswer,THE ANSWER,日本のテレビ女優第1号と対面した陸上・田中希実が憧れを告白「超有名番組の数々の司会を務め…」,https://news.yahoo.co.jp/articles/814115f4bcc44188ea10887588940c9ec7a6d7a2,1/18(木) 7:13
theanswer,THE ANSWER,大谷愛犬デコピンに続いて「札付きのワルだ…」　同僚の家を無残に荒らした“犯人”が話題「また派手に!!」,https://news.yahoo.co.jp/articles/875521ce7cd97f0d36f3a12f37c90648e983248a,1/18(木) 6:43
theanswer,THE ANSWER,タジキスタン監督が日本人主審に激怒「良いフライトを願う」　選手と接触しかけ…その後決勝点奪われる【サッカーアジア杯】,https://news.yahoo.co.jp/articles/ee26895748b5c9e0fc62af25c6d38e7bb7bf7bea,1/18(木) 6:13
theanswer,THE ANSWER,大谷翔平の指に頻繁にマメができる理由　元同僚投手が持論、原因の一つは「明らかに打撃手袋だ」,https://news.yahoo.co.jp/articles/c45494cc9c913e9104fcbc590c2b2f093b3a18e3,1/18(木) 5:43
theanswer,THE ANSWER,「韓国人審判だから明らかな報復だ」　アジア杯で中国＆韓国に新たな火種、判定巡って中国ファン恨み節,https://news.yahoo.co.jp/articles/1438c78a8ec3805bc50ddd895ad59076e26fa278,1/18(木) 5:13
theanswer,THE ANSWER,元中日ロドリゲスがブルージェイズと契約合意　4年47億円と米記者報道…昨春WBC後にキューバから亡命,https://news.yahoo.co.jp/articles/968936676e4c08dad1b59843bd3257d177c0bb34,1/18(木) 4:10
theanswer,THE ANSWER,アジア杯で衝撃の一発レッド　相手の顎に足裏キック→VAR退場で批判殺到「明らかに故意」「もはや格闘技」,https://news.yahoo.co.jp/articles/14e8d03d934c6990f66bf1f673ac8763f1ccedb7,1/18(木) 1:33
theanswer,THE ANSWER,アジア杯で中国大ブーイング「これでイエローもなし!?」　レバノンの顔面キック＆お咎めなし判定に批難轟々,https://news.yahoo.co.jp/articles/023262a4bfdda4ca2716f9dfebe2726838d81aab,1/17(水) 22:33
theanswer,THE ANSWER,アジア杯であわや惨事　中国選手の顔面に相手のスパイク激突、頬に痛々しい痕も…　日本人「なんでレッドにならないの」,https://news.yahoo.co.jp/articles/3d34928551c56b4a517b59ab6a37a70d7bbde47a,1/17(水) 21:20
theanswer,THE ANSWER,今年30歳の大谷翔平は「あと何年、投打両方できるか」　二刀流耐久年数に殿堂入り213勝投手が関心,https://news.yahoo.co.jp/articles/ddf2ed7c31786cf93c54d5052e843ae907d2b6d2,1/17(水) 20:03
theanswer,THE ANSWER,批判渦巻く中国代表、1試合でパスミス100本超　酷評にも「このスタイルを貫く」と監督方針不変,https://news.yahoo.co.jp/articles/c66dc0f515bd696fd9fc2a7bd9d85bce635e02ea,1/17(水) 18:48
theanswer,THE ANSWER,大谷愛犬デコピンに続く悲惨な光景　愛らしい“犯行”にド軍同僚も「こいつはひと苦労だ」,https://news.yahoo.co.jp/articles/b4ebe8b8d62ee535784d27c1cf4b991537bade1b,1/17(水) 18:03
theanswer,THE ANSWER,主役の南野拓実以上に目立った23歳同僚　誕生日ケーキに写り込んだ異変に日本人笑撃「何したのww」,https://news.yahoo.co.jp/articles/42d7f6c100f28ce43ad5dc835743a77ebc35b01e,1/17(水) 17:33
theanswer,THE ANSWER,日本の160円揚げたての逸品に「機嫌が悪くもなれない」　海外ジャンプ女子がコンビニの逸品に虜,https://news.yahoo.co.jp/articles/ff810afdeb8d0bb76d235f33cebf0604557e5b42,1/17(水) 17:03
theanswer,THE ANSWER,日本代表が異国で掲げた横断幕　国民に寄り添った試合後の行動に海外注目「インスピレーションの源」,https://news.yahoo.co.jp/articles/1f2f0b5a0bd3b246b6eeeb791b4f2f1577cad5f2,1/17(水) 16:33
theanswer,THE ANSWER,大谷翔平、話題沸騰のデコピンTシャツに反響止まず　希望者続出「予約した」「センス良すぎ」,https://news.yahoo.co.jp/articles/d9931ffc43e700ac592dd81c5d50b6747b3ec208,1/17(水) 15:33
theanswer,THE ANSWER,“大谷グラブ”6万個に同封された熱い一言、まさかの事件も…話題尽きない大谷翔平の2週間,https://news.yahoo.co.jp/articles/c42fc9dafe44fd9db13f8e7de6f11c04b2ee121f,1/17(水) 15:03
theanswer,THE ANSWER,日本でもらった「可愛い歓迎ドリンク」　欧州ジャンプ女子、デザインには議論「何に見える？」,https://news.yahoo.co.jp/articles/b972c440d5a53bc9468af06c9ec3f0bf2b4fe8b7,1/17(水) 14:03
theanswer,THE ANSWER,大谷翔平と離れたエ軍左腕、最も寂しいのは「ブルペン」　静かだけど「彼を見ているだけで…」,https://news.yahoo.co.jp/articles/9a8e878c69633c071c7e5de32e2f4ce8e14a55d1,1/17(水) 13:03
theanswer,THE ANSWER,羽生結弦「祈ることしかできません」　阪神淡路大震災から29年、記した思い「寄り添えていますように」,https://news.yahoo.co.jp/articles/e81e37f0ea24c6b94fc9f0695c7c8c71e6e86de5,1/17(水) 12:19
theanswer,THE ANSWER,大谷翔平の“デコピン事件”は「サービス」　台湾で愉快に報道、愛犬は「関係ないと言いたげだ」,https://news.yahoo.co.jp/articles/cfd7ad135f9c354b7a129d583c2060c3a1374419,1/17(水) 11:52
theanswer,THE ANSWER,大谷翔平、デコピン＆パワプロに続く話題　“エ軍最後の人形”も登場、注目度満点の今オフ,https://news.yahoo.co.jp/articles/9542f9c109d7a0146d975e779c34e1b9e5019299,1/17(水) 11:33
theanswer,THE ANSWER,「いつの間に」「知らんかった」　日本のライバル国にいた世界的名将にネット驚き【サッカーアジア杯】,https://news.yahoo.co.jp/articles/e6cf6bceeae27e741a529408acb98c611db71f3d,1/17(水) 11:03
theanswer,THE ANSWER,今季の大谷翔平に感じる「恐ろしいこと」　離れるエ軍戦士が敵目線で指摘「取り除くのは大きい」,https://news.yahoo.co.jp/articles/87f7908b039483c3140b89b19675ab58eb1ef65f,1/17(水) 10:33
theanswer,THE ANSWER,日本代表の密着カメラ、撮影の細かい配慮に称賛の声　PK練習で「すごい」「一緒に戦ってる」【サッカーアジア杯】,https://news.yahoo.co.jp/articles/698835d1c69ca8dcedb9dddfd34dce216fa8aa82,1/17(水) 10:03
theanswer,THE ANSWER,大谷翔平、女性スタッフに「周囲もほっこり」の細やかな気遣い　撮影現場で自ら行動のエピソード,https://news.yahoo.co.jp/articles/bce1d30be3529054754fc00a0ce6f09df39f9618,1/17(水) 9:33
theanswer,THE ANSWER,ド軍GMも「何も知らなかった」大谷翔平の“別人騒動”　混乱に身を委ね「かなりワイルドだった」,https://news.yahoo.co.jp/articles/8bce2975188f74aed12de5d81906a840f3903bd2,1/17(水) 8:43
theanswer,THE ANSWER,テニス全豪OPでボールガールが笑撃の格闘　捕まらない乱入者に海外実況席「これは不可能な課題」,https://news.yahoo.co.jp/articles/136ea47e7880cf8141a721227d68a5a1ac01b94f,1/17(水) 8:13
theanswer,THE ANSWER,大谷移籍でエ軍選手に走った衝撃「ニュース見た？」「クレイジーだ」　前日婚約でもSNSに釘付け,https://news.yahoo.co.jp/articles/9c7fae6f849bcac546c61ee365fff2b046349816,1/17(水) 7:53
theanswer,THE ANSWER,大谷翔平の愛犬に壊されても…“粋な返し”のパワプロ公式に笑撃「面白すぎ」「最高でやんす」,https://news.yahoo.co.jp/articles/f22492998b3a2eaae5a686ebd2db92bcd053a012,1/17(水) 7:13
theanswer,THE ANSWER,大谷翔平が“おねだり”した「ガンダー」って何？　能力アップ、体力回復にも貢献の愛されキャラ,https://news.yahoo.co.jp/articles/e1d6482dcdf4e1e3ad6b42d4fec07ecea279fed8,1/17(水) 6:43
theanswer,THE ANSWER,日本に敗れたトルシエ監督が取った舞台裏の行動　日本人感激「日本を気にかけてくれてる！」【サッカーアジア杯】,https://news.yahoo.co.jp/articles/d260731ea7f44cbfbd059d07bc43569e9f938d89,1/17(水) 6:13
theanswer,THE ANSWER,大谷翔平のデコピン写真に隠れた気遣い　日本の契約企業の「プロモーションうますぎ」と話題,https://news.yahoo.co.jp/articles/8afac045c17d81a64faa2461db515f66940eabdb,1/17(水) 5:13
theanswer,THE ANSWER,アジアカップで珍事　決勝ゴール巡り混乱、主審ジェスチャーを両軍が勘違い…敗北オマーンは落胆,https://news.yahoo.co.jp/articles/796f646f214f76e55d1242d8de089139d7ee42da,1/17(水) 4:51
theanswer,THE ANSWER,大谷翔平、ついに出た日本のデコピンTシャツに歓喜の声　粋なデザインが「売れそう」「可愛い」,https://news.yahoo.co.jp/articles/c56749941991a795685db51058b058216e710d73,1/17(水) 4:13
theanswer,THE ANSWER,タイが白星発進　石井正忠監督は就任後初勝利、女性サポーターの大声援を受け2大会連続決勝Tへ【サッカーアジア杯】,https://news.yahoo.co.jp/articles/7174620400a1a4b12dad655d0fffd9df24cfa17e,1/17(水) 1:29
theanswer,THE ANSWER,「ぎぃゃぁぁぁぁ!!」　タイの観客女性の絶叫に日本人驚き「可愛い」「黄色い歓声が多いw」【サッカーアジア杯】,https://news.yahoo.co.jp/articles/a6eeade755a952a0dae926a32153ca39f03d2138,1/17(水) 0:21
theanswer,THE ANSWER,欠場・三笘薫が取っていた日本勝利への行動に称賛　「ハーフタイムに他の選手を…かっこいい！」【サッカーアジア杯】,https://news.yahoo.co.jp/articles/a66da802788685b5f319762407f8a29923c61552,1/16(火) 21:41
theanswer,THE ANSWER,「え、この場で？」　ニュージーランド人が東京駅で驚いた日本の機械「アリガトウゴザイマス！」,https://news.yahoo.co.jp/articles/88f9955b49ed51539bf00189756b8fc347f8401c,1/16(火) 21:03
theanswer,THE ANSWER,大谷翔平、スポンサーの「最高の宣伝」に称賛の声　デコピンの隣りで「さりげなく世界に発信」,https://news.yahoo.co.jp/articles/e7444e02aac7f4956be9132c3b0a8314c3314200,1/16(火) 20:03
theanswer,THE ANSWER,日本の温かみに触れた欧州スキー選手が感激　ソウルフードを食し「ありがとう。次は蔵王よ」,https://news.yahoo.co.jp/articles/16fec7ed128a3f7356e1129517bcfbfe4d45e407,1/16(火) 19:03
theanswer,THE ANSWER,大谷翔平が愛するデコピンの表情に笑撃　自由奔放に生活し「悪そうな顔しとるw」「素直だから」,https://news.yahoo.co.jp/articles/c02b31eebab1daa99aec65054c78bbd14ae634e1,1/16(火) 18:20
theanswer,THE ANSWER,トルシエ監督と「犬猿の仲と思ったけど」　抱擁したまさかの日本人に感激の声「うおぉぉーーー」,https://news.yahoo.co.jp/articles/3e173ba60215701b33d5276a2f4652df190cf679,1/16(火) 18:03
theanswer,THE ANSWER,100周年事業でBMX世界大会を開催　甲子園球場が目指す「夢が叶う場所」の在り方,https://news.yahoo.co.jp/articles/b9b3327f9015d99256f464c42cb21338fff73df5,1/16(火) 17:43
theanswer,THE ANSWER,白星発進の韓国、不発エースの「安っぽい警告」に英紙辛辣「高くつかないことを願うだろう」,https://news.yahoo.co.jp/articles/4238f03b56df00f048b16019cbeb76dfa67fae8c,1/16(火) 17:33
theanswer,THE ANSWER,原英莉花、清楚系ヘアで共演した超大物芸能人に驚きの声　「すごい！」「録画保存だね！」,https://news.yahoo.co.jp/articles/75554ac12f32a3c1f7bb9ed62d6b1e66052a0478,1/16(火) 17:29
theanswer,THE ANSWER,大谷翔平の撮影現場に同行していた納得の人物　ファン発見「当たり前のように…」「探すの好き」,https://news.yahoo.co.jp/articles/0424d3bce8dee36288477a0b1b1e54ffa93684fe,1/16(火) 17:03
theanswer,THE ANSWER,「日本の遊びやってくれるの嬉しい」　名門リバプールに持ち込まれた伝統ゲームに日本人関心,https://news.yahoo.co.jp/articles/4026a7136e48c1e91248a89e6a347cfc1b708d7b,1/16(火) 16:33
theanswer,THE ANSWER,大谷翔平1014億円契約、正当化に「複数回の世界一」が必要か？　米記者激論「彼の責任じゃない」,https://news.yahoo.co.jp/articles/97e4d2a3b97798ecf17ef9a2ea7e055b98041481,1/16(火) 16:03
theanswer,THE ANSWER,大谷翔平が報告した“いたずら被害”に海外も笑撃　「彼は無実」「飼い主に似るね」と反響拡大,https://news.yahoo.co.jp/articles/ebd999809bbd7971821a969eb9e527dcaa0c214b,1/16(火) 15:03
theanswer,THE ANSWER,358億円男レンドンよ、もう怪我するな　エンゼルス新監督が面談へ「健康維持の姿勢を見せて」,https://news.yahoo.co.jp/articles/a357d3be0c653a343fe1c0b32bf38bf22fe7b6fb,1/16(火) 13:43
theanswer,THE ANSWER,「長距離×競歩」で狙う世界の頂点　東洋大監督夫妻、五輪メダリスト育成に生きる箱根駅伝の経験,https://news.yahoo.co.jp/articles/b47a89bed1309105a2b9d7a283e1b8e6d45c28a9,1/16(火) 12:08
theanswer,THE ANSWER,「久保見たか！」「韓国がV候補らしい威容」　日本に対抗心むき出し韓国メディア、至宝の2G絶賛,https://news.yahoo.co.jp/articles/4c497d7ac625be0d198c1da3ee353b75b7a92700,1/16(火) 12:03
theanswer,THE ANSWER,大谷翔平の加入に衝撃「何が起きてるんだ？」　同僚になる韓国19歳が対面熱望「本当に見たい」,https://news.yahoo.co.jp/articles/c3e81127fabef8afdd7c1d98e4aef43280cc63ab,1/16(火) 11:33
theanswer,THE ANSWER,今永昇太へ「城」を使った壮大な祝福　地元の計らいに注目「投げる日毎回して！」「素敵です」,https://news.yahoo.co.jp/articles/5208588935d69281eb6dc0a0150d9e629664337d,1/16(火) 11:03
theanswer,THE ANSWER,大谷翔平が“おねだり”した撮影現場のぬいぐるみが話題「持って帰るんか」「買えるのかな？」,https://news.yahoo.co.jp/articles/2b9a1f9a4f17dfe58efe2f9351b40addb6550776,1/16(火) 10:33
