media_en,media_jp,title_articles,link_articles,date_original
theanswer,THE ANSWER,スキー複合・渡部暁斗が許せなかった「行動に移せない自分」　環境問題に向き合うアスリートの意義,https://news.yahoo.co.jp/articles/46b51344e9e55024f5f6ac4dc5923badd6037aaf,1/25(木) 13:33
theanswer,THE ANSWER,「何で真ん中が大谷？」　韓国スター押しのけたMLB開幕戦ポスターに韓国人疑問「ソウルシリーズなのに…」,https://news.yahoo.co.jp/articles/6c4c944524595f834406f434269e2d846aae5573,1/25(木) 13:03
theanswer,THE ANSWER,日本戦で“ビンタ”したのは「王の血を引く王子だった」　インドネシア主将の意外な事実に英紙注目,https://news.yahoo.co.jp/articles/e367e771cfc65cd2c5bba92f289e454e0bc47189,1/25(木) 12:03
theanswer,THE ANSWER,アジア杯の裏で…世界的超大物の伊東純也“推し”が発覚　公の場でもアピール「とても良いわ！」,https://news.yahoo.co.jp/articles/8dfd3d691ac10d9ddf5e10aaf5aea54a7426c218,1/25(木) 11:33
theanswer,THE ANSWER,アジア杯の裏でまさかの“神の手”ゴール未遂　完全な反則も大喜び、英紙「悪名高きハンド再現」,https://news.yahoo.co.jp/articles/c45be9859167de3e3fb2429f362068becf81e979,1/25(木) 11:03
theanswer,THE ANSWER,「韓国のあのFW、誰やっけ…フン・ソンミン？」　日本失意の夜を越えて、朝釣りの鬱憤も晴らす久保竜彦の咆哮,https://news.yahoo.co.jp/articles/b03ebf52c4a2c976b615463512d54b8b50168a7f,1/25(木) 10:58
theanswer,THE ANSWER,鼻筋も歪む激闘が示した軽量級の魅力　寺地拳四朗をリング誌が絶賛「これ以上のものない」,https://news.yahoo.co.jp/articles/a57857b00cab2a1a6ef5eb4764a937b698eb56d5,1/25(木) 10:33
theanswer,THE ANSWER,韓国代表監督が森保ジャパンを直接視察　決勝Tいきなり日韓戦でも自信「避けたい国など一つもない」,https://news.yahoo.co.jp/articles/374c5bb1d1a1995ab80323b1c38c1461c0a4daca,1/25(木) 10:03
theanswer,THE ANSWER,アジア杯でも威力発揮のロングスローは「立派な戦術」　青森山田でも話題…インドネシアの得点をネット称賛,https://news.yahoo.co.jp/articles/c05ab402f1950891d2671f5eaa745376dacceeb7,1/25(木) 9:33
theanswer,THE ANSWER,札幌で食べた日本食の「空想にふけっている」　海外ジャンプ女子が冬の日本を満喫「新しい体験」,https://news.yahoo.co.jp/articles/6a66c1385f56bba984c9c864c9fff72389c6defb,1/25(木) 8:43
theanswer,THE ANSWER,アジア杯の客席にいた日本の女優に大会公式が注目　独特衣装にファンも歓声「知っている人だ」,https://news.yahoo.co.jp/articles/f32fe92bb5224c7a3545b802b52c0439a79abb60,1/25(木) 8:13
theanswer,THE ANSWER,大谷翔平と仲良しモニアックの“プロポーズ大作戦”が成功　婚約者の驚き投稿に大谷も「いいね」,https://news.yahoo.co.jp/articles/fa5db60e7486cea26aa3af51578b368e49e9a38a,1/25(木) 7:57
theanswer,THE ANSWER,小野伸二も驚いたイラク189cm男が得点ランクトップ浮上　日本も苦しめた“空中戦”で17年ぶり記録樹立【サッカーアジア杯】,https://news.yahoo.co.jp/articles/e7d582523dfea88d70e0d5ab9248c70a279aeff9,1/25(木) 7:13
theanswer,THE ANSWER,わずか0.95cmで…アジア杯の超際どいオフサイド証拠画像に国際実況も仰天「見てくださいよ、これ」,https://news.yahoo.co.jp/articles/4dcab90f47b0f11bb21929983717a2bd8eec9ee8,1/25(木) 6:43
theanswer,THE ANSWER,日本戦の裏で痛恨レッド「軽率で無謀だ」　“飛び蹴り”で退場のベトナム選手に海外実況も驚き,https://news.yahoo.co.jp/articles/4037efcf71822e666227246483c227fb79ce4ac4,1/25(木) 6:13
theanswer,THE ANSWER,森保JAPANの“異変”に中国ファンから指摘　3-1快勝でも「どうしたんだ。インドネシアに…」の声,https://news.yahoo.co.jp/articles/543fab3dfd42dac0a55ba8f005f708527e0ac8b1,1/25(木) 5:43
theanswer,THE ANSWER,米ESPN実況席も困惑した那須川天心戦の幕切れ　敵の戦意折れた混乱の一瞬「えっ、て感じですね」,https://news.yahoo.co.jp/articles/dd78f84b6c96d4b16e4ef1d4d17b5931c06b3f8a,1/25(木) 5:14
theanswer,THE ANSWER,「日本は前線にあまりにいい選手が多い」　敗れたインドネシアの韓国人監督が脱帽「打開難しかった」【サッカーアジア杯】,https://news.yahoo.co.jp/articles/8332046458c8dc3e489637d58aa990affe63239f,1/25(木) 5:03
theanswer,THE ANSWER,日本代表を欧州データ企業が採点　最高「8.9」＆最低「6.5」だったのは…インドネシア戦独自算出,https://news.yahoo.co.jp/articles/e0768dc34231751a12bcd6dfbdde00dd3da41555,1/25(木) 3:13
theanswer,THE ANSWER,日本の3-1快勝を海外メディアはどう見たか　黒星から進歩に評価も…「警戒に値」する課題とは,https://news.yahoo.co.jp/articles/f3e470f21728849166463f9340b1e52ee067a0bb,1/25(木) 2:43
theanswer,THE ANSWER,日本戦主審が厳しい判定、遠藤航へのイエロー提示にSNS不満「意味不明」「上田へのビンタは？」,https://news.yahoo.co.jp/articles/69ee1be035a8a6a933fbf93fc35755d2c2252987,1/24(水) 23:51
theanswer,THE ANSWER,日本3-1勝利でも「非常に残念だなぁと…」　小野伸二＆槙野智章が敢えて指摘した「試合の締め方」,https://news.yahoo.co.jp/articles/669322f995994460d9e33145c516c6d4728aeabb,1/24(水) 22:57
theanswer,THE ANSWER,日本戦の真裏で劇的展開！　後半ATベトナム同点弾→10分後にイラクPK弾で決着…イラク1位で決勝Tへ,https://news.yahoo.co.jp/articles/94489be13ef03b97822aa9eabb7b279c55defceb,1/24(水) 22:38
theanswer,THE ANSWER,日本戦でまさかの行為　“ビンタ”してきたインドネシア選手に怒りの声「酷すぎ」「手癖悪いな」,https://news.yahoo.co.jp/articles/f542c634f23edff2a165e073a3da817ad57c4672,1/24(水) 22:04
theanswer,THE ANSWER,ベトナム痛恨レッドで退場者！　“飛び蹴り”で警告2枚目…猛抗議の選手にもイエロー提示,https://news.yahoo.co.jp/articles/c50d77e9254707be2efb03fc793cd27f348921d5,1/24(水) 21:31
theanswer,THE ANSWER,ベトナム、日本を破ったイラク相手に先制！　FKから鮮やかに得点、トルシエ監督も拍手,https://news.yahoo.co.jp/articles/fe87f801debe011b24cce16269fa1afb26c22022,1/24(水) 21:20
theanswer,THE ANSWER,本田圭佑、日本の試合中にドストレートな一言　ファン「ですよね」「また解説やってほしいw」,https://news.yahoo.co.jp/articles/b20e2c4f3f189aa15a548d09c47bd3f2810c0f29,1/24(水) 21:18
theanswer,THE ANSWER,日本戦の真裏イラク―ベトナム戦でまさかの展開　OGでイラク失点→微妙判定で取消、海外実況「ミリ単位だ」,https://news.yahoo.co.jp/articles/7e7134a1e6d854126baa64aa684898645988109b,1/24(水) 20:59
theanswer,THE ANSWER,大谷翔平にDMで感謝された宿敵エース　徒労に終わった勧誘の裏側「残念。くよくよ考えるわけには…」,https://news.yahoo.co.jp/articles/25a85823952ffdd62de4c50feb9afcc7284bd08b,1/24(水) 19:33
theanswer,THE ANSWER,冬の日本で過ごした時間が「超、超楽しかった！」　アメリカ選手が山形で感激した定番日本食とは,https://news.yahoo.co.jp/articles/3f8ccebab2cc9cecd83bb0fbf2693c869e635bd4,1/24(水) 19:03
theanswer,THE ANSWER,飛び出したのは膝の皿　アジア杯の“超微妙オフサイド”に海外苦言「酷い判定」「凄い量のVARだ」,https://news.yahoo.co.jp/articles/011e272288993f621d9ac435476b9b015712368b,1/24(水) 18:33
theanswer,THE ANSWER,顔もよく似た大谷翔平ドジャース版人形が米好評　過去には賛否も「今までの買い物で最速で購入！」,https://news.yahoo.co.jp/articles/59aae69809a1acac2920e85838a8b05731d88cd6,1/24(水) 18:03
theanswer,THE ANSWER,定員45人のサッカー部に300人トライアウト参加　あふれた生徒の機会損失も補う部活の地域展開とは,https://news.yahoo.co.jp/articles/12fa60aefb241a75700f3029b210e245bf534ea8,1/24(水) 17:33
theanswer,THE ANSWER,鼻筋も歪んだ寺地拳四朗の死闘に米メディア称賛　パンチ被弾し続けても「耐久性と強い顎を証明」,https://news.yahoo.co.jp/articles/de6be6454aaa58c69a324ae55a121502e92a8f39,1/24(水) 17:03
theanswer,THE ANSWER,アジア杯で爪の先だけ出た“0.95cmオフサイド”に海外記者仰天　超際どい証拠画像で「歴史に残る」,https://news.yahoo.co.jp/articles/4d560ba6be665259c856180684980b7a2fc38eae,1/24(水) 16:33
theanswer,THE ANSWER,初めての日本で食べた「一生忘れられない食事」　得意じゃないけど…海外選手が思い出に残った料理とは,https://news.yahoo.co.jp/articles/179f6f06dac09b479594d30a9fdbef0c550e88a5,1/24(水) 16:03
theanswer,THE ANSWER,アジア杯・韓国戦も無料配信　サッカーやNFLを視聴可能、「DAZN Freemium」プラン開始,https://news.yahoo.co.jp/articles/b26cc168863d04a36550e324ca7f25a9be084703,1/24(水) 15:56
theanswer,THE ANSWER,寺地拳四朗の鼻を真っ赤に腫らした挑戦者に米記者称賛　両者ダウンも「ここまでもつれ込んだことに驚き」,https://news.yahoo.co.jp/articles/88aa964eb135392c2f8957fd2961b50a52c6c8b1,1/24(水) 15:36
theanswer,THE ANSWER,大谷翔平「ご協力頂いた皆様ありがとうございます」　グラブ6万個寄贈を発展させる善意の輪に感謝,https://news.yahoo.co.jp/articles/53520b8706430bb2ea95ffa724193d270867997e,1/24(水) 15:03
theanswer,THE ANSWER,韓国人スターを押しのけて大谷翔平が「真ん中に君臨」　韓国開幕ポスターで掲載された位置に日本人納得,https://news.yahoo.co.jp/articles/170a2e94e4aefb65441d19b685961dd9c5a815c2,1/24(水) 13:51
theanswer,THE ANSWER,「ホテルで自分が世界王者だと忘れてた」　ボクサー・ユーリ阿久井政悟が“夢見心地”の一夜回顧,https://news.yahoo.co.jp/articles/f0a359237c01b3c8b9d143b8c99addc287ee6b97,1/24(水) 13:03
theanswer,THE ANSWER,那須川天心、次戦は“聖地”後楽園ホールも検討　帝拳・本田会長「天心だけの興行の可能性もある」,https://news.yahoo.co.jp/articles/078322548f9ce005c2aa116c2e751df56c9082a7,1/24(水) 12:16
theanswer,THE ANSWER,大谷翔平“番記者”の解雇にライバル紙からも悲痛の声　「残念だよ」「君の取材は素晴らしかった」,https://news.yahoo.co.jp/articles/c5280441536f6896c1aedab6c9f4c948fdbe6616,1/24(水) 12:08
theanswer,THE ANSWER,ボクシング世界戦、鼻筋が歪んだ“衝撃ビフォーアフター”が話題「こんな顔になる拳四朗くん初めて」,https://news.yahoo.co.jp/articles/559a3087666747de93e4fc125857f09036b9c0b7,1/24(水) 12:03
theanswer,THE ANSWER,女子ゴルフ鈴木愛が能登半島地震に義援金1000万円寄付を発表「私に出来ることないか自分なりに考え…」,https://news.yahoo.co.jp/articles/56e90b953aab93368438c7919d44507614b94653,1/24(水) 11:56
theanswer,THE ANSWER,「日本は私が一番よく知っている」　インドネシア代表率いる韓国人監督、対決前に不気味発言【サッカーアジア杯】,https://news.yahoo.co.jp/articles/7c6b399a4b4d97a37fed6fbcfb0a911f278704c6,1/24(水) 11:36
theanswer,THE ANSWER,那須川天心、初KO後は暴食　ケーキ1ホール、ラーメン、うどん「顔がパンパン。パンチはもらってないけど、ダメージはあります」,https://news.yahoo.co.jp/articles/37a951c8a69dec7f94d97a881123a188bf9e3eb6,1/24(水) 11:03
theanswer,THE ANSWER,新生エディージャパンが目指す「30秒」の戦いとは　サッカー名門アヤックスもヒントに“超速”へ進化,https://news.yahoo.co.jp/articles/e556f6722cc56af406ab7d9222f917840e262d87,1/24(水) 10:33
theanswer,THE ANSWER,寺地拳四朗、傷だらけ激闘から一夜「ボクサーっぽくなった（笑）」「ひたすら猫とゆっくりしたい」,https://news.yahoo.co.jp/articles/9cc3e0835f130b08236f6256f2449fa90f406387,1/24(水) 10:17
theanswer,THE ANSWER,人形になった大谷翔平が「腹話術にしか見えない」　日本人笑撃も…顔の完成度は「イケメンで似てる」,https://news.yahoo.co.jp/articles/814aa9f05a8437cdab90dc9c3ea29ab49cc1c8ad,1/24(水) 10:03
theanswer,THE ANSWER,中国サッカー弱体化顕著　3戦無得点アジア杯敗退の陰に根深い問題「本戦参加願ってため息つく日も…」,https://news.yahoo.co.jp/articles/15e5e34c8f0ed79d3a8e234aae4d732fabee99bf,1/24(水) 9:33
theanswer,THE ANSWER,米LAタイムズが大量115人の記者を解雇　大谷翔平の“影武者”見つけた女性も…「取材できて幸せ」,https://news.yahoo.co.jp/articles/c6c065a061c725852e626a3863e976ac3e6b0dbd,1/24(水) 8:48
theanswer,THE ANSWER,初KO那須川天心、相手の心を折った決定的瞬間に注目「完全に戦意喪失してる」「圧倒」,https://news.yahoo.co.jp/articles/4db92d6ecd5e4cc608e982850878639f6cc43fe0,1/24(水) 8:13
theanswer,THE ANSWER,初めての日本で寿司や刺身に舌鼓　海外代表チームが札幌滞在を満喫「素晴らしい時間だ」,https://news.yahoo.co.jp/articles/72ccf6e66bee22e5ea0b9270a4c3e4a579de77a4,1/24(水) 7:13
theanswer,THE ANSWER,那須川天心が叫ぶ「闘うことの素晴らしさ」　1500万円超の寄付、施設の児童招待…初KOに秘めた姿,https://news.yahoo.co.jp/articles/13112f0c571466e852271d226f7a73488df05ca7,1/24(水) 6:43
theanswer,THE ANSWER,「中国サッカーの冬の時代」に母国メディア警鐘　国内リーグ初代王者が賃金未払いの末解散,https://news.yahoo.co.jp/articles/0671308ef8d50dae2e7061e57087b8a06ffb40f2,1/24(水) 6:13
theanswer,THE ANSWER,初KOの那須川天心を米メディア評価　世界ランカー相手に「強固な左的中、楽々とインサイドに」,https://news.yahoo.co.jp/articles/06c4a10b4f6655395b65bbb15d983fd6dc4be724,1/24(水) 5:43
theanswer,THE ANSWER,アジア杯のオフサイド判定に仰天、はみ出したのは「膝の皿」　証拠に海外実況は笑い堪えきれず,https://news.yahoo.co.jp/articles/d22bf5062b84d4533a0554bf764016d688d70748,1/24(水) 5:13
theanswer,THE ANSWER,イラン2-1でUAE撃破、グループ首位で決勝Tへ　日本と準々決勝で激突の可能性,https://news.yahoo.co.jp/articles/9494c225ab79cf0946e87a27b80687c6520aef2e,1/24(水) 2:06
theanswer,THE ANSWER,所属未定の藤浪晋太郎にフィットする3球団　「電撃的な投手が必要」と米メディアが指摘したのは,https://news.yahoo.co.jp/articles/faa1d4aa3b2f9da577f8bceef850f3595fda7740,1/24(水) 0:01
theanswer,THE ANSWER,那須川天心「ここからという時に終わった」　思わぬ形の初KO、綺麗な顔で会見「ダメージはない」【一問一答】,https://news.yahoo.co.jp/articles/3a13c4eb7895511297996281b3667e4f0bd5bea5,1/23(火) 22:28
theanswer,THE ANSWER,寺地拳四朗、2-0判定勝ちも「悔しい。反省」　両者ダウンの死闘制し世界戦14勝「カニサレス選手めちゃめちゃ強い」,https://news.yahoo.co.jp/articles/c2d0f9cd3a478bb6c503de11128ab08041992277,1/23(火) 22:18
theanswer,THE ANSWER,寺地拳四朗、2-0判定勝ちで2団体防衛成功！　両者ダウンの壮絶打ち合い、具志堅用高に並ぶ日本3位の世界戦14勝,https://news.yahoo.co.jp/articles/010ab016162f4b6740b7c635c745f93ef415cf4d,1/23(火) 22:02
theanswer,THE ANSWER,那須川天心がバンタム級参戦宣言「次もすぐに」　予想外の初KOには不完全燃焼「マジで？終わり？」,https://news.yahoo.co.jp/articles/7b4e934846b1d43fdfd5bbdf9e4bc5235f62e5f1,1/23(火) 20:56
theanswer,THE ANSWER,那須川天心、まさかの相手棄権で3回TKO勝ち　3連勝＆初のKOも不完全燃焼「マジで？終わり？」,https://news.yahoo.co.jp/articles/145634824a1b6743f9ebb0619dc66693b4dbe60b,1/23(火) 20:43
theanswer,THE ANSWER,ユーリ阿久井政悟が世界王座奪取！　長期防衛の強敵王者に3-0判定勝ち、岡山のジム初の世界王者誕生,https://news.yahoo.co.jp/articles/d6246c47fa61c296155c05b90362456994f8beb5,1/23(火) 20:07
theanswer,THE ANSWER,大谷翔平ら1800億円補強＝ポルシェ6900台、東京タワーは60塔…ドジャースの“本気”に衝撃,https://news.yahoo.co.jp/articles/c3d7a402d19ca5ea987223181970967583a2cad4,1/23(火) 19:54
theanswer,THE ANSWER,香港競馬で見られた「仰天シーン」　新・最強馬候補の祝福に集まった人数に反響「なかなか世界でも…」,https://news.yahoo.co.jp/articles/ca15e155f0e3cdecab377e092cfb44eea76e3103,1/23(火) 19:33
theanswer,THE ANSWER,辰吉丈一郎、次男・寿以輝の判定勝ちに超辛口「攻撃が単調すぎ。左が少なすぎ」　拳を痛めても「倒すのがプロ」,https://news.yahoo.co.jp/articles/ea8a166a0ac0b98bdd16f1c325b2f92bc0d063f4,1/23(火) 19:25
theanswer,THE ANSWER,アジア杯で日本の技術が「最も便利だ」　200万人の観戦体験支える製品に現地メディア脚光,https://news.yahoo.co.jp/articles/cbf02c294bd206ef1fb179613b6e02d4bb2b7720,1/23(火) 18:15
theanswer,THE ANSWER,3試合ノーゴールの中国は「死を待つばかり」　見せ場なく敗退濃厚にファン怒り「恥知らず」「解散だ」,https://news.yahoo.co.jp/articles/b20b07a4de2f7b761c43bc05c308444f4367119b,1/23(火) 18:03
theanswer,THE ANSWER,本田圭佑が異例のAT16分に困惑「16分！もうよく分からんw」　22年W杯では「ななふぅん!?」で話題【アジア杯】,https://news.yahoo.co.jp/articles/042ccaec7067a5bd130505afdb9a0e4e39bd8af7,1/23(火) 18:01
theanswer,THE ANSWER,少女ファンへの“神対応”に「癒された」　日本人女子ゴルファーの振る舞いに国内外から称賛,https://news.yahoo.co.jp/articles/d5238da1cff8973e18b682d817070ac423f7968b,1/23(火) 17:51
theanswer,THE ANSWER,井上尚弥が親子で快挙！　WBCが父・真吾氏と最優秀選手＆トレーナーに選出「偉大な父、息子、コーチの方程式だ」,https://news.yahoo.co.jp/articles/5caf74ef4dbe8690b5a8be34a46006fe0dc7124a,1/23(火) 17:21
theanswer,THE ANSWER,女子中高生3人を魅了したフラの奥深さ　安らぎと浄化を感じる“小さなハワイ”での時間,https://news.yahoo.co.jp/articles/1ae2a6affa1a948fc4eae13fbcd77865c8ae5a6b,1/23(火) 17:03
theanswer,THE ANSWER,日本審判団に激怒のタジキスタン監督、ファウル計32回の荒れ試合制し決勝T進出に歓喜「歴史作った」【サッカーアジア杯】,https://news.yahoo.co.jp/articles/215f9f861107475964ec71b9637c73aa589881b5,1/23(火) 16:33
theanswer,THE ANSWER,「渋谷に大谷翔平がいた」「めっちゃ大きい！」　話題のハチ公周辺ジャック、目撃者が続々反応,https://news.yahoo.co.jp/articles/7a9d5551e264a624990c6dcf7a5ebae321e111b1,1/23(火) 15:15
theanswer,THE ANSWER,日本のコンビニグルメが「別格だ」　海外代表チームが山形をエンジョイ「大都市です」,https://news.yahoo.co.jp/articles/1898e52ecb0eb8f1629c693088ee1c5dae64a395,1/23(火) 15:03
theanswer,THE ANSWER,“274億円軍団”韓国が「恥をさらすことを何とか回避」　アジア杯での苦戦に欧州辛辣,https://news.yahoo.co.jp/articles/8a06ff81eca6f6c995a92ce2c6769a9b8f24ce22,1/23(火) 13:33
theanswer,THE ANSWER,「殴られても効かなそうな」那須川天心の肉体美　仕上がったボクサー3戦目ボディに期待の声,https://news.yahoo.co.jp/articles/71f3b337e4f21241442e92879ad5159fcaf74d31,1/23(火) 12:03
theanswer,THE ANSWER,ドジャース主砲妻の“大谷＆山本シャツ”姿が話題　金髪とカールに合わせ「素敵です」,https://news.yahoo.co.jp/articles/1f6fc2c077611cac8fc2a52b4a091a13b671d5c4,1/23(火) 11:03
theanswer,THE ANSWER,危険な足裏タックルで一発退場　AT16分の珍事…タジキスタンの劇的勝利にネット衝撃「何が起きた？」【サッカーアジア杯】,https://news.yahoo.co.jp/articles/255f38c660c03ff0b5e0bd166903c6a0d46f062b,1/23(火) 10:48
theanswer,THE ANSWER,研究熱心な女子ゴルフ青木瀬令奈　野球選手との自主トレから学んだ「ゴルフと同じ部分」とは,https://news.yahoo.co.jp/articles/b3e2fb0eff75ccb90ab4c37b6a9ea20850fca8f6,1/23(火) 9:39
theanswer,THE ANSWER,日本のおもてなしに感激「歓迎してくれた！」　海外代表選手が山形で日本文化体験,https://news.yahoo.co.jp/articles/0b4d1a5a6ae009e0b9cfb7865bf1d6be699d8ad5,1/23(火) 9:18
theanswer,THE ANSWER,F1角田裕毅の“大変身”に海外驚愕「どうしたの？」　ムキムキ上腕から強烈パンチの「ロッキー」,https://news.yahoo.co.jp/articles/665ef128890dd188a4b26d45e2dc36806dfad421,1/23(火) 8:13
theanswer,THE ANSWER,香港競馬に現れた新スター候補、鮮烈G1勝利飾った勝負強さに日本人驚き「次はこの馬か」「強すぎる」,https://news.yahoo.co.jp/articles/08aea9a105175a3cef4e1a2d90c35d7e8b2c663d,1/23(火) 7:13
theanswer,THE ANSWER,日本代表の新シェフがお披露目　熱い思いと臨機応変の動きにファン感激「選手並みにかっこいい」,https://news.yahoo.co.jp/articles/37a5eb44cba7def848c1a8c6b1511a5006275f58,1/23(火) 6:13
theanswer,THE ANSWER,大谷翔平は「エンゼルスを去ってよかった」　米ファン納得の不名誉記録“なおエ”証明する「53」,https://news.yahoo.co.jp/articles/b08bcd6e110e43155623601c46edd364cbf6b771,1/22(月) 21:03
theanswer,THE ANSWER,日本人審判だけでなく大忙しだった実況席　キルギス2人の一発レッドに興奮MAX「アップグレード！」【サッカーアジア杯】,https://news.yahoo.co.jp/articles/fc19c423fcdc101e0a08769e4bde431699634121,1/22(月) 19:33
theanswer,THE ANSWER,363億円男レンドンの“試合多すぎ”発言が物議　元同僚がぶった切り「野球が大嫌い」「給料半分返せ」,https://news.yahoo.co.jp/articles/77d8e06d49d5c6c7e8fbbb987d99c7ad0406619a,1/22(月) 18:03
theanswer,THE ANSWER,米ゴルフで“ギャンブル”失敗　無情の池ポチャとなった38歳の選択に溜息「なぜ挑戦しようと…」,https://news.yahoo.co.jp/articles/63a62aabd3e48dfc25cf77cfebca613c4f7e1eba,1/22(月) 17:03
theanswer,THE ANSWER,ボクシング世界戦でまさかの珍事　睨み合い→“頭突き”の挑戦者・阿久井が苦笑「自分の間合いに…」,https://news.yahoo.co.jp/articles/0b3d1aa29f1e0eaab2facb59a16df62be753b9b4,1/22(月) 16:13
theanswer,THE ANSWER,小平奈緒とイ・サンファ、日韓の金メダリストが激闘の舞台で再会　地元紙は称賛「友情は永遠に」,https://news.yahoo.co.jp/articles/836ddfc427182154b94abf230edd4b68f623423a,1/22(月) 16:09
theanswer,THE ANSWER,世界王者・寺地拳四朗「前回より手数を出す」　具志堅用高に並ぶ世界戦14勝へ堂々の計量パス,https://news.yahoo.co.jp/articles/fb4d353ad30e4944d1845fb6fabbc3fe2ff5f726,1/22(月) 15:35
theanswer,THE ANSWER,リング禍防止へ、日本ボクシング界初の「STOP」タオル導入　23日世界戦で、JBC「わかりやすくなる」,https://news.yahoo.co.jp/articles/fc1d343104409b6daaa04200419f2402ea309c59,1/22(月) 15:16
theanswer,THE ANSWER,日本代表密着カメラが捉えた久保建英の悔しさ　イラク戦後の佇まいに奮い立ったファン「覚悟に痺れる」,https://news.yahoo.co.jp/articles/339ff36b2e8bf6c191efd8654c5d4577bd255aa2,1/22(月) 15:04
theanswer,THE ANSWER,サッカー中国代表が陥った「最悪の屈辱状況」　韓国メディアが指摘する戦犯「存在感がない」,https://news.yahoo.co.jp/articles/9971ecb34f1daef583c3a17fbcabf41b0678eb9b,1/22(月) 14:13
theanswer,THE ANSWER,那須川天心、14秒睨み合いで「俺のペース」　初KOへファンに要求「倒してくれという念を送ってほしい」,https://news.yahoo.co.jp/articles/8c19b0aae1dbce3d660732b16656a88dc806f114,1/22(月) 13:42
theanswer,THE ANSWER,那須川天心が54.8kg計量パス！　ボクサー3戦目ボディー完成、相手ロブレスも54.2kgで試合成立,https://news.yahoo.co.jp/articles/84e0edeb82a8d8effe276289e798c1c20e4498f3,1/22(月) 13:11
theanswer,THE ANSWER,一時集中治療室に入ったザッケローニ氏、公の場での「元気な姿」に日本人安堵「長生きしてほしい」,https://news.yahoo.co.jp/articles/a5f6021fb5508cf2fe8a8d8d946d1bef9f9d2960,1/22(月) 12:14
theanswer,THE ANSWER,宙を舞っても目は切らない…プロ意識高すぎる“忍者審判”ファン称賛　大惨事を軽々防いだ神業,https://news.yahoo.co.jp/articles/c4dcb75f0efbdac7ddbf91b045ea708fb365cb83,1/22(月) 11:55
theanswer,THE ANSWER,イ・ボミが小祝さくらに打ち明けた「後悔」　お茶目なポーズも見せた対応に反響「スマイルがいい」,https://news.yahoo.co.jp/articles/1d36341070575f7ee5406013f50221cb2e471c22,1/22(月) 11:33
theanswer,THE ANSWER,「無気力な姿」見せた韓国代表は勝っても負けても“進退両難”　母国メディアが指摘…日本以外にも強敵,https://news.yahoo.co.jp/articles/a4542e95611e726976f371b5699a2bad8d12d127,1/22(月) 11:08
