media_en,title_articles,link_articles,date_original
dime,1万円以下でコスパ抜群！装着感も音質も大満足のSOUNDPEATSのワイヤレスイヤホン「AIR3 DELUXE HS」,https://news.yahoo.co.jp/articles/f3e223d1bb66cb31440d5dce0ec72f576f1ae064,10/20(金) 21:40
dime,社名が変わるきっかけで多いのは？日本企業の「社名変更の歴史」を調べてみた,https://news.yahoo.co.jp/articles/9da4392d50bc5fc7b87ae77993169705b08b8168,10/20(金) 20:40
dime,イスラエルとハマスの衝突は金融市場にどう影響を与えるのか？,https://news.yahoo.co.jp/articles/54b2517ff12f2cd11bfc14177e1166e83e76b488,10/20(金) 18:40
dime,「不祥事を起こした芸能事務所のタレント」が出ている広告や広告主に対して悪い印象をもつ人はどれくらいいる？,https://news.yahoo.co.jp/articles/9e6127f3aba2d603a07cc860d31bed2e185708fb,10/19(木) 21:40
dime,制服に着替える時間はOKなのにラジオ体操はダメ？裁判事例に学ぶ「給料がもらえる時間」の条件,https://news.yahoo.co.jp/articles/4bec6955ef225e7a0d6178ba742f3f96a22cf402,10/19(木) 20:40
dime,始めるなら秋！花粉アレルキー対策「舌下免疫療法」のメリットとデメリット,https://news.yahoo.co.jp/articles/317fcebf7ce4e2543af798e0d627056d735818f4,10/19(木) 20:11
dime,ショート動画の流行で収益性が悪化したUUUMに復活の道筋はある？,https://news.yahoo.co.jp/articles/1314805aa89835ad7686fa9eee49a63cb2e58cfe,10/18(水) 21:40
dime,日本の金持ち企業ランキング、3位ファーストリテイリング、2位任天堂、1位は…知ってる？,https://news.yahoo.co.jp/articles/62b62ac7cb79f274e625d1df88861ff412adfe50,10/18(水) 21:11
dime,原因はミックス粉の中のタニ!?命に関わるアレルギー症状「ハンケーキ症候群」の怖さ,https://news.yahoo.co.jp/articles/72eb7912a436ed522ec9e2f53e5dd54e1f19b6a8,10/18(水) 20:11
dime,アニメを月1回以上見ている20～30代の割合、日・米・韓で最も高い国は？,https://news.yahoo.co.jp/articles/4bd7a28f15d7358aa3250fc7271723d566184e64,10/17(火) 22:10
dime,スマートリングは定着するか？「EVERING」「Oura Ring」「TwooCa Ring」それぞれの特徴と違い,https://news.yahoo.co.jp/articles/909311bc80ab84ca140976369c12f27fe55d9a87,10/17(火) 21:10
dime,マイナンバーカードと運転免許証を一体化する計画はどうなったのか？,https://news.yahoo.co.jp/articles/ac3e18aca773d5afc36e4867d8aa8a4313f9f396,10/17(火) 20:10
dime,処理水放出問題で中国に進出している日本企業への影響は？,https://news.yahoo.co.jp/articles/a7f234cfca4a9d4ab544af799f5325e2f21789d0,10/16(月) 21:40
dime,スマートタッチディスプレイより高音質に驚いたJBLのハイエンドワイヤレスイヤホン「Tour Pro 2」の実力,https://news.yahoo.co.jp/articles/abb03116d6ffbb42b0e5485b303e1848a13cf93e,10/16(月) 21:10
dime,若手社員600人に聞いた、新卒入社後3年以内に離職しなかった理由,https://news.yahoo.co.jp/articles/5828de702772fcd0650bbe8dddcf895fc79ca23e,10/16(月) 20:10
dime,「指示待ち部下」を「能動的に取り組む部下」に変えていく方法,https://news.yahoo.co.jp/articles/8b927faeb4a5296b6bdd802f65a2972c51231983,10/15(日) 22:10
dime,録音だけでは不十分？暴行の認定が争われたパワハラ裁判に学ぶ証拠の残し方,https://news.yahoo.co.jp/articles/845e58a1fe407292b048ac86b48d1e3da3f6e9ee,10/15(日) 21:50
dime,他のEVと何が違う？未知のオフロードEV走行が楽しめるジープ「ラングラー プラグインハイブリッド」,https://news.yahoo.co.jp/articles/35c38eed2d479b1cc48d2924a203875e0ffd5802,10/15(日) 21:20
dime,現代人の疲れた心を癒す「大人に刺さる玩具」が急増しているワケ,https://news.yahoo.co.jp/articles/a5210e2a09a27717f8d3cf016c6bb5549fc2b5e6,10/15(日) 16:40
dime,即席麺評論家・大山即席斎氏イチオシのいま食べるべき最新カップ麺21選,https://news.yahoo.co.jp/articles/4991d72b5b062f3d9bde60d9fd04c2acd516fa38,10/15(日) 11:10
dime,Amazonで1369円で買った「蚊避けブレスレット」で本当に蚊を撃退できるのか？,https://news.yahoo.co.jp/articles/b3f9174c3a92885977a604d3d00f33c6745c38f7,10/14(土) 23:06
dime,新築マンションより安く買える？不動産のプロに聞いた「狭小住宅」の意外なメリット,https://news.yahoo.co.jp/articles/f9f0a1b722b862f85670532e2655cab71cacc6cb,10/14(土) 21:50
dime,デザインだけじゃない！日産のクロスオーバーEV「アリア B9」で体感する新次元のパフォーマンス,https://news.yahoo.co.jp/articles/aaf80819535102eb7135b36a0c0bb10362827c85,10/14(土) 21:40
dime,青森県庁が仕掛けるSNSでも話題の〝裸エプロンの漁師トレカ〟、人気の裏にあった驚愕の事実,https://news.yahoo.co.jp/articles/e7839ab854df7bd5dab1f30756e9c2f75d402cdf,10/14(土) 21:10
