media_en,media_jp,title_articles,link_articles,date_original
nbn,メ?テレ（名古屋テレビ）,「戻らない」と答えた割合は半数以上　福島・双葉町の今　【東日本大震災から13年】,https://news.yahoo.co.jp/articles/a587c54a66aff6264d262f4b9e6981608a2179f8,3/11(月) 19:35
nbn,メ?テレ（名古屋テレビ）,原子力災害から13年 イチエフの「今」　同じ構造を持つ5号機を取材　デブリ取り出しに向けた準備,https://news.yahoo.co.jp/articles/768f1b7122c9229476cfda4133fa467921ae5781,3/11(月) 19:30
nbn,メ?テレ（名古屋テレビ）,車いすけん引装置「JINRIKI」改良型が名鉄百貨店で販売　坂道や段差でスムーズに移動可能,https://news.yahoo.co.jp/articles/4bdd844c4f37782ff814e09b7f1fb9d07ea54a50,3/11(月) 19:15
nbn,メ?テレ（名古屋テレビ）,岐阜県の課長級職員が禁煙の庁舎内で喫煙し戒告　「能登半島地震の業務で長時間席を離れられなくなった」,https://news.yahoo.co.jp/articles/83eec12e695ed53b9c861b7bdcd5ba17df6f4c39,3/11(月) 17:59
nbn,メ?テレ（名古屋テレビ）,東海道新幹線の車内で巡回警備中の警備員が乗客の体を20回ほど触る　委託先の全日警は解雇,https://news.yahoo.co.jp/articles/e017a5a344f185f56186b7050a6f0f9f107051dc,3/11(月) 17:43
nbn,メ?テレ（名古屋テレビ）,双葉町と作ったタオル“ダキシメテフタバ”　「メイドイン福島」をPR　復興への思いとともに世界へ,https://news.yahoo.co.jp/articles/26c4c584d2dd53b9ec6a41ea399222d151be45f2,3/11(月) 17:20
nbn,メ?テレ（名古屋テレビ）,ごみ埋め立て施設「愛岐処分場」の作業手順に厳しい声　未処理水流出事故受け専門家会議,https://news.yahoo.co.jp/articles/83f04d7ba25bbf58d93e8660cbc8f79bff6acc19,3/11(月) 16:58
nbn,メ?テレ（名古屋テレビ）,ラグビー姫野和樹ら特殊詐欺対策広報大使に就任「素早く対応を」　愛知・豊田署,https://news.yahoo.co.jp/articles/b3ea18104001f9eda7672f6187851bc49c08f1ff,3/11(月) 16:53
nbn,メ?テレ（名古屋テレビ）,「忘れてはいけない」追悼行事・東海地方から復興への祈り 【東日本大震災から13年】,https://news.yahoo.co.jp/articles/fc1c26dc8f02c743c6d8bfd9ee56f9ab976efe0c,3/11(月) 16:34
nbn,メ?テレ（名古屋テレビ）,岐阜・大垣の強盗事件でほう助の罪、フィリピン国籍被告に懲役2年2カ月　地裁判決,https://news.yahoo.co.jp/articles/49dbc692c7b577190082465aca3900ada5776aa2,3/11(月) 16:31
nbn,メ?テレ（名古屋テレビ）,南海トラフで最大2.9m津波到達予想の愛知・豊橋で避難訓練【東日本大震災から13年】,https://news.yahoo.co.jp/articles/693813781f55a2d4a99065f81b8df64cc67f81f4,3/11(月) 12:29
nbn,メ?テレ（名古屋テレビ）,名古屋のマンションで火災　焼けた部屋から見つかった男性が死亡,https://news.yahoo.co.jp/articles/25ccfa8d632e8afcace729bcbab1ab94e6deafd0,3/11(月) 12:24
nbn,メ?テレ（名古屋テレビ）,助手席から転落し車にはねられたか　男性が死亡…東名高速下りの一部区間で一時通行止め　愛知県,https://news.yahoo.co.jp/articles/b4b6bdb3d67368593632503f65bad379aff4d656,3/10(日) 23:06
nbn,メ?テレ（名古屋テレビ）,多度大社「上げ馬神事」 馬との接し方を学ぶ講習会…馬への暴行などで虐待と指摘　三重・桑名市,https://news.yahoo.co.jp/articles/8c6e39af289b415b7d0d5398eb224e5c9dfb29f2,3/10(日) 18:18
nbn,メ?テレ（名古屋テレビ）,早咲きの品種「カンヒザクラ」が見ごろ　三重・熊野市木本町の「鬼ヶ城」の遊歩道,https://news.yahoo.co.jp/articles/7de36435567f956d88f61ce43ade7cf5a4a6c553,3/10(日) 18:18
nbn,メ?テレ（名古屋テレビ）,ダンプカーで自転車の女性をひき逃げした疑いで男を逮捕　名古屋・千種区の交差点,https://news.yahoo.co.jp/articles/090222f1da06e17f9555b1309172adb6f05fd1d3,3/10(日) 12:22
nbn,メ?テレ（名古屋テレビ）,ジブリパークで2回目の内覧会　朝から大行列　愛知・長久手市,https://news.yahoo.co.jp/articles/47ab4bd928a5f3eb5c0d17a10dc67fe188e91ffc,3/10(日) 12:17
nbn,メ?テレ（名古屋テレビ）,愛知・豊橋市の里山で　春の訪れを告げるカタクリの花咲き始める,https://news.yahoo.co.jp/articles/c006d27a64b4af133d812ad3a7c20998520c0640,3/9(土) 18:13
nbn,メ?テレ（名古屋テレビ）,池田衆院議員が逮捕・起訴されたことを受け　愛知3区の自民党・地方議員ら対応検討する会議,https://news.yahoo.co.jp/articles/bd6518a21bc7144edaf50cdb2e2252d480389bdb,3/9(土) 18:09
nbn,メ?テレ（名古屋テレビ）,岐阜・下呂市の観光施設で土雛まつり　明治〜昭和の土雛を展示,https://news.yahoo.co.jp/articles/b4126ad8752b33757f22ccfc3712a7a6a611062c,3/9(土) 12:30
nbn,メ?テレ（名古屋テレビ）,藤井八冠が静岡・掛川市のイベントに参加　開催される予定だった王将戦の代替イベント,https://news.yahoo.co.jp/articles/a9e55383ee41c0704692fef2dc7d713e4b0f8068,3/9(土) 12:26
nbn,メ?テレ（名古屋テレビ）,アパートが全焼する火事　焼け跡から1人の遺体　住人の女性と連絡が取れず　三重・伊勢市,https://news.yahoo.co.jp/articles/ae157cc601091518d2c07d03a4bfbe32b991140e,3/9(土) 7:36
nbn,メ?テレ（名古屋テレビ）,妊婦が行う超音波検査　公費負担回数の増加・河村たかし市長が意欲「絶対にやらないといけない」,https://news.yahoo.co.jp/articles/44a78a20763d4cfa95fb0b25ab5f8899fa5af0a0,3/8(金) 20:22
nbn,メ?テレ（名古屋テレビ）,コアラ舎のレリーフ、店内に飾られた「アラレちゃん」や「悟空」、鳥山明さんゆかりの場所で悲しみ広がる,https://news.yahoo.co.jp/articles/fd90a0d57cd0de3bc90f824502ea09837a7dd15b,3/8(金) 19:46
nbn,メ?テレ（名古屋テレビ）,ドラゴンズの今シーズンの活躍祈る　名駅で応援イベント,https://news.yahoo.co.jp/articles/0af44463a1b5e3e9fa12749721aedc85418dc2a7,3/8(金) 19:29
nbn,メ?テレ（名古屋テレビ）,コンクリート詰め男性遺体発見の事件　傷害致死の罪で被告に懲役7年求刑,https://news.yahoo.co.jp/articles/da665fa4f1aee8eaa78d787bb1dc1ab70228b1e7,3/8(金) 19:21
nbn,メ?テレ（名古屋テレビ）,4歳の娘に暴行加え死亡させた罪、母親に懲役6年の判決　津地裁,https://news.yahoo.co.jp/articles/e976d52a039d94262f71f9c695d9f49d0b066285,3/8(金) 19:21
nbn,メ?テレ（名古屋テレビ）,輸入差し止めとなった偽ブランド品など知的財産侵害物品、差し止めは10万点　2023年,https://news.yahoo.co.jp/articles/c2dca929ae506cc372fc4501eb7b80007e71832a,3/8(金) 19:21
nbn,メ?テレ（名古屋テレビ）,捜査費用の横領などで愛知県警の巡査長を懲戒免職「ギャンブルや私的な飲食代に使った」,https://news.yahoo.co.jp/articles/5a0f56846e003d6b7b982601e417faef71434ef3,3/8(金) 19:16
nbn,メ?テレ（名古屋テレビ）,お得な「北陸応援割」予約スタート　代金最大50％引き　観光地も期待「問い合わせ急増」,https://news.yahoo.co.jp/articles/15e2af53491c517f9a6386ec1bc93f6c1008fdc5,3/8(金) 19:06
nbn,メ?テレ（名古屋テレビ）,記録的な大雨で大破…中断していた「渡し船」が復活　愛知県豊橋市,https://news.yahoo.co.jp/articles/95e2ecb5131a96d9fe7b92abe7bc8a40d8bd36eb,3/8(金) 18:28
nbn,メ?テレ（名古屋テレビ）,半島被災への備え、道路寸断・孤立の可能性も…「1週間以上の備蓄必要」,https://news.yahoo.co.jp/articles/fde97c885139c34572c672e0b0907328c32d22ab,3/8(金) 17:42
nbn,メ?テレ（名古屋テレビ）,殺人未遂容疑で逮捕されていたベトナム国籍の男性を不起訴　名古屋地検,https://news.yahoo.co.jp/articles/d9df7f3525bd579b35db74ccaf158b32e1e5717c,3/8(金) 13:39
nbn,メ?テレ（名古屋テレビ）,現役大学生が開発、子育て世代注目の“小児科専門アプリ”　夜間でも気軽にオンライン診療が可能に　名古屋,https://news.yahoo.co.jp/articles/84c69aa44ce45ff4b16aebc976fe8e043739c340,3/8(金) 13:30
nbn,メ?テレ（名古屋テレビ）,愛知・蒲郡市の女性殺害から8年　遺族らが情報提供呼びかけ,https://news.yahoo.co.jp/articles/521f1734686c575791675c6e648a25c7044025f9,3/8(金) 13:08
nbn,メ?テレ（名古屋テレビ）,列車と軽トラックが衝突、運転の男性が軽傷　愛知・豊橋鉄道渥美線の踏切,https://news.yahoo.co.jp/articles/3923649c72f041306c27c605a3d39eb022c662f0,3/8(金) 13:03
nbn,メ?テレ（名古屋テレビ）,伊勢名物「赤福餅」を新幹線で新潟へ 　JR東海が新サービス「東海道マッハ便」,https://news.yahoo.co.jp/articles/d921e7d3b22eae25b4733c9d5b76042e25aab2a2,3/8(金) 12:20
nbn,メ?テレ（名古屋テレビ）,プロ20年目、ドラゴンズ涌井が掲げる「200勝」　Xでは球団広報ばりの仕事ぶりに反響,https://news.yahoo.co.jp/articles/542f726f7e67eda8f0a8228e9efc399d4694ee92,3/8(金) 11:34
nbn,メ?テレ（名古屋テレビ）,大阪・関西万博で「空飛ぶクルマ」飛行計画　スズキとスカイドライブ（愛知県豊田市）が製造開始を発表,https://news.yahoo.co.jp/articles/5671505f4270419c817052b30f42b7a9600f6a6d,3/7(木) 22:27
nbn,メ?テレ（名古屋テレビ）,無許可営業の居酒屋で飲食した男女8人からノロウイルス検出　店を営業禁止処分に　岐阜市,https://news.yahoo.co.jp/articles/df93e7089f23a598ced20a6a80e19a6c26baf91b,3/7(木) 19:43
nbn,メ?テレ（名古屋テレビ）,「事実関係を明らかにするには至らず」小学生が同級生に93万円を支払った問題で保護者説明会,https://news.yahoo.co.jp/articles/fe383daaa4df278d79e49214108080c693e99247,3/7(木) 19:18
nbn,メ?テレ（名古屋テレビ）,「トリエンナーレ」負担金の支払いを求める訴訟で名古屋市の敗訴が確定　最高裁が上告を退ける,https://news.yahoo.co.jp/articles/acdb43841a7a340f8cac9fc9561bc26c7ac9486c,3/7(木) 19:13
nbn,メ?テレ（名古屋テレビ）,国内最高齢のスナメリ…38歳のメス「勇気」が老衰で死ぬ　三重県の鳥羽水族館,https://news.yahoo.co.jp/articles/9f421a0bfbc45422a0b6946fd5fe2d8893f5008b,3/7(木) 19:08
nbn,メ?テレ（名古屋テレビ）,名所・五条川がピンクに染まる「岩倉桜まつり」5年ぶり復活へ　樹木保全の工夫も,https://news.yahoo.co.jp/articles/7594345c1b6dad3fb6b007bd972ef956a3610f97,3/7(木) 18:51
nbn,メ?テレ（名古屋テレビ）,"竹内すいと荒木菜那、14年の競技生活に終止符　感謝を込めたそれぞれの""ラストダンス""",https://news.yahoo.co.jp/articles/163c059a151801e87bd6c1615f4795f9b89b784f,3/7(木) 18:07
nbn,メ?テレ（名古屋テレビ）,能登半島地震の被災地で命を守った耐震補強工事　住民の高齢化で浸透にはハードルも,https://news.yahoo.co.jp/articles/fe89db2e3409a900c11312f01924b370527b2a9e,3/7(木) 17:32
nbn,メ?テレ（名古屋テレビ）,少年少女が関わる犯罪防止に…漫画が描かれたハンドブック　愛知県警が専門学校生と協力して作成,https://news.yahoo.co.jp/articles/4b3d95dbe3a7a2a093d997e4584e4abb17dadcbe,3/7(木) 16:52
nbn,メ?テレ（名古屋テレビ）,女性を殺害し畑に遺体を遺棄した罪に問われている女に懲役18年を求刑　名古屋地裁,https://news.yahoo.co.jp/articles/1911e245a7ba79f6bc35fc0326fc76bb57bb5586,3/7(木) 16:36
nbn,メ?テレ（名古屋テレビ）,県道で軽自動車と普通乗用車が正面衝突　軽自動車を運転していた男性が死亡　愛知県豊橋市,https://news.yahoo.co.jp/articles/13da6a5898badf48f9fb8bd194395328609b9eab,3/7(木) 16:10
nbn,メ?テレ（名古屋テレビ）,被災地のトイレ問題　水を使わなくていい「トイレカー」開発　用を足した後に熱でフィルムを圧着,https://news.yahoo.co.jp/articles/e1986c250a837fde261d33d2d67d84bfea477bd1,3/7(木) 14:15
nbn,メ?テレ（名古屋テレビ）,春に水揚げされる天然ブリを広く知ってもらおうと「三重春ぶり宣言」熊野灘沿岸では4月まで水揚げ,https://news.yahoo.co.jp/articles/9bebc84a477a3cde0cbb1e8658dbf6444cca4454,3/7(木) 12:32
nbn,メ?テレ（名古屋テレビ）,公立中学校で卒業式　新型コロナ5類移行を受け4年ぶりに在校生全員が参加　三重県,https://news.yahoo.co.jp/articles/d7027d948711a36a6ebf38140ab21ec5c10970c9,3/7(木) 12:26
nbn,メ?テレ（名古屋テレビ）,合言葉は「つ・み・き・お・に」　ダンス動画を投稿　体で覚える不審者への対策,https://news.yahoo.co.jp/articles/b229a8abb4ff14ad1f0ae3af79d73f4afc9e017e,3/7(木) 11:45
nbn,メ?テレ（名古屋テレビ）,ウィシュマさん死亡から３年　医療体制を強化　変わろうとする名古屋入管に密着,https://news.yahoo.co.jp/articles/e4b19494a3799bd42fc4dfd7cd065e011653a7ad,3/7(木) 11:35
nbn,メ?テレ（名古屋テレビ）,110番通報中に別の車にもはねられたか？ひき逃げ容疑で２人逮捕　愛知・あま市,https://news.yahoo.co.jp/articles/62b6323f995821178455acedf7e3b01c85a14ac1,3/6(水) 22:55
nbn,メ?テレ（名古屋テレビ）,「ヤックルに乗った」、ジブリパーク「魔女の谷」が16日オープン　他４エリア含めて5千人が内覧　愛知,https://news.yahoo.co.jp/articles/fb70b6ca440c3feac2ba4bd883bd4d7d4c75c5af,3/6(水) 19:45
nbn,メ?テレ（名古屋テレビ）,名古屋入管での死から3年…亡くなったウィシュマさんの好物を詰めたお弁当を供えて法要,https://news.yahoo.co.jp/articles/fdeb66bbd5d103df8ab6a1bba14691e39f707bfd,3/6(水) 17:08
nbn,メ?テレ（名古屋テレビ）,利用率2.6%“バス離れ”解消へ　特別なバスを使い小学生に授業　公共交通機関に関心を,https://news.yahoo.co.jp/articles/ebe7def313b65b14c972ab84bea52e13339ca480,3/6(水) 17:02
nbn,メ?テレ（名古屋テレビ）,2019年の台風被害を教訓に「移動式変電所」の設置訓練　岐阜県美濃加茂市,https://news.yahoo.co.jp/articles/645e6aa763e0eceeeb576b9c25f3e58b797f0246,3/6(水) 12:45
nbn,メ?テレ（名古屋テレビ）,「車と事故をした…」110番通報途中で応答が途絶える…自転車の男性がひき逃げされ死亡　愛知県あま市,https://news.yahoo.co.jp/articles/53fc690ecf30ba5f4ab83b1251d9a378620437f9,3/6(水) 12:35
nbn,メ?テレ（名古屋テレビ）,愛工大・中村優斗　 最速157キロの直球が武器　侍ジャパンにメンバー入りした大学生の素顔,https://news.yahoo.co.jp/articles/b66e632bcfcc0ed7309de4ed4fb1e11254e84030,3/6(水) 11:52
nbn,メ?テレ（名古屋テレビ）,石川県の被災地で空き巣を繰り返したか　指輪やブランデーなど盗んだ疑いで10代の男女3人を逮捕,https://news.yahoo.co.jp/articles/535f584b7bb8a038ee35547e79ac468def8b8f12,3/6(水) 11:14
nbn,メ?テレ（名古屋テレビ）,ビッグモーターの愛知県内の店舗従業員を書類送検　街路樹を枯れさせた容疑　愛知県警,https://news.yahoo.co.jp/articles/142d78286892e6ac46eebc9f140b2915ebb7f260,3/5(火) 22:30
nbn,メ?テレ（名古屋テレビ）,国際ロマンス詐欺の被害金を資金洗浄か　岐阜市の男女4人を逮捕,https://news.yahoo.co.jp/articles/75f78c823b4b7544f3ad7133a362e6447338aa89,3/5(火) 22:26
nbn,メ?テレ（名古屋テレビ）,"""99のセクハラ""認定で辞職の岐阜・岐南町の小島英雄町長が退庁　「町民に対して申し訳ない」",https://news.yahoo.co.jp/articles/74b5b852e89ec7a7d6cb6207f39342d2da3db97e,3/5(火) 19:21
nbn,メ?テレ（名古屋テレビ）,名古屋で「春の大北海道物産展」始まる　北海道愛あふれる名物バイヤーのイチオシずらり,https://news.yahoo.co.jp/articles/6acdd6c99d091808814fae2fabcb0cc225e00cdb,3/5(火) 19:11
nbn,メ?テレ（名古屋テレビ）,名古屋市、来年度は「県民の日学校ホリデー」設定せず　保護者アンケート踏まえ方針,https://news.yahoo.co.jp/articles/06b125b259d95a09842ff73710fb91e010a8206c,3/5(火) 19:11
nbn,メ?テレ（名古屋テレビ）,愛知・清須市で寺など燃える火災、住宅の焼け跡から1人の遺体　住人男性と連絡取れず,https://news.yahoo.co.jp/articles/92e73ef64121d9b6aa57b96b6758f953b9daed8d,3/5(火) 19:06
nbn,メ?テレ（名古屋テレビ）,愛知県警岡崎署で勾留中の男性が死亡した事件、元警部に罰金80万円の略式命令,https://news.yahoo.co.jp/articles/cc6a13dd02bee77a144d2b8ddd25ba495f57b879,3/5(火) 18:36
nbn,メ?テレ（名古屋テレビ）,小6男児が同級生らに計93万円を渡す　相手児童は水族館記念メダルを「純金製で価値上がる」などと説明,https://news.yahoo.co.jp/articles/1384fb3e57750439338d359763f931e24fb00b21,3/5(火) 16:54
nbn,メ?テレ（名古屋テレビ）,犯人役を投げ飛ばし確保、駅構内で刃物を振り回す男への対応訓練　愛知県弥富市,https://news.yahoo.co.jp/articles/c182b16dff01e4f95800082beb2f7dde2e57d6c0,3/5(火) 16:54
nbn,メ?テレ（名古屋テレビ）,空き巣被害者が効果実感…リアルタイムで犯行を確認→逮捕へ　注目されるスマホ連動防犯カメラ　愛知県,https://news.yahoo.co.jp/articles/3269205fa4eddf9c023bc22c83a22438672cc738,3/5(火) 14:00
nbn,メ?テレ（名古屋テレビ）,「自身の無知と不勉強を恥じながら…」　愛知県東郷町長のハラスメント問題　町長が進退について答弁,https://news.yahoo.co.jp/articles/dcc07702641b5680011997bc7de2677b52992b3c,3/4(月) 19:38
nbn,メ?テレ（名古屋テレビ）,女性アスリートの写真を「雑誌の袋とじ」や「作品と称して販売」…対策に追われる現場,https://news.yahoo.co.jp/articles/b0cf600e1ebabc5992c8d4efc42763eb93014385,3/4(月) 19:26
nbn,メ?テレ（名古屋テレビ）,ガスの大口契約で“談合”　中部電力と子会社に計2600万円超の課徴金納付命令　公正取引委員会,https://news.yahoo.co.jp/articles/714cca1d231bf1b64e5ad691aecf330da01c2001,3/4(月) 19:21
nbn,メ?テレ（名古屋テレビ）,「支え合いを大切に」　能登地震で被災した石川県穴水町の小学校に募金　岐阜市の小学校がオンライン交流,https://news.yahoo.co.jp/articles/80b0b750fe7e241380f4b2e6bbf4d5eb921e9f3c,3/4(月) 17:28
nbn,メ?テレ（名古屋テレビ）,卒業生が自作衣装で「おひなさま」に　愛知県豊橋市の専修学校で伝統の卒業式,https://news.yahoo.co.jp/articles/5a8edee6e5f22df919ceb00948e57ea5078b04ed,3/4(月) 17:23
nbn,メ?テレ（名古屋テレビ）,ドラゴンズ大野　334日ぶりにバンテリンドームのマウンドへ　シーズンへ向け確かな手ごたえ,https://news.yahoo.co.jp/articles/1e9b85422757cb48a60b9f2dd4e0cdff263ba601,3/4(月) 14:27
nbn,メ?テレ（名古屋テレビ）,ドラゴンズ中田が移籍後初ヒット　「気持ちよく打席に立てた」,https://news.yahoo.co.jp/articles/67ea8b47d92df49fea1636adf3d7e37b6f661f0e,3/4(月) 14:21
nbn,メ?テレ（名古屋テレビ）,我が子が「おひなさま」姿に…幼稚園で「ひな祭りの会」　岐阜県高山市,https://news.yahoo.co.jp/articles/bbf44dff6d249713cff1b1b63554eb3df235f7a4,3/4(月) 12:46
nbn,メ?テレ（名古屋テレビ）,トヨタの全完成車工場が稼働　豊田自動織機のエンジン検査不正　岐阜と三重の工場の各1ラインが再開,https://news.yahoo.co.jp/articles/cf8117d54177697a9dd9d0a7afd09ff873a892b9,3/4(月) 12:41
nbn,メ?テレ（名古屋テレビ）,市長「何の金をそんなに集めないといけないか」　名古屋市教委の金品授受　指導室が300万円を受け取る,https://news.yahoo.co.jp/articles/078fb9d5f0a1f7f4630b12f5c8ba48c45e4275bd,3/4(月) 12:36
nbn,メ?テレ（名古屋テレビ）,舞台は蒲郡へ　「ラリー三河湾」開催　豊田章男会長もラリー走行披露,https://news.yahoo.co.jp/articles/37a200833d0d5d2fec65b92c5fa1892d39d20902,3/4(月) 7:12
nbn,メ?テレ（名古屋テレビ）,棋王戦第3局は藤井八冠が勝利　タイトル初防衛に王手,https://news.yahoo.co.jp/articles/f8f48ec69d1667213900e2d1c51a87894cf3915b,3/3(日) 22:38
nbn,メ?テレ（名古屋テレビ）,豊川を渡る人力の渡し船「牛川の渡し」が運航再開　去年の大雨で被災し船が破損　愛知県豊橋市,https://news.yahoo.co.jp/articles/a5543a79224b652eed3c702f04fc0d8ecf5774e7,3/3(日) 18:35
nbn,メ?テレ（名古屋テレビ）,賃金引き上げを訴え、連合愛知の組合員らがデモ行進　春闘は13日に集中回答日迎える　愛知,https://news.yahoo.co.jp/articles/94e311fbd36983c097ea62ce575a7d6119c2ac55,3/3(日) 18:35
nbn,メ?テレ（名古屋テレビ）,農業水路沿い約350本の河津桜が見ごろ　「笠松河津桜ロード」として地元の桜の名所　三重県松阪市笠松町,https://news.yahoo.co.jp/articles/f4673a36bf737e2ca539544c6785e643ff817ba3,3/3(日) 18:35
nbn,メ?テレ（名古屋テレビ）,飛騨高山雛まつり　京風雛や200年前に作られた豪華な雛人形の展示も　岐阜県高山市,https://news.yahoo.co.jp/articles/81002a6787e39aa38c56df5d116e6be8a1c70221,3/3(日) 12:54
nbn,メ?テレ（名古屋テレビ）,全日本ラリーの第1戦「ラリー三河湾」　新城ラリーから舞台を蒲郡市などに移す　愛知,https://news.yahoo.co.jp/articles/66575eb2835bc10b697f2a1c636a59344232ac27,3/3(日) 12:54
nbn,メ?テレ（名古屋テレビ）,藤井聡太八冠が「棋王」防衛目指す…第3局が新潟市で始まる　今季は藤井八冠が1勝1分,https://news.yahoo.co.jp/articles/4d9cc94e477d9878cf510b81b4ab8d0f53576231,3/3(日) 12:50
nbn,メ?テレ（名古屋テレビ）,「棋王」の初防衛がかかる藤井聡太八冠　棋王戦第3局の前日検分が行われる,https://news.yahoo.co.jp/articles/5b0f03a7478bf89689a5193c492082981073ca29,3/2(土) 18:25
nbn,メ?テレ（名古屋テレビ）,スイカが変身　エンジニアのあっと驚く作品を展示　カリヤマイクロメイカーフェア2024,https://news.yahoo.co.jp/articles/64d967ed9a09f5aa1502164549443ccae673f001,3/2(土) 18:20
nbn,メ?テレ（名古屋テレビ）,動物たちがベビーラッシュを迎える　すくすくと育ち可愛らしい姿　牧歌の里,https://news.yahoo.co.jp/articles/e10d47f556e00e5697f9b7dc78dea1b62933a31a,3/2(土) 18:15
nbn,メ?テレ（名古屋テレビ）,フィギュア吉田陽菜「すごく濃い3年間だった」　中京大中京高校を卒業　3年間で確実にステップアップ,https://news.yahoo.co.jp/articles/8ade6a39cb2362aae0db471761645f6ea133161b,3/2(土) 17:37
nbn,メ?テレ（名古屋テレビ）,高級ミカン「はるぽん」収穫始まる　木についたまま2カ月熟成　三重・紀宝町,https://news.yahoo.co.jp/articles/7e611364640df893097ea38e10d8147d8eefa700,3/2(土) 13:38
nbn,メ?テレ（名古屋テレビ）,電車の運転シミュレーターなど体験　日本モンキーパークに新施設「モンキーパーク駅」　愛知,https://news.yahoo.co.jp/articles/b8cb480d8e10e6ece7d08cf4459cb757a3dfe83d,3/2(土) 13:34
nbn,メ?テレ（名古屋テレビ）,能登半島地震　被災地の課題を参考に　市民病院でDMATが参加し災害訓練　岐阜市,https://news.yahoo.co.jp/articles/58d6e24df64427704ee2e1d9a6a07aa22a81c35d,3/2(土) 13:29
nbn,メ?テレ（名古屋テレビ）,変わらぬ友情を誓い合う「白線流し」　5年ぶりに在校生も全員参加して実施　岐阜,https://news.yahoo.co.jp/articles/e6d9cbd2eca8f622ef2dfd3dacbaf87b3b9fe705,3/1(金) 19:17
nbn,メ?テレ（名古屋テレビ）,"3月も700品目以上が値上げの春…でも店頭価格の上昇は「もう少し先」になる""からくり""",https://news.yahoo.co.jp/articles/42cdc49b8adec259b65fa44adae167da04dc4494,3/1(金) 18:58
nbn,メ?テレ（名古屋テレビ）,三十三銀行の男性行員が約3200万円を着服　顧客の自宅の現金を盗む　時計など購入,https://news.yahoo.co.jp/articles/4aefc19e26949185e1b43c4a0dbd79f81e92e028,3/1(金) 18:47
nbn,メ?テレ（名古屋テレビ）,盗撮・下着窃盗・痴漢…23件に関与　男性警部補を懲戒処分　三重県警,https://news.yahoo.co.jp/articles/4d3b6b0a2bed5f6bf20020ec606ddd3850f43173,3/1(金) 18:27
nbn,メ?テレ（名古屋テレビ）,消火用の「泡」が道路にあふれ出る　車が消火設備にぶつかったか　名古屋,https://news.yahoo.co.jp/articles/06b55b5f498de307e383366fbac010d33775bb73,3/1(金) 18:16
nbn,メ?テレ（名古屋テレビ）,就活解禁、「すでに内定2割超」のデータも…“売り手市場”で学生が重視するのは,https://news.yahoo.co.jp/articles/c0134cd53d9b6d2e6aca7fc59d54018c86b75623,3/1(金) 17:03
nbn,メ?テレ（名古屋テレビ）,市立中学校に初めて自販機を設置　災害時は飲料を無料で提供　名古屋,https://news.yahoo.co.jp/articles/218512e9f420ab6b215a4f4433475323dd41ea8d,3/1(金) 16:54
