media_en,media_jp,title_articles,link_articles,date_original
nbn,メ?テレ（名古屋テレビ）,「“独身最後”のHRボールなのかなと…」大谷翔平選手の結婚発表に愛知からも祝福の声,https://news.yahoo.co.jp/articles/033580691190e2bcc1dbbaeb4297cd106d0af8d0,3/1(金) 16:37
nbn,メ?テレ（名古屋テレビ）,システム不具合で戸籍証明書の交付申請の受付を停止　本籍地が市外の人が対象　名古屋市,https://news.yahoo.co.jp/articles/1876cac73d8a335c2b2ab00a83b635824ca72e1c,3/1(金) 14:37
nbn,メ?テレ（名古屋テレビ）,ドラゴンズV奪還へ「期待の選手は？」　沖縄キャンプでファン300人に聞いた,https://news.yahoo.co.jp/articles/1192e5389ee3855ce8e96cb3d7e1fbfe25bbd0ef,3/1(金) 14:25
nbn,メ?テレ（名古屋テレビ）,葬儀会場で酒を飲んだ後に車を運転し事故　教育委員会に所属する男性職員を懲戒免職処分　愛知・岡崎市,https://news.yahoo.co.jp/articles/d7195a8f7fa45bcbc17f1b75ee2c8bb58b331cd8,3/1(金) 14:20
nbn,メ?テレ（名古屋テレビ）,踏切事故　助けようとして事故に巻き込まれた男性に感謝状　愛知県警,https://news.yahoo.co.jp/articles/9de39fdb58f3ccf9c963b0ea089051e0dbd3c2db,3/1(金) 14:00
nbn,メ?テレ（名古屋テレビ）,電動キックボードにひき逃げされ歩行者がけが　乗っていた男性に罰金50万円の略式命令,https://news.yahoo.co.jp/articles/c183382456a37677e40ac03e1a91debc17f50550,3/1(金) 12:36
nbn,メ?テレ（名古屋テレビ）,新卒採用の会社説明会が解禁　旅行系・ＩＴ系の業種が人気　合同会社説明会,https://news.yahoo.co.jp/articles/8e5db8c3739196d9bcb6acdeb951670c977ff2ca,3/1(金) 12:24
nbn,メ?テレ（名古屋テレビ）,99のセクハラ認定の岐南町長　辞職は町議会で全会一致で同意　小島町長は欠席,https://news.yahoo.co.jp/articles/ffe67c10de5d3a9bab705393606ce1354b44fbd8,3/1(金) 11:02
nbn,メ?テレ（名古屋テレビ）,指定薬物「HHCH」所持の疑いで愛知県警が会社員の男ら2人を逮捕,https://news.yahoo.co.jp/articles/fc000df2e32f6da541adf841e5fce5996c0a6146,3/1(金) 7:38
nbn,メ?テレ（名古屋テレビ）,春日井市の県立高校卒業式お祝いメッセージで愛知県議「コロナはねつ造」と自論展開,https://news.yahoo.co.jp/articles/cd4e0bc042fb7577be686a0c95d0c0bda1818122,3/1(金) 7:23
nbn,メ?テレ（名古屋テレビ）,藤井聡太名人への挑戦者は一宮市出身豊島将之九段に　愛知出身者同士で名人戦七番勝負戦う,https://news.yahoo.co.jp/articles/f0c39bbd1163c6690c2e28df1e69547cde8f7f1d,3/1(金) 5:00
nbn,メ?テレ（名古屋テレビ）,地震発生で水道管が漏水したら…水道職員対象に研修会　愛知県尾張旭市,https://news.yahoo.co.jp/articles/785ac4c410f326b924b3c45f4f31ecb56ba1665a,2/29(木) 22:23
nbn,メ?テレ（名古屋テレビ）,ドラ柳投手が交通安全大使に　自身も交通事故で父親亡くし「悲しい思い減らしたい」,https://news.yahoo.co.jp/articles/3f9a92b3be0850b75bd21dbf83cff3ae9761ce78,2/29(木) 22:18
nbn,メ?テレ（名古屋テレビ）,市教委の金品受け取り問題　 新年度の人事を重点的に調査へ　名古屋,https://news.yahoo.co.jp/articles/87dadb5c55e67bd03759879e33c4706a6bfe0a3f,2/29(木) 19:27
nbn,メ?テレ（名古屋テレビ）,「スギ薬局」でシステム障害　うるう年の影響でシステム障害　処方薬の会計が一時不能に,https://news.yahoo.co.jp/articles/5e53919121e4b9ae3e016b391853961d23f446d7,2/29(木) 19:22
nbn,メ?テレ（名古屋テレビ）,藤井聡太八冠「観戦者として対局が楽しみ」　名人のタイトル挑戦者を決める対局,https://news.yahoo.co.jp/articles/97c6656e44d219e314d5b0e4c75997b7f6cb1090,2/29(木) 19:17
nbn,メ?テレ（名古屋テレビ）,“99のセクハラ”なぜ防げなかった　「議員時代からの積み重ねで言えない雰囲気に…」副町長の反省の弁,https://news.yahoo.co.jp/articles/64a332457bc80615d5e592adc76e945c1fc650e8,2/29(木) 19:04
nbn,メ?テレ（名古屋テレビ）,根尾は笑顔の“神”対応・ファン大興奮の中田翔フィーバー…ドラゴンズ沖縄キャンプの裏側,https://news.yahoo.co.jp/articles/4a3b3e143d48d30471a07e8adcd44aa9acc47fd9,2/29(木) 17:41
nbn,メ?テレ（名古屋テレビ）,SDGs活動の一環・ファミマの食品ロスを減らす取り組み　3000店舗を達成　名古屋,https://news.yahoo.co.jp/articles/b83358184476dcc3bf8f46e741c5b9007004e146,2/29(木) 17:41
nbn,メ?テレ（名古屋テレビ）,フォーリミ・GENさん　母校をサプライズ訪問「口に出すと夢は本当に叶う」　愛知,https://news.yahoo.co.jp/articles/114a696737c41a3553aaf189ea18b8d116026d2e,2/29(木) 17:29
nbn,メ?テレ（名古屋テレビ）,「半休で気が緩んだ」酒気帯び運転で通勤　名古屋市の職員が懲戒免職,https://news.yahoo.co.jp/articles/f1213271e77903f5da58365de1355e7708e55246,2/29(木) 17:01
nbn,メ?テレ（名古屋テレビ）,ジブリの大倉庫に「ちょっと付け足し」　宮崎吾朗監督が新エリアで特にお気に入りのスポットは,https://news.yahoo.co.jp/articles/dc9ea7b585d3664c685b6ac2c86b960017f592aa,2/29(木) 16:49
nbn,メ?テレ（名古屋テレビ）,“99のセクハラ”で辞職届「何も言うことないです。こちらも被害者」　岐阜・岐南町の小島英雄町長,https://news.yahoo.co.jp/articles/fdf41e9f777e890d01c024a4286021de1efe72d6,2/29(木) 16:42
nbn,メ?テレ（名古屋テレビ）,天然温泉を運ぶタンクローリーなどが珠洲市へ出発　2日間で約15トン　下呂温泉,https://news.yahoo.co.jp/articles/9d756631351e3ba33978461403b3bf7c86599672,2/29(木) 16:23
nbn,メ?テレ（名古屋テレビ）,「ジブリの大倉庫」に新オブジェ 　『君たちはどう生きるか』をモチーフ　愛知,https://news.yahoo.co.jp/articles/7091584495db4f7b7bc6646a0c673069fb9b7941,2/29(木) 12:33
nbn,メ?テレ（名古屋テレビ）,女性を殺害し畑に死体を遺棄した罪などに問われた女　初公判で起訴内容を認める,https://news.yahoo.co.jp/articles/20108b7244712ffab057c4b31ecc0dca54315937,2/29(木) 12:28
nbn,メ?テレ（名古屋テレビ）,99件のセクハラ認定の岐南町長　辞職届を提出「自分自身はふがいないと思っています」,https://news.yahoo.co.jp/articles/c0e67f0237c7ed284388b6de29e55d6fd490cf4c,2/29(木) 10:48
nbn,メ?テレ（名古屋テレビ）,セクハラ認定の岐南町長「心が折れた」「ガッツがなくなった」会見後に考え一転 3月5日に辞職表明　岐阜,https://news.yahoo.co.jp/articles/d267c5450ae7f3f25236df242df724027996aa7d,2/28(水) 20:18
nbn,メ?テレ（名古屋テレビ）,「心が折れた」セクハラ認定の岐南町長が一転、3月辞職へ…セクハラ、障害児差別発言記した報告書に反論,https://news.yahoo.co.jp/articles/8a4a980063c057b3f383947570577a287c0c6618,2/28(水) 19:26
nbn,メ?テレ（名古屋テレビ）,"【速報】""セクハラ認定""岐阜・岐南町の小島英雄町長が辞意　報道陣に「3月5日に辞めます」",https://news.yahoo.co.jp/articles/b213f619895954039649197a1260ac5e12c2d24e,2/28(水) 18:36
nbn,メ?テレ（名古屋テレビ）,ジブリパーク新エリア「魔女の谷」公開　高さ20メートル“ハウルの城”は存在感十分,https://news.yahoo.co.jp/articles/fa12ab49cc0298c1fca03cb5723e648959bd7479,2/28(水) 18:05
nbn,メ?テレ（名古屋テレビ）,トヨタの国内販売実績が前年割れ　1月、ダイハツ不正による生産停止が影響,https://news.yahoo.co.jp/articles/7b88a9678e14f12e62b3ef114131b67ddbe31983,2/28(水) 17:52
nbn,メ?テレ（名古屋テレビ）,有識者「動機の解明に重点」真相究明は法廷の場へ　陸自3人死傷事件で19歳男を起訴・実名公表,https://news.yahoo.co.jp/articles/4685168259b9a104a0521292378f901e59fc1061,2/28(水) 17:38
nbn,メ?テレ（名古屋テレビ）,国の有形文化財「銀花荘」で江戸時代の珍しいひな人形展示　岐阜・下呂市,https://news.yahoo.co.jp/articles/e00cf0591284e76d713348c8399686138d7f87da,2/28(水) 17:19
nbn,メ?テレ（名古屋テレビ）,ゴールデンウィークの東海道新幹線に「お子さま連れ車両」　JR東海が設定へ,https://news.yahoo.co.jp/articles/e81e7abac025f014380691c3f8a90c1a959f85dd,2/28(水) 17:16
nbn,メ?テレ（名古屋テレビ）,愛知県、新型コロナ後遺症の有無や症状把握のため実態調査へ　後遺症患者の支援策を検討,https://news.yahoo.co.jp/articles/98b5aac23b4b22f31fcec872a6bd14c8e94a22e6,2/28(水) 17:13
nbn,メ?テレ（名古屋テレビ）,トヨタの工場すべて再開へ　豊田自動織機のエンジン検査不正問題受け稼働停止,https://news.yahoo.co.jp/articles/2b483f99a17beb49a30614f0d3ea2fbad38a7bfc,2/28(水) 16:56
nbn,メ?テレ（名古屋テレビ）,「記憶を取り戻したい。悔しさしかない」子宮頸がんワクチン接種集団訴訟　名古屋地裁で原告が思いを語る,https://news.yahoo.co.jp/articles/80a27a263aafcb93f39d463e3023c756c228644e,2/28(水) 14:00
nbn,メ?テレ（名古屋テレビ）,ネコバスのナンバーは「と10ー6」、ジブリパーク初、乗り物のアトラクションにも注目,https://news.yahoo.co.jp/articles/1c9eff2174bc4cdf43e6d2806a078bd6776db6ac,2/28(水) 13:31
nbn,メ?テレ（名古屋テレビ）,"""99のセクハラ行為""認定の岐阜・岐南町長、任期満了前に辞職する意向明かす",https://news.yahoo.co.jp/articles/f157c8d165f5b6e827df013c2a5506444235caa4,2/28(水) 12:29
nbn,メ?テレ（名古屋テレビ）,「開かれた議会」へ一歩…議場に授乳・おむつ替えスペースを設置　愛知県豊橋市,https://news.yahoo.co.jp/articles/6ba3f7a49bfbc7355c8d1c7a424f3adc5e53aeda,2/27(火) 19:00
nbn,メ?テレ（名古屋テレビ）,スギ薬局が東海3県の高齢者施設にAEDを寄贈,https://news.yahoo.co.jp/articles/7504dacb7441ea51354266b8a50ef25b3612a926,2/27(火) 18:12
nbn,メ?テレ（名古屋テレビ）,桜花学園高の女子生徒らが会社設立　コーヒー販売で途上国への支援活動,https://news.yahoo.co.jp/articles/adc99da23a17330eea1670ab484b68679f40586e,2/27(火) 15:31
nbn,メ?テレ（名古屋テレビ）,町長の「少なくとも99のセクハラ行為」を認定　岐阜・岐南町の第三者委「即時の辞職を」,https://news.yahoo.co.jp/articles/76786cfe116d1e323b0eaf40ee49997512bb54a4,2/27(火) 15:11
nbn,メ?テレ（名古屋テレビ）,愛知県内で2023年にあった火災、前年比で150件以上増加　県が火災予防を呼びかけ,https://news.yahoo.co.jp/articles/07c88acd8aab0875412a890e3e82901d710269e1,2/27(火) 14:40
nbn,メ?テレ（名古屋テレビ）,ウクライナ侵攻から2年「日本で生きるため力を合わせる」　従軍していた父と家族の決断,https://news.yahoo.co.jp/articles/89a2c457ed9f45283cfb9b05997dee11b5a57f1b,2/27(火) 14:05
nbn,メ?テレ（名古屋テレビ）,【愛知フィギュア】松生理乃「大好きなプログラム」演じ切り優勝　田内誠悟は演技構成点でトップをマーク,https://news.yahoo.co.jp/articles/f1eb73e1b307f6b20c69af846fb87d770debe128,2/27(火) 13:52
nbn,メ?テレ（名古屋テレビ）,ジブリパークで「ネコバス」お披露目　新エリア「魔女の谷」に合わせ3月から運行,https://news.yahoo.co.jp/articles/38fff91f7cd266f65c23d0e6163a898f247903ad,2/27(火) 12:40
nbn,メ?テレ（名古屋テレビ）,路線バス車内で刃物トラブルに対応する訓練　警察との連携手順を確認　岐阜・高山市,https://news.yahoo.co.jp/articles/65a13219857d8def99f5714e7a619282108fdbb7,2/27(火) 12:17
nbn,メ?テレ（名古屋テレビ）,太陽光発電パネル　ブームで設置後、一斉に大量廃棄の懸念…老朽化以外にも原因が,https://news.yahoo.co.jp/articles/964a382fdb4d9bf0c12383f954f98be8f11cc9b5,2/27(火) 11:30
nbn,メ?テレ（名古屋テレビ）,クマが市街地に出没した想定で訓練　猟友会が猟銃で撃つことなど確認　三重,https://news.yahoo.co.jp/articles/13f331fdc33e5dfe31c2ed675b05fcdcf18a7797,2/26(月) 19:23
nbn,メ?テレ（名古屋テレビ）,市教委の金品受領問題…人事担う部署以外の部署でも金品を受領　詳細は「調査中」　名古屋市,https://news.yahoo.co.jp/articles/263d3124f098c33e968dcc114e6b6ca80e3c6e7e,2/26(月) 19:02
nbn,メ?テレ（名古屋テレビ）,ハラスメント問題で揺れる愛知県東郷町　議会が始まるも町長は途中退席,https://news.yahoo.co.jp/articles/ced0c2938edd06673aa5a931d7d444b47333d973,2/26(月) 17:16
nbn,メ?テレ（名古屋テレビ）,竹の折れた方角で今年の運勢を占う奇祭「きねこさ祭」 　厄年の男たちが五穀豊穣を祈願,https://news.yahoo.co.jp/articles/25c76027b2ec594db977fff3f3ebb61eee359fbe,2/26(月) 17:02
nbn,メ?テレ（名古屋テレビ）,株高でも「バブルの時は世の中が楽しい感じだった」　恩恵感じにくい市民　名古屋で聞いた,https://news.yahoo.co.jp/articles/ee30937bbbf9c498a4b2cbed62ea8f87eee5927b,2/26(月) 16:49
nbn,メ?テレ（名古屋テレビ）,プラスチック製品、「可燃ごみ」→「資源」へ　名古屋市が動画で呼びかけ,https://news.yahoo.co.jp/articles/734017f16503816e0a88e8511e8ec99f1fab51cb,2/26(月) 12:22
nbn,メ?テレ（名古屋テレビ）,細川成也「僕自身勝負の年」　待望の初ヒットはレフトへのタイムリー【ドラゴンズ オープン戦25日 】,https://news.yahoo.co.jp/articles/081a805be53e98c0ebd2307ec177dbc26dc7c3b2,2/26(月) 12:09
nbn,メ?テレ（名古屋テレビ）,根尾昂が4回を投げ1失点　 開幕ローテへアピール【ドラゴンズオープン戦　24日】,https://news.yahoo.co.jp/articles/e90bee387e95ac552dc471a02cbcbe66e96628c7,2/26(月) 11:42
nbn,メ?テレ（名古屋テレビ）,中部空港で地上業務の採用合同説明会 約500人が参加「グランドスタッフをやってみたい」 愛知県常滑市,https://news.yahoo.co.jp/articles/8a44521987c6623a7d65065d5e51d8007c707d44,2/25(日) 22:27
nbn,メ?テレ（名古屋テレビ）,アジアパラ大会 幹部らが競技場視察　既存宿泊施設の活用は「大会のレガシーに」 愛知県,https://news.yahoo.co.jp/articles/18f0bc1fb8ef99cb62ad0b68e6cbeb99271d488c,2/25(日) 22:16
nbn,メ?テレ（名古屋テレビ）,リニア残土受け入れ是非 町長に判断委ねる　審議会の答申は両論併記に　岐阜・御嵩町,https://news.yahoo.co.jp/articles/94583c96f4443b2112591668ea1652ad435fe832,2/24(土) 23:25
nbn,メ?テレ（名古屋テレビ）,「特別な駒だと思うのでいい将棋にしたかった」金沢での棋王戦第2局は藤井八冠が勝利　被災した駒を使用,https://news.yahoo.co.jp/articles/8cb1a53c075eae1fdcaa66bd7ff83cd32946e62e,2/24(土) 23:14
nbn,メ?テレ（名古屋テレビ）,ロシアによるウクライナ侵攻から2年　名古屋でウクライナ避難民らが反戦のデモ行進,https://news.yahoo.co.jp/articles/dd3d6b85ec6154f827d4516327af7401e2674fb7,2/24(土) 18:19
nbn,メ?テレ（名古屋テレビ）,サッカーなどのスポーツができる人工芝のグラウンドが完成しオープニングセレモニー　愛知県愛西市,https://news.yahoo.co.jp/articles/aeb38af635a3b62925ec8dcdf86f6b64da5fa9d6,2/24(土) 18:19
nbn,メ?テレ（名古屋テレビ）,停留所からレスラーが続々入場！路面電車がプロレスのリングに…乗客の間近で激アツなバトル　愛知・豊橋市,https://news.yahoo.co.jp/articles/4e2dea0ad677c356a3fe607e0992d615e8b7fd5b,2/24(土) 13:30
nbn,メ?テレ（名古屋テレビ）,新しい芽が膨らんでくる季節に…リンゴの木の枝の剪定作業　岐阜県高山市の果樹園,https://news.yahoo.co.jp/articles/6ff546d18f5b3019e5b15b33ca402bcd1e644981,2/24(土) 12:30
nbn,メ?テレ（名古屋テレビ）,能登半島地震で被災の駒を使用　藤井八冠が防衛目指す棋王戦五番勝負の第2局が始まる,https://news.yahoo.co.jp/articles/b5114190f8c1c1cceb25c0bdc1d133b43d90b2a6,2/24(土) 12:30
nbn,メ?テレ（名古屋テレビ）,中田翔が4番スタメンも無安打…移籍後初安打は次戦以降にお預け【ドラゴンズオープン戦】,https://news.yahoo.co.jp/articles/f6fcd4a8f3859b5de7bc7d042650af21b12102b4,2/24(土) 8:54
nbn,メ?テレ（名古屋テレビ）,能登半島地震で倒壊した家屋から探し出された将棋駒　棋王戦第2局の舞台で使用される,https://news.yahoo.co.jp/articles/ea20b9240dd61b8cb61e679c1742b4e5121c9e13,2/23(金) 22:32
nbn,メ?テレ（名古屋テレビ）,普段は立ち入り禁止　鉄道ファンの聖地「枇杷島の三角地帯」　イベントで開放,https://news.yahoo.co.jp/articles/976b17d989a9b604ed16d5509808cbe50e4de2b0,2/23(金) 19:27
nbn,メ?テレ（名古屋テレビ）,"SDGsな「竹取プロジェクト」三重・桑名市で進む　""名古屋めし""の有名店も参加",https://news.yahoo.co.jp/articles/63c3cf3cbb8117e18b97306a493c34c89b644aa1,2/23(金) 17:37
nbn,メ?テレ（名古屋テレビ）,3つ子のコツメカワウソがすくすく成長　アクア・トトぎふで一般公開,https://news.yahoo.co.jp/articles/278578687070df9fe8d152b00b939d3a4dc4690e,2/23(金) 17:16
nbn,メ?テレ（名古屋テレビ）,圧倒的な運動量と果敢な仕掛けが持ち味　名古屋グランパスのキーマン・久保藤次郎に迫る,https://news.yahoo.co.jp/articles/c17ad43a527f9ee8c8429fbededfb3707b5a594a,2/23(金) 16:53
nbn,メ?テレ（名古屋テレビ）,激しいもみ合いから一夜明けても神事は続く　完全復活した「国府宮はだか祭」,https://news.yahoo.co.jp/articles/0ec9ae10f47de61878373d9ba94206500ecf1238,2/23(金) 16:39
nbn,メ?テレ（名古屋テレビ）,熱田神宮で「天長祭」　天皇陛下の誕生日を祝い健康と国民の平和を祈願,https://news.yahoo.co.jp/articles/2851ca246f7535bcdb4d3972ddc1435eb4052c6e,2/23(金) 12:21
nbn,メ?テレ（名古屋テレビ）,柳裕也「今年こそ下剋上の年に…」1軍打ち上げ【ドラゴンズ沖縄キャンプ】,https://news.yahoo.co.jp/articles/e2fd08d55552b1f45109bea3530029cb8a6817df,2/23(金) 11:24
nbn,メ?テレ（名古屋テレビ）,「上げ馬神事」馬が駆け上がる壁をなくすことなど決定　神事中は万が一の負傷に備える,https://news.yahoo.co.jp/articles/7063d06cfa74c0cf39a306709c169f8b7eb65fae,2/22(木) 19:54
nbn,メ?テレ（名古屋テレビ）,バットで殴り殺害・遺体を山林に遺棄した罪に問われた男　懲役20年の判決 　津地裁,https://news.yahoo.co.jp/articles/e62ec56e29b939e3b4e0458052973ea7ddf6d9e4,2/22(木) 19:30
nbn,メ?テレ（名古屋テレビ）,“頂き女子りりちゃん”を名乗る女に接見　元ホストの男は「ホストっぽくない人でした」,https://news.yahoo.co.jp/articles/b0ce477a2df5442923d40a43c51bfedfae12dd92,2/22(木) 19:17
nbn,メ?テレ（名古屋テレビ）,母から受け継いだ着物が娘のひな人形によみがえる　新たな命を吹き込む伝統工芸士の職人技,https://news.yahoo.co.jp/articles/ff5d70d49d036439b9fa14e1fecde9e73e8ad83c,2/22(木) 19:01
nbn,メ?テレ（名古屋テレビ）,再起をめざすストライカー　グランパスのベテラン永井謙佑　家族と共に歩む新シーズン,https://news.yahoo.co.jp/articles/a5afae21cf0fbe546536be8a804423d815064274,2/22(木) 17:42
nbn,メ?テレ（名古屋テレビ）,補助金をだまし取ったとして逮捕された市議　議長が市議の辞職願を許可　岐阜県瑞穂市,https://news.yahoo.co.jp/articles/451b30a7325c31755a488c8af5f6b46d4294537b,2/22(木) 16:56
nbn,メ?テレ（名古屋テレビ）,公立高校の一般入試で学力検査　約3万3000人が受験　5教科の試験に臨む　愛知,https://news.yahoo.co.jp/articles/63ac41657ea7f01c5c80d86ac5d2a59849bc71d6,2/22(木) 16:43
nbn,メ?テレ（名古屋テレビ）,「スガキヤ」が定番のラーメン40円値上げへ　原材料価格などが上がった影響,https://news.yahoo.co.jp/articles/1ddff0c49b497e6dcff6e37357711dbeaa468062,2/22(木) 15:20
nbn,メ?テレ（名古屋テレビ）,ボードゲームで楽しく学ぶ「防災」、子どもの好奇心を刺激しながら命を守る教育　愛知県豊田市の小学校,https://news.yahoo.co.jp/articles/4dd3e22fa89c4065a6dc3702b36964e20409353c,2/22(木) 14:00
nbn,メ?テレ（名古屋テレビ）,「はだか祭」の神事に女性が初参加　願いが書かれた布を結び付けた儺追笹を奉納　愛知,https://news.yahoo.co.jp/articles/d60c2739fca81bd0d9a507a0d7099339d5e75f6d,2/22(木) 12:45
nbn,メ?テレ（名古屋テレビ）,レギュラーを目指す鵜飼航丞　2安打4打点・痛快なバッティング【ドラゴンズ沖縄キャンプ】,https://news.yahoo.co.jp/articles/47d7aec0ca00c46c301c77a32f21c8aa8d64d7c1,2/22(木) 11:30
nbn,メ?テレ（名古屋テレビ）,名古屋市教育委員会の金品問題で調査検証チームが初会合　座長の寺脇研教授「安心してもらえる報告を」,https://news.yahoo.co.jp/articles/8304756285da7d4a2acffd40da2c79162e5670d7,2/22(木) 1:35
nbn,メ?テレ（名古屋テレビ）,愛知医科大で合否判定ミス　共通テスト利用の医学部受験80人をPC操作誤り「不合格」に,https://news.yahoo.co.jp/articles/ced4d7fd64d9e19aa8e364e4f4d0c60037022330,2/22(木) 0:44
nbn,メ?テレ（名古屋テレビ）,名古屋市中村区の介護老人保健施設でノロウイルスによる食中毒,https://news.yahoo.co.jp/articles/5d596b43a7aa0c57fbc863e61795a8e30428eaef,2/21(水) 21:52
nbn,メ?テレ（名古屋テレビ）,1250年以上続く「天下の奇祭」に女性が初めて参加へ「歴史に残る１ページを」　国府宮はだか祭あす開催,https://news.yahoo.co.jp/articles/a0dcea736f06bccd439dddd0fc80b52d47399fe9,2/21(水) 20:05
nbn,メ?テレ（名古屋テレビ）,ショークラブで無許可で風俗営業をしたとして逮捕された男性2人を不起訴処分　名古屋地検,https://news.yahoo.co.jp/articles/2e1c27ae15eb8cc9721e87ebea568ce2ff885be5,2/21(水) 18:27
nbn,メ?テレ（名古屋テレビ）,震災で大打撃の輪島塗…伝統を絶やさぬために職人らが名古屋で作品展,https://news.yahoo.co.jp/articles/ca2aebc8413a080329ba64606e5112e06f3dea2a,2/21(水) 17:44
nbn,メ?テレ（名古屋テレビ）,横断する際の注意点など身を守るための行動を学ぶ　園児らを対象にした交通安全教室　愛知,https://news.yahoo.co.jp/articles/f4fc1ed74b6401d53b291244ed7d960d8e55be99,2/21(水) 14:00
nbn,メ?テレ（名古屋テレビ）,現役消防士が作るこだわりの地ビール 「“美濃加茂”を発信したい」売上の一部は地域貢献に活用　岐阜,https://news.yahoo.co.jp/articles/23f051301652b4a81f7789e38f521c64e28c705b,2/21(水) 13:40
nbn,メ?テレ（名古屋テレビ）,石川昂弥が猛アピール　井上2軍監督「走・攻・守すべて合格」1軍へGOサイン【ドラゴンズ沖縄キャンプ】,https://news.yahoo.co.jp/articles/2ac711373f4e2b6f067852f0b554d81afe2b759c,2/21(水) 13:15
nbn,メ?テレ（名古屋テレビ）,重さ4トン「大鏡餅」のパレード　沿道などには大勢の市民が駆けつける　愛知,https://news.yahoo.co.jp/articles/5415a22924aa85f6ce1566d61d7670e980636010,2/20(火) 19:23
nbn,メ?テレ（名古屋テレビ）,「ぴよりん」にライバルが登場　名鉄運輸のキャラクターがケーキに　構想から約1年半,https://news.yahoo.co.jp/articles/009dc2ca381a2625fb818554ccabd5497f3ef8d5,2/20(火) 18:04
nbn,メ?テレ（名古屋テレビ）,新幹線車内での殺傷事件想定の訓練　愛知県警とJR東海が連携、実際の車両で手順確認,https://news.yahoo.co.jp/articles/9f8c5ab35b558d7844e1aa3281b79753de2c7ec7,2/20(火) 17:02
nbn,メ?テレ（名古屋テレビ）,火災報知器の誤作動が相次ぐ　消防出動は66件、大雨、濃霧…トラブルの条件が重なる,https://news.yahoo.co.jp/articles/b732f9bed59abe7fb64133cdcfcb2d854cbc1dad,2/20(火) 16:39
nbn,メ?テレ（名古屋テレビ）,伝統工芸の伊勢型紙を後世へ「今の時代を残したい」“新たな形”で受け継ぐ、若き七代目に密着,https://news.yahoo.co.jp/articles/5b91f5c31e3ed231dc0bac6d3d4f2f46d16f45ad,2/20(火) 13:30
nbn,メ?テレ（名古屋テレビ）,三重・尾鷲市の保育園で南海トラフ想定の避難訓練　防災頭巾かぶり落ち着いて行動,https://news.yahoo.co.jp/articles/33294da57c31ba8dc309b8faf6cd3fc9f936a445,2/20(火) 12:31
nbn,メ?テレ（名古屋テレビ）,名古屋市議会2月定例会始まる　一般会計総額1兆4千億円の来年度当初予算案を審議,https://news.yahoo.co.jp/articles/5228301e8694343e85180a04872447037135cc7d,2/20(火) 12:31
nbn,メ?テレ（名古屋テレビ）,小学校の給食で13人が食中毒　マカロニグラタンなど食べる　ノロウイルスと断定　三重県鳥羽市,https://news.yahoo.co.jp/articles/462de6f6d7a9f10bc1f07b9535970e6892046d08,2/19(月) 19:21
