media_en,media_jp,title_articles,link_articles,date_original
nbn,メ?テレ（名古屋テレビ）,天下の奇祭「国府宮はだか祭」神男が“おこもり”三日三晩神社に　俗世間と縁切り身を清める,https://news.yahoo.co.jp/articles/767a7e7a9ff196e8d4677ab904abcf52ff300df2,2/19(月) 19:08
nbn,メ?テレ（名古屋テレビ）,ジブリパーク新エリア「魔女の谷」を一望できる展望台を整備　宮崎吾朗監督がデザインしたオブジェなど設置,https://news.yahoo.co.jp/articles/038014ab1495e6b431ae23213bbcae8049c23ccb,2/19(月) 17:58
nbn,メ?テレ（名古屋テレビ）,運行情報を確認できる大型モニターを導入　3月から運用開始　名古屋市営地下鉄,https://news.yahoo.co.jp/articles/a02ed2b2137221cdee4d25ebf00ea876b786b91b,2/19(月) 17:05
nbn,メ?テレ（名古屋テレビ）,愛知の高校生らが土日利用し被災地でボランティア活動、被災者「本当に助かった」広がる支援の輪,https://news.yahoo.co.jp/articles/d384076afe0681e7bbb141cb8dfaa70e1ab22259,2/19(月) 17:05
nbn,メ?テレ（名古屋テレビ）,名古屋の桜の名所で“開花発表”　暖冬の影響で去年より“早い春”の訪れ,https://news.yahoo.co.jp/articles/5e0b03e26d0cc3f91ed258979fd44e211e7d4153,2/19(月) 16:51
nbn,メ?テレ（名古屋テレビ）,記録的な暖冬でスキー場は悲鳴　パウダースノーではなく、水分含んだ“春雪”に「人工降雪機も使えない」,https://news.yahoo.co.jp/articles/13d32084cea2dc82a19673a544c321fe35d526da,2/19(月) 16:51
nbn,メ?テレ（名古屋テレビ）,名古屋市教委の金品受領問題、河村市長は検証チームを設置「徹底的に調査する」 幹部個人も現金受け取る,https://news.yahoo.co.jp/articles/0f5a9491581329b5236992905fb0287aeba99dcd,2/19(月) 16:39
nbn,メ?テレ（名古屋テレビ）,柳vsディカーソン　一発浴びるも「良かった」、高橋宏斗は1イニングおかわり【ドラゴンズ沖縄キャンプ】,https://news.yahoo.co.jp/articles/1871037e4d113d1bed3760e0f8ed539e8b3f7757,2/19(月) 13:09
nbn,メ?テレ（名古屋テレビ）,練習試合でロドリゲスが攻守で存在感　辻本倫太郎がプロ初打点をマーク【ドラゴンズ沖縄キャンプ】,https://news.yahoo.co.jp/articles/f26075589cd5aaf97040083053b4229cdc93d0f5,2/19(月) 13:09
nbn,メ?テレ（名古屋テレビ）,根尾昂が対外試合で初登板、3回パーフェクト　新たな武器カーブも披露【ドラゴンズ沖縄キャンプ】,https://news.yahoo.co.jp/articles/d9824c501298f25dc8228af653810c5fa2725f49,2/19(月) 12:54
nbn,メ?テレ（名古屋テレビ）,婚活イベントなど少子化対策に154億円計上…一般会計当初予算案など議会で審議　愛知県,https://news.yahoo.co.jp/articles/73807489372aadd50a2c0d43a9ba644f88ae2416,2/19(月) 12:54
nbn,メ?テレ（名古屋テレビ）,名古屋市教委の金品受領問題で、調査検証チームの委員を発表　元文部官僚や弁護士ら6人,https://news.yahoo.co.jp/articles/5fa41a41516204dec394efabb57d851ce3452e24,2/19(月) 12:43
