media_en,media_jp,title_articles,link_articles,date_original
nbn,メ?テレ（名古屋テレビ）,10年ぶり2回目の選抜出場となる豊川は一回戦で敗退【春のセンバツ高校野球】,https://news.yahoo.co.jp/articles/b442966f0bddaa52bdf0a2fa3b837fd8166fd48d,3/19(火) 16:56
nbn,メ?テレ（名古屋テレビ）,コンビニ店長が特殊詐欺を未然に防ぎ警察から感謝状が贈られる　同様の詐欺を防止したのは3回目　愛知県,https://news.yahoo.co.jp/articles/daffa8ff2cac96f4079297c86e548f0f66a810f2,3/19(火) 16:45
nbn,メ?テレ（名古屋テレビ）,【愛知初】タッチ決済で改札通過できる実証実験始まる  QRかざしチケットレス化も  名古屋鉄道,https://news.yahoo.co.jp/articles/2acc77b5a4c6ca87dd01eb52240237392e438bbe,3/19(火) 16:22
nbn,メ?テレ（名古屋テレビ）,2階建て建物が全焼する火事　焼け跡から年齢性別不明の1人の遺体が見つかる　愛知・稲沢市,https://news.yahoo.co.jp/articles/cb561bc254802b4bea90694334301a400cc98310,3/19(火) 12:51
nbn,メ?テレ（名古屋テレビ）,交通違反で警察に追跡されていた乗用車が事故起こす　信号待ちをしていた車2台にぶつかり逃走　愛知,https://news.yahoo.co.jp/articles/b541bbbfd2e12dce37bde16a5d45996c1c1db09d,3/19(火) 11:39
nbn,メ?テレ（名古屋テレビ）,愛知・東海市の名鉄河和線の踏切で男性が急行列車にはねられ死亡　一時運転見合わせ,https://news.yahoo.co.jp/articles/c916edf84f1b884177e704de32def2d546b31ef9,3/19(火) 1:17
nbn,メ?テレ（名古屋テレビ）,アカデミー賞オスカー像、ジブリパークで展示へ　「ジブリの大倉庫」で20日から,https://news.yahoo.co.jp/articles/ec77db48be230d6a383eb74f809dda7cdd9f8a0f,3/18(月) 22:40
nbn,メ?テレ（名古屋テレビ）,"東山動植物園の「お花畑」リニューアルオープンへ　「ズーボ」の""隠れ家""もお目見え",https://news.yahoo.co.jp/articles/d702ae2a6f65af7f2a0b7bb5250e07ec9f4dfde7,3/18(月) 22:25
nbn,メ?テレ（名古屋テレビ）,重さ6キロの天井板がホームに落下　けが人なし　名鉄笠松駅で乗務員が発見,https://news.yahoo.co.jp/articles/04e8d4e7466f8b6731f95395f4581f70897be0ee,3/18(月) 18:48
nbn,メ?テレ（名古屋テレビ）,出火当時、強風・乾燥注意報　牛舎などが焼ける火事　愛知・東海市,https://news.yahoo.co.jp/articles/c986eef914c262ea174a2c30bd5b4bc615e664f0,3/18(月) 18:48
nbn,メ?テレ（名古屋テレビ）,強盗殺人罪で起訴の男がコンビニ強盗に関与した疑いで再逮捕　容疑者は「黙秘します」　愛知県,https://news.yahoo.co.jp/articles/0a6635d3fd9710d9943a3ad3a11e3c0b5b88e697,3/18(月) 18:36
nbn,メ?テレ（名古屋テレビ）,工事現場の足場が崩れ車と接触　強風の影響か　愛知県蟹江町,https://news.yahoo.co.jp/articles/b879313833cc9482877f0651b9b1f7ab80628f57,3/18(月) 18:31
nbn,メ?テレ（名古屋テレビ）,ジブリパークが全面オープン　宿泊付きプランの売れ行きは好調　コンセプトルームを作る宿も,https://news.yahoo.co.jp/articles/3056c2dde3c259ab7dae552cf00a71e54d5546ef,3/18(月) 18:25
nbn,メ?テレ（名古屋テレビ）,北陸新幹線が延伸　新幹線開通を見据えて出来た「道の駅」 パーク＆ライドでお出かけ,https://news.yahoo.co.jp/articles/05be957c9f1b03e18de0403047101d3c0e2d7b5f,3/18(月) 17:53
nbn,メ?テレ（名古屋テレビ）,新瑞橋駅近くの住宅街で火災　近隣住民がけが　名古屋市瑞穂区　消火活動続く,https://news.yahoo.co.jp/articles/6f2f097464026d1fbe9b9f77bc89da4bcd66b87b,3/18(月) 16:42
nbn,メ?テレ（名古屋テレビ）,タイトル連覇記録を21に　藤井聡太八冠の地元　さらなるタイトル更新に期待　愛知,https://news.yahoo.co.jp/articles/fd65dc5376bbdf314a79f7c53e29fbf8ab9483fc,3/18(月) 16:35
nbn,メ?テレ（名古屋テレビ）,東岡崎駅の南口に名鉄が商業施設オープンへ　飲食店の開業を後押しするキッチンを備える　愛知,https://news.yahoo.co.jp/articles/b811abf8e5be4b0e378b3f711afebb798cfa1c4a,3/18(月) 15:51
nbn,メ?テレ（名古屋テレビ）,雪解けした斜面で咲き始めたセリバオウレン　飛騨地方に春を告げる,https://news.yahoo.co.jp/articles/e7f90fe41ed4c805a20a41382d93fc107dcbd52c,3/18(月) 12:35
nbn,メ?テレ（名古屋テレビ）,同性カップルや事実婚カップルを「家族」と認める制度スタートへ　県営住宅の入居などが可能に…愛知県,https://news.yahoo.co.jp/articles/77de8e96e6b3e8a15680e524e57046b7811222f1,3/18(月) 12:30
nbn,メ?テレ（名古屋テレビ）,サードのポジション争い　石川昂弥・高橋周平ともに猛アピール【17日のドラゴンズOP戦】,https://news.yahoo.co.jp/articles/f23876cfb45ac9987eeacf7dda168454b1c51507,3/18(月) 11:53
nbn,メ?テレ（名古屋テレビ）,細川成也が5階席への超特大ホームラン　3安打3打点の活躍【ドラゴンズ16日のOP戦】,https://news.yahoo.co.jp/articles/2be8cb81ae5e0fcf6d959682ac9d2f97a8172153,3/18(月) 11:34
nbn,メ?テレ（名古屋テレビ）,開幕投手候補の柳裕也が好投、中田翔は守備で躍動【ドラゴンズオープン戦】,https://news.yahoo.co.jp/articles/2f9fa8650d0cad5abef1fff9f470ffc58f68e2b5,3/18(月) 10:59
nbn,メ?テレ（名古屋テレビ）,マンションの一室で火事　性別不明の遺体見つかる　連絡取れていない住人か　愛知県豊橋市,https://news.yahoo.co.jp/articles/ba95ed9e0738e2630c5103be20ebef4bbb3e7339,3/18(月) 6:52
nbn,メ?テレ（名古屋テレビ）,藤井八冠「棋王」初防衛　第4局で伊藤匠七段に勝利　「大変なシリーズだったのでうれしい」,https://news.yahoo.co.jp/articles/3ea4baeb696a7b024677d8b91e909acfd5a838e9,3/17(日) 22:30
nbn,メ?テレ（名古屋テレビ）,高校生がSDGsの目標達成へのアイデア競う大会の表彰式　伊勢志摩の資源保全を提案した高校が最優秀賞に,https://news.yahoo.co.jp/articles/51e49d3b6dcb5adba11f802fce874621caa27c40,3/17(日) 18:44
nbn,メ?テレ（名古屋テレビ）,国民・大塚耕平参院議員　名古屋市長選出馬に向け来年度予算成立後離党へ　「区切りのいいところまでは」,https://news.yahoo.co.jp/articles/fb629d225359a600aaf38f1e2d31dba1a2ff5c90,3/17(日) 18:36
nbn,メ?テレ（名古屋テレビ）,高山祭の屋台「宝珠台」の蔵　能登半島地震の後扉が開かず　市職員らが状態確認　無事に扉が開く,https://news.yahoo.co.jp/articles/adb3a3d58a389943da63cd23aa76ce15dd668a93,3/17(日) 12:42
nbn,メ?テレ（名古屋テレビ）,藤井聡太八冠が「棋王」防衛果たすか　伊藤匠七段との五番勝負第4局　栃木県日光市,https://news.yahoo.co.jp/articles/be6d92c9481e231e3a4b8d4e735a840d5bcfb778,3/17(日) 12:36
nbn,メ?テレ（名古屋テレビ）,アニメ扱うサイトのバナー広告が発端　女性（20代）が112万円分だまし取られる　岐阜・高山市,https://news.yahoo.co.jp/articles/6682771d71a560a7162a67657af1ccafc9984e94,3/17(日) 5:30
nbn,メ?テレ（名古屋テレビ）,漁船が出入りできない輪島港で桟橋設置進む　荷さばき所の復旧求める声も,https://news.yahoo.co.jp/articles/214bff30d9b03e40a5fa247fe8f4aee832047d84,3/16(土) 22:12
nbn,メ?テレ（名古屋テレビ）,かわいいリスと触れ合える「リスの森」が今季もオープン　シマリスとエゾリス200匹を飼育　岐阜県高山市,https://news.yahoo.co.jp/articles/565be04283c35abbf690895c4695a70e44c900a7,3/16(土) 18:48
nbn,メ?テレ（名古屋テレビ）,海外の患者も受け入れへ　世界最新の陽子線がん治療装置を日本で初導入　岐阜県美濃加茂市の医療センター,https://news.yahoo.co.jp/articles/f0217a597e639af0098a206d01f3f397a6e874ef,3/16(土) 18:39
nbn,メ?テレ（名古屋テレビ）,ジブリパーク「魔女の谷」エリアがオープン　「ハウルの城」や「グーチョキパン屋」　初の乗り物遊具も,https://news.yahoo.co.jp/articles/ab7a8dee7069b8e60e8a637e728d47c3fb686dbf,3/16(土) 13:17
nbn,メ?テレ（名古屋テレビ）,北陸新幹線の金沢〜敦賀が開業　特急「しらさぎ」は名古屋〜敦賀の運行に　「やはり不便は不便」,https://news.yahoo.co.jp/articles/121e27a407386776863452b452540999d4447111,3/16(土) 13:12
nbn,メ?テレ（名古屋テレビ）,愛知県警港署の前署長を不同意わいせつ容疑で書類送検　官舎で署員に対しわいせつな行為か　今後処分も,https://news.yahoo.co.jp/articles/5340ece64d254a871b90e9c438cf7c6149a2775a,3/16(土) 13:05
nbn,メ?テレ（名古屋テレビ）,危険ドラッグを密輸して逮捕されていた男2人を不起訴処分　名古屋地検,https://news.yahoo.co.jp/articles/b14e29024a9fd4bf9f2b393bc881fc6c7ff8637e,3/15(金) 20:41
nbn,メ?テレ（名古屋テレビ）,両親をナイフで刺し殺害などの罪、53歳の長女に懲役29年の判決　岐阜地裁,https://news.yahoo.co.jp/articles/7a81aea92bb05cf3bc6974924790017bece8fd63,3/15(金) 19:36
nbn,メ?テレ（名古屋テレビ）,死亡した女性の長男(77)を逮捕…首を刃物のようなもので切りつけ失血死させたか　三重・鈴鹿市,https://news.yahoo.co.jp/articles/004baf29b15164635690d3949ee04db2ceebd285,3/15(金) 19:31
nbn,メ?テレ（名古屋テレビ）,名古屋城の木造復元への市民説明会で”サクラ”か　市議と市長特別秘書の間でメールやりとり明らかに,https://news.yahoo.co.jp/articles/bee007c4562ecb746ee6729bca88b33aa57632d0,3/15(金) 19:26
nbn,メ?テレ（名古屋テレビ）,頂き女子りりちゃん「いけないことした」法廷で涙ながらに謝罪　検察は懲役13年求刑,https://news.yahoo.co.jp/articles/124077d12531217af37631ffbb3b2bc7ed83836a,3/15(金) 19:20
nbn,メ?テレ（名古屋テレビ）,ジブリパーク新エリアがあすオープン　「ハウル」や「魔女宅」の世界観がテーマの「魔女の谷」,https://news.yahoo.co.jp/articles/f7fc3e696769decb843518e92733bd0f94e435cd,3/15(金) 19:14
nbn,メ?テレ（名古屋テレビ）,お酢づくりを疑似体験　ミツカンミュージアムがリニューアル　愛知県半田市,https://news.yahoo.co.jp/articles/acdcab6c18e7f1e2eb54e591e3f3566595871073,3/15(金) 19:08
nbn,メ?テレ（名古屋テレビ）,介護助手の女性を殺害し、畑に死体を遺棄した事件　38歳の無職の女に懲役16年の判決　名古屋地裁,https://news.yahoo.co.jp/articles/636d455c3d544963004dccee5c8a23c89e58fd34,3/15(金) 17:32
nbn,メ?テレ（名古屋テレビ）,車を運転しながら「ドラゴンクエストウォーク」をして死亡事故　元県立高校教師の男に実刑判決　名古屋地裁,https://news.yahoo.co.jp/articles/b1f74bffbf9582ce26f8348bc61e044e0aa06759,3/15(金) 17:27
nbn,メ?テレ（名古屋テレビ）,東山動植物園の人気者　スマトラオランウータンの「ネオ」が死ぬ　名古屋,https://news.yahoo.co.jp/articles/0c8eec3d9bda615af64861104c04967bc3344f95,3/15(金) 17:22
nbn,メ?テレ（名古屋テレビ）,名古屋から金沢への電車でのアクセス　あすからは敦賀で乗り換え　北陸新幹線が敦賀まで延伸,https://news.yahoo.co.jp/articles/097410a2ea391ebd7e499c983e87112074a19a0e,3/15(金) 16:43
nbn,メ?テレ（名古屋テレビ）,勾留中の男性被告が収容室の窓ガラスを割ったとして書類送検　被害額は99万円　岐阜拘置支所,https://news.yahoo.co.jp/articles/de20c00427315d6603c449e4a4d3557c5fa0d178,3/15(金) 16:32
nbn,メ?テレ（名古屋テレビ）,「煙が上がり爆発音」、大垣駅で停車中の電車がトラブル…電気系統の故障か？　乗客200人にけがなし,https://news.yahoo.co.jp/articles/33f45e9d530af52eccf51b202eb33bdb36963da1,3/15(金) 16:12
nbn,メ?テレ（名古屋テレビ）,4月の「春の高山祭」をPR　高山駅前に祭りの訪れを告げるのぼり旗設置,https://news.yahoo.co.jp/articles/b0dbced967545c92ef057fa6c47583011d334b32,3/15(金) 12:30
nbn,メ?テレ（名古屋テレビ）,中部電力が4月から「週休3日制」を導入　労働時間変わらず賃金水準は維持　社員の“モチベ”向上の狙いも,https://news.yahoo.co.jp/articles/e1474e26f1b0d16e6ac3d610147f5dbb00c7e8a2,3/15(金) 12:25
nbn,メ?テレ（名古屋テレビ）,JR東海道線大垣駅で「爆発音が聞こえる」と通報あり けが人なし　警察と消防が調査　岐阜,https://news.yahoo.co.jp/articles/4ca1de779fa828e89e3fcd296111167ef3192540,3/15(金) 11:12
nbn,メ?テレ（名古屋テレビ）,鈴鹿市の自宅で死亡の98歳女性　死因は第三者に首を切られた失血死,https://news.yahoo.co.jp/articles/a34ba69c448f70b8fef561239250422e88adb259,3/14(木) 22:36
nbn,メ?テレ（名古屋テレビ）,同じ場所で去年から火事・不審火5回発生　5回目の14日は枯れ草燃える　愛知県稲沢市,https://news.yahoo.co.jp/articles/f5e9ba15243a7189258877c2842edf8efa3735c8,3/14(木) 22:23
nbn,メ?テレ（名古屋テレビ）,住宅に置かれてあったタイヤ盗んだ疑い男逮捕　あま市周辺でタイヤ盗難約30件発生,https://news.yahoo.co.jp/articles/8a81220944536c91df015e7985f66ef851e06ab0,3/14(木) 22:18
nbn,メ?テレ（名古屋テレビ）,大垣市の住宅で現金2200万円奪われた強盗致傷事件　逮捕の男性2人が不起訴処分,https://news.yahoo.co.jp/articles/b5a2953879c6f0b59629bb6a0cb499a0d0fdc5ab,3/14(木) 21:09
nbn,メ?テレ（名古屋テレビ）,岐阜・各務原市の有機フッ素化合物検出問題、市長が国に対策支援要請,https://news.yahoo.co.jp/articles/dc26412c5c5b2a6e06f2754a0182bb8c0b3d6849,3/14(木) 19:37
nbn,メ?テレ（名古屋テレビ）,愛知県、新型コロナ対策の事業見直しへ　大村秀章知事「対策はひと区切り」,https://news.yahoo.co.jp/articles/57dc3f7521da7036ab65c07495f8cc27f768e6e3,3/14(木) 19:30
nbn,メ?テレ（名古屋テレビ）,バイクのパーツ代払っても納品されず…融資金詐取事件で実刑判決の中古バイク販売店社長に顧客ら怒り,https://news.yahoo.co.jp/articles/df5f8c942eb017d3713d97b2dc58e1da0432d149,3/14(木) 19:30
nbn,メ?テレ（名古屋テレビ）,「トイレそのまんまな和菓子」ユニーク商品のヒットを賃上げにつなげる老舗の挑戦,https://news.yahoo.co.jp/articles/4cb368447aaf5c7690a9b146041935eed059d7b6,3/14(木) 19:23
nbn,メ?テレ（名古屋テレビ）,医療従事者ら30分間のストライキ　賃上げやスタッフ不足の解消訴える,https://news.yahoo.co.jp/articles/1fe0025c8e6dcaab24637df8e55fe0db32b9062a,3/14(木) 19:12
nbn,メ?テレ（名古屋テレビ）,春闘“満額回答”相次ぐ　要求を大幅に上回る企業も「社員の処遇をあげて投資」 愛知,https://news.yahoo.co.jp/articles/dce971a8c4f2cee98b8f77c258b8c4d5e206b901,3/14(木) 19:04
nbn,メ?テレ（名古屋テレビ）,住人男性脅して暴行、2200万円入り金庫など奪った疑いで逮捕の男性2人を不起訴　岐阜地検,https://news.yahoo.co.jp/articles/27e2f19df2c0afb0ce21ae47a21a81f5dccacd85,3/14(木) 18:57
nbn,メ?テレ（名古屋テレビ）,記録的な暖冬で”春祭り”に異変　開催時期の前倒しで準備に影響も,https://news.yahoo.co.jp/articles/0eebebf6243896125394e999975265918bd7249b,3/14(木) 18:28
nbn,メ?テレ（名古屋テレビ）,パート勤務で直面、働き損？手取りが減る「年収の壁」突っ張り棒メーカーがこの“壁”に挑む,https://news.yahoo.co.jp/articles/7df01f816f2453856cc65fe3d5730fe01d63c8b2,3/14(木) 17:27
nbn,メ?テレ（名古屋テレビ）,レゴブロック製のサクラがお出迎え　名古屋のレゴランド・ジャパンで春の催し,https://news.yahoo.co.jp/articles/1e386412655acad045b3c543dcaf201a389322ca,3/14(木) 17:12
nbn,メ?テレ（名古屋テレビ）,銀行から融資金5600万円詐取の罪、中古バイク販売店社長に実刑判決　名古屋地裁,https://news.yahoo.co.jp/articles/8ce98679bf8294c9e5839a498d4c714ac83531e6,3/14(木) 17:06
nbn,メ?テレ（名古屋テレビ）,"センバツで活躍誓う豊川・愛工大名電・宇治山田商業…""春の王者""目指すそれぞれの思い",https://news.yahoo.co.jp/articles/668e76375c0caf28787086d165f2c462a47d6f7d,3/14(木) 17:01
nbn,メ?テレ（名古屋テレビ）,能登の被災地で不足が続くボランティア　解決のカギは「技能を持った人材の育成」と「資格制度づくり」,https://news.yahoo.co.jp/articles/158b28619096398851219d63178c5ffe28d2150f,3/14(木) 13:00
nbn,メ?テレ（名古屋テレビ）,住宅など9軒が燃えた火事、クラシックカーの所有者を書類送検　作業中に火花がガソリンに引火か　名古屋,https://news.yahoo.co.jp/articles/b1ee0added61f13d0e16ea05b37f2c20d3328d98,3/14(木) 12:39
nbn,メ?テレ（名古屋テレビ）,知人への勧誘成功で出資者に“紹介料”を支払いか　「西山ファーム」めぐる投資詐欺事件,https://news.yahoo.co.jp/articles/773dd32e5fe7641201dee388113fd888019ce5bd,3/14(木) 12:34
nbn,メ?テレ（名古屋テレビ）,スマホを使った「痴漢撃退ツール」配信開始　警告ブザーや音声読み上げ機能で助けを求める　三重県,https://news.yahoo.co.jp/articles/3eadc720fd221dbb1a726cfe5fab1f4619f8ebbf,3/14(木) 12:29
nbn,メ?テレ（名古屋テレビ）,保育園の給食「変わり納豆」に金属片が混入　一部の献立を中止に　岐阜県飛騨市,https://news.yahoo.co.jp/articles/771ca81fe3e65832bd8cc54fd50bea71238bac19,3/13(水) 21:40
nbn,メ?テレ（名古屋テレビ）,西山ファームの実質的経営者の男を逮捕　投資した男性「4年は非常に長く苦しかった」被害の回復を願う,https://news.yahoo.co.jp/articles/df36ffcc7591f0eb4319d9e426703e2e3d24ef7d,3/13(水) 19:43
nbn,メ?テレ（名古屋テレビ）,連合愛知「中小企業への波及が重要」　賃上げの回答があった29の組合のうち22の組合が満額回答,https://news.yahoo.co.jp/articles/cf71ad18d1f2da119de446396d9094070e452f71,3/13(水) 19:23
nbn,メ?テレ（名古屋テレビ）,住宅街にあるメダカ販売店で400匹が一夜で消える　“犯人”の正体は北米原産の特定外来生物,https://news.yahoo.co.jp/articles/0c5f00b0b1f7a2a16fe6d98f17a31c440397226c,3/13(水) 17:51
nbn,メ?テレ（名古屋テレビ）,木造平屋建ての住宅がほぼ全焼する火事　住人の80代男性と連絡が取れず　名古屋,https://news.yahoo.co.jp/articles/9721a333f4b831fd05f6c61775d39811390e283f,3/13(水) 17:35
nbn,メ?テレ（名古屋テレビ）,サウナファンの聖地で、“熱波”を送るパフォーマンス「ショーアウフグース」の大会開催　名古屋,https://news.yahoo.co.jp/articles/40066120a869b5b8b2c2baadd1539555c2b1cd4b,3/13(水) 17:35
nbn,メ?テレ（名古屋テレビ）,物流倉庫を自動化する技術などが注目を集める　最先端の製造技術など展示　愛知,https://news.yahoo.co.jp/articles/087eaab7f82b6d09406c6dd7fc71b7a2e3de225e,3/13(水) 17:31
nbn,メ?テレ（名古屋テレビ）,トヨタ　最高で月額2万8440円の賃上げ、一時金7.6カ月の要求に対し「満額回答」　春闘,https://news.yahoo.co.jp/articles/e76eb26ad237520ec302a070b6859e66eb2d299d,3/13(水) 17:22
nbn,メ?テレ（名古屋テレビ）,石炭の20％をアンモニアに置き換えて発電　CO2削減に向け実証試験　JERA碧南火力発電所,https://news.yahoo.co.jp/articles/9be182eb545d59900a44b84ad643598f19146657,3/13(水) 17:13
nbn,メ?テレ（名古屋テレビ）,JR東海道線「のり面」崩落…なぜ崩れたか？原因わからずJRと名鉄が調査を進める,https://news.yahoo.co.jp/articles/c9b797858617d7cbf3e1c90d2ecd6267e86e316a,3/13(水) 17:13
nbn,メ?テレ（名古屋テレビ）,首には刃物で切られたような跡　98歳女性が死亡　家に住む男性から話を聴く方針　三重,https://news.yahoo.co.jp/articles/58c07075c43cbff46884e2ac509a4aabffd91e1a,3/13(水) 13:56
nbn,メ?テレ（名古屋テレビ）,国際ロマンス詐欺　被害相談を受けていた弁護士を懲戒請求　愛知県弁護士会,https://news.yahoo.co.jp/articles/a46d9da1ec5c17b20536a196faee5cb6f933ca57,3/13(水) 12:37
nbn,メ?テレ（名古屋テレビ）,のり面が崩落　運転を見合わせたJR東海道線、始発から平常通り運転　原因は調査中,https://news.yahoo.co.jp/articles/699a26f0fae885bebb1c1e598e260e8d1e5e0c81,3/13(水) 12:37
nbn,メ?テレ（名古屋テレビ）,「西山ファーム」の実質的経営者の男　インドネシアから日本へ移送され逮捕　130億円余り集めたか,https://news.yahoo.co.jp/articles/b2ff466cf435d014a3ca0181a4c720087ccd2bcf,3/13(水) 11:44
nbn,メ?テレ（名古屋テレビ）,帰宅ラッシュを直撃　東海道線（名古屋〜岐阜）が5時間余り運転見合わせ　帰宅困難者続出で駅は大混雑,https://news.yahoo.co.jp/articles/5b58cca1b96307b92715f083a04d0e076275a2c3,3/13(水) 10:04
nbn,メ?テレ（名古屋テレビ）,巨額投資詐欺事件で西山ファーム代表を逮捕　逃亡先のインドネシアからけさ日本に　身柄は愛知へ,https://news.yahoo.co.jp/articles/5cb7cb96fa86e8b373465dbea4934d83c68d28b3,3/13(水) 9:15
nbn,メ?テレ（名古屋テレビ）,下請け会社への支払いで私的な取り分含めた水増し請求か　広告会社トヨタ・コニック・プロの元社員を逮捕,https://news.yahoo.co.jp/articles/20773a80d19c47ef2158eb60497172896cffd199,3/13(水) 0:28
nbn,メ?テレ（名古屋テレビ）,旧優生保護法下の強制不妊手術で国に賠償命令　名地裁「規定の制定当時から憲法違反」,https://news.yahoo.co.jp/articles/9293588eada56ce1f91d4062ace199f0afbe9f67,3/13(水) 0:28
nbn,メ?テレ（名古屋テレビ）,集合住宅に白骨化遺体　路上で転倒した50代男性の身元確認の過程で発見　同居の80代男性か,https://news.yahoo.co.jp/articles/694fdc774b01fbffcbf1db8a49672433be8d66c2,3/13(水) 0:07
nbn,メ?テレ（名古屋テレビ）,JR東海道線で運転再開　名古屋駅〜岐阜駅間で約5時間半ぶり　名古屋駅近くの法面崩落の影響,https://news.yahoo.co.jp/articles/8157506b40c12933a32d5df810bd1c8900971311,3/12(火) 21:59
nbn,メ?テレ（名古屋テレビ）,藤井聡太八冠が名鉄瀬戸線の車両で車掌姿、車内アナウンスも披露　特別な“将棋とれいん”運行,https://news.yahoo.co.jp/articles/8b626e51233c48d339ae3adc396da74841fcd8a3,3/12(火) 19:21
nbn,メ?テレ（名古屋テレビ）,JR東海道線の運転見合わせ、停車中の列車内に乗客　降車へ作業進める,https://news.yahoo.co.jp/articles/d2796196addd46292ba59a362283a5fe42072b28,3/12(火) 18:49
nbn,メ?テレ（名古屋テレビ）,JR東海道線の線路そばでのり面崩落、名古屋〜岐阜間で運転見合わせ続く　近くでは名鉄が工事,https://news.yahoo.co.jp/articles/b820a8e7e99daee2df7b18bc965b4811b220fd8e,3/12(火) 18:05
nbn,メ?テレ（名古屋テレビ）,吃音の学生たちが接客、1日だけの「注文に時間がかかるカフェ」　参加者たちの思い,https://news.yahoo.co.jp/articles/b618196d5e127f5114e779eddc5e6ff6326d8b97,3/12(火) 17:32
nbn,メ?テレ（名古屋テレビ）,関与した事件の被害総額は約6300万円に上るか　窃盗未遂などの疑いで男2人を逮捕・送検,https://news.yahoo.co.jp/articles/50e746080d724f3817d6e5733e11aa6d4403a08e,3/12(火) 17:15
nbn,メ?テレ（名古屋テレビ）,吹奏楽連盟の口座から不自然な引き出し　会計責任者の男性と連絡が取れず　岐阜,https://news.yahoo.co.jp/articles/a726e68328a04a9689d94e871b5bc0b94e932381,3/12(火) 17:15
nbn,メ?テレ（名古屋テレビ）,JR東海道線　名古屋駅ー岐阜駅間の上下線、運転見合わせ 　線路設備の確認のため,https://news.yahoo.co.jp/articles/85a72a85a6c6b3eedba5a8d16b0501f571bcab82,3/12(火) 17:06
nbn,メ?テレ（名古屋テレビ）,「北陸応援割」金沢のホテルでも大きな反響　石川県で予約始まる,https://news.yahoo.co.jp/articles/da5e55f3e9418b15d396761fad88b858e82b2f07,3/12(火) 16:42
nbn,メ?テレ（名古屋テレビ）,ジブリパーク新エリア「魔女の谷」　一望できる展望台がお披露目　翼のモニュメント設置,https://news.yahoo.co.jp/articles/cdfc61dac85b8044af15909cdde7bfb2d0854eaa,3/12(火) 12:25
nbn,メ?テレ（名古屋テレビ）,保育園の資金約2億5000万円を横領した罪に問われた前理事長　懲役7年6カ月求刑,https://news.yahoo.co.jp/articles/4c358210b22b2be6642ddbb7a14dcab9eef0e3dd,3/12(火) 12:20
nbn,メ?テレ（名古屋テレビ）,クレカ不正使用でスマホ詐取 余罪2000万円超か 共犯者が働いていた美容室の客のカード不正使用相次ぐ,https://news.yahoo.co.jp/articles/4cc1aa35b44e84e926a2ef8e8e1bd08fc34232d7,3/11(月) 21:26
