media_en,title_articles,link_articles,date_original
rnb,トレカで親しむ郷土の俳人　正岡子規の生誕を祝うイベント【愛媛】,https://news.yahoo.co.jp/articles/04b0e8d35244f9fdc339a9a509502d933faa9fe6,9/30(土) 15:29
rnb,愛媛銀行の行員からお金やライフプランについて学ぼう　東雲女子大学で講座開講【愛媛】,https://news.yahoo.co.jp/articles/c827456b22f91580a5fd3ee75235751d54e64691,9/30(土) 10:46
rnb,松山−大阪間が1時間38分に！「四国新幹線」で未来はどう変わる？実現の先にある“光と影”,https://news.yahoo.co.jp/articles/1430a38792146eb8539218fb9b62d8ba774cd6d4,9/30(土) 8:30
rnb,温暖化で農作物も熱帯化…“南国フルーツ”が特産品に変わる！？かんきつだけじゃない愛媛の果樹栽培,https://news.yahoo.co.jp/articles/9e28a3332d4952c98de460b5fad9f8648252fddb,9/29(金) 19:46
rnb,コロナ治療薬が10月から一部自己負担に 24時間体制の相談センターは継続【愛媛】,https://news.yahoo.co.jp/articles/7c0dcb5a59105a60c24a1d70117892b7fc378c26,9/29(金) 18:01
rnb,今夜は「中秋の名月」子どもたちはお月見クイズ！大人は地酒で月見酒はいかが？,https://news.yahoo.co.jp/articles/3e321eb8ffbfbfddbe673dd97d67a454652b97f0,9/29(金) 17:44
rnb,地元プロ3チームと連携 スポーツ通し地域貢献目指す「だいだいTeamEHIME」が発足,https://news.yahoo.co.jp/articles/bb9cfa2633fdc232a0415060930cfe3cde525165,9/29(金) 16:55
rnb,自動音声で「電気料金の未払いで数時間後に電気が止まる」県内で特殊詐欺の予兆電話相次ぐ【愛媛】,https://news.yahoo.co.jp/articles/108b1dbb5f883dfc0204cd394c6eac9fd41e5a00,9/29(金) 16:32
rnb,ダイキアクシスの新社長に大亀裕貴氏（31）が就任へ インドや東南アジア方面での浄化槽導入事業に意気込み,https://news.yahoo.co.jp/articles/5089ea02db50ae168ff95cdc8271d18d7c386662,9/29(金) 16:21
rnb,旬の農産物や情報をラジオで発信 JA今治立花と南海放送が協定結ぶ【愛媛】,https://news.yahoo.co.jp/articles/3fa37c8e15d4e4673ad2c65a2ffecd3ad45ba680,9/29(金) 16:00
rnb,ビールケースで男性の頭を複数回殴り踏みつける 26歳会社役員の男を殺人未遂罪で起訴【愛媛】,https://news.yahoo.co.jp/articles/03fc6bf657db172e6a2ecceed8075d3665eccc65,9/29(金) 15:22
rnb,西洋絵画の巨匠が手掛けた作品 県美術館で「ヨハネ・パウロ2世美術館展」【愛媛】,https://news.yahoo.co.jp/articles/beb71ca25c417f47c43b07fabf8076f1dea7f9ff,9/29(金) 15:11
rnb,「クリーニングこそサステナブル」一着の服を大切に着よう 業者が利用呼びかけ【愛媛】,https://news.yahoo.co.jp/articles/fb378b759795ff74655aaf962afef629f9423999,9/29(金) 11:50
rnb,普及進む“EV車”の火災想定訓練…鎮火に使うのは耐熱2500℃「ファイヤーブランケット」,https://news.yahoo.co.jp/articles/81967b60419837419f3af8bee082cc55e414a7b3,9/28(木) 19:29
rnb,インフルとコロナの“同時流行”で学級閉鎖も 医師は「かつて見たことがない状況」,https://news.yahoo.co.jp/articles/80ed164d938f56ce9c74c90347540deec1ab2938,9/28(木) 18:12
rnb,最大2万円分が受け取れる「マイナポイント」駆け込み申請で窓口が混雑 今月末まで【愛媛】,https://news.yahoo.co.jp/articles/bc793158ad0b588a3a82faa40b7ca76abd87f81d,9/28(木) 17:59
rnb,倒れていたおばぁちゃんを救助したのはおばぁちゃん！転落した暗い河川敷で奇跡的な発見　警察が感謝状【愛媛】,https://news.yahoo.co.jp/articles/326d74bf3b1d4a43e31868b23cf7eda107f2c1d3,9/28(木) 17:30
rnb,四国電力が伊方原発20キロ圏内の住民を訪問 安全対策など説明【愛媛】,https://news.yahoo.co.jp/articles/1719709903cde446210b2576389e27f372698a5e,9/28(木) 17:15
rnb,防犯意識高めて！大洲警察署で防犯ポスター審査会　全国地域安全運動を前に【愛媛】,https://news.yahoo.co.jp/articles/bb9265e374e321711b02bd1b143817e2589cd789,9/28(木) 16:47
rnb,中国市場への販路拡大へ ライブ配信を通して愛媛が誇る「真珠」をネット販売,https://news.yahoo.co.jp/articles/59eb92c4678f997239f414dba78ecf452da4d472,9/28(木) 14:42
rnb,四国の頂点めざす高校バスケのリーグ戦　強豪16チームが参戦【愛媛】,https://news.yahoo.co.jp/articles/d611b7009f66eeffc244af6a663fc5ba6d7d55fd,9/28(木) 11:51
rnb,実りの秋に要注意！県内での被害が増加傾向“イノシシ”に遭遇したらどうすればいい？,https://news.yahoo.co.jp/articles/0abf6d4e4964901c594a167cb3ac792d45c0a638,9/27(水) 18:12
rnb,長井健司さん銃撃16年の命日に妹墓参 遺品のカメラで「事件の真相につながってほしい」【愛媛】,https://news.yahoo.co.jp/articles/888dad58d249af7a228fdb5ce753a134f80b961f,9/27(水) 17:42
rnb,「自己中心的な動機に酌量の余地はない」出産したばかりの男の子を遺棄 33歳母親に懲役4年の実刑判決【愛媛】,https://news.yahoo.co.jp/articles/d55b6af58841c5606b2112235a0cf0d099484d4e,9/27(水) 17:30
rnb,試合中にテロが発生したら・・・ ＦＣ今治スタッフがテロ対応訓練【愛媛】,https://news.yahoo.co.jp/articles/ff067a3cc3b1f391f54356d02efb4c952e53eb16,9/27(水) 15:01
rnb,日本や愛媛の成り立ちを伝える舞台“一粒萬倍”2024年松山市で再上演,https://news.yahoo.co.jp/articles/67357183054fc24f99234563dd562381586ec8c9,9/27(水) 12:48
rnb,松山市のビル街でビジネスマンも癒される 老舗食堂で30年間不動の人気メニュー「昭和のかつ丼」,https://news.yahoo.co.jp/articles/98b998c0c248065f56fb074b1c61130ba01bda44,9/26(火) 19:42
rnb,5000円分を4000円で購入できる“まつやまプレミアム付き商品券”発売から1週間 購入続々と【愛媛】,https://news.yahoo.co.jp/articles/819f8f3789e0c0fe7b93fc8afbffe25455933ed7,9/26(火) 18:27
rnb,松山城二之丸史跡庭園“恋人の聖地”選定から10周年 記念イベント開催へ【愛媛】,https://news.yahoo.co.jp/articles/5827af2542161a00f9c46c502e1c603f97e2b9d8,9/26(火) 18:01
rnb,フジ卓球部が日本卓球リーグ実業団連盟に加盟 認定書を授与【愛媛】,https://news.yahoo.co.jp/articles/133cc6e815be8e90ba6a92d4b1f5edaccd3612c0,9/26(火) 18:00
rnb,処理水放出から1か月…愛媛の養殖魚をフランスへ 現地バイヤー向け商談会に業者も期待,https://news.yahoo.co.jp/articles/974ca5673dbdbc1066f497715b1a35565967906c,9/26(火) 17:46
rnb,愛媛ゆかりの日系ブラジル人研修員が四電工に配属 県の海外技術研修員受け入れ269人目に,https://news.yahoo.co.jp/articles/fe9ab202dbeb7d63c981a63b7fb8752f1df17284,9/26(火) 17:33
rnb,西条市 小学生女児が男に腕をつかまれ…走って逃げるも追いかけられる 警察がパトロール強化【愛媛】,https://news.yahoo.co.jp/articles/cb320a65936c9ec36343f1d1f7265a19b71fafb0,9/26(火) 17:31
rnb,帰宅中に警察官に呼び止められ…聖カタリナ学園高の男性教員が酒気帯び運転 学校側は処分検討【愛媛】,https://news.yahoo.co.jp/articles/49fe3770e2cc279db324c1bc5a0d11ef8bb0acb2,9/26(火) 14:08
rnb,効率的な住民窓口の実現めざし 今治市などで新サポートシステム導入【愛媛】,https://news.yahoo.co.jp/articles/5b8f9748425898a2d03b0947f4a90bf41caba13b,9/26(火) 11:37
rnb,高齢女性のキャッシュカードから不正に現金引き出し 介護施設職員の男を逮捕【愛媛】,https://news.yahoo.co.jp/articles/728117151eefb1aa9642b834203b30dfc180be69,9/26(火) 10:14
rnb,現地生産者との交渉・破談も…ベトナムのカカオ豆に夢をのせて スイーツ店の「チョコレート物語」,https://news.yahoo.co.jp/articles/d6034ca43354cd79a7073a2022a05ed77495fc91,9/25(月) 19:28
rnb,全国高校サッカー選手権 愛媛県大会“史上初”学校の垣根を超えた合同チームが出場,https://news.yahoo.co.jp/articles/afa4a4f5a76d2c1347999645e9d7e754f15d811c,9/25(月) 18:12
rnb,人口減が深刻な伊方町 移住促進に向け情報通信会社と協定結ぶ【愛媛】,https://news.yahoo.co.jp/articles/91e89e03d27a5411c4dc9974bd35eea2c5c0128f,9/25(月) 17:51
rnb,市の担当者が事務処理を怠り 長期入院時の国保での食事代が一部未払いに【愛媛】,https://news.yahoo.co.jp/articles/f5dfa64a5b570e3a120c679e71f4a6fda0c74440,9/25(月) 17:16
rnb,「世界一の情報発信の街」無印良品シンガポールの大規模ショップで愛媛県産品フェア開催,https://news.yahoo.co.jp/articles/15f7a6ba066eae97d95e6ac08d9bc25fb69f54e5,9/25(月) 17:03
rnb,「移動手段の一つとして」電動車いすの正しいルール学ぶ交通安全教室【愛媛】,https://news.yahoo.co.jp/articles/55688b12b213c9cc2b9a5d791130a86f26bd6cb7,9/25(月) 16:50
rnb,マイナ保険証は「欠かすことができない道」塩崎厚労政務官　医療・福祉・介護DX推進へ,https://news.yahoo.co.jp/articles/ace0f5426496fc69c729569c6d20352c54791522,9/25(月) 16:49
rnb,スマホをかざすと橋脚が映し出される!?津島道路の建設現場を小学生が見学【愛媛】,https://news.yahoo.co.jp/articles/c6dda27b274348d43af5104c1ebd041e74da83df,9/25(月) 16:36
rnb,「競艇や競馬などに使った」顧客口座から約2750万円横領 JAおちいまばり30代の男性職員を懲戒解雇【愛媛】,https://news.yahoo.co.jp/articles/abc60792f9b9d928e1991324aabd8ef22a8e92b6,9/25(月) 16:14
rnb,「街を盛り上げたい」FC今治のファン感謝祭 サポーターと交流深めJ2昇格への決意新たに【愛媛】,https://news.yahoo.co.jp/articles/f16d103fc40c15b9858a1965f1cac373df26cf67,9/25(月) 12:01
rnb,愛媛FCが3か月ぶりに黒星喫するも首位キープ FC今治は八戸を圧倒し昇格圏目前の3位に,https://news.yahoo.co.jp/articles/be249cf9ef8bc82b235ff5253c794ed3b8dc35ed,9/25(月) 11:54
rnb,秋の全国交通安全運動 県内一斉に自転車指導取り締まり 交差点では一時停止を【愛媛】,https://news.yahoo.co.jp/articles/dfc0511b011567007a0d7ec7cfdae7fb8460c763,9/25(月) 11:33
rnb,「そうりゃ！そうりゃ！」高まる秋祭りムード　松山市小野地区で神輿の総練【愛媛】,https://news.yahoo.co.jp/articles/cdd9d3cbb7051767eb15ce768bbc00cc6271ad35,9/24(日) 16:34
