media_en,title_articles,link_articles,date_original
aab,秋田市で新聞配達の女性クマに襲われ大けが　秋田県内クマによる人身被害今年２８人に　過去最多更新続く,https://news.yahoo.co.jp/articles/83041b677ac8b444a4b0404b02ff498014d786eb,9/29(金) 12:40
aab,秋田市と五城目町中心におよそ２０００台が浸水被害　７月の大雨　電気系統浸水し修理困難,https://news.yahoo.co.jp/articles/fac8b977117f9a065db27f3aba293a6144c65463,9/29(金) 12:36
aab,新米警察官が決意を新たに新たな一歩　秋田県警察学校で卒業式　３年ぶりに保護者や来賓を迎えての通常開催,https://news.yahoo.co.jp/articles/224a183f1b97f196487fd9eb745e5e3cc6f6bad8,9/28(木) 19:11
aab,女子バスケＷリーグ「アランマーレ秋田」　目標は２部リーグ制となる来シーズンの１部リーグ入り,https://news.yahoo.co.jp/articles/634f7af5d0d26a4b589083b088394db7137da1e1,9/28(木) 19:07
aab,「やるしかない」　Ｂ１秋田ノーザンハピネッツが佐竹知事を訪問　新シーズンに向けて意気込み語る,https://news.yahoo.co.jp/articles/cb28d74d359885a300714013d4b4b85da71b2884,9/28(木) 19:07
aab,キャッシュカードをだまし取ったとして詐欺の罪に問われた元警察官に執行猶予付きの有罪判決　秋田地裁,https://news.yahoo.co.jp/articles/6fcd7afc36af340ab5875cac5bd1591ac94871fe,9/28(木) 18:53
aab,新型コロナ　定点把握による秋田県の感染状況　患者数は前週から４９％減少　１定点あたり９．０２人,https://news.yahoo.co.jp/articles/e57ccd5784557bd70556809148905d53f83bfc0b,9/28(木) 18:49
aab,厳戒態勢の中　クリの木の近くに５日連続でクマが出没　地域住民からは不安の声が　秋田・大館市,https://news.yahoo.co.jp/articles/38c4dea62fd8624c8fc8fed29eb136ebc520dc90,9/28(木) 18:49
aab,９月１９日の大雨　秋田市へのり災証明の申請は２３０軒超に,https://news.yahoo.co.jp/articles/86e4140f6b0c0f1480d82c75e0158ad08062b191,9/28(木) 11:53
aab,秋田県内のレギュラーガソリン平均小売価格は３週連続の値下がり　１リットルあたり１７６．８円,https://news.yahoo.co.jp/articles/6715c06d30dfca646c27be6e75975365630b8c45,9/28(木) 11:45
aab,不良工事が発覚した横手駅前の再開発ビル　改修方法が決まりオープンは２０２４年１０月ごろの予定に　秋田,https://news.yahoo.co.jp/articles/c1a1f097ef1f58719f535fad42f8bea3e8cab800,9/27(水) 18:53
aab,麻酔銃が命中するも…　大館市の同じ地域で４日連続クマの目撃　北秋田市では男性がクマに襲われけが　秋田,https://news.yahoo.co.jp/articles/f42ceaf79fddfc17959f58bd1f1e79a4e91645f4,9/27(水) 18:50
aab,クリ拾いをしていた８０代の男性がクマに襲われけが　命に別状なし　秋田・北秋田市,https://news.yahoo.co.jp/articles/8c522b5f7ee021664684d971d00283c4c8769ec0,9/27(水) 16:59
aab,災害復旧のスピードに直結　「災害ごみ」仮置き場の的確な設置・運営の訓練　秋田・大仙市,https://news.yahoo.co.jp/articles/0c6c023031ab531e5c4bf63a0c6de39104f75af9,9/27(水) 11:55
aab,季節外れのサクラ咲く　秋田・大仙市の庭園　数本のサクラの枝に花が…,https://news.yahoo.co.jp/articles/ccebe6c3e665fb51b815f4912ac87fcf38c1ab73,9/26(火) 19:25
aab,嘱託警察犬の審査会　秋田県警　行方不明者捜索や事件捜査で活躍,https://news.yahoo.co.jp/articles/b797a8fb6449ca603370ada99f1ad801a984dca8,9/26(火) 19:22
aab,猟友会メンバーの男性（８２）がクマに襲われけが　捕獲用わなの見回りに向かう途中　秋田・大館市,https://news.yahoo.co.jp/articles/a3d5d6ed53037f6fb28164ac325d5587ab36b823,9/26(火) 12:58
aab,「水素エネルギー関連の投資」名目で１９００万円分仮想通貨だまし取られる　秋田市の男性が被害,https://news.yahoo.co.jp/articles/445eb445a2f7b1223ca4f868cc5c2d9ee0b5fe48,9/26(火) 12:56
aab,住宅地のクリの木に…クマが７時間居座る　パトカー並び警戒　朝から緊張高まる　秋田・大館市,https://news.yahoo.co.jp/articles/5269a92eb88ba0e74ac43baf8d89969975bbf5bf,9/25(月) 19:49
aab,園長先生が作った手づくりおもちゃが人気！新幹線にパトカー、ゴミ収集車などの働く車がずらり…　秋田市,https://news.yahoo.co.jp/articles/100d4794de202bc9f086fd1c072bb03565109e84,9/25(月) 19:46
aab,出荷シーズン迎えた「リンドウ」　猛暑で品質や収穫時期に影響も　秋田・由利本荘市鳥海町の生産農家は…,https://news.yahoo.co.jp/articles/53aee01b76bb8e4803ebe25d8d348c26acc3866d,9/25(月) 19:35
aab,秋田のブランド米「サキホコレ」が収穫時期迎える　本格デビュー２年目の新米販売は１０月２１日から,https://news.yahoo.co.jp/articles/5b4f0db0f3f218528aa44411b36d12f640b0d4c0,9/24(日) 18:07
aab,身近な食べ物を通して環境や食文化を考える　　/秋田・横手市,https://news.yahoo.co.jp/articles/b5f147e2869aa7101984ba5efd7c5df6aa1fd897,9/23(土) 19:14
aab,能代沖の洋上風車から再び油漏れ　11日に油流出の同じ施設で　/秋田,https://news.yahoo.co.jp/articles/e3478afa10750ec163acd4b9117bbe5927228e77,9/23(土) 19:14
aab,ショッピングモールで企業説明会　秋田で働くきっかけに,https://news.yahoo.co.jp/articles/c88882bebdf52ebe42dfd09a223d7569ac5ba742,9/23(土) 19:12
aab,市街地にクマが出没したら…学校近くの出没想定し教育委員会も参加の訓練　/秋田・にかほ,https://news.yahoo.co.jp/articles/7e1bd1a5556ceae3c85b15b44e7276b4cf57f8c2,9/22(金) 20:01
aab,県内外の起業家らが秋田の魅力を探るツアー　新たなビジネスの可能性を探る　/秋田,https://news.yahoo.co.jp/articles/cf97e29dcd51f4288e8a082f31821463060f9048,9/22(金) 20:01
aab,洋上風力発電を観光資源に　能代市でガイド養成講座開催　/秋田,https://news.yahoo.co.jp/articles/727fb14d33ba2c5303983cc26098c65f488f19d0,9/22(金) 20:01
