media_en,media_jp,title_articles,link_articles,date_original
ibciwatev,IBC岩手放送,気仙地方は春の便り　寺の境内にフクジュソウの黄色い花　岩手・大船渡市,https://news.yahoo.co.jp/articles/3f9c78ec04ef62906e261d77446a5e97ef540a18,2/5(月) 12:02
ibciwatev,IBC岩手放送,「持ち直しの動きが弱まっている」　物価高等影響　2023年12月の有効求人倍率は1.23倍　岩手県内,https://news.yahoo.co.jp/articles/492698c9af1c62b7d2da8201f31851b1b9df4ebd,2/5(月) 9:36
ibciwatev,IBC岩手放送,津波から命を守る行動を　高台へ駆け上がれ!　岩手・釜石で「韋駄天競走」　東日本大震災の教訓忘れず,https://news.yahoo.co.jp/articles/bdd604ed77a39fc6ee286e5484dbe043be5b0e01,2/4(日) 18:12
ibciwatev,IBC岩手放送,映画「罪と悪」舞台あいさつ　齊藤勇起監督と主演の高良健吾さんが映画の魅力をPR　盛岡,https://news.yahoo.co.jp/articles/0dced81814227187aa14a9bcd68612af4ec65c62,2/4(日) 18:08
ibciwatev,IBC岩手放送,看護職の人材確保が急務　岩手県が「看護就職・進学説明会」を盛岡で開催,https://news.yahoo.co.jp/articles/83eba5c510fb663b1f9fa01df3f2467fbba76110,2/4(日) 18:06
ibciwatev,IBC岩手放送,日本製鉄釜石シーウェイブス　グリーンロケッツ東葛に61―17で敗れる　ラグビーリーグワンD2,https://news.yahoo.co.jp/articles/480de52d170169d6e8a67f42c9bb362d96c06ac1,2/4(日) 17:08
ibciwatev,IBC岩手放送,岩手ビッグブルズがアウェーで越谷と1勝1敗　バスケットボールB2リーグ　次節はホームで福島と対戦,https://news.yahoo.co.jp/articles/a07dcfa822c749b55815c2c3a6f9a2d18d7cd56f,2/4(日) 17:01
ibciwatev,IBC岩手放送,4日は二十四節気の「立春」　岩手県内各地で冷え込み緩む　早春の花・オオイヌノフグリ咲く,https://news.yahoo.co.jp/articles/be23f22798d1b8ef4c4a724131cf5602a6963868,2/4(日) 11:57
ibciwatev,IBC岩手放送,「『棋は対話なり』技術が進むほどコミュニケーションが大事」　日本将棋連盟・羽生善治会長が盛岡で講演,https://news.yahoo.co.jp/articles/8976bccffc92e6977b200d0fd51174be6e5c4ff7,2/4(日) 11:54
ibciwatev,IBC岩手放送,小林陵侑が2位で今季7度目の表彰台　W杯ジャンプ男子第15戦,https://news.yahoo.co.jp/articles/7d1bd686b63eebfe846b701b84726ba969a96611,2/4(日) 10:21
ibciwatev,IBC岩手放送,家族連れが雪遊びとグルメを満喫　くずまき高原牧場冬まつり始まる　葛巻町,https://news.yahoo.co.jp/articles/edb53e238bfdd37f78390d82cf0361dfc9ca29c2,2/3(土) 22:02
ibciwatev,IBC岩手放送,「多くの子どもたちに夢をかなえてほしい」　菊池雄星投手が手がける野球複合施設の起工式　岩手・花巻,https://news.yahoo.co.jp/articles/a225d69f9062dc5d4148f6b986c5d8e2bbd85f3b,2/3(土) 18:42
ibciwatev,IBC岩手放送,将棋教室の講師は羽生会長と岩手県出身の小山四段　小学生と「多面指し」で対局　紫波町,https://news.yahoo.co.jp/articles/f6371182d2c991ddaa59ea434eafff401dbcedf7,2/3(土) 18:38
ibciwatev,IBC岩手放送,4年ぶりに力士招いた豆まき復活　園児や厄年の男女も威勢よく　中尊寺大節分会　岩手・平泉町,https://news.yahoo.co.jp/articles/91851b86291776cc9d275e969b979a36fd1f2414,2/3(土) 18:36
ibciwatev,IBC岩手放送,盛岡市で建物火災相次ぐ　中太田で作業小屋と住宅を全焼　住人1人がけが　鉈屋町の住宅でも火事,https://news.yahoo.co.jp/articles/eae41388960dcbafaec09d65758933d7e1092fb5,2/3(土) 14:11
ibciwatev,IBC岩手放送,植樹した高田松原の松を守れ　NPO法人が蔓延する植物の「クズ」退治活動　岩手・陸前高田市,https://news.yahoo.co.jp/articles/41a08048babbb7121d003f6842da0d389c910f8b,2/3(土) 12:21
ibciwatev,IBC岩手放送,岩手・花巻市で住宅と倉庫を全焼する火事　焼け跡から性別不明の2人の遺体発見　92歳女性と息子の2人と連絡取れず,https://news.yahoo.co.jp/articles/8ff58828b23fab417bb6794c8381dbabf5a26140,2/3(土) 8:14
ibciwatev,IBC岩手放送,「岩手県のお米を食べて野球に打ち込んできました」ロッテ佐々木朗希投手からのメッセージも上映　盛岡市で県産米の品質競うコンテストの表彰式,https://news.yahoo.co.jp/articles/c4ebfbe8f5cef3fbe39177eb460f9d1a7ed9dcb3,2/2(金) 19:01
ibciwatev,IBC岩手放送,2月限定1000個販売　岩手・田野畑村産の高級早採りワカメその名も「極　若芽」初出荷　シャキシャキ食感に潮の香り,https://news.yahoo.co.jp/articles/6fec15567d78ee4d6775018d53c9bd3d0ae7a93a,2/2(金) 19:01
ibciwatev,IBC岩手放送,「ハーフライフル」ってどんな銃?規制強化の動きで狩猟の現場からは懸念の声　岩手・大槌町,https://news.yahoo.co.jp/articles/d3bbc545550b93361de84e97f0c74e529402f53b,2/2(金) 19:01
ibciwatev,IBC岩手放送,「60プラスプロジェクト」とは?　県教育委員会が児童・生徒の生活習慣改善に取り組んだ学校を表彰　岩手・盛岡市,https://news.yahoo.co.jp/articles/4a46f6eed37197749832b251fac0368cd594fd1b,2/2(金) 19:01
ibciwatev,IBC岩手放送,岩手・一関市の住宅火災　焼け跡から性別不明の1人の遺体発見　68歳男性と連絡取れず,https://news.yahoo.co.jp/articles/5e4e388c29e932e37f5fad76d21770bd26d5ae79,2/2(金) 18:14
ibciwatev,IBC岩手放送,入院3人含む園児30人に嘔吐や下痢の症状　釜石保健所管内の教育保育施設で感染性胃腸炎集団発生　岩手県内で今年度48件目,https://news.yahoo.co.jp/articles/6651a1699b519129cd73da07553b2be2ad660cba,2/2(金) 17:59
ibciwatev,IBC岩手放送,盛岡市内の小学校で16人り患し学年閉鎖　小学校と中学校2施設がインフルエンザで休業措置　今季延べ449件　岩手,https://news.yahoo.co.jp/articles/afdfcff423e7d82b75e43273d5abf3c60b28cf0f,2/2(金) 17:48
ibciwatev,IBC岩手放送,「南部木遣り」や「潮垢離」に特色　秋祭り彩る盛岡山車と山田町をめぐる神輿渡御それぞれ岩手県無形民俗文化財指定へ　ともに江戸時代が起源,https://news.yahoo.co.jp/articles/63485872f744e8a958463b8188c85820e479b8ee,2/2(金) 17:34
ibciwatev,IBC岩手放送,暖冬だけど対策は必要?　県が霜被害から果樹を守るための対策会議を開催　岩手・盛岡市,https://news.yahoo.co.jp/articles/0166154cae2645803ad0a8456de0ca072d82e35e,2/2(金) 15:53
ibciwatev,IBC岩手放送,盛岡市長が解雇されたタクシー会社の従業員の再就職支援を業界団体に要請　再就職希望者への説明会開催へ準備進む　岩手・盛岡市,https://news.yahoo.co.jp/articles/cfa943f2717e6c6499c0ada23f261f2fcf9218ec,2/2(金) 15:51
ibciwatev,IBC岩手放送,豆をまいて心の中の「いじわる鬼」も退治　岩手・矢巾町のこども園で節分を前に豆まき,https://news.yahoo.co.jp/articles/5378ffce6baa60aa70eb20a04e41b4ab8d56460a,2/2(金) 12:12
ibciwatev,IBC岩手放送,ふるさと納税の返礼品開発や町産品の販路拡大で目指す「地産外商」　岩手・岩手町に一般社団法人設立,https://news.yahoo.co.jp/articles/5d6f80b5f4b6039421486eac0c9c0bfea77189f8,2/2(金) 12:12
ibciwatev,IBC岩手放送,NYタイムズで紹介されたあの店のコーヒーも　ゆかりの農産物詰め合わせ5000円相当を無料配布　盛岡市在住15歳以上の生徒・学生対象に限定1500セット,https://news.yahoo.co.jp/articles/67ecec9e3b798d568c8037c82ded087c2e9ab62e,2/1(木) 22:02
ibciwatev,IBC岩手放送,暴風警報の岩手県内　紫波町で山林火災　空の便も欠航に,https://news.yahoo.co.jp/articles/6f24f9a148fda965e7f1f4eb446c1529142a0fe6,2/1(木) 19:39
ibciwatev,IBC岩手放送,「体育館は避難所になる前提での建設を」　能登半島地震から1か月　感染症対策で被災地派遣の医師に聞く　東日本大震災機に設置の「DICT」として活動,https://news.yahoo.co.jp/articles/3159498bbb1bcc5db5e653577f2e95477ac39963,2/1(木) 19:39
ibciwatev,IBC岩手放送,岩手中央タクシーの破産受け盛岡市が業界団体に要請へ　「従業員の再就職へ協力を」　業界の現状調査も,https://news.yahoo.co.jp/articles/cf99ed2d46ef7776d86e30ef5a39097ae845d50b,2/1(木) 19:36
ibciwatev,IBC岩手放送,陸前高田市産“ゆず”と“ショウガ”のチョコレートも　盛岡駅直結の商業施設で恒例「ショコラマルシェ」　14日のバレンタインデーまで開設,https://news.yahoo.co.jp/articles/99eb8832490174d7928f80f9a10aa76206eafa1c,2/1(木) 19:36
ibciwatev,IBC岩手放送,「極めて身勝手も後悔と謝罪の気持ち示している」　女子高校生誘拐の岩手・奥州市の男に猶予判決　長野地裁松本支部,https://news.yahoo.co.jp/articles/68b3f433399830d3ccce09d7790cabbb4d445e3f,2/1(木) 19:32
ibciwatev,IBC岩手放送,中学2年生が伝統の「立志式」　色紙にしたためた決意の言葉を堂々発表　盛岡市,https://news.yahoo.co.jp/articles/0d55ac0ca3fc35a2643c5032b8d4357599a93930,2/1(木) 19:27
ibciwatev,IBC岩手放送,田野畑局のAM放送を1年間休止　IBCラジオ　放送は田野畑FM「81.5MHz」で　岩手,https://news.yahoo.co.jp/articles/c7a76240a6fb5e5c2017fa5df88a102af6e1c39b,2/1(木) 19:27
ibciwatev,IBC岩手放送,県営住宅19世帯で総額657万円の家賃を誤徴収　住戸面積を職員が入力ミス　払い過ぎた入居者には全額返還　不足生じる場合は支払い求める　岩手,https://news.yahoo.co.jp/articles/813b7c0b8f5b538628d03c0573da1d386a4ea41b,2/1(木) 18:53
ibciwatev,IBC岩手放送,ロッテ佐々木朗希投手がJA全農いわてとアンバサダー契約　CMやバックネット広告でふるさと岩手の農畜産物をPR,https://news.yahoo.co.jp/articles/b41e3688b444a0a337537f00a9a6337ac0b74bae,2/1(木) 18:16
ibciwatev,IBC岩手放送,遠野市内の保育園で11人り患し学年閉鎖　小学校や高校など3施設がインフルエンザで休業措置　今季延べ447件　岩手,https://news.yahoo.co.jp/articles/15bf6e7cb2f00943e3a67deb50676bab7052b995,2/1(木) 17:34
ibciwatev,IBC岩手放送,水田輝く5月の大会は奥州市の魅力がいっぱい　SUIさんも訪問予定の「きらめきマラソン」をPR　申し込みは2月15日まで　岩手,https://news.yahoo.co.jp/articles/185877b5f640411699566d5613bbbc8aa5d73a56,2/1(木) 15:51
ibciwatev,IBC岩手放送,大船渡湾望む温泉宿が2冠達成　「絶景」と「海の幸」　インターネットでの温泉宿・ホテル総選挙2023　岩手,https://news.yahoo.co.jp/articles/97c61b95519a6d73b815ffd020206272cfc64a15,2/1(木) 15:46
ibciwatev,IBC岩手放送,1日の秋田・湯沢市住宅火災　住人男性の無事を確認,https://news.yahoo.co.jp/articles/fe42fcb9267dfbef8b7d4235ebc4ae5918e0788f,2/1(木) 14:21
ibciwatev,IBC岩手放送,ヒスイの輝きで未来へ前進　発展続ける三陸の「完全陸上養殖アワビ」　3.11の甚大な被災を乗り越え挑戦を続ける親子　岩手・大船渡市【復興への羅針盤】,https://news.yahoo.co.jp/articles/a3a5b27907f98fb3b4d519c3d1c0240d612185f9,2/1(木) 13:04
ibciwatev,IBC岩手放送,JR山田線の利用拡大を沿線の盛岡市と宮古市が協議　上米内〜宮古間は岩手県内最大の赤字幅　来年度利用実態を詳細調査へ,https://news.yahoo.co.jp/articles/52bea1ba74b2b0194a6035cbf2ae8c65ccf30e31,2/1(木) 12:02
ibciwatev,IBC岩手放送,岩手ビッグブルズがホームで山形に快勝　バスケットボールB2,https://news.yahoo.co.jp/articles/8c82e29437a0e83b564dfaf8bec8b81f2d04bace,2/1(木) 10:46
ibciwatev,IBC岩手放送,クマによる人身被害が深刻な岩手県　来年度は精密な生息数の調査や市街地出没時の対応訓練実施へ　盛岡で県環境審議会,https://news.yahoo.co.jp/articles/c7ba380384f4eaa361257453fb560a4cb240f90e,1/31(水) 19:14
ibciwatev,IBC岩手放送,1定点あたり16.82人に　新学期始まり学校で新型コロナの感染広がる　インフルエンザも再び注意報レベルに　岩手県が注意呼びかけ,https://news.yahoo.co.jp/articles/da8b71915e6a232c1f8f0648f60942d4552ae510,1/31(水) 19:12
ibciwatev,IBC岩手放送,岩手県立708人と盛岡市立102人に吉報　公立高校の推薦入試で合格者数発表　一般入試の出願期間は2月5〜9日,https://news.yahoo.co.jp/articles/6b47dadae652eae97a5fb00ece23607a68a50616,1/31(水) 18:59
ibciwatev,IBC岩手放送,感染性胃腸炎が集団発生　中部と大船渡保健所、盛岡市保健所管内の教育保育施設4か所で計87人に症状　岩手県内で今年度47件に,https://news.yahoo.co.jp/articles/138db02bc51d1f841f6bca662da91138bce9d68c,1/31(水) 18:36
ibciwatev,IBC岩手放送,盛岡市内の高校で56人り患し学年閉鎖　小学校と高校の6施設がインフルエンザで休業措置　今季延べ444件　岩手,https://news.yahoo.co.jp/articles/9e65d3aa41aa8bf649ed6501e0e025d0ada827d5,1/31(水) 18:14
ibciwatev,IBC岩手放送,新たな大谷翔平ファンの聖地になるか!?高校時代を過ごした岩手・花巻市にMVP＆ホームラン王の記念モニュメント,https://news.yahoo.co.jp/articles/3f34990cc64908c6a2d7034c10e703ec8ace7c50,1/31(水) 17:06
ibciwatev,IBC岩手放送,奥州・前沢の同僚集団暴行死事件　主犯格の男にグループで最も重い懲役12年の実刑判決　盛岡地裁,https://news.yahoo.co.jp/articles/225ec64c11e49f32c8c025532f6609afac65eeca,1/31(水) 16:51
ibciwatev,IBC岩手放送,岩手県内のレギュラーガソリンの平均小売価格は3週間ぶりに値上がり,https://news.yahoo.co.jp/articles/6f40ad48f1477e11a899d2a389a3c1884e0436a2,1/31(水) 16:12
ibciwatev,IBC岩手放送,「商店街にこそ活路」　ニューヨークタイムズにも取り上げられた魅力深堀り　まち歩き通じ研究した成果を専門学校生が発表　盛岡市,https://news.yahoo.co.jp/articles/40770a2b99a9ba4296180585d2765f25a69117ca,1/31(水) 15:57
ibciwatev,IBC岩手放送,水源を守るキャンペーンの対象商品の一部を農業用水の管理団体に寄付　飲料メーカーとスーパーの運営会社　岩手・盛岡市,https://news.yahoo.co.jp/articles/28171f0d6a15b8e18b1216d697b68e1f396a489a,1/31(水) 15:54
ibciwatev,IBC岩手放送,岩手・盛岡市東仙北のマンション火災　病院で死亡したのは火元の部屋に住む65歳の男性,https://news.yahoo.co.jp/articles/f707d8ea078e200039f951a03c7e156cdd52778a,1/31(水) 13:28
ibciwatev,IBC岩手放送,能登半島被災地の食事をサポート　「SAVE IWATE」（盛岡市）が2回目の支援へ,https://news.yahoo.co.jp/articles/03f70dcca1ec758a6ca38d42cf2ca6b31f2357e0,1/31(水) 12:06
ibciwatev,IBC岩手放送,岩洞湖の「氷上ワカサギ釣り」が待望の解禁　氷の厚さようやく15センチに　初日から多くのファン　盛岡市,https://news.yahoo.co.jp/articles/924969880d21e8ff9081451f6146763bc9183d96,1/31(水) 12:06
ibciwatev,IBC岩手放送,「もう一度、お父さんが作るチャーハンが食べたい」　傷害致死事件被害者の長男の供述調書　主犯格とされる男の公判で朗読　岩手・奥州市,https://news.yahoo.co.jp/articles/3654b085089378c7b005365e1e22a83ed311d205,1/30(火) 19:39
ibciwatev,IBC岩手放送,みんなで感触に感動!　大谷翔平選手からのグローブが盛岡市の小学校に到着　野球をしない児童も「夢と勇気感じる」,https://news.yahoo.co.jp/articles/d9535f139a6ae75e5d31e5ba4a7edeceeae8c2c6,1/30(火) 19:32
ibciwatev,IBC岩手放送,デーモン閣下が盛岡に降臨・・・方言で「かかりつけ医を持って」　地域医療を考えるイベントで不要不急の受診を控えるよう呼びかけ,https://news.yahoo.co.jp/articles/37c51e8b355f900968529cbe871115a5c6b8b855,1/30(火) 19:21
ibciwatev,IBC岩手放送,徳光和夫さんが“念願の”花巻東高校に　国内最大級の感染症「肝炎」の早期対策を呼びかけ　スポーツコースの生徒が検査拡大のアイデアを発表　岩手,https://news.yahoo.co.jp/articles/ee2f1f5b15ba91dca658bc6e717065124cbb02fc,1/30(火) 19:21
ibciwatev,IBC岩手放送,自宅近くの小屋に火を放ち全焼させる　30歳の無職の男を放火の疑いで逮捕　やけどするも軽傷　岩手・陸前高田市,https://news.yahoo.co.jp/articles/8a87114c85fab6813f8cbd13c794837da50e0848,1/30(火) 19:09
ibciwatev,IBC岩手放送,住宅の焼け跡から発見された遺体はこの家に住む60歳の長男　秋田・由利本荘市,https://news.yahoo.co.jp/articles/fe7135ca739dc62691003a7e286f11c68f093ef3,1/30(火) 18:22
ibciwatev,IBC岩手放送,小学校・特別支援学校・幼稚園5施設がインフルエンザで休業措置　今季延べ438件　岩手,https://news.yahoo.co.jp/articles/23d153e2b7a9b301934e041c73470cdd0fb850c4,1/30(火) 17:46
ibciwatev,IBC岩手放送,新型コロナ関連補助金　別に約5000万円をだまし取ったか　旅館「長栄館」前社長ら3人を詐欺容疑で再逮捕　岩手,https://news.yahoo.co.jp/articles/02c032c24f322b860ace6624aee465f5438b1865,1/30(火) 16:57
ibciwatev,IBC岩手放送,特産の椿油はこうしてつくられる〜岩手・陸前高田市の小学生が製造工程を見学　ツバキの実を拾って届ける活動も,https://news.yahoo.co.jp/articles/fd8ff06bdcc8cc9c2683ad9f92fd3bdd60629b50,1/30(火) 16:03
ibciwatev,IBC岩手放送,警察学校で卒業式（長期課程）　40人が県民の暮らしを守る第一線へ　岩手,https://news.yahoo.co.jp/articles/3dc76f0fc6c589783d819578feb022d4e5bafbdc,1/30(火) 16:01
ibciwatev,IBC岩手放送,伐採作業中に木の下敷きに　首のあたりを強打し72歳の男性が死亡　岩手・一関市,https://news.yahoo.co.jp/articles/7e62dae538eb653ff402ac99e9cd9a0f70f5e9e6,1/30(火) 11:53
ibciwatev,IBC岩手放送,噴きあがる炎に静かな住宅街が騒然　未明に火事　住宅全焼し1人死亡　この家の男性か　盛岡市,https://news.yahoo.co.jp/articles/abbff141baefe83042361392e0577fe4ef946e35,1/30(火) 10:36
ibciwatev,IBC岩手放送,マンション2階から火の手　65歳の男性が病院に搬送されるも死亡　岩手・盛岡市,https://news.yahoo.co.jp/articles/af8b1c46dffde269c0fe2d885e0ffcbab11f7470,1/29(月) 19:41
ibciwatev,IBC岩手放送,音楽家目指す高校生が卒業演奏会に向けレッスン　不来方高校音楽コースの3年生9人　岩手・矢巾町,https://news.yahoo.co.jp/articles/9485c8d27725680428464e6492a8b43f4bcdba4d,1/29(月) 19:38
ibciwatev,IBC岩手放送,「岩手代表として戦えるのは誇り」　女子ホッケーサクラジャパンの及川栞選手がパリ五輪の意気込み語る　岩手・盛岡市,https://news.yahoo.co.jp/articles/a63db23c0372d2704be2702fc8a3944ab69d5121,1/29(月) 19:38
ibciwatev,IBC岩手放送,フィリピンの有名俳優が岩手県沿岸でロケ　東日本大震災をテーマに映画制作　モチーフは大槌町の「風の電話」,https://news.yahoo.co.jp/articles/66c41b312649eea439474b88fdb7c5c795b105ee,1/29(月) 19:36
ibciwatev,IBC岩手放送,「光る頭」競って横綱争い　頭皮に吸盤つけて綱引きも　「光頭会」が番付編成会議　秋田・横手市,https://news.yahoo.co.jp/articles/6ed37cd3dbd7f81ff4e0b0b633c3bd86cc3ec9f2,1/29(月) 19:36
ibciwatev,IBC岩手放送,インフルエンザによる休業措置7件　奥州市立真城小学校は1〜3学年が閉鎖　岩手,https://news.yahoo.co.jp/articles/6d621fffe3656c21e7c7dc2948d5bf48d5c8a6ae,1/29(月) 17:46
ibciwatev,IBC岩手放送,岩手県中部保健所管内の教育・保育施設で感染性胃腸炎の集団発生　園児と職員合わせて26人に嘔吐や下痢の症状,https://news.yahoo.co.jp/articles/7c65744d58defae1ffc75fca5e609a1f46d006a6,1/29(月) 16:21
ibciwatev,IBC岩手放送,「不安な気持ちを少しでも晴らせるように」　岩手・盛岡市が能登半島地震被災地に職員派遣　東日本大震災経験の男性も,https://news.yahoo.co.jp/articles/70200177ace79e8d2f877b928acb5387ddd3203f,1/29(月) 15:53
ibciwatev,IBC岩手放送,伝統の「こども音楽コンクール」で日本一　岩手大教育学部附属小が文部科学大臣賞受賞,https://news.yahoo.co.jp/articles/d43ae27113ac06ca45060e91605b469278374746,1/29(月) 15:44
