media_en,media_jp,title_articles,link_articles,date_original
tamahiyo,たまひよONLINE,脳のはたらきと密接に関係する「腸」。腸内環境のベースは５歳ごろまでにできる!?子どものために今したいこと【最新研究】,https://news.yahoo.co.jp/articles/9d7c1c4cab0985451a112c6074cf7a211f605388,1/1(月) 13:55
tamahiyo,たまひよONLINE,バースデイ、西松屋、しまむら…「めちゃくちゃ万能」「フォーマル感が出る」お出かけコーデ5選,https://news.yahoo.co.jp/articles/6a9c85fe9059d3393ec1622f4c05c684548a44a8,1/1(月) 12:55
tamahiyo,たまひよONLINE,EXITのりんたろー。がパパになる！ 妻を案じてかけた言葉に真顔で返された鋭いツッコミもすべてが学び,https://news.yahoo.co.jp/articles/0df8f031ec877a82d2a31cc24ae1e903772aafbc,1/1(月) 11:55
tamahiyo,たまひよONLINE,【月齢別】０才児ベビーの1月の様子＆お世話ポイント,https://news.yahoo.co.jp/articles/c31d64d880bd42d9c69004df78c45fcaf9c0ef12,1/1(月) 10:55
tamahiyo,たまひよONLINE,今、新しいバースデー記念として人気上昇中！赤ちゃんが描く“ファーストアート”って？,https://news.yahoo.co.jp/articles/05c2784ff44079ce4665dd3145dd34de94417010,2023/12/31(日) 13:55
tamahiyo,たまひよONLINE,お焚き上げに行けない！お正月飾りどうする？ゴミ出しのOK・NGは？専門家に聞いてみた,https://news.yahoo.co.jp/articles/5e251ba8881fcb86a2842d4a1c182b4f8f6274f0,2023/12/31(日) 11:55
tamahiyo,たまひよONLINE,今年の冬はGUで！「あったかぬくぬく素材♪」「おなかと足元の防寒対策に」おすすめアイテム4選,https://news.yahoo.co.jp/articles/61b4c8727622cff9d1f89007b0314ea2de737cf3,2023/12/30(土) 13:55
tamahiyo,たまひよONLINE,妊娠初期の超音波検査で確認できることは？赤ちゃんの性別はいつごろわかる？【産婦人科医】,https://news.yahoo.co.jp/articles/44ff46f45229dbeef26bde2d1923ab83a15f843d,2023/12/30(土) 11:55
tamahiyo,たまひよONLINE,年末年始の子どもの事故「大人がいっぱいいるときほど要注意！」,https://news.yahoo.co.jp/articles/95675f963926639afc1e7b6b5681af15e9e5da51,2023/12/29(金) 13:55
tamahiyo,たまひよONLINE,フリーアナ吉田明世、円安の中臨んだ遅めの夏休み、子どもからはまさかの反応が,https://news.yahoo.co.jp/articles/4c8bd3eb4f7cdaacd5b3f2779784b28b85fcfdaa,2023/12/29(金) 11:55
