media_en,media_jp,title_articles,link_articles,date_original
dime,＠ＤＩＭＥ,訪ねた古墳は2500基以上！古墳王子が紐解く古代の人々に学ぶ自然災害への知恵と工夫,https://news.yahoo.co.jp/articles/21f54ed6f3da19f3350ef96d6a645c753851ce28,1/27(土) 9:20
dime,＠ＤＩＭＥ,Z世代で薬物使用の検挙が増加傾向、大学生の3人に1人が「日常生活で大麻を入手できる」,https://news.yahoo.co.jp/articles/7dc8152660039e3bedba3d39c12f190ca1154810,1/26(金) 21:40
dime,＠ＤＩＭＥ,対応カードの発行枚数が1億枚を突破、Visaのタッチ決済は決済市場の勝者になれるのか？,https://news.yahoo.co.jp/articles/c85a3a42db37e666980b74218cf36ab5e05940af,1/26(金) 20:40
dime,＠ＤＩＭＥ,他人事じゃない！今年4月に改正される運送業ドライバーの労働時間規制、何が変わる？,https://news.yahoo.co.jp/articles/c9a0036282b598d0430916a62b11bdd328a49615,1/26(金) 19:21
dime,＠ＤＩＭＥ,怒鳴る＝パワハラ!?大声で長時間叱責する上司を訴えたら勝てる？,https://news.yahoo.co.jp/articles/a7b6d320fe5d9e8c929c9ca78e81bfd59c4f409b,1/25(木) 21:40
dime,＠ＤＩＭＥ,電動キックボート等「特定小型原付」市場に不適合ショックが発生！国交省が10車種の保安基準調査を実施,https://news.yahoo.co.jp/articles/6e94568e08a23410b46968fcbc8097895f6528d4,1/25(木) 20:40
dime,＠ＤＩＭＥ,マイナンバーカードを日常的に持ち歩いている人はどれくらいいる？,https://news.yahoo.co.jp/articles/8e2e334f011a0984df51d7d0c9426e49ab876e61,1/25(木) 17:20
dime,＠ＤＩＭＥ,あなたは「アート」という言葉を忘れて、鑑賞することができますか？,https://news.yahoo.co.jp/articles/b17a0dcde7e71874e49b1f8f71d1738e72bf50d4,1/24(水) 21:40
dime,＠ＤＩＭＥ,なぜ、オンライン診療やお薬手帳アプリは普及しないのか？医療サービスにおけるDXの現状と課題,https://news.yahoo.co.jp/articles/634e7b25952b8f8d54b7d82ad15707ff2b753ba2,1/24(水) 21:20
dime,＠ＤＩＭＥ,アメリカ旅行に必須のESTA申請、紛らわしい代行業者を回避する方法は？,https://news.yahoo.co.jp/articles/9b97a04a2ecbf3593b201a6050d5b11b77b4f2eb,1/24(水) 20:40
dime,＠ＤＩＭＥ,米国で電動キックボードシェアサービスのBirdが破産申請、車両数優先主義の限界が露呈か,https://news.yahoo.co.jp/articles/686aefa5ce71592cf31a333cc3417d10e6d599f5,1/23(火) 21:40
dime,＠ＤＩＭＥ,羽毛ふとんの寿命は？羽毛ふとんと毛布、掛ける順番は？スリープマスターが解説する掛けふとんの豆知識,https://news.yahoo.co.jp/articles/bd574c9dd7c5b1e28a5738dfccc40af1effa2beb,1/23(火) 21:10
dime,＠ＤＩＭＥ,年賀状は20年で6割が消失、大型買収は失敗、日本郵政は再起できるのか？,https://news.yahoo.co.jp/articles/843079a388035d7d27a984fa749188b410581600,1/23(火) 20:40
dime,＠ＤＩＭＥ,PayPayオフライン決済の利用上限が大幅緩和、イベント会場でも問題なく買い物できるレベルに,https://news.yahoo.co.jp/articles/19f879fce042da6d7b655c39ce4a9aea061c4fc9,1/22(月) 22:10
dime,＠ＤＩＭＥ,40〜50代女性の4人に1人が「更年期による不調を自覚」,https://news.yahoo.co.jp/articles/7fe2476754f33a4a3f6dc8d5c89978a162055da5,1/22(月) 21:40
dime,＠ＤＩＭＥ,NIKEのロゴマーク・スウッシュに隠された効果とは？安定的な成長を続けるブランド戦略,https://news.yahoo.co.jp/articles/b2e57b8cf484ec2e8c6ac1281bf4904e91c331a3,1/22(月) 20:40
dime,＠ＤＩＭＥ,業績は安定、株式市場からの評価も高いオートバックスが希望退職者を募った理由,https://news.yahoo.co.jp/articles/af56b6530d8c2a6c0f3ac623b566f2c4355c714b,1/21(日) 21:20
dime,＠ＤＩＭＥ,18歳新成人の8割、成人式を迎える20歳の6割以上がお年玉をもらっている,https://news.yahoo.co.jp/articles/fc243944e8c9e3bfcdb5b9701c1ea5d612e2f38e,1/21(日) 20:40
dime,＠ＤＩＭＥ,10年前にコストコの株を買っていたら、いくらになっていた？,https://news.yahoo.co.jp/articles/80bc35ce6fa35b10fdbdbb455c00b142e835ba45,1/21(日) 10:10
dime,＠ＤＩＭＥ,新NISAスタートでどう変わる？知らないと損する株式投資にかかる税金の基礎知識,https://news.yahoo.co.jp/articles/56e6d44fb7f4102aa32e65dc3428ba53cec34078,1/21(日) 9:20
dime,＠ＤＩＭＥ,キャストや監督の話を聞きながらリピート鑑賞！映画の「副音声」のエンタメ化が進んでいる理由,https://news.yahoo.co.jp/articles/8697c6d0d3780b79d4ecd06dfb7793dc4b7dfcd2,1/20(土) 21:40
dime,＠ＤＩＭＥ,犬や猫をお店で売っているのは日本だけ!?海外に学ぶ、これからのペットショップのあり方,https://news.yahoo.co.jp/articles/41153bb53aabd3e9785846c9400f099699e03f50,1/20(土) 21:20
dime,＠ＤＩＭＥ,昨年成人式に参加した女性の9割が和装を選択。準備はいつから？かかった費用は？,https://news.yahoo.co.jp/articles/e459b9d3bd1e2d5baeea72d9a616364f1578f8e2,1/20(土) 20:40
