media_en,media_jp,title_articles,link_articles,date_original
tamahiyo,たまひよONLINE,「寝かしつけに1時間超え」の悩みを解決するには？ 乳幼児睡眠コンサルタントが寝かしつけ時短のポイントをアドバイス,https://news.yahoo.co.jp/articles/1dabd4396655a2c6a38b0770ba0e9facf41f6bf4,1/27(土) 13:55
tamahiyo,たまひよONLINE,北斗晶の義娘・凛「沐浴は３日に１回」「授乳室がない」カナダ・日本の子育ての違いに感じること【インタビュー】,https://news.yahoo.co.jp/articles/ee522d49e3fb65ad8e1b676a26df80e773a33662,1/27(土) 11:55
tamahiyo,たまひよONLINE,丸山桂里奈・本並健治夫妻、パパは年男で厄年で還暦な今年。ママ担当の抱っこは15kgが限界かな。,https://news.yahoo.co.jp/articles/7761b651c6b7ed8adccd440c048bb7e43f024739,1/26(金) 13:55
tamahiyo,たまひよONLINE,小６で難病のALDと診断された息子。「もっと早く発見できていたら」と後悔する日々【体験談・医師監修】,https://news.yahoo.co.jp/articles/3c6db41119bdbb2ed446173cd3303155e5e49c12,1/26(金) 11:55
tamahiyo,たまひよONLINE,お風呂掃除いつするのがベスト？お風呂場に汚れを溜め込まないポイント６,https://news.yahoo.co.jp/articles/fcc96c4991fcb3fded94304c0a5289af13935dbf,1/25(木) 13:55
tamahiyo,たまひよONLINE,フリーアナ吉田明世、2024年の今年の目標「目はかけるけど手はかけない！」,https://news.yahoo.co.jp/articles/fc5b798eb45bb6b06ad834fb505ea0e431718870,1/25(木) 11:55
tamahiyo,たまひよONLINE,能登半島地震・緊急メッセージ。 被災時の妊婦さんとご家族が注意すべきこととは？ 【産婦人科医＆助産師】,https://news.yahoo.co.jp/articles/2b688865da3a34b28317738f7e17e6f732568c7b,1/24(水) 17:00
tamahiyo,たまひよONLINE,2人目育児は「大変？」それとも「楽勝？」。余裕があるわけではなく、空回りしなくなったの声も！リアルママボイス,https://news.yahoo.co.jp/articles/a2a2c3268077ac08b2c8beaae1c353e76aea73f1,1/24(水) 13:55
tamahiyo,たまひよONLINE,第1子妊娠中のモデル・Kelly、ストイックな生活から一変！妊娠してから起こった変化とは,https://news.yahoo.co.jp/articles/7b2efad81c208c749615020618c7203d97e759d8,1/24(水) 12:55
tamahiyo,たまひよONLINE,父になったおばたのお兄さん、男性側の不妊治療もオープンにしたいとSNSで発信！「ありがとう」と感謝の言葉を伝えることが夫婦の当たり前に。,https://news.yahoo.co.jp/articles/51b00edf835c1cc66b1ead1b21d3a4aa12fccac9,1/24(水) 11:55
tamahiyo,たまひよONLINE,子どもの人数の理想と現実。もう1人欲しいけど、金銭面など大きな壁が…。専門家に聞く,https://news.yahoo.co.jp/articles/0f840b7301f5168d1cc0b1705077d78111022c99,1/23(火) 13:55
tamahiyo,たまひよONLINE,おなかの赤ちゃんはどんな風に過ごしてる？おしっこはするの？産科医が解説,https://news.yahoo.co.jp/articles/6194730e420259eb23f31cdd8b6ea5d52c92be10,1/23(火) 12:55
tamahiyo,たまひよONLINE,障がいのあるなしに関わらず「エンタメの魔法」で、個性を活かして輝ける社会にするのが私の使命！きょうだい児の挑戦,https://news.yahoo.co.jp/articles/4380c9b86026cb98bba06c64e988fabf7137a297,1/23(火) 11:55
tamahiyo,たまひよONLINE,「看護師時代、病院の廊下で楽しそうにしているのを目撃された患者さん、実は…」みんなの人生ビックリエピソード,https://news.yahoo.co.jp/articles/3c5a5df554b40be2427a8b917987fc39a29d8c19,1/22(月) 13:55
tamahiyo,たまひよONLINE,「まさか・・・トイレに行っている間に子どもが大やけど」。電気ケトルによる乳幼児のやけどが増加。専門家も注意を呼びかけ,https://news.yahoo.co.jp/articles/0db2c58df5d6d591384ca265e6098077d78656d1,1/22(月) 12:55
tamahiyo,たまひよONLINE,2歳で全盲になった長男。数々のミュージシャンとも共演！24時間テレビやパラリンピック閉会式出演で感じたこと【全盲のドラマー体験談】,https://news.yahoo.co.jp/articles/b70901515ca723c9cd7c7121c7c64d30021fa2b7,1/22(月) 11:55
tamahiyo,たまひよONLINE,ユニクロ「おすすめの素材はコレ！」「暖かくすごす着方もご紹介！」冬のパジャマの選び方4選,https://news.yahoo.co.jp/articles/c8cc475d5088538ed3a6140f35c1b9e400dfd8de,1/22(月) 10:55
tamahiyo,たまひよONLINE,【ママ友宅でのもしものトラブル】子どもが家具を汚したら、または汚されたら？どうする？！,https://news.yahoo.co.jp/articles/d51098110968b88437f6a213083ef518f7314786,1/21(日) 13:55
tamahiyo,たまひよONLINE,EXITのりんたろー。がパパに！ 妻の出産後、病院近くの公園で大号泣。その理由とは!?,https://news.yahoo.co.jp/articles/1342d4cffbfc6a1946adcd5cf7959e3ab835e387,1/21(日) 12:55
tamahiyo,たまひよONLINE,小学４年で発症した副腎白質ジストロフィー。徐々に体の機能が失われていく難病、最初は発達障害だと思っていた【体験談】,https://news.yahoo.co.jp/articles/7dfef392c689c969654d3d7cf26cb0dd9235f25c,1/21(日) 11:55
tamahiyo,たまひよONLINE,家の中には危険がいっぱい！室内で起こる赤ちゃんの事故TOP3は？予防法も解説【小児科医】,https://news.yahoo.co.jp/articles/3a49fe3925639026c2d23c89b48031362e7a4a59,1/21(日) 10:55
tamahiyo,たまひよONLINE,「真夜中に山の上に連れて行かれて…」「着替えていてパンツ丸見えのときに」「片膝ついて指輪の箱パッカーン！」などなど、みんなのプロポーズ・エピソード,https://news.yahoo.co.jp/articles/a60c63a689572938c028a5099e53d9fa4490f275,1/20(土) 13:55
tamahiyo,たまひよONLINE,第2子を出産した鈴木ちなみ、出産間際の看護師さんからの質問にびっくり！初めてのシンガポールでの出産体験談,https://news.yahoo.co.jp/articles/e15c02de22047d823b469f5db0860bcf6dfcdb71,1/20(土) 12:55
tamahiyo,たまひよONLINE,小児がんで２歳で両目を摘出した長男。「あきらめたらいかん」両親の言葉で育まれた自己肯定感とは？【全盲のドラマー体験談】,https://news.yahoo.co.jp/articles/cf6e72a511fae429cbde2785e20da5a557a78992,1/20(土) 11:55
tamahiyo,たまひよONLINE,コンセントにつながった電気コードをなめて起こる「電撃傷」。体の中を電流が通り抜ける・・・赤ちゃんが危ない！【小児科医】,https://news.yahoo.co.jp/articles/5753779a2102e8d7938894ef6d05e7c834833fa8,1/20(土) 10:55
tamahiyo,たまひよONLINE,初めての体外受精・顕微授精をもっとるためにQ&Aで専門家が回答,https://news.yahoo.co.jp/articles/09b4d6da33736e23f4adae3e0d3c62fb8ce1c4a9,1/19(金) 14:55
tamahiyo,たまひよONLINE,しいたけのじく「食べる派」VS「食べない派」の理由は？しいたけ丸ごと美味しく食べるレシピも紹介！,https://news.yahoo.co.jp/articles/a1100890a207cc046fe25dbfb3a36c7a99bf5904,1/19(金) 13:55
tamahiyo,たまひよONLINE,「お風呂イヤ！」しんどすぎ…【ダイソー・セリア】神コスパのお風呂おもちゃをレポ,https://news.yahoo.co.jp/articles/4843ecffc266fc6176c3ed9245a7ae370bee4dbe,1/19(金) 12:55
tamahiyo,たまひよONLINE,パパになったおばたのお兄さん、息子は”推し“、奇跡的に立ち会う事ができた出産に一生分の親孝行をしてもらった感じ。,https://news.yahoo.co.jp/articles/af7f02df68f4ddc10be7309555ef077403c946bb,1/19(金) 11:55
tamahiyo,たまひよONLINE,パートナーに元カレ・元カノの話をしたことある？ むしろ円満になる裏ワザ,https://news.yahoo.co.jp/articles/3d833e85aec214c2bb82251bcb30a3f9d52dc5e3,1/18(木) 13:55
tamahiyo,たまひよONLINE,44歳で第一子を出産した宮崎宣子、「手首も膝も肩も痛い、抱っこしているのに全然寝ない〜」白目をむいて育児に奮闘中！,https://news.yahoo.co.jp/articles/0ad54ee990a232ffb46d1006532383a8c8a88a8b,1/18(木) 12:55
tamahiyo,たまひよONLINE,「9人も子どもがいる家には思えない」「いつも片づいていて尊敬」とインスタで話題！二女七男の大家族ママに聞く子育てのコツ,https://news.yahoo.co.jp/articles/1bad4f460722ae814d9e299bb51eaf87ff5aa8b0,1/18(木) 11:55
tamahiyo,たまひよONLINE,"ママ・パパ2,062人が選んだ妊娠・育児グッズを発表！パパの抱っこが増加？ 3位に「抱っこひも」が初ランクイン",https://news.yahoo.co.jp/articles/29d982d644f08eba340d7631ab7e2bb1f85b3df8,1/18(木) 10:55
tamahiyo,たまひよONLINE,私の大切な三つ子の妹。1人は亡くなり、2人は24時間介助が必要な重度重複障がいに…。「楽しく生きて」母の願いを胸に,https://news.yahoo.co.jp/articles/f976ddf087cc0eae07ae50f319011d5d36f9a411,1/17(水) 13:55
tamahiyo,たまひよONLINE,被災時の育児について緊急メッセージ「災害時だからこそ、周囲の力を頼って、頑張りすぎない育児を！」【小児科医】,https://news.yahoo.co.jp/articles/8c6d6c75c031bc9b7c724bbc6c9657b6cbf79d45,1/17(水) 12:55
tamahiyo,たまひよONLINE,北斗晶の義娘・凛、陣痛の痛みはプロレスの試合やけがの痛さとは次元が違う！産んだ翌日には退院する、カナダの出産,https://news.yahoo.co.jp/articles/27ec8a92335219d8031d3e33f818353ebbb0575c,1/17(水) 11:55
tamahiyo,たまひよONLINE,知らなきゃ損?!　食事でできる子どもの風邪予防を管理栄養士が伝授！,https://news.yahoo.co.jp/articles/8dcca3b748cf3fca8c4a3133d51b76f365266bc7,1/17(水) 10:55
tamahiyo,たまひよONLINE,車いすごと踊り出す子も！ピアニスト斎藤守也に聞く、障害の有無にかかわらず音楽が子どもに与える影響【インタビュー】,https://news.yahoo.co.jp/articles/b10ca44d7aeabee3654d9d0fee80bc047b0dfe95,1/16(火) 13:55
tamahiyo,たまひよONLINE,すっぴんでもOK！時短にもなる眉のアートメイクをしてみたいけれど、不安なことも…。その疑問について専門家に聞いてみた！,https://news.yahoo.co.jp/articles/9015bc0689dd2b14fe6ba6be77ef64a3c27423ae,1/16(火) 12:55
tamahiyo,たまひよONLINE,おたふくかぜの後遺症で8歳で難聴に。11歳で小児人工内耳の手術を受け、その1年半後にようやく「聞こえた！」の言葉が【ムンプス難聴体験談・医師監修】,https://news.yahoo.co.jp/articles/0c3459e22f8a6f6ecc500ca8008ba29b6c5c0dfd,1/16(火) 11:55
tamahiyo,たまひよONLINE,子育て中の腰痛をストレッチで解消！ヨガインストラクターが予防法を解説,https://news.yahoo.co.jp/articles/3ac0c37c6a82661632d6ff69e95952b3fd12a128,1/16(火) 10:55
tamahiyo,たまひよONLINE,イタリア流・幸せな子どもの育て方。「私は絶対合格する！」と夢を実現する力を持った娘が教えてくれたこと,https://news.yahoo.co.jp/articles/7273353f2c35e3960a772974c4517781a52e6627,1/15(月) 13:55
tamahiyo,たまひよONLINE,子どもの発熱は「熱の高さ」より「熱が出ている日数」が重要!その理由は？発熱時のおうちケアのポイントも解説【ママ小児科医】,https://news.yahoo.co.jp/articles/7025c9f60b3641d4404f3ab1c26183e7594fdd31,1/15(月) 12:55
tamahiyo,たまひよONLINE,「ママの顔を忘れんといてな」 2歳で両目を摘出し、光を失い戸惑う日々。その中で音を楽しみ、運命の出会いが【盲目のドラマー】,https://news.yahoo.co.jp/articles/db9f642ac5393b2b31d689e839266faac2f36c3f,1/15(月) 11:55
tamahiyo,たまひよONLINE,「体外受精（IVF）」または「顕微授精（ICSI）」の流れを知っておこう【専門家監修】,https://news.yahoo.co.jp/articles/b766d2a99a9d22b8b509bb28e7c41025703e4d63,1/15(月) 10:55
tamahiyo,たまひよONLINE,幼稚園の昼食はイタリアンのフルコース!? 友だちや恋人より家族を大事にするのがイタリア流【ファストロ滋子】,https://news.yahoo.co.jp/articles/6d2070582a053281c42dcef45e72a5f53fa1ddfe,1/14(日) 13:55
tamahiyo,たまひよONLINE,44歳で第一子を出産した宮崎宣子、不妊治療は夫が背中を押してくれたのがきっかけ。治療中は終わりの見えないマラソンのようだった,https://news.yahoo.co.jp/articles/a13f9119d17f5256a1028caf0a653a979bbfb5ec,1/14(日) 12:55
tamahiyo,たまひよONLINE,二女七男の9人きょうだいの大家族。赤ちゃんがクルーッと回りながら出てくる瞬間に立ち会える助産院で貴重な体験も,https://news.yahoo.co.jp/articles/259492735d3185df4effe1ef76870c208712d239,1/14(日) 11:55
tamahiyo,たまひよONLINE,「さかご」と言われると帝王切開になるの？診断されてできること【医師監修】,https://news.yahoo.co.jp/articles/6e786188583f60cd644a896a1892e4b78437fcde,1/14(日) 10:55
tamahiyo,たまひよONLINE,俳優の敦士、1歳の娘が目をキラッキラさせて公園遊びに夢中！初体験な遊び方にメロメロに,https://news.yahoo.co.jp/articles/4c1662fedea6821890ce0dc0ab8aa29de681b0db,1/13(土) 13:55
tamahiyo,たまひよONLINE,生後7〜8カ月ごろから始めたい、栄養バランスがとれた離乳食作りのポイント3【管理栄養士監修】,https://news.yahoo.co.jp/articles/3d2752e1413cb04d374d7ea3ddef764c5154daa8,1/13(土) 12:55
tamahiyo,たまひよONLINE,1歳半で黒目がエメラルドグリーンに。「網膜芽細胞腫」と診断された長男、光を奪いたくない…、命を守るために必要なのは両目の摘出だった【全盲のドラマー体験談】,https://news.yahoo.co.jp/articles/289353e1cc5e15b28993f83f508e015983527732,1/13(土) 11:55
tamahiyo,たまひよONLINE,正しいかみ合わせときれいな歯並びは、離乳食から！食べさせ方＆座らせ方のやりがちNG【歯科医師】,https://news.yahoo.co.jp/articles/9c909b6e1ce9cd21ba7db569ea9e2b4e27df83f6,1/13(土) 10:55
tamahiyo,たまひよONLINE,小学生の宿題、非効率でもＯＫ。プロが語る伸びる子の特徴とは,https://news.yahoo.co.jp/articles/1162e68fe381d543de6f8fc04b22f520f9237ff0,1/12(金) 13:55
tamahiyo,たまひよONLINE,ママ×会社員×イラストレーター3足のわらじで日々奮闘していたまぼさんがフリーランスに。会社員を卒業した理由は？,https://news.yahoo.co.jp/articles/d4870a29243e518383890aac5e0b77a54057ef37,1/12(金) 12:55
tamahiyo,たまひよONLINE,生きようとする赤ちゃんとその家族の写真でいっぱい！小さな赤ちゃんが主役になった日【イベントリポート】,https://news.yahoo.co.jp/articles/ffd9ba42c23a24f402911530f06041d5e754f6b1,1/12(金) 11:55
tamahiyo,たまひよONLINE,ベビースキンケア、よかれと思ったものが逆に刺激に!? やりがち「NG行動」3選【皮膚科医】,https://news.yahoo.co.jp/articles/0903c8d7cdb7e256fbb1be7c7010f3555ee1a65d,1/12(金) 10:55
tamahiyo,たまひよONLINE,夕飯・お風呂どっちが先？就寝時間は？子育て家庭の夕方のタイムスケジュール大調査！５人の子をもつ母の神タイムスケジュールも大公開,https://news.yahoo.co.jp/articles/0f1fb31e4fd11c01994cba77c34dfcfa707b94f3,1/11(木) 13:55
tamahiyo,たまひよONLINE,乳幼児のむし歯が減っている一方で、「あごが小さい」子が増える異常事態になっている!?【歯科医が注意喚起】,https://news.yahoo.co.jp/articles/7526c30a4e6166eddb498637f5faba39e8b924a7,1/11(木) 12:55
tamahiyo,たまひよONLINE,おたふくかぜが治った1週間後、「左耳が聞こえづらい」と・・・。まさか娘の片耳が聞こえなくなるなんて【ムンプス難聴体験談・医師監修】,https://news.yahoo.co.jp/articles/5935b9ee56bb31bb787434a32372c1855450c61e,1/11(木) 11:55
tamahiyo,たまひよONLINE,歯ブラシ濡れたまま使ってない？それNGです！意外と知らない歯ブラシの使い方＆選び方【歯科医師】,https://news.yahoo.co.jp/articles/feee2fa8da3de813f1f93762810cbb3291598953,1/11(木) 10:55
tamahiyo,たまひよONLINE,双子を出産したモデル・武智志穂。稽留流産を経験し不安も…。「妊娠が判明したときは喜び7割、不安3割」,https://news.yahoo.co.jp/articles/8a42584b798a6ab7c5de7e86020bca9223ef66f2,1/10(水) 13:55
tamahiyo,たまひよONLINE,「仕事に遅刻した」「帰りに1時間以上かかった…」朝は大泣き!そして、帰りも帰りたがらない登園・降園渋り、どうすれば？,https://news.yahoo.co.jp/articles/51c585ef0b1686c82be092b82605719411a3ff19,1/10(水) 12:55
tamahiyo,たまひよONLINE,二児のママ女優・美馬アンナさん。長男との時間を作るために「ねんねトレーニング」を開始！家族との合言葉は、“上の子ファースト”で。,https://news.yahoo.co.jp/articles/485ea5bbc65b0462440e79bee0a69667d475835b,1/10(水) 11:55
tamahiyo,たまひよONLINE,セリア、ダイソー、キャンドゥおもちゃ「親子で遊べる」「トイレトレーニングにも」おすすめ5選,https://news.yahoo.co.jp/articles/e942275f6f9b73197e0fbf8fd21f8179d556cfaf,1/10(水) 10:55
tamahiyo,たまひよONLINE,発達が気になる子をサポートするために、５歳児健診が大切。不登校予防にもつながる可能性も【セミナーリポート】,https://news.yahoo.co.jp/articles/1a910bce5feb470ddde632cf9ccc304b44776849,1/9(火) 13:55
tamahiyo,たまひよONLINE,産後ケア事業ってどんな制度か知っていますか？【小児科医】,https://news.yahoo.co.jp/articles/4a12ecdb74a1f5fdf7e90a0052a3884d5f87771a,1/9(火) 12:55
tamahiyo,たまひよONLINE,専門医が出会った、英語が得意なダウン症の女の子。障害がある子どもの将来に不安がない社会に！【小児科医】,https://news.yahoo.co.jp/articles/a4c8365b0431d29276ec91bb4298f922bcdb3227,1/9(火) 11:55
tamahiyo,たまひよONLINE,健康診断の結果は、尿酸値に注目して！年末年始・新年会シーズン、お酒を飲む機会が増えた人は要注意,https://news.yahoo.co.jp/articles/7ff22d32604b3d7d549ecb28648d31b08a7efba9,1/9(火) 10:55
tamahiyo,たまひよONLINE,赤ちゃんの歯磨きイヤイヤは、磨き方＆歯ブラシ選びに原因があった！【小児歯科医が回答】,https://news.yahoo.co.jp/articles/f0c047e5e123fec7a92c13ade610c521528d06e8,1/8(月) 13:55
tamahiyo,たまひよONLINE,「胎動を感じやすいのはどんなとき？」「パパが触ると胎動が止まる…？」胎動の疑問を産婦人科医が回答,https://news.yahoo.co.jp/articles/7bc7fddc4546b6d1bf6e25226ea55b703019b87d,1/8(月) 12:55
tamahiyo,たまひよONLINE,インスタでも大人気！ ”3才差兄×妹”きょうだいを育児中のまぼさんに聞いた「2人目育児のウラ話」,https://news.yahoo.co.jp/articles/536e10346a2201a198769ebd2dca41ea2042e416,1/8(月) 11:55
tamahiyo,たまひよONLINE,不妊の治療を解説「治療の前の卵巣刺激」・「じつは自然に近い人工授精」ってなにをする？【専門家監修】,https://news.yahoo.co.jp/articles/22396922b2e1c800d8611c24dd4f981795641e27,1/8(月) 10:55
tamahiyo,たまひよONLINE,心に染みすぎて泣けてくる…。「今のうちに寝とけ！」「いい加減は良い加減」妊娠＆育児中のママへ【専門家に聞く】,https://news.yahoo.co.jp/articles/a35e53bb4c098ff7f0278bd06122d461ba70100f,1/7(日) 13:55
tamahiyo,たまひよONLINE,SNSの総フォロワー約270万人! 簡単レシピが大人気の料理家まるみキッチン、素顔は３歳・９カ月の双子の３人娘のパパだった！,https://news.yahoo.co.jp/articles/cd01b29f0ef6917eb577c6fbae2b899b5d48a028,1/7(日) 12:55
tamahiyo,たまひよONLINE,「僕にしかできないことを仕事にしたい」 筋緊張が続く重度脳性まひの長男と母の挑戦は続く【体験談】,https://news.yahoo.co.jp/articles/5debd7a0411fe10536d7b62d4b8b4dc967bb1314,1/7(日) 11:55
tamahiyo,たまひよONLINE,実はこんなにあった！食品×薬のNGな飲み合わせ。健康食品やサプリも要注意【薬剤師】,https://news.yahoo.co.jp/articles/3b77b03383f7c5a8091d7594b52b7d6ec04eae07,1/7(日) 10:55
tamahiyo,たまひよONLINE,長男の病気をきっかけにNICUでのピアノコンサートを開催。病気や障害のある子と家族の心に音楽を届けたい【ピアニスト斎藤守也】,https://news.yahoo.co.jp/articles/c9405f6eff6bf0663229545ae35d6ee389d199d2,1/6(土) 13:55
tamahiyo,たまひよONLINE,基本を解説！男女で違う不妊治療の検査って？【専門家監修】,https://news.yahoo.co.jp/articles/aff1971a91b84d2781a01b675d8050168dc4038b,1/6(土) 12:55
tamahiyo,たまひよONLINE,重度脳性まひの息子、ママ友からしかられ、涙がぽろぽろと。息子を「かわいそう」と思う気持ちを手放した日【体験談】,https://news.yahoo.co.jp/articles/0a1f3e84cd4060c78e140d696be1bbffb10089ea,1/6(土) 11:55
tamahiyo,たまひよONLINE,セリアの木製おもちゃ「新商品でた」「思わずまとめ買い」おすすめ5選,https://news.yahoo.co.jp/articles/34f142abec8fbc30d13e34d612352a8afafcc768,1/6(土) 10:55
tamahiyo,たまひよONLINE,3人のパパ料理家・まるみキッチン、わがままボディ打破のためにダイエットを始めたら・・・「だれでも作れる」簡単レシピが誕生,https://news.yahoo.co.jp/articles/623d1e3c6a6314aa041f2e60a1fd048bc483f2e2,1/5(金) 13:55
tamahiyo,たまひよONLINE,日本初！257人の幼児の腸内細菌の調査でわかった脳との関係。腸内細菌の種類が子どもの感情のコントロールに影響か【研究報告】,https://news.yahoo.co.jp/articles/aa15c1d602132c7800bad19226cc317fb8695ac9,1/5(金) 12:55
tamahiyo,たまひよONLINE,女優・美馬アンナ、二児のママに。先天性欠損症で生まれつき右手のない息子にようやく妹ができた！,https://news.yahoo.co.jp/articles/80d2efc578296cbed87c41096d53cf856f610aaf,1/5(金) 11:55
tamahiyo,たまひよONLINE,赤ちゃんのつめ切り、いつ切る？どう切る？コツ＆やりがちNG2選【保健師が解説】,https://news.yahoo.co.jp/articles/bfbb1590359701a193061af7095de1f44f950175,1/5(金) 10:55
tamahiyo,たまひよONLINE,絵本を制作する小児科医。長期入院で病気と闘っている子どもたちのために、夢がある物語を【小児科医】,https://news.yahoo.co.jp/articles/cfafbf0e8f518766afab3ac0a3c4a80e31bab9e4,1/4(木) 13:55
tamahiyo,たまひよONLINE,臨月の妊婦さんは注意！家事、お出かけ、トイレ…“してはいけないこと”Q＆A【専門家】,https://news.yahoo.co.jp/articles/aedba18958ee6afafc8a44ab3d16939c7719285d,1/4(木) 12:55
tamahiyo,たまひよONLINE,第２子出産を報告した元乃木坂46衛藤美彩。夫・源田選手の言葉で、早くも箱入り娘決定か？！,https://news.yahoo.co.jp/articles/d99e50448e624815015ddb01e11b8d1aacead3f8,1/4(木) 11:55
tamahiyo,たまひよONLINE,なぜ妊娠しない？その原因を探る不妊治療の基本3ステップを解説【専門家監修】,https://news.yahoo.co.jp/articles/9ebd7860ee39f9c390a6e63dc0323aa37ec702dc,1/4(木) 10:55
tamahiyo,たまひよONLINE,アラフォーお悩みTOP３【疲れ】【痩せない】【シミ・シワ】とどう向き合う？,https://news.yahoo.co.jp/articles/c218291716ab78e3be96573117502cafc397c7fa,1/3(水) 13:55
tamahiyo,たまひよONLINE,いくらかけておくと安心？夫婦で考えたい、生命保険・医療保険のこと【専門家】,https://news.yahoo.co.jp/articles/b7aca3cd6b8e4b3aaa24231bc186f06309e68501,1/3(水) 12:55
tamahiyo,たまひよONLINE,父はジブリの鈴木P、鈴木麻実子、性を隠さないのは父譲り。息子の友だちを集めて、性教育をしたことも,https://news.yahoo.co.jp/articles/5c6dd9aa2e1616b04b59406675c5e322b2852388,1/3(水) 11:55
tamahiyo,たまひよONLINE,何かと気を遣うことが多い「子連れ外食」。みんなが気を付けているマイルールは？,https://news.yahoo.co.jp/articles/c386f80117f0c4c0b6b0a3f85eb9740af4204d7a,1/3(水) 10:55
tamahiyo,たまひよONLINE,「おむつの処理」「授乳中に部屋に入ってくる」「お風呂熱すぎる」などなど。義実家で地味〜に困ることあるある,https://news.yahoo.co.jp/articles/2d32148b0848b9a85b553886d168b5d49e03bc2a,1/2(火) 13:55
tamahiyo,たまひよONLINE,抱っこ、寝かしつけ、入浴、外遊びの時の子どもの「パパはイヤ！ママがいい！」にどう対処する？,https://news.yahoo.co.jp/articles/fc874f70e39fc87b638b521bf47e98e1b2999f08,1/2(火) 12:55
tamahiyo,たまひよONLINE,元チェキッ娘で第３子妊娠中の女優藤岡麻美、２人の息子たちは3カ国語で生活。台湾は息苦しかった私の心を解いてくれた,https://news.yahoo.co.jp/articles/5ad43fa8a24f7336036762438cb3dc8577111544,1/2(火) 11:55
tamahiyo,たまひよONLINE,冷え性改善のカギは血流にあり！血流を改善してからだを温める栄養素を管理栄養士が解説,https://news.yahoo.co.jp/articles/6bc4bd80c074e37542334b221312c7ca0247f71b,1/2(火) 10:55
