media_en,title_articles,link_articles,date_original
diamondf,変動金利の上昇に備えよう！ 住宅ローン変動金利の新常識(下),https://news.yahoo.co.jp/articles/94671140725b45c180239fcc6296b511c26e737f,9/25(月) 15:12
diamondf,埼玉県のマンション値上がり率2位は「ザパームス浦和岸町」、1位はどの物件？【中古マンションランキング】,https://news.yahoo.co.jp/articles/bb2a79cddaf5737007318cdb6588ff9e2673f07f,9/19(火) 11:12
diamondf,千葉県のマンション値上がり率2位は「サングランデ公津の杜グレイス」、1位はどの物件？【中古マンションランキング】,https://news.yahoo.co.jp/articles/b0fdb13ba57af4c76ad5ea4ea655c9fc3686c802,9/18(月) 11:12
diamondf,神奈川県のマンション値上がり率2位は「ルミエラガーデンズ」、1位はどの物件？【中古マンションランキング】,https://news.yahoo.co.jp/articles/f62299ca6cc33ffc89db59f5f286bb2a2e951e54,9/17(日) 11:12
diamondf,東京都のマンション値上がり率2位は「Wコンフォートタワーズ」、1位はどの物件？【中古マンションランキング】,https://news.yahoo.co.jp/articles/47245855b839451ceac83a4acf3aada953e6beee,9/16(土) 11:12
diamondf,葛飾区の洪水ハザードマップから水害の危険性を読み解く！　水害の歴史や川辺の住環境も紹介,https://news.yahoo.co.jp/articles/c277aad4a0d3323836d45da52e5152d6e5a50e32,9/16(土) 11:12
diamondf,晴海フラッグが大きく影響？注目物件や在庫状況など最新市況を不動産アナリストが解説【2023年9月版】,https://news.yahoo.co.jp/articles/879fe04be4eb4156dba47b3e1543a7a6f49f3975,9/13(水) 11:16
diamondf,「HARUMI FLAG SKY DUO（晴海フラッグ ）」第1期2次の販売が9月にスタート！予定価格も公開中,https://news.yahoo.co.jp/articles/5f18db59d04a90a12f5cff2abe734e9c2696e731,9/12(火) 17:02
diamondf,マンション購入後1年で転勤になった場合、 売却か賃貸どちらのメリットが大きいかをシミュレーション！,https://news.yahoo.co.jp/articles/1ac6fceb66d17525d2224864ddf7e6fee0c2606f,9/10(日) 11:12
diamondf,住宅ローンの未払利息が発生した時、銀行はどうした？　現役銀行員が過去の金利上昇時の対応を解説,https://news.yahoo.co.jp/articles/fbecc0fab103e82f624145d55f46fb4084f162dc,9/6(水) 8:01
diamondf,2023年9月の住宅ローン金利（132銀行・1000商品）をランキングで比較！変動金利、10年固定、全期間固定の金利動向は?,https://news.yahoo.co.jp/articles/ac4d50404b88d08468e3fb04c24eef46f1ec57aa,9/2(土) 10:48
diamondf,注目は杉並区？ 高倍率となった超人気マンションはどこ？ 最新の新築マンション相場、価格、売れ行きを櫻井幸雄氏が解説,https://news.yahoo.co.jp/articles/0eda339a34870dc14c942c8041852788618c3fce,9/1(金) 11:12
diamondf,変動金利のリスクを知っていますか？　住宅ローン変動金利の新常識(上),https://news.yahoo.co.jp/articles/2e495639c2e484d3b578cbff096183c7cdc72f8f,8/30(水) 18:02
diamondf,50代で住宅ローンを借りても大丈夫？ 住宅ローンを借りる際のポイントや注意点を銀行員が解説,https://news.yahoo.co.jp/articles/348c7c78a061ba5fb3c8642c5407636110882033,8/29(火) 17:02
diamondf,植田・日銀の政策修正で住宅ローンはどうなる？　早ければ2024年の利上げで変動金利上昇も！,https://news.yahoo.co.jp/articles/23ac160795f953c65a4471d3a2a52ec1b6477c1d,8/29(火) 8:12
diamondf,リノベーション成功のカギは、徹底的な情報収集と、理想の住まいを具体化すること！,https://news.yahoo.co.jp/articles/e45bf6f8eebb160bcca2bac686c1be43375d9cd5,8/23(水) 10:12
diamondf,リノベ時の引越し、モノの処分はどうしたらいい？,https://news.yahoo.co.jp/articles/bc1ca8b78e36bc8b5ce3b4b7998a4f1e25e05546,8/23(水) 10:12
diamondf,リノベ費用と、見積書を素人が読み解くためのポイントを紹介！,https://news.yahoo.co.jp/articles/84fba4fc76887ebdd433413df2f9e04e26bcf3c8,8/22(火) 10:12
diamondf,リノベの「現地調査」では何をするの？ 最終的な業者選びのポイントも解説,https://news.yahoo.co.jp/articles/1fda4fb4502da5358281ace2d7553d503a51ee10,8/22(火) 10:12
diamondf,リノベ会社の探し方と、個別相談では何を聞いたらいいの？,https://news.yahoo.co.jp/articles/cb916d80fd843b8f68271cf5d2fbc37eca5d8e0c,8/21(月) 10:12
diamondf,「リノベのご予算は？」と聞かれたら、何と答えるべき？,https://news.yahoo.co.jp/articles/0161a44331103a71a18a396c0ff5562b704a0e40,8/20(日) 10:12
diamondf,リノベは客と業者の共同プロジェクト！ 問題が起こって当たり前だと知っておこう,https://news.yahoo.co.jp/articles/0d40aa888bd750d059c4aad453f0f335b611e0b9,8/20(日) 10:12
diamondf,【不動産売却の失敗例】「高い査定額の会社を選ぶ」「多数の会社に依頼する」など、3つのケースを紹介！,https://news.yahoo.co.jp/articles/a96ab014840c26bbe690f2491cbe4a8f7c325604,8/16(水) 11:12
diamondf,2025年から新築住宅は省エネ基準適合が必須に！　住宅ローン減税も省エネ住宅でないと利用不可になる,https://news.yahoo.co.jp/articles/7836f5024a21b69373fa39a49da138183f9bd168,8/15(火) 11:12
diamondf,中古マンション価格が割安で、将来性が期待できる首都圏エリアトップ3は「柏市」「さいたま市桜区」、1位はどこ!?,https://news.yahoo.co.jp/articles/fe0b4546176a95fff24046682fdd3a202b9992b3,8/13(日) 11:12
diamondf,価格が高騰する都心マンションの需要を支えるものは？最新市況を不動産アナリストが解説！【2023年8月版】,https://news.yahoo.co.jp/articles/32254127f854756f1e94131fb58669fd927499b7,8/9(水) 11:12
diamondf,分譲マンション営業担当の本音とは？ 失敗しないマンション購入のために、営業に聞いておくべき5つの質問,https://news.yahoo.co.jp/articles/dae21a9c606a7447484d119e03b4c989a3dcb40f,8/7(月) 9:12
diamondf,注文住宅は、ダメ営業を見抜けるかどうかが成功のカギ！ 優秀かどうかがわかる5つの質問とは,https://news.yahoo.co.jp/articles/4943ee13f53fa763c2903b7859c6eeaba3097115,8/6(日) 9:12
diamondf,住み替える際に今の家を売却するか、賃貸に出すべきかの判断ポイント5ステップ！,https://news.yahoo.co.jp/articles/344353ef126b6cb95987ede13d853ad72d8e26ac,7/30(日) 11:12
diamondf,話題の「晴海フラッグ」、なぜこんなに盛り上がっているのか？　転売ヤーからでも買うべきか？,https://news.yahoo.co.jp/articles/17e4f966aaf6e2d02207c9555cfde884bfaa614c,7/30(日) 11:01
diamondf,中古マンションで割安感を求めるなら築20年超えの築古物件だが、デメリットもあるので要注意！,https://news.yahoo.co.jp/articles/d982dfe653b12095b3adf2e7a2ba54b34a5b6ff9,7/28(金) 11:12
diamondf,みずほFGの住宅ローン戦略転換で、今後の住宅ローン金利はどうなるのか？,https://news.yahoo.co.jp/articles/a7db10cde0c05294783948cb64de6ece261b9948,7/27(木) 17:12
diamondf,「すまいValue」でマンションを一括査定した結果、大手3社で1000万円も差があった！ 査定方法は妥当なのかを徹底検証,https://news.yahoo.co.jp/articles/973ab26b70b2e4e07e61dc0e9618466ad286b4ab,7/27(木) 11:12
diamondf,晴海フラッグの転売住戸を買ってもいい？ 住宅ローンが通らない可能性があるなど、注意点を要チェック！,https://news.yahoo.co.jp/articles/d19564307c550a963c94e84428bc45473ffb9e83,7/22(土) 11:12
diamondf,豪雨・台風の季節がやってきた！ 災害に便乗した悪質リフォーム商法に注意,https://news.yahoo.co.jp/articles/52e14b49bc940117a6a54e687c176e3b8afd557d,7/22(土) 9:12
diamondf,住宅ローンを借りやすい職業ランキング！  住宅ローン審査で注目のスコアリング審査を銀行員が解説,https://news.yahoo.co.jp/articles/d1fbeb5d2402c3049ca6411d8467ba8285689ea4,7/16(日) 16:02
diamondf,【不動産売却の成功事例】地元の不動産会社が、大手よりも早く売却できたのはなぜなのか？,https://news.yahoo.co.jp/articles/9007fbb29682405c6afaf7163c9f5d91e8b9e14f,7/15(土) 11:12
diamondf,首都圏で5000万円前後の物件はまだ十分にある！ 注目物件や在庫状況など最新市況を不動産アナリストが解説【2023年7月版】,https://news.yahoo.co.jp/articles/77cd6165c771a544395561bdac4286c5dbc16fc8,7/12(水) 16:16
diamondf,「ブランズタワー大阪本町」の価格や特徴を分析！ 近隣物件と比べるとやや高いものの、将来性を考えるとお得な理由,https://news.yahoo.co.jp/articles/bdcc3321c0732f6243e9df7e6e3456d33d95c72f,7/9(日) 11:02
diamondf,不動産価格上昇の可能性が高いエリアは？　江東区の枝川エリアがイチオシの理由も解説,https://news.yahoo.co.jp/articles/db4dba9bf921dc9fda22178d1ce8670e6c181548,7/8(土) 11:01
diamondf,フリーターが家を買う方法は？　住宅ローンの審査に通るために知っておきたいこと,https://news.yahoo.co.jp/articles/6f7e056f9a1ad18283f29f4010af2f0fa12d322b,7/7(金) 11:02
diamondf,不動産購入時に、営業担当のやる気をそぐ”NG行為”とは？,https://news.yahoo.co.jp/articles/261905db0468df817118a40bcb7e697fe8de95dd,7/6(木) 11:01
diamondf,2023年7月の住宅ローン金利（132銀行・1000商品）を実質金利ランキングで比較,https://news.yahoo.co.jp/articles/3808b807e27b74523d2b0054339b2aa959c526ec,7/4(火) 10:12
diamondf,「パークタワー西新宿」の価格や間取り、特徴を分析！ 資産性を考えると魅力的な価格帯…その理由は？,https://news.yahoo.co.jp/articles/5ad6207add6a5301de1bebb1e1ef7e384d0dba8c,7/3(月) 11:02
diamondf,不動産投資や高級車などの資産形成ローンを、銀行が積極セールスする理由を銀行員が解説,https://news.yahoo.co.jp/articles/be0f4af6027a232d92d4ce670056a5a28da59276,7/3(月) 11:02
diamondf,日本で発生している火災の10分の1は放火とその疑い！ 狙われやすい空き家はどのように対処するべき？,https://news.yahoo.co.jp/articles/4adcac95312d6e169b3d5851177f2b8e63eb4d5b,7/1(土) 16:02
diamondf,「湾岸2024年問題」で中古マンション価格は下落する？ 損をしない購入・売却のタイミングはいつ!?,https://news.yahoo.co.jp/articles/5a0e069790d01c20695227d7b41e642368e5c52a,7/1(土) 11:12
diamondf,資産価値の高いブランドマンションランキング3位は「ブリリア」、2位は「シティテラス」！ 1位はどこ？,https://news.yahoo.co.jp/articles/2c662322168c87286b34b1ee2ca20e54513db217,7/1(土) 11:12
diamondf,住宅ローンにがん団信は付けるべきか？　団体信用生命保険の基本を銀行員が解説,https://news.yahoo.co.jp/articles/fa7d5283b30447c7c97d05c853ea98480438942b,6/30(金) 12:12
diamondf,相続した実家の空き家など、不要な不動産を売却する際の注意点やおすすめの方法を解説！,https://news.yahoo.co.jp/articles/357da4da892237cd61fc757dc9d8436c39ef68db,6/30(金) 11:12
diamondf,「晴海フラッグ」タワー棟は買い？　人気マンションブロガーたちがコスパ最強マンションについて語る！,https://news.yahoo.co.jp/articles/e02be3b3d95f3d13025da2e905e97ce1742d533b,6/30(金) 11:01
diamondf,アラフィフ（50歳前後）からの住宅ローンは、なぜ80歳まで借りるべきなのか？,https://news.yahoo.co.jp/articles/07036a0896e9fc9a26c04ee8eb2d57d1815b0f50,6/30(金) 10:01
diamondf,"【マンション購入体験談】中古にはない新築マンションの魅力＜町屋駅 3LDK 5,680万円＞",https://news.yahoo.co.jp/articles/851985b39dec3a8e08ea53f4e9372a48962e539b,6/29(木) 11:02
diamondf,古民家や土管の庭も!? 新築マンションの共用施設は、工夫を凝らしたユニークなものが登場している,https://news.yahoo.co.jp/articles/6822ea0d0416e5ebbca591ee834fdaa208706aef,6/17(土) 11:12
diamondf,名古屋の大型マンション「プレミスト藤が丘」の価格や特徴を分析！　4000万円台の住戸が中心で名古屋市内では割安感が強い？,https://news.yahoo.co.jp/articles/bf17c5225da52dcaf6234bff12e2e0fad59f35e9,6/14(水) 16:01
diamondf,2023年は「超高層マンション」が選びやすい年？ 注目物件や在庫状況など最新市況を不動産アナリストが解説！【2023年6月版】,https://news.yahoo.co.jp/articles/3523bd761a3b0c1cc494b1ccd239235509a64c66,6/13(火) 11:02
diamondf,外国人は日本の不動産を購入できる？日本の不動産を購入する時に必要な情報・条件とは,https://news.yahoo.co.jp/articles/5372b3b757e4dd3fd0b5ca084b92c9e8bd3cb892,6/9(金) 13:01
diamondf,こんなハズじゃなかった…！　マンション購入後、住んでみて分かった後悔エピソード3選,https://news.yahoo.co.jp/articles/ee50c03d9d027ab309b2e8ff4392079aaefb3f40,6/9(金) 11:02
diamondf,「アトラスタワー五反田」のメリット・デメリットは？　2LDKが1億円超えでも6割が成約済み！部屋別の価格も公開,https://news.yahoo.co.jp/articles/83254be45c093a094312c1b6099a364efd374f22,6/4(日) 11:01
diamondf,銀行員はフラット35をどう見ている？「大事な商品だが、注文されなければイチオシの後ろにこっそり置いておきたい」が本音,https://news.yahoo.co.jp/articles/ee4e8d91c193a878c89a94e07d6ff7f7e7ac01d8,6/2(金) 19:01
diamondf,2023年6月の住宅ローン金利（132銀行・1000商品）を実質金利ランキングで比較,https://news.yahoo.co.jp/articles/193c76349018c917d5bcdaad008d1f20eb19084d,6/2(金) 11:12
diamondf,相鉄・東急直通線の開業で中古マンション価格は2倍以上値上がり！  将来の資産価値上昇は、新駅・新線の開業エリアが狙い目,https://news.yahoo.co.jp/articles/889c61121a3acd1b42f5b1ad34635e870e429f34,6/2(金) 11:12
diamondf,銀行が破綻したら住宅ローンはどうなる？ 「万が一」のために知っておきたいことを銀行員が解説,https://news.yahoo.co.jp/articles/6573d7f309703fae0bf8720119a57ebc2882d9c8,5/29(月) 11:02
