media_en,media_jp,title_articles,link_articles,date_original
dime,＠ＤＩＭＥ,20代の男女1000人に聞いた恋愛に対して積極的になれない理由,https://news.yahoo.co.jp/articles/4b78b394673191c9f47859004db8148d2af5f548,1/8(月) 21:11
dime,＠ＤＩＭＥ,物価の上昇に伴って始めた対策TOP3、3位投資、2位貯金、1位は？,https://news.yahoo.co.jp/articles/24b487b23ead640d6befe41af11888908142da8a,1/8(月) 20:40
dime,＠ＤＩＭＥ,【宇賀なつみの素顔のままで】証明写真,https://news.yahoo.co.jp/articles/d3212179dee5421a07c2d94dc83cb780ce5e83d6,1/8(月) 20:12
dime,＠ＤＩＭＥ,みそきん、駄菓子コラボ、カップ麺マンガ…2023年のインスタント麺トレンドを専門家が総括！,https://news.yahoo.co.jp/articles/222b8aa05fcbe3a170a1d9f011a310007fda1673,1/8(月) 17:10
dime,＠ＤＩＭＥ,降格して給与を減額された会社員、辞めた後に会社を訴えたら896万円も返ってきた理由,https://news.yahoo.co.jp/articles/812960f930cb26427996bb2a37ac7d89c8281c52,1/7(日) 22:20
dime,＠ＤＩＭＥ,NTT法を巡る議論の中でNTTは通信インフラを支える責任と説明を果たしているのか？,https://news.yahoo.co.jp/articles/1486a78970e5bb05465de84b43b83da1f9f32ac7,1/7(日) 21:40
dime,＠ＤＩＭＥ,LINEヤフーはGAFAMを倒すビッグテックになり得るか？,https://news.yahoo.co.jp/articles/8646103f8efe10bf4fdeb722030c40a0833cac83,1/7(日) 21:30
dime,＠ＤＩＭＥ,刺身に潜むアニサキスをパルスパワーで撲滅！熊本大学が開発した驚きの新アニサキス撃退技術,https://news.yahoo.co.jp/articles/cba21f2a48309712833ce2231f4e5b14deab19bd,1/7(日) 21:11
dime,＠ＤＩＭＥ,「白酒ラテ」「松馳感」「新スタイル七輪」日本人が知らない上海の最新トレンド,https://news.yahoo.co.jp/articles/37b1b8c12cd9b3b33e2236be26cb6608bd4e6220,1/7(日) 20:37
dime,＠ＤＩＭＥ,男性1000人に聞いた女性を見る時に意識してしまうポイント、3位髪、2位目、1位は？,https://news.yahoo.co.jp/articles/7a841ec5dc19e7865cbd6fe137d4f95e9752120b,1/6(土) 22:10
dime,＠ＤＩＭＥ,メルセデス・ベンツからアグレッシブなスポーツワゴン「AMG C63 S E PERFORMANCE ステーションワゴン」が登場,https://news.yahoo.co.jp/articles/0943c83ec0dd3b20465a958328c0991c092c451c,1/6(土) 21:50
dime,＠ＤＩＭＥ,職種別の平均年収ランキング、3位弁護士/825万円…1位は医師でいくら？平均年収が高い業種は？,https://news.yahoo.co.jp/articles/063d6e9b14c96654dc743d244090069bbce576ea,1/6(土) 21:40
dime,＠ＤＩＭＥ,「串刺しスイーツ」「モクテカン」「薬菓スイーツ」日本人が知らない韓国の最新トレンド,https://news.yahoo.co.jp/articles/711abcbda1e348b02523e95697d3578ac7ffc91a,1/6(土) 20:21
dime,＠ＤＩＭＥ,コロナで破産した人気イタリアンのシェフが地域のために食堂で海鮮丼を作ることを決意した物語,https://news.yahoo.co.jp/articles/86472361dd6e9e8569bdf2c275652529113ab5af,1/6(土) 20:11
dime,＠ＤＩＭＥ,不倫の当事者でも慰謝料がもらえる？37歳の独身女性が不倫相手から120万円を請求できた理由,https://news.yahoo.co.jp/articles/8c8dddafed0af959a96b2d45a35baa9ee3eb647f,1/5(金) 21:40
dime,＠ＤＩＭＥ,フィアット「ドブロ マキシ」vs日産「セレナ e-POWER」スタイルで選ぶ最新ミニバン対決,https://news.yahoo.co.jp/articles/9b48f9109180aedd2834cf657bd446f274acab4b,1/5(金) 20:40
dime,＠ＤＩＭＥ,花のお江戸で蒸されて、飲んで、心の中が一人祭り状態になる「浅草ROX まつり湯」の遊び方,https://news.yahoo.co.jp/articles/462c95fec3dd2a2ece743314a76f0042c33e9a9f,1/5(金) 7:30
dime,＠ＤＩＭＥ,飲酒頻度とストレス度合いはどう関係する？飲酒習慣がない人のストレス度合いは？,https://news.yahoo.co.jp/articles/afea6a35116dd1c6a204a2851c64e1d3bc49c831,1/4(木) 21:40
dime,＠ＤＩＭＥ,フリーランスのインボイス制度への対応状況は「なにもしていない」がまだ7割,https://news.yahoo.co.jp/articles/accd200a7e344bb1d9ba4050a3a301a2cf8d2deb,1/4(木) 20:40
dime,＠ＤＩＭＥ,時速110km/hの電動キックボードも登場、現実に対応しきれない道路交通法の行方,https://news.yahoo.co.jp/articles/ff4db7921aaa0b12e0b87e6aaa4c5a21a4d42324,1/4(木) 8:40
dime,＠ＤＩＭＥ,ある日突然社長が離職票を叩きつけてきた！いきなりの解雇宣言に対して訴訟を起こした結果…,https://news.yahoo.co.jp/articles/4507c2b06051f18df0c65216b9df0c65f7dcf672,1/3(水) 20:40
dime,＠ＤＩＭＥ,限定8台！アウディがスポーツクーペ「R8」の最終モデルCoup Japan final editionを発売,https://news.yahoo.co.jp/articles/693a97edbf9da62bdbd574fe797a020d1a49b998,1/3(水) 8:40
dime,＠ＤＩＭＥ,毎朝5分でOK！運動習慣が定着する心拍数連動エクササイズ「Smart 5min」の革新性,https://news.yahoo.co.jp/articles/093baa81030d20d292f0a23d49c26c92adfa9dba,1/3(水) 7:40
dime,＠ＤＩＭＥ,産後育休中に「新生児のおしりケアアイテム」を開発したパパの奮闘劇…累計23万本の大ヒット！,https://news.yahoo.co.jp/articles/87308853205d51d268d0390e1c26dccf5381487d,1/2(火) 21:40
dime,＠ＤＩＭＥ,ここまで進化した！厚さ2mmの便利すぎるカード型ボイスレコーダー「SLIMCA」,https://news.yahoo.co.jp/articles/6653efd3f410226ad2682f6afed0337ff5800f42,1/2(火) 21:10
