media_en,media_jp,title_articles,link_articles,date_original
ibciwatev,IBC岩手放送,アパートの部屋に荒らされた形跡なし　岩手・滝沢市の強盗殺人事件　容疑者は被害者宅に頻繁に出入り、寝泊まりも?,https://news.yahoo.co.jp/articles/6206b4985eac6035d8c8651bc0eba00487ef3f6e,11/11(土) 12:06
ibciwatev,IBC岩手放送,最高ランクは1箱「100万円」で落札　江刺りんご「サンふじ」の初セリ　岩手・盛岡市,https://news.yahoo.co.jp/articles/5bd5c1d80f43bd58bfe9aa81d9863666a89a4e76,11/11(土) 12:04
ibciwatev,IBC岩手放送,審査のポイントは「ボリューム」「バランス」「肌の美しさ」!　遠野市の産直で〇〇コンテスト　岩手,https://news.yahoo.co.jp/articles/022a0044db0ffd9af8751967722b6f1b58f9b26a,11/10(金) 19:17
ibciwatev,IBC岩手放送,「せんせいロボット」への指示を入力　小学生がプログラミングに触れる　電子部品メーカーが出前授業　盛岡市,https://news.yahoo.co.jp/articles/f3f2a772188758b9a66b33fc825909652f92aa60,11/10(金) 19:12
ibciwatev,IBC岩手放送,山田町と葛巻町の小中学校2施設で学年閉鎖　学級閉鎖も3施設で　今シーズンのインフルエンザによる休業措置5件増え57件　岩手,https://news.yahoo.co.jp/articles/44436f7e40386597e44eb041fc1931d783d981a5,11/10(金) 17:57
ibciwatev,IBC岩手放送,人家周辺での銃器使用基準の明確化や指定管理鳥獣への追加などを国に求める　クマによる人身被害で東北・北海道の知事が緊急要望　岩手・達増知事が内容を説明,https://news.yahoo.co.jp/articles/ebaa393726192b540bc8198aa64b4423edbcabf6,11/10(金) 16:42
ibciwatev,IBC岩手放送,市営住宅の使用料を延べ30世帯から過徴収　5年間で計200万円　複数職員でチェックせず老人扶養親族控除を適用せず算定誤り返還へ　6〜10年前の誤納も申し出あれば還付　盛岡市,https://news.yahoo.co.jp/articles/f91d0d9a103c345e75f017bb462b01414b2bfb35,11/10(金) 16:24
ibciwatev,IBC岩手放送,「宮古トラウトサーモン」　いけすを増やして今年度の養殖事業開始　250トンの出荷を目指す　岩手・宮古市,https://news.yahoo.co.jp/articles/d9eb5b9101fa606eca1c4d7d82e864d9158bbcf5,11/10(金) 16:02
ibciwatev,IBC岩手放送,「経営者の考えを変える必要がある」　脱炭素社会へ若者グループが提言　温暖化防止県民会議会長に報告　岩手,https://news.yahoo.co.jp/articles/5228633fdb3fc778dee559510fe4a9409eaf4ae2,11/10(金) 16:02
ibciwatev,IBC岩手放送,測量作業中に突然…　40代男性がクマに襲われ左手にけが　駆け付けた警察官もクマ目撃　秋田・鹿角市,https://news.yahoo.co.jp/articles/164584774a4f2a3d3165cc1f5a57fe777fa20242,11/10(金) 14:27
ibciwatev,IBC岩手放送,米袋が破られ、梅干しの瓶も割られる　民家の作業小屋にクマ入り込む　岩手・一関市,https://news.yahoo.co.jp/articles/55be8485336486bcff998bb290c31cf5e96c398e,11/10(金) 12:38
ibciwatev,IBC岩手放送,被害者男性はアパートに入居したばかり　強盗殺人容疑で逮捕の男（76）と知り合ったのはその後か　盛岡地検に送検し取り調べ本格化　岩手・滝沢市,https://news.yahoo.co.jp/articles/c46f1c6a99eca802530b5aebcaa9c0b4bd043fe6,11/10(金) 12:12
ibciwatev,IBC岩手放送,灯油1リットル114円に　岩手県生協連　20日から,https://news.yahoo.co.jp/articles/eb505f0695e913a32a8f7edc630c3842cff9ee35,11/10(金) 11:36
ibciwatev,IBC岩手放送,岩手県高野連がセンバツ21世紀枠の候補に水沢工業を推薦の方針を決定,https://news.yahoo.co.jp/articles/b75a64dccfbe6cc00b30c3c93b023b5c608b05ce,11/9(木) 19:01
ibciwatev,IBC岩手放送,宮沢賢治に花巻東高校も　岩手・花巻市のご当地カプセルトイがお披露目,https://news.yahoo.co.jp/articles/dfd87748115c2afac0428f58f840a78a2e9cd30e,11/9(木) 19:01
ibciwatev,IBC岩手放送,赤字路線の維持に向けた起爆剤となるか?岩手と秋田を結ぶ北上線の無料乗車キャンペーン開始で初日からにぎわい,https://news.yahoo.co.jp/articles/784a525d89355df4437415822ad699da13782b5c,11/9(木) 19:01
ibciwatev,IBC岩手放送,もしも事故でゴンドラが止まったら?　オープン前の安比高原スキー場で救助訓練　岩手・八幡平市,https://news.yahoo.co.jp/articles/c71c6bd9c67343f5d620153c5cb02cd39c62347a,11/9(木) 18:42
ibciwatev,IBC岩手放送,園児と職員44人が嘔吐や下痢の症状訴える　宮古保健所管内の教育・保育施設でノロウイルスによる感染性胃腸炎の集団発生　全員回復傾向　岩手県内今年度19件目,https://news.yahoo.co.jp/articles/92c90d4c356fd05d02d52c2298a509f10a6670b1,11/9(木) 17:53
ibciwatev,IBC岩手放送,盛岡市と八幡平市の小学校で学級閉鎖　今シーズンのインフルエンザによる休業措置2件増え52件　岩手,https://news.yahoo.co.jp/articles/deaad92e3d9bec44e450e1a4a173d4d3d6efd16a,11/9(木) 17:26
ibciwatev,IBC岩手放送,高齢男性に暴行加え首絞めて殺害し通帳も奪う　住所不定、無職の76歳の男を逮捕　岩手・滝沢市,https://news.yahoo.co.jp/articles/a409afbbd106c2fc505ed039d856c0fa179553df,11/9(木) 16:06
ibciwatev,IBC岩手放送,本物の牛2頭が学校に登場　牛乳の消費拡大目指し特別教室　岩手・盛岡市,https://news.yahoo.co.jp/articles/91dff95e5964b4502e51a45e2edbe552f4d62886,11/9(木) 16:03
ibciwatev,IBC岩手放送,凍結のリスク増す本格的な冬を前に水道設備のチェックを　岩手・盛岡市の無料点検サービスが始まる,https://news.yahoo.co.jp/articles/3955dde72bf1d50f42a0b7be1e026365a3c894f7,11/9(木) 12:18
ibciwatev,IBC岩手放送,少女にみだらな行為の岩手・花巻市教委職員に罰金80万円の略式命令,https://news.yahoo.co.jp/articles/b56403aefbf669f5e5f7d8184db656e5a7cf3130,11/9(木) 10:16
ibciwatev,IBC岩手放送,クマに小屋の中のコメを荒らされる被害　小屋の所有者の妻が成獣1頭を目撃　岩手・一関市,https://news.yahoo.co.jp/articles/ff83a520d3de1566c42cc2a43600b79c6f21b918,11/9(木) 10:16
ibciwatev,IBC岩手放送,岩手・盛岡市で「初霜」を観測　平年より14日、去年より21日遅く,https://news.yahoo.co.jp/articles/1065705ba9573f793a324d214a5d7c462d1ee59e,11/9(木) 8:39
ibciwatev,IBC岩手放送,生活保護の「障害者加算」認定誤り4年で66世帯へ約2492万円過払い　謝罪して返還求める　介護給付費関係交付金の算定ミスで過大受け取りも発覚　会計検査院の指摘で盛岡市,https://news.yahoo.co.jp/articles/aaec52edfcea57eb14e15f6416de4761579adedf,11/8(水) 21:36
ibciwatev,IBC岩手放送,全国初の「シン・オートコール」とは?　この12年あまりで進んだデジタル技術を防災に活用　“世界津波の日”の避難訓練で実践　岩手・陸前高田市　宮古市ではドローンの災害時利用の動きも【復興への羅針盤】,https://news.yahoo.co.jp/articles/1e417c1003614ab2fb61af2e75cfb21582a4da85,11/8(水) 19:32
ibciwatev,IBC岩手放送,「アフタヌーンティー」イベントへ高校生がメニューを考案　地元食材で“おこめのタルト”も　盛岡市,https://news.yahoo.co.jp/articles/216da7bb0c86bb4cd8bf0a7e911cd591bebd5951,11/8(水) 19:27
ibciwatev,IBC岩手放送,交通安全を呼びかける高校生CMコンテスト　「自転車用ヘルメット」テーマにした盛岡市立高校の作品がグランプリに　岩手,https://news.yahoo.co.jp/articles/820292adc01dfa37a25aa5054e4ab2d6e6c4e00c,11/8(水) 19:27
ibciwatev,IBC岩手放送,災害に備える〜LPガス事業者が「中核充填所」で対応訓練　有事の安定供給へ,https://news.yahoo.co.jp/articles/64b8460f8631dc2320cf9b0046b0d4edb11649e0,11/8(水) 19:24
ibciwatev,IBC岩手放送,軽ワゴンがのり面に乗り上げた後に電柱に衝突　運転の69歳女性が死亡　岩手・久慈市,https://news.yahoo.co.jp/articles/9f7954d92762a3a1a1e1d00addc73d073c9dc550,11/8(水) 19:08
ibciwatev,IBC岩手放送,インフルエンザ休業措置が岩手で今シーズン50件に達する　盛岡市の小学校1校で1〜3年生が学年閉鎖,https://news.yahoo.co.jp/articles/5d6abf1e46ff079ed713fed49b8cfec74499f8f2,11/8(水) 18:04
ibciwatev,IBC岩手放送,岩手県内のインフルエンザの感染拡大続く　患者数の平均は注意報発表の基準が目前,https://news.yahoo.co.jp/articles/69084dd40551a461b4d0732cb6739134f91a5520,11/8(水) 16:56
ibciwatev,IBC岩手放送,東日本大震災の記憶と経験を後世に伝える　岩手・大船渡市でパネル展始まる,https://news.yahoo.co.jp/articles/096c3cb71b0e25eee9a74568a2a3dcb136816be1,11/8(水) 15:57
ibciwatev,IBC岩手放送,倉庫の米袋や梅干し瓶がクマに荒らされる被害　岩手・一関市,https://news.yahoo.co.jp/articles/6d60104ed5f7fd90dfac4781feeed7ebeae2fdef,11/8(水) 15:21
ibciwatev,IBC岩手放送,乗務員不足で路線バス減便　岩手県交通が12月から　滝沢営業所管内,https://news.yahoo.co.jp/articles/8206414695fb59dd39648bbcf5dd0d8f61d99fcd,11/8(水) 12:38
ibciwatev,IBC岩手放送,「もっと飲んで」　苦境の牛乳　消費拡大へPR　盛岡駅で無料配布,https://news.yahoo.co.jp/articles/80d8d1e663297d416f57136643ff23f82c861a4d,11/8(水) 12:04
ibciwatev,IBC岩手放送,イノシシ用のわなを見に行ったところ竹やぶから成獣のクマ　71歳の男性が襲われけが　岩手・八幡平市,https://news.yahoo.co.jp/articles/786f62782df6c7b13fa883ee8f4a88ed26e0f8cc,11/8(水) 11:08
ibciwatev,IBC岩手放送,小屋の屋根補修中に転落か　74歳の男性が死亡　はしごが立てかけられた状態　盛岡市・綱取ダムの東、山間の地区,https://news.yahoo.co.jp/articles/3e42db7b7b46710af8bded60dd91df747bcab1e3,11/7(火) 19:34
ibciwatev,IBC岩手放送,「激闘王」がふるさとの高校生アスリートにエール　ボクシング3階級制覇の八重樫東さんが花巻東高校で講演　岩手,https://news.yahoo.co.jp/articles/e43c54be6437b701cec7e5c54e549072f8ff63e3,11/7(火) 19:22
ibciwatev,IBC岩手放送,「周りの支えにより強い気持ちで裁判に」　強盗殺人事件の被害者遺族が講演　盛岡市で犯罪被害者の支援を考える集会,https://news.yahoo.co.jp/articles/e9b25aae368454de2baf4f229189ada9fec18fdb,11/7(火) 19:19
ibciwatev,IBC岩手放送,「いつ」「どこに」　盛岡市役所新庁舎整備　市民説明会がスタート　100人が出席,https://news.yahoo.co.jp/articles/3b506a6ef3f4b5d9982baa663a82a68b8309cb74,11/7(火) 19:16
ibciwatev,IBC岩手放送,国史跡・達谷窟毘沙門堂（岩手・平泉町）の秋〜岩肌に刻まれた磨崖仏　歴史に思いをはせて〜ドローン撮影【岩手空中散歩】,https://news.yahoo.co.jp/articles/e8a6a0e60eb6464366f952f4e97d0428396dd5ae,11/7(火) 19:16
ibciwatev,IBC岩手放送,矢巾中学校の学校閉鎖含む保育園、小中高校の計8施設でインフル休業措置　岩手で今季49件,https://news.yahoo.co.jp/articles/bee9ede480abbb6089719d6b872a52e4e06d047e,11/7(火) 18:11
ibciwatev,IBC岩手放送,【速報】サンマ水揚げ量は前年比「4割増」　全さんま　10月末までの水揚げデータを発表,https://news.yahoo.co.jp/articles/957a22011d729295a593048e740b1d075a86395c,11/7(火) 16:54
ibciwatev,IBC岩手放送,原付バイクの男性（65）が転倒し重体　軽トラックによるひき逃げの可能性も　岩手・遠野市の国道,https://news.yahoo.co.jp/articles/1024c337c03e6a947e90a5a1b2a8e86843f24f1e,11/7(火) 12:08
ibciwatev,IBC岩手放送,沿岸に一時暴風警報　最大瞬間風速17.5mの大船渡　海は大荒れ　岩手,https://news.yahoo.co.jp/articles/afaee48cf0f1472bcb8a94c5a3f666b50b722183,11/7(火) 12:06
ibciwatev,IBC岩手放送,釣りをしていて海に転落か　76歳男性が死亡　秋田・男鹿市の漁港,https://news.yahoo.co.jp/articles/7214efaeecfd4c3fa42be1845a4b4ec85afdd229,11/7(火) 10:48
ibciwatev,IBC岩手放送,原付バイクと衝突した車が立ち去る　バイク運転の65歳男性は意識不明の重体　ひき逃げ事件として警察が捜査　岩手・遠野市,https://news.yahoo.co.jp/articles/cbd83dc19b6cfc4f00c28e745de5d502b927bad0,11/6(月) 20:14
ibciwatev,IBC岩手放送,「2人で楽になることも考えた…」　妻の首を絞め殺害の86歳男が6月に心中ほのめかす　岩手・二戸市,https://news.yahoo.co.jp/articles/e12b00c5167817cf48fd704f9d9be394cb52fec0,11/6(月) 19:02
ibciwatev,IBC岩手放送,「パラッタ」作りで交流深める　パキスタン人女性招き料理教室　中学生が国際理解深める　岩手・花巻市,https://news.yahoo.co.jp/articles/6909792d8cc93099366833c42bf595f5e489e058,11/6(月) 19:02
ibciwatev,IBC岩手放送,「一発殴ったことは間違いないが…」　集団傷害事件の被告が起訴内容否認　岩手・奥州市の建設会社で去年発生の事件,https://news.yahoo.co.jp/articles/efa537b19b8c833864e3626248c68db027c5a607,11/6(月) 19:02
ibciwatev,IBC岩手放送,人手不足に救世主?　新採用の自治体職員が消防団に体験入団　来年9月までさまざまな活動　岩手・盛岡市,https://news.yahoo.co.jp/articles/cac00a583966fc22c714805312ab5ec9bd8a97b9,11/6(月) 19:02
ibciwatev,IBC岩手放送,クマも好物のドングリ実るコナラが突然枯れ死する病気「ナラ枯れ」　岩手・洋野町で新たに確認　県内被害19市町村に拡大,https://news.yahoo.co.jp/articles/8dd16994c7a86196624b9be3ddd574c8e6df008e,11/6(月) 18:02
ibciwatev,IBC岩手放送,滝沢市と洋野町の小学校で学年閉鎖　今シーズンのインフルエンザによる休業措置3件増え41件　岩手,https://news.yahoo.co.jp/articles/78455418db890306d02303920fca7e6588f71025,11/6(月) 17:02
ibciwatev,IBC岩手放送,携帯電話番号を無断使用　マッチングアプリのアカウントを不正に作成　東京と神奈川の男女2人逮捕,https://news.yahoo.co.jp/articles/dcde78d6722327e851c3aa541215eea925951581,11/6(月) 16:54
ibciwatev,IBC岩手放送,「これは詐欺だな…」　還付金詐欺を防いだ金融機関に感謝状　岩手・盛岡市,https://news.yahoo.co.jp/articles/cd2f57a2854ebb40997ba8ce3abf14343f4540d7,11/6(月) 16:01
ibciwatev,IBC岩手放送,スマホ充電や電化製品への供給も　災害時に電気自動車を自治体に貸し出し　岩手・宮古市と大手メーカーなどが協定,https://news.yahoo.co.jp/articles/1ed3b4f55c3d3cd310ebbe71764477acb614e671,11/6(月) 15:59
ibciwatev,IBC岩手放送,後ろから来たトラックに　自転車で国道通行中の76歳男性はねられ死亡　岩手・雫石町,https://news.yahoo.co.jp/articles/998499e58f78ddab141bc3dd916358c0dd1b4b14,11/6(月) 10:11
ibciwatev,IBC岩手放送,「世界津波の日」に合わせ　津波避難想定し「かまど」として利用できるベンチで炊き出し訓練　岩手・宮古市,https://news.yahoo.co.jp/articles/8526f9b1dff6f34ba97d6e06d601a40500073d50,11/5(日) 18:06
ibciwatev,IBC岩手放送,高校生が郷土芸能で地域を盛り上げ　岩泉高校の生徒が初めて企画　　岩手・岩泉町,https://news.yahoo.co.jp/articles/27a233b849d3e07a28ad9b95ecb981fbd1e2cbce,11/5(日) 18:02
ibciwatev,IBC岩手放送,現職引退で16年ぶりトップ交代へ新人同士の一騎打ち確定　岩手・釜石市長選が告示　選挙戦は20年ぶり　今月12日投開票,https://news.yahoo.co.jp/articles/b07079cfb98ecdf6e3e0243873260a391b292a35,11/5(日) 17:02
ibciwatev,IBC岩手放送,遠野が専大北上を1―0で下し3年ぶりの優勝　高校サッカー岩手県大会決勝,https://news.yahoo.co.jp/articles/ec02f87a42514d7cc3590268363cc7baba518b28,11/5(日) 16:42
ibciwatev,IBC岩手放送,1人でクルミ拾いをしていたらクマに襲われ男性（69）けが　自宅近くの雑木林で　意識あり会話可能　岩手・奥州市,https://news.yahoo.co.jp/articles/6bf6307d4ef1a3be553edf12d9b2d1b028cf15f0,11/5(日) 16:21
ibciwatev,IBC岩手放送,岩手ビッグブルズ　ライジングゼファー福岡にホームで連敗　今季1勝10敗　バスケットボールB2,https://news.yahoo.co.jp/articles/718c69defc97f15dbf328e7a8951c5b7fb129f98,11/5(日) 15:18
ibciwatev,IBC岩手放送,クマに養蜂用の巣箱壊される　山林内でクマの目撃情報を受けた警察が発見　岩手県・陸前高田市,https://news.yahoo.co.jp/articles/acd250425b05a3e9a6aef1cc8d8dbe81639c884a,11/5(日) 11:59
ibciwatev,IBC岩手放送,新人2人が立候補　20年ぶりの選挙戦に　岩手・釜石市長選告示,https://news.yahoo.co.jp/articles/716c66303936f99fe059e2f08190abeda25c2607,11/5(日) 11:01
ibciwatev,IBC岩手放送,自宅敷地のクルミの木伐採中に転落か　76歳男性死亡　木に4mのはしご　盛岡市,https://news.yahoo.co.jp/articles/110cf8caac587a052840342b1e9ea8f6801dd453,11/5(日) 9:42
ibciwatev,IBC岩手放送,慰霊と教訓伝える場として活用　東日本大震災の津波で33人が犠牲の地区に記念碑建立　被災した「鳥居」も活用　岩手・釜石市,https://news.yahoo.co.jp/articles/d775c581f4f5e48e5f46d5c16e3c54fa4354cb5a,11/4(土) 17:26
ibciwatev,IBC岩手放送,グルージャがホームで鳥取と引き分け　サッカーJ3,https://news.yahoo.co.jp/articles/7b5746328a639921caea52bda3ad3e0d0e65cd0f,11/4(土) 17:23
ibciwatev,IBC岩手放送,86歳夫に首を絞められた妻の死因は窒息死　夫は殺人容疑で送検　岩手・二戸市,https://news.yahoo.co.jp/articles/3253752101b0a8b9494673dd40ea2cdeca9e1c5f,11/4(土) 17:12
ibciwatev,IBC岩手放送,JR上米内駅の開業100周年記念式典　地域住民らが節目祝う　盛岡,https://news.yahoo.co.jp/articles/088844661c4569874c7a1893a2a144ee0273e876,11/4(土) 17:09
