media_en,media_jp,title_articles,link_articles,date_original
aab,秋田朝日放送,北秋田市の森吉山阿仁スキー場　９日から冬の営業が始まるのを前に安全祈願祭　秋田,https://news.yahoo.co.jp/articles/b6ce6064a16bbe8ed930a308a00dd8305bb146e8,12/8(金) 19:04
aab,秋田朝日放送,秋田県　物価高騰対策などの事業費用を盛り込んだ約４３億円の補正予算案を議会に追加提案,https://news.yahoo.co.jp/articles/c7c1f3fdf8aac048894ed797563a2c165dc44b34,12/8(金) 19:00
aab,秋田朝日放送,運転席で”寝落ち”　男性巡査長が酒気帯び運転の疑い　８日付で停職６カ月の懲戒処分を受け依願退職　秋田,https://news.yahoo.co.jp/articles/bbe743ceddee5198deae023b1cc64e5f3955eec5,12/8(金) 18:58
aab,秋田朝日放送,秋田・由利本荘市　国道７号で６４歳の女性が軽ワゴン車にはねられ死亡　警察は運転手の男を逮捕,https://news.yahoo.co.jp/articles/0020bb9b42077595f5c50fbc0524b2c747678696,12/8(金) 12:00
aab,秋田朝日放送,酒かすの有効活用で廃棄問題軽減へ　新たなお土産品「酒蔵のブラウニー」誕生　秋田・にかほ市,https://news.yahoo.co.jp/articles/612d5e50741547eec2d58a53368521f1a128d575,12/7(木) 18:50
aab,秋田朝日放送,インフルエンザ　秋田県では患者数が前の週から２２％減　保健所別では大仙に警報・秋田市などに注意報,https://news.yahoo.co.jp/articles/90011640891e655284377bb85ffd845c390dcc5b,12/7(木) 18:48
aab,秋田朝日放送,仙北市出身　直木賞作家の西木正明さん（８３）が５日死去　ふるさと秋田の文化振興にも尽力,https://news.yahoo.co.jp/articles/ef9bf84b7c759a77afbbc548cf0782e01d29d8ab,12/7(木) 17:00
aab,秋田朝日放送,全国大会に出場する秋田の高校生が意気込み語る　バスケ女子の秋田中央は４８年ぶりにウインターカップへ,https://news.yahoo.co.jp/articles/656eee2130b11e3a0dc2866090709bf9b49a18e5,12/7(木) 12:25
aab,秋田朝日放送,将棋の藤井聡太竜王が秋田へ　大仙市での幻の「勝負めし」お披露目　大曲駅では新幹線の出発合図の体験も,https://news.yahoo.co.jp/articles/0d3c8e18a15a6e286268955eb3b222a6cab0591e,12/6(水) 19:16
aab,秋田朝日放送,５日に秋田・鹿角市で住宅が全焼した火事　見つかった２人の遺体は長男（２０）と長女（１２）と判明,https://news.yahoo.co.jp/articles/2d0b9df0b15c30e1ab159dfde3d3379879a2be63,12/6(水) 19:13
aab,秋田朝日放送,季節ハタハタはいつやってくる？　男鹿市では「ハタハタの日」に合わせ豊漁を祈願　秋田,https://news.yahoo.co.jp/articles/e0061603585bbeb8f5a06cd62f86f6f83e14bed5,12/6(水) 18:52
aab,秋田朝日放送,将棋の藤井聡太竜王の防衛を祝う会　竜王戦第６局が予定されていた秋田県大仙市で開催,https://news.yahoo.co.jp/articles/87d422a2d4ac350fc684afb4eba21ec4f1edb89f,12/6(水) 12:05
aab,秋田朝日放送,将棋の藤井聡太竜王が秋田へ　竜王戦の第６局が予定されていた大仙市の旧本郷家住宅を訪問　花火鑑賞も,https://news.yahoo.co.jp/articles/7f233ffe4ebdf28c7ba56cc0c488fc1f6ce48e77,12/5(火) 19:36
aab,秋田朝日放送,２０２４年の秋田県内のコメの「生産の目安」は２０２３年と同程度の４０万１３００トンに,https://news.yahoo.co.jp/articles/5526b5f21302b420d99c2222b5b1d87852fc1eca,12/5(火) 19:30
aab,秋田朝日放送,男性自衛官が同僚の尻などを触りセクハラで停職処分　別の隊員は窃盗をしたとして免職処分に　秋田,https://news.yahoo.co.jp/articles/6faf186dcfa79509fa1ad449accd0d9224332af5,12/5(火) 18:57
aab,秋田朝日放送,同居の兄を殺害した罪に問われている男の裁判　検察側は懲役６年を求刑　秋田,https://news.yahoo.co.jp/articles/562f10c2628d41d013797e73036d4350c7248adc,12/5(火) 18:56
aab,秋田朝日放送,秋田・鹿角市で住宅が全焼する火事　２人の遺体が見つかる　２０代の長男と小学生の長女か,https://news.yahoo.co.jp/articles/0c4281839ec3d285159f7aeaf1df9c3c4d4cf5fd,12/5(火) 11:56
aab,秋田朝日放送,見た目もかわいいキューブパンの専門店が秋田市にオープン　本格派の豚の角煮入りパンも,https://news.yahoo.co.jp/articles/1bd2d8902d1abeb5a878a5ea66b67937f074e4de,12/4(月) 19:32
aab,秋田朝日放送,季節ハタハタの接岸はいつ？　初漁日予測は2日も…地元漁師も待ちわびる　／秋田・八峰町,https://news.yahoo.co.jp/articles/9ee9ba4adf9624b8f51045c9a140e5e983f82be2,12/4(月) 19:32
aab,秋田朝日放送,秋田県　洋上風力発電など成長分野の産業振興に注力　クマ対策も引き続き強化へ,https://news.yahoo.co.jp/articles/f4beda3b52d7449b6d3cb9921959aa21fbe638aa,12/4(月) 19:32
aab,秋田朝日放送,秋田の郷土芸能がつなぐ交流の輪　「わっかフェス」来年も開催　東京の学生が「土崎港ばやし」に挑戦,https://news.yahoo.co.jp/articles/4e87e9b5daecb82cf8a3d9b721fd6f81b84624d0,12/4(月) 17:02
aab,秋田朝日放送,軽乗用車が川に転落　運転していた男性（４０）が死亡　秋田・八峰町の国道１０１号沿い,https://news.yahoo.co.jp/articles/c7225d5101c10c7f52379b3a62c24052fe1a371a,12/4(月) 12:18
aab,秋田朝日放送,昭和５０年代の旧・雄和町の様子を収めた映像の上映会　秋田市雄和の国際教養大学,https://news.yahoo.co.jp/articles/5bb39b6b1e4adb568cf68aedd82b334e054d3981,12/3(日) 18:12
aab,秋田朝日放送,２日の秋田県内は今季一番の冷え込みとなったところも　秋田市では初氷観測,https://news.yahoo.co.jp/articles/8782546d04c218962cc0590027788df702c865e3,12/2(土) 18:20
