ctgry,media_jp,title_pickup,title_articles,link_pickup,link_articles,date_original
local,,10歳車にはねられ意識不明 男逮捕,10歳男児が車にはねられ意識不明の重体　自宅前の道路に飛び出したか　車を運転していた男（21）を現行犯逮捕　名古屋・中村区,https://news.yahoo.co.jp/pickup/6501685,https://news.yahoo.co.jp/articles/f2690272392599e9acd5c2c4d58192aa4b870b8b,5/20(月) 19:23
local,,飼育員がバクにかまれ重傷 群馬,【速報】群馬サファリパークで体長1.8mのバクが飼育員に噛みつく　飼育員は重傷、ドクターヘリで病院に搬送,https://news.yahoo.co.jp/pickup/6501680,https://news.yahoo.co.jp/articles/7603d556ade3e0208af783ed44ef51d6ae5c8d14,5/20(月) 18:45
local,,不当な聴取 提訴した外国籍の母親,「おむつ替えも許されず」外国籍母親と当時3歳の娘が「警察官から不当な任意聴取」訴えた裁判で母親が胸中語る　東京地裁,https://news.yahoo.co.jp/pickup/6501676,https://news.yahoo.co.jp/articles/6b6be82d73c12ce231adf9fd7aef4b9dec89a530,5/20(月) 18:09
local,,那須雪崩 損賠交渉終結の見通し,残る1生徒の遺族と示談へ、栃木　雪崩事故、損賠交渉終結の見通し,https://news.yahoo.co.jp/pickup/6501674,https://news.yahoo.co.jp/articles/9f954de54627a5971c69a8a580c0877d30c24a90,5/20(月) 18:07
local,,民家で94歳死亡 顔腫れ手足にあざ,【速報】東大阪市の民家で94歳女性死亡　顔が腫れ上がり手足に複数のあざ　警察が死亡した経緯を捜査,https://news.yahoo.co.jp/pickup/6501667,https://news.yahoo.co.jp/articles/4970d328776ab852f5679088b311d7e809c8810b,5/20(月) 17:27
local,,熊本で発砲音か 現場で男を逮捕,【速報】発砲音聞こえたアパートで警察官にハサミ突きつけた男を公務執行妨害で現行犯逮捕　高校目の前で　熊本市　,https://news.yahoo.co.jp/pickup/6501666,,5/20(月) 17:22
local,,熊本で発砲音と通報 立てこもりか,熊本の住宅地で発砲音か　立てこもりの可能性も,https://news.yahoo.co.jp/pickup/6501660,https://news.yahoo.co.jp/articles/dab09a34cb3615e978eaa5bd40cf8ea4020deae2,5/20(月) 16:41
local,,売掛金 初のホスト店営業取り消し,東京・歌舞伎町のホストクラブで風俗営業許可の取り消し処分　従業員の売掛金問題での取り消し処分は全国初,https://news.yahoo.co.jp/pickup/6501657,https://news.yahoo.co.jp/articles/38c2bd0493e04c7b00a030809881e1704e07c64f,5/20(月) 15:47
local,,覆面パトと衝突 バイクの男性死亡,【速報】覆面パトカーと衝突、バイクの男性が死亡「警察官が心臓マッサージを行っていた」交通違反車両を見つけたパトカーが交差点へ進入して事故,https://news.yahoo.co.jp/pickup/6501655,https://news.yahoo.co.jp/articles/928ab784742a473b2128ab781a4ad3df2a3349ff,5/20(月) 15:39
local,,貨物船内で酸欠か 1人が意識不明,「酸欠状態」石巻港の貨物船の倉庫で2人が倒れ1人意識不明　倉庫内にはバイオマス燃料の“パームヤシ殻”　宮城,https://news.yahoo.co.jp/pickup/6501632,https://news.yahoo.co.jp/articles/b7ec371e7a25e10a02d10862da0d4a106eb3d303,5/20(月) 11:24
local,,大阪で小4不明 30歳推定の似顔絵,【速報】21年前に大阪府熊取町で行方不明の吉川友梨さん　現在の推定の「似顔絵」大阪府警が公開,https://news.yahoo.co.jp/pickup/6501628,https://news.yahoo.co.jp/articles/137a89c344dbf4b103066b52f3cd0c9d52523c7d,5/20(月) 10:56
local,,大阪小4不明から21年 似顔絵公開,【速報】21年前に大阪府熊取町で行方不明の吉川友梨さん　現在の推定の「似顔絵」大阪府警が公開,https://news.yahoo.co.jp/pickup/6501626,https://news.yahoo.co.jp/articles/137a89c344dbf4b103066b52f3cd0c9d52523c7d,5/20(月) 10:37
local,,30年以上塩漬けの土地 県が売却へ,３０年以上塩漬け「阿蘇ソフトの村」用地、投資額の３８分の１で県売却へ…ＴＳＭＣ進出に伴う需要期待,https://news.yahoo.co.jp/pickup/6501618,https://news.yahoo.co.jp/articles/621ec85dd9b52e59e27859bf0b80110d52623d63,5/20(月) 9:30
local,,乳児の遺体遺棄した疑い 女を逮捕,【続報】赤ちゃんはビニール袋に入れられた状態　死体遺棄容疑の女（25）「自分が出産した」,https://news.yahoo.co.jp/pickup/6501604,https://news.yahoo.co.jp/articles/f346e17b00bb9f690c51e8621c5981840e747d78,5/20(月) 7:10
local,,踏切で転倒 高齢男性はねられ死亡,【速報】70代男性が南海電鉄の準急電車にはねられ死亡…踏切を自転車で横断中に転倒するも起き上がれず接触　堺市,https://news.yahoo.co.jp/pickup/6501602,https://news.yahoo.co.jp/articles/d9d108b120af4e5bdf95124b36e867eaafb620a3,5/20(月) 6:44
local,,脱依存 ふるさと納税100億円の町,ふるさと納税100億円超だった宮崎県都農町、指定取り消しから再出発…町長交代で「脱依存」模索,https://news.yahoo.co.jp/pickup/6501586,https://news.yahoo.co.jp/articles/1a6aeb82051684d21a93976da1dc082c32c9ff30,5/19(日) 21:38
local,,夫婦殺害 背景に首謀者への畏怖か,上野飲食店経営者夫婦殺害、背景に首謀者への畏怖か　遺体処理から殺人も「断り切れない」,https://news.yahoo.co.jp/pickup/6501580,https://news.yahoo.co.jp/articles/2dd0f932a7fef1f9fc54f560922b5ab9b16d6fd3,5/19(日) 20:22
local,,熱帯びない都知事選 構図固まらず,東京都知事選告示まで１カ月も固まらない構図　小池百合子知事はいまだ意思表明せず,https://news.yahoo.co.jp/pickup/6501579,,5/19(日) 19:57
local,,加害者の残高931円 遺族の憎しみ,「顔も腫れあがり、髪の毛もむしり取られていた」妹が殺され償い求めた遺族　加害者からの賠償金は全額払われず　相手の口座に残っていたのはたった“931円”「憎みたくなくても憎んでしまう…今の制度では」,https://news.yahoo.co.jp/pickup/6501577,https://news.yahoo.co.jp/articles/b7fc7d5c1116045eb230b849c45ca67969e86702,5/19(日) 19:25
local,,女児を洗濯機で回した疑い 男逮捕,洗濯機で3歳女児回した疑い　母親の交際相手逮捕、茨城,https://news.yahoo.co.jp/pickup/6501576,https://news.yahoo.co.jp/articles/66dc07931ae91ad645c084da8e17e2c9e09dafd2,5/19(日) 19:01
local,,4歳が液体かけられやけど 大阪府,【速報】何者かに液体かけられ…４歳男児が右腕をやけど　市役所でだんじりイベント見学　大阪・河内長野市,https://news.yahoo.co.jp/pickup/6501560,https://news.yahoo.co.jp/articles/308b0767a1f95b7f951d6e0cf5c71486368d33b0,5/19(日) 16:26
local,,貧困でサッカーできない SOS4倍,貧困でサッカーできない子どもたち「お金がかかるスポーツになった」子どもの夢のため“借金”も…SOSは4倍に【news23】,https://news.yahoo.co.jp/pickup/6501556,https://news.yahoo.co.jp/articles/9f0c893b151951718740e6244b2003416f793914,5/19(日) 15:54
local,,バイクと自転車衝突 20代2人死亡,バイクと自転車が衝突、男女が死亡　26歳会社員と21歳女子大生　兵庫県伊丹市の交差点,https://news.yahoo.co.jp/pickup/6501555,https://news.yahoo.co.jp/articles/a6880cec960a25e0f7ef9da01315c498cb1a8fc3,5/19(日) 15:34
local,,20年孤独死0 マンモス団地の作戦,20年間「孤独死ゼロ」を実現させた大山団地・自治会会長の佐藤良子さん,https://news.yahoo.co.jp/pickup/6501551,https://news.yahoo.co.jp/articles/19df9aab2636c0c246b9ad7cd144451af38ab235,5/19(日) 15:27
local,,1キロ超 巨大イワガキ100個水揚げ,ギネス級？！ 重さ１キロ超の巨大イワガキ１００個！　島根県海士町で水揚げされ話題に,https://news.yahoo.co.jp/pickup/6501535,https://news.yahoo.co.jp/articles/f88983c69c01312007918d075927e7bc38433ffe,5/19(日) 10:58
local,,夫婦殺害容疑、指示役を再逮捕,指示役を殺人容疑で再逮捕、夫妻遺体事件で2人目　6人の役割を捜査,https://news.yahoo.co.jp/pickup/6501532,https://news.yahoo.co.jp/articles/b94354db1054079fd1f2c5a2063fc4f3c29a4a00,5/19(日) 10:10
local,,海水浴場で男性死亡 サーフィンか,【速報】サーフィンをしていたとみられる男性が死亡　サーフボードを抱きかかえた状態で発見　京丹後市,https://news.yahoo.co.jp/pickup/6501523,https://news.yahoo.co.jp/articles/06d91994a5b6547384a9e7c58f9846541d9fd021,5/19(日) 9:03
local,,下呂温泉街で火事 宿泊客が避難,【速報】岐阜・下呂温泉街で火事　赤い炎 宿泊客が一時避難　消火活動続く,https://news.yahoo.co.jp/pickup/6501516,https://news.yahoo.co.jp/articles/ad6c83f557c6af03b41be8354bce4762347c147f,5/19(日) 7:49
local,,3歳女児が車にはねられ死亡 青森,3歳女児　乗用車にはねられ死亡,https://news.yahoo.co.jp/pickup/6501510,https://news.yahoo.co.jp/articles/b6f3fc75eb491dd76dc6d1a9aef9bacd4ff4ea2a,5/19(日) 7:20
