ctgry,media_jp,title_pickup,title_articles,link_pickup,link_articles,date_original
local,,別名「ヤンキーショップ」の今,スカジャンに鯉口…木更津発、ヤンキーショップ「どこにもない物を」,https://news.yahoo.co.jp/pickup/6502156,https://news.yahoo.co.jp/articles/62480b3ee53868a084a4eb0568f083338b3321be,5/25(土) 11:01
local,,小池百合子氏 都知事選に出馬へ,小池百合子都知事が無所属で３選出馬へ…都議会で表明向け調整,https://news.yahoo.co.jp/pickup/6502155,https://news.yahoo.co.jp/articles/c175c73bdecaf4ec05d3aac00deadc5ccb97d888,5/25(土) 11:01
local,,発電所にムール貝 卸売りで名物に,発電所に大量のムール貝　点検で採取、隠れた名物に　漁協に卸売り,https://news.yahoo.co.jp/pickup/6502152,https://news.yahoo.co.jp/articles/65912ad5f79431cedc383f55e369d58df9dd0f0d,5/25(土) 10:20
local,,未成年が喫煙飲酒「粋塾」の実態,12歳に散弾銃発砲させたか…「自立支援施設」関係者を逮捕　未成年に“喫煙や飲酒”も,https://news.yahoo.co.jp/pickup/6502140,,5/24(金) 23:11
local,,保育士不在で保育 事業停止命令,【速報】条例に定める保育士を配置せず…札幌市の認可保育所、10か月間の事業停止命令　保育士が足りていないのに、市に無断で子どもを保育,https://news.yahoo.co.jp/pickup/6502132,https://news.yahoo.co.jp/articles/db3a7dcde48e9588197bb56c52eae6e9a1d3e21a,5/24(金) 21:44
local,,品川母子4人死亡 3日前に離婚成立,事件3日前に離婚成立　品川母子4人死亡、父は自傷か,https://news.yahoo.co.jp/pickup/6502122,https://news.yahoo.co.jp/articles/9e52acc4e8519f3c541b5eeb478c842e28dee451,5/24(金) 20:30
local,,春名風花さんの名誉毀損 賠償命令,ネットで春名風花さんの名誉を毀損　投稿の男性に賠償命令　横浜地裁,https://news.yahoo.co.jp/pickup/6502119,https://news.yahoo.co.jp/articles/50a0c6f87251624e5fc13504404bc07f1825cf35,5/24(金) 20:13
local,,長野4人殺害1年 謝罪の言葉なし,「ぼっちとばかにされ」猟銃やナイフで住民2人と警察官2人が犠牲に　社会から孤立…自暴自棄型の“ローンオフェンダー”　被告はなぜ凶行？専門家が分析　長野・中野市4人殺害事件1年,https://news.yahoo.co.jp/pickup/6502113,https://news.yahoo.co.jp/articles/074450f9bcdd17b14584782932f09a691d2bbf6f,5/24(金) 19:10
local,,熱中症の症状訴え 児童6人が搬送,【速報】運動会の練習を終えた児童12人が熱中症の症状を訴え　6人が救急搬送　山梨,https://news.yahoo.co.jp/pickup/6502107,,5/24(金) 18:21
local,,友人関係記載の資料 教員が紛失,中学校で友人関係記した個人情報を紛失、生徒が見つけ閲覧、撮影も,https://news.yahoo.co.jp/pickup/6502098,https://news.yahoo.co.jp/articles/ce274a3b5c437ff2668bbdcd470bf63364402705,5/24(金) 17:05
local,,富士山目隠し 町長「苦渋の選択」,「観光客減少懸念あったが…」「苦渋の選択」と富士河口湖町長　「富士山ローソン」の目隠し幕設置で会見,https://news.yahoo.co.jp/pickup/6502096,https://news.yahoo.co.jp/articles/54dbc8f0cd6ab99ff30ab27bf6a5fb16a086e764,5/24(金) 16:40
local,,4歳児やけど 液体はネイル接着剤,【速報】大阪・河内長野市で4歳の男の子の腕に液体がかかり火傷　液体は見物客のつけ爪用接着剤「ネイルグルー」と判明,https://news.yahoo.co.jp/pickup/6502089,https://news.yahoo.co.jp/articles/45460e0f1e9fd62c9c94e7e2d4a0f292926d791f,5/24(金) 15:23
local,,火災の住宅に4遺体 失血死の疑い,父親の首に浅い切り傷、自傷行為か　東京・品川母子4人死亡,https://news.yahoo.co.jp/pickup/6502087,https://news.yahoo.co.jp/articles/a60fe8f02963855d622b0ee3be45809a3a617a6b,5/24(金) 14:53
local,,万博無料招待 希望校ゼロの市も,万博に子どもを無料招待　大阪府の事業、交野市は参加希望校ゼロ,https://news.yahoo.co.jp/pickup/6502084,https://news.yahoo.co.jp/articles/4a2b3097d6ae051c18e40e1ca25ee520c8bf0996,5/24(金) 14:01
local,,不審車両を追跡 警察官が5発発砲,【続報】拳銃発砲は５発 不審車両を追跡の警察官 逃走した容疑者の負傷は不明 南甲府警察署,https://news.yahoo.co.jp/pickup/6502078,https://news.yahoo.co.jp/articles/93d90bec06b5627c0bda0b3ebe8349f30caf3f93,5/24(金) 13:09
local,,4人殺害 被告両親が建てた観音様,長野・中野市4人殺害事件　突然、加害者家族に…被告両親も苦悩の日々　一時は命絶つ考えも　NPOが支援「生きることが償い」　発生1年を前に供養の「観音様」建立,https://news.yahoo.co.jp/pickup/6502080,https://news.yahoo.co.jp/articles/d1870f4b406d27e4db85b89e4ab5cc290ef5713e,5/24(金) 13:03
local,,知的障害あっても芸能人に 変化,知的障害があっても芸能人になれる？　「挑戦できる場つくりたい」専門事務所が相次ぎ登場,https://news.yahoo.co.jp/pickup/6502075,https://news.yahoo.co.jp/articles/5d63584ec1e1f86a121c03faaa553569d1029bbc,5/24(金) 12:38
local,,神戸児童殺傷27年 子への思い今も,「国による一元的な犯罪被害者支援を」神戸・連続児童殺傷事件から27年　土師淳君の父親、守さんの手記「加害男性からの接触は、現時点では手紙を含めてありません」,https://news.yahoo.co.jp/pickup/6502042,https://news.yahoo.co.jp/articles/d4c53aae6e7ab9af9d8224a36e198d1609b4a72e,5/24(金) 7:39
local,,自転車で通学の中1 はねられ死亡,自転車で通学途中にはねられ 中学1年生の男子生徒が死亡 車運転の35歳男を逮捕 石川・加賀市,https://news.yahoo.co.jp/pickup/6502038,https://news.yahoo.co.jp/articles/fcd47c6a00cea2432fcb99a370a45bf04fe34b2f,5/24(金) 6:17
local,,品川の住宅に4遺体 父親を聴取へ,品川の住宅火災で母子４遺体、搬送された４０代の父親に事情聞く方針…母親とは今月離婚,https://news.yahoo.co.jp/pickup/6502035,https://news.yahoo.co.jp/articles/32ea13bdcf461566ef9018635a9a460de6c51c87,5/23(木) 23:00
local,,横浜の乳児遺体 死後1カ月以上か,ごみ集積所で乳児の遺体、死後1カ月以上経過か　横浜,https://news.yahoo.co.jp/pickup/6502028,https://news.yahoo.co.jp/articles/96a7a40d8967b364940735206bc3c42e5d85a042,5/23(木) 21:54
local,,男児はねられ死亡 都に賠償命令,東京都に6千万円賠償命令　パトカー衝突の男児死亡,https://news.yahoo.co.jp/pickup/6502013,,5/23(木) 19:25
local,,待機児童が前年の30倍超 悩む大津,『保育園入れない…』待機児童は前年の“30倍”超　子育て世帯が急増　マンション建設ラッシュの大津市,https://news.yahoo.co.jp/pickup/6502008,https://news.yahoo.co.jp/articles/658cc330ed6b134a101ea8780fd876fcda5c2400,5/23(木) 18:54
local,,小4で性被害「たすけて」はまほう,小4で性被害に遭った少女「『たすけて』は人をすくう言葉」…作文で助けを求めることの大切さを訴え,https://news.yahoo.co.jp/pickup/6502009,https://news.yahoo.co.jp/articles/9b6febade6aa7b73641bab9bd8e7753da0531162,5/23(木) 18:52
local,,「淀ちゃん」処理費巡り 市を提訴,【淀ちゃん訴訟】マッコウクジラの死体処理費8019万円の随意契約　住民グループが提訴「違法性を認識して契約、大阪市に損害」主張,https://news.yahoo.co.jp/pickup/6501996,https://news.yahoo.co.jp/articles/91393c4df4cc3cf2563ea803c194423932211a6a,5/23(木) 17:41
local,,大阪の切り付け事件 男2人を逮捕,【速報】大阪・ミナミのビルで男性2人切り付けられケガ　逃走していた男2人逮捕　飲食店でトラブルか,https://news.yahoo.co.jp/pickup/6501997,https://news.yahoo.co.jp/articles/9020799be1b45f4ef5fe21dcc5d6024733395242,5/23(木) 17:33
local,,密輸容疑 エンセン井上容疑者逮捕,格闘家のエンセン井上容疑者を麻薬密輸容疑で逮捕　輸入のチョコバーから検出,https://news.yahoo.co.jp/pickup/6501986,https://news.yahoo.co.jp/articles/36352f45a72ff5c823409203ef295d5d62e41a9c,5/23(木) 16:46
local,,品川火災 死亡の4人に刃物の傷か,住宅火災で4人死亡　1人は女性、3人は10歳未満の子どもで“刺し傷や切り傷”も　東京・品川区,https://news.yahoo.co.jp/pickup/6501981,https://news.yahoo.co.jp/articles/eec49978cd8ecfe99d1d2cd5151400d3d14914df,5/23(木) 16:33
local,,能登地震 関連死30人を正式認定,【速報】石川県で災害関連死30人正式認定 能登半島地震の死者260人に,https://news.yahoo.co.jp/pickup/6501978,https://news.yahoo.co.jp/articles/383a39427c6a4ed78101896b17e280850a9cf970,5/23(木) 15:59
local,,サルがゴミ漁る 名古屋で目撃続々,名古屋・天白区でサルの目撃情報が相次ぐ　「目を合わせず近づかないで」注意呼びかけ,https://news.yahoo.co.jp/pickup/6501975,,5/23(木) 15:13
local,,品川で住宅火災 4人死亡1人ケガ,【速報】住宅火災で4人死亡、1人ケガ　東京・品川区,https://news.yahoo.co.jp/pickup/6501973,https://news.yahoo.co.jp/articles/71ead1f9df7cdb78d277e77153aa2eeeb8bd659f,5/23(木) 14:52
local,,キンプリ花火大会 帰宅困難が多数,King&Prince出演の花火大会　終電が…新山口駅に帰宅困難者,https://news.yahoo.co.jp/pickup/6501970,https://news.yahoo.co.jp/articles/9611148e3afd64f254586142df6a28e9d63d3172,5/23(木) 14:27
local,,鹿を見た 江東区で目撃情報相次ぐ,江東区で鹿の目撃情報相次ぐ、区が注意を呼びかけ　その後見つからず,https://news.yahoo.co.jp/pickup/6501968,https://news.yahoo.co.jp/articles/bb135382b79c309dcc94b6afecb945c153478523,5/23(木) 14:13
local,,JR津軽線の一部区間 復活を断念,JR津軽線「復旧断念」　地元表明、廃止議論が加速か,https://news.yahoo.co.jp/pickup/6501962,https://news.yahoo.co.jp/articles/76ed25d32ca638cb875fe509eebf62a7cdc6fc5c,5/23(木) 13:37
local,,京都でタクシー逆走か 3人けが,【速報】タクシーが堀川通を２５０ｍ以上逆走か　京都市中京区で車６台が絡む事故　３人重軽傷　目撃者「破片が飛んできた」,https://news.yahoo.co.jp/pickup/6501957,https://news.yahoo.co.jp/articles/00bb9e8e8833243e0dfff7c20dfb4938121da969,5/23(木) 12:13
local,,沖縄で大雨 台風1号が発生見込み,沖縄や奄美で記録的な大雨 今年初の熱中症警戒アラート　台風1号が発生する見込み,https://news.yahoo.co.jp/pickup/6501959,https://news.yahoo.co.jp/articles/3d8c99aa0df25797a79db148b46527ac90fb1e9b,5/23(木) 11:55
local,,京都でタクシー逆走か 6人けが,【速報】タクシーが堀川通を少なくとも２５０ｍ逆走か　京都市中京区で車６台が絡む事故　６人けが　目撃者「破片が飛んできた」,https://news.yahoo.co.jp/pickup/6501949,https://news.yahoo.co.jp/articles/00bb9e8e8833243e0dfff7c20dfb4938121da969,5/23(木) 10:30
local,,ごみ集積場に赤ちゃん遺体 横浜,【速報】袋に入った男の赤ちゃん遺体ポンプ場敷地内のごみ集積場で見つかる　死体遺棄事件として捜査　横浜・港北区,https://news.yahoo.co.jp/pickup/6501934,https://news.yahoo.co.jp/articles/d45b5543d5e3635b3948c6198b1c77c0d3554b7d,5/23(木) 7:57
local,,中尾彬さん死去 出身地から悼む声,地元愛した中尾彬さん　千葉・木更津から悼む声　PR大使も務め,https://news.yahoo.co.jp/pickup/6501930,https://news.yahoo.co.jp/articles/449d19c3e010663d65633da62eba063adba9b123,5/23(木) 6:33
local,,山形で住宅火災 4人の遺体発見,山形県大江町で住宅火災　4人の遺体発見　父・子2人・祖母と連絡が取れず　母親は近くの人がはしごをかけ2階から救出,https://news.yahoo.co.jp/pickup/6501929,https://news.yahoo.co.jp/articles/c3bae63675a484e8fd0e9c672dfe2cfad5e5a2b3,5/23(木) 6:12
local,,性被害で妊娠 内密出産選んだ女性,「本当はもっと『大好きだよ』と言ってあげたかった」内密出産の実母の証言,https://news.yahoo.co.jp/pickup/6501924,https://news.yahoo.co.jp/articles/e9278300513b166645de1558e242fa1119d9f213,5/22(水) 23:40
local,,京葉線問題で転居検討1割 千葉市,「転居検討」も1割　京葉線アンケート、千葉市が結果公表　利用者、内房外房中心に「悪い影響」【訂正あり】,https://news.yahoo.co.jp/pickup/6501919,https://news.yahoo.co.jp/articles/706d582e5da79151fca8df4581d31f16d874ad49,5/22(水) 22:21
local,,4歳児やけど 原因は瞬間接着剤か,＜独自＞大阪の４歳児、やけどの原因は「瞬間接着剤」か　１００度近くに達することも,https://news.yahoo.co.jp/pickup/6501903,,5/22(水) 19:18
local,,OSO18恐怖再び クマに町民不安,"牛襲う""忍者グマ""OSO18の恐怖再び…ヒグマに子ウシ8頭襲われ4頭死ぬ クマを捕獲するための「箱わな」牧場付近に設置 猟友会などと今後の対策を協議 北海道別海町",https://news.yahoo.co.jp/pickup/6501894,https://news.yahoo.co.jp/articles/cb4dcb3a67716535fb6afafed45934644723db88,5/22(水) 18:32
local,,カスハラ防止の条例案提出へ 東京,東京都　全国初の「カスハラ」防止条例案提出へ,https://news.yahoo.co.jp/pickup/6501897,https://news.yahoo.co.jp/articles/34064c0bfb1f611e646a7f938f47b668c9b1866d,5/22(水) 18:28
local,,殺人など7つの罪 男に懲役30年,【速報】『懲役30年』の実刑判決　殺人・放火・詐欺など“7つの罪”の男　知人男性を414kgある除雪機でひいて殺害など…,https://news.yahoo.co.jp/pickup/6501888,https://news.yahoo.co.jp/articles/c4cbdd9d187152d77753c0fe46170a1c3e8b137d,5/22(水) 17:38
local,,高校生が原付逆走し車と衝突 重体,高校生の原付バイクが道路逆走　大型トラックと衝突　運転の高校生が意識不明の重体,https://news.yahoo.co.jp/pickup/6501883,https://news.yahoo.co.jp/articles/e922e913cb89f76c30aa5a231ce900d06446e6d7,5/22(水) 16:57
local,,沖縄で激しい雨 土砂災害に警戒,沖縄本島中南部で大雨洪水警報　土砂災害にも警戒,https://news.yahoo.co.jp/pickup/6501876,https://news.yahoo.co.jp/articles/bd70eb13f40ae3ddc73a5b53e06e92e662be358f,5/22(水) 15:35
local,,元宝塚月組トップ 詐欺疑いで逮捕,元宝塚月組トップ逮捕　架空の映画製作で1000万円詐取の疑い,https://news.yahoo.co.jp/pickup/6501874,https://news.yahoo.co.jp/articles/427aae7dded83b21f9598711b8be4f2f0950ebd3,5/22(水) 15:19
local,,前江東区長に5年間立候補禁止判決,木村前江東区長の立候補禁止　連座制適用、東京高裁,https://news.yahoo.co.jp/pickup/6501870,https://news.yahoo.co.jp/articles/dacce00e3ace5b44bd4547dc8723853878a8ee35,5/22(水) 14:54
local,,男性2人が車にはねられ死亡 茨城,40代とみられる男性2人が車にはねられ死亡…運転の女性（35）「気付くのが遅くなりはねた」　茨城・水戸市,https://news.yahoo.co.jp/pickup/6501854,https://news.yahoo.co.jp/articles/3a57368e2013f9041d7fee498f29f2b561495e53,5/22(水) 11:32
local,,クマ駆除辞退 報酬にハンター怒り,猟友会がクマの駆除辞退　「この報酬ではやってられない」「ハンターを馬鹿にしている」北海道奈井江町,https://news.yahoo.co.jp/pickup/6501842,https://news.yahoo.co.jp/articles/bb6d47eb39182b080b772bd0847e7cdaa843d58d,5/22(水) 9:21
local,,ヤミ金で利息得た疑い 男ら逮捕,【速報】「ヤミ金の味、忘れられず…」旧五菱会事件のヤミ金グループ元メンバーら4人　ヤミ金で利息得た疑いなどで逮捕,https://news.yahoo.co.jp/pickup/6501843,https://news.yahoo.co.jp/articles/e3a9eff144952555098d50692d8b2ecb5125040b,5/22(水) 9:15
local,,免許返納を拒み事故 怒鳴った息子,認知症の症状、車の鍵も取り上げたのに…　免許返納を拒んだ90歳父が交通事故も「俺は悪くない」そして要介護に　家族の苦悩,https://news.yahoo.co.jp/pickup/6501836,,5/22(水) 8:54
local,,佐賀・玄海町長の軽乗用車燃える,佐賀・玄海町長の軽乗用車が燃える…核のゴミ「文献調査」受け入れ表明したばかり,https://news.yahoo.co.jp/pickup/6501829,https://news.yahoo.co.jp/articles/b49faaa5bf58442ba9ddd47a14ded7fbff5d603a,5/22(水) 7:50
local,,窓に挟まれ2歳死亡 事故後絶たず,車の窓に挟まれ２歳女児死亡、運転の母「後ろ見ず閉めた」…子どもの事故は後絶たず,https://news.yahoo.co.jp/pickup/6501823,https://news.yahoo.co.jp/articles/8a80c75eaeef3c39607edc852d08cdddb3d5b6b5,5/22(水) 6:43
local,,女子大生殺害事件 50カ所以上の傷,【速報】大学生の渡辺華蓮さん殺害事件…死因は「失血死」遺体の傷は『50か所以上』肝臓に達するものも　発見2日前に死亡と推定　強い殺意か,https://news.yahoo.co.jp/pickup/6501821,https://news.yahoo.co.jp/articles/8b0424b398061acfc8287263d74fee29c52d1f84,5/22(水) 6:12
local,,94歳女性の死因は多発外傷 暴行か,【速報】民家で死亡の94歳女性　死因は「多発外傷」警察は殺人や傷害致死容疑を視野に捜査『くも膜下出血や脳挫傷』複数の骨折や打撲痕も　大阪府警,https://news.yahoo.co.jp/pickup/6501817,https://news.yahoo.co.jp/articles/b78a10eda38b3b31263ab0c8bd34f486ffad5cfa,5/21(火) 23:03
local,,リンゴ食べ死亡の子 眠そうだった,認可外保育施設でリンゴ詰まらせ女児死亡　検証委「事故防げた可能性」,https://news.yahoo.co.jp/pickup/6501812,https://news.yahoo.co.jp/articles/828cd170df0fa19f5be70a256b62ad56d2e912f0,5/21(火) 21:46
local,,ごみ収集車がはねた男児 意識回復,ごみ収集車が男児はねる、岐阜　一時意識不明も回復,https://news.yahoo.co.jp/pickup/6501808,https://news.yahoo.co.jp/articles/6d4bc1fb31ef2c6adc40a1cffe8b5e9ab6c11ad1,5/21(火) 20:49
local,,収集車にはねられた男児 意識回復,はねられた男子小学生の意識回復,https://news.yahoo.co.jp/pickup/6501805,,5/21(火) 20:35
local,,四日市市 返礼品の松阪牛取りやめ,ふるさと納税返礼品「松阪牛」取りやめ　三重・四日市、疑問の声受け,https://news.yahoo.co.jp/pickup/6501796,https://news.yahoo.co.jp/articles/9d6c2de67a42b993468d635381b562b4ed92218d,5/21(火) 19:44
local,,犯罪収益を資金洗浄疑い 12人逮捕,【速報】約500の架空会社設立し特殊詐欺・投資詐欺の被害金を「マネロン」か　資金洗浄グループ摘発　管理口座は4000以上,https://news.yahoo.co.jp/pickup/6501795,https://news.yahoo.co.jp/articles/7392049143a84ed8817e9ca2bde5baafcaaea8fc,5/21(火) 19:23
local,,ゴミ収集車と衝突し男児重体 岐阜,道路を横断中の小学生の男の子とゴミ収集車が衝突　男の子が意識不明の重体　岐阜,https://news.yahoo.co.jp/pickup/6501790,https://news.yahoo.co.jp/articles/d3ca16ea2870e14f3b55c248ce236ea7c9ecadbd,5/21(火) 18:46
local,,窓に挟まれ 後部座席の女児が死亡,「抜けない」母親119番も2歳くらいの女児が車の窓に首挟まれ死亡…走行中の車内で母子だけ,https://news.yahoo.co.jp/pickup/6501788,https://news.yahoo.co.jp/articles/a7af656397eb500176f23a260b9e999f076953db,5/21(火) 18:40
local,,住宅被害8万棟超え 能登半島地震,能登地震の住宅損壊8万棟超に　石川、2170戸で断水続く,https://news.yahoo.co.jp/pickup/6501785,https://news.yahoo.co.jp/articles/e22b17d77e80c7be073965e540e5283dfcce3ad7,5/21(火) 18:10
local,,リンゴ詰まり1歳死亡 2022年東京,リンゴ詰まらせ女児死亡　22年、東京の保育施設,https://news.yahoo.co.jp/pickup/6501775,https://news.yahoo.co.jp/articles/0c8ca21722b9da862ce37c0033e493e993b5c463,5/21(火) 17:08
local,,牛襲う新たなクマか 牛4頭が死ぬ,"【速報】ヒグマの仕業か 牧場で子ウシ8頭襲われ 4頭の死骸みつかる OSO18が活動していた北海道東部でまた…新たなOSO""牛襲いクマ""の出現か",https://news.yahoo.co.jp/pickup/6501771,,5/21(火) 16:43
local,,池上氏になりすまし詐取容疑 逮捕,池上彰さんになりすまし1000万円だまし取った疑い　中国籍の34歳男逮捕　池上さん呼びかけ「詐欺に引っかからないで」,https://news.yahoo.co.jp/pickup/6501769,https://news.yahoo.co.jp/articles/814bd97f074b83a5097dd802163a55a28701536e,5/21(火) 16:42
local,,市職員を裁判に動員 傍聴席埋める,教員わいせつ事件の裁判、横浜市教委が職員動員して傍聴席埋める…４事件で１回に最大５０人,https://news.yahoo.co.jp/pickup/6501766,https://news.yahoo.co.jp/articles/2d93c0d919fcab12d1b027151ccb453830d7a9b6,5/21(火) 16:00
local,,首都高3人死亡 「休めず」と供述,【独自】首都高3人死亡事故で逮捕のトラック運転手が風邪で高熱も「休めなかった」供述　元従業員「睡眠時間もろくにとれない」,https://news.yahoo.co.jp/pickup/6501754,https://news.yahoo.co.jp/articles/f31d94dbb39245486a56a5decdd7c4895faf4e3b,5/21(火) 14:36
local,,捜査資料漏えい巡り 警察16人処分,巡査長「組織内の評価高めたかった」…３０４人の捜査情報漏えい,https://news.yahoo.co.jp/pickup/6501756,https://news.yahoo.co.jp/articles/71a50b0d0c4344db22b97532d2a43a5ea62685da,5/21(火) 14:19
local,,車の窓に首を挟まれ 女児が死亡,【更新】3歳女児が車の窓に挟まれ死亡　母親が運転「赤信号で振り向いたら挟まっていた」　東京・練馬区,https://news.yahoo.co.jp/pickup/6501760,https://news.yahoo.co.jp/articles/f9966c4ccc374fc88babbb50175a9ea844c99638,5/21(火) 14:17
local,,富士山目隠し 観光客「良い対策」,「コンビニの上に富士山」外国人に人気のスポットに黒幕…「ちょっとさみしい」「良い対策」,https://news.yahoo.co.jp/pickup/6501758,https://news.yahoo.co.jp/articles/5560bef71b99cda90d62e2b0fe72ee3447aad09f,5/21(火) 13:51
local,,車の窓に首挟まれ 女児が意識不明,【速報】車の窓に首挟まれ2歳くらいの女児が意識不明の重体　東京・練馬区　,https://news.yahoo.co.jp/pickup/6501757,https://news.yahoo.co.jp/articles/7262d2f6811de3f9e66bf7ae05e9bb6e9d691b55,5/21(火) 13:39
local,,沖縄地方・奄美地方が梅雨入り,沖縄・奄美地方が梅雨入り　沖縄は平年より11日遅く　奄美は平年より9日遅く,https://news.yahoo.co.jp/pickup/6501740,https://news.yahoo.co.jp/articles/d997d371e3e1e496757d454386f504f0df7a6da6,5/21(火) 11:08
local,,富士山望むコンビニ 目隠し設置,富士山コンビニ「目隠し」設置　観光客のマナー違反対策　山梨・富士河口湖町,https://news.yahoo.co.jp/pickup/6501736,https://news.yahoo.co.jp/articles/d7d1832011a0a00a23dbce73dc1480f9f1434b38,5/21(火) 10:45
local,,夫婦殺害容疑 実行役の2人再逮捕,【速報】“実行役”の元俳優ら2人を殺人容疑で再逮捕　那須夫婦遺体　宝島さん夫婦を殺害した疑い　犯行後に大阪に逃走し散財か,https://news.yahoo.co.jp/pickup/6501734,https://news.yahoo.co.jp/articles/ea0d6af38ff34ab163c6bcb39481af276efcb0cf,5/21(火) 10:09
local,,夫婦殺害 SNSきっかけで身柄確保,潜伏先でSNSにピースサイン　実行役、投稿きっかけに身柄確保　夫妻殺害容疑で再逮捕へ・那須2遺体,https://news.yahoo.co.jp/pickup/6501727,https://news.yahoo.co.jp/articles/4e1294e99995d427d7eb478c56f9c93bc9ec65e9,5/21(火) 9:15
local,,神戸の射殺事件 暴力団幹部逮捕へ,ラーメン店「龍の髭」店主射殺、暴力団幹部を組織的な殺人容疑で逮捕へ…兵庫県警,https://news.yahoo.co.jp/pickup/6501713,https://news.yahoo.co.jp/articles/091c8aba708d4eb3e9cb685a22b783d852d579af,5/21(火) 7:32
local,,夫婦殺害容疑 実行役2人再逮捕へ,【速報】若山耀人容疑者と姜光紀容疑者を殺人容疑で再逮捕へ　栃木・那須で宝島龍太郎さん夫婦が遺体で発見　警視庁,https://news.yahoo.co.jp/pickup/6501704,https://news.yahoo.co.jp/articles/d65ca8747c7dcba9cffc6caccd9ce27a73efceff,5/20(月) 23:14
local,,飯塚事件 6/5に再審可否を決定,【速報】女児2人が殺害された飯塚事件　2度目の再審可否　6月5日に決定へ　福岡地裁,https://news.yahoo.co.jp/pickup/6501702,https://news.yahoo.co.jp/articles/92ef0f5e00fce0e6f50c76deba7fe057dd171dc2,5/20(月) 22:46
local,,王将社長射殺 弁護側は無罪主張へ,王将社長射殺事件の被告「関係ない」と否認　弁護側、無罪を主張する方針,https://news.yahoo.co.jp/pickup/6501699,https://news.yahoo.co.jp/articles/d5e80cda6a9078802518bc8bc58a0988cd93d61d,5/20(月) 22:41
local,,京都の観光バス路駐 運転手言い分,【独自】京都で外国人客向け観光バスが路上駐車　直撃に「運転手のこともわかってほしい」路上駐車を否定　違反の可能性は?,https://news.yahoo.co.jp/pickup/6501700,https://news.yahoo.co.jp/articles/97312b756897807828f777490f401b686c8397ed,5/20(月) 22:36
local,,がん手術中けい動脈切る 市が賠償,がん手術中、頸動脈切る　後遺症の60代男性に2060万円賠償　三田市民病院「医療過誤明らか」,https://news.yahoo.co.jp/pickup/6501695,https://news.yahoo.co.jp/articles/0c5dac9abf49908d2b75e1dbc6ef707a1c963b84,5/20(月) 22:04
