media_en,media_jp,title_articles,date_original
engine,ENGINE WEB,待望の左ハンドル仕様が登場　アルファ・ロメオ・ジュリア・クアドリフォリオにカスタマイズ・プログラムを導入,11/17(日) 8:10
engine,ENGINE WEB,自動車評論家の森口将之が販売終了のトゥインゴと累計生産台数1億台のスーパーカブを買った理由　小さなルノーと小さなホンダ、この2つの乗り物に共通するものとは？,11/17(日) 7:10
engine,ENGINE WEB,「i」はEVにプレゼント　BMW1シリーズが前輪駆動ベースを踏襲し、4代目にフルモデルチェンジ,11/17(日) 6:10
engine,ENGINE WEB,こんなの、もう出てこない　トヨタ・ランドクルーザー70とマツダ2　自動車評論家の渡辺敏史が推すのは日本市場ならではの、ディーゼル搭載実用車だ！,11/16(土) 18:10
engine,ENGINE WEB,レクサスUX300hにスポーティとエレガントを際立たせた2種類の特別仕様車を設定,11/16(土) 8:10
engine,ENGINE WEB,【詳細解説】320iセダンと420iクーペがドライバーズカーである理由を、自動車評論家の菰田潔が語る　なぜBMWは運転が楽しいクルマの大定番なのか？,11/16(土) 7:10
engine,ENGINE WEB,ニスモはメーカーによる抽選販売　日産フェアレディZが受注を再開するとともに2025年モデルを発表,11/16(土) 6:10
engine,ENGINE WEB,自動車評論家の国沢光宏が買ったアガリのクルマ！　内燃エンジンのスポーツカーと泥んこOKの軽自動車、これは最高の組み合わせです！,11/15(金) 18:10
engine,ENGINE WEB,今や希少な小型後輪駆動ベースのスポーツ・クーペ、BMW2シリーズ・クーペがちょっとだけ進化,11/15(金) 17:10
engine,ENGINE WEB,参考にしたのは巨匠建築家ル・コルビュジエのカラーパレット　パルミジャーニ・フルリエのトンダの新作　“時計の物語”を色で表現,11/15(金) 12:10
engine,ENGINE WEB,GR86の2倍以上の高出力　BMW M2が一部改良　3.0リッター直6ツインターボの出力をさらにアップ,11/15(金) 6:10
engine,ENGINE WEB,まだまだSUVには負けない　BMW3シリーズがさらなる改良で、PHEVのEV距離を大幅に延長,11/14(木) 17:10
engine,ENGINE WEB,精緻なメカニズムを“魅せる”オープンワーク文字盤に注目！　タグ・ホイヤー カレラ クロノグラフ エクストリームスポーツが発売！,11/14(木) 7:10
engine,ENGINE WEB,トヨタへのOEM供給も決定　スズキの世界戦略EVの第1弾、e ヴィターラがデビュー,11/14(木) 6:10
engine,ENGINE WEB,【後篇】過走行の初代カングー・ブラザーズ座談会　初代カングーは古典的フランス車の最終進化形！　やっぱり大事なのは、走る、曲がる、止まるだ！！,11/13(水) 19:11
engine,ENGINE WEB,【前篇】28万km、14万km、11万km、過走行の初代カングー3台オーナー座談会　どうしてカングーはこんなに運転が楽しいのか？,11/13(水) 19:10
engine,ENGINE WEB,新しい顔で勝負　アウディのフラッグシップSUVクーペ、Q8シリーズがマイナーチェンジ,11/13(水) 17:10
engine,ENGINE WEB,ジラール・ペルゴと日本の「固い絆の証」　エンジン時計委員、柴田充イチオシ　藍色のジラール・ペルゴ ロレアート,11/13(水) 7:20
engine,ENGINE WEB,公道でV12サウンドを堪能するのは無理なのか！？　ランボルギーニの新旗艦、レヴエルトに一般道で試乗！　あきらめて大人しく走るしかなかったその理由とは？,11/13(水) 7:10
engine,ENGINE WEB,プレミアムBセグメントSUVのレクサスLBXに既存グレードよりも安価な新グレード、エレガントが登場,11/13(水) 6:10
engine,ENGINE WEB,BMW4シリーズ・グランクーペが初の変更　新しいヘッドライトと装備の充実で商品力を高める,11/12(火) 17:10
engine,ENGINE WEB,1000Nmの恐るべき最大トルク！　新型ベントレー・コンチネンタルGTをマガリガワクラブでテストした！！,11/12(火) 7:10
engine,ENGINE WEB,アウディ最新のBEV専用SUV、Q6 e-トロンにクーペ・ルックのスポーツバックが加わった,11/12(火) 6:10
engine,ENGINE WEB,メルセデスGLS、BMW X7対抗のフラッグシップSUV、アウディQ7が2度目のマイナーチェンジ,11/11(月) 17:10
engine,ENGINE WEB,いま俄然注目のフル・ハイブリッドのルノー・アルカナがフェイスリフトでお色直し　モータージャーナリストの森口将之が試乗した！,11/11(月) 7:10
engine,ENGINE WEB,新型ポルシェ911にカレラTが登場　カレラ比−42kgの軽量化を施したMT専用のスポーティ・モデル,11/11(月) 6:10
engine,ENGINE WEB,【後篇】エンジンHOT100ランキングの1位と2位のスポーツカーが激突！　日本代表マツダ・ロードスター vs アルピーヌA110　少しでも長く存在し続けて欲しい！,11/10(日) 19:11
engine,ENGINE WEB,スポーツカーの本質、ライトウエイトスポーツ対決！　日本代表マツダ・ロードスター vs アルピーヌA110　エンジンHOT100ランキングの1位と2位が激突【前篇】,11/10(日) 19:10
engine,ENGINE WEB,4モーターで内燃機関を超える悪路走破性をゲット　メルセデス・ベンツGクラスにEVのG580 with EQテクノロジーが登場,11/10(日) 8:10
engine,ENGINE WEB,内緒で買って、父に隠れて乗ったボクスター　すべてはそこから始まった！　そんな若きオーナーは今、世界のベンチマークでクルマ道の修行中です！！,11/10(日) 7:10
engine,ENGINE WEB,デザインには面影たっぷり　サンクに続き、ルノー往年の名車であるキャトルがEVで復活,11/10(日) 6:10
engine,ENGINE WEB,限定車の発表やチャラン・ポ・ランタンのライブなど、今年のルノー・カングー・ジャンボリーも大盛況,11/9(土) 8:10
engine,ENGINE WEB,「今販売中のSUVタイプのPHEVでは、最も優れたハンドリングを持つと言い切っておく」マイナーチェンジした三菱アウトランダーに国沢光宏が試乗！　まるでラリー車みたいだ！！,11/9(土) 7:10
engine,ENGINE WEB,『007』の相棒になってから60周年アストン・マーティンDB12ゴールドフィンガー・エディション,11/9(土) 6:10
engine,ENGINE WEB,【後篇】2024年総まとめ！　自動車評論家44人が選んだ「いま身銭買いしたいクルマのランキング！」　クルマ好きの人たちの深層心理がわかった！！,11/8(金) 19:11
engine,ENGINE WEB,2024年総まとめ！　自動車評論家44人が選んだ「いま身銭買いしたいクルマのランキング！」　欲しいクルマが変わってきた？【前篇】,11/8(金) 19:10
engine,ENGINE WEB,GRカローラだけではない　水素エンジンを搭載するアルピーヌのコンセプト・カーがさらに進化,11/8(金) 17:10
engine,ENGINE WEB,これがスバルの次期主力パワートレイン！　クロストレックに追加されるハイブリッドにモータージャーナリストの国沢光宏が先行試乗！！,11/8(金) 7:10
engine,ENGINE WEB,新型ルノー・カングーに待望のMT登場　140台限定のクルールにディーゼルと組み合わせる,11/8(金) 6:10
engine,ENGINE WEB,さらにイケメン顔に変身　華やかな新しいフロント・マスクを得た新型プジョー208が日本に上陸,11/7(木) 17:10
engine,ENGINE WEB,300万円台の輸入車は今や貴重な存在！　フェイスリフトで内外装が新しくなったVW Tクロスにモータージャーナリストの高平高輝が試乗した！,11/7(木) 7:10
engine,ENGINE WEB,ミニのスポーツ・モデルも電動化　クーパーのEVとエースマンにジョン・クーパー・ワークス（JCW）登場,11/7(木) 6:10
engine,ENGINE WEB,これが1万円ビニール傘の凄さだ！　1万円超えでも納得の使い勝手と美しさ！　下町から生まれた高級傘を試してみた,11/6(水) 18:00
engine,ENGINE WEB,次世代の三菱パジェロスポーツか!?　3列シートを持つミドルサイズSUVのDSTコンセプトをお披露目,11/6(水) 17:10
engine,ENGINE WEB,ヤフオク7万円のシトロエン・オーナー、エンジン編集部ウエダの座敷童との戦いと、読書の秋【シトロエン・エグザンティア（1996年型）長期リポート#54】,11/6(水) 7:10
engine,ENGINE WEB,新生アルピーヌの第3弾、「A390_β」は5人乗りのA110と呼べるスタイリッシュなEVのSUVクーペ,11/6(水) 6:10
engine,ENGINE WEB,ヒョンデ・コナにワイルドなエクステリアと本革内装を持つ30台限定の特別仕様車、マウナ・ロアを設定,11/5(火) 17:00
engine,ENGINE WEB,ドイツ人の911、アメリカ人のコルベットに匹敵する国民的スポーツカーだ by 西川淳　1位、マツダ・ロードスター　2位のアルピーヌA110に大差で圧勝!,11/5(火) 7:10
engine,ENGINE WEB,これが最後のスバル・レガシィ・アウトバックか!?　500台の30周年記念モデルが抽選販売,11/5(火) 6:10
engine,ENGINE WEB,ヘッドライトはまるでチコちゃん！　フィアット500Xの実質的な後継車、EVになった600eにモータージャーナリストの森口将之が試乗した！！　愛されキャラの素質あり,11/4(月) 18:10
engine,ENGINE WEB,1レースで1000本以上！　ヨコハマタイヤのサステナブル素材を33%用いたタイヤで戦う日本最高峰のフォーミュラ・レース,11/4(月) 8:10
engine,ENGINE WEB,「軽さは善だ、を身をもって証明してくれる、貴重な存在 by 河村康彦」第2位はアルピーヌA110　自動車評論家44人が選んだ「2024年 身銭買いしたいクルマのランキング！,11/4(月) 7:10
engine,ENGINE WEB,日本に導入すれば絶好のハリアー対抗馬になるのに　日産ムラーノの4代目が北米でデビュー,11/4(月) 6:10
engine,ENGINE WEB,ブラックのセラミックケースとブルーの文字盤が月夜を演出　細田雄人のイチオシは、ブランパン フィフティ ファゾムス バチスカーフ コンプリートカレンダー ムーンフェイズ,11/3(日) 18:10
engine,ENGINE WEB,もはや3シリーズより日本向きかも　BMW2シリーズ・グランクーペが2代目に進化し、本国でデビュー,11/3(日) 8:10
engine,ENGINE WEB,「スポーツEVじゃ圧倒的に世界一 by 国沢光宏」「新時代のスポーツカー像をつくりあげた画期的なモデル by 岡崎五朗」「一度ステアリングを握ればわかる by 山本シンヤ」第3位、ヒョンデ・アイオニック5N　絶賛の声続々！,11/3(日) 7:30
engine,ENGINE WEB,自然吸気エンジンのポルシェ911の最高峰、GT3が992.2型に進化　果たして、その中身は？,11/3(日) 6:10
engine,ENGINE WEB,強いポルシェが帰って来た！　2024 FIA世界耐久選手権第7戦 富士6時間耐久レースをふり返える,11/2(土) 18:10
engine,ENGINE WEB,ジープ・ラングラーにショート・ボディが復活　しかも、絶対的な走破性を持つルビコンで導入,11/2(土) 17:10
engine,ENGINE WEB,これこそ現代版、M3！「M2クーペにはクルマ好きの大好物が詰まっている！」by 高平高輝　第4位はこのスポーツカー！,11/2(土) 7:10
engine,ENGINE WEB,ロッキー&ライズ、WR-Vとガチンコ勝負　スズキの新しいSUVクーペ、フロンクスが販売開始,11/2(土) 6:10
engine,ENGINE WEB,美しく心に響く時計　エンジン時計委員、野上亜紀のイチオシ　ジャガー・ルクルトのポラリス・パーペチュアルカレンダー,11/1(金) 19:10
engine,ENGINE WEB,遊び心満載のいま注目のEVがこれ！　ジープ初のEV、アベンジャーにモータージャーナリストの森口将之が都内で試乗！！,11/1(金) 18:10
engine,ENGINE WEB,これは間違いなく史上最速のウルスだ！　プラグイン・ハイブリッドのウルスSEにモータージャーナリストの島下泰久が試乗！！,11/1(金) 7:10
engine,ENGINE WEB,ダークな側面を強調したクールなロールス、ブラックバッジ・ゴーストもシリーズIIに進化,11/1(金) 6:10
engine,ENGINE WEB,今なお売上記録を伸ばし続ける「奇跡のカンパネラ」　今年4月に逝去したフジコ・ヘミング　その壮絶な人生と唯一無二のピアニズムを振り返る,10/31(木) 12:10
engine,ENGINE WEB,「これほど官能的で理想的なスポーツカーをピュアEVで成立させるのは、さすがのポルシェでも無理（言っちゃった）」by 河村康彦　第5位はこのスポーツカー！,10/31(木) 7:45
engine,ENGINE WEB,EVナシでガソリンのみ　ミニ・クーパーのオープン・モデルであるコンバーチブルがフルモデルチェンジ,10/31(木) 6:10
engine,ENGINE WEB,PDKの衝撃的デビュー　ついに911にもダブル・クラッチ・トランスミッション搭載！　 直噴エンジン＋PDKで武装した997型ポルシェ911はどうすごかったのか？【エンジン・アーカイブ「蔵出しシリーズ」】,10/30(水) 20:10
engine,ENGINE WEB,グリルのデザインを控えめな横長に変更　新しくなったBMW 1シリーズにモータージャーナリストの渡辺敏史が試乗　いいもの感が高まった！,10/30(水) 18:10
engine,ENGINE WEB,ヤフオク7万円のシトロエン・オーナー、エンジン編集部ウエダの悲しい自爆のガリ傷事件と、予備のホイール探し【シトロエン・エグザンティア（1996年型）長期リポート#53】,10/30(水) 7:10
engine,ENGINE WEB,トヨタとのタッグを活かす　スバル・クロストレックにトヨタ由来のフル・ハイブリッド・モデルが予約開始,10/30(水) 6:10
engine,ENGINE WEB,カックカクの攻めたデザインでGLCと真っ向勝負　BMWの大黒柱、X3がフルモデルチェンジ　自動車評論家の渡辺敏史が試乗した！,10/29(火) 19:10
engine,ENGINE WEB,ゆるぎない圧倒的な人気　スポーツカーの定番と言えばこれ！　第6位、ポルシェ911カレラ　自動車評論家44人が選んだ「2024年 身銭買いしたいクルマのランキング！」,10/29(火) 7:10
engine,ENGINE WEB,ロールス・ロイス・ゴーストがマイナーチェンジ　パンテオン・グリルが際立つ新デザインを採用,10/29(火) 6:10
engine,ENGINE WEB,エンジン時計委員、数藤健 のイチオシは？　ヴァシュロン・コンスタンタン パトリモニー ムーンフェイズ＆レトログラード・デイト　機能と情緒のバランスが傑出している！,10/28(月) 19:10
engine,ENGINE WEB,これを買ったのは間違いなかった！ by 生方聡　第7位はボルボEX30　自動車評論家44人が選んだ「2024年 身銭買いしたいクルマのランキング！」,10/28(月) 7:10
engine,ENGINE WEB,ドイツ・プレミアムもターゲット!?　3列シートSUVのマツダCX-80は大型、高級化で上を狙う,10/28(月) 6:10
engine,ENGINE WEB,軍用をオリジンとするとは思えない際立つエレガントさが魅力　ブレゲのパイロット・クロノに新作が登場！,10/27(日) 18:10
engine,ENGINE WEB,電動化時代に背を向けた高回転・高出力型エンジンを搭載する奇跡の存在　第8はポルシェ911GT3 & GT3RS　自動車評論家44人が選んだ「2024年 身銭買いしたいクルマのランキング！」,10/27(日) 7:10
engine,ENGINE WEB,三菱のSUV、アウトランダーPHEVが大幅マイチェン　新型バッテリーで性能を大幅に進化,10/27(日) 6:10
engine,ENGINE WEB,モデルライフの最後を迎えようとしているGT-Rの、最後の闘い！　日本代表、日産GT-Rニスモ・スペシャル・エディション VS 世界選抜、ポルシェ911GT3 RS,10/26(土) 20:10
engine,ENGINE WEB,頑固一徹オヤジのようなこだわりを持つマツダの新フラッグシップ、CX-80にエンジン編集部のムラカミが試乗！,10/26(土) 18:10
engine,ENGINE WEB,「贅沢なクルマ創りの完成形」by 菰田潔　9位は本物を知る人が最後にたどり着くモデル　自動車評論家44人が選んだ「2024年 身銭買いしたいクルマのランキング！」,10/26(土) 7:10
engine,ENGINE WEB,受注停止のまま、レクサスLXが一部改良　待望のハイブリッドを搭載したLX700hを新規設定,10/26(土) 6:10
engine,ENGINE WEB,「スポーツカーの歴史に残る」by 高平高輝　10位はアメ車と言えばこのスポーツカー　自動車評論家44人が選んだ「2024年 身銭買いしたいクルマのランキング！」,10/25(金) 19:10
engine,ENGINE WEB,地球上に敵なしのジムニーと狂気の爆速オフロード4WDのG63の対決　モータージャーナリストの清水草一が価格15倍以上の2台を乗り比べて分かったこととは？,10/25(金) 7:40
engine,ENGINE WEB,コンパクトなボディで3列7人乗りが魅力のメルセデス・ベンツのSUV、GLBに特別仕様車が登場,10/25(金) 6:10
engine,ENGINE WEB,レーシング・ドライバーの肩書きを持つジャーナリスト6人が投票！　11位はイギリスのこのスポーツカー　自動車評論家44人が選んだ「2024年 身銭買いしたいクルマのランキング！」,10/24(木) 19:10
engine,ENGINE WEB,「ガソリン代のためにバイトしていた時代を思い出す」by 山崎元裕　12位はこの国産スポーツカー　自動車評論家44人が選んだ「2024年 身銭買いしたいクルマのランキング！」,10/24(木) 7:35
engine,ENGINE WEB,アルピーヌの名を冠した新グレード設定　ルノー初のSUVクーペ、アルカナがマイナーチェンジ,10/24(木) 6:10
engine,ENGINE WEB,実はエンジン・モデルも進化！　A4改め、新型アウディA5とS5にモータージャーナリストの大谷達也が試乗　手抜きなしのデキ！！,10/23(水) 7:01
engine,ENGINE WEB,4気筒で1700万円超〜　ロータス最後の純内燃機関モデル、エミーラにカタログモデルが登場,10/23(水) 6:10
engine,ENGINE WEB,5年連続で三つ星を獲得し続ける『レストラン ケイ』のオーナーシェフ、小林圭さんの腕時計　「常に世界一を目指している姿勢に共感します」,10/22(火) 19:30
engine,ENGINE WEB,初登場でいきなり13位にランクイン！　新型ミニ・クーパー　自動車評論家44人が選んだ「2024年 身銭買いしたいクルマのランキング！」,10/22(火) 7:10
engine,ENGINE WEB,メルセデス・ベンツCクラス・オールテレインにブラック仕立てで豪華装備を備えた特別仕様車が登場,10/22(火) 6:10
engine,ENGINE WEB,今や貴重な純内燃エンジン、AMG謹製のV8ツインターボは680馬力！　新型アストン・マーティンDB12に試乗！！,10/21(月) 19:20
engine,ENGINE WEB,ポルシェが本気でつくった全天候型スポーツカー　第14位、ポルシェ911ダカール　自動車評論家44人が選んだ「2024年 身銭買いしたいクルマのランキング！」,10/21(月) 7:10
engine,ENGINE WEB,フェラーリ296よりも高額！　4000万円を超える究極のアルピーヌA110、Rウルティムが登場,10/21(月) 6:10
engine,ENGINE WEB,アイスブルーの美しいロレックス　スポーツモデルとは一線を画す今注目のロレックス「パーペチュアル 1908」,10/20(日) 18:10
engine,ENGINE WEB,ゴルフGTIはボディで曲がる、メガーヌRSはリア・サスペンションで曲がる、ではシビック・タイプRは何で曲がるのか？　ホットハッチ頂上決戦　山野哲也が判定を下す！,10/20(日) 7:40
engine,ENGINE WEB,トムスが50周年　ル・マンやスーパーGTなど、トヨタのモータースポーツを支えたその歴史を紐解く,10/20(日) 6:10
engine,ENGINE WEB,フランス版ミシュランの三ツ星シェフ、小林圭　その世界観が詰まった銀座のレストランとバー「ESPRIT C. KEI GINZA」に出かけてみた！,10/19(土) 18:10
engine,ENGINE WEB,まるで船の舳先！　この家の中はいったいどうなっているのか？　理想の建築を目指した建築家の素敵な自邸をのぞいてみた！,10/19(土) 7:10
engine,ENGINE WEB,メルセデス・ベンツの最量販車種GLCに、見た目だけではなく走りにも磨きをかけた特別仕様車が登場,10/19(土) 6:10
engine,ENGINE WEB,マルチェロ・ガンディーニの最高傑作のひとつ、ストラトス・ゼロも並んだ！　世界屈指のクルマの祭典、モントレー・カー・ウィークに見る世代交代,10/18(金) 18:10
engine,ENGINE WEB,冒険心があるなら誰でも一度は乗ってみたい憧れのクルマ　総合15位はこのSUV！　自動車評論家44人が選んだ「2024年 身銭買いしたいクルマのランキング！」,10/18(金) 7:10
engine,ENGINE WEB,EVでも、小さくても、前輪駆動でもジープ　ブランド初のEV、アベンジャー販売開始,10/18(金) 6:10
engine,ENGINE WEB,【速報！】限定799台、5億7600万円のスペシャル・フェラーリ登場！　その名は「F80」　イタリアの本拠地マラネロで開かれた内覧会からエンジン編集部のムラカミが速報する,10/17(木) 21:00
engine,ENGINE WEB,公道ではこれにまさるフェラーリはない by 清水草一　総合16位はこのスポーツカー！　自動車評論家44人が選んだ「2024年 身銭買いしたいクルマのランキング！」,10/17(木) 7:25
engine,ENGINE WEB,ゆるキャラ顔から大変身　シトロエン・ベルランゴがマイナーチェンジでフロント・マスクを一新,10/17(木) 6:10
engine,ENGINE WEB,ワクワクしたくて買うならどっちだ？　日本代表、トヨタGRヤリス vs 世界選抜、ヒョンデ・アイオニック5Nに国沢光宏が試乗　クルマ好きのハートを熱くする2台の戦闘機！,10/16(水) 18:10
engine,ENGINE WEB,多気筒NAエンジン＋ミドシップを遵守した最後のモデル by 武田公実　総合17位はこのホットハッチ！　自動車評論家44人が選んだ「2024年 身銭買いしたいクルマのランキング！」,10/16(水) 7:10
engine,ENGINE WEB,4輪進出へのさらなる一歩か!?　ヤマハ発動機とケータハムがEVスポーツクーペ開発で協業,10/16(水) 6:10
engine,ENGINE WEB,エンジン時計委員、菅原茂のイチオシは？　IWC ポルトギーゼ・パーペチュアル・カレンダー　見違えるほどオシャレになった！,10/15(火) 18:10
engine,ENGINE WEB,「買ったら長く持ちたい」と言う国沢光宏さんの言葉が胸に沁みた　総合18位はこのホットハッチ！　自動車評論家44人が選んだ「2024年身銭買いしたいクルマのランキング！」,10/15(火) 7:10
engine,ENGINE WEB,アルファードに負けない押し出しと豪華さ　メルセデス・ベンツVクラスがマイナーチェンジ,10/15(火) 6:10
engine,ENGINE WEB,日本代表、レクサスLBX vs世界選抜、BMWX2M35ixドライブ　日独の都会が似合うコンパクトSUV対決！　どちらにも備わる独自の持ち味とは？,10/14(月) 19:10
engine,ENGINE WEB,「日々の生活をエンスーな時間にしてくれる貴重な存在 by 森口将之」　在庫限りの総合19位はこのコンパクトカー　自動車評論家44人が選んだ「2024年身銭買いしたいクルマのランキング！」,10/14(月) 7:10
engine,ENGINE WEB,日産セレナe-POWERに待望の4WD追加　エクストレイル、アリアと同じe-4ORCEを搭載,10/14(月) 6:10
engine,ENGINE WEB,【試乗篇】ハイブリッド化された新型ポルシェ911カレラGTS　試乗して感じたその欠点とは？　ハイブリッドとノンハイブリッドを乗り比べた現時点の結論は,10/13(日) 18:12
engine,ENGINE WEB,【システム解説篇】電気モーターだけでは1mmも走らない！　ハイブリッド化された新型ポルシェ911は、カイエンやパナメーラのE-ハイブリッドとどこが違うのか？,10/13(日) 18:11
engine,ENGINE WEB,ついにハイブリッド化された新型ポルシェ911カレラGTS　エンジン編集部のムラカミが試乗！,10/13(日) 18:10
engine,ENGINE WEB,悪路性能、頂上決戦！　日本代表トヨタ・ランドクルーザー250 vs 世界選抜ジープ・ラングラー＆ランドローバー・ディフェンダー　本格派ゆえ心して乗るべし！！,10/13(日) 7:10
engine,ENGINE WEB,こんなクルマで車中泊したい　日産NV200バネットに動くリビングルーム、「マイルーム」が登場,10/13(日) 6:10
engine,ENGINE WEB,乗り比べてみたら驚きの結果に！？　内燃エンジンと電気モーター、2台のミニ・クーパーに試乗　よりミニらしいのはどっちだ？,10/12(土) 18:10
