media_en,media_jp,title_articles,date_original
engine,ENGINE WEB,3リッター直6FRのハッチバック、M135iは、絶対買う価値があるクルマです！　24歳の若きオーナーは只今、中古のコンパクトBMWでエンスー道修行中！！,10/12(土) 7:10
engine,ENGINE WEB,トヨタがF1で人材を育成　ガズー・レーシングがハースF1チームと協力関係を締結,10/12(土) 6:10
engine,ENGINE WEB,エンジン時計委員高木教雄、秋冬の腕時計のイチオシは？　ルイ・ヴィトン エスカル　小憎らしいほど、センスがいい！,10/11(金) 19:10
engine,ENGINE WEB,「中古になっても高くても自分のガレージに収めることができると信じてる by 西川淳」　総合20位はあのスポーツカー　自動車評論家44人が選んだ「2024年いま欲しいクルマのランキング！」,10/11(金) 7:10
engine,ENGINE WEB,価格はハイブリッド機構を持たない先代と同じ　PHEVになった新型BMW M5が日本上陸,10/11(金) 6:10
engine,ENGINE WEB,ロードゴーイング458の最も硬派なモデル、スペチアーレでテストドライブ800km！　これは有終の美を飾る1台だ！！【エンジン・アーカイブ「蔵出しシリーズ」】,10/10(木) 19:40
engine,ENGINE WEB,これ、購入予定です！　ホンダの軽商用EV、N-VAN e:にモータージャーナリストの国沢光宏が試乗　これから先、絶対注目のEV,10/10(木) 7:10
engine,ENGINE WEB,史上最高スペックのワゴン、アウディRS6アバントGT上陸　世界限定660台で、日本は10台のみ,10/10(木) 6:10
engine,ENGINE WEB,「正直限界があるのかさえ分からない」メルセデスAMG GT 63にモータージャーナリストの高平高輝が試乗　底が知れない不気味さがある！,10/9(水) 19:45
engine,ENGINE WEB,この時代にあえて1位に選んだスポーツカーがこれ！　モータージャーナリスト、河村康彦の「混沌とした時だからこそ、本当に自分で欲しいクルマを改めて考えた20台」のランキング,10/9(水) 7:10
engine,ENGINE WEB,アルファ・ロメオ・ジュリアとステルヴィオにイタリアン・テイストを盛り込んだ特別仕様車が登場,10/9(水) 6:10
engine,ENGINE WEB,これが内燃エンジン最後のゴルフか！？　モータージャーナリストの大谷達也が新しいゴルフにドイツで試乗　そのデキとは？,10/8(火) 18:10
engine,ENGINE WEB,ロードスターと並ぶ、世界一楽しめる後輪駆動車！　一部改良が行われたトヨタGR86とスバルBRZにモータージャーナリストの国沢光宏が試乗！,10/8(火) 7:30
engine,ENGINE WEB,気分はニュルブルクリンク　富士スピードウェイにレースも観戦できる常設キャンプ場が登場,10/8(火) 6:10
engine,ENGINE WEB,史上最高に美しいSUVがこれ！　モータージャーナリスト、岡崎五朗が選んだ「いま身銭を切ってでも欲しいクルマ20台」のランキング　5位はイギリスのあのクルマ,10/7(月) 7:10
engine,ENGINE WEB,日本一売れているホンダN-BOXに今流行のSUVテイストを盛り込んだN-BOXジョイがデビュー,10/7(月) 6:10
engine,ENGINE WEB,【速報！】価格は3億8000万円以上!? 　マクラーレンから、F1、P1の後継車となる1275馬力のアルティメット・スーパーカー、W1登場！　ただし、限定399台が既に売約済み,10/6(日) 21:10
engine,ENGINE WEB,理想はスポーツカーとSUVの2台持ち！　モータージャーナリスト、清水和夫が選んだ「いま身銭を切ってでも欲しいクルマ20台」のランキング　1位はドイツのあのクルマ,10/6(日) 7:10
engine,ENGINE WEB,ル・マン、スーパーGTなど日産のモータースポーツを支えたニスモが40周年　その歴史と戦績を紐解く,10/6(日) 6:10
engine,ENGINE WEB,0-100km／h加速2.5秒は歴代コルベット最速タイム！　シボレー・コルベット初のハイブリッド・モデル、イーレイにモータージャーナリストの佐野弘宗が試乗　目標は“世界一のGT”,10/5(土) 19:10
engine,ENGINE WEB,アメリカで内戦が勃発するというありそうな未来が恐ろしい　全米で大ヒットした映画『シビル・ウォー アメリカ最後の日』が描く不穏な未来予想図,10/5(土) 18:10
engine,ENGINE WEB,ヤフオク7万円のシトロエン・オーナー、エンジン編集部ウエダ、またしても緑の血の池地獄に！？　ラスボスの後に真のボスは登場するのか？,10/5(土) 7:10
engine,ENGINE WEB,後継ぎ不在のまま終わってしまうのか!?　8台限定となるBMW M8の最終限定車が登場,10/5(土) 6:10
engine,ENGINE WEB,この圧倒的な気持ちの良さはなんだ！　マクラーレン・アルトゥーラ・スパイダーにエンジン編集長のムラカミが試乗　ゆったりした時間が流れるスポーツカー！！,10/4(金) 19:10
engine,ENGINE WEB,まさに時計の絶景！　限定700本のグランドセイコー　「キャリバー9R 20周年記念限定モデル」のテーマは、秋の穂高連峰！！,10/4(金) 18:10
engine,ENGINE WEB,これが還暦オヤジのココロの叫びだ！　エンジン編集部員、シオザワが選んだ「自分が今ホントに欲しいと思ったクルマ20台」のランキング　1位はフランスのあのスポーツカー,10/4(金) 7:10
engine,ENGINE WEB,BMWのラグジュアリー・クーペ、8シリーズが終焉　その最後を飾る特別仕様車が登場,10/4(金) 6:10
engine,ENGINE WEB,これぞ完全無欠のフェラーリ　GTC4ルッソは、どんなスポーツカーだったのか？【エンジン・アーカイブ「蔵出しシリーズ」】,10/3(木) 19:10
engine,ENGINE WEB,武井壮さんとクルマ・トーク！　マセラティ目黒でエンジン・プレミアム・クラブの・スペシャル・イベントを開催！！,10/3(木) 7:20
engine,ENGINE WEB,12気筒の世界で頂点に立つスポーツカーはこれだ！　モータージャーナリスト、山崎元裕が「運動性能と背の低さで選んだクルマ20台」のランキング　1位はイタリアのあのクルマ,10/3(木) 7:10
engine,ENGINE WEB,ジムニー風のフロント・グリルでライバルを撃墜　新型スズキ・スペーシア・ギア登場,10/3(木) 6:10
engine,ENGINE WEB,閉じた姿もカッコいい！　メルセデス・ベンツの新しいクーペ、CLEカブリオレにモータージャーナリストの高平高輝が試乗！！,10/2(水) 19:10
engine,ENGINE WEB,【後篇／試乗動画付き】フェラーリ12チリンドリ国際試乗会速報　エンジン総編集長のムラカミがリポート　走りっぷりの凄さに、言葉が出ない！,10/2(水) 7:12
engine,ENGINE WEB,【試乗速報／動画付き】フェラーリ12チリンドリにエンジン総編集長のムラカミが試乗　世界で唯一残った自然吸気12気筒エンジンを積むスーパーFR,10/2(水) 7:11
engine,ENGINE WEB,メルセデス・ベンツCLEクーペに、30万円安く、しかも装備を充実させたお得な新グレードが登場,10/2(水) 6:10
engine,ENGINE WEB,【海外試乗記】新たなるボルボの旗艦、EX90にモータージャーナリストの大谷達也がロサンジェルスで試乗　実に魅力的なプレミアムSUV,10/1(火) 18:40
engine,ENGINE WEB,このスポーツカーには涙が出るほど感動した！　モータージャーナリスト、斎藤聡の「還暦のいま、身銭を切ってでも欲しいクルマ20台」のランキング　1位はドイツのあのクルマ,10/1(火) 7:10
engine,ENGINE WEB,FF＋布シート化で50万円お得なジープ・コマンダー・ロンジチュードが100台限定で登場,10/1(火) 6:10
engine,ENGINE WEB,日本のためにつくられたわずか10台だけのフェラーリ、J50　日本上陸50年を記念したスペシャル・モデルは、どんなフェラーリだったのか？【エンジン・アーカイブ「蔵出しシリーズ」】,9/30(月) 18:10
engine,ENGINE WEB,私はこのスポーツカーを都合3台乗り継いでいる！　エンジン編集部員、村山雄哉が選んだ「出会えて本当に良かったと思えるクルマ20台」のランキング　1位は日本のあのクルマ！！,9/30(月) 7:20
engine,ENGINE WEB,ライバルはメルセデスの大黒柱GLC　アウディQ5が新しい技術を満載して3代目に進化,9/30(月) 6:10
engine,ENGINE WEB,ポルシェ918スパイダーのニュル最速ラップの記録を塗りかえたスーパースポーツ！　ウラカン・ぺルフォルマンテは、どんなランボルギーニだったのか？【エンジン・アーカイブ「蔵出しシリーズ」】,9/29(日) 19:10
engine,ENGINE WEB,脳ミソも溶け出すものすごい高揚感！　フェラーリF12ベルリネッタはF1エンジンの音がした！【エンジン・アーカイブ「蔵出しシリーズ」】,9/29(日) 7:10
engine,ENGINE WEB,シルバーのV8エンジンを搭載　40台限定となるシボレー・コルベットの特別仕様車、シルバー・フレイム・シリーズが登場,9/29(日) 6:10
engine,ENGINE WEB,ヴァレンティノ・バルボーニというテスト・ドライバーを知っていますか？　限定250台の後輪駆動ランボ、ガヤルドLP550-2ヴァレンティノ・バルボーニは、どんなランボルギーニだったのか？,9/28(土) 18:10
engine,ENGINE WEB,生産終了、残るは在庫限り！　モータージャーナリスト、武田公実の「いま身銭を切ってでも欲しいクルマ20台」のランキング　1位はイタリアのあの小さいヤツ,9/28(土) 7:10
engine,ENGINE WEB,キャンプ場で映える!?　ジープ・ラングラー初のピンク色を設定した特別仕様車が登場,9/28(土) 6:10
engine,ENGINE WEB,実は、アシにお金のかかったホットハッチだった！　右ハンドルの6MTもあったミトは、どんなアルファ・ロメオだったのか？【エンジン・アーカイブ「蔵出しシリーズ」】,9/27(金) 19:10
engine,ENGINE WEB,1位のクルマ、買っちゃいました！　モータージャーナリスト、生方聡の「いま身銭を切ってでも欲しいクルマ20台」のランキング　1位はドイツのあのクルマ,9/27(金) 7:10
engine,ENGINE WEB,ボルボがEVモデルの車名をEXに統一　XC40リチャージのEV版がEX40に車名を変更,9/27(金) 6:10
engine,ENGINE WEB,窓を開け放ち、ストレート・シックスの快音を聞く！　BMWZ4ロードスター 　これは命芽吹くスポーツカーだ！！【エンジン・アーカイブ「蔵出しシリーズ」】,9/26(木) 19:40
engine,ENGINE WEB,家族持ちのクルマ好きが理想とするモデルがこれ！　エンジン編集部員、新井一樹が選んだ「宝くじ頼みだけど欲しいクルマ20台」のランキング　1位はドイツのあのクルマ！！,9/26(木) 7:40
engine,ENGINE WEB,プレミアム・ブランドに迫る完成度　SUV版ゴルフことフォルクスワーゲン・ティグアンがフルモデルチェンジ,9/26(木) 6:10
engine,ENGINE WEB,この夏の惨事のラスボス！　ヤフオク7万円のシトロエン・オーナー、エンジン編集部ウエダ、まさかのオーバーヒートか？【シトロエン・エグザンティア（1996年型）長期リポート#51】,9/25(水) 7:20
engine,ENGINE WEB,光る「VW」エンブレムがソソる　8.5世代に進化した新型フォルクスワーゲン・ゴルフが受注開始,9/25(水) 6:10
engine,ENGINE WEB,「ロード・カーのセットアップは、公道で時間をかけて決めるんだよ」997型911タルガの国際試乗会でエンジニアが発した一言にポルシェの凄さを見た！,9/24(火) 19:10
engine,ENGINE WEB,贅沢は敵、というより素敵！　BMW760iL（2008年）　6リッター、V12ツイン・ターボ搭載の旗艦は運転席がよかった！【エンジン・アーカイブ「蔵出しシリーズ」】,9/24(火) 7:30
engine,ENGINE WEB,ボディ・サイズはEクラス、5シリーズ級　ワゴン専用モデルになった新型VWパサートが受注を開始,9/24(火) 6:10
engine,ENGINE WEB,自然吸気4リッター・フラット6の吸い込まれるような吹け上がり感は圧巻！　991型911GT3RSにニュルのグランプリ・コースで試乗【エンジン・アーカイブ「蔵出しシリーズ」】,9/23(月) 19:10
engine,ENGINE WEB,これが21世紀最高の内燃エンジンを積んだスポーツカー！　モータージャーナリスト、渡辺敏史の「いま身銭を切ってでも欲しいクルマ20台」のランキング　1位はイタリアのあのスポーツカー,9/23(月) 7:40
engine,ENGINE WEB,アストン・マーティンF1がホンダに続き最高の戦力、エイドリアン・ニューウェイを獲得,9/23(月) 6:10
engine,ENGINE WEB,このアルファ・ロメオを世界遺産に認定したい！　ジュリアとステルヴィオ、２台の“クアドリフォリオ”に試乗　これが新車で買える最後のチャンスかも,9/22(日) 20:00
engine,ENGINE WEB,空冷時代を彷彿とさせる麻薬的な乗り味！　モータージャーナリスト、西川淳の「今この瞬間に欲しいと思うクルマ、ベスト20」のランキング　第2位はドイツのあのスポーツカー,9/22(日) 7:10
engine,ENGINE WEB,ホンダ・シビックに標準仕様以上タイプR未満のスポーティ・モデル「RS」が加わった,9/22(日) 6:10
engine,ENGINE WEB,中古車で狙うならこのアルファ　ジュリアに加わったヴェローチェの後輪駆動モデルは素晴らしいアルファ・ロメオだ！【エンジン・アーカイブ「蔵出しシリーズ」】,9/21(土) 19:50
engine,ENGINE WEB,本物を知る人が最後にたどり着くモデル！　モータージャーナリスト、山本シンヤの「いま身銭を切ってでも欲しいクルマ20台」のランキング　第3位はドイツのあのクルマ,9/21(土) 7:10
engine,ENGINE WEB,『ルパン三世』とフィアット500がコラボ　ルパン三世のモチーフを散りばめた特別仕様車が登場,9/21(土) 6:10
engine,ENGINE WEB,死ぬまで楽しめること間違いなし！　エンジン編集部員、村上政が選んだ「とにかく運転して楽しいクルマ20台」のランキング　2位はドイツのあのクルマ！！,9/20(金) 7:10
engine,ENGINE WEB,フィアット500eの兄貴分となる600eが日本上陸　まずはEVのみだが、追ってハイブリッドも登場予定,9/20(金) 6:10
engine,ENGINE WEB,これは欲しい！　ブリティッシュ・レーシンググリーンのタグ・ホイヤー モナコが登場　クルマ好きを虜にすること間違いなし！,9/19(木) 19:30
engine,ENGINE WEB,氷の上を滑っているような乗り味が凄い！　エンジン編集部員、荒井寿彦が選んだ「私の心を揺らしたクルマ20台」のランキング　1位はイギリスのあのクルマ！！,9/19(木) 7:40
engine,ENGINE WEB,【後篇】エミー賞18部門獲得の『SHOGUN 将軍』真田広之が語る「今から考えても無謀な人生最大のチャレンジでした」,9/19(木) 6:10
engine,ENGINE WEB,BMW M3の一部改良モデル上陸　出力アップしたエンジンと精悍なフロント・マスクで魅力アップ,9/19(木) 6:10
engine,ENGINE WEB,「日本の文化を世界に伝えるために」エミー賞18部門獲得の『SHOGUN 将軍』真田広之が語る【前篇】,9/19(木) 6:00
engine,ENGINE WEB,530万円はバーゲン価格だった！　159 のスポーティグレード、TIはどんなアルファ・ロメオだったのか？【エンジン・アーカイブ「蔵出しシリーズ」】,9/18(水) 21:10
