media_en,title_articles,link_articles,date_original
dime,「この人はデキる」と思わせる人の話し方,https://news.yahoo.co.jp/articles/44123913b9e5964cc70579c456307e9a21cd715d,10/22(日) 21:40
dime,内定をもらった社員が飲み会でメガトン級の大暴れ、「内定の取消し」を巡る裁判の行方はいかに!?,https://news.yahoo.co.jp/articles/f364c17b5339617e4068899b095c905174208ff6,10/22(日) 21:10
dime,VTuber運営企業「ANYCOLOR」と「カバー」「UUUM」なぜ収益力に差があるのか？,https://news.yahoo.co.jp/articles/b9481e179b92ab799d00def738fee570cc1dbcb0,10/22(日) 20:40
dime,女性に聞いた「男のプライド」の嫌いなところ、3位謝らない、2位意見を曲げない、1位は？,https://news.yahoo.co.jp/articles/70f1f3e5b2f08e0379d3e476380320cd1b1af904,10/22(日) 19:40
dime,高校生が考案！記憶を定着させてくれる不思議な付箋「エビングハウスフセン」,https://news.yahoo.co.jp/articles/6274ca22629297a364c9729dd7e7f53b27567c56,10/22(日) 9:10
dime,女性ライダーにもおすすめ！これから役立つ秋冬のライディングウエアと防寒グッズ9選,https://news.yahoo.co.jp/articles/0aa402ee3333bee48af22f5aabdaf4d55f31bc0a,10/21(土) 21:40
dime,9年という異例のスピードで完成したグローバルビジネスセンター「虎ノ門ヒルズ」の全貌,https://news.yahoo.co.jp/articles/84e4fd110f92ac02d0aa277ac1daf329610e7d78,10/21(土) 21:10
dime,メルセデス・ベンツが新型プレミアムSUV「GLE」「GLEクーペ」を発売、3列シート7人乗りを設定,https://news.yahoo.co.jp/articles/2a27aab75f8cb295eea6bf9d0edd3ac1cddf9511,10/21(土) 20:40
dime,F1の技術が余すことなく注ぎ込まれた！アストンマーティンのスーパーカー「Valhalla」,https://news.yahoo.co.jp/articles/efb65274ad27fe7ad29be43996f7107ed2f7e18a,10/21(土) 20:10
dime,人口の半数以上が老眼だった！老眼大国ニッポンで遠近両用レンズが進まない理由,https://news.yahoo.co.jp/articles/9bcfabfa04695befe01a091982163da91d29d509,10/21(土) 19:40
dime,1万円以下でコスパ抜群！装着感も音質も大満足のSOUNDPEATSのワイヤレスイヤホン「AIR3 DELUXE HS」,https://news.yahoo.co.jp/articles/f3e223d1bb66cb31440d5dce0ec72f576f1ae064,10/20(金) 21:40
dime,社名が変わるきっかけで多いのは？日本企業の「社名変更の歴史」を調べてみた,https://news.yahoo.co.jp/articles/9da4392d50bc5fc7b87ae77993169705b08b8168,10/20(金) 20:40
dime,イスラエルとハマスの衝突は金融市場にどう影響を与えるのか？,https://news.yahoo.co.jp/articles/54b2517ff12f2cd11bfc14177e1166e83e76b488,10/20(金) 18:40
dime,「不祥事を起こした芸能事務所のタレント」が出ている広告や広告主に対して悪い印象をもつ人はどれくらいいる？,https://news.yahoo.co.jp/articles/9e6127f3aba2d603a07cc860d31bed2e185708fb,10/19(木) 21:40
dime,制服に着替える時間はOKなのにラジオ体操はダメ？裁判事例に学ぶ「給料がもらえる時間」の条件,https://news.yahoo.co.jp/articles/4bec6955ef225e7a0d6178ba742f3f96a22cf402,10/19(木) 20:40
dime,始めるなら秋！花粉アレルキー対策「舌下免疫療法」のメリットとデメリット,https://news.yahoo.co.jp/articles/317fcebf7ce4e2543af798e0d627056d735818f4,10/19(木) 20:11
dime,ショート動画の流行で収益性が悪化したUUUMに復活の道筋はある？,https://news.yahoo.co.jp/articles/1314805aa89835ad7686fa9eee49a63cb2e58cfe,10/18(水) 21:40
dime,日本の金持ち企業ランキング、3位ファーストリテイリング、2位任天堂、1位は…知ってる？,https://news.yahoo.co.jp/articles/62b62ac7cb79f274e625d1df88861ff412adfe50,10/18(水) 21:11
dime,原因はミックス粉の中のタニ!?命に関わるアレルギー症状「ハンケーキ症候群」の怖さ,https://news.yahoo.co.jp/articles/72eb7912a436ed522ec9e2f53e5dd54e1f19b6a8,10/18(水) 20:11
dime,アニメを月1回以上見ている20〜30代の割合、日・米・韓で最も高い国は？,https://news.yahoo.co.jp/articles/4bd7a28f15d7358aa3250fc7271723d566184e64,10/17(火) 22:10
dime,スマートリングは定着するか？「EVERING」「Oura Ring」「TwooCa Ring」それぞれの特徴と違い,https://news.yahoo.co.jp/articles/909311bc80ab84ca140976369c12f27fe55d9a87,10/17(火) 21:10
dime,マイナンバーカードと運転免許証を一体化する計画はどうなったのか？,https://news.yahoo.co.jp/articles/ac3e18aca773d5afc36e4867d8aa8a4313f9f396,10/17(火) 20:10
dime,処理水放出問題で中国に進出している日本企業への影響は？,https://news.yahoo.co.jp/articles/a7f234cfca4a9d4ab544af799f5325e2f21789d0,10/16(月) 21:40
dime,スマートタッチディスプレイより高音質に驚いたJBLのハイエンドワイヤレスイヤホン「Tour Pro 2」の実力,https://news.yahoo.co.jp/articles/abb03116d6ffbb42b0e5485b303e1848a13cf93e,10/16(月) 21:10
dime,若手社員600人に聞いた、新卒入社後3年以内に離職しなかった理由,https://news.yahoo.co.jp/articles/5828de702772fcd0650bbe8dddcf895fc79ca23e,10/16(月) 20:10
