media_en,media_jp,title_articles,link_articles,date_original
bepal,BE-PAL.NET,トレッキングの服装として最低限必要なものは？季節に合わせたアイテムも紹介！,https://news.yahoo.co.jp/articles/0b9ec3dbe3f89c07bdf40ae68955d589645d0a0c,3/19(火) 8:03
bepal,BE-PAL.NET,日本でもっとも古い植物園「小石川植物園」の見どころをトレイルで体感【プロハイカー斉藤正史のTOKYO山頂ガイド】,https://news.yahoo.co.jp/articles/fcaf74696323317407caa10b63563b9b5872b944,3/18(月) 18:02
bepal,BE-PAL.NET,老舗ビルダー・ハイマー社の北欧テイストを取り入れたキャンピングトレーラーをじっくりチェック！,https://news.yahoo.co.jp/articles/882e9f1ddd085de61717af2b3d96d871eef1d075,3/18(月) 8:04
bepal,BE-PAL.NET,エル・エル・ビーン、マーモット、モス…北米の大人気ブランドの歴史を解説【L〜M編】,https://news.yahoo.co.jp/articles/d00d01702d6f076341e8faa2ca9027fd795c3241,3/17(日) 20:02
bepal,BE-PAL.NET,本体内に全パーツを収納可能！キャンプで使いやすい持ち運びできるピザ窯が登場,https://news.yahoo.co.jp/articles/d3e2b311f543b7500f929f47670f44b3cf55ee2b,3/17(日) 18:02
bepal,BE-PAL.NET,弘法山公園・吾妻山ハイキングコースを訪れたら…標高200メートル台でも大迫力だー！,https://news.yahoo.co.jp/articles/d9cba91ce0d76c6c1bc218416eafcd961347352c,3/17(日) 15:00
bepal,BE-PAL.NET,レトロな雰囲気がいいね！ホーローのミルクパンは寒い日のキャンプで大活躍,https://news.yahoo.co.jp/articles/e96e98e5041e88bbf3420c8a2c6f8e141b6238ee,3/17(日) 12:06
bepal,BE-PAL.NET,ダナー、エディー・バウアー、グレゴリー…アウトドア大国・北米17ブランドの歴史＆人気アイテムを紹介！【D〜K編】,https://news.yahoo.co.jp/articles/c780091e4fc336d6dc6eebf79c4826e90ba01363,3/17(日) 8:05
bepal,BE-PAL.NET,軽キャンでも向き合ってくつろげる！岡モータース「ミニチュアクルーズ」は装備も充実で超快適,https://news.yahoo.co.jp/articles/2888fd5692b85283428d81a061bfdd77c7a5ef55,3/16(土) 20:02
bepal,BE-PAL.NET,軽トラベースの超本格キャブコンがRVランドから登場！ 家族4人旅もできるのだ,https://news.yahoo.co.jp/articles/106f05ceb676562316b166df74123aeecefa2307,3/16(土) 18:02
bepal,BE-PAL.NET,KEEN「UNEEK」が10周年！ベストセラーも納得のオールシーズン履きたくなる魅力と新作を紹介,https://news.yahoo.co.jp/articles/e54bd3911dc1554a7236c4834b95927d0c05710f,3/16(土) 15:01
bepal,BE-PAL.NET,ポルトガル「ナザレ」にやってくる世界屈指の大うねりは、いつ見られる？,https://news.yahoo.co.jp/articles/53e93c454aa42cfbaabbf9f5fdff1c4201c57308,3/16(土) 12:04
bepal,BE-PAL.NET,ミステリーランチ創業者に直撃！ブランドの歴史と「世界最高のバックパック」誕生秘話,https://news.yahoo.co.jp/articles/67011f8d85aa817f16f543fa53ea5b013b63d51c,3/16(土) 8:05
bepal,BE-PAL.NET,丹沢の大山登山には関東平野が一望できる絶景ポイントが！片道90分で登れる初心者コースも,https://news.yahoo.co.jp/articles/5a925a5055e296da71a3a11ef1a6de492305a3ab,3/15(金) 18:03
bepal,BE-PAL.NET,広葉樹の森とともに生きたい！ 埼玉出身の私が福島県南会津町に移住したワケ,https://news.yahoo.co.jp/articles/8eb23bcdc12a504401f823982b6766a4df8de1dd,3/15(金) 8:04
bepal,BE-PAL.NET,ロゴスのこれで気軽に薫製おつまみ完成！「LOGOSの森林 ちょっとスモークするリッド」,https://news.yahoo.co.jp/articles/64c385ac11a8bb92f1ce0f5a0f0c845afb317004,3/14(木) 18:04
bepal,BE-PAL.NET,ベランピングとは？キャンプ初心者でも楽しめる方法と周囲に迷惑をかけない注意点！,https://news.yahoo.co.jp/articles/a9dd5865cd4367c9b0b7d56406b773caf9936a0d,3/14(木) 8:03
bepal,BE-PAL.NET,GORIXの自転車用フロントバッグはスマホやペットボトルをスマートに収納できる！,https://news.yahoo.co.jp/articles/a286350dbbe6e6cb5bb2a135c1f89d6de4e53bd1,3/13(水) 18:03
bepal,BE-PAL.NET,バナナ＆チョコレート簡単スイーツレシピ3選！子供にもできてキャンプでも楽しめる,https://news.yahoo.co.jp/articles/7d82139eab6ff20a1d8e6bda3b4800b212087197,3/13(水) 8:01
bepal,BE-PAL.NET,マウンテンバイクとロードバイクの違いって何？クロスバイクとの違いもチェック,https://news.yahoo.co.jp/articles/da9ed78850b6137c94ed816bcbbcf7609aa7a54a,3/12(火) 18:03
