media_en,media_jp,title_articles,date_original
nrin,NRI研究員の時事解説,国民民主党・経済政策の財源問題①：減税は財政赤字を削減させる？,11/5(火) 6:02
nrin,NRI研究員の時事解説,米国10月雇用統計は予想比下振れるも評価は難しく：FRBの緩やかな利下げ観測が継続,11/5(火) 6:00
nrin,NRI研究員の時事解説,IMFによる2024年10月のGFSR－日本にとっての意味合い,11/4(月) 19:59
nrin,NRI研究員の時事解説,植田総裁の記者会見からの示唆－正常化戦略の防衛,11/1(金) 15:06
nrin,NRI研究員の時事解説,米大統領選挙の世論調査の精度が改めて問われる,11/1(金) 6:03
nrin,NRI研究員の時事解説,日銀総裁記者会見：『時間的余裕はある』との表現を今後は使わない,10/31(木) 18:09
nrin,NRI研究員の時事解説,日銀は予想通りに追加利上げ見送り：日米政治情勢と為替に翻弄される金融政策,10/31(木) 13:02
nrin,NRI研究員の時事解説,ハリケーンでかく乱される米経済指標：FOMCや大統領選挙にも影響,10/31(木) 6:03
nrin,NRI研究員の時事解説,国民民主党の減税策（103万円の壁対策）を与党は修正のうえ受け入れるか,10/30(水) 16:00
nrin,NRI研究員の時事解説,"国民民主党の基礎控除等拡大策（年収の壁対策）：1,030億円程度の減税規模で217億円程度の景気浮揚効果か",10/30(水) 6:02
nrin,NRI研究員の時事解説,トランプ・リスクを再点検：追加関税は戦後の自由貿易体制を崩し、世界大恐慌以来の保護主義蔓延のリスクも,10/30(水) 6:00
nrin,NRI研究員の時事解説,与党との連携が視野に入る国民民主党の経済政策を再度確認：与党は基礎控除引き上げ、トリガー条項凍結解除を受け入れるか？,10/29(火) 15:33
nrin,NRI研究員の時事解説,「時間的な余裕はある」という表現は日銀の新たな市場との対話手段か,10/29(火) 6:02
nrin,NRI研究員の時事解説,衆院選大敗も石破首相は続投の意向：選挙後DAY1（初日）の金融市場は予想外の円安・株高に,10/28(月) 15:11
nrin,NRI研究員の時事解説,衆院与党過半数割れで政治の混迷が強まる：金融市場は不安定化：財政拡張傾向が強まり、日銀追加利上げは後ずれか,10/28(月) 7:50
nrin,NRI研究員の時事解説,為替介入か非伝統的政策か－SNBの選択,10/27(日) 19:27
nrin,NRI研究員の時事解説,衆院選挙の行方と金融市場・金融政策：日銀は日米の選挙結果と為替に翻弄される,10/25(金) 16:28
nrin,NRI研究員の時事解説,トランプに騙されるな：ダドリーNY連銀前総裁の警鐘,10/25(金) 6:03
nrin,NRI研究員の時事解説,米大統領選挙戦でハリス氏に失速感,10/24(木) 6:46
nrin,NRI研究員の時事解説,トランプ再選で関税引き上げの応酬が起こると、世界GDPの6％相当の貿易が減少（IMF世界経済見通し）,10/23(水) 12:47
nrin,NRI研究員の時事解説,衆院選と日銀金融政策：立憲民主党の0％超の物価目標,10/23(水) 6:02
nrin,NRI研究員の時事解説,各党が掲げる経済対策の効果：消費税率2％引き下げでGDPは0.4％押し上げられる計算だが。。。,10/22(火) 13:44
nrin,NRI研究員の時事解説,衆院選挙で各党が掲げる最低賃金引き上げ目標の問題点,10/22(火) 6:03
nrin,NRI研究員の時事解説,大規模経済対策に大義はあるか：中長期財政見通しや財政健全化目標への影響についても国民に説明すべき,10/21(月) 6:02
nrin,NRI研究員の時事解説,物価高対策で下振れた9月全国CPI：基調的物価上昇率は2％割れ。日銀の政策は為替の影響を強く受ける,10/18(金) 15:10
nrin,NRI研究員の時事解説,ECBが連続利下げを実施：想定以上のインフレ率の低下と景気下振れへの警戒,10/18(金) 13:00
nrin,NRI研究員の時事解説,ECBのラガルド総裁の記者会見－Magic language,10/18(金) 8:39
nrin,NRI研究員の時事解説,衆院選挙の結果と金融市場の反応,10/17(木) 17:48
nrin,NRI研究員の時事解説,米大統領選の行方と財政・金融市場への影響：トランプ勝利でスタグフレーションのリスクが高まる,10/17(木) 6:03
nrin,NRI研究員の時事解説,米国大統領で争点となる移民急増の光と影,10/16(水) 6:02
nrin,NRI研究員の時事解説,衆院選での各党経済政策比較：日本経済の将来像と中長期的な改革・戦略の具体策を国民に,10/15(火) 12:29
nrin,NRI研究員の時事解説,衆院選公示：自民党の選挙公約と問われる石破カラー,10/15(火) 6:02
nrin,NRI研究員の時事解説,変化率としての物価と金利,10/14(月) 20:13
nrin,NRI研究員の時事解説,11月に0.25％の利下げが現時点でのコンセンサスに（9月米CPI）：大統領選挙とFOMC直前に発表される10月雇用統計への注目度が高まる,10/11(金) 9:22
nrin,NRI研究員の時事解説,ECBの9月理事会のAccounts－Concerns for growth,10/11(金) 8:36
nrin,NRI研究員の時事解説,トランプ氏とマスク氏の距離感,10/11(金) 6:03
nrin,NRI研究員の時事解説,9月FOMCのMinutes－Better alignment,10/10(木) 8:01
nrin,NRI研究員の時事解説,米ハリケーンへの対応を巡る民主・共和の情報戦とハリス氏のメディア戦略,10/10(木) 6:01
nrin,NRI研究員の時事解説,石破首相の言動の変化が問われた党首討論：議論は政治資金問題に集中,10/9(水) 15:58
nrin,NRI研究員の時事解説,ハリス氏は反企業的か親企業的か,10/9(水) 6:02
nrin,NRI研究員の時事解説,実質賃金は再び低下（8月毎月勤労統計）：実質賃金のプラスとデフレ脱却,10/8(火) 9:47
nrin,NRI研究員の時事解説,石破政権はアベノミクスをどう評価したか（衆院代表質問）,10/8(火) 8:17
nrin,NRI研究員の時事解説,9月米雇用統計上振れで0.5％利下げ観測が後退：1ドル149円の円安で石破政権の日銀金融政策についての発言に変化が生じるか,10/7(月) 6:01
nrin,NRI研究員の時事解説,石破首相の所信表明演説：デフレ脱却最優先と金融政策,10/4(金) 15:01
nrin,NRI研究員の時事解説,ハリケーン『へリーン』は米大統領選挙の『オクトーバー・サプライズ』になるか,10/4(金) 11:36
nrin,NRI研究員の時事解説,石破首相が所信表明へ：岸田路線の継承が鮮明に：日銀利上げへの慎重発言と円安の影響,10/3(木) 14:03
nrin,NRI研究員の時事解説,石破首相と植田日銀総裁の初会談,10/3(木) 6:02
nrin,NRI研究員の時事解説,イランがイスラエルに報復攻撃：報復の応酬にエスカレートするか,10/3(木) 6:00
nrin,NRI研究員の時事解説,赤沢・新経済再生担当相が日銀の利上げに慎重姿勢,10/2(水) 6:02
nrin,NRI研究員の時事解説,米大統領選前にオクトーバー・サプライズはあるか？：イスラエルのレバノン地上作戦など地政学リスクにも注意,10/2(水) 6:01
nrin,NRI研究員の時事解説,人手不足が強まる中でも円高が物価を抑制（9月短観）：日銀の追加利上げへの慎重姿勢を後押しか,10/1(火) 11:45
nrin,NRI研究員の時事解説,週明け後の『石破ショック』の余波と早期の解散総選挙,9/30(月) 10:34
nrin,NRI研究員の時事解説,石破新政権の人事案：刷新感よりも安定感重視か：経済政策は岸田路線継承とアベノミクス脱却のパッケージ,9/30(月) 10:09
nrin,NRI研究員の時事解説,金融市場の「石破ショック」は一時的：石破新総裁は経済政策で岸田路線継承を表明,9/30(月) 6:00
nrin,NRI研究員の時事解説,自民党新総裁に石破氏が選出：地方創生を中核に据えた成長戦略の推進に期待：財政・金融政策の正常化も後押しか,9/27(金) 18:05
nrin,NRI研究員の時事解説,物価高対策で下振れる9月東京都区部CPI：基調的物価上昇率は2％割れが続く：追加利上げの後ずれ要因に,9/27(金) 11:39
nrin,NRI研究員の時事解説,ハリス氏が追加の経済政策を発表：中国に勝つための先端産業支援,9/27(金) 6:02
nrin,NRI研究員の時事解説,自民党総裁選での経済政策論争⑧：賃上げ,9/27(金) 6:02
nrin,NRI研究員の時事解説,9月短観の見通し：日銀は円高の経済・物価への影響を注視：追加利上げへの慎重姿勢が強まる可能性も,9/26(木) 6:02
nrin,NRI研究員の時事解説,自民党総裁選での経済政策論争⑦：規制改革,9/26(木) 6:02
nrin,NRI研究員の時事解説,自民党総裁選での経済政策論争⑥：労働市場改革,9/26(木) 6:00
nrin,NRI研究員の時事解説,自民党総裁選での経済政策論争③：物価高対策,9/25(水) 6:03
nrin,NRI研究員の時事解説,自民党総裁選での経済政策論争④：増税策と減税策,9/25(水) 6:03
nrin,NRI研究員の時事解説,自民党総裁選での経済政策論争⑤：社会保障制度改革,9/25(水) 6:03
nrin,NRI研究員の時事解説,自民党総裁選での経済政策論争①：地域経済活性化・東京一極集中是正,9/24(火) 6:03
nrin,NRI研究員の時事解説,自民党総裁選での経済政策論争②：貯蓄から投資へ,9/24(火) 6:03
nrin,NRI研究員の時事解説,野田元首相が立憲民主党新代表に選出：総裁選後の自民党との対立軸は経済政策よりも政治改革か,9/24(火) 6:03
nrin,NRI研究員の時事解説,植田総裁の記者会見からの示唆－利上げのロジック,9/23(月) 19:31
nrin,NRI研究員の時事解説,年内追加利上げの可能性は後退か（日銀総裁記者会見）：国内経済・物価はオントラックも米国経済の行方などを慎重に見極める時間が必要に,9/20(金) 18:07
nrin,NRI研究員の時事解説,日銀追加利上げのペースは鈍化か（日銀金融政策決定会合）：米国の動向次第で追加利上げは後ずれ：首相交代の影響も,9/20(金) 13:33
nrin,NRI研究員の時事解説,全国8月コアCPIは4か月連続で上昇も事前予想通り：今後の金融政策を占う観点からも注目される円安修正の物価への影響,9/20(金) 10:53
nrin,NRI研究員の時事解説,FRBのパウエル議長の記者会見－Recalibration,9/19(木) 9:00
nrin,NRI研究員の時事解説,FRBが0.5％の大幅利下げで労働市場の悪化に先手を打つ：大幅利下げは米大統領選挙に影響も,9/19(木) 7:17
nrin,NRI研究員の時事解説,高齢者の働く意欲を削ぐ在職老齢年金の見直し検討：自民党総裁選でも社会保障制度改革の議論を深めよ,9/18(水) 6:03
nrin,NRI研究員の時事解説,一時1ドル139円50銭台まで円高が進む：米国の大幅利下げ観測は行き過ぎか？,9/17(火) 8:07
nrin,NRI研究員の時事解説,自民党総裁選討論会：経済政策の具体的な議論は深まらず：高市氏は日銀の利上げに明確に反対,9/17(火) 6:02
nrin,NRI研究員の時事解説,"ECBのラガルド総裁の記者会見－Que ser, ser",9/13(金) 8:58
nrin,NRI研究員の時事解説,ECBは予想通りに0.25％の利下げを実施：10月の連続利下げ観測は後退,9/13(金) 8:26
nrin,NRI研究員の時事解説,自民党総裁選告示：新政権には日本経済の潜在力向上に資する経済政策の推進を,9/12(木) 14:58
nrin,NRI研究員の時事解説,米国8月コアCPIは予想を上回る：FRBは9月FOMCで0.25％の利下げの観測強まる,9/12(木) 8:45
nrin,NRI研究員の時事解説,米大統領選TV討論会：ハリス氏は予想よりも健闘か,9/11(水) 15:49
nrin,NRI研究員の時事解説,『資産運用立国実現プラン』は岸田政権が残した成果：金融所得課税強化は慎重な議論を,9/11(水) 6:02
nrin,NRI研究員の時事解説,立憲民主党代表選で4候補が論戦,9/10(火) 6:03
nrin,NRI研究員の時事解説,高市氏が自民党総裁選に立候補を表明：戦略的な財政出動を掲げ、日銀利上げに慎重な姿勢,9/9(月) 16:53
nrin,NRI研究員の時事解説,自民党総裁選：『小石河』有力3候補の経済政策,9/9(月) 6:01
nrin,NRI研究員の時事解説,9月の利下げ幅で見方が分かれる（米国8月雇用統計）：米国景気減速・円高で日銀利上げは後ずれも,9/9(月) 6:00
nrin,NRI研究員の時事解説,米大統領選挙でマイノリティからの支持獲得に課題を残すハリス陣営,9/6(金) 14:08
nrin,NRI研究員の時事解説,日本製鉄のUSスチール買収をバイデン大統領が正式に阻止へ,9/5(木) 14:54
nrin,NRI研究員の時事解説,実質賃金が2か月連続でプラス：総裁選でのデフレ脱却宣言の議論にも影響,9/5(木) 11:37
nrin,NRI研究員の時事解説,次期政権に引き継がれる防衛増税：議論は迷走を続けるか,9/5(木) 6:03
nrin,NRI研究員の時事解説,今後の中国の財税制改革について,9/4(水) 11:15
nrin,NRI研究員の時事解説,再燃した日本株の大幅下落,9/4(水) 11:13
nrin,NRI研究員の時事解説,次期政権に期待される『地方経済活性化』と『大都市一極集中の是正』：インバウンド需要を起爆剤に,9/4(水) 6:06
nrin,NRI研究員の時事解説,規制改革と自民党総裁選：ライドシェア全面解禁が試金石に：小泉政権以来の規制改革の大きな流れを作れるか,9/3(火) 6:03
nrin,NRI研究員の時事解説,膨張を続ける予算規模（2025年度予算概算要求）：自民党総裁選で財政健全化を争点に,9/2(月) 6:01
nrin,NRI研究員の時事解説,事前予想を上回った8月分東京都区部CPI：コメ価格高騰の影響も：日銀の追加利上げを後押しするか？,8/30(金) 11:20
nrin,NRI研究員の時事解説,自民党総裁選ではアベノミクスの功罪の評価を,8/30(金) 6:01
nrin,NRI研究員の時事解説,氷見野副総裁講演：追加利上げ方針の再確認と不安定な金融市場への配慮：タカ派的な側面も,8/29(木) 6:00
nrin,NRI研究員の時事解説,課題となる深刻なオーバーツーリズムへの対応,8/28(水) 6:02
nrin,NRI研究員の時事解説,トランプ大幅追加関税の実現可能性とその衝撃,8/27(火) 6:58
nrin,NRI研究員の時事解説,中国の最近の住宅在庫の処理策について,8/26(月) 9:19
nrin,NRI研究員の時事解説,雇用の悪化阻止に軸足を移したFRB：「政策を調整する時が来た」（ジャクソンホール）,8/26(月) 6:02
nrin,NRI研究員の時事解説,国会の閉会中審査における植田総裁の発言,8/25(日) 19:19
nrin,NRI研究員の時事解説,ハリス米大統領候補の指名受諾演説：自身の出自・経歴と重ねて物価押し下げ、中間層支援、人権問題への対応をアピール：ハリス政権成立は日本経済・企業にはプラスか,8/23(金) 15:37
nrin,NRI研究員の時事解説,日銀植田総裁は追加利上げの方針を変えず：副総裁との意見の違いには直接言及せず（国会閉会中審査・衆院）,8/23(金) 13:15
nrin,NRI研究員の時事解説,予想通りとなった7月全国CPI：基調的な物価上昇率、サービス価格上昇率の下振れで、日銀は早期追加利上げに慎重か,8/23(金) 9:37
nrin,NRI研究員の時事解説,米大統領選の勝敗を左右するラストベルト3州は米国全体の縮図：支持率でハリス氏がやや有利な情勢,8/22(木) 6:00
nrin,NRI研究員の時事解説,米民主党が党大会で党政策綱領を発表：ハリス氏の独自案は盛り込まれず,8/21(水) 14:38
nrin,NRI研究員の時事解説,インフレ対策が米大統領選を大きく左右するか,8/20(火) 6:02
nrin,NRI研究員の時事解説,ハリス氏が経済政策を発表：物価の安定と中間層支援をターゲットに,8/19(月) 6:01
nrin,NRI研究員の時事解説,米国7月小売売上高の上振れで円安株高の巻き戻しが進む：金融市場は依然不安定で、行き過ぎた円安株高の調整という基本構図は継続か,8/16(金) 10:22
nrin,NRI研究員の時事解説,米大統領選でトランプ敗北時に再び生じる混乱のリスク：勝っても負けてもトランプリスク,8/16(金) 6:01
nrin,NRI研究員の時事解説,4－6月期GDPは予想を上回るも個人消費の低迷はなお続く：円高・株安の影響、南海トラフ地震への警戒の影響、先行きの政治・政策の不確実性の影響にも注目,8/15(木) 11:44
nrin,NRI研究員の時事解説,米7月CPIは物価上昇率の着実な低下傾向を裏付ける：FRBは9月に0.25％利下げか,8/15(木) 6:26
nrin,NRI研究員の時事解説,自民党総裁選候補者の顔ぶれと経済政策姿勢,8/14(水) 17:11
nrin,NRI研究員の時事解説,岸田首相が総裁選に不出馬：岸田政権の経済政策の評価と次期政権の課題,8/14(水) 15:18
nrin,NRI研究員の時事解説,トランプ氏は金融政策への発言権を主張：トランプ再選でFRBの独立性が脅かされドル安進行のリスク,8/14(水) 8:15
nrin,NRI研究員の時事解説,"南海トラフ地震への警戒が経済に悪影響：旅行関連消費は1,964億円程度減少も",8/13(火) 8:35
nrin,NRI研究員の時事解説,ハリス氏は民主党副大統領候補にミネソタ州ワルツ知事を指名：ラストベルトの白人労働者層の取り込みを狙う,8/9(金) 6:02
nrin,NRI研究員の時事解説,中国の金融政策運営・金融調節を巡る最近の動き,8/8(木) 16:15
nrin,NRI研究員の時事解説,不安定な動きを続ける東京市場と日銀金融政策（主な意見）：追加利上げは早すぎたのか？遅すぎたのか？,8/8(木) 10:40
nrin,NRI研究員の時事解説,4－6月期国内GDP統計発表へ：個人消費は5四半期ぶりに回復も低迷は続く：金融市場動揺の影響に注目,8/8(木) 6:03
nrin,NRI研究員の時事解説,副総裁講演テキストで一転して円安・株高も効果は一時的か：安定性を欠く日本銀行の情報発信に課題,8/7(水) 11:58
nrin,NRI研究員の時事解説,動揺が続く東京株式市場：日本に政策対応の余地がないことが市場の不安を増幅,8/7(水) 9:31
nrin,NRI研究員の時事解説,ハリス氏のリベラル色（左派色）が米大統領選挙戦の強みにも弱みにもなる,8/7(水) 6:03
nrin,NRI研究員の時事解説,実質賃金は27か月ぶりのプラスもプラス定着は9月以降：日銀は円高・株安の賃金・物価への影響を見定める必要,8/6(火) 10:49
nrin,NRI研究員の時事解説,急速な円高・株安の連鎖はいったん落ち着きを取り戻すも不安定な動きは当分続く：米国経済が失速を免れるかが安定回復の鍵,8/6(火) 8:56
nrin,NRI研究員の時事解説,中東地域の地政学リスクが一段と強まる：イランのイスラエル報復攻撃が近づく,8/6(火) 6:03
nrin,NRI研究員の時事解説,日本株は過去最大の下落幅もグローバル金融危機の再来ではない,8/5(月) 16:47
nrin,NRI研究員の時事解説,週明けの東京市場はパニック状態に陥る：株式、債券の取引が一時停止に,8/5(月) 10:20
nrin,NRI研究員の時事解説,円高・株安傾向を増幅する米国景気減速懸念（7月米雇用統計）：R-word（リセッション）が意識され始める,8/5(月) 6:02
nrin,NRI研究員の時事解説,"日経平均は寄り付き直後1,900円安の暴落：米株はスイートスポットの局面を終える",8/2(金) 10:20
nrin,NRI研究員の時事解説,日銀の金融緩和が生んだ円安・株高バブルは崩壊に向かうか：緩やかな円安修正は日本経済にプラス,8/2(金) 6:02
nrin,NRI研究員の時事解説,日米金融政策が逆方向に動くなか歴史的円安は終焉へ：FRBは9月の利下げを示唆,8/1(木) 10:22
nrin,NRI研究員の時事解説,日銀総裁記者会見：円安が追加利上げの主役だったか,7/31(水) 17:38
nrin,NRI研究員の時事解説,日銀が追加利上げと国債買い入れ減額計画を同時決定：円安けん制を意識した決定に,7/31(水) 14:43
nrin,NRI研究員の時事解説,日銀が追加利上げ実施か：利上げは続くが2％物価目標達成は難しい,7/31(水) 9:37
nrin,NRI研究員の時事解説,ビットコインに新たな援軍か：トランプ氏が暗号資産支援を選挙公約に掲げる,7/30(火) 6:03
nrin,NRI研究員の時事解説,基礎的財政収支（PB）の2025年度黒字化は本当か,7/29(月) 12:49
nrin,NRI研究員の時事解説,外交分野でバイデンとの違いを打ち出すハリス米副大統領,7/29(月) 6:02
nrin,NRI研究員の時事解説,東京都区部7月CPIで基調的な物価上昇率は低下を続ける：日銀の2％物価目標達成は見えない,7/26(金) 12:08
nrin,NRI研究員の時事解説,大統領候補指名を確実にしたハリス氏の強みと弱み：過去の言動からハリス氏の経済政策を占う,7/25(木) 16:29
nrin,NRI研究員の時事解説,イーサ現物ETFの上場と変化を迫られる米国の暗号資産規制,7/25(木) 11:35
nrin,NRI研究員の時事解説,日銀追加利上げ観測で進む円高と円高に連動した株価の急落,7/25(木) 10:36
nrin,NRI研究員の時事解説,日米金融政策に政治はどう影響するか,7/25(木) 6:02
nrin,NRI研究員の時事解説,ハリス副大統領が予想外に早く大統領候補者指名を固める,7/24(水) 6:02
nrin,NRI研究員の時事解説,米大統領選挙戦で4つの裁判の逆風を撥ねつけるトランプ,7/23(火) 6:03
nrin,NRI研究員の時事解説,バイデン大統領が大統領選挙戦からの撤退を発表：民主党の苦境は続く,7/22(月) 8:47
nrin,NRI研究員の時事解説,日銀国債買い入れ減額の具体策を展望する,7/22(月) 6:01
nrin,NRI研究員の時事解説,トランプ氏は受諾演説で国民に結束と融和を呼びかけた：バイデン大統領の選挙戦離脱観測が強まる,7/19(金) 16:17
nrin,NRI研究員の時事解説,6月全国消費者物価はやや上振れ：円安阻止を重視する当面の金融政策姿勢,7/19(金) 10:55
nrin,NRI研究員の時事解説,トランプ再選は米国経済・金融市場が抱える問題を増幅：ドル高・円安が緩やかに修正されるのであれば日本経済にプラスだが。。。,7/18(木) 6:02
nrin,NRI研究員の時事解説,トランプ色が強いバンス氏が共和党副大統領候補に：外交政策ではトランプ以上に過激か,7/17(水) 6:02
nrin,NRI研究員の時事解説,連日の為替介入観測、米国利下げ観測で歴史的円安の終わりが見えてきたか,7/16(火) 6:00
nrin,NRI研究員の時事解説,米国6月CPIの下振れで金融市場はFRBの9月利下げをほぼ確信：日本政府は円押し上げ介入を実施,7/12(金) 8:21
nrin,NRI研究員の時事解説,トランプ色の強い共和党綱領案：米国大統領選挙戦を静観する金融市場の真意は,7/11(木) 11:26
nrin,NRI研究員の時事解説,中国人民銀行が国債売却へ：中国版シリコンバレーバンク破綻も警戒か,7/11(木) 6:02
nrin,NRI研究員の時事解説,利下げ時期についての明確なシグナルを避けたFRBパウエル議長の議会証言,7/10(水) 10:55
nrin,NRI研究員の時事解説,ビットコインが4か月ぶりの安値：マウントゴックスの弁済と米大統領選挙の不確実性が影響,7/10(水) 6:03
nrin,NRI研究員の時事解説,株式市場はスイートスポットに：消費低迷下で進む株高の持続性は。。。,7/9(火) 15:52
nrin,NRI研究員の時事解説,日銀が2014年上期の金融政策決定議事録を公表へ：円安等による一時的な物価上昇を政策効果によるものと誤解。10年後にも同じ過ちを繰り返さないか,7/9(火) 11:00
nrin,NRI研究員の時事解説,日銀支店長会議：賃金上昇に広がりは見られるが物価の先行きはなお不確実,7/8(月) 16:35
nrin,NRI研究員の時事解説,東京都知事選での小池氏3選と国政への影響,7/8(月) 11:29
nrin,NRI研究員の時事解説,9月にも実質賃金プラスへ（5月毎月勤労統計）：それでも個人消費の回復は遠い,7/8(月) 10:20
nrin,NRI研究員の時事解説,6月米雇用統計で9月利下げ観測強まる：円安歯止め効果に期待,7/8(月) 6:00
nrin,NRI研究員の時事解説,英国選挙で労働党が圧勝：極右政党の大幅台頭を防ぎ国際協調路線に軌道修正,7/5(金) 16:41
nrin,NRI研究員の時事解説,金融市場はトランプ再選をどう織り込むか：トランプトレードの再来も,7/5(金) 6:02
nrin,NRI研究員の時事解説,バイデン政権が抱えるロシア・イラン制裁とエネルギー価格安定のジレンマ,7/4(木) 6:02
nrin,NRI研究員の時事解説,財政検証の結果発表：政府は年金保険料納付の5年間延長案を撤回,7/3(水) 18:23
nrin,NRI研究員の時事解説,ノーベル賞受賞の経済学者16人がトランプ再選に警鐘,7/3(水) 6:01
