media_en,media_jp,title_articles,date_original
nrin,NRI研究員の時事解説,バイデン、大統領選離脱のプランB,7/2(火) 6:02
nrin,NRI研究員の時事解説,フランス下院選挙：極右政党の「財源なき歳出拡大」への懸念,7/1(月) 11:56
nrin,NRI研究員の時事解説,インバウンド需要の鈍化と円安・物価高の個人消費打撃で非製造業の景況感が17四半期ぶりに悪化（日銀短観・6月調査）：7月金融政策決定会合の展望,7/1(月) 10:55
nrin,NRI研究員の時事解説,物価上昇率鈍化でFRBの年内利下げ観測強まる：利下げ確信すればドル高円安の流れに歯止め,7/1(月) 6:01
nrin,NRI研究員の時事解説,米大統領TV討論会で明確な勝者はいなかったか：討論中にドル円は一時161円台,6/28(金) 14:22
nrin,NRI研究員の時事解説,6月東京都区部消費者物価はやや上振れ：円安阻止に重きを置いた当面の金融政策,6/28(金) 10:06
nrin,NRI研究員の時事解説,中国との差が際立つインド株の強さ：インド投資にも政治リスク,6/27(木) 8:15
nrin,NRI研究員の時事解説,日銀短観6月調査の見通しと7月金融政策決定会合の展望,6/26(水) 6:03
nrin,NRI研究員の時事解説,ロシアと北朝鮮が「包括的戦略パートナーシップ条約」締結：インド太平洋地域の安全保障環境の悪化に,6/25(火) 6:00
nrin,NRI研究員の時事解説,為替は1ドル160円目前に：円安への警戒を強める日銀（日銀主な意見）,6/24(月) 11:35
nrin,NRI研究員の時事解説,2段構えの経済対策：岸田首相記者会見,6/24(月) 7:45
nrin,NRI研究員の時事解説,政府は廃止した電気・ガス補助金を8月に一時復活か,6/21(金) 16:56
nrin,NRI研究員の時事解説,円安下でも基調的な物価上昇率の低下傾向が続く（5月CPI統計）：2％の物価目標達成は難しい,6/21(金) 10:19
nrin,NRI研究員の時事解説,財務省は国債発行の年限を短期化へ：日銀の国債買い入れ減額と足並みを揃える,6/20(木) 6:03
nrin,NRI研究員の時事解説,3年ぶりの党首討論開催：野党党首らの解散・総選挙、内閣総辞職要求を岸田首相は拒否,6/19(水) 17:18
nrin,NRI研究員の時事解説,改正政治資金規正法が成立,6/19(水) 14:18
nrin,NRI研究員の時事解説,政府の財政健全化目標と日銀の国債買い入れ減額：政府・国会は日銀頼みの財政運営からの脱却を,6/19(水) 6:03
nrin,NRI研究員の時事解説,フランス総選挙の危険な賭けにフランス国債市場が動揺：欧州債務危機と似た構図に,6/18(火) 6:02
nrin,NRI研究員の時事解説,骨太方針では労働市場改革が注目点の一つ：労働生産性向上を通じた持続的な実質賃金の上昇が重要,6/17(月) 6:01
nrin,NRI研究員の時事解説,日銀総裁記者会見：円安リスクに配慮した慎重な発言に,6/14(金) 18:02
nrin,NRI研究員の時事解説,日本銀行は次回会合で国債買い入れ減額計画を決定：日本銀行の円安恐怖症,6/14(金) 13:27
nrin,NRI研究員の時事解説,G7がロシア凍結資産のウクライナ支援活用で合意,6/14(金) 6:01
nrin,NRI研究員の時事解説,日本銀行は国債買い入れ減額へ,6/13(木) 13:20
nrin,NRI研究員の時事解説,FOMCの利下げ予想は年内3回から1回に：市場は利下げ観測をやや強める,6/13(木) 11:28
nrin,NRI研究員の時事解説,骨太方針での2025年度PB黒字化目標堅持は事実上の財政健全化先送り,6/12(水) 6:02
nrin,NRI研究員の時事解説,骨太の方針にラピダス量産支援を明記へ：政府保証にモラルハザードの問題,6/11(火) 6:03
nrin,NRI研究員の時事解説,5月米雇用統計は上振れ：年内利下げ回数の見通しは1回に,6/10(月) 6:00
nrin,NRI研究員の時事解説,ECBが利下げを実施：世界で利下げが本格化するなか日銀はひとり利上げへ,6/7(金) 10:49
nrin,NRI研究員の時事解説,金融・資産運用特区がスタート：成長戦略との連携も重要,6/6(木) 12:36
nrin,NRI研究員の時事解説,合計特殊出生率1.20へ低下：関連法案可決も少子化対策の実効性にはなお疑問,6/5(水) 17:27
nrin,NRI研究員の時事解説,日銀の国債買い入れ減額は本格的な量的引き締め（QT）の始まりではない,6/5(水) 13:02
nrin,NRI研究員の時事解説,4月の実質賃金下落幅は予想以上に縮小もプラス転換にはなお時間,6/5(水) 11:16
nrin,NRI研究員の時事解説,新札発行の経済効果は1.6兆円程度か：広く流通する最後の紙幣となるか,6/5(水) 6:02
nrin,NRI研究員の時事解説,自動車メーカー認証不正問題の経済への影響,6/4(火) 15:07
nrin,NRI研究員の時事解説,世界経済の中期見通し⑤：成長率に影響を与える諸要因とAI,6/4(火) 6:01
nrin,NRI研究員の時事解説,年金制度の安定性・信頼性を高める改革への期待：「在職老齢年金制度」、「第3号被保険者制度」の見直しで人手不足緩和も,6/3(月) 6:00
nrin,NRI研究員の時事解説,世界経済の中期見通し④：経済政策とイノベーション,5/31(金) 6:00
nrin,NRI研究員の時事解説,日本市場でトリプル安が進む：円安けん制の長期利回り上昇容認が弊害を生み、日銀はジレンマに,5/30(木) 14:50
nrin,NRI研究員の時事解説,ニューカレドニア暴動と重要鉱物の中国の生産過剰問題,5/30(木) 6:00
nrin,NRI研究員の時事解説,日銀の令和5年度決算：利上げによる逆鞘の発生が近づき、日銀の財務の安定性が試される局面に,5/29(水) 17:37
nrin,NRI研究員の時事解説,米国プライベート・クレジット・ファンドの潜在力と今後の注目点,5/29(水) 6:03
nrin,NRI研究員の時事解説,米国SECがイーサ（ETH）現物ETFを承認,5/28(火) 16:24
nrin,NRI研究員の時事解説,4年半ぶりの日中韓首脳会談では『未来志向』の経済協力で合意：米大統領選挙後の国際情勢を睨む面も,5/28(火) 6:02
nrin,NRI研究員の時事解説,日銀の自然利子率を巡る議論,5/27(月) 15:24
nrin,NRI研究員の時事解説,各国間の温度差が目立ったG7財務相・中央銀行総裁会議：日本の為替介入の是非を巡る議論は回避,5/27(月) 6:02
nrin,NRI研究員の時事解説,1ドル157円と10年国債利回り1％：日本銀行はいずれ政策のジレンマに直面するか,5/24(金) 15:28
nrin,NRI研究員の時事解説,7月まで一時的に加速も緩やかな低下基調を辿る消費者物価上昇率（4月CPI統計）：円安進行を受けた日銀早期追加利上げ観測は行き過ぎか,5/24(金) 11:04
nrin,NRI研究員の時事解説,衆院で政治資金規正法の改正議論が始まる：政治とカネの問題解消には遠く,5/24(金) 6:01
nrin,NRI研究員の時事解説,G7財務相・中央銀行総裁会議ではロシア凍結資産の活用とドル高・日本の為替介入が注目点,5/23(木) 6:02
nrin,NRI研究員の時事解説,2024年金商法改正の成立,5/22(水) 12:01
nrin,NRI研究員の時事解説,世界経済の中期見通し③：リーマンショック後の設備投資抑制が影響,5/22(水) 6:02
nrin,NRI研究員の時事解説,日銀追加利上げと量的引き締めはどちらが先か？,5/21(火) 13:30
nrin,NRI研究員の時事解説,米中対立が追加関税の報復合戦に発展する可能性,5/21(火) 6:02
nrin,NRI研究員の時事解説,バイデン大統領が賭ける『青い壁』3州,5/20(月) 6:02
nrin,NRI研究員の時事解説,世界でEVへの逆風が強まる,5/17(金) 6:02
nrin,NRI研究員の時事解説,米国経済・物価指標の下振れで1ドル153円台まで円高が進む,5/16(木) 12:30
nrin,NRI研究員の時事解説,円安・物価高で個人消費は未曽有の弱さに（1－3月期GDP）：強まる円安の弊害,5/16(木) 11:01
nrin,NRI研究員の時事解説,中国政府はいつ不動産救済に本腰を入れるのか,5/16(木) 6:03
nrin,NRI研究員の時事解説,為替介入の為替売買益、外貨準備の含み益の活用は正しい議論か,5/15(水) 6:02
nrin,NRI研究員の時事解説,米国が中国製EVへの関税率を4倍に引き上げ100％へ,5/14(火) 6:00
nrin,NRI研究員の時事解説,日銀がサプライズの国債買い入れ減額：円安けん制が狙いか,5/13(月) 16:40
nrin,NRI研究員の時事解説,発言の修正で円安へのけん制を再度強める日銀,5/13(月) 6:00
nrin,NRI研究員の時事解説,世界経済の中期見通し②：労働が成長の制約に,5/10(金) 16:07
