media_en,title_articles,link_articles,date_original
saitama,だまされたふり…電話は息子じゃない　通報した父、会いに来た詐欺師と接触…即逮捕　遠方から到着した18歳,https://news.yahoo.co.jp/articles/75f5e48cef272c27562751140b2d37a7f59522b8,8/13(日) 15:17
saitama,人気100店を展開する“ゴーゴーカレー”1日100食限定「オールスター」発売へ　15〜20日、ボリューミー絶賛,https://news.yahoo.co.jp/articles/d05602cc1780d3cacec1ad1c051a2d6e03e032f0,8/13(日) 14:23
saitama,駅前マルイに20日オープン、駅周辺になかった“図書館”　東武スカイツリーライン草加駅東口、入退場は自由,https://news.yahoo.co.jp/articles/ac3818fa9b98752c5ba87b3b8c35940c5163fb1a,8/13(日) 13:54
saitama,叫んだ母、飛び起き…窓が粉々に　震えた空襲、焼けた人の行列…胸だらりと出た女性、子と手つなぎ放心状態,https://news.yahoo.co.jp/articles/aa041a50f5916266c023d36c8d8eaeb77d5a4c58,8/13(日) 13:39
saitama,圧巻の熊谷花火大会、1万発に大勢感動　大きなワイドスターマイン打ち上げ、投票で決めた色や曲で夜空へ,https://news.yahoo.co.jp/articles/c7ec2cda9fe5acd7f9c6964fe0c626259a1d3902,8/13(日) 12:30
saitama,花火延期…あす14日予定だった　きょう13日カーニバル中止、4年ぶり秩父音頭まつりも　花火打ち上げ日時は,https://news.yahoo.co.jp/articles/761cf08d23dc0af835eeefa6ae0edeba0b83c85d,8/13(日) 12:07
saitama,あきれた大学生、出会い系アプリで女性のふり…待ち合わせた男性に襲い掛かる　架空女性の彼氏のふりして,https://news.yahoo.co.jp/articles/dc1d8d6f238c738742a99e930b90facd000826ab,8/13(日) 10:41
saitama,騒然…強盗2人「奥へ行け」昼の質店で破壊　客数人、店員、店長いるのに堂々と　20代くらい、強奪し逃走中,https://news.yahoo.co.jp/articles/1d6d2837fda57fa76429928349d7882f7cf93350,8/13(日) 10:15
saitama,2歳の娘、刺される…昼過ぎに自宅で　母親を逮捕、会社員31歳　上半身を刃物で刺され、全治不詳の状態,https://news.yahoo.co.jp/articles/4a81491744b83937ff915257e973383482975598,8/13(日) 9:40
saitama,びっくり！人気のコウノトリを見学できる「天空の里」来館5万人を突破　客驚き、鴻巣市長が“伝説米”贈呈,https://news.yahoo.co.jp/articles/967d668d2f515374cd0a647309073fca96e7a874,8/12(土) 15:50
saitama,浦和のカフェ風人気店、格別の“コーヒー豆店”だった　JR駅の近く　コンビニで飲めるも、根強いファン獲得,https://news.yahoo.co.jp/articles/77d226164d72180f08c437aa1e1360c0723e6bcd,8/12(土) 15:24
saitama,日本最大級の品揃えオープン！レイクタウンに“巨大”冷凍食品店が誕生　本年度中にイオン与野にも出店予定,https://news.yahoo.co.jp/articles/7224b9f0315cb8af89dd6e46d0001299033c8e6b,8/12(土) 15:01
saitama,埼玉初！最低賃金が1028円に　引き上げ率は5年間で最大、地方審が答申　時給1028円未満の県内労働者63万人,https://news.yahoo.co.jp/articles/33d3fe2c4d35dc9c01dd4bda51b074f9a65784e8,8/12(土) 14:29
saitama,ワイドスターマイン、5号玉、早打ちも！きょう12日“メッツァ”で花火打ち上げへ　19日も入場無料,https://news.yahoo.co.jp/articles/3fba1e5b99104f53a29d1cdafa4c8d625faf855f,8/12(土) 13:51
saitama,迷惑あおり運転、100人が病院で大騒ぎ…暴走する一部外国人、相次ぐ苦情　問題の背景は　騒動を取材＜下＞,https://news.yahoo.co.jp/articles/ae6d1024b86f52e17c1086f6faa3abd9d0282298,8/12(土) 13:48
saitama,乱闘…男女もめた結果、病院で100人大騒ぎ　救急車受け入れできず　批判の先は…誤解も　騒動を取材＜上＞,https://news.yahoo.co.jp/articles/e488682aa1862d804bc027f894b8dca08b75e4c3,8/12(土) 13:41
saitama,さいたま新都心けやきひろば、あす13日まで“水かけまつり”開催　世界各国のグルメ屋台、夕方にライブも,https://news.yahoo.co.jp/articles/79db4932016da53f2bcf8fca74f49a81605b77cd,8/12(土) 9:22
saitama,待望ブドウ狩りシーズン到来　秩父地域は観光農園47園　ちちぶ山ルビー、今月中旬から本格販売　今食べ頃は,https://news.yahoo.co.jp/articles/5a6ba5bdf1a8033f84f36ad1ba3fd7f7d2e65a25,8/11(金) 13:59
saitama,自転車の女性死亡…左折トラックに巻き込まれる　信号機ある昼の交差点、女性は横断中だった…身元判明,https://news.yahoo.co.jp/articles/90b3c67a5b8895184f27146dd4c9bfc5e797d991,8/11(金) 13:41
saitama,渋沢栄一の生誕地・深谷「中の家（なかんち）」がリニューアル　大勢行列「素晴らしい」「また盛り上がる」,https://news.yahoo.co.jp/articles/20a57d5d94eb2956d17ff83d2096a6fec131428b,8/11(金) 12:52
saitama,バイクの男性死亡…大型トラックと衝突　運転中だった男性、なぜか対向車線はみ出す　見通し良い直線道路,https://news.yahoo.co.jp/articles/bb92d77e5ff5fd207db293a071311da2fc0c35ec,8/11(金) 12:21
saitama,死亡…歯科医師が車にはねられる　信号機や横断歩道ない交差点、夕方に横断中だった　病院で息を引き取る,https://news.yahoo.co.jp/articles/c0569fa30429a21e3e58cadfe18b7c59d03061fc,8/11(金) 12:04
saitama,埼玉有数の規模！熊谷花火大会、あす12日開催　1万発、例年は客45万人　新たな“ワイドスターマイン”とは,https://news.yahoo.co.jp/articles/d974f13e6af4188b8a52cb01728ead99e7d402fb,8/11(金) 10:20
saitama,21歳逮捕…ずっと携帯見ていたので警官が詐欺師だと気付く　駅周辺の飲食店で　狙われた女性寸前で救われる,https://news.yahoo.co.jp/articles/b013c6ee245d22d382e37be1cd5a321b63d95b7d,8/11(金) 9:22
saitama,イオンレイクタウン、国内最大級“かき氷祭”きょう11〜20日開催　人気10店が50種類を用意　初出店の名店は,https://news.yahoo.co.jp/articles/d942357b5ba79c9b7b5523aef434c74126a75b49,8/11(金) 9:17
saitama,東武線で人身事故　男性死亡…急行列車にはねられる　昼前の駅構内、40〜50代くらい　最大2時間超の遅れ,https://news.yahoo.co.jp/articles/9665bad88334aefc5bcafab2ecb91fa1ba26313f,8/11(金) 6:55
saitama,男性死亡…屋根から転落、高さ6メートルの住宅で作業中　雨が降り出し家人が呼ぶと、なぜか男性転倒し悲劇,https://news.yahoo.co.jp/articles/601d225b46f06595b33476abaf61dba4d52d6148,8/11(金) 6:21
saitama,埼玉で初めて！ロッテと富士見市、ガムで健康づくり実現へ　口内フレイルの知見活用で協定、介護予防を推進,https://news.yahoo.co.jp/articles/9c79694b89d730686cc579039e98684910a9595b,8/10(木) 20:11
saitama,あきれた課長、パブで優越感…勤務先の医院で詐取した462万円超で　逮捕され無職に　ちやほやされた言葉は,https://news.yahoo.co.jp/articles/61338bd83006cd65294476e273e38e4db705ab7e,8/10(木) 17:51
saitama,カインズさすが、花壇に雑草生える隣の小学校に「児童と整備したい」と申し入れ　鮮やかな花々咲いて感動,https://news.yahoo.co.jp/articles/fdd9c669ace129c67e9235d21e18755668cfd2a1,8/10(木) 14:30
saitama,学校跡にオープンした“キャンパス”あす11日イベント　カフェ、特産品販売所も営業　廃校から生まれ変わる,https://news.yahoo.co.jp/articles/428a278a87ba6d59c919bed14ffb956a9fcd5aee,8/10(木) 14:10
saitama,男性死亡…トラックにはねられる　夜の国道にいた男性…身元不明　片側2車線の直線、運転手の男逮捕,https://news.yahoo.co.jp/articles/49cf1a7987d686b3e6f8da6a5796a1b90d545799,8/10(木) 13:34
saitama,女性驚き…向かいの家に3人侵入した瞬間目撃、すぐ通報　現金など強奪していた　警官が殴られるも全員逮捕,https://news.yahoo.co.jp/articles/e243f8a536b5666488717005d68799735d1de475,8/10(木) 9:50
saitama,とっさの判断…女性がトラックで道ふさぐ　住宅破壊の3人、車で激突も…意地で突破させず　近くの人ら制圧,https://news.yahoo.co.jp/articles/64a6c2eee1448fe8e1cdd49c164e7eac35113bd4,8/10(木) 8:12
saitama,心はいつもバリアフリー…「全盲の教師」新井淑則さん死去　教員仲間ら、遺志継ぎ交流広場「リルの家」開設へ,https://news.yahoo.co.jp/articles/5cab099d6b4cb031bbe34d7dfac2db0f1a358019,8/9(水) 15:23
saitama,さいたまに新アリーナ…「市民の声聞いていない」「説明不十分」反対署名1800筆超に　市民団体が中間報告会,https://news.yahoo.co.jp/articles/95552520609d990ad8d2b36bfe9fc76624144069,8/9(水) 14:10
saitama,お風呂も食事も遊びも！　熊谷の日帰り温泉に次世代型「キッズパーク」　キッズメニューや水遊びエリアも,https://news.yahoo.co.jp/articles/02801a5de10420a3eb57cad55665efec2b9076cd,8/9(水) 11:09
saitama,尾上松也さんが絶賛…小鹿野の子ら「舞台度胸据わっていた」　町役場新庁舎落成記念で特別公演、演技指導も,https://news.yahoo.co.jp/articles/a7cf7a05a98577d64a720129422dae818ffa5df9,8/9(水) 10:54
saitama,孫が…慌てる80代男性、救った連携　「会話大切に」心がけ生きる　特殊詐欺被害を未然防止、羽生署が感謝状,https://news.yahoo.co.jp/articles/7c4152d757012ff67016fbc08cbf59e2c618bdf9,8/9(水) 10:33
saitama,遠くの子孫の思い届けに…猛暑で「代理墓参」急増　秩父の墓地、障害者らが作業　7月からほぼ毎日「墓参」,https://news.yahoo.co.jp/articles/fa4a96c607859ebdde2a2ecabecc144e65896da8,8/9(水) 10:15
saitama,1000発増のはずが…花火打ち上げが直前中止　チケット完売、CF実施も　設営トラブル原因、朝霞市が返金対応,https://news.yahoo.co.jp/articles/3df265fb3cdc6fc13684b53bda273a788845e769,8/9(水) 9:47
saitama,発生から約9カ月…78歳女性から500万円奪った19歳会社員を逮捕　「おおむね間違いない」　防カメなどで特定,https://news.yahoo.co.jp/articles/c1502e609b5fe91ae3eae7e7a44841a392ac4d54,8/9(水) 9:27
saitama,すでに数千万円売り上げ…ガールズバー共同経営の男逮捕　無許可で客に接待、売上金は暴力団に流れた可能性,https://news.yahoo.co.jp/articles/878c72f80dec5e16cf5ecba0e040843fa03be5f9,8/9(水) 8:53
saitama,日曜の公園で…公然わいせつ容疑で検察事務官を逮捕　50代男性、飲酒状態で下半身露出　さいたま地検が発表,https://news.yahoo.co.jp/articles/d026b1e194b8975238d67165abc734cce8f27a50,8/9(水) 8:29
saitama,マイナ問題はどうなっている？　吉川の一日市長、現場で積極質問　「多くの仕事」で市を支える存在を実感,https://news.yahoo.co.jp/articles/4ffb07c64930c54db09937b53becf6d091df44ed,8/8(火) 14:31
saitama,埼玉は大転換期　再選の大野知事、今後も不変的に使うツールとは　認めたくないが…投票率、都市部ほど低く,https://news.yahoo.co.jp/articles/6211654f09e509b1557c8aa80f95e1f2278dd1e0,8/8(火) 10:38
saitama,地元の味引き継ぐ納豆も…さいたま市役所に「杉の子マート」開店　弁当やパンなど販売　障害者らレジ対応も,https://news.yahoo.co.jp/articles/4c68f7ca90bdfa1df850b64e84a4e0634919e1ba,8/8(火) 10:34
saitama,小ぶりでも糖度上々！　神川で梨直売所オープン　明治時代から栽培　昨年はひょう害も、今年は順調,https://news.yahoo.co.jp/articles/5658f232b98bc831388d5d711c347556484e3bfb,8/8(火) 10:09
saitama,ヤオコー深谷上野台店がリニューアル　商品数が大幅増　ブランド牛売り場、寿司店「漁火」の新商品も投入,https://news.yahoo.co.jp/articles/e7557a39f68cd2135f349e3be1fa226a9664dad1,8/8(火) 9:42
saitama,10万本が次々開花…皆野でムクゲの花見頃　暑さの中、山の斜面に咲き誇る色とりどり40種　9月上旬まで,https://news.yahoo.co.jp/articles/d4e6d5baedc08b29f101a1432ba5938bc5a6f2b0,8/8(火) 9:35
saitama,襲いかかった男、自転車の女性からバッグ強奪　女性から頼まれた人が通報、防カメで特定された会社員37歳,https://news.yahoo.co.jp/articles/2f117e7bfbedabf8b32e05e2bf26f07a87b4076d,8/8(火) 9:17
saitama,女性流血…追突した車の26歳男、基準5倍超のアルコール検出「酒は飲んでいない。飲酒検知も覚えていない」,https://news.yahoo.co.jp/articles/06667f63aef94a7dec989747763f3ef22ae71460,8/8(火) 8:41
saitama,科捜研OBが「マジでヤバい」…特殊詐欺被害、埼玉ワーストの越谷署が「自虐」ポスター　身近な犯罪、認識を,https://news.yahoo.co.jp/articles/458c31f09d3ebd96bc0aa574f55288e6b788c79a,8/8(火) 8:40
saitama,杏さん、片岡愛之助さん「翔んで埼玉」続編へ出演決定　ただならぬ雰囲気、気になる役柄は　杏さんは初男役,https://news.yahoo.co.jp/articles/715d1402aa1cc35c4eece0b9609dfb46fb834db3,8/8(火) 8:21
saitama,＜甲子園＞貫いた攻めの姿勢…浦和学院、初戦で散る　昨夏Vの仙台育英に9―19　両チームで計37安打の激戦に,https://news.yahoo.co.jp/articles/84f143c803618b235f58304d944deb32157f1185,8/7(月) 13:44
saitama,待望！関東一の水まつり“寄居玉淀水天宮祭”に客大勢　夜空を舞う盛大な花火、盛り上がりは最高潮に,https://news.yahoo.co.jp/articles/133900df4dae55c39fec2b0b454d9c853ecc178e,8/7(月) 12:42
saitama,松山高新聞部、全国トップに輝く　総文祭で最優秀賞　部員0人で廃部危機も今100人超に　立て直した矢野教諭,https://news.yahoo.co.jp/articles/f9b34371b806ac319c5ccff64aa83b171aac0ab5,8/7(月) 12:32
saitama,ラーメン、餃子もボリューム満点！千円で満腹　地元で最も古い町中華　なんとロースカツ、ハンバーグも人気,https://news.yahoo.co.jp/articles/9472b59471434cd494de61f5f8262b2d11d0ae0e,8/7(月) 10:41
saitama,1週間の疲れ癒して…金曜日限定のビアガーデン、4年ぶり開催　「日本一のハンバーガー」も　羽生であと2回,https://news.yahoo.co.jp/articles/c49581375989aaf2cb2f8d5d3fe5e111b281cda7,8/7(月) 10:27
saitama,地元のあめで熱中症予防を…熊谷の中学生が対処法など発信　リーフレットと「ニシダ飴」の塩あめ配布,https://news.yahoo.co.jp/articles/2e4d7a2f3fc2825824370dda66bb6efd83393c5f,8/7(月) 10:04
saitama,運転マナー悪い男、注意した20歳を引きずり逮捕　20歳が窓からエンジン切ろうとした瞬間に発進「絡まれた」,https://news.yahoo.co.jp/articles/a7b9594938729c9ea96d611bd75361bb84740728,8/7(月) 9:48
saitama,＜知事選＞現職の大野元裕氏、再選果たす　2新人に大差　投票率、全国ワーストを更新…1、2、4、6位が埼玉,https://news.yahoo.co.jp/articles/d20341132c3f74ef2a4121c9404a20faecd18bc8,8/7(月) 9:19
saitama,知らない世界も、新しい言葉も…紺野美沙子さん、行田で読書の魅力語る　原爆で子亡くした母らの手記朗読も,https://news.yahoo.co.jp/articles/88b5ef58d77ef6e0f456dcc7a4fa66ec2a94bd13,8/7(月) 8:46
saitama,男性死亡…破砕機に巻き込まれる　24時間体制の工場　事故の瞬間は誰もわからず、気付くと両足が機械に,https://news.yahoo.co.jp/articles/8d40a359773a67dc9664d92f48b8cac78f77f9a2,8/7(月) 8:23
saitama,＜知事選＞現職・大野元裕氏、大差で再選　柴岡祐真氏、大沢敏雄氏退ける　投票率は過去最低を更新,https://news.yahoo.co.jp/articles/507cc6d946fddc4fa3f681744eb70fe1642c2cee,8/7(月) 0:50
saitama,そごう大宮店に有名レストラン「千草屋」出店　黒毛和牛のハンバーグやビーフシチュー、期間限定で提供,https://news.yahoo.co.jp/articles/dd8fc52b756fdcc0ccf2c9970cbf2a85680130e7,8/6(日) 16:01
saitama,消えた友達、真っ黒な人…広島で被爆「生かされた」少女、看護師に　「戦争だけは困る」生きている限り伝える　#戦争の記憶,https://news.yahoo.co.jp/articles/ebb3cecb8cfc44beb56ee5f18ae036fbffae1f81,8/6(日) 15:23
saitama,＜甲子園＞魔物も味方に…浦和学院きょう初戦　「縁ある」仙台育英と3度目対戦　両指揮官認め合う「総合力」,https://news.yahoo.co.jp/articles/74248bf7eb7c4003f73283266b663f7e0255a40d,8/6(日) 14:36
saitama,「初心者」でも食べやすく…配合変えた2種類のライ麦パンが人気　上里の「ブレッド＆コーヒー　ロクシー」,https://news.yahoo.co.jp/articles/d3e8bf948d48936b5c6aac851d32337b7d9dde09,8/6(日) 10:56
saitama,あのシーンを思い出す？　旧渋沢邸「中の家」10日にリニューアルオープン　アンドロイド栄一や再現セットも,https://news.yahoo.co.jp/articles/1f2ea22cc58d7bbd215de8966890aee65f64e4a2,8/6(日) 10:46
saitama,大河ドラマもイチゴも「太郎兵衛もち」も…盛りだくさんの田んぼアート、越谷で見頃　在住の漫画家が原画,https://news.yahoo.co.jp/articles/2eb8ef60b2c46199d631e0a3e1e1dfa77f29405d,8/6(日) 10:30
saitama,夏の日差しとじっくり相談　越生で梅の天日干し　丹念に「昔ながらの方法で」　11月上旬から販売予定,https://news.yahoo.co.jp/articles/830eff33dddc35fc0f4562d83c172ecd493311db,8/6(日) 10:15
saitama,＜知事選＞午後5時に閉まる所も…秩父など5市町の投票所で繰り上げ　きょう投開票、県選管が注意呼びかけ,https://news.yahoo.co.jp/articles/b6d9cf0add346ddb5491d63290ac215ddce57533,8/6(日) 9:56
saitama,すごい水圧にびっくり…行田で4年ぶり「一日消防士体験」　小学生80人が放水訓練や救助訓練など体験,https://news.yahoo.co.jp/articles/f600ac57f412ecc30b2197616d7ab8b01a4f89e2,8/6(日) 9:37
saitama,率直にうれしい…外国籍の子の「在留特別許可」でクルド人男性　埼玉にも一定数の対象者　「救済の契機に」,https://news.yahoo.co.jp/articles/f2347dbec4b83d1f4a5860a04500fd0c7eb9f1e4,8/6(日) 9:15
saitama,内偵捜査で…ガールズバーの経営者ら2人逮捕　無許可で接待伴う営業行った疑い　暴力団関与の可能性も,https://news.yahoo.co.jp/articles/1b4d20003a1085dc07b1adc9065b1de123c47cf8,8/6(日) 8:35
saitama,誇り持って応援できるように…ピッチ乱入問題で浦和・田口代表ら報告、謝罪へ　さいたま市長「再発防止を」,https://news.yahoo.co.jp/articles/777e09364572ae564140542052bd92212aaeb106,8/5(土) 18:07
saitama,町長の辞任届も偽造…元小鹿野町職員に有罪判決　地域商社めぐり虚偽の登記　「巧妙で悪質」も反省など考慮,https://news.yahoo.co.jp/articles/6199c8a3399a76a9bc8c6d65ac2cc53c1a945877,8/5(土) 17:25
saitama,トレーラーが民家に…国道17号の事故で逮捕の運転手男性、不起訴に　さいたま地検、処分理由は明らかにせず,https://news.yahoo.co.jp/articles/c40385de9c6bbd35cdd31d10dbf8f8a53f9b4df4,8/5(土) 16:50
saitama,生後2カ月の次男が骨折…暴行容疑で逮捕の母親を不起訴　さいたま地検、処分理由明らかにせず　夫は6月に起訴,https://news.yahoo.co.jp/articles/e028a9bee81a22fbc7be6e7acb0374ec0a91c1a5,8/5(土) 16:25
saitama,明日も進む、いのちの取り組み…少女の死教訓の「ASUKAモデル」　全国普及へ、さいたま市教委ふるさと納税CF,https://news.yahoo.co.jp/articles/2fd8686ba7cfd45d07aae7487a9b44a40ef88128,8/5(土) 11:00
saitama,間一髪！そばには受け子も？　詐欺被害も熱中症も防いだ地域の輪　浦和署、カットサロン従業員2人に感謝状,https://news.yahoo.co.jp/articles/d88298d3efd35e4dc597cc4eba95dfebefd7bbe9,8/5(土) 10:46
saitama,太陽見上げる2万本…熊谷でヒマワリ農園が開園　「迷路型なので、ぜひ楽しんで」　見頃は20日ごろまで,https://news.yahoo.co.jp/articles/6d6ad443392a392d1f917bafb1bb0011f64c9b38,8/5(土) 10:30
saitama,猛暑のおかげ？特産のイチジク、ふっくら甘く　「今年は出来が良い」　加須で「ドーフィン」の出荷始まる,https://news.yahoo.co.jp/articles/00c804dbb9b706fb0d331bf181285a6f92c39cdb,8/5(土) 10:16
saitama,グリホサート検出…所沢ビッグモーター前、土壌から除草剤成分「通常使用より多い量」　反対車線側は未検出,https://news.yahoo.co.jp/articles/645b45462adcfe8aa3682b4a0bc1dbc27e11f035,8/5(土) 9:57
saitama,身に覚えのない所得が…選挙の立会人ら614人の支払報告にミス　所沢市、処理誤り前年分報告　課税額に変更も,https://news.yahoo.co.jp/articles/cc289745b78774737b7d898fbd224c20cc0af2c9,8/5(土) 9:33
saitama,深夜の圏央道で玉突き事故、3人死傷　大型トラックが軽乗用車に追突、45歳の運転手を逮捕　入間の外回り線,https://news.yahoo.co.jp/articles/7fbe05f9762e0f142dcd0fb50de83b8419bc901e,8/5(土) 8:55
saitama,ごみの搬送中に…フォークリフトに挟まれ58歳男性死亡　運転席とマストの間に上半身　日高の太平洋セメント,https://news.yahoo.co.jp/articles/2caac9270c86a4ebaec7b3ac9f3d85ec95af9c4a,8/5(土) 8:35
saitama,呼吸ない…水泳教室で男性倒れる、従業員男女が電気ショック　救急隊の到着前に呼吸再開、返してくれた返事,https://news.yahoo.co.jp/articles/73f64b5bd676930c6cde387767e34d8e7e2a5f91,8/4(金) 17:32
saitama,埼玉中小企業家同友会【設立50周年・地域に生きる（16）】ライフサポートサービス・山口伸一郎社長、健康経営で生産性向上へ,https://news.yahoo.co.jp/articles/28958b679fc4acb904bd4d46da49e916929af4f4,8/4(金) 17:03
saitama,梅林堂、きょう4日から「やわらかゴールドプレーン」が限定パッケージ　テーマは「ママへのプロポーズ」,https://news.yahoo.co.jp/articles/19cc1399c9544f37c95f5a2e4bcc443289bdac6b,8/4(金) 16:51
saitama,セブン店員、客を説得必死…詐欺阻止　勇敢な女性客も！詐欺師と電話する男性客に気付き、電話代わって撃退,https://news.yahoo.co.jp/articles/32d6e55e6add1aecc91846f2240b5e221fc9e54b,8/4(金) 16:34
saitama,車道に飛び出した足…倒れた20代を男性が救う　優しい人続々　詐欺師と客が電話、郵便局員が代わって客守る,https://news.yahoo.co.jp/articles/1f590447cb53f2c2e184ba1b5e66a5f7132a2ddb,8/4(金) 15:53
saitama,暴動…浦和レッズのサポ、試合後ピッチに乱入　77人処分、入場禁止や厳重注意　さらに人数が増える可能性も,https://news.yahoo.co.jp/articles/57f9240b60daf45ef378c63d2ae9cf9486f5f222,8/4(金) 14:40
saitama,女性にわいせつ行為、レントゲン中…商業施設の整形外科で　放射線技師の男逮捕　父親が警察に話し発覚,https://news.yahoo.co.jp/articles/c22e5cf41aaadd01f6090fec9fb2eed346c37b09,8/4(金) 13:45
saitama,絶景！東京都市圏で最大級の花火大会、あす5日に開催　川両岸で戸田橋、いたばし両大会が同時に計1万3千発,https://news.yahoo.co.jp/articles/008a464579e2187d57aa38ff06a84202a449fd9e,8/4(金) 13:15
saitama,埼玉花火まとめ、各大会の日時場所は　あす5日は寄居玉淀水天宮祭、5号玉80発＆スターマインなど5千発,https://news.yahoo.co.jp/articles/5fdf8e528df40584a577302316e5e0abf0f15a73,8/4(金) 13:10
saitama,＜甲子園＞浦和学院、仙台育英と対戦へ　6日の第1日第3試合　仙台育英の強力投手陣、打線に「食らいつく」,https://news.yahoo.co.jp/articles/09f9ed4ad05184ab5b89a751e8976165e846357c,8/4(金) 10:37
saitama,女子高生にわいせつ行為、夕方の駅で…男逮捕　契約社員22歳　体触った4日後、別の女子高生に暴行していた,https://news.yahoo.co.jp/articles/eb9e617a46486397eac31bb34f58f8fccbb542e5,8/4(金) 10:03
saitama,性的暴行…女児、車で襲われる　自宅へ送迎する施設職員を逮捕　自宅行かず路地裏へ　母が警察に相談し発覚,https://news.yahoo.co.jp/articles/b8e2b4f8ee6e1b34cfd30550e2726c791822e850,8/4(金) 7:43
saitama,謝罪…“いじめ報告書PDF”の黒塗りマスキング外れてしまう…ある操作で　ネットに公開、繰り返されたミス,https://news.yahoo.co.jp/articles/b86f4355b02c2bd26f40bf59d45eb7a89ef6c892,8/3(木) 18:55
saitama,埼玉絶品すごく人気、すぐ完売する“野菜すし”　パプリカ、ブロッコリーなど40種類も　握り方のコツは,https://news.yahoo.co.jp/articles/810aa82bbf8a271b5421d15c990907dac24cb4cc,8/3(木) 17:06
saitama,イオンレイクタウン、きょう3日から“初開催”の「山陽フェア」　イオン全店で6日まで　限定の刺し身とは,https://news.yahoo.co.jp/articles/2145afff272dc85f26875f8d5c9285b83185b4e7,8/3(木) 16:11
saitama,娘死亡…生後3カ月、暴行した母に執行猶予5年　周囲は育児に協力せず、つらい状況「夫が協力していたら」,https://news.yahoo.co.jp/articles/2cf3e20c708aa2966a826a3e44132cb3e898f3e3,8/3(木) 16:01
saitama,女子トイレ盗撮、市役所で…一般人も使用の場所、職員逮捕　落ちていた四角いもの、女性拾う…カメラだった,https://news.yahoo.co.jp/articles/e06ad06b46a7b588ca73bd7e4796b72fd2a06be9,8/3(木) 14:25
