media_en,media_jp,title_articles,link_articles,date_original
asmasahi,AERA STYLE MAGAZINE,さっとはおるだけで装いがおしゃれに！ この春に着たい、薄手のスプリングコート。,https://news.yahoo.co.jp/articles/3d8f199c83ff195eadf8d33c3ee3c154e8997954,3/31(日) 20:03
asmasahi,AERA STYLE MAGAZINE,圧巻のコストパフォーマンス！ 洗濯機で洗えるイージーケアがうれしいジーユーのスーツ。,https://news.yahoo.co.jp/articles/52eefab82b05e2204fda9e5d1442b484506f0498,3/30(土) 12:06
asmasahi,AERA STYLE MAGAZINE,世界屈指の総合アウトドアブランドが提案する、お花見をもっと快適にする便利アイテム。,https://news.yahoo.co.jp/articles/a94b535c4fd6f0a3c092570327fb5de0dbbdc15a,3/30(土) 10:01
asmasahi,AERA STYLE MAGAZINE,お花見本番までに買いそろえたい！ 効率よく過ごせる、エル・エル・ビーンの有能グッズ。,https://news.yahoo.co.jp/articles/99fd8aab65b5c9d94d712d38fde18720e604ace8,3/29(金) 19:30
asmasahi,AERA STYLE MAGAZINE,俳優・町田啓太の“特別感”のある選択。持つ人に知的で丁寧な印象をまとわせるもの。,https://news.yahoo.co.jp/articles/dd0d81bc749eee50e33a8c75a9a5ea9a8cb3ef27,3/28(木) 20:04
asmasahi,AERA STYLE MAGAZINE,コスパ抜群！ オン・オフ問わず使えて、洗濯機でも洗える、シワになりにくい無印良品のセットアップ。,https://news.yahoo.co.jp/articles/2570b3f66430bfa5a6d0f68a2f87f4221d3ca922,3/23(土) 12:07
asmasahi,AERA STYLE MAGAZINE,この時期に活躍する一着とは！気分をぐっと高揚させてくれる、薄手のスプリングコートを紹介。,https://news.yahoo.co.jp/articles/f21e4d6c58c3e8c08bd17f2c2acfddcd01cc8002,3/23(土) 12:07
asmasahi,AERA STYLE MAGAZINE,世代間による価値観の違いから起こる“社内世代間バトル“。果たしてこの闘いに、終わりは来るのか！,https://news.yahoo.co.jp/articles/23f1bd921aed5325462fbbea4b72bf4e58adb422,3/22(金) 19:01
