media_en,title_articles,link_articles,date_original
theworldw,まったく休まないサカの気になる疲労　2021−22シーズンから“リーグ戦全試合出場”のレフティーに代わりはいない,https://news.yahoo.co.jp/articles/6f8cf2f9a30ff8b71a5d04377f2b7b1bc2737b58,9/25(月) 9:40
theworldw,ベリンガム抜けたドルトムントはやや苦戦中？　渋い戦いの連続に「ベリンガムなくして楽園はない」,https://news.yahoo.co.jp/articles/0edf76ea614f54bdc36bea57798be668350bd561,9/25(月) 9:10
theworldw,CLで“6シーズン連続得点王”は再現不可能？　6シーズンで82ゴールのC・ロナウドに届く者は出てくるか,https://news.yahoo.co.jp/articles/f9a4dc28ac94b55fb7c3889b4d87765f3d79badc,9/24(日) 23:40
theworldw,ベーリー氏がオーナーになってからの《チェルシー・ワースト補強》は？　ヒットせぬ大型補強の数々,https://news.yahoo.co.jp/articles/590815f32e97faac6faf03546ad94326ad7cc74e,9/24(日) 20:40
theworldw,“30代”からブンデス1部、CLデビューの遅咲きFW ウニオン・ベルリンで最高の時を過ごすベーレンス,https://news.yahoo.co.jp/articles/84a0e4b5e0eb3eeef6f0f8933da7e0081df7fdd1,9/24(日) 20:20
theworldw,今後数年で“2億ユーロ”の売却益を得る？　鎌田、コロ・ムアニら手放したフランクフルトの若手補強戦略,https://news.yahoo.co.jp/articles/93f76e7c93721476b1c54b0f8566fa42b0c54e94,9/24(日) 19:40
theworldw,81本もシュート打って5ゴール……　あまりにも低いチェルシー攻撃陣の決定率に改善策はあるか,https://news.yahoo.co.jp/articles/a4832e072cd32b187b18a51a6d884bb40c4b0a56,9/24(日) 17:30
theworldw,“146分間”で4ゴール決める恐ろしき18歳　バイエルンで結果出し続けるテルは新怪物候補だ,https://news.yahoo.co.jp/articles/e74036250efc9051107ece2282d789bf09d78d4b,9/24(日) 16:50
theworldw,ポステコグルー・スパーズの強さは本物か　アーセナル&リヴァプール戦で試される真の力,https://news.yahoo.co.jp/articles/d247b3f1f85ddfe497de1ba6962d184dda4a0f11,9/24(日) 13:30
theworldw,ジェズス＆リシャルリソンがノースロンドンダービーのカギを握る？　難しいスタートから復調の2人のブラジル人に注目集まる,https://news.yahoo.co.jp/articles/6dc1f339b318bad35b82969311737f74a7cdb7da,9/24(日) 12:30
theworldw,ただでさえ怪我人だらけなのに……　シティの中盤はさらなる人員不足に　首絞め退場のロドリにペップは厳しい言葉,https://news.yahoo.co.jp/articles/aa3a5b8da88b889fe11c957a00b769abf149558b,9/24(日) 12:01
theworldw,“7年半ぶりに先発”のジョニー・エヴァンズがユナイテッドを救った！　「ユナイテッドのベンジャミン・バトン」,https://news.yahoo.co.jp/articles/6fa8d82d392b7ea6cd0b63ccb9169e70c0978a26,9/24(日) 11:00
theworldw,オナナ苦戦の裏でインテル新守護神が絶好調「オナナを懐かしむことがなくなった」,https://news.yahoo.co.jp/articles/cbcbfc3caffc601349aa695799ab3072fdec8c65,9/24(日) 7:00
theworldw,ケインはあっという間にゲルト・ミュラーやクローゼを超えた！　圧巻ハットでバイエルンの新記録を樹立,https://news.yahoo.co.jp/articles/43f93ff5d6ef6fe394416a854fb6c59d69f03f09,9/24(日) 1:54
theworldw,今季もパス成功率“94.1%”と精密機械ぶりは変わらない　ゲームチェンジャーになるクロースの存在感,https://news.yahoo.co.jp/articles/d20be4a90d843a917abeae0c83f21ac68798cc29,9/23(土) 23:10
theworldw,ムバッペを圧巻スピードで封じた3年前の衝撃　マンUを離れたDFが今は2部にいた,https://news.yahoo.co.jp/articles/448742f830d30249515a65af4aafcbac694f1efb,9/23(土) 21:40
theworldw,ウーデゴーは加入時の「4倍の価値がある」　主力の契約延長に軒並み成功、以前とまったく違うアーセナルへの期待値,https://news.yahoo.co.jp/articles/56035c1972e47b4a990902190494a62a0a63b603,9/23(土) 19:30
theworldw,PSV戦のハフェルツの姿は今後も見られる？　批判浴びた数試合とはまったく違うパフォーマンスに改善,https://news.yahoo.co.jp/articles/30c9c14a0f944c048c47ba8f333f8b00ea173d26,9/23(土) 18:31
theworldw,新戦力補強“4億ポンド”で言い訳は許されない？　マンU指揮官テン・ハーグに厳しい視線,https://news.yahoo.co.jp/articles/8534fa66012684092cc8ae06b413cce8aced6a10,9/23(土) 16:10
theworldw,フランクフルト時代の得点力取り戻せるか　ヨビッチが目指すミランでの成功「チームの目標を達成すべく全力を尽くす」,https://news.yahoo.co.jp/articles/bd80ca98153ef91b0aead76144b8e78c407caf15,9/23(土) 15:10
theworldw,バーンリーに負ければ大変なことに　格下との連戦でユナイテッドは勢い取り戻すか、さもなくば……,https://news.yahoo.co.jp/articles/8c5a72300c5bd14eb304f6de2a524987f19d9569,9/23(土) 15:01
theworldw,「こいつは一体誰なんだ!?　と思っていた」ファーディナンドとルーニー、最初はヴィディッチとエヴラを疑っていた,https://news.yahoo.co.jp/articles/6f02e8a91d80d98dad92204b71ca8758626bf719,9/23(土) 14:01
theworldw,セルティックはCLでアトレティコに勝つべし　中村俊輔がいた06-07にベスト16へ進んだストラカンが考える勝ち上がり,https://news.yahoo.co.jp/articles/21d8822f14f390bc7650ff92a4ca57ef5e053296,9/23(土) 14:00
theworldw,ギュンドアンとカンセロがバルセロナのレベルを上げた？　現地メディアもペップ・シティからやってきた2人を称賛,https://news.yahoo.co.jp/articles/98f5896c6f368b7c6d98d79c1771c80dad8d1548,9/23(土) 13:00
theworldw,インテルの司令塔はチームに勝利をもたらす？　チャルハノール出場時の勝率が凄い,https://news.yahoo.co.jp/articles/17dbaee009526e7fa3282123421b09a0188b2416,9/23(土) 12:00
theworldw,バイエルンで躍動するケイン　スター選手揃いのバイエルンで驚いた2人の選手を挙げる,https://news.yahoo.co.jp/articles/8a920f69c245515153b610efd3ff57a22162a24e,9/23(土) 11:01
theworldw,OBプティはアーセナルの戦いが退屈？　「昨季と同じようにプレイを始める必要がある」,https://news.yahoo.co.jp/articles/414b312d970227b2cb5433d115efb81701dbb30d,9/23(土) 10:00
theworldw,遠藤航の強みであるデュエルもまだ炸裂せず…… ELでのパフォーマンスには批判も「ファビーニョからのダウングレードだ」,https://news.yahoo.co.jp/articles/95db2028f20e85bbea53874478cd157f1b37e0c0,9/23(土) 8:50
theworldw,昨シーズンの輝きを取り戻したいカゼミロ　マンU復活には世界屈指のボールハンターの復調が欠かせない,https://news.yahoo.co.jp/articles/d493f03717660e948e28954754f81c5646355183,9/22(金) 23:20
theworldw,6試合のうち4試合で先制点を許すリヴァプール　勝負強さを見せるも、気になるスロースタート,https://news.yahoo.co.jp/articles/821275afdf35076eaded08d36e5e2caf59f1cd05,9/22(金) 22:01
theworldw,怪我して復帰してまた怪我して……　モウリーニョも困惑!?　レナト・サンチェスに「理解するのは難しい」,https://news.yahoo.co.jp/articles/3e3a124a75e38508cc9ff6e08f7c78507c4ff814,9/22(金) 21:32
theworldw,新天地バルセロナで輝くカンセロ　移籍を決断した経緯を語る「私にとってシティは世界最高のチームであり……」,https://news.yahoo.co.jp/articles/e5caa02c7f078ba695128a467342cc94012a58f1,9/22(金) 20:40
theworldw,CLデビューを飾ったドリブラー・ボブ　グリーリッシュやフォーデン、ドクらとの熾烈なポジション争いで成長を狙う,https://news.yahoo.co.jp/articles/b85a42dda7cfe7b0b6f1f1cae6538b15b360b475,9/22(金) 19:11
theworldw,アーセナル、主将ウーデゴーの契約延長を発表　「簡単な決断だった」「アーセナルは昔から特別。ゲームでいつも使ってた」,https://news.yahoo.co.jp/articles/e7752c251b7005458d841a975a5b0a9cf1ea2796,9/22(金) 18:30
theworldw,ユナイテッドの問題は守備ではなくボールを持てない中盤？　「カウンター攻撃しかできない」「自信が失われつつある」,https://news.yahoo.co.jp/articles/7caf8345b1d2521bd80c3836cfcb5cfe6580d7ed,9/22(金) 18:03
theworldw,「モウリーニョもコンテも間違いだった」とトッテナムのレヴィ会長　「このクラブにはふさわしくない」,https://news.yahoo.co.jp/articles/c008a3a1bba055dea88a89c9bf12183299912337,9/22(金) 17:01
theworldw,気になるノースロンドンダービーのGK起用　「2人のトップGKが同じチームにいるのは初めて」,https://news.yahoo.co.jp/articles/217654f5b8d2ba93712f3888e4afcbba815783c4,9/22(金) 15:30
theworldw,「レアル・マドリードでプレイするために生まれてきたと思う」　止まらぬ“ベリンガム旋風”にはナチョも絶賛,https://news.yahoo.co.jp/articles/b03ad7ad0e1d56b6a072d701b4f3ad416c0ba02a,9/22(金) 14:10
theworldw,インテルと互角に戦ったソシエダはCLベスト16へ進めるか　昨季ファイナリスト相手の戦いに手応えも,https://news.yahoo.co.jp/articles/80a6395b64916cb5b6f087d9f54203fa13168d34,9/22(金) 12:40
theworldw,《久保建英&ヴィニシウス》の2トップも面白い？　久保がマドリーへ戻るならば、起用法はどうなる,https://news.yahoo.co.jp/articles/11ba0cdeed2b77e3755f78553f8397489ff93784,9/22(金) 6:40
theworldw,ジェラードはリヴァプール退団を後悔していた　実現しなかったジェラード×クロップ「ブレンダンとの5カ月を我慢すればクロップと……」,https://news.yahoo.co.jp/articles/35c6b3f712a4c92d2bdae346f4740be69aba5697,9/21(木) 23:50
theworldw,「彼らは我々より1回多く優勝している」　マンC指揮官ペップはノッティンガム・フォレスト戦を前に気を引き締める,https://news.yahoo.co.jp/articles/68c3b99d8c4a03791f97b4a9fd16c7decc1d593e,9/21(木) 23:50
theworldw,三笘薫&マーチのウイングコンビは《現プレミアTOP5》に入ると大絶賛　「彼らがいなければ別のチームになる」,https://news.yahoo.co.jp/articles/c5d1b6f4fe7469ebdb5ea9f5b9c8f5de4b64f2bf,9/21(木) 23:30
theworldw,STVVで《3試合16セーブ》と早くも大忙し　鈴木彩艶が踏み出した新たな一歩「ザイオンは世界最高の才能の一人」,https://news.yahoo.co.jp/articles/4a47ba9cc2bac3ae167732e93af2a5f07e9b118b,9/21(木) 23:10
theworldw,「監督になって以来、最高レベルのチームだ」と語るシャビ　6試合で18ゴール中のバルセロナは9年ぶりの欧州王者奪還に挑む,https://news.yahoo.co.jp/articles/b561782199d0b0c8ed768366357726e8c4504333,9/21(木) 22:40
theworldw,アルバレスこそがデ・ブライネの後継者に!?　チャンスメイクの才能が花開いてきた,https://news.yahoo.co.jp/articles/7710739762228d838dbe54ac15ad488be61f1f54,9/21(木) 22:30
theworldw,日本代表でも右SB1番手になった菅原由勢はリヴァプールにピッタリ？　「アーノルドの完璧なバックアップオプション」,https://news.yahoo.co.jp/articles/2c960ce5c71f71c6f4bdd05d4ec48648a9f9004f,9/21(木) 22:10
theworldw,ゴール決まったのになぜか“ガチギレ”!?　アルテタがペップみたいになってきた,https://news.yahoo.co.jp/articles/31f850317406288ffa9acd94bb35fde6d2d658a5,9/21(木) 21:31
theworldw,巧いだけじゃない　リヴァプール新戦力ショボスライが魅せた“36.76km/h”の爆速スプリントが話題呼ぶ,https://news.yahoo.co.jp/articles/9f3fce78e21a9a4e5b88adeb3d7ce70acfb70233,9/21(木) 21:10
theworldw,昨季の経験を強さに変えたトッテナム　アーセナルとの “ノースロンドンダービー”を制することができるか,https://news.yahoo.co.jp/articles/177b2bc14288d8b37a180eafb79dd46e48935ae1,9/21(木) 20:40
theworldw,たった“142分”でチェルシーでの得点関与数に並んだ　J・フェリックスが1億2700万ユーロの輝きを放つとき,https://news.yahoo.co.jp/articles/361096086a74a07d6c97c306a1ee5baf12ee0ea5,9/21(木) 19:40
theworldw,アーセナルの成功の鍵を握るのはハフェルツ？　13年間在籍したクラブOBは新天地で悩めるドイツの天才に期待を寄せる,https://news.yahoo.co.jp/articles/b3c70524103322e32b8e5d054628466edb6dd2e3,9/21(木) 19:21
theworldw,今シーズンはチャンスを掴みたいセルヒオ・ゴメス　持ち前の攻撃力はマンCの新たな武器となり得るか,https://news.yahoo.co.jp/articles/bdadbb761f632bae28c710224cd10e567f3aca83,9/21(木) 18:30
theworldw,自身のミスを認めたマンUのGKオナナ　クラブレジェンドは守護神の人格を称賛,https://news.yahoo.co.jp/articles/d1b19d2c3ea02c1df6c80dd24c3af64e646ba8ab,9/21(木) 16:30
theworldw,ガナーズの10番がピッチに帰ってきた　スミス・ロウ投入でサポーターは万雷の拍手「それはどれほどの感情だっただろう」,https://news.yahoo.co.jp/articles/77527a31035bacef29daf32cd89a489a625418dc,9/21(木) 15:30
theworldw,ノース・ロンドン・ダービーを前にトッテナムに大ダメージ　ペリシッチが右膝前十字靱帯損傷で今季絶望か,https://news.yahoo.co.jp/articles/e7c0cd961120bbea9a8e1144d16f2ad713d07b2a,9/21(木) 15:12
theworldw,今や頼れるアーセナルの絶対的リーダー　ウーデゴーはクラブのレジェンドになるか「いつか彼はそうした存在になるかも」,https://news.yahoo.co.jp/articles/7048fde423be93109a340927cdf07126f862cdfc,9/21(木) 11:41
theworldw,「どうしてニューカッスルはトップ4になれたの？」　CL・ミラン戦での防戦一方展開に実力を疑う声も,https://news.yahoo.co.jp/articles/bb69dbc225bcb6ba7f7fef71014ce25b13c83d44,9/21(木) 11:10
theworldw,昨季のラスト4試合より始まった覚醒は今季も続く　“11ゴール”に関与するアウォニイの快進撃,https://news.yahoo.co.jp/articles/e939cf4b752c95eb43410157c3301dcded93ad5d,9/21(木) 9:40
theworldw,アーセナル冨安健洋、CL初出場！　チームは初戦で複数得点の快勝に,https://news.yahoo.co.jp/articles/4046242e01ab9ac64f5ee438ad6993cac391fdf6,9/21(木) 6:07
theworldw,苦悩続いた“クロアチアのメッシ”と呼ばれた男の今　新天地で見せた1ゴール1アシストの輝き,https://news.yahoo.co.jp/articles/4a7f14e8b1f9b0924f290048f4f28edca4c8e960,9/20(水) 23:30
theworldw,ブライトンにファティの居場所はある？　三笘、ファーガソン、ウェルベックらハイレベルすぎる攻撃陣の争い,https://news.yahoo.co.jp/articles/88ea71c2fc0923914701547ff5a08bf97b9ede0e,9/20(水) 22:40
theworldw,テン・ハーグはかつてバイエルンでミニ・ペップと呼ばれていた　「似たような髪型をしていた」,https://news.yahoo.co.jp/articles/8d4d656d8c73adbe0ff41dbd78ae97d4e197cac9,9/20(水) 22:01
theworldw,ジョージア期待の星・クワラツヘリアのパターンが読まれてきた？　4月から続く“セリエA無得点問題”,https://news.yahoo.co.jp/articles/70174164f7efc632781ea077b2279edfc6f5c1dc,9/20(水) 21:40
theworldw,アーセナルにとって大きすぎるスーパーサブ　加入から12のゴールに関与するトロサールの実力,https://news.yahoo.co.jp/articles/f80df38d0832cbc5ac0c6ab2e283c873ed14121b,9/20(水) 21:10
theworldw,三笘ほどのドリブラーは世界を見てもそうはいない　主力2名が抜けてもブライトンの強さは健在,https://news.yahoo.co.jp/articles/9bec5a85c396575077f9d1debe7fc6d732df0f16,9/20(水) 21:00
theworldw,点も取れるアンカーに　指揮官も大絶賛のMFロドリは守備的MFの枠を超えた唯一無二の選手に,https://news.yahoo.co.jp/articles/8fd5b9a33aeb074a1e59fed3ad68f5b12fbe92f1,9/20(水) 19:03
theworldw,神童ラミン・ヤマルが紡ぐヒストリーはまだまだ終わらない　クラブ史上最年少CLデビュー、そして次は？,https://news.yahoo.co.jp/articles/9f68d98dce22c24dcf9f66c0ff3f9b8112413649,9/20(水) 16:01
theworldw,「狂気の6分間」「なぜ重要かを思い出させた」　“6分で5セーブ”記録のニック・ポープがニューカッスルを救った,https://news.yahoo.co.jp/articles/c8220bbdfbd8cd5480e041cc892aa5bfbcf79875,9/20(水) 15:30
theworldw,3試合で3ゴール1アシストのJ・フェリックス　悲願のバルセロナ移籍を果たした天才は輝きを取り戻したのか,https://news.yahoo.co.jp/articles/8c3bfc7a8d6b4fc2167abf1d2a74a04aaafb1859,9/20(水) 15:01
theworldw,CLでも存在感を示す2ゴール　チャンスメイクも得点もできるアルバレスはマンCに欠かせない選手へと成長した,https://news.yahoo.co.jp/articles/e535004a0ae118e5406ef407032610472e2f583a,9/20(水) 14:30
theworldw,“守護神”がチームに勝ち点をもたらす値千金の同点ゴール　プロヴェデルはCL史上4人目の選手に,https://news.yahoo.co.jp/articles/a2705af59afe74ce6b043eb3c5c9264e73350661,9/20(水) 14:01
theworldw,インテルの“フリー補強組”は超豪華　ムヒタリアン、チャルハノール、テュラムら巧みな補強術,https://news.yahoo.co.jp/articles/b449ad7a4cc30f8f70f6000836664f5110e891a2,9/20(水) 13:30
theworldw,ユナイテッドに立ちはだかるハリー・ケイン　今夏ケインを追いかけなかったのは赤い悪魔の失敗だったのか,https://news.yahoo.co.jp/articles/6ed3bf91282f40c17c450374a4dde064ee14560b,9/20(水) 13:02
theworldw,最高のオールラウンダーの負傷は痛すぎる　シティはいつまで首位を独走できるのか,https://news.yahoo.co.jp/articles/32ada6d702c7e0edaa10a5c3f40eb126278fcfbc,9/20(水) 12:02
theworldw,昨季終盤から“16戦連続無敗”の強さ　粘り強さ取り戻したリヴァプールこそマンC最大のライバルか,https://news.yahoo.co.jp/articles/f956c7a48678cbc0c7f358c9dbf0798e13707a4c,9/20(水) 9:30
theworldw,市場価値は8500万ユーロまで上昇　26歳迎えたラウタロは完成された“超万能ストライカー”になった,https://news.yahoo.co.jp/articles/a54398667c3ba002fa8f6c5a530cb0ef2c121df3,9/20(水) 9:10
theworldw,CL優勝候補はどこだ　マンCの連覇が最有力、次点はケイン加入のバイエルンor昨季準優勝のインテルか,https://news.yahoo.co.jp/articles/73d400a6389b7cd78c12b98a8c66bbd900a5d6da,9/20(水) 8:40
theworldw,ACLはネイマール、ベンゼマ、C・ロナウドらサウジ勢が支配するのか　「ACLの様相は劇的に変わる可能性がある」,https://news.yahoo.co.jp/articles/022ae51faa64a38fd612ea275a95011d2ff67494,9/19(火) 23:30
theworldw,レヴァンドフスキ、ヤマル、F・トーレスらバルサ攻撃陣が予想以上に怖い　開幕前の想定超える豪華戦力に,https://news.yahoo.co.jp/articles/2dab477f3c30c47861e646172efe770dccc0fffe,9/19(火) 22:40
theworldw,“ラーション以来最高のFW”と絶賛の古橋とCL決勝Tへ　セルティックが挑む再びの大勝負,https://news.yahoo.co.jp/articles/5142c71031fe9be6471691b141b9a3073d1a9905,9/19(火) 22:10
theworldw,デ・ゼルビが1年で作り上げた超攻撃的ブライトンの恐ろしさ　5大リーグNo.1の枠内シュート数はシティやレアルもかなわない,https://news.yahoo.co.jp/articles/abe4077d20c55b6ae39df06def2f16b626550752,9/19(火) 21:31
theworldw,使わないなら譲ってくれ!?　ベンチに座ったラムズデールに国内外のビッグクラブがさっそく興味,https://news.yahoo.co.jp/articles/d3e5fd8f73283f311d311205fa33819b5f630019,9/19(火) 19:00
theworldw,ネイマール、ハメス、アザール、ポグバらの世代は期待はずれ？　30代で急失速した才能多く,https://news.yahoo.co.jp/articles/2c0ea51c98ef9a892366804562a160da04cd3440,9/18(月) 23:30
theworldw,遠藤退団のシュツットガルトがまさかの3位発進　“4戦8ゴール”と止まらぬ大型FWギラシが起こすサプライズ,https://news.yahoo.co.jp/articles/75b1e5a8a2fc77597f2f94133cc7bd79d3536885,9/18(月) 23:10
theworldw,「遠藤こそ今のリヴァプールが求めている選手」　守備的MF定まらぬリヴァプールで遠藤航が重要戦力になる時はくるか,https://news.yahoo.co.jp/articles/8f74d299d6fc0ff2dd4a96461678cc790443b9e1,9/18(月) 22:30
theworldw,女子W杯から世界で知名度爆上がり　今季の女子プレミア注目の“新戦力第2位”に宮澤ひなたの名,https://news.yahoo.co.jp/articles/59f5c4e970f26a24c0e18e0745cd23d18aed0a6c,9/18(月) 22:10
theworldw,「マドリーは久保を買い戻すべき」　メッシの姿重なる久保は22歳で“特別な領域の選手”となった,https://news.yahoo.co.jp/articles/c1c1761936cc3b1d1bc3de98dc61f330f3a7af4c,9/18(月) 21:40
theworldw,X・シモンズ、オペンダ、シェシュコら新星凄すぎる　あのヴェルナーがライプツィヒでFW“4、5番手”に？,https://news.yahoo.co.jp/articles/5b1bdcf1d067ca298b2a9ed7972d1eb8cf22d0a0,9/18(月) 21:20
theworldw,ペップも認めるマンCに欠かせない選手に成長したアルバレス　デ・ブライネ不在の中、2列目で輝きを放つ,https://news.yahoo.co.jp/articles/bbc5ec58bad4b41c509ef6d780b07fdb544e2f87,9/18(月) 20:30
theworldw,メッシ退団で失われていたバルセロナの“武器”　絶好調F・トーレスが蘇らせるか,https://news.yahoo.co.jp/articles/ca36f467509c7284aefa8a3271cb4b9ee5a2a40c,9/18(月) 20:02
theworldw,昨シーズンのリーグ最多となる17回の無失点記録はどこへ……　1試合平均2失点のマンUは守備陣の復活が欠かせない,https://news.yahoo.co.jp/articles/afb348ba3e44a601a64e0c38d67af2c2f19d893e,9/18(月) 19:40
theworldw,チーム全員が喜んだリシャルリソン待望のゴール　プレミア最多得点記録者のレジェンドも称賛,https://news.yahoo.co.jp/articles/ad48161a42511f595ac7b87bd266993805a20365,9/18(月) 16:31
theworldw,ニューカッスルはパケタ獲得に興味か　今夏マンCも注目したブラジル人MFを1月の市場で狙う,https://news.yahoo.co.jp/articles/f8be6ec52b63d6b280b7fd1282483f269d1b8dcc,9/18(月) 15:40
theworldw,マンUでのキャリアが不透明なサンチョ　冬の移籍でバルセロナが獲得に興味か,https://news.yahoo.co.jp/articles/24c42e899593c61321c3d7bbeb86ce3bb5f34dc7,9/18(月) 15:10
theworldw,ミランを5発粉砕のインテルが強すぎる　誰が出ても安定しているインテルこそスクデット最有力か,https://news.yahoo.co.jp/articles/3525785b8917c740a6adbaf48bab2b932a3823f6,9/18(月) 13:30
theworldw,"223試合で200ゴールに貢献　 ""リヴァプールの王""・サラーは今シーズンも圧倒的存在感を示す",https://news.yahoo.co.jp/articles/4b086108ecd1ff1b60eadeac1907bd4932de20e5,9/18(月) 13:00
theworldw,古橋の元ライバルが“MLS得点ランク首位”に　22戦14ゴールとアメリカでも冴え渡る得点力,https://news.yahoo.co.jp/articles/4a5641300418c3b67cb49cfd2455d33b60c14b5f,9/18(月) 12:40
theworldw,フィジカルモンスターの体を作ったのは母の料理？　ウェイトトレーニングは一度もしたことがないとトラオレが衝撃の告白,https://news.yahoo.co.jp/articles/bd9105375336eb6f87b82a76e218ba0a918b1de4,9/18(月) 12:02
theworldw,アーセナルは“GKを使い分ける”チームを目指す？　ラジャの初スタメンをめぐって批判も,https://news.yahoo.co.jp/articles/cca5553a4577199876d9068cac60453bf18c2bfe,9/18(月) 12:00
theworldw,ブライトンに歯が立たなかったユナイテッドは大丈夫なのか　ネビル氏「起こるかもしれないと憂慮したことが実際に……」,https://news.yahoo.co.jp/articles/619a3282cb75d165857e4c0061344a567f35abbf,9/18(月) 11:32
theworldw,K・フィリップスは今夏のローン移籍を拒否していた?　今季はかつてのプレイを取り戻し真価を示すシーズンとなる,https://news.yahoo.co.jp/articles/16cf91ec0ed7d4d68225b4e4d56262796977d983,9/18(月) 11:02
theworldw,左サイドで圧倒的な存在感を出したドク　グリーリッシュとの熾烈なポジション争いを制することができるか,https://news.yahoo.co.jp/articles/8124fffaf8eee21a3a2da66a4c464d488c99146f,9/18(月) 10:00
theworldw,怪我に苦しむファンタジスタの復活はあるのか　残留を選んだチアゴはリヴァプールで再起を誓う,https://news.yahoo.co.jp/articles/e810af9d8c376727013eed01fd6b5f32f65c6be5,9/18(月) 9:00
theworldw,ベリンガムはいずれ “バロンドール”をとる選手に……　元イングランド代表レジェンドはオーウェン以来の偉業を期待,https://news.yahoo.co.jp/articles/38d2bd797bade2613d372f0d15e21a409c91a2d7,9/17(日) 23:50
theworldw,リヴァプールでは“13分”しか出番なかったが…… 昨季大苦戦の司令塔が新天地でアンタッチャブルになっていた,https://news.yahoo.co.jp/articles/2dfa4d26e97054245b29b9cbfa3e06ab699e2379,9/17(日) 23:30
