media_en,title_articles,link_articles,date_original
theworldw,復帰を誓うシーズンのはずが……　ユヴェントスのポグバにまたしても怪我の疑惑が浮上か,https://news.yahoo.co.jp/articles/4e81dcfa6f8bc35ecbee590f57c6098f823031e5,9/4(月) 14:30
theworldw,「新たなヒーロー」「違いを生み出す選手」　マンU戦で逆転弾を決めたMFライスをネビル氏は絶賛,https://news.yahoo.co.jp/articles/538500fd589b930ffdc3b0f9bd0ad6b4b991c691,9/4(月) 13:54
theworldw,サンチョがテン・ハーグと対立!?　SNSで主張「スケープゴートにされた」,https://news.yahoo.co.jp/articles/ada7fdaf8dd4450e451e4f29dbc731bce37ce7f9,9/4(月) 13:02
theworldw,ホイルンドのアイドルはC・ロナウド？　マンU待望のストライカーはレジェンドを超える活躍を見せることができるか,https://news.yahoo.co.jp/articles/5ce2a1a51948fed8968900fca95bdacebc4c8ddf,9/4(月) 13:00
theworldw,開幕4連勝を記録したマンCの強さの秘訣をフォーデンが明かす　「このチームでは多くのストライカーが評価されているが……」,https://news.yahoo.co.jp/articles/3075a36f112a6d93886311cdb927f1bc27fa820b,9/4(月) 12:04
theworldw,帰ってきたガブリエウがアーセナルを救った　「モンスタークラス」の絶妙なオフサイドが話題に,https://news.yahoo.co.jp/articles/ed7530921f1779bf315a1fcbb15e419d5836a22f,9/4(月) 11:24
theworldw,イングランド代表初招集のエンケティア　進化を見せるストライカーのメンタリティを指揮官アルテタも絶賛,https://news.yahoo.co.jp/articles/80edbcc48dcb445798cf670ccff09ce87f0900aa,9/4(月) 11:01
theworldw,首位に返り咲いたヴィッセル神戸　経験豊富な2人の新加入選手とともにクラブ初の優勝を目指す,https://news.yahoo.co.jp/articles/1da4399e56724a1300ed95e170c17cfcad3a0ddb,9/4(月) 10:01
theworldw,カイセドよりアムラバトを獲得すべきだった？　元チェルシーのルブフ氏はクラブの補強にコメント　「彼はE・フェルナンデスと組むのに最適な選手だっただろう」,https://news.yahoo.co.jp/articles/4c43ba827cf07ee71fd35dec0c69fd7e41d02d71,9/4(月) 9:30
theworldw,39試合で42ゴール　プレミア最速で40ゴールを達成したハーランド　ペップの右腕リージョも「生まれながらの点取り屋」と称賛,https://news.yahoo.co.jp/articles/415b0707cdfacc4b5b0526d542d346eaf9333581,9/4(月) 9:01
theworldw,ケインの穴はソン・フンミンを中心に埋められる　新生・スパーズの攻撃力は昨季までのチームを超えるかもしれない,https://news.yahoo.co.jp/articles/01c67f56f876848b044e8151aa951481eab7fcca,9/4(月) 8:30
theworldw,“1億ポンドFW”になる未来がもう見える？　ブライトンの若き点取り屋はルーニー級のFWになる,https://news.yahoo.co.jp/articles/9f96703154f0ec5bc32795f1ecef229a747adc36,9/4(月) 8:00
theworldw,「サッカーは数世代前まで遅くて退屈なスポーツだと……」　メッシ効果もあってアメリカのサッカーイメージが変わる？,https://news.yahoo.co.jp/articles/bcb3acce9e45aced226a52f248517ba066575c29,9/4(月) 7:31
theworldw,「今季のクボは15ゴールは決められる」　ソシエダの“主役”となった久保建英を世界が絶賛,https://news.yahoo.co.jp/articles/fecc4cd88e51d2526a7e7df5d18fdceff5d4c5a6,9/4(月) 6:40
theworldw,マンCデビューを果たしたFWドク　「可能性を感じさせる」と現地メディアは評価も選手自身は悔しさを露わに,https://news.yahoo.co.jp/articles/1b863b181cc1e3e8e6c92b27dbb51a03ba0c653e,9/4(月) 4:40
theworldw,セルヒオ・ラモスにスペイン復帰の可能性？　古巣セビージャからの短期オファーを検討か,https://news.yahoo.co.jp/articles/1fafd4a9be261a294f4066a98d900d386a600999,9/4(月) 3:39
theworldw,注目のライスが値千金の決勝ゴール　終了間際の劇的ゴールでアーセナルがマンUに逆転勝利,https://news.yahoo.co.jp/articles/57dfdfaf31db767a23cd91d413b58bd3d6c039c3,9/4(月) 3:16
theworldw,日本代表FW上田綺世がフェイエノールト加入後初ゴール　移籍後初ゴールは華麗なターンからの豪快フィニッシュ,https://news.yahoo.co.jp/articles/0dca35387eee510ec1d80a3fba84671643c0b201,9/4(月) 0:02
theworldw,日本代表FW古橋亨梧が今季3ゴール目を記録　宿敵レンジャーズとの “オールドファーム”でスーパーゴラッソ,https://news.yahoo.co.jp/articles/983fe956d891e6eed5d2946b6f7ac3706fa5f2c7,9/3(日) 23:46
theworldw,欧州の“ベテラン引き抜き”はサウジだけではない　ザハ、イカルディら引き抜くガラタサライの路線に不安も,https://news.yahoo.co.jp/articles/d424eb9857c90a8c1d5ecd83ba4daf357d6819e0,9/3(日) 23:10
theworldw,リヴァプールは町田浩樹に注目すべし？　ELで見るべき注目のタレント「アンフィールドのレーダーに載る可能性のある選手」,https://news.yahoo.co.jp/articles/90e33fe767ad460b51f86a5a5df0eafdcdf3b214,9/3(日) 21:40
theworldw,ソン・フンミン、ハーランド、ファーガソン　プレミアで28年ぶりの“ハットトリック祭り”,https://news.yahoo.co.jp/articles/fc927efccbba94c2e14f04d44cf63dea291896a8,9/3(日) 21:10
theworldw,マンCのアカデミーも超優秀　パルマー、ハーウッド・ベリス、トラフォードら今夏に羽ばたいたヤングスターたち,https://news.yahoo.co.jp/articles/e2348e28ce3feeeeb0b9c459487186ddb99e0671,9/3(日) 20:31
theworldw,ミランの10番は怪物だ　R・レオンは止められない領域へ「このシャツを着ることにさらなる責任を感じている」,https://news.yahoo.co.jp/articles/31edf612677acf60992d7b6439729d02e7b57403,9/3(日) 19:40
theworldw,まさかの2シーズン連続CLグループ敗退中　今季は組み合わせ的にもバルセロナに言い訳は許されない？,https://news.yahoo.co.jp/articles/99657d09e658ebccafc2bc86358ca8396fe5b41f,9/3(日) 18:40
theworldw,ワイナルドゥム、2人の“偉大なリーダー”と再会へ　サウジリーグ参戦が正式決定,https://news.yahoo.co.jp/articles/e5f82be39c1a71c27c9c94eff4cfe4812a5f76c9,9/3(日) 17:54
theworldw,グラフェンベルフ、遠藤航らリヴァプールの“中盤大改革”　若き戦力グラフェンベルフはどう起用する？,https://news.yahoo.co.jp/articles/4405b9fb0f044d7179d4229fdcbc701aa1b8337d,9/3(日) 17:40
theworldw,なぜアーセナルはシステムをいじっている？　現代は分析と対策のサイクルが早すぎる　「土曜に何かをすれば、日曜日には分析される」,https://news.yahoo.co.jp/articles/dcf37a63bfe089a1d83784ced39a0bad4d8b336b,9/3(日) 14:00
theworldw,4戦5発とベリンガムのおとぎ話は終わらない！　イングランド代表にも好影響か,https://news.yahoo.co.jp/articles/798429a482f0a1b9d50daf497da8d80eca9450a7,9/3(日) 12:00
theworldw,「アノエタの王だ」「久保のために入場料を払う価値がある」　ハット未遂・超活躍の久保にスペインでも絶賛やまず,https://news.yahoo.co.jp/articles/b75708eaa681d9af3ae67cda5fae11b565d26b4a,9/3(日) 11:31
theworldw,今季ヨーロッパNo. 1のクラブに輝くのはどのチーム？　昨季王者のマンCの優勝確率は36%も……　 ケイン獲得のバイエルンも優勝候補になり得るか,https://news.yahoo.co.jp/articles/dbe8951375b7e614192d2c4793d1993862a68f55,9/3(日) 11:01
theworldw,裏をかいた川崎の3バックに混乱も……　C大阪は「トップ3」へ大きな勝利,https://news.yahoo.co.jp/articles/0d355b0ffc5270dcb1d769d443b1e724892ea3eb,9/3(日) 10:30
theworldw,昨季に続いてもう一度CL決勝の舞台へ　クアドラード、テュラムら加えたインテルは頂点目指せるか,https://news.yahoo.co.jp/articles/551c1b9e90a963e4bc31ea4907083349fb5cd595,9/3(日) 8:40
theworldw,なぜファティはブライトンへ？　若手にとって魅力的すぎるスタイル「スパーズもファティ獲得を望んでいたが……」,https://news.yahoo.co.jp/articles/f8136614a647489c4b85ed5ed98e25578b0d083f,9/3(日) 8:20
theworldw,日本代表FW浅野拓磨が今季ブンデス初ゴールを含む2ゴールの活躍　ドイツ戦を前に日本代表ストライカーの嬉しい2発,https://news.yahoo.co.jp/articles/16bb0f9e2360d0c88486af75811635dfc7f9f439,9/3(日) 0:41
theworldw,昨季だけで“212回”もエアバトルに勝つ男　34歳迎えても193cmの大型ストライカーは強すぎる,https://news.yahoo.co.jp/articles/be8cb000153841121f346efc8224aa2136ac34dc,9/2(土) 23:30
theworldw,日本代表MF久保建英が止まらない　2ゴール＆OG誘発で今季初勝利に大きく貢献　4試合で3ゴール1アシストの大爆発,https://news.yahoo.co.jp/articles/284e6f9e899cbdca40d324d8e66911c0a5432be6,9/2(土) 23:10
theworldw,サウジはサラー獲得を諦めない？　アル・イテハドは “総額368億円”もの超高額オファーを準備か,https://news.yahoo.co.jp/articles/6cec97feb781272397ab5b6d50552aa8597dfab3,9/2(土) 23:00
theworldw,セリエAでは《98試合で76ゴール》に関与　ローマに来たルカクは真のワールドクラスFWなのか,https://news.yahoo.co.jp/articles/6736d1d24a7ef271bbf099c7e60df57e984b32d9,9/2(土) 22:30
theworldw,“4343億円”もの金額を費やした夏に　ビッグディール成立が目立ったプレミアリーグの総支出額は5大リーグの48%をも占める,https://news.yahoo.co.jp/articles/f135235a98f21d75e1f00d6db796e88d1bcb903b,9/2(土) 22:02
theworldw,イタリアのレジェンドが新たな冒険を決断　36歳にして初の海外挑戦をするDFボヌッチ　「新しい挑戦を楽しみにしている」,https://news.yahoo.co.jp/articles/c942f758edb34e243735d0b810b05c4ff1a13282,9/2(土) 21:00
theworldw,バルセロナが移籍最終日にポルトガル代表のダブル獲り　去就が注目されたカンセロとJ・フェリックスをレンタルで加入,https://news.yahoo.co.jp/articles/2e80af406f916e50fd187209379b451ef7438615,9/2(土) 19:32
theworldw,超マネーパワー見せつけるサウジアラビアはまだ欧州の脅威ではない？　UEFA会長は「中国でも同様のアプローチが」,https://news.yahoo.co.jp/articles/2dbeb27c3ea4b70483a122d9a98d4bbc9cd37748,9/2(土) 18:30
theworldw,チェルシーやマンUでプレイしたレフティがJリーグに？　神戸がファン・マタ獲得間近に,https://news.yahoo.co.jp/articles/a4e3d92c233fc567584c751ab4a8bd12d3ec02fe,9/2(土) 17:40
theworldw,32歳でドイツ代表初招集　昨季はプレミアで“9ゴール”とブライトンで花開いたグロスの才能,https://news.yahoo.co.jp/articles/e4f1519a155c0e7b5451e096b354103d1d6ea603,9/2(土) 17:40
theworldw,ベン・イェデル、南野拓実との連携は恐怖？　モナコでバログンは爆発するか「ためらわずモナコに加入したいと伝えた」,https://news.yahoo.co.jp/articles/dc0b9880c7956013c66900a9fc2fbd5adda2b0ca,9/2(土) 17:10
theworldw,「15歳の彼のなかにジダンを見出した」　No.5背負うベリンガムはジダンの後継者となれるのか!?,https://news.yahoo.co.jp/articles/1b24f8f2ee19c0015649db06aed84a258ccf5f09,9/2(土) 15:01
theworldw,柴崎岳が7季ぶりにJリーグに帰ってくる　タイトル獲得に向けて鹿島のレジェンドに期待が集まる,https://news.yahoo.co.jp/articles/fe95e1be705db70fa10e6bae07ab82038ee97d07,9/2(土) 13:50
theworldw,デッドラインデイに中盤強化実現！　アムラバトがやや特殊な買取OP付きローンでユナイテッドへ,https://news.yahoo.co.jp/articles/9537fc8fa7b7ece516c0ff11794ec267dff73562,9/2(土) 12:03
theworldw,グリーンウッドはラ・リーガでみそぎの再出発　ヘタフェへのローン移籍が発表,https://news.yahoo.co.jp/articles/cc4a8ed14d71f1475da6ee41c72293c5b2910113,9/2(土) 11:33
theworldw,リヴァプールこそマンC最大のライバルに？　“2年目のヌニェス”が本物の場合は恐怖の攻撃陣に,https://news.yahoo.co.jp/articles/2e950d6d5cfabeb02f3d33df8a141f8f064ac59a,9/2(土) 8:10
theworldw,とんでもない《CL・死のF組》を抜け出すのはどこだ　PSG、ミラン、ドルトムント、ニューカッスルの突破予想は,https://news.yahoo.co.jp/articles/f77d55f8c1b12238673d57c16a7c341234f7b892,9/2(土) 7:11
theworldw,ブンデス1部初昇格から“4年”でCLの舞台へ　レアル、ナポリに挑むウニオン・ベルリンの旅,https://news.yahoo.co.jp/articles/22d71e357bbf84267ce50cdfbea8a5f0112abba4,9/1(金) 21:10
theworldw,イングランド代表の2列目は豪華すぎ　好調のスターリングでも入れぬサバイバル「前回から誰か1人を外すのは……」,https://news.yahoo.co.jp/articles/ec6618ce5ecec57d536a6d06946cbbeea245fb9d,9/1(金) 20:30
theworldw,ライスに足りないのは得点力　同じ“英国人最高額移籍”の経験者が語る「平均2ゴールは十分ではない」,https://news.yahoo.co.jp/articles/d886969906c0fc38274d0867f46dce093bdc77de,9/1(金) 19:01
theworldw,ヴィニシウス離脱で早くもレアルにピンチ　攻撃のリーダーになるべきロドリゴにかかる期待,https://news.yahoo.co.jp/articles/916cf4949fb7d5dcb9f24a08c665b28d1d1eded4,9/1(金) 18:31
theworldw,ルーク・ショーの代役はレギロンか　メディカルチェック完了でマンUは左SBの代役確保へ,https://news.yahoo.co.jp/articles/da856c22423140630ec2cbcf63c4b8f41733a192,9/1(金) 14:30
theworldw,パルマーはチェルシーへ……　今季の飛躍が期待されたマンCアカデミー出身のレフティが新天地でのプレイを決断か,https://news.yahoo.co.jp/articles/21a2329ebcfd46f8a4c7fb9e57df78663aab92f9,9/1(金) 13:50
theworldw,まさか現在の礎ができるとは……　アルテタ＆メルテザッカーを獲得、思い出される2011年アーセナルのパニックバイ,https://news.yahoo.co.jp/articles/fc6424028c9e7efae3b2af17548a225a4b62d800,9/1(金) 12:40
theworldw,今季の “ビッグイヤー”を手にするのはどのチームか　CLグループステージの組み合わせが決定　グループFは死の組に……,https://news.yahoo.co.jp/articles/beeaa72ff0688c3b4883b31458c65e9a8b32d919,9/1(金) 12:03
theworldw,ベリンガムと並んで欧州をリードするのは南野拓実だ　衝撃のスタートに「リヴァプールはタキを売るべきではなかった」,https://news.yahoo.co.jp/articles/b4bce1815a1925939f2accc4d9a97c2754f37e3f,8/31(木) 23:30
theworldw,スアレス、ベンゼマ、レヴァンドフスキ、《全盛期No.1》は誰だ　世代を代表する3人のストライカー,https://news.yahoo.co.jp/articles/ed29c83d99ae2faf8ddce4c8121bdf2d2b306171,8/31(木) 23:00
theworldw,バログンを手放したのはもったいない？　アーセナルファンからは「エンケティアよりも優れている」,https://news.yahoo.co.jp/articles/e1c750221427a258962bd2db0703bc5ecb88f8bf,8/31(木) 22:20
theworldw,「控えとしては問題ないが、それだけ」「1500万ポンドをドブに捨てた」　遠藤航はリヴァプールで成功できるのか,https://news.yahoo.co.jp/articles/76861ebb3d88afce1b06304e8dc0c61f907283d8,8/31(木) 21:50
theworldw,マンCに次ぐ“49ポイント”獲得　アストン・ヴィラを変えるエメリ・マジック,https://news.yahoo.co.jp/articles/cca1c980220b8c10b5dc0106a3afc829e90513e9,8/31(木) 21:12
theworldw,仏の名門リヨンがピンチ？　今夏はルケバ、アワールらも手放した「中堅チームになる危険性がある」,https://news.yahoo.co.jp/articles/44b486a919fcdbc1a1232d2c7f566a360853e628,8/31(木) 20:40
theworldw,ロナウドが改めてサウジ・ファンの心を掴んだ「ダンス」が話題　その意味とは……,https://news.yahoo.co.jp/articles/5216c786bf24d66d9e8262f5c962219fc9e3982e,8/31(木) 20:31
theworldw,国内44戦91ゴール決めた“ソロモンのメッシ”？　19歳で欧州挑戦を選んだレアイとは本物か,https://news.yahoo.co.jp/articles/ad6b7b5d5418d4680cbdded7d112bd87db9973ba,8/31(木) 17:10
theworldw,サラー、お金を受け取らないで！　アンフィールドでの居場所とサウジの富はどちらが貴重か,https://news.yahoo.co.jp/articles/c0a8baf89f05ba9c0469df25200fc00ce89f82bf,8/31(木) 17:03
theworldw,バルサはブラジルの神童待ちきれぬ　国内19ゴールと好調の新怪物に集まる期待「ヤマルとの組み合わせを想像してみるといい」,https://news.yahoo.co.jp/articles/51a90fae11046d4eeb4db7105d57126ecfa1f692,8/31(木) 15:30
theworldw,プレミアが豪華すぎてイングランド人選手が苦戦？　気になる代表選手たちの出番問題,https://news.yahoo.co.jp/articles/0ee39e690901876b5a0f1e197c600e3e4718fa53,8/31(木) 13:30
theworldw,ケインはサヨナラも言わせてもらえなかった!?　長年身を捧げたトッテナムとの別れ方が話題に,https://news.yahoo.co.jp/articles/6d1c021fc63c98cd7860d7d9bf72f44cc3e7c216,8/31(木) 12:01
theworldw,スターリング復帰の兆し、新顔も!?　イングランド代表の面々に変化の予感,https://news.yahoo.co.jp/articles/34df9d1cc202682eecb0489be82cb163f46b657a,8/31(木) 11:30
theworldw,バイエルンにさらなる新戦力の可能性　アーセナル苦しめたポルトガル代表MFに興味か,https://news.yahoo.co.jp/articles/242a09c9625f79816c420858094a22cb7f806c4b,8/31(木) 11:00
theworldw,リーガ王者バルセロナも戦々恐々？　近年はクジ運悪し、“死の組”に巻き込まれれば早期敗退も,https://news.yahoo.co.jp/articles/e70444735bc9b85f7835889b40bedfe02fc1342a,8/31(木) 10:01
theworldw,三笘に強烈ライバル登場!?　アンス・ファティがブライトンへ、バルサの10番がやってくるか,https://news.yahoo.co.jp/articles/967eab9cc052ea108cb2de2a1e53e0ed553ab64a,8/31(木) 9:01
theworldw,ユナイテッド左SB問題を誰が解決する？　ククレジャか、それともアヤックス・ルートを使うのか,https://news.yahoo.co.jp/articles/8e7be64325769f21e69d5d4c3f2895eb45c6d24f,8/30(水) 23:00
theworldw,ヌニェスの活躍はSNSから離れた結果？　今季飛躍が期待されるストライカーはサッカーに専念,https://news.yahoo.co.jp/articles/359e6f9bb57af881b37c088072e9a42b54c7713a,8/30(水) 21:31
theworldw,バルサの若き “10番”がプレミアに？　トッテナムがA・ファティの獲得に向けた交渉を開始か,https://news.yahoo.co.jp/articles/9dcce258578a3d5c58ca136885fbe383582261a3,8/30(水) 20:11
theworldw,「彼はクラブの未来になるだろう」　指揮官デ・ゼルビも絶賛のバレバにかかる期待　19歳の逸材は “NEXTカイセド”になれるか,https://news.yahoo.co.jp/articles/ec0da576464cf2f40d83eada26652ab40d51958e,8/30(水) 19:32
theworldw,新加入コバチッチがもたらす新たな可能性　ロドリの攻撃参加にも大きな影響が……,https://news.yahoo.co.jp/articles/4a85243ca55c5be4e85fd9aedea40ea26f8ada24,8/30(水) 18:02
theworldw,ケインはすでにバイエルンにおいて重要な存在に　指揮官トゥヘルも信頼をおくストライカーはレジェンドたちを超えられるか,https://news.yahoo.co.jp/articles/96439453768dd3f99c2345483528166a3467617e,8/30(水) 17:30
theworldw,アトレティコでも試合ごとに負傷者続出　7-0大勝もシメオネはこれで戦えるのか,https://news.yahoo.co.jp/articles/280fcd89bb43079e41d56e77a66b6bb2a17c1223,8/30(水) 17:01
theworldw,パーフェクトMFへ次の課題は得点力？　レアル通算102戦2ゴールのカマヴィンガの次なるステップ,https://news.yahoo.co.jp/articles/c55344e064dd32ad24b2e3f26a5b871bef6dce80,8/30(水) 16:40
theworldw,「小さな勝利とわずかな差の積み重ねだ」　マンCの精神的支柱ルベン・ディアスがリーグ優勝に必要なことを語る,https://news.yahoo.co.jp/articles/ae75b0072e84be2f276e0943ddd1f21c38b464d0,8/30(水) 15:50
theworldw,シティとアーセナルからほとんどが選出　PFA年間ベスト11でユナイテッドは軽視されている!?,https://news.yahoo.co.jp/articles/5aa5882ce12eaf346ec8f42deae2694fec1ad4e3,8/30(水) 14:30
theworldw,ピッチに乱入したのはボクシングの元世界チャンピオン？　ハーランドに抱きついた男性が話題に……,https://news.yahoo.co.jp/articles/c60e84130d79c96b98dbdac75e0376a5ef476430,8/30(水) 14:30
theworldw,メッシらマイアミの助っ人とは真逆の結果に…… アメリカでインシーニェらいるトロント悪夢の8連敗,https://news.yahoo.co.jp/articles/59f5c3e5e9b4eea8594af76b54525b06d78c8286,8/30(水) 13:30
theworldw,理想は“日本のベリンガム”　リーズが注目する田中碧の可能性「ボックス内に飛び出して重要なゴールを決めることもできる」,https://news.yahoo.co.jp/articles/90ed2d37083c51069f649f57c5e883a8665fd043,8/30(水) 12:40
theworldw,キーパス数は“リーグ2位タイ”　ベティスで躍動する復活の魔術師,https://news.yahoo.co.jp/articles/f97e3701642dddde800d761cb9f33febd7897d5a,8/30(水) 12:10
theworldw,不適切な抗議に対する追加処分は前例アリ　ファン・ダイクにさらなる処分の可能性,https://news.yahoo.co.jp/articles/f18d877a585d8c9195b9d37289cad664d7619427,8/30(水) 11:02
theworldw,チェルシーからスミス・ロウへのオファーは「あっさり拒否」　アルテタは生え抜きの10番をどう使うつもりなのか,https://news.yahoo.co.jp/articles/2fdbd81cde4c8eb1b1b5d2d41a791af83decd020,8/30(水) 10:30
theworldw,指揮官交代も問題なし　オシムヘン、ロボツカ、アンギサら躍動の王者ナポリにセリエA連覇はある,https://news.yahoo.co.jp/articles/98892f24b5943cfe0e8e2edc10bc36726d2f63a8,8/30(水) 10:30
theworldw,テクニックと1試合平均12.581km走る運動量　ミランが1900万ユーロで獲得したラインデルスは大バーゲンだ,https://news.yahoo.co.jp/articles/826c44ff7f31e6388257e5c10c9259d98cddcdab,8/30(水) 8:30
theworldw,ドイツの天才MFが今や市場価値“600万ユーロ”に……　悩める29歳のテクニシャンはどこへ行く,https://news.yahoo.co.jp/articles/4a31dd964923dec01f4c7c419140d02dbf8ec4f3,8/29(火) 23:10
theworldw,モドリッチ、クロースがスタメンに入れない魔境　レアルの“中盤サバイバル”が激しすぎる,https://news.yahoo.co.jp/articles/8be0a36221ce82d7e6b57baacf06bce3bb54cc0a,8/29(火) 21:50
theworldw,勝ち点6を稼げた理由が謎？　ドタバタ続きのマンUは危険な状態か「開幕3試合のうち1敗しかしていないのは全くの謎」,https://news.yahoo.co.jp/articles/9e89f81d908b181c619f0d45ed536422c0eecbba,8/29(火) 20:40
theworldw,20歳とは思えぬ貫禄　すでにレアルの主役となったベリンガムのリーダーシップが凄すぎる「すでに世界的スターの素質」,https://news.yahoo.co.jp/articles/eb28a410238b57e048ef637bb205aa2dda8e394a,8/29(火) 19:40
theworldw,1年を経て復活の“2m大型ストライカー” ウルブズのエースへカライジッチの挑戦,https://news.yahoo.co.jp/articles/ca3211b2d9e663f1e738495014f53e20a2d901ce,8/29(火) 19:20
theworldw,マネ、フィルミーノも離れて“ヌニェスの時間”がきた　「アンフィールドでの困難な最初のシーズンに耐えた」男に爆発の予感,https://news.yahoo.co.jp/articles/5106defcb913a260580d3fe3e3c20fb7c09c9d72,8/29(火) 18:40
theworldw,昨季から“7試合連続ゴール”と止まらない　マンU相手にも決めたアウォニイが覚醒している,https://news.yahoo.co.jp/articles/3d73f18c8a7d78783a038ea953a49805f34a0b7a,8/29(火) 18:10
theworldw,得点を奪えるパーフェクトなアンカーへ　劇的ゴール増えるロドリの進化「後ろから上がってくるMFのことはあまりケアしていない」,https://news.yahoo.co.jp/articles/88eec8331b6bc882c88ebcdb86356aec98449972,8/29(火) 17:40
theworldw,ミランも偽SB導入、1対1に強いタレントも揃った　スクデット奪還目指すミランは危険な存在に,https://news.yahoo.co.jp/articles/2c70a9b1f1c37ad9882b860332ba897533554d4a,8/29(火) 16:40
theworldw,トナーリ、ジョエリントン、ギマランイス、ロングスタッフら中盤が強烈すぎる　ニューカッスルの戦う中盤は脅威だ,https://news.yahoo.co.jp/articles/73014e2f097e69089a75c4e6e955539ed756f1af,8/29(火) 8:02
theworldw,新体制で古橋がまさかの前線で孤立状態？　2試合連続無得点は危機なのか「亨梧は本当に孤立していた」,https://news.yahoo.co.jp/articles/15554ec77537b8bb441f14452d8a8ab8f4f9870f,8/29(火) 7:12
theworldw,去就に注目が集まるカンセロ、ついに新天地が決定か　バルサ加入が秒読み段階,https://news.yahoo.co.jp/articles/3bb720a5ad9793ec4f96336d3aa38f238fd043da,8/28(月) 23:30
theworldw,リヴァプールが王者マンCと争うには……　OBキャラガー氏は中盤とディフェンスの補強が必要だと語る,https://news.yahoo.co.jp/articles/5248111f7cda7c033fdd911943c89dce10b22b57,8/28(月) 23:30
