media_en,title_articles,link_articles,date_original
theworldw,サラーの代役候補に上がってたのはトッテナムで悩めるブラジル代表FW？　アル・イテハドは冬の移籍で再びサラー獲得に動き出すのか,https://news.yahoo.co.jp/articles/050812afa002f5a2ecb8c71f9f4eb87b77036ffd,9/11(月) 11:01
theworldw,ヴェッラッティも中東へ　移籍間近に迫るアル・アラビには元同僚も,https://news.yahoo.co.jp/articles/a72093c08a8a5673fe8b56225d3994c570a61a90,9/11(月) 10:30
theworldw,ケインが衝撃の告白から再起を誓うかつてのチームメイト、デル・アリにエール　「彼が再びサッカーに復帰するのを見るのが待ちきれない」,https://news.yahoo.co.jp/articles/3ec578eefddb5a5260fe89e1e733056875a31afd,9/11(月) 10:01
theworldw,またも北マケドニアに勝てなかったイタリアは危険モード？　もうEURO予選で負けは許されない,https://news.yahoo.co.jp/articles/eeb66f87f8583b646dc042bb33e2451bfe0c0874,9/11(月) 8:03
theworldw,フランス&イングランドの実力が飛び抜けている？　EURO2024“優勝候補筆頭”はどこだ,https://news.yahoo.co.jp/articles/98a5db020e6fe62211385a13c4dc66f86af306e3,9/11(月) 7:31
theworldw,タレント揃うドイツ代表が勝率5割以下　フリック体制2年間の成績が悲惨過ぎる,https://news.yahoo.co.jp/articles/30f94ff1c1d6d74d9c4b8015848a8496afd53833,9/11(月) 7:00
theworldw,日本代表が引導を渡した　大不振のドイツ代表、フリック監督を電撃解任,https://news.yahoo.co.jp/articles/188497d0b189c67e2fe431611fa05d9022fa6552,9/11(月) 5:00
theworldw,フリックをただちに解任せよ　「史上最悪の代表監督」「選択肢は3つしかない」と独紙辛辣,https://news.yahoo.co.jp/articles/7de67c5957068ce5ebd071988f18478f41fc0b1c,9/10(日) 23:50
theworldw,代表ではいつも爆発する田中碧に独紙もなぜと首ひねる　「彼がフォルトゥナで爆発するのはいつ？」,https://news.yahoo.co.jp/articles/11f4849131c1cd3caf24e649a2b8332a7f01ad3f,9/10(日) 23:30
theworldw,EURO予選5試合で失点0の“鉄のディフェンス”　メニャン、ウパメカノらフランスの守備が強力すぎる,https://news.yahoo.co.jp/articles/c1c0907f145fdee3af38704f3048d8ccbd04de1c,9/10(日) 23:10
theworldw,ドイツ戦で存在感を見せた日本代表MF遠藤航　リヴァプールファンは期待を高める　「誰もが彼の名前に敬意を払う時期が来たと思う」　「彼は新しいファビーニョかもしれない」,https://news.yahoo.co.jp/articles/dcdd8903b590b2cfdadbbcbffe906db32604eec2,9/10(日) 22:30
theworldw,日本も強かったが、それ以上にドイツは大丈夫？　「もはやドイツはサッカー大国ではない」と世界から心配する声が,https://news.yahoo.co.jp/articles/0fff2da87419eb1ed31c5a1eb2dcd18338ac8122,9/10(日) 21:40
theworldw,就任半年で韓国代表監督・クリンスマン大ピンチ　親善試合で勝てずピリピリムード「早くもプレッシャーにさらされている」,https://news.yahoo.co.jp/articles/3356728f7ebe528ca267c3294a4fc3b146c018b0,9/10(日) 21:11
theworldw,ドイツキラー浅野の「ハンジ・フリックって何？」発言が再注目　「彼はドイツの恐怖の体現者」「彼のことを痛いほど思い出す」,https://news.yahoo.co.jp/articles/aadf95132d523689b5271b0617d117e24e66b05f,9/10(日) 21:02
theworldw,レアル離れて“6年”で渋い守備職人に大変身　ダニーロが迎えた全盛期「マドリードで彼を懐かしむ人はほとんどいなかった」,https://news.yahoo.co.jp/articles/303bf8634214dd91968358fe1163f3bcf1e0e35f,9/10(日) 20:31
theworldw,マグワイアとヘンダーソンは今後も呼ぶべきか　英紙は疑問視「証明しなければならないものがある」,https://news.yahoo.co.jp/articles/f62f76722fa14121bdc206b2ea5f529175e8dada,9/10(日) 20:00
theworldw,ニューカッスルFWが“スコットランドへの移籍”を検討？　EURO目前にウインガーの判断は,https://news.yahoo.co.jp/articles/093eebd226813147666823d3a01b1dcbcd34e939,9/10(日) 19:31
theworldw,クラブでの立場に悩むサンチョ　マンUレジェンド、ギグス氏が言及　「あとはサンチョ次第だ」,https://news.yahoo.co.jp/articles/d587d512a5f2fa3a7c6d99523311b7fef61e1507,9/10(日) 15:30
theworldw,残すはゴールで示すのみ　FWロドリゴはレアルを引っ張るストライカーへと成長を遂げることはできるか,https://news.yahoo.co.jp/articles/caad794fc47e787d695585b126a8742d5e37aa5d,9/10(日) 14:40
theworldw,新天地で出場機会の確保に悩むティーレマンス　エメリ監督の信頼を勝ち取り、アストン・ヴィラの鍵となれるか,https://news.yahoo.co.jp/articles/3e01d8af5c611e0fe219d442a34fe49da3cb74d8,9/10(日) 13:30
theworldw,「フリックはいまだに自分が適任と思っている」　日本に惨敗のドイツ指揮官の首はもはや皮一枚,https://news.yahoo.co.jp/articles/e2ceee4eee6fdd1c5f259513a5545eb439facb2d,9/10(日) 13:00
theworldw,レジェンド、ガスコインのように……　絶対的司令塔マディソンは今季スパーズにタイトルをもたらすことができるか,https://news.yahoo.co.jp/articles/d1dd5e3acc0efa827407c20cdd4622f6ac8e9f85,9/10(日) 12:30
theworldw,今季出場機会確保に悩むMFモドリッチ　世界最高のレアルの中盤でレギュラー奪回に挑む,https://news.yahoo.co.jp/articles/96c6e5d20fb6f9e9f739e426f0de5958bc17af56,9/10(日) 11:00
theworldw,ジンチェンコのアーセナル加入説得に動いたのはあの選手？　選手自身も冗談かと思ったG・ジェズスの来訪,https://news.yahoo.co.jp/articles/c5876cfaae92424b4a6b4deb36944e3e78fcbd76,9/10(日) 9:02
theworldw,「日本に1-4という恥ずかしい敗北」　日本に衝撃の大敗、フリック監督には酷評の嵐,https://news.yahoo.co.jp/articles/a1ad9a072be13b71be1ce0c30c50987f57d1c8e9,9/10(日) 8:00
theworldw,まさに圧巻！　攻撃でも違い見せた冨安健洋　やはり日本代表の最終ラインにはこの男が必要だ,https://news.yahoo.co.jp/articles/48ddfd06ee7cbd1e8ef13cb7bb1d519e7eead05a,9/10(日) 7:00
theworldw,「想像力がないドイツ」「またしても負けた」 “日本の大勝”で独メディアもショックを隠しきれず,https://news.yahoo.co.jp/articles/526a0299bd345087605011e4e7a3c72b535331e2,9/10(日) 6:40
theworldw,伊東！上田！浅野！田中も！　驚きの“4発“でドイツに圧勝　終始ペース握り日本が圧倒,https://news.yahoo.co.jp/articles/d9903c9506b5426adcbe792d832b79f1370e8646,9/10(日) 5:48
theworldw,“今後10年”のバロンドールはどうなる？　ベリンガム、ムバッペ、ハーランド、ヴィニシウスら候補者大予想,https://news.yahoo.co.jp/articles/443f57657db4a39975bce1024fe818b7d3a396f4,9/9(土) 23:30
theworldw,メッシが抜けたらアルゼンチン代表は“暗黒期”に？　難しい2026W杯への準備「彼なしではプレーすることもできない状況に」,https://news.yahoo.co.jp/articles/af546c58bb693538607e735203ca1edc20591e93,9/9(土) 23:10
theworldw,リーガの“タレント流出”は深刻？　資金力で勝てぬリーガの現実「リーガが最も魅力的な時代があったが……」,https://news.yahoo.co.jp/articles/f8679e801330e2177b9d86590f500fae41807535,9/9(土) 22:10
theworldw,ニューカッスルはチームの要ギマランイスに新契約の準備？　今夏もビッグクラブが関心を示していたブラジル代表MF,https://news.yahoo.co.jp/articles/1ccc8b351f14edede7f86b3a6c3bbb151c61b747,9/9(土) 21:40
theworldw,ボリビア戦で2発のネイマール　79ゴール達成で “王様”ペレを超え、ブラジル代表最多得点記録を更新,https://news.yahoo.co.jp/articles/cf19255d94c81cb4159b92cc287f098cb2740071,9/9(土) 20:00
theworldw,メッシも「世界最高のDF」とべた褒め　ロメロは新生スパーズの中心に,https://news.yahoo.co.jp/articles/3847f99a97e361a5fe4fe15ff1c2c41f80d31d03,9/9(土) 15:01
theworldw,マクトミネイがまさかの得点ランキングトップ　クラブで出番待つ男は代表で燃える,https://news.yahoo.co.jp/articles/9c812f3ee406fa6a84d27a7bea88972ad9dbdc37,9/9(土) 13:02
theworldw,コバチッチはすでに攻撃における重要な役割を担う？　数字には表れないクロアチア代表MFの存在感,https://news.yahoo.co.jp/articles/3c515761c73bd6818cde6299037c68c399c631e4,9/9(土) 12:31
theworldw,アーセナル退団のぺぺ、実はゴール関与効率はサカ以上!?　“出れば仕事する男”だった最高額FWの記憶,https://news.yahoo.co.jp/articles/709d8b5641d40590d906cef7a87159c8083b82fe,9/9(土) 12:03
theworldw,ドイツはキミッヒの偽SBプランもあり？　負けられない日本戦へフリックはどうする,https://news.yahoo.co.jp/articles/6c221e73bc04e9065e0627f0050ad1a39a470971,9/9(土) 11:40
theworldw,グリーズマンは早ければ来年アメリカに？　メッシやブスケッツらとチームメイトになる可能性も,https://news.yahoo.co.jp/articles/36492b92ab7ceef10c7b76a7928dd19833613317,9/9(土) 11:00
theworldw,ファン・ダイクへの追加処分が決定　審判への暴言によりウルブズ戦も出場できず,https://news.yahoo.co.jp/articles/cdfde93ddba22d5ccd29a703f1b10697ef1a9f50,9/9(土) 11:00
theworldw,ガビやヤマルら若手たちには負けてられない　ベテラン・モラタが見せるベテランの意地,https://news.yahoo.co.jp/articles/f2b4b85c0510cf47c65df91a59f38e3ebd9adeec,9/9(土) 9:03
theworldw,最年少記録を次々と更新するスペインの若き怪物　ヤマルはスーパースターになるための要素を持っている,https://news.yahoo.co.jp/articles/62d76c84b4addf6d17073ee33fb3b419946f699c,9/9(土) 8:00
theworldw,「マウントより優れているのではないか」　中国で《131戦46ゴール》と暴れる巨人MFにまさかのラブコール？,https://news.yahoo.co.jp/articles/df5aef470b2def1158f42eef2f04d24704ce576e,9/8(金) 23:30
theworldw,アザール、ヴィツェルら黄金世代から新世代へ　ドク、デ・ケテラエル、オペンダらベルギーは強さを維持できるか,https://news.yahoo.co.jp/articles/b2c1e137ef7111af4018d757aadf99dee9398e71,9/8(金) 23:10
theworldw,「三笘がリーグで最も才能のある選手の一人であることを否定する人はいない」　プレミア最強左ウイングとなる日も近い？,https://news.yahoo.co.jp/articles/d275ca24fc75bd464738299f9c238bf55f173cd4,9/8(金) 21:50
theworldw,板倉滉、ファン投票大差でクラブ月間MVPを受賞　サムライたちの活躍は久保らアタッカー陣だけじゃない,https://news.yahoo.co.jp/articles/83aabf7162e577eb9375a633c4b4447d381dbe44,9/8(金) 21:49
theworldw,オペンダにX・シモンズ、ハーランド2世候補のシェシュコ　豪華攻撃陣揃ったライプツィヒが面白い,https://news.yahoo.co.jp/articles/10808245a4570ab7242975c18e3d97c43b98d978,9/8(金) 21:10
theworldw,モウリーニョは今季途中に解任されるかも？　1分2敗の立ち上がりに漂う不穏な空気,https://news.yahoo.co.jp/articles/9e797e306f625ec3a1d544acb832b93ea7915977,9/8(金) 20:20
theworldw,モンテネグロから来た“NEXTヴラホビッチ候補”　セリエAでブレイクを予感させる大型FWへの注目,https://news.yahoo.co.jp/articles/0c1ab10e37c42c8dd60b8ed18e628a4ebbe463ee,9/8(金) 19:40
theworldw,怪我多すぎた7年間　2000分以上プレイできたのが1シーズンだけだったバイリーのマンU生活,https://news.yahoo.co.jp/articles/6f2e7804926f2719ac5f3b82718fb897a0e0104a,9/8(金) 17:40
theworldw,ドイツ代表はまったく準備ができていない　「日本に負けて敗退したのも不思議はない」,https://news.yahoo.co.jp/articles/7bc8612dc8a798a93148bbf276cd71e2cda4d387,9/8(金) 16:00
theworldw,ヘンダーソンのサウジ移籍は「お金のためだ」と厳しい指摘　「マックアリスターらとのポジション争いに耐えられない」,https://news.yahoo.co.jp/articles/7755a5f6542aec289b38e7a3b2fd3f38c91447e4,9/8(金) 13:01
theworldw,ぺぺがトルコリーグへ　アーセナルが移籍金最高額7200万ポンドの男をついに放出,https://news.yahoo.co.jp/articles/a3f86794ded9a706d9a6373cce3a537cd7c96c5d,9/8(金) 12:03
theworldw,ユナイテッド宮澤ひなたは“遅咲き”　苦労人ぶりに英紙注目「日本にはプロリーグがなく学業を……」,https://news.yahoo.co.jp/articles/146dcc8c763bca779e98c8845386d5b742a478ed,9/8(金) 11:02
theworldw,ムバッペが決めなくてもフランス代表は楽勝「つねに最高の状態である必要はない」,https://news.yahoo.co.jp/articles/36ffd5b31f6605c17c80daefe3a00cadb1b76863,9/8(金) 10:01
theworldw,もう“12回”もドリブルで抜かれている…… マンUの守備職人カゼミロは衰えてしまったのか,https://news.yahoo.co.jp/articles/b23a570257efbadfd31ad3455b7c74431a6c2993,9/8(金) 8:02
theworldw,イングランドの“CB1番手”になってもおかしくない？　ブライトンで経験積んできたダンクに巡ってきたチャンス,https://news.yahoo.co.jp/articles/1237a138e55a6b6210dc887a2d1ffdb7a80dd96a,9/8(金) 7:31
theworldw,南野を超えるのはロドリ&ベリンガムのみ　《8月の月間ベストイレブン》に入るロケットスタートを予想していたか,https://news.yahoo.co.jp/articles/41da9a65da45ca52bd548c1e198a82014e5eebab,9/8(金) 6:50
theworldw,イブラ、カバーニ時代を超えて《PSG最強攻撃陣》爆誕？　ムバッペ、デンベレ、コロ・ムアニら顔ぶれが豪華すぎる,https://news.yahoo.co.jp/articles/c74bd210c0ea2d5f20017192217f4fc9316bbe64,9/7(木) 23:30
theworldw,南野も大復活のモナコは優勝狙える？　開幕《4試合で13ゴール》と攻撃陣大爆発,https://news.yahoo.co.jp/articles/1c06ca4c7252b403b6d43f893ea3a097356537bc,9/7(木) 21:20
theworldw,開幕3戦4ゴールと“36歳”の鉄人ストライカーは止まらない　今もレ・ブルーに欠かせぬジルーの凄さ,https://news.yahoo.co.jp/articles/40299952461d7ce3e2daaa58426e8df8a9e915de,9/7(木) 19:40
theworldw,ジェラードに続き、テリーもサウジに？　チェルシーのレジェンドがアル・シャバブの監督就任が間近に,https://news.yahoo.co.jp/articles/5e6f276b72aa88f6bd2d6e6a91d6ac423aca9e76,9/7(木) 14:00
theworldw,「これまでの人生で最も困難な電話だった……」　3冠王者マンCのキャプテン、ギュンドアンが恩師ペップとの別れを明かす,https://news.yahoo.co.jp/articles/e8af27e7607a36120668982e48dbd16179ffbcac,9/7(木) 12:10
theworldw,ブライトンへの移籍を決断させたのはデ・ゼルビの存在？　バルセロナから衝撃の移籍を選んだファティが告白,https://news.yahoo.co.jp/articles/70973fe069f14b64ad611f26f86900f7c7f9d361,9/7(木) 11:02
theworldw,アムラバトとカゼミロの併用も？　獲得した理由をテン・ハーグが明かす　指揮官も信頼する新加入MFにかかる大きな期待,https://news.yahoo.co.jp/articles/d7ecaef4b04824fc90ca3114a6c2410fa9792e92,9/7(木) 10:01
theworldw,エンケティアとジェズスは良きライバル？　ブラジル代表FWの存在が自身のレベルアップに大きく影響,https://news.yahoo.co.jp/articles/60a5618a6ad17df6deee38a46c7ca13578d64e4e,9/7(木) 9:00
theworldw,メッシなら2026W杯目指せる？　MLSで魅せる“異次元”のプレイにかかる期待,https://news.yahoo.co.jp/articles/7d420a75a8bf67d0a6f83a353cf1d633cfaa55df,9/7(木) 8:00
theworldw,ベリンガム、ライス、マディソン、フォーデンら“黄金の中盤”どう活かす　ワクワクするイングランド代表は完成するか,https://news.yahoo.co.jp/articles/d04808a56fb41e8d56ea2194d903ad58342f05ed,9/7(木) 7:32
theworldw,“得点力”身につけた久保建英はついに新時代の怪物となる　大当たりだったソシエダへの移籍「長所に磨きをかけている」,https://news.yahoo.co.jp/articles/1ecfe2e1b44ae959d2dcf31ad200430da1932118,9/7(木) 6:50
theworldw,D・シルバが一緒にプレイしたかった選手とは？　 “魔術師”がパスを出したいと語ったマンCの怪物ストライカー,https://news.yahoo.co.jp/articles/8925fabde2117d73c4b351ea5b5b400e16f7d22a,9/6(水) 23:00
theworldw,W杯で生まれたなでしこのNewスター、FW宮澤ひなたがマンUに加入　マンC長谷川とのマンチェスターダービーも実現,https://news.yahoo.co.jp/articles/40025caf257f2ceca70ecbd3cc0da2c979df8ebf,9/6(水) 22:23
theworldw,マンチェスター・シティは完璧な補強をした？　4人の新加入選手を獲得した3冠王者は今季も磐石の体制か,https://news.yahoo.co.jp/articles/6d6e705545707fdfc5e3560995dfe82a2eaa8e47,9/6(水) 22:00
theworldw,今回のドイツは本気でくるぞ　ドイツに迫る“絶対負けられない日本戦”「監督の交代が行われる可能性が……」,https://news.yahoo.co.jp/articles/367e954edc8e09367ca831da16926ec4234fc0b6,9/6(水) 21:40
theworldw,ナイジェリアから襲来した“193cm”の大型FW　X・アロンソ率いるレヴァークーゼンでボニフェイスが止まらない,https://news.yahoo.co.jp/articles/a5533390f142749207cbd1fb0f3f19228b4535fd,9/6(水) 20:40
theworldw,スカマッカもデ・ケテラエルもアタランタで復活する　“ガスペリーニ流”で2人は危険な存在へ,https://news.yahoo.co.jp/articles/38f7530c7ea3b7ee2348ff72252d47a96adb2d58,9/6(水) 19:40
theworldw,初招集エンケティアはゲームチェンジャーとなるか　期待されるイングランド代表の新たな武器,https://news.yahoo.co.jp/articles/67a2f49a47907e3ecacf9da7d65718ba3c14ace2,9/6(水) 19:01
theworldw,マンUに続く“アウェイで強豪に勝てない問題”　今季もスパーズ、アーセナルに負ける厳しい船出に,https://news.yahoo.co.jp/articles/a465e72ed67a9fbf213ab7940d917403bff9dc50,9/6(水) 18:30
theworldw,男子チームも“女子選手にキス”のルビアレス会長を非難　モラタら団結し声明「ルビアレス氏の容認しがたい行為を拒否する」,https://news.yahoo.co.jp/articles/de5cc6b867251c757b45a51503c5ab2b8f2daa3e,9/6(水) 18:01
theworldw,ユナイテッド高額移籍TOP5はすべて失敗!?　4億ポンド以上投じるも成功例なし「なぜこれほど間違ってしまったのか」,https://news.yahoo.co.jp/articles/20c1581b95119bb76719af4df4ac431a76a1ba5e,9/6(水) 17:02
theworldw,デ・ブライネの穴埋める万能FWアルバレスの献身性　マンCの救世主となるハーランドの名相棒,https://news.yahoo.co.jp/articles/40dbbc4321bca444b1af2d5fa9177922ddc795f2,9/6(水) 16:40
theworldw,ラムズデール危うし!?　ラジャはまもなくその力を見せるか「チャンスを与えることを真剣に検討」,https://news.yahoo.co.jp/articles/76d751a541abe7264c74e8b803b299c0bc7692b2,9/6(水) 15:01
theworldw,今度は約395億円の巨額入札　アル・イテハドが今季既に2G2Aのサラー獲得を試みる,https://news.yahoo.co.jp/articles/71060b0c065755db509fc1091e7759180d5e7f1b,9/6(水) 12:02
theworldw,メッシが来たインテル・マイアミはもう“MLS最強クラス”？　キエッリーニは「対戦したチームの中で最高」と絶賛,https://news.yahoo.co.jp/articles/d4714acd44ab2eb6d2ad1bbe844baae88b4fba3b,9/6(水) 8:50
theworldw,ペップがイングランド代表監督はありえる？　サウスゲイトの後任候補と思われる監督陣とは,https://news.yahoo.co.jp/articles/dbde0e5825e89b31c0d2807c1f8d01d81651b014,9/6(水) 8:34
theworldw,カテナチオらしい最後の守備ユニット？　イタリア支えた“BBC”への称賛,https://news.yahoo.co.jp/articles/37417ffd94a7c7331c1cdc7652ca96a44b4d7369,9/6(水) 8:20
theworldw,サウジは“欧州5大リーグ”へ近づくか　圧倒的マネーパワーで狙う将来のビジョン「現実的なゴール」,https://news.yahoo.co.jp/articles/3a67529c9d94a05d85f13689d7b2ff2eccb5adf3,9/5(火) 23:50
theworldw,今夏の主役は“守備的MF”　ロドリ、ライス、カイセド、エンソら頂点を目指す中盤の番人たち,https://news.yahoo.co.jp/articles/2fff6c52194049b733832c86275781f2b76a5633,9/5(火) 23:30
theworldw,サイドバックとは思えぬアシスト力　アザールをも超えるアーノルド驚異のアシスト数,https://news.yahoo.co.jp/articles/2238438baae0d6f83d027155bcb4cbb8b2943254,9/5(火) 23:10
theworldw,求めるはハート、献身性、ハングリーさ　“超熱血監督”になりそうな青年指揮官テベスの挑戦,https://news.yahoo.co.jp/articles/f0ca0c5a292235a57d98a17e0fe0b83adf50143f,9/5(火) 22:30
theworldw,エースが長期離脱のJ2首位・町田、“J1級FW”の加入内定　ファンも「昇格に向けた追い討ち補強」と歓迎,https://news.yahoo.co.jp/articles/52d86ce192aabf9e048af10751ee76b08fec3f02,9/5(火) 18:30
theworldw,《システム変更が大当たり》　1試合平均5人の怪我人を抱えるもレアルは開幕4連勝,https://news.yahoo.co.jp/articles/55ef90084b22bc6f8dffef95731f1ac5cae0f4e2,9/5(火) 18:03
theworldw,今1番波に乗っている選手は彼で決まり？　ハーランドの輝きすぎている1週間の記録,https://news.yahoo.co.jp/articles/fc6e9aea92e0a12edd8036a3bb4f3c4d642d094d,9/5(火) 17:30
theworldw,「キャリアが終わるまでここにいたい」ウォーカーがバイエルンへの移籍を拒否しシティと新契約を結んだ理由を語る,https://news.yahoo.co.jp/articles/d24648d3de815a2fac685161f5b4e45d65433488,9/5(火) 17:00
theworldw,鎌田大地はラツィオ“不動の存在”となれるか　脅威となるゲンドゥージの存在「どちらか1人を外す選択を迫られる」,https://news.yahoo.co.jp/articles/5749fad5009f2ca21b81f53d20e7cf3ce24e8cc2,9/5(火) 8:31
theworldw,世界を魅了したなでしこジャパンも危険？　女子W杯で見えたアジアの立ち位置「パワーバランスが欧州側に傾いている」,https://news.yahoo.co.jp/articles/40c4edb720bae791668eef9065960db31be497e7,9/5(火) 6:50
theworldw,PSGは完全なる“ムバッペ帝国”となった　ムバッペのために動くチームは昨季より強力かもしれない,https://news.yahoo.co.jp/articles/83c02b2f7227ef2a7df40356221272bbb925e12b,9/4(月) 23:10
theworldw,K・ウォーカーが残留を決断したのはペップとの寿司ディナーのおかげ？　バイエルン移籍が噂されたイングランド代表DFはなぜ残ったのか,https://news.yahoo.co.jp/articles/7cad9faa8f3fade01d213c0f925c0524d86c042c,9/4(月) 22:30
theworldw,MFトーマスの離脱期間は6週間？　アーセナルの要の復帰は10月のインターナショナルブレイク後が濃厚か,https://news.yahoo.co.jp/articles/ba638ab92062519c75c06f5ef8a9d85d2c75e787,9/4(月) 21:40
theworldw,4試合7失点のユナイテッド　ファンの間で割れる意見《デ・ヘアとオナナはどちらが良いのか》,https://news.yahoo.co.jp/articles/9a427698d4a38e8b467ae28f3118a197ea4847c7,9/4(月) 21:03
theworldw,モドリッチ、クロースがジョーカーになるとき　途中出場からレアルを変える攻撃の切り札に,https://news.yahoo.co.jp/articles/bcea350190374734f11c2a6e51f18bf844c53bf7,9/4(月) 20:40
theworldw,「日本はドイツ戦に向け準備完了」　現地メディアが浅野のゴールと共に恐怖を蘇らせ日本を再び厳重警戒,https://news.yahoo.co.jp/articles/33f199dc840685406a8455d5ee376130fb33ac5e,9/4(月) 20:23
theworldw,ハフェルツ活躍への導き方は恋の駆け引きと同じ!?   アルテタの奇妙なコメントが話題,https://news.yahoo.co.jp/articles/40e6e346bd31e3f489a492309ed32477305f2d79,9/4(月) 20:19
theworldw,マンCの “もう1人のノルウェー人選手”に注目　トップチームデビューを果たしたオスカー・ボブが短い時間で残した存在感,https://news.yahoo.co.jp/articles/f62881e50849f4ee300f1e2755bdf70e047c3a46,9/4(月) 20:02
theworldw,絶好調な南野、ここまでムバッペに次ぐリーグ2位の高評価　5大リーグでもトップ10入り,https://news.yahoo.co.jp/articles/937deebb7c2e488ed1cdff3159c447551585d956,9/4(月) 19:36
theworldw,「彼がハーランドになることを期待している」　マンU待望のストライカー、ホイルンドにかかる期待　マンUレジェンドも太鼓判を押す,https://news.yahoo.co.jp/articles/ad4d6a8a9f10af93aef1e9e574931fbf27521f28,9/4(月) 19:11
theworldw,今夏退団の噂もあったK・ウォーカーはマンCでのキャプテンを希望？　デ・ブライネ不在時のチームを引っ張るリーダーとなれるか,https://news.yahoo.co.jp/articles/e97be6c6c7be12c56faedda7f05c141718163e98,9/4(月) 16:01
theworldw,早くもサウジ対策を計画のマンC　絶対的ストライカー・ハーランドへの巨額のオファーに備え、2倍の給与を提示か,https://news.yahoo.co.jp/articles/ee03279620f575927bcaf0810ee58fa2e5c16ea5,9/4(月) 15:01
