media_en,media_jp,title_articles,link_articles,date_original
yomidr,読売新聞（ヨミドクター）,夏の便秘は熱中症予備軍？　解消に向けて具だくさんみそ汁がいいわけ…ミントティー、甘酒、ココアもおすすめ,https://news.yahoo.co.jp/articles/900b907e17fe9fa7eb017e08d33e45539a77e1a1,7/31(水) 11:40
yomidr,読売新聞（ヨミドクター）,「お股から何か出てきている」子宮脱・子宮下垂かも…30、40歳代でなることも　原因と治療法は？,https://news.yahoo.co.jp/articles/ebb487343b011cb2e17fb5d553f9863fb1915556,7/30(火) 17:40
yomidr,読売新聞（ヨミドクター）,ベニシアの一周忌　無一文だった若き日の彼女に新宿で京都行きを勧めた米国人ら集う…テーブルにインド料理を並べたワケ,https://news.yahoo.co.jp/articles/f6180686ce6036aae85ef8958bdc63f4bafe029b,7/30(火) 11:40
yomidr,読売新聞（ヨミドクター）,旅慣れたビジネスマンはサングラスを使う？…時差ボケを考える,https://news.yahoo.co.jp/articles/1d8de8c897d417156d75437689be2df8dc50f0d4,7/29(月) 11:52
yomidr,読売新聞（ヨミドクター）,［加古隆さん］トレードマークの帽子をかぶるようになったわけ　コンサート「銀河の旅びと」ポスターが宮沢賢治と似ている？,https://news.yahoo.co.jp/articles/a264e55c633c4180304310c0d18be5d5c34ba8d3,7/28(日) 17:10
yomidr,読売新聞（ヨミドクター）,学会って何をしてるんですか？,https://news.yahoo.co.jp/articles/d28b71f88aac9b3fdda1551423da1c43d3d79007,7/27(土) 20:10
yomidr,読売新聞（ヨミドクター）,減塩など食事制限が厳しい日本　糖尿病や高血圧の高齢者にも食事制限しないスウェーデン　なぜ違う？,https://news.yahoo.co.jp/articles/3d4c2ca453865fbd0faa7411ea58943664f72f73,7/27(土) 18:10
yomidr,読売新聞（ヨミドクター）,新型コロナ　2月に感染した30歳代女性　今も続く倦怠感　「KP．3」でも後遺症が出る可能性…患者11週連続増,https://news.yahoo.co.jp/articles/aff3afd98fe1e1c747f6f6b6f6bd322f7b9ddf0d,7/26(金) 16:11
yomidr,読売新聞（ヨミドクター）,成績が上がらず部長に叱責される課長　夜も眠れず適応障害に…改善に向けて取り組んだのはサウナで「涙活」,https://news.yahoo.co.jp/articles/3a629ffd36547254f0a52b2895425847a473e99a,7/25(木) 11:40
yomidr,読売新聞（ヨミドクター）,お風呂につかって熱中症予防　「41度の湯に10分間つかる全身浴」2週間続けると何が起こる？…進めておきたい「暑熱順化」,https://news.yahoo.co.jp/articles/6811820c5728c4774c602f9f27604b3eab84b648,7/24(水) 17:40
yomidr,読売新聞（ヨミドクター）,介護職場　若手の確保に知恵　記録は音声入力、20〜30歳代職員が大学生に仕事の魅力を紹介…働き手の平均年齢は50歳,https://news.yahoo.co.jp/articles/3fdfb35612254e91844bb1de1c3c927c2dba97be,7/24(水) 17:40
