ctgry,media_jp,title_pickup,title_articles,link_pickup,link_articles,date_original
domestic,朝日新聞デジタル,核抑止力依存の転換を 広島市長,【平和宣言全文】「希望胸に行動し、核抑止力依存の転換を」広島市長,https://news.yahoo.co.jp/pickup/6509826,https://news.yahoo.co.jp/articles/ca0c8bfb31310fc9fbce554ca5c8b26b33655102,8/6(火) 9:02
domestic,Yahoo!ニュース,中継 広島「原爆の日」の平和式典,広島平和記念式典　中継,https://news.yahoo.co.jp/pickup/6509817,,8/6(火) 7:49
domestic,ウェザーマップ,激しい雷雨恐れ 晴れても急変注意,きょう(火)の天気　晴れても天気急変に注意　道路が冠水するような激しい雷雨のおそれ　暑さは変わらず 湿度アップで蒸し暑さ増す,https://news.yahoo.co.jp/pickup/6509812,https://news.yahoo.co.jp/articles/f41ebce14a73bd911944d8284fb800ded372d8b5,8/6(火) 6:40
domestic,日テレNEWS NNN,6日も猛烈な暑さ 雷雨となる所も,【天気】広く猛烈な暑さ　東北〜西日本で非常に激しい雨のおそれも,https://news.yahoo.co.jp/pickup/6509806,https://news.yahoo.co.jp/articles/4566f905edf3007243cda9d28bd6fdf35a16b838,8/5(月) 23:36
domestic,tenki.jp,お盆にかけ局地的な雷雨が頻発か,お盆休みにかけて「ゲリラ雷雨」頻発か　夏空が安定せず雷雨の発生しやすい原因とは,https://news.yahoo.co.jp/pickup/6509772,https://news.yahoo.co.jp/articles/41d6a5d1a5675ebe2216bcbdae7302513a7ba472,8/5(月) 17:10
domestic,毎日新聞,レバノン全土に退避勧告 外務省,外務省がレバノン全土に退避勧告　ヒズボラとイスラエル間の緊張続き,https://news.yahoo.co.jp/pickup/6509770,,8/5(月) 16:48
domestic,スポーツ報知,作家の大崎善生さんが死去 66歳,作家の大崎善生さんが死去　６６歳　「聖の青春」など将棋ノンフィクションで活躍,https://news.yahoo.co.jp/pickup/6509754,https://news.yahoo.co.jp/articles/0d1f88e8c637d38a07b952e943f793846d3bfc75,8/5(月) 14:52
domestic,読売新聞オンライン,キャリア官僚10年未満で退職 最多,キャリア官僚「１０年未満で退職」過去最多、理由は長時間労働や「もっと魅力的な仕事に」,https://news.yahoo.co.jp/pickup/6509720,https://news.yahoo.co.jp/articles/a5439e6adb5430bf43dc86c991156c17890a283e,8/5(月) 9:40
domestic,TBS NEWS DIG Powered by JNN,岸田首相「交代すべき」7割 JNN,自民党総裁選で「岸田総理交代すべき」が7割に　自民党支持層の6割近くも「交代した方がいい」8月JNN世論調査,https://news.yahoo.co.jp/pickup/6509711,https://news.yahoo.co.jp/articles/dda45f3c5cdf176e7785400d5a026c71296b0a3e,8/5(月) 8:46
domestic,読売新聞オンライン,学童保育の登録 来年度にも厳格化,学童保育の登録条件を来年度にも厳格化…６割で利用実態乏しく、待機児童の解消図る,https://news.yahoo.co.jp/pickup/6509710,https://news.yahoo.co.jp/articles/3d168b2b5ea2c4768b185799ff8811c84fc00cc8,8/5(月) 8:24
domestic,tenki.jp,関東から九州にかけて猛暑続く,今日5日(月)　関東から九州にかけて猛暑が続く　熱中症対策を万全に,https://news.yahoo.co.jp/pickup/6509704,https://news.yahoo.co.jp/articles/a9dce9d7119809096559ac56a65216f7f794ba3f,8/5(月) 7:28
