ctgry,media_jp,title_pickup,title_articles,link_pickup,link_articles,date_original
local,TBS NEWS DIG Powered by JNN,奄美地方に線状降水帯か 27日夜～,【台風10号】線状降水帯“半日前”予測情報　奄美地方に発表　今夜からあす午後にかけて　あす正午まで400ミリ予想,https://news.yahoo.co.jp/pickup/6511892,https://news.yahoo.co.jp/articles/aa7fcbc1f8b0d89157597a7625a6ae88333d5194,8/27(火) 12:08
local,ＫＲＹ山口放送,オスプレイの基地配備を容認 岩国,【速報】米軍岩国基地へのオスプレイ・F35C配備計画　岩国市長が容認,https://news.yahoo.co.jp/pickup/6511879,https://news.yahoo.co.jp/articles/58fb80acba168ae3e8786825e8fd94fb66dee147,8/27(火) 10:51
local,まいどなニュース,子供食堂で中学生が転売 悩む店主,中学生が小学生に100円で転売、大人だけの来店も続出…子供食堂を中止　たこ焼き屋店主が決めた新ルールとは？　,https://news.yahoo.co.jp/pickup/6511870,https://news.yahoo.co.jp/articles/c8ffee374c2f92b69bf32749732320be016d0915,8/27(火) 9:09
local,毎日新聞,市長の退職金 ネット投票で決定?,市民の評価で退職金の額決定？　茨城・つくば市長が条例案提出へ,https://news.yahoo.co.jp/pickup/6511865,https://news.yahoo.co.jp/articles/da76c3b0ef03ec936a6e09f866a20e102e337c28,8/27(火) 8:34
local,産経新聞,抜歯手術で子死亡 ありえへんと父,「抜歯で命を落とすなんて…」息子を亡くした父親、悲しみと憤りを吐露,https://news.yahoo.co.jp/pickup/6511862,https://news.yahoo.co.jp/articles/df79f3ac49cf1037bd5eca9862cc3e00193cf0ad,8/27(火) 7:53
local,産経新聞,抜歯手術で17歳死亡 父が憤り吐露,「抜歯で命を落とすなんて…」息子を亡くした父親、悲しみと憤りを吐露,https://news.yahoo.co.jp/pickup/6511858,https://news.yahoo.co.jp/articles/df79f3ac49cf1037bd5eca9862cc3e00193cf0ad,8/27(火) 7:39
local,朝日新聞デジタル,兵庫知事巡り 維新が対応判断へ,維新代表、党対応判断へ　兵庫知事問題、30日の百条委の内容踏まえ,https://news.yahoo.co.jp/pickup/6511856,https://news.yahoo.co.jp/articles/aa2cdb6f0e8a3f59a584386644dba29c59911965,8/27(火) 6:47
local,弁護士ドットコムニュース,裸見られ苦痛 女性受刑者が国提訴,「男性刑務官に全裸を見られ精神的苦痛」女性受刑者が国賠提訴　弁護士は「暴力の一種」,https://news.yahoo.co.jp/pickup/6511837,https://news.yahoo.co.jp/articles/71fe878adfdecf51e8fb2cb67e4e7d18fdb8b2e4,8/26(月) 20:23
local,ウェザーマップ,27日午前 東海に線状降水帯発生か,台風10号　東海で27日(火)午前に「線状降水帯」発生の可能性　台風は29日(木)以降に西日本接近のおそれ　暴風・高波・土砂災害など厳重警戒,https://news.yahoo.co.jp/pickup/6511840,https://news.yahoo.co.jp/articles/990105603b5d02d6a60a84169740a3b2d083ca5d,8/26(月) 20:21
local,朝日新聞デジタル,パワハラ疑い鹿角市長 研修受講へ,秋田・鹿角市長が「パワハラ」謝罪、研修受講へ　「あった」回答3割,https://news.yahoo.co.jp/pickup/6511833,https://news.yahoo.co.jp/articles/71a6937faa4e877b7d812a37f39a2f7d7b355252,8/26(月) 19:23
local,ＳＢＣ信越放送,キャンピングカー横転 8歳が死亡,【続報】8歳の男の子が死亡　東京・新宿区の小学生と身元確認　上信越道で一家が5人乗ったキャンピングカーの横転事故　車は48歳の父親が運転　70代の祖父母も骨折などの重軽傷　,https://news.yahoo.co.jp/pickup/6511806,https://news.yahoo.co.jp/articles/552ccf838ca5cffd7f4982d140d11212080350a2,8/26(月) 15:31
local,読売テレビ,抜歯手術後に死亡 医師を書類送検,【速報】全身麻酔の抜歯手術で17歳生徒死亡　歯科医師2人書類送検　 気管から酸素チューブ外れたか　業務上過失致死の疑い,https://news.yahoo.co.jp/pickup/6511793,https://news.yahoo.co.jp/articles/70b06d36ff657575077d03773f590c96226833f7,8/26(月) 12:31
local,RBC琉球放送,シュノーケル5分で溺れ74歳死亡,シュノーケルを始めて5分で意識不明・心肺停止　親族らが引き上げるも74歳の男性死亡　,https://news.yahoo.co.jp/pickup/6511776,https://news.yahoo.co.jp/articles/f35a7cbba44a7a7fd6282fb84ece3a51b6e45382,8/26(月) 9:11
local,テレビ朝日系（ANN）,花火で日本船「妨害」中国の漁船,中国船“禁輸後”も三陸沖操業かデータで浮かぶ実態 日本の漁師「矛盾してる」,https://news.yahoo.co.jp/pickup/6511771,https://news.yahoo.co.jp/articles/052f70f50116a40b15507b03d9838218b4c113c5,8/26(月) 8:25
local,日テレNEWS NNN,栃木県に線状降水帯 厳重警戒を,栃木県北部で「線状降水帯」が発生　猛烈な雨降り続く,https://news.yahoo.co.jp/pickup/6511759,https://news.yahoo.co.jp/articles/ed2b1004f80cb4bec421c91cf7ede7e4ba1dc5d3,8/26(月) 0:57
local,関西テレビ,維新の現職首長 大阪府で初の敗北,【速報】大阪で『維新が敗北』　自民離党の元府議が箕面市長選を制す　維新公認の現職首長が大阪で落選するのは初　吉村氏が応援も及ばず,https://news.yahoo.co.jp/pickup/6511754,https://news.yahoo.co.jp/articles/debc3c4ad67212f6af447bff78b23f408483e46e,8/25(日) 22:58
local,読売新聞オンライン,富山県で1時間146ミリの雨 警戒を,富山県上市町で１時間に１４６ミリの降雨、黒部市でも７４ミリ…石川と富山で土砂災害警戒情報,https://news.yahoo.co.jp/pickup/6511733,https://news.yahoo.co.jp/articles/9aadef77f2835e901e1853c17ddd9d562189f307,8/25(日) 18:12
local,チューリップテレビ,若い女性の転出止まらぬ富山 なぜ,“若い女性の転出” なぜとまらない? 一旦出たら戻りたくない富山…人口100万人から減り続け　親が聞いたらショックな本音も,https://news.yahoo.co.jp/pickup/6511730,https://news.yahoo.co.jp/articles/0c3170d3faa4b860a24afb840f6aab1aefb3ade9,8/25(日) 18:11
local,読売新聞オンライン,山口達也さん 講演で語る悔悟の念,元ＴＯＫＩＯ山口達也さん、飲酒運転防止インストラクターとして「体験と悔悟」語る…福岡３児死亡事故１８年,https://news.yahoo.co.jp/pickup/6511722,https://news.yahoo.co.jp/articles/01b6438b462176453e788e554e38b91c8dc960db,8/25(日) 16:07
local,毎日新聞,路上生活の夏 炎天下さまよう人も,酷暑の夏　路上生活者、つかの間の涼求め　炊き出しにも制約,https://news.yahoo.co.jp/pickup/6511713,https://news.yahoo.co.jp/articles/d073900dd16368d464806e95a9bcec9a0b8d84ba,8/25(日) 15:30
local,テレビ朝日系（ANN）,中古品買取店で強盗致傷疑い 逮捕,中古品買取店から130万円の入った金庫強奪か、35歳男を逮捕　逃走途中の川でほぼ全額見つかる　栃木,https://news.yahoo.co.jp/pickup/6511712,https://news.yahoo.co.jp/articles/ba066c26feee3b418c56425d966e3403ded501ea,8/25(日) 14:04
local,東洋経済オンライン,19浪して九大に合格 感動はなく,「19浪で九州大学に合格」。共通一次とセンター試験受け続けて20年、心病まずに挑戦し続けられた理由。,https://news.yahoo.co.jp/pickup/6511708,,8/25(日) 13:34
local,日テレNEWS NNN,父の死刑執行いつ 覚悟決める息子,"母を殺したのは、父だった　事件から24年…""死刑囚の子""として生きる息子　たどり着いた答え【Nドキュポケット】",https://news.yahoo.co.jp/pickup/6511696,https://news.yahoo.co.jp/articles/2e54477e11ce86f3486ffacb3cac502b7f7ccd9c,8/25(日) 11:01
local,朝日新聞デジタル,区立校の越境入学 不正あっせんか,千代田区立校の越境入学で虚偽申請　元議長あっせん、保護者から金品,https://news.yahoo.co.jp/pickup/6511684,https://news.yahoo.co.jp/articles/34b4c7f72f669c1add9cb3dc445095a6718f2896,8/25(日) 8:34
