ctgry,media_jp,title_pickup,title_articles,link_pickup,link_articles,date_original
entertainment,スポニチアネックス,八乙女が結婚 STARTO今年6人目,八乙女光が結婚発表　STARTO社結婚ラッシュ！今年6人目、有岡大貴に続きヘイセイ連続で,https://news.yahoo.co.jp/pickup/6510489,https://news.yahoo.co.jp/articles/1663cd5e7ca5200025404d6ec2be230a3c05b039,8/12(月) 18:57
entertainment,オリコン,Hey!Say!JUMP八乙女光が結婚,Hey! Say! JUMP八乙女光、一般女性と結婚「もっと笑顔に出来るように、感謝の気持ちを込めて頑張ります」,https://news.yahoo.co.jp/pickup/6510481,https://news.yahoo.co.jp/articles/23eb56717b97801e6ec08dad6c1af635d2efa624,8/12(月) 17:10
entertainment,ENCOUNT,金属バット・友保隼平 結婚を報告,金属バット友保隼平、結婚を発表　39歳誕生日にサラリと報告「やったぜ！結婚したぞ！」,https://news.yahoo.co.jp/pickup/6510439,https://news.yahoo.co.jp/articles/b9fd4ebaa2f1a524f5b1f5b2d80247bc8a159039,8/12(月) 9:05
entertainment,スポニチアネックス,閉会式 空からトム・クルーズ登場,空からトム・クルーズだ〜！閉会式にサプライズ登場　ミッションinパリtoロス　会場大興奮,https://news.yahoo.co.jp/pickup/6510432,https://news.yahoo.co.jp/articles/64434681aaa467f3115fb8b33dc495b756bc2110,8/12(月) 7:39
entertainment,スポニチアネックス,松山千春が狭心症悪化 ツアー中止,松山千春　狭心症の症状悪化でコンサートツアーの中止を発表　「手術に臨み、再び歌えるよう頑張りたい」,https://news.yahoo.co.jp/pickup/6510430,https://news.yahoo.co.jp/articles/c264efdce5487eed5dfea0fb703c8d6188e80319,8/12(月) 0:05
entertainment,スポニチアネックス,投稿物議 事務所がアナの契約解消,“男性の体臭が苦手すぎる”物議フリーアナ「異性の名誉毀損」事務所との契約解消「大変反省しております」,https://news.yahoo.co.jp/pickup/6510424,https://news.yahoo.co.jp/articles/3aee071468b85f84aabd942e8bebe2c61280c7f3,8/11(日) 22:59
entertainment,スポニチアネックス,青山テルマ結婚 芸能界から祝福,青山テルマが結婚発表　芸能界から祝福の声　広すぎる交友関係でコメント欄も豪華な「おめでとう」相次ぐ,https://news.yahoo.co.jp/pickup/6510399,https://news.yahoo.co.jp/articles/6e991884f6462e6e4e5d413057b844793d73d20c,8/11(日) 16:10
entertainment,スポーツ報知,青山テルマが結婚 相手は一般人,青山テルマ、結婚を発表「お互いに支え合い、私達らしくオモロい家庭を築いていきたい」お相手は一般人【コメント全文】,https://news.yahoo.co.jp/pickup/6510388,https://news.yahoo.co.jp/articles/51768c0f30b4b95ec342285728cfc5899add0413,8/11(日) 12:43
entertainment,スポーツ報知,青山テルマ、結婚を発表,青山テルマ、結婚を発表,https://news.yahoo.co.jp/pickup/6510385,,8/11(日) 12:12
entertainment,TBS NEWS DIG Powered by JNN,ランジャタイ・伊藤幸司 活動休止,ランジャタイ　伊藤幸司さん　芸能活動を休止　「未成年の女性と関係を持ったことが発覚」 　本人もSNSで謝罪　「深く反省し、徹底して自分自身を見つめ直します」　【全文】,https://news.yahoo.co.jp/pickup/6510381,https://news.yahoo.co.jp/articles/4ca846a0b1abca41c0b19f95ca7383d6048f635a,8/11(日) 11:22
entertainment,日刊スポーツ,フワちゃん 芸能活動休止を発表,フワちゃん活動休止を発表「自分のことを 見つめ直す時間に」不適切投稿を直接謝罪も収束せず,https://news.yahoo.co.jp/pickup/6510373,https://news.yahoo.co.jp/articles/ceb76bd5a75637e28ee953c3c1e71fef14a88ac2,8/11(日) 9:39
entertainment,オリコン,中山秀征 中丸夫妻との会話明かす,『シューイチ』中丸雄一の謹慎を発表後初の生放送　番組冒頭でMCの中山秀征が謝罪　夫妻との会話を明かし「新たな中丸君としての機会に」,https://news.yahoo.co.jp/pickup/6510369,https://news.yahoo.co.jp/articles/7d382d70bd7c6562e1e1d3d7b55454df3f62fed0,8/11(日) 8:56
entertainment,スポニチアネックス,ばんばんざい・るな 結婚を発表,超人気ユーチューバー「ばんばんざい」るなが結婚！　お相手は“同業”「エスポワール・トライブ」はんくん,https://news.yahoo.co.jp/pickup/6510349,https://news.yahoo.co.jp/articles/be310b2d4ec9deb32371a4230efcb79b4040db78,8/10(土) 23:20
entertainment,モデルプレス,乃木坂46 掛橋沙耶香が芸能界引退,乃木坂46掛橋沙耶香、卒業＆芸能界引退発表 2022年ライブ中の転落事故から休養していた,https://news.yahoo.co.jp/pickup/6510347,https://news.yahoo.co.jp/articles/eaad6d20f45800af6d56abdcca8e45858d6aa77d,8/10(土) 21:33
entertainment,スポニチアネックス,KENZO ブレイキン金のAMIを祝福,KENZO　ブレイキン初代王者AMI祝福「歴史に名を刻んでくれてありがとう」　勝因は「経験値の差」,https://news.yahoo.co.jp/pickup/6510344,https://news.yahoo.co.jp/articles/a30854a4c392cf1237b4595ad7069b6b2f782e67,8/10(土) 20:47
entertainment,ENCOUNT,久間田琳加 身長のサバ読んでいた,久間田琳加、公式プロフの身長サバ読み告白　現在も成長中「たぶんたどり着いた」,https://news.yahoo.co.jp/pickup/6510325,https://news.yahoo.co.jp/articles/467d765eca81cfd717ae3ebf3edfde2da4e471df,8/10(土) 17:04
entertainment,オリコン,騒動にやす子 もう終わりましょう,やす子「フワちゃんさんのことめちゃめちゃ許してます」　誹謗中傷をやめるように投稿,https://news.yahoo.co.jp/pickup/6510324,https://news.yahoo.co.jp/articles/be58b97a47c62be2b64205cbdc0c047effb55f52,8/10(土) 16:31
entertainment,オリコン,やす子 めちゃめちゃ許してます,やす子「フワちゃんさんのことめちゃめちゃ許してます」　誹謗中傷をやめるように投稿,https://news.yahoo.co.jp/pickup/6510321,https://news.yahoo.co.jp/articles/be58b97a47c62be2b64205cbdc0c047effb55f52,8/10(土) 16:13
entertainment,オリコン,たべっ子どうぶつ 初アニメ映画化,『たべっ子どうぶつ』初アニメ映画化で来年5月公開　主演・らいおんくん！動画解禁,https://news.yahoo.co.jp/pickup/6510298,https://news.yahoo.co.jp/articles/f0a412c2a9fbe73dcb68910bdf5ac6ad3ff4046d,8/10(土) 11:07
entertainment,オリコン,フワちゃん「ANN0」の降板決定,フワちゃん『ANN0』降板　誹謗中傷する行為「決して認めることができない」　後任は「調整中です」,https://news.yahoo.co.jp/pickup/6510228,https://news.yahoo.co.jp/articles/f340e72868088da5c78653faeb36c6add7913d3c,8/9(金) 17:40
entertainment,中日スポーツ,藤波朱理の金 地上波で中継されず,レスリング『藤波朱理の金メダル』地上波放送なしに困惑の声…「BSか。地上波でやるべき試合だろ」「マジ」「酷くない？」【パリオリンピック】,https://news.yahoo.co.jp/pickup/6510215,https://news.yahoo.co.jp/articles/246e102e14df0cc562d310bdb3c404ab589ff095,8/9(金) 15:50
entertainment,中日スポーツ,藤波朱理の金 地上波中継なく困惑,レスリング『藤波朱理の金メダル』地上波放送なしに困惑の声…「BSか。地上波でやるべき試合だろ」「マジ」「酷くない？」【パリオリンピック】,https://news.yahoo.co.jp/pickup/6510212,https://news.yahoo.co.jp/articles/246e102e14df0cc562d310bdb3c404ab589ff095,8/9(金) 15:07
entertainment,オリコン,やす子 騒動「今後言及しません」,やす子、フワちゃんとの騒動「今後は言及しません」　自身のスタンス表明「明るい言葉を発信したい」,https://news.yahoo.co.jp/pickup/6510209,https://news.yahoo.co.jp/articles/7ae91629ccdf282d5a5f716b7b7fdb77650b4ee4,8/9(金) 14:29
entertainment,NEWSポストセブン,TKO木下 歌舞伎町で「ホスト」に,TKO木下隆行が「ホスト転身」　働く店は相方・木本武宏の「巨額詐欺騒動」が関係する“因縁のホストクラブ”,https://news.yahoo.co.jp/pickup/6510184,https://news.yahoo.co.jp/articles/e8e4a3b3dbe56084efee262bacf6741091c120ba,8/9(金) 10:32
entertainment,スポーツ報知,元フジ久代萌美アナ 第1子を出産,久代萌美アナが第１子出産を公表「家族３人での新しい生活を、楽しく過ごしております」　夫はユーチューバー・はるくん【コメント全文】,https://news.yahoo.co.jp/pickup/6510168,https://news.yahoo.co.jp/articles/9831bf8086367fddbd31ad885560f3e15576e40c,8/9(金) 7:46
entertainment,日刊スポーツ,やす子に直接謝罪 フワちゃん報告,フワちゃん「操作を誤って実際に投稿」不適切投稿でやす子に直接謝罪「確執など全くありません」,https://news.yahoo.co.jp/pickup/6510167,https://news.yahoo.co.jp/articles/3fc90d1e35d121b2f4c927d0772023f92ed3ab0a,8/9(金) 7:32
entertainment,オリコン,Perfume衝撃 ずっと結成年勘違い,Perfume、結成年をずっと1年勘違い「衝撃事実」　すでに25周年突入＆Wikipediaの修正をお願い,https://news.yahoo.co.jp/pickup/6510092,https://news.yahoo.co.jp/articles/97b1bea17d7ea91f3adae3a0b71909a035fb216e,8/8(木) 15:07
entertainment,スポニチアネックス,元日向坂・潮 セントフォース入り,元「日向坂46」潮紗理菜　セント・フォース入り「言葉と向き合い届けたい」癒しボイスの“聖母”で人気,https://news.yahoo.co.jp/pickup/6510086,https://news.yahoo.co.jp/articles/e38dd6c4ae6a01314216b2cc025c76fac6cd1808,8/8(木) 13:56
entertainment,共同通信,タレントのなすび 石川観光大使に,なすびさん、石川県観光大使に　能登半島地震の被災地支援,https://news.yahoo.co.jp/pickup/6510081,https://news.yahoo.co.jp/articles/bf9ab54ceefbcd32dfe854cd7855c5865cb7e100,8/8(木) 12:55
entertainment,共同通信,能登地震支援のなすび 観光大使に,なすびさん、石川県観光大使に　能登半島地震の被災地支援,https://news.yahoo.co.jp/pickup/6510069,https://news.yahoo.co.jp/articles/bf9ab54ceefbcd32dfe854cd7855c5865cb7e100,8/8(木) 11:37
entertainment,モデルプレス,平手友梨奈 事務所と専属契約終了,平手友梨奈、HYBEとの専属契約終了,https://news.yahoo.co.jp/pickup/6510064,https://news.yahoo.co.jp/articles/4d4cfab8d7584c5c9fd08632dfd137f9b2279ee9,8/8(木) 11:13
entertainment,スポニチアネックス,岸田タツヤ&高木由梨奈アナが結婚,俳優・岸田タツヤとフリーアナの高木由梨奈が結婚発表「手を取り合い温かい家庭を」,https://news.yahoo.co.jp/pickup/6510056,https://news.yahoo.co.jp/articles/f3520d48090b222e800d936124e39b35090c6a72,8/8(木) 10:01
entertainment,オリコン,広末涼子 約25年ぶりライブ開催へ,広末涼子、約25年ぶりにライブ開催　音楽を通して「ありがとうの気持ちを届けたい」,https://news.yahoo.co.jp/pickup/6510005,https://news.yahoo.co.jp/articles/d8d482c97501aa37cfd3135820b2ea4c1a36d690,8/7(水) 19:00
entertainment,スポニチアネックス,中丸雄一謹慎 対応に追われる各局,中丸雄一　テレビ各局が「出演見合わせ」対応を発表　テレ朝、日テレにラジオ…人気番組レギュラー多数,https://news.yahoo.co.jp/pickup/6510004,https://news.yahoo.co.jp/articles/42122b9e7c34ba60dbf2ba08ee57dbbb4263563c,8/7(水) 18:48
entertainment,FNNプライムオンライン（フジテレビ系）,中丸雄一が謹慎 後悔と謝罪つづる,「後悔の念しかございません」KAT-TUNの中丸雄一さんが謹慎発表「お叱りの葉を全てしっかりと受けめる」妻以外の女性との密会報道受け,https://news.yahoo.co.jp/pickup/6509990,https://news.yahoo.co.jp/articles/fec38672e72d253677660ec40edf572e26c6e985,8/7(水) 16:55
entertainment,FNNプライムオンライン（フジテレビ系）,中丸が謹慎「妻に悲しい思いを」,「後悔の念しかございません」KAT-TUNの中丸雄一さんが謹慎発表「お叱りの葉を全てしっかりと受けめる」妻以外の女性との密会報道受け,https://news.yahoo.co.jp/pickup/6509987,https://news.yahoo.co.jp/articles/fec38672e72d253677660ec40edf572e26c6e985,8/7(水) 16:40
entertainment,文春オンライン,中丸雄一が謹慎 女性とホテル密会,「本人の希望も含め謹慎」KAT-TUN中丸雄一（40）が橋本環奈似女子大生と“アパホテル密会”休業へ　事務所は「家族やお相手に辛い思いをさせたことを深く反省」「弊社も看過できず、大変遺憾」,https://news.yahoo.co.jp/pickup/6509968,https://news.yahoo.co.jp/articles/ae0c5a519a05d68596836803d24f2832084836c1,8/7(水) 13:21
entertainment,ENCOUNT,大木凡人 ケンカうったことはない,「凡ちゃ〜ん」の大木凡人、大動脈解離を経ても「生涯現役」　“芸能界最強説”は本当か,https://news.yahoo.co.jp/pickup/6509962,https://news.yahoo.co.jp/articles/31e2739a3538d851a0b598ebe98b2fd601aa25a0,8/7(水) 11:58
entertainment,スポニチアネックス,中丸雄一 TV各局に休業申し入れ,KAT―TUN・中丸雄一　休業をテレビ各局に申し入れ　キー局関係者「何らかのスキャンダルがあった」,https://news.yahoo.co.jp/pickup/6509948,https://news.yahoo.co.jp/articles/f2eb4e138ad7553493ecbba2b3b749993713ffe9,8/7(水) 10:33
entertainment,ENCOUNT,大木凡人79歳 今も元気で生涯現役,大木凡人、大動脈解離を経ても「生涯現役」　“芸能界最強説”は本当か「ガードマンもやった」,https://news.yahoo.co.jp/pickup/6509943,https://news.yahoo.co.jp/articles/31e2739a3538d851a0b598ebe98b2fd601aa25a0,8/7(水) 10:12
entertainment,スポニチアネックス,フワちゃん やす子に直接謝罪,フワちゃん　やす子に直接謝罪　日テレ「行列」は出演シーンカットへ　CM動画は非公開に,https://news.yahoo.co.jp/pickup/6509935,https://news.yahoo.co.jp/articles/118c484ca61efb00d8692baeb4701528e9e4c7b3,8/7(水) 8:32
entertainment,オリコン,初代しんちゃん役 矢島晶子が改名,声優・矢島晶子が改名「うえちあき」に　代表作に『クレしん』初代しんちゃん役・『ガンダムW』リリーナ役など,https://news.yahoo.co.jp/pickup/6509933,https://news.yahoo.co.jp/articles/0c46aff5bb82bae0b639109260adaeb82fc14601,8/7(水) 8:15
