ctgry,media_jp,title_pickup,title_articles,link_pickup,link_articles,date_original
world,読売新聞オンライン,ウクライナの越境攻撃 交渉狙いか,ウクライナがロシア西部に最大規模の越境攻撃、外交交渉を有利に進める狙い…ガス関連施設を制圧,https://news.yahoo.co.jp/pickup/6510370,https://news.yahoo.co.jp/articles/cbe601b1c1ebe49e5ec370588a56195463714659,8/11(日) 9:02
world,共同通信,ウクライナ越境攻撃 ロシアに衝撃,ウクライナ奇襲、ロシアに衝撃　越境攻撃5日目、緊張続く,https://news.yahoo.co.jp/pickup/6510352,https://news.yahoo.co.jp/articles/7f36dc2beaeb80e19ccdb2040b3ba2a5159a5606,8/11(日) 0:08
world,共同通信,駐日米大使 11月下旬に離任の意向,駐日米大使、11月に離任意向　民主勝利なら政権移行関与,https://news.yahoo.co.jp/pickup/6510346,https://news.yahoo.co.jp/articles/ac81f0d52aab84363a3a270cff9aec05a5cd4254,8/10(土) 21:31
world,テレビ朝日系（ANN）,ウから越境攻撃続き 露政権に批判,ウクライナの対ロシア越境攻撃続きプーチン政権への批判高まる,https://news.yahoo.co.jp/pickup/6510335,https://news.yahoo.co.jp/articles/941e4cee623feefaa98ae60be4031c8960a580e0,8/10(土) 18:51
world,ＡＦＰ＝時事,トランプ氏 披露の逸話は大ぼら?,トランプ氏が「大ぼら」、会見で披露した逸話を本人らが否定,https://news.yahoo.co.jp/pickup/6510334,https://news.yahoo.co.jp/articles/3a25195e49831409838d5917e68542fe212c345e,8/10(土) 18:39
world,共同通信,中国 自己破産制度の導入を検討,中国、自己破産制度の導入検討　個人債務急増、苦しみ永遠,https://news.yahoo.co.jp/pickup/6510323,https://news.yahoo.co.jp/articles/ed2df5bf0796423b361974286009720242036cee,8/10(土) 16:35
world,FNNプライムオンライン（フジテレビ系）,ガザの学校に空爆 100人以上死亡,ガザの学校が空爆され100人以上死亡…イスラエル軍は「イスラム組織ハマスの拠点」と正当性主張　パレスチナ自治区,https://news.yahoo.co.jp/pickup/6510317,,8/10(土) 15:27
world,共同通信,水原被告の違法賭博胴元 罪認める,水原一平被告の胴元、罪認める　違法賭博を運営、来年2月に量刑,https://news.yahoo.co.jp/pickup/6510308,https://news.yahoo.co.jp/articles/959707f5ac6bd0360c889b414eb8307d96c82b82,8/10(土) 13:48
world,読売新聞オンライン,ウ軍 ロシア西部で占領地域拡大か,ウクライナ軍、ロシア西部で占領地域拡大か…米国製装甲車などの精鋭部隊投入か,https://news.yahoo.co.jp/pickup/6510288,https://news.yahoo.co.jp/articles/84b7467f7a76525313c30740391ba553da0dd252,8/10(土) 8:21
world,テレビ朝日系（ANN）,ブラジルで旅客機墜落 全員死亡,ブラジルで旅客機が墜落　乗客乗員61人全員死亡,https://news.yahoo.co.jp/pickup/6510282,,8/10(土) 7:19
world,朝日新聞デジタル,ウで14人死亡 スーパーなどに攻撃,ウクライナ東部で14人死亡　スーパーや郵便施設にロシア軍の攻撃,https://news.yahoo.co.jp/pickup/6510266,https://news.yahoo.co.jp/articles/c50685d6acbba7965f03370a6dd409633cd5c428,8/10(土) 0:40
world,時事通信,トランプ氏焦りか ハリス氏を批判,ハリス氏の勢いに焦り　トランプ氏、長時間会見で「極左」批判　米大統領選,https://news.yahoo.co.jp/pickup/6510259,https://news.yahoo.co.jp/articles/e0019ecee3c9bd4e8f236c328c0d1a6bfb7b5365,8/9(金) 22:58
world,朝日新聞デジタル,ウで10人死亡 スーパーなどに攻撃,ウクライナ東部で10人死亡　スーパーや郵便施設にロシア軍の攻撃,https://news.yahoo.co.jp/pickup/6510258,https://news.yahoo.co.jp/articles/c50685d6acbba7965f03370a6dd409633cd5c428,8/9(金) 22:41
world,日刊スポーツ,須崎を破った選手 メダル求め提訴,【レスリング】体重超過で失格のインドのビネシュが銀メダル求めてスポーツ仲裁裁判所に提訴,https://news.yahoo.co.jp/pickup/6510256,https://news.yahoo.co.jp/articles/1f6c7f7cd19baedb825fb68407481f47e312bb0d,8/9(金) 22:19
world,BBC News,英の女児3人刺殺 なぜ騒乱に発展,【解説】 イギリスの騒乱はなぜ起きたのか,https://news.yahoo.co.jp/pickup/6510237,https://news.yahoo.co.jp/articles/9a65e9a7a3b3ce5c4ce7fa91601d25fe5bf95ddc,8/9(金) 18:56
world,テレビ朝日系（ANN）,タイで日本人切断遺体 2人を逮捕,【速報】タイの日本人切断遺体事件　ラオスで拘束の容疑者2人をタイ警察が逮捕,https://news.yahoo.co.jp/pickup/6510235,https://news.yahoo.co.jp/articles/92755f93532adddaab6ac3b0462f931af99d1544,8/9(金) 18:45
world,毎日新聞,ガザ停戦交渉が15日に再開か 要請,ガザ停戦交渉15日に再開か　仲介国がハマスとイスラエルに要請,https://news.yahoo.co.jp/pickup/6510220,https://news.yahoo.co.jp/articles/f3024d0946b6915b88bdcb1d99f9f87af4ecc7dd,8/9(金) 17:03
world,共同通信,バンクシー新作 公開後すぐ盗難か,バンクシー新作盗まれる　4作目オオカミ、公開すぐ,https://news.yahoo.co.jp/pickup/6510194,https://news.yahoo.co.jp/articles/bcd00bbae542c2e63e6772ab2761d82eeead4f24,8/9(金) 11:55
world,ロイター,米大統領選討論会 9月10日に開催,米大統領選討論会、9月10日に開催　トランプ氏はあと2回提案,https://news.yahoo.co.jp/pickup/6510178,https://news.yahoo.co.jp/articles/45de87e53271f0cc02677ae07c303ca96b874e3c,8/9(金) 9:23
world,ＡＦＰ＝時事,異例 バンクシーが3日連続で新作,バンクシー、3日連続の新作 今度はサル,https://news.yahoo.co.jp/pickup/6510099,https://news.yahoo.co.jp/articles/62e83c1d8e03accb445529bd6177050da970e53d,8/8(木) 16:32
world,CNN.co.jp,バンス氏、ワルツ氏の軍歴を批判,バンス氏、ワルツ氏の軍歴を批判　米副大統領候補の２人は退役軍人,https://news.yahoo.co.jp/pickup/6510093,https://news.yahoo.co.jp/articles/633fec42c62db02c2216481f9adf35b3d3347914,8/8(木) 15:32
world,BBC News,ウが露に越境攻撃 ガス施設制圧か,ウクライナがロシアに越境攻撃、主要ガス施設制圧との情報も　クルスク州に非常事態宣言,https://news.yahoo.co.jp/pickup/6510091,https://news.yahoo.co.jp/articles/277c22a3d626e85a08f7753fa40919a76353e0a7,8/8(木) 15:09
world,ロイター,攻撃受け失明のガザ少女 死にたい,「医者になる夢消えた、死にたい」　イスラエルの攻撃で視力失ったガザ少女,https://news.yahoo.co.jp/pickup/6510084,https://news.yahoo.co.jp/articles/54fa6e86a965cfa40955a4cdda795dcacc47d126,8/8(木) 13:49
world,時事通信,タイの最大野党に解党命令 背景,背景に保守勢力の危機感　強まる改革要求　タイ,https://news.yahoo.co.jp/pickup/6510085,https://news.yahoo.co.jp/articles/b47790541472c69d3da69ba3b6a597746665275b,8/8(木) 13:46
world,ロイター,イスラエル、報復攻撃に厳戒態勢,イスラエル、報復攻撃に厳戒態勢　輸血用血液の備蓄など緊迫高まる,https://news.yahoo.co.jp/pickup/6510046,https://news.yahoo.co.jp/articles/2f0a1857fa8f110f346f135f6dbafa26238456a7,8/8(木) 7:55
world,時事通信,イランが報復計画を再検討か 米紙,イラン、報復計画を再考か　対イスラエル攻撃で米紙,https://news.yahoo.co.jp/pickup/6510014,,8/7(水) 20:13
world,日テレNEWS NNN,庶民的 ハリス氏の副大統領候補,ハリス氏、大統領候補に　副大統領候補は“庶民派”ウォルズ氏　トランプ氏“攻撃”強める,https://news.yahoo.co.jp/pickup/6510011,https://news.yahoo.co.jp/articles/b772ded9c32aaae72c922471e30f423776e24532,8/7(水) 19:46
world,TBS NEWS DIG Powered by JNN,BTS・SUGAさん 飲酒運転で処分,【速報】「BTS」のSUGAさんが電動スクーターを飲酒運転した疑いで捜査　本人はファン向けにコメント,https://news.yahoo.co.jp/pickup/6509977,https://news.yahoo.co.jp/articles/c8071176d5787a7b15dd93144ec5f80a521a1f56,8/7(水) 14:57
world,時事通信,バングラ ユヌス氏主導で暫定政権,ユヌス氏主導の暫定政権発足　治安回復、分断修復焦点　バングラデシュ,https://news.yahoo.co.jp/pickup/6509970,https://news.yahoo.co.jp/articles/793d755e3a3eec94561d9cb723f6d3fc3fd747dc,8/7(水) 13:31
world,MBSニュース,世界分断?「五輪休戦」巡る事情,なぜロシアがNGでイスラエルはOK？『パリオリンピック』の裏側　ロシアは“新オリンピック”の開催を検討！？世界が分断のおそれも【五輪と国際情勢】,https://news.yahoo.co.jp/pickup/6509951,https://news.yahoo.co.jp/articles/54c9178548b6f9ad7ce77d524b724032dc9993e2,8/7(水) 11:34
world,共同通信,洪水被害復旧に30万人志願 北朝鮮,北朝鮮、洪水復旧に志願30万人　金正恩氏「誇らしい」,https://news.yahoo.co.jp/pickup/6509952,,8/7(水) 11:27
world,時事通信,料理教室ABC、中国で一斉に閉店,料理教室ABC、中国で一斉閉店　返金求める声相次ぐ,https://news.yahoo.co.jp/pickup/6509946,https://news.yahoo.co.jp/articles/613c63f6d4ab682ca40f75ddde5e43be7bbe480f,8/7(水) 10:39
world,日テレNEWS NNN,ハリス氏 大統領候補に正式指名,米民主党、ハリス氏を大統領候補に正式指名,https://news.yahoo.co.jp/pickup/6509931,https://news.yahoo.co.jp/articles/9da0d91eb7efb0a352750ec9bfc6515ceab9240d,8/7(水) 8:55
world,毎日新聞,ハマス最高指導者にシンワル氏,ハマス最高指導者　ハニヤ氏の後任は「強硬派」のシンワル氏,https://news.yahoo.co.jp/pickup/6509926,https://news.yahoo.co.jp/articles/d22ee0a82beb423982a70ebae04cf295f433e59d,8/7(水) 6:59
world,産経新聞,比 メダリストにラーメン一生分も,「日本育ち」体操男子ユーロが億万長者に　パリ五輪でフィリピン初２冠、ラーメン一生分も,https://news.yahoo.co.jp/pickup/6509915,https://news.yahoo.co.jp/articles/aaaa87deaa17d130287aa5691d812eda19919afe,8/7(水) 0:09
world,CNN.co.jp,ハリス氏 副大統領候補にワルツ氏,ハリス氏、副大統領候補にミネソタ州のワルツ知事を起用,https://news.yahoo.co.jp/pickup/6509910,https://news.yahoo.co.jp/articles/cbc2d85c87b3f6f135e0e8620f487c0be5afae58,8/6(火) 22:46
world,TBS NEWS DIG Powered by JNN,米大統領選 株安で「批判合戦」に,世界的な株安がアメリカの株式市場も直撃　トランプ前大統領は「カマラ暴落だ」と持論を展開,https://news.yahoo.co.jp/pickup/6509906,https://news.yahoo.co.jp/articles/3ccf450bed7da68262b66242198dad8d2afdab3d,8/6(火) 21:59
world,毎日新聞,バングラデシュ前首相 英に亡命へ,インドに逃亡中のバングラデシュ・ハシナ前首相、英国に亡命へ　,https://news.yahoo.co.jp/pickup/6509897,https://news.yahoo.co.jp/articles/0563079d6b6358f580531b79940cdfe08589fb31,8/6(火) 20:29
world,テレビ朝日系（ANN）,ハリス氏 民主党候補に正式指名へ,米ハリス副大統領　民主党候補に正式指名へ,https://news.yahoo.co.jp/pickup/6509859,https://news.yahoo.co.jp/articles/2e67b4e1e60b32312d40847b4c05986471e5b639,8/6(火) 14:43
world,読売新聞オンライン,バングラのデモ 背景に経済格差,ハシナ首相の父の像を棒で殴打…バングラデシュデモ、経済格差・強権への不満が一気に噴出,https://news.yahoo.co.jp/pickup/6509846,https://news.yahoo.co.jp/articles/aa75fd18b36a8bd8d529cc2f06fe59aaa37efba6,8/6(火) 12:06
world,テレビ朝日系（ANN）,イラク米軍拠点に攻撃 5人負傷か,イラクの米軍拠点にロケット弾攻撃か　5人負傷と米報道,https://news.yahoo.co.jp/pickup/6509840,https://news.yahoo.co.jp/articles/c6dd7e8257581536880f9ab348d0cc33df38d281,8/6(火) 11:05
world,朝日新聞デジタル,UNRWA職員9人を解職 奇襲関与か,UNRWA職員9人、イスラエル攻撃関与の可能性で解職　国連が公表,https://news.yahoo.co.jp/pickup/6509823,https://news.yahoo.co.jp/articles/bf29071b3ebb50709da9e7c140bbe8557c316b09,8/6(火) 8:30
world,ロイター,バングラ首相が辞任 国外に脱出,バングラデシュ首相が辞任、国外脱出　暫定政権樹立へ,https://news.yahoo.co.jp/pickup/6509797,https://news.yahoo.co.jp/articles/ed57ae6ad1042067ffaa813eb26e8a9c1ca2ac22,8/5(月) 20:41
world,TBS NEWS DIG Powered by JNN,バングラ首相が辞任し出国か 報道,バングラデシュ・ハシナ首相が辞任し、軍用ヘリで出国か　反政府デモ拡大の中　ロイター通信が報じる,https://news.yahoo.co.jp/pickup/6509792,https://news.yahoo.co.jp/articles/b55cb3231905d7265fc1aa541f0c03ec047b2bdc,8/5(月) 19:31
world,毎日新聞,五輪のパリ 路上では若者が物乞い,シャンゼリゼ通りで若年女性が「物乞い」　“包摂”理念の祭典の陰で,https://news.yahoo.co.jp/pickup/6509784,https://news.yahoo.co.jp/articles/38733496d2c32539d29c805a7c1668d78ff34bc9,8/5(月) 18:12
world,CNN.co.jp,マリ、ウクライナとの断交を発表,マリがウクライナと断交、ワグネル襲撃で反体制派に情報提供,https://news.yahoo.co.jp/pickup/6509767,,8/5(月) 16:43
world,RKK熊本放送,米滞在中 プールで溺れ中学生死亡,プールで溺れた女子中学生死亡 熊本・大津町の国際交流事業で米滞在中　町が記者会見へ,https://news.yahoo.co.jp/pickup/6509730,https://news.yahoo.co.jp/articles/0564f9be891f2aaa49e49f7fc173041b95c5d60a,8/5(月) 11:47
world,共同通信,五輪「台湾」グッズまた没収か,「台湾」グッズまた没収か　五輪会場、応援に制限,https://news.yahoo.co.jp/pickup/6509713,https://news.yahoo.co.jp/articles/6a1d6ee0b8f1676696fa7a2dafbe3e649a687505,8/5(月) 9:26
world,ロイター,バングラで大規模デモ 90人超死亡,バングラで首相辞任要求の大規模デモ、警官と衝突で91人死亡,https://news.yahoo.co.jp/pickup/6509714,https://news.yahoo.co.jp/articles/52afaa797ece1928d801a7b187fbd71d3d79be41,8/5(月) 9:18
