media_en,media_jp,title_articles,link_articles,date_original
rnb,南海放送,椿まつり2日目 好天に恵まれ賑わう,https://news.yahoo.co.jp/articles/3acac4d4b34c0be59dd56d7c65622739d8a08002,2/17(土) 14:34
rnb,南海放送,ランナー熱走の裏で ドタバタの設営に救護の現場では…「愛媛マラソン」支える5300人のボランティア＆スタッフたち,https://news.yahoo.co.jp/articles/d5c7d49e4f11d93e94266b1d39b791cd0c2a798f,2/16(金) 18:30
rnb,南海放送,来年松山市にオープン予定「こども本の森」建築家・安藤忠雄さんが施設に込めた思い語る,https://news.yahoo.co.jp/articles/105a0fb1af1424000796263b5077e35b9f07b222,2/16(金) 17:51
rnb,南海放送,愛媛・今治ピアノ教師殺人事件 男子生徒の手足を縛りケガさせる 重要参考人の男を再逮捕,https://news.yahoo.co.jp/articles/5f23461832f9a13f46e2142e71c6e12c9cf36d55,2/16(金) 17:44
rnb,南海放送,「10波であるのは間違いない」コロナ患者数は6週ぶり減少も依然高い水準【愛媛】,https://news.yahoo.co.jp/articles/56be0dc1618b7067e0a8b3c1196423016056699c,2/16(金) 17:23
rnb,南海放送,愛媛県がスキー場のPR動画制作 知事自ら出演しゲレンデを滑走,https://news.yahoo.co.jp/articles/7e3843bd721b0d6e1e0928b0b855534adab13f25,2/16(金) 16:20
rnb,南海放送,伊予路に春を呼ぶ“椿まつり”参拝客が家内安全や商売繁盛を祈願 18日まで開催【愛媛】,https://news.yahoo.co.jp/articles/14d8226eed528be28f5a8e06ed99510215524e7f,2/16(金) 15:48
rnb,南海放送,インボイス導入後初の確定申告がスタート 所得税などは3月15日まで受付【愛媛】,https://news.yahoo.co.jp/articles/6808b7c85d013f9d1523ddab8f8743c96c28cc2e,2/16(金) 13:59
rnb,南海放送,ブライダル・ホテル業界めざす専門学生 卒業制作で2泊3日愛媛旅行プランを提案,https://news.yahoo.co.jp/articles/e7c24f39a1764e72929d24ad28d345d45151933c,2/16(金) 11:16
rnb,南海放送,愛媛・今治ピアノ教師殺人事件 重要参考人の男を逮捕致傷容疑で再逮捕の方針,https://news.yahoo.co.jp/articles/a4cffcac5507f1a8e7bc287ed82e0690120a3aef,2/15(木) 18:40
rnb,南海放送,ランナーたちはどんな思いで42.195キロに挑むのか…1万人が目指したフィニッシュ地点で聞いたそれぞれの「走る理由」,https://news.yahoo.co.jp/articles/c5b35409ea828a2b7f367faa3caa1de786131d24,2/15(木) 18:30
rnb,南海放送,今治市沖で3人死亡の衝突事故 貨物船「白虎」の元航海士の控訴棄却 二審も有罪判決【愛媛】,https://news.yahoo.co.jp/articles/12ceeb99797d4c97bdeb3d782dd6181e2cb17b76,2/15(木) 18:13
rnb,南海放送,国の有形文化財「武徳殿」壁などが味噌や生卵で汚される被害 新居浜市が対応を検討,https://news.yahoo.co.jp/articles/79305235c1044cb21a7b101582a0aa11b5068e89,2/15(木) 18:03
rnb,南海放送,四国地方で春一番 4月並みの暖かさに 椿神社で早咲きの桜が開花【愛媛】,https://news.yahoo.co.jp/articles/631555ed813f55da6357840b773f12365a72d433,2/15(木) 17:53
rnb,南海放送,豊かな心や多様な価値観育んで 小学生が絵本「せかいいちのねこ」の舞台鑑賞,https://news.yahoo.co.jp/articles/db8b8ffd842c799337ebf14a46740ec9d84b1e2d,2/15(木) 17:42
rnb,南海放送,愛媛県新年度予算案は過去最大7283億円 人口減少対策や地域経済の活性化など柱,https://news.yahoo.co.jp/articles/607bcc3dfbf4215377ac2ca43abce13f2d17b029,2/15(木) 15:52
rnb,南海放送,愛媛県民文化会館前の県有地 MICE誘致めざし協力事業者を再募集へ,https://news.yahoo.co.jp/articles/615091a72359e905f82edbcea6484a5db6cd4934,2/15(木) 14:47
rnb,南海放送,瀬戸内海の海洋ごみ削減を目指して 4県が連携し海岸清掃活動【愛媛】,https://news.yahoo.co.jp/articles/cc481efcda30f8c7fbd57049d88ec53a652b6795,2/15(木) 11:47
rnb,南海放送,「家に人が入っています」女性宅に無断で侵入した教育委員会職員の男を逮捕【愛媛・久万高原町】,https://news.yahoo.co.jp/articles/95ea48dfe7ced7fba0db7d7b692d2e6b53ed386f,2/14(水) 21:02
rnb,南海放送,応援団長は浜口京子さん！愛媛マラソンで完走ランナーが口をそろえて“満足！”と語るワケ,https://news.yahoo.co.jp/articles/165acea8e8097f83922c8f5e163f74dc62f1a355,2/14(水) 19:01
rnb,南海放送,J2昇格めざし FC今治が大山祇神社で必勝祈願 今月25日開幕戦【愛媛】,https://news.yahoo.co.jp/articles/5d35b3dc88d44815185c79e8945b75544b2a3b4a,2/14(水) 18:30
rnb,南海放送,四国中央市銃撃事件から1か月…指名手配の前谷容疑者は県外潜伏か　県警が動画で情報提供呼びかけ【愛媛】,https://news.yahoo.co.jp/articles/9dd1d1790f138e5de254291c31c8beb779328f57,2/14(水) 17:55
rnb,南海放送,学習塾で「おやこほけんしつ」体験会 栄養不足の改善で子どもの学力向上図る【愛媛】,https://news.yahoo.co.jp/articles/570cf8dd867aab3c4d4ed2ec983bcf07d18489e2,2/14(水) 16:59
rnb,南海放送,地球温暖化への理解深めて モーグル元五輪代表・上村愛子さんが講演【愛媛】,https://news.yahoo.co.jp/articles/2e093eecc9c30a15c9ef27a6bee92cc4c7934cdd,2/14(水) 16:58
rnb,南海放送,バレンタインデーは季節外れの暖かさに 4月並みはあすまで 寒暖差に注意【愛媛】,https://news.yahoo.co.jp/articles/de06eec994fb791607f274a5bf4a95d55033ec47,2/14(水) 16:43
rnb,南海放送,バレンタインデーは季節外れの暖かさに 4月並みはあすまで 寒暖差に注意【愛媛】,https://news.yahoo.co.jp/articles/de06eec994fb791607f274a5bf4a95d55033ec47,2/14(水) 16:43
rnb,南海放送,バレンタインデーに「チョコっと注意！大作戦」警察官らが特殊詐欺防止呼びかけ【愛媛】,https://news.yahoo.co.jp/articles/ef82d12677f77a94f8b3d4956d39ab5446b617c9,2/14(水) 11:35
rnb,南海放送,史上最多1万547人が伊予路を駆け抜けた「第61回愛媛マラソン」名物＆新たな挑戦,https://news.yahoo.co.jp/articles/74f9cf6812f437bcede969ec2dee2eaf46bf2fce,2/13(火) 19:00
rnb,南海放送,自転車のヘルメット 努力義務化からまもなく1年…成人の着用率は50％未満【愛媛】,https://news.yahoo.co.jp/articles/afdae27cb267b5fbce980c44068a6f6b944d86db,2/13(火) 18:14
rnb,南海放送,松山城観光を支えて約70年…ロープウェイのゴンドラ入れ替え工事 22日から6代目が運行【愛媛】,https://news.yahoo.co.jp/articles/48f056d2a99c1b99c26a44f56e4a9c96b6e69286,2/13(火) 17:24
rnb,南海放送,県内各地で気温上昇 宇和島で最高気温19.1℃ 今週は4月並みの暖かさ続く【愛媛】,https://news.yahoo.co.jp/articles/439940a17ec62ed53f66d4643f8cbde610e0b48b,2/13(火) 16:21
rnb,南海放送,香川県の鳥インフル受け 県内114の養鶏場に緊急消毒用の消石灰配布【愛媛】,https://news.yahoo.co.jp/articles/b67fbc45467215b83a7468f3dafd0461ff728997,2/13(火) 15:02
rnb,南海放送,宇和島市の南楽園 春の訪れ告げる梅の花が見ごろ 3月3日まで梅まつり開催【愛媛】,https://news.yahoo.co.jp/articles/8699aee7245adca01887f35d1775c4f47ad1a8cc,2/13(火) 10:59
rnb,南海放送,“熱走”から一夜明け…「恩返しできたら」愛媛マラソンコースでジョギング＆ゴミ拾い,https://news.yahoo.co.jp/articles/46aab5e34f0e0feaa483debb143d780d6ac330bd,2/12(月) 17:43
rnb,南海放送,丹精込めた早咲きの椿が一堂に「伊予つばき名花展」2月18日まで開催【愛媛】,https://news.yahoo.co.jp/articles/90ee5e617152741ffa1a4105aa6603b13ca039af,2/12(月) 17:22
rnb,南海放送,第61回愛媛マラソン　男子優勝は金子晃裕（コモディイイダ ） 女子は儀藤優花（肥後銀行）,https://news.yahoo.co.jp/articles/a9935abd741a919cb255c8c652491dcc5ef8d457,2/11(日) 12:16
rnb,南海放送,あす開幕！１万人が伊予路を駆ける　制限なしの「第６１回愛媛マラソン」,https://news.yahoo.co.jp/articles/356e2a0ddea89f6825468a178bae8f85ba61977b,2/10(土) 16:34
rnb,南海放送,悲惨な事故を繰り返さない　えひめ丸事故から２３年　宇和島水産高校で追想式典,https://news.yahoo.co.jp/articles/5be332368fff9c9527326361f428624f146acee5,2/10(土) 12:19
rnb,南海放送,新時代に突入した地球 過去100年分の地層データにみる「人新世」の始まり…人が求めた豊かさの代償とは,https://news.yahoo.co.jp/articles/eecb244653a5e7703256b26914d4c27a59ad8e8b,2/10(土) 9:00
rnb,南海放送,自転車で道路横断中の高校生が大型トラックに700m引きずられ死亡…「トラックの左折時」に潜む危険,https://news.yahoo.co.jp/articles/2c9fb781043afea77d28ccc7b625363b188f4d8a,2/9(金) 19:29
rnb,南海放送,あさって開催「愛媛マラソン」メイン会場ではランナーに“足湯”のおもてなし,https://news.yahoo.co.jp/articles/9d023c61cf396a77dbd5259e4b9586f4ad9539c0,2/9(金) 18:29
rnb,南海放送,愛媛マラソンの“名勝負”再び！前回優勝争いの2選手が今大会にかける思い,https://news.yahoo.co.jp/articles/d2b39e7706b57be49c40499430138111624ec107,2/9(金) 17:03
rnb,南海放送,コロナ患者数が5類移行後最多 0歳から14歳が64％ インフルも若年層で感染目立つ【愛媛】,https://news.yahoo.co.jp/articles/89d33cc4c9211a4e55afcd1e13c3b6d9c0f6a100,2/9(金) 16:34
rnb,南海放送,松山市 4000円で5000円分の買い物ができる“プレミアム付商品券”第2弾を3月発行,https://news.yahoo.co.jp/articles/6e254089270cd7562ac33a9ba57f7d2a170e3ac4,2/9(金) 15:39
rnb,南海放送,松山市の当初予算2197億円余 6年連続で過去最高を更新 観光・街づくりなど柱に,https://news.yahoo.co.jp/articles/f9f074bc4c5ca358f746c0f30f2bca8a6fbf3070,2/9(金) 15:34
rnb,南海放送,地域におけるスポーツ推進について考える 松山市で全国会議【愛媛】,https://news.yahoo.co.jp/articles/b1fdd5c02662d929436c13b1bae7915087458a02,2/9(金) 15:28
rnb,南海放送,空き巣や置き引きが発生…被災地の治安維持へ 愛媛県警が自動車警ら隊を派遣,https://news.yahoo.co.jp/articles/bb01c1ddad18c3c511adbfe19906eaece25b91ef,2/9(金) 14:37
rnb,南海放送,伊予路に春を呼ぶ「椿まつり」16日開幕を前に 地元園児が神社の清掃【愛媛】,https://news.yahoo.co.jp/articles/97851b2001ea307acd653c724189921b9feb7fa2,2/9(金) 14:19
rnb,南海放送,松山大学でⅡ期日程の一般入試 5学部6学科の平均志願倍率は5.4倍【愛媛】,https://news.yahoo.co.jp/articles/952139ec202aadfa9986057998c71d9badcef023,2/9(金) 11:50
rnb,南海放送,愛媛・今治ピアノ教師殺人事件 重要参考人の男 教室訪れた男子生徒を縛ってけがさせたか,https://news.yahoo.co.jp/articles/4159e539c9d6bbc4c6aa651d49e28497f28366a4,2/8(木) 18:28
rnb,南海放送,愛媛マラソン史上2度目のサブテン達成なるか！？優勝候補筆頭の男子招待選手,https://news.yahoo.co.jp/articles/dc8c83327d765ade1b04c6c777cc763a4b05e294,2/8(木) 17:34
rnb,南海放送,防災や減災への意識高めて 能登地震で現地調査の愛大准教授が講演【愛媛】,https://news.yahoo.co.jp/articles/5e3d1074457288c02eede959eef8ea0b064c5441,2/8(木) 17:07
rnb,南海放送,「同僚に対するストレスから」公用文書を無断で持ち出し不当に破棄 元県職員の男に執行猶予付き有罪判決【愛媛】,https://news.yahoo.co.jp/articles/c25651959b03c827200e110bead11409f52281b1,2/8(木) 15:00
rnb,南海放送,環境保全に役立てて アサヒビールが「愛媛の森林基金」へ寄付金贈呈,https://news.yahoo.co.jp/articles/cf37026ac45c103efe460de5d04162e5d3c3022c,2/8(木) 11:21
rnb,南海放送,JR四国×JALの観光ツアーでおもてなし！ハワイの有名シェフがマダイに感激！南予の魅力、世界に届け,https://news.yahoo.co.jp/articles/27ab90bb1c35af0bee99c53d688871ce92717f95,2/7(水) 19:00
rnb,南海放送,「愛媛マラソン」大会記録更新に期待！女子レースの優勝争いでカギを握る2人の招待選手,https://news.yahoo.co.jp/articles/b5a4d9305bfe6537310a901c2e9d5902ef281d6f,2/7(水) 18:42
rnb,南海放送,春の到来まであと少し…双海町で“菜の花”と“スイセン”が満開【愛媛】,https://news.yahoo.co.jp/articles/ea71f443f0eaa52d82ea83af93617214f55fb8b6,2/7(水) 17:17
rnb,南海放送,トラックドライバーの長時間労働解決へ「2024年問題」荷主事業者対象のセミナー,https://news.yahoo.co.jp/articles/38985333faf42018b1bf6c57d958380af9a3158d,2/7(水) 17:09
rnb,南海放送,顧客から預かった現金着服 JAおちいまばりの元職員を業務上横領容疑で逮捕 被害総額は9100万円か【愛媛】,https://news.yahoo.co.jp/articles/f83cd79c2baf911f4570c4de9408e76248eaeb65,2/7(水) 16:52
rnb,南海放送,プロの料理人目指し一歩踏み出す学生へ 後輩たちが料理で卒業祝う【愛媛】,https://news.yahoo.co.jp/articles/96471af6d202dd1de3ea66d21da5b3c3c3014bd0,2/7(水) 15:43
rnb,南海放送,世界最大の自転車国際会議「Velo city」愛媛県が誘致へ 実現すれば国内初,https://news.yahoo.co.jp/articles/d5509dc2bad6b9b3246d2c6a54ce4e1371a40950,2/7(水) 11:50
rnb,南海放送,霧氷と雪に覆われる霊峰・石鎚山へ！西日本最高峰の「神の山」に魅せられた人たち,https://news.yahoo.co.jp/articles/d0c5ba8b02fccd10fb84656e1e3f8206f4f732a9,2/6(火) 19:00
rnb,南海放送,コロナとインフルエンザ「入り混じってピークに達している」対策は？,https://news.yahoo.co.jp/articles/b0ad99462a21f949357d84f812326c19351cb114,2/6(火) 18:53
rnb,南海放送,桃の節句を前に園児が“ひな人形”見学 トレンドは「木目調」や「パステルカラー」,https://news.yahoo.co.jp/articles/3b9a729fd5697a14a01d1d0e148817f71d1379eb,2/6(火) 17:37
rnb,南海放送,2年ぶり愛媛が全国1位に 2021年産かんきつの収穫量が20万6000トン,https://news.yahoo.co.jp/articles/dce2035cd467ea0ce1ab992f938329bc1bc996eb,2/6(火) 17:37
rnb,南海放送,県内唯一の女子実業団チーム「ひめぎん女子陸上部」の3人が愛媛マラソンにかける思い,https://news.yahoo.co.jp/articles/d4004410feb83e4f59f72f8f726233957d633640,2/6(火) 16:29
rnb,南海放送,香川県の養鶏場で鳥インフル確認　愛媛県内の養鶏場で緊急消毒実施へ,https://news.yahoo.co.jp/articles/6c33847706865a4e8804df6e54239e2011c67c8b,2/6(火) 16:12
rnb,南海放送,“ミスりんごあおもり”が児童養護施設の子ども達にリンゴをプレゼント【愛媛】,https://news.yahoo.co.jp/articles/4a556ef3d6f09f1d26c62a0c5d8c5e0a111c9144,2/6(火) 14:48
rnb,南海放送,妹亡くし看護師目指す…御荘中3年生が「法務大臣賞」 全国中学生人権作文コンテスト【愛媛】,https://news.yahoo.co.jp/articles/7ecc9bd73bb41bda20bf96bb2dd24cfb863031ea,2/6(火) 13:31
rnb,南海放送,災害時の「トイレ問題」松山では最低30日間使えなくなる予測も…簡易トイレの作り方と注意点,https://news.yahoo.co.jp/articles/25074d13d7ae7396f2a90aae604a488ff7e9b53a,2/6(火) 12:33
rnb,南海放送,受験シーズン本格化 県内多くの私立高校で一般入試始まる【愛媛】,https://news.yahoo.co.jp/articles/abb47683df56dfcca0a3cc2d03a1b4a9dfc33c8f,2/6(火) 11:22
rnb,南海放送,急増する死亡事故…この時期の特徴は？ドライバー全員が無事故・無違反の物流会社に学ぶ「安全運転マイルール」,https://news.yahoo.co.jp/articles/636ffddbe73b553dcf4a0b97dc46b1ac13501b57,2/5(月) 19:00
rnb,南海放送,能登半島から学ぶ〝次の災害から命を守る”ために応援職員が伝えたいこと,https://news.yahoo.co.jp/articles/ba5eb7596e79c6eafda0f7d18382597c8d2743b7,2/5(月) 19:00
rnb,南海放送,愛媛マラソン開催直前！堀江地区のボランティア団体と小学生が沿道の清掃活動,https://news.yahoo.co.jp/articles/7859f223d8d461b783df0c9acbc77cf58f483897,2/5(月) 18:28
rnb,南海放送,愛媛県と東京藝大が連携 地域活性化めざす「アートベンチャーエヒメ」がスタート,https://news.yahoo.co.jp/articles/cace670f224659c82bd5295306fd3703571bd15c,2/5(月) 17:31
rnb,南海放送,選手たちを“食”で応援！小中学生がサッカー選手と「愛媛FC給食」考案,https://news.yahoo.co.jp/articles/a60b50f53df846134e70d772e05abc59a137705e,2/5(月) 17:10
rnb,南海放送,松山市で雨降るも…石手川ダムの貯水率39.7％ 本格的な回復には至らず【愛媛】,https://news.yahoo.co.jp/articles/f82103021b0f8b44f3ae553c95d4d8c62f2d7b3d,2/5(月) 16:52
rnb,南海放送,箱根ランナーたちが愛媛マラソンに参戦！3人の大学生招待選手に注目,https://news.yahoo.co.jp/articles/bcaff91a0b436f80f8befb90f9c1b01f2d1c7bf2,2/5(月) 15:22
rnb,南海放送,県の「被災地支援連携チーム」が輪島市に派遣 避難所での支援活動へ【愛媛】,https://news.yahoo.co.jp/articles/284393ba4b45b142048645659b76daa183ed8a2a,2/5(月) 14:55
rnb,南海放送,東温市で軽乗用車と衝突 ミニバイクの80歳男性が死亡 今年の交通事故死者は11人に【愛媛】,https://news.yahoo.co.jp/articles/ccf6d1583ae570e957929db4437c1c9e100adcbc,2/5(月) 14:47
rnb,南海放送,往復1万円で行き先は運まかせ！高速バス「ガチャ旅きっぷ」第2弾販売【愛媛】,https://news.yahoo.co.jp/articles/1cbefd264e9498aa96410bfb6903d304b9460546,2/5(月) 11:14
rnb,南海放送,みかんジュースの頂点は？県産柑橘の販路拡大目指しコンクール開催中【愛媛】,https://news.yahoo.co.jp/articles/acab88330f15d83a570c4e1e4918fe7a022e712a,2/4(日) 14:20
rnb,南海放送,「立春」に春の訪れ祝う縁起酒「立春朝搾り」の出荷【愛媛】,https://news.yahoo.co.jp/articles/acf7c364fb49f2c61bcde7f7e3c84da085837f94,2/4(日) 10:36
rnb,南海放送,2月の毎週土曜にイベント開催  愛媛の食の魅力を再発見,https://news.yahoo.co.jp/articles/60d93bc0707c2107a430940e56f4c6d0dec55f69,2/3(土) 15:48
rnb,南海放送,開催迫る！　大会前に愛媛マラソンコースを清掃,https://news.yahoo.co.jp/articles/908170663461495287b2d45793e0a7918c95cd86,2/3(土) 11:26
rnb,南海放送,「映像の復元や解析はできなかった」警視庁 ジャーナリスト長井健司さんのカメラを家族に返却,https://news.yahoo.co.jp/articles/79bbc3cc2bcf1347236decd9215bd028f7d01e46,2/2(金) 19:25
rnb,南海放送,大切なのは「共助」のチカラ…大規模災害で長期化する避難生活を見据え 進む“日頃の備え”,https://news.yahoo.co.jp/articles/e205879cb32596f088fe09c0661f1fc41ec1afd3,2/2(金) 18:53
rnb,南海放送,【独自】愛媛・今治ピアノ教師殺人事件から1週間 被害者は男子生徒が教室に来る前に切りつけられたか,https://news.yahoo.co.jp/articles/eddd9163e2ae50c6ac64c43cf05e29c484b06ed6,2/2(金) 18:36
rnb,南海放送,県内で相次ぐ凶悪事件 県警本部長が犯人の早期検挙や真相解明を指示【愛媛】,https://news.yahoo.co.jp/articles/ee9124e33958b7f3a866f880b632ec6e81659caa,2/2(金) 18:08
rnb,南海放送,松山自動車道の東温スマートICが3月23日開通 救急搬送の時間短縮に期待,https://news.yahoo.co.jp/articles/ecd454e930d340817941198f30e72f3a04f9c4f2,2/2(金) 16:56
rnb,南海放送,あすは節分！鬼の登場に泣き出す子どもも…園児たちが勇気出して“鬼退治”【愛媛】,https://news.yahoo.co.jp/articles/9ea6a7f5224b34326d15c61a676118b633b9e787,2/2(金) 16:28
rnb,南海放送,新型コロナ患者数が松山市と中予で急増 インフルは5歳から9歳が全体の4割占める【愛媛】,https://news.yahoo.co.jp/articles/59898ec4ea9a8f814538534eff2ae9c3136ff253,2/2(金) 16:12
rnb,南海放送,24年度県当初予算案「防災・減災」「人口減少対策」など重点 中村県政で最大規模の見通し【愛媛】,https://news.yahoo.co.jp/articles/e2270fed7a15552dc4120d46cb5ca59d60ee4211,2/2(金) 15:58
rnb,南海放送,松山空港に新国際線ターミナルが3月オープン 週12便の国際線が運航予定【愛媛】,https://news.yahoo.co.jp/articles/669b6340b16b4cacb11ad32ff089a3acebd75008,2/2(金) 15:46
rnb,南海放送,県産養殖魚の販路拡大へ ハワイの有名シェフらがマダイ養殖場を視察【愛媛】,https://news.yahoo.co.jp/articles/16601006456ea71ea75ce1ff20716706f66e51a9,2/2(金) 13:03
rnb,南海放送,日本人初の女性パイロット・兵頭精の人生描いたミュージカル 出身地で上演【愛媛】,https://news.yahoo.co.jp/articles/f2200efec4af258ee8cb128ff0ba5eb08417677d,2/2(金) 11:27
rnb,南海放送,野生動物による被害は年間3億6000万円超…農作物を守れ！新人ハンターたちの実践訓練,https://news.yahoo.co.jp/articles/1fe6427a06e7a788d734eb35d13f0ee0abe5a1bc,2/1(木) 19:00
rnb,南海放送,「歩く」と「走る」ではどっちが速い？今年の愛媛マラソンに“競歩”のトップアスリート達が参戦！,https://news.yahoo.co.jp/articles/1507c5cfdf8210a238e850ada30cd285e1a65445,2/1(木) 17:45
rnb,南海放送,特別支援学校の生徒たちが“分身ロボット”通して接客体験 就労の一助に【愛媛】,https://news.yahoo.co.jp/articles/556e57a5817cf7ade683d8fa3c77d427f90690da,2/1(木) 17:32
rnb,南海放送,本館全焼から2年半…「佐田岬亀ヶ池温泉」がグランドオープン！レストランや物販コーナー再開【愛媛】,https://news.yahoo.co.jp/articles/8d53294a5c2dd8a33892dbe899026d901b875e97,2/1(木) 17:13
rnb,南海放送,能登半島地震発生から1か月…2000戸で断水続く石川・穴水町へ給水車と職員派遣【愛媛】,https://news.yahoo.co.jp/articles/a0e19f6d94b6725ba84f261c0dd89000b3ad3972,2/1(木) 14:28
rnb,南海放送,災害に強くクリアな音声のラジオへ 南海放送が県内3エリアでワイドFM転換実験開始【愛媛】,https://news.yahoo.co.jp/articles/191e734257affa503311b8a264d571f68336fb27,2/1(木) 14:21
rnb,南海放送,運休中の「坊っちゃん列車」3月20日に運行再開 松山市が経費支援のクラファン実施へ,https://news.yahoo.co.jp/articles/f848a199a5af1c4dc69b3893005aba0d23ce8c16,2/1(木) 11:34
rnb,南海放送,【速報】坊っちゃん列車　3月運行再開を発表「乗組員の確保に目処がつきつつある」伊予鉄道,https://news.yahoo.co.jp/articles/6e29504651077c618b8fc227fa01d42afe07658a,2/1(木) 8:59
rnb,南海放送,2013年策定の南海トラフ巨大地震被害想定　愛媛県が改定・見直しへ,https://news.yahoo.co.jp/articles/94dc6e8805a45b39ab9398f8975fa61eda41897f,1/31(水) 19:00
rnb,南海放送,人口270人の島から 子どもたちの期待を背負って！マラソンランナーは“校長先生”,https://news.yahoo.co.jp/articles/73801fd6712a67df27c6a0e3f89a8eb8f699a7a7,1/31(水) 18:07
rnb,南海放送,伊予市双海地域で最新型“自動運転バス”あすから実証運行 誰でも無料で利用可【愛媛】,https://news.yahoo.co.jp/articles/c3063a4feef2d155998a0c249fefcf8ebf14d1a5,1/31(水) 17:09
rnb,南海放送,愛媛のスキー場へ行こう！知事とトップスキーヤ－が共演　過酷!?なPR動画撮影の舞台裏,https://news.yahoo.co.jp/articles/1819e99eb71b62b9b8c455f0cd47b656e22d87f8,1/31(水) 17:09
rnb,南海放送,障害者アーティストのデザインコンぺ表彰式 最優秀作品は商品化され販売【愛媛】,https://news.yahoo.co.jp/articles/fc42fe136948519cdf18da061ee8178d022660cf,1/31(水) 16:52
rnb,南海放送,三浦工業にサイバー攻撃…ホームページが改ざんされる 個人情報の流出はなし【愛媛】,https://news.yahoo.co.jp/articles/45e570ccb245a1610722576523a5e46d5d7c3dd0,1/31(水) 16:33
rnb,南海放送,直売所などで6000円分を5000円で購入できる“プレミアム商品券”あす申込み受付開始【愛媛】,https://news.yahoo.co.jp/articles/7088706e41f7cefb5dbc47af832d3b215baa1fce,1/31(水) 16:14
rnb,南海放送,宇和島市で車が海に転落 親子2人が死亡 ガードレールがない直線道路【愛媛】,https://news.yahoo.co.jp/articles/08ac168990d0fa8e235f12ce7d64fa2230c036e2,1/31(水) 13:36
rnb,南海放送,2030年までに選果場の再編・統合へ JA愛媛中央会が知事に支援を要請,https://news.yahoo.co.jp/articles/f240736dec04686125c34f3c3ce7444936b2577c,1/31(水) 11:12
rnb,南海放送,熱帯果樹だけど今が旬！松山ブランドにも認定「アボカド」産地化めざす若手農家の挑戦,https://news.yahoo.co.jp/articles/34ef21d6f3379313362590b1d5fceac21faf5a67,1/30(火) 19:00
rnb,南海放送,愛媛・今治ピアノ教師殺人事件 暴行容疑で逮捕の男 事件当日被害者の自宅近くを訪れたと供述,https://news.yahoo.co.jp/articles/f0eeb5099a01dede9b578b47cd30f1ad08c69425,1/30(火) 18:10
rnb,南海放送,部員数減少で一時は応援辞退も…北条の中高生が合同ブラスバンド結成！地域一丸で奏でるエール,https://news.yahoo.co.jp/articles/67a669850c0b2e8f4b2a010933668c1178fad34d,1/30(火) 17:34
rnb,南海放送,大手スーパー「フジ」が本社を広島に移転 マックスバリュ西日本と合併で514店舗展開に,https://news.yahoo.co.jp/articles/9c829a2cc21dae953dc7b8a76423126d109e1d4a,1/30(火) 17:08
