ctgry,media_jp,title_pickup,title_articles,link_pickup,link_articles,date_original
local,テレビユー山形,車とトラックが衝突 女性2人死亡,山形県長井市の事故　56歳と82歳の女性2人の死亡確認　軽を運転の54歳女性は話せる状態　軽乗用車と大型トラックの衝突事故　3人は親子,https://news.yahoo.co.jp/pickup/6517951,https://news.yahoo.co.jp/articles/8ddaa09b0f21179a4870dffc55ada26f35771e15,10/28(月) 23:49
local,OBS大分放送,駅伝中の高2ひかれる なぜ車進入,高校駅伝でコースに車が誤進入、男子選手がひかれけが　事故はなぜ起きたのか?高体連が再発防止策検討へ　大分,https://news.yahoo.co.jp/pickup/6517948,https://news.yahoo.co.jp/articles/8566e410a5e8c7903bf947450122abd13a545997,10/28(月) 23:37
local,日テレNEWS NNN,新橋女性刺殺 父語る苦しい胸の内,新橋・ガールズバー従業員殺害　被害女性の父親が苦しい胸の内語る　女性は警視庁に金銭トラブル相談も,https://news.yahoo.co.jp/pickup/6517946,https://news.yahoo.co.jp/articles/e4cb158e363355713151b686cf4ce592441baf25,10/28(月) 22:42
local,テレビユー山形,車がトラックと衝突 2人心肺停止,【速報・続報】長井市の3人意識不明の事故　50代と80代の女性2人が心肺停止　50代の運転手も意識不明　軽は左からトラックが激しくぶつかったか（山形）,https://news.yahoo.co.jp/pickup/6517928,https://news.yahoo.co.jp/articles/9a91a459ddeacdf7ebf408b54979f85e66c1ad1c,10/28(月) 19:11
local,沖縄タイムス,難病の娘バギーで押しマラソン 涙,「いつか一緒に走りたい」父が涙　難病の娘をバギーで押してハーフ完走　東京の夫妻、「琉球一美しい島」でマラソン,https://news.yahoo.co.jp/pickup/6517923,https://news.yahoo.co.jp/articles/57c4164dd7f1eee0ab08554162ce39540b5e1f58,10/28(月) 18:09
local,ｔｙｓテレビ山口,自民・山口県連 石破氏を痛烈批判,「石破総裁の責任、進退も含めてしっかり考えるべき」衆院選自民党惨敗で党山口県連が痛烈に批判,https://news.yahoo.co.jp/pickup/6517920,https://news.yahoo.co.jp/articles/67a000fce43507da0bfc443564873f40c2b713af,10/28(月) 17:52
local,TBS NEWS DIG Powered by JNN,千葉の強盗事件 公開手配の男逮捕,【速報】千葉・市川市強盗傷害事件で公開手配の21歳の男を逮捕「神奈川でもやった」と説明　横浜市の強盗殺人事件にも関与か,https://news.yahoo.co.jp/pickup/6517919,https://news.yahoo.co.jp/articles/727f3af593b6f117969254fc1937b26cd35661b6,10/28(月) 17:46
local,朝日新聞デジタル,福井の中3殺害 再審開始が確定,福井の中3殺害事件、再審開始が確定　検察が異議申し立てせず,https://news.yahoo.co.jp/pickup/6517913,https://news.yahoo.co.jp/articles/98b8a349eb25365cd32af934d876d9a82e43a5ae,10/28(月) 16:42
local,STVニュース北海道,公園で学生死亡 3人以上が暴行か,死亡の大学生　前日夜にひとりでいる様子　3人以上から暴行か　交友関係のトラブル捜査　北海道,https://news.yahoo.co.jp/pickup/6517905,https://news.yahoo.co.jp/articles/b6c7eda4a146c3ed7e1536fe2b7674706da6e197,10/28(月) 16:13
local,読売新聞オンライン,不在者投票525人分が無効 豊中市,大阪・豊中市で不在者投票５２５人分が無効票に…投票箱に入れ忘れ、車の中の段ボール箱から発見,https://news.yahoo.co.jp/pickup/6517896,https://news.yahoo.co.jp/articles/9d46e0eac134dda04f5db66f35f69769ca14eeee,10/28(月) 14:34
local,FNNプライムオンライン（フジテレビ系）,神宮外苑の再開発 樹木伐採を開始,【速報】神宮外苑の再開発で樹木伐採開始…反対運動受けて伐採本数124本減らすなど計画変更,https://news.yahoo.co.jp/pickup/6517893,https://news.yahoo.co.jp/articles/551b5a2b6b8fcef8e9c7008fda99907e692fd1c4,10/28(月) 13:56
local,FNNプライムオンライン（フジテレビ系）,日大ラグビー部 寮に大麻吸引具,【独自】日大ラグビー部の寮に大麻吸引具…写真入手　寮内では窃盗横行?「ポロシャツがメルカリで…」警視庁が捜査,https://news.yahoo.co.jp/pickup/6517894,https://news.yahoo.co.jp/articles/c0949a07e223d72a4fc70cf4bbc3f6b5f0491694,10/28(月) 13:50
local,FNNプライムオンライン（フジテレビ系）,千葉強盗事件 公開手配の男を確保,【速報】指名手配の久保田陸斗容疑者（21）の身柄確保　千葉・市川の女性連れ去り強盗事件で,https://news.yahoo.co.jp/pickup/6517884,https://news.yahoo.co.jp/articles/9e9b8d3130136655f674ae716bd88e0c962d88f5,10/28(月) 12:20
local,FNNプライムオンライン（フジテレビ系）,千葉強盗事件 公開手配の男確保,【速報】指名手配の久保田陸斗容疑者（21）の身柄確保　千葉・市川の女性連れ去り強盗事件で,https://news.yahoo.co.jp/pickup/6517881,https://news.yahoo.co.jp/articles/9e9b8d3130136655f674ae716bd88e0c962d88f5,10/28(月) 11:43
local,新潟ニュースNST,「保守王国」新潟、自民党が全敗,保守王国・新潟で“自民全敗”の衝撃…立憲が５選挙区すべて制す　非公認候補に“2000万円”がとどめか【開票一覧】,https://news.yahoo.co.jp/pickup/6517874,https://news.yahoo.co.jp/articles/03c5256276790301ae181dcc3ccdf762c693e958,10/28(月) 10:58
local,時事通信,新橋刺殺 6月頃知り合ったと供述,女性店員、遺体の傷十数カ所　客の男「6月に知り合った」　警視庁,https://news.yahoo.co.jp/pickup/6517872,https://news.yahoo.co.jp/articles/738a104dbcad389877c3f6a7cb370a91a5bce905,10/28(月) 10:45
local,tenki.jp,台風21号 31～1日頃に沖縄接近か,台風21号　31日～11月1日頃「非常に強い」勢力で沖縄に接近か　本州への影響は,https://news.yahoo.co.jp/pickup/6517868,https://news.yahoo.co.jp/articles/d3cda01e9b15d67e061da8f856fafe035b91dfce,10/28(月) 9:40
local,HTB北海道ニュース,全裸遺体は大学生 複数で暴行か,全裸で見つかった遺体は20歳の男子大学生　死因は激しい暴行による外傷性ショック　複数犯か　北海道江別市,https://news.yahoo.co.jp/pickup/6517863,https://news.yahoo.co.jp/articles/875d9fa160746bea60a4d9b798fe02d0ac91e056,10/28(月) 8:33
local,読売新聞オンライン,車が歩道に突っ込む 5人重軽傷,東京・文京の交差点、乗用車が歩道に突っ込み女性５人重軽傷…対向車との衝突避けるためか,https://news.yahoo.co.jp/pickup/6517861,https://news.yahoo.co.jp/articles/aa4ff69163ef9c31b89fd514bf9fb9fcb0b27397,10/28(月) 8:04
local,産経新聞,二階伸康氏 比例復活もならず,二階俊博氏の三男・伸康氏の落選が確実に　保守分裂の和歌山2区で敗れ、比例復活もならず,https://news.yahoo.co.jp/pickup/6517842,https://news.yahoo.co.jp/articles/0a587c43655699e5688d608f171529e065661afd,10/28(月) 3:26
local,朝日新聞デジタル,平沢勝栄氏が当選確実 東京17区,平沢勝栄氏が10回目の当選確実　自民裏金問題で処分、無所属で出馬,https://news.yahoo.co.jp/pickup/6517839,https://news.yahoo.co.jp/articles/2b9e1caba498b09e61a8310fe48eda1add67bbaf,10/28(月) 2:42
local,ＫＲＹ山口放送,岸信千世氏が当選 山口2区,大激戦の山口2区 自民の前職 岸信千世氏が当選,https://news.yahoo.co.jp/pickup/6517831,https://news.yahoo.co.jp/articles/5dc8578f868d17a7b40e20404c550a7f7eb08fa2,10/28(月) 0:41
local,毎日新聞,松野博一氏が当選確実 千葉3区,自民・松野博一氏が9回目の当選確実　衆院千葉3区,https://news.yahoo.co.jp/pickup/6517829,https://news.yahoo.co.jp/articles/8ba1428e057cd01a6814128bf2713cfe896d69fd,10/28(月) 0:18
