ctgry,media_jp,title_pickup,title_articles,link_pickup,link_articles,date_original
local,河北新報,国道に尿入りボトル投棄 悩む住民,酷暑の国道4号、点在する「茶色い液体」入りのペットボトル　125本拾って嗅いでみた,https://news.yahoo.co.jp/pickup/6473909,https://news.yahoo.co.jp/articles/b280fe3859cf950d7d691be46df0dfa2cfebe744,8/31(木) 9:50
local,河北新報,国道に尿入りボトル? 拾ってみた,酷暑の国道4号、点在する「茶色い液体」入りのペットボトル　125本拾って嗅いでみた,https://news.yahoo.co.jp/pickup/6473906,https://news.yahoo.co.jp/articles/b280fe3859cf950d7d691be46df0dfa2cfebe744,8/31(木) 9:24
local,朝日新聞デジタル,首相襲撃 殺人未遂容疑で追送検へ,岸田首相襲撃、殺人未遂容疑で追送検へ　爆発物を鑑定、殺傷能力確認,https://news.yahoo.co.jp/pickup/6473901,https://news.yahoo.co.jp/articles/83068af6dcd378fb94ef23492652904720ff5e6c,8/31(木) 8:37
local,読売テレビ,店提供の弁当で食中毒 男性が死亡,飲食店提供の弁当でサルモネラ食中毒、１人死亡　３２人が症状訴え７人から菌検出　和歌山・白浜町,https://news.yahoo.co.jp/pickup/6473874,https://news.yahoo.co.jp/articles/936975b784f9936346964999304c1b6141c088d9,8/30(水) 22:24
local,毎日新聞,スラダン聖地の迷惑対策 なぜ強化,スラムダンク「聖地」、観光客の迷惑行為横行　鎌倉市が対策強化,https://news.yahoo.co.jp/pickup/6473873,https://news.yahoo.co.jp/articles/37c1ccc28c5b448e567b47d6fe804a2f2e36552b,8/30(水) 22:06
local,サンケイスポーツ,砂丘でVIVANTごっこを 知事提案,鳥取県の平井伸治知事　観光客に「鳥取砂丘でＶＩＶＡＮＴごっこを楽しんでほしい」,https://news.yahoo.co.jp/pickup/6473871,https://news.yahoo.co.jp/articles/e77c43157f4d3875a9afe3bf58509c1d1749e7f0,8/30(水) 21:34
local,京都新聞,京アニ放火 公判前に社長コメント,京アニ社長、事件の公判に向けコメント「法の定めに従い、しかるべき対応を」　,https://news.yahoo.co.jp/pickup/6473865,https://news.yahoo.co.jp/articles/b21825296386fce5093000ff3434b50905a12bef,8/30(水) 20:28
local,読売テレビ,大阪府の子全員 万博に無料招待へ,「大阪・関西万博」大阪府民の子ども全員を無料招待　９月開会の議会に関連経費を計上へ　大阪府,https://news.yahoo.co.jp/pickup/6473851,https://news.yahoo.co.jp/articles/f2861b583e1fbbd410b7702e58f4924991a2e09c,8/30(水) 18:31
local,中国新聞デジタル,陰口を言われ 非正規公務員の嘆き,私物隠され、あいさつ無視され「生意気なのよ」　つらすぎる非正規公務員の嘆き,https://news.yahoo.co.jp/pickup/6473844,https://news.yahoo.co.jp/articles/d1c153ef8086bbf71543af86e9ec4f4ef9168f5f,8/30(水) 17:53
local,読売新聞オンライン,ビルに女性遺体 自殺の男書類送検,熊本雑居ビル女性遺体、エレベーター点検社員を書類送検…事件後に自殺,https://news.yahoo.co.jp/pickup/6473824,https://news.yahoo.co.jp/articles/1c476c985bd1c323655f7185fe6eb11febef283c,8/30(水) 15:01
local,共同通信,お手柄 園児拾った財布で事件解決,お手柄園児に警視庁感謝　財布拾って窃盗事件解決,https://news.yahoo.co.jp/pickup/6473809,https://news.yahoo.co.jp/articles/953c7c1cc7520aefbcf25ed38caa7314bd86985c,8/30(水) 12:48
local,47NEWS,6歳妹暴行死「全部私の責任」と母,「全部、私の責任だから」母親はなぜ子どもたちを置いて家を出たのか　拘置所で語った６度の結婚と家族への思い【大津女児虐待死事件（中）】,https://news.yahoo.co.jp/pickup/6473804,https://news.yahoo.co.jp/articles/d76fa305dff42e78a2bb7a57180700579756a020,8/30(水) 12:25
local,読売新聞オンライン,熊本ビル遺体 自殺の男書類送検へ,熊本雑居ビルに女性遺体、自殺したエレベーター点検会社社員を書類送検へ,https://news.yahoo.co.jp/pickup/6473803,https://news.yahoo.co.jp/articles/794652b3746f5f4476cdaecd850c0cae3004e16b,8/30(水) 12:14
local,テレビ朝日系（ANN）,運送会社社長を殺害疑い 男逮捕,【速報】運送会社社長の男性が腹を刺され死亡　出頭の29歳男を緊急逮捕　埼玉・三郷市,https://news.yahoo.co.jp/pickup/6473792,https://news.yahoo.co.jp/articles/b769baa3a97703e783c7199a5f997b061245619f,8/30(水) 10:41
local,関西テレビ,拳銃奪おうとした男に警官が発砲,"【速報】警察官が男に拳銃を""3回""発砲　「刃物を捨てろ！撃つぞ」の警告も…""木刀""を振り回し警察官の拳銃を奪おうと暴れる　男は公務執行妨害で現行犯逮捕　大阪市",https://news.yahoo.co.jp/pickup/6473773,https://news.yahoo.co.jp/articles/f9accb80bb09a5aaaf921be34b687df4c616d491,8/30(水) 7:49
local,MBSニュース,大阪IRのPR 美術作品を無断使用,大阪IRのPR動画　奈良美智さん「あおもり犬」や村上隆さん作品など3点で無断使用と判明 　大阪府・市が謝罪　一部著作物で権利処理未了もしくは未処理のものも,https://news.yahoo.co.jp/pickup/6473753,https://news.yahoo.co.jp/articles/bfef4c9d7fdb1b7486da98f4c0ef9cf8788e66de,8/29(火) 21:56
local,テレビ朝日系（ANN）,渋谷の飲食店で爆発 男性2人けが,【速報】東京・渋谷で爆発　男性2人けが　原因はカセットコンロのガスボンベ,https://news.yahoo.co.jp/pickup/6473737,https://news.yahoo.co.jp/articles/8cedd2774aae0b03f92c0dfd6dea5171d3f4ddb8,8/29(火) 18:33
local,RCC中国放送,マスク拒否 元市議の訴え退ける,マスク着用拒否　元呉市議の訴え退ける判決　広島地裁　AIRDOは「適切に審理した結果」とコメント,https://news.yahoo.co.jp/pickup/6473734,https://news.yahoo.co.jp/articles/6399da9388e5de90ae4525488606ffa7cfb65711,8/29(火) 18:14
local,JRT四国放送,阿波おどりの席違法 観光庁が調査,違法運営のプレミアム桟敷席　観光庁が聞き取り調査【徳島】,https://news.yahoo.co.jp/pickup/6473736,https://news.yahoo.co.jp/articles/bd078e72443ae5da429d49598f84b8bfd94f7d32,8/29(火) 18:10
local,読売新聞オンライン,中学生の自殺ほう助 懲役5年6カ月,女子中学生の自殺手助け、２９歳男に懲役５年６月判決「被害者の未熟さにつけ込み卑劣」,https://news.yahoo.co.jp/pickup/6473723,https://news.yahoo.co.jp/articles/3e5b7f9d254a311d1b008f89d6d66c4b5693d024,8/29(火) 17:10
local,TBS NEWS DIG Powered by JNN,西武・山川穂高選手を不起訴,埼玉西武ライオンズの山川穂高選手を嫌疑不十分で不起訴処分　知人女性に対する強制性交の疑いで警視庁が書類送検　東京地検,https://news.yahoo.co.jp/pickup/6473722,https://news.yahoo.co.jp/articles/b1dbb8ecd7e0cc185300364ea5d636b4e7f20d38,8/29(火) 16:54
local,RKB毎日放送,射殺など 工藤会系幹部に無期懲役,"市民をターゲットに“射殺""放火”「暴排ステッカー」の店を襲撃したとして起訴された暴力団「工藤会」幹部に無期懲役の判決",https://news.yahoo.co.jp/pickup/6473714,https://news.yahoo.co.jp/articles/ddc384f3b4fbc92c400d256e8ac896d3d4ee880e,8/29(火) 14:39
local,tenki.jp,東京都心は35℃ 9日ぶりの猛暑日,都心で今年22回目の猛暑日　8月終盤も最多記録を更新　終わらない記録的に暑い夏,https://news.yahoo.co.jp/pickup/6473713,https://news.yahoo.co.jp/articles/72b6e50579552662f1381f877ce5c10d4939d787,8/29(火) 14:01
local,47NEWS,6歳の妹の命奪う 17歳の兄の孤立,「ジャングルジムから落ちた」６歳の少女の命を奪った兄はうそをついた　ネグレクトされた異父兄妹の１０日間【大津女児虐待死事件（上）】,https://news.yahoo.co.jp/pickup/6473705,https://news.yahoo.co.jp/articles/fa4d00cb09d53e5d332b5cc975273e57d670c5f9,8/29(火) 13:19
local,47NEWS,孤立した兄 6歳の妹の命奪うまで,「ジャングルジムから落ちた」６歳の少女の命を奪った兄はうそをついた　ネグレクトされた異父兄妹の１０日間【大津女児虐待死事件（上）】,https://news.yahoo.co.jp/pickup/6473701,https://news.yahoo.co.jp/articles/fa4d00cb09d53e5d332b5cc975273e57d670c5f9,8/29(火) 12:57
local,STVニュース北海道,陸自演習場 発射の砲弾が行方不明,砲弾１発行方不明…演習場外へ着弾？不発弾に？捜索中　北海道・然別演習場,https://news.yahoo.co.jp/pickup/6473694,https://news.yahoo.co.jp/articles/a6c72e73d654fa675759be688210d78ee4013472,8/29(火) 11:45
local,カナロコ by 神奈川新聞,ミスした教諭に賠償請求 市に抗議,「プールの水」賠償請求、川崎市に抗議１００件以上　市長「教員不足とまったく別の話」,https://news.yahoo.co.jp/pickup/6473680,https://news.yahoo.co.jp/articles/a7bbbdeee64577261e34e37b251783b1893b6e84,8/29(火) 9:42
local,FBC 福井放送,患者体内にガーゼ9年半 病院謝罪,手術で体内にガーゼ置き忘れ　９年半後に別の病院受診で発覚　坂井市立三国病院（福井県）,https://news.yahoo.co.jp/pickup/6473677,https://news.yahoo.co.jp/articles/0ee43d5ce54e07a8a9c8671435bd5c787891a2c8,8/29(火) 8:50
local,読売新聞オンライン,個人口座で給食費管理 全国6割超,学校給食費、校長らの「個人口座」で管理する自治体が６割以上…文科省が「公会計化」要請へ,https://news.yahoo.co.jp/pickup/6473674,https://news.yahoo.co.jp/articles/62a85037c8edbc02faa35c58fb3ed1a55fadc315,8/29(火) 8:18
local,読売テレビ,警察官が頭刺されけが 男を逮捕,【速報】公開手配のベトナム人を逮捕　職務質問中の警察官の頭を“ドライバー”で突き刺した疑い「身に覚えはあるが少し内容が違う」容疑を一部否認,https://news.yahoo.co.jp/pickup/6473636,https://news.yahoo.co.jp/articles/ee55d49504a5fce276b9ac8fd0d9fc0ed73b3377,8/28(月) 19:08
local,読売新聞オンライン,海洋博物館 閉鎖後の維持7000万円,海に浮かぶ構造、かさむ電気代…「なにわの海の時空館」閉鎖１０年で維持費７０００万円,https://news.yahoo.co.jp/pickup/6473634,https://news.yahoo.co.jp/articles/50bcf4c2c9a614c96c0997579bd431def1953165,8/28(月) 18:48
local,IBC岩手放送,県警、被害者を認知症と判断ミス,「判断ミスで初動捜査が遅れた」　岩手・雫石町の強盗殺人未遂事件で県警が陳謝　被害者の認知症を疑い事件性なしと判断,https://news.yahoo.co.jp/pickup/6473633,https://news.yahoo.co.jp/articles/d58701ef9be587d38bd8a71d8e5e27b9ace6c67b,8/28(月) 18:42
local,TNCテレビ西日本,0歳児死亡 日陰も危険な車内温度,０歳児置き去り死　車内の危険性を検証「約２０分で４０℃超」　両親の“勘違い”が悲惨な事故に　【福岡】,https://news.yahoo.co.jp/pickup/6473628,https://news.yahoo.co.jp/articles/289319035312f9d818bb987a1bc01a09a3f84a76,8/28(月) 17:52
local,関西テレビ,治療後に複数患者が死亡 行政指導,カテーテル治療後に死亡した患者3人のカルテに不備　神戸市が神戸徳洲会病院を行政指導,https://news.yahoo.co.jp/pickup/6473623,https://news.yahoo.co.jp/articles/48d19b6ddec3e28f86930d8584d992ebca5200d1,8/28(月) 17:13
local,時事通信,首切断 親子3人の鑑定留置始まる,親子3人の鑑定留置開始　来年2月まで、ススキノの男性殺害,https://news.yahoo.co.jp/pickup/6473620,https://news.yahoo.co.jp/articles/198920511d109e8b79cf9d93a0d15cfa4adc8455,8/28(月) 16:49
local,読売テレビ,浜に遺体 沈没貨物船の乗員と判明,【速報】和歌山・有田市の海岸で発見の遺体、行方不明の６７歳の一等航海士と判明　貨物船衝突事故,https://news.yahoo.co.jp/pickup/6473611,https://news.yahoo.co.jp/articles/e970849e1c02aaead5083c8e9328ed7d46529b22,8/28(月) 15:27
local,読売テレビ,海岸に遺体 沈没貨物船の乗組員か,和歌山・有田市の海岸で身元不明の１人の遺体発見　貨物船衝突事故、行方不明の乗組員の可能性,https://news.yahoo.co.jp/pickup/6473607,https://news.yahoo.co.jp/articles/d09c9ce6c186b129066983508a845bdf925021c9,8/28(月) 14:46
local,TBS NEWS DIG Powered by JNN,永山絢斗被告に懲役6カ月求刑,【速報】「リラックスした気持ちになり眠れるから」永山絢斗被告が初公判で起訴内容を認める　中2で初使用　懲役6か月を求刑　判決は9月1日　大麻所持の罪　東京地裁,https://news.yahoo.co.jp/pickup/6473589,https://news.yahoo.co.jp/articles/75a0cfacb90049cf139d9633d78321bb9d0303f3,8/28(月) 11:02
local,読売新聞オンライン,花火有料席増も売り上げ不振 島根,１０倍増やした花火「有料観覧席」、３割売れ残り…「無料エリアから閉め出された」と批判噴出,https://news.yahoo.co.jp/pickup/6473583,https://news.yahoo.co.jp/articles/5c8e546900462f92f8e79b4281951e23e40d146c,8/28(月) 10:16
local,下野新聞SOON,路面電車開業2日で運行乱れ 栃木,栃木・ＬＲＴ「こんなに混むなんて」　開業２日目 、現金払い多くダイヤに乱れ,https://news.yahoo.co.jp/pickup/6473580,https://news.yahoo.co.jp/articles/8f80b14dbad156ae64bffba755f0ac67a83a44b7,8/28(月) 9:31
local,北海道新聞,マイワシ水揚げ増 飼肥料向け高騰,マイワシ水揚げ量3割増　道東沖　飼肥料向け高騰、操業盛ん,https://news.yahoo.co.jp/pickup/6473579,https://news.yahoo.co.jp/articles/6a338bdd957ab7641ff5091b9e0cd090d9de86a6,8/28(月) 9:28
local,読売テレビ,80cmのトカゲが住宅から脱走 滋賀,【注意】肉食のサバンナオオトカゲが住宅から脱走　ケースに入れず飼育　約８０センチ・茶色　大津市,https://news.yahoo.co.jp/pickup/6473557,https://news.yahoo.co.jp/articles/d06dca9bc9b138fa4ed90ee82fc1f5daf4c437e7,8/27(日) 22:19
local,静岡朝日テレビ,漁港で7歳男児溺れる 搬送後死亡,家族で遊泳中に7歳の男の子が溺れドクターヘリで搬送されたものの間もなく死亡　静岡・東伊豆町,https://news.yahoo.co.jp/pickup/6473555,https://news.yahoo.co.jp/articles/cf9a889c5cc615f2d988e2e536ca405ec70c6456,8/27(日) 21:37
local,テレビ静岡NEWS,漁港で7歳男児が溺れる 救急搬送,東伊豆の漁港で遊泳中 7歳男児が溺れて救急搬送　静岡,https://news.yahoo.co.jp/pickup/6473547,https://news.yahoo.co.jp/articles/1b9fc25f23cd412b72d273eaeec73487b6c3e76e,8/27(日) 19:17
local,MBSニュース,水上バイク同士が衝突 2人重軽傷,【速報】琵琶湖で水上バイク同士が衝突…男女2人が重軽傷　38歳男性が腰を骨折するなどケガ　同じグループ内で事故　滋賀,https://news.yahoo.co.jp/pickup/6473532,https://news.yahoo.co.jp/articles/c818641aa9dfee5f4644e72e11d9e9d09a6edd2f,8/27(日) 17:09
local,,ドカンと爆音 児童12人死んだ空襲,集団下校中に爆撃、奪われた児童１２人の命　凄惨な記憶を語り継ぐ男性　#戦争の記憶,https://news.yahoo.co.jp/pickup/6473531,https://wararchive.yahoo.co.jp/wararchive/umk5.html,8/27(日) 17:08
local,読売新聞オンライン,20年以上条例違反 看板付け替えへ,２０年以上も条例違反の看板、山梨の大手スーパー・事業組合が付け替えへ,https://news.yahoo.co.jp/pickup/6473527,https://news.yahoo.co.jp/articles/dd90fe9f82bbc77b0a290c662cfb523acf56fc74,8/27(日) 16:39
local,テレビ朝日系（ANN）,富士登山 宿泊でも体調不良者次々,富士山“無計画”登山で「救急搬送は毎日」　宿泊しても…“体調不良”意外な理由,https://news.yahoo.co.jp/pickup/6473525,https://news.yahoo.co.jp/articles/5d4c45d2b994c0d45e80b553e34ddba81ec1909a,8/27(日) 15:53
local,TNCテレビ西日本,0歳死亡 車内に少なくとも2時間か,車内で０歳児死亡　締め切った車内に少なくとも２時間いたか　北九州市八幡西区,https://news.yahoo.co.jp/pickup/6473520,https://news.yahoo.co.jp/articles/9560309a46117a0163d8f09dff70704cfe990221,8/27(日) 15:33
local,河北新報,市バスにあおられ恐怖 仙台市謝罪,仙台市バスにあおられ恐怖　市民被害訴えに交通局謝罪,https://news.yahoo.co.jp/pickup/6473504,https://news.yahoo.co.jp/articles/33077838b2e19e9d56e9cbfdce8e60f845b27316,8/27(日) 12:02
local,カナロコ by 神奈川新聞,横浜市の少年野球 給水係なぜ女性,【追う！マイ・カナガワ】少年野球の給水係、なぜ女性だけ？　大会規定に疑問「性別役割を変えていかないと」,https://news.yahoo.co.jp/pickup/6473498,https://news.yahoo.co.jp/articles/16e3f466f9577b04b57c8dab766e39498a442b31,8/27(日) 10:23
local,共同通信,関東で6歳未満の女児を脳死判定,関東で6歳未満女児を脳死判定　心臓、肝臓を移植,https://news.yahoo.co.jp/pickup/6473480,https://news.yahoo.co.jp/articles/9999b4b82a1b8bda5b23a37f4e0f0b03cdfdb6ad,8/27(日) 0:01
local,毎日新聞,中国からか 福島県外でも苦情電話,福島県外でも苦情電話　中国からか　施設側、処理水と無関係「困惑」,https://news.yahoo.co.jp/pickup/6473473,https://news.yahoo.co.jp/articles/6c79cab675a050eabddd20ea99703bedfd9c8912,8/26(土) 22:28
local,MBSニュース,水上バイク接触 無免許疑いで逮捕,【速報】“無免許”の水上バイクが小学1年の男児と女児に接触　運転の男を現行犯逮捕『酒飲んだ』という趣旨の話　男児は後頭部切るケガ　滋賀・琵琶湖,https://news.yahoo.co.jp/pickup/6473450,https://news.yahoo.co.jp/articles/74493aca91a1687faa92a8c45e57acc7ee8baa8b,8/26(土) 18:01
local,RKB毎日放送,駐車場で車内に放置か 0歳児死亡,【速報】コストコの駐車場で車内に0歳男児を放置か　男児は病院で死亡を確認,https://news.yahoo.co.jp/pickup/6473449,https://news.yahoo.co.jp/articles/141d7126ead9ec03f9fdc52db5988dd4e5d37dec,8/26(土) 17:50
local,MBSニュース,水上バイクが接触 子ども2人搬送,【速報】水上バイクが6歳男児と女児に接触　男児は後頭部　女児は顔をケガ　運転の男を無免許の疑いで現行犯逮捕　滋賀・琵琶湖,https://news.yahoo.co.jp/pickup/6473445,https://news.yahoo.co.jp/articles/74493aca91a1687faa92a8c45e57acc7ee8baa8b,8/26(土) 17:30
local,神戸新聞NEXT,分裂から8年、神戸山口組は9割減,山口組分裂から8年、際立つ勢力差　神戸山口組は千人未満、有力団体が相次ぎ離脱　暴排強化も背景に,https://news.yahoo.co.jp/pickup/6473417,https://news.yahoo.co.jp/articles/dd86bfdcb13bb053abe990ba241cb2e4da02eb58,8/26(土) 12:14
local,メ〜テレ（名古屋テレビ）,血を流して倒れた男性死亡 名古屋,血を流して倒れていた男性が見つかり死亡、警察官にバールを突き付けた男を現行犯逮捕 関連を捜査,https://news.yahoo.co.jp/pickup/6473413,https://news.yahoo.co.jp/articles/a614bb7b14a0e3ac52c31950f9e8b73a5ef12bd2,8/26(土) 11:11
local,読売新聞オンライン,阿波おどり 20万円席は違法状態,阿波おどり「２０万円桟敷席」は建築基準法違反の状態だった…市は台風対応で「気が回らず」,https://news.yahoo.co.jp/pickup/6473408,https://news.yahoo.co.jp/articles/7ffc4edf74cc13079d33dddb15d86a4625b1f206,8/26(土) 10:25
local,神戸新聞NEXT,単純ではない 捜査員語る6歳殺害,背中全体にあざ、6歳児死亡「単純な話じゃない」　閉ざされた異様な家族生活、虐待疑う通報寄せられず　神戸,https://news.yahoo.co.jp/pickup/6473400,https://news.yahoo.co.jp/articles/12e6c6921151926f746d2c3931d011c3b895b2d6,8/26(土) 8:56
local,BSS山陰放送,8歳死亡 スライダー事故の背景,ウォータースライダーで衝突、男児（8）死亡　監視は引率スタッフ1人のみで手薄だったか「通常は1人が滑り終わるまで次を滑らせない」,https://news.yahoo.co.jp/pickup/6473390,https://news.yahoo.co.jp/articles/be54384074cba7bc652d86311917ae13f1671c52,8/26(土) 1:39
local,産経新聞,私立行きたい 無償化に声弾む中3,「私立行きたい」言えた　高校無償化、生徒ら期待　課題も,https://news.yahoo.co.jp/pickup/6473377,https://news.yahoo.co.jp/articles/6ff36c75b5099769062effc2133139d1df76f3c8,8/25(金) 22:32
local,TBS NEWS DIG Powered by JNN,新宿のビルで異臭騒ぎ 2人搬送,【速報】東京・歌舞伎町近くのビル地下工事現場男性作業員2人がシンナー臭で一時意識もうろう,https://news.yahoo.co.jp/pickup/6473376,https://news.yahoo.co.jp/articles/2d41a430574248d1051d9f04892c871f3d944806,8/25(金) 21:59
local,TBS NEWS DIG Powered by JNN,新宿のビルで異臭騒ぎ 2人が重体,【速報】東京・歌舞伎町近くのビル工事現場で異臭騒ぎ男性作業員2人が意識不明シンナー臭の情報も,https://news.yahoo.co.jp/pickup/6473370,https://news.yahoo.co.jp/articles/2d41a430574248d1051d9f04892c871f3d944806,8/25(金) 20:56
local,毎日新聞,受刑者「さん」付け 名古屋刑務所,受刑者を呼ぶ時は「さん」付けで　暴行問題の名古屋刑務所で開始,https://news.yahoo.co.jp/pickup/6473367,https://news.yahoo.co.jp/articles/fb0efa841c38ec63bb52e4f5e8ef378b5c4747de,8/25(金) 20:41
local,京都新聞,露店爆発10年「地獄」だった治療,やけど痕「地獄のような痛み」　医師らとの出会いが将来変えた「一生懸命生きる」,https://news.yahoo.co.jp/pickup/6473363,https://news.yahoo.co.jp/articles/c87fcf723bea064da71e3ca8be88beae24b4bdc8,8/25(金) 20:09
local,FNNプライムオンライン（フジテレビ系）,野生のシカ目撃相次ぐ 東京・府中,「角が...突進したら怖い」多摩川沿いに“シカ”目撃　野球グラウンドで...なぜ?,https://news.yahoo.co.jp/pickup/6473361,https://news.yahoo.co.jp/articles/70ccbbaeced9db22880614c0cb4f55ccead487d5,8/25(金) 19:59
local,HTB北海道ニュース,猛烈暑さで異変か 北海道で桜咲く,暑い！厳しい残暑に北海道各地でも悲鳴　あまりの暑さで異変？桜が咲く,https://news.yahoo.co.jp/pickup/6473360,https://news.yahoo.co.jp/articles/220d9e60919588842ccadfd653f6375c544f842f,8/25(金) 19:59
local,京都新聞,露店爆発 炎と爆風に囲まれた10歳,やけど痕「地獄のような痛み」　医師らとの出会いが将来変えた「一生懸命生きる」,https://news.yahoo.co.jp/pickup/6473351,https://news.yahoo.co.jp/articles/c87fcf723bea064da71e3ca8be88beae24b4bdc8,8/25(金) 18:30
local,BSS山陰放送,スライダーで衝突 重体の男児死亡,【速報】ウォータースライダーで衝突、意識不明だった児童が死亡,https://news.yahoo.co.jp/pickup/6473348,https://news.yahoo.co.jp/articles/6ef92c004d7e2bc9d0b67afc862207dccf6ce6d7,8/25(金) 18:10
local,MBSニュース,琵琶湖の遺体 転落した19歳と判明,【速報】遺体で発見の男性は行方不明の19歳男子大学生と判明　ボートから転落し溺れ行方不明で捜索　滋賀・琵琶湖,https://news.yahoo.co.jp/pickup/6473344,https://news.yahoo.co.jp/articles/613dbacc7348c9c3458c0102cd350831e6300615,8/25(金) 18:00
local,読売新聞オンライン,環八の地下に貯水トンネル新設へ,「環八」地下に貯水トンネル新設…２５ｍプール１０００杯分、豪雨時の浸水被害対策,https://news.yahoo.co.jp/pickup/6473343,https://news.yahoo.co.jp/articles/4ee91c900120cb2b2971b8917d47a56be2ceadcb,8/25(金) 17:38
local,熊本日日新聞,エアコンない給食室 調理員の悲鳴,猛暑の給食室「倒れそう」　エアコン設置なぜ進まない？　熊本市など、費用多額で後回しに,https://news.yahoo.co.jp/pickup/6473323,https://news.yahoo.co.jp/articles/d3010b2c4870a7c62271d823803453955d7b0abb,8/25(金) 15:23
local,テレビ朝日系（ANN）,マニラ保険金殺人 死刑囚が死亡,マニラ保険金殺人事件の岩間俊彦死刑囚（49）が東京拘置所で死亡,https://news.yahoo.co.jp/pickup/6473318,https://news.yahoo.co.jp/articles/3db071c6c580e20dff40d4c12e2622a00bcfe2cd,8/25(金) 15:07
local,北海道ニュースUHB,牛66頭襲ったクマ 味噌煮込みに,"「捕獲するだけではクマに申し訳ない 有効活用が一番」忍者グマ OSO18 北海道釧路市の飲食店でヒグマの""味噌煮込み""として提供 「柔らかくて美味しい」との声も",https://news.yahoo.co.jp/pickup/6473314,https://news.yahoo.co.jp/articles/d4a72d10e40c2ee4b59523301491a7b149809570,8/25(金) 15:03
local,MBSニュース,大阪 高校授業料の無償化案を決定,大阪府「高校授業料の完全無償化案」を決定　“所得制限の撤廃”を決める　府外の兵庫・京都などの私立校に通う生徒も対象の方針　吉村知事「大きな一歩」,https://news.yahoo.co.jp/pickup/6473316,https://news.yahoo.co.jp/articles/0b8dd6cef960ac8ae97cf0f7899b358630b7bb1d,8/25(金) 15:02
local,BSS山陰放送,スライダーで児童衝突 運営が謝罪,ウォータースライダーで衝突、男児（8）意識不明　施設運営企業が謝罪「場内での行動を把握しきれていなかった」,https://news.yahoo.co.jp/pickup/6473301,https://news.yahoo.co.jp/articles/c069aeefc4c027c3729feb3861291df7f2b4579b,8/25(金) 12:26
