ctgry,media_jp,title_pickup,title_articles,link_pickup,link_articles,date_original
local,AERA dot.,苦情続き 都で花火禁止の公園増加,都会の子どもは花火をどこでやる？禁止の公園増加　「大人がルール守って」　場所探しアプリも登場,https://news.yahoo.co.jp/pickup/6473299,https://news.yahoo.co.jp/articles/259c933cf2475a05e426c9a761855dfd42126108,8/25(金) 12:16
local,中国新聞デジタル,親離婚問う 子供生活調査に懸念も,小中学生に「家族に自殺しようとした人や薬物使用者はいますか?」 広島県の調査に保護者困惑「傷つく子いるのでは」,https://news.yahoo.co.jp/pickup/6473291,https://news.yahoo.co.jp/articles/01a3ae6ef40d6183081cc160f96ce811b03dc19e,8/25(金) 11:32
local,西日本新聞,恋人の飲酒運転を見逃し 今も後悔,「嫌われたくなかった」交際相手の飲酒運転を見逃し同乗…女性の葛藤と後悔　「自分は強いから」と押し切られ,https://news.yahoo.co.jp/pickup/6473287,https://news.yahoo.co.jp/articles/f5c4bfb8bf78e96bd1148cd892b117d0bcbcc92e,8/25(金) 10:29
local,読売新聞オンライン,日大 事件対応検証で第三者委設置,日大アメフト部大麻事件「空白の１２日間」はなぜ生じた…対応を検証へ第三者委設置,https://news.yahoo.co.jp/pickup/6473279,https://news.yahoo.co.jp/articles/ec1c4bbc68938b4cd964fbbe13e9dfd9398b50b3,8/25(金) 8:29
local,読売新聞オンライン,バスケ強豪校 顧問が部員に暴力,男子バスケ強豪の石川・金沢高、ベテラン顧問が部員に暴力…「死ね」「カス」など暴言も,https://news.yahoo.co.jp/pickup/6473274,https://news.yahoo.co.jp/articles/19c35a49041cca18798732bece6f03a882dbd59a,8/25(金) 7:53
local,北海道新聞,首切断 3容疑者の鑑定留置認める,＜独自＞ススキノ殺人　3容疑者、鑑定留置半年間　札幌簡裁決定,https://news.yahoo.co.jp/pickup/6473269,https://news.yahoo.co.jp/articles/77946f62582fdf03dbe4fe0653a5a7851facf7dd,8/25(金) 6:32
local,MBSニュース,紀伊水道で貨物船が転覆 2人不明,乗組員3人救助　50代と60代男性2人の行方分からず　和歌山・紀伊水道で貨物船の衝突事故　日本籍船が転覆　海上保安部の巡視船などが捜索,https://news.yahoo.co.jp/pickup/6473266,https://news.yahoo.co.jp/articles/c495d6c96f142c80cce1da96eaa9922a60697112,8/25(金) 5:44
local,関西テレビ,紀伊水道で貨物船転覆 乗組員捜索,紀伊水道で貨物船２隻が衝突　１隻が転覆　乗組員と連絡取れず,https://news.yahoo.co.jp/pickup/6473265,https://news.yahoo.co.jp/articles/a80054ef69f755012ee88d5af2aed794c130d8f3,8/25(金) 4:05
