media_en,media_jp,title_articles,link_articles,date_original
bbt,富山テレビ,石川県から派遣要請…地震の被災地に向け富山県が運行するボランティアバス出発 県内外の30人が七尾市へ,https://news.yahoo.co.jp/articles/f51dde5a592ea109c41a59cf88b7a83098bd6b06,2/17(土) 12:09
bbt,富山テレビ,北陸3県グッと近く…新幹線の敦賀延伸まで1カ月 応援割等で高まる観光需要に各県どれだけ存在感示せるか,https://news.yahoo.co.jp/articles/da2c36a8cb2c26732342cc993c20193d06dd4490,2/16(金) 20:46
bbt,富山テレビ,『市役所本庁舎建て替えや移転に向けた基本計画作成』小矢部市新年度予算案…防災備蓄品の充実も,https://news.yahoo.co.jp/articles/e5de66f5b1ba2e27744daa0ef0314e852bdd17c4,2/16(金) 20:45
bbt,富山テレビ,『連携や役割分担を確認』…富山市が“災害時協力協定”を結んでいる企業や団体と意見交換,https://news.yahoo.co.jp/articles/4b261ef67af9a0385fca1d1ad7280a367c64322e,2/16(金) 20:42
bbt,富山テレビ,スキーと登山組み合わせた山岳スキー日本選手権（17・18日黒部市）で連覇狙う中学２年生…目指すは五輪,https://news.yahoo.co.jp/articles/2e0aa0d273eced3a1e53f65fbada5b9105a20a89,2/16(金) 20:39
bbt,富山テレビ,家族の世話など日常的に行う子供…ヤングケアラーへの対応等考える研修会 専門家「実情に合わせた支援を」,https://news.yahoo.co.jp/articles/d14ac7986964d4ce450ad56a1b720108ac87b3ec,2/16(金) 20:37
bbt,富山テレビ,子どもたちに野球の楽しさを…読売ジャイアンツ女子チーム所属の高岡市出身選手が母校で出前授業,https://news.yahoo.co.jp/articles/549001740b7372505c58e76df3eb037b37622850,2/16(金) 20:35
bbt,富山テレビ,過去2番目の早さ…となみチューリップフェアに向け開花時期調整のため遮光ネット設置 暖冬で生育やや早く,https://news.yahoo.co.jp/articles/78c9643b96295d32774ca733038c336ad2214d67,2/16(金) 20:31
bbt,富山テレビ,創業250年の老舗和菓子店再び…“名物まんじゅう”も復活「6月1日の朔日饅頭（ついたちまんじゅう）」,https://news.yahoo.co.jp/articles/ddec23986806bbea09caae66d12eccdf09ced360,2/16(金) 20:27
bbt,富山テレビ,確定申告の受付始まる…申告期限は3月15日までだが能登半島地震の影響で富山と石川では期限延長,https://news.yahoo.co.jp/articles/b01e9998754a57eca0d2e5739af97336e50dae0b,2/16(金) 20:24
bbt,富山テレビ,敦賀駅に一番乗りの「つるぎ1号」等数分で完売…北陸新幹線敦賀開業まで1カ月 初日の切符は激しい争奪戦,https://news.yahoo.co.jp/articles/fb1191282bb557354d504d9a956c6b38b14a26f9,2/16(金) 12:33
bbt,富山テレビ,16日は一転、平年並みの寒い一日に…予想最高気温は富山市で7度と『15日より14度程も低く』,https://news.yahoo.co.jp/articles/2aef31cbe73f62a8508ef230bfd7029d137734da,2/16(金) 12:32
bbt,富山テレビ,富山県内のガソリン価格は“先週と変わらず”横ばい…元売り会社への補助金効果で全国的に小幅な値動き続く,https://news.yahoo.co.jp/articles/5a48c7f3ef30cfbfe6ac02c63f50829d3e447ee7,2/16(金) 12:26
bbt,富山テレビ,【地震】富山県内で震度1 新潟県上中越沖を震源とする最大震度2の地震が発生 津波の心配なし,https://news.yahoo.co.jp/articles/59a9c30b4a19b303171aab29b6cc8ac5796fcbb4,2/15(木) 20:05
bbt,富山テレビ,『去年より13日早い“春一番”』最高気温今年初めて20℃超…16日は寒気等の影響で一時的に寒く　富山,https://news.yahoo.co.jp/articles/6783fdf349fadad99a96ccb2299adc3b993f7fb2,2/15(木) 19:53
bbt,富山テレビ,対策に“複数の工法”必要となる可能性も…能登半島地震で液状化被害出た富山県氷見市 専門家が現地調査,https://news.yahoo.co.jp/articles/9101a99b9c2e51d23ea19b292b499eb2cec850ad,2/15(木) 19:51
bbt,富山テレビ,地震発生時の対応検証する事業も…射水市が約411億円の新年度予算案発表 液状化の復旧は「補正予算で」,https://news.yahoo.co.jp/articles/6e5f2419be9b9a5bd96a8259614204ee96fc8928,2/15(木) 19:49
bbt,富山テレビ,今月20日から『とやま応援クーポン』配布…富山県独自に地震で打撃を受けた観光業などを支援,https://news.yahoo.co.jp/articles/2de0d8e7111cff43e53f11e153e964d85b22754e,2/15(木) 19:46
bbt,富山テレビ,長引く避難所生活…大切な「子育て家庭や女性視点の備え」家族4人分の避難グッズの実例と専門家からの助言,https://news.yahoo.co.jp/articles/e255e2000182748325b0d04ffded8056f011e8d9,2/15(木) 19:44
bbt,富山テレビ,富山市の『くすりテーマの施設』は閉館した北陸電力エネルギー科学館“ワンダー・ラボ”跡地に,https://news.yahoo.co.jp/articles/6ff88dc657e5a8a361153ef83075136d91383c67,2/15(木) 19:42
bbt,富山テレビ,“薬剤師を確保”富山大学薬学部“地域枠”入学生を激励…条件満たせば返金免除となる奨学金約700万円,https://news.yahoo.co.jp/articles/5632432ae89c3f74f9ec5143bec1ad18a78ada57,2/15(木) 19:40
bbt,富山テレビ,NBAレイカーズ八村塁選手（富山市出身）が『自己最多36得点』の活躍でチームの勝利に貢献,https://news.yahoo.co.jp/articles/098bb86b1553d80568efdd417258a2f414b5af26,2/15(木) 19:38
bbt,富山テレビ,『今回初めて大学1、2年生を対象』…富山へのUIJターン促進で県が“企業見学”バスツアー,https://news.yahoo.co.jp/articles/b943f098bc373b023ec3083904e34156077b6fca,2/15(木) 19:36
bbt,富山テレビ,専用の居場所どう確保するか…災害発生時の“ペット伴った避難” 動物愛護推進員等対象にした研修会 富山,https://news.yahoo.co.jp/articles/b32a5254c2bbe24e863316f0f9ccf85c0ef88138,2/15(木) 19:34
bbt,富山テレビ,【地震】富山県内で震度2 新潟県上中越沖を震源とする最大震度3の地震が発生 津波の心配なし,https://news.yahoo.co.jp/articles/f48e77a1f15b2fd605e13fe59ee5ca0a0fbcd196,2/15(木) 15:35
bbt,富山テレビ,【地震】富山県内で震度2 佐渡付近を震源とする最大震度3の地震が発生 津波の心配なし,https://news.yahoo.co.jp/articles/327edc76a82adf9a6721b9437feb94e65c92bd02,2/15(木) 12:54
bbt,富山テレビ,エコビレッジ構想掲げる南砺市　自然体験を目玉に新たな居住エリア「桜ヶ池エコビレッジフィールド」を整備,https://news.yahoo.co.jp/articles/28e8b846a25cb0e1a838017aae10629e8727a215,2/15(木) 12:32
bbt,富山テレビ,続く季節外れの暖かさ　予想最高気温は富山市で20度も16日は6度まで急降下寒暖差に注意,https://news.yahoo.co.jp/articles/137ef2887219efeeec953716ccc0254c4129a5bf,2/15(木) 12:31
bbt,富山テレビ,“春本番の陽気”4月下旬並みの今年一番の暖かさ…最高気温は富山市19.6度・高岡市伏木19.2度,https://news.yahoo.co.jp/articles/5da201d59eb56ad5fbb2307f6200fc8c633d8757,2/14(水) 19:53
bbt,富山テレビ,富山県内の地震被害住宅1万件超（6日時点より2000件近く↑）これまで未確認の舟橋村で一部破損10件,https://news.yahoo.co.jp/articles/6b9f27becd212cf603cf4f41c2a41414050bc817,2/14(水) 19:48
bbt,富山テレビ,能登半島地震で被害の道路などの復旧に向けて…復旧予算を見積もる『国の災害査定開始』,https://news.yahoo.co.jp/articles/7e5b90cce2b9d087cc65883867e50848e37df491,2/14(水) 19:46
bbt,富山テレビ,3月の北陸新幹線・敦賀延伸に合わせて「能登半島地震の復興支援」JR西日本が観光キャンペーン実施を発表,https://news.yahoo.co.jp/articles/e3ce8286725b6b8cf84848427b530f3e7ceef682,2/14(水) 19:42
bbt,富山テレビ,富山市が個人タクシーの組合と協定…地震など災害時に“高齢者や障害者”がタクシーを利用しやすく,https://news.yahoo.co.jp/articles/9de782efca4c976e48f738aef43d6181a7bf9578,2/14(水) 19:30
bbt,富山テレビ,地区離れる人が後を絶たず…液状化被害が深刻な富山県射水市港町 自治会長の嘆き「コミュニティなくなる」,https://news.yahoo.co.jp/articles/d414621178a763341d7a635dda3e96b8e39e10eb,2/14(水) 19:27
bbt,富山テレビ,部活動できない状態続く…七尾市の高校サッカー部が富山で活動再開 部員45人の生活を民宿やJA等が支援,https://news.yahoo.co.jp/articles/3e060946f800ed3a0d3bf307b1b9b9140c9f7fe7,2/14(水) 19:25
bbt,富山テレビ,インフルは注意報レベル続く…コロナ患者数2週連続減少 増加傾向だった30-50代が減少に転じる 富山,https://news.yahoo.co.jp/articles/9b60849b0ec50bde5f2a7b35a1da3af60be20246,2/14(水) 19:23
bbt,富山テレビ,季節外れの暖かさ…予想最高気温は富山市・高岡市伏木ともに18度（4月中旬から下旬並み）梅が可憐な花,https://news.yahoo.co.jp/articles/4d0fc8516e18c3d1861ffee8f461908564be4a54,2/14(水) 12:33
bbt,富山テレビ,県立高校再編検討会議で意見交換「学科・コース見直しにデータサイエンスや地域連携なども…」　富山,https://news.yahoo.co.jp/articles/e306d88ddc458590b0e0f334e7816e8f978a9141,2/14(水) 12:32
bbt,富山テレビ,小さな子どもを育てる母親が震災時の避難など学ぶ『普段の荷物に入れておくものは…』,https://news.yahoo.co.jp/articles/0969d31bbf11a21246379fc4a10c57cff19127be,2/14(水) 12:31
bbt,富山テレビ,『春本番の陽気』で今年一番の暖かさ（4月中旬並み）…青空に“雪の立山連峰”も美しく映える,https://news.yahoo.co.jp/articles/181768f84b2992ec1637457517814e30ffec5576,2/13(火) 20:13
bbt,富山テレビ,過去最大規模に…氷見市の新年度予算案は一般会計265億4400万円 復旧や災害対策に46億円余り計上,https://news.yahoo.co.jp/articles/3b8955d1d6cc2b30a243beb0158f936dece1b1b8,2/13(火) 20:09
bbt,富山テレビ,母の故郷・氷見の復興願い…朝乃山が義援金100万円を林市長に手渡す「被災者を勇気づけるような相撲を」,https://news.yahoo.co.jp/articles/ff087866318b2579bc9fd7546eccd082ae497ecf,2/13(火) 20:07
bbt,富山テレビ,“津波”でカニかご船3隻のうち『2隻でかごが流されたベニズワイガニ漁』が再始動　富山県射水市,https://news.yahoo.co.jp/articles/7e5b894ab47e1746779603a2c868b2a6d12c734f,2/13(火) 20:05
bbt,富山テレビ,“朔日（ついたち）饅頭”の老舗和菓子店…復活への日々に密着『救いの手を差し伸べたパティシエも』　富山,https://news.yahoo.co.jp/articles/7c00d47b1e4c26acbb4b72ff16255bbaaca7924c,2/13(火) 20:00
bbt,富山テレビ,入札を妨害か…立山町が発注したキャンプ場工事の入札巡る官製談合事件 逮捕・送検された町の係長を起訴,https://news.yahoo.co.jp/articles/b103ec1b23e9148ea95e5cce09f3605d8c898b68,2/13(火) 19:55
bbt,富山テレビ,“試験当日は通報しない”などとSNSに…受験生の痴漢被害等防止を警察官が呼びかけ「ためらわず相談を」,https://news.yahoo.co.jp/articles/166f6f9c3e42517df2fa8496faaea5ae88296564,2/13(火) 11:58
bbt,富山テレビ,春本番の陽気4月中旬並みの暖かさに　予想最高気温は富山市で17度　14日は20度近くまで上がる見込み,https://news.yahoo.co.jp/articles/6160f4020da014f5ec233d65748e88116ccbcdd8,2/13(火) 11:56
bbt,富山テレビ,プロ野球“注目の富山県勢選手”は…巨人の宮崎キャンプ・千葉ロッテの石垣島キャンプを取材,https://news.yahoo.co.jp/articles/7c604ef1bfc399531dbc2b57f578d43676b78e03,2/12(月) 20:11
bbt,富山テレビ,地震で大きな液状化被害発生…富山県氷見市の林市長が対策に取り組む方針示す 地盤強化や地下水位下げる等,https://news.yahoo.co.jp/articles/eecbc521dbdeea25ddb17f55b76f057dd0712c30,2/12(月) 19:55
bbt,富山テレビ,被災地の七尾市開催予定の少年サッカー大会を滑川市で開催「地震が起きてから試合していなかった」,https://news.yahoo.co.jp/articles/62cfbef1279ecc596e33dfb02b9ca20d7be38475,2/12(月) 19:51
bbt,富山テレビ,地震被災地に思いを寄せる“14歳の若きドラマー”「音楽のチカラで、平和な優しい世界をつくりたい…」,https://news.yahoo.co.jp/articles/c2c0fb81dfa850bc77f82f087c83ace6094ca240,2/12(月) 19:49
bbt,富山テレビ,地震で被災…のとじま水族館のペンギン10羽 富山市のファミリーパークで公開中「健康な状態で戻したい」,https://news.yahoo.co.jp/articles/cc108ed0193574165d91f69f69354861c1d55705,2/12(月) 19:46
bbt,富山テレビ,午前5時半頃に道路を横断中…80歳男性がトラックにはねられ死亡 近くの横断歩道使わず渡ろうとしたか,https://news.yahoo.co.jp/articles/14a84b9db1d78213804cf6590934823aeb1fc6e0,2/12(月) 19:43
bbt,富山テレビ,知事も含む富山県総合教育会議…県立高校再編基準の検討状況報告『基本方針など、さらに検討』,https://news.yahoo.co.jp/articles/7eb21c30b1e0f9a83a19df1b24b1fbf15264a8be,2/12(月) 19:41
bbt,富山テレビ,福井県内北陸線沿線の火災で福井〜敦賀間運転見合わせ…特急運休で富山から関西・中京方面のアクセスに影響,https://news.yahoo.co.jp/articles/7f20b412f6a455afe653dae299482c4c9408a3a0,2/12(月) 18:05
bbt,富山テレビ,地震で液状化発生…氷見市で被害復旧に向けた意見交換会 住民が求める仮設住宅設置に市長「今後検討する」,https://news.yahoo.co.jp/articles/d8301e4f34ed6dd4f5bcd267cd30ba96dd5d8873,2/12(月) 12:33
bbt,富山テレビ,幅広い年代の住民が様々なスポーツをレベルに合わせて『総合型地域スポーツクラブ体験会』,https://news.yahoo.co.jp/articles/7a19f2da23c18f3dd6dd897e9634972f53f2ab79,2/12(月) 12:32
bbt,富山テレビ,『約2000人の小中高校生が集まり“書き初め大会”』…一筆一筆に思いを込めて　富山,https://news.yahoo.co.jp/articles/c5baff5206bab7855e6e2e350eeb7973d9ab8979,2/12(月) 12:29
bbt,富山テレビ,北陸新幹線“敦賀延伸”3月に迫る…富山駅で福井県の観光PRイベント 恐竜の巨大なバルーンもお目見え,https://news.yahoo.co.jp/articles/dfe9043e5b1112f4e6a054b50bee12684146f2f3,2/11(日) 18:19
bbt,富山テレビ,公明党・山口代表が地震で被災した富山県氷見市を視察「あらゆる面で財政支援し復旧加速していく事が重要」,https://news.yahoo.co.jp/articles/31bbbc78e0f249d9d1f2f85890dc39163c08af52,2/11(日) 18:15
bbt,富山テレビ,能登半島地震の生活再建支援制度…対象地域に「富山県の追加を」新田知事が来県した公明党・山口代表に要望,https://news.yahoo.co.jp/articles/d1382f2355e8c361e61122ad2db9a8f18fe22009,2/11(日) 18:13
bbt,富山テレビ,寒ブリ味わう恒例イベント…ひみ番屋街で『ぶり・鰤・ブリづくし』能登半島地震の影響で延期され開催 富山,https://news.yahoo.co.jp/articles/8f20c444f6b9f5e5da46f14315379779b45dfcf6,2/11(日) 13:57
bbt,富山テレビ,地震でカニかご流される被害…射水市の新湊漁港でベニズワイガニ漁が本格的に再開 約460匹水揚げ 富山,https://news.yahoo.co.jp/articles/9380147ca2cc8fd5b3416aa2d55fb16d4fb8b915,2/10(土) 19:45
bbt,富山テレビ,ボランティアの人も乗車…石川県の和倉温泉と富山県の高岡・氷見を結ぶ観光路線バス 10日から運行再開,https://news.yahoo.co.jp/articles/34573f18867064273e203abb9f40520024f9cbe5,2/10(土) 19:39
bbt,富山テレビ,全国高校スキー大会男子ノルディック複合 雄山高校3年の坂大芳輝選手が4位「表彰台に届かず悔しい」富山,https://news.yahoo.co.jp/articles/f69a03fd97a251d3c8453329a10cea388522ad94,2/10(土) 19:32
