media_en,media_jp,title_articles,link_articles,date_original
kry,ＫＲＹ山口放送,能登半島地震の被災者支援に 下関西ライオンズクラブが日本赤十字社に義援金贈る,https://news.yahoo.co.jp/articles/0a81d44f12e79816c64e8cd92f2b032f0416296a,1/7(日) 12:02
kry,ＫＲＹ山口放送,高齢女性が軽トラックにはねられ死亡〜山口市阿知須〜山口県内ではことしはじめての交通死亡事故に,https://news.yahoo.co.jp/articles/2f974b8c25cee464d7b90d3f76dc76370ee8f9fc,1/5(金) 20:09
kry,ＫＲＹ山口放送,山口・山陽小野田で火事…3軒長屋と隣接2棟が全焼　住民の全員無事を確認,https://news.yahoo.co.jp/articles/ebe51275c8980462a4d6c5381334c8fd251615f8,1/5(金) 20:00
kry,ＫＲＹ山口放送,輪島市の姉妹都市・萩市が支援発表 見舞金1000万円や支援物資おくる,https://news.yahoo.co.jp/articles/3c2330bf98412bba0474325c423b313fa2af93be,1/5(金) 19:44
kry,ＫＲＹ山口放送,高校生が育てた七草を出荷 宇部西高校,https://news.yahoo.co.jp/articles/04f23930453c7b5da65b01cf9d288287441e2191,1/5(金) 19:43
kry,ＫＲＹ山口放送,建設業界の仕事始め 防府天満宮で「釿始式」,https://news.yahoo.co.jp/articles/d1c04650c09030b2cfee36ded0a666ebe62b3ca2,1/5(金) 19:42
kry,ＫＲＹ山口放送,女子ハンドボールYMGUTSが新年の必勝祈願,https://news.yahoo.co.jp/articles/95aa8ac3d5301d6944fe0c7ce066848955574a28,1/5(金) 19:41
kry,ＫＲＹ山口放送,パリへ「代表選考を勝ち抜く」下関出身・体操 南一輝選手が決意,https://news.yahoo.co.jp/articles/02449d0f37b7f79b7c3fdf9f2734618c43395043,1/5(金) 19:34
kry,ＫＲＹ山口放送,【山口天気 夕刊1/5】あす6日(土)は二十四節気「小寒」　今年最初の3連休は「寒の内」らしい寒さへ,https://news.yahoo.co.jp/articles/fd37a5fb85fae9f301bc6db2000a43394cf6c384,1/5(金) 18:39
kry,ＫＲＹ山口放送,妻の首をしめ殺害しようとした男を起訴 山口地検,https://news.yahoo.co.jp/articles/2eabe77b5e1b77eb87eb14fc11990fbf0dc03f85,1/5(金) 14:44
kry,ＫＲＹ山口放送,山口大学に情報系の新学部設置を目指す ２年後の学生募集へ,https://news.yahoo.co.jp/articles/eb39fdf077180d7e58d27ab8d9bc9a43a390ffe8,1/5(金) 12:24
kry,ＫＲＹ山口放送,防府から被災地へ出発　緊急災害対策派遣隊が給水支援,https://news.yahoo.co.jp/articles/8387f4e30973f94edd3a9b4e407065637a8f9c3a,1/5(金) 12:15
kry,ＫＲＹ山口放送,山口宇部と岩国空港で一部欠航 羽田航空機事故の影響続く,https://news.yahoo.co.jp/articles/196185c48616e5e51e1705cd5337de93b0a8cd4d,1/5(金) 7:04
kry,ＫＲＹ山口放送,【山口天気 朝刊1/5】きょう5日(金)は天気穏やかで昼間は過ごしやすい 今年最初の3連休は寒気流入へ…真冬の寒さに備えを,https://news.yahoo.co.jp/articles/25beb809a997bb297a1ba593da15453aa706d26b,1/5(金) 7:01
kry,ＫＲＹ山口放送,山口情報芸術センターで映画「ふたりの桃源郷」上映始まる,https://news.yahoo.co.jp/articles/d317e75d0a026586e2f1aefd02da2732536d10f9,1/4(木) 19:32
kry,ＫＲＹ山口放送,周防大島町で20歳を迎える若者を祝福,https://news.yahoo.co.jp/articles/d49a85353835b2d64c47a4bfd3b7a13772cf8cd6,1/4(木) 19:31
kry,ＫＲＹ山口放送,萩焼の窯元も仕事始め 坂高麗左衛門さんが着物姿で作品作り,https://news.yahoo.co.jp/articles/8a53e8bd023387fc7d9e851fe33d8989dd2ad58b,1/4(木) 19:27
kry,ＫＲＹ山口放送,山口県庁で仕事始め 能登半島地震の犠牲者に黙とうささげる,https://news.yahoo.co.jp/articles/27c159308169a018f7e15fda7cccb0269f8c2326,1/4(木) 19:26
kry,ＫＲＹ山口放送,【山口天気 夕刊1/4】5日(金)も穏やかな空模様で 昼は春先の過ごしやすさに しかし3連休は後半ほど真冬らしい寒さ…体調管理に十分注意,https://news.yahoo.co.jp/articles/badc6a5b1a46dd2a5ff3a0aa84cd104b0f968e09,1/4(木) 18:39
kry,ＫＲＹ山口放送,中国電力による上関町議会への説明会は１月９日開催へ…使用済み核燃料の中間貯蔵施設,https://news.yahoo.co.jp/articles/ddac2b05d12164795fb15feb2eccb5e3b31ed323,1/4(木) 18:10
kry,ＫＲＹ山口放送,山陽道下り 防府東−山口南の通行止め解除,https://news.yahoo.co.jp/articles/10bf0fab2f98045aa33c554d23910dc6508654f4,1/4(木) 15:44
kry,ＫＲＹ山口放送,上関町が中国電力の“法定外公共物の占用”を許可　使用済み核燃料の中間貯蔵施設・立地可能性調査で,https://news.yahoo.co.jp/articles/42746b117fd034a7846b80795ae7d39e0938387f,1/4(木) 14:10
kry,ＫＲＹ山口放送,地域住民に寄り添った活動を 山口県警の広域緊急援助隊が被災した石川へ,https://news.yahoo.co.jp/articles/bda7ec31efca729b9929cf444995d8f136279fe5,1/4(木) 12:03
kry,ＫＲＹ山口放送,新春恒例　下関でフグの初競り,https://news.yahoo.co.jp/articles/23c58b3d322dc23f5e51badbd70e1eaeb7af97c6,1/4(木) 11:56
kry,ＫＲＹ山口放送,【山口天気 朝刊1/4】天気は回復　晴れるわりには気温はやや低め　風がヒンヤリ,https://news.yahoo.co.jp/articles/31660d9394b89ba87075a57675228a2ad50ab373,1/4(木) 7:09
kry,ＫＲＹ山口放送,Ｕターンラッシュがピーク 新山口駅で別れ惜しむ姿,https://news.yahoo.co.jp/articles/42d82f95cee255120bd82735ead51b1f70abb7bf,1/3(水) 18:15
kry,ＫＲＹ山口放送,今年も物流事故ゼロで 出光興産徳山事業所で初荷式,https://news.yahoo.co.jp/articles/8bf7e356c0956badb0dc472205f4667f42ae4072,1/3(水) 18:14
kry,ＫＲＹ山口放送,年末年始のスーパーで…現金約500万円を盗んだ男を逮捕,https://news.yahoo.co.jp/articles/afc19af3ccbf398d85a5d077181ea45fe8a17bb3,1/2(火) 19:42
kry,ＫＲＹ山口放送,福袋を求めて！山口井筒屋で初売り,https://news.yahoo.co.jp/articles/0da3c6349b519c1552e0a39c3b6e2ad1e76c2b49,1/2(火) 19:40
kry,ＫＲＹ山口放送,正月の帰省に合わせて開催 萩市で二十歳のつどい,https://news.yahoo.co.jp/articles/052da8490d4cba83dcd3c218a3c94de506d58842,1/2(火) 19:39
kry,ＫＲＹ山口放送,山口県日本海沿岸に発令されていた津波注意報は２日午前７時半に解除されました。,https://news.yahoo.co.jp/articles/741596a5df0cb98ca5c85103c88b15bd4935f11e,1/2(火) 8:12
kry,ＫＲＹ山口放送,2024年 山口県では6市町で首長選挙実施,https://news.yahoo.co.jp/articles/77786b45f838305311af07a2cd88d40b417f5df2,1/1(月) 13:47
kry,ＫＲＹ山口放送,全国体力テストの体力合計点で山口県の中学２年男子が初めて全国平均を上回る,https://news.yahoo.co.jp/articles/a195764feeea52b9f82c382b3041b2b630c8c25f,2023/12/31(日) 12:10
kry,ＫＲＹ山口放送,大晦日に年越しそば…山口市のそば屋もにぎわう,https://news.yahoo.co.jp/articles/75f8b63b5136a9349e336d9c6b558f53ff2d4004,2023/12/31(日) 12:09
kry,ＫＲＹ山口放送,「釣りに行く」と出かけたまま帰宅せず…男性教員を長門市の防波堤付近の海中で発見・死亡,https://news.yahoo.co.jp/articles/e449d48fa50f50cd15b094527c1e077d207ed1a3,2023/12/31(日) 9:21
kry,ＫＲＹ山口放送,山口市吉敷上東でクマのような動物の目撃情報…警察は注意呼びかけ,https://news.yahoo.co.jp/articles/756c211dc1b4c6d0dcd731e0443e30687c683707,2023/12/31(日) 9:09
kry,ＫＲＹ山口放送,ブリ・ハタ・フグ…正月用の食材を買い求め…道の駅・潮彩市場防府にぎわう,https://news.yahoo.co.jp/articles/57240bd1733aa892687a7312f2681283a6a9abf4,2023/12/30(土) 17:40
kry,ＫＲＹ山口放送,屋久島沖で墜落のオスプレイ…機体の一部が岩国基地に陸揚げ,https://news.yahoo.co.jp/articles/3c42695215be666342634858a7fc199e2b960aab,2023/12/30(土) 14:08
kry,ＫＲＹ山口放送,高齢の男性が運転する乗用車が駐車場から5ｍ転落…周防大島町外入,https://news.yahoo.co.jp/articles/30dd5059af82ce035bd1a5e771e27067219ad1bf,2023/12/30(土) 12:41
kry,ＫＲＹ山口放送,墜落オスプレイの機体一部を載せたサルベージ船が30日午前、岩国基地に入港,https://news.yahoo.co.jp/articles/e386318700336fde8d9a7677a68cbbc705c3591a,2023/12/30(土) 10:43
kry,ＫＲＹ山口放送,年末年始もうそ電話詐欺に注意を！警察官らが山口宇部空港で帰省客に注意呼びかけ,https://news.yahoo.co.jp/articles/56fb7975dde80fef2c20ef365d2ec68e92b5bb3d,2023/12/29(金) 19:25
kry,ＫＲＹ山口放送,受験生たちが正月返上で勉強！山口市の進学塾で「正月特訓」と銘打った特別講座,https://news.yahoo.co.jp/articles/ad275af929c04c3d5f18e44a73be5cd21e54f7c0,2023/12/29(金) 19:24
kry,ＫＲＹ山口放送,帰省ラッシュがピーク JR新山口駅も多くの家族連れで混雑 Uターンのピークは1月3日の見込み,https://news.yahoo.co.jp/articles/7454859d9f646d35386cb4828f6b36f597808161,2023/12/29(金) 19:23
kry,ＫＲＹ山口放送,【山口天気 夕刊12/29】2023年は最後の最後で天気ぐずつく　新年の初日の出は瀬戸内側ほどチャンス十分,https://news.yahoo.co.jp/articles/6570bd75d977285a0d4365fb90916db95e030116,2023/12/29(金) 18:28
kry,ＫＲＹ山口放送,全国高校サッカー選手権 初戦に臨んだ高川学園は1対4で千葉代表の市立船橋に敗れる,https://news.yahoo.co.jp/articles/876caf82d2706b82665860b9deca5f4315f05398,2023/12/29(金) 14:07
kry,ＫＲＹ山口放送,【山口天気 夕刊12/28】年越し準備はかどる陽気続く　30日（土）からは天気・気温変化小刻みに,https://news.yahoo.co.jp/articles/9c5a3627c87b3d12e662281a6a57f0b82a2cb467,2023/12/28(木) 19:32
kry,ＫＲＹ山口放送,年末年始の食材を買い求める人たちで賑わう 道の駅・萩しーまーとでは新鮮な魚がずらり,https://news.yahoo.co.jp/articles/0099b80745211fac47793fcdf045e8f2b9ea4a75,2023/12/28(木) 19:27
kry,ＫＲＹ山口放送,留学生が餅つきで地域の人たちと交流　日本の農耕文化を学んでもらおうと開かれている恒例行事,https://news.yahoo.co.jp/articles/4a63477c658fc17cb84e72533c60e78ee6f089e3,2023/12/28(木) 19:26
kry,ＫＲＹ山口放送,プログラミングを体験してみよう！地元の小中学生や社会人を招いての教室が開催される,https://news.yahoo.co.jp/articles/1c47273ffa7f2d8fb9765bcf197dd5df0a8a9edc,2023/12/28(木) 19:25
kry,ＫＲＹ山口放送,全国高校サッカー選手権開会式 全国3842校の頂点へ 高川学園が堂々の行進,https://news.yahoo.co.jp/articles/78e96272f296388a8d6e6d73d3b08a4c6b944559,2023/12/28(木) 15:53
kry,ＫＲＹ山口放送,中学生が描く周南市の未来像は 市長とまちづくりについて話し合う懇談会開催,https://news.yahoo.co.jp/articles/8e78a5cfbdc6ca6eb0e028c758a437a7ed72cf52,2023/12/28(木) 11:52
kry,ＫＲＹ山口放送,来年の干支は「辰」！ことしの干支「兎ダイバー」と来年の干支「辰ダイバー」が交代式,https://news.yahoo.co.jp/articles/69c22e8079453ea460e75bbe7eced71177a58673,2023/12/27(水) 19:38
kry,ＫＲＹ山口放送,インフルエンザ患者 1医療機関あたりの報告者数が3週ぶりに前の週を下回る,https://news.yahoo.co.jp/articles/5e3553a091fdd9426260548c6ca64a3597f33b92,2023/12/27(水) 19:38
kry,ＫＲＹ山口放送,次世代に演劇の楽しさや魅力を！県内4つの高校の生徒が集い演劇披露,https://news.yahoo.co.jp/articles/5adca059a475ad7329a81b89e452eac6ed76711a,2023/12/27(水) 19:37
kry,ＫＲＹ山口放送,開封は2073年 錦帯橋創建350年の節目に中高生による「未来のメッセージ」などタイムカプセルに封印,https://news.yahoo.co.jp/articles/aba046e6b3413f82a2f8d0d2d8c7a9c7356f98e8,2023/12/27(水) 19:36
kry,ＫＲＹ山口放送,【山口天気 夕刊12/27】あす28日(木)も大掃除日和　しかし年越しのタイミングは小刻みな天気変化で　元日は一時冷たい北風も,https://news.yahoo.co.jp/articles/2960df4fa8323f0e4ce56667f16438b60245de63,2023/12/27(水) 18:32
kry,ＫＲＹ山口放送,山口市の小学校で窓ガラスが複数枚割られる 警察は器物損壊事件として捜査,https://news.yahoo.co.jp/articles/09dce64adb752cae027d4959248669e26a8e794f,2023/12/27(水) 17:15
kry,ＫＲＹ山口放送,山口県警の補助金活用し防犯カメラを設置〜下関・彦島自治連合会〜,https://news.yahoo.co.jp/articles/7b2641513919305cafc028f7af104659289a2cf7,2023/12/27(水) 12:12
kry,ＫＲＹ山口放送,山陽道下り・岩国IC出口付近で軽乗用車が単独事故 運転していた男性が死亡、交通規制は実施されず,https://news.yahoo.co.jp/articles/71c9aa117bfc979865ee095abcf87a8a00d131e4,2023/12/27(水) 10:02
kry,ＫＲＹ山口放送,治療薬のなかった難病「筋強直性ジストロフィー」に有効な薬を確認…山口大学が発表,https://news.yahoo.co.jp/articles/d46723dd60b9f7cff680abea2366296c469396a3,2023/12/27(水) 9:02
kry,ＫＲＹ山口放送,【山口天気 朝刊12/27】午後ほど日ざし届いて気温高め　年末年始は天気変化小刻みで大晦日は雨・風強まる可能性,https://news.yahoo.co.jp/articles/ad22f1e60c24c8e19a097cbfb56311de36d6d522,2023/12/27(水) 7:00
kry,ＫＲＹ山口放送,来年のシード権獲得！プロゴルファーの細野勇策選手が地元、山陽小野田市役所を表敬訪問,https://news.yahoo.co.jp/articles/15ff7b13b11897928456f32be6092b6e16cc8e77,2023/12/26(火) 20:06
kry,ＫＲＹ山口放送,迎春準備進む 国の名勝 錦帯橋に地元まちおこしグループが製作した門松設置,https://news.yahoo.co.jp/articles/49010a76bee88a7009efe7ac282c5cf93e4b0384,2023/12/26(火) 20:05
kry,ＫＲＹ山口放送,落雷で破損した美祢市花尾山の「天空の鳥居」再建へ 市内秋芳町の神社のご神木を利用,https://news.yahoo.co.jp/articles/da0eb93bd49dd0a536d6720ed2bc056405698033,2023/12/26(火) 20:05
kry,ＫＲＹ山口放送,若者の県内定着に向けて連携 県と周南公立大学が協定締結 デジタル人材の育成やスポーツ振興も,https://news.yahoo.co.jp/articles/b5dec4370b5cc9ae8c557ecb24758485dd154534,2023/12/26(火) 20:04
kry,ＫＲＹ山口放送,【上関・中間貯蔵施設】村岡知事“負担としては過大”原発と中間貯蔵施設の併設に否定的な考え,https://news.yahoo.co.jp/articles/cc842911417460f9e3c994bb765da4b0f25323b8,2023/12/26(火) 20:03
kry,ＫＲＹ山口放送,【山口天気 夕刊12/26】年末年始は気温高め続くが　大晦日は全国的に強まる雨風に注意　初日の出は瀬戸内側ほどチャンスあり,https://news.yahoo.co.jp/articles/7873a03c88ccecded37a50728ff471ea9f6d13ba,2023/12/26(火) 18:33
kry,ＫＲＹ山口放送,下半身の露出強要で動画撮影も 山口県内の私立高校の運動部で1年生部員が上級生からいじめ,https://news.yahoo.co.jp/articles/0f1d1d31a6d0756b0256594c832956a037d3ee01,2023/12/26(火) 17:28
kry,ＫＲＹ山口放送,下関市の国道191号でバイクと乗用車が正面衝突 バイクを運転していた59歳の男性が死亡,https://news.yahoo.co.jp/articles/70d1dd4d038a9fb33131e2f622998777304aa299,2023/12/26(火) 12:00
kry,ＫＲＹ山口放送,【山口天気 朝刊12/26】久しぶりに広く気温二桁　昼はホッとできる体感　さらに気温上昇で暖かい年末年始へ,https://news.yahoo.co.jp/articles/ca49161fbbdc803ed5cc1a97b0d6d0978da44eda,2023/12/26(火) 7:01
kry,ＫＲＹ山口放送,防府天満宮で絵馬の焚き上げ神事 80年前から続く年中行事でことしはおよそ3万枚の絵馬,https://news.yahoo.co.jp/articles/5d2ce275fcaed8278743f6ae94cb907811d59cfc,2023/12/25(月) 19:58
kry,ＫＲＹ山口放送,田布施町の高松八幡宮 来年の干支「辰」をモチーフにしたジャンボ絵馬お披露目,https://news.yahoo.co.jp/articles/1d37b1453d47450f74aaa0ed19aef49f782bf1cd,2023/12/25(月) 19:57
kry,ＫＲＹ山口放送,周南市の遠石八幡宮で巫女の研修会 地元の高校生など15人が巫女としての心構えや着付け学ぶ,https://news.yahoo.co.jp/articles/72c0187eb9a6e671ed4b9eb392800ca2c3da467f,2023/12/25(月) 19:56
kry,ＫＲＹ山口放送,8月からの少雨で木屋川ダムの貯水量が平年を大きく下回る 下関市が渇水対策本部を設置し節水呼びかけ,https://news.yahoo.co.jp/articles/c76bee66a64d7a8805c813c53b2766661e85ba57,2023/12/25(月) 19:56
kry,ＫＲＹ山口放送,ＪＲ山陰線不通…早期の運転再開などＪＲに働きかけを 下関市の中学校ＰＴＡ関係者が下関市に署名提出,https://news.yahoo.co.jp/articles/9b31092dbb008963ffe4fb78865b4d3925a638eb,2023/12/25(月) 19:55
kry,ＫＲＹ山口放送,【上関町・中間貯蔵施設】柳井市など周辺1市3町が会合を開き対応を協議,https://news.yahoo.co.jp/articles/2cc27bdc5d22668e745f7388228c8af49516dfc4,2023/12/25(月) 19:54
kry,ＫＲＹ山口放送,【山口天気 夕刊12/25】26日(火)は朝は冷えるが昼は久々の2桁の気温続出！　その後も年の瀬は寒さ緩む日々,https://news.yahoo.co.jp/articles/ea55580424d3281abe5b5377ed55eb550cde004a,2023/12/25(月) 18:29
kry,ＫＲＹ山口放送,政府予算案、岩国基地周辺事務所・店舗への防音工事工法検討費を新たに計上 岩国市が長年要望,https://news.yahoo.co.jp/articles/ad38afb5f209c8fd27671a396c5fc8a87a2c0bfe,2023/12/25(月) 15:30
kry,ＫＲＹ山口放送,「みんなが第一志望に受かりますように…」受験生を応援！空港に特大の絵馬設置,https://news.yahoo.co.jp/articles/76fdb23138e5498a1fac7d7e01feec6953477ee0,2023/12/25(月) 11:53
kry,ＫＲＹ山口放送,【山口天気 朝刊12/25】クリスマスは曇りがちで空気冷たい　昼まで時雨も　あす26日（火）からは日に日に気温上昇　季節外れの暖かさへ,https://news.yahoo.co.jp/articles/a03df8b24f39855f9c31a0c34889b06464132c59,2023/12/25(月) 7:01
kry,ＫＲＹ山口放送,ハンドボール女子日本選手権 山口銀行YMGUTS初戦を接戦で制し2回戦進出,https://news.yahoo.co.jp/articles/519fb21e8459476d297bd2f5d0a8f02fb1e345e4,2023/12/24(日) 18:23
kry,ＫＲＹ山口放送,【速報】周防大島町で民家火災…かつて飲食店も併設・けが人はいない模様,https://news.yahoo.co.jp/articles/27e6347afc88ffee084de0273ee419bd5cc2b8f7,2023/12/24(日) 17:57
kry,ＫＲＹ山口放送,調理科のある女子高校で…親子でつくる「クリスマス料理教室」,https://news.yahoo.co.jp/articles/95c4e5eb02363e329a7781098af6d8b7d8a2210c,2023/12/24(日) 17:40
kry,ＫＲＹ山口放送,全国高校駅伝・西京女子アンカー14人抜きの快走で20位 男子は35位,https://news.yahoo.co.jp/articles/9a4ff2ce46776e88855dfa4321be22c7d3ba000a,2023/12/24(日) 16:18
