media_en,media_jp,title_articles,link_articles,date_original
ybc,YBC山形放送,【山形大雨】土砂流入した旅館で暑さの中、撤去作業続く「地道に取り除くしかない」　休業を来月１６日まで延長,https://news.yahoo.co.jp/articles/305a358338c3554edc8fad2a54745057ec21752a,8/5(月) 13:04
ybc,YBC山形放送,【夏の甲子園】山形県代表　鶴岡東は聖光学院高校（福島）と初戦対戦,https://news.yahoo.co.jp/articles/0b8e3c8d7a6967dd03dc4908f505fd247a57815f,8/5(月) 12:31
ybc,YBC山形放送,いよいよ５日開幕　山形花笠まつり　前日イベント「花笠サマーフェス」で祭り気分を盛り上げ,https://news.yahoo.co.jp/articles/da963527786949ac284906f9bc4d8958752bed8e,8/5(月) 12:24
ybc,YBC山形放送,山形代表・鶴岡東は初戦で福島代表・聖光学院と東北対決…全国高校野球選手権の組み合わせ抽選会,https://news.yahoo.co.jp/articles/d38ee81c1550ce543b93e94620d990154a5832d2,8/4(日) 18:59
ybc,YBC山形放送,山形出身・鈴木透生選手擁する水球男子日本代表「ポセイドンジャパン」がスペインと対戦…8-23で敗れる,https://news.yahoo.co.jp/articles/a24b2ef696b6ffdf11f89946787848cf99be764c,8/4(日) 12:24
ybc,YBC山形放送,山形市の建設設備会社が創立70周年機に社名変更「弘栄設備工業」から「KOEI（コーエイ）」に,https://news.yahoo.co.jp/articles/2afee4ded29e36722f524493920502b85fd480e6,8/4(日) 12:18
ybc,YBC山形放送,山形市出身・MF土居聖真選手が移籍後初ゴール！モンテディオ山形が粘り強く耐え抜き勝ち点1,https://news.yahoo.co.jp/articles/0e03d19446329436531cc607a398dde257ef6e79,8/4(日) 12:04
ybc,YBC山形放送,今夏初・山形県に熱中症警戒アラート、山形・米沢で猛暑日迫る暑さ,https://news.yahoo.co.jp/articles/aafe7103943fe2fc531b600de7071c5dc11fbfe9,8/3(土) 17:59
ybc,YBC山形放送,山形県に今夏初の「熱中症警戒アラート」が発表,https://news.yahoo.co.jp/articles/38a15dee1ab72d9c1d48eb938a028d06213d4abd,8/3(土) 12:49
ybc,YBC山形放送,記録的大雨から2度目の週末、山形県戸沢村で暑さのなかでの復旧作業続く,https://news.yahoo.co.jp/articles/687d3980c430d976cf0c6695cef09e5f7b4f2e46,8/3(土) 12:24
ybc,YBC山形放送,"「関係人口」の創出パワー,ふるさと納税部門の全国トップ3に「山形県」",https://news.yahoo.co.jp/articles/b68462a82e199b2b36451f3e55da1853a5f49799,8/3(土) 12:15
ybc,YBC山形放送,舟形町の最上小国川アユの「やな場」崩壊　海水浴場には多くの漂流物　庭月観音も本堂浸水,https://news.yahoo.co.jp/articles/196ca096c8c60d26743b5b8731f214cdb612fd69,8/2(金) 18:11
ybc,YBC山形放送,大雨での農林水産分野の被害額60億円　さらに拡大見込み　鮭川村と戸沢村に仮設住宅建設へ,https://news.yahoo.co.jp/articles/ecf86237bb2a13a5ad5d332d189f343a582d79f7,8/2(金) 18:11
ybc,YBC山形放送,梅雨明けしたとみられる山形県内　厳しい暑さ続く見込み　被災地での復旧作業熱中症対策を,https://news.yahoo.co.jp/articles/ffc4dd179ef20cccc47535c61f69386a27447e36,8/2(金) 18:10
ybc,YBC山形放送,１カ月かけての社員の世界一周旅行を支援　東根市の農機具メーカー　サクランボの原産地トルコも訪問,https://news.yahoo.co.jp/articles/f7e274c55272b89dbd3e82cf0e67495cd8a79fd4,8/2(金) 16:47
ybc,YBC山形放送,【大雨】舟形町特産のアユを獲る「やな場」崩壊　復旧のめど立たず・山形,https://news.yahoo.co.jp/articles/1d36ccd491c0cd81deafa3fb5e892028943e97e1,8/2(金) 12:38
ybc,YBC山形放送,夏休みの小学生が経済学ぶ　証券会社で社会学習・山形,https://news.yahoo.co.jp/articles/d5628f6ee49e953dc86870b77383e7469ff89854,8/2(金) 12:34
ybc,YBC山形放送,山形新幹線　山形−大石田駅間で運転再開　新庄−大石田間は代行バス　最上川の舟下りも営業再開,https://news.yahoo.co.jp/articles/d8cd5e90108e4b4322b2ad2bfd70f9031ef3f740,8/1(木) 18:34
ybc,YBC山形放送,山形県内大雨1週間　3人死亡住宅被害1200棟　鮭川村の一部避難指示続く　停電は全て解消,https://news.yahoo.co.jp/articles/153d430bb81fef2aa9e97aa3a6c097f942abee5b,8/1(木) 18:23
ybc,YBC山形放送,山形県内1日2度の大雨特別警報　梅雨前線や庄内沖の海面温度上昇に台風など複合要因か,https://news.yahoo.co.jp/articles/9256037b9783f105d2cd6e287b0be681c708697f,8/1(木) 18:01
ybc,YBC山形放送,救助要請で出動し亡くなった新庄署の警察官　「真っすぐで一生懸命」恩師が突然の死を悼む,https://news.yahoo.co.jp/articles/0a4f4721f5d965895e26d9fd872184cc0c77e082,8/1(木) 18:01
ybc,YBC山形放送,以前勤務していた会社事務所に火をつけ3度目逮捕　元酒田市消防団副分団長の男,https://news.yahoo.co.jp/articles/4dfd311671139714179e41bf319712d3181fda07,8/1(木) 17:59
ybc,YBC山形放送,JR米坂線の橋梁が崩落するなどした豪雨から2年　飯豊町の80代の不明男性の捜索行う,https://news.yahoo.co.jp/articles/75b7166192120e2f66605afd6b41a6bd6af3c062,8/1(木) 17:44
ybc,YBC山形放送,「堤防持ちこたえた」国の堤防調査委員会が考え示す　大規模な浸水被害が出た戸沢村を視察,https://news.yahoo.co.jp/articles/02b9e3ba56fdb6c3f43190eda6ad29c647f8387b,8/1(木) 15:58
ybc,YBC山形放送,リポーターの仕事を体験するお仕事体験企画！児童が山形交響楽団のコンサートに潜入！,https://news.yahoo.co.jp/articles/a63ea80391ac12487a9a520449c13c001ecf9dc8,8/1(木) 15:05
ybc,YBC山形放送,山形県戸沢村の「最上川舟下り」1日営業再開…半数以上の船が流される,https://news.yahoo.co.jp/articles/78d047b8438de656c28a2573721061c263b922fe,8/1(木) 12:32
ybc,YBC山形放送,山形県・大雨から1週間 依然避難者300人近く…3人が死亡約1200棟被害,https://news.yahoo.co.jp/articles/ed856a10c39ea9671420b307e3128c6945c514ba,8/1(木) 12:26
ybc,YBC山形放送,のり面崩落の山形新幹線　山形−大石田間1日に運転再開　大石田−新庄間は代行バス,https://news.yahoo.co.jp/articles/065892c06be0fc644cc8c7e3b7840286db8d487c,7/31(水) 17:28
ybc,YBC山形放送,「輪中堤」整備された戸沢村蔵岡地区　想定外の「最上川」氾濫に「もう住めない」の声も,https://news.yahoo.co.jp/articles/9a750370ed8154fc7404b402a95555b95a260821,7/31(水) 17:21
ybc,YBC山形放送,戸沢村の最上川の舟下り　11隻の舟が流される　残った5隻で1日に営業再開へ,https://news.yahoo.co.jp/articles/0d383ebccc2a50fb73206f23a106dc43316c04d2,7/31(水) 17:21
ybc,YBC山形放送,国土交通省が最上川堤防調査委員会設置　決壊した現地を視察　原因や復旧方法を検討へ,https://news.yahoo.co.jp/articles/eeee18102c083b956c5f78a7f76d15a68d070aa1,7/31(水) 17:20
ybc,YBC山形放送,り災証明書の発行に向け酒田市で現地調査始まる　担当者「想定していたよりかなり深刻」,https://news.yahoo.co.jp/articles/6525b51a28a8ad8a24871ea0400c833d7780b7a4,7/31(水) 17:10
ybc,YBC山形放送,大雨で避難中に不明の86歳女性か心肺停止の状態で発見　住宅に打ち上がった流木の中に　山形・酒田市,https://news.yahoo.co.jp/articles/c7441e3408ccc6869a38040f77ec6e1ddb57d36b,7/31(水) 14:34
ybc,YBC山形放送,元県議に348万円を請求するよう吉村知事に命じる　不正受給の返還請求訴訟で山形地裁が判決,https://news.yahoo.co.jp/articles/cc50b4a7bed6adc9f2ce51eb97808ff4191497fc,7/31(水) 14:13
ybc,YBC山形放送,「どうしたものか…」約5000人分の予約がキャンセル見込み　大雨で土砂流入の温泉旅館片付け作業に追われる　山形・最上町,https://news.yahoo.co.jp/articles/2fd661506b8a4b5df90e700a2fd9ea54b7290676,7/31(水) 12:33
ybc,YBC山形放送,勤務先の口座から自分の口座へ…現金約1000万円横領の疑いで当時経理担当の茨城県の男逮捕　山形県警,https://news.yahoo.co.jp/articles/fef964b0a28424f545f8d7a50cacf073b7e80b56,7/31(水) 12:25
ybc,YBC山形放送,米沢市で作業中だった男性がクマに襲われけが　県内での人的被害3件目,https://news.yahoo.co.jp/articles/7c335bfc34a4c3f31bbb5e14f504d69a3dd8b956,7/31(水) 11:40
ybc,YBC山形放送,8月3日開催予定「酒田の花火」中止…大雨で会場が冠水したことや災害対応理由に,https://news.yahoo.co.jp/articles/ac60c08c4aad3942bf546b514952112d2dead14d,7/30(火) 17:04
ybc,YBC山形放送,酒田などで災害ボランティアの受け入れ始まる…水に浸かった畳や泥の撤去作業,https://news.yahoo.co.jp/articles/daeb59d308b8c0e54479233cc020854aa28ff7b0,7/30(火) 14:58
ybc,YBC山形放送,【山形大雨】不明遺体の身元は新庄警察署勤務の巡査部長（２９）　県内で死亡確認は2人目,https://news.yahoo.co.jp/articles/e6e84155b63dcd6710e89ba6e72c082e86df91cb,7/29(月) 23:03
ybc,YBC山形放送,【山形大雨】身元不明の男性遺体は新庄警察署の男性巡査部長（当時）29歳と判明,https://news.yahoo.co.jp/articles/85ae4480eb51c9fca8843c78a62be10cb9b401dc,7/29(月) 20:46
ybc,YBC山形放送,道路寸断の酒田市北青沢地区　1階が土砂で埋まった住宅も　自衛隊の支援活動に同行,https://news.yahoo.co.jp/articles/e6c9a7191cfc3c2e07d354fd54ea0743f5b5be33,7/29(月) 18:31
ybc,YBC山形放送,「悔しい…」農作物全滅の畑も　大雨特別警報から5日　甚大な被害次々と,https://news.yahoo.co.jp/articles/15fdc77d15bf48459beb3986cf726e0ac0f4dfcf,7/29(月) 18:31
ybc,YBC山形放送,山形道のトンネル内で軽トラックと大型トラック正面衝突　仙台市の55歳の男性が死亡,https://news.yahoo.co.jp/articles/9d49544e52978aa2aaf4264232724f06ddee340b,7/29(月) 18:30
ybc,YBC山形放送,【山形・大雨被害】　鮭川村のナメコ栽培が浸水被害　機械の故障と断水でさらに拡大か,https://news.yahoo.co.jp/articles/822b33349083d86f724049dd18d558a923b44154,7/29(月) 18:30
ybc,YBC山形放送,「もう住めない」　山形の大雨で家屋被害766棟　7棟が全壊　り災証明書の発行始まる,https://news.yahoo.co.jp/articles/c4e7c2ccce8aaed42f02b6a9fea56c3ba31230aa,7/29(月) 18:09
ybc,YBC山形放送,「正義感強かった」兄と同じ道に　大雨救助で亡くなった新庄署の警察官　中学時代の同級生悼む,https://news.yahoo.co.jp/articles/e8ca5063ce3df55ad543a284ec95cb3b5e119d62,7/29(月) 17:03
