media_en,media_jp,title_articles,link_articles,date_original
ishikawa,石川テレビ,人生おもしれぇっす！HIRO10…涙も新種目ブレイキン男子で最高のパフォーマンス！,https://news.yahoo.co.jp/articles/cc11ec7376ae7df94495405e2240c860b5d09415,8/11(日) 12:34
ishikawa,石川テレビ,「人が集まる場所に」珠洲市の「潮騒レストラン」が営業再開,https://news.yahoo.co.jp/articles/50ce39766753e83d58bac2f45340cc4c4f610283,8/10(土) 18:26
ishikawa,石川テレビ,輪島の味覚と伝統文化を味わって　イオンモールかほくで「まるっと輪島フェア」,https://news.yahoo.co.jp/articles/b3149cc6e1e57be4632f55dcb19b89c9be010871,8/10(土) 18:24
ishikawa,石川テレビ,金沢駅は帰省客で混雑　Uターンピークは12日,https://news.yahoo.co.jp/articles/098de0d9b744e553cdc426636e5c46515a8a28ac,8/10(土) 18:20
ishikawa,石川テレビ,「夢のような25周だった」パリ五輪　女子1万メートルに金沢市出身の五島莉乃選手が初出場,https://news.yahoo.co.jp/articles/4bab2fceb3d53d9b465e557a1a493e032b6ce352,8/10(土) 12:04
ishikawa,石川テレビ,ナイジェリア戦で芸術的フリーキックを決めたなでしこジャパンの北川ひかるが海外に移籍へ,https://news.yahoo.co.jp/articles/d3cdb9be102d3a2a451e3487d6e9e18d6251ffd1,8/9(金) 19:21
ishikawa,石川テレビ,今の問題点や今後の住まいの考え等聞く…馳知事が“仮設住宅回り”開始 初日は電気料金補助求める声あがる,https://news.yahoo.co.jp/articles/1351f9b8c0ce95bd5218a5535d201756ca915322,8/9(金) 18:44
ishikawa,石川テレビ,タクシー会社の元専務が1億円超を横領したとされる事件 国税局が所得税約5200万円脱税の疑いで告発,https://news.yahoo.co.jp/articles/5c94a5c67ce52d28de1d10f970e9bdb32b6ab662,8/9(金) 18:37
ishikawa,石川テレビ,パリ五輪でファン沸かせる…水球男子代表の新田一景選手が帰国し地元・白山市役所へ「応援が自分の力に」,https://news.yahoo.co.jp/articles/3e6ca6c7567b30db7266dea5412a27af609db144,8/9(金) 18:31
ishikawa,石川テレビ,避難所生活等で負荷生じ亡くなった男性も…珠洲市・能登町・七尾市が災害関連死21件を認定 計110人に,https://news.yahoo.co.jp/articles/9696f2d05d9fcb1746753bf1df3de0d3acc98654,8/9(金) 17:21
ishikawa,石川テレビ,「組合役員にはボーナスや退職金支払わない」と述べたとして能美市の会社救済命令,https://news.yahoo.co.jp/articles/ae258c8e14a2c084b34188517d81616cc53bf8c8,8/9(金) 17:19
ishikawa,石川テレビ,パリ五輪で予選敗退の水球男子日本代表の新田一景選手が「ロスオリンピックに向け精進」と次の目標明かす,https://news.yahoo.co.jp/articles/299d4fa96506dd7d14c6b7a9cc38627d4242a302,8/9(金) 12:04
ishikawa,石川テレビ,奥能登4つの公立病院が石川県に“新しい基幹病院の建設”を求める…地震で入院患者数が大幅減,https://news.yahoo.co.jp/articles/20212a019a65ea21279e562c077e07beaa84e8dd,8/9(金) 12:04
ishikawa,石川テレビ,お盆は渋滞に要注意！リニューアル工事続く北陸道で最大10kmの渋滞予測,https://news.yahoo.co.jp/articles/5c5eaf6f2b060ff7137aa2c0029caecedfc30aaf,8/9(金) 12:04
ishikawa,石川テレビ,甲子園初勝利！夏の高校野球 石川代表の小松大谷が大分の明豊に勝ち初戦突破 2回戦は大阪桐蔭と対戦へ,https://news.yahoo.co.jp/articles/57afb742b2f27eeea9573f471a700e02ddaaadbb,8/8(木) 21:29
ishikawa,石川テレビ,裏金問題で馳知事を刑事告発…馳知事は「告発の内容については詳細を承知していない」,https://news.yahoo.co.jp/articles/8228efdc66700a9866a422353c5040cf27f79045,8/8(木) 21:10
ishikawa,石川テレビ,日本は5位…パリ五輪アーティスティックスイミング木島萌香の地元・白山市からも熱い声援「よく頑張った」,https://news.yahoo.co.jp/articles/af3176f2487197f02ce134cc2315fa1843a7c9df,8/8(木) 19:51
ishikawa,石川テレビ,靴が壊れて立ち止まっていた10代女性に「直してあげる」修理に見せかけて足を触った疑いで72歳男逮捕,https://news.yahoo.co.jp/articles/083d915fe5fe6d30bbf1805c2b446321c7ac407f,8/8(木) 16:15
ishikawa,石川テレビ,「ドーンという音で…」金沢で住宅など4棟焼く火事…けが人はなし,https://news.yahoo.co.jp/articles/32394bd7deb1496403dff0106f2deef62d27230c,8/8(木) 16:13
ishikawa,石川テレビ,復興応援絆大使に就任…くまモンが能登の被災地へ 大人も子供も笑顔に「はなれていても心は1つだモン！」,https://news.yahoo.co.jp/articles/366b2aa096d3ab86cc6d5735643851fd12115caf,8/7(水) 21:25
ishikawa,石川テレビ,被災した穴水高校の主将が先導…夏の甲子園開幕 石川代表・小松大谷は8日の第2試合で大分の明豊と対戦,https://news.yahoo.co.jp/articles/1837803fc6c0ee44198517c2ee82f2136b17650f,8/7(水) 21:25
ishikawa,石川テレビ,「能登の古材を守りたい」解体される家屋の床や柱を保存、再利用へ,https://news.yahoo.co.jp/articles/1b8797ece6fef043196e4b5420bd375592699602,8/7(水) 21:18
ishikawa,石川テレビ,連結トレーラー等から4トン車に…能登半島地震で大量に発生した災害廃棄物の積み替え拠点 金沢で運用開始,https://news.yahoo.co.jp/articles/0409c6583e14ff5c7f1921f4f4a7303532e6d826,8/7(水) 21:16
ishikawa,石川テレビ,北陸新幹線「小浜ルート」最大で事業費5兆3千億円工期約28年 与党PTは26年3月迄の認可着工目指す,https://news.yahoo.co.jp/articles/9db456e0c398e7f011d86646d43503c091b872e1,8/7(水) 21:08
ishikawa,石川テレビ,99歳の元隊員も参列「女子挺身隊員」慰霊の集い,https://news.yahoo.co.jp/articles/2f1ec6ae61102f8fb942bca7a60324151c210d15,8/7(水) 21:05
ishikawa,石川テレビ,新たな発信拠点に　タテマチストリートにライブハウス完成,https://news.yahoo.co.jp/articles/c9e7c4e5c71533d20afacad2f20cb07f7bd9d66b,8/7(水) 12:18
ishikawa,石川テレビ,アーティスティックスイミングは総合4位に後退　最終種目へ,https://news.yahoo.co.jp/articles/f5114074ed855d239bf65bfae44671e714194d5a,8/7(水) 12:08
ishikawa,石川テレビ,“人間国宝”に認定へ…輪島塗の装飾技法『沈金』の職人・西さん 地震を機に過去の図案捨て「新しい形に」,https://news.yahoo.co.jp/articles/d66e4d8a469fc40d31b692352202f5e99824860d,8/6(火) 19:00
ishikawa,石川テレビ,1700世帯を24時間見守り…仮設住宅の高齢者の孤独死防止 システム導入費等の補正予算案可決 輪島市,https://news.yahoo.co.jp/articles/69b40a483881e3a36719ce72dbe52bdd83762c44,8/6(火) 18:40
ishikawa,石川テレビ,「優勝というより郷土料理伝えたい」地震乗り越えた高校生が“和食の甲子園”で復興への願い 七尾・鵬学園,https://news.yahoo.co.jp/articles/69225a9d1794818bd1d56160e0a0974776597614,8/6(火) 18:35
ishikawa,石川テレビ,大会2日目に大分代表・明豊と…7日開幕する夏の甲子園 石川代表・小松大谷ナインが開会式のリハーサルに,https://news.yahoo.co.jp/articles/69960ad83adcfcf1762091ae43b7cce46bdcf84a,8/6(火) 18:33
ishikawa,石川テレビ,ロスへつながる1勝…白山市出身の新田一景選手が出場した水球男子日本代表が初勝利,https://news.yahoo.co.jp/articles/c378d8a5b9a32570c3eb49174d80af32c7061c17,8/6(火) 18:27
ishikawa,石川テレビ,抗議で6位から3位のメダル圏に浮上…アーティスティックスイミング白山市出身の木島萌香選手が出場,https://news.yahoo.co.jp/articles/c2129fea8a85e809f3a3d0196f8f8fb96d421b5c,8/6(火) 18:27
ishikawa,石川テレビ,別件で聴取中に異変？尿検査で覚醒剤成分検出したとして自称医師の男を逮捕,https://news.yahoo.co.jp/articles/0e3888df33784049ac6efe498f1590449a08ab65,8/6(火) 18:21
ishikawa,石川テレビ,暗号資産約340万円をだまし取られ…40代男性がSNSロマンス詐欺の被害に,https://news.yahoo.co.jp/articles/4191e455b7ab1f36a9316ea2c048fd1c71af4207,8/6(火) 17:36
ishikawa,石川テレビ,県職員ってどんな仕事？夏休み中の子どもたちが親の職場を見学,https://news.yahoo.co.jp/articles/31c2aede3bfd523cf1222511f1f9d89fa2e8b274,8/6(火) 16:25
ishikawa,石川テレビ,草むしり中の男性が車にはねられ意識不明…白山市内で交通重体事故,https://news.yahoo.co.jp/articles/d949bc2041002adc7050006e20438a59f1eaa480,8/6(火) 16:25
ishikawa,石川テレビ,小松大谷も堂々行進…夏の甲子園開幕を前にリハーサル,https://news.yahoo.co.jp/articles/52937d0e56c1add83364a195db29761f37fb498e,8/6(火) 12:55
ishikawa,石川テレビ,1房100万円の値がついた高級ブドウ”ルビーロマン”を無料で！金沢駅で試食イベント,https://news.yahoo.co.jp/articles/743855f311dbe35a773aa3a9a13504b34db22c00,8/6(火) 12:53
ishikawa,石川テレビ,シリーズ企画「ひんやりスポット」地震に負けない志賀町の大自然,https://news.yahoo.co.jp/articles/d9d73c3288fdea98d266a53bb910568fb3253d64,8/5(月) 21:10
ishikawa,石川テレビ,県産ナシ主力品種『幸水』初出荷 JA担当者「ここ近年で無いくらい最高の出来」約270トン出荷へ 石川,https://news.yahoo.co.jp/articles/385b6663e307061af40511fd979f3cb9d4089eda,8/5(月) 18:51
ishikawa,石川テレビ,被災地訪れた松村防災担当相「公費解体の加速化図る」各自治体の課題等を共有するリストの作成計画明らかに,https://news.yahoo.co.jp/articles/1afadd879c494d5f61982b6cbfb7781862768a61,8/5(月) 18:51
ishikawa,石川テレビ,能登半島地震には間に合わず…M7以上の恐れある活断層「近畿-北陸の沿岸等で25カ所」政府の地震調査委,https://news.yahoo.co.jp/articles/6a772a9c9a8f51d85c7be5aed0fb7545cbce48dd,8/5(月) 18:48
ishikawa,石川テレビ,立ちふさがった米国の壁…パリ五輪“なでしこジャパン”メダルに届かず 金沢出身の北川は攻守にわたり活躍,https://news.yahoo.co.jp/articles/164e7a1ea3e19c00e00280bf1d1fd1349e919f41,8/5(月) 17:59
ishikawa,石川テレビ,バスケットボール女子日本　ベルギーに惜敗,https://news.yahoo.co.jp/articles/9b1bf1830ded8001730be040a6d42a0528767461,8/5(月) 12:37
ishikawa,石川テレビ,小松の十二ヶ滝で男子児童が溺れ意識不明の重体,https://news.yahoo.co.jp/articles/3ae7c42f1f55a3b27316f08bcc073bfe5127d65f,8/5(月) 12:35
ishikawa,石川テレビ,気象予報士がゲスト　地球環境と気象を学ぶ親子イベント,https://news.yahoo.co.jp/articles/bc515092bba91d0355c3fcb8acf0918d2c05d213,8/4(日) 18:37
ishikawa,石川テレビ,携帯電話を分解してリサイクル学ぶ,https://news.yahoo.co.jp/articles/8852473e32e7a13eed1bcbad581c58e9dd239ad4,8/4(日) 18:34
ishikawa,石川テレビ,夏の甲子園　小松大谷は大分代表・明豊との対戦,https://news.yahoo.co.jp/articles/f305d70a793b4095fd7f9792e243c2ad54b84d22,8/4(日) 18:32
