media_en,title_articles,link_articles,date_original
kyt,【速報】フリースクール発言問題の滋賀・東近江市長、謝罪意向の一方で「撤回して何の意味がある」「信念で発言した」,https://news.yahoo.co.jp/articles/388df62a55a9158499d09b66ef3d09b1be5a473d,10/25(水) 11:27
kyt,リニューアルした市施設の床暖房、未検査で使用不可　設計会社に損賠請求,https://news.yahoo.co.jp/articles/ecaebd503df67bb7e79321dfd14b2bcc47a00537,10/25(水) 11:02
kyt,【速報】フリースクール発言問題の滋賀・東近江市長「深く反省、謝罪したい」　定例会見で「配慮の足りないワンフレーズ」,https://news.yahoo.co.jp/articles/3ea553c575226a55901b4c3a6eb08775c9d840ac,10/25(水) 10:57
kyt,「ふくちやまのエエもん」に２品認定,https://news.yahoo.co.jp/articles/06a6c7c3a0937314f6fbab5905f1dc4029a7ff56,10/25(水) 10:42
kyt,京都アニメーションはこうやって放火された　裁判で判明した犯行の一部始終,https://news.yahoo.co.jp/articles/a7953a00aa62403fd002fe126c121f7f14ff7bdf,10/25(水) 10:32
kyt,【速報】信号のない交差点で車と衝突　オートバイの男性死亡,https://news.yahoo.co.jp/articles/19d90244724d4ec5bac828785d09ca8e302ac3e1,10/25(水) 9:57
kyt,「日本に素晴らしい木あること知って」　京都府南丹市で優良材の表彰式,https://news.yahoo.co.jp/articles/abd5bb9bffcd39ecc7f9844ce058c3e76cf93df0,10/25(水) 9:02
kyt,今夏の猛暑、バラもこたえた　大津市のバラ園一般公開も、近年では最も花少なく,https://news.yahoo.co.jp/articles/167140fb5043cc781adf5e52f6efc2230eb9a4c7,10/25(水) 7:02
kyt,黄檗駅で人身事故、JR奈良線が一時運転見合わせ　回送電車が人と接触,https://news.yahoo.co.jp/articles/e5ad8e7068a90b1390a947fe941adf690c0fd9e2,10/24(火) 23:22
kyt,阪急・上新庄駅で人身事故　京都線・千里線が一時運転見合わせ,https://news.yahoo.co.jp/articles/6ddbdd38072d7d0cc1e90f993b185ac7a02d4e38,10/24(火) 21:06
kyt,畑でパワーショベル転落か、下敷きの72歳男性が死亡　滋賀県長浜市,https://news.yahoo.co.jp/articles/17b7657c8389547e6122f8a83219d76ff3467f9f,10/24(火) 20:06
kyt,ALS嘱託殺人事件、医師・大久保被告の初公判は来年1月に　京都地裁,https://news.yahoo.co.jp/articles/4d658dde87879086de46f67f8c7af3defc54d94c,10/24(火) 19:54
kyt,東近江市長「なんで謝罪する必要あるの」　フリースクール発言「親御さんには誤解与えた」とも,https://news.yahoo.co.jp/articles/ef28501d3da412d21efc779d3b37ee331af23250,10/24(火) 18:46
kyt,13歳未満の女児の下半身触る、49歳塾経営者を不同意わいせつ容疑で逮捕,https://news.yahoo.co.jp/articles/4dfc850f64827a35193b01604bf33a50c98a642c,10/24(火) 18:39
kyt,岸田首相「不登校はさまざまな要因が複雑に関わる」　東近江市長の発言受け答弁,https://news.yahoo.co.jp/articles/d05f246a87bcd63ef7a63f4ce5099ac76a02843f,10/24(火) 18:39
kyt,滋賀県野洲市がピアノ使用料徴収ミス、14万円超返還へ　1回300円が500円に,https://news.yahoo.co.jp/articles/45df416265e78e1730638bd66d7f51db4ebf3044,10/24(火) 18:24
kyt,京都府宮津市の海に沈んだ車で発見の遺体は86歳女性　夫は近くの海岸で遺体発見,https://news.yahoo.co.jp/articles/0dfefd66f256f337d9a9ad0554caa7ccd632c392,10/24(火) 17:01
kyt,同志社大元アメフト部員性的暴行　共犯の男に懲役5年求刑「極めて卑劣で悪質」,https://news.yahoo.co.jp/articles/3f405af00f8442d2d3ba3a34bcdc38fdd1cb9e81,10/24(火) 16:16
kyt,社説：首相の所信表明　借金財政でも「還元」なのか,https://news.yahoo.co.jp/articles/d0d774ce0dc58a9919078312ede66d916e698f7d,10/24(火) 16:01
kyt,保育園児と住民が植えたコキアが真っ赤に　笑顔で抱きつき「大きくなった」,https://news.yahoo.co.jp/articles/8364a683234bac786a0519504abbfeb91c24c335,10/24(火) 15:32
kyt,滋賀・東近江市長のフリースクール発言「配慮に欠けた」　市教委が保護者向け文書で見解,https://news.yahoo.co.jp/articles/feb9a812aa9e0b2a4acde1654e8ea53f3027756e,10/24(火) 14:54
kyt,米スタンフォード大客員講師の僧侶が中学校で講演　「命の大切さ・生きるとは」,https://news.yahoo.co.jp/articles/816b5d81d47d5ac14581992453e5bccc8d533d01,10/24(火) 14:42
kyt,「不登校の大半は親の責任」滋賀県東近江市長のフリースクール発言「配慮ある発言ではなかった」三日月知事が見解,https://news.yahoo.co.jp/articles/616c10eb0cb0a46c6e3fc092947f3d9334782534,10/24(火) 13:17
kyt,幼稚園の送迎バスと軽ワゴン車が接触　通園中の児童26人乗車　滋賀・豊郷,https://news.yahoo.co.jp/articles/0bd8b0b92fdd6c36a0da284c29c6371ac74dc529,10/24(火) 12:48
kyt,キンモクセイにも猛暑が影響？　開花最も遅く、京都府立植物園「めったにない」,https://news.yahoo.co.jp/articles/0df379693ae4b8421c2f7a981dfa5a1989daa4d2,10/24(火) 10:32
kyt,京都の「木」で自由に楽しく工作、小学生の作品をずらりと展示,https://news.yahoo.co.jp/articles/93391829acab367735d2d4c0f519e70e6c14a80e,10/24(火) 7:01
kyt,ワクチンコールセンター過大請求、「全額返還」で住民監査請求を却下,https://news.yahoo.co.jp/articles/2460642d2bac2db8e66af5fb126f1b8051a63a4f,10/23(月) 19:46
kyt,介護施設で入所者暴行、3人目被害者は脳挫傷に　容疑の職員再逮捕,https://news.yahoo.co.jp/articles/e4bb67ac7389edcc253797ef3afa1d099b84f5b6,10/23(月) 19:24
kyt,「発達障『がい』の子も親も元気に」地域との橋渡し役で奔走、女性の思いとは,https://news.yahoo.co.jp/articles/e7493721aae7a45d5978e0cef7ed7275cc22e652,10/23(月) 18:48
kyt,「暴力団に名義貸ししている」警官名乗る男に現金1600万円だまし取られる,https://news.yahoo.co.jp/articles/97f9469a16b548e2a5b20615fabc7873c6d2b51f,10/23(月) 18:22
kyt,在宅中でも「堂々」侵入、自転車で物色し窃盗繰り返す　容疑の35歳男を逮捕,https://news.yahoo.co.jp/articles/46ffc77de101ababe04e2a7ee8d9b3c801142b48,10/23(月) 17:32
kyt,京阪本線、鴨東線、中之島線が全線で一時運転見合わせ　香里園駅で車両故障,https://news.yahoo.co.jp/articles/61a85426910dff1999704c4638487a37da077fda,10/23(月) 16:39
kyt,女性になりすまし電子マネー8万円相当だまし取った疑い　21歳大学生の男逮捕,https://news.yahoo.co.jp/articles/1cbdf59c1bc254bdeb36b629b069b0d860c76871,10/23(月) 16:33
kyt,社説：給食費の無償化　実現に向けて幅広い議論を,https://news.yahoo.co.jp/articles/e522e52ca9a3ca16dd2b6a6781b057898e6ff413,10/23(月) 16:02
kyt,「自分の居場所」「前向けた」　就労支援手がけるNPOが歩んだ20年、精神障害者とともに,https://news.yahoo.co.jp/articles/9de2adfe5b01d4aeb706d22be1461be232992afe,10/23(月) 15:02
kyt,日本三景・天橋立を低速電動車で巡って　狭い道もすいすい、「グリスモ」実証実験　観光船やバスとも連動,https://news.yahoo.co.jp/articles/75d331cdc4277457a9040d548843602a129e0be9,10/23(月) 15:02
kyt,子ども守る町の人に「ありがとう」　児童が感謝込め安全ポスター　緊急時駆けこむ「110番の家」描く,https://news.yahoo.co.jp/articles/0de339760c93a347258ada9a7eb2b789ac1fc4a9,10/23(月) 15:02
kyt,芝居の喜びかみしめ稽古に熱　コロナ乗り越え12月に節目公演　2010年発足の市民演劇サークル「谺」,https://news.yahoo.co.jp/articles/16383a1d689096bf3e07b3e2e777b1d7b6339dbc,10/23(月) 15:02
kyt,東海道新幹線が運転再開　三河安城ー名古屋でのり面火災,https://news.yahoo.co.jp/articles/b26e1bc5643af4d9dd403f776e53515874df62b7,10/23(月) 12:36
kyt,ブランド品など盗み1300万円被害　京都の百貨店などで、窃盗容疑で男2人追送検,https://news.yahoo.co.jp/articles/f928df70b5fabd192cc378fc5d8fcc7afe9323fe,10/23(月) 12:16
kyt,青葉被告の刑事責任能力、検察側「正常な心理」弁護側は無罪か減刑主張　京アニ放火殺人公判,https://news.yahoo.co.jp/articles/de7cb016d1bbb3a81d61311c29aeae80c5041309,10/23(月) 11:57
kyt,両親殺害の初公判で「黙秘します」と被告　弁護側は「責任能力なく」無罪主張,https://news.yahoo.co.jp/articles/2bfb4851c4520d3425d71220adc17c8e8ba2c834,10/23(月) 11:51
kyt,東海道新幹線が一時広範囲で運転見合わせ　三河安城ー名古屋駅間でのり面火災,https://news.yahoo.co.jp/articles/71c8ce2671368e7156a8efefcdd70f7ef90308ca,10/23(月) 11:09
kyt,京都市の神社参道でスズメバチ被害相次ぐ　幼児ら刺される　市が注意喚起怠り、被害拡大,https://news.yahoo.co.jp/articles/4dc667da5b34cfddbddf8b70926c66192f3decc8,10/23(月) 10:32
kyt,京都サンガの試合日に「紫うどん」はいかが？　本拠近くのうどん店がチームカラーにちなんで開発,https://news.yahoo.co.jp/articles/cea4a0697939f28029c1537d4e0af4b420529b4f,10/23(月) 7:02
kyt,京アニ放火殺人事件裁判、23日から刑事責任能力の審理へ　注目される精神鑑定医の証言,https://news.yahoo.co.jp/articles/76f037d2cbd96bc074a3ddce8cd42317ac320ec1,10/23(月) 7:02
kyt,寝たきりの人の髪カットします　訪問美容師は元高校教師　認知症の祖母の介護きっかけに転身,https://news.yahoo.co.jp/articles/0401eb1b4563d70ba7eda3e4261d7ac539e34748,10/23(月) 6:01
kyt,80歳僧侶の車が82歳男性をはねる　県道横断中、全身強打し死亡,https://news.yahoo.co.jp/articles/60dca674a8ead54539b6214490c09ec5a2b94a1b,10/22(日) 18:02
kyt,社説：希少生物の危機　輸入大国、日本の責任は重い,https://news.yahoo.co.jp/articles/e17b8c7c960bb5a8c9189b28354cba22d2e63187,10/22(日) 16:39
kyt,8歳女児に軽乗用車で衝突　ひき逃げ容疑で短大生の19歳女を逮捕「逃げた理由は飲酒運転だったから」,https://news.yahoo.co.jp/articles/54abc9471eb54437c0b44d53a76ac7c6c5f7f190,10/22(日) 14:32
kyt,「壬生菜」の発祥地知っている？　地元の小学生が栽培・販売へ　京都・中京,https://news.yahoo.co.jp/articles/003b928604ed4869e7f83eb7387ef9a699e3aa1d,10/22(日) 14:02
kyt,路上での性犯罪どうしたらなくせる？　警官と見回り、大学生が感じた危険とは,https://news.yahoo.co.jp/articles/992cb1f08a88f9a8ee5cdc677eb553a97d8e20f0,10/22(日) 13:02
kyt,京都の時代祭、行列が都大路へ　動く歴史絵巻　明治維新から平安時代を忠実再現,https://news.yahoo.co.jp/articles/0107800c7952cb41db02b553fab985f7b1844bae,10/22(日) 12:36
kyt,学校給食値上げ「やむを得ず」86％　物価高でも保護者容認、その理由は　京都,https://news.yahoo.co.jp/articles/83014c972a01897e6613a0a80885446d1ef2474b,10/22(日) 11:32
kyt,滋賀県議「国スポ」シャツ着用、「全会一致」にならず　一部議員「巨額の税投入、盛り上げる気なれず」,https://news.yahoo.co.jp/articles/4535193236cf61bf483e947fc5f48306425ed7ae,10/22(日) 10:02
kyt,京都市内で火災件数が急増　消防が「火の用心」呼びかけ,https://news.yahoo.co.jp/articles/10efa6823fe18a1efece66d85f96e38201274804,10/22(日) 9:02
kyt,地元に伝わる人形浄瑠璃、小学生が学ぶ「学校での練習楽しみ」　京都・京丹波,https://news.yahoo.co.jp/articles/51104b6608ded159344de33fd4d9fd79945757b2,10/22(日) 8:01
kyt,「生活苦で紙おむつ乾かし再利用」母親の声聞き、1万枚を市に寄贈　大津の小児科医院,https://news.yahoo.co.jp/articles/8f98e64c9c3c1a76b27ae099ef9a67b7d07746b4,10/21(土) 19:31
kyt,京都サンガ、湘南に敗れる　J1残留決定は次節持ち越し,https://news.yahoo.co.jp/articles/048acabdd14c755f971d3d39b30f6be767ab504f,10/21(土) 17:32
kyt,女性宅に侵入し毛布など窃盗、容疑の保健所技師の男逮捕　京都,https://news.yahoo.co.jp/articles/532af74088c1db13ac45adc456610f90a61e2ba6,10/21(土) 16:24
kyt,社説：京都市芸大の移転　まちに開かれ、文化育む場に,https://news.yahoo.co.jp/articles/84473559629b1f7f1b8960b0efdf7e1811707bf0,10/21(土) 16:02
kyt,幾何学模様、ダリア大輪「すごかった」　滋賀・日野,https://news.yahoo.co.jp/articles/d662874b40b26f06083636f613584c1f7b88a5c0,10/21(土) 14:02
kyt,世界チャンピオンの寺地拳四朗が一日署長　痴漢に遭った体験を告白「恐怖で声出なかった」,https://news.yahoo.co.jp/articles/b7076d96a788794b64a086e2face2894c14d2fb8,10/21(土) 12:02
kyt,京都府長岡京市のコスモスに異変　背丈は半分、開花しない株も,https://news.yahoo.co.jp/articles/adcd49956044cd18cda535aa6d37e888fa800a8d,10/21(土) 10:32
kyt,桂文枝さん、京都・亀岡にいらっしゃーい！　創作落語書き下ろしへ「ネタ探し」,https://news.yahoo.co.jp/articles/0cc81ac8deb1ddb366dcd18077faaf45fa662146,10/21(土) 7:02
kyt,フリースクール発言、滋賀・東近江市長に撤回求める　共産党湖東地区委員会,https://news.yahoo.co.jp/articles/3e619465f14f2db22bbf744d547cc0e79ea31b57,10/20(金) 20:42
kyt,日本赤十字社、救援金受け付け　イスラエル・パレスチナ情勢緊迫化,https://news.yahoo.co.jp/articles/f8d1b17e76d49d08d18930b5413b05fb4ba43ac4,10/20(金) 20:02
kyt,給与額の誤入力で課税ミス　住民税、3人に30万円多く通知　京都府大山崎町,https://news.yahoo.co.jp/articles/bf60268919a57548390b81a0a62a56fbb5966fea,10/20(金) 19:33
kyt,「フリースクールは国家の根幹崩しかねない」　発言した市長「私の真意伝わっていない」,https://news.yahoo.co.jp/articles/89307d0e4e38c5f3a0f50b3acf8f1b2c816f8e9d,10/20(金) 19:31
kyt,滋賀・東近江市長のフリースクール発言　京都府知事「私とは考えが異なる」,https://news.yahoo.co.jp/articles/7ce2cfda6e1fb8b1cc7ca379b1dcfa4ba20c050f,10/20(金) 19:03
kyt,国道で軽乗用車に追突　ひき逃げの疑いで42歳男を逮捕「事故起こしたと思ってない」,https://news.yahoo.co.jp/articles/8b2568d44f1437a44ae46e5f5aa24e879d3ef61b,10/20(金) 18:27
kyt,捜査指揮の刑事ら4人を証人に採用へ　滋賀・湖東病院国賠訴訟,https://news.yahoo.co.jp/articles/21a1413240a0b9c713678171d31b5c50d4a4eabb,10/20(金) 18:22
kyt,木くず、コンクリート片…大型袋10袋分を不法投棄　容疑で大阪の解体業の男を逮捕,https://news.yahoo.co.jp/articles/a3049df9d889e999866fabedf216c7f8c110f6b9,10/20(金) 18:12
kyt,社説：観光公害対策　分権で京都に委ねては,https://news.yahoo.co.jp/articles/35127548505915be5fccb57c4c9a9fb3dc40e950,10/20(金) 16:06
kyt,社説：中国の一帯一路　軌道修正は避けられぬ,https://news.yahoo.co.jp/articles/c85359c1ddc0ae9c2606a09e46196676cfbd3f91,10/20(金) 16:01
kyt,「コンチキチン」に子どもの笑顔　ユネスコ無形文化遺産、京都・六斎念仏の体験会,https://news.yahoo.co.jp/articles/7fbb7756d1d8c0f666425eef9de882a6388efd5c,10/20(金) 13:51
kyt,極彩色の灯りに染まる境内、幻想の景色に　京都・万福寺で催し、本場の中国から作品輸入,https://news.yahoo.co.jp/articles/397e124b487d77427e2dbf4e7a6c09b4fde36293,10/20(金) 13:06
kyt,「自分の国はストーブ使わない」京都・南丹で外国人向け防災講座、119番のポイント確認,https://news.yahoo.co.jp/articles/5dbeac332fb7bd4f7c26f34bb685f5e74f1c483d,10/20(金) 12:42
kyt,「窒素」供給管、「酸素」と誤ってつないだか　樹脂加工会社の男性従業員が死亡,https://news.yahoo.co.jp/articles/15006595eba9ee8ce06016d152a3bb1992911c9a,10/20(金) 11:54
kyt,「望ましくない」盛山文科相が見解　滋賀の市長「フリースクール認めがくぜん」発言に対し,https://news.yahoo.co.jp/articles/b1ef415cdc496861f6a112cca54496b79730f890,10/20(金) 11:12
kyt,夏休みの学童保育で給食「本当にうれしい」喜ぶ共働き家庭　けれど提供は少数派,https://news.yahoo.co.jp/articles/a2eff13d002c46f69b4eac51ee28ffd38db98882,10/20(金) 10:32
kyt,生徒が手がけた小皿やバターナッツずらり　販売会で丹波支援学校生が奮闘,https://news.yahoo.co.jp/articles/6a314ae05753433e269afc2affe92d226f24111d,10/20(金) 7:03
kyt,相手翻弄する魔法トスで全国制覇へ　京都代表の中学生バレー選手「勝ち上がる」と意気込み,https://news.yahoo.co.jp/articles/cb34491b2b04453d2bada795c474b9adcf306de8,10/20(金) 7:02
kyt,外国窃盗団横行のデマ火消しに奔走　東日本大震災で指揮した元宮城県警本部長が講演,https://news.yahoo.co.jp/articles/08c842879fc984f22eca46ca268be1e93b5d91b1,10/20(金) 7:02
kyt,本名と違う名前で3日呼ぶ　江戸時代からの伝統神事「子ども無事育つ」と言い伝え,https://news.yahoo.co.jp/articles/ce42d1a2541cfa3118afcb06e0351e1e7d82951d,10/20(金) 7:02
kyt,所有の空き家に放火し全焼させた疑い、57歳女を逮捕　近隣にも延焼,https://news.yahoo.co.jp/articles/f7bf0cb57d081b935233c57d29151e9c3905dfcd,10/19(木) 23:39
kyt,同僚女性宅の鍵盗み侵入、カメラ設置し盗撮　容疑で39歳会社員男を再逮捕,https://news.yahoo.co.jp/articles/2381c14cebdcae02f6b279496e593289b07be1c8,10/19(木) 20:57
kyt,10代少女2人とわいせつ、撮影も　27歳中学教諭を懲戒免職　本年度で免職5人目,https://news.yahoo.co.jp/articles/368e41ce0be2ce842554cbf6057f2b5d98c785f5,10/19(木) 20:48
kyt,「iFace」類似のスマホケース販売、商標法違反疑いで京都の男女を逮捕,https://news.yahoo.co.jp/articles/49ce6641251a5e729131b61dbc7669446d909fc0,10/19(木) 20:22
kyt,「仕事の決算で金要る」とうそ、高齢者から2200万円詐取疑い　無職男を3回目逮捕,https://news.yahoo.co.jp/articles/aa349eb647da593299198c03cb403d6e65f63667,10/19(木) 19:57
kyt,エスカレーターで女性のスカート内盗撮疑い、滋賀県職員の27歳男逮捕,https://news.yahoo.co.jp/articles/1731c51ced04824d181be93235ed80e4d7381481,10/19(木) 19:27
kyt,京都・綾部市の公用車が路線バスに追突　横断歩道手前で停車中,https://news.yahoo.co.jp/articles/967ddd5dd01a2a48c6f817b623258c9bf8a6cf0d,10/19(木) 19:09
kyt,内縁妻の17歳娘に強制性交、2年半にわたり性的虐待　同居男に懲役7年判決,https://news.yahoo.co.jp/articles/0eec2a5c5ad26548dba5175f3fffc3f181394d94,10/19(木) 18:51
kyt,10代少女にわいせつ行為で有罪判決、68歳市教委職員を懲戒免職　滋賀・高島市,https://news.yahoo.co.jp/articles/fa4fd7a9d4b7d78af5de028cb6f37858152971ae,10/19(木) 18:22
kyt,73歳女性、架空請求で380万円だまし取られる　宅配便で現金発送も,https://news.yahoo.co.jp/articles/6d36638cc3380196294b532a490b02e7f5084a25,10/19(木) 17:48
kyt,社説：参院１票の格差　抜本的改革は不可避だ,https://news.yahoo.co.jp/articles/adcb62b516b5fff3eb32ac31b4e8a37c7573bf69,10/19(木) 16:06
kyt,社説：出産費保険適用　負担軽減へ環境整備を,https://news.yahoo.co.jp/articles/4dfe12395995c191eaa289927ba80c5d7580a55e,10/19(木) 16:01
kyt,JR山科駅で人身事故、22歳女性が死亡　ホームで倒れ列車と接触か,https://news.yahoo.co.jp/articles/13c387c70b2a83dcd7ab1b67635d7b81e47ab55d,10/19(木) 15:51
kyt,恭仁京跡に広がるコスモス畑が見頃、住民が丹精込め育てる　京都・木津川,https://news.yahoo.co.jp/articles/b779d80439c1264e4395f1021fea2ef178d226a4,10/19(木) 13:22
kyt,インフルエンサーに宣伝依頼、応募の客になりすまし消費者金融から金引き出す　容疑で20代の男逮捕,https://news.yahoo.co.jp/articles/00d51564a997723ef99b9ba7d750a7db0b83b0b4,10/19(木) 12:16
kyt,JR駅で女性が特急にはねられ病院に搬送　上下線で22本運休、4万5千人に影響,https://news.yahoo.co.jp/articles/b9e69cc6f802088c7d0802b072619471f68b7fa0,10/19(木) 12:03
kyt,男性警部補が部下を膝蹴りや平手打ち、「自分の人柄を理解、手を出しても大丈夫と思った」　本部長訓戒に,https://news.yahoo.co.jp/articles/f0b188baedd690db138e3f0959e1850393ae3865,10/19(木) 11:27
kyt,亀岡祭のちまき300本、山鉾関係者や大学生が手作業で仕上げる　京都・亀岡,https://news.yahoo.co.jp/articles/71a3f0712c679f261a119dd7471dece07cf2f81e,10/19(木) 11:22
kyt,京都・福知山で水道管が漏水、90戸で断水,https://news.yahoo.co.jp/articles/4b1f758aecfe59215bf16b0e6022e01008c44988,10/19(木) 11:03
kyt,「おかずから食べるなど具体的な提案したい」　京都の栄養士らNPO法人を設立,https://news.yahoo.co.jp/articles/90a3cf2f20d7280c9bdec41a12fba48cde43025e,10/19(木) 10:32
kyt,滋賀・東近江の山中で遭難、40歳男性を救助　登山道入り口で発見,https://news.yahoo.co.jp/articles/a84a9367554d0d7954991b9e1044288d3b7baef2,10/19(木) 9:39
kyt,JR山科駅で特急電車が人と接触　琵琶湖線、京都線、神戸線、湖西線で一時運転見合わせ,https://news.yahoo.co.jp/articles/f40d3453da86b873916dccf5fb1bcd2ad980cd9c,10/19(木) 9:09
kyt,「片言の日本語を話す男から電話で指示」不審に思ったコンビニ店員、詐欺被害防ぐ,https://news.yahoo.co.jp/articles/6fc0ac1cc032108753111f04f5728e90ddfd98b4,10/19(木) 7:02
kyt,1個450キロの工事用鋼材7個盗まれる　12万円相当、滋賀の資材置き場,https://news.yahoo.co.jp/articles/13c93aa23db1b34562b1e1204d37bc2f8469a11b,10/18(水) 20:36
kyt,「山で遭難した」40代男性が電話、その後連絡取れず　19日朝から捜索,https://news.yahoo.co.jp/articles/dfd7d9a743de70a85f5dc03323ad7fd809e25925,10/18(水) 20:27
kyt,特殊詐欺の「出し子」か、盗んだカードで100万円引き出す　容疑の男2人逮捕,https://news.yahoo.co.jp/articles/4762d67cab92719e274867f3cd5c3ad6a239c730,10/18(水) 18:02
kyt,社説：ローカル線存廃　将来像、住民交え議論を,https://news.yahoo.co.jp/articles/959e13b40ef45479117a78145be305b9f90aa4ea,10/18(水) 16:06
kyt,社説：防衛相の失言　不信が募る内向き内閣,https://news.yahoo.co.jp/articles/ff2c3b36f010b065d54d38eacb8bfea11b40f0bc,10/18(水) 16:02
kyt,漫画の魅力、小学生に本職が伝える　京都・南丹出身の松本さん講演,https://news.yahoo.co.jp/articles/5203d5abb9ba38804fe731ed0a53726e0fad9b1b,10/18(水) 15:42
kyt,避難所支援へトイレカー導入　京都・八幡市がクラウドファンディング,https://news.yahoo.co.jp/articles/c1af6bd54420329de9735fd9d4797857e9a56abf,10/18(水) 15:27
kyt,「子の成長過程で図書館重要」　内田樹さん、滋賀・長浜市で講演,https://news.yahoo.co.jp/articles/306e5cee58ac2df1079db7a29154f889a9640ad0,10/18(水) 12:54
kyt,京都市南区でマンション火災、住人の女性死亡,https://news.yahoo.co.jp/articles/198dd8cfb96eb7023c070dafb14c71d00ff6448d,10/18(水) 12:27
kyt,「地域の良さ、子どもたち再発見して」　歴史や伝統題材の児童書を寄贈,https://news.yahoo.co.jp/articles/6b25c8a9522c13e74acac34a10d1ff7961c67a03,10/18(水) 11:33
kyt,京都最大「果物産地」のスイーツ売り上げ好調　集客力抜群のイベントが寄与,https://news.yahoo.co.jp/articles/c59bd6e41305fde258a92b84e7f3b45456d6c567,10/18(水) 11:02
kyt,1000円分お得な電子クーポン開始　サイト参加店で使用可能,https://news.yahoo.co.jp/articles/c9de7a551a85f570c3e56c0843f763bd83fb2852,10/18(水) 9:54
kyt,巫女姿の女子中学生、舞を奉納　京都・亀岡で4年ぶり「大井祭」,https://news.yahoo.co.jp/articles/4cf8b6493cfc39fc41b5c31f00d7ebbf9fb202d9,10/18(水) 7:02
kyt,車を衝突させ事故偽装、保険金1200万円詐取疑い　外国籍の男ら逮捕,https://news.yahoo.co.jp/articles/0fdee26f4f548bccc7119e92834af21c11c57bf9,10/17(火) 20:54
kyt,大阪万博「突貫工事で下請けにしわ寄せ」　組合が時間外労働規制除外に反対,https://news.yahoo.co.jp/articles/5379721033cf37cfc6b25dfa3b2040ed2e0d07df,10/17(火) 20:12
kyt,「不登校になる大半の責任は親に」　滋賀・東近江市長が不適切発言「フリースクールの存在にがくぜん」,https://news.yahoo.co.jp/articles/a07ac2f24a0ab3e1d9f92ca46af2d37908aab6e7,10/17(火) 20:06
kyt,バイクで追い抜きざまにひったくり疑い　自称解体工の男と派遣社員の女逮捕,https://news.yahoo.co.jp/articles/e3caed09f5867fab201ddc5c02d1b229d6b0ee00,10/17(火) 20:01
kyt,ゴルフ場から銅線850メートル盗まれる　時価900万円相当、何者かが切断か,https://news.yahoo.co.jp/articles/fc174a91c9e3c8bca7ae9a77fb0d8df16b055be9,10/17(火) 19:54
kyt,フェイスブックで知り合い「国際金市場で利益」65歳男性、415万円詐欺被害,https://news.yahoo.co.jp/articles/dbb130668debcf85a55dd1f89cd07399bfc8b7b6,10/17(火) 19:46
kyt,絶版スポーツカー「CR-X」と「RX-7」盗んだ疑い　自動車販売・修理業の男逮捕,https://news.yahoo.co.jp/articles/89de29a59db2feccffad98892765f3fccb7f2da1,10/17(火) 19:46
kyt,東海道・山陽新幹線の「車内喫煙ルーム」2024年春に廃止,https://news.yahoo.co.jp/articles/6bd54a51e4dac96914a5a4e5de24cf7bdb06feb4,10/17(火) 16:24
kyt,社説：「ガザ戦争」激化　軍事侵攻は人道危機深める,https://news.yahoo.co.jp/articles/38d6efab3ade1c5c199966cf49d44d8f30890a7e,10/17(火) 16:02
