media_en,title_articles,link_articles,date_original
mrt,伊勢えび漁が解禁　日南市・富土漁港では今季初水揚げ　9日からは「日南海岸伊勢えびまつり」,https://news.yahoo.co.jp/articles/e3dd72809bf5e77cc2d5be669c940375e83b5d50,9/5(火) 12:04
mrt,都農町長選挙が告示　現職と新人の2人が届け出　一騎打ちの公算大（5日午前11時半現在）,https://news.yahoo.co.jp/articles/2bf3fa6c95654ccbb8c4b5575e8a2b923be74300,9/5(火) 12:04
mrt,運転中の取材班のエンジンルームに猫!雨が原因?寒い時期だけではない車に猫が入り込むトラブル　対策は「バンバン」より「猫コンコン」,https://news.yahoo.co.jp/articles/e164e2f9d2f48036d0b7e2efebd46816395af625,9/5(火) 11:46
mrt,9/5（火）宮崎県内の交通取り締まり情報,https://news.yahoo.co.jp/articles/d4be8f757a8fd44070df8406f30298bbb7e0cff3,9/5(火) 6:01
mrt,鹿と新聞配達中の原付バイクが衝突　バイクの男性が意識不明の重体,https://news.yahoo.co.jp/articles/089a7146b59427da62b7b1e74ef69dcce87057b8,9/4(月) 19:04
mrt,秋の気配漂うも　宮崎県内は約20年ぶりとなる9月の猛暑日のところも,https://news.yahoo.co.jp/articles/16b1c69c01c5539ab030bc98866e3136d00c0c0c,9/4(月) 19:02
mrt,松山英樹選手 ブルックス・ケプカ選手の参戦が決定　50回目のダンロップフェニックストーナメント,https://news.yahoo.co.jp/articles/8169fec6db0ba583bb2b16f2a1eedb26eb47e341,9/4(月) 19:02
mrt,神楽の「ユネスコ無形文化遺産」への早期登録を　宮崎県内はじめ全国の神楽保存団体などでつくる協議会が文化庁に要望,https://news.yahoo.co.jp/articles/ce9fe8aadd6121cf2e840f7f59edb1af5ef1c395,9/4(月) 19:02
mrt,「現物の確認が行われないことを利用」「販売管理システムを改ざん」　青果物の架空取引で現金4000万円余りをだまし取った男の初公判,https://news.yahoo.co.jp/articles/7e863e90112446e0e1dcc8e1e2c4d29044c93a06,9/4(月) 19:02
mrt,家畜伝染病「豚熱」　全国2位の飼育頭数の宮崎県　県内養豚農家に募る危機感,https://news.yahoo.co.jp/articles/3623916129291e945e56e26b17db9b43ed410450,9/4(月) 19:02
mrt,テゲバジャーロ宮崎　今シーズン初の3連敗　2日 カマタマーレ讃岐戦,https://news.yahoo.co.jp/articles/a0c042980d3ebcfcda2889a1d4ca333abcb32c38,9/4(月) 19:02
mrt,宮崎市9月議会が開会　物価高騰対策など13億円余りの補正予算案が提出,https://news.yahoo.co.jp/articles/4ebfdd5bf35343caa56cf7ae1e158ab846831619,9/4(月) 12:09
mrt,都城市の年間の移住者数　7月までに過去最高を上回る,https://news.yahoo.co.jp/articles/32e9a53eb8b7ad61b5e87ab9d63aa96cb0654935,9/4(月) 12:09
mrt,全国から更なる観光客を　宮崎県でのJリーグ春季キャンプ　強化試合を大会形式に,https://news.yahoo.co.jp/articles/868cb2a0758f6dd689d59255efe2a74b63973e55,9/4(月) 12:09
mrt,10月の宮崎県人会世界大会前に宮崎市で秋のおもてなし植栽イベント,https://news.yahoo.co.jp/articles/02227ef21cf8aadc36a354d765d63d15be5e6de0,9/3(日) 18:02
mrt,ビーチバレー「霧島酒造オープン」　決勝戦,https://news.yahoo.co.jp/articles/29862434f957ce50c8c4a4dc941920627819a794,9/3(日) 18:02
mrt,トップアスリートが参加　日向ビーチスポーツフェス,https://news.yahoo.co.jp/articles/20efcce66007d80252dc4c3808c0113d20196a79,9/3(日) 18:02
mrt,9月3日は「ぐっすり」の語呂で秋の「睡眠の日」　宮崎市で睡眠について公開講座,https://news.yahoo.co.jp/articles/c7fe2459f8ba498a384929a3446820a4198e5eac,9/3(日) 18:02
mrt,宮崎県内の7月の有効求人倍率は前月と同じ1.42倍,https://news.yahoo.co.jp/articles/c56e1f714b15202029b0c296a9088213f6176eac,9/3(日) 18:02
mrt,地元特産の食材を使って有名シェフらが特別に考案　日向市で食の祭典「運命のレシピ」,https://news.yahoo.co.jp/articles/c2e03d4bd855bc1fe8a43e0dfe7dd6893a43d2ec,9/3(日) 11:46
mrt,J3　テゲバジャーロ宮崎　第25節の結果,https://news.yahoo.co.jp/articles/50d0e65d1071edd39054a49a775828ad8fb52b35,9/3(日) 11:44
mrt,宮崎県小林市で自転車の女性がはねられ重体,https://news.yahoo.co.jp/articles/ebba837fe89124aa047b54984afaa572c7840ac9,9/2(土) 19:18
mrt,宮崎県西都市　水道代金360万円余りを過大請求,https://news.yahoo.co.jp/articles/2a0743e89e993c22736ae0f63a742a3ca50d2a0c,9/2(土) 19:16
mrt,男性の育児参加へ　「お父さん食堂」開催,https://news.yahoo.co.jp/articles/916a2ac64e60eacf018aebb9d73c65eda09bc875,9/2(土) 19:14
mrt,タレント藤本美貴さんも登壇　「hinataのキッズフェスタ」,https://news.yahoo.co.jp/articles/0b34f60ab15dab43c1b9446dc36f7bf516a5c487,9/2(土) 19:14
mrt,南海トラフ巨大地震を想定　大型商業施設で防災訓練,https://news.yahoo.co.jp/articles/39863211b019e1ef9444f10a3caf8d27ff5aed4d,9/2(土) 12:11
mrt,宮崎県宮崎市　子ども1人あたり1万円を支給へ,https://news.yahoo.co.jp/articles/7ca05788eb8c3fe084099d5182e0a06613810bc5,9/2(土) 12:08
mrt,自転車は交差点で「歩行者用」の信号で進む?「車用」の信号で進む?警察に聞くと・・・,https://news.yahoo.co.jp/articles/c2e46e87ea083d3b8b90932066caa40d9f29fb08,9/2(土) 11:02
mrt,宮崎市役所の新庁舎建設　建設中の仮設庁舎にMRT宮崎放送の社屋活用を検討開始,https://news.yahoo.co.jp/articles/ab2f32508cdf68495aa87f3a34aede9fcfded5a8,9/1(金) 18:09
mrt,フランスの日本酒・焼酎コンクール　柳田酒造（都城市）の麦焼酎「青鹿毛」が最高賞を受賞,https://news.yahoo.co.jp/articles/cb0ea4e1449df01c5915be39a81dafb500a4587a,9/1(金) 18:09
mrt,宮崎駅周辺と青島エリアで電動キックボードのシェアリングサービス　スタートを前に宮崎市で試乗会,https://news.yahoo.co.jp/articles/1501ca0b8d49a5ceb288cbd5b9eb94467e6d352f,9/1(金) 18:06
mrt,県内初の取り組み　不登校の中学生向けのオンライン学習支援が延岡市で始まる,https://news.yahoo.co.jp/articles/b71d84f40eb9d09367dbbb8e2f7c651cd1ebdc34,9/1(金) 18:06
mrt,佐賀県で「豚熱」発生　万が一に備えて　宮崎県でも豚へのワクチン接種の研修会,https://news.yahoo.co.jp/articles/2bb1b246d18255457264209bf66fe8eb6013b182,9/1(金) 18:06
mrt,国内トップレベルの選手が熱戦　ビーチバレー「霧島酒造オープン」が開幕,https://news.yahoo.co.jp/articles/3cf2219776f8f00f10b1acfbe7e659e399fd7c97,9/1(金) 18:06
mrt,1万円で3千円分お得　宮崎市のプレミアム付き商品券　応募受け付け開始,https://news.yahoo.co.jp/articles/6d430bd6a030fc33e66791fdc2d61269195ca5d8,9/1(金) 18:06
mrt,防災の日　全校児童8人で「垂直避難」を確認　日南市の小学校で避難訓練,https://news.yahoo.co.jp/articles/e93cdebdcda12f70b21b8904608ce5f9eeb563be,9/1(金) 18:06
mrt,子牛取引価格の低迷を受け　宮崎県が和牛繁殖農家に独自の補助策　9月県議会に補正予算を提案へ,https://news.yahoo.co.jp/articles/a82d288fd358a694dd860ef7351743a612e23579,9/1(金) 18:04
mrt,「防災の日」　災害への備えを「南海トラフ防災展」始まる　宮崎空港で10日まで,https://news.yahoo.co.jp/articles/70f5a5aa8c42f98b6aa0adabae586fd57801a45d,9/1(金) 12:04
mrt,みずみずしい食感とほどよい甘さ　美郷町西郷で特産「さいごう梨」の収穫,https://news.yahoo.co.jp/articles/952f4cea9c301b644be6032a7cd63243fc72ad16,9/1(金) 12:04
mrt,宮崎市の地域自治区のあり方を協議する検討会　今後の施策などをまとめた報告書を市長に提出,https://news.yahoo.co.jp/articles/b9117761ca578e0a5497d57c168a261406994890,9/1(金) 12:04
mrt,宮崎市・大淀川で発見された男性の遺体　身元が判明,https://news.yahoo.co.jp/articles/f0ac85304e273222244dc5643a23580963dbfae4,8/31(木) 19:41
mrt,宮崎県内の「梅毒」感染者数　117人と過去最多を更新　2030代が全体の6割を占める,https://news.yahoo.co.jp/articles/18c3af347190e822c44fd84b11c838f71559a600,8/31(木) 19:02
mrt,「物流の2024年問題」に向け連携強化を　運送事業者や関連企業などが宮崎市で総決起大会,https://news.yahoo.co.jp/articles/7d5106c0b0a850295d96eba1161b21bfb6e3e304,8/31(木) 19:02
mrt,学校給食に役立てて　オリーブオイル660Lを宮崎市の専門店が寄付,https://news.yahoo.co.jp/articles/57ec009fb817bfacaa2da4b65d82dfc3af286cf9,8/31(木) 19:02
mrt,「防災の日」を前に　MRTラジオとFM宮崎が合同で「防災特別番組」を放送,https://news.yahoo.co.jp/articles/c10c76ee9b8c450365ae27620fe9812a9522e1d2,8/31(木) 19:02
mrt,新型コロナワクチン接種　延岡市で使用済み注射器を誤使用,https://news.yahoo.co.jp/articles/fbe94b50bce3c493c529f50a600e3132e0b49fc8,8/31(木) 19:02
mrt,下着だけ身に着けた男性の遺体　宮崎市の大淀川で発見　警察が捜査,https://news.yahoo.co.jp/articles/07f957b75e798f870eb82d34054b0a74aee2d908,8/31(木) 12:24
mrt,和太鼓部門で高鍋が3位など　全国高校総合文化祭で優秀な成績を収めた生徒たちが成果を報告,https://news.yahoo.co.jp/articles/402f3e2c1e0215b698a26abb3771e927f97c81c3,8/31(木) 12:08
mrt,宮崎県内で大雨　一部の自治体に「避難指示」　土砂災害に警戒　台風12号の情報にも注意を（31日午前11時50分現在）,https://news.yahoo.co.jp/articles/667b5b0ae5d73853d1bec9dc35959885dbc600a5,8/31(木) 12:08
mrt,選手たちの第2の人生を支援　プロ野球独立リーグ「宮崎サンシャインズ」がセカンドキャリア説明会,https://news.yahoo.co.jp/articles/8e5c126c7d3eeb1e71507d39d41b991d1e690b75,8/31(木) 12:06
mrt,宮崎県内で大雨　日之影町・日向市の一部地域に「避難指示」　7市町村に「土砂災害警戒情報」（31日午前10時半現在）,https://news.yahoo.co.jp/articles/d47e504dc714118bc022795f6a1be9d1d9c24a2c,8/31(木) 10:51
mrt,経営健全化に取り組む串間市民病院　昨年度約6500万円の純利益を確保,https://news.yahoo.co.jp/articles/60cd4665148f3afd674f0e0769b790a773eafd05,8/30(水) 19:01
mrt,あすにかけて大雨のおそれ　土砂災害や河川の増水などに警戒　台風11号の影響も（30日午後6時現在）,https://news.yahoo.co.jp/articles/251eb7acc0a1fced07fbfeff607f5ff3f0818cbb,8/30(水) 19:01
mrt,佐賀県で「豚熱」感染疑いを確認　宮崎県が緊急防疫会議,https://news.yahoo.co.jp/articles/107602b5576881a2ea597ec5312da9d5a07cee8c,8/30(水) 19:01
mrt,南海トラフ巨大地震の「臨時情報」が出たらどうする?京大防災研究所がセミナー,https://news.yahoo.co.jp/articles/a49a5f45d8f25a939803cf8a1d53667115f6368c,8/30(水) 19:01
mrt,年金減額訴訟の控訴審　福岡高裁宮崎支部は原告の訴えを退る,https://news.yahoo.co.jp/articles/96c6f4c39177ca19e38b1a76806b36c1aa373e36,8/30(水) 19:01
mrt,大規模災害時に活用を　宮崎市で災害用伝言ダイヤル「171」の啓発キャンペーン,https://news.yahoo.co.jp/articles/c5b2a0e39b2ec481fc46d71bf6d3a13c8d20e016,8/30(水) 19:01
mrt,レギュラーガソリン1Lあたり187.4円　宮崎県内でもガソリン価格が過去最高値を更新,https://news.yahoo.co.jp/articles/65125594233c526a5650a05ea5ef3caaa97ac515,8/30(水) 19:01
mrt,水上スキー世界大会を前に　日本代表・長友 亮 選手（宮崎市出身）が知事表敬,https://news.yahoo.co.jp/articles/1effaf2babbb82cf00d77d2c53cd928a4af849b2,8/30(水) 19:01
mrt,「マイナポータル」で身体障害者手帳などの情報が閲覧不可に　宮崎県への問い合わせで発覚,https://news.yahoo.co.jp/articles/5c042a579faadce4b7886619cb08cebe5e6ec29a,8/30(水) 19:01
mrt,宮崎市の国道でトラックと自転車が衝突する事故　自転車の女性が死亡,https://news.yahoo.co.jp/articles/af0b1635448e5e924d079307dec9c72d2525cd0b,8/30(水) 12:06
mrt,全国有数の「かんしょ」の産地・串間市　地元の小学生が収穫体験,https://news.yahoo.co.jp/articles/0567d44b789aaee130ca0d82652de71a6f4058e5,8/30(水) 12:06
mrt,プログラミングなどIT技術が学べる　地域住民向けの教育施設が高鍋町にオープン,https://news.yahoo.co.jp/articles/75dd71d2eb6dc7f462c33c5e03d6254ec64a7cc4,8/30(水) 12:06
mrt,「化け物過ぎて驚いてます」子どもも大人も大絶叫　町民手作りの「お化け屋敷」舞台裏に密着,https://news.yahoo.co.jp/articles/0a60e0c9aff04aaacbf2cab7882a39b2b5b96707,8/30(水) 11:51
mrt,JR宮崎駅周辺の治安悪化が問題となる中　近くの中学校では警察が防犯講習会,https://news.yahoo.co.jp/articles/9189d9e30bb58de0e7acbe007d0459224d4c79dc,8/29(火) 19:02
mrt,「宮崎ぎょうざの日」始まる　県内各地の飲食店でイベント開催　宮崎市のいまの順位は?,https://news.yahoo.co.jp/articles/b9796e9f62976d20023b347a2b7b9bf3ede52bc6,8/29(火) 19:02
mrt,最大規模の日米共同訓練に　陸上自衛隊と米海兵隊の実動訓練「レゾリュート・ドラゴン」　10月に霧島演習場などで実施へ,https://news.yahoo.co.jp/articles/273b0c9e3c1851794b084b988c6da506a43a562a,8/29(火) 19:02
mrt,非行少年の立ち直りへ相互に助言・支援協力　宮崎県警察本部と宮崎少年鑑別所が協定,https://news.yahoo.co.jp/articles/5408228e5e2c94653b8d4d3ed15e5feacf0fb893,8/29(火) 19:02
mrt,大規模災害に備えて　串間市で警察官が手信号の訓練,https://news.yahoo.co.jp/articles/4e5d25c6d57a34fbef8ad43c7c11d772be2d50e5,8/29(火) 19:02
mrt,去年の台風14号で内水氾濫が発生の都城市　浸水を検知するセンサーを宮崎県内で初設置,https://news.yahoo.co.jp/articles/776b38aa7a51d5197d63836d346b885235b650f9,8/29(火) 19:02
mrt,シングルス優勝・ダブルス準優勝・団体戦3位　北海道IHで大活躍　佐土原高校男子テニス部が学校で表彰,https://news.yahoo.co.jp/articles/b625b867dc868967a0d39540a52119dbeddea245,8/29(火) 19:02
mrt,約400台が未返却　新型コロナ陽性者に宮崎県が貸与の「パルスオキシメーター」,https://news.yahoo.co.jp/articles/3a080b9baf70dbf9b84149c142937ab8c9577f93,8/29(火) 19:02
mrt,台風シーズンを前に　延岡市で緊急排水を行う「排水ポンプ車」の操作訓練,https://news.yahoo.co.jp/articles/4a62e565dd2a520065e857d100786a214926f275,8/29(火) 19:02
