media_en,title_articles,link_articles,date_original
aab,地球温暖化防止に向けて　秋田県が初めて「グリーンボンド」を発行へ,https://news.yahoo.co.jp/articles/d46d7e445307a1a0ca7af3b71d7eb0fd797bf743,9/7(木) 12:00
aab,軽自動車がクマと衝突　運転していた男性にけがはなし　秋田・八峰町,https://news.yahoo.co.jp/articles/9209df931309b58167b8aa007ab7025cf75334fc,9/7(木) 11:58
aab,昭和の秋田へタイムスリップ　県内の出来事をまとめた「県政映画」の上映会　秋田空港の建設工事の様子も,https://news.yahoo.co.jp/articles/6f351bb5ef94c1a76ab099db2e709ebfaf9fb28a,9/6(水) 19:04
aab,記録的な暑さが影響　「本来なら出荷で忙しい時期なのに」　ダリアの収量が大幅に落ち込む見込み　秋田,https://news.yahoo.co.jp/articles/da489a753825be11284d68ce0848cda7d758b66d,9/6(水) 19:00
aab,記録的な暑さで特産の「比内地鶏」に大きな被害　被害を免れた農家が行っていた対策は　秋田・大館市,https://news.yahoo.co.jp/articles/a905dd98a7af1d2c7c8c659fb662004107d1995e,9/6(水) 18:54
aab,給食事業を手掛ける広島の会社が突然営業をストップ　秋田県消防学校でも５日から食事の提供されず,https://news.yahoo.co.jp/articles/a10ae0a48d384808f2010b4b6a735db81b895549,9/6(水) 18:54
aab,秋の味覚　湯沢市で「観光栗園」オープン　味には影響ないものの連日の猛暑で生育は遅れる　秋田・湯沢市,https://news.yahoo.co.jp/articles/121278d58ef5b28a7468ed2792fd60c078473c13,9/6(水) 18:54
aab,横手駅前の再開発ビルの不良工事問題　傾いた柱の立て直しなど本格的な改修工事をすることが決まる　秋田,https://news.yahoo.co.jp/articles/f24945fcd4793e5f57115e92712a1b469b7de46c,9/6(水) 18:41
aab,屋外で涼んでいたところを…　８０代男性がクマに襲われ顔や腕にけが　命に別状なし　秋田・大館市,https://news.yahoo.co.jp/articles/0ab226ffe5d5e4bd49e336177e50517e1aad332d,9/6(水) 18:39
aab,７０代男性がウォーキング中にクマに遭遇　足を踏まれ軽いけが　秋田・鹿角市,https://news.yahoo.co.jp/articles/ebdf10ad62446e76d7881a4737bfff0a4c93e2cd,9/5(火) 18:54
aab,「健康寿命日本一」を目指す秋田　減塩・野菜たっぷり「ごろっとトマトの豚たま中華炒め」を県庁食堂で提供,https://news.yahoo.co.jp/articles/36f1af8a11d744adca1a19de2da61a2d172f6a63,9/5(火) 18:54
aab,横手駅前の再開発ビルの不良工事問題　柱と梁を設計図通り戻すなどの本格的改修検討へ　秋田,https://news.yahoo.co.jp/articles/9e590b1bdd2246432bb0de9b1665d98c63050905,9/5(火) 18:51
aab,詐欺の罪に問われている元警察官の裁判　検察側は懲役３年を求刑　秋田,https://news.yahoo.co.jp/articles/d7f8dba7a2aac50ba88d826792ad3d0050e0c426,9/5(火) 18:49
aab,秋田・上小阿仁村　農家への補助金を少なく支給するミス　課長など職員２人を懲戒処分,https://news.yahoo.co.jp/articles/432d64a6860b67182ad31d9b7b19ca6192c328a1,9/5(火) 11:56
aab,猛暑続き熱中症増加、この夏救急車の出動相次ぐ　／秋田,https://news.yahoo.co.jp/articles/1f02db161927cb83eceb6d6e6572270f55bd920a,9/4(月) 19:19
aab,秋田市で身近な国際交流楽しむイベント開催　民族衣装のファッションショーも,https://news.yahoo.co.jp/articles/51c3fb8454a44e131b8021023fd858d38aacf40a,9/4(月) 19:19
aab,大雨被害受けた秋田市のトレーニングジムが１カ月半ぶりに営業再開,https://news.yahoo.co.jp/articles/f41fa65b2024cc715aa73480197d08320309da6d,9/4(月) 19:19
aab,秋田県　大雨被害の復旧事業費３２億円余りを盛り込んだ補正予算案を議会に内示,https://news.yahoo.co.jp/articles/8ccdb7ee1ea4ec80bed2ab9b71f4af517e043fe6,9/4(月) 17:14
aab,トラクターの下敷きになり７９歳男性が死亡　北秋田市　道路から田んぼ脇ののり面に転落,https://news.yahoo.co.jp/articles/6a8a788736ef59be9f57df90a01632535650341c,9/4(月) 12:43
aab,「スペシャルオリンピックス」秋田市で開催　スポーツ通じて知的障害のある人たちを支援,https://news.yahoo.co.jp/articles/c1663a9f273a6e8ab260e68b468685879ced8959,9/3(日) 18:33
aab,「アキタミュージックフェス」始まる　音楽の力で街を元気に　秋田市の中心市街地に様々な音楽響く,https://news.yahoo.co.jp/articles/bc54a35cfb461f45df13709a492acbf3dfbebf0d,9/2(土) 18:27
aab,「かごしま国体」へ！秋田県選手が結団式　「豪雨に見舞われた秋田の皆様に勇気と感動を」,https://news.yahoo.co.jp/articles/a1dda4ba28382340531430d607ee086421733c0d,9/2(土) 18:13
aab,秋田市・大森山動物園が開園５０周年　１９７３年９月１日の開園から半世紀に渡り動物の魅力伝え続ける,https://news.yahoo.co.jp/articles/019fb7feb5783af5da4547ac9f23142ee2dbe708,9/1(金) 18:54
aab,西武秋田店どうなる？先行きに不安の声　「なくなったら秋田の玄関口が衰退してしまう」,https://news.yahoo.co.jp/articles/7bf5e041cedfa45873831f102353c5ebcb9f6820,9/1(金) 18:54
aab,猛暑で特産のネギの生育にも大きな影響　秋田・能代市　７月には大雨の被害も　出荷できないネギが山積み…,https://news.yahoo.co.jp/articles/fac2885b32e4f29bf76a365de5282ed6f4e06d50,9/1(金) 18:52
aab,「防災の日」秋田県庁でも大地震や火災想定し訓練　避難経路や防災設備の使い方確認　心構え新たに,https://news.yahoo.co.jp/articles/a7c047e4c16379b8b499c5d1ec5b12e23af2e34e,9/1(金) 12:21
aab,秋田県内の新型コロナ感染状況　定点医療機関あたりの患者数は前の週からは減少,https://news.yahoo.co.jp/articles/aefca3f66417932a685450b0cc98d7eb8a34fcb5,8/31(木) 18:59
aab,「そごう・西武」の売却を巡り　秋田市の穂積市長　西武秋田店の存続に向け「社長に会って要望したい」,https://news.yahoo.co.jp/articles/9e08b12968d33a6713dec210c261560f17bb745e,8/31(木) 18:48
aab,記録的な猛暑で　”畑のキャビア”とも呼ばれるあの農産物にも深刻な被害が…　秋田・大館市,https://news.yahoo.co.jp/articles/9e172086d8b786cfe89f54c24ae8faeac121be16,8/31(木) 18:43
aab,中国からか　「迷惑電話」は秋田県内にも　「処理水を飲んだか」との質問も,https://news.yahoo.co.jp/articles/a58fee076036eb097f8d5051726ce96d53d5ce35,8/31(木) 18:43
aab,横手市で３９．２℃　秋田県内の観測史上最高の気温に　３１日は県内１８地点で３５℃以上の猛暑日に,https://news.yahoo.co.jp/articles/d26606aa2a67e69cb4e1cda73d2fd8c29503a63c,8/31(木) 18:38
aab,北秋田市でアユ釣りをしていた神奈川県の７３歳の男性が川に流され死亡　秋田,https://news.yahoo.co.jp/articles/9cb9ca325d60bb5fed9246648dcd9820b2db5e66,8/31(木) 16:57
