media_en,media_jp,title_articles,link_articles,date_original
theworldw,theWORLD（ザ・ワールドWeb）,チェルシーに長年足りていないのは“ジエゴ・コスタ”？　よく似たFWと評されるオモロディオンを獲得すべきか,https://news.yahoo.co.jp/articles/bba41597e659a1ca744e05de24e49e5ef7d14bd6,7/13(土) 18:30
theworldw,theWORLD（ザ・ワールドWeb）,ACミランはドルトムントFWフュルクルクを獲得か　EURO2024では2ゴールの大活躍,https://news.yahoo.co.jp/articles/bfcdce41e745d45836e2d496fb2a7b01c059e1e0,7/13(土) 18:00
theworldw,theWORLD（ザ・ワールドWeb）,なでしこジャパン、パリ五輪に弾みをつける4発でガーナに大勝！　田中、浜野、藤野が揃って1ゴール1アシストと攻撃陣が大暴れ,https://news.yahoo.co.jp/articles/085000b7e00923e076b771b209e7485fe105f094,7/13(土) 17:31
theworldw,theWORLD（ザ・ワールドWeb）,レンヌの逸材ドゥエは今夏争奪戦へ　チェルシーも獲得レースに参戦と現地報道,https://news.yahoo.co.jp/articles/4ef56226b6206e22f6e6fafdab41bc7924af163d,7/13(土) 17:30
theworldw,theWORLD（ザ・ワールドWeb）,スペイン代表は何を食べている？　料理長ロドリゴ・ヴァルガス氏「これだけは持ちこんだ」,https://news.yahoo.co.jp/articles/6e73e232904e59eb3586dda82fd06fc6d678a99a,7/13(土) 17:00
theworldw,theWORLD（ザ・ワールドWeb）,サンチョが10カ月ぶりにマンUのトレーニングに参加　テン・ハーグ監督とは「前向きな話し合い」,https://news.yahoo.co.jp/articles/c44a36c56575b37cfe4d872b2da0ccdaad06dacb,7/13(土) 15:00
theworldw,theWORLD（ザ・ワールドWeb）,マンUの未来を担う1人かと思われたが……　19歳DFカンブワラは新契約拒否で、移籍先を模索か,https://news.yahoo.co.jp/articles/85edb3e8ff43a7c8a6a118900f3612378897c71f,7/13(土) 13:01
theworldw,theWORLD（ザ・ワールドWeb）,悲願のEURO初制覇へ　イングランド代表MFライスは3年前にも誓った約束を再び宣言　「もし優勝したら……」,https://news.yahoo.co.jp/articles/2cd44d1968794407f741872808a2aa3807957b11,7/13(土) 12:01
theworldw,theWORLD（ザ・ワールドWeb）,EURO2024でストライカーの得点が少ないのはなぜ？　得点の取り方が変わった現代サッカー,https://news.yahoo.co.jp/articles/53f8ce36ef094840b63a08b10ff3d070d6325ba5,7/13(土) 11:51
theworldw,theWORLD（ザ・ワールドWeb）,カナダでもサッカー熱を高めたい　コパ・アメリカでベスト4入りは新たなステージへの一歩に「国内でこのスポーツを発展させたいんだ」,https://news.yahoo.co.jp/articles/9016c9bded01849f5020fc48317e28283255c5db,7/13(土) 11:31
theworldw,theWORLD（ザ・ワールドWeb）,ユーヴェ移籍が決まったドウグラス・ルイスの後釜に？　アストン・ヴィラはアンギサへオファーを出すもナポリはこれを拒否,https://news.yahoo.co.jp/articles/add4771d18fe4c8bd05d50fda94dd6f6df651e11,7/13(土) 11:01
theworldw,theWORLD（ザ・ワールドWeb）,ファン・ダイクがリヴァプールを離れ新たなキャリアを歩む可能性　「この夏にじっくり考えるつもり」と自身の将来について語る,https://news.yahoo.co.jp/articles/f6e6d0beadb43c1d9db34ff5ee3bf8d8ba8642bd,7/13(土) 8:02
theworldw,theWORLD（ザ・ワールドWeb）,マンU、今夏のターゲットはオランダ人？　ザークツィー、デ・リフトに続き、シャビ・シモンズにも獲得報道,https://news.yahoo.co.jp/articles/5cb0d1f4fe66732ec4ab1cad1745a4c83d84cef4,7/13(土) 7:01
theworldw,theWORLD（ザ・ワールドWeb）,ワトキンスの劇的逆転ゴールは回避出来るものだった？　キエッリーニが語るオランダが犯した「些細なミス」,https://news.yahoo.co.jp/articles/a855090f182652b7463b17f26f5f538e4b83837e,7/13(土) 6:01
theworldw,theWORLD（ザ・ワールドWeb）,ククレジャ、ガクポ、ミカウタゼらの活躍は想像以上？　EURO2024で期待上回った7人のタレント,https://news.yahoo.co.jp/articles/270b41eb877ccb9d717deebffddc08d85e19c771,7/12(金) 23:40
theworldw,theWORLD（ザ・ワールドWeb）,C・ロナウドVSメッシに続く新時代のライバルはハーランド&ムバッペではない？　期待される2人のティーンエイジャー,https://news.yahoo.co.jp/articles/0eba48954b657baddc4fe6be750689045e9800fb,7/12(金) 23:10
theworldw,theWORLD（ザ・ワールドWeb）,ライスの新相棒はメイヌーで決まり？　K・フィリップス不在を嘆いたサウスゲイトに現れた救世主　「ライスと共にイングランドの中盤の未来を担う存在となる」,https://news.yahoo.co.jp/articles/23200c3606fcaa39fcdf8dceeb8bbf0343b47bd1,7/12(金) 22:10
theworldw,theWORLD（ザ・ワールドWeb）,オリーセ退団のクリスタル・パレス　 “もう1人のエース”エゼはなんとしても引き留める方針か,https://news.yahoo.co.jp/articles/82baf6c9f7f508c7d8c04846e0fe5256e91167c0,7/12(金) 21:01
theworldw,theWORLD（ザ・ワールドWeb）,バイエルンMFゴレツカに迫る放出の危機　パリーニャとパブロビッチが競争相手では厳しいと有識者指摘,https://news.yahoo.co.jp/articles/c7f79772d1ae9be18175182391378f991e985f10,7/12(金) 20:02
theworldw,theWORLD（ザ・ワールドWeb）,スペインに勝つためには「完璧でなければならない」　イングランド指揮官サウスゲイトはEURO初制覇へ意気込み,https://news.yahoo.co.jp/articles/38a41a550acba621a108d95dc3106984940b07dc,7/12(金) 19:01
theworldw,theWORLD（ザ・ワールドWeb）,人員整理進めるチェルシー、MFウゴチュクは今夏レンタル移籍へ　プレミアリーグ3クラブが興味か,https://news.yahoo.co.jp/articles/6b1a1534f52a6c43d9de93fc87f8fc3887f85704,7/12(金) 18:31
theworldw,theWORLD（ザ・ワールドWeb）,悪童バロテッリはブラジルでキャリア継続へ　名門コリンチャンスへの移籍が決定的に,https://news.yahoo.co.jp/articles/e877dea8224b64c4be53eb6c6e947c87b18ffa64,7/12(金) 18:02
theworldw,theWORLD（ザ・ワールドWeb）,カルバハルが“マンCの心臓”ロドリをレアルへ誘惑？　「レアル・マドリードと契約するように毎日言っている」「我々にとって完璧な人材だ」,https://news.yahoo.co.jp/articles/1093c36f55376246ab9ac3fde0520d37b77386f0,7/12(金) 17:30
theworldw,theWORLD（ザ・ワールドWeb）,ドルトムントの新背番号10はMFユリアン・ブラント　「10は神秘的な数字」,https://news.yahoo.co.jp/articles/6079f3625980b9f947a690e3a8e530a2fc241400,7/12(金) 17:03
theworldw,theWORLD（ザ・ワールドWeb）,去就不透明なJ・フェリックスにプレミア復帰の可能性？　アストン・ヴィラが獲得に自信か,https://news.yahoo.co.jp/articles/473f50be5b6306264718da9d72cdca8634f2fe41,7/12(金) 16:30
theworldw,theWORLD（ザ・ワールドWeb）,ムバッペはW杯&EUROの両方を手にできるか　EUROは4年後が全盛期で迎える最後の大会かもしれない「今大会の彼とフランスは失敗した」,https://news.yahoo.co.jp/articles/605b0aed8f63c5a2e54bf09d1e83ac5fa315ca83,7/12(金) 16:10
theworldw,theWORLD（ザ・ワールドWeb）,現代では少なくなったタイプの司令塔　コパ・アメリカで6アシスト決めるハメスの左足は「ベッカムを思わせる」,https://news.yahoo.co.jp/articles/460acf00e658ccaa75bbbc9f94d9650f4a342a55,7/12(金) 15:40
theworldw,theWORLD（ザ・ワールドWeb）,ヤマルでもニコ・ウィリアムズでもない　イングランド代表が“警戒すべき”スペイン代表の2人とは　「フランス戦の彼らのプレイは素晴らしかった」,https://news.yahoo.co.jp/articles/5d305964c6072fac9cb0c0124e1f2540fd4d67f9,7/12(金) 15:20
theworldw,theWORLD（ザ・ワールドWeb）,74試合指揮して6敗しかしていないアルゼンチンの強さ　スカローニはアルゼンチンを「勝利のマシーンに変えた」,https://news.yahoo.co.jp/articles/577160b550befe059c18902f008b35519df81e36,7/12(金) 14:30
theworldw,theWORLD（ザ・ワールドWeb）,「いつも1人で試合を最初から最後まで見返す」　“ピッチ上の監督”と呼べるスペインの頭脳・ロドリが続ける試合分析,https://news.yahoo.co.jp/articles/55660ab8c1ebf12f07d581c29358a0f2520a53b2,7/12(金) 14:10
theworldw,theWORLD（ザ・ワールドWeb）,「オランダのブスケッツ」と称賛される陰の英雄　デ・ヨングの穴を埋めたスハウテンの評価が上昇中,https://news.yahoo.co.jp/articles/d659fbfcd7433e3fb9b03211e03ab38cb9a52cf6,7/12(金) 13:30
theworldw,theWORLD（ザ・ワールドWeb）,アストン・ヴィラFWディアビにアル・イテハド移籍の可能性浮上　既に個人合意と報道,https://news.yahoo.co.jp/articles/6f1026e9e4e28f90bd67fa7bcee3749914c6a503,7/12(金) 13:20
theworldw,theWORLD（ザ・ワールドWeb）,10年前のW杯では0勝で大批判を浴びた　韓国代表2度目のホン・ミョンボ政権に募る不安「また同じシナリオが繰り返されるかもしれない」,https://news.yahoo.co.jp/articles/d416035fc4ed1dc9545e6999328b2790318f139f,7/12(金) 12:30
theworldw,theWORLD（ザ・ワールドWeb）,今大会のコパ・アメリカがメッシの代表活動で最後の大舞台か？　「私は今、最後の戦いを満喫している」,https://news.yahoo.co.jp/articles/7e6dce0a244084f8a05eb001a1346d6ff42126bd,7/12(金) 7:02
theworldw,theWORLD（ザ・ワールドWeb）,若きメッシが赤子のヤマルを抱いた写真が話題に　写真家も当時の様子を明かす,https://news.yahoo.co.jp/articles/aba44b2ec569fb089222662c27843ba653cf6a5a,7/12(金) 6:30
theworldw,theWORLD（ザ・ワールドWeb）,グリーンウッドのマルセイユ移籍が実現間近も市長が非難声明　「到底容認出来るものではない」,https://news.yahoo.co.jp/articles/3094226450a2e48c021cae005da194faf5bcec24,7/12(金) 6:03
theworldw,theWORLD（ザ・ワールドWeb）,セルティックでは古橋との相性も良かったのに…… 25歳でサウジアラビアへ向かってしまったアタッカーの現在,https://news.yahoo.co.jp/articles/93d55813c80880c34a1d68e5d476c2dc4594655b,7/12(金) 0:10
theworldw,theWORLD（ザ・ワールドWeb）,ブラジルはまだネイマールを中心にチームを作るべきなのか　2年後のW杯時には“34歳”迎えているエースの今後,https://news.yahoo.co.jp/articles/c2d2cff876ad30762dff164b143be311c68cffe9,7/11(木) 23:50
theworldw,theWORLD（ザ・ワールドWeb）,サウスゲイト監督の“勇気ある決断”を称賛するイングランド代表OB　「ポルトガルのロベルト・マルティネス監督にはクリスティアーノ・ロナウドを交代させる勇気がなかった」,https://news.yahoo.co.jp/articles/fac4fed2829ea44c6348f17583909c6dc5e09541,7/11(木) 23:00
theworldw,theWORLD（ザ・ワールドWeb）,昨シーズン、レアルで大活躍のGKルニンがリヴァプールに移籍か　アリソンが退団した場合に備えて準備,https://news.yahoo.co.jp/articles/39e3003a30c0266a1eb2c701812c65c34a74a6d3,7/11(木) 22:30
theworldw,theWORLD（ザ・ワールドWeb）,スペインに敗れたフランスに仏メディアは辛口評価　スタメンの平均評価「3.6」に留まる中、チームトップの高評価を記録したのは……,https://news.yahoo.co.jp/articles/cd0430758b4b367fae2abdcd522cdfc52cb26e67,7/11(木) 22:10
theworldw,theWORLD（ザ・ワールドWeb）,クーマン監督がPK判定に憤慨　DF出身のガリー・ネビル氏も敵チームに同情,https://news.yahoo.co.jp/articles/504d689b4483e7ae30ed35c8e65adbad1dbe61a5,7/11(木) 21:40
theworldw,theWORLD（ザ・ワールドWeb）,昨季はセリエA19試合で《0ゴール0アシスト》の悪夢　アズーリ期待のエース候補だった男がぶつかった壁,https://news.yahoo.co.jp/articles/ed04d76730f9fb4af5f00191e531d870e219143b,7/11(木) 21:20
theworldw,theWORLD（ザ・ワールドWeb）,イングランド代表が予想外の “史上初”を記録　オランダ撃破で2大会連続でのEUROファイナルへ,https://news.yahoo.co.jp/articles/2501972e951aac83ebbdc9f8f86c4b7f2f23c32d,7/11(木) 21:02
theworldw,theWORLD（ザ・ワールドWeb）,目標は大きく2026W杯“ベスト4”入り　オーストラリア代表監督が描く夢「W杯に出場するためだけに指揮しているわけではない」,https://news.yahoo.co.jp/articles/b6e9ab5295fb1046f9c4422be4bf3ef1b70a71a6,7/11(木) 20:40
theworldw,theWORLD（ザ・ワールドWeb）,バルセロナとニコ・ウィリアムズの代理人が接触　世界屈指の逸材をめぐる争奪戦は早々に決着か,https://news.yahoo.co.jp/articles/4825ba78c540a54685c2a9541fda6821458fe400,7/11(木) 20:03
theworldw,theWORLD（ザ・ワールドWeb）,"イングランドの勝利を手繰り寄せたワトキンスの一撃　 ""準備を怠らなかった""ストライカーをケインも称賛　「5分かもしれないし、1分かもしれないが……」",https://news.yahoo.co.jp/articles/769d257357d2ade739c3bc4a617c6897f65b2c30,7/11(木) 19:31
theworldw,theWORLD（ザ・ワールドWeb）,ACミランがトルコの至宝アルダ・ギュレルをレンタルで獲得か　レアル・マドリードではムバッペ加入で出場機会減少の可能性,https://news.yahoo.co.jp/articles/876ca48ade528395188c9c3179b7a1fb872c1260,7/11(木) 19:21
theworldw,theWORLD（ザ・ワールドWeb）,今夏フラムからチェルシーに完全移籍を果たしたDFアダラビオヨが新シーズンに自信　「凄く良いチームになるだろう」,https://news.yahoo.co.jp/articles/0415648629b8de71f8d9f5a6d9f5f853300082b9,7/11(木) 19:11
theworldw,theWORLD（ザ・ワールドWeb）,フランスサッカー協会はデシャン体制継続の方針　「彼の契約が問題になることはない」,https://news.yahoo.co.jp/articles/8852d5a548f3722759e6a868c258f0c2a2411c19,7/11(木) 19:01
theworldw,theWORLD（ザ・ワールドWeb）,イングランド代表を決勝へと導いたFWワトキンスがMFパルマーとの信頼を語る　「彼が最高のパスを出してくれると確信していました」,https://news.yahoo.co.jp/articles/835045256c79fc7d3439f96e9b7bf4f5c926242c,7/11(木) 18:50
theworldw,theWORLD（ザ・ワールドWeb）,ケフラン・テュラムのユヴェントス入団が決定！　ペソット氏を「おじさん」と呼ぶほど昔馴染みでクラブとは相思相愛,https://news.yahoo.co.jp/articles/75020d5a556bf1b00a85f81d377eeaf13e9b4ab2,7/11(木) 18:30
theworldw,theWORLD（ザ・ワールドWeb）,スペイン指揮官がイングランドを分析　「我々はこの大会のビッグチームをすべて経験した」,https://news.yahoo.co.jp/articles/009a82880b39434b39afafb31d33faf3b87e03ca,7/11(木) 17:30
theworldw,theWORLD（ザ・ワールドWeb）,インテルとヴェネツィアの間で若手3選手の移籍が決定的に！　その中には元インテルのスタンコビッチ氏の息子も,https://news.yahoo.co.jp/articles/a9856890e10e0888016b1f104c7254da13ba0b7b,7/11(木) 17:30
theworldw,theWORLD（ザ・ワールドWeb）,ラツィオの顔、インモービレが300万ユーロで移籍!?　ベシクタシュのオファーをクラブ側も合意と報道,https://news.yahoo.co.jp/articles/723b53fda065dac48703f21b1fe855a57417abdb,7/11(木) 15:40
theworldw,theWORLD（ザ・ワールドWeb）,チェルシーが興味を示すアデイェミ　ドルトムントはオファー次第では売却容認も選手本人は移籍に消極的か,https://news.yahoo.co.jp/articles/b2b5e57d1942fc4c1b73bd23a2fce8092488976c,7/11(木) 14:30
theworldw,theWORLD（ザ・ワールドWeb）,14年ぶりにユース時代を過ごした古巣に復帰　コウチーニョはヴァスコ・ダ・ガマへの1シーズンのレンタル移籍が決定,https://news.yahoo.co.jp/articles/2491b4f3b6f5faf77a5417285f0666a2888978fb,7/11(木) 14:01
theworldw,theWORLD（ザ・ワールドWeb）,物議を醸すPK判定に？　オランダ代表クーマン監督と主将ファン・ダイクは審判の判定に納得いかず　「このようなVARの判定はサッカーを破壊する」,https://news.yahoo.co.jp/articles/1ca536db956bce85a96c7828b90b9634bb3f1203,7/11(木) 13:30
theworldw,theWORLD（ザ・ワールドWeb）,フランス相手に “16歳”が大仕事　ヤマルの一撃にスペイン代表指揮官も脱帽　「天才的な一面を見た」,https://news.yahoo.co.jp/articles/4a4c3f42b2eedfc5c48db024cb194559e66496a0,7/11(木) 13:00
theworldw,theWORLD（ザ・ワールドWeb）,ドイツ代表MFミュラーが代表引退へ　「現実的に考えればスペインとの試合が最後」,https://news.yahoo.co.jp/articles/20cf1e2879588e0f2039d84479111d3440273427,7/11(木) 12:31
theworldw,theWORLD（ザ・ワールドWeb）,W杯では2大会で12ゴールを決めるもEUROでは1ゴール　フランスのエース、ムバッペは消化不良のままEUROから姿を消すことに……,https://news.yahoo.co.jp/articles/dd97ae63b3443250b421d9f9119973a729c287cd,7/11(木) 12:07
theworldw,theWORLD（ザ・ワールドWeb）,コーチングスタッフとしてバルサに復帰？　フリック新監督は現役引退を決めたチアゴと会談,https://news.yahoo.co.jp/articles/e667b99f7eacf466c548326ab5e6610c007b18fb,7/11(木) 11:00
theworldw,theWORLD（ザ・ワールドWeb）,今の南米で王者アルゼンチンを倒せるのはウルグアイのみ？　アグエロは「ウルグアイだけだと思う」,https://news.yahoo.co.jp/articles/a72be31e9c6b7ea6bf98a06a52f03f29e7eaf86e,7/11(木) 7:00
theworldw,theWORLD（ザ・ワールドWeb）,ワトキンスが起用に応える逆転ゴール！　後半AT弾でオランダを下したイングランドが2大会連続で決勝へ進出,https://news.yahoo.co.jp/articles/10fb236c0dddb6ed637ef36b4d6f72bb9ef69003,7/11(木) 6:09
theworldw,theWORLD（ザ・ワールドWeb）,ヤマルとニコ・ウィリアムズの両翼がバルサで再現か　獲得について会長が言及「彼と契約するための資金もある」,https://news.yahoo.co.jp/articles/d038e5a6abd781956ec97535ca03978c56655579,7/11(木) 6:00
theworldw,theWORLD（ザ・ワールドWeb）,サッカー王国ブラジルがMF&DFの人材不足に？　ヴィニシウスらFW陣の個人能力に依存した状態でタイトルは獲れない,https://news.yahoo.co.jp/articles/230f9126a619e0a2e901a56da7751736bd5b8462,7/10(水) 21:40
theworldw,theWORLD（ザ・ワールドWeb）,困った時には“197cm”のビッグマン　オランダの重要武器であるベグホルストの存在感「彼はスタッツだけでは測れない」,https://news.yahoo.co.jp/articles/4bcbbd5373247935dabae62f133726ef4d6a065d,7/10(水) 21:20
theworldw,theWORLD（ザ・ワールドWeb）,2大会連続でEURO決勝の舞台へ　イングランド代表監督サウスゲイトはオランダ戦へ意気込み　「この機会を歴史を変える原動力として活用しなければならない」,https://news.yahoo.co.jp/articles/3fe411ca2fb37b942daba9f6759d3189473dc9d0,7/10(水) 21:02
theworldw,theWORLD（ザ・ワールドWeb）,バイエルンとの契約で悠々自適？　トーマス・トゥヘルに1年間休養の可能性が浮上,https://news.yahoo.co.jp/articles/16240f21292a795d664e57c6d16f44e9affee4ba,7/10(水) 20:02
theworldw,theWORLD（ザ・ワールドWeb）,チェルシーに所属する17歳FWエステヴァンが遂にブラジル代表デビューか　9月のW杯予選に招集される可能性,https://news.yahoo.co.jp/articles/4c7033cbcca84af20185a0f243f9f8b5a5ba4904,7/10(水) 19:01
theworldw,theWORLD（ザ・ワールドWeb）,アーセナルがイングランド代表GKラムズデールの売却を検討か　5000万ポンドを要求と現地報道,https://news.yahoo.co.jp/articles/131d2b4a0364fb7536ebfeea3f4d024300e626ec,7/10(水) 18:50
theworldw,theWORLD（ザ・ワールドWeb）,チェルシーがポルトガルの若き逸材フランシスコ・コンセイソンを獲得か　近日中にも正式オファーと現地報道,https://news.yahoo.co.jp/articles/a9d227d063069923f2f57c6b91c1cc616b89ef4b,7/10(水) 18:40
theworldw,theWORLD（ザ・ワールドWeb）,レヴァークーゼンMFフリンポン残留の可能性高まる　契約解除条項の有効期間は今週で満了,https://news.yahoo.co.jp/articles/05be865fc1076a44e0c327314e20bb12ec1aa432,7/10(水) 18:30
theworldw,theWORLD（ザ・ワールドWeb）,スペイン代表FWニコ・ウィリアムズをめぐる争奪戦にバイエルンも参戦か　今夏マネーゲーム勃発の可能性,https://news.yahoo.co.jp/articles/6c684730d8e875ce7953a933af155c510b8b84e3,7/10(水) 18:03
theworldw,theWORLD（ザ・ワールドWeb）,ヌニェスのバックアッパーにスアレスがいる恐怖　37歳で受け入れた2番手の立ち位置「スアレスはチームメイトを熱烈に応援している」,https://news.yahoo.co.jp/articles/ccac17dd61e9dcb2935536fd8221c1905d8e56e8,7/10(水) 17:40
theworldw,theWORLD（ザ・ワールドWeb）,オランダ戦は3バックか4バックか……　決勝進出がかかる大一番にイングランドはどのフォーメーションで挑むのか,https://news.yahoo.co.jp/articles/459192216db1a88315e6801c62e328d1e74d98ab,7/10(水) 17:30
theworldw,theWORLD（ザ・ワールドWeb）,「フランスは巨大な雄牛に乗せられた士官候補生のようだった」スペインに敗北したフランス、母国メディアが批判,https://news.yahoo.co.jp/articles/77a5992f3debc4365f24d1922e56d3522c66b898,7/10(水) 17:02
theworldw,theWORLD（ザ・ワールドWeb）,エヴァートンはマンUの2度目のオファーを拒否　　ブランスウェイト獲得へ “102億円”の移籍金提示されるも要求額を満たさず,https://news.yahoo.co.jp/articles/540526e78a6976cc8f1d3c983142a46a660079e0,7/10(水) 13:40
theworldw,theWORLD（ザ・ワールドWeb）,ハメスこそコパ・アメリカ2024のベストプレイヤーか　コロンビア2001年以来のコパ・アメリカ制覇も夢じゃない,https://news.yahoo.co.jp/articles/4dd2f04d1e99676597810cac8a5f5815b94d8959,7/10(水) 12:40
theworldw,theWORLD（ザ・ワールドWeb）,警備員のタックルでモラタが膝を負傷？　フランス撃破の喜びの裏でキャプテンの決勝出場に懸念が,https://news.yahoo.co.jp/articles/a7656c699794148011a8bde3e3cf066fce8bde65,7/10(水) 7:40
theworldw,theWORLD（ザ・ワールドWeb）,ムドリクはEUROに出たのに夏休み返上でトレーニング参加　マレスカ・チェルシーでついにその実力が引き出されるか,https://news.yahoo.co.jp/articles/0b7285fbd903f38072d9e7e1604defbe7dcae494,7/10(水) 7:03
theworldw,theWORLD（ザ・ワールドWeb）,ラミン・ヤマル、EURO最年少ゴール記録をついに更新　16歳と362日の一撃は弧を描くビューティフルゴール！,https://news.yahoo.co.jp/articles/5f1f1387e5df3c5ccb4274892dc0cd233a6a708c,7/10(水) 5:25
theworldw,theWORLD（ザ・ワールドWeb）,ウルグアイのビエルサ監督、大金星の喜び見せず　近年の『発展』に提言,https://news.yahoo.co.jp/articles/284c5189e50268b05e19340f52457951e369cec5,7/9(火) 23:50
theworldw,theWORLD（ザ・ワールドWeb）,クンデが警戒するのはチームメイトの16歳「ラミン・ヤマルは危険、本当に信じられない」,https://news.yahoo.co.jp/articles/c7c405805e71e7a1b5107b6d6926df64934aa5f0,7/9(火) 23:20
theworldw,theWORLD（ザ・ワールドWeb）,日韓W杯3位のチームを超えられる？　トルコの才能・ギュレルは本物だ「レアルが何の考えもなく選手を獲得することはない」,https://news.yahoo.co.jp/articles/05f06430f9aaf139a919f6861d386c0dcc828673,7/9(火) 21:20
theworldw,theWORLD（ザ・ワールドWeb）,W杯では19戦10ゴール、しかしEUROでは17戦0ゴール…… レーヴ体制からドイツの得点源だったT・ミュラーの不思議,https://news.yahoo.co.jp/articles/500826e98db653ba8fbf2c9c0b35c713e8f09467,7/9(火) 20:31
theworldw,theWORLD（ザ・ワールドWeb）,マンCとスペイン代表合わせて“5321分間”もプレイ　忙しすぎるMFロドリの稼働率,https://news.yahoo.co.jp/articles/be7ba4caaa7116b6425cabcfbe65b83f12465cc6,7/9(火) 20:01
theworldw,theWORLD（ザ・ワールドWeb）,チェルシーはアトランタ・ユナイテッド所属のDFケイレブ・ワイリーの獲得が決定的に　移籍金は780万ポンドと報道,https://news.yahoo.co.jp/articles/4b0d53d8d2979f7b16bc35a2e5e4093e1f225665,7/9(火) 19:31
theworldw,theWORLD（ザ・ワールドWeb）,マレスカ体制始動のチェルシー　初日の体力テストではDFグストがトップに,https://news.yahoo.co.jp/articles/50ee406ce74a5193b48fa523102cfbca9bec5c08,7/9(火) 19:00
theworldw,theWORLD（ザ・ワールドWeb）,チェルシーはドルトムントFWアデイェミを獲得か　ドイツ屈指のスピードスターは欧州ビッグクラブ間で争奪戦へ,https://news.yahoo.co.jp/articles/e50970db8a0fb5eab32af974d661d96ac8b73b4b,7/9(火) 18:31
