media_en,media_jp,title_articles,link_articles,date_original
theworldw,theWORLD（ザ・ワールドWeb）,C・ロナウド＆メッシは2026W杯も戦えるのではないか　EURO、コパで魅せるさすがの実力「これで本当に終わりなのか」,https://news.yahoo.co.jp/articles/c847dcf29dc02e919c4e01215b2653618d696b21,6/24(月) 6:20
theworldw,theWORLD（ザ・ワールドWeb）,土壇場のフュルクルク弾が開催国ドイツを救う！　試合巧者スイスに追いつきA組1位突破,https://news.yahoo.co.jp/articles/f5510f522e767508fe1b77c856cf251997c00ff6,6/24(月) 6:10
theworldw,theWORLD（ザ・ワールドWeb）,カルドーソ、バリオスら2010W杯で日本を倒した時は強かったのに…… 欧州組も激減と低迷するパラグアイ代表の現状,https://news.yahoo.co.jp/articles/ac41ef49d8f79140479c54066567a4dc0725d62e,6/24(月) 0:10
theworldw,theWORLD（ザ・ワールドWeb）,39歳でも第一線で戦うC・ロナウドについて、マンU時代のチームメイトが語る “変わらぬ野心”　「バロンドールを獲得すると公言していた」,https://news.yahoo.co.jp/articles/93dd528a0e515f5588c81ed6dff8867abf5432d0,6/23(日) 23:00
theworldw,theWORLD（ザ・ワールドWeb）,チェルシーがホッフェンハイム所属の21歳FWバイアーを獲得か　今季はブンデスリーガで16ゴール1アシストを記録,https://news.yahoo.co.jp/articles/2451af5590b9daefb448c4730c4fb875b5d7e6e6,6/23(日) 22:10
theworldw,theWORLD（ザ・ワールドWeb）,ポゼッションか、ロングボールか……　未だEUROでの戦い方定まらぬイングランド代表の懸念点を英メディアが指摘,https://news.yahoo.co.jp/articles/cbbed0999eee938076ba1f9c62105430180869bb,6/23(日) 22:00
theworldw,theWORLD（ザ・ワールドWeb）,"今のバルサで《アンタッチャブル》なのはクバルシやヤマルら “6人""だけ？　デ・ヨングやアラウホらもオファー次第では売却か",https://news.yahoo.co.jp/articles/19ff0d1c71ce070615f5cd9137a15750b90b8224,6/23(日) 21:02
theworldw,theWORLD（ザ・ワールドWeb）,バイエルンがトルコ代表MFチャルハノールを獲得か　インテルは6000万ユーロを要求,https://news.yahoo.co.jp/articles/49a9e3f66b814e88bd9fc87d2a6f1522a87721d5,6/23(日) 20:31
theworldw,theWORLD（ザ・ワールドWeb）,イングランド代表DFルーク・ショーが再び負傷　来季に備えて帰国も検討と現地報道,https://news.yahoo.co.jp/articles/9d18849ee5f1110922a99ac7b439009872cfd82f,6/23(日) 20:21
theworldw,theWORLD（ザ・ワールドWeb）,ニューカッスルがカルヴァート・ルーウィン獲得へ　エヴァートンは財政難でストライカーの現金化が必要か,https://news.yahoo.co.jp/articles/fe3469a0f1b0b6d1802acea10d35091232eb288b,6/23(日) 20:00
theworldw,theWORLD（ザ・ワールドWeb）,移籍金が36億円以上も急騰　チェルシーがU‐20イングランド代表ケリーマン獲得で合意か,https://news.yahoo.co.jp/articles/02e468e48c7758d0a1735de61924515491eae7ed,6/23(日) 19:03
theworldw,theWORLD（ザ・ワールドWeb）,チェルシーがメッシにそっくりのブラジルU‐17FWウィリアンと契約,https://news.yahoo.co.jp/articles/84d0cbab8e5c12b24233413d85ae4c463830d1b8,6/23(日) 18:30
theworldw,theWORLD（ザ・ワールドWeb）,リヴァプールがMFブラヒム・ディアス獲得を検討　レアルは移籍金次第で応じる方針,https://news.yahoo.co.jp/articles/7e3d30d2acac400973457239fcc7cf51053cef4c,6/23(日) 18:01
theworldw,theWORLD（ザ・ワールドWeb）,ロナウドと自撮りしようとファンが乱入し試合中断　ポルトガル監督は懸念,https://news.yahoo.co.jp/articles/4e58d3ced890373f0725d148c6d46b79c88dd456,6/23(日) 17:50
theworldw,theWORLD（ザ・ワールドWeb）,A・サンチェスの新天地は……　今夏インテル退団が濃厚な35歳は欧州キャリアをスタートさせた古巣へ復帰の可能性も,https://news.yahoo.co.jp/articles/1651c5d0a8b16554c4fa913889872acc2e02e557,6/23(日) 17:30
theworldw,theWORLD（ザ・ワールドWeb）,ガラタサライはワン・ビサカの獲得へ動く　ユナイテッドは約34億円のオファーで売却容認か,https://news.yahoo.co.jp/articles/db7ded092c8edfadf9ed3567567189dabff251e3,6/23(日) 17:01
theworldw,theWORLD（ザ・ワールドWeb）,今やG大阪における存在感は絶大　神戸との上位決戦でスーパーゴールを決めたウェルトンにかかる期待,https://news.yahoo.co.jp/articles/58e98762f9c54462520640e89c91b6b5054b9396,6/23(日) 16:00
theworldw,theWORLD（ザ・ワールドWeb）,インテルのラウタロVSマンCのアルバレスはどちらが1番手？　アルゼンチン代表らしい贅沢な攻撃陣の悩み,https://news.yahoo.co.jp/articles/9efcf5a3a9e3f60accd96d8a9639270f5763ddd6,6/23(日) 15:40
theworldw,theWORLD（ザ・ワールドWeb）,浦和レッズを救ったのは切り札の左足！　3シーズンの武者修行を経て戻ってきた武田英寿が手繰り寄せた価値あるドロー,https://news.yahoo.co.jp/articles/05ed1867b2207fa425fbdd9ca62a649e441ec1f8,6/23(日) 15:00
theworldw,theWORLD（ザ・ワールドWeb）,悪夢のドイツ戦から取り戻した自信　スコットランドが狙うGS最終節の勝利「ただひたすら走ってではだめ」,https://news.yahoo.co.jp/articles/4b33f595c45cb80a25a3f0612b13e6dcb7b0534d,6/23(日) 14:40
theworldw,theWORLD（ザ・ワールドWeb）,X・シモンズは来季もPSGからのレンタル移籍が濃厚!?　バイエルン&ライプツィヒらが狙う,https://news.yahoo.co.jp/articles/5f354cea7d81ab37c2d97ca34f117621e38f453b,6/23(日) 14:00
theworldw,theWORLD（ザ・ワールドWeb）,人気銘柄オリーセの新天地はバイエルンか　チェルシー、ニューカッスルらとの争奪戦を制す,https://news.yahoo.co.jp/articles/0b2205d87e04b63a71d6647ef3f8eab4c27f9f4a,6/23(日) 13:01
theworldw,theWORLD（ザ・ワールドWeb）,先発落ちのベルギー代表MFトロサールの父親が監督批判　「テデスコは良い指導者ではない」,https://news.yahoo.co.jp/articles/cf3c446fb74fc44b17743741d42aedc2d0305a95,6/23(日) 12:01
theworldw,theWORLD（ザ・ワールドWeb）,ポステコグルーも低調なイングランドにガッカリ　「選手を本来のポジションで使ったほうがいい、それが出発点」,https://news.yahoo.co.jp/articles/34d5025625388d992526f735c1d383a1a633e9de,6/23(日) 11:03
theworldw,theWORLD（ザ・ワールドWeb）,C・ロナウドでもアンリでもない　アーセナルレジェンドが選ぶプレミアリーグ史上最高の選手は天才オランダ人FW,https://news.yahoo.co.jp/articles/522b883159a425e020a8975671d967545fdd7fe3,6/23(日) 9:02
theworldw,theWORLD（ザ・ワールドWeb）,親子2代でユヴェントス入りなるか!?　父はあのフランス代表のレジェンド,https://news.yahoo.co.jp/articles/e86bfc41c1d5b21a843100f4a485ed392e5c6c09,6/23(日) 8:30
theworldw,theWORLD（ザ・ワールドWeb）,グリーリッシュが意外な場所に出没！　苦戦中の代表とは対照的なSNSを投稿,https://news.yahoo.co.jp/articles/40b4302dcc730f685864288d25f1afb239d189e0,6/23(日) 7:31
theworldw,theWORLD（ザ・ワールドWeb）,ニコ・ウィリアムズが前回大会王者イタリアを相手に輝きを放つ　「僕たち全員が動物のように連動した」,https://news.yahoo.co.jp/articles/fdfa00b1f1b975e6910968bc818f55f99326088c,6/23(日) 7:02
theworldw,theWORLD（ザ・ワールドWeb）,イタリア代表にとってクロアチアは最悪の対戦相手!?　名将カペッロ氏が警告とエールを送る,https://news.yahoo.co.jp/articles/2e81a18737a5d1d85678bf2546e91f9c8c014384,6/23(日) 6:30
theworldw,theWORLD（ザ・ワールドWeb）,カルヴィン・フィリップスの不在を嘆くサウスゲイトにイアン・ライトが反論　「この状況でも慌てない選手が代表に選ばれている」,https://news.yahoo.co.jp/articles/97b4b6e3d1092fdabce41494f9e6ae12222fd3f1,6/23(日) 6:01
theworldw,theWORLD（ザ・ワールドWeb）,攻守の歯車が噛み合ったポルトガル!!　トルコに完璧な勝利でノックアウトステージ進出を決めた,https://news.yahoo.co.jp/articles/0195cd7c4ee58d309975583c3cc8903eb18cf2c0,6/23(日) 6:00
theworldw,theWORLD（ザ・ワールドWeb）,ベルギーがルーマニア撃破でEURO初白星　ティーレマンス&デ・ブライネ弾で勝利し、グループEは4チームが勝ち点3で並ぶ大混戦に,https://news.yahoo.co.jp/articles/f5f965844222e2a93b12ad330567ddb4ca4375c5,6/23(日) 5:59
theworldw,theWORLD（ザ・ワールドWeb）,現イングランド代表のベストイレブンはどれなのか　サポーターへの緊急アンケートで見えるメイヌー&パルマーへの期待,https://news.yahoo.co.jp/articles/d826b3f2811f31511471b4ac723408019fca6e82,6/23(日) 0:30
theworldw,theWORLD（ザ・ワールドWeb）,リヴァプールに久保建英は合うか　トップクラブでプレイすれば「さらに多くのゴールを決められる」との評価も,https://news.yahoo.co.jp/articles/821b5e7bd45da50077ad68b0ee4aee3403ec1f3b,6/22(土) 23:50
theworldw,theWORLD（ザ・ワールドWeb）,ヤマル、ギュレル、ムシアラ、ベリンガムたち若手がとんでもない…… ヤングスターたちがEUROで示す“サッカー新時代”,https://news.yahoo.co.jp/articles/c9e0e84fb510c483e09039084a3876dd50d64e0e,6/22(土) 21:51
theworldw,theWORLD（ザ・ワールドWeb）,イングランドの右サイドを駆ける爆速のSBウォーカーは“40歳”でもプレイできる？　「スピードもあるし、若いと感じている」,https://news.yahoo.co.jp/articles/8feeaafffa6da621c8ce8e838dca64a65883f6bd,6/22(土) 21:11
theworldw,theWORLD（ザ・ワールドWeb）,「彼は衰えていない。常に危険な存在」　サウジアラビアでC・ロナウドを見てきたトルコ代表DFが語る警戒感,https://news.yahoo.co.jp/articles/b46fa2fcd240f2466942190594a1c1b4bf545966,6/22(土) 20:40
theworldw,theWORLD（ザ・ワールドWeb）,EURO2024でブレイク中のスペイン代表FWウイリアムズにビッグクラブが熱視線,https://news.yahoo.co.jp/articles/977d47e2debc39c9a07b197cd80529d9c38911f3,6/22(土) 19:02
theworldw,theWORLD（ザ・ワールドWeb）,今夏、左サイドバックの強化を狙うチェルシー　ACミランのテオ・エルナンデスの獲得を検討か,https://news.yahoo.co.jp/articles/8dc50bea4fc6c7eab9b0ee94015b66aca4b597c5,6/22(土) 18:31
theworldw,theWORLD（ザ・ワールドWeb）,ブライトン新指揮官がウンダブに復帰要請？　主力大量流出の危機に瀕するシュツットガルトに更なる打撃か,https://news.yahoo.co.jp/articles/baa48031680118fd792026bcf206f87ec7418239,6/22(土) 18:01
theworldw,theWORLD（ザ・ワールドWeb）,若手獲得が止まらないチェルシー　今度はバルセロナから18歳FWマルク・ギウを獲得か,https://news.yahoo.co.jp/articles/f6a2df5519a1b55b3d51acc506d831db085f9b8f,6/22(土) 17:40
theworldw,theWORLD（ザ・ワールドWeb）,EURO2024で大活躍中のククレジャが新指揮官のマレスカ監督を絶賛　「本当に素晴らしい監督」,https://news.yahoo.co.jp/articles/08b3481ac214232a0232bae9da2ed920e6485548,6/22(土) 17:30
theworldw,theWORLD（ザ・ワールドWeb）,王座奪還に向けて大型補強に乗り出すバイエルン　インテルMFチャルハノールの獲得を検討か,https://news.yahoo.co.jp/articles/9d68460efd2f1b61dff760b1d9bf234d262416ac,6/22(土) 17:00
theworldw,theWORLD（ザ・ワールドWeb）,A・アーノルドの中盤起用は失敗？　英メディアはサウスゲイト監督をバッサリ！　「これは本職ではないポジションで起用されている選手と同じくらい、いやそれ以上に監督にも責任がある」,https://news.yahoo.co.jp/articles/b42d88e4ac3c16cd908a961d8fc57afe8d27627a,6/22(土) 15:00
theworldw,theWORLD（ザ・ワールドWeb）,グリマルドを抑えて“スペイン代表左SB1番手”に　サポーターから『MVP』との声も挙がったククレジャの躍動,https://news.yahoo.co.jp/articles/f59a834d26b22fe4d1e8c7c8f26cbed46297de9e,6/22(土) 14:01
theworldw,theWORLD（ザ・ワールドWeb）,“サウジアラビア組”がEUROで魅せる想像を超える活躍　カンテ、ブルカ、スタンチュら輝き放つ実力者たち,https://news.yahoo.co.jp/articles/077ff9709576b98a3c59cf145196c85338ea5542,6/22(土) 13:01
theworldw,theWORLD（ザ・ワールドWeb）,"今のイングランドには ""変化""が必要か　パルマーやゴードンら未だ出番のないスター選手をサウスゲイトは使いこなせるか",https://news.yahoo.co.jp/articles/465efcbb2d5ad9be7a97a6d5a2e837926179f00d,6/22(土) 12:01
theworldw,theWORLD（ザ・ワールドWeb）,ベルギー代表で重ねたキャップ数は驚異の“154試合”　ベンチから見守る37歳のDFフェルトンゲンに出番はくるか,https://news.yahoo.co.jp/articles/86eaf114d0c42eab3df0f2237b5f9defc177ccae,6/22(土) 10:10
theworldw,theWORLD（ザ・ワールドWeb）,「デクラン・ライスは過大評価されている」　アイルランド代表時代の同僚が大胆な見解を示す　「彼はワールドクラスではない。私にとってワールドクラスとは……」,https://news.yahoo.co.jp/articles/d115ecc705699b47cf942ae267b93dbaba320f51,6/22(土) 9:01
theworldw,theWORLD（ザ・ワールドWeb）,コパ・アメリカに挑む驚異のヤングスターたち　ブラジルの神童エンドリックなど、今大会で注目すべきNEXTスター候補,https://news.yahoo.co.jp/articles/125b628527a6ba55863e83e10c997194ab66ac4d,6/22(土) 8:40
theworldw,theWORLD（ザ・ワールドWeb）,レアル加入2年でこなしたゲームは“101試合”　フリーでやってきたDFリュディガーが過ごす圧巻の2年間「最も愛される一人」,https://news.yahoo.co.jp/articles/5568a66484a7630c2ded7d7300d40a26ab18b097,6/22(土) 8:00
theworldw,theWORLD（ザ・ワールドWeb）,優勝候補アルゼンチンにとって最も危険なライバル？　バルベルデ、ヌニェス、アラウホらウルグアイは南米の頂点狙えるチームだ,https://news.yahoo.co.jp/articles/fce441ba753ce59adef4eb6048eadeb8f9dda721,6/22(土) 7:00
theworldw,theWORLD（ザ・ワールドWeb）,今のアメリカは本当に“黄金世代”なのか　プリシッチ世代が迎える勝負のコパ・アメリカ「ビッグゲームで力を発揮できていない」,https://news.yahoo.co.jp/articles/f4428f88c5533549040fd6f32b17fa411a2128ba,6/22(土) 6:40
theworldw,theWORLD（ザ・ワールドWeb）,シャビ・シモンズのゴールは幻に……　オランダ×フランス、D組最注目のビッグマッチは激闘ドロー,https://news.yahoo.co.jp/articles/f54aa741651df0a97817e846ab6a01b6ea17bd16,6/22(土) 6:11
theworldw,theWORLD（ザ・ワールドWeb）,プレミアよりもラ・リーガの方が上？　名将が唸るスペインのレベルの高さ「今でも世界最高だと思っている」,https://news.yahoo.co.jp/articles/2d1a86ca430f4c412175da94e913165cfbb9fa97,6/21(金) 23:50
theworldw,theWORLD（ザ・ワールドWeb）,マルティネッリにアーセナル退団の線も!?　気になるのは過去に何度も下された“アルテタの冷酷な決断”,https://news.yahoo.co.jp/articles/e371cc63bbe73d855554593981e536d26efc5011,6/21(金) 23:00
theworldw,theWORLD（ザ・ワールドWeb）,PSGで主力のザイール・エメリが“MF7番手”？　カンテ、ラビオ、カマヴィンガら激しすぎるフランス代表中盤の争い,https://news.yahoo.co.jp/articles/0d190381059fec75e5e81d18fb2cdb506b3e19e0,6/21(金) 22:10
theworldw,theWORLD（ザ・ワールドWeb）,“2012年以来最高のスペイン”　『死の組』を2連勝で難なく乗り越えたスペイン代表はEURO優勝候補の1つか,https://news.yahoo.co.jp/articles/7f83518eadded5fb90b5c4a523719b28490829a3,6/21(金) 21:10
theworldw,theWORLD（ザ・ワールドWeb）,デ・リフト放出は間違い？　バイエルンOBがクラブの方針に疑問　「彼はチームで一番のCB」,https://news.yahoo.co.jp/articles/7db1e56e83fbb6c6b8af69d50990430185155f9c,6/21(金) 20:03
theworldw,theWORLD（ザ・ワールドWeb）,プレミア初挑戦で好印象!?　ボーンマスの20歳DFにプレミアビッグクラブが熱視線,https://news.yahoo.co.jp/articles/975e8e94943365a3bb52efe0e21edce54c9f2e60,6/21(金) 19:30
theworldw,theWORLD（ザ・ワールドWeb）,黄金世代に衰えが見えるクロアチア　イタリア戦で指揮官は世代交代を決断できるのか,https://news.yahoo.co.jp/articles/a8e7f071be5a468932beaf1a7c950c704053e2ca,6/21(金) 19:02
theworldw,theWORLD（ザ・ワールドWeb）,A・アーノルドの中盤起用は本当に正解か？　ロイ・キーン氏もイライラ「ライスがベビーシッターになっていた」,https://news.yahoo.co.jp/articles/93c64c841f56b72f1d0fb8e513bb9ef1a25f6e72,6/21(金) 18:30
theworldw,theWORLD（ザ・ワールドWeb）,早くも傷だらけのフランス、鼻骨折のムバッペに続きサリバにも懸念、ケガでトレーニングを欠席　来季に向け勤続疲労の心配も,https://news.yahoo.co.jp/articles/ebcfa6121328686d54ea189e7c0809528701e5b2,6/21(金) 18:00
theworldw,theWORLD（ザ・ワールドWeb）,リールFWデイビッドはプレミア4クラブで争奪戦か　今季はリーグ・アンで19ゴールと大活躍,https://news.yahoo.co.jp/articles/640a36c7ba5246b7557f1c37cf730d655e6b6c84,6/21(金) 17:40
theworldw,theWORLD（ザ・ワールドWeb）,ロペテギ新監督率いるウェストハム　今夏の移籍市場でバルセロナFWフェラン・トーレスの獲得目指す,https://news.yahoo.co.jp/articles/8f3bfd6f960401f45ccc8e5d502dd653549e8fd2,6/21(金) 17:30
theworldw,theWORLD（ザ・ワールドWeb）,フェネルバフチェFWバチュアイがライバルクラブであるガラタサライに電撃移籍へ　既にメディカルチェックも合格と現地報道,https://news.yahoo.co.jp/articles/036d9490dc59bb089034a37ac3ff43dcec52695a,6/21(金) 17:02
theworldw,theWORLD（ザ・ワールドWeb）,EURO2024でフォーデンに更なるステップアップを求めるセスク　「国を背負って大きな大会に臨む時なんだ」,https://news.yahoo.co.jp/articles/84825019f03013824193ea8f41eba25a2777b0b4,6/21(金) 16:20
theworldw,theWORLD（ザ・ワールドWeb）,C・ロナウドはベンチかスタメンか？　ポルトガルで広がる論争,https://news.yahoo.co.jp/articles/26267a0cbc393be4ed7a8c6018c9f079211f9f57,6/21(金) 16:10
theworldw,theWORLD（ザ・ワールドWeb）,アーセナルはトルコ代表24歳DFへ約34億円のオファー？　ドルトムントとの争奪戦の可能性も,https://news.yahoo.co.jp/articles/9f94d9c2f6719ffe6ea204a25e62c59efab5380d,6/21(金) 16:01
theworldw,theWORLD（ザ・ワールドWeb）,バイエルンはトゥヘル体制のままの方が良かった？　難しい今季の評価「レヴァークーゼンが強すぎただけで……」,https://news.yahoo.co.jp/articles/8fe79e917214680669c81cdd59e336094c8047f9,6/21(金) 11:41
theworldw,theWORLD（ザ・ワールドWeb）,ムバッペ退団で攻撃陣の補強必須なPSG　 “リヨンの神童”チェルキ獲得へ正式オファーか,https://news.yahoo.co.jp/articles/b656d6e282b855394b826d5d30cf3f2e624794f4,6/21(金) 11:01
theworldw,theWORLD（ザ・ワールドWeb）,C・ロナウドより鉄人な41歳の番人　ポルトガル代表で138試合をこなすペペは今大会もディフェンスリーダーに,https://news.yahoo.co.jp/articles/47ff90d57e3c1d4b31d2b9eb26ca6678149e0b7d,6/21(金) 10:10
theworldw,theWORLD（ザ・ワールドWeb）,カイセドと比較される18歳MFに注目！　来季は三笘薫のチームメイト!?,https://news.yahoo.co.jp/articles/319ab9bfb0b377fd0ed14a33a3b8232f0049a47a,6/21(金) 9:30
theworldw,theWORLD（ザ・ワールドWeb）,レスターが新監督を発表　マレスカ前監督に匹敵する実績の持ち主が後任に！,https://news.yahoo.co.jp/articles/aea3d7c6c258667e7b65aa18d78e3a0beeb3f25f,6/21(金) 9:01
theworldw,theWORLD（ザ・ワールドWeb）,キエーザからアトレティコの若き天才ウインガーへ方針転換 !?　ローマが代理人と接触し好感触,https://news.yahoo.co.jp/articles/8912f92372b11194cc89bec1d4d750edbad93d79,6/21(金) 8:30
theworldw,theWORLD（ザ・ワールドWeb）,メッシ、ディ・マリア、スアレス、ゲレーロ、ハメス　今回のコパ・アメリカがラストになるかもしれない英雄たちへの注目,https://news.yahoo.co.jp/articles/3b750246915cec0aa9d797f7a1d6650272dfd442,6/21(金) 8:00
theworldw,theWORLD（ザ・ワールドWeb）,プレミアリーグの優勝トロフィーが盗難被害　密かに再発注していた？,https://news.yahoo.co.jp/articles/2276fc369666d7c4401b057e10b646ef849632d6,6/21(金) 7:31
theworldw,theWORLD（ザ・ワールドWeb）,個も組織も上回ったスペインが勝利　守備で手一杯だったイタリアは失点1で上出来の試合内容,https://news.yahoo.co.jp/articles/334de3738767a5c70b0b038db59363214dd5bd2c,6/21(金) 7:09
theworldw,theWORLD（ザ・ワールドWeb）,ウガンダで八百長組織を摘発！　関与した審判や選手13人を処分,https://news.yahoo.co.jp/articles/e5de72873cdf705cc692db55246b9719b9bbd04f,6/21(金) 7:06
theworldw,theWORLD（ザ・ワールドWeb）,ベリンガムとA・アーノルドの“尊い関係”が加速!?　「イングランドで花開くブロマンス」,https://news.yahoo.co.jp/articles/59f28ad54047437f5510c2947a317182052707c1,6/21(金) 6:31
theworldw,theWORLD（ザ・ワールドWeb）,グループリーグ突破が絶望的なクロアチア　それでもイタリア戦には「勝利できる」とモドリッチ,https://news.yahoo.co.jp/articles/52b3a85d84e25e6f4743b52b4b41ea16a8eb7faf,6/21(金) 6:31
theworldw,theWORLD（ザ・ワールドWeb）,デンマークに大苦戦のイングランドはドロー　ストライカーのケインにゴールが生まれるもヒュルマンドがスーパーミドルを叩き込む,https://news.yahoo.co.jp/articles/87bd764a3509d243cc534fe056925c8b4f8148cc,6/21(金) 3:10
theworldw,theWORLD（ザ・ワールドWeb）,「彼はとてもエキサイティングで、フレッシュで、恐れを知らない」　ウォルコットがフォーデンの代わりに起用を推す選手とは？,https://news.yahoo.co.jp/articles/bcd01005ae33ca1be51dacaa03b4c4e44738bd09,6/20(木) 23:00
theworldw,theWORLD（ザ・ワールドWeb）,アルネ・スロット、リヴァプール指揮官として初めて公に発言「ユルゲンが遺したものを基に努力」「多くの類似点が見られるだろう」,https://news.yahoo.co.jp/articles/0e32631e4401add19412c6091de686a53b75793f,6/20(木) 22:30
theworldw,theWORLD（ザ・ワールドWeb）,ケパにレアル・マドリード残留の可能性も？　今季大活躍のルニンの去就が影響か,https://news.yahoo.co.jp/articles/f68592d2ea517e3f6e0784bd7a34588a55b37c07,6/20(木) 22:00
theworldw,theWORLD（ザ・ワールドWeb）,ギュレル、スタンチュらEUROで激増するエリア外からのミドル　現代では減っていたエリア外からのゴールに脚光集まる,https://news.yahoo.co.jp/articles/a7558f4517fb1f8190f5a9278ef9953e218c58a1,6/20(木) 21:40
theworldw,theWORLD（ザ・ワールドWeb）,EURO出場国では最高齢の平均“28.5歳”　ギュンドアン、クロースら渋いベテラン光るドイツが見せる華麗な世代融合,https://news.yahoo.co.jp/articles/cb195371d9758c6b3cc95ee19b443e69332e01e0,6/20(木) 20:40
theworldw,theWORLD（ザ・ワールドWeb）,カタールW杯ではデンマークになかった大型FWホイルンドの選択肢　レジェンドも絶賛する若きホープの存在感,https://news.yahoo.co.jp/articles/e7d1188dfd47b760db1e27588733dcc4cf9f8ea7,6/20(木) 20:00
theworldw,theWORLD（ザ・ワールドWeb）,ベルギー対イスラエル戦の開催をブリュッセル市が許可せず　パレスチナ紛争影響し治安懸念,https://news.yahoo.co.jp/articles/ff700f0bab5d840621432ca93519a606ba58fd6e,6/20(木) 19:31
theworldw,theWORLD（ザ・ワールドWeb）,イタリアとの大一番に臨むスペイン　不安要素はロドリの勤続疲労,https://news.yahoo.co.jp/articles/e28767557bece7045ad207226f2ad568b0909f8c,6/20(木) 19:02
theworldw,theWORLD（ザ・ワールドWeb）,アル・イテハドがガーナ代表FWクドゥスに熱視線！　ウェストハムは慰留に努める,https://news.yahoo.co.jp/articles/b351f629ce9300f55012d188d1dc34a35be7f348,6/20(木) 18:31
theworldw,theWORLD（ザ・ワールドWeb）,アストン・ヴィラ、EUROオランダ代表DFマートセン獲得でチェルシーと合意か　移籍金約70億〜80億円,https://news.yahoo.co.jp/articles/b2c3f2e762893e410eb6289c6a863cc202015318,6/20(木) 18:01
theworldw,theWORLD（ザ・ワールドWeb）,バルセロナがRBライプツィヒMFダニ・オルモに興味か　フリック新監督が獲得を熱望,https://news.yahoo.co.jp/articles/e6ab33c64e17ba684d8417cedc8fa827f20f3892,6/20(木) 17:50
