media_en,media_jp,title_articles,link_articles,date_original
theworldw,theWORLD（ザ・ワールドWeb）,体重はまさかの”110kg”到達でドルトムントDFに太り過ぎ問題勃発　今夏のオフには10kg近くのマイナスが求められることに,https://news.yahoo.co.jp/articles/ef73b1d8d2337c612d6f24e7a7953426c6440d67,6/13(木) 22:10
theworldw,theWORLD（ザ・ワールドWeb）,指揮官テルジッチはドルトムント退団へ　契約解除を要求し、話し合いの末、退任が決定,https://news.yahoo.co.jp/articles/8d61a500b241ffee3bee49d893f00dc82a129001,6/13(木) 21:39
theworldw,theWORLD（ザ・ワールドWeb）,レアル・マドリードはロメロ獲得に興味　守備陣強化で目をつけたのはトッテナムのディフェンスリーダー,https://news.yahoo.co.jp/articles/8780efaa900929e024ed0c5b40a7a1965ea1f307,6/13(木) 21:30
theworldw,theWORLD（ザ・ワールドWeb）,日本人トップは鈴木優磨、驚異の「1100％アップ」を記録した選手も　Jリーガーの最新市場価値,https://news.yahoo.co.jp/articles/f0cec0b9897005b25de079db5c7b8fd1801e74c8,6/13(木) 21:11
theworldw,theWORLD（ザ・ワールドWeb）,A・アーノルドは中盤で起用すべきか　ライスやベリンガムをも上回る圧倒的チャンスクリエイト数は大きな武器に,https://news.yahoo.co.jp/articles/6e49dff73396a2ad7b2ffa83369d278fcaa55718,6/13(木) 20:31
theworldw,theWORLD（ザ・ワールドWeb）,アルミロンは今夏ニューカッスルを退団か　サウジアラビアから高額オファーも,https://news.yahoo.co.jp/articles/6a0e8e6b0989ac7081a02960568f655d6380fd1d,6/13(木) 19:31
theworldw,theWORLD（ザ・ワールドWeb）,開催国としてEURO2024制覇を狙うドイツ代表　パブロビッチの扁桃炎による離脱を受けてエムレ・チャンの追加招集を発表,https://news.yahoo.co.jp/articles/3a226c9157861cc730d9addfb0c834aab74feea2,6/13(木) 18:30
theworldw,theWORLD（ザ・ワールドWeb）,スター集団・イングランド代表の《最重要プレイヤー》は　25歳で中盤の最年長者となるライスが攻守のカギを握る,https://news.yahoo.co.jp/articles/40abcba3e8cf7074d09fc2c013a820c288cd6f4e,6/13(木) 17:40
theworldw,theWORLD（ザ・ワールドWeb）,日本代表MF三笘薫所属のブライトン　来夏で契約満了となるドイツ代表MFグロスと契約延長に向けて交渉中か,https://news.yahoo.co.jp/articles/5665957cfdfbe678ec1e7d8616d381f6921c198d,6/13(木) 17:01
theworldw,theWORLD（ザ・ワールドWeb）,日本代表DF伊藤洋輝がバイエルン移籍で合意か　5年契約を結び、残すはメディカルチェックのみ,https://news.yahoo.co.jp/articles/abee89dd9b51e7b1eacd026a0dd14ef21d5526ec,6/13(木) 13:10
theworldw,theWORLD（ザ・ワールドWeb）,パリーニャをめぐるクラブ間交渉が難航　バイエルンの二度目のオファー提示もフラムが拒否,https://news.yahoo.co.jp/articles/c5f62ff6824cdf142d754bd22cfeb3df9391d83e,6/13(木) 12:02
theworldw,theWORLD（ザ・ワールドWeb）,ブラジル代表MFエデルソンが移籍を検討　リヴァプールやアトレティコ・マドリードが関心,https://news.yahoo.co.jp/articles/ff318c13f789a4c229ddd6ccb18f83724d45154c,6/13(木) 11:02
theworldw,theWORLD（ザ・ワールドWeb）,ユヴェントスがチアゴ・モッタ新監督の就任を発表　「偉大なクラブの指揮嬉しい」,https://news.yahoo.co.jp/articles/8e9ebba17ba7045c430368cfa8c60ef202369ca2,6/13(木) 10:02
theworldw,theWORLD（ザ・ワールドWeb）,W杯カタール大会を経験したのは10人のみ　ヤマル、フェルミン・ロペスら将来性抜群のスペイン代表に再び黄金期はくるか,https://news.yahoo.co.jp/articles/dc0a5e873e04403b933baa0f96fdf20d2eb571ff,6/13(木) 7:31
theworldw,theWORLD（ザ・ワールドWeb）,「エヴァートンでの仕事を終えた頃はみんな私が年寄りだと……」　アンチェロッティが乗り越えた苦難の3年間,https://news.yahoo.co.jp/articles/11bfcf5110aa50a68c13833f28d768ba2ae1e790,6/13(木) 6:50
theworldw,theWORLD（ザ・ワールドWeb）,人口約3万3000の代表チームに9倍となる28万フォロワー　《FIFAランク210位》のチームに集まる不思議な人気,https://news.yahoo.co.jp/articles/76bba2908a07af8bb364f58c6df4dbdbdde56cb9,6/12(水) 23:50
theworldw,theWORLD（ザ・ワールドWeb）,バルセロナは新たな中盤のターゲットを設定？　今季ブンデス2位にまで順位を上げたシュツットガルトの23歳MFの獲得を検討か,https://news.yahoo.co.jp/articles/ff7a9b70950cce49ace76451a2b5477991dec02f,6/12(水) 23:00
theworldw,theWORLD（ザ・ワールドWeb）,チェルシーはFWデュラン獲得に興味　アストン・ヴィラではワトキンスのバックアッパーとして出番が限られる20歳,https://news.yahoo.co.jp/articles/76255f593789a215ded819f7a6445dcb6b836df9,6/12(水) 22:00
theworldw,theWORLD（ザ・ワールドWeb）,カナダ、アイスランドを4-0で粉砕　EUROへオランダ代表の仕上がりに対戦相手も脱帽「どのエリアも非常にクオリティが高い」,https://news.yahoo.co.jp/articles/1a61bcd27f085c3f52634334377f827717bcb624,6/12(水) 21:40
theworldw,theWORLD（ザ・ワールドWeb）,イングランド2部が過去最高の動員数　スペイン・ドイツ・イタリアの1部よりも上,https://news.yahoo.co.jp/articles/6c851b966c098e9a27fdc37bb8d0c2f21940f1dd,6/12(水) 21:02
theworldw,theWORLD（ザ・ワールドWeb）,イングランド代表サウスゲイト監督がEURO2024へ背水の陣　優勝できなければ退任か「最後のチャンス」,https://news.yahoo.co.jp/articles/93da7fae563c78a0a4f44d5acaf935f4291c382a,6/12(水) 20:30
theworldw,theWORLD（ザ・ワールドWeb）,ドイツサッカー界を揺るがした衝撃の移籍をゲッツェが振り返る　「練習中に60人ものファンがやってきて僕を侮辱した」,https://news.yahoo.co.jp/articles/49c5daa97d40b193836fea5e521eb1cfc7d86fc6,6/12(水) 20:03
theworldw,theWORLD（ザ・ワールドWeb）,カンファレンスリーグ制覇は偶然ではない　CL、ELでも結果を出してきたオリンピアコスの躍進,https://news.yahoo.co.jp/articles/7ff8bbbd9681142dd1ca5a1edae3de9190d3974d,6/12(水) 19:40
theworldw,theWORLD（ザ・ワールドWeb）,ナイジェリア政府、W杯アフリカ予選で大不振の代表チームに説明要求　「最近の結果は受け入れられません」,https://news.yahoo.co.jp/articles/d271f0b3c861f6f059c88eb36ba386f2ea1f902b,6/12(水) 19:31
theworldw,theWORLD（ザ・ワールドWeb）,福田師王はボルシアMGで来季最も活躍が期待される若手選手　独紙実施アンケートで最多得票率,https://news.yahoo.co.jp/articles/6c5bd5b5b3f0e1f9ae7b5bdcd07c187a2562dda3,6/12(水) 19:04
theworldw,theWORLD（ザ・ワールドWeb）,希望が絶望に　レヴァンドフスキが負傷したポーランドは団結できるか,https://news.yahoo.co.jp/articles/f93f7e655f3855b421ab4aa33a31174345fea674,6/12(水) 18:30
theworldw,theWORLD（ザ・ワールドWeb）,前田大然とティアニーの左サイドをセルティックで見たい？　「左サイドで日本のダイナモの良きパートナーとなる」,https://news.yahoo.co.jp/articles/1a04bde6bf679c9459e2d576c4b5710e3175b79b,6/12(水) 18:05
theworldw,theWORLD（ザ・ワールドWeb）,マンチェスター・ユナイテッドのテン・ハーグ監督が一転、続投へ　リーグ8位フィニッシュもFA杯制覇が影響か,https://news.yahoo.co.jp/articles/b1e30e5f5491f4612d978a909550d42dffe3f9b7,6/12(水) 17:31
theworldw,theWORLD（ザ・ワールドWeb）,レヴァークーゼンDFターをめぐるバイエルンとの交渉が大詰め　焦点は移籍金交渉へ,https://news.yahoo.co.jp/articles/7eacc120b1341824be663a2a54b5b7a7cbc3e790,6/12(水) 17:04
theworldw,theWORLD（ザ・ワールドWeb）,アーセナル&チェルシーに大打撃　去就注目されたFWシェシュコはライプツィヒと新契約で今夏残留へ,https://news.yahoo.co.jp/articles/acce55513fe359419f01c8f6f77887e7e4e8fd01,6/12(水) 15:02
theworldw,theWORLD（ザ・ワールドWeb）,セルビア対イングランドは「ハイリスク」　ドイツ警察当局が注意喚起,https://news.yahoo.co.jp/articles/dcefb1c8278f0a26c703818feb22c8316d449110,6/12(水) 14:30
theworldw,theWORLD（ザ・ワールドWeb）,ウクライナ戦争の特別処置で移籍金取れず　シャフタール・ドネツクが法的措置を示唆,https://news.yahoo.co.jp/articles/d095edec4b38c9c6418118f94801320574110fe4,6/12(水) 14:01
theworldw,theWORLD（ザ・ワールドWeb）,ラツィオMFルイス・アルベルトのアル・ドゥハイル加入が正式決定！　移籍金は推定20億円,https://news.yahoo.co.jp/articles/a04bed08c69e4c958462328d084e46d747900aa0,6/12(水) 12:40
theworldw,theWORLD（ザ・ワールドWeb）,レアル・マドリードDFリュディガーにアル・ナスルが熱視線　4年総額169億円の破格オファーを用意か,https://news.yahoo.co.jp/articles/d74487df5e00be8404a460a76740011ee0e04124,6/12(水) 12:30
theworldw,theWORLD（ザ・ワールドWeb）,ポーランド代表に激震！　エースのレヴァンドフスキがハムストリング負傷でEURO2024の初戦オランダ戦欠場決定,https://news.yahoo.co.jp/articles/fc2a4e623c5edd99a2b7e679887a240f4f40c51a,6/12(水) 12:20
theworldw,theWORLD（ザ・ワールドWeb）,出場枠増加したのにナイジェリアのW杯出場が危ない　ルックマン、ボニフェイスらいても《4戦0勝》のピンチに,https://news.yahoo.co.jp/articles/2015f8eb4ae9c6c4b75d0179d6550aa3313fffbb,6/12(水) 6:40
theworldw,theWORLD（ザ・ワールドWeb）,目標はアーセナルを率いてCL優勝　パレスを解雇されたヴィエラがプレミアリーグへの思いを吐露,https://news.yahoo.co.jp/articles/62a41ad122699fd5988d6f4077c7eef082c8e4f5,6/12(水) 6:01
theworldw,theWORLD（ザ・ワールドWeb）,余裕の表れ!?　コンディション調整を優先でメッシ温存でも、堅実にエクアドルに勝利,https://news.yahoo.co.jp/articles/5ed483fefb36b76a5b0aea35252ef4468242ef36,6/12(水) 0:30
theworldw,theWORLD（ザ・ワールドWeb）,サウジリーグでの活躍は無意味!?　C・ロナウドのポルトガル代表先発起用に異議,https://news.yahoo.co.jp/articles/14a5e99c305a03547fee29d3c52d86a45e040075,6/12(水) 0:00
theworldw,theWORLD（ザ・ワールドWeb）,ただ短気なのか、開催国としての気合の表れか？　リュディガーがCL決勝の相手FWと乱闘騒ぎ,https://news.yahoo.co.jp/articles/e0f05684573af4f9354dad026bbb8377f7fe1bb1,6/11(火) 23:30
theworldw,theWORLD（ザ・ワールドWeb）,“ベイル時代”が終わったウェールズは弱体化してしまうのか　今月はスロバキアに0-4大敗で批判が「がっかりしている」,https://news.yahoo.co.jp/articles/d4ba804a824a46a76f9a8c952817dbc60322800a,6/11(火) 23:10
theworldw,theWORLD（ザ・ワールドWeb）,"ムバッペは “フランスの偉大な選手全員を超える""　英雄ジダンは後輩の新章に期待　「レアル・マドリードで歴史を作るだろう」",https://news.yahoo.co.jp/articles/416598c340c657af13c012ddb1ff712ebc8a6505,6/11(火) 22:30
theworldw,theWORLD（ザ・ワールドWeb）,「彼の時代がきた」　ブラジルのレジェンド・怪物ロナウドもヴィニシウスのバロンドール獲得を支持　「今や間違いなく世界最高の選手だ」,https://news.yahoo.co.jp/articles/9267986192184533d19feead0b360bfc55bbcdc2,6/11(火) 22:00
theworldw,theWORLD（ザ・ワールドWeb）,グヴァルディオル、スタニシッチら若きクロアチア守備陣の完成　EURO初戦のスペイン戦で見るべきヤマルら強烈ウイングとのバトル,https://news.yahoo.co.jp/articles/c97ab737f5f3eb7058f2cc2c35b8b5464b06b64b,6/11(火) 21:40
theworldw,theWORLD（ザ・ワールドWeb）,日本代表は2戦連続5ゴールでシリア代表に完勝　上田、堂安、相馬、南野とゴールラッシュ　W杯アジア2次予選を全勝無失点で最終予選へ,https://news.yahoo.co.jp/articles/a0ede84d692b701d06294e756a8be20c16d18af4,6/11(火) 21:16
theworldw,theWORLD（ザ・ワールドWeb）,優勝候補イングランドがセルビアに負けるかも？　ヴラホビッチ、サマルジッチ、ミトロビッチらの脅威に不安の声,https://news.yahoo.co.jp/articles/aea8c33f21eff8093fd3f355917d2f730b86133a,6/11(火) 21:10
theworldw,theWORLD（ザ・ワールドWeb）,百年の恋も一気に冷めたか!?　2028年まで契約を残すナポリの主将が、ユヴェントス移籍へ口頭合意,https://news.yahoo.co.jp/articles/ac76f04415f9013dd14ad0d16af92bfbc82c3d69,6/11(火) 20:00
theworldw,theWORLD（ザ・ワールドWeb）,膝の大ケガから約1年半ぶりに走る動画をSNSで投稿　「二度と復帰できないかもしれない」と語った元バルサの天才MFが喜びを噛み締める,https://news.yahoo.co.jp/articles/57545cbbe579e890b0d63bce141ac4ee7dcea13a,6/11(火) 20:00
theworldw,theWORLD（ザ・ワールドWeb）,レアル攻撃陣のタレントが豊富すぎる　ムバッペ&エンドリック加入でロドリゴにとって来季は “勝負の1年”か,https://news.yahoo.co.jp/articles/ba1f48efe9ba9c6e2bbf693e1c46cda4bba5a2d7,6/11(火) 18:02
theworldw,theWORLD（ザ・ワールドWeb）,31歳スティル監督がRCランスの新監督に正式決定　今季までは伊東純也と中村敬斗が所属するスタッド・ランスを指揮,https://news.yahoo.co.jp/articles/c53de2002009afbda237b9ca162b2b86820872c1,6/11(火) 17:30
theworldw,theWORLD（ザ・ワールドWeb）,マンC指揮官グアルディオラがバルセロナ復帰の可能性を一蹴　「扉は既に閉ざされている。年齢を重ね過ぎた」,https://news.yahoo.co.jp/articles/a01e1066b9606ea8f253b18a458c10f7fd3c7db1,6/11(火) 17:02
theworldw,theWORLD（ザ・ワールドWeb）,マクアリスターが明かしたリヴァプールでの別れを惜しむユルゲン・クロップからのメッセージ,https://news.yahoo.co.jp/articles/88c1c2cc0fbd9c283acac299bb88947817031916,6/11(火) 16:01
theworldw,theWORLD（ザ・ワールドWeb）,ジョアン・フェリックスは来季もバルセロナでプレイできるのか　不透明な去就について語る　「私はバルサを愛しているし……」,https://news.yahoo.co.jp/articles/d38026bf4b75004b518f61fc086948c87d3a69d4,6/11(火) 15:01
theworldw,theWORLD（ザ・ワールドWeb）,アトレティコはトッテナムのホイビュア獲得を再燃？　様々なクラブが注目する守備的MFは今夏こそ退団か,https://news.yahoo.co.jp/articles/c5dd6193bf3e7b9f85e2739befe586c012960013,6/11(火) 14:01
theworldw,theWORLD（ザ・ワールドWeb）,チェルシーはオリーセと個人的条件で合意　残すは契約解除金の支払いスケジュールの調整のみか,https://news.yahoo.co.jp/articles/14e1ff24fcb6e02f4e4216469d95103254d2c775,6/11(火) 13:01
theworldw,theWORLD（ザ・ワールドWeb）,オランダ代表に激震！　MFフレンキー・デ・ヨングが負傷でEUROを欠場することを発表,https://news.yahoo.co.jp/articles/de96b725b3f32197b0a48b335102f42f4c126fc5,6/11(火) 12:31
theworldw,theWORLD（ザ・ワールドWeb）,レスター・シティの新監督はポッター？　スールシャール？　財務状況もネックに,https://news.yahoo.co.jp/articles/801b4b793f9cfe358bc2d7276df574b9cd282868,6/11(火) 11:31
theworldw,theWORLD（ザ・ワールドWeb）,ウルブズがポルトガルU-21ロドリゴ・ゴメス獲得でブラガと合意か　今季30試合7得点の俊英,https://news.yahoo.co.jp/articles/c7089e76bccb36aca03c695c5d5d8031ba1875cc,6/11(火) 11:01
theworldw,theWORLD（ザ・ワールドWeb）,ヴィニシウスに人種差別のバレンシアファンに有罪判決　スペインサッカー史上初,https://news.yahoo.co.jp/articles/65ee7cdb1a8fd6000b121aeb8f19063e851b3fb5,6/11(火) 10:10
theworldw,theWORLD（ザ・ワールドWeb）,怪我さえなければ今もイングランドNo.1のテクニシャン？　久々のゲームで魅せたウィルシャーのドリブルにファンもメロメロ,https://news.yahoo.co.jp/articles/604d8cfb8e2971df535c730d11f6ad6065fe76eb,6/11(火) 6:50
theworldw,theWORLD（ザ・ワールドWeb）,アメリカはコロンビアに1-5、カナダはオランダに0-4　2026W杯へホスト国に広がる不安「カタールの方が強いのでは」,https://news.yahoo.co.jp/articles/be723c3075c2b698c7923ea7b872e3cbcd9ce7ad,6/11(火) 6:32
theworldw,theWORLD（ザ・ワールドWeb）,久保建英がアジア人選手市場価値ランキングでダントツの1位！　2位の韓国代表選手とは約2倍の差をつける,https://news.yahoo.co.jp/articles/409a32429bee00d4f4c260091949f87609b5c11b,6/11(火) 0:30
theworldw,theWORLD（ザ・ワールドWeb）,1試合33億円稼ぐレアル・マドリードにとってクラブW杯はマイナス!?　アンチェロッティ監督が大会不参加の意向を表明,https://news.yahoo.co.jp/articles/e3ee3e017a15a62666a3a916fa3280ec0f2b7119,6/11(火) 0:00
theworldw,theWORLD（ザ・ワールドWeb）,レアルでの成長から“モロッコ希望の星”となる　2026W杯へブラヒム・ディアス中心のモロッコ攻撃陣が面白い,https://news.yahoo.co.jp/articles/d62d44c24cf2cdd20c7c2292f11a320134191a2d,6/10(月) 23:10
theworldw,theWORLD（ザ・ワールドWeb）,セルティックのオライリー招集外はデンマークでも波紋呼ぶ　元代表戦士は疑問も「私なら100％彼を選んだ」,https://news.yahoo.co.jp/articles/952d4da82098ce2b6788c44b4b942c0d244c99cb,6/10(月) 22:40
theworldw,theWORLD（ザ・ワールドWeb）,新生フリック・バルサ守備の柱の1人に　去就騒がれたクンデは来季もチームに欠かせない存在へ,https://news.yahoo.co.jp/articles/d282e369833f6dcabd198f9ce169e0e2f4120603,6/10(月) 22:00
theworldw,theWORLD（ザ・ワールドWeb）,"16歳だった少年が ""マンCのエース”へ　 プレミア初ゴールをアシストしたアグエロがフォーデンの成長を喜ぶ　「今のシティで最も完成された選手」",https://news.yahoo.co.jp/articles/a49fb220d7d1dcf33901d894fcd3f3164813c43b,6/10(月) 21:03
theworldw,theWORLD（ザ・ワールドWeb）,バルセロナ・アトレティックで手腕を発揮するマルケス監督、シャビの後任ポスト昇進は叶わずも現職継続を熱望,https://news.yahoo.co.jp/articles/3b1e64b776f121ddf1611606e9e65163f6f9893e,6/10(月) 20:30
theworldw,theWORLD（ザ・ワールドWeb）,チェルシーに続き、アーセナルもオシムヘン獲得レースから撤退？　高すぎる移籍金がネックでプレミア行きは消滅か,https://news.yahoo.co.jp/articles/10ce5558ba1379ea65f562322271d3b03aeceb90,6/10(月) 20:02
theworldw,theWORLD（ザ・ワールドWeb）,ウェールズのクラブが引退したベイル氏の復帰を真剣に検討中!?　「ゴルフならいつでも出かけさせてあげる」とオーナーが勧誘,https://news.yahoo.co.jp/articles/bf99d14b285f389357a7b7c2d01a1d7c6c5759ef,6/10(月) 19:31
theworldw,theWORLD（ザ・ワールドWeb）,1年で欧州復帰の可能性　CB補強必須のアトレティコはアル・ナスルのラポルト獲得を検討か,https://news.yahoo.co.jp/articles/545008c44d6877ce901f003878f6409807cef554,6/10(月) 19:00
theworldw,theWORLD（ザ・ワールドWeb）,ユヴェントスもバルサFWロッキ獲得に興味　シャビ退団で状況が変わった神童の去就はどうなる,https://news.yahoo.co.jp/articles/e21db862e2dc1102a12ab63dd4524918a2e12cf0,6/10(月) 18:30
theworldw,theWORLD（ザ・ワールドWeb）,FAカップ優勝→即解雇の過去を持つファン・ハール氏、テン・ハーグ監督の続投を求める,https://news.yahoo.co.jp/articles/f19288e39afe5081832a09c21f22ca0ddf6fc2bc,6/10(月) 18:00
theworldw,theWORLD（ザ・ワールドWeb）,シェシュコは“ハーランド級”のストライカーになるのか　今季のブンデスでギラシに次ぐ2位の決定率が示す可能性,https://news.yahoo.co.jp/articles/1c09fefcd28a6f6784d0cb7661e79842f406d091,6/10(月) 17:40
theworldw,theWORLD（ザ・ワールドWeb）,バイエルンがフラムMFパリーニャ獲得で個人合意か　交渉成立となれば1年越しの移籍実現へ,https://news.yahoo.co.jp/articles/b69815faabd784d605abf656cd688b4a0ac30b0a,6/10(月) 17:20
theworldw,theWORLD（ザ・ワールドWeb）,バイエルン退任のトゥヘル監督　マンUと交渉もプレミアリーグ復帰は叶わず,https://news.yahoo.co.jp/articles/e7314af19e4d6bbee943b377a75f2d962923401d,6/10(月) 17:10
theworldw,theWORLD（ザ・ワールドWeb）,サンチョは今夏での退団が既定路線か　マンUが指揮官の去就に関わらず売却を希望,https://news.yahoo.co.jp/articles/8d41bb28eb5bc1f5f8de2ede4ab08a5d1f5c9823,6/10(月) 17:01
theworldw,theWORLD（ザ・ワールドWeb）,今季のプレミア出場数は昨季の半分に……　アーセナルで定位置確保に悩むファビオ・ビエイラに古巣ポルトが救いの手？,https://news.yahoo.co.jp/articles/7a6dc9644a691657f5ed7dd079b7e9a0439a83ef,6/10(月) 16:31
theworldw,theWORLD（ザ・ワールドWeb）,アル・ナスルがGKシュチェスニーの獲得に向け交渉開始　ユヴェントスも売却を準備か,https://news.yahoo.co.jp/articles/06690268984ff3cfa694f51ea47aec3b67da8462,6/10(月) 16:01
theworldw,theWORLD（ザ・ワールドWeb）,ラツィオの会長が新監督について口を割る　「サッリも彼を高く評価していました」,https://news.yahoo.co.jp/articles/01799192f692191a7f12cdd79b8d00e04912ec15,6/10(月) 15:30
theworldw,theWORLD（ザ・ワールドWeb）,アメリカ代表は2026W杯で上へ行ける？　究極の腕試しとなるコパ・アメリカへ「コパ・アメリカはこのチームの成長に不可欠」,https://news.yahoo.co.jp/articles/6ed1fb7661c6c1fbc1b55a30e31aa8f70a437d10,6/10(月) 15:00
theworldw,theWORLD（ザ・ワールドWeb）,スコットランドリーグ得点王の力を示す時　EUROへ遅咲きのスコットランド代表FWシャンクランドがカギ握る,https://news.yahoo.co.jp/articles/9a256e325998e8da95d485d8a233e827d363efaa,6/10(月) 14:30
theworldw,theWORLD（ザ・ワールドWeb）,新監督の三笘起用法はいかに!?　ブライトンがザンクトパウリをブンデスリーガへ昇格させた新進気鋭の監督を招聘か,https://news.yahoo.co.jp/articles/16d01da01e6cba0716e8b5f383673e0af0f011cc,6/10(月) 12:30
theworldw,theWORLD（ザ・ワールドWeb）,無念、チェコ代表のキャプテンが自転車の転倒による怪我でEURO2024欠場を発表,https://news.yahoo.co.jp/articles/fd1788130c56ad0b0a130fec63b420ab09092f11,6/10(月) 12:20
theworldw,theWORLD（ザ・ワールドWeb）,J・コール、エデン・アザール、ウサイン・ボルトら出場　イングランドとワールド・イレブンが対戦　ユニセフのチャリティーマッチで30億円の支援集まる,https://news.yahoo.co.jp/articles/a422c388247446547ae5c8bdf5c2472497a88cb1,6/10(月) 12:02
theworldw,theWORLD（ザ・ワールドWeb）,リヴァプール元主将アラン・ハンセンが重病で入院　クラブが発表,https://news.yahoo.co.jp/articles/44f6043daa4cdec62145401bc275c379ff312209,6/10(月) 11:31
theworldw,theWORLD（ザ・ワールドWeb）,昔はクリンスマン、クローゼらがいたのに　なぜドイツからストライカーは消えたのか「衰退の原因の一つは得点力不足だ」,https://news.yahoo.co.jp/articles/109e610d689868470b34053ba21afe9cd6393cfa,6/10(月) 0:10
theworldw,theWORLD（ザ・ワールドWeb）,スパーズが5500万ポンドも投じて獲得したMFは今　モウリーニョも苦言呈した過去「彼を選手として愛しているが……」,https://news.yahoo.co.jp/articles/720e95362559d92e34cb771f11c88cc53b8ce7ea,6/9(日) 23:50
theworldw,theWORLD（ザ・ワールドWeb）,EUROを前に気を引き締めるきっかけに？　屈辱的な敗戦を喫するもMFメイヌーは前向き　「負けた後にトーナメントに出場するのは良いことだと思う」,https://news.yahoo.co.jp/articles/6eb2f2fa01928a0054f750040b7fb22d143083eb,6/9(日) 23:30
theworldw,theWORLD（ザ・ワールドWeb）,まだ23歳ながらも実力は世界トップクラス　 “世界最高のDF”へ近づくサリバが掴む確かな手応え　「私はリーグでトップ3のディフェンダーだと思う」,https://news.yahoo.co.jp/articles/c3877065c270f834a3186d6d39f80cdc05c668e6,6/9(日) 23:00
theworldw,theWORLD（ザ・ワールドWeb）,実力は年間最優秀選手賞のフォーデンよりもサカが上!?　ウォルコット氏がプレミアのウィングをランク付け,https://news.yahoo.co.jp/articles/cde99e98c5ac1bdf6707c88be0c7bc4cf9d5196d,6/9(日) 22:10
theworldw,theWORLD（ザ・ワールドWeb）,プレミア行きより “ユヴェントス愛”を貫いたデル・ピエロ　移籍の可能性があった2つのプレミアクラブとは,https://news.yahoo.co.jp/articles/894ae9ef0e00997f22ebd65570f568c362ea7f34,6/9(日) 22:01
