media_en,media_jp,title_articles,link_articles,date_original
theworldw,theWORLD（ザ・ワールドWeb）,ブライトン所属日本代表MF三笘薫にチェルシーが熱視線！　クラブ内部で高い評価と現地報道,https://news.yahoo.co.jp/articles/fd83c12bb6b20ec8cd5db31eae43dca7d8bf85a5,7/5(金) 18:30
theworldw,theWORLD（ザ・ワールドWeb）,モデルはレアル・マドリード　ギュンドアン＆クロースが説く打倒スペインに必要な勝者のメンタリティ,https://news.yahoo.co.jp/articles/2a15e847c39a1043e449455a2f5207c23b6e0292,7/5(金) 18:02
theworldw,theWORLD（ザ・ワールドWeb）,アトレティコ・マドリードFWモラタに今夏セリエA行きの可能性浮上　ACミランと2027年までの契約で合意か,https://news.yahoo.co.jp/articles/1e38ff774b80ac2ab184dc5ec627765b29dedbb7,7/5(金) 17:50
theworldw,theWORLD（ザ・ワールドWeb）,現在フリーのポッター氏が韓国代表に逆オファーと現地報道　かつてはブライトンやチェルシーを指揮,https://news.yahoo.co.jp/articles/ef4dce64371ecbf8a01fcb7406b3f81592721279,7/5(金) 17:40
theworldw,theWORLD（ザ・ワールドWeb）,マンC退団濃厚なセルヒオ・ゴメスの新天地はスペインか　争奪戦を制したレアル・ソシエダへの加入間近,https://news.yahoo.co.jp/articles/487efe92ff0e5cc0b51af968802643f5d76ae010,7/5(金) 17:30
theworldw,theWORLD（ザ・ワールドWeb）,アメリカ代表のコパ・アメリカGS敗退にカナダ代表監督も落胆　「彼らは何らかの解決策を見つけなければ」,https://news.yahoo.co.jp/articles/4c9b0eeed25e95ae2be5162f6e7de523c3843c98,7/5(金) 17:00
theworldw,theWORLD（ザ・ワールドWeb）,ユーヴェ、バイエルンと渡って再び移籍？　デ・リフトはワールドクラスDFなのか「かつて考えていたほど優れた選手なのかという疑問が」,https://news.yahoo.co.jp/articles/201e081016c8a5dcbd0a986626c11dd400eeacf6,7/5(金) 16:40
theworldw,theWORLD（ザ・ワールドWeb）,グリーズマンのレ・ブルーでの立場が怪しくなってきた？　EUROで0ゴール0アシストの現状に厳しい視線も,https://news.yahoo.co.jp/articles/d2cd43ad6c42fbbec32d9849fb3ddd0a8a5b7936,7/5(金) 16:10
theworldw,theWORLD（ザ・ワールドWeb）,去就に注目集まるカンセロはどこへ……　バルセロナに加え、古巣ベンフィカやインテルも興味か,https://news.yahoo.co.jp/articles/59d82eb21bc9d0c3c6fbc66111ce7badc8e0311a,7/5(金) 15:30
theworldw,theWORLD（ザ・ワールドWeb）,ギュンドアン、バルサの『後輩』ヤマルの弱点に言及「非常に注意が必要だが……」,https://news.yahoo.co.jp/articles/a38856495d7008cbdf921955a828dc060aee7341,7/5(金) 11:01
theworldw,theWORLD（ザ・ワールドWeb）,ロッカールームの置き手紙、16強で敗退のルーマニア代表「EURO2024で得られた経験に感謝」,https://news.yahoo.co.jp/articles/a505490e578f46e93f7001040da8661b395eda17,7/5(金) 9:30
theworldw,theWORLD（ザ・ワールドWeb）,コパ・アメリカのグループ首位通過チームは全員“アルゼンチン人指揮官”　いよいよ戦いはベスト8の舞台へ,https://news.yahoo.co.jp/articles/7a476fd170bfd94a70eb78e4921804a27fb0f4e7,7/5(金) 8:40
theworldw,theWORLD（ザ・ワールドWeb）,C・ロナウド、メッシ、デ・ブライネ、そして41歳のペペ　彼らは2026W杯にも参戦してくるか,https://news.yahoo.co.jp/articles/5506db24f0648646ed4e91ddc19f04253f29b9ad,7/5(金) 8:10
theworldw,theWORLD（ザ・ワールドWeb）,事実上の決勝戦　黄金時代を率いた元スペイン監督デル・ボスケも母国を後押し「スペインは優勝候補」,https://news.yahoo.co.jp/articles/4b147144412eeab38274733fdfa5d6a8dc3d338d,7/5(金) 7:40
theworldw,theWORLD（ザ・ワールドWeb）,開催国ドイツとの大一番を控えるスペイン　ニコ・ウィリアムズが代表監督への全幅の信頼を強調　「彼は僕をたくさん助けてくれた」,https://news.yahoo.co.jp/articles/1443cbd0316ea12d2bd56fc8848cb012c02e0238,7/5(金) 6:00
theworldw,theWORLD（ザ・ワールドWeb）,それでも期待せずにはいられない？　W杯、EUROでのC・ロナウドフリーキック成功率が“1.7%”しかない事実,https://news.yahoo.co.jp/articles/74e85cdb93b18250cade8f1f9d283d77e45a1d9e,7/5(金) 0:10
theworldw,theWORLD（ザ・ワールドWeb）,鎌田大地は「ここ数シーズンの欧州サッカー界で最高の攻撃的MFの1人」　パレスMF陣のキングになり得る日本の司令塔に溢れる称賛,https://news.yahoo.co.jp/articles/249a8f300058c120a3f8d828e15455556afd27f1,7/4(木) 23:30
theworldw,theWORLD（ザ・ワールドWeb）,イングランドはスイス戦で3バックを採用する可能性も　2トップやベリンガム&フォーデンの2シャドーなど予想されるフォーメーションは……,https://news.yahoo.co.jp/articles/4be16508dffde1a01b14596c823497da57ca5404,7/4(木) 23:00
theworldw,theWORLD（ザ・ワールドWeb）,元プレミア戦士ロンドンがコパ・アメリカで大暴れ　3試合で2ゴール1アシストを記録する34歳のストライカーがベネズエラを引っ張る,https://news.yahoo.co.jp/articles/207aaaae0ab6416c3684f618efa56cf458a8ea56,7/4(木) 22:30
theworldw,theWORLD（ザ・ワールドWeb）,レアルのターゲットにまで浮上したグエーイ　EUROで評価を上げる23歳CBは欧州ビッグクラブによる争奪戦の予感,https://news.yahoo.co.jp/articles/b77cd2fba509a364507841ca308dca11c0064adb,7/4(木) 22:00
theworldw,theWORLD（ザ・ワールドWeb）,ルーマニアがEUROで見せた復活への兆し　ドラグシン、デニス・マン、ヤニス・ハジら次はW杯を目指す戦いへ,https://news.yahoo.co.jp/articles/1c987d6f6754327625b9f305ba2768529caa0d03,7/4(木) 21:30
theworldw,theWORLD（ザ・ワールドWeb）,エデルソンはついにマンチェスター・シティを去るか　サウジのオファーに合意あれば引き止めはしない!?,https://news.yahoo.co.jp/articles/8b01028e65fbf6b76af200dc7f2742018eac70bd,7/4(木) 21:02
theworldw,theWORLD（ザ・ワールドWeb）,バルセロナが狙っていた22歳はプレミア挑戦を希望か　クリスタル・パレス、エヴァートン、イプスウィッチらが獲得に興味,https://news.yahoo.co.jp/articles/daf24e2ae61fa7fda553d8c049ea3dec90cc06e1,7/4(木) 20:31
theworldw,theWORLD（ザ・ワールドWeb）,低調なパフォーマンスが続くイングランド、元イングランド代表レジェンドが警告「このままだと敗退する」,https://news.yahoo.co.jp/articles/9b7ffe14d9bc4146d2f1a3f67db4243853f259f0,7/4(木) 20:31
theworldw,theWORLD（ザ・ワールドWeb）,ドイツ代表DFリュディガーが大一番スペイン戦へ意欲　「互角の試合になる」,https://news.yahoo.co.jp/articles/5e8d835489757bd2794d553201f775da1d1aebda,7/4(木) 20:03
theworldw,theWORLD（ザ・ワールドWeb）,スペイン代表DFククレジャ、同僚FWニコ・ウィリアムズを勧誘!?　「彼にチェルシーへ来るように言いました」,https://news.yahoo.co.jp/articles/e16190c96828df60e98af55c27eca517555f203e,7/4(木) 19:30
theworldw,theWORLD（ザ・ワールドWeb）,スペイン代表FWホセルがトニ・クロースに宣戦布告　「彼を年金生活に送り込む」,https://news.yahoo.co.jp/articles/dbdbb5f817f74fcb45a101783a770da2253f6947,7/4(木) 19:02
theworldw,theWORLD（ザ・ワールドWeb）,PSVの逸材、ベルギー代表FWバカヨコは今夏にプレミアリーグへ挑戦か　チェルシーが獲得狙う,https://news.yahoo.co.jp/articles/ac021603c9f1bee252ff027f2c3d450c09077d53,7/4(木) 18:50
theworldw,theWORLD（ザ・ワールドWeb）,トッテナムへの加入が決定したアーチー・グレイが移籍理由を語る　「家族全員がポステコグルー監督を尊敬している」,https://news.yahoo.co.jp/articles/05ce714cf7870a0a1a5422bd5d5c962e748dd20e,7/4(木) 18:40
theworldw,theWORLD（ザ・ワールドWeb）,予想外？　ブレーメンMF佐藤恵允のパリ五輪代表選出はサプライズと独紙報道,https://news.yahoo.co.jp/articles/c3b8fdafe30520c61a469704cf4c9392740a5220,7/4(木) 18:30
theworldw,theWORLD（ザ・ワールドWeb）,フラムMFパリーニャのバイエルン移籍が秒読み段階に　既にクラブ間交渉は成立,https://news.yahoo.co.jp/articles/ff5a0f92590a518f099b0f0ef403fa81fc5c48de,7/4(木) 18:00
theworldw,theWORLD（ザ・ワールドWeb）,フラムからのオファーを拒否したウィリアン　サウジやトルコのクラブからも熱視線が送られる35歳の次のキャリアは,https://news.yahoo.co.jp/articles/d6374a2c1b0ade3d58f6f6be9f7d871e0ba86062,7/4(木) 17:30
theworldw,theWORLD（ザ・ワールドWeb）,「プレミアリーグで最高の選手としてここに来たのに……」　EUROでは影が薄いフォーデンが巻き返しを誓う,https://news.yahoo.co.jp/articles/c424502f4d2ab4424401a9deacd18655d380574f,7/4(木) 16:40
theworldw,theWORLD（ザ・ワールドWeb）,ベリンガムの出場停止はむしろ良いこと!?　ハマン氏指摘「ベリンガムかフォーデンをもっと早く外すべきだった」,https://news.yahoo.co.jp/articles/8a69f74a6310dc3868ea814502eb7e54f33cd87a,7/4(木) 12:30
theworldw,theWORLD（ザ・ワールドWeb）,EURO参戦中の代表主力選手もタダ！　ビッグネーム揃いの「ゼロ円移籍」が可能なフリー選手たちは？,https://news.yahoo.co.jp/articles/3e8d14904ecc3c6c378d070fdd98d9e86cb7644a,7/4(木) 12:02
theworldw,theWORLD（ザ・ワールドWeb）,スペイン紙、久保の五輪不参加を「嬉しいニュース」と報道,https://news.yahoo.co.jp/articles/cd6041eb4a7b56c668a97887f4220ae3a4dd491e,7/4(木) 11:32
theworldw,theWORLD（ザ・ワールドWeb）,ドイツが警戒するのはヤマル、ニコだけじゃない　ドイツとの繋がりがある34歳のスペイン代表FW,https://news.yahoo.co.jp/articles/aef518dded2ac5933a07414b78c2f7bb8d27d561,7/4(木) 11:02
theworldw,theWORLD（ザ・ワールドWeb）,オランダにグループ3位通過からの優勝が見えてきた？　3発快勝のルーマニア戦は転機になるか「彼らに自信を与えるかも」,https://news.yahoo.co.jp/articles/d54b7d4e36c1b9a17b0e8bb2436f99b3dab383cc,7/4(木) 10:30
theworldw,theWORLD（ザ・ワールドWeb）,W杯、EURO本大会19試合で負けたのは1回だけ　すっかりフランス代表MF1番手になった“お守り”カンテの影響力,https://news.yahoo.co.jp/articles/a92a21167772c11dbf7f593123a733a9a0c57616,7/4(木) 9:01
theworldw,theWORLD（ザ・ワールドWeb）,セレソンにロナウジーニョ、カカー級のスターをもう一度　ギマランイスが求めるワクワク感「ヴィニやロドリゴの力で取り戻したい」,https://news.yahoo.co.jp/articles/a39f95a7a903ee396ff7278b582dc964f4e53747,7/4(木) 8:30
theworldw,theWORLD（ザ・ワールドWeb）,ブラジル女子代表のマルタが6度目の五輪出場へ　悲願の金メダルなるか!?,https://news.yahoo.co.jp/articles/a083614e0d245cb1e5eda36342735a504bf8efd1,7/4(木) 0:00
theworldw,theWORLD（ザ・ワールドWeb）,ブッフォン、トッティ、カンナバーロ、18年前のアズーリは凄かった　「今のイタリアに2006年のような才能は存在しない」,https://news.yahoo.co.jp/articles/8498c25bdbdc230c6526aa39e9fc8c857d63d97b,7/3(水) 23:40
theworldw,theWORLD（ザ・ワールドWeb）,1度PKを外したのに、PK戦1番手を務める最強メンタル　C・ロナウドの“心拍数”が証明する凄み「なぜ彼が最高の選手かが分かる」,https://news.yahoo.co.jp/articles/41898bdcb1a28f3f54d320ec6897efa4fdaca18f,7/3(水) 23:10
theworldw,theWORLD（ザ・ワールドWeb）,「フランスのディフェンスリーダーとしての地位を確立した」　アーセナルの守備の要はついにフランス代表にとっても欠かせない存在に,https://news.yahoo.co.jp/articles/cf077ef4b14b0d5c48fe4a2741d2478d23d46dec,7/3(水) 22:00
theworldw,theWORLD（ザ・ワールドWeb）,開催国アメリカがまさかのGSで消える…… コパ・アメリカで揺らいだ“黄金世代”への期待感「何も進歩していない」,https://news.yahoo.co.jp/articles/188dde8389c700e9a362a24f6e241999988a0d14,7/3(水) 21:40
theworldw,theWORLD（ザ・ワールドWeb）,ニコ・ウィリアムズへ強い関心を示すバルセロナ　資金調達のため2人の主力選手売却に動く可能性も,https://news.yahoo.co.jp/articles/deda5da3bb7d3d3ce738ccbbfb72300355acb640,7/3(水) 21:02
theworldw,theWORLD（ザ・ワールドWeb）,EURO4試合でPK&オウンゴール2発の3点のみ　流れの中から得点がないフランス代表攻撃陣は問題を抱えているのか,https://news.yahoo.co.jp/articles/daefe8d511242e680e083e1a429630e9e095b2c4,7/3(水) 20:30
theworldw,theWORLD（ザ・ワールドWeb）,華麗なMFからまさかのマッチョマンに転向して1年……　筋肉に魅了されたエジルが節目を祝う「1年間とても頑張った」,https://news.yahoo.co.jp/articles/b600650322d2f4d7538330cb56a1b951084602ea,7/3(水) 20:01
theworldw,theWORLD（ザ・ワールドWeb）,ジャカ、内転筋のMRI検査を実施も……異常なしで一安心　次戦、スイス史上初のベスト4なるか注目,https://news.yahoo.co.jp/articles/1322257f15bcda29f27885ef31093201a6150aea,7/3(水) 19:30
theworldw,theWORLD（ザ・ワールドWeb）,アーセナルがフランス代表DFジュール・クンデに接触か!?　冨安健洋のライバルがまたひとり加入の可能性,https://news.yahoo.co.jp/articles/060b321c7b391b035acc2e574042f6c5b0179084,7/3(水) 19:01
theworldw,theWORLD（ザ・ワールドWeb）,ガクポはリヴァプールでも左ウインガーがいい!?　ルーマニア戦大活躍に「クラブでも左で使え」の声,https://news.yahoo.co.jp/articles/3947f378798d20df77a519c0ea52451f92c05c9e,7/3(水) 18:30
theworldw,theWORLD（ザ・ワールドWeb）,レスターからチェルシーへの移籍が正式発表されたデューズバリー・ホールが意気込みを語る　「新シーズンの目標はタイトルを獲得すること」,https://news.yahoo.co.jp/articles/4ea7705be8a6cff2e0c82862bbb8b1c8a41a389f,7/3(水) 18:01
theworldw,theWORLD（ザ・ワールドWeb）,サウジアラビアにまたしても大物加入か！？　マルセイユFWオバメヤンにアル・シャバブ移籍の可能性浮上,https://news.yahoo.co.jp/articles/d245eafd02026c1b1aa3eae3b8f4547561c4c043,7/3(水) 17:50
theworldw,theWORLD（ザ・ワールドWeb）,チェルシーDFチルウェルに今夏退団の可能性浮上　プレミアリーグの複数クラブで争奪戦か,https://news.yahoo.co.jp/articles/79c7d2a24788be47aa619abc803eaf90e32770c4,7/3(水) 17:40
theworldw,theWORLD（ザ・ワールドWeb）,マルセイユのデ・ゼルビ新監督が早速、チーム強化のため始動　獲得の本命はメッシが絶賛したインテルの19歳か!?,https://news.yahoo.co.jp/articles/e4811e4fee75a1f6a77b7c6e4e5daa35372bd5ef,7/3(水) 17:30
theworldw,theWORLD（ザ・ワールドWeb）,骨折の音が聞こえた……　カナダ代表のブキャナンが練習中に大ケガで救急搬送,https://news.yahoo.co.jp/articles/8b8a5148ed1c71c97bc658831de8f7141d6ebb58,7/3(水) 17:02
theworldw,theWORLD（ザ・ワールドWeb）,侮辱され巨大な横断幕が張られたマルキージオ氏　ユヴェントスの過激ファンに対し正論で反撃,https://news.yahoo.co.jp/articles/2cf477f8197bf294ec4f13082b57ca2f8791340a,7/3(水) 16:31
theworldw,theWORLD（ザ・ワールドWeb）,ベンフィカがジョアン・フェリックスの復帰を画策か　バルサ退団が決まった24歳の将来はどうなる,https://news.yahoo.co.jp/articles/37309be053882ab757171aacaaafb5a4252f2058,7/3(水) 15:30
theworldw,theWORLD（ザ・ワールドWeb）,パリ五輪に挑むU-23日本代表の18名が発表　2008年北京五輪同様にOA枠は使用せず　鈴木彩艶や松木玖生は招集外に,https://news.yahoo.co.jp/articles/ca466d1a034242555a1fe7a5385375c083a5f157,7/3(水) 14:30
theworldw,theWORLD（ザ・ワールドWeb）,まるでC・ロナウドになった気分だった？　イングランドを救ったベリンガムが劇的バイシクル弾を振り返る,https://news.yahoo.co.jp/articles/663ef01ff043e406fd729d2a4a5eb12f11d1dd43,7/3(水) 11:01
theworldw,theWORLD（ザ・ワールドWeb）,プレミア、ブンデス、セリエAからのオファーを認める　ACミランも興味を示すチェルシーFWブロヤはどこへ行くのか……,https://news.yahoo.co.jp/articles/931287af37705b0ec01aa9bc982668bae611e1c7,7/3(水) 10:01
theworldw,theWORLD（ザ・ワールドWeb）,ますます分からなくなったイングランド代表のベストイレブン　フォーデン、サカ、ケインら難しい起用法,https://news.yahoo.co.jp/articles/4bd83bc43a1d475d5d5e4b4ab462ff39ae43ff02,7/3(水) 8:40
theworldw,theWORLD（ザ・ワールドWeb）,バイエルン退団が濃厚なデ・リフト　マンチェスター・ユナイテッドへの移籍を熱望か,https://news.yahoo.co.jp/articles/60345f798c24e56bd2427c2942f7797bd22d9d00,7/3(水) 8:00
theworldw,theWORLD（ザ・ワールドWeb）,ロドリはまだ過小評価されている？　スペイン代表でも変わらぬ存在感を見せる世界最高の守備的MF,https://news.yahoo.co.jp/articles/7cd2742e69c84c103ffc0aba44664b30dd675713,7/3(水) 7:03
theworldw,theWORLD（ザ・ワールドWeb）,トルコはCKからデミラルが2ゴール　今大会のダークホース、オーストリアの猛攻に耐えオランダが待つベスト8へ進出,https://news.yahoo.co.jp/articles/7c55ff0f85735e5303612403f0a70d1c78d32290,7/3(水) 6:04
theworldw,theWORLD（ザ・ワールドWeb）,今季躍進のボローニャは主力を引き留められるか　チアゴ・モッタ監督に続きザークツィー、カラフィオーリも引き抜きの可能性,https://news.yahoo.co.jp/articles/99e5214623352303ab4eb1a43e1762346baecc04,7/3(水) 6:00
theworldw,theWORLD（ザ・ワールドWeb）,欧州制覇へ向けて「決定力不足」の解消は必須か　オランダ、8強進出も明確な課題が,https://news.yahoo.co.jp/articles/7db032b67aa8ba6bff176aca65ef9a60e80c7d12,7/3(水) 3:17
theworldw,theWORLD（ザ・ワールドWeb）,デ・ブライネのベルギー代表キャリアはこれが最後なのか　黄金世代でも届かぬ頂点「35歳でW杯はあり得ないことではないが……」,https://news.yahoo.co.jp/articles/f8f58f2de4937ab79f6357c328f2303d5667737e,7/2(火) 23:50
theworldw,theWORLD（ザ・ワールドWeb）,もうアルゼンチンはメッシに依存していない　スカローニが作ってきた新時代への道「メッシ依存のイメージを消し去った」,https://news.yahoo.co.jp/articles/0ba90c23c52d8fb3e3297c3e1a7ab2757473e59e,7/2(火) 22:40
theworldw,theWORLD（ザ・ワールドWeb）,問題だらけだったイタリア代表の敗北劇　クオリティ低下した中盤、キエーザ頼みのサイドなど2026W杯へ課題多く,https://news.yahoo.co.jp/articles/80bc9daf4713971d14186e4bdd99a317e7174c3c,7/2(火) 21:20
theworldw,theWORLD（ザ・ワールドWeb）,強かったメキシコはどこへ……　ワールドカップ16強常連だった国の現在,https://news.yahoo.co.jp/articles/785aaea3fb5b43b489bc0a84e893c6145571cec5,7/2(火) 19:31
theworldw,theWORLD（ザ・ワールドWeb）,レアル・ソシエダDFル・ノルマンはアトレティコ移籍へ　EURO2024ではスペイン代表の主力として活躍中,https://news.yahoo.co.jp/articles/1dc8a0228a57d256987c08766a98ddea14e1994d,7/2(火) 19:00
theworldw,theWORLD（ザ・ワールドWeb）,「ミスティアーノ・ペナウド」と嘲笑した『BBC』にジョン・テリーら怒り「恥ずべきことだ」「サッカー解説のTikTok化」,https://news.yahoo.co.jp/articles/6471b745102641d4d3e2f519a31d192a45d54367,7/2(火) 18:30
theworldw,theWORLD（ザ・ワールドWeb）,トリノで大ブレイクのイタリア代表DFボンジョルノはナポリ移籍か　セリエAのビッグクラブ間で争奪戦と報道,https://news.yahoo.co.jp/articles/e5cae50fbc2d17a188ba341f2ebd5bb30bce2874,7/2(火) 18:30
theworldw,theWORLD（ザ・ワールドWeb）,バルセロナからチェルシーへの移籍が決定したギウが心境を語る　「幼い頃からプレミアリーグでプレイすることが夢だった」,https://news.yahoo.co.jp/articles/3c57d9cb9e5b4386814f2953ec8aa9583c7ded90,7/2(火) 17:31
theworldw,theWORLD（ザ・ワールドWeb）,EUROでも対人戦は最強クラス　ドイツの守備を束ねるリュディガーは現世界最高のDFか「選手として最高の時期を過ごしている」,https://news.yahoo.co.jp/articles/4bd9e136426e024501a7c628ae792ff4b0e60923,7/2(火) 14:30
theworldw,theWORLD（ザ・ワールドWeb）,2014W杯から10年経った今もコロンビアの柱はハメス　コパ・アメリカで見せる輝き「特別に注目されるべき」,https://news.yahoo.co.jp/articles/aaecdb77e573b36444cd03c1211b72897037c613,7/2(火) 13:01
theworldw,theWORLD（ザ・ワールドWeb）,休暇を楽しむバロテッリだが……　スターの宿命か、泥酔し転倒する姿が批判の的に,https://news.yahoo.co.jp/articles/a93692565299086220b9adf66ce9f890efb0fe9f,7/2(火) 9:01
theworldw,theWORLD（ザ・ワールドWeb）,ブライトンが19歳の右ウインガーを獲得　三笘と共に手に負えない存在となれるか!?,https://news.yahoo.co.jp/articles/33f620956599d46d6944e1601a8c1759bec79818,7/2(火) 8:30
theworldw,theWORLD（ザ・ワールドWeb）,ムバッペがレアルの公式サイトに登場！　白いユニフォーム姿をお披露目,https://news.yahoo.co.jp/articles/a6d790e31ab52f86d6142f66a9b5dbc0051939ce,7/2(火) 7:32
theworldw,theWORLD（ザ・ワールドWeb）,C・ロナウドの悔し涙にチームが奮起！　死闘の末のPK戦でポルトガルの守護神が神がかりセーブを連発,https://news.yahoo.co.jp/articles/95aa0c7c2c6afe75470b6550a477266ef9923651,7/2(火) 7:22
theworldw,theWORLD（ザ・ワールドWeb）,ルカクは世界最強のCF!?　レジェンドOBのパパン氏がACミランには彼が必要と語る,https://news.yahoo.co.jp/articles/55b7650c0ff884db1edf119107522212de731f4f,7/2(火) 6:30
theworldw,theWORLD（ザ・ワールドWeb）,スイスに敗れイタリアのEURO2024敗退に落胆するドンナルンマ　「酷い試合をしてしまった。我々は破壊された」,https://news.yahoo.co.jp/articles/9097d39e9439a690a3bb38fbeeb84b9f9c598e41,7/2(火) 6:00
theworldw,theWORLD（ザ・ワールドWeb）,コロ・ムアニ弾が決勝点呼び込んだ　ベルギーとの強豪対決制しフランス8強進出！,https://news.yahoo.co.jp/articles/3ed55830263f2f10337d87d6bf144c9ec73b0e72,7/2(火) 3:10
theworldw,theWORLD（ザ・ワールドWeb）,人口“350万人”のウルグアイはなぜこんなにサッカーが強いのか　3億人超えのアメリカでも届かぬ実力「フットボールの血が流れている」,https://news.yahoo.co.jp/articles/80bb39bee3c705148653eb9ac485a5132564a6dc,7/2(火) 0:10
theworldw,theWORLD（ザ・ワールドWeb）,鎌田大地のC・パレス移籍で「鳥縛り」話題に　これまで在籍クラブのエンブレムはすべて“鳥”,https://news.yahoo.co.jp/articles/9c1b6f544dca5f9b58b9431419b7a2e424df2ebd,7/1(月) 23:30
theworldw,theWORLD（ザ・ワールドWeb）,開催国ドイツ撃破へ、スペインのファビアン・ルイス「歴史的なことを成し遂げたい」,https://news.yahoo.co.jp/articles/e672e08471ae1dc3e0bc9775bad1d47c809afb52,7/1(月) 23:10
theworldw,theWORLD（ザ・ワールドWeb）,「派手さこそないものの……」　今大会屈指の強さを誇るスイスをピッチ後方から支える3人のリーダー,https://news.yahoo.co.jp/articles/5fc67503e6a9cc70d6888bfba3207977fa2e0267,7/1(月) 23:00
theworldw,theWORLD（ザ・ワールドWeb）,ベリンガムの劇的ゴールでイングランドの優勝の可能性がみえた!?　ファーディナンド氏がトーナメントを勝ち上がる秘訣を語る,https://news.yahoo.co.jp/articles/70f6a8cbe96278ea0602f8694ed6ed45059ef67f,7/1(月) 22:30
theworldw,theWORLD（ザ・ワールドWeb）,決勝点アシストのイヴァン・トニーはサウスゲイト采配に不満でいっぱい　「かなりウンザリしていたのは間違いない」,https://news.yahoo.co.jp/articles/f9e6ff5e3745fb82b01a03e114b5c87afba09677,7/1(月) 22:00
theworldw,theWORLD（ザ・ワールドWeb）,ドイツとの一戦は “事実上の決勝戦”か　スペイン代表指揮官は開催国撃破に自信　「我々は世界最高のチームと選手たちを擁している」,https://news.yahoo.co.jp/articles/b28f865783c79748867ae3d78bf058de601af403,7/1(月) 21:00
theworldw,theWORLD（ザ・ワールドWeb）,EURO2024最大の問題点は「落雷」か　デンマーク監督が語った心停止→足切断の恐怖エピソード,https://news.yahoo.co.jp/articles/b550c3cc172410618224fe04b0205ea155a002cd,7/1(月) 20:01
