media_en,title_articles,link_articles,date_original
courrier,「どんな代償を払ってもウクライナに平和を」という主張は本当に正しいのか,https://news.yahoo.co.jp/articles/eca4a2ecd87d1a87ddb05113e196a04c796c3219,9/6(水) 11:30
courrier,海外メディアの評価「実写版『ONE PIECE』は大惨事を免れた」,https://news.yahoo.co.jp/articles/a62e2ad405bb1de71cfc9abe231660358b1cc51d,9/6(水) 11:30
courrier,イタリア　ドロミテ渓谷の夏休み,https://news.yahoo.co.jp/articles/26dbb85a08a643279e8c91830b83bb8d1b72687b,9/5(火) 21:31
courrier,プーチンが世界中に潜伏させていた「スリーパーセル」を起動しはじめた,https://news.yahoo.co.jp/articles/43b1f8204ffb18c982215c41afa627a0c5020719,9/5(火) 18:32
courrier,英紙が富士山の“オーバーツーリズム”と“弾丸登山”を問題視「ここは神聖な山なのに…」,https://news.yahoo.co.jp/articles/d14efce09c0dbb8837c509cc1d7d7d506884d34a,9/5(火) 18:31
courrier,こどもの疑問に“マジ回答”「本を黙読しているときに聞こえる頭のなかの声は何？」に専門家が本気で答えたら…,https://news.yahoo.co.jp/articles/2ec183b73de631a8a6df6d5ee9cef728f6054247,9/5(火) 18:15
courrier,コロナ再感染はどれほどヤバいのか？　重症化や後遺症リスクを米国の専門家に聞いた,https://news.yahoo.co.jp/articles/6ac91008bba370fea3eacb0f96aa509778b7d797,9/5(火) 18:00
courrier,米国の長い夏休み　子供たちの過ごし方,https://news.yahoo.co.jp/articles/0ea2a98d4c4c8624e9267e23a5ccdac279459a5d,9/5(火) 9:57
courrier,北条司が仏紙に告白「漫画を書きはじめたのはお金のためでした」,https://news.yahoo.co.jp/articles/4bb90436d2f3536419a459cec86e2ccd60ad13b8,9/5(火) 6:03
courrier,思想家が言った「恐怖を感じることをしなさい」とはどういう意味か？【英語で学ぶ名言】,https://news.yahoo.co.jp/articles/b0dcf6687c9405ebd1697c1f40a1a81abb32691c,9/4(月) 18:00
courrier,「目眩がする…」　2万匹のネズミと裸足で触れ合う“ネズミランド”と化した寺院の光景　インド,https://news.yahoo.co.jp/articles/435a15a8222994f637fbbe0ff5b79e07c5ef2563,9/3(日) 10:51
courrier,フルートを吹く女性の譜面台が“勝手に”動く…　何度も邪魔し続けていた犯人の正体,https://news.yahoo.co.jp/articles/84cf1bab28bcfb2ffc3415e6a19943ff82cad0b3,9/2(土) 23:39
courrier,中国のさびれた街が “新たな経済モデル”で「世界有数のテック都市」になるまで,https://news.yahoo.co.jp/articles/1a462f2e9f8e0188462b5db2230e956a8bb96fcc,8/31(木) 12:00
courrier,人権活動家が語った「幸せはゴールではない」とはどういう意味か？【英語で学ぶ名言】,https://news.yahoo.co.jp/articles/f879eac3887bd36a1ad8b4aa06dd6f1ed8080d24,8/28(月) 18:00
courrier,海外で展開する製品・サービスやビジネスモデルの仮説はこうして構築しよう,https://news.yahoo.co.jp/articles/a0470b70d7354264f2fb743b071672f221df0bf0,8/28(月) 14:10
courrier,豪雨の生中継中にレポーターを襲った悲劇　水のなかへ消えた瞬間をカメラが捉えた,https://news.yahoo.co.jp/articles/bc0d3c652e03db2346a05c387da0d5391be94efe,8/27(日) 11:10
courrier,なぜ生物のなかで“人間だけが老いる”ようになったのか　「老化」が持つ重要な役割,https://news.yahoo.co.jp/articles/4022f219e414225c4179b592e1c2769dabc0308a,8/26(土) 22:00
courrier,スペイン北部バスク地方で出会った不思議なスポーツ,https://news.yahoo.co.jp/articles/3e950eda0b96592259ddee73bbaa4056974de9a3,8/23(水) 10:06
courrier,空港でスーツケースを待っていたら現れた“すばやく動く黒い物体”にその場が騒然,https://news.yahoo.co.jp/articles/fd8d82b153708e7d3c5d20f0136bdff61c100a42,8/22(火) 9:55
courrier,レゲエの神様が語った「音楽の良いところは痛みを感じないところ」とはどういう意味だったのか,https://news.yahoo.co.jp/articles/f54b58f9e17bf2ffda7fd9537286e2543fb4a3f1,8/21(月) 23:20
courrier,初めての「海外進出」の際に注意すべき3つのポイント　提携パートナーはこう選べ！,https://news.yahoo.co.jp/articles/e3eb741dd7220900bcb4d92c9f005b6f53cdc813,8/21(月) 14:10
courrier,「人間のお手本だ！」　危険を犯して犬を救助する勇敢な少年2人の姿に絶賛の声,https://news.yahoo.co.jp/articles/31f6b8bb7baa6ef6eab00771e44bb1251f38b5de,8/20(日) 15:15
courrier,不倫に裏切り…宿敵「ナチス戦犯」をスパイとして利用したイスラエル諜報機関の恐るべき手口,https://news.yahoo.co.jp/articles/9ec315161cae7e20c9ae947984a2e63d0076e8aa,8/20(日) 10:30
courrier,手のひらに“最も便利なタトゥー”を入れた男性　その奇妙なアイデアに「なぜ」「どうして」と戸惑う声,https://news.yahoo.co.jp/articles/33f8165180fc8f7074e2d1db76dd030cbbd965b7,8/20(日) 9:20
courrier,世界で精子の減少が止まらない理由──著名な学者が「1年で1%減っていく」と警鐘を鳴らす根拠,https://news.yahoo.co.jp/articles/a5f7d19448952aa8a6981f2098f3a765468cd86d,8/20(日) 9:00
courrier,約200万円かけて「コリーになった日本人」に海外メディア読者が衝撃を受ける,https://news.yahoo.co.jp/articles/74757c8286900a6121ea24a317d5e231396bd50c,8/19(土) 13:42
courrier,人間の目には見えない「透明マント」でネット上の画像をAIから守る技術がすごい,https://news.yahoo.co.jp/articles/fe32e5284fcae82e6fc922885a7013dae10bd03e,8/18(金) 8:30
courrier,レンジャーズ球場で大谷選手のホームランを見る【America’s Favorite Pastime：前編】,https://news.yahoo.co.jp/articles/76d5de67da85e33b3836527c670a85186babf67d,8/18(金) 7:06
courrier,ニック・ボストロム「意識を持っていようといまいと、AIが人類を滅ぼす危険性はある」,https://news.yahoo.co.jp/articles/63879d82ce066d10ea0fea06355f36e1d2b02882,8/16(水) 12:00
courrier,フライトキャンセルの知らせを受けた女の子の反応がまるで映画『エクソシスト』の世界,https://news.yahoo.co.jp/articles/3a8e2b762b7975e0e8f3b27449cb1d9e3daa1c68,8/14(月) 21:13
courrier,「人間の愚かさには限りがない」と諦めれば、怒りを鎮めることができる【英語で学ぶ名言】,https://news.yahoo.co.jp/articles/43b805898786479f84e22a211bd075765ad0c68e,8/14(月) 18:06
courrier,「全国民の恥だ」中国の世界遺産で“杖を振り回して殴り合い”の大ゲンカが勃発　非難とともに「あきらめの声」も,https://news.yahoo.co.jp/articles/756b9dcc13ce66e290e14e90f2a32d245290f644,8/13(日) 11:05
courrier,デリバリーの配達員が、信号待ちのあいだに取った「衝撃の行動」　その真実を巡って議論が勃発,https://news.yahoo.co.jp/articles/c3132a1eac5627876515e4a76a170ce40b35da90,8/12(土) 15:28
courrier,バルセロナでおいしいパエリアを求めて,https://news.yahoo.co.jp/articles/4564d67139c0f544e992b0622e89b5e004d0a9d2,8/12(土) 10:36
courrier,映画『バービー』のヒットにあやかって葬儀屋が売り出した“特注の棺”が話題に　宣伝文句は「バービーのようにお休み」,https://news.yahoo.co.jp/articles/cf6fc66bb284681c7d0a8a2651ab73beb1abcce4,8/11(金) 22:46
courrier,「寄り道」が多くても大丈夫。ウガンダ在の社会起業家、仲本千津さんが若者に送るエール,https://news.yahoo.co.jp/articles/eafee5151e88d9b6af8ca19eb78a9d73c6d16fbf,8/11(金) 21:00
courrier,がん治療支援ベンチャーキャピタルを立ち上げたスティーブ・ジョブズの息子リード・ジョブズとは,https://news.yahoo.co.jp/articles/1de9877aff458ec9162cc2b095164c4339f843a2,8/11(金) 15:00
courrier,Yコンビネーター出身者が活躍するリップリングが人事業務を一括化する,https://news.yahoo.co.jp/articles/60f85376e6a2ba9683cdab50c056d11349c8e362,8/11(金) 11:45
courrier,祖国でも日本でも「希望を踏みにじられる若者」を救いたい…在日ミャンマー人が広げる支援の輪,https://news.yahoo.co.jp/articles/a3f98c039144a74018c5f51acc8a92629b319d3d,8/10(木) 17:30
courrier,日本から消えてしまった「発展、進歩、進化」という言葉　元THE BOOM宮沢和史がそれを良いと思う理由,https://news.yahoo.co.jp/articles/95168c8e52d4d9a904417a3db645bb4c7af9cd86,8/10(木) 12:50
courrier,学習意欲を高めてくれる言葉,https://news.yahoo.co.jp/articles/548067168bdf137b177a1ea973d6d1a0ab0c595b,8/9(水) 21:30
courrier,食事で感じる多文化国家インドの面白さ,https://news.yahoo.co.jp/articles/248bc726900a93aafb2b0a4a30f43d77138c5af2,8/7(月) 22:31
