media_en,media_jp,title_articles,link_articles,date_original
ksbv,KSB瀬戸内海放送,倉敷市の20代女性職員を停職６か月の懲戒処分　酒を飲んだ状態で車を運転し物損事故,https://news.yahoo.co.jp/articles/d5cd2c99ebc2538069814ae529db5f68278d127e,12/27(水) 13:34
ksbv,KSB瀬戸内海放送,JR瀬戸大橋線の久々原駅で普通列車がオーバーラン　乗客約60人にけがなし　JR西日本,https://news.yahoo.co.jp/articles/bbb81f7c2db2bfe0244b8ea49ec71e325bca9739,12/27(水) 13:07
ksbv,KSB瀬戸内海放送,岡山市の建設会社の元社長を不起訴に　社会福祉法人の役員選任めぐる贈収賄事件で逮捕　福岡地検,https://news.yahoo.co.jp/articles/42247614747fb0000032739d7740144ad460afe3,12/27(水) 12:07
ksbv,KSB瀬戸内海放送,「また帰ってきて」電柱に作られたコウノトリの巣を保存へ　香川・まんのう町,https://news.yahoo.co.jp/articles/c97715c2d01eb03c22ccddab21ad3b95065569a8,12/27(水) 11:37
ksbv,KSB瀬戸内海放送,大型車の「駐車1時間まで」区画を設置　山陽道の吉備SAで実証実験 ドライバーの休憩機会の確保へ　岡山,https://news.yahoo.co.jp/articles/24f6a628b3002e3e403765fc2816cc64525e3678,12/27(水) 10:51
ksbv,KSB瀬戸内海放送,自転車の66歳男性が軽自動車にはねられ死亡　岡山・倉敷市の国道,https://news.yahoo.co.jp/articles/35a7007b02636bc4997a9191430ea5897faf393f,12/27(水) 9:07
ksbv,KSB瀬戸内海放送,「祝い肴三種さえあればOK」おせち料理の始まりや食材の願掛けなど　専門家に聞いてみた【みんなのハテナ】,https://news.yahoo.co.jp/articles/774cad6d3a7905c186605408c830b5bf6d919f0d,12/26(火) 18:00
ksbv,KSB瀬戸内海放送,高松−羽田線　年末年始の予約状況（12月25日現在）全日空は前年上回る予約率,https://news.yahoo.co.jp/articles/814ac422bba6e457a9d0914cafed5fe9e943c42c,12/26(火) 17:52
ksbv,KSB瀬戸内海放送,屋島山上で自動運転バスの実証調査へ　地域公共交通の持続可能性確保に期待　高松市,https://news.yahoo.co.jp/articles/3becd86888b4d7e7ed576f2b0218409edda9bdf4,12/26(火) 17:19
ksbv,KSB瀬戸内海放送,直島の海岸に漁船が乗り揚げ　底引き網のローラーに巻き込まれ66歳の船長が死亡　香川,https://news.yahoo.co.jp/articles/9484f4a585b5f75754935add06b1a6da1fcd05c0,12/26(火) 17:11
ksbv,KSB瀬戸内海放送,年末年始のセールに向けデパートで福袋の準備進む　菅井八段と対局できる「体験型」の福袋も　岡山市,https://news.yahoo.co.jp/articles/57432526c483c3e0dd9100eda7f2468a629cbcdb,12/26(火) 16:18
ksbv,KSB瀬戸内海放送,水島臨海鉄道でラッピング列車の出発式　倉敷市に工場がある化学メーカーの「脱酸素剤」をPR　岡山,https://news.yahoo.co.jp/articles/b1e80fe70e7cf0910c398e9c603a22f4b9217f87,12/26(火) 16:16
ksbv,KSB瀬戸内海放送,介護老人福祉施設等での高齢者への虐待件数が過去最多　香川県が2022年度の対応まとめ,https://news.yahoo.co.jp/articles/c2a78e4d724eebaf67251194535f4c60ffc80ed2,12/26(火) 15:12
ksbv,KSB瀬戸内海放送,豊島の太陽光発電所を巡る裁判　撤去を求めた住民側の訴えを退ける判決　高松地裁,https://news.yahoo.co.jp/articles/22817eef4c75907abf1e0cf0f51b20cb30477d5f,12/26(火) 13:20
ksbv,KSB瀬戸内海放送,小学校の危険な通学路　対策が必要な1475カ所の約9割で安全対策を完了　香川県,https://news.yahoo.co.jp/articles/798092be8473f026f020aed1bb88281ba42633fa,12/26(火) 12:40
ksbv,KSB瀬戸内海放送,JR高松駅ビル「TAKAMATSU ORNE」開業日は2024年3月22日　ミスドやバーガーキングなど出店発表,https://news.yahoo.co.jp/articles/d7038de78c1918ed3b08ae1706079861270fbc3c,12/26(火) 11:09
ksbv,KSB瀬戸内海放送,就実短期大学が2025年度から学生募集を停止へ　近年は急速に志願者減少し定員割れ続く　岡山市,https://news.yahoo.co.jp/articles/b43a23540a9a8f41d8ef7c1249bfd070f73d3382,12/25(月) 18:01
ksbv,KSB瀬戸内海放送,減便続くJR赤穂線　運行本数をコロナ禍前に戻すようJR西日本に要望　岡山県と沿線の3市,https://news.yahoo.co.jp/articles/7fc29238f6eaa77bec20fcc6459b5b8e071be6a4,12/25(月) 17:31
ksbv,KSB瀬戸内海放送,浄水場から目標値超の化合物が検出された原因究明へ　吉備中央町が有識者委員会を設置　岡山,https://news.yahoo.co.jp/articles/390c092432f06d966ce355c125215c3d82264334,12/25(月) 17:18
ksbv,KSB瀬戸内海放送,香川県ブランド米「おいでまい」に別品種が混入　一部は学校給食として販売　苗配布時に間違ったか,https://news.yahoo.co.jp/articles/75c22e8184b5dc262bed3646c80571b8cd6f0f94,12/25(月) 17:00
ksbv,KSB瀬戸内海放送,自転車の小2男児　軽自動車にはねられ重体　軽自動車運転の女（77）を現行犯逮捕　岡山・倉敷市,https://news.yahoo.co.jp/articles/d1e3e0b787482648f0ce4da69111369cc173a44a,12/25(月) 16:55
ksbv,KSB瀬戸内海放送,ダイハツ出荷停止問題　岡山県の取引企業は80社　東京商工リサーチが調査,https://news.yahoo.co.jp/articles/93735a5e3b03df874c2ac209904a034c9ac18b68,12/25(月) 16:22
ksbv,KSB瀬戸内海放送,岡山市消防局が24時間対応の救急隊を増やす　救急出動の増加を受けて体制強化,https://news.yahoo.co.jp/articles/02e03a981a77affb1e99acd04b12e5c2f8f0e795,12/25(月) 15:21
ksbv,KSB瀬戸内海放送,新年に向け栗林公園に高さ約2mの門松が　元日は入園料が無料に　高松市,https://news.yahoo.co.jp/articles/b3177e50ce8f8e774e26dde03d70d0cbb3dd0722,12/25(月) 15:11
ksbv,KSB瀬戸内海放送,防衛力強化へ「特定利用空港・港湾」選定へ…香川県は「高松港」が候補地に,https://news.yahoo.co.jp/articles/de8bef3eb7ebc46491ca43795833c1e13385370d,12/25(月) 14:40
ksbv,KSB瀬戸内海放送,岡山市が公式LINEに「スポット検索」機能を追加　ペット情報の発信も,https://news.yahoo.co.jp/articles/e051848e18304f011615e5a69f638ff772ab7242,12/25(月) 14:04
ksbv,KSB瀬戸内海放送,部活動を指導する先生向けの研修会　ウォーミングアップなどで使える体の動かし方学ぶ　香川,https://news.yahoo.co.jp/articles/9fcfd11666cceddb46c405b5ac8d2aa40efd5a8d,12/25(月) 13:53
ksbv,KSB瀬戸内海放送,歌手・手島章斗さんが一日鉄道警察隊長に　犯罪や事故に巻き込まれないよう注意呼び掛け　岡山県警の鉄道警察隊,https://news.yahoo.co.jp/articles/11e35bef4fa0b0e1501963e8e222e21326857c26,12/25(月) 11:56
ksbv,KSB瀬戸内海放送,島の支援学校に校訓碑などを寄贈　小豆島ライオンズクラブ　香川県,https://news.yahoo.co.jp/articles/59f82aa8122f296dcca0914819107242951e0dee,12/25(月) 11:40
ksbv,KSB瀬戸内海放送,高校応援団らが演舞やダンスを披露　特別支援学校の生徒との合同ステージも　香川,https://news.yahoo.co.jp/articles/ee17b786067f74d47a5052d7275fe62675458211,12/25(月) 11:36
ksbv,KSB瀬戸内海放送,障害者福祉施設の職員らによる虐待　2022年度は過去最多の8件　香川県,https://news.yahoo.co.jp/articles/95f7aaf5c80006cfc0845d328ec57a411452736b,12/25(月) 11:25
ksbv,KSB瀬戸内海放送,両親と同居の自宅に放火か　26歳の女を逮捕　壁や天井焼けるもけが人なし　香川・土庄町,https://news.yahoo.co.jp/articles/7811cfb7b525da0735824110fd868081e86aee97,12/25(月) 8:48
ksbv,KSB瀬戸内海放送,全国高校駅伝　男子の倉敷連覇ならず2位,https://news.yahoo.co.jp/articles/43ab54570245f0dc3dbbdb30e96c0524da1135ba,12/24(日) 15:32
ksbv,KSB瀬戸内海放送,さぬきこどもの国でサンタクロースを探すイベント　高松市,https://news.yahoo.co.jp/articles/cf5de5d7856be05f878ca0164d1b19f5d581b2d1,12/24(日) 12:53
ksbv,KSB瀬戸内海放送,井原市の駐在所で放火か？オートバイなど焼ける　岡山・井原市,https://news.yahoo.co.jp/articles/1101a19a6b811acfaa7e2d14cbb55ac9808a5427,12/24(日) 12:33
ksbv,KSB瀬戸内海放送,2歳男児が車の窓ガラスに首を挟まれ意識不明の重体　香川県,https://news.yahoo.co.jp/articles/c2fca5130608b0f977d8c688895b96942432ffe2,12/24(日) 11:57
ksbv,KSB瀬戸内海放送,岡山県総合グラウンドのクリスマスマーケットにぎわう,https://news.yahoo.co.jp/articles/a1e1a7082256073f34e8fe43cbc4ce986e264702,12/24(日) 11:42
ksbv,KSB瀬戸内海放送,「頼まれてやった」容疑者の男の1人が容疑認める　倉敷夫婦殺傷事件,https://news.yahoo.co.jp/articles/8ef5c2ac335651f678062d6681b23ca914fd49ba,12/23(土) 17:03
ksbv,KSB瀬戸内海放送,マスキングテープでクリスマスツリー　高松市,https://news.yahoo.co.jp/articles/5ea25150e58270637b54d58df9a7e0aee1d6dcde,12/23(土) 16:56
ksbv,KSB瀬戸内海放送,田村神社で人形供養祭　高松市,https://news.yahoo.co.jp/articles/749c1a7b0d325c24c32a0aaf62ac6fada80c1626,12/23(土) 12:31
ksbv,KSB瀬戸内海放送,児童養護施設にサンタがやってきた！　岡山市中区,https://news.yahoo.co.jp/articles/1f5128efcd6c09755380e81d12e62ff00fcb8d71,12/23(土) 11:29
ksbv,KSB瀬戸内海放送,仏壇の線香が原因か　住宅で障子や畳が焼ける　香川・まんのう町,https://news.yahoo.co.jp/articles/2815036c0793031e705a71f07c6992cdba20864b,12/23(土) 10:34
ksbv,KSB瀬戸内海放送,山本由伸投手がドジャースへ　地元・備前市から祝福の声　少年時代の監督「寒いのが苦手だからヤンキースは無いと思ってた」,https://news.yahoo.co.jp/articles/4966180e99c4413067783036b15d0716a4a2f0db,12/22(金) 18:34
ksbv,KSB瀬戸内海放送,倉敷市夫婦殺傷事件　家族間に金銭的トラブルか　殺人未遂容疑の長男ら送検　岡山,https://news.yahoo.co.jp/articles/f58c14ce18a258680093dbdf7a3a5887074959f9,12/22(金) 17:54
ksbv,KSB瀬戸内海放送,「個人情報を漏えいした」とDV被害女性が町を訴えた裁判　和解が成立　香川・三木町,https://news.yahoo.co.jp/articles/20c9da868c0a23b7f945eb296054574c3a9daaf6,12/22(金) 17:41
ksbv,KSB瀬戸内海放送,香川県の民間企業　2023年冬のボーナス見込み額平均52万5000円　前年比1万4000円増加見込み,https://news.yahoo.co.jp/articles/88be52faa5f837239a21c161ef981c5f6c9ec04c,12/22(金) 17:12
ksbv,KSB瀬戸内海放送,香川県　2024年度の予算要求額　約4876億円　前年度を約6億8千万円下回る,https://news.yahoo.co.jp/articles/1d19384ca2d2430e8380a852dd0c32d2865cc16b,12/22(金) 17:06
ksbv,KSB瀬戸内海放送,再犯率は47.9％…背景には「生きづらさ」　高松市で再犯防止シンポジウム「出所者の生きづらさは私たちの想像の外にある」,https://news.yahoo.co.jp/articles/89c57b72d36b4848a2ca6040a3db189db1e24953,12/22(金) 16:33
ksbv,KSB瀬戸内海放送,岡山市の新アリーナ財政負担などについて知事「今の状況で市に返答できない」,https://news.yahoo.co.jp/articles/7c830c4f66236fad4f416dd66966df18c6595465,12/22(金) 16:10
ksbv,KSB瀬戸内海放送,香川県の統一水道料金　高松市の料金体系を軸に検討へ　2028年度スタートめざす,https://news.yahoo.co.jp/articles/21dfb28adcc08cdb6949579bd95ed0158655e05c,12/22(金) 16:01
ksbv,KSB瀬戸内海放送,JR西日本　雪の影響で22日から23日にかけて運転見合わせ　岡山は因美線・伯備線など【15時50分現在】,https://news.yahoo.co.jp/articles/ba95e084fb6f02f2be4773175464b4baca604056,12/22(金) 15:40
ksbv,KSB瀬戸内海放送,あすから冬休み！　多くの小中学校で終業式　岡山,https://news.yahoo.co.jp/articles/fe88ce3b6f2a137de637c015afafbe61b941418c,12/22(金) 15:31
ksbv,KSB瀬戸内海放送,この1年で最もチョーケシにしたいことは？　2023年の「今年の妖怪」も発表　小豆島,https://news.yahoo.co.jp/articles/b080c56ca9b6779f72faaf1e2e27795baaf42593,12/22(金) 14:42
ksbv,KSB瀬戸内海放送,障害者相談支援事業などで消費税未納　委託した高松市が1.2億円を支払いへ,https://news.yahoo.co.jp/articles/ed842825924c10440f4a877b11401f58f55c4082,12/22(金) 14:08
ksbv,KSB瀬戸内海放送,男子はわずか1秒差を制し…全国中学駅伝史上2校目の男女アベック優勝　京山中学校の選手が喜びを語る,https://news.yahoo.co.jp/articles/91ec4d789c558551882ebc1d26cd79cb72a6b14d,12/22(金) 13:57
ksbv,KSB瀬戸内海放送,倉敷市夫婦殺傷事件　逮捕の長男(29)は当時現場におらず　岡山,https://news.yahoo.co.jp/articles/9cd260d948fb3aff31f3af3e1ec4c50cf09457f6,12/22(金) 12:06
ksbv,KSB瀬戸内海放送,公用車でスピード違反など　笠岡市が課長級の市職員（60）を戒告処分,https://news.yahoo.co.jp/articles/3437b4225c751ed21766238f4dfb82329c1c33e6,12/22(金) 12:02
ksbv,KSB瀬戸内海放送,警戒中の警官の前で…電車内で女子高生のスカート内を盗撮しようとした疑いで男（29）を現行犯逮捕　高松市,https://news.yahoo.co.jp/articles/4f2c9df500041191e3be0f8ea00871cd3e4f9a0f,12/22(金) 11:43
ksbv,KSB瀬戸内海放送,高松市の小学校で終業式　YouTubeに使う時間を決めるなど冬休みの過ごし方も確認　香川,https://news.yahoo.co.jp/articles/687536772445cb890e2f6eef96357a19305e2869,12/22(金) 11:41
ksbv,KSB瀬戸内海放送,顔を蹴ってけがをさせるなどして男性からマイナンバーカードを奪ったか　男女2人を逮捕　岡山,https://news.yahoo.co.jp/articles/c44e18f8888b7bdcef7b78c6557dff22bd02702b,12/22(金) 11:13
ksbv,KSB瀬戸内海放送,吉備中央町・浄水場の有機フッ素化合物問題　使用済み活性炭が置かれていた資材置き場の土壌から高い値検出　岡山,https://news.yahoo.co.jp/articles/50b77500936f376b8abe5361d0bd79567b3968f5,12/21(木) 18:57
ksbv,KSB瀬戸内海放送,年末年始の旅行費用が「過去最高」に　宿泊料金高騰で…岡山県では2018年比で約1.6倍,https://news.yahoo.co.jp/articles/1b80ab6a4b173966eb245e4b2ca169b4cf678b84,12/21(木) 18:38
ksbv,KSB瀬戸内海放送,「何で未成年の女の子をホテルに連れて行くんや」と男性から現金20万円を脅し取った疑い　男女5人を逮捕　香川,https://news.yahoo.co.jp/articles/47c27b992d4838248c399cc6ee40f4f57aaf329e,12/21(木) 18:36
ksbv,KSB瀬戸内海放送,倉敷市・夫婦殺傷事件　夫婦の長男ら20代の男2人を殺人未遂容疑で逮捕　長男は事件後「殺されるような父ではなかった」と話す,https://news.yahoo.co.jp/articles/5642726b023cf4c51071d64135aaaee53c554722,12/21(木) 18:32
ksbv,KSB瀬戸内海放送,琴平町の「商店街」復活へ　空き店舗が次々と改修　滞在狙い宿泊施設も2024年12月オープンへ　香川,https://news.yahoo.co.jp/articles/965072db94b43197a8ab452eca1ed765ebad12d6,12/21(木) 18:28
ksbv,KSB瀬戸内海放送,サッカー日本代表・佐野海舟選手が津山市長を訪問　元日のタイ代表戦へ抱負「地元にいいニュースを届けられるように」　岡山,https://news.yahoo.co.jp/articles/a602a8796cb4b3d99af4ba19e63996076254bf3e,12/21(木) 17:33
ksbv,KSB瀬戸内海放送,父親の遺体を自宅に遺棄した疑いで逮捕の男性(52)を不起訴に　岡山地検,https://news.yahoo.co.jp/articles/6576a0c541d98918577357ab7d331c2c70ac4c15,12/21(木) 17:01
ksbv,KSB瀬戸内海放送,あなぶきアリーナ香川（香川県立アリーナ）の公式ホームページ　12月25日に公開へ,https://news.yahoo.co.jp/articles/a8ef28efe37a3708660776543ee4c79ec292e824,12/21(木) 16:46
ksbv,KSB瀬戸内海放送,12月22日は冬至　カピバラがゆず湯であったまる　岡山市・池田動物園,https://news.yahoo.co.jp/articles/edd37a3eb0ff703ceb3984d8397d340a148dc43f,12/21(木) 16:23
ksbv,KSB瀬戸内海放送,踏切死亡事故を受け「第4種踏切は廃止・改良すべき」 運輸安全委員会が調査報告　香川,https://news.yahoo.co.jp/articles/5ee73cd9225f3bbb1a776364c21671886ff73753,12/21(木) 16:19
ksbv,KSB瀬戸内海放送,中高生が自転車事故の怖さを体験　香川・東かがわ市,https://news.yahoo.co.jp/articles/e0eef817286d5f595b956c80437e457d0234d28a,12/21(木) 16:17
ksbv,KSB瀬戸内海放送,高松―上海線の運休期間が1カ月延長　2024年1月末まで,https://news.yahoo.co.jp/articles/35da59f786517e1b537fb7c7523faef487653f3f,12/21(木) 15:59
ksbv,KSB瀬戸内海放送,JR岡山駅近くで9月に発生した回送列車の脱線事故　JR西日本が影響まとめる,https://news.yahoo.co.jp/articles/e3bd876b6e8a26f9b8e108c70991c24de5f3c230,12/21(木) 15:54
ksbv,KSB瀬戸内海放送,妖怪美術館で年末年始のイベント「妖怪詣」　前向きになれる妖怪のおみくじも　小豆島,https://news.yahoo.co.jp/articles/79ff3d15e784c832ca241c96fee74b3507454dd4,12/21(木) 15:43
ksbv,KSB瀬戸内海放送,倉敷市・夫婦殺傷事件　夫婦の長男ら20代の男2人を殺人未遂などの疑いで逮捕,https://news.yahoo.co.jp/articles/9d82448db40722a55ebc2bfae39d2f0486dc9091,12/21(木) 14:32
ksbv,KSB瀬戸内海放送,岡山市で初氷を観測　平年より4日遅く　JR姫新線などで運転取りやめや大幅な遅れの可能性,https://news.yahoo.co.jp/articles/0fd33d94b5b264b32528651707258542b9ed24fb,12/21(木) 11:58
ksbv,KSB瀬戸内海放送,再犯防止に向けて活動する香川大学の学生団体が学長表彰,https://news.yahoo.co.jp/articles/b243637d4b0fb71a01dd86ee51549dfe4e0ff95a,12/21(木) 11:55
ksbv,KSB瀬戸内海放送,G7香川・高松都市大臣会合　経済波及効果は8億9100万円　前回会合を上回る,https://news.yahoo.co.jp/articles/eadb92bd813beced1d11faad17037c4bff7310e1,12/21(木) 11:46
ksbv,KSB瀬戸内海放送,笠岡湾干拓地の農地代問題　百条委員会「適切な処理とは言えない」　岡山,https://news.yahoo.co.jp/articles/46aad30b6ecd1fa8426c2ffd2b4b8fc74cf8b210,12/20(水) 18:43
ksbv,KSB瀬戸内海放送,笠岡市が第三者委員会の調査を待たずに「ハラスメントはなかった」とする文書作成　市長のパワハラ疑い音声データ公開で　岡山,https://news.yahoo.co.jp/articles/155d5ad06fba3965d1a1f3ff8f67b565a0712a4f,12/20(水) 18:36
ksbv,KSB瀬戸内海放送,開校2年遅れで生徒数は？　さぬき市の県立高校統合について地元の関係者が意見　香川,https://news.yahoo.co.jp/articles/5ca98f897ebce9a073da5e0617ce6aca2d81a3d5,12/20(水) 18:35
ksbv,KSB瀬戸内海放送,有機フッ素化合物の血中濃度が国平均の約80倍と判明　吉備中央町の水質問題で一部の町民が検査　岡山,https://news.yahoo.co.jp/articles/de5920c4676dda26fe7bb1fafaf488524f48b59f,12/20(水) 18:33
ksbv,KSB瀬戸内海放送,「小学校14校→4校、中学校6校→3校に統廃合が望ましい」高梁市公立小中学校の再編検討委が報告書　岡山,https://news.yahoo.co.jp/articles/020d67cc3185fcde157fa3d42aceafba3a65fee6,12/20(水) 18:29
ksbv,KSB瀬戸内海放送,セクハラ行為で県職員(58)を懲戒処分　30代女性に性的な発言繰り返し尻触る　香川県,https://news.yahoo.co.jp/articles/f0ef16b4240d15d27a29e31ba2147843143be0d3,12/20(水) 18:17
ksbv,KSB瀬戸内海放送,倉敷市で軽自動車と原付バイクが衝突　高齢女性が重体,https://news.yahoo.co.jp/articles/58f092d7d96de02cf3b169c8a211cae3bc879791,12/20(水) 18:10
ksbv,KSB瀬戸内海放送,渋滞中の車にタンクローリーが衝突した想定の訓練　5つの消防署が合同で　年末は交通量増で事故増加の恐れ　岡山市,https://news.yahoo.co.jp/articles/e4be34ddbe236072af6b57b5a49d0f80e661bf50,12/20(水) 17:49
ksbv,KSB瀬戸内海放送,岡山市中心部の消防署　夜間の救急対応を2隊体制に強化へ,https://news.yahoo.co.jp/articles/e1ad800b2edd4dd0aad197489e1719c260eca993,12/20(水) 17:40
ksbv,KSB瀬戸内海放送,香川県教委が徴収金の取り扱い要綱を改正　高校事務職員の私的流用受け,https://news.yahoo.co.jp/articles/ef8ded7d75b3cd936bc7a1a7fe1b9d52a3f30117,12/20(水) 17:19
ksbv,KSB瀬戸内海放送,26年ぶりに会期延長となった高松市議会　追加提案の補正予算案など可決し12月定例議会が閉会,https://news.yahoo.co.jp/articles/9575d665e15a567c17ee62cf859466af73adb411,12/20(水) 16:41
ksbv,KSB瀬戸内海放送,2024年のそうじゃ吉備路マラソン　総社市の店舗とコラボした給食を実施へ,https://news.yahoo.co.jp/articles/8626f7eca25e218026e7a3bb773656563563478c,12/20(水) 15:50
ksbv,KSB瀬戸内海放送,JR西日本の岡山エリア　雪の影響で21〜23日にかけて運転取りやめなどの恐れ,https://news.yahoo.co.jp/articles/6ff73e93fcea745c91e4d2bb7f290014352e519e,12/20(水) 15:30
ksbv,KSB瀬戸内海放送,ご当地お雑煮ランキング　香川県の「あん餅雑煮」が全国3位に！,https://news.yahoo.co.jp/articles/bb40115cc7696839c0840401ef0799fe61c093a5,12/20(水) 14:48
ksbv,KSB瀬戸内海放送,意外…超おしゃれなバーで「あん餅雑煮」を提供している理由とは？　香川・高松市,https://news.yahoo.co.jp/articles/11367d24c5b98171e24667e9da15a10c876ca3c1,12/20(水) 13:11
ksbv,KSB瀬戸内海放送,岡山市北区で重機が電線に引っかかる…約1330戸が一時停電も復旧,https://news.yahoo.co.jp/articles/f6694e4d5076541aa51b74f8367009b2139ade9b,12/20(水) 12:40
ksbv,KSB瀬戸内海放送,園児がクリスマスツリーを見学　飾りは園児が手作り　香川・丸亀市,https://news.yahoo.co.jp/articles/69d15fb813e752a80f8383a9da3feb95c0c758f7,12/20(水) 12:20
ksbv,KSB瀬戸内海放送,教職員のストレスチェックで個人情報が漏洩　医師が面接で別人の結果を表示　岡山県教委,https://news.yahoo.co.jp/articles/ae2059ba876ce8ecd3062377c1745a7d859a04cd,12/20(水) 12:00
ksbv,KSB瀬戸内海放送,水道料金返還に関する議案が「可決」　吉備中央町の浄水場から目標値超の有機フッ素化合物検出で　岡山,https://news.yahoo.co.jp/articles/47e1b13b33ea42a138b1fb8bb6de9a1149221fec,12/20(水) 11:55
ksbv,KSB瀬戸内海放送,百十四銀行が100％出資の投資専門子会社を設立へ　高松市,https://news.yahoo.co.jp/articles/dc32e0cb4113d4e67417df121c13c568aec71045,12/20(水) 11:20
ksbv,KSB瀬戸内海放送,岡山市北区伊島町で棟続きの住宅2軒が全焼し1人死亡の火事　身元が判明 亡くなったのは住人の55歳の男性,https://news.yahoo.co.jp/articles/f4ab08d469e59f20d7499de26bfa435381c99616,12/20(水) 11:10
ksbv,KSB瀬戸内海放送,四国の企業の57.4％が「後継者不在」と回答　8年連続で割合上昇,https://news.yahoo.co.jp/articles/92ae9f9c313bd43d939b31e92e7178c3bc8d7646,12/19(火) 19:26
ksbv,KSB瀬戸内海放送,物価高…クリスマスプレゼントに影響は？　「ライブ配信ごっこ」ができる子ども向けパソコンなど人気　香川,https://news.yahoo.co.jp/articles/7f438474a44275c55abeb7bf44eb5f5b00d4d314,12/19(火) 18:57
ksbv,KSB瀬戸内海放送,「給付型奨学金」新設の積立金などの補正予算案を可決　高松市議会　追加補正予算の審議のため26年ぶりに会期延長,https://news.yahoo.co.jp/articles/07938d088abfeba44917c86eaf026bc063857adf,12/19(火) 18:47
ksbv,KSB瀬戸内海放送,四国運輸局　ことでんに2023年2度目の「改善指示」　踏切で遮断機下りないトラブル相次ぎ　香川,https://news.yahoo.co.jp/articles/94d2bcf3990f0fa17e16d559108c96458a2e76e7,12/19(火) 18:40
ksbv,KSB瀬戸内海放送,「書道」がユネスコ無形文化遺産の提案候補に　関係者からは期待の声「書道に接する人が増えたら…」　香川,https://news.yahoo.co.jp/articles/07d0284d0b3b06f2132d5803fb8d2123c16299a0,12/19(火) 18:36
ksbv,KSB瀬戸内海放送,高校生らが県議会で議員体験　地域の課題など質問　岡山県政や選挙に興味を,https://news.yahoo.co.jp/articles/90bfbd8a44038e6ac847a1f405509d3efa2f7329,12/19(火) 18:15
ksbv,KSB瀬戸内海放送,JR倉敷駅西側の区画整理　完成予定が7年延期で2031年度に　延期は4回目　総事業費は約48億円増加　岡山,https://news.yahoo.co.jp/articles/e55159fded7fbdb303b448f9aab7302406e21f00,12/19(火) 17:59
ksbv,KSB瀬戸内海放送,競技開始3年で年代別日本代表に…スポーツクライミング・大杉金剛さん(15)　加速を武器に世界へ　岡山市【こどもみらいパーク】,https://news.yahoo.co.jp/articles/c330c17f05c33d8b947e1c3a387b13b305d0c7d7,12/19(火) 17:50
ksbv,KSB瀬戸内海放送,四国の企業　女性社長の割合は10.1%　8年連続の増加で初の10％超え　香川は10.2%で全国6位,https://news.yahoo.co.jp/articles/84c76ccfc3e82a0cbd9df7233c70a6a1638f938b,12/19(火) 17:33
ksbv,KSB瀬戸内海放送,初滑り！いぶきの里スキー場のメインコースがオープン　気温が高く予定より3日遅れで　岡山・新見市,https://news.yahoo.co.jp/articles/4f9eaaa764078fffc4c13cc21e0d2adc4960a566,12/19(火) 17:06
ksbv,KSB瀬戸内海放送,国道交差点で原付バイクとトラックが衝突　原付の80歳女性が死亡　岡山・総社市,https://news.yahoo.co.jp/articles/9185207ee2f852482d107ea904600bfeae44f8de,12/19(火) 16:55
