media_en,media_jp,title_articles,link_articles,date_original
ksbv,KSB瀬戸内海放送,子育て世帯を支援「ももっこカード」18歳未満まで対象拡大へ　協賛店舗でお得なサービス 　岡山,https://news.yahoo.co.jp/articles/32e120ad3f888174597777535dc9a65b3a540558,11/23(木) 17:19
ksbv,KSB瀬戸内海放送,東かがわ市に防災物資の拠点施設が完成　支援物資を受け入れて保管と仕分け　香川,https://news.yahoo.co.jp/articles/62d8ec0c65d7cdb04b0011bc0da64f9f6e8355dc,11/23(木) 17:01
ksbv,KSB瀬戸内海放送,定期購入や副業サイトに注意…香川県の消費生活相談　特に30代や20歳未満の相談が増加　23年度上半期,https://news.yahoo.co.jp/articles/26013596a333fd6a089ef55931495440e612d1fd,11/23(木) 16:33
ksbv,KSB瀬戸内海放送,高松市中央公園の再整備で樹木は？ 伐採反対の市民団体と市職員が現地で意見交換,https://news.yahoo.co.jp/articles/db859a7a60f8ceef923137ecec7a38384483f60b,11/23(木) 15:46
ksbv,KSB瀬戸内海放送,JR高松駅前広場を無料で貸し出し　社会実験5カ月で利用5件　市長「周知や要件緩和を検討」,https://news.yahoo.co.jp/articles/5f472fcb9b67008e9fe2b02680e40f0416bd85bf,11/23(木) 13:45
ksbv,KSB瀬戸内海放送,B3香川ファイブアローズ　丸亀・三豊・観音寺でのホーム戦の2階自由席を無料に　平均観客1500人達成へ,https://news.yahoo.co.jp/articles/aa3aabaab72443e5a024b93d09c6f29ac30c991e,11/23(木) 12:00
ksbv,KSB瀬戸内海放送,吉備中央町の浄水場問題　専門家が住民に健康への影響を説明　不安や町への不満の声相次ぐ　岡山,https://news.yahoo.co.jp/articles/762982922c0cd75de998ec7aa6e1eb80c1bbffe6,11/23(木) 11:35
ksbv,KSB瀬戸内海放送,日本維新の会を離党の宮岡陽子香川県議　新会派を立ち上げ　離党理由は語らず,https://news.yahoo.co.jp/articles/ef46ad1823050f96d6aa374ceb90c680399326f0,11/22(水) 18:38
ksbv,KSB瀬戸内海放送,物価高騰に対応しつつ少子化対策など推進　香川県知事が2024年度の予算編成方針を説明　11月定例県議会が開会,https://news.yahoo.co.jp/articles/e6f1af399030fe7c773762b3db8103a5da433af4,11/22(水) 18:27
ksbv,KSB瀬戸内海放送,高松市が組織改編　2024年度から「広報シティプロモーション課」や「東京事務所」など新設へ,https://news.yahoo.co.jp/articles/48821b32b2dad9616b678d14b2cb9ad934a467e8,11/22(水) 18:17
ksbv,KSB瀬戸内海放送,企業が子育て応援　岡山市に寄付金を贈呈　絵本の購入費用に,https://news.yahoo.co.jp/articles/2cb3249507b6bc1e5631b39db1fd30505099e278,11/22(水) 17:16
ksbv,KSB瀬戸内海放送,岡山・真庭市のスキー場で冬支度進む　支配人「暖冬予報でちょっと心配」,https://news.yahoo.co.jp/articles/276542750fcad01ffc30fc2f6197fcfed0c434b3,11/22(水) 16:58
ksbv,KSB瀬戸内海放送,栗林公園で11月23日から秋のライトアップ　12月3日まで　高松市,https://news.yahoo.co.jp/articles/5b406652e93dea42e9e8de0e0a9dbda8942070e5,11/22(水) 16:05
ksbv,KSB瀬戸内海放送,約1カ月ぶりに水道水の使用制限解除　岡山・吉備中央町の浄水場の水質問題,https://news.yahoo.co.jp/articles/2244ad87fd503b8fb85ebd1740d0465267cc4ece,11/22(水) 15:46
ksbv,KSB瀬戸内海放送,2023年は交通事故死者の7割が高齢者　有識者らに意見を求める委員会　香川県警,https://news.yahoo.co.jp/articles/88dcfe539f3d01fd3ac4b44f4149a0a464ac0d10,11/22(水) 15:39
ksbv,KSB瀬戸内海放送,2028年度から統一の香川県の水道料金　当初の設定より値上がりの見通し　資材価格高騰の影響,https://news.yahoo.co.jp/articles/54e7685df8e2895a204da97a0594a96211cb9444,11/22(水) 15:31
ksbv,KSB瀬戸内海放送,丸亀城の崩落の石垣　復旧方針示される　伝統工法に現代の工法も活用し構造強化へ,https://news.yahoo.co.jp/articles/8c7033436d9f93f30aa5b30c0939f5bb3e3a4363,11/22(水) 13:08
ksbv,KSB瀬戸内海放送,11月22日は「回転寿司記念日」　なぜ右回り？考案者は？お得なネタは？　疑問を調査！【みんなのハテナ】,https://news.yahoo.co.jp/articles/4e1e4813dee654890e79f7c671c9b3127af24206,11/22(水) 13:06
ksbv,KSB瀬戸内海放送,岡山市　来年度から水道料金値上げの条例案提出へ　値上げ率は従来の方針より抑制,https://news.yahoo.co.jp/articles/09bbfae5fe01670a62d14208170fef89ef97cf40,11/22(水) 11:57
ksbv,KSB瀬戸内海放送,暫定目標値の9万倍も…浄水場水質問題で上流で発見の活性炭から高濃度の有機フッ素化合物　岡山・吉備中央町,https://news.yahoo.co.jp/articles/3c23a5d27eecb758f789c1ca23ccdb9072259d98,11/22(水) 9:39
ksbv,KSB瀬戸内海放送,気温が下がり鍋シーズン本格到来　高騰が続いていた葉物野菜の価格落ち着く　香川,https://news.yahoo.co.jp/articles/78f4ef8c86e641c94f17fd0285007b591fc5ca39,11/21(火) 18:59
ksbv,KSB瀬戸内海放送,香川県議の政務活動費ウォッチング　市民団体が企画…県民が使い道をチェック,https://news.yahoo.co.jp/articles/4ba0dd2f8a9e103a09edcb8e0f34e9a65c9b293a,11/21(火) 18:41
ksbv,KSB瀬戸内海放送,強制隔離の歴史を次世代に　中学生がハンセン病療養所を訪問　岡山・瀬戸内市,https://news.yahoo.co.jp/articles/9ab9fc8572b49f5ea0b45cc9acfba7be2821589a,11/21(火) 18:31
ksbv,KSB瀬戸内海放送,ホームの端に近づくと音でお知らせ　視覚障害者の転落防止システムの実証実験　岡山大が開発,https://news.yahoo.co.jp/articles/9aa015ec58fd99e26066a4b265c78a945097f9b4,11/21(火) 18:29
ksbv,KSB瀬戸内海放送,離島の電話交換所が被災した想定で通信回復訓練　NTT西日本と坂出海保が連携　香川,https://news.yahoo.co.jp/articles/3458fbd97b6f67090b1802e47ee9f1c1bd2c1833,11/21(火) 18:18
ksbv,KSB瀬戸内海放送,時代に合わせて新たな「いじめ対策」を　岡山県の大学やPTAの関係者らが協議,https://news.yahoo.co.jp/articles/aee459ad70772abd01a251a1adb22147d7d95bc7,11/21(火) 18:08
ksbv,KSB瀬戸内海放送,会社の労働組合の口座情報を改ざんした疑い　殺人未遂の罪で起訴の男を再逮捕　香川・さぬき市,https://news.yahoo.co.jp/articles/1cb6c6c481bb47a2ff421ea93eec41c1aa374e6f,11/21(火) 17:49
ksbv,KSB瀬戸内海放送,坂出市の庭園のコイ約200匹を回収　14日にコイヘルペスウイルスへの感染確認　香川,https://news.yahoo.co.jp/articles/2fcfdb7f6ab9bb285892aba2b961abe90310c419,11/21(火) 17:42
ksbv,KSB瀬戸内海放送,死んだ野鳥から鳥インフルエンザの陽性反応　簡易検査で　香川・東かがわ市,https://news.yahoo.co.jp/articles/10567a425924ee912c3fa8e524063511d99d0d1e,11/21(火) 17:32
ksbv,KSB瀬戸内海放送,岡山県の2024年度の当初予算編成　「少子化対策」に重点的に配分へ,https://news.yahoo.co.jp/articles/7a857985400f93192d8baedad7a6a4f2f2a43591,11/21(火) 17:10
ksbv,KSB瀬戸内海放送,岡山の酒造りを伝える特別展　杜氏を養成する学校設立の資料も初公開　岡山県立博物館,https://news.yahoo.co.jp/articles/21cb8a786f963de8c3f46725f2f2800b6d852203,11/21(火) 17:05
ksbv,KSB瀬戸内海放送,ウエストランドの2人が「津山ふるさと大使」第1号に就任へ　出身の岡山・津山市をPR,https://news.yahoo.co.jp/articles/7ec9cc8e39f1d304d5e8aabe52dc349d5edb2020,11/21(火) 16:17
ksbv,KSB瀬戸内海放送,小学生がアナウンサー体験で伝え方学ぶ　自動車ディーラーが放課後の「学びの場」提供　岡山,https://news.yahoo.co.jp/articles/034e2d09e62fb97625899aa3c060b24950e9a435,11/21(火) 14:44
ksbv,KSB瀬戸内海放送,行方不明者の捜索などにあたる「嘱託警察犬」を選ぶ競技会　シェパード14頭が参加　香川・丸亀市,https://news.yahoo.co.jp/articles/d3587ac3d19d54ef33b5d3553ddf37f405d2a292,11/21(火) 14:39
ksbv,KSB瀬戸内海放送,温浴施設「クアタラソさぬき津田」の存続求め　会員らが請願書と署名を市長に提出　香川・さぬき市,https://news.yahoo.co.jp/articles/dceb23f51eeaca069cbf247ab3f27e47f4004f81,11/21(火) 11:40
ksbv,KSB瀬戸内海放送,フランスの建築家が香川の木造建築を見学「とても洗練されている」,https://news.yahoo.co.jp/articles/24f1ba23a495c4b47ce346154eef720da2016eb0,11/21(火) 11:12
ksbv,KSB瀬戸内海放送,JR芸備線の再構築協議会設置巡り…岡山県知事「協議会設置なら参加」と回答の方針,https://news.yahoo.co.jp/articles/1cf2af75d0753a715715eb03b299ab9d5144b6af,11/21(火) 9:22
ksbv,KSB瀬戸内海放送,全国高校サッカー選手権組み合わせ決定　前回優勝の岡山学芸館は尚志（福島）　大手前高松は北海（北海道）と対戦,https://news.yahoo.co.jp/articles/3128bd126112d01077775fab152df8329a10f77b,11/20(月) 19:04
ksbv,KSB瀬戸内海放送,「特定重要拠点」について国が香川県に説明　防衛力強化に向け自衛隊なども活用できるよう各地の港や空港を整備へ,https://news.yahoo.co.jp/articles/c6ffc284f41cbd67150fe2cc3c09040a5c7aa130,11/20(月) 19:02
ksbv,KSB瀬戸内海放送,ネット環境から離れる「オフラインキャンプ」 3カ月経ち変化は？保護者の関わり方も鍵　香川,https://news.yahoo.co.jp/articles/e307b956c32023b1437248d2de64bd349b308540,11/20(月) 18:39
ksbv,KSB瀬戸内海放送,海外への訪問終え　香川県議会議長「できるだけ多くの人が行けばいい」　知事「交流のバトンを引き継げた」,https://news.yahoo.co.jp/articles/4b6e91a4cea5e82934cf807186af99dbdbf47437,11/20(月) 18:37
ksbv,KSB瀬戸内海放送,江戸時代に「殿様が食べた料理」のレシピ集が完成　岡山後楽園で試食会,https://news.yahoo.co.jp/articles/46d0d764493f12295b4d2cf84188dcd81fd7708c,11/20(月) 18:32
ksbv,KSB瀬戸内海放送,高校バスケ ウインターカップ　尽誠学園は沖縄の美来工科と初戦　岡山・香川代表の対戦相手は？,https://news.yahoo.co.jp/articles/a5429438dddbf87362d558df708bc7fb8533a457,11/20(月) 18:27
ksbv,KSB瀬戸内海放送,小学生が授業で「ドローンサッカー」に挑戦　2024年の大会を目指し練習　香川,https://news.yahoo.co.jp/articles/94835b25cf6d5e27278387bef6d92dc5f5c70573,11/20(月) 18:25
ksbv,KSB瀬戸内海放送,5万1000円で落札の金魚も　東かがわ市で「日本オランダ獅子頭」の全国品評大会,https://news.yahoo.co.jp/articles/a35a655e9105efdce4a75f0b7c3a56c8fbd8ac45,11/20(月) 17:56
ksbv,KSB瀬戸内海放送,四国電力が高松市のため池に太陽光発電所を建設開始　県内2例目で2025年2月運転開始へ,https://news.yahoo.co.jp/articles/b0caf531cda45b06bcf9fbfb7429d6568b64b40a,11/20(月) 17:40
ksbv,KSB瀬戸内海放送,岡山ゆかりの戦国大名・宇喜多秀家の命日に寺で法要　岡山市,https://news.yahoo.co.jp/articles/17188f1f5d371f8b90db26f2536e25980a7f2f6a,11/20(月) 17:25
ksbv,KSB瀬戸内海放送,岡山市のトミヤコーポレーションが東京・銀座に初出店　時計や宝飾品を販売,https://news.yahoo.co.jp/articles/6649224a49cb70b2d56eeb4fdfec7236c8b1db46,11/20(月) 15:50
ksbv,KSB瀬戸内海放送,福士加代子さん企画の駅伝大会　2024年も開催へ「楽しい疲れが出る大会に」　前回は約1200人が参加　高松市,https://news.yahoo.co.jp/articles/c48fbad89e97cc25fac50d799f7d88b210e99ea6,11/20(月) 15:19
ksbv,KSB瀬戸内海放送,中国銀行と百十四銀行が定期預金の金利引き上げ　10年物を現在の0.002％から0.2％に,https://news.yahoo.co.jp/articles/d99b2223f8a36f6837dfe03e71a6be8fe27bcf1f,11/20(月) 15:15
ksbv,KSB瀬戸内海放送,全校児童の2割が外国ルーツの小学校　「多文化共生」をテーマにした学習発表会　香川・丸亀市,https://news.yahoo.co.jp/articles/b24e9985557dfe2f1b2f14d0fd1f7a578c748e34,11/20(月) 14:58
ksbv,KSB瀬戸内海放送,西大寺会陽　裸の男たちによる宝木争奪戦が4年ぶりに復活へ　会長「安全にけがのないように」　岡山市,https://news.yahoo.co.jp/articles/e6f4398fd62a3a2a901f7cc1677363bb40141b5e,11/20(月) 14:54
ksbv,KSB瀬戸内海放送,総社市議会議長が議長辞職願を提出　公選法違反の疑い指摘　岡山,https://news.yahoo.co.jp/articles/0734f11436882358cc7e7f09978cfc2fb384d39d,11/20(月) 11:54
ksbv,KSB瀬戸内海放送,岡山県立美術館で伝統工芸品を集めた展示会　岡山市,https://news.yahoo.co.jp/articles/e8813a6abac6d9e1b0ef5c5f37577ccbb8b09040,11/19(日) 18:03
ksbv,KSB瀬戸内海放送,路面電車を運行している岡山市の会社が運転士の確保に向け体験会,https://news.yahoo.co.jp/articles/248cd1dcc3c22101063760fa1a53be8c7b40fb48,11/19(日) 18:02
ksbv,KSB瀬戸内海放送,金魚の品評会が行われ全国各地から愛好家が集まる　香川・東かがわ市,https://news.yahoo.co.jp/articles/c5d26ed0d6acd25c30f1cf821579cc42fbe64f20,11/19(日) 16:36
ksbv,KSB瀬戸内海放送,香川県産の新しい小麦「さぬきの夢2023」を使ったうどんの試食会 に300人が列　高松市,https://news.yahoo.co.jp/articles/22353193ef66fc2c9d9bc35fff066a27dbad0f3a,11/19(日) 15:24
ksbv,KSB瀬戸内海放送,次世代の起業家が経営者やリーダーから学ぶ　岡山,https://news.yahoo.co.jp/articles/f1850bbf2e9014b75c63e3132d1adbf80b15eb50,11/18(土) 17:44
ksbv,KSB瀬戸内海放送,各地で最高気温が10℃下回る　今シーズン一番の寒さ　岡山・香川,https://news.yahoo.co.jp/articles/0f0d36d344dfd3cdad730da9dfa5f0f0d2e16187,11/18(土) 17:15
ksbv,KSB瀬戸内海放送,飛行機炎上を想定　高松空港で4年ぶり大規模訓練　香川,https://news.yahoo.co.jp/articles/54ea4ac508f804e3853037beae7479ad1aa06e05,11/18(土) 17:12
ksbv,KSB瀬戸内海放送,有機フッ素化合物問題　有識者委員会が健康への影響を協議　岡山・吉備中央町,https://news.yahoo.co.jp/articles/4c90f165694fe6acfdbc17e897279c1a85a5a19f,11/18(土) 12:03
ksbv,KSB瀬戸内海放送,高松第一高校　3階建ての新体育館が完成　香川,https://news.yahoo.co.jp/articles/c505e9807a4520d484f862b3498e8d0fd49228bb,11/18(土) 11:30
ksbv,KSB瀬戸内海放送,【判決詳報】香川県のゲーム条例「弁護士費用」訴訟　高松高裁は住民側の控訴を退ける,https://news.yahoo.co.jp/articles/a8e37e7bbdace0e2dae99d90ecd579f146ef0e4e,11/17(金) 19:00
ksbv,KSB瀬戸内海放送,蒜山高原でヤマブドウを使ったワインを堪能　おすすめのおともはジャージー牛の濃厚なミルクで作ったチーズ　岡山・真庭市,https://news.yahoo.co.jp/articles/f09d8495bc9063775dc3b0536924f88fae1a8792,11/17(金) 18:40
ksbv,KSB瀬戸内海放送,原子力関連施設で火災が起こった想定　原子力災害の対応訓練　岡山・鏡野町,https://news.yahoo.co.jp/articles/f3558e8566e089ae06d728206a92eae968829c52,11/17(金) 18:15
ksbv,KSB瀬戸内海放送,火災発生時の避難方法は？　医療機関で研修会　岡山市,https://news.yahoo.co.jp/articles/6703d1114ee76474da8361922bb904715946d358,11/17(金) 18:07
ksbv,KSB瀬戸内海放送,「図面で見るよりいいな」建築を学ぶ高校生が建設中の香川県立アリーナを見学,https://news.yahoo.co.jp/articles/e90b472297d31d9c55da7d023c1b21780848143e,11/17(金) 17:25
ksbv,KSB瀬戸内海放送,インフルエンザ流行続く　1医療機関あたり19.14人　岡山,https://news.yahoo.co.jp/articles/83edea6932207ee9a35462d44bec040bc2a0f790,11/17(金) 16:11
ksbv,KSB瀬戸内海放送,“プール熱” 流行警報を発令　「流水での手洗い、うがいなど感染予防を」　香川,https://news.yahoo.co.jp/articles/0074f2737fd407b368c522c22894edb52a61725e,11/17(金) 15:32
ksbv,KSB瀬戸内海放送,岡山県の新型コロナ感染状況　1医療機関当たり1.62人,https://news.yahoo.co.jp/articles/5f7b81d23b4e94f3e2b425bd7c7bc7c2769f5c70,11/17(金) 14:49
ksbv,KSB瀬戸内海放送,10代前半中心にインフルエンザ流行続く　1医療機関あたり17.60人　香川,https://news.yahoo.co.jp/articles/9f6c6e4681cdb21273488489c2ec4803b03e225a,11/17(金) 14:43
ksbv,KSB瀬戸内海放送,香川県まんのう町の会社がフランスのパティシエと新商品を開発　チョコレート事業を成功させ「誰もが働ける場所」を,https://news.yahoo.co.jp/articles/6cd488f55bb15443aa112cf19ce9311249c74547,11/17(金) 13:34
ksbv,KSB瀬戸内海放送,サンポート高松を「遊歩道化」へ　2回目の社会実験が開始　2週間にわたり車の通行規制,https://news.yahoo.co.jp/articles/e9fb795ec8f45bdff14a68649e79b2037ce741e9,11/17(金) 12:02
ksbv,KSB瀬戸内海放送,飛行場に小型機が約6年放置　停留料360万円も未納　所有者男性とは2020年ごろから連絡取れず　岡山市,https://news.yahoo.co.jp/articles/b479c647c7eeb998d3fdeafeae979e61ebea2c1a,11/17(金) 11:54
ksbv,KSB瀬戸内海放送,エムポックス（旧サル痘）に30代男性が感染　岡山県初確認,https://news.yahoo.co.jp/articles/c41b71ce20f2a887064582fc0a50c1ff3cccba00,11/17(金) 11:24
ksbv,KSB瀬戸内海放送,【解説】「真剣に考えて！」浄水場から目標値を大幅に超える化合物　町の対応の遅れに住民から厳しい声　岡山・吉備中央町,https://news.yahoo.co.jp/articles/4fb1e2221adb1f09eb93e2d6113fe0421a660e6e,11/16(木) 18:37
ksbv,KSB瀬戸内海放送,家電をロボットが「自動で解体」　平林金属が実証実験　岡山市,https://news.yahoo.co.jp/articles/30393c53392a0ad813be02e6b6029f9157655c4c,11/16(木) 18:19
ksbv,KSB瀬戸内海放送,秋物はすでにセールに　季節外れの暑さから一転…急な寒さで“変わる商戦”　岡山,https://news.yahoo.co.jp/articles/64dd8fb7ea382ac156262212fc96b3201389cac8,11/16(木) 17:55
ksbv,KSB瀬戸内海放送,小中学生が環境美化をテーマに絵画やイラスト描く　香川県知事賞に豊中中学校1年の十鳥心緒さん,https://news.yahoo.co.jp/articles/8071725c9353c0f25ef8df29e8a02bd2ad0147e8,11/16(木) 17:51
ksbv,KSB瀬戸内海放送,センバツ　21世紀枠の香川県推薦校　大手前高松に決定,https://news.yahoo.co.jp/articles/435d05ec6dfc893b44bebc279a860c01b544a058,11/16(木) 17:01
ksbv,KSB瀬戸内海放送,「議長辞職を求める」政治倫理審査会の委員長が方針示す　議長の名前添えた花を贈った問題　岡山・総社市,https://news.yahoo.co.jp/articles/b11685fb1e01b9c73f7d6416b3d856206675d5ac,11/16(木) 16:53
ksbv,KSB瀬戸内海放送,「ミステリーの結末が読めない…」図書館でページが破られる被害相次ぐ　約120ページ破られたものも　高松市,https://news.yahoo.co.jp/articles/298674073aac536e0f9db2bd4ff37cd03c97e0a2,11/16(木) 16:35
ksbv,KSB瀬戸内海放送,ネット上の有害情報を監視　大学生らを「サイバー・パトロール・モニター」に　岡山県警,https://news.yahoo.co.jp/articles/e5385e633b157c8b3afe7e432b4a2c0cd08e54d9,11/16(木) 15:48
ksbv,KSB瀬戸内海放送,日本オランダ獅子頭と出合い早期退職…金魚2千匹以上を繁殖する元教師　香川・東かがわ市,https://news.yahoo.co.jp/articles/44f61ec7d326137e8c0e9c896505203cf1eb6f78,11/15(水) 19:18
ksbv,KSB瀬戸内海放送,「貧乏くさい」発言がきっかけ　四国4県と秋田県の特産品販売会　香川からはオリーブの新漬け出品,https://news.yahoo.co.jp/articles/acd70e1a82e94a0acb5b62940553cbd987fe60a6,11/15(水) 18:54
ksbv,KSB瀬戸内海放送,ママやパパを助けたい　離乳食を全国の赤ちゃんに届ける女性　こだわりは「手切り」　高松市,https://news.yahoo.co.jp/articles/d223cd6a10685a7b8478d1069f2d965f86d433c3,11/15(水) 18:48
ksbv,KSB瀬戸内海放送,文学で岡山市の活性化を　ユネスコ創造都市加盟受け会議「これからが試されるとき」,https://news.yahoo.co.jp/articles/97f803dd200497f6036fd616ea529f2288cb058a,11/15(水) 18:41
ksbv,KSB瀬戸内海放送,F-2戦闘機が岡山空港で離着陸訓練　航空自衛隊の基地が使えなくなったことを想定,https://news.yahoo.co.jp/articles/d0b6ac3a2864ace4190309349c2a9de4f5df744a,11/15(水) 18:33
ksbv,KSB瀬戸内海放送,万引き被害防止には「声掛け」を　高松市で防犯啓発セミナー,https://news.yahoo.co.jp/articles/c9710916d95618c7b8603ca2362b42042f7f52a1,11/15(水) 18:27
ksbv,KSB瀬戸内海放送,七五三の起源は？千歳飴の意味は？　神社や専門家が疑問に回答【みんなのハテナ】,https://news.yahoo.co.jp/articles/5738b9f1703f51ea75d27ec5d5c45b2f81b12782,11/15(水) 17:24
ksbv,KSB瀬戸内海放送,園児が「火事の怖さ」を学ぶ　パネルシアターでわかりやすく　岡山・高梁市【こつこつ防災】,https://news.yahoo.co.jp/articles/02fffb83a8ab4c8047627ecbb42473125614d372,11/15(水) 16:55
ksbv,KSB瀬戸内海放送,白備前の「辰」の置物を窯出し　備前焼作家・木村玉舟さんが制作　岡山,https://news.yahoo.co.jp/articles/bdc73f1018f8360ff2ae9c419e4999c11fa04713,11/15(水) 16:33
ksbv,KSB瀬戸内海放送,首里城の修復に貢献　香川出身・鎌倉芳太郎の顕彰碑を沖縄に設置へ　素材は庵治石,https://news.yahoo.co.jp/articles/c3f83457316365cdb011c42084310b1339ffca49,11/15(水) 15:41
ksbv,KSB瀬戸内海放送,赤い皮と濃厚な甘さが特徴　香川県産ミカン「小原紅早生」の収穫始まる　坂出市,https://news.yahoo.co.jp/articles/83268d0250fd6833023b14cf51c1a3d442151e1a,11/15(水) 15:25
ksbv,KSB瀬戸内海放送,日本原駐屯地で陸上自衛隊と岡山県警が合同訓練　連携強め対応能力向上へ,https://news.yahoo.co.jp/articles/64ccff588ca1326441da4bce82833c57b11c8164,11/15(水) 15:15
ksbv,KSB瀬戸内海放送,メインテーマはフルーツ　人気スイーツなど販売する「いいものマルシェ」　天満屋岡山店,https://news.yahoo.co.jp/articles/0d6119c6a40a6469a02d740c492492815cae1d91,11/15(水) 12:10
ksbv,KSB瀬戸内海放送,岡山市の工作機械メーカーTAKISAWAがニデックの子会社に　TOBが成立,https://news.yahoo.co.jp/articles/75d2b5155a0f296f299c25807446e2d1d717d824,11/15(水) 11:29
ksbv,KSB瀬戸内海放送,2021年は出荷額全国1位の香川県　冷凍食品の商品開発を支援するシンポジウム,https://news.yahoo.co.jp/articles/427ad0efebd517780e771882ae721f46822ef728,11/15(水) 11:22
ksbv,KSB瀬戸内海放送,薬不足…せき止め、たん切り、タミフルも　インフルエンザ患者増の医療機関へ影響　医師「見通し立たない…」　岡山,https://news.yahoo.co.jp/articles/51fbacbf78f2e9b02158b8dac8bd6fab4ad257a0,11/14(火) 18:34
ksbv,KSB瀬戸内海放送,小学校で「補助犬」の出前授業　障害への理解深める　高松市,https://news.yahoo.co.jp/articles/856de6f7c60e0c13e2ae89c75d5a292043edae8f,11/14(火) 17:48
ksbv,KSB瀬戸内海放送,坂出市の公園のコイがコイヘルペスウイルスに感染　香川県では栗林公園での発生以来5年ぶり,https://news.yahoo.co.jp/articles/885f7d60553d5d81bcd74340f702c41f9cf582c4,11/14(火) 17:27
ksbv,KSB瀬戸内海放送,防衛省発注の新型護衛艦「ゆうべつ」進水式　日本周辺海域で警戒監視へ　機雷除去などにも対応可能　岡山・玉野市,https://news.yahoo.co.jp/articles/8e14978e98845a84daaf5577d84be7d91d221158,11/14(火) 16:37
ksbv,KSB瀬戸内海放送,特急「やくも」の新型車両273系が公開　乗り心地向上　JR西の在来線特急では初設置のグループ向けの座席「セミコンパートメント」も,https://news.yahoo.co.jp/articles/4af240a8c3c93389d535e896940b9e52a3f681e6,11/14(火) 16:29
ksbv,KSB瀬戸内海放送,西野金陵の初しぼり発売へ　2023年の出来は 「まるでサツマイモのスイーツ」　香川・多度津町,https://news.yahoo.co.jp/articles/503364d61c9af8a9c48254fc16c1a302b984cd5b,11/14(火) 15:01
ksbv,KSB瀬戸内海放送,6歳未満のチャイルドシート使用状況　香川県は84.2%　JAFが調査結果を発表,https://news.yahoo.co.jp/articles/eedfff7fb5b6ae7dd4a53b2f0bb4f293044285a1,11/14(火) 14:07
ksbv,KSB瀬戸内海放送,岡山・倉敷市で死んだ野鳥　簡易検査で鳥インフルエンザ陽性,https://news.yahoo.co.jp/articles/2a36ba39c3b772b8b1037503923121207e026d18,11/14(火) 13:47
ksbv,KSB瀬戸内海放送,高梁川水系　2008年以来の第1次取水制限始まる　岡山,https://news.yahoo.co.jp/articles/bb21208dd8195aa5707798d6ca9e8cf96bcc3332,11/14(火) 13:28
ksbv,KSB瀬戸内海放送,備前焼作家を目指す中学生「世界にも共感を持ってもらえるような作家に」　岡山・備前市【こどもミライパーク】,https://news.yahoo.co.jp/articles/73d18dda2c742d6a6367a9446656080c5f9742a0,11/14(火) 13:21
ksbv,KSB瀬戸内海放送,JR四国 中間決算を発表「コロナ禍前と同水準まで回復」売上高254億円　香川,https://news.yahoo.co.jp/articles/0b3f8fcaad9c9821236e0039b2c8a500a7c71dd5,11/14(火) 12:09
ksbv,KSB瀬戸内海放送,岡山県で今シーズン初の「冬日」 県北の3地点など　13日夜からの強い冷え込みで,https://news.yahoo.co.jp/articles/b342097143455b27b7ecdb4c1306e3a1a90cb085,11/14(火) 11:13
