media_en,media_jp,title_articles,link_articles,date_original
ksbv,KSB瀬戸内海放送,JR岡山駅東口　新タクシー送迎ゾーンの運用開始　入り口には専用の左折レーン設置,https://news.yahoo.co.jp/articles/4637135b003f31970f2a2486d31d028d060d3591,12/4(月) 17:31
ksbv,KSB瀬戸内海放送,V3女子・倉敷アブレイズがホーム開幕戦　地元ファンの声援受け4連勝で首位キープ　岡山,https://news.yahoo.co.jp/articles/f245da28c74fef146cf98a6fbfb8d5dfe5805bd0,12/4(月) 17:28
ksbv,KSB瀬戸内海放送,B3トライフープ岡山　アウェーで岐阜と1勝1敗　18チーム中17位と苦戦続く,https://news.yahoo.co.jp/articles/9b96f0b5d1ed945886bbcb03c8bb971d40946d73,12/4(月) 17:05
ksbv,KSB瀬戸内海放送,B3香川ファイブアローズが11月から負けなしで10連勝　東京Zとの第1戦は2度延長戦を制す,https://news.yahoo.co.jp/articles/1376203c6370455a3e597f2a2cbeb98349cc2e46,12/4(月) 16:52
ksbv,KSB瀬戸内海放送,J3カマタマーレ讃岐　最終戦で敗れ20チーム中16位で今季を終える　香川,https://news.yahoo.co.jp/articles/e5c64f37b44fb45c689fad1cdd13a9ac27b214a9,12/4(月) 16:36
ksbv,KSB瀬戸内海放送,「お酒を飲んで運転しちゃだめ」年末に向け園児らが交通安全を呼び掛け　高松市,https://news.yahoo.co.jp/articles/65882ea5eea2e81ac27bf49e40340d390a0a410b,12/4(月) 16:29
ksbv,KSB瀬戸内海放送,「ホームランは狙ったら打てない」パ首位打者・オリックス頓宮裕真選手らが児童を指導　香川,https://news.yahoo.co.jp/articles/38f6b3de2fb70e100c5b9cbbc4abb2b1e06b1948,12/4(月) 16:13
ksbv,KSB瀬戸内海放送,正月を前に小豆島にある樹齢1600年以上の木にしめ縄を新調　香川・土庄町,https://news.yahoo.co.jp/articles/ca1ad3aaf2d0bb1c92d289e4a5db35e291c7992d,12/3(日) 14:44
ksbv,KSB瀬戸内海放送,備前市出身・オリックスの頓宮裕真選手ら　小学生チームを指導　香川,https://news.yahoo.co.jp/articles/67a0f735febec884e75d8ef2e095f36776ed721c,12/2(土) 17:54
ksbv,KSB瀬戸内海放送,オムライスにハンバーガー　食べ物いっぱいのイラスト展　岡山,https://news.yahoo.co.jp/articles/3ba800a5b2c410f57f673a45f453adce8ba14f04,12/2(土) 15:22
ksbv,KSB瀬戸内海放送,各地の「年明けうどん」食べ比べ　4年ぶり入場制限解除でにぎわう　香川,https://news.yahoo.co.jp/articles/1e6d50642f90d2abd67adb4cfbc09eb348e02cd2,12/2(土) 11:44
ksbv,KSB瀬戸内海放送,香川県労働委員会　新会長に香川大経済学部の岡田徹太郎教授が就任　会長交代は14年ぶり,https://news.yahoo.co.jp/articles/65eae2ae5b7f56acc005216bbfb80e830b10fbe7,12/1(金) 21:37
ksbv,KSB瀬戸内海放送,岡山市の新アリーナ実現に向けプロチームと経済団体が署名活動を開始,https://news.yahoo.co.jp/articles/ca6a4c0d1e90e3de95f161478c50d3287ec9852c,12/1(金) 18:24
ksbv,KSB瀬戸内海放送,高速道路を逆走する車へどう対応？　四国4県の警察らが合同訓練,https://news.yahoo.co.jp/articles/061c246705fd2e6c4f71e63fee95b8cce7b00859,12/1(金) 18:03
ksbv,KSB瀬戸内海放送,年末年始は食中毒発生に注意を！　スーパーなどで一斉立ち入り検査　香川,https://news.yahoo.co.jp/articles/32e0d9c0c16b5a09189d153098e4fc0d2f6c1602,12/1(金) 16:57
ksbv,KSB瀬戸内海放送,大麻グミの「HHCH」販売など禁止を前に　岡山・香川でも販売店舗に立ち入り検査,https://news.yahoo.co.jp/articles/e4019e2f3ff50aaea2c3679ebf478321847d7315,12/1(金) 16:53
ksbv,KSB瀬戸内海放送,"通常料金2,220円も→200円に　岡山市を走る路線バスで運賃最大200円キャンペーン始まる　2024年1月3日まで",https://news.yahoo.co.jp/articles/4f02b60ae345a616ae1cee60ad4addad895bdaf8,12/1(金) 15:47
ksbv,KSB瀬戸内海放送,デジタルアートが高知城など彩る　12月1日からナイトイベント開催,https://news.yahoo.co.jp/articles/f428b6536bf5c367400dec828cecc7be350d89f5,12/1(金) 15:03
ksbv,KSB瀬戸内海放送,寒い日には…鍋で温まろう！　本場仕込みの「みそ煮込みうどん」と寒ブリの「しゃぶしゃぶ」　岡山・香川【ほっとマルシェ】,https://news.yahoo.co.jp/articles/d245f4c0303e18f785c3cb613cd42134283e2b7d,12/1(金) 14:55
ksbv,KSB瀬戸内海放送,住民が最後の運航見送る　岡山・備前市と香川・小豆島を結ぶフェリー運休へ　約50年間運航,https://news.yahoo.co.jp/articles/f496b9a96fb6a1615f50bf8c9648ac2392a8d769,12/1(金) 14:42
ksbv,KSB瀬戸内海放送,こんぴら歌舞伎　松本幸四郎さん・市川染五郎さんら出演で5年ぶり開催へ　香川・琴平町,https://news.yahoo.co.jp/articles/ce534f4f9a2425b6c088b8e1c47fc63a3523da33,12/1(金) 14:19
ksbv,KSB瀬戸内海放送,岡山県がインフルエンザ警報を発令　2019年1月以来4年ぶり　過去2番目の早さ,https://news.yahoo.co.jp/articles/7bbc5ec63a17601046e8351adf9cf43c11a918be,12/1(金) 14:01
ksbv,KSB瀬戸内海放送,岡山県の新型コロナ感染状況　1医療機関当たり1.94人　10週ぶり増加,https://news.yahoo.co.jp/articles/7bfbaaa99cc4d2926bd7ab6d9a01fb594b60e1ea,12/1(金) 13:51
ksbv,KSB瀬戸内海放送,【解説】バス路線維持を…岡山市がバス路線再編計画の素案を提示　事業者「みんなで協力して」「絶対もめる」,https://news.yahoo.co.jp/articles/8145219f9ff6b03a7b472ccb8536a599a9f7af4b,11/30(木) 19:16
ksbv,KSB瀬戸内海放送,10月時点の保育所の待機児童　香川県全体では減少も高松市では増加,https://news.yahoo.co.jp/articles/156fda72cf65a3a86b0485baea622817ecee94cd,11/30(木) 18:46
ksbv,KSB瀬戸内海放送,対戦したい相手は「巨人の浅野選手」　英明・寿賀弘都投手がオリックス入団会見　高松市出身,https://news.yahoo.co.jp/articles/399a160bed6793a0b9418a9056fe061947b19bb3,11/30(木) 18:33
ksbv,KSB瀬戸内海放送,「バタフライするハクトウワシ、見たことないでしょ」アラスカの自然から命の大切さ学んで　写真家が小学校で講演会　高松市,https://news.yahoo.co.jp/articles/81e733f91272b3899544422c0b2d6fecbc99ef74,11/30(木) 18:29
ksbv,KSB瀬戸内海放送,「一切恥じるような行動はしていない」議長が慣例に従い辞職　不信任決議や審議拒否…混乱続いた観音寺市議会　香川,https://news.yahoo.co.jp/articles/951f3560428012cb20582ec74be0a0d872c0c882,11/30(木) 18:25
ksbv,KSB瀬戸内海放送,吉備中央町　水道水の安全を確認し給水所を閉鎖　農家は風評被害心配　岡山,https://news.yahoo.co.jp/articles/aea1ad7cf4bad539de545904f10c06eb8f189767,11/30(木) 18:16
ksbv,KSB瀬戸内海放送,「こんな盆栽があったらいいな」香川が誇る盆栽を題材に小学生の絵画コンテスト,https://news.yahoo.co.jp/articles/12d02ea5ba19aaa9785a591b8feea2b72a4800aa,11/30(木) 16:58
ksbv,KSB瀬戸内海放送,少花粉スギ・ヒノキへの植え替え促進に約1500万円など　一般会計補正予算案提案　11月定例岡山県議会が開会,https://news.yahoo.co.jp/articles/01d4aba2636596fd2b549f76b72e7d58f75e749f,11/30(木) 16:30
ksbv,KSB瀬戸内海放送,水道料金値上げに関する条例改正案など提案　11月定例岡山市議会が開会,https://news.yahoo.co.jp/articles/ad3be44bae6a5d390965dfdb686b9d835ce9b8d5,11/30(木) 16:19
ksbv,KSB瀬戸内海放送,議長名入りの花贈り公選法違反の疑い指摘　総社市議会・深見議長が議長辞職　岡山,https://news.yahoo.co.jp/articles/374a3bd361dc1f0126670804a597fe2745fc708e,11/30(木) 16:16
ksbv,KSB瀬戸内海放送,死後のスマホデータどうする？「デジタル分野」など 多様化する“終活の今”　香川,https://news.yahoo.co.jp/articles/e3090867e4ed3249135efe0da0b5bcc256040ebd,11/30(木) 15:32
ksbv,KSB瀬戸内海放送,還付金詐欺被害が急増…岡山県警が「緊急警戒情報」発出　2023年で2回目,https://news.yahoo.co.jp/articles/d6846f2c520587ceec913fd6602d392d7642480a,11/30(木) 12:11
ksbv,KSB瀬戸内海放送,「金時にんじん」の収穫が最盛期　香川県が収穫量全国一　おせち料理以外の用途にも,https://news.yahoo.co.jp/articles/8f881ca432c548de0125260050c529d50d5098b3,11/30(木) 11:33
ksbv,KSB瀬戸内海放送,さぬき市の60代男性が新型コロナワクチン接種後に死亡　国の一時金を給付へ,https://news.yahoo.co.jp/articles/b129831617fb5eb7c33c16dcf0c5ad877805503e,11/30(木) 10:23
ksbv,KSB瀬戸内海放送,森山未來さんが岡山・奈義町へ　森の芸術祭参加アーティストとして伝統芸能「横仙歌舞伎」を体験,https://news.yahoo.co.jp/articles/1ef9eb0b29bee067158d902836b9c44730c5ffc5,11/29(水) 18:42
ksbv,KSB瀬戸内海放送,住み続けたい街ランキング　香川県の1位は…！？,https://news.yahoo.co.jp/articles/69003d4f260a0613eeba3ce9c23aecfba7f9b5fc,11/29(水) 18:33
ksbv,KSB瀬戸内海放送,コンビニ強盗を想定した防犯訓練　香川では今年5件の強盗事件,https://news.yahoo.co.jp/articles/d85ca869ebd0e65f9b8db958f77536a67f6a198c,11/29(水) 18:21
ksbv,KSB瀬戸内海放送,【独自】岡山市　重複しているバス路線「廃止」で再編へ　30日に協議会で素案提示,https://news.yahoo.co.jp/articles/67ef72d94d46a034bf20440a3bcdf536f503d414,11/29(水) 18:17
ksbv,KSB瀬戸内海放送,なぜお肉はおいしい？幸せな気持ちになる理由は？　専門家がお肉の疑問に回答【みんなのハテナ】,https://news.yahoo.co.jp/articles/60e0f088c221359ff5e76580b5ef738188f871d8,11/29(水) 18:12
ksbv,KSB瀬戸内海放送,ホームセンター「カインズ」が岡山市初出店　開店と同時に約800人の客が　四国のファン獲得にも期待,https://news.yahoo.co.jp/articles/4556b9f1f3c69678412e9541e79f0d658d9feea5,11/29(水) 18:05
ksbv,KSB瀬戸内海放送,駅へ交通系ICカードの導入を　JR姫新線の沿線自治体トップらがJR西日本に要望書を提出　岡山,https://news.yahoo.co.jp/articles/f7974b3ac988f06493374973dbca4b9e60b9b164,11/29(水) 17:57
ksbv,KSB瀬戸内海放送,住み続けたい街ランキング　岡山県の1位は…！？,https://news.yahoo.co.jp/articles/eb3ec8242ad785d74485fe26a2a85e47325b8663,11/29(水) 17:42
ksbv,KSB瀬戸内海放送,高松市の女性消防隊が全国大会で優秀賞　市長に報告,https://news.yahoo.co.jp/articles/362af0b49e862b94aedf7bf5c4871fc9ea681e68,11/29(水) 17:16
ksbv,KSB瀬戸内海放送,丸い、落ちない、滑らない「マンホールおまもり」　先着50人も開始5分で配布終了　香川・観音寺市,https://news.yahoo.co.jp/articles/5bd3b8cb3341afa26deec24376cf80b796c52577,11/29(水) 17:15
ksbv,KSB瀬戸内海放送,咽頭結膜熱（プール熱）で幼稚園が学級閉鎖　岡山市では15年ぶり,https://news.yahoo.co.jp/articles/af280ae0d5e997562e430af7aa2ace429e0eec89,11/29(水) 17:06
ksbv,KSB瀬戸内海放送,市長や議員対象のハラスメント防止条例案まとまる　岡山・笠岡市議会　中国地方の市では初,https://news.yahoo.co.jp/articles/8f050a78c88a1fd318b439992aee11b11339cf22,11/29(水) 16:28
ksbv,KSB瀬戸内海放送,岡山県の中高校生　視力1.0未満の割合が過去ワースト,https://news.yahoo.co.jp/articles/09dd9cdea200bce3b59084852f5e9e3d426ec4da,11/29(水) 16:18
ksbv,KSB瀬戸内海放送,体験を通して防災知識を育む「くらしき防災フェア」　約1万5000人が訪れる　岡山・倉敷市【こつこつ防災】,https://news.yahoo.co.jp/articles/a1e55005bc513b6580b6d1f1dbb70245a0d4d9cf,11/29(水) 16:11
ksbv,KSB瀬戸内海放送,JR岡山駅前の再開発「駐車場エリア」が完成　506台駐車可能　近くの商業施設と提携,https://news.yahoo.co.jp/articles/dea361cc09760914f4dfcdd191fb3703c6baa771,11/29(水) 16:06
ksbv,KSB瀬戸内海放送,"V3女子・倉敷アブレイズが12月2,3日にホーム戦　Vサマーリーグでは東レアローズに勝利",https://news.yahoo.co.jp/articles/0c4e8d8229f0658507db43130e512844c676f56e,11/29(水) 16:03
ksbv,KSB瀬戸内海放送,「勇気を出して相談してほしい」　岡山市で犯罪被害者支援のフォーラム,https://news.yahoo.co.jp/articles/8b50c525eab76f85a873044073363fc79d35c484,11/29(水) 14:30
ksbv,KSB瀬戸内海放送,岡山市の新アリーナ基本計画素案　市議会委員会では「市民の利用しやすい料金設定」などの要望が,https://news.yahoo.co.jp/articles/993d027fd4cef657837e611019a2d4b29f535407,11/29(水) 10:48
ksbv,KSB瀬戸内海放送,保育園の時に4つの全国大会で優勝　実戦空手のスーパーキッズ・今中櫻子さん（小1）　岡山・赤磐市【こどもミライパーク】,https://news.yahoo.co.jp/articles/bf770cced99507f4e2e8280546d89300e74425b7,11/28(火) 19:40
ksbv,KSB瀬戸内海放送,【特集】高松市サンポート地区で遊歩道化へ社会実験　近隣住民から不安の声「子どもたちの事故が心配」,https://news.yahoo.co.jp/articles/99dd3fb5adda2c666a4b2e0da013ac2f6d77b8be,11/28(火) 19:35
ksbv,KSB瀬戸内海放送,JR芸備線の再構築協議会　斉藤鉄夫国交大臣「できるだけ早く設置したい」,https://news.yahoo.co.jp/articles/63e60360b379e5e8794386483b2e1ce715148959,11/28(火) 19:25
ksbv,KSB瀬戸内海放送,香川県　インフルエンザで6校7学級が学級閉鎖　1校1学年が学年閉鎖,https://news.yahoo.co.jp/articles/918b8177f15846c16209e022cb35c5296e31b4fe,11/28(火) 18:56
ksbv,KSB瀬戸内海放送,備前市出身・山本由伸投手がパ・リーグ年間MVP　幼馴染の頓宮裕真選手は首位打者・ベストナイン　岡山,https://news.yahoo.co.jp/articles/8cdf895d1b589a6e2d8415e0476e361b3ab825ca,11/28(火) 18:46
ksbv,KSB瀬戸内海放送,電動3輪バイクで小豆島を観光　学生が企業とツアー開発　香川,https://news.yahoo.co.jp/articles/0d060d044998ab0d5487739819e6224b358cbac0,11/28(火) 18:27
ksbv,KSB瀬戸内海放送,JR四国　10月の鉄道収入が初めてコロナ禍前を上回る　火災のJR善通寺駅は修復が2024年3月までかかる見通し,https://news.yahoo.co.jp/articles/adb48c1e70582b16320ab66b28b3fb863333845f,11/28(火) 18:26
ksbv,KSB瀬戸内海放送,「ペット用自販機」がJR高松駅に登場　「犬・猫用さぬきうどん」など特産使ったえさやおもちゃを販売　香川,https://news.yahoo.co.jp/articles/bd9c9f6d9d4a7b85ef866431aa470cfff571d2fe,11/28(火) 18:03
ksbv,KSB瀬戸内海放送,岡山盲学校・聾学校の新校舎整備へ検討委員会　「一体型か併設型か」など協議,https://news.yahoo.co.jp/articles/3500b8775c0b134349b909637a5938a70cf2f232,11/28(火) 18:00
ksbv,KSB瀬戸内海放送,改良復旧工事中に…川の泥から基準値超の鉛やヒ素　処分などで工事費が約1億6600万円増額　岡山県「悪影響ない」,https://news.yahoo.co.jp/articles/1f9287dc487cdeff37afca6f225f435eb3a20274,11/28(火) 17:53
ksbv,KSB瀬戸内海放送,牛窓港沖で貨物船が座礁　乗組員5人にけがなし　油の流出なし　岡山・瀬戸内市,https://news.yahoo.co.jp/articles/ed3284f9fb085cbc319b4cb0578f99a19eedc0e5,11/28(火) 17:37
ksbv,KSB瀬戸内海放送,年末年始の高速道路　中国支社管内では5km以上の渋滞が前年度の3倍の予測,https://news.yahoo.co.jp/articles/e88cbc4bb339947a75570188d31522c78ad59823,11/28(火) 17:29
ksbv,KSB瀬戸内海放送,死んだ野鳥を遺伝子検査　「H5亜型」高病原性鳥インフルエンザを検出　香川県で今季初　香川・東かがわ市,https://news.yahoo.co.jp/articles/bec26a0fe6381653b65c5b9144d40d75c789320a,11/28(火) 17:03
ksbv,KSB瀬戸内海放送,贈賄罪で罰金の美作市議に対し辞職勧告決議案を可決　議会中に謝罪を申し出る場面も…報道陣の取材には応じず　岡山・美作市,https://news.yahoo.co.jp/articles/f11a434a3a268b76f8920e9094f0077f846cd561,11/28(火) 16:56
ksbv,KSB瀬戸内海放送,設備の老朽化も…香川用水の耐震化工事進む　南海トラフ地震に備え,https://news.yahoo.co.jp/articles/a89a2b78f1a5e8ffd261c43256fb48e49cb7f8b0,11/28(火) 16:50
ksbv,KSB瀬戸内海放送,高松市の路線バス再編案　13路線で約4割減便　「2024年問題」への対応で　香川,https://news.yahoo.co.jp/articles/732aa60e795699e10232f6c948dc59a4e4603e17,11/28(火) 14:34
ksbv,KSB瀬戸内海放送,観音寺市運営のLINEアカウントから個人情報閲覧可能な状態に…URLのリンクミスが原因,https://news.yahoo.co.jp/articles/0da4dd3b85d84da85ecb27adef4867c676694b34,11/28(火) 13:10
ksbv,KSB瀬戸内海放送,高松市が音楽プロデューサー・ 塚田良平さんに「シティプロモーションプロデューサー」を委嘱　東京での認知度向上へ,https://news.yahoo.co.jp/articles/ec595ff8b10a912e43ec856f508fd1dfdd8f6a18,11/28(火) 12:07
ksbv,KSB瀬戸内海放送,感染症の発生に備え関係機関の連携強化を　岡山市の病院で訓練,https://news.yahoo.co.jp/articles/b50b044004b8c64ec9b59a04eb69bffa308d445e,11/27(月) 19:42
ksbv,KSB瀬戸内海放送,「費用高い」と指摘の香川県議らの海外派遣　参加議員が議会で意義強調「必ず成果があると確信」,https://news.yahoo.co.jp/articles/55fa5499da0b2aca5db696ac7c929fc0a671ec15,11/27(月) 18:23
ksbv,KSB瀬戸内海放送,倉敷市　小中学校3校を統廃合し義務教育学校を新設へ　2026年4月開校予定　岡山,https://news.yahoo.co.jp/articles/16bbd8da46e926ba2f016e2413486cd9c9c81784,11/27(月) 18:13
ksbv,KSB瀬戸内海放送,JR芸備線の再構築協議会　岡山県「既存協議会での協議を希望も設置なら参加」と国に回答,https://news.yahoo.co.jp/articles/523abd71648ce447bf2117204f16284720c2838a,11/27(月) 18:07
ksbv,KSB瀬戸内海放送,高松国際ピアノコンクールで4位の西本裕矢さん　地元・高松市の小学校で演奏を披露,https://news.yahoo.co.jp/articles/41b5afcfa6ef46eb200d67ba810a17c1b30b5366,11/27(月) 18:05
ksbv,KSB瀬戸内海放送,今季新設V3・女子　倉敷アブレイズが開幕2連勝　岡山,https://news.yahoo.co.jp/articles/cfe4667b4a81ca63d7b15b075fa44f622a66b63c,11/27(月) 18:03
ksbv,KSB瀬戸内海放送,ことでん琴平線・学生などの利用見込み　平日夕方の一部電車の運行区間を滝宮駅まで延長へ　香川,https://news.yahoo.co.jp/articles/92010bb666a0d5a38ec3a96474561b70a6b3ace3,11/27(月) 18:02
ksbv,KSB瀬戸内海放送,3年ぶりに台湾・高雄から高松空港にチャーター便が到着　2024年1月末まで週3往復運航　香川,https://news.yahoo.co.jp/articles/bcaf46fcbe41fc53f19b62d4ae614daf24384513,11/27(月) 17:07
ksbv,KSB瀬戸内海放送,島人口の3倍近くが集結　漁師がタコの魅力伝える「本島タコタコフェスティバル」　香川・丸亀市,https://news.yahoo.co.jp/articles/b6d58042687788d9bc17f3ed146054dc161eb8cb,11/27(月) 15:54
ksbv,KSB瀬戸内海放送,"産廃処分場の排水から基準値超える有機化合物　発がん性指摘の「1,4‐ジオキサン」　岡山・津山市",https://news.yahoo.co.jp/articles/8324d69ea213c3df021009ca64f83e841835152f,11/27(月) 15:09
ksbv,KSB瀬戸内海放送,岡山市が新アリーナの基本計画素案を発表　メインアリーナの観客席は5000席以上,https://news.yahoo.co.jp/articles/d2000250d8704caa4eef06adfbf2dd3cf2a5a785,11/27(月) 12:36
ksbv,KSB瀬戸内海放送,藤井聡太八冠が琴平町で祝賀会　讃岐うどん味わう「おそらく2回目」　自身の対局解説も　香川,https://news.yahoo.co.jp/articles/577ce927e02bdf3f0fbd4f7f15960ef4a4405576,11/27(月) 11:56
ksbv,KSB瀬戸内海放送,藤井聡太八冠が琴電琴平駅に　「ことでん」の制服に着替えて車掌ポーズを披露　香川,https://news.yahoo.co.jp/articles/f0b98c43f9508864f4f62181dbcf759533a861dc,11/27(月) 11:07
ksbv,KSB瀬戸内海放送,全日本実業団対抗女子駅伝で天満屋女子陸上部が7位入賞　宮城県,https://news.yahoo.co.jp/articles/6e6f896e29a29ac1370577c6f18f562e8e3ead9c,11/26(日) 18:17
ksbv,KSB瀬戸内海放送,岡山市の西川緑道公園筋を歩行者天国に　家族連れら楽しむ,https://news.yahoo.co.jp/articles/52058f01292fca44ecf8e970ccb3f5190db37700,11/26(日) 18:04
ksbv,KSB瀬戸内海放送,岡山市中心部でイノシシが目撃される,https://news.yahoo.co.jp/articles/a1a93072bb69a46c67ac30e1e2d90acdcc0c7242,11/25(土) 16:59
ksbv,KSB瀬戸内海放送,「津山ふるさと大使」にウエストランド　任命式　岡山,https://news.yahoo.co.jp/articles/75fa658ce7c58f3927b6cac18a59ac064801b1af,11/25(土) 16:27
ksbv,KSB瀬戸内海放送,認知症SOS　やさしい声掛け訓練　香川,https://news.yahoo.co.jp/articles/d453f553065de590d95fdb8e5183f5dd410ac333,11/25(土) 13:42
ksbv,KSB瀬戸内海放送,名刀と人気ゲーム「刀剣乱舞」がコラボ　「山鳥毛」特別展始まる　岡山,https://news.yahoo.co.jp/articles/cf08605c7b15421945f4428a882f389eab8ab30f,11/25(土) 13:21
ksbv,KSB瀬戸内海放送,岡山・笠岡市の住宅や井原市の酒蔵　国の登録有形文化財登録を答申,https://news.yahoo.co.jp/articles/f6ecdc4da6491867bbfc69d851419d0462ea9f8e,11/24(金) 19:00
ksbv,KSB瀬戸内海放送,香川県民にとってはアタリマエ！　お正月の郷土料理「あんもち雑煮」,https://news.yahoo.co.jp/articles/6bd34cbf3682b0c3b6d91f4644e29cc89da42e16,11/24(金) 18:43
ksbv,KSB瀬戸内海放送,人気ピアニスト・ハラミちゃん「頑張って高校生になり切った」　高校でサプライズ演奏　教職員が生徒に内緒で企画　岡山・倉敷市,https://news.yahoo.co.jp/articles/6c2d812ef926940dbb6f494c7059c5836a6bafb3,11/24(金) 18:33
ksbv,KSB瀬戸内海放送,一足早いクリスマスを　岡山市の中心部に巨大なプレゼントボックスのイルミネーション,https://news.yahoo.co.jp/articles/173eff8bba3f1b1bd2004348efd5d26ac7755a01,11/24(金) 18:24
ksbv,KSB瀬戸内海放送,荷主が荷積みと荷降ろし行いドライバーの「荷待ち」時間を短縮　2024年問題に向け先進的な対策を香川労働局長らが視察,https://news.yahoo.co.jp/articles/b51f5dc338bfea65a9c9f53ddebdfc20a26d5730,11/24(金) 18:13
ksbv,KSB瀬戸内海放送,クラフトビールや珍味など…高松駅の駅ビル開業に向けJR四国グループが商品開発「ここでしか買えないお土産を」,https://news.yahoo.co.jp/articles/4b8f6033125fea8568e199f507b473af90f364fd,11/24(金) 18:04
ksbv,KSB瀬戸内海放送,なぜ今？岡山市の水道料金値上げ　背景には老朽化や節水機器の普及,https://news.yahoo.co.jp/articles/e311937897cb43746af3a130e8978aee160c8c61,11/24(金) 17:58
ksbv,KSB瀬戸内海放送,松本明子さんと小学生が水産物のPR動画を撮影　YouTubeで公開へ　香川県,https://news.yahoo.co.jp/articles/b52be520f6f0c1e60d9b623e1e4e9f1cba1653ff,11/24(金) 17:42
ksbv,KSB瀬戸内海放送,高松市の庵治太鼓の鼻オートキャンプ場　民間企業のアイデアでリニューアルへ,https://news.yahoo.co.jp/articles/b35350cd06986dd669968d606ff016ba56ddb58c,11/24(金) 17:22
ksbv,KSB瀬戸内海放送,保育園児がミカンの収穫を体験　赤くて甘い坂出市発祥の「小原紅早生」　香川,https://news.yahoo.co.jp/articles/983938f937b58aca92d841f59a75de1f4f48e404,11/24(金) 16:07
ksbv,KSB瀬戸内海放送,サッカーJ2・ファジアーノ岡山　木山隆之監督の続投を発表「悔しさを糧に挑み続ける」,https://news.yahoo.co.jp/articles/e55fa943bf988add4eb02750e26e4dbf2c04d3bd,11/24(金) 14:09
ksbv,KSB瀬戸内海放送,大規模災害に備え　技術や知識持つボランティアを養成する研修会　岡山,https://news.yahoo.co.jp/articles/83c96dd5f705eee10041eab0d90fefc661561c02,11/24(金) 12:06
ksbv,KSB瀬戸内海放送,こだわりの新米をおいしく！おにぎり専門店と土鍋ごはん　岡山・香川【ほっとマルシェ】,https://news.yahoo.co.jp/articles/a2c2e6b05fdc75430cdbe0d3cd48e17465ab9308,11/24(金) 12:04
ksbv,KSB瀬戸内海放送,香川県選管が2022年分の政治資金収支報告書を公表　収入の合計は前年より10％以上増加,https://news.yahoo.co.jp/articles/6e87f38662c6caec73855c0f3c689e2c56c0a2c3,11/24(金) 11:49
ksbv,KSB瀬戸内海放送,栗林公園で秋のライトアップ始まる　12月3日まで　期間中は若い人の来園が増加する傾向　高松市,https://news.yahoo.co.jp/articles/5204ac55243d3255dbb3b2b1cd3b2e93e37780f1,11/24(金) 11:08
ksbv,KSB瀬戸内海放送,「杜の街グレース」に温泉&フィットネス施設開業　個室でサウナと風呂楽しめるスペースも　岡山市,https://news.yahoo.co.jp/articles/a6c58efa2ebfdff932e2a9f5cf2e96106f571e67,11/23(木) 18:14
ksbv,KSB瀬戸内海放送,日頃の疲れを癒やして…「プラ寝たリウム」鑑賞会　勤労感謝の日に快適な睡眠環境を提供　高松市,https://news.yahoo.co.jp/articles/92a40249b9dccb0360e3f8e7aae3763ecba6a1d0,11/23(木) 18:06
ksbv,KSB瀬戸内海放送,女子サッカーの普及へ女性向けのイベント　吉備国大シャルムや湯郷ベルの選手も参加　岡山,https://news.yahoo.co.jp/articles/f82f20610079c0cf92803b661f4f95cb000b3855,11/23(木) 17:41
