media_en,media_jp,title_articles,link_articles,date_original
ksbv,KSB瀬戸内海放送,飲酒運転根絶へ…園児らが大根を家族にプレゼント　警察「大根と大根絶を掛けさせていただいて…」　岡山・倉敷市,https://news.yahoo.co.jp/articles/317de186a9e097422bbf9a41c8a63ec590610d7c,12/12(火) 17:02
ksbv,KSB瀬戸内海放送,選手が飲酒運転で逮捕…社長が謝罪「全て私の監督不行き届き」　B3香川ファイブアローズ,https://news.yahoo.co.jp/articles/4453f09de4eb6df0dc4133525c1848d59edf8370,12/12(火) 16:18
ksbv,KSB瀬戸内海放送,山陽新幹線　年末年始の予約率は40%　下りのピークは12月29日か(12/11時点),https://news.yahoo.co.jp/articles/9221891768617220e533a45c635613980dbb1070,12/12(火) 16:14
ksbv,KSB瀬戸内海放送,「正社員の人手不足」の割合が3年連続で上昇　過去4番目の高水準　四国の企業,https://news.yahoo.co.jp/articles/d6998f85e19639427a1e2a8de95d87e955186d8f,12/12(火) 14:36
ksbv,KSB瀬戸内海放送,ファジアーノ岡山U-18 高校生年代サッカーの最高峰の「プレミアリーグ」に初昇格,https://news.yahoo.co.jp/articles/9e7a6c2bf29aec2078f2cf407573525d87bf6fb2,12/12(火) 14:00
ksbv,KSB瀬戸内海放送,労働組合の口座から60万円近く横領か…上司への殺人未遂容疑で逮捕・起訴の男（50）を再逮捕　香川・さぬき市,https://news.yahoo.co.jp/articles/7bc6068bff8e4df14c07eabe037ab5ea703a7a31,12/12(火) 12:25
ksbv,KSB瀬戸内海放送,幼稚園児の3割超が視力1.0未満　過去最も高い割合に　香川県,https://news.yahoo.co.jp/articles/9bbd80e822ac76a8a3f66036dca7fdaa4ed93ae1,12/12(火) 11:48
ksbv,KSB瀬戸内海放送,岡山・瀬戸内市で住宅全焼　避難しようと2階から飛び降りた住人男性(73)がけが,https://news.yahoo.co.jp/articles/a3f6f3430e25921ded05500ea53d58d732b065f9,12/12(火) 11:37
ksbv,KSB瀬戸内海放送,正月飾りの縁起物「千両」の競り　降水量減で実はやや小ぶり　高松市,https://news.yahoo.co.jp/articles/01d3eb3851213b60f21b5d30f58a44a2a6481754,12/12(火) 10:30
ksbv,KSB瀬戸内海放送,フィギュア・三宅星南選手　全日本選手権へ意気込み「4回転ジャンプを成功させたい」　地元・岡山県矢掛町で意気込み,https://news.yahoo.co.jp/articles/eb8d9060fc41e4d966f02a5dad966a273b3763f5,12/11(月) 20:08
ksbv,KSB瀬戸内海放送,マイクロモビリティを観光手段に　牟礼・庵治エリアで実証実験　香川,https://news.yahoo.co.jp/articles/a23a66929a8d0f447883464a19436f4564503a3a,12/11(月) 20:06
ksbv,KSB瀬戸内海放送,プラスチックごみを「燃えるごみ」から「資源ごみ」に　岡山市南区にプラスチックの中間処理施設が完成,https://news.yahoo.co.jp/articles/1cb6bbb4d6046cd641a3fc305932058087e247ff,12/11(月) 19:39
ksbv,KSB瀬戸内海放送,高校バスケウインターカップ女子岡山代表・倉敷翠松　ベスト8へ！後輩を陰で支える「お母さん」,https://news.yahoo.co.jp/articles/3330934709b651ba94538f010c7a582b7f1256de,12/11(月) 19:14
ksbv,KSB瀬戸内海放送,高松市・新屋島水族館にコツメカワウソが仲間入り　桂浜水族館生まれの「鳩三朗」繁殖に期待,https://news.yahoo.co.jp/articles/5d4249a56b9f08c1c4a81e0770cb25799f8e9540,12/11(月) 19:07
ksbv,KSB瀬戸内海放送,長島愛生園の調理師(50代)が入所者用の食材を無断で持ち出したとして懲戒免職処分,https://news.yahoo.co.jp/articles/7ed92d093d4baa40f9d9a053fe4a7e4f90015ba4,12/11(月) 18:16
ksbv,KSB瀬戸内海放送,焼き芋食べて「ゆったり」運転を　香川・丸亀警察署で交通安全呼び掛け,https://news.yahoo.co.jp/articles/0efdfb8c3b3006cbb810efdbcb44de68ee601822,12/11(月) 18:13
ksbv,KSB瀬戸内海放送,世界的チェリスト・宮田大さんが小学校で演奏「風景をイメージしながら聴いて」　香川・三豊市,https://news.yahoo.co.jp/articles/a094b482393883f0c6133daa90588be633367c5b,12/11(月) 18:08
ksbv,KSB瀬戸内海放送,香川県が過去使用の2ドメインを第三者が再利用　ウェブサイト管理者にリンクの削除など依頼,https://news.yahoo.co.jp/articles/2144f418ffb01063a2c9ff2d81bfcf2534a4443b,12/11(月) 18:05
ksbv,KSB瀬戸内海放送,岡山市議会　傍聴席への子どもの入場規制を廃止　子育て世代の議員らの要望受け,https://news.yahoo.co.jp/articles/c4c66c62839b305752959a20c0e8430d5d409061,12/11(月) 18:01
ksbv,KSB瀬戸内海放送,プロバスケ・香川ファイブアローズの選手を逮捕　酒気帯び運転をした疑い,https://news.yahoo.co.jp/articles/cf6524d5ea447198159b64b137dd1bb34f8861c7,12/11(月) 17:47
ksbv,KSB瀬戸内海放送,移動が多くなる年末年始を前に…交通機関を全国一斉点検　新岡山港ではフェリー点検,https://news.yahoo.co.jp/articles/91782cdac502cfb65ee49f238728afd03b2edd34,12/11(月) 17:16
ksbv,KSB瀬戸内海放送,目指すは“先輩”渡邊雄太超え　香川代表・尽誠学園が掲げる「全員守備・全員攻撃」　高校バスケウインターカップ男子,https://news.yahoo.co.jp/articles/1836cd63b1975ca30254f5da280fdcb0f0d8989a,12/11(月) 16:37
ksbv,KSB瀬戸内海放送,科学の甲子園ジュニア全国大会　香川県代表チームが優勝！,https://news.yahoo.co.jp/articles/e68e20ddd7f42866f77c172b458ab9ee345977ff,12/11(月) 15:05
ksbv,KSB瀬戸内海放送,「秋の烏城灯源郷」岡山城天守の入場者数　2023年はコロナ禍前を上回る,https://news.yahoo.co.jp/articles/cca0b9a38b4f78bd5e1a04575e129d23851d2384,12/11(月) 12:57
ksbv,KSB瀬戸内海放送,岡山市の新アリーナ実現求め　プロスポーツチームの選手らが署名活動,https://news.yahoo.co.jp/articles/43ae2a38ef88f7fc7b3802d756ad8c006618694c,12/11(月) 12:14
ksbv,KSB瀬戸内海放送,巨人のコーチ・鈴木尚広さんが野球教室　代走通算盗塁の日本記録保持者がコツなど指導　岡山市,https://news.yahoo.co.jp/articles/b94906fbab9da2f293efd944aab3edd296f1c837,12/11(月) 12:00
ksbv,KSB瀬戸内海放送,駐屯地内で同僚男性にキス…目撃の隊員に不快な思いさせたと自衛隊員2人を懲戒処分　香川・善通寺市,https://news.yahoo.co.jp/articles/a50b77bd4aa2e1210f03817665953e4ef6db90e3,12/11(月) 11:53
ksbv,KSB瀬戸内海放送,全日本ロボット相撲大会　2部門で香川県の高校のチームが優勝,https://news.yahoo.co.jp/articles/d674d8911e2cfcc229ff7647d9917811b4aabc4d,12/11(月) 11:10
ksbv,KSB瀬戸内海放送,金融・経済の知識を競う高校生のクイズ大会　エコノミクス甲子園香川大会,https://news.yahoo.co.jp/articles/a3fa47235767287d8baf850cefc8b470e22e5baf,12/10(日) 18:00
ksbv,KSB瀬戸内海放送,讃岐国府跡周辺の魅力を発信しようという祭りが開かれ多くの人でにぎわう　香川・坂出市,https://news.yahoo.co.jp/articles/dfe8395860c2d8fc3249319f6c6cdf6977350f2a,12/10(日) 17:09
ksbv,KSB瀬戸内海放送,勝ち負けは競わず子どもたちに運動の楽しさを感じてもらうイベント　岡山市,https://news.yahoo.co.jp/articles/68af12e7d8008b3b887c36aee74bc7da18e34f89,12/10(日) 16:23
ksbv,KSB瀬戸内海放送,オリックス3連覇に貢献　首位打者を獲得した頓宮裕真選手が地元でトークショー　岡山・備前市,https://news.yahoo.co.jp/articles/bb96d4ecbd26479060e2743c49f03e6042547ca3,12/10(日) 16:21
ksbv,KSB瀬戸内海放送,日本代表・佐野海舟選手（津山市出身）のサッカー教室　 岡山,https://news.yahoo.co.jp/articles/d15c732e6ed6d75e3b6997ef0fced487196ffa44,12/9(土) 17:07
ksbv,KSB瀬戸内海放送,ことでん踏切で車が立ち往生　電車と衝突　けが人なし　香川,https://news.yahoo.co.jp/articles/4a949b6b31a142fcaf2d9b25f2d095ebfa17b1a0,12/9(土) 17:07
ksbv,KSB瀬戸内海放送,北海道の新鮮なホタテを1枚100円で販売　岡山,https://news.yahoo.co.jp/articles/ef9033d7cfbd70938b2c145972a90c3401a75c92,12/9(土) 12:17
ksbv,KSB瀬戸内海放送,障害者施設で作った菓子や小物などの販売会　香川・三木町,https://news.yahoo.co.jp/articles/fa1aff9ee258588ac4cf078e1c8dfe13b87e37ca,12/9(土) 12:17
ksbv,KSB瀬戸内海放送,採れたてイチゴがごろごろのったタルトなど　岡山・香川のイチゴのスイーツを紹介【ほっとマルシェ】,https://news.yahoo.co.jp/articles/8d8a824029aeffeaeea438e664627cf33b3e4bf0,12/8(金) 18:57
ksbv,KSB瀬戸内海放送,料金箱には紙を押し込み…防犯カメラに不審行動　無人販売店で肉2パックを盗んだ疑い　59歳男を逮捕　香川・観音寺市,https://news.yahoo.co.jp/articles/abad1b88fff5497df9b7b00505bd636925884ca5,12/8(金) 18:45
ksbv,KSB瀬戸内海放送,岡山特産の黄ニラがたっぷり！　冬に食べたい「もつ鍋」　岡山市,https://news.yahoo.co.jp/articles/8f0bc84406131f9feca322a67c8d143577e4974e,12/8(金) 18:45
ksbv,KSB瀬戸内海放送,年末年始の事故を防げ　香川県警で交通指導取締りの出発式,https://news.yahoo.co.jp/articles/f98069a9b9b3a563d759e9c969ca0d08560743ea,12/8(金) 18:21
ksbv,KSB瀬戸内海放送,倉敷市・夫婦殺傷事件からあすで1週間　男性の死因は出血性ショック　近くには血が付いた刃渡り22cmの刺し身包丁が,https://news.yahoo.co.jp/articles/dca6de0f90545880235d8a66dcca92cde14e5053,12/8(金) 18:13
ksbv,KSB瀬戸内海放送,2024年の岡山・笠岡市長選　現職の小林嘉文市長が立候補表明　3期目目指す,https://news.yahoo.co.jp/articles/79fba27b1983689f98aae0b30448e201006f4730,12/8(金) 18:10
ksbv,KSB瀬戸内海放送,小豆島の食の魅力を東京で発信　オリーブやそうめんをPR　東京農大の学生が考案した商品も,https://news.yahoo.co.jp/articles/4862044fad38baba4e5006ee4a3224d4b4b35214,12/8(金) 17:53
ksbv,KSB瀬戸内海放送,中国地区は岡山城東を推薦　来春のセンバツ21世紀枠地区候補,https://news.yahoo.co.jp/articles/4b2662dbc20dfa807c1d88f29ddc24b99d62bc6a,12/8(金) 17:52
ksbv,KSB瀬戸内海放送,引っ越し手続きを「まとめて」オンラインで　2024年1月から香川県で実証実験　個人の特定にはマイナカード活用,https://news.yahoo.co.jp/articles/4a054b5bd4e92782ac0c072d5fb86581a524b4c6,12/8(金) 17:35
ksbv,KSB瀬戸内海放送,インフルエンザで8校(園)が学年・学級閉鎖　香川,https://news.yahoo.co.jp/articles/c68f893ab0a22551147fabdebc2011050b437648,12/8(金) 17:09
ksbv,KSB瀬戸内海放送,岡山県　国の総合経済対策受け　物価高騰支援など盛り込んだ追加補正予算案,https://news.yahoo.co.jp/articles/f06b5ebba08dcc1f765be84deff08385c84ceb13,12/8(金) 16:48
ksbv,KSB瀬戸内海放送,香川県の港や空港の「軍事利用」を拒否　反対派県議ら県に申し入れ,https://news.yahoo.co.jp/articles/3a0600d95fbcb6c095c91467883d41d034c4c8b3,12/8(金) 16:44
ksbv,KSB瀬戸内海放送,母親を殺害した疑いで送検の女性を不起訴に　精神鑑定の結果から刑事責任を問えないと判断か　岡山地検津山支部,https://news.yahoo.co.jp/articles/3176bd190aa928457e0e890597d6c60dda3047cf,12/8(金) 16:40
ksbv,KSB瀬戸内海放送,ジェットスター高松―成田線が就航10周年　今夏からは利用客数がコロナ禍前を上回る,https://news.yahoo.co.jp/articles/b2d4b814166ee728a2be419e93737f764a2d17f1,12/8(金) 16:39
ksbv,KSB瀬戸内海放送,インフルエンザ患者　1医療機関あたり23.60人　香川,https://news.yahoo.co.jp/articles/334c44e849f0b2630b0d424df7d17006eee736e0,12/8(金) 16:00
ksbv,KSB瀬戸内海放送,一足早くクリスマス気分を　恒例のクリスマス電車が運行開始　園児「かわいいしきれい」　岡山市,https://news.yahoo.co.jp/articles/76139b4ee91be900914a5a5b0cbe1903d31a69b4,12/8(金) 15:39
ksbv,KSB瀬戸内海放送,インフルエンザで5小学校が学級閉鎖へ　岡山市,https://news.yahoo.co.jp/articles/e76853f858b3d96132347be9d34468e8f283b963,12/8(金) 15:27
ksbv,KSB瀬戸内海放送,イノシシ捕獲の補助金未交付　玉野市が職員を懲戒処分　岡山,https://news.yahoo.co.jp/articles/cb6fa8c24f7c244b8bc412190ed30b4b2d8dcac5,12/8(金) 15:16
ksbv,KSB瀬戸内海放送,JR西日本　初詣臨時列車の運転ダイヤ発表　岡山駅〜最上稲荷に近い備中高松駅まで1時間ごとに運転,https://news.yahoo.co.jp/articles/348c62feb7f8bfac96c030bd72e3faa9ca4a7d73,12/8(金) 14:55
ksbv,KSB瀬戸内海放送,インフルエンザ　警報レベル続く　岡山市と備北地域も「レベル3」に　岡山,https://news.yahoo.co.jp/articles/66094b38705335a016dc350e0fd0a7123985a4c0,12/8(金) 14:00
ksbv,KSB瀬戸内海放送,岡山県の新型コロナ感染状況　1医療機関当たり2.17人,https://news.yahoo.co.jp/articles/6a6feb0bcfbc6fb3642f132b0547479ae75e8ac2,12/8(金) 13:56
ksbv,KSB瀬戸内海放送,11月の倒産件数は10件　3カ月連続で増加　岡山,https://news.yahoo.co.jp/articles/3e65a3be34884aacb700f179a40dcb8c9963048e,12/8(金) 13:54
ksbv,KSB瀬戸内海放送,犯人を素早く検挙せよ！警察官の「逮捕術」を競う大会　香川県警,https://news.yahoo.co.jp/articles/97c569127aba0666e1498022a71ab12899f24a84,12/8(金) 11:59
ksbv,KSB瀬戸内海放送,河川敷で16歳の少女に下半身露出　公然わいせつ容疑で会社員の男（46）を逮捕　香川,https://news.yahoo.co.jp/articles/cc32c61e98634b8e488fdcb5069f6acf2e5610d7,12/8(金) 10:57
ksbv,KSB瀬戸内海放送,倉敷市・夫婦殺傷事件　夫の死因は「出血性ショック」　上半身には複数の刺し傷や殴られたような痕　岡山,https://news.yahoo.co.jp/articles/5dfbcaafee9a4682acccac455393b6e0a47eb746,12/8(金) 9:47
ksbv,KSB瀬戸内海放送,【特集】真備中学校のマーチングバンドが初の全国大会へ　西日本豪雨乗り越え「音楽で街を元気に」　岡山,https://news.yahoo.co.jp/articles/97d307c37981d5b92c3539214b4069dbd54d5aa0,12/7(木) 18:58
ksbv,KSB瀬戸内海放送,中・高校生が「先生」に　小学校で出前授業…睡眠の大切さを伝える　岡山・倉敷市,https://news.yahoo.co.jp/articles/9e996846ef20423306f80086169a843b9ec8668e,12/7(木) 18:55
ksbv,KSB瀬戸内海放送,新型コロナ5類移行後初の年末年始　ホテルや飲食店「年末年始の動きが早い」の声　岡山市,https://news.yahoo.co.jp/articles/9488863f4600f09707a6166fb041ce85f001b26b,12/7(木) 18:45
ksbv,KSB瀬戸内海放送,【解説】高松市のバス路線が大幅減便へ　背景には運転手不足と2024年問題　市は「電車とバスを組み合わせた交通」目指す,https://news.yahoo.co.jp/articles/f50ebc69dd8ee7d510864599f7280c51d15f9b2d,12/7(木) 18:36
ksbv,KSB瀬戸内海放送,岡山県　2023年夏の外国人宿泊者が前年の約9.6倍に　2019年比7割ほどに回復　最多は台湾から,https://news.yahoo.co.jp/articles/ac896dad9a4e3542cfe46ecb1aa253102c5d3303,12/7(木) 18:33
ksbv,KSB瀬戸内海放送,観音寺市議がSNSで差別的な投稿　辞職勧告決議を可決　「公人として不適切」香川,https://news.yahoo.co.jp/articles/f2ef4bc779d5ebb64552dcedb2897c2f1b0a9ca2,12/7(木) 18:30
ksbv,KSB瀬戸内海放送,虐待の疑いがある家庭への立ち入り調査を児相と警察が訓練　香川県での立ち入り調査は10年間で17件,https://news.yahoo.co.jp/articles/ce96f3fdd9cbca93558c34a5b4d1f39a45d859bc,12/7(木) 18:20
ksbv,KSB瀬戸内海放送,お気に入りの器を見つけて　全国各地の陶磁器を集めたイベント　岡山市,https://news.yahoo.co.jp/articles/519bbe429ca1571094571a096f419c7f93c6932f,12/7(木) 18:12
ksbv,KSB瀬戸内海放送,岡山市が「選択的週休3日制」導入へ　職員の育児や介護の支援で2024年度から,https://news.yahoo.co.jp/articles/b210f4de904cd1a285442c3c4c28981357b52bac,12/7(木) 18:07
ksbv,KSB瀬戸内海放送,トンネル火災で9月から通行止めの山陽道下り線　12月15日に解除へ　播磨JCT〜赤穂IC間,https://news.yahoo.co.jp/articles/613f3039a6a18489499917177c297044fb2d8c86,12/7(木) 18:04
ksbv,KSB瀬戸内海放送,お米甲子園で高松農業高校（岡山市）が全国1位の最高金賞に　農業高校の生徒が育てた米の食味を競う,https://news.yahoo.co.jp/articles/e371762ec58817b802f2c103571b38d12fd60909,12/7(木) 17:32
ksbv,KSB瀬戸内海放送,作陽出身・伊藤涼太郎選手がサッカー日本代表に初選出　津山市出身・佐野海舟選手も　岡山,https://news.yahoo.co.jp/articles/547d61de2380962824155e1e3bd1265e0d891a43,12/7(木) 14:23
ksbv,KSB瀬戸内海放送,志願者減少で…美作大学が短期大学部の募集を2025年度以降停止へ　岡山・津山市,https://news.yahoo.co.jp/articles/d1d8221716332e3eda7e9883918ff17074ff8560,12/7(木) 13:22
ksbv,KSB瀬戸内海放送,刀ごとの表情を楽しんで 「お守り刀」の展覧会　岡山市・林原美術館,https://news.yahoo.co.jp/articles/f7db54a9825251bd6fc1dee82dd0c43691ac96f3,12/7(木) 11:55
ksbv,KSB瀬戸内海放送,「ながら運転やめましょう」サンタ姿で小学生らが安全運転呼び掛け　高松市,https://news.yahoo.co.jp/articles/b4fbdf6bc0733959359a5c0c8460149f172c2078,12/7(木) 11:32
ksbv,KSB瀬戸内海放送,世界初「フル電動クレーン車」をタダノが開発　1台当たり約27tのCO2排出を削減　香川,https://news.yahoo.co.jp/articles/737e985af246ce39b0e10eff635d37006c20cdad,12/6(水) 19:22
ksbv,KSB瀬戸内海放送,「シラス干し」が全国で1番値上がりしたのは岡山市　なぜ？　この1年で100g389円上昇,https://news.yahoo.co.jp/articles/b26cd870e265a7fc35df0d699bfd7798eab6fab6,12/6(水) 19:12
ksbv,KSB瀬戸内海放送,ハンバーガーショップで強盗想定の訓練　11月に別店舗で発生の強盗事件はいまだ解決せず　香川,https://news.yahoo.co.jp/articles/780f8f7d4cb7c321187949ccc7a1c13890386d74,12/6(水) 18:43
ksbv,KSB瀬戸内海放送,DV被害者の情報を漏えいした三木町　和解案を議会に提案　提訴女性「二次被害を生んだことを恥ずかしいと思って」　香川,https://news.yahoo.co.jp/articles/0dc596cfb57abfb1493ecd81cf2f003df3951750,12/6(水) 18:34
ksbv,KSB瀬戸内海放送,イルミネーションはなぜ冬に飾る？いつ始まった？　専門家が疑問に回答【みんなのハテナ】,https://news.yahoo.co.jp/articles/673b25be010df45a0117414db02b200db5dc825a,12/6(水) 17:52
ksbv,KSB瀬戸内海放送,「老後生活に大いに不安感じる」半数超　百十四経済研究所が香川県民にアンケート,https://news.yahoo.co.jp/articles/4601828d8d907b101825917a98b3e39e60a57380,12/6(水) 17:24
ksbv,KSB瀬戸内海放送,岡山市のバス路線再編　素案に関するパブコメ募集　2024年1月にも計画策定へ,https://news.yahoo.co.jp/articles/23fdd7233a02fca77e81103eb24483539820719e,12/6(水) 17:21
ksbv,KSB瀬戸内海放送,落雷で焼けた国宝・神谷神社本殿　屋根の保存修理工事を前に氏子が現地見学　香川・坂出市,https://news.yahoo.co.jp/articles/53d295b348c00a0192d446248724aa3c0638d323,12/6(水) 16:47
ksbv,KSB瀬戸内海放送,JR岡山駅東口　新しい一般車ゾーンの仮運用開始　当面は降車のみ利用可,https://news.yahoo.co.jp/articles/846be5d35f6e1fa7216a801724068c1cd4d6b652,12/6(水) 15:47
ksbv,KSB瀬戸内海放送,温浴施設「クアタラソさぬき津田」の存続求め　さぬき市に1万人分超の署名　香川,https://news.yahoo.co.jp/articles/0a990dd6f6fbeeb2eea374d7e033bdfc1a7b62e0,12/6(水) 12:01
ksbv,KSB瀬戸内海放送,岡山・吉備中央町の水質問題　町の対応を検証する第三者委員会が初会合　2023年度中に再発防止策など報告予定,https://news.yahoo.co.jp/articles/d80c81a3dfc0bb4a328d78a6a8d1e719f748ef76,12/6(水) 11:32
ksbv,KSB瀬戸内海放送,【特集】商店街でゲームのお祭り　ゲームとどう付き合う？保護者とクリエイターの対話の場も　香川,https://news.yahoo.co.jp/articles/0dc6a3bc4a6953a623b20e080d2edcb357ab1cb6,12/5(火) 19:28
ksbv,KSB瀬戸内海放送,倉敷市出身プロサッカー選手がアフリカの子どもたちを支援へ　使われていないスパイクなど集める　岡山,https://news.yahoo.co.jp/articles/3c70a6651fde940aaa1b993dd693e80b881ed062,12/5(火) 19:13
ksbv,KSB瀬戸内海放送,イチゴの価格が高騰　スーパー担当者「過去一番ぐらい高い」　クリスマスケーキにも影響　岡山,https://news.yahoo.co.jp/articles/373c38a06e990c57b3798172396c5703e3a29485,12/5(火) 18:56
ksbv,KSB瀬戸内海放送,全国高校駅伝の連覇目指す倉敷高校が練習公開　副主将「今のチームで伸び伸びと走りたい」　岡山,https://news.yahoo.co.jp/articles/7b29d5da27e14df39e387713d8f2e4d9369b1bb2,12/5(火) 18:42
ksbv,KSB瀬戸内海放送,さぬき市の統合高校の基本計画　県内の高校初の「地域連携スペース」も　2030年4月の開校目指す　香川,https://news.yahoo.co.jp/articles/79ea33573cc6c53ff302125945fdcc32c9a13b26,12/5(火) 18:36
ksbv,KSB瀬戸内海放送,JR四国の特急「しおかぜ」「いしづち」の車両リニューアル　12月23日デビュー　親しみやすい「顔」に　岡山・高松と松山結ぶ,https://news.yahoo.co.jp/articles/625f76dba0cc2ca7657f8781dc71f39cdfd5fa9e,12/5(火) 18:19
ksbv,KSB瀬戸内海放送,「2024年問題」で高松市の路線バスは約4割削減の再編方針…高松市長が理解と協力求める,https://news.yahoo.co.jp/articles/ef58881a13594c3cb74c963792d2b26e24811b17,12/5(火) 16:58
ksbv,KSB瀬戸内海放送,「NFT」で樹齢200年の盆栽の「パトロン」に！　高松市の新たなふるさと納税返礼品に,https://news.yahoo.co.jp/articles/d3f9515feff8f0c48afbbf0395ac687fbd2bad1a,12/5(火) 16:04
ksbv,KSB瀬戸内海放送,金刀比羅宮　2024年の初詣は参拝制限なし　小判型お守り・限定御朱印も登場　香川・琴平町,https://news.yahoo.co.jp/articles/5d77628b0721e6bd5f5ea716328d2951b2b7ba1f,12/5(火) 15:45
ksbv,KSB瀬戸内海放送,岡山市　国の物価高騰対策を受け低所得世帯に7万円を給付へ　対象は約9万6000世帯,https://news.yahoo.co.jp/articles/985ebfb4aa50cf8214a5136636fb63eee6a9d681,12/5(火) 15:35
ksbv,KSB瀬戸内海放送,“練習場所がない”新体操部などへの影響懸念…井原市が代替地の確保断念　岡山県に井原高校南校地の借用延長求める,https://news.yahoo.co.jp/articles/d9c177468ee0f12cfbae89f4f6311aab783e3b39,12/5(火) 15:30
ksbv,KSB瀬戸内海放送,「どんぶり王選手権」で最優秀賞の地産地消どんぶり　市役所食堂で3日間限定販売へ　岡山市,https://news.yahoo.co.jp/articles/424cb08d367306a01850caae40ca155266218b55,12/5(火) 11:10
ksbv,KSB瀬戸内海放送,『PPAP プラは資源!!』資源分別呼び掛け　ピコ太郎さんのキャンペーンソング公開　岡山市,https://news.yahoo.co.jp/articles/e514e21157975c92b27da7b3629a4f0722880d11,12/5(火) 10:12
ksbv,KSB瀬戸内海放送,【特集】小学生が地元食材を使ったバラ寿司づくりに挑戦　「じぶんで考える食の学校」　香川,https://news.yahoo.co.jp/articles/d0d06b16e3ddee28a3bc626ae1f5b615267f137d,12/4(月) 20:12
ksbv,KSB瀬戸内海放送,ことでん　2023年度上半期の利用状況は前年より改善　コロナ禍前の水準には達せず　香川,https://news.yahoo.co.jp/articles/fe5b9f5f90bfb0690702f746ef84b193aeefa95c,12/4(月) 19:09
ksbv,KSB瀬戸内海放送,岡山南高校　スーツスタイルの制服を来春導入へ　全員がスーツとセーラーから選べるように,https://news.yahoo.co.jp/articles/6dff6a499bef9c3f58fd9a746e8c0fef9b918342,12/4(月) 18:46
ksbv,KSB瀬戸内海放送,ホーユーが食事提供停止した琴平高校の食堂が再開　OBの会社が運営受託し全メニュー550円以内　香川,https://news.yahoo.co.jp/articles/a5205c1f5fc975e22368836cdc8c763847c769f0,12/4(月) 18:39
ksbv,KSB瀬戸内海放送,燃料費など高騰で…経済団体が岡山市長に支援を要望　市長「補助金第3弾を前向きに検討」,https://news.yahoo.co.jp/articles/63e51ba6ecbe7be22d5a09fd3fcedf2f5ebd63b2,12/4(月) 18:03
ksbv,KSB瀬戸内海放送,栗林公園の秋のライトアップ　昼夜あわせた入園者数は過去最多　夜は冷え込み前年より減　高松市,https://news.yahoo.co.jp/articles/14d165504bb848c1f462fa40d9d4770b0596670a,12/4(月) 17:55
ksbv,KSB瀬戸内海放送,給付型奨学金の新設など盛り込んだ補正予算案を提案　12月定例高松市議会開会,https://news.yahoo.co.jp/articles/402bbaa695874d5958e01dfb9316e44e0fb5bbbe,12/4(月) 17:47
ksbv,KSB瀬戸内海放送,四国電力社長　電気料金値下げは「検討できる状況にない」　2023年度上半期の連結決算は過去最高,https://news.yahoo.co.jp/articles/214a3fa7c728ad7176a2994dc6a83ac9d9cb0daf,12/4(月) 17:44
ksbv,KSB瀬戸内海放送,人型ロボット「Pepper」が一日警察署長に　小学生に防犯啓発　岡山西署,https://news.yahoo.co.jp/articles/65a928573dce53658e6dddbcd1a51a9d033e98c5,12/4(月) 17:41
