media_en,media_jp,title_articles,link_articles,date_original
it_monoist,MONOist,アミン成分排出量が従来の10分の1のCO2吸収液を用いたCO2分離回収設備を発売,https://news.yahoo.co.jp/articles/484f9c181c8d5d8ef220742af9d0e53f1258ee27,4/23(火) 10:30
it_monoist,MONOist,ハノーバーメッセが開幕、AIや水素など「競争力ある持続可能な産業」の最新技術,https://news.yahoo.co.jp/articles/daeff71ff2095b3047d83960cbcdfed73454b3f5,4/22(月) 11:00
it_monoist,MONOist,ランクセスの2023年通期業績は在庫調整の影響で減収減益、2024年通期は回復見込み,https://news.yahoo.co.jp/articles/aa93fa4309fff07f667934b153a2b533c6c1d889,4/22(月) 9:00
it_monoist,MONOist,アップルが温室効果ガス排出量を2015年比で55％以上削減、コバルトの再利用なども,https://news.yahoo.co.jp/articles/239296566f7a01ea8f6d9d9163b9fc245011d67d,4/22(月) 7:35
it_monoist,MONOist,5G通信の遅延時間1ms以下は複数端末の制御でも可能か、東芝が量子技術で道を開く,https://news.yahoo.co.jp/articles/b273e3b2b1d8a16d908491a74c840b2c52204a21,4/22(月) 7:10
it_monoist,MONOist,SUBARUは次世代EyeSightで死亡事故ゼロ実現へ、ステレオカメラ×AIは相性抜群,https://news.yahoo.co.jp/articles/54c263ffc7869ce1b391fde0bc1613b66e8394df,4/22(月) 6:45
it_monoist,MONOist,EVワイヤレス給電協議会が設立、関西電力、ダイヘン、シナネンらが発起人に,https://news.yahoo.co.jp/articles/d38671a4e2c9a67d4a259db120fcc51b430de763,4/19(金) 15:05
it_monoist,MONOist,核融合炉発電の研究を加速、ヘリカル型核融合炉初号機の完成は2034年を目標に,https://news.yahoo.co.jp/articles/266abb4c8f092a380ad0261b276fb450a74dbf7f,4/19(金) 10:30
it_monoist,MONOist,オリックス環境が使用済み太陽光パネルの国内販売／再利用を開始,https://news.yahoo.co.jp/articles/ed5a4703615ab0457bb2fccfda282827d067d58c,4/19(金) 10:30
it_monoist,MONOist,景気減速でソフト開発の脆弱性対応が後手に？ SBOM整備の取り組みも足踏みか,https://news.yahoo.co.jp/articles/cdf33773323dc600e191b05a962945c5ca2914b7,4/19(金) 6:40
it_monoist,MONOist,ソニーが大型テレビ用緩衝材で発泡スチロール撤廃、生分解性バイオポリマーを採用,https://news.yahoo.co.jp/articles/1df9b77d971c9e15893eacacbf247e8530f3d2b1,4/19(金) 5:45
it_monoist,MONOist,リチウムイオン電池からのレアメタル回収に新技術、無機酸や有機溶媒を使わない,https://news.yahoo.co.jp/articles/02aed7747df95910041a25b84de9a0b4cd254d54,4/18(木) 12:30
it_monoist,MONOist,DNPがプラスチック部分を100％リサイクル材にしたICカードを発売,https://news.yahoo.co.jp/articles/491ac7ded0d0e6c6f2dbd07d8643baed48becdd9,4/18(木) 11:30
it_monoist,MONOist,トレーサビリティーを強化したトルクメーター、無線通信や波形データに対応,https://news.yahoo.co.jp/articles/00274de9fd15a7fca30fe2a063765ddd35092f44,4/18(木) 7:35
it_monoist,MONOist,Formlabsが新型3Dプリンタ「Form 4」発表,https://news.yahoo.co.jp/articles/608aa61cba521b0c6899ddc0f27d2148c4664aa1,4/18(木) 6:35
it_monoist,MONOist,リブ部分のみを発泡させ樹脂部品の軽量化と強度向上を実現する新たな発泡成形技術,https://news.yahoo.co.jp/articles/a2eb51beb26327c0f7bf35739d5cf080e8badf62,4/17(水) 10:30
it_monoist,MONOist,オリンパスの新CMOが担う「MSA」の役割とは、内向きではなく患者と向き合う,https://news.yahoo.co.jp/articles/124f99ff927c50c2ca6bc298e9f4eb93709adc5a,4/17(水) 7:10
