media_en,media_jp,title_articles,link_articles,date_original
kts,鹿児島ニュースＫＴＳ,１０代女性の首を絞めて殺害しようとした疑い　殺人未遂の疑いで男を逮捕　鹿児島市,https://news.yahoo.co.jp/articles/30ebb7d2a492f674ae2b239da9c91382783f98f7,9/13(金) 12:16
kts,鹿児島ニュースＫＴＳ,【予報士解説】台風１３号　今後の動きは？,https://news.yahoo.co.jp/articles/1f20ca282ef18f0056e594ac011ec2cbfafbc952,9/13(金) 12:14
kts,鹿児島ニュースＫＴＳ,９月１６日は敬老の日　「いつまでも元気で」感謝の思いを込めたアイテムは！？　鹿児島,https://news.yahoo.co.jp/articles/87d0296e62f490e65474bf6ce3c67a4c0d85b381,9/12(木) 19:48
kts,鹿児島ニュースＫＴＳ,鹿児島県議会の全会派に要望書　市民団体が百条委の設置求める　鹿児島県,https://news.yahoo.co.jp/articles/055abd80379bcdaa57443d679e162ba249cabe3e,9/12(木) 19:48
kts,鹿児島ニュースＫＴＳ,バイクが国道脇のガードパイプに衝突　運転していた男性が死亡　現場は一時通行止めに　鹿児島市,https://news.yahoo.co.jp/articles/24ecb26127f84dd64e97879d55fde308940797e4,9/12(木) 19:48
kts,鹿児島ニュースＫＴＳ,震度６強の地震想定　城山ホテル鹿児島で防火・防災訓練　　鹿児島市,https://news.yahoo.co.jp/articles/99f1bb466f6effb4972a15067383dde584890109,9/12(木) 19:48
kts,鹿児島ニュースＫＴＳ,【かごしまマーチングフェスティバル１５日開催】笑顔とチームワークが武器　鹿児島市・武小学校金管バンド,https://news.yahoo.co.jp/articles/7ad61d837977ce58e0111af087e35f1977931c48,9/12(木) 19:48
kts,鹿児島ニュースＫＴＳ,【動画・かごしまの天気9/12】台風１３号北上中　連休初日１４日夜に奄美地方に最も接近の予想,https://news.yahoo.co.jp/articles/529ce992efd7432ccb567271563a6375b95e12c7,9/12(木) 19:42
kts,鹿児島ニュースＫＴＳ,塩田知事「整備費増額の可能性も」　新総合体育館・労務費高騰の声　鹿児島県議会,https://news.yahoo.co.jp/articles/e1165edd6a55c012d7233b59203c32304f767719,9/12(木) 19:42
kts,鹿児島ニュースＫＴＳ,【自民党総裁選】鹿児島県民の声…新しい首相に期待することは,https://news.yahoo.co.jp/articles/bd42b294312899ee777551733a36cbbcf04bf54c,9/12(木) 18:49
kts,鹿児島ニュースＫＴＳ,【自民党総裁選】１２日告示・選挙戦スタート　鹿児島県内でも党員・党友に投票用紙発送,https://news.yahoo.co.jp/articles/b737fd8548ffb1618dbe37f33d251295a61e2593,9/12(木) 18:47
kts,鹿児島ニュースＫＴＳ,【予報士解説】台風１３号　週末に奄美に接近か　奄美大島では早くも台風に備え,https://news.yahoo.co.jp/articles/793f4fb6b08e09c2f59be34dd7c6e9c9a0c20bcf,9/12(木) 18:41
kts,鹿児島ニュースＫＴＳ,過去の大規模災害から学ぶ　県民の防災意識高める研修会を開催　鹿児島県,https://news.yahoo.co.jp/articles/a2f222d27f56e51ada1933cca5a8b047c91eec45,9/12(木) 13:32
kts,鹿児島ニュースＫＴＳ,バイクが道路脇のガードパイプに衝突　運転していた男性が死亡　鹿児島市,https://news.yahoo.co.jp/articles/1f923c3a333775830d99008176285206cde0f6e7,9/12(木) 13:30
kts,鹿児島ニュースＫＴＳ,２６００冊の絵本がずらりと本棚に！県内初　絵本だけの図書館が誕生・鹿児島市,https://news.yahoo.co.jp/articles/7096d6390423d433b6ad47942d65a30af900404f,9/11(水) 20:16
kts,鹿児島ニュースＫＴＳ,長崎の味と匠の技　４３社一堂に　鹿児島市・山形屋で物産展開幕,https://news.yahoo.co.jp/articles/873283e15c5309ed86a507bdc7cee13cbca08fac,9/11(水) 20:13
kts,鹿児島ニュースＫＴＳ,【動画・かごしまの天気9/11】台風１３号　３連休初日に奄美地方へ接近するおそれ,https://news.yahoo.co.jp/articles/8f6d11315374454c16037c13664e856548ad2316,9/11(水) 18:56
kts,鹿児島ニュースＫＴＳ,【かごしまマーチングフェスティバル１５日開催】２年連続の全国大会出場を目指して　鹿屋小金管バンド,https://news.yahoo.co.jp/articles/76d085ded85f38de64e8fb22e5cce65cc25b4f66,9/11(水) 18:51
kts,鹿児島ニュースＫＴＳ,「パチパチという音。納屋から火が出ていた」鹿児島・南さつま市で住宅と納屋が全焼　けが人なし,https://news.yahoo.co.jp/articles/d79f4c165e4d3987c017056fdfabf1b2b532019d,9/11(水) 18:48
kts,鹿児島ニュースＫＴＳ,指宿スカイラインの工事現場　掘削作業中に重機に挟まれ６０歳男性が死亡　鹿児島市,https://news.yahoo.co.jp/articles/eb61c9af4f9af1e464ad6cd7335c7eb042033f72,9/11(水) 18:44
kts,鹿児島ニュースＫＴＳ,九州自動車道で普通貨物車が横転する事故　２人けが　通勤時間帯に５キロ以上の渋滞が発生　鹿児島市,https://news.yahoo.co.jp/articles/a7592a25d0eaf64b34e90d8b8d84ab5e9c00e5a8,9/11(水) 18:44
kts,鹿児島ニュースＫＴＳ,教育現場で何が？過去最悪のペースで相次ぐ教職員の不祥事　鹿児島,https://news.yahoo.co.jp/articles/ec860581373bd2c30d48b5d2f41f146a9845a5b6,9/11(水) 18:41
kts,鹿児島ニュースＫＴＳ,県警不祥事を巡る百条委員会　自民党が反対し設置されない公算大に　専門家の見解は？　鹿児島,https://news.yahoo.co.jp/articles/186500a50e0420c761280f447e668854ada761b3,9/11(水) 18:37
kts,鹿児島ニュースＫＴＳ,九州自動車道上り線で普通貨物車が横転する事故　通勤時間帯に渋滞が発生　鹿児島市,https://news.yahoo.co.jp/articles/a30b8aedb9e8026543b01fcc91d02a91e191cbeb,9/11(水) 12:55
kts,鹿児島ニュースＫＴＳ,日豊本線で倒木による停電が発生　国分から南宮崎の区間で始発から運転見合わせ　約２０００人に影響,https://news.yahoo.co.jp/articles/a987f5fb4e4e70a7343b57f66517776e99e8b5c9,9/11(水) 12:55
kts,鹿児島ニュースＫＴＳ,商店街が生き残るためには？　鹿児島市・宇宿商店街の挑戦に注目,https://news.yahoo.co.jp/articles/3599522247a38d953b197d8051bd91a5dd652ae9,9/10(火) 20:58
kts,鹿児島ニュースＫＴＳ,鹿児島・鹿屋航空基地　ヘリコプターのねじ１本を紛失　飛行中に落下か,https://news.yahoo.co.jp/articles/5400b80314600fbd9eed3393e49518e29820c1c4,9/10(火) 20:10
kts,鹿児島ニュースＫＴＳ,【動画・かごしまの天気9/10】１０日は各地で雨、すっきりしない一日　１１日は午後から天気回復見込み,https://news.yahoo.co.jp/articles/b8c88127a5e30d431dfbf22f9fb77ad016b97e9e,9/10(火) 20:10
kts,鹿児島ニュースＫＴＳ,鹿児島東西道路　シールドマシンが本格掘進開始　開通は２０２５年夏から秋ごろの見通し,https://news.yahoo.co.jp/articles/86cb505375b3307e9b7c9959ec8d5987e9437a52,9/10(火) 19:56
kts,鹿児島ニュースＫＴＳ,東京都内で女性を盗撮した疑い　鹿児島・いちき串木野市の３０代男性主事を懲戒処分,https://news.yahoo.co.jp/articles/894c7f4f3e75ef55b61cea2502c7160a96b32d79,9/10(火) 19:49
kts,鹿児島ニュースＫＴＳ,７月死去　鹿児島銀行前頭取・松山澄寛さん　お別れの会　本店ビル建て替えや「Ｐａｙどん」導入に貢献,https://news.yahoo.co.jp/articles/b59fdfa3a0639f49a5dda9fae221922ae7e1846c,9/10(火) 19:49
kts,鹿児島ニュースＫＴＳ,盗撮の元警察官に有罪判決　一連の鹿児島県警不祥事で３人目,https://news.yahoo.co.jp/articles/d2d99c5dbb51d767c60e9836e0afed145dba8047,9/10(火) 19:49
kts,鹿児島ニュースＫＴＳ,２０３０年３月末に完成か　防衛省の馬毛島工事　工期が３年遅れ　鹿児島・西之表市,https://news.yahoo.co.jp/articles/568fb4624ab1c9b4b1c761e03d33d2f492f31e2f,9/10(火) 19:44
kts,鹿児島ニュースＫＴＳ,【かごしまマーチングフェスティバル１５日開催】支えてくれる人に感謝を込めて！　西出水小学校,https://news.yahoo.co.jp/articles/38d4f865dd170b24cdc3784659bcb280baa91b61,9/10(火) 19:44
kts,鹿児島ニュースＫＴＳ,ルーツはヒマラヤ！　鹿児島・霧島市で「赤ソバ」の種まき　気象予報士も挑戦,https://news.yahoo.co.jp/articles/3dff9271d0bb6838e87bbcad338cc0f683df5da9,9/10(火) 19:42
kts,鹿児島ニュースＫＴＳ,女子トイレなどで盗撮の元警察官に執行猶予付きの有罪判決　鹿児島地裁,https://news.yahoo.co.jp/articles/229e10b055ab4c6e12758da08239717317fb4b74,9/10(火) 15:21
kts,鹿児島ニュースＫＴＳ,コンサートやバックヤードツアーも　夜のかごしま水族館でイベント　鹿児島市,https://news.yahoo.co.jp/articles/33d07c66a99341634c4760f6edc6b8d3757b92c2,9/10(火) 12:12
kts,鹿児島ニュースＫＴＳ,公園に呼び出し暴行、現金奪った疑い　１０代の女３人を逮捕　鹿児島市,https://news.yahoo.co.jp/articles/6b1c4ff711a8ee7a5363efdf593c1b57f9ec2466,9/10(火) 12:09
kts,鹿児島ニュースＫＴＳ,男衆１００人が屋根を倒す　五穀豊穣願い「ショチョガマ」夕方には「平瀬マンカイ」も　鹿児島・奄美大島,https://news.yahoo.co.jp/articles/03bd13e72414bfb2339a3f5cfafc75805ad45e9a,9/9(月) 19:17
kts,鹿児島ニュースＫＴＳ,暖かい気候生かし全国に先駆けオリーブの収穫祭　長雨と台風の影響あるが風味は上々　鹿児島・日置市,https://news.yahoo.co.jp/articles/83687d26751258134d9debcf4cebf0d769f2fbf6,9/9(月) 19:11
kts,鹿児島ニュースＫＴＳ,【動画・かごしまの天気9/9】県内３カ所で観測史上最も遅い猛暑日に。１０日は日差し少なく雨や曇り予想,https://news.yahoo.co.jp/articles/c0518663fa1ba6b8fcb75f82f218f4817426936f,9/9(月) 19:11
kts,鹿児島ニュースＫＴＳ,【かごしまマーチングフェスティバル１５日開催】　ことしは正統派で勝負！龍桜高校（鹿児島県姶良市）,https://news.yahoo.co.jp/articles/141a760aadf3ca0ca151cf735bc1f585c6678e68,9/9(月) 19:08
kts,鹿児島ニュースＫＴＳ,重篤患者を２４時間体制で受け入れ　米盛病院「救命救急センター」開所式　鹿児島市,https://news.yahoo.co.jp/articles/d212b0f5eef54c070c31b74dc043cdd821766993,9/9(月) 18:58
kts,鹿児島ニュースＫＴＳ,ハンドボール・リーグＨ開幕！ブルーサクヤ鹿児島は初戦白星発進,https://news.yahoo.co.jp/articles/ae7cc39bda5bde5be272526d0bc18a11423c4405,9/9(月) 18:53
kts,鹿児島ニュースＫＴＳ,H2Aロケット49号機・打ち上げ延期　天候不良予想で　鹿児島・種子島,https://news.yahoo.co.jp/articles/cdb3c19f4634f5c388a567b3f133ecdb27a1bd98,9/9(月) 18:49
kts,鹿児島ニュースＫＴＳ,【独自】本港区移転希望の鹿児島サンロイヤルホテル　約２０億円の債務超過状態　県議会で議論展開か,https://news.yahoo.co.jp/articles/cb8edf1b6e7d614ecb43db7793c7f9dc78f8e3b5,9/9(月) 18:33
kts,鹿児島ニュースＫＴＳ,鹿児島市・下鶴市長　２期目出馬を表明　鹿児島市長選挙は１１月２４日投開票,https://news.yahoo.co.jp/articles/bac81b009efa099d6195cbd8543c8f6a04df1da0,9/9(月) 18:29
kts,鹿児島ニュースＫＴＳ,【鹿児島ユナイテッドＦＣ】悪夢の６連敗　ホームでいわきＦＣに敗れる,https://news.yahoo.co.jp/articles/931552ee9e14769270610d2006e97c08b41a7311,9/9(月) 18:13
kts,鹿児島ニュースＫＴＳ,鹿児島市の北ふ頭で７２歳の貨物船船長が死亡　海に転落か,https://news.yahoo.co.jp/articles/59cc81045f7ebd3bbaa619fae5c9166eaa10697c,9/9(月) 15:09
kts,鹿児島ニュースＫＴＳ,渡り鳥のシーズンを前に　高病原性鳥インフルエンザ防疫演習　鹿児島市,https://news.yahoo.co.jp/articles/b859fae7891b5d9f2fabe536583d7ff66486216f,9/9(月) 12:54
kts,鹿児島ニュースＫＴＳ,下鶴市長が２期目を目指して出馬を表明　１１月２４日投開票の鹿児島市長選挙,https://news.yahoo.co.jp/articles/df71a2ad4ed909cb63a304c3bfba9411ef13b855,9/9(月) 12:51
kts,鹿児島ニュースＫＴＳ,伊佐市の特産品「金山ねぎ」をPR　高校生が植え付け体験　鹿児島・伊佐市,https://news.yahoo.co.jp/articles/c1b1d0758c0aa4918d78871aa653fc2d2400b40d,9/8(日) 18:24
kts,鹿児島ニュースＫＴＳ,妊婦と赤ちゃんに心地よいメロディーを　KTSマタニティコンサート　鹿児島市,https://news.yahoo.co.jp/articles/9650bb4f891cb241dc16d6d935bbd3f8202b926f,9/8(日) 18:22
kts,鹿児島ニュースＫＴＳ,かごしま探求プロジェクト  本格始動を前に研修,https://news.yahoo.co.jp/articles/3517353ff509b08d3ef968f1789b53af8fe2d88a,9/8(日) 12:58
kts,鹿児島ニュースＫＴＳ,小学生がウミガメの赤ちゃんを放流　中種子町・鹿児島,https://news.yahoo.co.jp/articles/b424e0bffb7ed64fee9bb07b24edf2ff763a6304,9/7(土) 16:27
kts,鹿児島ニュースＫＴＳ,来年夏の参院選　自民党県連　立候補予定者を２人に絞り込む　鹿児島,https://news.yahoo.co.jp/articles/c61789aab773404e1482ee9265ff3a7ab3cf84aa,9/7(土) 16:12
kts,鹿児島ニュースＫＴＳ,６０代男性が鹿児島市電と接触する事故 　軽傷,https://news.yahoo.co.jp/articles/8c8d8f9a3dd5dc8670c63ddd8ac563048c118224,9/7(土) 12:14
kts,鹿児島ニュースＫＴＳ,ファミリー層に人気の施設に変身！霧島国際ホテルのリニューアル完了　鹿児島・霧島温泉郷,https://news.yahoo.co.jp/articles/0ac2462797e0178c3ba62529c9d7cca9d3658cf5,9/6(金) 19:48
kts,鹿児島ニュースＫＴＳ,経営再建中の山形屋   １０月からエディオンと丸善が出店・鹿児島県,https://news.yahoo.co.jp/articles/666e65b00fd636e44d4666b11a9c576cf20b5362,9/6(金) 19:45
kts,鹿児島ニュースＫＴＳ,鹿児島県警の前生活安全部長　本田被告の裁判で公判前整理手続き適用が決定・鹿児島県,https://news.yahoo.co.jp/articles/3750dc48de6d2191781f7b5945660cca142d65aa,9/6(金) 19:41
kts,鹿児島ニュースＫＴＳ,アミュプラザ鹿児島　１０月１日からフレックスタイム制度導入　店舗ごとに開店・閉店時間を選択可,https://news.yahoo.co.jp/articles/6b32a8b5c6822349edb45905f86ef5ad728317e7,9/6(金) 19:41
kts,鹿児島ニュースＫＴＳ,肝付町が宇宙への学び応援！中高生が手作りロケットを発射！約１２０メートル上空へ　鹿児島,https://news.yahoo.co.jp/articles/f455bf800fc86eb6ed5026255e7e27876cac7d7a,9/6(金) 19:37
kts,鹿児島ニュースＫＴＳ,鹿児島県内の水稲作柄状況は「平年並み」　ただし台風１０号の影響はまだ反映されず,https://news.yahoo.co.jp/articles/67fd1a490b078a7f1e1237f0e6c7f5b8fe6175c4,9/6(金) 19:35
kts,鹿児島ニュースＫＴＳ,鹿児島のコメ事情は？ＪＡの直売所「おいどん市場」の売り場は？　鹿児島市,https://news.yahoo.co.jp/articles/55a5f037b723810260b569520ef15c4f4af9bb60,9/6(金) 19:32
kts,鹿児島ニュースＫＴＳ,【動画・かごしまの天気9/6】　週末は猛暑日の所も　８日の奄美地方は一時雨の予想,https://news.yahoo.co.jp/articles/37f684a6c2d71c102dbc459bb99ca7a790296610,9/6(金) 19:25
kts,鹿児島ニュースＫＴＳ,ＪＲ指宿枕崎線が６日から全線で運転再開　本数を減らして運行していた区間も通常通りに　鹿児島,https://news.yahoo.co.jp/articles/3568430782a16a90c24cf107c6e09d7d1b166a8c,9/6(金) 19:25
kts,鹿児島ニュースＫＴＳ,伝統製法にこだわり　黒酢の秋仕込みがスタート　鹿児島県霧島市,https://news.yahoo.co.jp/articles/f5184383d66637ecf6e30f71d753c7a94d70cbff,9/6(金) 12:08
kts,鹿児島ニュースＫＴＳ,鹿児島県警不祥事を巡る百条委員会の設置　最大会派の自民党県議団は「賛成しない」,https://news.yahoo.co.jp/articles/ca295bb9c5282f437df1eb71dac3d68dc66572dd,9/5(木) 20:06
kts,鹿児島ニュースＫＴＳ,「ＳＮＳ型ロマンス詐欺」の疑いで逮捕された千葉市の女を送検　鹿児島,https://news.yahoo.co.jp/articles/911e396f22d7ef21bb6c679811cb11ce74f8ac3d,9/5(木) 20:06
kts,鹿児島ニュースＫＴＳ,【動画・かごしまの天気9/5】６日も鹿児島県内は高気圧の圏内　洗濯日和,https://news.yahoo.co.jp/articles/53714d1f81f997c8df443316b99907faab05406f,9/5(木) 20:06
kts,鹿児島ニュースＫＴＳ,鹿児島にも秋の気配　えびの高原ではススキが見ごろ　西之表市は安納芋が収穫の最盛期,https://news.yahoo.co.jp/articles/afe4a3980495904c0306c3094125061308f0f3b3,9/5(木) 20:06
kts,鹿児島ニュースＫＴＳ,スズメバチハンターの駆除作業に密着！　鹿児島,https://news.yahoo.co.jp/articles/dcb527626ce43ed684aa86406de08ad3ffe41be1,9/5(木) 19:59
kts,鹿児島ニュースＫＴＳ,食欲の秋！鹿児島市のスーパーをのぞいてみた　台風や不作による食卓への影響は？,https://news.yahoo.co.jp/articles/1e11b48fe5c4d5a94a7a0f61471680db50112162,9/5(木) 19:59
kts,鹿児島ニュースＫＴＳ,【中継】いまが漁の最盛期　旬を堪能！阿久根伊勢えび祭り　鹿児島,https://news.yahoo.co.jp/articles/1846541be3d236d07a96c13e895f9e769b297a2c,9/5(木) 19:54
kts,鹿児島ニュースＫＴＳ,台風１０号による農業被害２０億円超える　被害額は今後も増える可能性　鹿児島県まとめ,https://news.yahoo.co.jp/articles/e099b3ab331e66c6aaace9a0e1bef586fce761c6,9/5(木) 19:51
kts,鹿児島ニュースＫＴＳ,諏訪之瀬島で連日噴火を観測　鹿児島・十島村,https://news.yahoo.co.jp/articles/a5555c80e1f65a760fad98a2e8d8a5696971fa3e,9/5(木) 11:56
kts,鹿児島ニュースＫＴＳ,「ＳＮＳ型ロマンス詐欺」　鹿児島県警初の逮捕,https://news.yahoo.co.jp/articles/75489662bedd8f0cbaea0cbc8b6fd9023dc0f09f,9/5(木) 11:56
kts,鹿児島ニュースＫＴＳ,佐多岬灯台の南西沖で身元不明遺体発見・鹿児島県,https://news.yahoo.co.jp/articles/93f176ab1e2930bdb9bd74b95cc55711c3c83772,9/4(水) 22:14
kts,鹿児島ニュースＫＴＳ,ＳＮＳを使い親近感を抱かせ現金をだまし取ったＳＮＳ型ロマンス詐欺で県警初の逮捕,https://news.yahoo.co.jp/articles/cd436c77f642f3e286fa2541e3eed2cdfc1ccb12,9/4(水) 21:38
kts,鹿児島ニュースＫＴＳ,地元に愛された文具店が５７年の歴史に幕・・・「はやま文具」最後の一日に密着　鹿児島市,https://news.yahoo.co.jp/articles/b047c623d152ef37a7c1cbd65eee1ba0be255e57,9/4(水) 20:34
kts,鹿児島ニュースＫＴＳ,鹿児島東西道路の田上ランプ交差点　９月４日から武岡トンネルへの合流方法が変更,https://news.yahoo.co.jp/articles/7e98b7c98a5bd53f463c1b596ddc2e4cbaf9f6cd,9/4(水) 20:21
kts,鹿児島ニュースＫＴＳ,鹿児島県警不祥事の再発防止策など県が約１８億４０００万円の補正予算案発表,https://news.yahoo.co.jp/articles/331465d47169a656cd3f5eb46bd08deb715dd8b7,9/4(水) 20:21
kts,鹿児島ニュースＫＴＳ,【動画・かごしまの天気9/4】５日も広い範囲で晴天　薩摩・大隅地方の山沿いは「にわか雨」も,https://news.yahoo.co.jp/articles/42071580243acf5e258f4f2c479abc9c5fb79f6d,9/4(水) 20:17
kts,鹿児島ニュースＫＴＳ,若手バイヤー厳選の「かわいい」が一堂に！鹿児島市の山形屋で「使ってみたいＭＯＮＯフェア」開催,https://news.yahoo.co.jp/articles/de69960bdc3cf551549e02a5762e700acea9a9db,9/4(水) 19:14
kts,鹿児島ニュースＫＴＳ,両親は徳之島出身・盛山文部科学相　鹿児島県立大島高校を視察,https://news.yahoo.co.jp/articles/aecab85112e3bcd7df297b9705fb429c6eedf410,9/4(水) 18:51
kts,鹿児島ニュースＫＴＳ,鹿児島県警不祥事に「百条委員会設置を」　市民団体が県議会に陳情書提出へ,https://news.yahoo.co.jp/articles/2dcdc987b533b5debe743a9554f9f8fccc72d429,9/4(水) 18:45
kts,鹿児島ニュースＫＴＳ,鹿児島東西道路・田上ランプ交差点　武岡トンネルへの合流が右車線からに変更　注意すべき点は？,https://news.yahoo.co.jp/articles/1c0aaac49e623c39f2792f0ee6c6be752962673e,9/4(水) 18:40
kts,鹿児島ニュースＫＴＳ,またも不祥事‥鹿児島県警の男性警察官が書類送検　虚偽公文書作成等の疑い,https://news.yahoo.co.jp/articles/c7c1d0f33e97397984aad9d57c2c128caaa078ee,9/4(水) 18:40
kts,鹿児島ニュースＫＴＳ,鹿児島東西道路の田上ランプ交差点　武岡トンネルへの合流方法が４日から変更,https://news.yahoo.co.jp/articles/8e0ac6eb772bdf67b50e99ee9a7a4e53dca68401,9/4(水) 14:22
kts,鹿児島ニュースＫＴＳ,鹿児島・志布志市　製材所の建物１棟全焼　けが人なし,https://news.yahoo.co.jp/articles/ca132356096f1d74e31d2cd8d12b2f299bff171b,9/4(水) 14:04
kts,鹿児島ニュースＫＴＳ,霧島アートの森で開催中・清川あさみ展の魅力（２）「清川あさみが紡ぐファッション」,https://news.yahoo.co.jp/articles/71037dded9338a632493907954049fad85ad0046,9/4(水) 10:49
kts,鹿児島ニュースＫＴＳ,霧島アートの森で開催中・清川あさみ展の魅力（１）「清川あさみが紡ぐ自然」,https://news.yahoo.co.jp/articles/c3a1745eeedc9721b968629acab64636f02e7817,9/4(水) 10:45
kts,鹿児島ニュースＫＴＳ,与論島の塩加工工房が全焼　けが人なし,https://news.yahoo.co.jp/articles/c3df3eadf86db737855ad1dfa9e91024477aa95a,9/3(火) 21:26
kts,鹿児島ニュースＫＴＳ,鹿児島市長選挙　１１月１７日告示、２４日投開票の日程,https://news.yahoo.co.jp/articles/c3e73f5846505cac311766e8b2a6b57a13d2d1e5,9/3(火) 19:43
kts,鹿児島ニュースＫＴＳ,「世界的に前例なし」奄美大島の特定外来生物マングースの根絶を宣言,https://news.yahoo.co.jp/articles/aab4dab6046bec0a5c89beef7d50df7719c16736,9/3(火) 19:43
kts,鹿児島ニュースＫＴＳ,推定樹齢３０００年の「弥生杉」倒れる　台風１０号が影響か　鹿児島・屋久島,https://news.yahoo.co.jp/articles/9902682cbd4eae8653cbba62326f56d703629825,9/3(火) 19:43
kts,鹿児島ニュースＫＴＳ,旧統一教会の団体が「おはら祭」に参加を申請　事務局が今後判断　鹿児島市,https://news.yahoo.co.jp/articles/98a84f87731178b7582b8ab926e3b1a289b50fb0,9/3(火) 19:32
kts,鹿児島ニュースＫＴＳ,頭から血を流して倒れていた男性がその後死亡　身元不明　鹿児島市,https://news.yahoo.co.jp/articles/c33b7139737cb6332dcd738683cfefde02604232,9/3(火) 19:32
kts,鹿児島ニュースＫＴＳ,秋の味覚のサンマ　昨年よりも豊漁で１００円ほど安く　 鹿児島市,https://news.yahoo.co.jp/articles/3791f877da807fdbc7e6e15cc39914bc5c35e4f2,9/3(火) 19:32
kts,鹿児島ニュースＫＴＳ,【動画・かごしまの天気9/3】４日も県本土は広く晴天　奄美地方は通り雨の時間も,https://news.yahoo.co.jp/articles/97ecf0e2dbb0bf2c82e6a978820abcf7b977ecf6,9/3(火) 19:32
kts,鹿児島ニュースＫＴＳ,馬毛島で小屋の屋根に被害　台風１０号の影響か　鹿児島・西之表市,https://news.yahoo.co.jp/articles/4c4c30569b03ba2b9b9ef162454cc972e95d1268,9/3(火) 19:32
kts,鹿児島ニュースＫＴＳ,９０００万円減額の補正予算案を提案　アリーナ工事入札業者なしで　鹿児島市議会,https://news.yahoo.co.jp/articles/a294d41be16bd5563a988aeb4efb78e06176d644,9/3(火) 19:29
kts,鹿児島ニュースＫＴＳ,塩田知事が寄付金２５８万円を全額返金　寄付をした後援会団体に政治団体の登録なく　　鹿児島,https://news.yahoo.co.jp/articles/6b360e34bcedc9443baf04b222f2506b4b06ba62,9/3(火) 19:26
kts,鹿児島ニュースＫＴＳ,硫黄島で２日ぶりに噴火が発生　噴煙が火口から７００メートルまで上がる　鹿児島・三島村,https://news.yahoo.co.jp/articles/e3d6d42f37034e0dc9c40f3b0ba739d0a5aa6444,9/3(火) 14:56
kts,鹿児島ニュースＫＴＳ,デジタルスタンプラリーで特産品が当たる！旧入来町や樋脇町など薩摩川内市東部区域で開催中　鹿児島,https://news.yahoo.co.jp/articles/f7f3f59e66e00708a84ef7bb2f9a47284dc8a571,9/3(火) 14:34
kts,鹿児島ニュースＫＴＳ,塩田知事が寄付金２５８万円を全額返金　寄付を受けた後援会団体が政治団体の届け出なく　鹿児島,https://news.yahoo.co.jp/articles/40aa45a388066e75b62c34100f3ce10d57549a2a,9/3(火) 14:31
kts,鹿児島ニュースＫＴＳ,鹿児島港の海中で見つかった遺体の身元が判明　台風接近時に転落の船長男性,https://news.yahoo.co.jp/articles/0e71c0df0413a75c665282e99698b2e3e86cf476,9/3(火) 9:46
kts,鹿児島ニュースＫＴＳ,【県警不祥事】盗撮事件の誤った指示の内容を文書として記録していないことが明らかに　鹿児島,https://news.yahoo.co.jp/articles/e9530ca5bdf278e3b1159fee58e0ed111c53f624,9/2(月) 20:00
kts,鹿児島ニュースＫＴＳ,パリ五輪・柔道金メダリストの角田夏美選手が鹿児島にやってきた！世界を沸かせた巴投げを披露！,https://news.yahoo.co.jp/articles/00071e08205bd51622f106ebacdead79410683d0,9/2(月) 19:54
