media_en,title_articles,link_articles,date_original
khks,仙台市役所で雨漏り、廊下が一時水浸し　仙台の降水量は1時間に30ミリ,https://news.yahoo.co.jp/articles/cb194278810181d81b3790f2cf95023ae330ab1e,9/6(水) 11:35
khks,石巻、名取の一部地域に避難指示　仙台は青葉、太白、若林の土砂災害警戒区域に高齢者等避難発令,https://news.yahoo.co.jp/articles/1bb6ddf4514ab9f8d843849b34db07915b7ccecd,9/6(水) 9:27
khks,震災で3人の子亡くした男性が製作したモニュメント、ベンチと積み木に生まれ変わる,https://news.yahoo.co.jp/articles/3caf8bdc666c222b6086348c7bf7b109b5020855,9/6(水) 6:30
khks,日ハム戦雨天中止、則本きょう6日スライド登板　借金2桁からのAクラスなるか,https://news.yahoo.co.jp/articles/6f022e3250d0f056bbd36a28eec11dad5d231d1c,9/6(水) 6:30
khks,低利用魚や南方系魚を新たな料理に　仙台「ホテル瑞鳳」と石巻の漁師団体が連携、可能性模索,https://news.yahoo.co.jp/articles/bed16297a6f2324b718e650dd93e35e1c038860d,9/6(水) 6:30
khks,おじさん図鑑「推し」見つけて　福島・岩代観光協会、地域を支える20人パンフレットに　愛情とユーモアで人柄紹介,https://news.yahoo.co.jp/articles/e61f454c40b0ac64d085a238af3be02f46942230,9/6(水) 6:30
khks,仙台で1時間に44.5ミリの激しい雨　仙台駅東西地下自由通路一時通行止め（5日）,https://news.yahoo.co.jp/articles/2e765ebafd3d8c2dda72dbe29e01ee0b9f1ce178,9/5(火) 16:37
khks,東北楽天・島内が復調の兆し「まだやれるところ見せる」,https://news.yahoo.co.jp/articles/30027569551f75d550830a3ad3093a69bcddea71,9/5(火) 16:00
khks,ESG債「サステナビリティボンド」宮城県が東北で初めて発行へ　法人が対象,https://news.yahoo.co.jp/articles/e6cf8ed7203467e915a26abd6e8915275235d561,9/5(火) 15:16
khks,宮城4病院再編　県、民間精神科病院の公募案提示　デイケアや訪問看護など要件,https://news.yahoo.co.jp/articles/6c1740b5fe8344293beb3117c2e1307a63c939df,9/5(火) 6:30
khks,木星の閃光、30〜40mの小天体が衝突か　これまでで最も強い光　京大・有松特定助教が分析,https://news.yahoo.co.jp/articles/093ea929251948f8eff8c1d440a34d29107de596,9/5(火) 6:30
khks,仙台・定禅寺ジャズフェス9日から　4年ぶり制約なし開催、416組出演へ,https://news.yahoo.co.jp/articles/151611b9c0f836a86bad34f3baacc32154fb8d8c,9/5(火) 6:30
khks,東北電、料金値上げ背景に最高益1400億円　消費者から疑問の声　24年3月期予想,https://news.yahoo.co.jp/articles/69d918199383b5cdfddbb79799bb1aa2351341c0,9/5(火) 6:00
khks,昼飲みもどうぞ　仙台駅東口・ヨドバシに5店舗連なる横丁、5日オープン,https://news.yahoo.co.jp/articles/710248e7cc79a9ec66a6e7301a0ce2491dfc6d0b,9/4(月) 18:09
khks,仙台市「こども財団」11月設立へ　22年ぶりの外郭団体,https://news.yahoo.co.jp/articles/e6779d57488b47de7ad238644782f0784a21e4ad,9/4(月) 14:00
khks,仙台の真夏日、22日連続でストップか　宮城の広範囲で「恵みの雨」,https://news.yahoo.co.jp/articles/2cd5a1de94ef03ba43c29320411f3f149bec88d2,9/4(月) 12:46
khks,仙台みちのくYOSAKOI今年は通常開催　運営協力助っ人求む,https://news.yahoo.co.jp/articles/d7dd818d4444da491c90db8cfe4c08ce75aab764,9/4(月) 6:00
khks,スズメバチも酷暑にげんなり？　宮城県内で駆除依頼大幅減,https://news.yahoo.co.jp/articles/69b001beb0873e1d6f660b8e34dd79e78388ecd8,9/4(月) 6:00
khks,岩手知事、達増氏5選　野党共闘踏みとどまる,https://news.yahoo.co.jp/articles/808c7a0cf912938814f30480dbb4b97e60dd8225,9/4(月) 6:00
khks,岩手知事選　開票結果（選管最終）,https://news.yahoo.co.jp/articles/ea7fabcd6de52e4fccce3471d57dc300fad33daa,9/3(日) 18:00
khks,秋季高校野球宮城県大会、出場の29校出そろう　12日開幕,https://news.yahoo.co.jp/articles/9b71080a10b17dc3fa2b42cec4ba2a953e1eb483,9/3(日) 16:35
khks,フェンシングと物理の二刀流　仙台一高の蒔田晏奈さん　今夏、インターハイと総文祭に出場,https://news.yahoo.co.jp/articles/cd237674c3965ba192357d94298ad672ec025201,9/3(日) 7:00
khks,まさかの没収試合　仙台六大学野球で出場選手が名簿と違う背番号で打席に,https://news.yahoo.co.jp/articles/891d2867e2b1666de68c44ddcf9653fed461413e,9/3(日) 7:00
khks,木星に隕石衝突の瞬間か　仙台のアマチュア天文家・清野和裕さんが閃光撮影,https://news.yahoo.co.jp/articles/4af67808d8a75efbab528995404dd51cff4a4158,9/3(日) 7:00
khks,スローフード、宮城・富谷から発信　30日に「テッラ・マードレ」日本版初開催,https://news.yahoo.co.jp/articles/5ec1207d490ab3057da26a2b685adb286b2fad17,9/3(日) 6:00
khks,東北楽天、粘り勝ち　ロッテに5-3,https://news.yahoo.co.jp/articles/06c0a3ab7d3da215b7566f246116dbc7b61c2695,9/2(土) 21:41
khks,アリオ仙台泉、24年1月末閉店を正式発表　店頭に張り紙掲示,https://news.yahoo.co.jp/articles/37c5a93b9056624c86e86b7f9f436f486fa86a19,9/2(土) 19:29
khks,コメの適切な収穫時期「７〜１０日早まる」　猛暑が影響、宮城県やJAが見通し,https://news.yahoo.co.jp/articles/c71e4d461e4227b4553860192fd30135fa2f42c3,9/2(土) 16:00
khks,宮城県、クマ出没注意報を解除　目撃情報が月平均下回る,https://news.yahoo.co.jp/articles/cbab70ab4f79c0354c92a9b65772709dfe406f86,9/2(土) 16:00
khks,仙台・じもとHDに180億円公的資金注入へ　コロナ特例は全国初　SBIから約20億追加出資も,https://news.yahoo.co.jp/articles/1f24a00053ee886db028f19eb1bd8b6c0c65eaf0,9/2(土) 6:00
khks,東北電グループ、ネットショッピングのポイント二重取り新サービス開始,https://news.yahoo.co.jp/articles/01415f612273fcc3785a86687b4d6743fa9c495b,9/2(土) 6:00
khks,処理水心配する家族を説得し来日　中国出身の劉穎さん、白石市地域おこし協力隊員に,https://news.yahoo.co.jp/articles/0c19bafa635d8e05d22f889b7a2f57307884b2bb,9/2(土) 6:00
khks,東北大、国際卓越研究大の認定候補に　10兆円ファンドから支援,https://news.yahoo.co.jp/articles/0a0eeb50f240f097307598b866f5b83379a35ec8,9/2(土) 6:00
khks,8月の仙台は平均気温28・6度、1926年以降最高　気象庁,https://news.yahoo.co.jp/articles/1c37175e6a9eae38fb860970ff4b6ca3e53b5bab,9/1(金) 19:26
khks,贈答用セット「も・も・て・な・しBOX」を限定販売　福島市,https://news.yahoo.co.jp/articles/13aa7481751b879c717f4d382c2761efaea1c25f,9/1(金) 15:35
khks,仙台の真夏日、20日連続　観測史上最長また更新,https://news.yahoo.co.jp/articles/bdc6531b710f3aee47862fa5bdbc85a60b98b39c,9/1(金) 11:36
khks,宮城県「クマ出没注意報」解除　6月18日以降、人身被害なし,https://news.yahoo.co.jp/articles/b1e0809c0822ff53dd02a08d9f037b0e1952e34f,9/1(金) 11:16
khks,8月の仙台は暑かった…真夏日は30日間、熱帯夜も24日間　観測史上最多を更新,https://news.yahoo.co.jp/articles/d7199830d680aa97e24073d34113220d46ae0590,9/1(金) 6:30
khks,相次ぐ熱中症搬送　山形の学校現場、屋外活動の実施判断に苦慮,https://news.yahoo.co.jp/articles/ce13de5d87525cfd4b5bfd0ec7be8ee748266cec,9/1(金) 6:30
khks,処理水放出1週間　消費者、冷静な反応　流通や観光の現場に大きな変化なし,https://news.yahoo.co.jp/articles/c7f99818a485e1f0eaee7068456d93484fa603d2,9/1(金) 6:30
khks,山形の認定子ども園で園長が性的虐待か　複数の園児の下腹部触るなどの言動、園長は「事実無根」と否定,https://news.yahoo.co.jp/articles/d5e7aee5686818e16b22d6d942bbe6e6fa403980,9/1(金) 6:30
khks,「スーパーブルームーン」夏の夜に、丸く、大きく　13年ぶり観測　仙台,https://news.yahoo.co.jp/articles/e8e5ef9abf047ada72b81739ed2927bb6d633e62,8/31(木) 21:18
khks,迷惑電話、受けないようにするにはどうすればいいの？　NTTなど通信事業者に聞いてみました,https://news.yahoo.co.jp/articles/f570ffeee3ff3ba0598e999a0f9d58dfd0ccfc86,8/31(木) 16:00
khks,七十七銀、法人向けネットサービスに一時ログインできない不具合,https://news.yahoo.co.jp/articles/03539a255615a786c49a251c82c4bbfdbf68b92b,8/31(木) 12:09
khks,新型コロナ、新規感染者2688人で大幅に増加　宮城県週報,https://news.yahoo.co.jp/articles/0187f77522102abe662e78fcd9b7e9d550f70145,8/31(木) 10:43
khks,仙台駅近くの14階建てマンションの1階飲食店で火事　けが人なし,https://news.yahoo.co.jp/articles/51e6595dc2d764190273422f11216a4ded8f0dcf,8/31(木) 8:24
khks,涼やか風鈴列車　あのチョコレート菓子戦争もクールダウン？,https://news.yahoo.co.jp/articles/44511daeb3e1c4e98b7914369b6246afa1f27a10,8/31(木) 6:30
khks,ガソリン　東北184円、12週連続上昇　「頑張って乗り越えられるレベルでない」消費者・企業から悲鳴,https://news.yahoo.co.jp/articles/61c63f5ae439139e242186af2153088e9c6a4717,8/31(木) 6:30
khks,ケヤキ並木、消えるガソリンスタンド　仙台・定禅寺通の店舗きょう31日閉店,https://news.yahoo.co.jp/articles/12531d6f142411b919a38e7ed52acef03ea0eec4,8/31(木) 6:30
khks,なぜ？山形・南陽市役所に3800件以上の迷惑電話　中国になじみの深い地名が原因に？,https://news.yahoo.co.jp/articles/1e6ec81ba4a86a90cddb5243de99c3c345509e66,8/31(木) 6:30
khks,酷暑の国道4号、点在する「茶色い液体」入りのペットボトル　125本拾って嗅いでみた,https://news.yahoo.co.jp/articles/b280fe3859cf950d7d691be46df0dfa2cfebe744,8/31(木) 6:30
khks,ツール・ド・東北、24年以降も大会継続へ　新法人設立、サイクルツーリズム推進,https://news.yahoo.co.jp/articles/46a377cbee632ac9205ebcc3121f6ab8edb3e812,8/30(水) 19:13
khks,今晩から今年最大の満月「スーパームーン」月と地球が近づく仕組みは？　天気は？,https://news.yahoo.co.jp/articles/222dc4a58043e4509cb952a7e0d5adeac803e3ac,8/30(水) 16:00
khks,休館中なのになぜか全国３位の人気　博物館キャラ投票で宮城・利府町郷土資料館の「あさガオー」「みヤギー」が謎の健闘,https://news.yahoo.co.jp/articles/e79475a459eda242dc00d6a12690d2ff959e5686,8/30(水) 15:35
khks,仙台牛を台湾に大規模輸出　東経連、全農みやぎと日ハムを仲介,https://news.yahoo.co.jp/articles/ae8400055640c97cc2f25576c6af22151144a0fb,8/30(水) 15:33
khks,プラごみ回収袋を地域清掃用ごみ袋に再資源化　仙台市が全国初の「水平リサイクル」実現,https://news.yahoo.co.jp/articles/c38f3d8170139a681583da47f28e09eb6b5ea831,8/30(水) 15:32
khks,仙台市コロナ1031人　前週より増加　8月21日~27日,https://news.yahoo.co.jp/articles/827210a5084b28b08d3414348481149db00db91f,8/30(水) 15:03
khks,宮城のレギュラーガソリン183円10銭　過去最高の184円に迫る,https://news.yahoo.co.jp/articles/e79d76b279c0c2b4a996f28ce7a00d5c920c90ca,8/30(水) 14:43
khks,迷惑電話「市民へのテロ行為も同然」　福島市、復興庁に対策を要望,https://news.yahoo.co.jp/articles/a8d982d862e6e7b2e84e89c17096f5ece6149c5b,8/30(水) 6:30
khks,仙台の震災遺構「荒浜小」来館50万人超える,https://news.yahoo.co.jp/articles/8478142cac56e0a22426e11f491c11decd1cd66f,8/30(水) 6:30
khks,処理水　迷惑電話3000件以上　福島県と県内の市町村施設へ,https://news.yahoo.co.jp/articles/ea979535b3aa219c6798de7b991b0d8fc2526a23,8/30(水) 6:30
khks,仙台駅東口「ロピア」、開店1週間で10万人来店,https://news.yahoo.co.jp/articles/621d1b1e4227045519e4ebbe451209934cd03f44,8/30(水) 6:30
khks,8月の熱中症搬送　宮城、27日までに894人　最多を更新,https://news.yahoo.co.jp/articles/bb77e74f35b7ee03366bfd82f01412ec8f6f349a,8/29(火) 15:56
khks,「暑い日の　のどのかわきは　赤信号」　宮城・名取市と大塚製薬　熱中症対策標語コンテスト,https://news.yahoo.co.jp/articles/603b5129bab61f306bd5540e7c3a901f2e2b6361,8/29(火) 15:33
