media_en,media_jp,title_articles,link_articles,date_original
usoccer,超WORLDサッカー！,磐田一筋11年、DF小川大貴が初の期限付き移籍でJ2千葉に加入「僕にとってかけがえのない時間でした」,https://news.yahoo.co.jp/articles/35631738baa96d15ec6f1ee09c73331edb86b01e,7/8(月) 10:08
usoccer,超WORLDサッカー！,ミラン監督退任のピオリ氏、アル・イテハド行きはなし？ ベンゼマが拒否と報道も実態は別のところに,https://news.yahoo.co.jp/articles/c03c79b046e93b6c514bb6efb5b7f0fe4ab663c9,7/8(月) 9:30
usoccer,超WORLDサッカー！,リバプールの控えGKアドリアンの退団が正式決定！ 本人がビデオメッセージ「一生感謝する」,https://news.yahoo.co.jp/articles/180a81a2a1ab47753e851cb24a070f3c0238c855,7/8(月) 8:55
usoccer,超WORLDサッカー！,リヨン、昨季レンタルのガーナ代表FWヌアマを完全移籍で獲得！移籍金は50億円に,https://news.yahoo.co.jp/articles/d5b2f56167aadbdc17c4175134b1ff516d10ee1d,7/8(月) 8:30
usoccer,超WORLDサッカー！,フィオレンティーナがイタリア代表FWケアンを獲得!　近日中に公式発表へ,https://news.yahoo.co.jp/articles/ed226c8904a9f70ab9b7dca4d8c6cd44b61923ef,7/8(月) 8:00
usoccer,超WORLDサッカー！,ブライトン、ウィルシャー氏が期待を寄せた“NEXTサカ”をアーセナルから獲得,https://news.yahoo.co.jp/articles/f2746c912da0b0fb45ea7265c62c791a9054ae63,7/8(月) 7:30
usoccer,超WORLDサッカー！,ポルトがイラン代表FWタレミの退団を発表…数日中にもインテル入りか,https://news.yahoo.co.jp/articles/5f4133bfe2dd407ab13e8058db2c6d9d4b768f0b,7/8(月) 7:00
usoccer,超WORLDサッカー！,バイエルン、クリスタル・パレスMFオリーズ獲得を正式発表！2029年までの5年契約を締結,https://news.yahoo.co.jp/articles/0ac776c955dfe86b343d25fad42fb9d542ae3ca5,7/8(月) 6:30
usoccer,超WORLDサッカー！,ブラジル戦負傷のアラウホのコパ・アメリカが終了…ペドリに続きバルサ勢2人目の離脱に,https://news.yahoo.co.jp/articles/fc7aeccb4f0799634c1cde468a9562a8e2b07a5c,7/8(月) 0:30
usoccer,超WORLDサッカー！,レスターが18歳の逸材MFゴールディングを獲得…デューズバリー＝ホール抜かれたチェルシーから補強,https://news.yahoo.co.jp/articles/d0bda61c379515606e7496b5752a1a00a660e96f,7/7(日) 23:42
usoccer,超WORLDサッカー！,負傷離脱のペドリ、UEFAがバルセロナへ補償金支払いへ…最大1年間で13億円,https://news.yahoo.co.jp/articles/03da7f7ff8cb818a445f798110a718ba8ce520b9,7/7(日) 23:35
usoccer,超WORLDサッカー！,ラ・レアルに朗報…スビメンディが来季残留の意思表示,https://news.yahoo.co.jp/articles/11b561466b55152b3e97189191bb15507a945192,7/7(日) 23:15
usoccer,超WORLDサッカー！,伊藤洋輝の加入で難しい状況に？ バイエルンの韓国代表DFキム・ミンジェ、セリエA復帰の可能性,https://news.yahoo.co.jp/articles/bf3cdae2c58010a7d0277f655c18dc127566a163,7/7(日) 22:57
usoccer,超WORLDサッカー！,中盤補強必須のラツィオ、フリーのカストロヴィッリに接触か？,https://news.yahoo.co.jp/articles/b82b47a96e36701badf9cb005137c658146665f5,7/7(日) 22:52
usoccer,超WORLDサッカー！,ユナイテッドがオランダ代表FWザークツィー獲得で大筋合意、契約解除金の70億円も支払いへ,https://news.yahoo.co.jp/articles/86392cdc3ca84648fba8c81d27954485f890ef19,7/7(日) 22:15
usoccer,超WORLDサッカー！,ベレンゲルがアスレティックと契約延長！　昨季限りで契約満了も新たに3年契約締結,https://news.yahoo.co.jp/articles/8e16ab79c27eb1756067196f0704435a73d8695d,7/7(日) 22:05
usoccer,超WORLDサッカー！,ケガでユーロ終了のペドリはチームに帯同続ける「別の方法で貢献する」、クロースにもメッセージ「これがフットボール」,https://news.yahoo.co.jp/articles/6c0e03f4fe8b1c67dd69110a5a82412630e994e8,7/7(日) 21:40
usoccer,超WORLDサッカー！,不屈の京都が宮本優太のJ初弾で絶好調の福岡撃破！　土壇場被弾も後半ラストプレー弾で劇的今季初の連勝【明治安田J1第22節】,https://news.yahoo.co.jp/articles/9a6ec74ef43acdaa1d4f1987570d2baaaca91774,7/7(日) 21:20
usoccer,超WORLDサッカー！,苦しみ抜いた最下位の群馬が16戦ぶりの今季2勝目！　今季初複数得点となる会心4ゴール【明治安田J2第23節】,https://news.yahoo.co.jp/articles/885719600266dafcb8d7fcf861d0a88887ea334f,7/7(日) 21:07
usoccer,超WORLDサッカー！,「懐かしい3ショット」「素晴らしい関係」長谷部誠が恩師の元を訪問！ 昨年倒れたザックの下を訪れ懐かしのショット「とてもとても元気で安心しました」,https://news.yahoo.co.jp/articles/7174aba89a79ec7bf30a353e36e48d75073aba48,7/7(日) 20:58
usoccer,超WORLDサッカー！,敵地で大逆転勝利の今治が久々連勝で4位浮上！　琉球が連敗を「3」でストップ【明治安田J3第20節】,https://news.yahoo.co.jp/articles/d7ffcc0f89b3e19929fc2bf9371c3ee2212a62c2,7/7(日) 20:14
usoccer,超WORLDサッカー！,伝統の堅守でブラジル撃破のウルグアイ…ビエルサは自身の志向と異なる守備のメンタリティ称える,https://news.yahoo.co.jp/articles/dfab0af88e67c1f83e111a23f92cc8e906407303,7/7(日) 19:00
usoccer,超WORLDサッカー！,期待外れのベスト8敗退となったセレソン指揮官「期待通りの結果ではなかったことは認めざるを得ない。その責任は私が負う」,https://news.yahoo.co.jp/articles/029bf8cae240483b94aeee8e4ed9931699db0dd4,7/7(日) 18:00
usoccer,超WORLDサッカー！,「このクラブが大好きですし、離れるのは本当に寂しい」…移籍決断の清武弘嗣がC大阪サポーターにメッセージ動画　「もう1回自分の価値を証明」,https://news.yahoo.co.jp/articles/5cb3ffd71084e5cff7833a39dad66db1c468b939,7/7(日) 17:50
usoccer,超WORLDサッカー！,【JFL第15節】ラインメール青森が青森山田サッカー部の大声援を背に3位枚方撃破！ Hondaは朴康造監督初陣の鈴鹿とドロー,https://news.yahoo.co.jp/articles/8e7ae2fde03957b44ee1748ef07affba06aee1ef,7/7(日) 17:08
usoccer,超WORLDサッカー！,フリーのペペがサウジアラビア行きへ交渉の場設定…現時点ではあらゆる選択肢を評価,https://news.yahoo.co.jp/articles/0a8d6269e4a0ae50e0b4094205084a5739201950,7/7(日) 16:50
usoccer,超WORLDサッカー！,ノーゴールでユーロ終戦のC・ロナウドがメッセージ　「このレガシーは尊重され、これからも築かれていくと確信」,https://news.yahoo.co.jp/articles/8a34a11e85b795355f9b4ebfa3ca9178b2a8ec27,7/7(日) 16:45
usoccer,超WORLDサッカー！,G大阪DF江川湧清が自動車同士の接触事故…双方ともに大きなケガなし,https://news.yahoo.co.jp/articles/fcc4701283e9cbe3010ed72a013faf5841a559e5,7/7(日) 16:15
usoccer,超WORLDサッカー！,「熱意を取り戻し、PSGの支配に挑戦する」…デ・ゼルビ監督がマルセイユでの挑戦へ意気込み,https://news.yahoo.co.jp/articles/06ba0c8ce4a79396c0a44487e052e3f5e907c190,7/7(日) 16:05
usoccer,超WORLDサッカー！,甲府GKコ・ボンジョが今季いっぱいの残留決定…今年4月に鳥栖から緊急レンタルで加入,https://news.yahoo.co.jp/articles/c38f5453322fa97e98256cbc5afd30dccf9cf05d,7/7(日) 16:00
usoccer,超WORLDサッカー！,岡山がいわきDF嵯峨理久を獲得！　「謙虚に、貪欲に岡山の地で頑張ります」,https://news.yahoo.co.jp/articles/d1e0a7af89db8630f0508a27de3c695ae06d5d4e,7/7(日) 15:45
usoccer,超WORLDサッカー！,広島新エースの大橋祐紀が入籍　「更なるパワーアップを目指し、二人三脚で…」,https://news.yahoo.co.jp/articles/56bbc93380f3cba8caeccc6644b4d307009de195,7/7(日) 15:30
usoccer,超WORLDサッカー！,8月に中国開催予定のトロフェ・デ・シャンピオンが延期に…モナコCEO「キャンセルは少し遅すぎた」,https://news.yahoo.co.jp/articles/63c9e1b3e61f9cbe80a7a39b48255752f58e910d,7/7(日) 14:53
usoccer,超WORLDサッカー！,「チーム、スイス全体を失望させた気がしている」…PK戦唯一失敗のアカンジはベスト8敗退の責任負う…,https://news.yahoo.co.jp/articles/ab4bbf0572b2f43078ec9ec34510f0ff01b38061,7/7(日) 14:20
usoccer,超WORLDサッカー！,アルゼンチン代表MFアルマダがボタフォゴへ完全移籍…来年1月のリヨン行きも内定,https://news.yahoo.co.jp/articles/9cf03cb642376ca08c2c9a328f8db4bee9e3f8f6,7/7(日) 13:51
usoccer,超WORLDサッカー！,J2首位長崎が守備強化！　いわきCB照山颯人を完全移籍で獲得,https://news.yahoo.co.jp/articles/21b444c205c63942ec908962b1122c24045b9cff,7/7(日) 13:50
usoccer,超WORLDサッカー！,エジプト代表レファートが31歳で逝去…今年3月の試合中に心臓発作,https://news.yahoo.co.jp/articles/6e2469c75c159f11889d320389a090acad015524,7/7(日) 13:30
usoccer,超WORLDサッカー！,「いつもイカしてる」「グッとくる…」福島が地域密着の「SDGsユニフォーム」を発表！ わらじまつりに桃やぶどうなど…「地元密着ってこういうこと」,https://news.yahoo.co.jp/articles/c9441a62dca258f30521343c3bca00f303008ef5,7/7(日) 13:20
usoccer,超WORLDサッカー！,スペインで停滞感払拭なるか…ファン・デ・ベークがCL参戦ジローナ移籍に迫る,https://news.yahoo.co.jp/articles/981648d2c5afb9f426e188e982ea1206cb394b92,7/7(日) 13:15
usoccer,超WORLDサッカー！,ユーロ2024ベスト4決定！ 優勝経験国は3つ、わずか1ゴールや唯一の全勝など4強の今大会を振り返る【ユーロ2024】,https://news.yahoo.co.jp/articles/242361cebe5b711e4f42a3dc6b52c17b005a71c0,7/7(日) 12:55
usoccer,超WORLDサッカー！,準決勝にアルゼンチン、カナダ、コロンビア、ウルグアイが進出！ 4強出揃う【コパ・アメリカ2024】,https://news.yahoo.co.jp/articles/bea1691ec84e48052526f51892f2c26de25b5e96,7/7(日) 12:45
usoccer,超WORLDサッカー！,ウルグアイが2011年大会以来のベスト4！　10人になるもブラジルとのPK戦制す【コパ・アメリカ2024】,https://news.yahoo.co.jp/articles/17dc6526b3c8eff468064587e6b15fed9001acb3,7/7(日) 12:13
usoccer,超WORLDサッカー！,「よりリスペクトされるだろう」トルコは若手の躍動もベスト8で力尽きる…モンテッラ監督は今後に期待「未来は我々の味方」,https://news.yahoo.co.jp/articles/db82be9afb127731ebad957d05eccd0a32e911b6,7/7(日) 11:05
usoccer,超WORLDサッカー！,好調G大阪、昨年末に右ヒザ手術の東口順昭が離脱…左ヒザ内側半月板損傷と診断,https://news.yahoo.co.jp/articles/3df0fda09936c07edf379e3da9119b3d2fa43990,7/7(日) 11:00
usoccer,超WORLDサッカー！,元日本代表MF清武弘嗣がC大阪を出て再起！　鳥栖にレンタル移籍…「もう一度認めてもらえるように」,https://news.yahoo.co.jp/articles/4d8cc8135cfda040a5454ff14f5c20ad43ea0ae6,7/7(日) 10:25
usoccer,超WORLDサッカー！,オランダ指揮官クーマン、4強入りに満足　「国民全員にとって特別なこと」,https://news.yahoo.co.jp/articles/614cfc82438ddbfb355c1d2f18e5d221c80454c8,7/7(日) 10:10
usoccer,超WORLDサッカー！,PK戦で力尽く…4強入りならずも堂々のスイス指揮官「胸を張って去る」,https://news.yahoo.co.jp/articles/2b1008c4274ded32b9ba8ca59e8913d2a1b4a557,7/7(日) 9:30
usoccer,超WORLDサッカー！,山口が町田MF奥山洋平を期限付き移籍で獲得「今の自分を必要としてくれた事に感謝」,https://news.yahoo.co.jp/articles/da2708ebb0764efa9016ea3d4f7fba35842b5a70,7/7(日) 9:20
usoccer,超WORLDサッカー！,ハメスが1G2Aの躍動！ コロンビアがパナマ相手に5ゴール奪ってベスト4進出【コパ・アメリカ2024】,https://news.yahoo.co.jp/articles/97d59440514936d8c07b7e1d2fbb6557296fdb19,7/7(日) 8:57
usoccer,超WORLDサッカー！,イングランド指揮官がPK戦決着の準々決勝に　「ここまでで最高の試合」,https://news.yahoo.co.jp/articles/96d199a8a5956ccfd3e62f7505b83b351ad6ac16,7/7(日) 8:50
usoccer,超WORLDサッカー！,川崎Fの下部組織育ちMF村田聖樹がデンマーク1部のヴェイレBKに加入！ 昨季までアゼルバイジャンでプレー,https://news.yahoo.co.jp/articles/ade8bf9bfcb9e6bb6fc3f76be6c4f202e6de788b,7/7(日) 8:17
usoccer,超WORLDサッカー！,ペドリを負傷させたクロースが謝罪「一日も早い回復と活躍を祈っている」,https://news.yahoo.co.jp/articles/d852ac42ffe1c14e00802e65ee865e1a135551aa,7/7(日) 7:30
usoccer,超WORLDサッカー！,ドイツ戦で負傷のペドリのユーロが終了…グレード2のねん挫で大会中の復帰は叶わず,https://news.yahoo.co.jp/articles/b49fd4b666d5a12fb67f49db199656b0e9ca5053,7/7(日) 6:50
usoccer,超WORLDサッカー！,トルコに逆転勝利のオランダが5大会ぶりのベスト4進出！【ユーロ2024】,https://news.yahoo.co.jp/articles/494438434354d009357bda3b79dadf86bee19d3f,7/7(日) 6:10
usoccer,超WORLDサッカー！,PK戦までもつれたスイスとの激闘を制したイングランドが準決勝進出！【ユーロ2024】,https://news.yahoo.co.jp/articles/60f3adeb8d27645f7c05e2af637d51ddaa5b416a,7/7(日) 3:50
usoccer,超WORLDサッカー！,インテル、ナポリを退団したジエリンスキの獲得を正式発表！4年契約を締結,https://news.yahoo.co.jp/articles/9f232ff63cf7730309a6a51dfc8de21cc094039d,7/7(日) 0:40
usoccer,超WORLDサッカー！,ユベントスが世界で最もセクシーなサッカー選手、スイス女子代表FWレーマンを獲得！ ブラジル代表の恋人と揃って移籍,https://news.yahoo.co.jp/articles/ba1bf0fa51b7e8dd28c1cd68574156301a2134d5,7/6(土) 23:40
usoccer,超WORLDサッカー！,鎌田大地ら中盤の選手退団のラツィオ、ナイジェリア代表期待の若手MFデレ＝バシルを買取義務のレンタル移籍で獲得,https://news.yahoo.co.jp/articles/6b76ea9152ba6ec78c30ea7dc1dce018fcf7bbea,7/6(土) 23:20
usoccer,超WORLDサッカー！,スポルティングのキャプテン、元ウルグアイ代表DFコアテスが母国の古巣・ナシオナルに完全移籍,https://news.yahoo.co.jp/articles/7f6b6bf080e4b1be243e6c7c0dea1683be83aef2,7/6(土) 23:05
usoccer,超WORLDサッカー！,プレミア昇格のレスター、フルアムのジャマイカ代表FWデコルドバ＝リードを完全移籍で獲得,https://news.yahoo.co.jp/articles/e478c5514680efabbb639c122e6728deab776830,7/6(土) 22:55
usoccer,超WORLDサッカー！,衝撃の結末…勝利目前の川崎F、守護神が滑って転倒し土壇場失点…磐田とドローに終わる【明治安田J1第22節】,https://news.yahoo.co.jp/articles/cb17875cc22f0c1829494816e1cf8cbb6d394c36,7/6(土) 22:35
usoccer,超WORLDサッカー！,首位長崎が九州ダービー制して無敗継続！ 2位横浜FCはクラブ記録の8連勝達成【明治安田J2第23節】,https://news.yahoo.co.jp/articles/b6e27ec047dc692a69bd46101d030643a1718cad,7/6(土) 22:33
usoccer,超WORLDサッカー！,横山歩夢が2ゴールの躍動！ 鳥栖が今季2度目の2連勝で貴重な勝ち点3、6月無敗の新潟を下す【明治安田J1第22節】,https://news.yahoo.co.jp/articles/e07d61781a71f4cb969dbd3efa3cd85bedd6fbab,7/6(土) 22:00
usoccer,超WORLDサッカー！,戸嶋祥郎の後半AT弾で柏が点の取り合いを制す！ FC東京は今季初の連敗【明治安田J1第22節】,https://news.yahoo.co.jp/articles/75cddf7b418ea256e3699a315d9ef4be5087fec9,7/6(土) 21:55
usoccer,超WORLDサッカー！,2位沼津が首位大宮の独走に待ったをかける！　強いホームで3発勝利【明治安田J3第20節】,https://news.yahoo.co.jp/articles/fb107f616e50e117c000ffe8b08ede210a5133f8,7/6(土) 21:55
usoccer,超WORLDサッカー！,残留争い中の湘南が劇的ドラマ！ 90分から石井久継、ルキアンの2ゴールで浦和に大逆転勝利【明治安田J1第22節】,https://news.yahoo.co.jp/articles/784e6f0d7add99a9e0dcbdb7a71e5e783f777e92,7/6(土) 21:28
usoccer,超WORLDサッカー！,G大阪が最多4発で力強い仕切り直しに成功！　横浜FMは4連敗【明治安田J1第22節】,https://news.yahoo.co.jp/articles/987f30156685babae0dceb219f79b1dc20d26848,7/6(土) 21:08
usoccer,超WORLDサッカー！,ナポリ退団の元ドイツ代表MFデンメ、ヘルタ・ベルリンに完全移籍で4年半ぶりの母国復帰,https://news.yahoo.co.jp/articles/724ad9f3505756ea8542704db0b27f9a92091375,7/6(土) 21:07
usoccer,超WORLDサッカー！,C大阪が8戦無敗も粘りの10人東京Vに勝ち切れず…山見＆レオ・セアラが共に2戦連発の痛み分け【明治安田J1第22節】,https://news.yahoo.co.jp/articles/6e22c93ec48d784438090548a06b3b738d6c9991,7/6(土) 20:50
usoccer,超WORLDサッカー！,【JFL第15節】首位独走高知 & 2位栃木Cがともにドローで勝ち点「10」差変わらず…枚方は今節勝利なら2位再浮上,https://news.yahoo.co.jp/articles/c5763ef89d117a194eba34334affea63c60968b9,7/6(土) 20:45
usoccer,超WORLDサッカー！,浅野拓磨がマジョルカに完全移籍！ クラブ4人目の日本人、初のラ・リーガ挑戦へ,https://news.yahoo.co.jp/articles/2c1a5417714b52fb3598e3913fc33ed79824f0d0,7/6(土) 20:40
usoccer,超WORLDサッカー！,首位町田が下田北斗の決勝点で逃げ切り！ 名古屋は泥沼の4連敗【明治安田J1第22節】,https://news.yahoo.co.jp/articles/908a9c54593da9c185287fc7ed3549dcdd04324a,7/6(土) 20:27
usoccer,超WORLDサッカー！,鹿島が鈴木優磨2アシストで5戦ぶり白星！　札幌は5戦ノーゴール＆8連敗に【明治安田J1第22節】,https://news.yahoo.co.jp/articles/e94ed8dd9c27467c672e7f146851b89391f598d6,7/6(土) 20:05
usoccer,超WORLDサッカー！,準々決勝でオランダと対戦のトルコ、指揮官はチームの経験不足認めるも「言うまでもなく勝ちたい」,https://news.yahoo.co.jp/articles/39dc5786e0eaa43dbf703ae10f02ed963cf5e4e3,7/6(土) 17:52
usoccer,超WORLDサッカー！,FC東京戦の柏、井原正巳監督が体調不良…栗澤僚一ヘッドコーチが指揮へ,https://news.yahoo.co.jp/articles/8ad9c518a7536ca393563e978b3dbbd413502231,7/6(土) 17:40
usoccer,超WORLDサッカー！,守備改善の一手！　ウェストハムがキルマンを獲得、ロペテギ新監督と再会に,https://news.yahoo.co.jp/articles/97f74b262f854ce4b2225386f9e97cce5b6426b6,7/6(土) 17:35
usoccer,超WORLDサッカー！,「熱狂的な相手」トルコを警戒のオランダ指揮官、ベスト4進出へ「自分たちの力を信じ続けなければ」,https://news.yahoo.co.jp/articles/31dc3d82e5114a1f14be0fde69678896a0a53d99,7/6(土) 17:22
usoccer,超WORLDサッカー！,イタリアに続きイングランドも撃破へ、スイス指揮官「強豪相手に戦えることを証明している」,https://news.yahoo.co.jp/articles/9a2fbd5d04714bee4c7a133385101aceaa2aaab2,7/6(土) 16:41
usoccer,超WORLDサッカー！,負傷交代のペドリ、ユーロ中の復帰厳しいか…最低でも全治1カ月の報道も,https://news.yahoo.co.jp/articles/a2c523d91d32b737e6cecb1d804cc7c9b41d2563,7/6(土) 16:05
usoccer,超WORLDサッカー！,チェルシーが新たな若手有望株を確保…U-21ポルトガル代表MF獲得間近に,https://news.yahoo.co.jp/articles/71ad74afe043fd8a44b17af434e4788c5d25b3b9,7/6(土) 16:00
usoccer,超WORLDサッカー！,“エル・コマンダンテ”が古巣帰還…36歳ホセ・モラレスがレバンテに2年ぶりの復帰,https://news.yahoo.co.jp/articles/08486cf243722f54c00ed3c88b36d2680d1eb391,7/6(土) 15:45
usoccer,超WORLDサッカー！,【J1注目プレビュー|第22節:G大阪vs横浜FM】優勝争いへ連敗避けたいG大阪、横浜FMは3連敗を止められるか!?,https://news.yahoo.co.jp/articles/3bb71e2fdca114b030b3b1505ae4bd95b99be4a9,7/6(土) 15:40
usoccer,超WORLDサッカー！,キエーザはローマ移籍か？　ディバラとの再タッグに注目…,https://news.yahoo.co.jp/articles/baa9796db94b5f5609753f8ee47cf8af68b21a43,7/6(土) 15:30
usoccer,超WORLDサッカー！,【J1注目プレビュー|第22節:町田vs名古屋】首位を守りたい町田、名古屋は未勝利の6月を終え巻き返しなるか,https://news.yahoo.co.jp/articles/c6546983db52f92d36917a46acf6c367b0744ff9,7/6(土) 15:15
usoccer,超WORLDサッカー！,新守護神探すセルティック、ユーロ参戦中のスイス代表GKが新たな候補に？,https://news.yahoo.co.jp/articles/97eb928971711416b71f41bc0a5652b5d022d14d,7/6(土) 14:40
usoccer,超WORLDサッカー！,4強入り懸けスイスと対戦のイングランド指揮官、目標はシンプル「彼らに問題を引き起こすだけ」,https://news.yahoo.co.jp/articles/6e988cb1592e98edc6ad1982c020845dcf744f22,7/6(土) 14:39
usoccer,超WORLDサッカー！,クロース現役引退のドイツ、ミュラーも代表に別れ？ 「これが最後の試合になるかも」,https://news.yahoo.co.jp/articles/0db759b2b3b215eeb8b249f2e812f8c1ce5b2c46,7/6(土) 14:31
usoccer,超WORLDサッカー！,【J1注目プレビュー|第22節:東京VvsC大阪】7戦無敗のC大阪を迎える東京V、引き分けが多い両者は決着をつけられるか!?,https://news.yahoo.co.jp/articles/ee520d454850f585d8bc0ff0e5092ffae0a9f212,7/6(土) 14:25
usoccer,超WORLDサッカー！,マルセイユがファン・ヒチャンに関心か？　デ・ゼルビ新監督もアプローチを承認,https://news.yahoo.co.jp/articles/839052dc813883989f670177670318fe80b3937a,7/6(土) 14:20
usoccer,超WORLDサッカー！,ドルト退団マテウ・モレイが故郷の古巣マジョルカに加入…,https://news.yahoo.co.jp/articles/3bd6a58276e3d8694d9011a9f290ee2af94ec696,7/6(土) 14:05
usoccer,超WORLDサッカー！,【J1注目プレビュー|第22節:鹿島vs札幌】前節完敗の鹿島は連敗を避けたいところ、泥沼7連敗中の札幌に光は差すか,https://news.yahoo.co.jp/articles/61f3017a19b70ae4899b67bb8cb82750cbe10b09,7/6(土) 14:00
usoccer,超WORLDサッカー！,アウグスブルク、昨季ブレストの大躍進に貢献した大型FWムニエを獲得,https://news.yahoo.co.jp/articles/f4ebd4c21929c9ab6b0e48f0a99c1815eb0ee2df,7/6(土) 13:50
usoccer,超WORLDサッカー！,ダニ・ガルシアが恩師メンディリバル率いるECL王者オリンピアコス加入,https://news.yahoo.co.jp/articles/aeeeacf65508e87596a7f13ee2ee9d354d2fd3d7,7/6(土) 13:38
usoccer,超WORLDサッカー！,アルベルト・モレノが5年過ごしたビジャレアル退団…負傷に苦しむもEL優勝も経験,https://news.yahoo.co.jp/articles/0d391f12493c64e6e47dd5946d5756ba1adfca5c,7/6(土) 13:28
usoccer,超WORLDサッカー！,「夢は今打ち砕かれた」ユーロは手にできず、スペインに敗れ現役引退…トニ・クロースがキャリアを終える「今日はとても悲しい」,https://news.yahoo.co.jp/articles/443e31b9ea28bb92eefecacd5249783973a7e192,7/6(土) 13:15
usoccer,超WORLDサッカー！,町田のパリ五輪代表FW平河悠が海外移籍前提でチーム離脱…名古屋戦後に,https://news.yahoo.co.jp/articles/8b67fdf84fd8eea81beae94165c7d841d60ffb33,7/6(土) 12:50
usoccer,超WORLDサッカー！,「何が起こっているのかがわからなかった」PK戦突入間際の劇的ゴール、スペイン代表MFメリーノが優勝へ意気込み「重要なのはメンタリティ」,https://news.yahoo.co.jp/articles/59f9b9b536b9fd2af8c39b2f7d96a8228c894ed5,7/6(土) 12:35
usoccer,超WORLDサッカー！,初出場カナダがベスト4！　GS全勝突破ベネズエラはPK戦で力尽く【コパ・アメリカ2024】,https://news.yahoo.co.jp/articles/66ced109cbac0ae64d1855809b93d82f0945cf33,7/6(土) 12:15
usoccer,超WORLDサッカー！,「違う結果に値した」ユーロ敗退でC・ロナウドの胸で号泣のペペ、41歳DFは自身の去就に「将来について話す時間はある」,https://news.yahoo.co.jp/articles/aec3dd4146d641073f1816d655195ff2dccccdd5,7/6(土) 12:02
usoccer,超WORLDサッカー！,降格バーンリー、パーカー氏が監督就任！　コンパニ氏後任がついに決定,https://news.yahoo.co.jp/articles/e6dddac4483522b6633be57e2b54ad35a2306e81,7/6(土) 11:35
usoccer,超WORLDサッカー！,4強入りならずも前向くポルトガル指揮官「プライドをもっての負け」,https://news.yahoo.co.jp/articles/e668c228f8961b58abc23a0c9b0f5bb880d9cf8e,7/6(土) 11:05
usoccer,超WORLDサッカー！,スタッド・ランス支えたキャプテン、モロッコ代表DFアブデルハミドが昇格組のサンテチェンヌに完全移籍,https://news.yahoo.co.jp/articles/57cbbc219ae76da22f6f1122f0cb2b9c229f9fd7,7/6(土) 11:05
usoccer,超WORLDサッカー！,ジダンの次男、GKリュカ・ジダンがエイバルから降格したグラナダに完全移籍！ エイバルでは正守護神としてプレー,https://news.yahoo.co.jp/articles/fd2711d7604c8368c3db4abac08a4fbfeeaa3936,7/6(土) 10:55
