media_en,media_jp,title_articles,link_articles,date_original
usoccer,超WORLDサッカー！,1カ月前は110kg…“太り過ぎ”指摘のジューレが減量成功でお腹も凹む,https://news.yahoo.co.jp/articles/bb1ef65560ea9ba5b48eb30f1089201609382e41,7/11(木) 15:12
usoccer,超WORLDサッカー！,シティU-23のリアム・デラップがイプスウィッチに完全移籍へ！　強肩ロリー・デラップの長男,https://news.yahoo.co.jp/articles/f317ebc49f43350fd4a681b6ddcc5f376985fa12,7/11(木) 14:30
usoccer,超WORLDサッカー！,ユーロで通算5度目の準決勝敗退…主要タイトル遠いオランダ代表「手ぶらで去る」,https://news.yahoo.co.jp/articles/5a8ef65dfc07fd0a545c5a0c818398c329f0a96b,7/11(木) 14:00
usoccer,超WORLDサッカー！,酔っ払いが発端か？ 試合後に大乱闘、ダルウィン・ヌニェスらがコロンビアのファンとスタンドで殴り合い…ウルグアイ主将「家族を守る必要があった」,https://news.yahoo.co.jp/articles/6b683e29949a967ef39442154af92ada0f8a3613,7/11(木) 13:35
usoccer,超WORLDサッカー！,しぶとく交渉のバイエルンがパリーニャ獲得で合意へ、選手の渡独は休暇後に？,https://news.yahoo.co.jp/articles/9745beeacf98740dfec63566ad84a94f7de105f3,7/11(木) 13:30
usoccer,超WORLDサッカー！,ダンフリースとインテルの契約交渉が再開へ…延長or売却は現状50-50か,https://news.yahoo.co.jp/articles/078a3bd76e60d30a4b2883f90063b2ca338f9dc3,7/11(木) 13:30
usoccer,超WORLDサッカー！,「新しい歴史を作る」プレミアリーグに挑戦する鎌田大地、クリスタル・パレス移籍の理由の1つは「監督からの信頼を感じられた」,https://news.yahoo.co.jp/articles/29dfcb3006f20eca0b87897c8bb4018680aa5f0b,7/11(木) 13:05
usoccer,超WORLDサッカー！,ギラシーのドルトムント入りがストップ、メディカルチェックで問題発生か,https://news.yahoo.co.jp/articles/a05d882ecc05e1456560bdd548453cbcc78be6a9,7/11(木) 12:40
usoccer,超WORLDサッカー！,J3首位の大宮が徳島からナイジェリア人FWオリオラ・サンデーを完全移籍で獲得、昨季途中からはJ3八戸でプレー「昇格しましょう!」,https://news.yahoo.co.jp/articles/720c8916116f83436873c2dafc6d057fb1ee184a,7/11(木) 12:10
usoccer,超WORLDサッカー！,「言葉では言い表せない」堂々たるプレーでユーロ決勝進出に貢献、喜び爆発のメイヌーは「歴史に名を刻むためここにいる」,https://news.yahoo.co.jp/articles/473513e810c1e8f1f3ab883afbf6021dd8586c37,7/11(木) 11:30
usoccer,超WORLDサッカー！,ニューカッスルの立て直しに貢献！ PIFの買収を支えた共同オーナーのステーブリー＆ゴドゥーシ夫妻がチームを去ることに,https://news.yahoo.co.jp/articles/a0e1e8053fe884e8bc86b1a12925e6d5963cc819,7/11(木) 11:25
usoccer,超WORLDサッカー！,数的不利を跳ね除けコロンビアが23年ぶりの決勝進出！前半退場者も最後までリード守り死闘制す【コパ・アメリカ2024】,https://news.yahoo.co.jp/articles/6153f3f41e3bc6e46db2bb901a1729cd94feb439,7/11(木) 11:18
usoccer,超WORLDサッカー！,バレンシアのスイス代表DFキュメルトがバジャドリーへレンタル移籍…昨季はナントでプレー,https://news.yahoo.co.jp/articles/ef89e515df98c190bf814b60af5acc3b4401175e,7/11(木) 10:53
usoccer,超WORLDサッカー！,「言葉にならない！」後半ATに劇的ゴール、イングランドを2大会連続決勝に導いたワトキンスが喜びを語る「ユーロでプレーするなんて思ってもみなかった」,https://news.yahoo.co.jp/articles/8c801209207622f92f06052871604e88d297370e,7/11(木) 10:45
usoccer,超WORLDサッカー！,トッテナム退団のタンガンガがミルウォールに加入！昨季後半もレンタル移籍でプレー,https://news.yahoo.co.jp/articles/e6016a2fc767c44524d2fad2509ea7dac8edc7d4,7/11(木) 10:10
usoccer,超WORLDサッカー！,U-19日本代表FW道脇豊が海外移籍へ！ 準備のため熊本のトレーニングを離脱,https://news.yahoo.co.jp/articles/c7d703ad491796bd89de3a278ad2558d4dcb32a5,7/11(木) 9:57
usoccer,超WORLDサッカー！,ホイルンドがフランクフルトに完全移籍！ 兄はユナイテッドでプレーする双子の1人、2029年まで契約,https://news.yahoo.co.jp/articles/b07567cb9f3209d4bd090198d4625ebe57a2227e,7/11(木) 9:40
usoccer,超WORLDサッカー！,コパ・アメリカでグループ突破ならずの開催国アメリカ…バーホルター監督の解任を発表,https://news.yahoo.co.jp/articles/f91291a5f9214ee414e6a3284e390ebd5648128f,7/11(木) 9:30
usoccer,超WORLDサッカー！,「結果にはがっかり」惜しくもユーロ決勝進出に届かずのオランダ…クーマン監督は「チームの将来には自信がある」,https://news.yahoo.co.jp/articles/550b0b2e66e514db13d80e70c495c5423edfc701,7/11(木) 9:00
usoccer,超WORLDサッカー！,「質は抜群だった」2大会連続でユーロ決勝進出、歓喜のサウスゲイト監督「全員が準備万端だった」,https://news.yahoo.co.jp/articles/7b7df313a039d87ccfca0ad78aa1fd8b125b6978,7/11(木) 8:40
usoccer,超WORLDサッカー！,17位に沈むコリンチャンス、新監督にラモン・ディアス氏を招へい,https://news.yahoo.co.jp/articles/4e1cfb0b7f5e6152ac698ed0f4558d06ec33a8e6,7/11(木) 8:30
usoccer,超WORLDサッカー！,バレンシアのスイス代表DFキュメルトが昇格組のバジャドリーへレンタル移籍,https://news.yahoo.co.jp/articles/bb6f33cf7b7719375d12bb2f4f7aac5147d8253b,7/11(木) 8:00
usoccer,超WORLDサッカー！,ナポリ、マドリーDFラファ・マリンを完全移籍で獲得！マドリーは買戻しOPを保持,https://news.yahoo.co.jp/articles/f64904e1523cf256c52f5dcb2883d2feaf1582e0,7/11(木) 7:30
usoccer,超WORLDサッカー！,ローマ、レンヌMFル・フェの獲得を正式発表！,https://news.yahoo.co.jp/articles/26b8ddf5a2a6635f9fe02aa02db146b3730a2b33,7/11(木) 7:00
usoccer,超WORLDサッカー！,ケフラン・テュラム、父リリアンの古巣ユベントスへ完全移籍！4年契約を締結,https://news.yahoo.co.jp/articles/259b25134982f2065c3d68a56874e7ccf16de3e5,7/11(木) 6:30
usoccer,超WORLDサッカー！,途中出場ワトキンスの劇的弾でイングランドがオランダに逆転勝利！2大会連続の決勝へ駒を進める【ユーロ2024】,https://news.yahoo.co.jp/articles/c05dc841e7b7b5a6425e4d30071951a2de93b918,7/11(木) 6:05
usoccer,超WORLDサッカー！,ボーンマス、ブレイズから元プレミア最年少得点者のFWジェビソンを獲得,https://news.yahoo.co.jp/articles/faac424dccac84a32724562f1f8b8166bcd1d52c,7/11(木) 0:55
usoccer,超WORLDサッカー！,コウチーニョが14年ぶりに古巣ヴァスコ・ダ・ガマに加入！「大好きなクラブに帰ってきた」,https://news.yahoo.co.jp/articles/136fdfc365bc483a8991d0b0e79d602df2d34bc6,7/11(木) 0:30
usoccer,超WORLDサッカー！,「世界一をみんなで取りたい」パリ五輪へ強い意気込みを語る浜野まいか、１年間の成長は「フィジカルとメンタル」,https://news.yahoo.co.jp/articles/f454e2d9e4c5e0f9fb68ef69ab3aaebe3f48a0ae,7/10(水) 23:58
usoccer,超WORLDサッカー！,「長い道のりだった」苦労して掴んだパリ五輪代表、北川ひかるは自身の特徴を出す「得点につながるプレーができれば」,https://news.yahoo.co.jp/articles/50da1672416492cf210ac59c7146e515b5f2c04e,7/10(水) 23:45
usoccer,超WORLDサッカー！,「課題が多かった」トレーニングマッチを終えた長野風花、始動からハードな日々が続く中で「チームとして積み上げていければ」と意気込む,https://news.yahoo.co.jp/articles/5a2bc5981c23c9896b39a25c282b341788d7fc2f,7/10(水) 23:30
usoccer,超WORLDサッカー！,ムバッペのレアル入団セレモニーが16日に開催…いよいよ憧れのクラブでのキャリアがスタート,https://news.yahoo.co.jp/articles/5ff08f35b408b65116bd55f0a9f8ac24bcd7fd2a,7/10(水) 22:55
usoccer,超WORLDサッカー！,「色々なチャレンジができた」トレーニングマッチを終えた熊谷紗希、本番へ向けて重要な試合に「良いシミュレーションになった」,https://news.yahoo.co.jp/articles/21cb67a81093f50a77daa7d57029a1fd9ecdf61e,7/10(水) 22:25
usoccer,超WORLDサッカー！,ミュラーがやはりドイツ代表に別れか…現地メディア報じる,https://news.yahoo.co.jp/articles/a5a33363e1a191c174c86c5be6f11faab850b0b5,7/10(水) 22:05
usoccer,超WORLDサッカー！,「J1勢が続々敗退した3回戦」川崎F3失点完敗、新潟6失点惨敗、横浜FMはPK戦勝利も苦境を象徴する“あっさり2失点”【天皇杯】,https://news.yahoo.co.jp/articles/1e07fed14092b3bd3de8f36b7f738ac49802cd08,7/10(水) 21:54
usoccer,超WORLDサッカー！,なでしこが30分×3本の変則的トレーニングマッチ、なでしこ1部ヴィアマテラス宮崎に5-0で勝利,https://news.yahoo.co.jp/articles/296853572cd253ab2dc423ce1916ed4fb668609c,7/10(水) 21:30
usoccer,超WORLDサッカー！,監督人事で慌ただしいアル・イテハド、ブラン氏が近く就任へ,https://news.yahoo.co.jp/articles/0d03170ab8274ef3a222bc16a9a3e6865a72e45c,7/10(水) 21:15
usoccer,超WORLDサッカー！,3回戦唯一のJ1勢対決は湘南に軍配！　鈴木章斗ゴラッソで東京V撃破しベスト16進出【天皇杯】,https://news.yahoo.co.jp/articles/255d8fc8078f1314e86beecf8437495cdb62ec90,7/10(水) 21:00
usoccer,超WORLDサッカー！,ナポリがローマ退団のイタリア代表DFスピナッツォーラをフリーで獲得！,https://news.yahoo.co.jp/articles/8c9342abd5e0bad60ef1b8bb81a052d2aae99230,7/10(水) 20:40
usoccer,超WORLDサッカー！,元フランス代表ムサ・シソコが古巣ワトフォードへ！　クレバリー監督とは元チームメイトの間柄,https://news.yahoo.co.jp/articles/f62dfcb6eccbd3a12fd927c9c501b9f6943d6183,7/10(水) 20:35
usoccer,超WORLDサッカー！,「今日はクラブでの僕の冒険が終わる思い出深き日」　ファン・デ・ベークがユナイテッドに別れ,https://news.yahoo.co.jp/articles/55560a7c3a6afb4e4fdfef9a09d0da98d9d48efe,7/10(水) 19:40
usoccer,超WORLDサッカー！,準決勝でついに初得点のメッシ、コパ・アメリカ2連覇で有終の美へ「最後の戦いだと意識」,https://news.yahoo.co.jp/articles/fbe9a11b1f342a48414dc70f90dff271b9dc823e,7/10(水) 19:27
usoccer,超WORLDサッカー！,菅原由勢がプレミア昇格組サウサンプトンへ！　メディカルチェック＆サインとロマーノ氏報道,https://news.yahoo.co.jp/articles/266b006312f17cf11be19cf5a86eb5132748d999,7/10(水) 18:50
usoccer,超WORLDサッカー！,アーセナルがウルブスGKベントリーにオファーも実らず…第3GK獲得の動き,https://news.yahoo.co.jp/articles/1c30fc96aca4fced1b9ec1f4424af572582f53c1,7/10(水) 18:20
usoccer,超WORLDサッカー！,ラツィオがタヴァレス獲得へ交渉中…アーセナルの要求額に及ばずも自信ありか,https://news.yahoo.co.jp/articles/5b07dfdbccf206ea84b73b3cc2bb7d541a6146ae,7/10(水) 18:13
usoccer,超WORLDサッカー！,「リバプールがダメというわけではなく…」セリエA最優秀GKディ・グレゴリオの代理人がユベントス入りの経緯明かす「約束を守った」,https://news.yahoo.co.jp/articles/0b8b98d9487b910a2985a044e862566b3c4e79b2,7/10(水) 17:58
usoccer,超WORLDサッカー！,鹿児島FW米澤令衣が右ヒザ手術で全治約3カ月…トレーニングマッチで負傷,https://news.yahoo.co.jp/articles/19904ab3954f74918b99cb415f17ccd05b818ac9,7/10(水) 17:25
usoccer,超WORLDサッカー！,物議醸すドイツ代表ファンからククレジャへのブーイング…スペイン代表指揮官は「スポーツやドイツを代表するものではない」,https://news.yahoo.co.jp/articles/af66680eaef782d8eb78bbc8d4300e915d13d374,7/10(水) 17:15
usoccer,超WORLDサッカー！,ファン・デ・ベークのジローナ移籍が決定的に…移籍金はひとまず50万ユーロ,https://news.yahoo.co.jp/articles/4287d6e40be606ff856667b6a7f2046a52a0468c,7/10(水) 17:05
usoccer,超WORLDサッカー！,経営破綻から蘇ったパレルモ…米国マンハッタンで新ユニお披露目会！ 黄金期を彩ったパストーレやアマウリら集結,https://news.yahoo.co.jp/articles/6d49ce8c4e70bef6d8bcafeff692674b3bf4bea3,7/10(水) 16:45
usoccer,超WORLDサッカー！,S・インザーギ監督にサウジから巨額オファーも、インテルとの契約延長望む指揮官は拒否,https://news.yahoo.co.jp/articles/4c443fe360985d31402e95ad290a3681f1f42d9e,7/10(水) 16:30
usoccer,超WORLDサッカー！,契約残り1年のキャルバート＝ルーウィン、エバートンの延長オファー拒否？ ユナイテッドが注視か,https://news.yahoo.co.jp/articles/f3f6119326276402fca6d9e337823e1263267419,7/10(水) 16:22
usoccer,超WORLDサッカー！,改革進むユナイテッド、テン・ハグ体制3年目も始動…ラッシュフォードらが初日から復帰,https://news.yahoo.co.jp/articles/4b1f590a6fcea74ce5115722e3caae7d98d49aba,7/10(水) 16:15
usoccer,超WORLDサッカー！,イヴァン・トニー獲得へウェストハムがオファー検討…契約残り1年となったブレントフォードの判断は？,https://news.yahoo.co.jp/articles/58f90138e46f049e7891db7fc5f84c734e69c727,7/10(水) 16:00
usoccer,超WORLDサッカー！,「悔しさがこみ上げてくる」　ヴィニシウスが準々決勝欠場で敗退の責任を一身に…「謝罪する」,https://news.yahoo.co.jp/articles/3fbf80e0082863e45b7afba84dc4c2f9a7ed5adc,7/10(水) 15:45
usoccer,超WORLDサッカー！,「ファンを熱狂させる『形』を作りたい」ミラン就任のフォンセカ監督、久々のセリエA復帰について「私はイタリアに情熱を持っている」,https://news.yahoo.co.jp/articles/523b8a40d83a05d97c2758d12736148f51d72438,7/10(水) 15:30
usoccer,超WORLDサッカー！,“ホイルンド・ツインズ”は来季ブンデスでプレー？　エミルに続きオスカーに移籍の可能性,https://news.yahoo.co.jp/articles/5dc75e4fd52c926a5fe4012e124b32dc7f9095c0,7/10(水) 15:15
usoccer,超WORLDサッカー！,フリック・バルサがいよいよ始動…米国プレシーズンツアーの帯同メンバーは現状未定,https://news.yahoo.co.jp/articles/00c28637b26a2a015296bf9f7d5ea3678d524b92,7/10(水) 15:10
usoccer,超WORLDサッカー！,ユナイテッドに多額のリセール条項も？　グリーンウッド巡ってマルセイユと合意か,https://news.yahoo.co.jp/articles/2d73f1672c8b14d6615b1a97a4aa18ba67a2fe81,7/10(水) 15:00
usoccer,超WORLDサッカー！,インテル退団のサンチェス、今度はマルセイユに復帰？  古巣ウディネーゼなども関心,https://news.yahoo.co.jp/articles/21b057c40c0f81fab04df72518a09a7d0ec9d979,7/10(水) 14:41
usoccer,超WORLDサッカー！,PSGがユーベの逸材CBハイセン獲得へ接近…個人間合意でクラブ間交渉本格化,https://news.yahoo.co.jp/articles/04a1c4bac257098b738207ec8c11875ee1170ff0,7/10(水) 14:35
usoccer,超WORLDサッカー！,JFL首位独走の高知、J3岐阜からDF和田侑樹が期限付き移籍で加入！「J3昇格へ全力で闘います」,https://news.yahoo.co.jp/articles/1a8b8a248d607db5fc264b74856d128641b6fffa,7/10(水) 14:20
usoccer,超WORLDサッカー！,イングランド戦控えるオランダに思わぬトラブル…鉄道トラブルで急遽空路で決戦の地ドルトムント入り,https://news.yahoo.co.jp/articles/4faa8185cda001d8a1bfea4e55be2e4ae5144d85,7/10(水) 14:18
usoccer,超WORLDサッカー！,スロベニア代表CBビヨルは隠れた人気銘柄？ インテルに続き6クラブから関心か,https://news.yahoo.co.jp/articles/523da24d0c8c158c47fd63fb91f9a019d67372a0,7/10(水) 14:05
usoccer,超WORLDサッカー！,レバンテ、ホセ・モラレスに続きイボーラが帰還…4度のEL制覇に昨季ECL制覇のベテランがプリメーラ復帰の切り札に,https://news.yahoo.co.jp/articles/8aa24bf4fc76f77fe748dec49141669c05bfc725,7/10(水) 13:52
usoccer,超WORLDサッカー！,スパーズ加入内定の逸材ヴシュコビッチがウェステルローへレンタル移籍,https://news.yahoo.co.jp/articles/0c98e1e7628a3fd10f5086076da9e55c2f97038b,7/10(水) 13:40
usoccer,超WORLDサッカー！,ボルドーが財政難で3部に強制降格…クラブは異議申し立てと共にリバプールのオーナーにクラブ売却へ,https://news.yahoo.co.jp/articles/d164cd994f2e285f2dad8b4e7e93ee8aa3b437ca,7/10(水) 13:35
usoccer,超WORLDサッカー！,“ブカヨ・サカをどう止める？” オランダ代表のファン・デ・フェンが先発起用を期待「スピードなら負けないよ」,https://news.yahoo.co.jp/articles/45345ab96d41205a45e609ebd38d6b61eff025fe,7/10(水) 13:30
usoccer,超WORLDサッカー！,去就注目のルニン、ひとまずレアルのプレシーズン参加へ…アーセナルが動向注視か,https://news.yahoo.co.jp/articles/d4afd4f44c17cea46b39509ad7f222c44bd229bd,7/10(水) 13:15
usoccer,超WORLDサッカー！,プレミア勢から関心も…人気銘柄トディボの希望はユベントス移籍か,https://news.yahoo.co.jp/articles/ff023edfeae9d4258df47baf5eccc4c48ce4c194,7/10(水) 13:10
usoccer,超WORLDサッカー！,移籍金総額61億円で決着！　ボンジョルノがナポリのメディカルチェックへ,https://news.yahoo.co.jp/articles/7f54d6ced1b1ce7dd3c4784092d6b446142b44ed,7/10(水) 12:45
usoccer,超WORLDサッカー！,CBが欲しいユナイテッド、テン・ハグ監督もよく知るデ・リフトとは口頭合意か？ バイエルンは82.8億円を要求へ,https://news.yahoo.co.jp/articles/807fa986b18263ea788f43e912a967a7c21f14ee,7/10(水) 12:40
usoccer,超WORLDサッカー！,ファンの愚行が大問題に発展？ ユーロ優勝まであと1つのスペイン代表に暗雲、試合後に警備員のタックル受けたモラタがまさかの負傷…指揮官「様子を見なければいけない」,https://news.yahoo.co.jp/articles/fa92f66acd76883b107c2a31546283bce49a3037,7/10(水) 12:20
usoccer,超WORLDサッカー！,新体制ドルトムントがリヨンFWシェルキと口頭合意、クラブ間交渉は継続中,https://news.yahoo.co.jp/articles/b45f80fe813a7ef4967638dcc1d3dcb83a2eb6df,7/10(水) 12:10
usoccer,超WORLDサッカー！,マルセイユ入り近づくグリーンウッド、一部で加入反対運動もデ・ゼルビ監督は寛容「選手たちは私の息子のようなもの」,https://news.yahoo.co.jp/articles/d66406e3879dc7ed5ece28bf1e87bfd4f59bbd5f,7/10(水) 12:08
usoccer,超WORLDサッカー！,中村敬斗にドルトムント行きの可能性、かつて香川真司を見出したミスリンタート氏も高く評価…移籍金は30億円前後か,https://news.yahoo.co.jp/articles/571840a85629db0d77ca8d4c5749936f4fef49f3,7/10(水) 11:55
usoccer,超WORLDサッカー！,ユナイテッドの103億円オファーもエバートンは拒否、イングランド代表DFブランスウェイトの獲得は難航,https://news.yahoo.co.jp/articles/f15b6d9ea8e3f58c75bb3306a427d8728b8d3d38,7/10(水) 11:25
usoccer,超WORLDサッカー！,ヴェローナが降格組フロジノーネからMFハルイを獲得！セリエAで4季目へ,https://news.yahoo.co.jp/articles/03820204ee04061a5e953b2e51ae5e4547c67cde,7/10(水) 11:17
usoccer,超WORLDサッカー！,盤石の試合運びでアルゼンチンが連覇に王手！メッシにも待望の初ゴールで士気は最高潮に【コパ・アメリカ2024】,https://news.yahoo.co.jp/articles/87bba5cc66f0a573c890d1e24e4d96cab93de703,7/10(水) 11:05
usoccer,超WORLDサッカー！,菅原由勢はプレミア昇格のサウサンプトン移籍へ…複数年契約、近日中に正式発表へ,https://news.yahoo.co.jp/articles/c8f0144d693322baf75570985a87d5ea5599ec2f,7/10(水) 10:48
usoccer,超WORLDサッカー！,横浜FC、桐蔭横浜大学MF遠藤貴成の2025シーズン加入内定を発表！「1日でも早く三ツ沢のピッチに」,https://news.yahoo.co.jp/articles/40ead6c9ace16a65869fa4cc0c335f541ae78c76,7/10(水) 10:30
usoccer,超WORLDサッカー！,先制アシストも決勝逃したムバッペ、悔しさあらわ「欧州王者になる、ユーロで良いプレーをしたいという野心があったけど…」,https://news.yahoo.co.jp/articles/d3bc474088f331a1ca35069b2dac1d5469bcba0b,7/10(水) 10:28
usoccer,超WORLDサッカー！,指揮官も絶賛のザルツブルクMF川村拓夢がトレーニングで左ヒザを負傷…接触のない負傷で長期離脱の可能性も,https://news.yahoo.co.jp/articles/6bb8e23a67b66524b7d164c6c2f7a17b09a00f41,7/10(水) 10:17
usoccer,超WORLDサッカー！,磐田が栃木に武者修行していたGK中島佳太郎の復帰を発表…今季加入も開幕前に育成型期限付き移籍「全力を注いで戦います」,https://news.yahoo.co.jp/articles/9a026638e2dbe1f9defd3960a242f9910421f376,7/10(水) 10:10
usoccer,超WORLDサッカー！,谷口彰悟がキャンプメンバー外…アル・ラーヤンをすでに離れ、ベルギー行き準備か,https://news.yahoo.co.jp/articles/478cf7e6c8a855c9036fb70d5b6a375b0534d050,7/10(水) 10:02
usoccer,超WORLDサッカー！,「決勝進出は特別」ユーロ準決勝で見事なゴラッソ、母国をファイナルに導いた新星ヤマルは「純粋な高揚感があった」,https://news.yahoo.co.jp/articles/2a28b0d8c25ea3231a28e13b2de39e394f67ad7a,7/10(水) 9:55
usoccer,超WORLDサッカー！,磐田がイスラエル人DFハッサン・ヒロを獲得！188cmのCBとして昨季リーグ戦25試合に出場,https://news.yahoo.co.jp/articles/834de1e38763dde0c3dcdc6f62e48e1f3d19827b,7/10(水) 9:30
usoccer,超WORLDサッカー！,「以前のように効率的なら…」ユーロ準決勝敗退のフランス…デシャン監督はチームの将来性強調「若い選手が多くいる」,https://news.yahoo.co.jp/articles/8125c82de769860a90f54f849d25111f59d3ca3b,7/10(水) 9:05
usoccer,超WORLDサッカー！,「この選手たちを指導出来て誇り」3大会ぶりユーロ決勝進出のスペイン、指揮官はゴラッソの16歳ヤマル絶賛「偉大な選手になる予感がある」,https://news.yahoo.co.jp/articles/435e005c48a02c9d9813590772805a8da08b7cd4,7/10(水) 8:35
usoccer,超WORLDサッカー！,ベティスがDFディエゴ・ジョレンテを獲得、昨季はレンタル先のローマで主力としてプレー,https://news.yahoo.co.jp/articles/524395fb108c7f6b4b497e0af9bcfcd79e25d119,7/10(水) 8:00
usoccer,超WORLDサッカー！,インテルがジェノア守護神マルティネスを獲得、ゾマーの後継者に,https://news.yahoo.co.jp/articles/ee74b2b411e9f28bd5cfda54b0d06bd2929fb925,7/10(水) 7:30
usoccer,超WORLDサッカー！,アトレティコがU-21スペイン代表FWマルティンとの契約を2029年まで延長、昨季は2部で15G,https://news.yahoo.co.jp/articles/62b9078056e000324395d4297a98fdd39490a7ea,7/10(水) 7:00
usoccer,超WORLDサッカー！,エトー息子エティエンヌがラージョのリザーブチームに加入,https://news.yahoo.co.jp/articles/2f37c43c459d5785ab7c02d18c28c30e1fc9eb3c,7/10(水) 6:30
usoccer,超WORLDサッカー！,ヤマルのユーロ最年少ゴラッソ&ダニ・オルモの3戦連発弾、フランスに逆転勝利のスペインが3大会ぶり決勝進出【ユーロ2024】,https://news.yahoo.co.jp/articles/7e80c7189e02957af4c8590e754f72acfcf1451b,7/10(水) 5:55
usoccer,超WORLDサッカー！,コウチーニョが14年ぶりに古巣ヴァスコ・ダ・ガマに加入！「大好きなクラブに帰ってきた」,https://news.yahoo.co.jp/articles/1ddc046882d578636de9528a8cae0112bd00b764,7/10(水) 0:30
usoccer,超WORLDサッカー！,レアルが狙う18歳DFヨロをユナイテッドが急襲!? 破格の87.2億円オファー提示でリールが受け入れか…レアルは61億円での獲得を望む,https://news.yahoo.co.jp/articles/2d053a0657514acc8c0c81a3b580356d44cf04c1,7/9(火) 23:40
usoccer,超WORLDサッカー！,昇格組レスターがアタランタのDFオコリを完全移籍で獲得、アカデミー育ちでセリエA 51試合に出場,https://news.yahoo.co.jp/articles/e2f66f05b01350de59067989e320fad0e6b9ac99,7/9(火) 23:25
usoccer,超WORLDサッカー！,「ワールドクラスのGK」パルマのSDが鈴木彩艶にベタ惚れ、「並外れたレベル」と高く評価し獲得を熱望…数日中にもまとめるか,https://news.yahoo.co.jp/articles/00d29fbe04ac3c4172785babf5f8e0f8a6c93a76,7/9(火) 23:15
usoccer,超WORLDサッカー！,町田FW平河悠が加入と同時にモデル起用！ ブリストル・シティが新アウェイユニフォーム発表…ホームユニフォーム姿も注目,https://news.yahoo.co.jp/articles/a185025c35f7cbfbb4064d161e554ac686b2e046,7/9(火) 22:50
usoccer,超WORLDサッカー！,鎌田大地がラツィオを去った理由はやはり代理人？ ロティート会長が更新料の要求を明かす「250万ユーロを求めてきた」,https://news.yahoo.co.jp/articles/2a47cd247338a92cbfb9675e156837e43438c32d,7/9(火) 22:30
