media_en,media_jp,title_articles,link_articles,date_original
theworldw,theWORLD（ザ・ワールドWeb）,ケインは実は負傷していた？　議論呼ぶ交代「背中が痛くて、試合を続けることができなかった」,https://news.yahoo.co.jp/articles/84362ca1cc339ffd5102f09b46a938f6bb40ade4,5/9(木) 13:40
theworldw,theWORLD（ザ・ワールドWeb）,スペインで輝きを取り戻した才能はどこへいく……　注目集めるグリーンウッドの新天地候補となる5つのクラブ,https://news.yahoo.co.jp/articles/fc01dc29da7e3803c45fe365f2a7929f99632146,5/9(木) 13:01
theworldw,theWORLD（ザ・ワールドWeb）,「クロップ期」のリヴァプールはビジネス面も優秀だった　支出純額3億4600万ポンドはBIG6でもっとも少ない、改めて注目される健全経営ぶり,https://news.yahoo.co.jp/articles/23671d81fee826cff3b5e28b2db3520304d77dfd,5/9(木) 12:31
theworldw,theWORLD（ザ・ワールドWeb）,「非常に奇妙で疑わしい」　主審自身も謝罪したという微妙な判定にバイエルンは憤慨,https://news.yahoo.co.jp/articles/fc9c7b1092ae260b369b7d9a9e0de27893f7192b,5/9(木) 12:07
theworldw,theWORLD（ザ・ワールドWeb）,エージェント・リオ・ファーディナンド？　マンUレジェンドがCL準決勝でトゥヘルを指揮官就任に誘ったと話題,https://news.yahoo.co.jp/articles/55f8ee3582e2f33418b4d7af2f1f4b052becb0ca,5/9(木) 11:32
theworldw,theWORLD（ザ・ワールドWeb）,最も成功率の高いPKキッカーは誰だ？　サッカー史上最高のPKキッカー9人,https://news.yahoo.co.jp/articles/2620879a6f0116d6c0bf96bbad3014ae74c21a29,5/9(木) 8:01
theworldw,theWORLD（ザ・ワールドWeb）,プレミアリーグ残留争いに影響は？　N・フォレスト、4点減点の処分の取り消しを求める訴え却下が確定,https://news.yahoo.co.jp/articles/25445d9bb965d39f18a63cfa0c03191c14b8af34,5/9(木) 7:30
theworldw,theWORLD（ザ・ワールドWeb）,鎌田大地の激変ぶりにイタリアでも驚きの声　一瞬でラツィオの“主役”に「サッカーは本当に奇妙なスポーツだ」,https://news.yahoo.co.jp/articles/5677a6d2f08038c3125edcf0d4194be0c1d11f3e,5/8(水) 23:30
theworldw,theWORLD（ザ・ワールドWeb）,ティンバーよりもホワイト&冨安健洋が上か　アーセナルの最終ラインで起こる熾烈な争い「現在は冨安が絶好調だ」,https://news.yahoo.co.jp/articles/e2831cb52d1532109704a6d5ec385fdc6a552b6c,5/8(水) 23:10
theworldw,theWORLD（ザ・ワールドWeb）,ナポリはすでにオシムヘンの後釜を見定めた？　ジェノアのストライカー獲得が最有力か,https://news.yahoo.co.jp/articles/0005374518f15fe31fb88d6bff6a40b05b995636,5/8(水) 23:00
theworldw,theWORLD（ザ・ワールドWeb）,直近6試合で3ゴール1アシスト　マンチェスター・シティのサッカーに適応したグヴァルディオル,https://news.yahoo.co.jp/articles/b93bda65472cc740349c3f6e3accba68d69ed8c0,5/8(水) 22:30
theworldw,theWORLD（ザ・ワールドWeb）,4連敗の新生トッテナムは正しい道を進んでいるのか　批判も集まる中、主将ソンが胸中を明かす　「忘れてはならないのは……」,https://news.yahoo.co.jp/articles/74f0508a3bd6fdab9abe0b69c52ebf45e4690ed0,5/8(水) 22:00
theworldw,theWORLD（ザ・ワールドWeb）,新生・リヴァプールで遠藤航の序列はどうなる？　もっと高く評価されるべき貢献度「多くの人が間違っていることを証明してきた」,https://news.yahoo.co.jp/articles/2ca4cba80e3a9f2ade0a0051a93109879ccf8900,5/8(水) 21:40
theworldw,theWORLD（ザ・ワールドWeb）,ニューカッスル&バイエルンが興味　アーセナルがジンチェンコの価格を設定か,https://news.yahoo.co.jp/articles/3f11661ac34c1ff7bcb6a82e70a74b16899151e9,5/8(水) 21:02
theworldw,theWORLD（ザ・ワールドWeb）,昨季は2部で勝ち点101を稼いで昇格したが…… 青年指揮官コンパニ率いるバーンリーがプレミア19位に沈む試練,https://news.yahoo.co.jp/articles/79a9b39ef4f8c937a0520295915311b0b1f976ea,5/8(水) 19:40
theworldw,theWORLD（ザ・ワールドWeb）,レンタル先での出場時間はわずか “58分”　悩める生え抜きストライカーはチェルシー退団が既定路線か,https://news.yahoo.co.jp/articles/bad5394bf66898b623872123db6e4df6721e5e30,5/8(水) 19:00
theworldw,theWORLD（ザ・ワールドWeb）,無敗を継続しながら進化を続けるレヴァークーゼン　ローマとのEL準決勝2ndレグで注目されるシャビ・アロンソの采配,https://news.yahoo.co.jp/articles/8974e301e4145aee693eaf2028525e0a7c4b76ec,5/8(水) 18:30
theworldw,theWORLD（ザ・ワールドWeb）,サリバ&マガリャンイスはファーディナンド&ビディッチを思わせるCBコンビ？　プレミアの歴史に名を刻むコンビへ,https://news.yahoo.co.jp/articles/31456da18aafd529fa0b05eb0ccd5bda0e056620,5/8(水) 18:01
theworldw,theWORLD（ザ・ワールドWeb）,44試合で”44ゴール”とバイエルンでも大暴れ　指揮官トゥヘルがケインに驚いた意外なこととは,https://news.yahoo.co.jp/articles/1f7b9aac42662867bf24cbe751a8f222aad23afe,5/8(水) 17:30
theworldw,theWORLD（ザ・ワールドWeb）,フリー契約で左利きCBの獲得は大きい　またも「着実補強」のニューカッスル新戦力はすでに合意済みか,https://news.yahoo.co.jp/articles/589b766e83bcdf0bee30852c65952adaf856e9c3,5/8(水) 16:31
theworldw,theWORLD（ザ・ワールドWeb）,アントニーが敗戦後に示した3本指の意味は？　「明らかに監督のやっていることに同意していない」,https://news.yahoo.co.jp/articles/637804311e678dd1122e74e36155d3fba959c3e1,5/8(水) 15:30
theworldw,theWORLD（ザ・ワールドWeb）,「堅実」を絵に描いたような男がここまで穴になるとは……　悲しきカゼミロの凋落「彼はMLSかサウジに行くべきだとわかっている」,https://news.yahoo.co.jp/articles/c4a7e0013a633e27531e662c37bd8cbabaefa8a3,5/8(水) 12:30
theworldw,theWORLD（ザ・ワールドWeb）,バイエルンのCL決勝進出は確定？　ドイツメディアが注目するトゥヘルの不敗神話,https://news.yahoo.co.jp/articles/59750a693bf320b3c8cbea91f422bc6f20d935bf,5/8(水) 12:00
theworldw,theWORLD（ザ・ワールドWeb）,フンメルス、サンチョ、フュルクルク……　ドルトムントの「望まれなかった男」たちが起こしたサプライズ,https://news.yahoo.co.jp/articles/693c7fa1628b4d8db14bc2a5a55a48451eb677ab,5/8(水) 11:31
theworldw,theWORLD（ザ・ワールドWeb）,ミランが新たな9番獲得に狙いを定めた？　実現すればクラブ史上最高額の移籍金か,https://news.yahoo.co.jp/articles/038de50ca340163fb593227df3280a6d94ed7f90,5/8(水) 7:02
theworldw,theWORLD（ザ・ワールドWeb）,ドルトムントがPSG撃破！　レジェンドDFフンメルスのヘディング弾で11年ぶりCL決勝進出,https://news.yahoo.co.jp/articles/352745c1e7a470635efe871f0bdb1f01664a2fcb,5/8(水) 6:20
theworldw,theWORLD（ザ・ワールドWeb）,C・ロナウド&メッシを超える“ライバル関係”はもう2度と実現しないかもしれない　2人が同じ時代に揃った奇跡,https://news.yahoo.co.jp/articles/954f712915f3806c16eb368dbd61f2c53a8daf49,5/8(水) 0:10
theworldw,theWORLD（ザ・ワールドWeb）,PSGからローマに来ても存在感薄く　たった“260分”しかプレイ出来ていないR・サンチェスの現状,https://news.yahoo.co.jp/articles/79bc0d8a572bb5f134d3c34333a63177bab46a0b,5/7(火) 23:10
theworldw,theWORLD（ザ・ワールドWeb）,「ピッチに立てば、そこは僕の遊び場」　レアル・マドリード移籍予定のエンドリックが現在の心境を語る,https://news.yahoo.co.jp/articles/56d78581b48eee66a9dd950d63da973579cda76f,5/7(火) 23:00
theworldw,theWORLD（ザ・ワールドWeb）,今季のレアルの強さは中盤にあり　新世代とベテランが絶妙に融合する圧巻の “熟練度”　「質・量ともに間違いなくサッカー界最高」,https://news.yahoo.co.jp/articles/ad575eac5bd048060fbef81cbd5a5f9decded83c,5/7(火) 22:40
theworldw,theWORLD（ザ・ワールドWeb）,「私も大きな転換期を迎えた一員」　ファン・ダイクは残るのか？　去就騒がれるなかクラブ愛を語る,https://news.yahoo.co.jp/articles/0891821c61cceea133355a1db731995f3ed26212,5/7(火) 21:40
theworldw,theWORLD（ザ・ワールドWeb）,76-77シーズン以下の“史上最弱のユナイテッド”となるのか　81失点、13敗、そして待ち受ける初の8位以下フィニッシュ,https://news.yahoo.co.jp/articles/f3c69430670fa52b282934675e7b784e2dd3dd3a,5/7(火) 20:31
theworldw,theWORLD（ザ・ワールドWeb）,もはやMLSでメッシ＆スアレスが遊んでいる　昨年14位のチームを1位にする元バルサ組の脅威「レオがいればすべてが簡単」,https://news.yahoo.co.jp/articles/24eac479ea02e39a6bfab49b105b76f23d7d2ba5,5/7(火) 18:31
theworldw,theWORLD（ザ・ワールドWeb）,本来はアルゼンチン代表に入れる実力者　トルコの名門で《70戦53ゴール20アシスト》とイカルディの得点力爆発中,https://news.yahoo.co.jp/articles/b0c4a7cf49091981f9687e764a2aaaa3665ce55e,5/7(火) 18:00
theworldw,theWORLD（ザ・ワールドWeb）,「一つ間違えばプレミアで優勝できない」　プレミア史上初の4連覇にむけ、ペップ・シティが超えなければならない3試合,https://news.yahoo.co.jp/articles/a35b64bd444228b6d8d2f73c6295f7e5545e595c,5/7(火) 17:30
theworldw,theWORLD（ザ・ワールドWeb）,アーセナルが獲得すべきは今季プレミア20Gのストライカー　「彼は私にティエリ・アンリをとても思い出させる」,https://news.yahoo.co.jp/articles/24f3a225535caee661f2155fa56c3a6450fd9a59,5/7(火) 16:33
theworldw,theWORLD（ザ・ワールドWeb）,デイビッド・モイーズ、デクラン・ライス売却後のウェストハムの苦労を語る　「国内最高の中盤の選手が守れば……」,https://news.yahoo.co.jp/articles/9ff412c55de1c8cd156f5a4524f71e65afe2cdac,5/6(月) 22:30
theworldw,theWORLD（ザ・ワールドWeb）,ギリギリの残留から一気に《勝ち点34増》でトップ4入りの大快進撃　激変したシュツットガルトはバイエルンをも捉えた,https://news.yahoo.co.jp/articles/5b4d25429cde98f98b5aac61f9e64c211bfb7bcc,5/6(月) 21:10
theworldw,theWORLD（ザ・ワールドWeb）,偉大なキャプテンとなったラウタロ・マルティネス　インテルでの契約延長を望む「僕はバンディエラだと言われている」,https://news.yahoo.co.jp/articles/026126c9077bb4e478559a421c778a437b0ede82,5/6(月) 21:02
theworldw,theWORLD（ザ・ワールドWeb）,マンUは今季ここまで7ゴールのラッシュフォードを手放すべきなのか　「移籍案は誰にとっても良い動き」,https://news.yahoo.co.jp/articles/114622a00a9b1fd11d95f7eb655888448320d5bd,5/6(月) 20:02
theworldw,theWORLD（ザ・ワールドWeb）,トルコ代表でも完璧なレジスタへ　EURO2024へ期待はチャルハノールに「世界最高クラスのMFの一人になった」,https://news.yahoo.co.jp/articles/1b8768c0fd267e5b12f35d165dad1b9de5723798,5/6(月) 19:40
theworldw,theWORLD（ザ・ワールドWeb）,大勝のチェルシー、ここ3カ月に絞れば「4位」の成績だった　ようやくチームとなった彼らの来季は期待できるか,https://news.yahoo.co.jp/articles/6ad7e6b73773e8ae60a7c6b066a8ebc71bc85087,5/6(月) 19:02
theworldw,theWORLD（ザ・ワールドWeb）,ウーデゴー、今シーズン1億500万ポンドで加入したチームメイトを大絶賛！,https://news.yahoo.co.jp/articles/bf66404a7a692da0cbf435fe97578601bcb95477,5/6(月) 18:31
theworldw,theWORLD（ザ・ワールドWeb）,サンチョとマンUの“すれ違い”はどうなる？　復帰に関して面談を実施、去就はテン・ハーグ次第か,https://news.yahoo.co.jp/articles/42a9f88688a481aa334d9fe95d5f1beacef9cfdf,5/6(月) 18:02
theworldw,theWORLD（ザ・ワールドWeb）,マンC、バイエルンと戦ってもCL最高の《パス成功率95.3%》　レアルにもクロース以上のゲームメイカーはいない,https://news.yahoo.co.jp/articles/eb311eb7f4eea722bb03a56a63d398c3ed73b2b5,5/6(月) 17:40
theworldw,theWORLD（ザ・ワールドWeb）,スパーズ指揮官ポステコグルーに“プランB”はあるか　攻撃的な哲学に疑問も「スパーズは時にオープンすぎる」,https://news.yahoo.co.jp/articles/12a05f1fc2172d7cbafff5d0aa20a85a14769d73,5/6(月) 17:01
theworldw,theWORLD（ザ・ワールドWeb）,ポグバが俳優に転職!?　ドーピング違反で試合に出られない期間にフランス映画に出演,https://news.yahoo.co.jp/articles/ebbdaf18090a3d9b4abeaaa60920ea3ec7446f22,5/6(月) 16:32
theworldw,theWORLD（ザ・ワールドWeb）,インザーギはインテルをどう進化させるか　リーグ連覇、CL制覇、CWCへの道「より大きなスカッドが必要だ」,https://news.yahoo.co.jp/articles/685b64c3669f1607a7751a21127d6c646122eb8b,5/6(月) 16:00
theworldw,theWORLD（ザ・ワールドWeb）,僅か10分でも充実のヴィッセル神戸でのキャリア　マタが振り返るトルコ、日本での日々「日本文化から多くのことを学んだ」,https://news.yahoo.co.jp/articles/7c0361c201cdb04b5e13986c210c00fa27ea31f3,5/6(月) 15:40
theworldw,theWORLD（ザ・ワールドWeb）,“大阪ダービー”で魅せたのはやはりエース！　G大阪が「7番」宇佐美のバースデー弾で5年ぶりのダービー勝利を飾る,https://news.yahoo.co.jp/articles/7307c4f244eebbcf53823e26e60cb4ff99ff3371,5/6(月) 15:20
theworldw,theWORLD（ザ・ワールドWeb）,17歳ながらベルギー1部で8ゴールと躍動する新時代の怪物FW候補　ルカクとも比較される大型ストライカーがいる,https://news.yahoo.co.jp/articles/8f6ea0a85b375f730fcbc5bcfe8de2cda67e6228,5/6(月) 14:30
theworldw,theWORLD（ザ・ワールドWeb）,物議醸すハフェルツの“ダイブ”　相手GKは納得いかない「彼に打たせて、それがゴールするのを見ていれば良かったのかい？」,https://news.yahoo.co.jp/articles/fbdda6fe3d2b3f08282f7dfef016e4735ebe4083,5/6(月) 14:00
theworldw,theWORLD（ザ・ワールドWeb）,キーンはどうしてもハーランドが気に入らない!?　舌戦再開「甘やかされたガキ」,https://news.yahoo.co.jp/articles/18fb10e0bdfe6f2f4c2f4bcdf5e880211ffde584,5/6(月) 12:01
theworldw,theWORLD（ザ・ワールドWeb）,ルカ・モドリッチ、レアル・マドリードのレジェンドを超えて歴史的大記録を達成,https://news.yahoo.co.jp/articles/48e54eb321db37f3befeff23493b887b16835a3e,5/6(月) 7:30
theworldw,theWORLD（ザ・ワールドWeb）,冨安の左SBこそベストの選択か　ボーンマス戦のパフォーマンスに称賛の声「ベストパフォーマンスを発揮した」,https://news.yahoo.co.jp/articles/0bcc3f6e3a98f0e558298a3fa12009739e6482d9,5/5(日) 23:30
theworldw,theWORLD（ザ・ワールドWeb）,《イングランド2部のミルナー》と呼ぶべき鉄人　525試合を重ねてきた大ベテランのキャリア「ミルナーだと言い聞かせている」,https://news.yahoo.co.jp/articles/42a471a1c92350da6216e8f809405afaf0bd8ad8,5/5(日) 23:10
theworldw,theWORLD（ザ・ワールドWeb）,ついにシーズン100失点に到達……　今季のシェフィールド・Uはプレミア史上最弱のチームか,https://news.yahoo.co.jp/articles/941bd3d522f589bfff4e0cfebd336df102595e05,5/5(日) 22:50
theworldw,theWORLD（ザ・ワールドWeb）,サンチョにユナイテッド復帰の選択肢はなし？　ドルトムントは再レンタルの交渉へ,https://news.yahoo.co.jp/articles/8a438aad80303f26910e68bf36e3e0ba4b036926,5/5(日) 22:10
theworldw,theWORLD（ザ・ワールドWeb）,カイル・ウォーカーがマンCからメガマネーでサウジアラビアへ移籍か　元チームメイトにアドバイスを求めたと報道,https://news.yahoo.co.jp/articles/95b49e3372f628876364c73aeddef469d9a9d943,5/5(日) 21:31
theworldw,theWORLD（ザ・ワールドWeb）,K・フィリップスは “謎の負傷”で今季終了か　再起を図るレンタル移籍も実らず、EURO行きは絶望的に,https://news.yahoo.co.jp/articles/dd3a9f94b0ce22c98962962b5daae1b5ae4f057f,5/5(日) 21:02
theworldw,theWORLD（ザ・ワールドWeb）,エデルソンは過小評価されている？　チームのリズムとテンポを司る守護神は “影の司令塔”　「シティの成功に対する彼の貢献は評価されるべき」,https://news.yahoo.co.jp/articles/c9242b4dfda3600d774c3def232f7b007d86e4da,5/5(日) 20:31
theworldw,theWORLD（ザ・ワールドWeb）,マンUがマイケル・オリーセの獲得を狙う？　今季16試合の出場で7ゴール4アシストを記録,https://news.yahoo.co.jp/articles/18f79c672f7ae8f53248724219f09a9c0d1bea6d,5/5(日) 20:00
theworldw,theWORLD（ザ・ワールドWeb）,世界的シンガー、エド・シーランも喜びを爆発　地元のクラブ&スポンサーを務めるイプスウィッチが22年ぶりにプレミア昇格,https://news.yahoo.co.jp/articles/d5abf59c5eff195b405001561cf8f533f736050e,5/5(日) 19:31
theworldw,theWORLD（ザ・ワールドWeb）,ジェズスはウイングの役割も受け入れてはどうか？　サカのバックアッパー問題も解決,https://news.yahoo.co.jp/articles/2e7b94e42b1ab5e93c640403e8e68423aa3311e5,5/5(日) 19:00
theworldw,theWORLD（ザ・ワールドWeb）,仏代表は本当にEURO2024“優勝候補筆頭”なのか　ウパメカノ、コロ・ムアニの出番減、負傷問題など気になる部分も,https://news.yahoo.co.jp/articles/23cca3986cf6d7312f7b6dc6a2e010c70950d0dd,5/5(日) 18:30
theworldw,theWORLD（ザ・ワールドWeb）,リシャルリソンら3名の売却を容認？　トッテナムはさらなるチーム力アップのため今夏も積極補強か,https://news.yahoo.co.jp/articles/1747c4dbd602a2329d3122b5e5a458f237bf9da9,5/5(日) 17:40
theworldw,theWORLD（ザ・ワールドWeb）,シーズン15ゴール関与を達成したデクラン・ライスは「6番」か「8番」か　恐るべきはその適応性,https://news.yahoo.co.jp/articles/c39428c4dda1619a5f953cc9e57128c5592b38d0,5/5(日) 17:00
theworldw,theWORLD（ザ・ワールドWeb）,オランダ代表引退のベテランFWが《エールディヴィジ得点ランク1位タイ》　EURO2024へ気になるセンターフォワード選び,https://news.yahoo.co.jp/articles/e68374419497970de8e56eb7a2497d8b644460aa,5/5(日) 16:40
theworldw,theWORLD（ザ・ワールドWeb）,ヘタフェはグリーンウッド再レンタルに向け交渉開始か　一方のマンUは売却を望む,https://news.yahoo.co.jp/articles/3683e484a199765ca9aac00aa0e02968624cb5a6,5/5(日) 16:00
theworldw,theWORLD（ザ・ワールドWeb）,ドイツ代表はEUROで優勝狙える？　バイエルン、ドルトムント、レヴァークーゼンで躍動する代表選手たち,https://news.yahoo.co.jp/articles/beb09798ec069c3774142cdbfbcf052286198f7a,5/5(日) 15:30
theworldw,theWORLD（ザ・ワールドWeb）,チェルシーがオシムヘン獲得に動き出す　移籍実現にはルカクらを含む “148億円”のオファーが必要か,https://news.yahoo.co.jp/articles/9a03606775fc19ff5b6cef42589db0e6736e23f4,5/5(日) 15:01
theworldw,theWORLD（ザ・ワールドWeb）,ムエタイで2度王者に輝いた父を持つリコ・ルイス　格闘技を通じて学んだこと「それは人生にも通じるものだと思う」,https://news.yahoo.co.jp/articles/697dd0dd74e16a39be06e5bf2272fb4d37dc0049,5/5(日) 14:10
theworldw,theWORLD（ザ・ワールドWeb）,"プレミア4戦連発、7ゴールのハーランド　キーン氏の ""リーグ2発言”を結果でねじ伏せる　「あの男のことはそれほど気にしていない」",https://news.yahoo.co.jp/articles/9fbfd573d7a02500c520b3608120fd33bc595056,5/5(日) 13:01
theworldw,theWORLD（ザ・ワールドWeb）,レヴァンドフスキの後釜にヌニェスを据える？　ウルグアイ代表FWにバルセロナが興味,https://news.yahoo.co.jp/articles/31376c59bb0f86e83c182851d23a517709b8e49b,5/5(日) 12:30
theworldw,theWORLD（ザ・ワールドWeb）,勝てば宿敵のリーグ優勝に貢献してしまう……　マンUとトッテナムが陥るジレンマ,https://news.yahoo.co.jp/articles/afb10adecb1275a2ce6e1d580bf26f572e4c359f,5/5(日) 12:03
theworldw,theWORLD（ザ・ワールドWeb）,スペイン、ドイツ、イングランド….…　3つのリーグでMVP級の選手を生んだイングランド代表はEURO2024で結果を残せるか,https://news.yahoo.co.jp/articles/a52b7ad1d6fb9888bc2917feb79d8152fb290d2d,5/5(日) 11:31
theworldw,theWORLD（ザ・ワールドWeb）,南野拓実が1G1Aの大活躍！　今季9点目はGKノーチャンスの芸術弾,https://news.yahoo.co.jp/articles/262662be2e2bf408cfa362edca77980bf8e8e257,5/5(日) 11:21
theworldw,theWORLD（ザ・ワールドWeb）,4戦負けなしと好調なクリスタル・パレス　指揮官グラスナーはユナイテッド攻略に自信　「どのチームにも弱点はある」,https://news.yahoo.co.jp/articles/c2d8ea211e46287c217ed10242022ad201eeac19,5/5(日) 11:01
theworldw,theWORLD（ザ・ワールドWeb）,チェルシーは17歳の新星「メッシーニョ」の獲得を狙う　4700万ポンドを用意か,https://news.yahoo.co.jp/articles/00a7a4440fdb15689101ee4a47eb2829e7eabe56,5/4(土) 23:50
theworldw,theWORLD（ザ・ワールドWeb）,「最大の損失は三笘薫。彼は1対1においてリーグトップ5に入る選手」　得点力ガタ落ちのブライトンが欠いている“創造性”,https://news.yahoo.co.jp/articles/3da5e631e0e492990c359ac762a96e30a6c463ba,5/4(土) 23:30
theworldw,theWORLD（ザ・ワールドWeb）,サネ、ドク、クワラツヘリアをも超える “103回”　5大リーグトップのドリブル成功数を誇るクドゥスのポテンシャル,https://news.yahoo.co.jp/articles/b2418e196bdacced17f4bff4a526f020d1d1a534,5/4(土) 23:10
theworldw,theWORLD（ザ・ワールドWeb）,レアル・マドリードのナチョはアメリカへ向かう　今夏でクラブを退団の報道,https://news.yahoo.co.jp/articles/a7d4943ee6275fb0e86a5910a4b5344ff7f14d2b,5/4(土) 23:00
theworldw,theWORLD（ザ・ワールドWeb）,なぜフォーデンはFWA年間最優秀選手賞を受賞できた？　投票した英記者が絶賛する “一貫した卓越性”,https://news.yahoo.co.jp/articles/251fe7fc1ea2152c0662f03cdb1a5001ac84c0a3,5/4(土) 22:20
theworldw,theWORLD（ザ・ワールドWeb）,マンCとアーセナルが狙いを定めるギマランイス　バルサレジェンド、リバウドが新天地を予想　「もしニューカッスルを離れるなら……」,https://news.yahoo.co.jp/articles/5cb185af07caae62a1745361dadb567e69270cb7,5/4(土) 21:40
theworldw,theWORLD（ザ・ワールドWeb）,プレイ時間はわずか “229分”　今冬に加入するも出番がもらえないドラグシンの現状に代理人は不満　「ベンチに座るだけで残るつもりはない」,https://news.yahoo.co.jp/articles/758da31d6b9443cc12fc0bf1dd71e26010828317,5/4(土) 21:02
theworldw,theWORLD（ザ・ワールドWeb）,プレミア最終盤でマンCを止めるチームはあるか　カギ握るはトッテナム、ウェストハムか「僕たちにもやるべきことがある」,https://news.yahoo.co.jp/articles/59f9f2fcba4b1bd6ba67717be1a08147d1e1204f,5/4(土) 20:40
theworldw,theWORLD（ザ・ワールドWeb）,アメリカでは無名だったルーニー、名前も聴き取ってもらえなかった「ウィンとかウォンとか言われて、結局イアンと名乗った」,https://news.yahoo.co.jp/articles/988e3209624e53d636e4c9acc0525fa8a5c57373,5/4(土) 20:01
theworldw,theWORLD（ザ・ワールドWeb）,マンCにとって“ギュンドアン流出”の影響は大きすぎた　ラ・リーガで5ゴール7アシストと躍動するチャンスメイカーの実力,https://news.yahoo.co.jp/articles/2b3f868146c730f64f91d7cbe26a8b118c0421c4,5/4(土) 19:40
theworldw,theWORLD（ザ・ワールドWeb）,マンC新加入ヌネスが語る “常勝軍団”を作り上げた指揮官ペップのメンタリティ　「レアル・マドリードと対戦しようが、6部リーグのチームとカップ戦を戦おうが関係ない」,https://news.yahoo.co.jp/articles/c3a497e14d0ee57486388bc24efa887b571b55da,5/4(土) 19:02
theworldw,theWORLD（ザ・ワールドWeb）,リヨンやナポリに続いてマンUも興味？　今夏レンタル移籍が噂されるバルサの神童ロッキに多くのクラブが注目,https://news.yahoo.co.jp/articles/a87b7161af95c3e8094b37e02aa1a720ae9c0c07,5/4(土) 18:31
theworldw,theWORLD（ザ・ワールドWeb）,ラングニックにも断られて難航するバイエルンの新監督探し　次はプレミアクラブの現役指揮官をリストアップか,https://news.yahoo.co.jp/articles/a54817c57f3b8999b8495e14480712e7b06ea410,5/4(土) 18:00
