media_en,media_jp,title_articles,link_articles,date_original
theworldw,theWORLD（ザ・ワールドWeb）,「最高のシーズン」、「役割がなかった」　今季躍進のシュツットガルトで明暗分かれた伊藤と原口,https://news.yahoo.co.jp/articles/07eacd1aede6ae8c71f3bbfed73992779cac92aa,5/27(月) 18:03
theworldw,theWORLD（ザ・ワールドWeb）,今季36発のケインが欧州得点王に!　キャリア初のゴールデンシューを獲得,https://news.yahoo.co.jp/articles/7ef8618a1f9d2bcca40ee4624504c3813be24e86,5/27(月) 17:30
theworldw,theWORLD（ザ・ワールドWeb）,CB補強が必須のユナイテッド　今夏の獲得候補はブランスウェイトを始めとする6人か,https://news.yahoo.co.jp/articles/f4a1b7dc8f077c053c0456bf6f20372a63b9520e,5/27(月) 17:01
theworldw,theWORLD（ザ・ワールドWeb）,アルゼンチン代表MFエンソ・フェルナンデス　今夏のパリ五輪出場を熱望「監督に行きたいと伝えた」,https://news.yahoo.co.jp/articles/14331f309792a803b019f1168bbea82664eef0c6,5/27(月) 17:01
theworldw,theWORLD（ザ・ワールドWeb）,シーズン最終盤5月の出場時間はわずか “10分”　今季苦しんだグリーリッシュの復活をペップは期待　「彼は戻ってくるだろう」,https://news.yahoo.co.jp/articles/a0fcd12d9be9437ab4e8f2cb48c71825bd8313e5,5/27(月) 16:01
theworldw,theWORLD（ザ・ワールドWeb）,37歳ボヌッチが今季限りでの引退を発表　ユヴェントスでは8度のセリエA制覇、イタリア代表でもEURO2020制覇に貢献,https://news.yahoo.co.jp/articles/3afd4c4ed119a60e2e7d35601aab26ed8d992d2c,5/27(月) 15:20
theworldw,theWORLD（ザ・ワールドWeb）,昇格逃したリーズはプレミアクラブの草刈り場に!?　今季20G9Aのエースほかアタッカー陣に光る才能アリ,https://news.yahoo.co.jp/articles/92be5ab39d75f7f7c3e465f5bba84ee9a7ee7aac,5/27(月) 15:01
theworldw,theWORLD（ザ・ワールドWeb）,ミニ・メッシとも期待された若きFWが“イングランド3部”で踏み出した一歩　8ゴール13アシストの成績に称賛の声,https://news.yahoo.co.jp/articles/362da995f3d20969a6bea7669f962b99f79e9735,5/27(月) 13:11
theworldw,theWORLD（ザ・ワールドWeb）,クロップに続いてペップ時代も終わるのか　「来シーズン末にシティを去る予定」英紙報じる,https://news.yahoo.co.jp/articles/689884de06e15fd342e76e584120deeec8626f51,5/27(月) 11:31
theworldw,theWORLD（ザ・ワールドWeb）,イングランド・プレミア昇格の最後の枠はサウサンプトン　プレイオフ決勝でリーズに勝利,https://news.yahoo.co.jp/articles/1ac1f47561aedc3b43cae37fc4461dd1200dc1a3,5/27(月) 11:24
theworldw,theWORLD（ザ・ワールドWeb）,ラムズデール、なぜか「ハグリッドコスプレ」で登場!?　サウサンプトン×リーズで客席に,https://news.yahoo.co.jp/articles/357e6c7d4b23db316c5635ca6a9d31ba9300823b,5/27(月) 11:02
theworldw,theWORLD（ザ・ワールドWeb）,『つまらないシーズン』とバッサリ　出番求めてレアルからPSGへ渡ったアセンシオの1年目に厳しい評価,https://news.yahoo.co.jp/articles/b3dfb111eb94ee4868871b303cefe46dd2775310,5/27(月) 7:10
theworldw,theWORLD（ザ・ワールドWeb）,レアルで全シーズン《90%超え》のパス成功率　精密機械クロースが繋いだ34000本のパス,https://news.yahoo.co.jp/articles/9e58f6562bf44f1f5ae15340f1af189b8ce129f7,5/27(月) 6:40
theworldw,theWORLD（ザ・ワールドWeb）,アズーリ期待の若手FWが“イングランド2部”で過ごした1年　プレミア昇格に燃えるニョントの戦い,https://news.yahoo.co.jp/articles/a426606ee520bc27d83921b246ded08768dac6b3,5/26(日) 20:00
theworldw,theWORLD（ザ・ワールドWeb）,スコールズ氏がユナイテッドのアンカーを大絶賛！　「まるで全盛期のガットゥーゾみたいだ」,https://news.yahoo.co.jp/articles/22011cf72d9aca442667ff3008b5e599759b6ad1,5/26(日) 19:30
theworldw,theWORLD（ザ・ワールドWeb）,シャビ2世とも言われた男の復活劇　セリエAで92.1%のパス成功率を残すゲームメイカーへの注目,https://news.yahoo.co.jp/articles/0179a6e0e85298c7bac8d8bbb515f79805822adc,5/26(日) 17:01
theworldw,theWORLD（ザ・ワールドWeb）,ブンデスリーガは過小評価されていた？　レヴァークーゼン、ドルトムントの躍進に見る真の競争力「本当に難しいリーグ」,https://news.yahoo.co.jp/articles/31b06b9e0b23ef8f323c26cb545555be793af9e2,5/26(日) 16:40
theworldw,theWORLD（ザ・ワールドWeb）,"FA杯決勝で魅せたB・フェルナンデスの超絶アシスト　 ""美しすぎる”ノールックパスに称賛の嵐　「世界を見渡してもあのパスを出せる選手はそういない」",https://news.yahoo.co.jp/articles/a60de309de058ad78a56dc09d3f2109c8d460599,5/26(日) 13:01
theworldw,theWORLD（ザ・ワールドWeb）,横浜F・マリノス指揮官キューウェル監督はACL決勝の判定に不満爆発　「レフェリーによってかなり崩されたのは事実」,https://news.yahoo.co.jp/articles/469bf4ae9846b309642a3a599b70a18fb460b23d,5/26(日) 12:30
theworldw,theWORLD（ザ・ワールドWeb）,開幕まであと少しのEURO2024　 “19%”の優勝確率を叩き出したのはタレント豊富なスター軍団,https://news.yahoo.co.jp/articles/f1105d3473c8f23cee0cc7c82c6a834533f7efde,5/26(日) 12:03
theworldw,theWORLD（ザ・ワールドWeb）,「今週ずっと酔っ払っているようなプレイをしている」　「酒の飲み過ぎだ」　FA杯連覇を逃したシティのパフォーマンスをファンは非難,https://news.yahoo.co.jp/articles/367c1c34e145d68cec2acf6cd45c981c711f033a,5/26(日) 11:41
theworldw,theWORLD（ザ・ワールドWeb）,残留か移籍か　日本代表MF鎌田大地に恩師率いるクリスタル・パレスが熱視線,https://news.yahoo.co.jp/articles/3c5f47dd884768db3e84e81aee2134a355d8053b,5/26(日) 11:31
theworldw,theWORLD（ザ・ワールドWeb）,アジアの頂点にあと一歩届かなかった横浜F・マリノス　守護神ポープの退場もあり、ACL決勝でアル・アインに敗戦,https://news.yahoo.co.jp/articles/0b0725f20d95f2d681177198ebf09a28a9c83848,5/26(日) 3:21
theworldw,theWORLD（ザ・ワールドWeb）,マンチェスター・ユナイテッドが昨季のリベンジ成功でFAカップ制覇　ガルナチョ&メイヌーの19歳コンビが躍動,https://news.yahoo.co.jp/articles/93a99c68bb59721b3d7d742acb070a39a1102373,5/26(日) 0:58
theworldw,theWORLD（ザ・ワールドWeb）,エンケティア、スミス・ロウらアーセナルの“ヘイルエンド組”はチームを去るのか　英メディアも厳しい評価,https://news.yahoo.co.jp/articles/5676d336eb75438171f920cac9e67e50a75e9a26,5/25(土) 23:40
theworldw,theWORLD（ザ・ワールドWeb）,17歳でもうインスタのフォロワー数が“1000万人超え”の驚異　止まらぬエンドリック・フィーバー「前例のない動き」,https://news.yahoo.co.jp/articles/1e17d2cfcb1eb99ce38e29de90cad662b0286c5f,5/25(土) 23:30
theworldw,theWORLD（ザ・ワールドWeb）,プレイ時間 “481分”に留まった主将をチェルシーは変えるべき？　クラブOBが次期キャプテンに強く推薦するのは……,https://news.yahoo.co.jp/articles/27080d05422bc7c9a5e8793434199fc15e5db358,5/25(土) 23:01
theworldw,theWORLD（ザ・ワールドWeb）,ウーデゴーとハフェルツはプライベートも仲良し　今季最後のゴール生み出した2人は一緒にバカンスへ「充電中！」,https://news.yahoo.co.jp/articles/8df96a108139537c847c4e19efb39d0621339672,5/25(土) 22:50
theworldw,theWORLD（ザ・ワールドWeb）,「アルテタが最も信頼するディフェンダーの1人であることは明らか」　 “進化を続ける”アーセナルでの日本代表DF冨安健洋の評価とは,https://news.yahoo.co.jp/articles/256e47d0654e88fe68c640f4630cca83247e0dec,5/25(土) 22:30
theworldw,theWORLD（ザ・ワールドWeb）,フリックの “補佐的役割”を期待？　バルセロナはフリック・バイエルンの司令塔だったチアゴの獲得を検討か,https://news.yahoo.co.jp/articles/21dab70145d3f1cf92fc5879efe99e4039a552ef,5/25(土) 22:00
theworldw,theWORLD（ザ・ワールドWeb）,「彼のような人がもっと必要だと学校で教えるべき」　“カフーカス”とまで呼ばれるレアルの職人L・バスケスへの絶賛,https://news.yahoo.co.jp/articles/3da7ac04dc92ff345104704674cd824436e12e65,5/25(土) 21:40
theworldw,theWORLD（ザ・ワールドWeb）,注目はいつでも《爆速の前田大然VS超攻撃型SBタヴェルニエ》　セルティックVSレンジャーズの頂上決戦のポイントに,https://news.yahoo.co.jp/articles/9fb6c1a10d0ce3626f103d26d4be1a55ecfc1a55,5/25(土) 21:20
theworldw,theWORLD（ザ・ワールドWeb）,今夏ドルトムントと契約満了となるフンメルス　去就が注目されるベテランCBにACミラン&ユヴェントスが興味か,https://news.yahoo.co.jp/articles/b1d77e9e07d175e83bb9558951953481193e5085,5/25(土) 20:31
theworldw,theWORLD（ザ・ワールドWeb）,「ボールを持っていないときは苦しむ覚悟がある」　FA杯決勝での打倒マンCへダロトが語る“覚悟”,https://news.yahoo.co.jp/articles/aaed34bc8094ffd0d6464c6f32e4d07ad7760702,5/25(土) 20:01
theworldw,theWORLD（ザ・ワールドWeb）,レヴァンドフスキにまだ年齢的な衰えはきていないか　36歳で迎える来季への自信「あと2年はトップレベルでプレイできる」,https://news.yahoo.co.jp/articles/5fcf177c7f5d81265c26842f2f2f3eddc199ed28,5/25(土) 19:40
theworldw,theWORLD（ザ・ワールドWeb）,"ストライカーよりも優先順位は上？　クラブレジェンドが考えるアーセナルが今夏 ""補強しなければらない”ポイントとは",https://news.yahoo.co.jp/articles/69e45e3617cc191d465e80c08c2436af6bb156e4,5/25(土) 18:20
theworldw,theWORLD（ザ・ワールドWeb）,ソシエダの“クラブレコード補強”は失敗に終わるのか　39戦4ゴールのみのサディクにクラブを離れる案が浮上中,https://news.yahoo.co.jp/articles/02c01ece3d2291836cd5e0f50e8d68b537808147,5/25(土) 17:30
theworldw,theWORLD（ザ・ワールドWeb）,FA杯連覇に挑むマンC　指揮官ペップが警戒するのは “プレミア最高のチャンスメイカー”　「彼の創造性は私がこれまで見た中で最高のもの」,https://news.yahoo.co.jp/articles/944418f5d676f5e7a982b0dd477cbabccb0e5e1b,5/25(土) 16:10
theworldw,theWORLD（ザ・ワールドWeb）,ルーニー氏、監督として再起のチャンス到来!?　イングランド2部のプリマスがオファーを準備,https://news.yahoo.co.jp/articles/15a2ab9a2f4eac184fb4966538c93f331cb89f39,5/25(土) 15:01
theworldw,theWORLD（ザ・ワールドWeb）,今季リーグ戦 “74失点”のウェストハム　守備の改善を図るロペテギはウルブズのキルマン獲得に興味か,https://news.yahoo.co.jp/articles/948f16a574879a3c96ddb0da81bca45ac62a7f80,5/25(土) 14:30
theworldw,theWORLD（ザ・ワールドWeb）,今夏ステップアップが濃厚なオリーセ　人気銘柄はユナイテッドとチェルシーによる争奪戦か,https://news.yahoo.co.jp/articles/ea00f5052b746c4698a3846c19fc9b95b07218e6,5/25(土) 14:00
theworldw,theWORLD（ザ・ワールドWeb）,アンチェロッティ監督が引退表明のクロースを唯一無二と称賛　「代わりを務めるのは不可能」,https://news.yahoo.co.jp/articles/2c395e23c5a4d334b6d3a688ff194f9011002054,5/25(土) 13:31
theworldw,theWORLD（ザ・ワールドWeb）,今夏のマンC移籍も破談の可能性大？　賭博違反が認められればパケタには数年に及ぶ出場停止処分も,https://news.yahoo.co.jp/articles/68f4b40ea14bfef4bc87525d87df9cf9cdbb18b0,5/25(土) 13:01
theworldw,theWORLD（ザ・ワールドWeb）,バルセロナ退任のシャビ監督がサポーターにメッセージ　「私の人生とも言えるクラブの幸運を祈っている」,https://news.yahoo.co.jp/articles/c4848b3b2b83ebd5361cc5e973f197753c5c5ccd,5/25(土) 12:30
theworldw,theWORLD（ザ・ワールドWeb）,FA杯で勝とうが負けようがテン・ハーグはクビに　後任はトゥヘルかマッケンナか,https://news.yahoo.co.jp/articles/5adeb650f2b676ae9a639cc74e1d03edea21cb59,5/25(土) 12:03
theworldw,theWORLD（ザ・ワールドWeb）,韓国代表からの関心に感謝　今季限りでバルセロナ退任のシャビ監督は1月に韓国代表からオファーを受けていた?,https://news.yahoo.co.jp/articles/0f87f9fe0e21d36680e01ed2fdfc2f9f5ed51893,5/25(土) 11:00
theworldw,theWORLD（ザ・ワールドWeb）,シャビ監督退任発表のバルセロナ　後任はフリック氏が濃厚に,https://news.yahoo.co.jp/articles/15951b2fd59a45a61cc9c7f66587d1d103ed78c1,5/25(土) 10:50
theworldw,theWORLD（ザ・ワールドWeb）,菅原由勢は今季もまた《エールディヴィジ最優秀右サイドバック候補》に「今やAZの右サイドでお馴染みの顔となった」,https://news.yahoo.co.jp/articles/ee22f576e4ff7ad252fffb3dd4e047fb0f642be8,5/25(土) 8:30
theworldw,theWORLD（ザ・ワールドWeb）,ベテランになったカゼミロを超えるセレソンの番人へ　EL制したアタランタの潰し屋・エデルソンのフィジカルがとんでもない,https://news.yahoo.co.jp/articles/a6d64cd127d2c81ff36fd6a4ad4084ca0efa021a,5/25(土) 8:10
theworldw,theWORLD（ザ・ワールドWeb）,チェルシーの《1億ポンド超え中盤コンビ》をどう評価する　ポチェッティーノが納得していなかったパワー&サイズ不足,https://news.yahoo.co.jp/articles/b9787dee0e74b2cfffa16c032dace7bcb536d703,5/24(金) 22:40
theworldw,theWORLD（ザ・ワールドWeb）,40歳の今季も“3100分間”のフル稼働　リーグ・アン最少失点のニースを統率する番人が1年の契約延長,https://news.yahoo.co.jp/articles/3435b3b64432855dce0436d5b84aace843cafe87,5/24(金) 22:11
theworldw,theWORLD（ザ・ワールドWeb）,EURO選外のラッシュフォード、代表オフィシャルウェアの広告ビジュアルに登場　モデルを務めるも選出ならず,https://news.yahoo.co.jp/articles/534c69076c5371f3df1bb637d48cec9e1269b4fe,5/24(金) 14:00
theworldw,theWORLD（ザ・ワールドWeb）,コンパニ招聘をめぐってバイエルンとバーンリーが交渉　違約金の希望額に2倍以上の差,https://news.yahoo.co.jp/articles/edc518015d29242fdc422f144905aebb08320d8e,5/24(金) 12:00
theworldw,theWORLD（ザ・ワールドWeb）,注目の日本人対決は田中碧に軍配！　デュッセルドルフが昇降格POで浅野拓磨先発のボーフムに3発快勝,https://news.yahoo.co.jp/articles/b5b41e31d70e15550bbf0868ecdbc79300f80d11,5/24(金) 11:11
theworldw,theWORLD（ザ・ワールドWeb）,ウェストハムがロペテギ氏招聘を正式発表！　かつてレアル・マドリードやスペイン代表を率いた名将,https://news.yahoo.co.jp/articles/a00249fd76425e5fc908afc2c8b00af83a7183ce,5/24(金) 11:00
theworldw,theWORLD（ザ・ワールドWeb）,ジルーがEURO2024後の代表引退を明らかに！　「若い選手にポジションを譲る時」,https://news.yahoo.co.jp/articles/1b2015a5b0de62a2e3a39dfd70be8141773a16e6,5/24(金) 10:50
theworldw,theWORLD（ザ・ワールドWeb）,レッドとイエローだけじゃない!?　コパ・アメリカ2024で「ピンクカード」の導入が決定,https://news.yahoo.co.jp/articles/dc53c90361fe1a1cf19967ed86561a122a50387d,5/24(金) 10:30
theworldw,theWORLD（ザ・ワールドWeb）,「チームは降格を避けるためにプレイしていた」　セリエA中位だったところからEL制覇へアタランタを変えたガスペリーニの手腕,https://news.yahoo.co.jp/articles/e5f5044338f11462e466e7bfe0af69ac523f4a65,5/24(金) 10:01
theworldw,theWORLD（ザ・ワールドWeb）,チームは8位、その中でチャンスメイク数は《2年連続プレミアNo.1》　今季もフル稼働した鉄人ブルーノの凄さ,https://news.yahoo.co.jp/articles/7efc4e7e5d0c96c2da4f5a1a6b2a583ca52965e3,5/24(金) 7:50
theworldw,theWORLD（ザ・ワールドWeb）,三笘薫の衝撃ドリブルゴールも選出　ガルナチョのバイシクル、カイセドのロングシュート、今季《プレミアNo.1ゴール》はどれだ,https://news.yahoo.co.jp/articles/9a91bbb680746809984ceceb282fdf22e518394c,5/24(金) 7:31
theworldw,theWORLD（ザ・ワールドWeb）,今夏、移籍の目玉になるか!?　チェルシー、トッテナム、PSGが狙うリヨンの若き天才ドリブラー,https://news.yahoo.co.jp/articles/1cd4947a7005a45e26f9e5f47d8ecda199b5ad9d,5/24(金) 7:00
theworldw,theWORLD（ザ・ワールドWeb）,監督解任したばかりのチェルシー、後任に2年連続昇格を達成した急成長の若手監督を狙う,https://news.yahoo.co.jp/articles/97ba8beac1a097c5fc4439dc93f491ac98c6e65a,5/24(金) 6:31
theworldw,theWORLD（ザ・ワールドWeb）,伊東純也は仏で『日本のムバッペ』となった　リーグ10位のドリブル成功数、3位のチャンスメイク数が示す圧巻の攻撃性,https://news.yahoo.co.jp/articles/b83c2aaa89144d5b85e22c944bfb2276aeb0bb3b,5/23(木) 23:30
theworldw,theWORLD（ザ・ワールドWeb）,ドイツ代表はGK大国ではなくなった？　EUROへ38歳のノイアーがリスクになるとの不安も「集中力を維持できなくなった」,https://news.yahoo.co.jp/articles/23e382627aa3f0568459fcf8e143e7561da6a382,5/23(木) 22:40
theworldw,theWORLD（ザ・ワールドWeb）,チェルシーの新監督はマレスカか　今季レスターを2部優勝に導いた名将に熱視線,https://news.yahoo.co.jp/articles/172e5528297b65679ba7c4de7f68dcf63ffe4ae1,5/23(木) 22:20
theworldw,theWORLD（ザ・ワールドWeb）,相馬勇紀はカーザ・ピア退団へ　今季5ゴール3アシストも完全移籍はならず,https://news.yahoo.co.jp/articles/0996f0a06a5d74f4fdbfdce3bc431a32e62b5aae,5/23(木) 22:10
theworldw,theWORLD（ザ・ワールドWeb）,今週末にも発表!?　バイエルンがコンパニ招聘で口頭合意か,https://news.yahoo.co.jp/articles/14aa7f26cd04df82aaab549f2874785a6b0c22ff,5/23(木) 22:00
theworldw,theWORLD（ザ・ワールドWeb）,6クラブ目にして掴んだ栄光　プレミア、ブンデスを経てアタランタで大きく飛躍したルックマンのキャリア,https://news.yahoo.co.jp/articles/1a5f35a9eaebded092ce7ec1ca3f486ca0a7ca68,5/23(木) 21:50
theworldw,theWORLD（ザ・ワールドWeb）,レアルはトルコの至宝・ギュレルをどう活かす　クロース引退で浮上するギュレルの出番増加プラン,https://news.yahoo.co.jp/articles/e79b8d2125bd2ed2c65fc6ffb99bc876f5e9dd58,5/23(木) 21:10
theworldw,theWORLD（ザ・ワールドWeb）,ケイン、ムバッペ、ハーランドにも負けないラウタロの実力　セリエAで示した万能性「羨ましいことは何もない」,https://news.yahoo.co.jp/articles/484529cf3a4c22d2ebfb27ff7747c652d80d00ac,5/23(木) 20:40
theworldw,theWORLD（ザ・ワールドWeb）,「マンチェスター・シティにはプレミアリーグで優勝できるチームが2つある」　セスクが言及したプレミア王者とアーセナルの “選手層の差”,https://news.yahoo.co.jp/articles/7f6d00823537fe3b681beef0003f558c4eef31b9,5/23(木) 19:40
theworldw,theWORLD（ザ・ワールドWeb）,ブンデスリーガ年間MVPヴィルツに独代表OBバラックが太鼓判　「間違いなくレアルでも通用する」,https://news.yahoo.co.jp/articles/2e75509740b3f997643b5c8281b4e3a6e41cae3d,5/23(木) 19:01
theworldw,theWORLD（ザ・ワールドWeb）,イングランド代表落選がサンチョの去就に与える影響　ドルトムントにとっては吉報か,https://news.yahoo.co.jp/articles/8a37b7356ef966152f7f679e1431dca74326e771,5/23(木) 18:02
theworldw,theWORLD（ザ・ワールドWeb）,守備の要グエイの退団に備えるクリスタル・パレス　代役候補は元バルセロナのディフェンダーか,https://news.yahoo.co.jp/articles/40d6f3bdbdeda05bf1a95549272dec09f3c4fee2,5/23(木) 17:00
theworldw,theWORLD（ザ・ワールドWeb）,“52戦目”にして今季初黒星を喫したレヴァークーゼン　無敗記録が途絶えるもX・アロンソはチームを称賛　「誇りに思うべきだ」,https://news.yahoo.co.jp/articles/519dad1e03df004bda31481607786eb1d043f9c3,5/23(木) 16:00
theworldw,theWORLD（ザ・ワールドWeb）,指揮官も驚きの成長ぶり？　EL決勝で衝撃のハットトリックを決めたルックマンを大絶賛　「彼がここまで成長できるとは誰も想像できなかった」,https://news.yahoo.co.jp/articles/959b973a6510ab9a9d4b22a8d523fa320f6e2e91,5/23(木) 14:40
theworldw,theWORLD（ザ・ワールドWeb）,中盤の底から13ゴール3アシスト　インテル不動のレジスタになったチャルハノールが過ごした“最高のシーズン”,https://news.yahoo.co.jp/articles/606def2eac2d60e12a9feb4ee94ec75d7aeca8cf,5/23(木) 11:00
theworldw,theWORLD（ザ・ワールドWeb）,クアンサー、ブラッドリー、バイチェティッチ　リヴァプールはクロップが起用してきた若手をどう活かす,https://news.yahoo.co.jp/articles/4473adbae0b59567a7028b5f7d14576bd3cd7f75,5/23(木) 10:30
theworldw,theWORLD（ザ・ワールドWeb）,近年、失敗続きのガットゥーゾ氏、監督として再起を図る次の舞台はサウジか!?,https://news.yahoo.co.jp/articles/d653eafd5967ed74397ff1550bbde8a8c12a8dfe,5/23(木) 7:01
theworldw,theWORLD（ザ・ワールドWeb）,冨安健洋の不安材料は怪我のみ　来季も“左SB1番手”であるべき圧倒的実力「主力になる準備ができていることを証明した」,https://news.yahoo.co.jp/articles/6d3ade38b4c6891e36e068bc2d08682db09d6984,5/23(木) 0:10
theworldw,theWORLD（ザ・ワールドWeb）,今季の遠藤航はマクアリスター、ファン・ダイクたちと“最高評価”　批判黙らせた後半戦「重要な歯車であることが証明」,https://news.yahoo.co.jp/articles/95408f59355cff70247a00f9143d12068423700c,5/22(水) 23:50
theworldw,theWORLD（ザ・ワールドWeb）,“国内10連覇”ザルツブルクの支配が途切れた　二桁得点者ゼロで渋く頂点に立ったシュトゥルム・グラーツの戦い,https://news.yahoo.co.jp/articles/9d6c7bcd9d2329dfada1d38fa07665f6ebabd38d,5/22(水) 23:30
theworldw,theWORLD（ザ・ワールドWeb）,タイトル獲得には “30ゴール”を決められる9番が必要？　アーセナルが今夏狙うべきストライカーとは　「彼はフィジカルがとても強くて、純然たる9番」,https://news.yahoo.co.jp/articles/459fc95c263ee42d8efb73e4dbffe9fa2775f6c9,5/22(水) 23:00
theworldw,theWORLD（ザ・ワールドWeb）,今季手がつけられなかったフォーデンをイングランドのレジェンドも大絶賛　「最初のゴールは何だったんだ！」「彼には信じられないほどの天賦の才がある」,https://news.yahoo.co.jp/articles/32141e46fafe6e6611f1f47bb4772d91cbbb3ead,5/22(水) 22:00
theworldw,theWORLD（ザ・ワールドWeb）,“22試合で3ゴール“から “13試合で13ゴール”へ　リーグ終盤のマテタはハーランドをも上回る得点ペース,https://news.yahoo.co.jp/articles/4de5ba3fb4b7e102b1b35b3e92be30c9a47bed23,5/22(水) 21:00
theworldw,theWORLD（ザ・ワールドWeb）,注目点として急浮上したトニ・クロースの後継者　レアルはリヴァプールMFマクアリスター獲得に興味か,https://news.yahoo.co.jp/articles/7eeb9226118c82067f4d2ec1e691f8e97ac4a51d,5/22(水) 19:30
theworldw,theWORLD（ザ・ワールドWeb）,コンパニは最初から候補者リストの上位に？　独紙もリスクと評するバイエルンの新監督探し,https://news.yahoo.co.jp/articles/9b1bd9eb1bcd619d1d58ca068d19d8c502047524,5/22(水) 19:00
theworldw,theWORLD（ザ・ワールドWeb）,デンベレわずか一年でPSG退団の可能性　才能抜群でも素行不良の問題児,https://news.yahoo.co.jp/articles/9f03e6cbb97b0c74824870be845243ad3fb104d9,5/22(水) 18:03
theworldw,theWORLD（ザ・ワールドWeb）,今シーズン全公式戦で40得点以上をマークしているポルトガルのレジェンド、EURO2024で大暴れなるか!?,https://news.yahoo.co.jp/articles/8a8863d516e2fb0897274099542347eefb222337,5/22(水) 17:01
theworldw,theWORLD（ザ・ワールドWeb）,プレミア4連覇に欠かせなかった存在　シティの2ndGKオルテガの気になる去就　「ここに留まることに反対する理由はあまりない」,https://news.yahoo.co.jp/articles/96a2c328be26b67597b7afb1efd86445a597eb11,5/22(水) 16:40
theworldw,theWORLD（ザ・ワールドWeb）,GKエデルソンに今夏マンC退団の可能性が浮上　著名記者ファブリツィオ・ロマーノ氏「すでにサウジアラビアのプロリーグのクラブが興味を示しており……」,https://news.yahoo.co.jp/articles/49f0db141b07402d2f2de054b7e69616e8709ada,5/22(水) 15:00
