media_en,title_articles,link_articles,date_original
bepal,アルトラ「スペリオール5」の特徴は？軽量トレランシューズで足裏感覚を研ぎ澄ませ,https://news.yahoo.co.jp/articles/5d248e08828cae148bf0577010d30c8aa5180379,9/20(水) 8:01
bepal,さすが鉄製！老舗OIGENのホットサンドメーカーで作る料理が絶品すぎたので紹介したい,https://news.yahoo.co.jp/articles/471afd01caff286dfb155a1c46a8b5717bc26d10,9/19(火) 18:03
bepal,バックカントリー「オリソン」の使い心地は？今勢いのあるテントを体感レビュー！,https://news.yahoo.co.jp/articles/4fc244520500076cade99802f277f533d64de533,9/19(火) 8:02
bepal,メスティンでラーメンをおいしく作るには？キャンプで食べたいおすすめアレンジ5選,https://news.yahoo.co.jp/articles/15bfd3c6e50f34e05bbe216fa36739429be62da9,9/18(月) 18:04
bepal,ヘッドライトをランタンに変える魔法のギア！モンベル「クラッシャブルランタンシェード」とは,https://news.yahoo.co.jp/articles/dcc9f94e37689c2d2985367e594291aa6b60144c,9/18(月) 8:02
bepal,キャンプでおすすめのノコギリとナタは？老舗ブランド・シルキーの製品を愛用者が紹介,https://news.yahoo.co.jp/articles/6d94b05bae6b543a8f0acc0b7cdb5a0929cb795c,9/17(日) 20:01
bepal,コーナンのアルミスキレットは本当に使えるのか!? 実際に料理を作ってみた,https://news.yahoo.co.jp/articles/045ea2a954fb71a6727a35017d1cc4c4d666effd,9/17(日) 18:05
bepal,ソロキャンパー必見！多機能テーブル「A38grate」の便利な特徴4つ,https://news.yahoo.co.jp/articles/f0c808673a60ac1f669e320fada89528235bd2b7,9/17(日) 15:00
bepal,水中写真家が解説！佐賀の海は国内トップクラスの秘境だ,https://news.yahoo.co.jp/articles/fb1247545f6b1d55c653458c0137c43f69c1a324,9/17(日) 12:03
bepal,アメリカの「マッスルビーチ」とは？あの“レジェンド”も筋トレしていた筋肉の聖地だった,https://news.yahoo.co.jp/articles/e60dfabe011cd0aec51db7a3aec25d5e94963eae,9/17(日) 8:04
bepal,さばいどる かほなんのサバイバルチャレンジ2023スタート！「10日間無人ビーチ」生活,https://news.yahoo.co.jp/articles/cdc5b97561555bc777546a461b655e5e3ff4c673,9/16(土) 20:02
bepal,セリアの人気手ぬぐい10選を紹介！実際に購入したらユニークな柄が多すぎた,https://news.yahoo.co.jp/articles/cf1463dfcf32fcdac97e765ac5cd5080cc40a8ad,9/16(土) 18:04
bepal,六甲山登山で活用したい「トレイルステーション神戸」が新神戸駅に誕生！,https://news.yahoo.co.jp/articles/73f6fc1b05ed9f7eb49222613836cfff93e398a3,9/16(土) 15:00
bepal,タイ式BBQ「ムーガタ」って何!?焼き肉&しゃぶしゃぶが融合する謎の料理を食べてみた,https://news.yahoo.co.jp/articles/0d27fdfff2c5b97949a70bff73ab736353c775db,9/16(土) 12:06
bepal,ギシギシ音から解放！コット難民に「GIMMICKのコット」をおすすめしたい理由,https://news.yahoo.co.jp/articles/366876a9c6e3a1a3d606e11b3423f794b8f1b6db,9/16(土) 8:02
bepal,アウトドアでも普段も大活躍！「ナルゲン」ボトルを使ったらタフで洗浄も簡単,https://news.yahoo.co.jp/articles/d8c296c110464a9cfb7eb358a2a05a58e4ab6ed7,9/15(金) 18:05
bepal,アルファロメオのSUVならキャンプにもGOOD！ 「トナーレPHEV」は積載もよし,https://news.yahoo.co.jp/articles/c1f0ab0ec5043a179178bf231d1acae18a320462,9/15(金) 8:05
bepal,アイリスオーヤマの名品「RV BOX」って知ってる？キャンプで大活躍の“座れるコンテナ”なのだ,https://news.yahoo.co.jp/articles/f77650690c64b1a6a8cd477757ea868975477c55,9/14(木) 18:04
bepal,すでに品薄状態！コールマンの新色バックパックが派手可愛いのだ,https://news.yahoo.co.jp/articles/ee3533cab2f78e8bfa463c288d8d3092a11644a5,9/14(木) 17:01
bepal,ミステリーランチのあの人気バックパック「アーバンアサルト」が進化した！,https://news.yahoo.co.jp/articles/8f07e26e7c1e3ae4dd295d708ae89c10de0de096,9/14(木) 16:00
bepal,今年も発売するぞ！NANGA×アーバンリサーチのコラボダウン3種が登場,https://news.yahoo.co.jp/articles/98312cd3ee03728009e8974ee6730e5aeb7f6fad,9/14(木) 15:01
bepal,人気のバブアーを手に入れるチャンス！2023秋冬の予約会は9月24日まで,https://news.yahoo.co.jp/articles/687303be241901ff7554f92bcabe7ba5aca35072,9/14(木) 13:50
bepal,タイガー魔法瓶の100周年記念モデル「魔法のかまどごはん」は究極のアウトドアギアだった！,https://news.yahoo.co.jp/articles/6c4760068217209a48e11f0c497b14a37af683fc,9/14(木) 8:00
bepal,カスタムできるランタンスタンド！小物も置ける5050workshopの「2WAYSTAND」,https://news.yahoo.co.jp/articles/51f6db4e1ee454f9efbe2e13f6fd9b1e59c5d23d,9/13(水) 18:03
