media_en,title_articles,link_articles,date_original
abema,自然の恐ろしさが分かる光景… 海岸沿いを走る道路の崩落が現在も続き、崖がむき出しに　まさに地名の通りの「大崩海岸」が話題に,https://news.yahoo.co.jp/articles/034b230ffadf4208efd0ebd8728eca728663b3ad,9/4(月) 11:50
abema,一体、何が起きたんだ！？ ボールボーイがグラウンドを逃げまどう “魔物”がロッテ・ブロッソーを襲った！打球が三塁ベース付近で謎変化した衝撃の瞬間,https://news.yahoo.co.jp/articles/c3408d625b284207e094b4d2d9fc3b8b2b7e1448,9/4(月) 11:50
abema,超早指しで心臓バクバクのハプニング 持ち駒から「角」が突然消えた…解説者「そんなことあるんですか！？」／将棋・ABEMAトーナメント,https://news.yahoo.co.jp/articles/141a0689d8cc4483ce1c7da9647543f1a0001c36,9/4(月) 11:01
abema,吉田正尚の同僚が自由すぎる スライディング後になかなか立たない“のんびりプレー”,https://news.yahoo.co.jp/articles/34e4d7118b212f5cf8721faf0c6cc09926c52ce7,9/4(月) 11:00
abema,「彼は2度もこれをやってのけた」大谷翔平の“40本20盗塁” 複数シーズンでの達成はメジャー史上8人目 快挙に現地から反響続々,https://news.yahoo.co.jp/articles/bb3db5db99f3e091ea221c57067fd65d40bd2032,9/4(月) 10:58
abema,将棋・9月4日週の主な対局 9日、藤井聡太竜王・名人がJT杯連覇に向け今期初陣 菅井竜也八段と2回戦で激突,https://news.yahoo.co.jp/articles/bbd19adc02b1a603f62722e20b4a6f49ab3b6f1c,9/4(月) 10:26
abema,吉田正尚、極端シフトの合間を抜く技ありヒット ボール球でも跳ね返す広角打法,https://news.yahoo.co.jp/articles/46a911b8e378fd05c186a83f565ef6c332b189d7,9/4(月) 10:01
abema,「サイトウにはユウヤもいる」藤井聡太竜王・名人の兄弟子、齊藤裕也四段、A級棋士・斎藤慎太郎八段を撃破で“サイトウ対決”制す／将棋・ABEMAトーナメント,https://news.yahoo.co.jp/articles/12fc760bec061cfffaf128e5924bcb8ec266ff85,9/4(月) 10:01
abema,住宅で母子死亡 無理心中か 群馬・館林市,https://news.yahoo.co.jp/articles/569e2447197e589d5497206dc476a37b2eade0bc,9/4(月) 9:10
abema,ゼレンスキー氏 国防相の交代発表 事実上の更迭か,https://news.yahoo.co.jp/articles/a2d5e2ce45fd8d1742bdb921957c98c1af456320,9/4(月) 9:08
abema,これが日本の天才打者 吉田正尚、実績十分のベテラン投手から豪快アーチ ファンも「すげぇ」「早起きしてよかった」,https://news.yahoo.co.jp/articles/3a0825368bc769a284a62721abf5de03bc27b4e4,9/4(月) 9:01
abema,猫「どうして…僕のご飯食べてる」大好きなおやつを食べられた“驚愕した表情”に「目は口ほどに物を言う」と反響続々,https://news.yahoo.co.jp/articles/445af4f00cdfb23799ae0d662db5fafdce85658e,9/4(月) 8:41
abema,大谷翔平、2四球＆1盗塁でシーズン40本塁打＆20盗塁に到達！複数回達成は史上8人目の快挙 チームはアスレチックスに3連敗,https://news.yahoo.co.jp/articles/b39d5b9fdfa3eb958de70ae92c0e9c3d2b4f38d8,9/4(月) 8:17
abema,球場どよめく珍事！ ボールボーイのダイビングキャッチに「オラついてるw」「ナイスファイトw」ファン興奮,https://news.yahoo.co.jp/articles/c8fbf564160efbe5813b1d4723efdc033f483275,9/4(月) 8:09
abema,サングラスしていてよかったー 吉田正尚、強い日差しに負けない懸命キャッチに現地中継も注目,https://news.yahoo.co.jp/articles/0a021e0384d38da0eca32673d8a1b06e13471ff8,9/4(月) 8:00
abema,トラックと正面衝突 トレーラー運転手が重体 千葉・柏市,https://news.yahoo.co.jp/articles/b1eee2d222c32cd104ef6791b5ce26858a417e11,9/4(月) 8:00
abema,一体、どこまで飛ばすんだ！？ 技アリ内角打ちで“サブマリン殺し” 日本ハムの若きアーチスト・清宮幸太郎が美しすぎる弾丸ライナーを叩き込んだ瞬間,https://news.yahoo.co.jp/articles/b22bb7bf417eca52a9a97c83249f2e9d872593ee,9/4(月) 7:50
abema,大谷翔平、相手のスキを突く見事な盗塁！自身2年ぶりのシーズン20盗塁で史上8人目の複数回40‐20を達成,https://news.yahoo.co.jp/articles/1715dcf99f29250092f3afa114c6298039fb41dc,9/4(月) 7:41
abema,砂漠の祭典「バーニングマン」で豪雨 数千人が立ち往生 米・ネバタ州,https://news.yahoo.co.jp/articles/e3f8c4e9e683fe7626eda6890a0b111c4a93bc89,9/4(月) 7:30
abema,東武東上線 池袋〜小川町駅間で運転見合わせ,https://news.yahoo.co.jp/articles/5466699e8bd95e025320d9781050a4370a403381,9/4(月) 7:26
abema,「レンフローがレッズの逆転勝ちを完成させた！」大谷翔平の元同僚、移籍2戦目で“サヨナラ打” 殊勲の全力疾走に球場大熱狂,https://news.yahoo.co.jp/articles/c3edf690fedada3feb823c3e4be96f91b094c7ae,9/4(月) 7:26
abema,ロシアで「対日戦勝記念日」名称変更後初,https://news.yahoo.co.jp/articles/5e64110633210ae94636587fbcb8405608235e5a,9/4(月) 7:14
abema,麻生氏「明らかに政治の話」中国の水産物全面禁輸を批判,https://news.yahoo.co.jp/articles/e02f7fa13dd227212d410017c2dbee053aa36ad5,9/4(月) 7:10
abema,球場騒然！ボールが止まった… 芸術的すぎる「秘打」が炸裂　3塁線上ギリギリにピタリと止まる“超絶バントヒット”が決まった瞬間,https://news.yahoo.co.jp/articles/fa79ebfa14717d35604787b92f50e6c80ddfaf05,9/4(月) 7:10
abema,これは良トレードすぎる！なんでこんなに良い選手ばかり… 中日から移籍して大爆発 「めちゃくちゃスタメンで使いたい男」日本ハム・郡司裕也が猛打爆発中,https://news.yahoo.co.jp/articles/7602715fddf714531e8d608e7798c3880760b94a,9/4(月) 7:03
abema,え、入ったの？吉田正尚、13戦ぶり14号ホームランと思わず必死に全力疾走 ベンチでようやくニッコリ,https://news.yahoo.co.jp/articles/367ddb95052f3e54ad8ae6973b71b390d19e578b,9/4(月) 7:00
abema,球場が大熱狂！世界一の新記録達成　連日の猛暑で体調不良からの大復活 “30秒間で31発”のギネス世界記録を叩き出した西武「レオ」の“連続バク転”がスゴすぎる瞬間,https://news.yahoo.co.jp/articles/f49fb90b5849f2e6d9d4a8d68cf8a7d2d7304c04,9/4(月) 6:50
abema,大谷翔平、1試合2四球に敵地ファン我慢の限界でブーイングも…即、今季20個目の盗塁で史上3人目の快挙にリーチ！ 今季の四球の数は91個に,https://news.yahoo.co.jp/articles/bac589ff6ff828146da297b0382ec1abc5473ca9,9/4(月) 6:47
abema,吉田正尚、弾丸14号3ランも気づかず三塁まで全力ダッシュのお茶目シーン 47度目マルチ安打＆3打点の活躍で勝利に貢献,https://news.yahoo.co.jp/articles/8c74eb0ab4a46d4cbf43524e9c6e9012029f87e5,9/4(月) 6:19
abema,吉田正尚、久々に豪快な一発 13試合ぶりの今季14号3ラン！本人気づかず三塁まで全力疾走、日本人メジャー1年目では5位タイ,https://news.yahoo.co.jp/articles/d3fdb52f4de3efe1c15dd4ac211b3ea32a386215,9/4(月) 4:11
abema,2025年デフリンピック 東京大会エンブレム決定,https://news.yahoo.co.jp/articles/2cae0c0c7934856736850a257cc8f39c131ba9e5,9/3(日) 18:47
abema,ゼレンスキー大統領 ウクライナ軍の前進を強調,https://news.yahoo.co.jp/articles/a3265ae303710c18bb38e2e06a72ec9a20f6ce96,9/3(日) 18:42
abema,和歌山の川で男性2人溺れる 1人死亡 1人意識不明の重体,https://news.yahoo.co.jp/articles/ad0a8124ed98ac2c662f39b28f448020d4c02a03,9/3(日) 18:17
abema,琵琶湖「水上バイク事故」相次ぐ 2台衝突 1人死亡,https://news.yahoo.co.jp/articles/69c04756853595453d09da45e3cc69f819f273a8,9/3(日) 17:46
abema,おばたのお兄さん、入院中の妻・山崎アナの心中を察し、複雑な心境を報告「言葉で寄り添うことしかできないもどかしさ」,https://news.yahoo.co.jp/articles/d119753d3d20a0cb71f12e458109fe1ca66b3466,9/3(日) 17:02
abema,沼にハマった人を救出 助け出されたのは“殺人未遂”の容疑者 アメリカ・オレゴン州,https://news.yahoo.co.jp/articles/a0dcdbdf18d59d922905e934277f95ccbed88dc3,9/3(日) 15:11
abema,あぁ俺しーらね…すっぽ抜けたバットがダグアウトの監督を襲い思わず「Wow！」実況も笑いを堪えきれず,https://news.yahoo.co.jp/articles/7784b60c0a28588b1dccf3d6ae4e658655945c18,9/3(日) 13:30
abema,麻雀プレイヤー林美沙希アナ「大人になるほど迷ってしまうのですが」 小学生麻雀大会のレベルに驚き 取材で見えた熱気、“打てる場”には課題も,https://news.yahoo.co.jp/articles/88e44a32492d55aa4049be4e5335d20fdcdb57df,9/3(日) 13:30
abema,誰が取る？俺が取る！インフィールドに高々と打ち上がった打球に内野手全員集合！「逃げるピッチャーかわいいw」,https://news.yahoo.co.jp/articles/1daf23f9c699430560fed4bd78031e78d193d92f,9/3(日) 12:40
abema,鳥の“かまって”アピールが独特すぎる！ 予想外の姿に反響「めちゃくちゃされるがままwww」「信頼しきった姿」,https://news.yahoo.co.jp/articles/6883fa89adf2f2228ccb90f4a6dbc96257fc892e,9/3(日) 12:01
abema,吉田正尚の同僚主砲、バッターボックスで見せた緊急回避の瞬間　あわやデッドボールを冷静対応に「よけ方うまいなw」,https://news.yahoo.co.jp/articles/bb526d004be4a20379d0afc1b532ca2bba31a5d7,9/3(日) 12:00
abema,一体これは何だ！？ 水槽に入れるとスイスイ泳ぐ…人工筋肉を使った“古代魚型ロボット”のリアルな泳ぎ方に反響「素晴らしい技術」,https://news.yahoo.co.jp/articles/18d8328770347fd8ab19acd69ede726b4d2ded46,9/3(日) 11:51
abema,大谷翔平の右肘靱帯損傷を知りながらも“志願の強行出場” 「ホームラン王を絶対に獲りたいんですよ！初タイトルなんですよ！」 その“胸中”を川撫@則氏が推察,https://news.yahoo.co.jp/articles/cf343072d63e8e69abf98093fde394d2dee05ff0,9/3(日) 11:51
abema,本田真凜選手、宇野選手との“ラブラブ”な様子を披露し「全員幸せであれ」「とても健全でステキ」と悶絶の声,https://news.yahoo.co.jp/articles/fb2cc7837bb1dd49dec1917c67c83daa3cc841b0,9/3(日) 11:51
abema,土屋太鳳、第1子出産後の心境を報告「生きる喜びの一つでもある」,https://news.yahoo.co.jp/articles/082432bdd2c595c210f9b5043c6f2d5f54ce65a4,9/3(日) 11:51
abema,しょうがないけど打ちたかった…大谷翔平、2度の申告敬遠に打席内でバットをポーンと1回転,https://news.yahoo.co.jp/articles/918b7850019168f7b59b20152d8fbfc7b0c2ad9e,9/3(日) 11:42
abema,東京都庁 中国「86」迷惑電話に自動音声対応,https://news.yahoo.co.jp/articles/0140684d046be3d3b9028c0027d1041fc8e4ed13,9/3(日) 11:33
abema,投げる不安がなくなった “二刀流断念”で打者に専念する大谷翔平の今後はどうなるか？ 独走するホームラン王以外の打撃タイトル奪取へ期待大,https://news.yahoo.co.jp/articles/ce2e396e26f280f47fb7cb380e92f94330780262,9/3(日) 11:31
abema,敵・味方関係なくファンがっかり、大谷翔平への申告敬遠 ボールボーイだけがちょっぴり得した優しい“肩ポンポン”,https://news.yahoo.co.jp/articles/7276ce2048711d445f8121631eda7d6b701bfe38,9/3(日) 11:30
abema,吉田正尚、ボテボテのあたりに全力疾走→アウトのタイミングでも両手を広げてセーフアピールにファンもキュン「可愛いw」,https://news.yahoo.co.jp/articles/5002612d0ac5b655cf3f6c063082b5f055d13e31,9/3(日) 11:28
abema,吉田正尚は2試合続けて途中交代…3打数1安打1打点1四球　レッドソックスは20試合連続ホームランなどで連敗を5で止める,https://news.yahoo.co.jp/articles/2ce328c3068dfea97191671ee4c161a8e4b6d664,9/3(日) 11:09
abema,大谷翔平の“マン振り”が球場のどよめきを呼ぶ 空振り1回でファンざわざわ 解説者も「よく振れますね」,https://news.yahoo.co.jp/articles/146d32e70aff163d07c221204b84608ebfbf9714,9/3(日) 11:00
abema,「まさかこれ、詰みなんじゃないですか？」藤井聡太竜王・名人、電光石火の大逆転勝利に解説者＆敵も味方も騒然 兄弟子は「同じチームで良かった…」／将棋・ABEMAトーナメント,https://news.yahoo.co.jp/articles/1acc4ae30ab3ab6fbb4f082b3e92e6cf3dc928a8,9/3(日) 11:00
abema,藤井聡太竜王・名人「力を合わせて勝てて良かった」チーム藤井、難敵のチーム斎藤を破り4強入り！2期ぶり5度目Vへ前進／将棋・ABEMAトーナメント,https://news.yahoo.co.jp/articles/185734cab32a69296bdeb84dfb76da0daf5c878b,9/3(日) 10:30
abema,ノーベル賞授賞式 ロシア大使ら招待の方針を撤回,https://news.yahoo.co.jp/articles/8ff64f9a2c56fcc30256250b619982b22dd49e32,9/3(日) 10:14
abema,北朝鮮 きのう発射 巡航ミサイル画像を公開,https://news.yahoo.co.jp/articles/110ff14f61b29be81f8538d586b66205c46a6201,9/3(日) 9:48
abema,期待した観客も完全に“立ち上がり損” 大谷翔平、絶好機でまたも申告敬遠に球場中から不満続出,https://news.yahoo.co.jp/articles/990e1c9c364a9bb9794252b7d771ec00c6d1b67a,9/3(日) 9:41
abema,パパもママも大喜び！大谷翔平の同僚ルーキーがメジャー初安打で喜び爆発「おめでとう！」,https://news.yahoo.co.jp/articles/8809c5e0ca42b759e78ab1863c0327043bda48bb,9/3(日) 9:00
abema,前日途中交代の吉田正尚、うっぷんを晴らす豪快スイングから時速174キロの弾丸ツーベース「こういうヒット久しぶりに見た」,https://news.yahoo.co.jp/articles/6cc2f09e1d9d341d4c144a3ec9a809060a69e8e1,9/3(日) 8:57
abema,バスケW杯 日本が48年ぶり自力で五輪決定,https://news.yahoo.co.jp/articles/c40fc8f5c071775c368413b2b01a25f407c543d3,9/3(日) 8:57
abema,台風11号 沖縄・先島諸島に接近,https://news.yahoo.co.jp/articles/93f4f1dcf85121383a4cfba0e7ed404769903911,9/3(日) 8:48
abema,カーボベルデ市民 “五輪決定”バスケ日本代表にエール,https://news.yahoo.co.jp/articles/7ef3d4d1ae9ddd5a5f2395256f4b2dfb58b1509b,9/3(日) 8:42
abema,大谷翔平に1試合2敬遠 両リーグトップ＆自己最多21個目の申告敬遠、球場総立ちも勝負避けられる,https://news.yahoo.co.jp/articles/311254a8386d42b6448bcc3b4403745881b5dc2a,9/3(日) 7:56
abema,大谷翔平、今季ワースト9試合・43打席ノーアーチ 1試合2敬遠・両リーグ最多21個目の申告敬遠に敵地でも大ブーイング チームは連敗で借金「8」,https://news.yahoo.co.jp/articles/6b7b9667d4c6ea2e4343d43649451c120e23968c,9/3(日) 7:38
abema,“プールの水”出しっぱなしで川崎市が教員＆校長に賠償請求「個人の責任どこまで？」弁護士に聞く,https://news.yahoo.co.jp/articles/e95f869852e553634c11d0d4a39471c43186af84,9/3(日) 7:30
abema,敵地でもため息＆ブーイング 大谷翔平、両リーグ最多20個目の申告敬遠に本人はあっさり顔,https://news.yahoo.co.jp/articles/227ff0d0904a2071bc22d14cab0d92ab4a0a6839,9/3(日) 7:13
abema,大谷翔平に両リーグトップ20個目の申告敬遠 2年ぶり自身最多タイ記録、球場から大ブーイング起きる,https://news.yahoo.co.jp/articles/4367182b38e1438f22e3f5a14388caeb55f31d3e,9/3(日) 6:27
abema,松坂大輔「プロになってすぐATM行きましたね」プロ野球選手とプロゴルファーの“お金事情”トーク,https://news.yahoo.co.jp/articles/068868dd0fb109d00f3682799191c968f26c6b72,9/2(土) 22:02
abema,大谷翔平の同僚・モニアック、大量失点を食い止める美技「モニたんありがとう」「ナイスキャッチ」「危なかった」,https://news.yahoo.co.jp/articles/b5fcd384926db9ecf6c9ebd2a2594e604784f2f1,9/2(土) 20:00
abema,「乳幼児の死亡率を下げること」命やケアを重視、女性視点で被災者支援に尽力 “西洋人女性”の活躍に女性ら団結 【関東大震災から100年】,https://news.yahoo.co.jp/articles/f7a9149b7c2ab36806030015d71ebf2f672e9ed9,9/2(土) 19:10
abema,ベニズワイガニ漁が解禁 約2100匹が初競りに 2匹が極上認定,https://news.yahoo.co.jp/articles/213230691b64527c69e169de703ce65d0f8bd7e1,9/2(土) 18:46
abema,松坂大輔「最初からやり直したい…」男子プロゴルフツアー挑戦への道 最終試験は19オーバーの「91」で絶望的,https://news.yahoo.co.jp/articles/74d3cbc0f995aa72136cbb77b7ff01496758de94,9/2(土) 18:31
abema,大谷翔平へのピッチクロックバイオレーションに場内大ブーイング「なんでやねん！」「申告敬遠よりもひどいw」ファンも激昂,https://news.yahoo.co.jp/articles/5248322c07fdeb87c3fa92d26a36f9db487693f7,9/2(土) 18:00
abema,大谷翔平、目の覚めるような“弾丸ツーベース”に驚きの声が殺到「打球速すぎ」「痛烈！」「ひっぱり谷」,https://news.yahoo.co.jp/articles/23611c16b40202280afecf815d6ef279ab1ab1b7,9/2(土) 17:03
abema,「キャーーー！」大谷翔平、ポール際の弾丸ファールにファンから悲鳴と歓声,https://news.yahoo.co.jp/articles/1634bdc0c4e2a54a740e1259e49ce0fa06a5cc3c,9/2(土) 16:40
abema,「見失い方がコント」大谷翔平の同僚ルーキーが引き起こした“珍事” 相手野手の動きがまるでコントな瞬間,https://news.yahoo.co.jp/articles/0e9d20ea89f180156c6272fb397cba2ecb141ad2,9/2(土) 16:17
abema,【RIZIN】ドーピング検査は「陽性」 木村“フィリップ”ミノル、半年間の出場停止処分へ K-1時代の使用は否定「K-1をやめた後から」,https://news.yahoo.co.jp/articles/3cef7e288791c56be3089435059b1d224ead076b,9/2(土) 15:13
abema,哀愁ただよう独特な風情… 富山市八尾町「おわら風の盆」始まる,https://news.yahoo.co.jp/articles/b13495427bd707b80b8a18f1b7a1be26569378af,9/2(土) 15:13
abema,加護亜依、友人からのおもてなし料理を大絶賛「愛があふれている！！」,https://news.yahoo.co.jp/articles/028f9eface459a278a8e9d1fb2f69690456a0bab,9/2(土) 15:06
abema,ゼレンスキー大統領 国連総会出席か ロシアによる侵攻後初,https://news.yahoo.co.jp/articles/e6383b5e6c2480fbe331f30741ba999f098b5f7b,9/2(土) 14:39
abema,井浦新、柄本佑＆安藤サクラ夫妻との“躍動感あふれる”3ショット公開「私服で会うと恥ずかしい不思議な気分」,https://news.yahoo.co.jp/articles/77f27c9179d29e89bcba51dc9d98146f5e7a0ba4,9/2(土) 14:21
abema,あれ？滑らないの？華麗なスライディングキャッチのつもりが芝にめり込む驚きの瞬間「怪我しなくてよかった…」,https://news.yahoo.co.jp/articles/51ccabf345af1be5c288abd6dc414a6db49490f2,9/2(土) 14:00
abema,ひろゆき氏「1日でアメリカの投資会社が1000億円儲けた。日本は本当にひもじくなっている」そごう・西武売却に持論,https://news.yahoo.co.jp/articles/c65552abec858a128755bb37aea0854bccff3551,9/2(土) 13:56
abema,これはファインプレーなのか？壁際のジャンピングキャッチに現地解説が大爆笑　ファンも意見が真っ二つのシーン,https://news.yahoo.co.jp/articles/61198f1f2c216c10abd9b033b36ce5505e9eee60,9/2(土) 13:30
abema,全身あわせて約280万円！ 工藤静香、イベントで着用したハイブランドコーデを披露,https://news.yahoo.co.jp/articles/f0a1520f7be3c5111ec98ebdc0a5281394c484e7,9/2(土) 13:26
abema,山下智久、芸能活動27年目を報告し現在の心境を明かす「無限の可能性を旅していきたい」,https://news.yahoo.co.jp/articles/e3c6810825a1483cc1c7cbb99b4e45ddeb28434c,9/2(土) 13:25
abema,台風11号 沖縄・先島諸島に最接近へ 35mの暴風が吹く恐れあり,https://news.yahoo.co.jp/articles/8927b7f224623120e9e008801cc7c13211a27395,9/2(土) 13:18
abema,大谷翔平を襲った“珍事” 相手投手のピッチクロック違反で四球→場内大ブーイング チームは大敗で今季ワーストタイの借金7,https://news.yahoo.co.jp/articles/edb589975b8b3a9a77dda748a92ce5eae61b1b94,9/2(土) 13:09
abema,バットの先っぽだけ飛んでった！！打者も「あれ？」の決定的瞬間　根本から折れてバックネットに直撃,https://news.yahoo.co.jp/articles/2b305e17a74a69d16fc5e0263ebd7c832c7a453c,9/2(土) 13:01
abema,大谷翔平の打席で「審判でかw」ファンざわめき 身長193センチの大谷と遜色ない球審のサイズ感に驚きの声,https://news.yahoo.co.jp/articles/8548aafa2c44d874d3a67849b7958dcfd576cc8f,9/2(土) 12:44
abema,西武池袋本店のストで「皆さんに支えられていると実感」 そごう・西武労組委員長に聞くこれからの百貨店,https://news.yahoo.co.jp/articles/77023eb72143d90d5e1d04765b487fee2d660435,9/2(土) 12:36
abema,吉田正尚の「夢のあるフルスイング」がえぐい！マッチョマンの美しいスイング&フォロースルーにスタジアムも驚きの声,https://news.yahoo.co.jp/articles/33dc902346841f8c01b4b71202a73b074da8df58,9/2(土) 12:30
abema,京急・杉田駅から約200メートル離れた商店街で火事 ポンプ車など48台が出動,https://news.yahoo.co.jp/articles/2df220e743a88995e828f588c72d4f5583dbaab5,9/2(土) 12:16
abema,過去125年間で最大規模 フロリダ州を直撃したハリケーン 浸水被害は数千戸に,https://news.yahoo.co.jp/articles/4f6a74798807e10187a0672a0f0acd8457117fab,9/2(土) 12:11
abema,「多くの中国人は政府のウソに白けている」若年層“雇用不満”の矛先に？ 中国政府が処理水放出に猛反発,https://news.yahoo.co.jp/articles/a02bc22232ac1c57bd4883ed854bdeaaa412300d,9/2(土) 12:03
abema,勉強に飽きた中学2年生が“天才な遊び”を見つけてしまった！ 発想力がスゴすぎるドラクエの“スライム”がネット上で話題に,https://news.yahoo.co.jp/articles/eebfba043ae375478bc869ca3ff3d24c15ad3726,9/2(土) 12:02
abema,「相手と関わりたくない」反対の声も…離婚後の「共同親権」導入加速 虐待やDVのリスクは？ 専門家に聞く,https://news.yahoo.co.jp/articles/8f3620fe71c881bb040cba04486d58508113566c,9/2(土) 11:52
abema,南アフリカ・ヨハネスブルクのビル火災 約200人のホームレスが寝泊まりしていたか,https://news.yahoo.co.jp/articles/b392267af66d3f2afcda5ba80abbb2a9ee9fdaea,9/2(土) 11:52
abema,3匹が一列に並び熱視線!? “まさかの理由で”飼い主を見つめ続けるポメラニアン姉妹に「笑顔の圧がすごい」「可愛すぎるんだけどー!!」と反響,https://news.yahoo.co.jp/articles/c5d6fbfc710b9f2bba2c79477694dfc1a9d311a4,9/2(土) 11:51
abema,ファウル覚悟のプレーにも倒れない！ “神の子レベル”三笘薫がDF4人ブチ抜き超絶ドリブル→スーパーゴールを叩き込んだ「体の強さ」がエグすぎる,https://news.yahoo.co.jp/articles/456299a808270a66104ead4d3a7d0103725533e0,9/2(土) 11:51
abema,「縦突破」ではなく「中に切り込む」！ 三笘薫のドリブルがゴール量産仕様に進化していた　“メッシ級”ブチ抜きカットインからスーパーゴールを炸裂した瞬間,https://news.yahoo.co.jp/articles/ddc13069296ab80ed9be751245cc2a3346dbe70d,9/2(土) 11:51
abema,砂金採りハンター「5〜7割の河川で採れる」「砂金の“重さ”」 金高騰で注目、行き過ぎた行為で賠償リスクも？,https://news.yahoo.co.jp/articles/9c2ce4815609dd727b4ff03e34cdc6ef9cff9386,9/2(土) 11:50
abema,奨学金「帳消し」は“救済”か“不平等”か？学生の貧困対策、最適解は？,https://news.yahoo.co.jp/articles/0851d5bb076f972439d98e7e8066780432e85ded,9/2(土) 11:50
abema,2試合ぶりスタメンの吉田正尚は2打数無安打&7回途中交代　レッドソックスは19試合連続ホームランも最下位のロイヤルズに13失点完敗,https://news.yahoo.co.jp/articles/892dc16c820b3e4747528eef74c8497b45b3cc63,9/2(土) 11:50
abema,この半透明の不思議な物体は…？ “卵”から誕生する赤ちゃんイカの神秘的すぎる瞬間をとらえた超貴重映像,https://news.yahoo.co.jp/articles/2bf417f7cd87f1b1992f5f9fd3635ba6086a7e62,9/2(土) 11:50
abema,「ねぇ…どうして？」就寝直前の息子が聞いてきた“予想外の疑問”に反響 「とうとう気づいてしまったんですね…」「信者にならないか？」,https://news.yahoo.co.jp/articles/4c0239b6e821d083a2cfbfe40b4ed8ac7bb1c155,9/2(土) 11:50
abema,旧統一教会に「過料」で最終調整 政府,https://news.yahoo.co.jp/articles/336bfe2bf580e6e0cee4232f42feafcd498be4a8,9/2(土) 11:47
abema,大谷翔平が見たい！ ネット裏に敵ファンが殺到の珍事「みんなカメラ構えてて草w」驚きの声,https://news.yahoo.co.jp/articles/c0d8ff75c8403eea27d7ead305864d04880afc52,9/2(土) 11:41
abema,修正しようと思えばできた？ “投手今季絶望”の大谷翔平が打席で見せなかった「いつもの動作」 身体のメカニックが出していた異常サイン,https://news.yahoo.co.jp/articles/2f186fc4ff4955fdf7a46b6308517966d369c4c7,9/2(土) 11:32
