media_en,title_articles,link_articles,date_original
abema,北朝鮮 日本海へ向け弾道ミサイル2発発射 金正恩総書記が海外訪問中のミサイル発射は初 ロシア訪問は軍事協力目的の強調か,https://news.yahoo.co.jp/articles/3a38e1725fe6b9ac619a4725daf64fa8a77c1ca6,9/13(水) 12:59
abema,観光地で「ゴミ問題」以上に嫌がられているものは？　無自覚から生じる“観光公害”が深刻化　インバウンド活況の今、求められる「ツーリストシップ」とは,https://news.yahoo.co.jp/articles/56e89b005f6a4e5749f71fe31953c13478621bef,9/13(水) 12:55
abema,岸田総理、「不測の事態に備え万全の態勢をとること」など3点指示 北朝鮮が弾道ミサイルの可能性があるもの発射,https://news.yahoo.co.jp/articles/92aace97909ab382c3a906a4ac4247ebd5aa9648,9/13(水) 12:54
abema,アウト、アウトだ！絶対にアウト！メジャーの塁審が異論を認めない必死の連続コール,https://news.yahoo.co.jp/articles/a7adebe5dc498bba9179a479746b2b804a8dd5a8,9/13(水) 12:30
abema,北朝鮮が発射した2発目の弾道ミサイルの可能性があるもの、EEZ外に落下か 防衛省,https://news.yahoo.co.jp/articles/0c690af169bbae3d1e2179b3a3eeb826d2e113f1,9/13(水) 12:22
abema,前澤友作氏、フェイスブック社に怒りの抗議も「本国に言って」とたらいまわしにされたことを告白　詐欺広告への画像無断使用で,https://news.yahoo.co.jp/articles/0bd298300a34ebd55e23b1b3c60715b9d86fcf9b,9/13(水) 12:15
abema,北朝鮮が弾道ミサイルの可能性のあるものを再び発射 防衛省,https://news.yahoo.co.jp/articles/883709c9e973e1156a1ef3f38ec6227903eca652,9/13(水) 12:07
abema,「職場いじめ」約6割が経験アリ「力関係の強い側が無意識に」境界線は？,https://news.yahoo.co.jp/articles/1a8772079a8b71ace489b99924e246063534689e,9/13(水) 12:03
abema,スーパームーンは最大！規則的な動きが分かる 「月」の大きさの変化、1年分を30秒でまとめてみた,https://news.yahoo.co.jp/articles/d60017ed141c7adb5f16c21597f03ff16f5a5d50,9/13(水) 12:02
abema,地元のシンボルを市が伐採？ 1.5kmも続くキノコ型街路樹 住民らが意見書を提出 千葉・浦安市,https://news.yahoo.co.jp/articles/29d63eb6d3d957f2c43742c933ae45fedef48b59,9/13(水) 12:01
abema,「人生が終わるかと思った」 中国旅客機が飛行中にエンジン火災 脱出する乗客のそばには燃えているようなエンジンも,https://news.yahoo.co.jp/articles/bfb65679ad1251f7ef21ab9812880af1d61de8f7,9/13(水) 12:01
abema,誕生日の贈り物？ 7歳の女の子が大粒ダイヤモンドを発見 アメリカ,https://news.yahoo.co.jp/articles/fd4d32625dcd6d71b941bfd847173d4b84152f2e,9/13(水) 12:01
abema,北朝鮮が弾道ミサイルの可能性のあるものを発射 すでに落下か 防衛省,https://news.yahoo.co.jp/articles/43e9defc2cfdd0806ff57b7fd30c23b84843d467,9/13(水) 12:00
abema,吉田正尚、ダブルヘッダー2試合目は出番なし チームは長時間ゲーム落とし疲労度たっぷりの1日2敗,https://news.yahoo.co.jp/articles/9898ad0d36ac342abb85838ebf456268d08d344e,9/13(水) 11:54
abema,「怖いOBなら怒ってます（笑）」 屋根つき球場なのに… 放送席が水浸しになる前代未聞の”珍光景”が広がった瞬間,https://news.yahoo.co.jp/articles/d9fe84c7f7999b740af0193f9c3158bb44499a72,9/13(水) 11:52
abema,なぜ、ソフトバンクは苦戦するんだろう？ 移籍1年目で三冠王が射程圏内！長打力も装備した安打製造機・近藤健介の進化し続ける「とんでもない」打撃,https://news.yahoo.co.jp/articles/7fccc79589b05357903da784f29ec7a34a867628,9/13(水) 11:52
abema,球場騒然！「残念… そこには源田がいるッ！！」 守備で金が取れる男 西武・源田が“極悪イレギュラー打球”を神キャッチ→超絶トスを炸裂する瞬間,https://news.yahoo.co.jp/articles/1585b92fd8199fa1e526a476f50f47b3939cd850,9/13(水) 11:52
abema,「なんだこの既視感…」農林水産省の“ユニークな取り組み”に「使うぜ」「良いと思う」と反響続々,https://news.yahoo.co.jp/articles/7a7443485a6388f2c0720dcd2bc4c2c05f02d13f,9/13(水) 11:51
abema,飼育員も大興奮！！まるで花が開くように動く “ミステリアス” なクラゲの姿に「色も形も動きも最高」「こんな生き物いるんだ」と驚きの声,https://news.yahoo.co.jp/articles/4d80a9e9295a58a6011d0d3569dce23e1ad908aa,9/13(水) 11:51
abema,犬「こうやって乗るんだよ」兄弟にマウント！？ “ドヤ顔” で走る姿に「乗れなかった子抱き締めてあげたい」「愛嬌があってかわいいわぁ〜」など話題,https://news.yahoo.co.jp/articles/23baa704d1b76f5f33ca28a53846d27a010468b0,9/13(水) 11:51
abema,モーニング娘。‘23の譜久村聖、身につけた特技を告白「寝ながら踊れるし歌える」,https://news.yahoo.co.jp/articles/9d05ae9f5e557aff218e73df5ea591038d119285,9/13(水) 11:50
abema,衝撃！千葉県のとあるスーパーで不思議な光景　セルフレジでコード決済しようとすると… 突然、聞きなれた声が？ まさかの展開に,https://news.yahoo.co.jp/articles/4eb25f7881f239e430b750d6cbf50c7cdf5e6a70,9/13(水) 11:50
abema,胸熱！！誰よりも喜ぶ久保建英、祝福の「背中バンバン」にSNS大盛り上がり！伊藤敦樹の“逆足”弾丸ミドルで代表初ゴールが決まった瞬間,https://news.yahoo.co.jp/articles/cfa26ff770fcdc92210dbf41743f9595eddf997a,9/13(水) 11:50
abema,吉木りさ、3歳長女の目が生まれつきの遠視だったことを明かす「本当にショックで…今まで気づかなくてごめんね」,https://news.yahoo.co.jp/articles/9fa55a365717c3989c115e9d2a15dfaa1b0e2964,9/13(水) 11:38
abema,今年はもっと「UK」がブレイクする！仕掛け人兼選手・仲林圭「ショーマツより売れます！」／麻雀・Mリーグ,https://news.yahoo.co.jp/articles/9dd0759982cfa84f586960653c97a75842301b5d,9/13(水) 11:33
abema,羽生善治会長「関心ありがたい」 “舵取り役”就任から3カ月 激務＆1000枚の免状署名も「不思議な気分だけど名誉なこと」,https://news.yahoo.co.jp/articles/69c12aab0b867220ede1a14f39b1cf315e0937eb,9/13(水) 11:31
abema,キンタロー。“犬系彼女”のモノマネ動画を公開「本人より面白い」「コラボに期待」と反響,https://news.yahoo.co.jp/articles/a420da347d2573d5d38596dc87338a9603c3a49d,9/13(水) 11:18
abema,職務質問から逃れようとし車3台にぶつかる事故 盗難ナンバープレートを車につけ逃走か 男3人を逮捕 名古屋市,https://news.yahoo.co.jp/articles/b28b505695b54eea4b784ba9362ba77f48e4be24,9/13(水) 11:17
abema,紗栄子「私もまだ気持ちの整理はついておりませんが…」愛馬との別れを報告,https://news.yahoo.co.jp/articles/3741f99dce6835e174cdc3be339ea103dd30f1bb,9/13(水) 11:12
abema,鈴木優、離れて暮らす家族のために2年目の飛躍を誓う「負けるわけにはいかない」愛娘の言葉が大きな刺激に／麻雀・Mリーグ,https://news.yahoo.co.jp/articles/60476b7d46be42435b4149678364594645a267e3,9/13(水) 11:02
abema,初日から3大関を全員撃破！快進撃・北勝富士は立ち合い前からテンションMAX、汗びっしょり,https://news.yahoo.co.jp/articles/158db4f2c6b09d371cc2f06b0b32e61358001842,9/13(水) 11:01
abema,リビア東部で洪水 死者5300人超、行方不明約1万人か,https://news.yahoo.co.jp/articles/669afeecdbc25a27dfedc13c2939a8f78e7b3632,9/13(水) 10:30
abema,もう仲間は失わない…瑞原明奈「あの時の悔しさは全く消えていません」入れ替え阻止と優勝宣言「大きいことを言っちゃった（笑）」／麻雀・Mリーグ,https://news.yahoo.co.jp/articles/c8d7f84044eec78f0f4ca22bf80d023a26065c08,9/13(水) 10:30
abema,そこ、まわしじゃない！幕内で出た珍技「肉つかみ」に館内騒然 右手で脇肉がっちり、解説親方も「珍しいですね…」,https://news.yahoo.co.jp/articles/b7380af88fe1a278fa10a8a03d4e37cb0f5bca0f,9/13(水) 10:00
abema,「調子が悪い」と「悪い偶然が起きた」は違う 麻雀サイボーグ・小林剛“鋼のメンタル”が揺れない理由／麻雀・Mリーグ,https://news.yahoo.co.jp/articles/0e6aa39990e3a991393cee8e4045426538aad219,9/13(水) 10:00
abema,台湾 原発で大規模訓練 ドローン攻撃など想定,https://news.yahoo.co.jp/articles/cd271e3f80fe222ee16db827a51e2273c789d0e8,9/13(水) 9:50
abema,タイで“逃走”逮捕の男 他人のパスポートを悪用,https://news.yahoo.co.jp/articles/84310a90355a9895e3fdeab5c6e65b7db7ddc868,9/13(水) 9:37
abema,農林水産省、10月以降に小麦売り渡し価格11.1％減少を発表 3年ぶり引き下げ,https://news.yahoo.co.jp/articles/82fb1ab96cd228e758e845b19fb15441f42e955a,9/13(水) 9:32
abema,やす子、前髪を下ろした“イメチェンショット”に反響「長い髪の方が似合っている」「ちょっと大人っぽくて可愛い」,https://news.yahoo.co.jp/articles/0ed144ccaf366ff427d988c5431eccc0e527bbad,9/13(水) 9:32
abema,北斗晶、カナダにいる初孫・寿々ちゃんのお宮参りを報告 「遠く離れていても心は結ばれていますように」,https://news.yahoo.co.jp/articles/cfdb967c8c7278cec2a6e33297af6fde9cfc67cc,9/13(水) 9:31
abema,竹内涼真の妹・たけうちほのか、スタイル際立つ水着ショットを披露「スタイル神」「最高すぎる」ファンから絶賛の声,https://news.yahoo.co.jp/articles/5688c76bfc28851b68d8a8d536532b16d6acc97a,9/13(水) 9:30
abema,深田恭子、バッティングセンターで“素振り”を披露 「女神」「ニッコリ笑顔可愛すぎる」と絶賛の声,https://news.yahoo.co.jp/articles/c58edecfaa776474d5fe3c5563481264d85f5002,9/13(水) 9:26
abema,きょう内閣改造 女性閣僚5人で“刷新感”,https://news.yahoo.co.jp/articles/cda5365ebc1b374fc9ed3249fa65788610b015ae,9/13(水) 9:25
abema,デジタル庁、「ガバメントクラウド」の公募条件緩和へ,https://news.yahoo.co.jp/articles/25839fbbfb30fac023808c460647b7b5abb30234,9/13(水) 9:19
abema,モロッコ地震 死者2900人超 救助入らない被災地も,https://news.yahoo.co.jp/articles/82b4630ee2c7084b4c4f92887fc53125cc95a5f5,9/13(水) 9:14
abema,記念のボールは見つかるか？吉田正尚の同僚ルーキー、メジャー初HRは照明直撃＆場外へ,https://news.yahoo.co.jp/articles/2614f5168c21f749dc1f26fa77f1fbb4575a5d97,9/13(水) 9:13
abema,残ってるのはどっちだ！？白星を譲れない力士が土俵際で見せた“同時ダイブ”が迫力満点,https://news.yahoo.co.jp/articles/2e92740cbe2d8bf70cf92850d6ceabd7fdf88b94,9/13(水) 9:00
abema,右肘を痛めた大谷翔平、なぜバットを振れるのか？ 3度のトミー・ジョン手術を経験した評論家の“詳しすぎる”解説にファン「めちゃくちゃ分かりやすい」,https://news.yahoo.co.jp/articles/6a7fa316b61e937ea979ddc572c92da465c6ce14,9/13(水) 8:06
abema,お客様にはぶつかれない！土俵から落下する力士、咄嗟の判断で人がいない座布団目掛けてダイブの“神回避”,https://news.yahoo.co.jp/articles/c8c57c2cde02e88755779439f7e5bff085fb6c60,9/13(水) 8:02
abema,セブン銀行 コンビニATMで口座開設など可能に,https://news.yahoo.co.jp/articles/6dc745641bbbd9fd131ecc2eebbb8e534944124e,9/13(水) 7:41
abema,もはや衝撃映像！試合を決定づけたイナズマ伊東純也の“爆速”80メートルドリブル　速すぎてファウルでしか止められずPK獲得するまでの一部始終,https://news.yahoo.co.jp/articles/b8c45c55eae96f7658cb8a872b961eaec22a65ed,9/13(水) 7:31
abema,匿名通報「闇バイト」にも拡大 情報料最大で100万円に,https://news.yahoo.co.jp/articles/c3fd46da4ec7f4c7a312ea2625dd8c33c819c30c,9/13(水) 7:22
abema,伊藤優孝、逃げ切りの卓内トップ「強いヤツばかりで大変」／麻雀・鳳凰戦A2リーグ,https://news.yahoo.co.jp/articles/4abdf68b65192eb7e3895b299de2961e72fe9774,9/13(水) 7:20
abema,ヤマト運輸 小型EVトラック約900台を全国に導入,https://news.yahoo.co.jp/articles/fdd3397e3aeb1109397bfbc3f41f26fc3bf13bed,9/13(水) 7:18
abema,Apple、新型「iPhone15」を発表 充電はUSBタイプCに変更,https://news.yahoo.co.jp/articles/6358e3cdeec8102e78211a22b94034072183c95e,9/13(水) 7:12
abema,「頭も清めてる」「被っとるやないか」大量塩撒き力士、頭に塩が載るまさかの“雪化粧”でファン大ウケ,https://news.yahoo.co.jp/articles/6f63fdc9ae1a4899c045d6ea68f81b8ff696b008,9/13(水) 7:06
abema,ジャッジの強烈ファールがあわや直撃も…三塁ランナーが華麗なジャンプで神回避　ファンは「変な汗が出そう」とヒヤリ,https://news.yahoo.co.jp/articles/28bd6440d979f0b7ca42fa9ac6a65f8482ad84d1,9/13(水) 7:03
abema,毎日「死んでしまいたいな…」 人気YouTuberが中学時代の壮絶な“いじめ体験”を告白,https://news.yahoo.co.jp/articles/dac423ccbcabaf545db5717bd893183fbcc5c6f2,9/13(水) 7:02
abema,「日本に逆らえなかった」「不安な結果」日本に完敗のトルコで高まる監督解任論　「続けば“森保デスノート”確定」と話題に,https://news.yahoo.co.jp/articles/f637d55f39f0a5a0a439774faed4be203f9f5ddf,9/13(水) 6:53
abema,1打席の間にスタンドでナイスキャッチとナイスキャッチ未遂が連続して起こる珍事　まさかの“放送席から乗り出し”試みたアナウンサーにファン「「おしいw」「落ちるなよ」,https://news.yahoo.co.jp/articles/3ebc49edcd91eb0c0249a4e24dae31d8a7e516c6,9/13(水) 6:32
abema,「おおっ！」とどよめく館内 気持ち良すぎるほど美しく決まったレア大技「二丁投げ」揃った両足をスパン！,https://news.yahoo.co.jp/articles/1d941a221fcfd5b3fe6c27e7777010834513e170,9/13(水) 6:04
abema,吉田正尚、2試合ぶりスタメンも3打数ノーヒット　チームも逆転負けでダブルヘッダー1試合目を落とし連勝ならず,https://news.yahoo.co.jp/articles/5fa8fe952c3fb84ead46eb120bc92c8bf4b76eee,9/13(水) 5:23
abema,日本がトルコに4-2で勝利！途中出場の伊東純也が3戦連発、古巣のスタジアムでPK獲得のイナズマドリブルを披露！森保ジャパンは欧州遠征を連勝で締めくくる,https://news.yahoo.co.jp/articles/1956b59a1137c93569e1c87df56e6d0c32cd44e8,9/12(火) 23:18
abema,藤井聡太竜王・名人がシリーズ初勝利「八冠制覇」へ前進 永瀬拓矢王座を破りシリーズ成績1勝1敗に／将棋・王座戦五番勝負第2局,https://news.yahoo.co.jp/articles/84981ce50f4f31ac2d0506856d7297d91a968202,9/12(火) 22:02
abema,「さすが神戸対局」永瀬拓矢王座VS藤井聡太竜王・名人の白熱の終盤戦 窓外に鳴り響く汽笛の音に視聴者ワクワク「港町だねぇ」,https://news.yahoo.co.jp/articles/d89f887414c8bb0db88e079cbf3ad7eb7469d694,9/12(火) 20:48
abema,ビッグモーター 新入社員の採用活動を取りやめ 来年4月の入社を辞退する内定者も,https://news.yahoo.co.jp/articles/0b731cd1a3a5d4d1cc9690fa95751cea75eec068,9/12(火) 20:34
abema,国家公安委員長に初入閣の松村祥史参議院議員が内定,https://news.yahoo.co.jp/articles/893f1807c4cfedcc3108248bf5c79bda6de4fd8d,9/12(火) 20:03
abema,第2次岸田再改造内閣 女性5人が閣僚に内定 過去最多と並ぶ,https://news.yahoo.co.jp/articles/782ecf3f5002ab01ef5f5c9d80f0caf994afc86c,9/12(火) 19:51
abema,自民・麻生派の伊藤信太郎衆議院議員 環境大臣として初入閣,https://news.yahoo.co.jp/articles/43f03eb243952acafecc18654bc6d5cb0c0e0613,9/12(火) 19:47
abema,土屋品子衆議院議員の初入閣固まる 復興大臣に内定,https://news.yahoo.co.jp/articles/552cd88a7e4877972b1a45e92dc57b4ebbbb2bbd,9/12(火) 19:44
abema,初入閣の加藤鮎子衆議院議員がこども政策担当大臣に内定,https://news.yahoo.co.jp/articles/bdde14a6872057f105618769171be0204c0d23ed,9/12(火) 19:38
abema,厚労大臣、文科大臣、防衛大臣ら “初入閣”内閣改造の顔ぶれ固まる,https://news.yahoo.co.jp/articles/ad6b61c231ab44cea80c2bb0c8bf456c9f109e30,9/12(火) 19:36
abema,斉藤国土交通大臣 河野デジタル大臣 高木国対委員長の留任固まる,https://news.yahoo.co.jp/articles/292bc30d723badc9d1de659095087c4262029587,9/12(火) 19:22
abema,上川陽子元法務大臣の入閣固まる 外務大臣に内定,https://news.yahoo.co.jp/articles/c0ac882348aea72bd0718adb00f51ec355b0dd76,9/12(火) 19:20
abema,新藤義孝元総務大臣の入閣固まる 経済再生担当大臣に内定,https://news.yahoo.co.jp/articles/6ecfc4f4c51bdb269a9c1c5a35babe7f16654e3d,9/12(火) 19:18
abema,木原稔衆議院議員の初入閣固まる 防衛大臣に内定,https://news.yahoo.co.jp/articles/4b41cbe6ec2177726a87d732165c15454b9e32c0,9/12(火) 19:15
abema,安倍派“下村外し”の裏に森喜朗元総理？ 下村博文氏「憤慨している」「口を出すならもう一度議員に」 土下座については「全く事実と異なる」,https://news.yahoo.co.jp/articles/ff82b4c541c3453f3cdd63c09cf8e89b1c945e52,9/12(火) 19:00
abema,初入閣の武見敬三参議院議員が厚生労働大臣に内定,https://news.yahoo.co.jp/articles/c22472d20446b18e8c5f248791ac075a2100c889,9/12(火) 18:56
abema,鈴木財務大臣の留任固まる,https://news.yahoo.co.jp/articles/46e8a733b782ede9e980a73552f27aa8dbe729ee,9/12(火) 18:47
abema,高市経済安全保障担当大臣の留任固まる,https://news.yahoo.co.jp/articles/e57736e8e6185da028d81392ab2a3dad1df0619d,9/12(火) 18:38
abema,鈴木淳司衆議院議員の初入閣固まる 総務大臣に内定,https://news.yahoo.co.jp/articles/2a073a98e1cd7f209b5166d30383399bcc390bb4,9/12(火) 18:33
abema,“岸田派”盛山正仁衆議院議員の初入閣固まる 文部科学大臣に内定,https://news.yahoo.co.jp/articles/154b0daac35f72634eab89926238bba556c7fcec,9/12(火) 18:32
abema,宮下一郎衆議院議員の初入閣固まる 農林水産大臣に内定,https://news.yahoo.co.jp/articles/8ee293051d357990b07e146c19262f9c04671132,9/12(火) 18:27
abema,西村康稔経済産業大臣を留任へ 岸田総理が意向を固める,https://news.yahoo.co.jp/articles/9f5ce5cf2249e3f86815974ac255f4630bf95080,9/12(火) 18:25
abema,武見敬三参議院議員と松村祥史参議院議員の初入閣固まる,https://news.yahoo.co.jp/articles/e249cd5329be236433f622cce53f0e98dd872acf,9/12(火) 18:24
abema,自見はなこ参議院議員の初入閣固まる 地方創生担当大臣に内定,https://news.yahoo.co.jp/articles/3ae6ca87112f6df977ccd65df5438c951174d376,9/12(火) 18:16
abema,小泉龍司衆議院議員の初入閣固まる 法務大臣に内定,https://news.yahoo.co.jp/articles/403cfdc2cb23ec26a84bdfbeed639564c54001d2,9/12(火) 18:14
abema,自民党・谷垣グループ加藤鮎子氏の初入閣固まる,https://news.yahoo.co.jp/articles/7066894ff93e233556c3806c14747ad770cf58c9,9/12(火) 18:07
abema,こっちが勝ち？そっちが勝ち？同時にばったり倒れた2人の力士、際どい勝負に思わず見つめ合った一瞬,https://news.yahoo.co.jp/articles/146ceb7789c332e59f31c66ed1b95c58a1d5cf72,9/12(火) 18:07
abema,デヴィ夫人、NYの豪華自宅を公開「夫人含めすべてが美しい」「絵画みたい」とファン絶賛,https://news.yahoo.co.jp/articles/c545da46089a1edb6ace4b2a118ccc169489631a,9/12(火) 18:03
abema,渡米した脅威の14歳＆15歳の日本人練習生、HYBE米オーディションでBLACKPINK楽曲を激しくパフォーマンス！SNSで話題に,https://news.yahoo.co.jp/articles/a5d3e59f436b94cfab4d9d2134fb553d3d36157a,9/12(火) 18:00
abema,経済界のトップがジャニーズ事務所の姿勢を厳しく批判 「“チャイルドアビューズ”を認めることになる」,https://news.yahoo.co.jp/articles/43e74a906adae83757363ed34a94328f339c0c20,9/12(火) 17:59
abema,吉川ひなの、11歳長女の後ろ姿がそっくりと話題に「女ふたりマシンガントーク」,https://news.yahoo.co.jp/articles/1c9156735e1ce20d2b9d82076f67c2eec54e36a5,9/12(火) 17:47
abema,ハロウィン目的で「渋谷に来ないで」 韓国・梨泰院の雑踏事故受け区長が呼びかけ,https://news.yahoo.co.jp/articles/45c763b1c1535c2d1eef7adf3601c8c0f8a7f89e,9/12(火) 17:45
abema,誰が三笘を止められるのか？ドイツ代表キミッヒもお手上げ状態の超絶ドリブル＆カットイン、たったひとりで左サイドを切り裂いた衝撃的瞬間,https://news.yahoo.co.jp/articles/cd2f60c786784a205c6cf0b96f8d9fec750d50fb,9/12(火) 17:37
abema,クリミア半島近くのガスや石油の採掘施設を奪還 2015年以降ロシア占拠 ウクライナ国防省が発表,https://news.yahoo.co.jp/articles/3764b3fa8a7e15118f670e9bb9f6b8bf6c4f19eb,9/12(火) 17:36
abema,「これで“金子のK-1”になった」金子晃大が語った玖村将史戦の勝因と対RISE王者、K-1への“ケジメ”とは？,https://news.yahoo.co.jp/articles/5e1a81a7c58f68d6c1adf89ec377c74a19117bd0,9/12(火) 17:29
abema,新しい学校のリーダーズが新CMに登場 2メートルの巨大なソイラテ担ぎ「腕が筋肉痛です笑」「プルプルしてます笑」,https://news.yahoo.co.jp/articles/5811b988d4e0fd9a9ebb42564b64af07dc0a8bcb,9/12(火) 17:23
abema,ファッション系YouTuberげんじ、250万円で目を整形しビフォーアフター公開「めちゃめちゃ綺麗」の声,https://news.yahoo.co.jp/articles/9dd93acf24bd1f895862cf31ca1c2bc9bd0e17e3,9/12(火) 17:22
abema,イチローの“愛弟子”とイチローの“熱烈”ファンが奇跡の巡り合わせ！ 偉業達成の記念HR球をダイレクトキャッチ→狂喜乱舞の決定的瞬間,https://news.yahoo.co.jp/articles/34b3de49de5a275ef0265296567cb55711096b81,9/12(火) 17:08
abema,永瀬拓矢王座VS藤井聡太竜王・名人 注目の第2局は形勢互角のまま夜戦へ突入 熱戦を制するのはどっちだ／将棋・王座戦五番勝負,https://news.yahoo.co.jp/articles/ac3620a4b093a854c2b52e57f6989f02859aca88,9/12(火) 17:05
abema,「ミュージシャン同士の“音量競争”で苦情も…」千葉・柏市“路上ライブ”で独自制度 街との共存を実現,https://news.yahoo.co.jp/articles/32ffd84f9472f2635a046b4e2a58be6870689622,9/12(火) 17:00
abema,永瀬拓矢王座はドリンク3種、藤井聡太竜王・名人は“秋色”ロールケーキで糖分補給 ファンも注目「ケーキ珍しいね」「これは食べたい」,https://news.yahoo.co.jp/articles/b25230a57cb40f9ac7fc5160fff0e38641a9b924,9/12(火) 16:43
abema,「ルンバ」のアイロボット社 空気清浄機を販売へ 「日本は欧米に比べて需要が高い」,https://news.yahoo.co.jp/articles/e055364431d338531e5ac7c057b0d12552681b09,9/12(火) 16:07
abema,決まり手考えるなら「粘り反り」？土俵際、エビ反りで踏ん張った細身力士がまさかの逆転勝利,https://news.yahoo.co.jp/articles/6f3f7f4cc2d5a716619e4f7633d9f59101fe5999,9/12(火) 16:00
abema,「麻央そっくり」市川團十郎、プールで泳ぐ勸玄の姿に驚き,https://news.yahoo.co.jp/articles/f740a34a7b5824f7f96bbf47469c61e5fc93a7f5,9/12(火) 15:41
abema,北斗晶、長男夫妻からの手紙に感激「飛行機で読むのはやばい」,https://news.yahoo.co.jp/articles/a1173498f4018da7ff57d40d974b4657de17c760,9/12(火) 15:39
abema,モロッコ地震 「全員外で寝泊り」「軍などの救助入らず」…震源地近くの現状,https://news.yahoo.co.jp/articles/7eaa38942babb27f17ca7692480fca9480227e62,9/12(火) 15:36
abema,元King & Prince岩橋玄樹、両腕の複数タトゥー公開「すごく美しい、大人の色気」「うっとりするほどかっこいい」ファン絶賛,https://news.yahoo.co.jp/articles/f55497a002ede0d2f0f7cf329c7450655ae46b8a,9/12(火) 15:36
abema,ビッグモーターと損保ジャパンの不正請求問題をめぐり、19日に立ち入り検査へ 金融庁,https://news.yahoo.co.jp/articles/405ddff877645de53cc40423f162c5067942709d,9/12(火) 15:26
abema,岸田総理 官房副長官に村井英樹氏と森屋宏氏の起用固める,https://news.yahoo.co.jp/articles/a1f8456fffe27daabcbdaa567b3af6a0f3478a02,9/12(火) 15:08
abema,「防衛翌日も研究会」永瀬拓矢王座、研究仲間が語る膨大な研究量 ファンも「研究の鬼すぎる」「休んで！」と驚きの声,https://news.yahoo.co.jp/articles/2c79ef587cc651a70810b0245d8e66c98666f8e8,9/12(火) 15:06
abema,"大谷翔平の同僚・オホッピー、キャリア初2打席連続弾→味方投手が帽子で""スポッとキャッチ""のファインプレー",https://news.yahoo.co.jp/articles/da699d12d68139dbd1efdd4f0b885c3798f86b7a,9/12(火) 15:01
abema,大谷翔平の同僚、アスリート系ルーキーが超絶美技！ あわやホームランを阻止「空間認識能力が高い」と識者絶賛,https://news.yahoo.co.jp/articles/a6b5a6b9d028cb00ab5f094baf19d20a5da90ff1,9/12(火) 14:40
