media_en,media_jp,title_articles,link_articles,date_original
biz_jinji,日本の人事部,失敗しないための問いの立て方！「チャンクダウン」と「チャンクアップ」が仕事に効く,https://news.yahoo.co.jp/articles/fef420a45f186a1cacc754a315b86a67ef6a1480,7/25(木) 7:31
biz_jinji,日本の人事部,JINSがオフィス移転で、挑戦者としてのマインドを取り戻せた理由,https://news.yahoo.co.jp/articles/fa05245c2532f397461b0a17b84d6ecea4bff04a,7/24(水) 7:30
biz_jinji,日本の人事部,「禁煙外来に行ったら？」がヘビースモーカーに響かない理由　行動変容ステージモデルとは,https://news.yahoo.co.jp/articles/36f80664786ac780e37a960ddbf98d3b7452ba19,7/23(火) 7:30
biz_jinji,日本の人事部,6割の企業がAI人材不足を実感！人事白書2024が示す最新トレンド,https://news.yahoo.co.jp/articles/d737ab21039253d440491db450fffaaa6437837a,7/18(木) 7:30
biz_jinji,日本の人事部,上司の心得はやっぱり聞き上手であること？　部下の才能を引き出すオートクライン効果,https://news.yahoo.co.jp/articles/e896bb8121bfa64514f0178572de759d6a7f9482,7/17(水) 7:30
biz_jinji,日本の人事部,人手不足時代の切り札になるか？タレント・インテリジェンスとは,https://news.yahoo.co.jp/articles/1945991de2214cc02da5955775a6ebfc54da2843,7/16(火) 7:30
biz_jinji,日本の人事部,人事の常識を覆す制度改革　ドミノ・ピザのジョブ型雇用やノーレーティング導入の秘訣に迫る,https://news.yahoo.co.jp/articles/b0a4103a819a655fcbd6be74b3b8bff4b40ef276,7/11(木) 7:30
biz_jinji,日本の人事部,長い会議で貴重な時間を無駄にしないために　すぐに使えるフレームワーク「OARR（オール）」とは,https://news.yahoo.co.jp/articles/c6087278099d7b648e9bae8631deea70c3430bba,6/27(木) 7:32
biz_jinji,日本の人事部,メンタルに作用する9つの環境特性「ビタミンモデル」とは,https://news.yahoo.co.jp/articles/72601ee30ddb9ef466b551ca33ee07113392b965,6/26(水) 7:30
biz_jinji,日本の人事部,達成・権力・親和・回避のどれかで人の行動は説明できる？　マクレランドの欲求理論,https://news.yahoo.co.jp/articles/6ee692a6f5956ecb176bf725aad70ccfac1055d3,6/25(火) 7:30
biz_jinji,日本の人事部,仕事のモチベーション向上に必要な5つの要素　職務特性モデルとは,https://news.yahoo.co.jp/articles/720f3c454f2f90e5f5e9287cfc3e73a4b9488264,6/20(木) 7:30
biz_jinji,日本の人事部,部下が成長しない……その原因は上司や周囲の期待にある!?　ゴーレム効果とは,https://news.yahoo.co.jp/articles/af094d27e88feb5737c1f789a6b13b556b01fb50,6/19(水) 7:30
biz_jinji,日本の人事部,フラット型組織は言葉遊び？　沼上幹氏の組織論,https://news.yahoo.co.jp/articles/39a5ea5e5d6855e4f37dfef07fa33487066cfbf1,6/18(火) 7:30
biz_jinji,日本の人事部,2万色のファンデーションとダイバーシティ　なぜ日本ロレアルは女性管理職比率50%超を達成できるのか,https://news.yahoo.co.jp/articles/02be500a4128c31fd527a1ab7ef530aecf7d2f83,6/13(木) 7:30
biz_jinji,日本の人事部,会社への不満や離職対策に効く人事データの活用法　タムラ製作所の心理的安全性のつくり方,https://news.yahoo.co.jp/articles/e979b8e04bcf94a24f7f40130f354634223bb0bb,6/12(水) 7:30
biz_jinji,日本の人事部,数値化を諦めない！日清食品グループの「戦略的」健康経営 いかに経営に貢献しながら、従業員の健康を守るのか,https://news.yahoo.co.jp/articles/385e79b7873ee770fac249434b1407da4c8a0192,5/29(水) 7:30
biz_jinji,日本の人事部,「あの人はもう年だから……」は年齢差別　エイジズムを職場から無くすにはどうしたらいいのか,https://news.yahoo.co.jp/articles/340d5ff1e3e6b81ef1b45b4a077952c922adbd09,5/28(火) 7:30
biz_jinji,日本の人事部,就活や待機児童、配属など、身の回りのさまざまなミスマッチを解消する「マッチング理論」とは,https://news.yahoo.co.jp/articles/bec41dc9226b547540fff9ad6fa2b8fc0a21c8a5,5/23(木) 7:30
biz_jinji,日本の人事部,仕事がつまらない・楽だけど暇、そんなときの落とし穴　ボアアウト（退屈症候群）に要注意！,https://news.yahoo.co.jp/articles/4a54398fefcf98c723f4859b185cceafe090c0d2,5/22(水) 7:30
biz_jinji,日本の人事部,仕事に行き詰まったときにはSF映画を見るといい？　ブレイクスルーをもたらすSF思考とは何か,https://news.yahoo.co.jp/articles/0cd344e470683d072107639fcc0561f10f0113f4,5/21(火) 7:30
biz_jinji,日本の人事部,100時間の残業が当たり前だった環境をどうやって改善したのか　社員40名の中小企業が取り組む健康経営,https://news.yahoo.co.jp/articles/d7b1a6fdee314aa760dc1effec96836dbb70614f,5/16(木) 7:31
biz_jinji,日本の人事部,知っておきたい職場の「自尊感情」　エンゲージメントへの影響と職場の居場所マネジメント,https://news.yahoo.co.jp/articles/882ab3d8bcfd7942b6352bab2bbf8a871d439e7b,5/15(水) 7:30
biz_jinji,日本の人事部,管理職の成果を高める「管理職分業」　 日揮グループの事例に学ぶ、職務を分担することで、ミッションを推進する方法とは,https://news.yahoo.co.jp/articles/67a9f9a5e3610c355e4c964c2a08620a7d5896f8,5/9(木) 7:32
biz_jinji,日本の人事部,脳が省エネする五つの仕組み　ヒューリスティックとは,https://news.yahoo.co.jp/articles/fdac6aec707d152211a0e2cb880a6229ebe6ec84,4/18(木) 7:30
biz_jinji,日本の人事部,集団が持つ力を引き出す！　グループ・ダイナミクスとは,https://news.yahoo.co.jp/articles/ce67e859cda35ccbdcb17c694b623e1165d0ecf8,4/17(水) 7:30
biz_jinji,日本の人事部,塩野義製薬の「データサイエンス人材」育成戦略 データドリブンな企業文化を醸成し、社内外に発信,https://news.yahoo.co.jp/articles/7d985c67c98813264b5bcb6e63dec41fa5163d62,4/16(火) 7:30
biz_jinji,日本の人事部,災害やリスク全般への備えとして注目される「BCM/BCP」 整備や社内への浸透に人事はどう関わるべきか,https://news.yahoo.co.jp/articles/e563a2173b5b80ecef1d88bec26f17e334e93caa,4/11(木) 7:30
biz_jinji,日本の人事部,ジャパネットが実践する、アットホームでストイックな生産性向上施策とは,https://news.yahoo.co.jp/articles/f28e679d53fe76e346b9e5e97ce9374cd3720ff8,4/10(水) 4:30
biz_jinji,日本の人事部,アフラック生命保険流！人的資本経営に向けた、アジャイル型の人事データ整備・活用とは,https://news.yahoo.co.jp/articles/9f9ffda1434e8728f275ffdf16b0e4c8feff04e0,4/9(火) 7:30
biz_jinji,日本の人事部,欧米でのモラハラへの取り組み状況,https://news.yahoo.co.jp/articles/a83a9be4212790a88995f07d5d9d6ff69da547e9,4/4(木) 7:30
biz_jinji,日本の人事部,職場における「感謝」の力とは？ 〜多様な人たちがスムーズに協働し、成果を出すひけつ〜,https://news.yahoo.co.jp/articles/ba0b4b28bd3cdb70cfa703f56354446007e0d1a1,4/3(水) 7:30
biz_jinji,日本の人事部,二刀流の相乗効果　ポジティブ・スピルオーバーとは,https://news.yahoo.co.jp/articles/68be47cc79a816f95615a201c5d237fd954653d6,3/27(水) 7:30
biz_jinji,日本の人事部,リスキリングとは違う？　アップスキリングとは,https://news.yahoo.co.jp/articles/6f7043ba2cddcf6262046f4107a5410865c0ff79,3/26(火) 7:30
biz_jinji,日本の人事部,知りたい本音の退職理由　エグジットインタビュー（退職前面談）とは,https://news.yahoo.co.jp/articles/070664c17b42c5010117c82f47d562bde807f0f6,3/14(木) 7:30
biz_jinji,日本の人事部,今さら聞けない「春闘」　時期や流れ、2024年春闘基本方針を解説,https://news.yahoo.co.jp/articles/24ec17382a0f7863128553a7ae92341470b18c39,3/13(水) 7:30
biz_jinji,日本の人事部,「賃上げ」とは　基礎解説や2024年の予測まとめ,https://news.yahoo.co.jp/articles/5e03788b42c7522413dea96b827be0fea3393cd3,3/12(火) 7:31
biz_jinji,日本の人事部,人事が知っておきたい「交渉学」　傾聴と問いかけで従業員と組織に働きかける,https://news.yahoo.co.jp/articles/e7ec4d5327d7cd47f842ab9bac2b6e3d998a708c,3/8(金) 7:31
biz_jinji,日本の人事部,三菱UFJ銀行の「異動」が変わる。公募活性化によるキャリア自律支援とは,https://news.yahoo.co.jp/articles/f4abf77d2b8471d962f87f5e997108ed6ac83936,3/6(水) 7:31
biz_jinji,日本の人事部,「書く瞑想」で集中力向上。ジャーナリングとは,https://news.yahoo.co.jp/articles/dc3e2f9fbd9998ea01ede758e895804d89f6e7e7,3/5(火) 7:30
biz_jinji,日本の人事部,ビジネスシーンにおける「服装」の効果とは？　被服心理学から考える,https://news.yahoo.co.jp/articles/4e1aed91ee99a48f3377b7fc75f5a1b5b31c3e3c,2/27(火) 7:30
biz_jinji,日本の人事部,忘れても、次は早く覚えられる！　「エビングハウスの忘却曲線」とは,https://news.yahoo.co.jp/articles/db45e2553e00da9ad4a61fdbe2db38ae6ba8f38a,2/22(木) 7:30
biz_jinji,日本の人事部,三菱UFJ銀行の「異動」が変わる。公募活性化によるキャリア自律支援とは,https://news.yahoo.co.jp/articles/6cc64f338c5d623bb693868936bb3596a3e52c70,2/21(水) 7:32
biz_jinji,日本の人事部,仕事をつまらなく感じるのはなぜ？　職務特性モデルとは,https://news.yahoo.co.jp/articles/0a2cefbd989b24fb886c875bb8b95f8b39679f75,2/20(火) 7:30
biz_jinji,日本の人事部,そもそも「主体性」って何？　脳科学の視点から考える、社員の「主体性」の育み方,https://news.yahoo.co.jp/articles/3fa8c7179cde36a4915bf2ddc75b474c641e7d95,2/14(水) 7:30
biz_jinji,日本の人事部,優れた起業家が実践する「エフェクチュエーション」とは,https://news.yahoo.co.jp/articles/e314cb6b348d6e56c85fea222dcc3049c644dd44,2/8(木) 7:32
biz_jinji,日本の人事部,三菱重工業のHR部門大改革　「HRから変わって、HRが変えていく」,https://news.yahoo.co.jp/articles/6079e695aafe35fae080d36be52bfecf57b98414,2/7(水) 7:30
biz_jinji,日本の人事部,いま押さえておくべき「ハラスメント」に関する法律とその対処方法,https://news.yahoo.co.jp/articles/18456904170fbae90b61b3a59c451fa60ff3578a,2/6(火) 7:31
biz_jinji,日本の人事部,人事パーソンに求められる「データアナリティクス」 何を学び、どう取り組むのか,https://news.yahoo.co.jp/articles/67fc0be4a5911e82c769f1c9a12e9a4cc29e828b,1/30(火) 7:30
