media_en,media_jp,title_articles,link_articles,date_original
domani,Domani,子供の家庭学習は「学年×20分」？勉強時間と自由時間のいいバランスってあるの？,https://news.yahoo.co.jp/articles/7deda56ffb9ef9e95041ea0899616e22aebba4f1,1/28(日) 7:30
domani,Domani,ハワイ旅の円安対策に「分泊のすすめ」。子連れに最高な2大ホテルもチェック【円安でも楽しめる子連れハワイ】,https://news.yahoo.co.jp/articles/fa96473e8b7e5e59905f6d2dba1e6234edb72b33,1/27(土) 8:11
domani,Domani,大人女性が選んだ「買ってよかった！」おすすめ家電・美容機器トップ10を発表！,https://news.yahoo.co.jp/articles/6d861e443272d82b7f6ec8ab23ac0a884390795a,1/27(土) 8:00
domani,Domani,【実録・39歳、子連れ再婚の365日】学校説明会でバッタリ会ったママ友から厳しい一言に、なぜか息子のスイッチがON！,https://news.yahoo.co.jp/articles/f275da799971bf6dc475851c42c526c965906561,1/27(土) 7:50
domani,Domani,モデル・牧野紗弥さん、長女が海外留学することに。「学んでほしいのは語学だけじゃない、1ドル200円時代の稼ぎ方」,https://news.yahoo.co.jp/articles/61af2c9980e94a5b584bae44066b03fff5ded54e,1/24(水) 11:41
domani,Domani,【実録・39歳、子連れ再婚の365日】突然うずくまった夫。まさかの緊急手術！？,https://news.yahoo.co.jp/articles/da134b15b07c1135120371efadc994bfa81cc9a8,1/24(水) 7:40
