media_en,media_jp,title_articles,link_articles,date_original
gifuweb,岐阜新聞Ｗｅｂ,スイレン、水面にふわり　岐阜・関市の円福寺で見頃,https://news.yahoo.co.jp/articles/7189c66a81b0ca944e9f7e114de2b1b62da60b66,5/17(金) 10:39
gifuweb,岐阜新聞Ｗｅｂ,「テーマパークのようなゲーセンつくる」１７歳、夢の起業　岐阜各務野高生、全国から仲間集める,https://news.yahoo.co.jp/articles/80406aa6d798ebeaba5856a8ecdade8a4ee32c8e,5/17(金) 9:54
gifuweb,岐阜新聞Ｗｅｂ,バスケで町に活気を…３人制プロ「垂井レイザーバックス」　ボールパーク新設目標、アパレル事業も企画,https://news.yahoo.co.jp/articles/d260ddcb2303a952ecdd3b9ddd71e407f4d923fd,5/17(金) 9:32
gifuweb,岐阜新聞Ｗｅｂ,スタンプラリーで位置情報を偽装「ぎふ旅コイン」不正取得　容疑の４人を摘発,https://news.yahoo.co.jp/articles/5b5604197fea8d9ee4b405a69d8369fd1657888a,5/17(金) 9:23
gifuweb,岐阜新聞Ｗｅｂ,賃貸メリットなど解説、空き家活用のススメ　岐阜・美濃加茂市のまちづくり団体が住民向けパンフ作成,https://news.yahoo.co.jp/articles/1106780b06e0e94a5384d5deba5ff098e3f36829,5/17(金) 9:13
gifuweb,岐阜新聞Ｗｅｂ,リニア残土受け入れ協議を一時停止　岐阜・御嵩町、瑞浪市の水位低下問題受け,https://news.yahoo.co.jp/articles/46e126afcc4297e355700d0dae46019fc36c6168,5/17(金) 9:02
gifuweb,岐阜新聞Ｗｅｂ,性別による「無意識の偏見」なくそう　岐阜県が職場や家庭エピソード募り啓発動画制作へ,https://news.yahoo.co.jp/articles/36284e8b6e2097c348134df6b9ff5d0f66a9c537,5/17(金) 7:37
gifuweb,岐阜新聞Ｗｅｂ,リニア、トンネル掘削工事一時中断へ　ＪＲ東海、水位低下の岐阜・瑞浪市で湧水調査,https://news.yahoo.co.jp/articles/5f7b7bc264bf193791d86bac71214af923766e4b,5/17(金) 7:32
gifuweb,岐阜新聞Ｗｅｂ,ドワンゴ学園準備会や角川ドワンゴ学園と協定、稲刈りや栗拾いで新商品開発　岐阜・恵那市を学びの場に,https://news.yahoo.co.jp/articles/3e920ab20304a4fc1685ea683520050a5754c63c,5/16(木) 9:46
gifuweb,岐阜新聞Ｗｅｂ,デイグランピングやＢＭＸパーク、木曽川沿いの新公園着工　岐阜・各務原市「必ずにぎわいうまれる」,https://news.yahoo.co.jp/articles/c1a13a9323a1c62b3675fd0605e42410ce26c7a3,5/16(木) 9:26
gifuweb,岐阜新聞Ｗｅｂ,美川憲一さん、原点の地「柳ケ瀬」に７月７日来たる　岐阜高島屋閉店前、商店街イベント,https://news.yahoo.co.jp/articles/364a1bea2b2d2f93506043faf33b5b4d12a3e482,5/16(木) 9:03
gifuweb,岐阜新聞Ｗｅｂ,チラシ投かん中に置き配など窃盗２０回　岐阜地裁初公判、男は起訴内容認める,https://news.yahoo.co.jp/articles/02734a84193be56262915ad96f570728654ee869,5/16(木) 8:42
gifuweb,岐阜新聞Ｗｅｂ,闘犬種ピットブルずさん飼育、制御できず２度事故「悪質」検察側禁錮６月求刑　岐阜・各務原市の女公判,https://news.yahoo.co.jp/articles/ffa8f9ddefe1afdff4d0428ac5476c760d6db40a,5/16(木) 8:18
gifuweb,岐阜新聞Ｗｅｂ,ゴルフ場でも井戸水位に異変、施設の水「すべて井戸水、出なくなったら…」　リニア工事,https://news.yahoo.co.jp/articles/620f3242a4486b632b760d98447ddb26a55ee74d,5/16(木) 7:49
gifuweb,岐阜新聞Ｗｅｂ,リニア工事水位低下、岐阜県知事「原因究明と抜本対策求める」　地元住民から中断求める強い声も,https://news.yahoo.co.jp/articles/988eb88190055cf883e8cccc8986fab905798045,5/16(木) 7:36
gifuweb,岐阜新聞Ｗｅｂ,岐阜・飛騨市で民家全焼　留守中でけが人なし,https://news.yahoo.co.jp/articles/4ddcc99036f95718b91fdfb297106914090ba43a,5/15(水) 10:02
gifuweb,岐阜新聞Ｗｅｂ,朝バラ、早朝入園でゆったり愛でる　岐阜・ローズガーデンで２万株見頃,https://news.yahoo.co.jp/articles/212fe5d5ae235b731747854d271e093397a758ce,5/15(水) 9:51
gifuweb,岐阜新聞Ｗｅｂ,湖池屋の新工場「飛騨牛商品」構想発表、岐阜・海津市は「良質な水豊富」　ポテチ作り体験併設,https://news.yahoo.co.jp/articles/8ae6d546032058c270fce294fda11f9126873f73,5/15(水) 9:36
gifuweb,岐阜新聞Ｗｅｂ,核テナント撤退の商業施設「プラティ多治見」にぎわい不足課題　市長が説明「運営企業に助言する」,https://news.yahoo.co.jp/articles/05733d2f9293b656aa5894329bcfc6100d075350,5/15(水) 9:26
gifuweb,岐阜新聞Ｗｅｂ,西濃運輸、運賃値上げ　６月から１０〜２０％、価格や人件費上昇で適正化図る,https://news.yahoo.co.jp/articles/57fba64aa7db284b7b4fbc160d9bf0db97397b37,5/15(水) 9:13
gifuweb,岐阜新聞Ｗｅｂ,鉄道ファン増やし「人が集まる場所に」高校生がプラレール運転会企画　岐阜・池田町で１９日イベント,https://news.yahoo.co.jp/articles/1a0855a2cfd803b1285d951a031933a3836599c6,5/15(水) 9:02
gifuweb,岐阜新聞Ｗｅｂ,病院女子トイレに侵入疑い６１歳男逮捕、手鏡でのぞき見目的か　岐阜・養老署,https://news.yahoo.co.jp/articles/e6ffca013906adf2cb6d21a575425c459d410f4c,5/15(水) 8:39
gifuweb,岐阜新聞Ｗｅｂ,リニア工事で井戸枯渇、ため池にひび…住民「元に戻して」　岐阜・瑞浪市、井戸水の家庭もある集落,https://news.yahoo.co.jp/articles/b17ee6174f77f3bf4a85534c416a2737733ea1fb,5/15(水) 7:41
gifuweb,岐阜新聞Ｗｅｂ,リニア工事で水位低下、岐阜・瑞浪市内の井戸など１４カ所　ＪＲ東海認める「早急に上水道工事進める」,https://news.yahoo.co.jp/articles/6a63e4a43d7832436ccec15a685d2e2da23a8ca2,5/15(水) 7:21
gifuweb,岐阜新聞Ｗｅｂ,岐阜バス、右折時に逆走「前の車が右折矢印でも動かず追い越した」　不適切運転で謝罪文掲載,https://news.yahoo.co.jp/articles/1d1dacac83efb8c1d0c01373dc4f9863ff620141,5/14(火) 11:16
gifuweb,岐阜新聞Ｗｅｂ,バラ香り音楽奏でるオープンガーデン　岐阜・美濃加茂市の石材店庭園,https://news.yahoo.co.jp/articles/73a710cfc29b92c10a5ac965516116a0c8b53c64,5/14(火) 10:19
gifuweb,岐阜新聞Ｗｅｂ,オールドカーで「友人どんどん増える」岐阜・高山市でイベント、県内外オーナーの１２０台展示,https://news.yahoo.co.jp/articles/c859afc6957ca732b6d67ea51f7e1c7e15ea50fa,5/14(火) 9:56
gifuweb,岐阜新聞Ｗｅｂ,公園で朝のヨガ、基本のストレッチで心身リラックス　岐阜市,https://news.yahoo.co.jp/articles/01aabf71e3ed42437715dd30213a9ee8ca17c7f8,5/14(火) 9:37
gifuweb,岐阜新聞Ｗｅｂ,大垣北高と米子東高野球部タッグ、野球少年指導　プレー褒めて楽しさ伝える、元プロ選手も活動に感銘,https://news.yahoo.co.jp/articles/256be63638eba85b9ca53fb7eb27ede8114ffa05,5/14(火) 9:27
gifuweb,岐阜新聞Ｗｅｂ,かわいい黄色い花だけど…生態系に影響大「オオキンケイギク」駆除活動　岐阜・関市の堤防,https://news.yahoo.co.jp/articles/893e27fefa115beb56749fc584a38db618c7e296,5/14(火) 8:42
gifuweb,岐阜新聞Ｗｅｂ,減収減益予想２８・４％、増収増益を上回る　岐阜県内企業２４年度業績,https://news.yahoo.co.jp/articles/7be199d7f7acf98f82e8cb39ded184441d3fd1f3,5/14(火) 8:32
gifuweb,岐阜新聞Ｗｅｂ,朝ドラ「半分、青い。」ロケで話題、五平餅「みはら」閉店　撮影関係者も来訪「４４年間お疲れさま」,https://news.yahoo.co.jp/articles/946474f073f653861aa5f3ada7db4c03cfd8c49e,5/14(火) 7:56
gifuweb,岐阜新聞Ｗｅｂ,岐阜・池田町長選に竹中氏出馬へ　前町長がセクハラ認定で辞職,https://news.yahoo.co.jp/articles/e707f35b6fe8daf7a7ca838172302220f35896bc,5/14(火) 7:27
gifuweb,岐阜新聞Ｗｅｂ,陸自射撃訓練、22日に再開　発砲事件あった岐阜市の日野射撃場,https://news.yahoo.co.jp/articles/8fd648eb0d8abf4804d0eeac520692fc339fd380,5/13(月) 12:16
gifuweb,岐阜新聞Ｗｅｂ,色鮮やか「ルピナス」空目指し満開　岐阜・美濃市、洲原ひまわりの里,https://news.yahoo.co.jp/articles/df7aa912cdd55c47572303cc969397b1ed317096,5/13(月) 8:58
gifuweb,岐阜新聞Ｗｅｂ,「きのこの山・たけのこの里」森林保全、本格スタート　明治ＨＤ、岐阜県、関市が看板除幕式,https://news.yahoo.co.jp/articles/77c6ecc2f7c67cdf444174ef8bd3f3256a152532,5/13(月) 8:32
gifuweb,岐阜新聞Ｗｅｂ,地域のシンボル的存在、町を一望　京塚山（通称・高雄山、郡上市）,https://news.yahoo.co.jp/articles/c055e7e60124c5ad9729d72237a8e835ba18302a,5/13(月) 8:12
gifuweb,岐阜新聞Ｗｅｂ,東鉄バス、肥田線を１０月撤退　土岐市が代替運行の方針、利便性維持へ同じダイヤ,https://news.yahoo.co.jp/articles/968e34e89d078356ba6104445534bcf49eede76d,5/13(月) 7:51
gifuweb,岐阜新聞Ｗｅｂ,ＦＣ岐阜が天皇杯切符、ＦＣ.Ｂｏｍｂｏｎｅｒａに５−０　サッカー県代表決定戦,https://news.yahoo.co.jp/articles/5d210f87ff3c4b72ffea88430018caf90aa63720,5/12(日) 11:02
gifuweb,岐阜新聞Ｗｅｂ,ドローン業者をマッチング、岐阜県がビジネスサイト開設　撮影、測量、散布…３０社を目的別に,https://news.yahoo.co.jp/articles/765fb747923947584d9c1460f4fdab70157073c0,5/12(日) 8:17
gifuweb,岐阜新聞Ｗｅｂ,初夏告げる天然鮎の初競り、過去５年で最多８２キロ入荷　岐阜市中央卸売市場,https://news.yahoo.co.jp/articles/0e9ac6e51c0ed08c0f9d6922a09562485f137e8d,5/12(日) 7:46
gifuweb,岐阜新聞Ｗｅｂ,１３００年の歴史「長良川鵜飼」開幕　観覧船定員制限を撤廃,https://news.yahoo.co.jp/articles/cb77de24ee9d1197d538b8eb864dfdb8cb901af9,5/12(日) 7:26
gifuweb,岐阜新聞Ｗｅｂ,養老公園と養老駅、乗車無料で往復　岐阜・養老町、土日祝日シャトルカート運行開始,https://news.yahoo.co.jp/articles/5923ecc1c1566d49a21d98ba6c72bc0acda6b6d0,5/11(土) 10:16
gifuweb,岐阜新聞Ｗｅｂ,鵜匠のフラッグ、船頭紹介カード…鵜飼発信、移住者が新風　きょう「長良川鵜飼」開幕,https://news.yahoo.co.jp/articles/2e409ce393067c9d3cde61c35f2078d3838959c0,5/11(土) 10:11
gifuweb,岐阜新聞Ｗｅｂ,海洋堂の元原型師、原詠人さんの「お宝」一堂　岐阜市で国内外１００点超の恐竜模型など展示,https://news.yahoo.co.jp/articles/98a8a7cc1d080da394b6bb8ab460fad88c069c20,5/11(土) 9:41
gifuweb,岐阜新聞Ｗｅｂ,能登地震受け木造住宅の耐震化推進へ岐阜県が無料診断呼びかけ　補強費用や相続人不在も課題,https://news.yahoo.co.jp/articles/3659f9d530ab915d6b33d1b304685578b447546a,5/11(土) 9:27
gifuweb,岐阜新聞Ｗｅｂ,岐阜・御嵩町、リニア残土受け入れ　健全土のみ、ＪＲと協議へ,https://news.yahoo.co.jp/articles/9831827847dc2c68e14cfb8fd5ec0357f399480b,5/11(土) 8:54
