media_en,media_jp,title_articles,link_articles,date_original
aab,秋田朝日放送,八峰町・能代市沖の洋上風力発電事業者決定　　　/秋田,https://news.yahoo.co.jp/articles/4c0ad21657e46d940fc6c8f5bba2476f01500fda,3/25(月) 14:05
aab,秋田朝日放送,副業かたるSNSの広告にだまされ　20代女性が１５７万円の詐欺被害　　/秋田,https://news.yahoo.co.jp/articles/428597e9c4baad78d19f424d4c867f41f7e2e1c2,3/25(月) 14:03
aab,秋田朝日放送,秋田はインフルエンザ・新型コロナともに患者数が増加　インフルは大仙保健所管内に警報,https://news.yahoo.co.jp/articles/88376d66a9356257fcaf70a2fab9985117814c6b,3/24(日) 16:28
aab,秋田朝日放送,サッカー・Ｊ２ブラウブリッツ秋田　アウェーで清水エスパルスに敗れる,https://news.yahoo.co.jp/articles/25af32ab77947ce0d5aa2f9e9bcf1d4d3ee9c2e9,3/24(日) 16:25
aab,秋田朝日放送,50代の小学校教頭　同僚をホテルに誘いセクハラで懲戒処分,https://news.yahoo.co.jp/articles/f137900d17f485cd7b394927f863ff0fcddaa3a7,3/23(土) 18:04
aab,秋田朝日放送,札幌と秋田の中学生が洋上風力発電学ぶ,https://news.yahoo.co.jp/articles/9184347363dc21cfc44f5f0c147f29d071ccb05a,3/23(土) 18:02
aab,秋田朝日放送,横手リトルシニアが初の全国大会前に意気込み語る,https://news.yahoo.co.jp/articles/67d517ae4f0f1cddeb28f8c5e28c26b513e5c54f,3/23(土) 18:02
aab,秋田朝日放送,トレーラーハウスホテル４月オープン,https://news.yahoo.co.jp/articles/3f418258440d56deab517f5c730b4217c9dd0535,3/22(金) 19:45
aab,秋田朝日放送,秋田市外旭川のまちづくり巡り秋田市が県に回答　トップ会談も申し入れ,https://news.yahoo.co.jp/articles/30bb10e9351dd57a227448509c1b915e74542047,3/22(金) 19:37
aab,秋田朝日放送,秋田県内唯一の日本語学校１期生が卒業「自販機のジュースも何もかも新鮮」,https://news.yahoo.co.jp/articles/fe09a2b8fc23003112d92204a55678fb03f036da,3/22(金) 19:37
aab,秋田朝日放送,クルーズ船が秋田に　今年初寄港！バスで観光地へ…「「秋田犬が楽しみ」,https://news.yahoo.co.jp/articles/1ae2184ddaaffb83c38482474fba363e384d8a61,3/22(金) 19:35
aab,秋田朝日放送,アマチュア社会人バスケの頂点を決める大会で女子の秋田銀行が４年ぶり３度目の優勝　喜びを報告,https://news.yahoo.co.jp/articles/cdf3c15afd5e8371447952f1571c999e4f0edbf9,3/21(木) 13:03
aab,秋田朝日放送,ミニ新幹線の乗車体験や模型を的に見立てた射的も　色々な遊び方で鉄道の魅力を体感　秋田市で２４日まで,https://news.yahoo.co.jp/articles/90172a192291fb58d67ffb63b62a7c9590cebcba,3/20(水) 19:08
aab,秋田朝日放送,医師不足の地域へ　移動診療車による「遠隔診療」で患者と医師をつなぐ　秋田市でも試験運用,https://news.yahoo.co.jp/articles/a6621fe08ba288b82267e1baae882623a38165b2,3/20(水) 19:03
aab,秋田朝日放送,「暑さ寒さも彼岸まで」とは言うものの…寒の戻りで厳しい冷え込みに　彼岸の中日　雪の中の墓参り　秋田,https://news.yahoo.co.jp/articles/6cff8ce5b47cc956ea192a4d050d306abd80d7cf,3/20(水) 19:00
aab,秋田朝日放送,「パソコンがウイルスに感染」　秋田市の７０代男性が修理代金として電子マネー３０万円分をだまし取られる,https://news.yahoo.co.jp/articles/0daf1feec0f714a145187cfe9e5b0fb7bf20fbe1,3/20(水) 12:14
aab,秋田朝日放送,サッカーＪ２・ブラウブリッツ秋田のクラブハウスの起工式　８月下旬の完成目指す,https://news.yahoo.co.jp/articles/b6dc801b28413a63befa18fc36f34b83d01e90a4,3/19(火) 19:12
aab,秋田朝日放送,人とクマとの共存へクマがすみやすい森づくりから考える講演会　専門家はクリに着目　秋田,https://news.yahoo.co.jp/articles/ca4972f1102646ce2e0e85e36762f1c8318c7167,3/19(火) 19:03
aab,秋田朝日放送,秋田県能代市出身の総合格闘家・斎藤裕さん　アンバサダー務めるブランド米「サキホコレ」への愛を語る,https://news.yahoo.co.jp/articles/4d84d083f1d7d2c3423d45e48aca72f047860fb9,3/19(火) 18:59
aab,秋田朝日放送,土地改良区の口座から約６００万円を着服したとして起訴された男の初公判　男は起訴内容認める　秋田,https://news.yahoo.co.jp/articles/771a4b94bdd0392c7b18363651e2b05798fc8248,3/19(火) 18:57
aab,秋田朝日放送,秋田県の佐竹知事　秋田市外旭川地区のまちづくりをめぐり市長と再び会談する意向はないと強調,https://news.yahoo.co.jp/articles/3a0a753b27c34069dbf383ce08cfbf718f67a7d8,3/19(火) 18:54
aab,秋田朝日放送,晴れの舞台に学生たちが個性あふれる装いで　秋田市の秋田公立美術大学で卒業式,https://news.yahoo.co.jp/articles/1a1e7dbe104da6e5c929b8824b38efb8b11b4de2,3/18(月) 18:44
aab,秋田朝日放送,秋田県内の洋上風力発電事業　漁協などが漁業への影響について回数を重ねて分かりやすく説明するよう求める,https://news.yahoo.co.jp/articles/6b892b488b2bed05ee94ca0657a5da4319046f1c,3/18(月) 18:42
aab,秋田朝日放送,除雪作業の効率化を図るシステムの開発などを目指す　秋田大学にデジタル技術の研究拠点設置,https://news.yahoo.co.jp/articles/7ef69e923f96a548bdf9774c4a001dbb27e25d53,3/18(月) 18:39
