media_en,media_jp,title_articles,link_articles,date_original
relifenet,Reライフ.net,万一に備えて書いた希望や情報　残された家族にとって大きな指針に　Reライフ終活ワークショップ詳報③ ～エンディングノート記入練習（下）～,https://news.yahoo.co.jp/articles/28f2c1aea4170763172a94a2848cdfe571ed9259,1/23(火) 17:01
relifenet,Reライフ.net,<連載　僕はパーキンソン病　恵村順一郎>病を得たからこそ見える景色がきっとある　ゆっくり歩いていこう、と元旦の富士を望み思う,https://news.yahoo.co.jp/articles/4b98a847c7d40b9e725d5e88298d94c7b190150e,1/22(月) 11:04
relifenet,Reライフ.net,骨粗しょう症とは 原因や治療法・予防法を専門医が詳しく解説,https://news.yahoo.co.jp/articles/1c1f467480bb11d113d30ef7e79059827f9a9fb0,1/22(月) 11:03
relifenet,Reライフ.net,早期リタイアに必要な資金とは 準備内容や失敗しないための対策も解説,https://news.yahoo.co.jp/articles/93dfed618df80da8897bacb4e5fced279141731d,1/18(木) 11:03
relifenet,Reライフ.net,腸内細菌の様子をタイプ分け、日本人の特徴は?　健康作りにどう生かす?　腸内細菌叢データベース開発の摂南大・井上亮教授インタビュー,https://news.yahoo.co.jp/articles/570eb726da2c243c63474f996b01de01207c06cb,1/17(水) 11:03
relifenet,Reライフ.net,高齢者が受け取れる給付金を紹介 50代から老後のお金を増やすには,https://news.yahoo.co.jp/articles/5422598ba58a596f72cbcdfa0df654deee3e0455,1/11(木) 11:01
relifenet,Reライフ.net,腸の音から状態探る「腸活アプリ」開発　腸内細菌は体内時計の調節も　　第2回ガットフレイル研究会報告（下）,https://news.yahoo.co.jp/articles/676b201c55a61fedca6a52fe4d7db15386f3d3d0,1/10(水) 11:02
