media_en,media_jp,title_articles,link_articles,date_original
dime,＠ＤＩＭＥ,20000人に聞いた現在利用しているクレカTOP3、3位PayPayカード、2位イオンカード、1位は？,https://news.yahoo.co.jp/articles/88b4329f5c22d306695317434dd94e8158ee4b2e,9/2(月) 21:40
dime,＠ＤＩＭＥ,管理職が「創造的なマネジメント業務」に使える時間は業務全体の2割未満,https://news.yahoo.co.jp/articles/263c768398434c81a7deca57ad14f843a62daac0,9/2(月) 21:11
dime,＠ＤＩＭＥ,男子中学生が将来なりたい職業TOP3、3位会社員、2位公務員、1位は？,https://news.yahoo.co.jp/articles/dadc16d713b7e5d9cfc1563a6bdf2fe01b48f970,9/2(月) 20:50
dime,＠ＤＩＭＥ,倒産する中小企業が激増する？10月からの最低賃金引き上げが日本経済に与える影響,https://news.yahoo.co.jp/articles/15a318a815f9acc64be4d225ead8a7506d1f9359,9/1(日) 21:20
dime,＠ＤＩＭＥ,バイクと軽自動車のいいとこどり！令和のスーパーカブを目指す一人乗りに特化した超小型EV車「mibot」,https://news.yahoo.co.jp/articles/3f479dded1e5e9517cca6acd1a24ef64e4557b2f,9/1(日) 20:40
dime,＠ＤＩＭＥ,減塩しょうゆと普通のしょうゆ。味の区別ついてる？味くらべをした結果……,https://news.yahoo.co.jp/articles/af2cd40a2041cb178f50467e06f9f6b39bfa7333,9/1(日) 17:20
dime,＠ＤＩＭＥ,毎年応募が殺到する「東京セカンドキャリア塾」とは？なんとプレシニアコースは競争率が4倍超！,https://news.yahoo.co.jp/articles/579181d27e7f4222f45575ded562880c3836ab18,9/1(日) 16:50
dime,＠ＤＩＭＥ,9月1日は防災の日！被災経験者が語る、あると超便利な防災用品、備蓄アイテム、防災アイデア10選,https://news.yahoo.co.jp/articles/2d016a90edf64e8abc37f0e8777e377aabca1a28,9/1(日) 10:14
dime,＠ＤＩＭＥ,メルセデス・ベンツの電動SUV「EQA 250＋」がお買い得だと言い切れる理由,https://news.yahoo.co.jp/articles/ca69a8dd8dff176d26f1e300e04d82d212466dd0,9/1(日) 9:34
dime,＠ＤＩＭＥ,中林美和×kanonが母娘で紡ぐウェルビーイング・ファッションのカタチ,https://news.yahoo.co.jp/articles/bcad045ff437f1db763b8a2805737a764b25d110,8/31(土) 20:50
dime,＠ＤＩＭＥ,海外旅行にはAirTagを用意すべし！危険すぎる海外の空港事情,https://news.yahoo.co.jp/articles/f65d06c14dee331e578e40533686e3687ac1aa97,8/31(土) 20:40
dime,＠ＤＩＭＥ,土曜ランチの定番といえばコレ！ブラジル人のソウルフード「フェイジョアーダ」とは？,https://news.yahoo.co.jp/articles/b070fd9c400152cb51bab014e283e757f506e6d2,8/31(土) 10:30
dime,＠ＤＩＭＥ,キャンプに続いて釣りブームも終焉か？ダイワとシマノに求められる次の戦略,https://news.yahoo.co.jp/articles/3a930bbbe77507b375be74b6bc4764e15adb10b2,8/31(土) 8:20
dime,＠ＤＩＭＥ,らしさを継承しながら先進性を体現した「レンジローバー イヴォークAUTOBIOGRAPHY P300e」,https://news.yahoo.co.jp/articles/3710182b3e000997868d6ebb6a7fc9f5383d7171,8/30(金) 21:40
dime,＠ＤＩＭＥ,世界恐慌によって明暗が分かれる国の条件は？,https://news.yahoo.co.jp/articles/6fb56c82bbedc1e7a1ef91b33482d1ef80355886,8/30(金) 21:20
dime,＠ＤＩＭＥ,「金融を核としたスマートライフ事業でさらなる成長を目指す」NTTドコモ・前田新社長が描く未来へのビジョン,https://news.yahoo.co.jp/articles/6c2af7a81bdebdb627c92c801a66b8c10e95b631,8/30(金) 20:51
dime,＠ＤＩＭＥ,ファーストEVの選択肢としてボルボ「EX30」を薦めたい理由,https://news.yahoo.co.jp/articles/7e6907c145895cb72bf63c5abca46982f87654e4,8/29(木) 21:41
dime,＠ＤＩＭＥ,向いてる職業や恋愛の傾向がまるわかり！不思議と当たる「スピリットアニマル占い」,https://news.yahoo.co.jp/articles/a3f2e67a76930e01c47dfbcc02097623f97df84c,8/29(木) 21:20
dime,＠ＤＩＭＥ,今年6月から導入された定額減税、「手取り額の増加を期待しない」人は何割いる？,https://news.yahoo.co.jp/articles/c02a89fbf2944f034d02f633e35ade893952ddb3,8/29(木) 21:08
dime,＠ＤＩＭＥ,セカンドカーとして所有したくなるレクサスのコンパクト電動SUV「UX300e」,https://news.yahoo.co.jp/articles/9e95a3f4313aa4481201939490e6f18194aa55e7,8/29(木) 20:44
dime,＠ＤＩＭＥ,半導体市場で圧倒的な競争力を持つTSMCの強さの秘密,https://news.yahoo.co.jp/articles/34622bea52c6f1736f2f6b41e981d411254b78ee,8/28(水) 21:20
dime,＠ＤＩＭＥ,5年ぶりにSIMフリー市場へ参入！レノボ傘下で復活したarrowsスマホ「We2/We2 Plus」でFCNTは再起できるか,https://news.yahoo.co.jp/articles/d18a9296a4ed1872cee5ca194ade53eca6ab06e9,8/28(水) 20:40
dime,＠ＤＩＭＥ,会員制セカンドホームサービスのSANUが2週間で建てられる新型キャビン「SANU CABIN MOSS」を年内5拠点に展開,https://news.yahoo.co.jp/articles/03762ad2d05eab8cae7d11b2e6a905ea11dde20c,8/27(火) 21:40
dime,＠ＤＩＭＥ,【テンバガーを探せ】「ミッションクリティカル」領域にAIを社会実装するABEJAの先進性,https://news.yahoo.co.jp/articles/68a3547f68c3d01a72aefbb78bef8f96eab0c1c9,8/27(火) 21:10
dime,＠ＤＩＭＥ,オリンピックで注目度急上昇！覚えておきたい「馬術」競技の基本知識,https://news.yahoo.co.jp/articles/0dcadfe59fb52a4caa735fafda3fa7fd3177a531,8/27(火) 20:40
