media_en,media_jp,title_articles,link_articles,date_original
dime,＠ＤＩＭＥ,わが家に元自衛隊の爆発物探知犬がやってくる!? 引退した使役犬の譲渡活動に密着,https://news.yahoo.co.jp/articles/8b52b2a703710211e7d25010748cadd3dc7cc321,8/14(水) 21:40
dime,＠ＤＩＭＥ,【遠出の知恵】高速道路の渋滞も快適に乗り切れる「ACC」の活用法,https://news.yahoo.co.jp/articles/bb6f85bcaa211e5a6a5b171db7eceb576cf16209,8/14(水) 20:20
dime,＠ＤＩＭＥ,Galaxy AIの実用性は？最新折りたたみスマホ「Galaxy Z Flip6」はどう進化したのか,https://news.yahoo.co.jp/articles/295fd0a69dcf2df74c919f56e6abe9e9acf6ab7d,8/14(水) 19:45
dime,＠ＤＩＭＥ,10万円以下で買えるDAPに新時代の音を感じた「ポタフェス2024夏 秋葉原」探訪記,https://news.yahoo.co.jp/articles/699c5f543885435c71d2a909e6767e88cdca19a9,8/13(火) 21:40
dime,＠ＤＩＭＥ,累計100万本以上売れている男性用日傘「Wpc. IZA」、女性向けと全く違うポイントとは,https://news.yahoo.co.jp/articles/99ce8c72ae598143e5fe6801fa2bede022d97441,8/13(火) 20:40
dime,＠ＤＩＭＥ,【今日の簡単おつまみ】この楽しさはハワイ級!?これが「怠け貧者のポップコーンシュリンプ」だ！,https://news.yahoo.co.jp/articles/36fed25d89ce7d7400ae73ae0200a8f67d5d775e,8/13(火) 17:10
dime,＠ＤＩＭＥ,たったひと言で人間関係を変えることができる「言いかえ」表現の事例集,https://news.yahoo.co.jp/articles/54aef5ed89a97d93fca25c1986149cb8f7d05676,8/12(月) 21:20
dime,＠ＤＩＭＥ,キャンピングカーに走りも居住性も求めたい人におすすめのバンテック「ASTRARE GX4」,https://news.yahoo.co.jp/articles/d6470042a024b2b7cd8f1f3c35b6f1b701443199,8/12(月) 19:50
dime,＠ＤＩＭＥ,ついに日本国内でも利用可能に！緊急時に役立つiPhoneの衛星通信を試してみた,https://news.yahoo.co.jp/articles/4328fda67aae09f4bc8d310e6c21872d10d55ed2,8/12(月) 17:20
dime,＠ＤＩＭＥ,スタートから半年経った新NISAの利用実態、元本割れした人はどれくらいいる？,https://news.yahoo.co.jp/articles/bd249d830b717c78a5bc99726733b553dd44fb52,8/12(月) 8:20
dime,＠ＤＩＭＥ,痛くも痒くもない「糖尿病」がもつ本当の怖さとは？,https://news.yahoo.co.jp/articles/add5d6440e74dbb51c86d60f234ae07313b7cfa2,8/12(月) 7:40
dime,＠ＤＩＭＥ,「お金がない」と不安になってしまう人へ。人気VTuber・犯罪学教室のかなえ先生からアドバイス,https://news.yahoo.co.jp/articles/941fa7566d6668a5013bd5defd2eaba8c6dca92d,8/11(日) 22:41
dime,＠ＤＩＭＥ,スズキの新型「スペーシア」に加わった待望のクロスオーバーモデル「スペーシア ギア」を徹底分析,https://news.yahoo.co.jp/articles/0e58bce2b5cba129454230530abab6f7799cd502,8/11(日) 22:27
dime,＠ＤＩＭＥ,PS5が失速、事業構造の見直しを進めるソニーのゲーム事業,https://news.yahoo.co.jp/articles/8f88cac3fe6b62840b0293598cebc59b7929dd63,8/11(日) 21:59
dime,＠ＤＩＭＥ,「聴力の低下と認知症との関係」を補聴器後進国の日本人は知っておくべき,https://news.yahoo.co.jp/articles/1b6262ddb27bd709a45de9de47746d92eb61876a,8/11(日) 8:20
dime,＠ＤＩＭＥ,真夏のツーリングにおすすめ！冷却水を浴びながら走る新感覚グッズ「リキッドウインド」,https://news.yahoo.co.jp/articles/589d892e054074c51a6701e85e6f9598c99c8204,8/11(日) 7:40
dime,＠ＤＩＭＥ,マイナス金利政策解除後に「安全資産」と「リスク資産」の割合に変化はあったのか？,https://news.yahoo.co.jp/articles/f84ecfd3b75d755b8a85119d989caf39e93d865c,8/11(日) 7:20
dime,＠ＤＩＭＥ,発売が待ち遠しい！電動ポップアップルーフの「ジムニー」5ドアがカッコよすぎる!!,https://news.yahoo.co.jp/articles/63568f2bb536e50da28af20065153f8925908117,8/10(土) 21:42
dime,＠ＤＩＭＥ,自分を〝主人公〟だと考えることが人生にもたらす大きなメリット,https://news.yahoo.co.jp/articles/61f0f8417d9221da150b8b73a467525e0f29400c,8/10(土) 20:58
dime,＠ＤＩＭＥ,パリ五輪スポーツクライミング代表・森秋彩ロングインタビュー「クライミングは自分と向き合えるスポーツです」,https://news.yahoo.co.jp/articles/c0489298c90b455815b7bf3d66af1aced074a41f,8/10(土) 18:32
dime,＠ＤＩＭＥ,認知症グレーゾーンからのUターンをサポートしたお嫁さんのファインプレー,https://news.yahoo.co.jp/articles/6f377b076226bdf55a1be1d63b832ea4f7bf2aab,8/9(金) 21:20
dime,＠ＤＩＭＥ,関東大震災から100年が経った今「クルマの防災」について考える,https://news.yahoo.co.jp/articles/7538b183c076c6136ea2abb0651ff213f298074a,8/8(木) 21:20
dime,＠ＤＩＭＥ,家づくりのプロが解説！地震で倒壊する可能性がある家の特徴と対策,https://news.yahoo.co.jp/articles/e989beaefebfc34bffe8ed7d42eb11c7d8b5a364,8/8(木) 20:40
dime,＠ＤＩＭＥ,間違ってませんか？「つっぱり棒」や「非常食」の正しい備え方【家の防災対策】,https://news.yahoo.co.jp/articles/561f5d839422799c0b4befce62e510b7f38ffe63,8/8(木) 19:42
