ctgry,media_jp,title_pickup,title_articles,link_pickup,link_articles,date_original
domestic,TNCテレビ西日本,識者「キングメーカーは岸田氏」,【鈴木哲夫さん解説】総裁選“逆転劇”のウラ側「キングメーカーは岸田首相」石破新内閣には「小石河連合が再結集」そして麻生氏は　福岡,https://news.yahoo.co.jp/pickup/6514968,https://news.yahoo.co.jp/articles/861deb278200b715789453302e2fd4ec7319b1af,9/28(土) 11:24
domestic,毎日新聞,袴田さんの虚偽自白 県警の記録は,＜袴田巌さん再審＞「殺したのは私です」　警察が「王様」と誇った袴田巌さんの虚偽自白,https://news.yahoo.co.jp/pickup/6514961,https://news.yahoo.co.jp/articles/77b98bc2d4be2dfa2b6016a18c36a8e82069a1f9,9/28(土) 9:41
domestic,日テレNEWS NNN,石破氏勝利の裏側 ポイントを解説,【解説】石破新総裁“誕生のウラ側”…5回目の挑戦制す　勝敗のポイントは,https://news.yahoo.co.jp/pickup/6514959,https://news.yahoo.co.jp/articles/6ced96b9a82068326fa556f72e5f00f968e25fba,9/28(土) 9:14
domestic,毎日新聞,袴田さん 強いられた虚偽の自白,＜袴田巌さん再審＞「殺したのは私です」　警察が「王様」と誇った袴田巌さんの虚偽自白,https://news.yahoo.co.jp/pickup/6514956,https://news.yahoo.co.jp/articles/77b98bc2d4be2dfa2b6016a18c36a8e82069a1f9,9/28(土) 8:58
domestic,日テレNEWS NNN,総裁選で石破氏勝利 舞台裏を解説,【解説】石破新総裁“誕生のウラ側”…5回目の挑戦制す　勝敗のポイントは,https://news.yahoo.co.jp/pickup/6514955,https://news.yahoo.co.jp/articles/6ced96b9a82068326fa556f72e5f00f968e25fba,9/28(土) 8:40
domestic,日テレNEWS NNN,石破氏 党要職に森山氏の起用検討,自民・石破新総裁、党の要職に森山総務会長の起用を検討,https://news.yahoo.co.jp/pickup/6514950,https://news.yahoo.co.jp/articles/39ea3585548193b455de53353245bdff4a2ad5fe,9/28(土) 7:34
domestic,産経新聞,衆院選 11月10日の投開票有力視,石破茂総裁誕生で自民党内に強まる早期解散論、衆院選投開票は11月10日が有力視,https://news.yahoo.co.jp/pickup/6514945,https://news.yahoo.co.jp/articles/7e262fdc309d81e15cee92bbec7ded56db84470f,9/27(金) 23:09
domestic,BSS山陰放送,「選ばれると思わず」石破夫人涙,自民党新総裁に石破茂氏　地元で佳子夫人は大粒の涙、インタビュー中に石破氏本人から電話が…「今晩は何時になるか分からない」,https://news.yahoo.co.jp/pickup/6514935,https://news.yahoo.co.jp/articles/77f0fca593f02d5424bb6af72d846d0eb101b496,9/27(金) 21:40
domestic,日刊スポーツ,青木理氏、地上波出演を当面自粛,「劣等民族」発言の青木理氏「サンモニ」など地上波テレビ出演を当面自粛「僕なりのケジメ」,https://news.yahoo.co.jp/pickup/6514936,https://news.yahoo.co.jp/articles/897dd3604d4c9c003e146e63a9a427083bf1fb32,9/27(金) 21:36
domestic,テレビ朝日系（ANN）,野党各党「解散前に国会論戦を」,野党「解散前に国会論戦を」などと訴え　自民・石破新総裁選出に,https://news.yahoo.co.jp/pickup/6514928,,9/27(金) 20:37
domestic,TBS NEWS DIG Powered by JNN,小泉氏 敗戦も「感謝でいっぱい」,「感謝の気持ちでいっぱい」「新総裁支えていく」小泉氏　18票差で決選投票進めず　自民党総裁選,https://news.yahoo.co.jp/pickup/6514930,https://news.yahoo.co.jp/articles/73bc6963708d6e1055d4d00ecd7cb529033cc0f9,9/27(金) 20:11
domestic,毎日新聞,石破氏 衆院解散「なるべく早く」,石破茂新総裁、衆院解散は「なるべく早く」,https://news.yahoo.co.jp/pickup/6514926,https://news.yahoo.co.jp/articles/7e262fdc309d81e15cee92bbec7ded56db84470f,9/27(金) 19:04
domestic,読売新聞オンライン,石破茂氏の勝因 消去法的な支持,自民党総裁選、石破茂氏の勝因は「悪さ加減の選択」問われる実行力…組閣の多様性が課題,https://news.yahoo.co.jp/pickup/6514924,https://news.yahoo.co.jp/articles/ce8979b036338b0800bcf1791ca80e8e0b7a7d56,9/27(金) 18:52
domestic,産経新聞,加藤氏 推薦人20人勝利誓うも16票,総裁選最下位の加藤勝信氏、議員票16票で推薦人数に届かず　5人が引きはがしか,https://news.yahoo.co.jp/pickup/6514922,https://news.yahoo.co.jp/articles/101b4a96a8f790cffb1d799bb83625e74cbc5d24,9/27(金) 18:44
domestic,tenki.jp,台風17号 週明けに関東近づく恐れ,関東　明日28日にかけて沿岸部で激しい雨　週明けは台風17号が関東に近づく恐れ,https://news.yahoo.co.jp/pickup/6514917,https://news.yahoo.co.jp/articles/37397f35fbc2ee689bd488f119124a67168be9c7,9/27(金) 18:33
domestic,TBS NEWS DIG Powered by JNN,レバノン退避備え 自衛隊機派遣へ,レバノン情勢受け、自衛隊機を周辺国に派遣へ　木原防衛大臣が命令,https://news.yahoo.co.jp/pickup/6514919,https://news.yahoo.co.jp/articles/532d27a627a8c568c6ae5c0fd395622d03874ce6,9/27(金) 18:07
domestic,Yahoo!ニュース,中継 自民党の石破茂新総裁が会見,中継　自民党の石破茂新総裁が記者会見,https://news.yahoo.co.jp/pickup/6514909,,9/27(金) 17:43
domestic,FNNプライムオンライン（フジテレビ系）,石破氏が「大逆転」場内どよめき,麻生派の高市氏支援が逆効果?石破氏“大逆転”で涙の議員も…小泉氏陣営や旧岸田派が石破氏支持に流れたか,https://news.yahoo.co.jp/pickup/6514910,https://news.yahoo.co.jp/articles/62419dbd17f24e7bcf31e88a25c34304d47b3e64,9/27(金) 16:43
domestic,ABEMA TIMES,高市氏 敗因は「私自身の力不足」,高市早苗氏、初の女性総裁・総理ならず 安倍元総理の国葬儀から2年「いい報告ができなくて申し訳ない」涙こらえる,https://news.yahoo.co.jp/pickup/6514911,https://news.yahoo.co.jp/articles/e812a5eab9d96d45053deb8d02cd3113fcf3df32,9/27(金) 16:40
domestic,読売新聞オンライン,石破氏 安全で安心な国へ全身全霊,新総裁の石破茂氏「安全で安心な国へ全身全霊を尽くす」と決意,https://news.yahoo.co.jp/pickup/6514907,https://news.yahoo.co.jp/articles/04066d8ef984a7ecf1cc3323b7dd182485202bb3,9/27(金) 16:07
domestic,毎日新聞,自民新総裁の石破茂氏 どんな人物,自民新総裁の石破茂氏　元銀行員、安全保障や農政の論客,https://news.yahoo.co.jp/pickup/6514906,https://news.yahoo.co.jp/articles/c6f78ed348ffd0f8d69bda571f1537bcf9847ed4,9/27(金) 16:01
domestic,TBS NEWS DIG Powered by JNN,自民党 新総裁に石破茂氏を選出,【速報】「笑顔で暮らせる、安全で安心な国に」自民党の新総裁に石破茂氏　過去最多9人による激戦の結果,https://news.yahoo.co.jp/pickup/6514904,https://news.yahoo.co.jp/articles/6a2ce49eaeeab6dcf5611aa18af8e08018825d64,9/27(金) 15:26
domestic,Media info not found,中継 高市氏と石破氏の決選投票,自民党総裁選2024　投開票ライブ中継,https://news.yahoo.co.jp/pickup/6514899,,9/27(金) 14:13
domestic,共同通信,レバノン邦人退避 空自派遣を調整,邦人退避へ空自機派遣を調整　政府、レバノン戦闘激化で,https://news.yahoo.co.jp/pickup/6514893,https://news.yahoo.co.jp/articles/0723e6060835ce460f55476288fc9369a64dd7e6,9/27(金) 13:40
domestic,Media info not found,中継 自民党総裁選の投開票,自民党総裁選2024　投開票ライブ中継,https://news.yahoo.co.jp/pickup/6514889,,9/27(金) 12:42
domestic,時事通信,使用済み核燃料搬入 市民ら抗議,「核ごみ持ち込むな」市民ら抗議　運搬船接岸、恒久保管に不安　青森・むつ市,https://news.yahoo.co.jp/pickup/6514885,https://news.yahoo.co.jp/articles/dcd9fcdd71a266b355d7d8bf7441d77efccbeba7,9/27(金) 11:59
domestic,時事通信,自民総裁選「3強」に長所と短所,「3強」に長所と短所　経験・保守・刷新　自民総裁選,https://news.yahoo.co.jp/pickup/6514875,https://news.yahoo.co.jp/articles/40a768ad992edf47536aa75fc5eea1fbe8ad2a07,9/27(金) 9:52
domestic,読売新聞オンライン,袴田さん無罪判決 捜査機関に衝撃,証拠捏造を断罪した無罪判決、捜査機関に衝撃広がる…静岡県警幹部「正直納得いかない」,https://news.yahoo.co.jp/pickup/6514867,https://news.yahoo.co.jp/articles/7e1e40dc5655c24c140bf891183e109cf9706a33,9/27(金) 8:42
domestic,TBS NEWS DIG Powered by JNN,総裁選投票会場スマホ控えて なぜ,自民党総裁選投開票で“異例ルール”「会場でスマホ使用控えるよう呼びかけ」その理由は？候補者たちは前日に相次ぎ“重鎮詣で”【news23】,https://news.yahoo.co.jp/pickup/6514872,https://news.yahoo.co.jp/articles/f480db71ad1d713956b21983784f046840a2a047,9/27(金) 8:42
domestic,tenki.jp,関東甲信と東海 激しい雨の恐れ,今日27日　北・東日本に雨雲　関東と東海で激しい雨に　西日本は晴れて厳しい暑さ,https://news.yahoo.co.jp/pickup/6514866,https://news.yahoo.co.jp/articles/798c809ba88930323ec253a2482500ed533cc1f1,9/27(金) 8:03
domestic,テレビ静岡NEWS,袴田巌さんに姉 あんたが勝った,袴田さんの姉・ひで子さんが「あんたが勝った」と伝えると巖さんはかすかな声で…　再審で無罪勝ち取る,https://news.yahoo.co.jp/pickup/6514858,https://news.yahoo.co.jp/articles/5902269964f6bf1ba229513f45799bb2485c5a54,9/27(金) 6:58
domestic,産経新聞,麻生氏、総裁選で高市氏を支持へ,＜独自＞自民・麻生副総裁が高市氏支持へ、麻生派議員にも指示　1回目から,https://news.yahoo.co.jp/pickup/6514856,https://news.yahoo.co.jp/articles/385a69f027f45a2b77afa8d7d1186ce7c2c9e95f,9/27(金) 6:20
