media_en,media_jp,title_articles,link_articles,date_original
saga,佐賀新聞,久光スプリングスがジュニアアカデミー、佐賀県鳥栖市を本校に　本格始動前に体験会,https://news.yahoo.co.jp/articles/b3fb0bd78c786c6f05be1adf12f8477bbb699b33,11/21(火) 11:24
saga,佐賀新聞,ハンドボールの楽しさ知って　レッドトルネードSAGA　国スポ盛り上げへ小城市で教室,https://news.yahoo.co.jp/articles/0b94969d4fded7eb9d43c926a36b467522689be4,11/21(火) 8:17
saga,佐賀新聞,写真映え！赤く色づく「コキア」見頃　伊万里市川内野地区に1300本,https://news.yahoo.co.jp/articles/3374679145bab8c0e0bca7604aae8b095a980c54,11/21(火) 7:22
saga,佐賀新聞,10代娘の体触る　わいせつで逮捕の公立中学教諭、懲戒免職に　佐賀県教育委員会発表,https://news.yahoo.co.jp/articles/53933bed149dd6e6707bc65dd5178db29e84c087,11/20(月) 19:57
saga,佐賀新聞,酒気帯び運転の疑いで会社役員の50代男を逮捕　佐賀市,https://news.yahoo.co.jp/articles/5647d1a59dc27a1ac7d9c814df86c1adbd65be8a,11/20(月) 18:48
saga,佐賀新聞,投資詐欺の疑いで福岡県の30代男を逮捕　佐賀市の知人から294万円だまし取る　佐賀北署,https://news.yahoo.co.jp/articles/5e2c62dd34c90c9249fac00aa575503889fa2532,11/20(月) 18:17
saga,佐賀新聞,＜写真グラフ＞力と華、祭礼の場彩る　佐賀県伝承芸能祭,https://news.yahoo.co.jp/articles/c13f538b57bee12b46932c425b55d8a37a254944,11/20(月) 9:09
saga,佐賀新聞,大江海透投手、母校にプロ指名を報告　神埼清明高校卒、プロ野球ドラフト会議でオリックスから育成２位指名,https://news.yahoo.co.jp/articles/bd089df888100664fc3d24d155bbd34fca9cf1dc,11/19(日) 12:06
saga,佐賀新聞,「介護従事者こそ社会のヒーロー」　タレントのハリー杉山さんが佐賀県小城市で講演　さが介護・健康・福祉フェア,https://news.yahoo.co.jp/articles/542989744f85857951ed7688f797b29d6c72a176,11/19(日) 11:52
saga,佐賀新聞,無免許運転で追突事故、19歳少年が身代わりか　23歳の男逮捕　佐賀県白石署,https://news.yahoo.co.jp/articles/2bda29e6c572c54a42fdae35db04eaae352f7c65,11/19(日) 10:09
saga,佐賀新聞,踏切で列車と自動車が接触事故　唐津線で一時運転見合わせ、遅延や運休発生　18日夕、唐津市,https://news.yahoo.co.jp/articles/65c79c78f2a8ac5952274631cd9dd3244d58d795,11/18(土) 19:52
saga,佐賀新聞,SAGAサンライズパークでイルミネーション　初めてのクリスマス、12月25日まで　佐賀市,https://news.yahoo.co.jp/articles/656cbdf709a745d67ef87df3e13bc5d880794889,11/18(土) 17:06
saga,佐賀新聞,＜レットル佐賀＞ワクナガに快勝、2連勝　レットル佐賀 38―27 ワクナガ,https://news.yahoo.co.jp/articles/344a977ae293cf86fadaf9e6ab0409fe5acfdace,11/18(土) 16:17
saga,佐賀新聞,＜サガン鳥栖＞「創造、変化、前進続ける」川井健太監督と契約更新　2024シーズンも指揮,https://news.yahoo.co.jp/articles/a81742c684077508ed669f0b35a7df2f4ccb9770,11/18(土) 10:43
saga,佐賀新聞,佐賀県・天山で初冠雪を観測　今季一番の寒気,https://news.yahoo.co.jp/articles/d21bc8622795c00d98003c4fb4ef293ef5d76bb4,11/18(土) 9:43
saga,佐賀新聞,水路で発見の40代男性遺体、死因は溺死　鳥栖市,https://news.yahoo.co.jp/articles/4a1abf3277adc8be8c838757df4e7a143f1f91cb,11/17(金) 22:06
saga,佐賀新聞,＜サッカー・全国選手権佐賀大会＞佐賀東高校と佐賀商業高校、11月18日決勝　駅前不動産スタジアムで,https://news.yahoo.co.jp/articles/b6ebd4a42523cec620ca83afdda866343be52c4b,11/17(金) 18:17
saga,佐賀新聞,＜レットル佐賀＞4カ月ぶりホーム戦勝利で飾れ　11月18日ワクナガ戦　日本ハンドボールリーグ男子,https://news.yahoo.co.jp/articles/d90a1310137222df017e368a7c6fcbbf11a3fd6e,11/17(金) 18:02
saga,佐賀新聞,【速報】サガン鳥栖、川井健太監督の契約更新を発表,https://news.yahoo.co.jp/articles/c072d469da4959e55eb550a7dfa7bbc735af6f0b,11/17(金) 17:32
saga,佐賀新聞,大麻所持疑いの女子高生ら、不起訴　佐賀地検,https://news.yahoo.co.jp/articles/dbd8ce569c924b495d61f10d6588ab8bba82bacf,11/17(金) 17:03
saga,佐賀新聞,下校の列に車、佐賀市の71歳男性を在宅起訴　佐賀地検、過失運転致傷で,https://news.yahoo.co.jp/articles/6fcaeed66194b5ff8fde2357a84197f8f776c65a,11/17(金) 12:02
saga,佐賀新聞,ＡＩ活用作品ＯＫのＤＸ川柳コンテスト　佐賀県　著作権リスクも裾野拡大重視,https://news.yahoo.co.jp/articles/f079f5470a623c3ead159916d749656b584563a7,11/17(金) 11:22
saga,佐賀新聞,「後ろに怖か人がおるけん」同僚から150万円脅し取った疑い、男を逮捕　鳥栖署,https://news.yahoo.co.jp/articles/dd4002553ba3ce0d074f5113a3a8257f34734667,11/17(金) 10:02
saga,佐賀新聞,企業立地奨励金を365万円過大交付　鳥栖市が算定ミス　複数人での確認怠る,https://news.yahoo.co.jp/articles/ac936fc08a75a6152a16c6071e72f8492713749b,11/16(木) 18:17
saga,佐賀新聞,プレジャーボート転覆　男性1人病院搬送、1人が行方不明　佐賀県唐津市と長崎県松浦市の県境、鷹島肥前大橋の沖合で,https://news.yahoo.co.jp/articles/c0ad3d5261ce2f49a7aacea6b8c8446bd31100ca,11/16(木) 17:51
saga,佐賀新聞,窯元訪ねて、秋の唐津魅力満載　11月18、19日に「窯元ツーリズム」　販売や陶芸体験、交流など,https://news.yahoo.co.jp/articles/198be23560442690cb4d74b7a201132a5b7bca75,11/16(木) 17:46
saga,佐賀新聞,武雄センチュリーホテル、2025年春の営業再開目指す　改修工事開始,https://news.yahoo.co.jp/articles/4fe1e68665c547bf733246f183a35a8a867472bd,11/16(木) 12:02
saga,佐賀新聞,＜新型コロナ＞佐賀県内感染者、前週比30人減の76人　11月6〜12日,https://news.yahoo.co.jp/articles/b3426ca310ed2f1e6f222a533dad19108049dfe5,11/16(木) 11:27
saga,佐賀新聞,インフルエンザ流行、佐賀県が５シーズンぶり警報　「手洗いと換気、マスク着用を」,https://news.yahoo.co.jp/articles/0637780f6a9fe410a1228b029c857203241f359e,11/16(木) 9:16
saga,佐賀新聞,紅葉の名所、国名勝「九年庵」（神埼市）　11月15日から秋の一般公開,https://news.yahoo.co.jp/articles/40190b2ffd01335aea9b35ddc7b029a228dbe72f,11/15(水) 12:06
saga,佐賀新聞,利用者から300万円着服、佐賀県が事業者指定の一部効力停止処分　福岡県大川市の障害福祉サービス事業者,https://news.yahoo.co.jp/articles/2741ee259ada330de71259c1e593d8ae4c9ec5ce,11/15(水) 11:02
saga,佐賀新聞,島耕作、佐賀県副知事に 　県が人気漫画とコラボ　「経験生かして、次は公務員にチャレンジ」,https://news.yahoo.co.jp/articles/e5ee62a6ab992056e85318c9b9f30944db15d8e1,11/15(水) 9:54
saga,佐賀新聞,上峰町のふるさと納税返礼品の牛肉　20トン産地偽装　九州農政局、業者立ち入り検査で判明,https://news.yahoo.co.jp/articles/0d4a62f2984b56d9f78f31d88a60607352c12294,11/15(水) 7:39
saga,佐賀新聞,ブラックモンブラン生クリームパン、佐賀県でも販売開始　竹下製菓子会社,https://news.yahoo.co.jp/articles/d7402e55fbd46aa82eec0ca3136cedf831454ee3,11/14(火) 22:22
saga,佐賀新聞,オートバイ購入持ちかけ現金だまし取る　詐欺容疑で男逮捕　鳥栖署,https://news.yahoo.co.jp/articles/ffd6ef0e4c4b7c319274fc4a78568528ac045f3c,11/14(火) 12:03
saga,佐賀新聞,駅ナカ本屋“佐賀之書店”開店記念　今村翔吾さん、凪良ゆうさんのトーク＆サイン会　12月3日開催、11月20日締め切り,https://news.yahoo.co.jp/articles/2f714a755b60e1df830d94474c232f0058800525,11/14(火) 12:02
saga,佐賀新聞,上峰町の返礼品受け付け停止　楽天のふるさと納税サイト　産地偽装発覚受け,https://news.yahoo.co.jp/articles/ca10ecfaf1afff68636190587c4a8ac46ccbef69,11/14(火) 8:02
saga,佐賀新聞,わいせつ容疑で佐賀県立高校の男子生徒逮捕　佐賀北署　路上で歩行者に抱きつく,https://news.yahoo.co.jp/articles/2c939055ebe40b60030a539b1c226a5e8780ef46,11/14(火) 7:48
saga,佐賀新聞,「写真を持っている人はいませんか」嬉野・旧「笹屋旅館」再生へ思い　長崎県佐世保市から移住の宇田川さん、喫茶オープン目指す　佐賀県嬉野市,https://news.yahoo.co.jp/articles/a14505ad487d1f9a0f9771f2c79bba6ff911da31,11/13(月) 12:02
saga,佐賀新聞,「娘が足をなめられた」　武雄市の住居に侵入、10代女性にわいせつ容疑で男逮捕,https://news.yahoo.co.jp/articles/9ea57456398910a27a2af989f7b54151853a6ad1,11/13(月) 10:12
saga,佐賀新聞,「池干し」で魚の生態系学ぶ　トヨタソーシャルフェス　親子ら170人、環境保全の関心高め,https://news.yahoo.co.jp/articles/66b1aad11a4437f7e4f601dd892a1a4671518394,11/13(月) 9:48
saga,佐賀新聞,＜ハンドボール＞リーグ戦再開、白星で飾る　レットル佐賀 33−29 大同特殊鋼,https://news.yahoo.co.jp/articles/6284fb4889b41987836f43104e17eee69312e553,11/12(日) 12:02
saga,佐賀新聞,大型商業施設で20代女性のスカートの中を盗撮未遂、容疑で福岡県の20代男を逮捕　佐賀市,https://news.yahoo.co.jp/articles/f7944f19bb30717d86d91a249f74500ca6327cc7,11/12(日) 11:09
saga,佐賀新聞,＜サガン鳥栖＞堀米同点ゴールも、横浜Ｃの堅守に屈す　鳥栖1-3横浜FC,https://news.yahoo.co.jp/articles/d85817d51141a86dce8a63e7d27d04b57efd2d45,11/12(日) 11:02
saga,佐賀新聞,＜久光スプリングス＞ＮＥＣに完勝　久光３―０ＮＥＣ,https://news.yahoo.co.jp/articles/ef8691bf7f86fcd1506b9fe7abff3337d70aec8c,11/12(日) 10:27
saga,佐賀新聞,＜佐賀バルーナーズ＞千葉Ｊに完勝　佐賀95―76千葉Ｊ,https://news.yahoo.co.jp/articles/c36d470be1a25f9887b607199413e48e5b960041,11/12(日) 9:52
saga,佐賀新聞,酒気帯び運転で対向車に衝突、50代男性にけが負わす　危険運転致傷で70代男を逮捕　佐賀市,https://news.yahoo.co.jp/articles/b1af6f28c6f68672330e6c81e312b136802e397d,11/12(日) 8:33
saga,佐賀新聞,秋の夜空に色とりどりの大輪　伊万里湾大花火、観客魅了　４年ぶりに観客集めて実施　11日夜,https://news.yahoo.co.jp/articles/a7578891d4df577847a0e980f366633b3b00867c,11/11(土) 21:27
saga,佐賀新聞,アサヒビール鳥栖工場、操業開始を2029年に延期　資材価格高騰で「建設費２倍」に　博多工場は28年末まで操業延長,https://news.yahoo.co.jp/articles/2fdbaf8236c5f62a44070f2ea635464bc8181195,11/11(土) 13:57
saga,佐賀新聞,食堂「春駒」101年の歴史に幕　「皿うどん」世代超え愛され　牟田さん夫婦「やり切った」　佐賀市高木町,https://news.yahoo.co.jp/articles/0fd89dca5449e75c561c3f1118088206b177f121,11/11(土) 12:27
saga,佐賀新聞,【訃報】元衆議院員 保利耕輔氏死去,https://news.yahoo.co.jp/articles/44e6096a5d501a314269e2c18ba9324a31f0f6e2,11/10(金) 20:17
saga,佐賀新聞,アサヒビール鳥栖工場、操業開始時期を３年延期　費用の大幅高騰で　2026年から2029年に　博多工場は操業延長,https://news.yahoo.co.jp/articles/f562ee07c299444a7767608f879c287653772e8e,11/10(金) 17:37
saga,佐賀新聞,人気作の原画、色鮮やか　絵本作家・こみねゆらさん、佐賀市の「子どもの本屋ピピン」で作品展,https://news.yahoo.co.jp/articles/a27931830c9fea4101c16b054fe09a8fc248700b,11/10(金) 17:17
saga,佐賀新聞,東京で佐賀への移住ＰＲ　佐賀県主催　市町や企業ブース出展,https://news.yahoo.co.jp/articles/3ee19a39511fbc59199fac318aaed21086c4cd79,11/10(金) 16:32
saga,佐賀新聞,武雄市で保護猫譲渡会　11月14日、木寺石油　20匹の引き取り先募る,https://news.yahoo.co.jp/articles/377e241f5acda72223ee204f2f1a4baad8cb8048,11/10(金) 12:17
saga,佐賀新聞,プラネタリウム100年の歴史たどる　佐賀県立宇宙科学館（武雄市）で企画展　機材の進歩、触れて体験,https://news.yahoo.co.jp/articles/f2ad24915ad6b005084418700b5bd69430a5538f,11/10(金) 12:06
saga,佐賀新聞,秋のヒマワリ満開　みやき町山田地区　約10万本が咲き誇る　佐賀県,https://news.yahoo.co.jp/articles/ab5927dbe13a1e182a6f71a68170873759fb49db,11/10(金) 10:06
saga,佐賀新聞,ふるさと納税返礼品の和牛　「佐賀県産」と産地偽装　福岡県久留米市の業者、県内も影響,https://news.yahoo.co.jp/articles/da13cec185f59260a14fafca3268f714cf5683f7,11/10(金) 8:46
saga,佐賀新聞,江北小学校の給食に金属部品混入　健康被害の報告なし　江北町教育委員会発表,https://news.yahoo.co.jp/articles/3b14d8e1c0daff1046329da111079c2dc7de0815,11/10(金) 7:48
saga,佐賀新聞,親から子へ勇気つなぐ　水没車から高齢男性救出→警察官息子に引き継ぎ　鳥栖署、久留米市の男性に感謝状,https://news.yahoo.co.jp/articles/9df201969da3cec6e6863261dfc56519cf684b1e,11/9(木) 8:17
saga,佐賀新聞,【速報】＜佐賀バルーナーズ＞広島に敗れる　佐賀61―80広島,https://news.yahoo.co.jp/articles/451bc27dffd6672c308fe3cc9246dc4fa18a1edc,11/8(水) 21:16
saga,佐賀新聞,酒気帯び運転の疑いで介護職員逮捕　鳥栖署,https://news.yahoo.co.jp/articles/d58fc03592e7c0e111efbb2dac5724f01130a63e,11/8(水) 19:02
saga,佐賀新聞,高校生に大麻を密売、容疑で23歳会社員の男逮捕　佐賀南署,https://news.yahoo.co.jp/articles/18ee3d1bfe39664c3bba925262a39312664d0ea3,11/8(水) 15:02
saga,佐賀新聞,若基小学校給食のご飯にさびた金属片混入　健康被害の報告なし　佐賀県基山町,https://news.yahoo.co.jp/articles/de799d744a6a42fe34aba7a0f036431736aec1f7,11/8(水) 12:06
saga,佐賀新聞,「日本に残るためには保釈金が必要」　中国警察などかたるニセ電話詐欺　佐賀市の女性、1800万円被害,https://news.yahoo.co.jp/articles/f2f17f00d45c1f50067611360a72b03e365526f6,11/8(水) 8:22
saga,佐賀新聞,11月8日は立冬　カモ飛来、寒さの予感　佐賀市の嘉瀬川に,https://news.yahoo.co.jp/articles/13d71b2a7adfa8214382767664679d62c48385c8,11/8(水) 7:39
saga,佐賀新聞,「あたたかく迎えてくれた」　佐賀バルーンフェスタ参加のウクライナチーム　平和へ「ひとつの空、目指そう」,https://news.yahoo.co.jp/articles/ca818a4b6c5c9440f4eaf19c1d82613d3f01b672,11/7(火) 12:02
saga,佐賀新聞,唐津市の空き家に放火、容疑で男逮捕　唐津署,https://news.yahoo.co.jp/articles/9196f4326f4bcd989744dd38112e721adc6ddf2b,11/7(火) 9:02
saga,佐賀新聞,佐賀舞台の映画「つ。」　制作スタッフが山口祥義知事訪問　海外で高評価、11月10日公開,https://news.yahoo.co.jp/articles/9d082ce4833d15153d96f569c400c10ed296937d,11/7(火) 8:51
saga,佐賀新聞,「同意の上でやった」　たばこを男性の腕に押しつけ、容疑で58歳女逮捕　佐賀南署,https://news.yahoo.co.jp/articles/2d1df0b8f0969b38c810beae1d95d611d4a25bc5,11/6(月) 22:02
saga,佐賀新聞,「戦争のせいで銀行が機能せず…」パキスタン在住の米国人を装う詐欺　佐賀市の50代女性が被害,https://news.yahoo.co.jp/articles/75f21ad164ae73ec25f2ff2d6f0fef780cf9a2dc,11/6(月) 19:54
saga,佐賀新聞,「きれいな砂場で遊んで」　こども園の砂場を抗菌化、佐賀県建設業協会青年部が「クリーン作戦」,https://news.yahoo.co.jp/articles/273eed0893e7413898fa6d2312f24a587743f660,11/6(月) 17:02
saga,佐賀新聞,佐賀バルーンフェスタ、白熱「キー・グラブ・レース」　68機、景品目指し奮闘　ドミニク選手（イギリス）唯一手に,https://news.yahoo.co.jp/articles/8f3ad90c42cf6b541a4e2699143d3fba276669e3,11/6(月) 12:24
saga,佐賀新聞,「足ブルブルだよ」江頭2:50さん、念願のフライト！　「呼ばれないから、お金払って普通の参加者として出場」　佐賀バルーンフェスタ,https://news.yahoo.co.jp/articles/9545ac022bb89416ce85ec314047012579dbcf31,11/5(日) 9:54
saga,佐賀新聞,唐津くんち、翌日祭で幕　3日間で41万人が堪能,https://news.yahoo.co.jp/articles/a54e289d0479e6c904e21ca3136d3932a1075efb,11/5(日) 9:32
saga,佐賀新聞,「子どもの時の記憶の何倍もきれい」　夜間係留、幻想の炎　バルーンフェスタ　5日、最終日,https://news.yahoo.co.jp/articles/bdb800c79d61c39a121103eacd687b096e0aba48,11/5(日) 8:48
saga,佐賀新聞,佐賀バルーナーズ　秋田ノーザンハピネッツに惜敗　65ー66,https://news.yahoo.co.jp/articles/79de0030a33ff5b7b7eb18474b3475bd2aeb82b1,11/4(土) 18:27
saga,佐賀新聞,佐賀競馬のアイドルになりませんか？　「大人の青春」コンセプト、20歳以上の女性が対象,https://news.yahoo.co.jp/articles/3d96424229c533e315a350be4a833aee2d6176b4,11/4(土) 11:52
saga,佐賀新聞,唐津くんち、「翌日祭」始まる　曳山14台が旧城下町を巡る,https://news.yahoo.co.jp/articles/a0a8701681e1faa744f91d10fa54e44f0520df19,11/4(土) 10:18
saga,佐賀新聞,佐賀の秋、熱気　「唐津くんち」「バルーンフェスタ」に37万人歓声,https://news.yahoo.co.jp/articles/5c1f86ab0ef7d0245a2edffd5c28f102b7a2b967,11/4(土) 6:57
saga,佐賀新聞,佐賀バルーンフェスタ　交通渋滞で競技開始遅れる　3日午前　「公共交通機関での来場を」大会広報が呼びかけ,https://news.yahoo.co.jp/articles/c91c3abde931971266e01417d1c7cc2a45a4e5f0,11/3(金) 11:37
saga,佐賀新聞,唐津くんち、御旅所神幸始まる　「エンヤ」「ヨイサ」曳山14台が西の浜の御旅所へ,https://news.yahoo.co.jp/articles/0b3750df0f1aa9a13e4181e0e748b68dfba6277f,11/3(金) 10:02
saga,佐賀新聞,唐津くんち「宵曳山」で幕開け　豪華絢爛な14台の曳山、旧城下町を巡行,https://news.yahoo.co.jp/articles/e5b8177e1103b5db97e175a337c5d3432157f571,11/2(木) 19:42
saga,佐賀新聞,16歳未満とみだらな行為、容疑で専修学校教員を逮捕　佐賀南署,https://news.yahoo.co.jp/articles/ea6ade58f046db8ae803f45d89ca37006cbd573a,11/2(木) 17:02
saga,佐賀新聞,知人女性にプライベート画像を拡散すると脅し、強要　容疑で福岡の20代男を逮捕　鳥栖署,https://news.yahoo.co.jp/articles/8c3bd9bf76b2b8a69bf02328916af9afd12d9569,11/2(木) 15:46
saga,佐賀新聞,上峰町のふるさと納税返礼品、産地偽装　シャインマスカット、長野・岡山産を「九州産」　仲卸業者、独断で,https://news.yahoo.co.jp/articles/6163e7e68d92d5550bfe8f2304295dcbbca706af,11/2(木) 10:22
saga,佐賀新聞,直木賞作家・今村翔吾さんが佐賀駅に書店　12月3日開店、2020年3月以来の「駅ナカ本屋」復活,https://news.yahoo.co.jp/articles/b0ce345fb3e5c57b5c50502a4cfc657103fd750f,11/2(木) 10:17
saga,佐賀新聞,信号機に大型トラックが衝突、根元から折れる　佐賀県みやき町の県道交差点,https://news.yahoo.co.jp/articles/d2955046bf578f7667f313a5adcb55b1c693cc53,11/2(木) 10:16
saga,佐賀新聞,「客の女性が抱きつかれた」鹿島市の商業施設で不同意わいせつ疑い　46歳男を逮捕　鹿島署,https://news.yahoo.co.jp/articles/6f8ee0e15784dd2a7d07c2d2d5c6d3eb4bc23125,11/2(木) 10:12
saga,佐賀新聞,世界の気球、佐賀再来　バルーンフェスタ開幕　４年ぶり海外勢参戦,https://news.yahoo.co.jp/articles/062f02cf02ddebcf52721d85ae0504f710d03eec,11/2(木) 9:32
saga,佐賀新聞,佐賀インターナショナルバルーンフェスタが開幕　カラフルな気球が大空へ,https://news.yahoo.co.jp/articles/f30348c4653bcedf5aec58efb73f196e7f0051eb,11/1(水) 7:24
saga,佐賀新聞,佐賀県内の女子高校生ら大麻所持　容疑で2人逮捕 佐賀南署,https://news.yahoo.co.jp/articles/8900444ba78cc6e9e030ba31a80fa3a495f6c55b,10/31(火) 19:02
saga,佐賀新聞,サガ・ライトファンタジー、佐賀市で始まる　バルーンフェスタ前夜祭,https://news.yahoo.co.jp/articles/127182be53f4be2e423c47666b42606332a941fd,10/31(火) 18:54
saga,佐賀新聞,「日本の生活に疲れた」小城署に自ら出頭　不法残留の疑いでベトナム国籍の男逮捕,https://news.yahoo.co.jp/articles/2648c4a1e91b549d9be8df93f7f0f54866172459,10/31(火) 17:51
saga,佐賀新聞,AI開発「ハイレゾ」玄海町に進出　 旧有徳小校舎をデータセンターに,https://news.yahoo.co.jp/articles/9c31250023f7daf0bad16b6a9d869cda17c8375f,10/31(火) 17:48
saga,佐賀新聞,アニメキャラのかかしなどずらり！ 　バルーンフェスタ来場者もてなし　佐賀市のバルーン佐賀駅北,https://news.yahoo.co.jp/articles/804c639be87da91e7516542dd2f91cd0d3af8157,10/31(火) 15:42
saga,佐賀新聞,全国障害者スポーツ大会、佐賀にバトン　鹿児島大会閉幕、2024年は県内で,https://news.yahoo.co.jp/articles/5c172fb0fdd6acb7844dced565c6534b0de3fae8,10/31(火) 8:32
saga,佐賀新聞,「パワハラ認められず」東明館高の野球部元監督　調査結果を公表,https://news.yahoo.co.jp/articles/a00cb6bd51d076ed594b8874c0c07aade7a00a41,10/31(火) 7:57
saga,佐賀新聞,唐津神社で本殿祭　唐津くんちの成功と安全祈る,https://news.yahoo.co.jp/articles/dde30008bfd7bf932b1d83c3f5d1b90a3197700e,10/30(月) 20:12
saga,佐賀新聞,武雄アジア大学「学びの選択肢増やす」設置目的、まちづくり構想説明 シンポジウム,https://news.yahoo.co.jp/articles/3aedfb39ee1b9a2298de73bc6eb0dc9e5e326396,10/30(月) 11:48
saga,佐賀新聞,＜佐賀バルーナーズ＞渋谷に競り勝ち３連勝　佐賀74―68渋谷,https://news.yahoo.co.jp/articles/95f8ab0ab5a8443044a6d8114335b5408e2a2341,10/30(月) 8:17
saga,佐賀新聞,＜久光スプリングス＞開幕４連勝　ストレートでアランマーレ（山形）下す,https://news.yahoo.co.jp/articles/fefc612795b92586ec7907671dae5b4d56572e05,10/30(月) 7:13
saga,佐賀新聞,＜生き物ヒトとなり＞（81）ススキ　現代の救世主か、侵略者か,https://news.yahoo.co.jp/articles/f83d60b699b5014200f54f6008fc203354feb19b,10/29(日) 12:22
saga,佐賀新聞,唐津くんち絢爛豪華に　曳山14台に町人文化の粋　11月2日から3日間,https://news.yahoo.co.jp/articles/218b89870f99eb930304b61f54662eb61c65550d,10/29(日) 12:18
saga,佐賀新聞,【動画】日本一奪還目指し　佐賀県沖の有明海でノリ種付け,https://news.yahoo.co.jp/articles/e261dd58f74bb2ea812b62c021de5ac8a532549c,10/29(日) 10:19
saga,佐賀新聞,有田工業高校が最優秀賞に　佐賀県高校総合文化祭、新聞コンクール,https://news.yahoo.co.jp/articles/b3b1575733c53d05d581ef2f22eb4b8155bb9a73,10/29(日) 10:18
saga,佐賀新聞,佐賀バルーナーズがサンロッカーズ渋谷に快勝　今季初の連勝　佐賀80−59渋谷　バスケットボール・B1リーグ,https://news.yahoo.co.jp/articles/679e03f3c5df6eb4016935a2b7723ca2f6e0dfec,10/28(土) 21:32
saga,佐賀新聞,唐津くんち動画を渋谷センター街で上映！　名場面を大型ビジョンで　10月29日まで,https://news.yahoo.co.jp/articles/f4ddd3428f64d63985a2c803f86d28abad4608d1,10/28(土) 21:12
saga,佐賀新聞,羽生結弦さん佐賀公演の日程発表　1月12、14日にSAGAアリーナで,https://news.yahoo.co.jp/articles/2f6cf86967f51814602f4db07d1aa7416821063f,10/28(土) 17:46
saga,佐賀新聞,佐賀空港利用者1千万人突破　開港25年　東京から帰省の三木さんに記念品,https://news.yahoo.co.jp/articles/639dce3e87c162b9c6579217d82d15dcab323d27,10/28(土) 12:22
saga,佐賀新聞,＜サガン鳥栖＞数的不利も名古屋と分ける　来季もJ1確定　鳥栖１−１名古屋,https://news.yahoo.co.jp/articles/4c46c83fb4826f73df11faa0ad20a3bd81b6f90f,10/28(土) 10:06
saga,佐賀新聞,佐賀の高校生が人工衛星開発　最終試験クリア、2024年夏宇宙へ　手のひらサイズ、アイデア結集,https://news.yahoo.co.jp/articles/1229b18264cf43049ff040bc280a4ebe06f2bf7d,10/28(土) 9:46
saga,佐賀新聞,佐賀県警の警視、自転車で通勤中に歩行者と事故　小城市、70代男性が重傷,https://news.yahoo.co.jp/articles/94c0566caedd9986a80d70b0e63c249c0d89b115,10/27(金) 12:02
saga,佐賀新聞,SNSで副業話、小城市の30代女性が詐欺被害　小城署発表,https://news.yahoo.co.jp/articles/413f136f54c1dd7d97d89bf6789041477fb7c83f,10/27(金) 10:02
saga,佐賀新聞,佐賀県内に竜巻注意報　佐賀市内でビー玉大のひょう確認,https://news.yahoo.co.jp/articles/0b402a257d112cc0c7d2b282a044e7dac8fe6519,10/27(金) 9:19
saga,佐賀新聞,＜見どころサガン鳥栖＞相手の堅守崩し勝ち点３を　10月27日、敵地で名古屋グランパス戦,https://news.yahoo.co.jp/articles/ddbccdef3634ede23243572ba53ffba8b3108750,10/26(木) 18:02
saga,佐賀新聞,佐賀バルーナーズ2勝目　信州ブレイブウォリアーズの追い上げ振り切る　佐賀80―74信州,https://news.yahoo.co.jp/articles/c73b9750820177420092ac52ca343d5d93afd8b0,10/26(木) 9:02
saga,佐賀新聞,「がっかり…」嬉野温泉駅前の温泉「手湯」のオブジェ壊れる　嬉野市が被害届提出,https://news.yahoo.co.jp/articles/4dc917a9186c3a98431e1a1ba2bf81d362e9d18a,10/26(木) 8:02
