media_en,media_jp,title_articles,link_articles,date_original
utyv,UTYテレビ山梨,国道300号＜本栖みち＞　落石による通行止め　3日ぶり解除　身延町,https://news.yahoo.co.jp/articles/039f3157d10cb403e3658609c170fb1369b57c4b,11/23(木) 12:16
utyv,UTYテレビ山梨,首都圏甲府会の総会でめざましい活躍をした児童・生徒らを表彰　子どもたちが全国や世界に羽ばたくよう後押し,https://news.yahoo.co.jp/articles/17bdb60b8e78477179415339e1a433c70cc9090c,11/23(木) 12:12
utyv,UTYテレビ山梨,妹と手話で話す姿に「あれ変だよね。魔法使いみたいだよね」差別問題を考える切っ掛けは一言　実体験をもとに高校生の弁論全国大会で最高賞,https://news.yahoo.co.jp/articles/d9c5c3b6101379b79b30eff38e1fc56e5e200982,11/23(木) 9:02
utyv,UTYテレビ山梨,『これはね、手話って言って私と妹が話すための大切な言葉なの』　高校生の主張で最高賞　前橋真子さんの主張の全文,https://news.yahoo.co.jp/articles/81132ab927a821f6e5687f6573ebb55f00c44877,11/23(木) 9:02
utyv,UTYテレビ山梨,「いい夫婦の日」　川柳コンテストの入賞作品から読み解く　イマの夫婦像,https://news.yahoo.co.jp/articles/bcc6120dc088d5e5c3d12f2b90c2e0fb5ec60511,11/22(水) 21:44
utyv,UTYテレビ山梨,県内の全市町村で小中学校の給食費の無償化を求め要望書　市民団体が県に提出,https://news.yahoo.co.jp/articles/073e73dbb0d667efe2b77a33a813ba31d40590bb,11/22(水) 21:21
utyv,UTYテレビ山梨,あすは暖かいが週末は気温が下がる　寒暖差で体調崩さないよう気をつけて　気象予報士が解説,https://news.yahoo.co.jp/articles/29a7d375db9ef3cf2f18a090cea3f6256106d208,11/22(水) 20:57
utyv,UTYテレビ山梨,11月22日は「いい夫婦の日」　多くのカップルが婚姻届け　晴れの日を祝う,https://news.yahoo.co.jp/articles/072576a6f3be7b580fcc9ba2534bbd595827cb01,11/22(水) 20:46
utyv,UTYテレビ山梨,市街地上空で3機編隊飛行　アメリカの軍用機の空中給油か　甲府市で3日連続の目撃,https://news.yahoo.co.jp/articles/3ecb50914b26324cc93b290c2378660b0373965f,11/22(水) 20:01
utyv,UTYテレビ山梨,「ブランド価値おとしめる」ふるさと納税の返礼品　県産フルーツは1割から2割が低評価　山梨県が対策へ,https://news.yahoo.co.jp/articles/62c81f98ea0e8c33f7aeb28c5c97c4201774ec7e,11/22(水) 19:11
utyv,UTYテレビ山梨,“医師プログラム”　違約金は違法と東京都の団体が県を訴え　知事「違約金は当然」争う姿勢　山梨,https://news.yahoo.co.jp/articles/23eb33e749fb2e54c7ca2c36864779578ad504e5,11/22(水) 19:02
utyv,UTYテレビ山梨,「何かできることはないかと」果物盗難防止に貢献　3団体に感謝状　被害額は昨年比6割減,https://news.yahoo.co.jp/articles/08ac7d769c28f1a5e15e29c9512e4963294bc6cf,11/22(水) 19:02
utyv,UTYテレビ山梨,高級腕時計31点、およそ2500万円相当を強盗　見張り役の男に判決　懲役4年6か月,https://news.yahoo.co.jp/articles/3fd148cf84cfb6467e3526bed85d59bfeb592bf7,11/22(水) 18:42
utyv,UTYテレビ山梨,大相撲九州場所11日目　竜電（甲府市出身）が8勝目!　今年最速の勝ち越しを決める,https://news.yahoo.co.jp/articles/8a49f0c4b3178e5ad59769ce4fcdddc5bda85fab,11/22(水) 17:42
utyv,UTYテレビ山梨,電子部品製造会社でデジタルツール体験ワークショップ　利益率向上の成功事例を紹介,https://news.yahoo.co.jp/articles/94d43ec2f8a5e58c3b615726ddf3a20dc1b2db5f,11/22(水) 17:36
utyv,UTYテレビ山梨,ガソリン価格173.3円　4週連続の値上がり　政府からの補助金の減額が原因　山梨,https://news.yahoo.co.jp/articles/aa0aba40ebccb6490d96422ad8e4818d631ba6a7,11/22(水) 17:04
utyv,UTYテレビ山梨,「県全体の日本酒品質向上へ」酒造本格化前の研修会　杜氏が注意点などを学ぶ,https://news.yahoo.co.jp/articles/4ba17cacff46032b42e4810ea7bcadc1e1ec5a52,11/22(水) 17:04
utyv,UTYテレビ山梨,富士山登山鉄道構想　知事自ら出席しての地元住民への説明会始まる　山梨県,https://news.yahoo.co.jp/articles/362bd09c5d9e0e55204c61a1c7f6b1810cb9661d,11/22(水) 12:11
utyv,UTYテレビ山梨,県の「医師キャリア形成プログラム」の違約金は違法　東京都の消費者団体が提訴　山梨,https://news.yahoo.co.jp/articles/3c8098652b458800705cafd09b470ec77c868e95,11/22(水) 12:06
utyv,UTYテレビ山梨,「自家用車のドアで」機械に手を挟まれた社員の労災事故を隠すため虚偽説明の疑い　社長など書類送検,https://news.yahoo.co.jp/articles/b4224a0aa3b2afbaffd31851ec2074b62c8a42fb,11/22(水) 10:48
utyv,UTYテレビ山梨,重体だった90歳の男性が死亡　市道の交差点で自転車に乗って軽乗用車と衝突,https://news.yahoo.co.jp/articles/fd52ef55c6649233ee5ced92db35077ea7726fea,11/22(水) 0:24
utyv,UTYテレビ山梨,空調設備工事で入った大学からデジタルカメラを盗んだ疑い　建設業の男を逮捕,https://news.yahoo.co.jp/articles/2592ba9297c624cffd7f8f905afcb1859aae8d2a,11/21(火) 22:21
utyv,UTYテレビ山梨,「育児の悩みを話せる場がない」　乳幼児育てる親のホンネ　人口減少対策一環の座談会で知事と意見交換,https://news.yahoo.co.jp/articles/6f5743ebc593255ad0f91aafeaa5a2b3271aa309,11/21(火) 22:11
utyv,UTYテレビ山梨,学校にオレンジ色のすだれ　閉校した小学校の校舎で「ころ柿」作り　今が最盛期　山梨,https://news.yahoo.co.jp/articles/1f759e49ebd9d496db00c69644f7525f027faa19,11/21(火) 22:02
utyv,UTYテレビ山梨,甲府市SDGs推進パートナー交流会　新たな事業の可能性などアイデアを出し合う,https://news.yahoo.co.jp/articles/89bb2bb3061b422a97be9ef7bc8f5c4e98715910,11/21(火) 21:57
utyv,UTYテレビ山梨,手話による狂言の公演会　県立ろう学校の子どもたちが日本の伝統芸能に触れ表現を学ぶ　山梨,https://news.yahoo.co.jp/articles/4bf1549f7c7476eebaac4971b76c7454f738af87,11/21(火) 21:42
utyv,UTYテレビ山梨,LED80万球で「スイスの森の冬景色」　県内最大級イルミネーション始まる　山梨・ハイジの村,https://news.yahoo.co.jp/articles/164d962c4565bbc1825ad99e3ef93b302715442e,11/21(火) 21:38
utyv,UTYテレビ山梨,「散歩には最高ですね」公園内で赤や黄色の紅葉をゆったりと　山梨・桂川ウェルネスパーク,https://news.yahoo.co.jp/articles/660244c8812e12d32b2c18c9779830c0d05e056d,11/21(火) 21:33
utyv,UTYテレビ山梨,災害級の大雪に備える　緊急車両の通行ルートの確保訓練　立往生した車両を小型重機で移動,https://news.yahoo.co.jp/articles/99b5ac4be0f6f049af14665d8d1e8226ea0e54e9,11/21(火) 19:57
utyv,UTYテレビ山梨,アメリカの軍用機が市街地上空で空中給油か　県内で目撃相次ぐ　山梨,https://news.yahoo.co.jp/articles/767505e5ad750ba1bd88294681e0d6c3784c6571,11/21(火) 19:54
utyv,UTYテレビ山梨,「精神障害は責任能力に影響はなかった」精神鑑定を行った医師が証言　甲府殺人放火事件裁判,https://news.yahoo.co.jp/articles/556a97fb014e435b97d67aada6583eb2c450332b,11/21(火) 18:53
utyv,UTYテレビ山梨,市道の交差点で軽乗用車と衝突　自転車の90歳の男性が意識不明の重体,https://news.yahoo.co.jp/articles/df8a6fe55b70a8e674d8080dbe96af398c454eda,11/21(火) 18:32
utyv,UTYテレビ山梨,大相撲九州場所10日目　竜電（甲府市出身）は玉鷲と取組　6勝3敗同士の結果は,https://news.yahoo.co.jp/articles/90573390775b1bf03b79cf843ef134c8f35f6bb6,11/21(火) 18:02
utyv,UTYテレビ山梨,「一部に弱めの動きがみられるものの持ち直し」県内景気判断を6か月連続で据え置き　日本銀行甲府支店,https://news.yahoo.co.jp/articles/f47b81f803d49105cd2ba4da2bee3566189535f1,11/21(火) 12:22
utyv,UTYテレビ山梨,元日のニューイヤー駅伝　初出場の「富士山の銘水」が県庁を訪問　健闘を誓う　山梨,https://news.yahoo.co.jp/articles/a5a696ce225f59e31b8d2cbccc9e12bb42939728,11/21(火) 12:14
utyv,UTYテレビ山梨,「クマ2頭がうろついている」　深夜の湖畔沿いの県道で目撃情報,https://news.yahoo.co.jp/articles/fcd4c20b8366c44a533f6431a961cfcfba79f56b,11/21(火) 11:33
utyv,UTYテレビ山梨,高校バスケ全国大会ウインターカップ　創部2年の自然学園＆インターハイ優勝の日本航空　その強さに迫る,https://news.yahoo.co.jp/articles/2658e3480b7abf034e355ed2f6a3715dbbf2235d,11/20(月) 20:32
utyv,UTYテレビ山梨,高校バスケ日本一を決めるウインターカップ　組み合わせ決まる,https://news.yahoo.co.jp/articles/faa2d4034aceb36706e39b2d00a175437b16e294,11/20(月) 20:29
utyv,UTYテレビ山梨,届出量の20倍の廃材を保管　約175分の1まで減らすよう解体業者に改善命令　山梨県,https://news.yahoo.co.jp/articles/30c8ea4d6a5f25500f5b37ea9b4b5f868d3b4dea,11/20(月) 20:21
utyv,UTYテレビ山梨,「希望しない就職の決定で絶望感、交際を断られ怒りを一気に」臨床心理士が証言　甲府殺人放火事件裁判,https://news.yahoo.co.jp/articles/d52f166949aae8ee46942014c5d0b0772f87cd56,11/20(月) 19:09
utyv,UTYテレビ山梨,2032年開催の国民スポーツ大会　準備委員会設立　テーマは持続可能な大会運営,https://news.yahoo.co.jp/articles/f2d857b1e85f6c7530230688a16769ab0f46a2a5,11/20(月) 19:04
utyv,UTYテレビ山梨,新ご当地ラーメン「やまなし源水ラーメン」販売開始　ブランド魚「富士の介」や甲州地どりでダシ,https://news.yahoo.co.jp/articles/65bb749cf0378be2476d119900a13ce40f62e82c,11/20(月) 19:04
utyv,UTYテレビ山梨,国道300号で大規模な落石　現場周辺9kmが全面通行止め　岩盤の劣化の可能性,https://news.yahoo.co.jp/articles/ffe120613037c30ef79048c7db78d936524d5bf0,11/20(月) 18:39
utyv,UTYテレビ山梨,キャッシュレスキャンペーン開始　4種のキャッシュレス決済全部使うと最大2万円分ポイント還元　山梨市,https://news.yahoo.co.jp/articles/4c7b39cee401cce846e81000494a8b38439170de,11/20(月) 18:34
utyv,UTYテレビ山梨,大相撲九州場所9日目　竜電（甲府市出身）の結果は,https://news.yahoo.co.jp/articles/754ef92584ae7ce8120c8994b7a7bdfb1e428bd9,11/20(月) 17:51
utyv,UTYテレビ山梨,きょうは県民の日　無料のリニア見学センター　多くの子どもたちで賑わう,https://news.yahoo.co.jp/articles/b016b3f789d81285e4d9a499c2f753a608b467ba,11/20(月) 17:08
utyv,UTYテレビ山梨,“農泊”　宿泊しながら農業体験　参加者のストレス軽減効果を報告,https://news.yahoo.co.jp/articles/bb7b0cfe985a84a684d860b54acfa50d56b45a0f,11/20(月) 17:08
utyv,UTYテレビ山梨,社会運動などで奮闘した山梨ゆかりの3人の女性に学び女性活躍の輪を広げる会が発足,https://news.yahoo.co.jp/articles/b710ca0403050b73357b8f29310ba9e6a801a164,11/20(月) 17:06
utyv,UTYテレビ山梨,神社のさい銭箱から8000円を盗んだ疑い　44歳の男を逮捕,https://news.yahoo.co.jp/articles/d7e437129e1af82130f6ba5a3b7f013c3a8a23d6,11/20(月) 16:06
utyv,UTYテレビ山梨,国道300号が落石で通行止め　区間拡大【20日午後1時55分現在】　山梨・身延町,https://news.yahoo.co.jp/articles/a51f138991413e1e561c02d928d04598215bc739,11/20(月) 12:46
utyv,UTYテレビ山梨,黒岳で下山中の女性が体調不良　県警ヘリが救助　高山病か,https://news.yahoo.co.jp/articles/223ebe6e2a08eddd1f1e5bceb66a9b3b439cfa24,11/20(月) 10:51
utyv,UTYテレビ山梨,早朝の国道　またクマ目撃　付近では今月9日も目撃情報,https://news.yahoo.co.jp/articles/305a617c1a23bd054b557de240103a89d33a076d,11/20(月) 10:29
utyv,UTYテレビ山梨,1人で登山していた50歳の女性が下山中に転倒し骨折　防災ヘリで救助　山梨・大月市,https://news.yahoo.co.jp/articles/a7f3f2bb9694e7fdc1e40ceef9495d43cf709915,11/19(日) 20:12
utyv,UTYテレビ山梨,竜電は下手出し投げで勝って6勝2敗　大相撲九州場所8日目,https://news.yahoo.co.jp/articles/4d1ecb463f349bffec150b4fbde3d8c7977e09d3,11/19(日) 20:12
utyv,UTYテレビ山梨,「芸術を見ることで心を落ち着けることができる」大村智博士がギャラリートーク,https://news.yahoo.co.jp/articles/ca53e86da686f804c78f3c211d8d74a486636fa8,11/19(日) 20:09
utyv,UTYテレビ山梨,障がいのある人などの就職支援を考える講演会　山梨・南アルプス市,https://news.yahoo.co.jp/articles/daf35c5773263bfde0f98c7a326b7716c037d684,11/19(日) 20:06
utyv,UTYテレビ山梨,自動車販売会社で野菜やお菓子を販売するマルシェ,https://news.yahoo.co.jp/articles/67654e8320109af115dd3ba35f3253d4763ee2cc,11/19(日) 20:06
utyv,UTYテレビ山梨,今年は11年ぶりに最高ランクの出来栄え　山梨ヌーボーまつり,https://news.yahoo.co.jp/articles/71a766240fe410a23d6d6e5106675e47a8215cd1,11/19(日) 20:06
utyv,UTYテレビ山梨,西湖のキャンプイベントで山梨をPR,https://news.yahoo.co.jp/articles/28db3e6361a40804dc46ff8a1c214c5a93137844,11/19(日) 12:46
utyv,UTYテレビ山梨,車線変更をめぐりトラブルとなった相手の顔面を殴る蹴るなど暴行し前歯を折る　傷害容疑で51歳の男を逮捕,https://news.yahoo.co.jp/articles/07575a2a947ffcef5972a2df2da172f7b88ce384,11/19(日) 9:54
utyv,UTYテレビ山梨,中央線の甲府ー小淵沢間の下り線で運転再開　貨物列車の車輪空転の影響で一時運転を見合わせ,https://news.yahoo.co.jp/articles/f0b85f043b01aa4d54ca627e25405c30e23e92c0,11/19(日) 9:16
utyv,UTYテレビ山梨,増穂小学校教諭がひき逃げ容疑で逮捕　富士川町が謝罪,https://news.yahoo.co.jp/articles/6f49f4d984df2457302af9f5c4ca7e063e8739d0,11/18(土) 17:14
utyv,UTYテレビ山梨,南アルプス市「市民みんなで楽しむ」イベント　山麓オータムフェア2023,https://news.yahoo.co.jp/articles/5ed42a832a2ca02fb7871fb0a2725a6e1c2d4151,11/18(土) 17:14
utyv,UTYテレビ山梨,大相撲九州場所7日目　竜電（甲府市出身）が5勝目,https://news.yahoo.co.jp/articles/526fce245001887e4fcb54effbc63604ae9a7707,11/18(土) 17:14
utyv,UTYテレビ山梨,「発信に前向きにできたら」高校生の主張の全国大会で最高賞　甲陵高校の前橋真子さんが県に報告,https://news.yahoo.co.jp/articles/f14933cfc4fb6104f1e1aeb0eca3244ef35d07c4,11/18(土) 7:32
utyv,UTYテレビ山梨,「自分の夢を見つけるために挑戦を」新津茉莉花さんが講演　海外で女性の支援活動,https://news.yahoo.co.jp/articles/71617fc9a0d353375eb6e3289ab68c579e610140,11/18(土) 7:02
utyv,UTYテレビ山梨,職人の手仕事の大切さ　「アーツ・アンド・クラフツ」特別展　家具や書物など約160点　山梨県立美術館,https://news.yahoo.co.jp/articles/d296a262c3d4db58dc51fc499a031a8ec3f06c4c,11/17(金) 20:48
utyv,UTYテレビ山梨,福島を応援　福島県で水揚げの魚「メヒカリ」でランチメニュー　県庁の地下食堂で提供　山梨,https://news.yahoo.co.jp/articles/3675122431eab9d2954b9ad45a7826c45ba03aba,11/17(金) 20:29
utyv,UTYテレビ山梨,年末商戦の幕開け　ブラックフライデーセール始まる　対象商品は去年の1.4倍　山梨・昭和町の総合スーパー,https://news.yahoo.co.jp/articles/3dbd277e1a76a824432ad039ac4c5bed893f5ffc,11/17(金) 20:16
utyv,UTYテレビ山梨,インフルエンザ感染者　1医療機関あたりは全国2番目の多さ　予防の徹底を呼びかけ　山梨県,https://news.yahoo.co.jp/articles/04fa0d763adc1eacd24a19ea30f2f36fe6677e08,11/17(金) 19:57
utyv,UTYテレビ山梨,賛否がある富士山登山鉄道構想　地元説明会に知事は出席する方針,https://news.yahoo.co.jp/articles/a1ab7fa81cdc3975162c191e12bb1a6553035f93,11/17(金) 19:32
utyv,UTYテレビ山梨,同僚の財布から1000円を抜き取る　市立病院の職員を停職1か月　山梨・富士吉田市,https://news.yahoo.co.jp/articles/3e19cc9afb22b0b02d01df545c1e982f6047b62f,11/17(金) 19:12
utyv,UTYテレビ山梨,クマは体長およそ1.3m　男性が襲われ頭や足を負傷　クマは猟友会が射殺　山梨,https://news.yahoo.co.jp/articles/2712c3d5cdc126f24df4b89d80062b81abbb9873,11/17(金) 17:54
utyv,UTYテレビ山梨,大相撲九州場所6日目　甲府市出身の竜電　きょうの取組結果,https://news.yahoo.co.jp/articles/e3e9964b9c581c5506bb0d04aab6a7d8a496d90a,11/17(金) 17:32
utyv,UTYテレビ山梨,「職を失うかもしれないので」小学校教諭をひき逃げの疑いで逮捕　車で自転車に衝突、逃走　高校生が大けが,https://news.yahoo.co.jp/articles/e80406a58e28c5eaec23ec9f044f625392e08852,11/17(金) 15:43
utyv,UTYテレビ山梨,金の取引による資産運用をかたった詐欺　70代女性が約1億円の被害　SNSでやりとり,https://news.yahoo.co.jp/articles/74ce8c62f78d14facd92e6acb4a471bfdcc68b79,11/17(金) 14:36
utyv,UTYテレビ山梨,届け出た量の20倍の廃材を保管　解体業者に対し今月中に改善命令　山梨県,https://news.yahoo.co.jp/articles/abc56c01ce5abefcf193e7c688b6be6a3e6d119e,11/17(金) 12:09
utyv,UTYテレビ山梨,大気不安定　落雷や竜巻などの激しい突風、降ひょう、局地的な激しい雨に注意　甲府地方気象台,https://news.yahoo.co.jp/articles/6f63fe07166dcc2094e37f4f3fb5e9cd48e2e18f,11/17(金) 7:11
utyv,UTYテレビ山梨,夕方の国道20号　横断中の高齢女性がトラックにはねられ死亡,https://news.yahoo.co.jp/articles/bf91fac82bf4b6611fc0492b7ab67d6161e399f4,11/16(木) 21:19
utyv,UTYテレビ山梨,解雇され野宿　素足にサンダル姿のベトナム人技能実習生を保護　そこに浮かび上がる問題点,https://news.yahoo.co.jp/articles/f4f863583b128a6dd86e4fc67a8ca438005b58f8,11/16(木) 20:41
utyv,UTYテレビ山梨,17日は「二つ玉低気圧」により局地的に激しい雨の恐れ　今後の1か月予想もあわせ　気象予報士が解説,https://news.yahoo.co.jp/articles/e5b2ce4e9a02bd81b4cd5cf2a0144bdac576438c,11/16(木) 20:36
utyv,UTYテレビ山梨,一足早くクリスマス気分に　甲府市の山梨英和中学・高校で恒例のクリスマスツリー点灯式,https://news.yahoo.co.jp/articles/81585598f56bb1db0826fc217ae10f5ee4fc6a80,11/16(木) 19:02
utyv,UTYテレビ山梨,あす未明から荒れた天気　気温低下も予想　カー用品店では急ピッチでタイヤ交換　山梨,https://news.yahoo.co.jp/articles/858de1e3a527eb02cc715c374c73225a5609cdf2,11/16(木) 18:54
utyv,UTYテレビ山梨,「大人世代の一部で拡大」インフルエンザ感染者1221人　10週間ぶり減少も3週連続1000人超　山梨,https://news.yahoo.co.jp/articles/7d0de6189035b9800259dcbd2cbfeb57accc0554,11/16(木) 18:46
utyv,UTYテレビ山梨,「これからもみんなのことを守ってください」　園児が警察署を訪れ日頃の感謝伝える,https://news.yahoo.co.jp/articles/3eb5477c1077fd6c6b3424ea5a817c11ea3ec574,11/16(木) 17:14
utyv,UTYテレビ山梨,「罪を軽くするために大げさに話した」謝罪の供述が半年後に変化　検察が指摘　甲府殺人放火事件裁判,https://news.yahoo.co.jp/articles/297e7e3d494e6aefc63ea28474e48f0de7de2f46,11/16(木) 16:57
utyv,UTYテレビ山梨,大相撲九州場所5日目　甲府市出身の竜電　きょうの取組結果,https://news.yahoo.co.jp/articles/a2b0d4e42d67a62057fcf6ece7b434d3ce1b8b28,11/16(木) 16:51
utyv,UTYテレビ山梨,メタセコイアの並木が黄色く色づき　赤茶色へと表情を変える　身延町・富士川クラフトパーク,https://news.yahoo.co.jp/articles/28a37ddf3f3e78dd2aa7bee7c895f0609f34cae9,11/16(木) 16:46
